user_name,user_profile_url,rating,local_guide,comment_num,comment_text
 雯 ,https://www.google.com/maps/contrib/110367413568269973387/reviews?hl=zh-TW,1,True,8,"2020/10/4用餐，當天17:00前入座，客人不算多，但餐點品質表現很差。當天是特別去慶生的，有使用店家App壽星優惠8折，但針對出餐品質這麼差勁，店家完全沒任何表示，相當失望!!
廣島牡蠣腰內$390
里肌豬排(大)$290

第一份送上的餐點「廣島牡蠣腰內」沒任何問題，但是第二份的餐點，店家說明：『豬排炸得實在太醜，要重做，會稍微等久一點』(大約10分鐘左右，重炸的餐點送上了)，沒想到拿到餐點時，
「里肌豬排(大)」底部的炸皮是濕掉的@@是在哈囉，這樣可以出餐?!太扯了，當天分食豬排給友人，夾過去時，『底部炸皮直接皮肉分離』，超級無言.................

另外，這家店可以免費續飯&續湯&續菜，但常常都找不到服務員，這次和之前的用餐體驗都是如此...。不過，這次用餐體驗最另人生氣的，依舊是『濕掉的炸皮，依然出餐給客人』，超級失望"
 吳哲安 ,https://www.google.com/maps/contrib/109657812865822969938/reviews?hl=zh-TW,1,False,16,"外場服務人員很客氣也很熱心介紹
但餐點真的雷
今天點的炸牛排上來幾乎是全熟了，又乾又硬，本來以為不會更慘了，直到咬到串炸的杏鮑菇......不說了，請自行體會"
 SuperWay Su ,https://www.google.com/maps/contrib/112891388252088378182/reviews?hl=zh-TW,2,True,213,兩顆星是給店員的，雖然都很年輕但服務但服務親切態度好，牛排我覺得不行，肉質沒有日本吃到的好吃可以理解，但日本吃到的差太多，也太熟了，不是應該炸十秒就離鍋嗎？除了生熟不均勻意外，肉也切的亂七八糟，有些超厚有些超薄，飯只有五穀飯沒有純白飯可以選有點可惜，日本米是很好吃的，很不想這樣說但我覺得隔壁的大戶屋是個不錯的選擇，只能說遺憾了
 YiYi ,https://www.google.com/maps/contrib/108005028319404914345/reviews?hl=zh-TW,5,False,45,回訪很多次了，炸牛排跟牡蠣都很美味！服務人員也都很親切～建議高麗菜絲的口感能脆一點就更棒了。
 張逐羽 ,https://www.google.com/maps/contrib/113077832860665735156/reviews?hl=zh-TW,1,False,5,"服務人員少
兩人的餐點都快吃完了
另外兩人的竟然來說餐點上齊時
才發現還有兩份套餐沒做
瞎
要不是都在談事情早就開噴了
服務人員還什麼都沒說的送上來
丟下抱歉重複下單barara
鹽巴罐沒了要他們加也沒什麼服務態度"
 Chloe Pig ,https://www.google.com/maps/contrib/112894185822169380440/reviews?hl=zh-TW,1,False,23,叫了Ubereat外送，收到後飲料已經整杯打翻，店家說是外送員的問題，他們本來就沒義務要附杯架，餐點全部泡在飲料裡，那就算了，整盒濕的餐盒打開還發現很長的頭髮，嚇傻！京都勝牛在台灣的形象整個毀了以後拒絕往來
 Eddie Wang ,https://www.google.com/maps/contrib/109871858810008818221/reviews?hl=zh-TW,4,True,124,點的是春饗雙人套餐，高麗菜以及味噌湯可續，續菜續湯不小器，咖哩醬料味道不錯，主餐溫度稍嫌不足，主餐以及醬料種類多樣，可請服務人員拿小烤盤來，如果想再烤熟一些，整體體驗不錯，份量也夠
 Linda Shih ,https://www.google.com/maps/contrib/103743358162190497039/reviews?hl=zh-TW,3,True,76,有些失望，點了雙人海陸套餐，蝦子很不新鮮。服務人員很快的換上另一隻，結果還是一樣的腥，肉不緊實。
 信智王 ,https://www.google.com/maps/contrib/103703586242629281954/reviews?hl=zh-TW,1,False,15,"桌上沒有服務鈴
點餐網站也沒有服務鈴按鈕
想續東西還要碰運氣等服務生經過…
以這個價位來說這種用餐體驗實在不划算"
 Allen Chien ,https://www.google.com/maps/contrib/108256479781760994112/reviews?hl=zh-TW,4,True,"1,873","菜單上的料理琳瑯滿目，除了炸牛排，還有鰻魚飯、咖哩飯等，排除選擇障礙後，點了春饗雙人套餐，以及加點炸串料理來吃吃看。
春饗套餐是「牡蠣和菲力」和「豚牛二味」為主的組合，搭配炸雞和飲料。這兒的點餐方式是透過觸碰螢幕點選，服務員就會來確認餐點，並且說明套餐的內容，以及白飯、高麗菜絲和湯品都是可以免費續加，絕對是能讓人吃飽飽的組合。
炸雞算是非常好吃，裹著薄粉的雞肉鮮嫩多汁，不柴不乾，算是很滿意。「牡蠣和菲力」的廣島牡蠣覺得很一般，沒有鮮嫩多汁的口感，之前在日本有超過炸牛排，所以菲力當然也要拿來煎，不想吃太生的牛肉，醬汁有二種選擇，看個人喜好。
「豚牛二味」就是牛豬雙拼，喜歡熟一點的都可以拿來煎，搭配高麗菜絲真的很有飽足感。加點的炸串口味很一般，沒有感覺到很特殊。可以續湯和高麗菜絲，真的吃的很飽，可惜白飯不像日本有提供山藥，攪拌後更是美味啊！"
 陳郁頻 ,https://www.google.com/maps/contrib/103656271061716717852/reviews?hl=zh-TW,5,False,8,我覺得真的很好吃，菜單的每一頁都想點來吃，如果真的要說缺點，就是東西看起來都太好吃了，不知道怎麼選，感謝🙏今日提供完美的一餐
 Tammy Lin ,https://www.google.com/maps/contrib/110366976082365648880/reviews?hl=zh-TW,4,True,229,"豚牛二味380
厚切菲力390
會員加購牛肉串炸30
加購69套餐
加一成

豬排意外的好吃
原以為會很難吃🤣有點驚艷到
沾串炸醬不錯🤣

牛排個人比較喜歡我這種比較細薄的
厚切的中間會太生而且醬汁比較容易沒有入味
但還是都好吃

串炸不知道為什麼有一支是杏鮑菇
但我覺得很普通可以不用點🤣

飯生菜味增湯可以無限續
員工也會問而且很勤
味增湯超級淡飯有點偏軟
生菜醬兩個醬都不錯
其中一個是泡菜醬很特別
黃金泡菜的味道蒜味很香
哦左下角醃蘿蔔好臭我吃不完🤣

冰淇淋好吃黑糖很濃珍珠有嚼勁但不會太硬
但如果單點85我一定不會點來吃🤣
百香青梅醋氣泡
不錯喝但其實就是調味糖漿吧🤭

整體來說為了肉肉會想回去吃
但不會想加點套餐或串炸
可以續的那些其實我覺得福勝亭還更有誠意🤭"
 Que der ,https://www.google.com/maps/contrib/111900005774500666016/reviews?hl=zh-TW,1,False,6,"雷到爆
主角是牛排結果完全咬不斷
肉質很差整個很搞笑
東西只有一點點唯一的優點只有高麗菜跟白飯能續
因為配菜也只有高麗菜
肉也只有一點點好吃的是醬汁而已
吃一點點東西兩個人平均一人花了要900$"
 issac Chien ,https://www.google.com/maps/contrib/115705404127187225866/reviews?hl=zh-TW,4,True,897,用餐時段常滿座，服務人員有問必答親切桌邊服務也很勤，整體味道還不錯肉上菜時大約三分熟，記得使用鐵盤加熱後牛肉香味才會出來。
 洗發發 ,https://www.google.com/maps/contrib/101010726055806594063/reviews?hl=zh-TW,1,False,11,一下忘記我的湯不要蔥，我的咖喱要加購烏龍麵也忘記，加菜要提醒很多次也沒上，四格甜點的果凍也很苦不好吃，朋友的烤、炸雙拼烤完很油超油，林口的好吃一百倍去林口吃
 Ted S ,https://www.google.com/maps/contrib/110252142450425573619/reviews?hl=zh-TW,5,True,549,炸牛排還不錯，外熟內生還蠻軟嫩，尤其炸軟殼蝦還蠻驚豔，整隻蝦連蝦頭都可以吃掉，個人覺得比炸牛排好吃；炸牡蠣也不錯，牛肉吃多剛好可以換換口味。至於沾醬方面，個人覺得沾鹽巴加芥末最好吃，其他沾醬就沒什麼感覺。第二次回訪，覺得服務還不錯。
 Serena Pai ,https://www.google.com/maps/contrib/101765601727614016178/reviews?hl=zh-TW,4,True,111,"麵衣有緊緊抓住肉，而且有助於口感的功能這點很棒，高麗菜絲、味增湯可以追加。份量對女生而言相當有飽足感。想吃肉時會優先考慮的店家。加入會員可以以非常有感的優惠價加購牡蠣或炸串。除了傳統的和風沙拉醬汁之外，竟然有黃金泡菜的醬，新鮮的體驗。
一星扣在味增湯的鈉含量以及點餐用平板的觸控不良。"
 Yolomei ,https://www.google.com/maps/contrib/112755752168601284257/reviews?hl=zh-TW,5,False,1,第一次來吃口感很特別很喜歡環境衛生做的很好店員的服務態度很好介紹餐點時也很明確很有耐心下次還會再去吃
 陳玉芬 ,https://www.google.com/maps/contrib/111685322042757786827/reviews?hl=zh-TW,1,True,47,"覺得感覺狠不好，吃到一半
發現有ㄧ根頭髮😱跟店員說裡面有頭髮
於是收走，後來跟我說幫我換一個新鐵盤
看到頭髮已經狠倒胃，以後不會來吃了
只是當下的感覺真的很不好，說打九折
今天本來就會打9折啊，唉😔😔
到現在很反胃😖😖😖"
 哈利不是波特 ,https://www.google.com/maps/contrib/101934929115636557625/reviews?hl=zh-TW,3,True,965,喜歡豬排多過於牛排，牛排可能炸過關係吃起來沒有汁，加熱煎一下的方式因爲炸粉掉落很容易有焦味傳出，直接吃貌似好些。整體環境舒適，服務態度好。
 超鴻 ,https://www.google.com/maps/contrib/104715845213531625916/reviews?hl=zh-TW,5,True,145,"都是用平板點餐，一開始喝水就是用氣泡水覺得很不錯不用額外多點氣泡飲
牛肉好吃，不過我今天是點雞肉煮覺得還不錯，中規中矩，炸的雞塊不推薦，好柴很鹹"
 林芷伃 ,https://www.google.com/maps/contrib/114727953452519736815/reviews?hl=zh-TW,2,False,2,"服務態度很好
就是牛排不是很好吃
翼板牛酸掉，服務員有提出要再換一份，但實在沒胃口了"
 Wesson Lin ,https://www.google.com/maps/contrib/106707871260940135752/reviews?hl=zh-TW,5,True,48,"炸牛排每一口都吃到牛肉的多汁和軟嫩，外面又有恰到好處的酥脆麵衣
醬汁有2-3種，吃起來不會無聊，要是覺得肉太生不習慣，也可以請服務生幫你準備烤盤，把肉烤熟到你喜歡的熟度
喜歡吃炸豬排的人，我想也會喜歡吃京都勝牛"
 卡媽 ,https://www.google.com/maps/contrib/110691818870948947640/reviews?hl=zh-TW,4,True,30,"第一次吃炸牛排
外皮酥脆內肉鮮嫩
有點驚艷

白飯味增湯小菜高麗菜都可以續加
泡菜沙拉醬很特別
不過還是芝麻醬比較搭沙拉🥗"
 夏宇 ,https://www.google.com/maps/contrib/103084604930991995124/reviews?hl=zh-TW,4,True,332,第一次吃京都勝牛在京站，因爲是假日所以排隊了半小時才入座，今天點了御韓雙人餐，除了炸牛排及炸牡蠣好吃外，個人最愛的就是高麗菜絲及味噌湯可無限加點，另飲料及飯後甜點均優，餐廳內明亮乾淨，點餐是每個座位旁有個平板電腦供個人點餐蠻方便的，唯一就是座位不算寬敞，可能是在購物賣場有空間限制，不然就完美了👍
 Lala ,https://www.google.com/maps/contrib/114734612168166273449/reviews?hl=zh-TW,4,True,956,"今天點雙人套餐。牛肉嫩多汁，搭配烤盤很像牛排，不一樣的感覺但都很好吃值得嘗試。豬排也非常不錯，入口即化不會太硬軟硬適中。最讓人驚艷的還是炸牡蠣！怎麼那麼好吃又肥嫩啦！！

但炸雞有點可惜，油膩沒有特色，不難吃但不會想吃第二次....店員可能因為很忙，總覺得每個人都沒生氣...

整體表現很不錯！沒吃過炸牛排的朋友們推薦來吃吃😋"
 阮逸修 ,https://www.google.com/maps/contrib/114498885766451074841/reviews?hl=zh-TW,4,True,772,這次點了雙人套餐，炸牛排的部分還不錯，豚牛二味的牛排熟度剛好，但是菲力的部分有比較過熟了一些，但還是不錯吃的，豬排的部分很多汁很不錯，炸雞也是多汁美味，炸牡蠣很大顆且裡面熟度剛好，吃起來對我這個怕生的人是很剛好的，醬料的種類算蠻多，其中咖哩醬不管是配豬排或是配牛排我覺得都很好吃，熱茶的部分覺得有點太苦了，配菜的高麗菜補的很快，飯跟湯也都可以續，吃起來也是中規中矩，旁邊也有可以再加熱的烤盤也算貼心，60元的飲料系列比較普通而且也蠻小杯的，比較不推薦，整體來說算是值得推薦的炸牛排。
 Wei Shan Chen ,https://www.google.com/maps/contrib/105253388880549493324/reviews?hl=zh-TW,1,True,84,"雖然號稱肉有三分熟，可是實際上桌約莫只有一分熟。入口時生冷無比，也因為過生、有厚度又帶筋，口感軟爛難以咀嚼吞嚥。

次論炸牛排的外皮，可能起鍋時內場沒有以大火逼油、也沒有經過吸油處理，整個炸皮油膩無比，僅以手機拍攝食物，都能看到炸油浮在炸皮之上，肉已過生難以咀嚼、配上油膩膩的炸皮，更是難以下嚥。

再論加熱的烤盤，雖然上桌時加熱瓷盤已經抹上一層油，但隨桌附贈的小油燈很難在短時間內將瓷盤燒熱，所以肉一上加熱瓷盤，一下就會沾黏；之後隨著熱度增加，炸皮又會因為水氣逐漸軟爛、配上原本的油膩口感，外皮只是更加難吃，還得看著炸皮的油汩汩流出。然而若你一旦捨棄加熱瓷盤，就得吃沒味道、沒熱度的生肉片，口口都是味如嚼蠟。

反覆加熱幾片肉片後，炸皮的碎屑會慢慢積累在加熱瓷盤中央最熱的位置，然後燒得焦黑無比，用餐空間也沒有任何排氣措施，燒焦味衝著你來，好不容易換了瓷盤，又得重新等加熱，然後一邊聞著鄰桌食客瓷盤炸皮的燒焦味。

另外，烤盤受熱不均，若不是放在正中央，要等上好長一段時間才能烤熟，你最多最多一次加熱兩片肉來吃，長時間的等待，桌上的炸牛排本來就不熱了，你第二次上烤盤的炸牛排等於是炸皮放軟的冷肉，再反覆加熱來吃，這種食物口味、口感怎麼可能能稱好？

最後是附餐的味噌湯，前面炸牛排可以說是口味不合，但這味噌湯入口卻有股塑膠味，吃到這裡我們終於和餐廳反應了，最後餐廳內場回覆說口味正常，態度很好地幫我們換了新的一碗湯，可再入口還是滿滿塑膠味，吃到這真是食勁全消，只能匆匆結帳離去。

食物品質奇差，白白排隊一場。

炸皮落下，在烤盤燒得焦黑"
 蔡大痣 ,https://www.google.com/maps/contrib/105138910734664680010/reviews?hl=zh-TW,4,True,39,可免費續味噌跟沙拉，泡菜醬很特別。友人點的牡勵吃起來有苦味，炸牛排就比較好吃
 Kobayashi 小林 (Small Lin) ,https://www.google.com/maps/contrib/100321873000014536503/reviews?hl=zh-TW,5,True,102,"炸牡蠣大顆、新鮮，而炸牛排的料理方式獨創一格，是吸引我來這間店的誘因，炸牛排裡頭的肉的確生紅還有血肉，但因每一塊均切的很薄，並不會因為有筋而難以咀嚼的問題，隨餐附上的三種醬料，外加桌上擺放的糊麻醬、和風醬與玫瑰鹽，讓我能用不同的醬料去品嚐每一塊肉，每一口都新鮮感十足👍👍另外，獨特的百香酸梅氣泡飲，不僅僅能在用餐前開開胃，在餐後喝也能充分的解油膩，不僅外觀美、口感也極佳喔😆😆炸物的部分也是令我驚艷呢🌼直接把整塊三分之一的洋蔥拿下去炸的金黃酥脆，吃進嘴裡完全沒有洋蔥的嗆鼻味，凡而反而彷若在吃很有口感的洋蔥圈，根本就是我的最愛。
這間店，服務好，餐點美味，值得五顆星的評價🎉🎉🎉"
 李緯 ,https://www.google.com/maps/contrib/107971300221363156713/reviews?hl=zh-TW,2,True,72,牛肉鍋膳這個價位算可以4顆星，牛三味吃起來跟看起來都太黑，大概3顆星，加服務費都5百多了，應該可以再細膩一點，最後為何給2顆星呢？因為我點套餐，雞塊沒上來，跟服務生說，她只是冷冷說，我幫妳刪掉（臉就一副你吃完才講，我只是懶得拿照片出來⋯⋯），飲料算單點就好，也沒說個不好意思之類的⋯⋯，因為也吃飽了，我也只好就這樣接受
 林育煌 ,https://www.google.com/maps/contrib/110141068809959831240/reviews?hl=zh-TW,4,True,153,"春響雙人套餐-炸牡蠣與炸菲力牛排、經典豚牛兩味、炸雞塊、黑糖白玉抹茶凍、百香青梅氣泡飲、藍柑優酪氣泡飲

炸牡蠣-大顆，鮮美，酥炸的外衣配上軟嫩的內在，多層次的口感，不用醬料就很好吃。

炸菲力牛排-配上芥末就十分好吃，但店家有附三種醬料，牛排醬、和風露、咖哩醬，都可以嘗試看看。

經典豚牛兩味-豬排其實蠻普通的，沒有什麼經驗感，只能說中規中矩，炸牛排就比炸菲力稍微在薄一點，但也算好吃。

日式炸雞塊-剛上來的時候蠻好吃的，薄薄的外衣，配上多汁的雞肉，但隨著時間流逝，略顯乾柴。

兩杯飲品的表現，其實視覺大於味覺，藍柑優酪氣泡飲味道極像小時候的冰淇淋汽水，百香青梅氣泡飲比較像沒有酒精淡淡的梅酒。

黑糖白玉抹茶凍-抹茶味與黑糖不太濃，但還算好吃。

整體店面明亮，服務態度也很好，看到客人白飯快沒有了，也會主動詢問，餐點快用畢時即會詢問是否要上甜點。

對於沒吃過炸牛排的朋友是可以嘗試。"
 Jo Chang ,https://www.google.com/maps/contrib/117316757605476837349/reviews?hl=zh-TW,5,True,908,(´∀｀)♡有用烤板加熟了，但是我還是比較喜歡熱熱的肉。服務態度很好。
 Ponée Chou ,https://www.google.com/maps/contrib/104398839400987876332/reviews?hl=zh-TW,3,True,21,"忍不住嘴一下，不知是不是店內排煙系統做得不好，不時煙味燻人頗為影響用餐感受（我會因為這點猶豫要不要再訪）。服務生皆友善，提供冰涼的氣泡水和茶，高麗菜絲可續加。今天點的是厚切菲力炸牛排和東京風里肌豬排鍋膳，以及兩顆炸牡蠣。米飯雖份量不多，濕潤飽滿令人驚艷，最喜歡的是豬排鍋膳，醬汁淋在米飯或高麗菜絲上鹹淡適中，肉質軟嫩不膩口，但整體來說份量有點少，大食漢應該會吃不飽，一份也不便宜，相對會覺得cp值比較低。

如果有機會再造訪，希望能改善店內的空氣品質。"
 Avon Teng ,https://www.google.com/maps/contrib/112509545123392177033/reviews?hl=zh-TW,2,True,167,聽朋友推薦特地造訪，勝牛四味肉質不差，但麵衣非常油膩，沒有瀝油，薄片的牛肉已經過熟，同等價位可以有更好的選擇。
 Xiu Claire ,https://www.google.com/maps/contrib/108047900795649653308/reviews?hl=zh-TW,3,True,88,表現差強人意…尤其炸雞塊很不行！上桌時都是冷的～炸牛排推薦微加熱後比較好吃～氣泡飲和配菜醬料可以～服務勤勞詢問是唯一加分的點～
 fifi Huang ,https://www.google.com/maps/contrib/104277761952187126449/reviews?hl=zh-TW,3,True,"1,137","店內有提供氣泡水還不錯，
東京風牛排鍋膳其實跟大戶屋這類的口味大同小異，炸雞塊也不推。沙拉的醬汁瓶並沒有隨時去清潔瓶口部份，總而言之這間餐廳該有的細節它們並沒有注意到（如果以它的價位來看），
服務人員雖然一直走來走去，但並不會主動去觀察客人需要什麼，
你要主動叫他們才會來幫你服務~"
 Elaine Lin ,https://www.google.com/maps/contrib/107203403141882250761/reviews?hl=zh-TW,5,True,47,"第一次吃炸牛排，吃起來不會油膩，
份量上很足夠。
也提供許多不同的醬料給客人，可以品嚐到不同口感，很棒！
如果覺得肉太生，還會提供陶盤給客人，讓客人可以烤到自己想要的熟度，很不錯的服務喔！"
 Chien-Yu Chen ,https://www.google.com/maps/contrib/102520555739402326856/reviews?hl=zh-TW,5,True,147,今天內用了牡蠣豬腰內(NT$390)，加NT$69升級套餐(選了飲料/白桃冰茶+甜點/花見糰子)。剛坐下即可選免費(可續加)熱茶或冰氣泡水，整體來說餐點分量中等，主餐分量中間稍微偏少，不過炸牡蠣跟豬腰內肉都滿不錯的，水分都還在不會炸到太乾，麵衣也不會太厚。白飯、高麗菜絲、味噌湯聽說可以免費續加，甜點好吃。內用需再加一成服務費，本次用餐(平日中午)吃完還再坐了一下，感覺環境悠閒，推薦給不趕時間的人。
 陳銀狐 ,https://www.google.com/maps/contrib/103740031800328621402/reviews?hl=zh-TW,5,False,1,巨好吃肉很嫩也吃的飽環境安靜服務員也很好不會用電子書會耐心的講解平平的價錢能有這種服務很不錯！！
 MK Lan ,https://www.google.com/maps/contrib/112169698155412283153/reviews?hl=zh-TW,3,True,576,"價位中上
炸牛肉吃起來不怎麼特別
其他餐點也是一般般
整體吃下來感覺普普通通

服務方面很優質
有什麼不懂的可以向服務人員詢問
會很用心的講解

這次用餐花了快600
沒有令人感到驚艷
份量如圖

沒吃過炸牛肉想要嚐鮮的人可以試試
看合不合自己的胃口
我個人是沒有很喜歡這種味道"
 Mr.K ,https://www.google.com/maps/contrib/102159703385494149190/reviews?hl=zh-TW,5,True,554,"京都有名的炸牛排餐廳
服務很扎實，點餐使用的是平板很方便
意外地牡蠣好吃可以點
炸牛排類基本都好吃不用怕踩雷

然後...用餐時間要等很久是唯一缺點。"
 Lexie Wang ,https://www.google.com/maps/contrib/103265345278657689276/reviews?hl=zh-TW,3,True,46,"牛肉三分熟，口感我是可以接受，會有一點點的生肉的軔勁在。如果不敢吃那麼生，也可以請店員提供陶爐來加熱再食用。

翼板部位雖然油花不多，但肉質咬起來是軟嫩的，只是單吃牛肉本身感覺不到牛肉味與甜味，吃起來就是炸衣與醬料的味道，雖然有7種沾醬，但又不是想來吃沾醬的XD

再來炸牛排的麵衣是比較薄的，有明顯反油的油膩感，皮較為濕軟，相較來說炸豬排是比較好吃的。

更多美食評論IG：lexie.tw"
 莊家豪 ,https://www.google.com/maps/contrib/117718537005216405665/reviews?hl=zh-TW,4,True,111,"2020/9/19
初訪

京都勝牛雙味

剛好來京站看電影，就順便在這覓食了。
運氣不錯，並沒有等太久就入坐，
之前也吃過幾家炸牛排，
很巧的是大家都稱上桌的炸牛排是3-5分熟，
也同樣有提供加熱的小爐。
之前吃到的炸牛排，用手指摸，
其實都還是冰的，老實說如果不再加熱，應該是沒辦法吃。
但勝牛真的是不一樣，即使是菲力的部位，用手去摸最中心最紅的地方，是有溫度的，是溫熱的，基本上到這裡我就大概知道不需要再加熱了。

不論是比較薄的翼板、有厚度的菲力，
吃起來都是軟嫩的，熟度口感都不錯，果然有符合這樣等級店家的水準。（讓我聯想到某次在幸子豬排吃的炸牛排，相較之下牛肉呈現的水準就差蠻多的）

店家提供了蠻多種沾醬，但我只用了海鹽、經典牛排醬、和風（中間有拌入一點芥末）、咖哩醬，基本上都不錯，特別是咖哩醬，其實也不馬虎，只是牛肉我還是喜歡淡一點的調味，所以幾乎都是只沾經典牛排醬。

店家的飯、高麗菜絲都可以續，食量大的人也不用擔心。"
 marry me ._. BTS ,https://www.google.com/maps/contrib/118063390686912936737/reviews?hl=zh-TW,5,False,1,"一定是大拇指的啦
不能說好吃，也不能說超好吃，只能說超級無敵好吃
尤其是那個黑糖珍珠冰淇淋"
 Eisei Sho ,https://www.google.com/maps/contrib/102577386211476342616/reviews?hl=zh-TW,4,True,50,"點了招牌的炸牛排小份的，肉比想像中多，三分熟的翼板牛嫩嫩的很不錯，但我更喜歡放在陶盤上加熱後的牛排，油花經過加熱後味道更甜美，個人最喜歡配上和風醬後加一點芥末，好好吃！另外加點的溫泉蛋則是直接淋在麥飯上，再搭配牛排，我覺得十分搭。高麗菜絲和麥飯可以一直續，因為一開始給的有點少，所有又再續了一次高麗菜絲，可以吃得很飽。
服務生都很親切，也很注意客人的需求，像是烤盤只要有點焦了就會主動幫忙換新的；反應要加菜加飯也都馬上幫我們補上，真的很謝謝他們。下次有經過且不用久等的話，會想再吃一次。"
 潔西卡 ,https://www.google.com/maps/contrib/113000613635176197090/reviews?hl=zh-TW,3,True,817,"對於京都勝牛的人員的服務與貼心非常推薦，假日用餐的候位與帶位安排與上餐速度與服務都相當好。單點餐點價位於310元到550元之間，副餐約莫在80到180元之間
點了元祖炸牛排和京玉牛排盒膳套餐，兩種餐點的牛肉部位是一樣的，但餐點片的厚度不太一致還有外面的酥炸的程度也不太一樣，食用觀感有點落差。另外有點可惜的是五分熟的牛肉上菜時已經微溫，肉質軟韌帶筋不太好入口。雖然有烤盤可以加熱，但兩份餐點全加熱的情況也讓烤盤容易焦黑有味道與煙霧，讓一旁併桌的客人相當介意，但同為用餐的客人也很難避免這尷尬。
不過副餐的高麗菜絲、味噌湯和麥飯真的很好吃都在水準之上，粒粒分明軟Q的麥飯越嚼越香，配上胡麻醬的高麗菜絲更是美味。
整體來說，期盼牛肉的品質可以更穩定一些。"
