user_name,user_profile_url,rating,local_guide,comment_num,comment_text
 林煒凱 ,https://www.google.com/maps/contrib/106545269443141021682/reviews?hl=zh-TW,5,False,4,份量十足，味道不錯。
 高昀婕 ,https://www.google.com/maps/contrib/104070512336753395203/reviews?hl=zh-TW,5,False,15,超級好吃服務態度超級棒！用優惠券得到套餐超級美味划算！一定要指定萓芹服務人員！她很勤勞幫我們換烤盤好貼心！一定會常常來！推薦給大家！！
 suliven Chen ,https://www.google.com/maps/contrib/106059650992467214603/reviews?hl=zh-TW,4,True,156,牛肉料理一流，口味獨特，湯飯高麗菜絲及氣泡水免費續超佛心。
 Jeremy Liu ,https://www.google.com/maps/contrib/112694943283016907928/reviews?hl=zh-TW,4,True,452,"源自日本京都的日式炸牛排專賣店《京都勝牛》，
去年(2018年)首次進駐台灣市場，
目前在台北有兩間分店，
包括京站和新光三越信義新天地A11館各一家。
《京都勝牛》的炸牛排算是好吃，
品質和料理都還算到位，
整體餐點呈現還算是精緻，
但是並沒有讓人感到很驚豔的程度，
可能原本想說畢竟是日本來的店會有比較高的期待感吧！
比較特別的就是搭配多種醬汁以及玫瑰鹽、七味粉等，
在品嘗炸牛排的風味變得更豐富。"
 Lou Chang ,https://www.google.com/maps/contrib/110523784416254723398/reviews?hl=zh-TW,4,True,26,"餐點不錯
用餐環境寬敞
但服務人員似乎訓練不足
流程有點慌亂"
 Y.C. H ,https://www.google.com/maps/contrib/118031496831343453940/reviews?hl=zh-TW,4,True,309,"服務不錯
麥飯好吃
芥末真的不嗆🤣
高麗菜很甜可續"
 Hsi An Chen ,https://www.google.com/maps/contrib/101911573235698741694/reviews?hl=zh-TW,3,True,86,品嘗了店內招牌的京都勝牛三味，可以一口氣吃到厚切菲力、炸翼板及薄切牛醬三種不同類型口感的炸牛排，不管菲力跟薄切口味都不錯，可惜的是炸翼板的熟度掌握不是太好，同一塊肉同時出現357分熟，且血水有點多，不過能自己再用烤盤微調，另外有點可惜的是炸物不夠熱，且外面裹的麵衣與肉有分離現象，是美中不足之處，希望炸牛排能再加強，店內服務還ok，下次有機會再來嘗試極上和牛系列～
 JW C ,https://www.google.com/maps/contrib/108362978395355096555/reviews?hl=zh-TW,4,True,177,"【店家使用振興券有特別優惠！】
振興券200元可以折抵240元，振興券500元可以折抵650元。
還有送六角集團其他店家的優惠折抵券。

1.京都勝牛三味$480
+90元套餐(銅鑼燒冰淇淋、葡萄柚優酪氣泡飲)
2.腰內豬排(L)$290
+90元套餐(和風蜜團子、百香青梅醋氣泡飲)

抵達的時候剛好是用餐時間，有大概八人在排隊，但也沒有等很久呢，因為比較多人的關係，所以店員有先幫我們點餐，沒有人的時候好像是使用位置上的平板點餐。店員服務還算蠻親切的。
整體分量足夠，套餐都有一份主食加上米飯、小菜、味噌湯。茶水可以選擇茶或是氣泡水。米飯、高麗菜絲是可以免費再續加的。
腰內肉偏軟的口感，沾上豬排醬與芝麻，甜甜的很好吃!
甜點蜜團子不算太甜但我沒有很喜歡那個口感，百香青梅醋氣泡飲好喝，氣泡水會增加超多飽足感的XD"
 Feier Song ,https://www.google.com/maps/contrib/115288898530931142714/reviews?hl=zh-TW,5,False,1,餐點都很好吃而且服務態度也很好衛生環境也不錯很推薦去嚐嚐
 陳珍妮 ,https://www.google.com/maps/contrib/103326767384516429819/reviews?hl=zh-TW,5,True,"1,275","這次的台北行收穫滿滿😍
又是吃口袋名單內想吃好久的炸牛排🥩
牛排是五分熟如果敢吃生一點就可以直接吃了🤤
不敢吃生的話，餐廳有提供小烤盤可以烤一下👍
烤過肉味會更香唷😛
餐點有附氣泡水、熱茶、高麗菜絲、味增湯都可以無限續加🤩

📍京都勝牛台北京站店
地址：台北市大同區承德路一段1號B3
#炸牛排
#日式美食"
 Ray Lei ,https://www.google.com/maps/contrib/115890118298675800616/reviews?hl=zh-TW,5,True,22,炸牛排跟其他食材都好吃，服務也親切。
 Courtney Chien ,https://www.google.com/maps/contrib/105527619828769673992/reviews?hl=zh-TW,4,True,213,"在日本住過一陣子的我有時候都會很想念日本的味道
吃過這家後
個人覺得味道很像
而且真的好好吃😋
如果沒有預算考量的話蠻建議試試看的

另外餐點來之前還可以喝喝氣泡水
如果吃炸的我覺得氣泡水還蠻適合解膩的

也希望員工訓練可以再做更好～"
 Mick Peng ,https://www.google.com/maps/contrib/102987602122183853198/reviews?hl=zh-TW,1,False,1,服務態度有夠差，看到有需求，都對眼了，也不會來，主動尋求服務還要被兇，扯
 陳奕霖 ,https://www.google.com/maps/contrib/102813012989390964529/reviews?hl=zh-TW,5,False,11,服務好，隨時會詢問是否要加飯跟湯，很讚呦
 Huang Letitia ,https://www.google.com/maps/contrib/116845811544417538241/reviews?hl=zh-TW,4,True,35,"京都勝牛-台北京站店，位在京站B3，
一入座會詢問要熱茶還是氣泡水，選了熱茶。

主菜是炸物，有牛、豬、海鮮。

這次點了雙味牛，升級69元套餐。
飯、湯、高麗菜絲這3樣可以免費續，
高麗菜絲可以搭配桌上的醬料使用，
我自己是覺得它的飯還不錯🍚

炸雙味牛的部份，肉質有點偏軟，
不太好咬，比較可惜~

甜品的湯圓蠻軟Q有彈性👍

店員都蠻親切的🙂"
 哈哈好 ,https://www.google.com/maps/contrib/105408385942414162936/reviews?hl=zh-TW,5,False,5,服務員態度很好！餐點好吃，會想再來的餐廳
 幸宏偉 ,https://www.google.com/maps/contrib/114374672373467274851/reviews?hl=zh-TW,5,True,12,"朋友強力推薦抱持好奇心態來嚐鮮
真是意外好吃欸😋
點了春饗雙人餐（愛吃牛肉的各位可嘗試👍
本來想說吃得完沒想到飽的要命
最後還是死命的吃完了（才不會枉費花了錢吃好料
店內裝潢設計很簡單明瞭
店內衛生環境也很乾淨
是一家悠閒吃飯的好地方"
 YH TSAI ,https://www.google.com/maps/contrib/113376597401910551718/reviews?hl=zh-TW,1,True,38,用餐時間10/10晚上，家人聚餐有一位小朋友當時點了兒童餐，目錄上是汽車造型的餐盤加上蛋包飯，餐點到的時候是一個普通的餐盤，於是問了送餐人員這個是兒童餐嗎？她說是因為假日客人較多兒童餐的餐盤都沒有了，當下覺得合理也可以接受，只是差個盤子能吃就好了，但是仔細看目錄上的蛋包飯和送來的餐完全不一樣，沒有蛋包只有白飯，當下覺得他可能送錯了，於是問她我們點的是蛋包飯，怎麼會沒有蛋包，她又解釋了因為今天生意比較好所以蛋包都賣完了，當下覺得在點餐的時候為什麼都沒有告知餐點差這麼多，她說有給你半片玉子燒替代，我向她反應這個應該在點餐的時候就應該告知而不是餐送上來也沒告知我們問了才解釋，當下不問還好問了之後這位女服務生當下馬上變臉很不高興的說。那你餐還要不要？當下真的被她一句話惹怒，我告訴她不是要不要的問題，而是餐的差別這麼大的情況應該要先告知，我們當下還可以做其他的選擇，而我們等了那麼久餐送上來了才發現餐不對，孩子現在餓了你說我要不要，她說你不要那我們就收走，我說那你收走小孩吃什麼，她還是一臉隨你要不要的態度，爭下去也沒意義，當下也只能被迫接受，結帳的時候又發現臉書按讚活動餐點可以折價部分結帳她沒有折到，告訴她沒有折到價，但當時她已經刷了卡，他竟然說喔那你等一下我請人來處理，於是就丟下我站在櫃檯過了一下子另外一個女的服務生走過來問我，請問有什麼問題嗎我說你同事沒有告訴你請你來處理什麼問題嗎？他說沒有誒可不可以再說一次，當下真的非常火怎麼會請一個這麼不負責的員工，非常不好的用餐經驗，絕對不會再來！
 許瀚升 ,https://www.google.com/maps/contrib/112915056625060739640/reviews?hl=zh-TW,3,True,250,點雙人套餐炸牛的部分覺得筋偏多不太好咬炸牡蠣跟豬排還不錯飯湯高麗菜絲可以續
 巧巧 ,https://www.google.com/maps/contrib/102928361394187349930/reviews?hl=zh-TW,5,False,3,店員介紹餐點詳細，餐點也好吃肉跟甜點都很好吃
 steven86547983 ,https://www.google.com/maps/contrib/103728263759325978338/reviews?hl=zh-TW,2,False,12,"點了兩個餐，牡蠣翼阪牛、鐵板牛排
鐵板牛排整個不行，肉質不嫩且幾乎咬不斷，講白了就是難吃也對不上他480+10%的價位。
配餐的飯是冷的，味增湯是溫的。
炸翼阪牛相對算能入口，可能是炸衣的關係
唯一可以的就是炸牡蠣，算好吃值得嘉許
其他完全不值這價位，且都已經自助點餐還要收服務費我也是不懂"
 Dongheng Liu ,https://www.google.com/maps/contrib/104461260926840075742/reviews?hl=zh-TW,4,True,27,機器點餐後上菜的速度合宜，對於有時很累不太想再多說話回應只想吃肉的人來說，平板點餐自己看餐點介紹的感覺很放鬆。
 沈容安 ,https://www.google.com/maps/contrib/106455270546210643733/reviews?hl=zh-TW,5,True,15,可以再加烤盤將牛排烤自己喜歡的熟度，炸牡蠣跟豬排也很好吃，加上氣泡水、飯、味噌湯、高麗菜絲都可續，CP值很高，服務也很好
 G N ,https://www.google.com/maps/contrib/109411218733731903222/reviews?hl=zh-TW,1,True,46,花五百多吃牛肉乾咬不動難吃
 Chiton Tsai ,https://www.google.com/maps/contrib/103251375635345718549/reviews?hl=zh-TW,3,True,353,厚切菲力必須使用烤盤加熱才算好吃
 A-Kwon Fang ,https://www.google.com/maps/contrib/103714456755345789855/reviews?hl=zh-TW,3,True,"2,971","不時有著身分證字號或生日優惠的炸牛排店除了以往在高雄才常有外，台北車站附近的京站樓下也是在美食街開了一家；平時的人潮實在也是排的很可觀、再加上有可以預約訂位的額度後，平時直接來排的等候時間差不多要等到40分鐘或是一小時以上；而說實在位子算是挺狹小的，邊操作石盤烤牛排也一邊要注意不要把其他盤子碰下桌。
炸牛排就真的百百家都差不多口味，怕不熟的有提供石盤烤熟但要注意不要烤太老；加套餐的甜點部分倒是這家滿足的關鍵點，不管是糰子還是信玄餅都顯得頗為精緻。"
 Allen Liu ,https://www.google.com/maps/contrib/118098153318065740856/reviews?hl=zh-TW,3,False,5,"餐點ok，用餐服務也ok，但貴賓券折抵說明令人費解，內用每消費$1000元""兌換""一張這點讓人誤以為消費滿千才贈送這張抵用券，並沒有提到要消費滿千才能""抵用""或""使用""貴賓券，有誤導消費者之嫌。"
 WanTing “吉兒醬” ,https://www.google.com/maps/contrib/102750326500331235919/reviews?hl=zh-TW,4,True,146,頗生、還沒有烤盤可以煎！不過品項種類很多
 Vickey ,https://www.google.com/maps/contrib/114888414432743625232/reviews?hl=zh-TW,2,False,11,麵衣很油膩，有些部位又炸太熟根本咬不動
 oe z ,https://www.google.com/maps/contrib/108070063620296597690/reviews?hl=zh-TW,4,True,83,"勝牛三品，雪花鐵板牛，炸菲力，炸牛串都好吃～
鐵板烤盤必備，邊烤邊吃超讚!
生日月送四格甜品（珍珠冰淇淋滿分，糰子很特別）。
烏龍麵偏軟爛不Q表現普通，不建議加單～"
 lily isme ,https://www.google.com/maps/contrib/114627496756919286000/reviews?hl=zh-TW,3,True,217,有油煙味，服務還可以部分服務人員蠻親切的，肉的厚度不大一致
 陣立偉 ,https://www.google.com/maps/contrib/115068012178980448736/reviews?hl=zh-TW,5,False,11,去京站吃飯發現就這間店沒人不用排隊第一次吃滿怕踩雷結果意外的不錯吃
 咩咩 ,https://www.google.com/maps/contrib/114590771234964442692/reviews?hl=zh-TW,5,True,61,牛肉外酥內嫩炸的剛剛好
 高多 ,https://www.google.com/maps/contrib/109169273448604233078/reviews?hl=zh-TW,5,True,374,飯高麗菜味增湯都可以免費續加
 林屁佑 ,https://www.google.com/maps/contrib/111209502933637793988/reviews?hl=zh-TW,3,False,14,"更新：在裡面用餐服務還不錯、餐點也蠻好吃的。（所以結論就是工作分配要加強外面有客人的時候應該優先去跟客人帶位或是告知客人等候狀況。）

還沒吃就先生氣的部分：
在外面等了10分鐘沒人來接待
就算要候位也應該要有人出來說明一下
不是讓一排客人在外面乾等啊
服務員一堆在裡面走來走去走來走去
也沒看到到底在忙什麼啊
爛死了還沒吃就一肚子火還要收服務費
請加強員工訓練吧不然趕快倒一倒
第一次看到這種沒人要接待在外面排隊的客人的店"
 Xiu Wen Huang ,https://www.google.com/maps/contrib/104495105821136665310/reviews?hl=zh-TW,3,True,177,今天點了牛豚二吃，餐點跟服務態度都普通
 Kevin Wang ,https://www.google.com/maps/contrib/109579216024366875841/reviews?hl=zh-TW,4,True,68,炸牛排好吃不在話下，高麗菜絲佐胡麻醬，讚!
 陳達龍 ,https://www.google.com/maps/contrib/107992497033502667903/reviews?hl=zh-TW,5,True,43,份量剛好，獨食適合。
 葉芸 ,https://www.google.com/maps/contrib/101675322090531079254/reviews?hl=zh-TW,4,True,28,另一份京都聖牛三味送上桌時已經冷了，且沾醬後也沒什麼味道。鍋膳比較好吃
 Nicole ,https://www.google.com/maps/contrib/117353585810726354490/reviews?hl=zh-TW,3,False,21,"*兒童餐的薯條很硬
*詢問餐點問題，服務回應態度差（金髮色女店員）好像我打擾到她ㄧ樣⋯"
 Chin Liao ,https://www.google.com/maps/contrib/116617070367986507945/reviews?hl=zh-TW,4,True,54,"在04/08約18:30與女友一同前往食用晚餐
晚餐時段店內卻半滿而已想說該不會要踩雷了吧。
而入座後服務生便問要氣泡水還是熱茶，雙雙都選了免費一杯的氣泡水。
當天點了厚切菲力炸牛排(390)與元祖翼板炸牛排(380)，炸牛排上桌的熟度大概只有3分左右，需要再更熟的朋友可以請服務生上陶盤供客人自己加熱以達到想要的熟度。
調味料的部分則有提供玫瑰鹽、七味粉、芥末、咖哩醬、牛排醬以及和風鰹魚醬，個人很喜歡鰹魚醬的風味。
生菜絲飽水度也很棒，雖說當天在吃高麗菜絲時吃到一大片塑膠袋，但當天值班負責人的危機處理及時也很棒，服務員們也會適時詢問客人是否需要添加生菜絲，整體用餐體驗很棒。
至於大家最愛考量的CP值嘛，我就拿價位差不多的勝博殿做比較，多花快100塊從炸豬排升級成炸牛排個人覺得沒什麼問題。

當天餐點給3🌟、而另外1🌟給服務人員們

算是我想吃會再訪的店。"
 李崇民 ,https://www.google.com/maps/contrib/115477535177313877531/reviews?hl=zh-TW,5,True,111,牛肉肉質嫩好吃！外酥內軟的口感極佳，份量不小可以吃的很飽！
 Ma Leon ,https://www.google.com/maps/contrib/113509366768310219842/reviews?hl=zh-TW,2,True,16,"炸牡蠣一上桌冷的，牛三寶之一如圖片薄到只吃到麵皮與醬汁，座位擁擠，各扣1分。
同樣的價位在京站有許多CP值更高、品質更穩定的選擇，
第二次來訪，品質落差已讓人準備將此掛名京都之店，列入拒往。"
 Salus Li ,https://www.google.com/maps/contrib/104692592305184034485/reviews?hl=zh-TW,5,True,229,好吃，服務親切，油煙有點濃
 Chih yin Yang ,https://www.google.com/maps/contrib/100725135756333401700/reviews?hl=zh-TW,4,True,206,從新體驗日本吃炸牛排的感覺
 聽說客家糰子會拉肚子 ,https://www.google.com/maps/contrib/116545836372585883321/reviews?hl=zh-TW,5,False,3,腰內肉好吃，很嫩
 Zhih-wei Wang ,https://www.google.com/maps/contrib/111978708225898020136/reviews?hl=zh-TW,5,True,35,店員細心有禮貌！
 溫震宇 ,https://www.google.com/maps/contrib/115281227516269970011/reviews?hl=zh-TW,5,True,194,在京都吃過一次，味道完勝台北的，但還是很好吃，缺點是牛肉熱度有點不夠，吃兩種牛肉肉的套餐就好，三種牛的套餐第三種肉很柴不好吃
 賴沛綺 ,https://www.google.com/maps/contrib/109726093664163080561/reviews?hl=zh-TW,3,True,36,"餐點好吃
點餐機明明選了飲料去冰但送來的飲料還是有冰塊
招手請服務生協助，服務生說下次可以選去冰，但我明明就有選去冰🙄️🙄️🙄️"
 Weihsin Wang ,https://www.google.com/maps/contrib/113976372763600268292/reviews?hl=zh-TW,4,True,159,食物還可以，服務來說，以這樣價位來說，只能說差可
 kimberlly Wang ,https://www.google.com/maps/contrib/107735987378962398913/reviews?hl=zh-TW,4,True,42,"炸牛排口感普通，份量普通～價格不便宜😅
服務不錯👍"
 邱奕升 ,https://www.google.com/maps/contrib/114696878198483548115/reviews?hl=zh-TW,5,False,3,京站ㄉ服務超好><每種肉都超好吃😍一定要來！
 哈囉你好嗎 ,https://www.google.com/maps/contrib/101043245338723022783/reviews?hl=zh-TW,2,True,115,烤盤受熱不均，導致肉放在上面根本變放好看的
 Mia Tzeng ,https://www.google.com/maps/contrib/101090357386200213195/reviews?hl=zh-TW,4,True,140,"雖然不是點招牌的牛肉
豬排的表現也很不錯
價格也相當平價"
 Steven Hung ,https://www.google.com/maps/contrib/106430503947337148157/reviews?hl=zh-TW,1,False,88,跟朋友吃不到饗食，繞了一圈選了這家店，看裝潢、菜單感覺都不錯，結果實際吃起來大失所望。朋友點了招牌牛排、酒，我點了海陸鍋、四格點心，兩個人再分二顆牡犡，最後花了1500上下，實在很不值得，不會再訪了。
 游泳褲 ,https://www.google.com/maps/contrib/113186706860707211139/reviews?hl=zh-TW,5,True,82,"以為是可樂餅但是是炸洋蔥好吃
點餐機的UIUX需要再改進"
 Siou Liou ,https://www.google.com/maps/contrib/110846168078423091831/reviews?hl=zh-TW,3,True,793,海陸里肌豬排，覺得太鹹、肉太硬，這樣的價位不如吃勝博殿
 白白 ,https://www.google.com/maps/contrib/100744815557012584945/reviews?hl=zh-TW,5,True,29,服務好啊東西好吃啊只是有些真的太貴了
 Gaspar Xie ,https://www.google.com/maps/contrib/105964758109967216631/reviews?hl=zh-TW,5,True,945,鐵板牛排單上鹽巴就好吃
 Angel Chu ,https://www.google.com/maps/contrib/108782006322779105518/reviews?hl=zh-TW,2,True,358,"這星是給服務員人的，應該不會再來了
牛肉咬到吞不下去，豬肉就四條全是大蒜，口味也不ok,不知道說什麼好"
 Anella Carmen ,https://www.google.com/maps/contrib/102203566870713350570/reviews?hl=zh-TW,5,True,23,"炸牛排煎過更香！
高麗菜絲的黃金泡菜醬真的有夠好吃，不知不覺續了三次菜絲XD
免費的飲料有茶和氣泡水可以選，讓我印象也挺深刻的！
日式餐廳服務果然非常到位，收餐盤出了小差錯還招待了甜點作為道歉。"
 Tony Hsu ,https://www.google.com/maps/contrib/116619473158964675671/reviews?hl=zh-TW,5,True,148,"食材極佳、服務很好、價格較高
Ingredientsarerealfresh.Serviceisverygood.Abitpricey."
 高小姐 ,https://www.google.com/maps/contrib/117393226821708584767/reviews?hl=zh-TW,5,True,58,餐廳同仁服務態度很好，值得稱讚🥰🥰🥰
 Mia Chuang ,https://www.google.com/maps/contrib/105316881832488242641/reviews?hl=zh-TW,5,False,15,牛肉超好吃，上菜速度超快，服務很貼心🥰
 Willy ,https://www.google.com/maps/contrib/114774709015597406469/reviews?hl=zh-TW,5,False,3,外場服務員態度都很好餐點品質也好吃👏
 曹策勛（Shün Tsao） ,https://www.google.com/maps/contrib/103548522298425734686/reviews?hl=zh-TW,3,True,253,自己炸還蠻有特色的，但口感很普，份量也不多
 何彥葶 ,https://www.google.com/maps/contrib/105414791470699263052/reviews?hl=zh-TW,5,False,11,"好好吃！跟在日本吃到味道一樣！❤️
服務態度又很好！"
 邱永龍 ,https://www.google.com/maps/contrib/107428425140186752546/reviews?hl=zh-TW,5,True,"1,302",日式和牛店，湯、飯、高麗菜絲無限續加😬
 Mole ,https://www.google.com/maps/contrib/111267267179565476558/reviews?hl=zh-TW,2,True,27,第一次吃炸牛排可能不夠客觀，不過想來吃的人要有心理準備他的肉跟皮滿分離的，又因為肉上桌時大概5分熟而已，口感較韌，整個咬起來就是皮都爛掉了但肉還在嘴巴裡翻滾，總之個人覺得不好吃，另外炸牡蠣也滿腥的。
 許涼 ,https://www.google.com/maps/contrib/115290256319245349693/reviews?hl=zh-TW,5,False,21,"醬料（含沙拉醬）和肉都好吃！咖哩醬好吃到想直接買
店員都很好，貼心一直擔心隔板會不會倒弄到我們🤣
茶凍（？）很特別，好吃
飲料竟然也好喝
還會想再去！"
 Rocker Lin ,https://www.google.com/maps/contrib/103122063364858762046/reviews?hl=zh-TW,5,True,31,今天吃的是京都勝牛三味，牛肉的熟度炸的剛剛好，肉質鮮嫩多汁。
 Jun Jun ,https://www.google.com/maps/contrib/108152083398569473416/reviews?hl=zh-TW,5,True,270,"#收取10%服務費
#提供刷卡服務"
 Wei Jerry ,https://www.google.com/maps/contrib/109663435649865049614/reviews?hl=zh-TW,4,True,382,牛肉來到面前怕生的人可以再加熱煎一下，炸雞塊的肉很嫩，但邊邊容易炸到太硬，口感變得很衝突
 宗哲 ,https://www.google.com/maps/contrib/102832055336092819140/reviews?hl=zh-TW,1,False,13,"剛剛從京都勝牛離開，滿肚子的火，一下是事情發生經過：
事件1.剛上菜的時候，醬汁就灑到外面，結果筷子也被沾到了，於是和服務生說，然後請她換個筷子，然後服務生跟我說‘喔’，這樣就算了，結果路上遇到其他服務生，結果還給我聊了一下（面帶笑容），我就在想說我要等妳多久，肉都冷掉了，沒筷子我要怎麼吃？真的很差勁⋯

事件2.剛上菜的時候，馬上和服務生說要加烤盤，好了，事情剛正要展開，眼看著烤盤被服務生端過來了，結果上到隔壁桌？？？我看隔壁也是一臉錯愕，我就想說會不會是他有點，結果等了10分鐘還是沒來，後來就又叫了服務生，然後就說請稍等，是要我等多久⋯，我還說我剛剛有說了，才發現漏給才說不好意思，才趕快給⋯，不然又不知道要等多久⋯

事件3.上完烤盤後，等沙漏完準備要烤，放上去不到2分鐘火變小了？？？？？隔壁送錯的還在燃燒中，請問是給之前沒檢查有沒有油嗎？結果和服務生說沒火了，然後說等下幫妳補，我要等幾次等多久？隔壁2組客人都吃光了⋯⋯，這樣就算了，等了5分鐘，又沒人來換是怎樣，不是說等一下？於是又叫了一次，這次有服務生來了，然後過來不知道要把上面烤盤放哪裡，然後拿著烤盤‘痾⋯’還看了我一下，才整個連下盤火都拿走，然後就拿去補，我就在想能不能快一點，結果看到服務生拿到角落又開始講話，我的肉在妳前面，還給我慢慢弄⋯，一直等一直等一直等，真的很糟糕的體驗⋯

想一想離開的時候什麼也沒說真的蠻後悔的，真的是很糟糕的經驗，還想著1年前才吃過，怎麼才一陣子服務變的這麼差？下次應該不會再去了⋯"
 Linda Lin ,https://www.google.com/maps/contrib/113460733593369507625/reviews?hl=zh-TW,5,False,3,"推薦菲力炸牛排!超好吃~~飯也超好吃的!!
特別想說服務人員態度真的非常好，之前帶家人去吃家人對於服務人員的態度真的讚不絕口!
使用APP也整個很划算，多送很多東西，累積點數還能換炸物非常划算~每次去吃都吃超飽~"
 Hu ,https://www.google.com/maps/contrib/102087512289785992170/reviews?hl=zh-TW,5,False,3,"東西好吃😋服務人員服務態度很好👌🏻
店長人好看"
 南先生 ,https://www.google.com/maps/contrib/112489075449531942681/reviews?hl=zh-TW,5,False,1,不得不說這裡東西好吃服務又佳，下次會再來光顧
 L C ,https://www.google.com/maps/contrib/103060692222145594588/reviews?hl=zh-TW,3,True,48,"在東京吃過念念不忘，在台灣開了以後期待很久終於去吃，但是吃完覺得並沒有讓人非常滿意

第一肉滿硬的，在日本吃的是軟嫩有肉汁的那種，在這裏的感覺就是硬+乾，麵衣比日本的厚和脆，但是肉同樣是生的怎麼這麼硬啊....
然後他沒有味道，我沾了滿滿的醬，還是不鹹，肉也沒有牛肉的味道，然後又很硬，我不知道我在吃什麼QQ

另外更讓人印象深刻的是，肉是冷的正常。但是白飯也是冷的！唯一只有味增湯是熱的。冬天吃下來覺得更冷了….

然後服務，感覺服務生並沒有很熟練，可能因為忙感覺不到禮貌，而且外場服務生沒有一個人有笑容....，做為一間打著日本招牌的餐廳，這是非常不合格的。希望至少這點能夠改進

總結，不會再訪，然後我更想念日本的牛かつ了。"
 Wing ,https://www.google.com/maps/contrib/103129058464056153100/reviews?hl=zh-TW,2,True,194,不會想吃第二次，炸豬比炸牛好吃，但要吃炸豬不如去邁泉、杏子或勝博殿。
