user_name,user_profile_url,rating,local_guide,comment_num,comment_text
 佐倉ㄚㄐ ,https://www.google.com/maps/contrib/111459264195443843885/reviews?hl=zh-TW,1,False,9,員工對顧客視而不見，沒有叫人鈴只好舉手要水，結果有個剛下班的員工與其他正在上班的員工聚在吧檯講話，完全不看用餐桌，根本薪水小偷，結果好不容易與剛下班的女店員（戴眼鏡，是她帶我們入座，我們第一次來，她介紹點餐方法也講的不清不楚）對視到，也沒有提醒旁邊正在上班的員工有人招手，就轉頭繼續做自己的事，感覺員工要不是有社交障礙，就是員工培訓不足，肉本身還不錯，但店員服務真的是只能嘆氣，如果沒有收服務費就不服務，那可以在桌上放水壺讓客人自己倒，豈不美哉ㄏㄏ。
 Richard Fan ,https://www.google.com/maps/contrib/109028277605775538399/reviews?hl=zh-TW,5,False,12,份量適中剛剛好，點餐是掃QRCode線上勾選，整體用餐經驗良好!!
 黃詠晟 ,https://www.google.com/maps/contrib/102918626652195767081/reviews?hl=zh-TW,1,True,44,新竹巨城店的服務爛透了你們是不是沒發薪水？
 番紅花 ,https://www.google.com/maps/contrib/110064162037239912165/reviews?hl=zh-TW,5,False,14,燒肉好吃，CP值不錯，適合人數少來吃，如果不用排隊就更好了。
 Mio Q ,https://www.google.com/maps/contrib/107165941285004154044/reviews?hl=zh-TW,5,False,326,"比燒肉smile好太多了！環境，肉類品質。
就是火小了一點。"
 amy lan ,https://www.google.com/maps/contrib/113401391649365718134/reviews?hl=zh-TW,5,True,90,自己一個人想吃燒肉的好選擇，用QRcode點餐還蠻特別的，可以慢慢參考菜單不用急，這次點了夏季推出的迷迭香檸檬牛五花200g套餐+單點松阪豬100g，都好吃👍，個人非常喜歡松阪豬，自己烤到外酥內嫩加上鹽跟擠點檸檬就是人間美味。
 SI YUAN HUANG ,https://www.google.com/maps/contrib/112857175305668737235/reviews?hl=zh-TW,1,False,32,肉質普通，烤爐火太小，烤個肉都要等個幾分鐘，價格偏貴份量少吃不飽，CP值低不符期望，沒有網路部落客說的那麼厲害。
 希娜韓 ,https://www.google.com/maps/contrib/112956075393111685652/reviews?hl=zh-TW,3,False,183,"雞腿肉（單點100g）+豬五花（單點100g）$210
平日1115到店裡大概坐一半
在1140左右開始需要等位子
對於食量小只想稍微吃一下烤肉的人來說很適合
如果食量正常想吃飽就點套餐裡面有白飯
食量大的就去吃真正的吃到飽吧

上菜速度非常快
比較不夠貼心的是上來的就是肉跟可以裝兩種醬的醬料盤
沒有附一個可以放熟食的盤子
烤好就只能往醬料裡丟
但又很小整個真的不太方便
醬料有5.6種可以選
但是醬料的瓶子都黏黏的感覺沒有清

B5大小的小爐
但只有更中間的地方火力是夠的
如果點了雞腿肉那種要小火慢慢烤的就會占烤爐很大位置
2人座位的爐子大小是一樣的
所以2個人來應該很累

我覺得對我來說是適合我的店
但清潔方面跟小碟子可以再改進"
 周家妤 ,https://www.google.com/maps/contrib/108306739528530659195/reviews?hl=zh-TW,5,True,7,"到的時間不是用餐巔峰時段所以不用排隊，但店裡還是蠻多人的。帶位和送餐速度都很快！
餐點不錯吃～肉就算不沾醬味道也很夠了！吃的很飽，不過如果這樣點感覺種類有點少，吃到最後容易吃膩啦。
冷氣確實不太強，但可能是因為店裡沒有坐滿，所以個人倒也沒感覺到熱。
總體來說感覺不錯，可以偶爾吃吃的～"
 Chih Ling Chang ,https://www.google.com/maps/contrib/104674490936579022198/reviews?hl=zh-TW,5,True,24,"一個人突然想吃燒肉也可以來的好地方

肉的份量與飯量都可以選擇自己喜歡的克數相當人性化
泡菜跟味噌湯雖然是配角但也毫不遜色
但建議避開用餐時段才不會排很久，也建議不要太多人去🤣

（圖片是200g牛五花+松阪豬&飯量350g）"
 楊晉侑 ,https://www.google.com/maps/contrib/106480417195685400065/reviews?hl=zh-TW,5,True,44,雖然說花了可以吃一趟吃到飽的錢，但不論肉質或厚度，甚至是肉味跟感受都更勝一籌，可以一個人吃的燒肉，不必在意讓你覺得尷尬的周遭
 Evelyn Liu ,https://www.google.com/maps/contrib/100845778076412173571/reviews?hl=zh-TW,3,True,43,點了牛五花松阪豬套餐100g，再單點橫膈膜50g，一共400元，選了最大碗的飯，松阪豬很好吃，沾醬有很多選擇柚子胡椒醬➕蒜泥清爽解膩，但肉量對我來說份量真的很少，價錢不便宜CP值很低，適合小鳥胃的人來吃，想嚐鮮的人可來吃一次看看。
 Ben 黃 (大天兵) ,https://www.google.com/maps/contrib/108100828639819104522/reviews?hl=zh-TW,5,True,236,一個人也可以吃最低180-170
 鄭喻心 ,https://www.google.com/maps/contrib/106477546969653384785/reviews?hl=zh-TW,4,False,10,肉質的部分很美味，但是吃到後半段的時候會有點膩，因為平均的油脂量都蠻高的，如果有可以搭配解膩的東西或是飲品會更好（沙拉好像蠻小份的但要加購的話好像是$40）。另外份量的話200g的肉配200g的白飯對我的女性友人來說算是7~8分飽，我吃300g的肉如果沒有配白飯可能是6.5~7分飽，僅供各位參考。
 國民baby ,https://www.google.com/maps/contrib/104209492095098270777/reviews?hl=zh-TW,5,True,29,原以為會吃不飽但份量真的可以食材也不錯
 Alice Tsai ,https://www.google.com/maps/contrib/110170983508231119251/reviews?hl=zh-TW,3,True,425,"排隊時間：半小時
（20:35開始等，約21:05可以進去用餐，最晚入場時間為21:15。）

加分：
1.白飯非常好吃！套餐可以免費選擇最大碗的350g
2.沒有服務費
3.肉片沾蒜味醬很下飯
4.非常適合一人等車時用餐，但時間要預留長一點免得趕不上車
5.調味料選擇多

扣分：
1.排隊時間過長
2.排隊動線不好，加上很悶熱，店家也沒有提供冰水或是號碼牌等措施，讓人煩躁
3.CP值很低，370元只能吃300公克的肉跟飯（附湯跟泡菜）
4.烤爐不大，能烤的數量有限，加上有深度，會有點看不到正前方的位置
5.烤豬五花常常冒火，即使關小還是會烤到燒焦，網子也不會換，致癌疑慮
6.夾子超難用，很難施力，用久了手很痠...
7.味噌湯超級鹹"
 Brell Lee ,https://www.google.com/maps/contrib/117794686993604502489/reviews?hl=zh-TW,4,True,77,"還是比較適合一人一爐烤比較自在，想要吃到剛剛好飽的話（以普通食量計，不算小鳥胃那種）大概是點到四到五百出頭，點餐時可選擇要不要增加飯量。

環境衛生空氣清新，吃完也沒有我很怕的油煙味這點大加分~然後肉本身的調味蠻恰當，除非你想要嚐不同的味道，不然可以不額外加桌邊的醬料。

很適合自己一個人來吃，如果是要多人熱鬧加吃通海那就不適合選這裡。"
 Vicky Chen ,https://www.google.com/maps/contrib/110465249939185179651/reviews?hl=zh-TW,3,True,85,"優點:一人吃也不會尷尬,很新奇
缺點:
1.分量很少,我點牛五花,超小的肉片,吃不飽
2.不太清楚白開水是否要另外點?因為我沒有,但看其他人都有水喝
3.如果加點其他肉類,總價格可以去吃烤肉吃到飽(淚)
4.總體而言,就是自己烤的燒肉飯"
 朱蔚鈞 ,https://www.google.com/maps/contrib/106495716929199573604/reviews?hl=zh-TW,5,True,28,超級好吃，出餐快速，油花均勻，醬料適切
 錢多多 ,https://www.google.com/maps/contrib/101694221244458257859/reviews?hl=zh-TW,5,True,268,當天排隊其實還好（大約下午2：00左右到），因為人潮流動速度快，整個用餐時間大約40~50分鐘，當天點了牛五花300g➕加購沙拉=350元（中碗飯）。牛五花🍖片很薄，所以沒有牛腥味，吃起來口感很搭，肥瘦剛好，口感極佳，跟在日本吃的一樣，只是日本當地的牛五花更好吃，搭配店家提供多種醬料，日式醬油➕蒜泥，非常清爽而且微甜好入口，超級推薦日本越光米白飯，整體來說，就是大概花個350元，吃一個現烤的牛肉套餐，好吃、可以吃很飽，而且可以很悠哉的慢慢吃，沒人管的著，醬料就在桌子右手邊，想怎麼沾，通通自己來，我覺得很不錯，會常來。
 阿鸛顏 ,https://www.google.com/maps/contrib/100850639161617904780/reviews?hl=zh-TW,4,True,124,嗯，肉不錯、但是有點貴，但是是有那個價值的
 Eric ,https://www.google.com/maps/contrib/111941314454633371364/reviews?hl=zh-TW,4,True,71,"肉還OK不到難吃但也沒時麼特別，沾醬很多可以選
餐點內容可以選飯量，怕吃不飽可以大碗的飯
套餐內容有泡菜跟味增湯只是吃起來沒有辦法吃肉吃到爽肉的分量不多要到吃爽，花費會變得很高

嘴癢想一個人吃的話還是不錯的"
 weiwei ,https://www.google.com/maps/contrib/118079391346092432175/reviews?hl=zh-TW,4,True,43,好吃，但火力太小，烤起來很慢不過癮
 Rick志 ,https://www.google.com/maps/contrib/108692652990897775153/reviews?hl=zh-TW,1,False,6,CP值不是很低，是爆~低！我還要排一小時的隊還不能預約，吃起來跟外面可以預約、好一點的吃到飽燒肉品質一樣，重點是！兩個價錢還一樣多！結果燒肉Like三片肉、另一個品質好的可以吃到飽！真的不懂為什麼還有人排那麼爽，不要鬧~了！真的不要被排隊人潮騙了！真的吃起來很普通又貴！！鄉親阿~不要再被這種餐廳騙了！！不行，被騙去吃這家真的愈想愈氣，齁氣氣氣氣氣~我連一顆星都不想給超爛！透！了！！！
 Joanna ,https://www.google.com/maps/contrib/104872480282138940298/reviews?hl=zh-TW,3,True,184,"在京站內價錢不得已高也是人之常情，吃下來雞肉很好吃，很重鹹，飯女生點200g的也不會太飽，剛好而已。
優點1.醬料有很多選擇到是不錯。2.一個人或許真的滿不錯的，適合。但大組人馬不太適合。3.完全無煙式，值得肯定。
兩人合考網子小，且桌號好像是c5還c4中間的發熱的棒子整根黑掉了，感覺壞掉很久？因此肉都要考一陣子才熟，問店員說中間好像壞掉，她說雞肉要慢慢考，好吧那就慢慢慢慢慢考。"
 Chao-Cheng Cheng ,https://www.google.com/maps/contrib/111812421849835337292/reviews?hl=zh-TW,3,True,85,"限定桌曆優惠套餐
桌曆定價190(內含許多優惠券)，現在這個套餐只要490，蠻划算的～也註定我明年每個月都需要來報到了
應該是因為風潮還在，不然不是一間值得排隊的店。就是可以一個人自由去解決突然想吃燒肉的餐廳"
 Julie ,https://www.google.com/maps/contrib/116735453900799284800/reviews?hl=zh-TW,3,True,99,第一次過來嚐鮮，用餐時段外面要排隊。點的是180牛5花，覺得肉質普通，小小一塊，給想要來體驗一人燒肉的感覺……售價應該含店租，算小貴欸。希望小菜在多2樣，不然我覺得CP值很低，醬料選擇多，白飯不錯吃。
 ユリ ,https://www.google.com/maps/contrib/116503257962841938267/reviews?hl=zh-TW,2,True,67,"非常不推薦的一餐
點了三色豬五花套餐
其中一個是墨魚醬完全看不出來烤熟了沒，只能烤的久一點（很懷疑這是誰想出來的醬料）隔天老公跟我兩個拉肚子拉的一塌糊塗，絕對不會再去吃了
對於不吃牛肉的人也不夠友善，幾乎都是牛肉套餐～"
 周嘉鴻 ,https://www.google.com/maps/contrib/106159713427411142798/reviews?hl=zh-TW,5,True,30,這次沒排很久，約10分鐘就進場
 余安 ,https://www.google.com/maps/contrib/111836097492344935564/reviews?hl=zh-TW,3,True,206,"普普通通，份量很少
醬料還不錯，蠻多元的"
 戴浩安 ,https://www.google.com/maps/contrib/108826323966620742332/reviews?hl=zh-TW,5,True,84,好肉很好吃，但有點貴，人很多
 W L ,https://www.google.com/maps/contrib/105623022163809122692/reviews?hl=zh-TW,3,True,81,店內候位冷氣出風口那個位子可以不要擺嗎？在那等候位子整個被冷氣風直灌頭頂真的非常冷。餐點的份量跟價錢吃完，我覺得多加點錢吃別家還比較吃的飽，真的比較適合小鳥胃的人去吃。肉的品質是不錯，但是這樣的價錢跟份量，除非一個人想吃燒肉會再光顧，不然實在沒什麼吸引力再去吃。
 B WEI ,https://www.google.com/maps/contrib/107222676221775528864/reviews?hl=zh-TW,5,True,100,"好吃的燒肉套餐，點了牛五花200g套餐，選了350g的飯（還有150、250g的飯量可以選擇），吃完滿飽的！
覺得牛五花好吃，可以邊吃邊嘗試各種沾醬，沾醬放進飯裡也滿好吃的哈哈。
另外還吃了朋友點的松阪豬、雞肉，但個人還是偏愛牛五花，便宜又好吃！"
 Heui-Ting Lin ,https://www.google.com/maps/contrib/112156249723573323839/reviews?hl=zh-TW,4,True,"1,583",在京站一樓外面，天氣冷的話要排隊很冷，用餐不收服務費也不限時間，結論就是適合一個人想吃個燒肉的地方，他提供多種醬汁都非常好吃，尤其是味噌的，飯一開始可以選大中小，男生大概中的很剛好，如果拍是不飽可以選大的，事後加飯要加40元，套餐除了肉就只有基本的飯跟泡菜還有湯，其他就沒有了，店內不大，所以座位也比擠一些，肉並沒有太特別，但是一個蠻特別的用餐體驗，值得來試試
 Ethan Chang ,https://www.google.com/maps/contrib/104037286709442070620/reviews?hl=zh-TW,5,True,122,一人燒肉造福我們單身狗QQ
 Chen Bruce ,https://www.google.com/maps/contrib/115057709322079498632/reviews?hl=zh-TW,4,True,48,"日本人開店要更細心，水倒好準備不ok,客人到了再倒新水才是"
 張竣凱 ,https://www.google.com/maps/contrib/104435573445286771510/reviews?hl=zh-TW,4,True,124,燒肉很好吃，沾沾醬料、灑灑鹽巴都非常下飯，用餐環境乾淨舒適。缺點是價格太貴吃不飽，肉片太薄，不適合胃口大的人。
 徐大 ,https://www.google.com/maps/contrib/109763826453934824410/reviews?hl=zh-TW,5,True,55,肉好吃，配白飯真的很下飯，醬料也不錯
 子燕 ,https://www.google.com/maps/contrib/112648771931784327725/reviews?hl=zh-TW,1,False,16,"對不起，我應該要認真看一顆星的評論。
點了200g當下覺得，這個有200g嗎？
飯量最大碗，然後肉吃完了不只肚子空虛連精神也很空虛，只能不斷灌汽水把自己灌飽。
這個價格我覺得去西門的烤肉店吃到飽差不多價格，而且還有其他東西可以吃、飲料喝到爽、冰淇淋吃到飛起。
只能說嚐鮮過一次之後，我還是乖乖地去一半燒肉店吧。
重點是上菜真的超慢(躺"
 蔡さいさん ,https://www.google.com/maps/contrib/115032472370665419948/reviews?hl=zh-TW,5,True,55,不想吃吃到飽又想吃燒肉是個不錯的選擇，排隊約40分鐘。不過飯量有點微妙150g、200g、350g，飯量吃200g是有點不夠，350g感覺又太多了，間距不夠平衡。肉就是很單純未醃製的肉，純粹靠醬料調味，共有6種醬料
 阿健 ,https://www.google.com/maps/contrib/112172495438588854072/reviews?hl=zh-TW,3,False,50,"時間：假日晚服務：普通舒適：可以
店內的烤爐都是小型的但有些位置是兩人合用一爐，看倌如果不是一個人來可能要注意一下用餐時間。
厚切牛五花肥油較多適合用解膩的醬料（如柚子醬）肉切的很厚燒烤時間較久但喜歡嚼肉的看倌可以試試
牛舌愛吃的不用多說
橫膈膜切的較厚，但牛味十足筆者喜歡半熟
咖哩價錢跟份量讓筆者有點……但味道夠正統
沙拉胡麻醬搭配的很好建議點來緩和肉類的油脂"
 sherry chen ,https://www.google.com/maps/contrib/101531405958901502039/reviews?hl=zh-TW,5,False,5,"剛點好餐就遇上朋友不舒服到需要掛急診，很感謝店家願意幫忙改成外帶，且沒有收取已上餐部分的餐點費用（雖然完全沒有吃，不過應該對店家而言仍是損失）
整體服務非常體貼快速，謝謝店家。"
 YaChing Cheng ,https://www.google.com/maps/contrib/114619846947803545006/reviews?hl=zh-TW,1,False,17,"體驗過一次就好
肉品普通，份量少，價位高
重點是服務人員差，現場排隊要靠客人自律，水杯只能加冷開水"
 陽情節 ,https://www.google.com/maps/contrib/107475912830522313331/reviews?hl=zh-TW,4,True,194,"這間店本就屬於快速門市，所有人來去很快，不太適合太多人坐下來慢慢吃慢慢聊，我們兩個女生一人點兩百克的肉其實真的不夠，胃口小的當然沒問題，但是無肉不歡或是胃口比較好的請一定要買大份量。
飯最大碗，200kg肉，味噌湯（很普通）烤肉醬料很多種慢慢挑"
 Hsiao Yi Huang ,https://www.google.com/maps/contrib/103196367784304137342/reviews?hl=zh-TW,5,True,288,"蠻好吃的，肉跟醬料跟服務等都有一定水準，價格又親民。
但7度的天氣平日下午兩點竟然還排了10分鐘，不敢想像好天氣的假日要排幾小時"
 高峯翠くんの旦那さん ,https://www.google.com/maps/contrib/107487873376244359987/reviews?hl=zh-TW,2,False,13,"1.店內有蒼蠅在飛（體型中等的普通蒼蠅），在我面前很歡樂的刷了很久存在感，最後停在面前的木頭隔板上。不管牠哪裡飛來的，都代表你們衛生管理有問題。

2.水杯先倒好水放在桌上，等未上門的客人入座，如果是已進門準備入座的客人也就算了，重點是當時並未有任何客人等待，不管現在是不是防疫期間或是店員貪圖方便的個案，於衛生觀念上都不妥。

餐點、服務品質中規中矩，沒有加減分，口味就是吃粗飽，但不會飽的評價。
對貴店的衛生管理極度抱持懷疑，未來是否會再入店消費，答案是不會。

備註：整體本來只給一顆星，第兩顆星是給帶我入座的外場店員服務應對有及格。"
 Chiung Liang Khu ,https://www.google.com/maps/contrib/116233140458713640675/reviews?hl=zh-TW,1,True,185,店員在門口亂丟紙箱，不知道是不是在不爽什麼
 JC Lai ,https://www.google.com/maps/contrib/113149722329681248585/reviews?hl=zh-TW,4,True,77,牛五花300g後面偏油但可以接受。不過沒吃飽。
 Nate Lin ,https://www.google.com/maps/contrib/100209591798571238608/reviews?hl=zh-TW,5,True,653,好吃！火力調成五比較足夠
 Leo Yeh ,https://www.google.com/maps/contrib/116515801867607877593/reviews?hl=zh-TW,3,True,32,不錯的體驗，橫隔膜的肉質不錯，可以嚐鮮！
 陳近南 ,https://www.google.com/maps/contrib/112445582999274030222/reviews?hl=zh-TW,4,False,"1,581",人氣日系燒肉...平日用餐時間亦需排隊...可依個人喜好及食量選擇種類、份量、單點或套餐...套餐附白飯(大碗350g量超多)、泡菜、味噌湯...以200g的五花牛+松阪豬套餐來說...要價330元(免+1成)...男生應該只能吃個七分飽...雖然味道很不錯...也有很多種醬料可以選擇...但就肉的份量及厚度而言...爽度還是不太足夠...不過可以客製化點餐...一人一烤架...即便是自己一個人突然想吃燒肉又不見得想吃多...也可以很輕鬆的前往享用...
 Iwal Kao ,https://www.google.com/maps/contrib/118408491906171394266/reviews?hl=zh-TW,4,True,481,用QRcode在自己手機點餐，牛五花油到起火
 Will Lee ,https://www.google.com/maps/contrib/114443910952824688097/reviews?hl=zh-TW,2,False,3,豬五花又小又薄，量也少的可憐，雞肉小到不夠塞牙縫的感覺，沒青菜，飯竟然還秤重的，簡直是小孩子辦家家酒，搞噱頭而已。
 VERITAS ,https://www.google.com/maps/contrib/116728774683355269819/reviews?hl=zh-TW,3,False,15,"肉的品質還算不錯，
價格偏高，
說是一人燒肉店，
實際一人位置不多，
大多是兩人以上去用餐，
台人用餐習慣都是邊吃邊聊，吃完再聊，
所以翻桌率也慢～"
 ting ,https://www.google.com/maps/contrib/111000139311675496509/reviews?hl=zh-TW,2,False,35,"座位小，用餐感覺太擁擠，肉有新鮮，但都沒來換網，都在前面忙著。
套餐加點肉也要7百左右，倒不如去原燒（空間舒服，套餐東西也比較豐富，一位也可吃，還是碳火）"
 Anne Hsieh ,https://www.google.com/maps/contrib/105941733561093559882/reviews?hl=zh-TW,3,True,678,"周末的8點多排大概半小時可入座
優點：
白飯水準高醬汁選擇也多喜歡蒜味醬跟柚子胡椒淋在飯上就很好吃
店員有專業感
缺點：
肉品選擇不夠多烤爐很迷你頂多放三片牛五花就滿了
火力不旺火就算調到最大烤的速度也快不起來
白飯內混了一小條菜瓜布的屑屑衛生需加強
烤到最後肉都黑黑的希望可以幫忙換烤網"
 H ,https://www.google.com/maps/contrib/106888835537854651313/reviews?hl=zh-TW,3,False,112,"用餐體驗中間水準

不會主動換網，

點了啤酒沒附杯子，也沒附冰塊，

但是一杯350ml的鐵鋁罐啤酒卻要100元外加一成服務費，

我覺得不符這個價格"
 陳昱廷 ,https://www.google.com/maps/contrib/111946444210352088703/reviews?hl=zh-TW,3,True,42,上餐錯也少上可樂上了還是常溫的==
 王思涵 ,https://www.google.com/maps/contrib/101842976977686018020/reviews?hl=zh-TW,1,False,14,"用餐完後發現服務生清理桌子很噁心，一個抹布一桌擦到底，擦完桌子後順勢擦烤網旁的鐵片，覺得十分噁心，烤肉的過程中，都有碰到稍稍兩旁的鐵片，真的很難想像，剛剛吃下肚的，含蓋前桌的細菌😫😫😫,吃完後脹氣+隔天腹瀉，不知道是不是有關係🤔🤔"
 TW L ,https://www.google.com/maps/contrib/110624409415309960511/reviews?hl=zh-TW,3,True,82,"結論

避開人潮因為不值得你等太久
一個人可以吃是大賣點肉都還好
所以點便宜的就好
要點一定要點300g牛五花套餐或200g的套餐
100g少的可憐而且加點很貴
牛舌還好橫隔膜不錯
然後千萬不要浪費錢點和牛你會後悔
沒吃過那麼難吃的和牛"
 易霖易霖 ,https://www.google.com/maps/contrib/104891043442791694160/reviews?hl=zh-TW,1,False,14,應該叫精緻牛五花套餐8片薄博的一片，份量真的很少，吃不飽，我寧願去吃599吃到飽的
 주산유 ,https://www.google.com/maps/contrib/104192319636927714924/reviews?hl=zh-TW,1,False,2,業主你確定你是主打單人燒肉嗎？我今天是1人用餐你帶我到4人桌的位子和不認識的2人併桌這我還可以接受，但是即使旁邊的2人先吃完空出了位子，理論上應該是再帶2人入座吧？服務生你帶一家4口坐我隔壁加對面是哪招？！我還有一盤肉還沒烤欸！變相趕客人快點吃完走人嗎？主打單人燒肉還對單人用餐這種態度？真的是吃一次就夠了，感覺超級差勁！
 Huei ,https://www.google.com/maps/contrib/110975078894024357762/reviews?hl=zh-TW,1,False,16,"個人覺得肉質與價錢對不上，還有忘記給餐具和水，這就算了
戴著打掃手套拿餐具，餐具上面都是手套上的水和髒東西了，還拿給客人，這到底是？"
 馬克 ,https://www.google.com/maps/contrib/107861823415099232391/reviews?hl=zh-TW,5,True,194,今天是開店後第三次去吃牛肉和六瓶調味料依舊如昔可是雞肉感覺退步了大小塊差異太大個人感覺還可以接受可是現今連碎肉也送上感覺就差了些雖然克數和成本利潤重要可是拿小碎肉來燒烤有點失望殘念
 Carmen Chen ,https://www.google.com/maps/contrib/115563059114274478006/reviews?hl=zh-TW,3,True,127,"位在京站華陰街出口的單人燒肉餐廳。
雖然是平日中午11點半就到門口了，但已經客滿了，因此等了一下才進去。
點了牛五花300g的套餐，肉量很多，一人用餐大概45分鐘。
肉質一般，烤爐蠻小的，而且頗深，所以不是很好烤，能夠一次烤的份量大約三片牛肉，火力也蠻小的，雖然是日本品牌，但是沒有像是一般日式燒肉店的燒烤速度。
雖然位在商場很棒的位置，但是食物並沒有好吃的味道與口感，整體有點可惜了。"
 chesterlee2004 ,https://www.google.com/maps/contrib/100930773843506918678/reviews?hl=zh-TW,5,True,202,第一次感受這種日本式的燒肉當午餐，驚艷於點餐的方式，第一次經驗，發現自己以後會做的更好，點多一點的肉，這次純粹是淺嘗燒肉，不夠過癮，以後應該肉肉點個200克的，不要只是點100克，不夠過癮
 Ronan Liu ,https://www.google.com/maps/contrib/118256388907147572828/reviews?hl=zh-TW,3,False,6,烤盤不大火又很小火小到牛肉都要用老半天
 Mei Mei ,https://www.google.com/maps/contrib/115709847619722576782/reviews?hl=zh-TW,4,True,18,"👄牛五花+松阪豬套餐（200g)$330
👄牛五花+橫隔膜套餐(200g)$390
牛五花超薄
松阪豬脆好吃
橫隔膜咬不斷理還亂（很多人推薦，我是沒啥感覺啦）
很多人說CP值不高
我是覺得還可以辣
肉質都算不錯辣
醬料都滿好吃的
其實原味就夠味了"
