user_name,user_profile_url,rating,local_guide,comment_num,comment_text
 Chung-Hao Cheng ,https://www.google.com/maps/contrib/103950258070004859223/reviews?hl=zh-TW,4,True,"1,092","2018在日本開業的一個人燒肉，來台開幕已經2年，目前還是排隊人潮不斷，尤其是位在轉運站，很多都是外縣市轉運時來吃的。
店內主打的訴求是TASTY！QUICK！VALUE！完全可以滿足忽然想吃燒肉的慾望。
因為生意好，店家訂候位規定多，目前沒有開放訂位，都是要現場排，且人到齊才可以入座。
特別選下午時段過去排隊，當天假日下午16：12到，前面有18人，大約排了1排半，16：30就排到第三排了。
約16：33排到門口，16：45進店坐著繼續排，16：50入座，假日下午從開始排到入座要38分鐘。
因為排隊在京站華陰街的主要出入口，外圍就是吸菸區，風會往裡面吹，排隊除了風很大以外，還會有二手煙飄進來。
在店內排隊隊入座前，店員會問有沒有來過，並介紹用手機掃QRCode點餐，入座點完餐送出後要先將電烤網預熱按到3，後續肉上來要調高到5。
點完主餐後可以加購沙拉和咖哩，白飯可以選150/200/350g的飯，三種份量都沒有另外加價，建議男生肚子餓建議要先選350g，不然之後要點要再加錢。
這裡消費成人的低消是170，但不收10%服務費，且沒有提供外帶餐盒，不過有需求可要求換烤網和加水。
桌上的醬料總共有6種，有岩鹽、辣柚子胡椒、蒜泥、蒜香沾肉醬、鹽醬和味噌醬。
點完送出後大概2分鐘就會上餐，速度很快，店員會介紹怎麼吃，也有介紹餐具紙巾在抽屜內。
100g的肉約有3.5盎司，這裡提供的牛五花有8片，橫隔模有6塊，壽喜燒安格斯牛有6片，沒有重量概念可以參考肉的片數來點餐。
6種醬料中辣味的柚子胡椒最好吃，醬汁濃稠可以附著在肉上，味道又有層次，另外就是蒜香沾肉醬，店家的醬料碟只有兩個不夠放沾醬，可以烤的時候先灑點岩鹽，烤好再沾辣柚子胡椒。
一般美國牛五花簡單烤過沾醬配飯就很好吃，橫膈膜比較有咬勁，跟燒肉店比起來口感和香味還是有差，應該是等級不一樣，雖然是老饕推薦，個人反而覺得普通。
另外壽喜燒給的醬汁很多，安格斯牛吃完後可以再將普通的牛五花放在壽喜醬裡先醃泡過再烤。
烤網差不多是烤200g的肉，如果烤了比較多建議就要更換。
白飯是大橋越光米，也是店家比較講究的品項，不配肉單吃也很好吃，烤好的肉片沾醬後撒點岩鹽配飯吃相當美味。
整體來說來這裡就是吃肉配飯的，隨餐附的味噌醬和泡菜都只是陪襯，而且吃的時間比想像中快很多，當天烤20片肉不到30分鐘就吃完了。
一個便當約500g，大食量的男生來這裡吃300g的肉+350g的飯絕對非常過癮。
只是雖然疫情有比較趨緩，但用餐沒有量體溫、噴酒精、實名制，個人用餐也沒有隔板，這裡人潮量多，這樣真的不及格。
加上排隊的時間比吃的時間還久，雖然可以一個人烤肉吃得很開心，希望未來能多開一些店讓用餐不要等那麼久。"
 Chingxuan Chen ,https://www.google.com/maps/contrib/108183902768628108559/reviews?hl=zh-TW,4,False,10,"外頭常有排隊，但流動頗快，等一下就有座位。
肉質還算不錯，也有很多種調味料可以使用。份量對大食量還說還是略少一點。300多左右的價格還算可以。適合嚐鮮與食量小。"
 鍾小貓 ,https://www.google.com/maps/contrib/104468738872438975085/reviews?hl=zh-TW,4,True,50,"現在低消180
100g豬五花4片和松阪豬3塊220元
建議點200g280元
才差60元比較划算"
 潘華祺 ,https://www.google.com/maps/contrib/100751854245107304985/reviews?hl=zh-TW,1,False,4,"整盤肉都碎肉
火小到肉都癱了也烤不到
店員群聚在旁邊不肯換烤網
態度又差到換烤網用丟的

一顆星都不想給"
 阿家 ,https://www.google.com/maps/contrib/115959377223650246240/reviews?hl=zh-TW,3,False,2,"自己烤肉很happy，白飯很yummy

但是肉夾上塞滿油垢，醬汁與渣渣，感覺餐具不太乾淨，有點badbad"
 Am Focus ,https://www.google.com/maps/contrib/105838712940883696292/reviews?hl=zh-TW,3,False,8,肉不錯，我對面的ㄧ直發爐火很旺，希望多給一份碟裝醬料2格不夠，冷氣不冷，加強ㄧ下員工對肉分類的認識，總體來說平日來吃很好👍不用等
 Aa Lin ,https://www.google.com/maps/contrib/109688102004236573210/reviews?hl=zh-TW,5,True,112,整體來說不錯，自己烤自己吃（廢話）可惜肉好少，要吃飽可能要多點預算，爐ㄗ有點小，沒辦法一次放很多肉下去，必須慢食
 Roger H. ,https://www.google.com/maps/contrib/113492126401872480319/reviews?hl=zh-TW,2,True,699,"先說還好這餐沒有排隊很久就進來吃了，要不然應該只會給1星。這間燒肉在日本引起不少話題，主打的就是一個人也可以來吃燒肉，結果到台灣來之後，變成適合一個人坐的位置沒幾個，大多是要兩個人共用一個烤網，但烤網還是一樣很小並沒有放大，結果導致兩個人要共用這樣小小的一個網子烤肉，很難烤...而且在日本是用平板點餐，在台灣變成要掃QRCODE連上網站的方式點餐，那如果手機沒有網路怎麼辦?
因為第一次來吃，想先試試看基本款，所以點了200g牛五花套餐和200g豬雞套餐，內容除了肉之外，還有一碟味道有點怪的韓式泡菜和一碗很鹹沒有料的味增湯，還有可以小中大碗都不加價的蠻好吃的白飯。他的牛五花用的部位不太好，咬起來筋很多，而且可能品質也不是很好，所以吃起來肉質也很普通，還好有六種醬料可以隨意沾，彌補了一下不好吃的牛肉。我覺得他的豬五花和雞肉吃起來還比牛肉好吃。結帳服務人員的態度沒有很好，臉有點臭臭的，不過上菜的服務人員還會帶一點點微笑，雖然動作也有點隨便...整體來說他的價格偏高，肉質沒有很好，如果還要排隊排很久，實在不會再想來了。"
 夜橘 ,https://www.google.com/maps/contrib/100511980890133698039/reviews?hl=zh-TW,1,True,69,讓客人在外面等了半個小時，只因為沒有四個人同時的位置。也沒見到店員再安排位置，就只看到一直往空位置塞人
 June Yang ,https://www.google.com/maps/contrib/114907847530695161683/reviews?hl=zh-TW,5,True,432,"假日中午12點開始排隊大概排了40分鐘
點餐用qrcode掃描很迅速
套餐附泡菜跟湯還不錯
整體用餐體驗蠻讚的"
 Rocker Ye ,https://www.google.com/maps/contrib/115649005253680860343/reviews?hl=zh-TW,5,True,26,素食可以吃的烤肉，蠻特別的！
 陳芷萱 ,https://www.google.com/maps/contrib/115130727033308814699/reviews?hl=zh-TW,1,False,3,排了20分鐘出來說8:30不收客囉啊沒位置為什麼不說大家都餓著在排隊結果你們一句沒有囉就打發走？會不會太扯別人的都不是時間差評
 Kino Hsi ,https://www.google.com/maps/contrib/107606051772153737208/reviews?hl=zh-TW,5,False,14,10/12二訪京站店，服務態度跟餐點值得稱許，松露醬味道十足，很有機會再訪品嚐新菜色。
 YY h ,https://www.google.com/maps/contrib/118246577190035449715/reviews?hl=zh-TW,4,True,16,"平日下午來吃生意不錯
醬料選擇很多
但是冷氣很弱，可能故障了吧
不少服務費
難怪學生族群很多"
 松浦えいすけ ,https://www.google.com/maps/contrib/107695339642056099406/reviews?hl=zh-TW,5,True,71,CP值非常高的平價個人烤肉👍
 高慈薏 ,https://www.google.com/maps/contrib/114779779131287402744/reviews?hl=zh-TW,3,True,57,"肉質還可以
但火也太小了吧⋯⋯⋯⋯⋯⋯"
 Kiky Chen ,https://www.google.com/maps/contrib/115418234181800319495/reviews?hl=zh-TW,4,True,349,"日本品牌平價單人無煙燒肉店！環境很乾淨，單人座位附單人烤爐，油煙是下吸式，吃完身上幾乎沒有臭味！桌下也有籃子可以置物。雙人座位則要兩個人共用一個烤爐。

肉的部分由於是平價燒肉所以無法期待太高，但牛五花有基本水準，另外點了橫隔膜比較沒有驚艷感。白飯煮的蠻好吃，有大中小三個份量可以選擇。套餐還附有泡菜、味增湯與水。

醬汁共有六種選擇！套餐也有400g/300g/200g/100g肉等各種選擇。女生的話選擇200g肉差不多，男生可能要點300g肉以上。

點餐系統很先進，使用QRCODE掃描後線上點餐。不需要服務費。整體而言一個人或兩個人想快速吃燒肉、燒肉丼飯或是烤肉飯的時候是個好選擇。會再來吃的餐廳。

營業時間到10點半蠻方便的。中午和晚餐時段仍需要排隊，但是大部分客人30-40分鐘可以吃完，因此不會等太久。下午與晚上過了晚餐時間應該不需要排隊。"
 Dong Lin Wu ,https://www.google.com/maps/contrib/108826684109299783387/reviews?hl=zh-TW,4,True,165,"終於吃到主打一人燒肉的燒肉ライク！
不開放訂位，只能現場排隊
這次非用餐時間前來，體感只排了15分鐘左右，算是非常幸運！
點餐跟結帳都是使用QRCode，
點完送出後沒幾分鐘餐就送來了十分迅速。
肉的部分覺得還算OK，但醬料就有很多種選擇，
個人還是最愛鹽味，最能吃出本身的味道；
爐台是可以控制火力的，像是吃火鍋那樣的設計；
另外白飯的部分在點餐的時候可以選擇份量，都不用額外加錢！
最大份量的白飯挺驚人的..很餓又沒太多預算點肉的朋友可以試看看..
一份套餐內含肉、白飯、泡菜、味噌湯，沒有蔬菜，
個人覺得蠻適合平時午晚餐想吃個燒肉，
但臨時又揪不到人的選擇，
燒肉ライク能幫你解解饞但又不會吃到很撐很膩，
撇除用餐時段的大排長龍的話還蠻推薦的！"
 林涵蓁 ,https://www.google.com/maps/contrib/103194816029221977977/reviews?hl=zh-TW,5,True,93,很適合一個人說吃就吃的小確幸，沾醬有五、六種口味，有機會想再二訪
 fuei nako ,https://www.google.com/maps/contrib/111611113047360170880/reviews?hl=zh-TW,2,True,138,"蠻久之前去吃過一次，那次覺得蠻好的，大概有4星，所以在9/14又去2訪……就變成了2星。
19/09/14二訪，這次是10：10左右抵達京站，到門口時還沒有人排隊，大約在10：30開始陸續有人來排隊，10：40左右排隊人潮就變的蠻多的。
因為初訪印象很好，當時吃的飯也覺得很合自己口味，這次就叫了超大碗的飯！
結果這碗飯我吃了一口就完全不想吃了……
飯裡有一塊一塊硬硬的東西，挖上面吃也有，撥開上面吃下面的飯也有，讓我這餐吃的非常痛苦😭
本來是滿懷期待的點了大碗的飯……沒想到這次這麼可怕。
這次的肉品點了和牛跟橫膈膜套餐，還有單點的松露牛舌，我覺得水準跟初訪一樣，還是好吃，讓我吃完忍不住又追加橫膈膜！
雖然覺得肉都有醃過有點可惜啦：）
湯的部分就是蠻鹹的，我都會配著飯吃，但是這次的飯難已入口我就沒喝了……
還有這次跟初訪不一樣的是，有服務生幫忙倒水，記得初訪是自己倒的，有人幫忙倒水還蠻方便的，不用一直從座位上起來。
嗯……之後有機會應該還是會再去吃橫膈膜，希望到時候不要再吃到可怕的飯了。"
 Mostro Chen ,https://www.google.com/maps/contrib/110433925703636473408/reviews?hl=zh-TW,4,True,138,"燒肉，誰說燒肉一定要一群人吃才爽，一個人享受也可以很放鬆，無須在意別人眼光，日本知名專為一個人用餐的燒肉店『焼肉LIKE』的台灣首間店，進駐台北京站一樓，讓一個人又想大口吃燒肉有了很棒的選擇。價位上不會太貴，而且要吃多少肉都可以依照你當下的想法自由搭配。點餐方式也相當特別，使用手機掃QRCode後，就直接在上面點餐，相當方便。用餐環境來說，我挺喜歡這間的明亮開放，不過有個缺點就是面對大落地玻璃那面的夏天會很熱，其餘方面無論是店員的態度及上餐的速度都有一定的水準，最後肉質方面當然不需要拿來跟其他高單價的燒肉店來比較，我覺得這個價位可以吃到這樣的肉質很超值，下次來就不要點套餐，都單點來吃個過癮吧！🍖🍚🍺
#殘獸玩樂日記"
 Sylvia Hsia ,https://www.google.com/maps/contrib/113482344370418302197/reviews?hl=zh-TW,2,True,199,"牛五花薄碎到很難放平烤，口感差；橫隔膜普通，烤爐火小，肉都要等一會兒才能吃。
配菜是味噌湯和泡菜，淡而無味，只有越光米飯還不錯吧～

空虛的一餐！"
 豬董（小豬） ,https://www.google.com/maps/contrib/104790647279663515710/reviews?hl=zh-TW,3,True,139,"採掃QRcode點餐，免服務費
每人低消點100g以上套餐一份，
套餐裡有含飯（可以選克數）+小菜一碟+湯一碗，
醬料有很多可以選則，
推推牛五花肉很好吃，
點雞肉的話要有心理準備要烤很久……
建議一人一個烤爐，因為它們烤爐很小，
肉片量無法一次放太多~"
 Oliver cho ,https://www.google.com/maps/contrib/116282661301779619505/reviews?hl=zh-TW,5,True,173,一個人來吃真的蠻方便
 Claire Liau ,https://www.google.com/maps/contrib/111612786963102552954/reviews?hl=zh-TW,4,True,181,"第一次嘗試一個人燒肉，點了300g牛五花，覺得滿划算的。肉質和調味也不錯👍還有六種醬料供選擇，不會因為味道單一覺得膩。有一人座也有多人座，適合各種客群。
平日中午十一點去，所以沒有排隊。出來時排了很多人。不能預約只能現場候位。還是離峰時間去比較適合！"
 apple chen ,https://www.google.com/maps/contrib/111819883317237978001/reviews?hl=zh-TW,2,True,132,"我們兩位平日17:30抵達排隊，大約18:30入場，不過是跟另外兩位併桌四人位!
點餐是用手機掃QRCODE，套餐肉量分200g/100g、單點100g/50g
兩個人一個烤爐，桌面下抽屜就是放餐具的!手機點完餐後，服務生就會送肉盤來!白飯是不分價格的，我選最少的，食量不大的我都覺得太少!所以記得選大碗一些囉!
本來滿心期待的!朋友點了100g套餐180元!只能說那薄薄的四片肉跟幾塊小雞肉，我真的很不能接受阿!這樣並不便宜阿!所以朋友又再加點了一盤肉!
我點的是牛五花&橫膈膜200g套餐$390這個肉量正常多了!
不過可能看到100g套餐，太空需了!還是覺得少，肉質還可以!但並不沒有那種會想回訪的感覺，大排長龍而且並沒有多便宜!
只能說最大的特色還是一個人來吃燒烤吧！

營業時間:
週日~週四11：00～21：30
例假日前一日11：00～22：00
台北市大同區承德路一段1號"
 小獅王 ,https://www.google.com/maps/contrib/112862449667145399454/reviews?hl=zh-TW,4,True,109,東西不難吃啦，只是記得點400g的，然後飯大碗。不然大概只有小鳥胃可以吃的飽。排了半小時這樣的份量真的不OK。點兩份的錢還不如去吃吃到飽
 King T ,https://www.google.com/maps/contrib/107299534136565206872/reviews?hl=zh-TW,3,True,123,日常的排隊，點菜上菜步調不變，清潔的速度很快，翻桌率真的很高。第三次來的心得，燒肉還是炭火好，也因為每次吃完這邊燒肉都會鬧肚子三次左右，這次是最後一次前往用餐。
 凱特貓 ,https://www.google.com/maps/contrib/108319013662587144007/reviews?hl=zh-TW,4,True,129,肉量夠，想吃燒烤但又不想去吃吃到飽的可以去吃，不過價格偏高。
 Wen-ling Luo (Goretti LUo) ,https://www.google.com/maps/contrib/114208946029889113692/reviews?hl=zh-TW,5,True,53,"*推薦牛肋排，肉質鮮甜口感軟嫩👍🏼還有咖哩～看似普通卻意外驚艷好吃喔😋

若不想吃吃到飽卻又想吃燒肉的人而言，是另一個不錯的選擇👍🏼單人位設計，一人吃也不覺得奇怪(不過也因此烤盤比較小，兩人來吃會烤比較久)。

日式燒烤(調味整體偏甜)；大碗飯量十足(大食量女生也會吃很飽)；肉質新鮮、口感紮實，單單配鹽巴調味就很好吃，以此價位來說算是不錯。"
 倪尼尼 ,https://www.google.com/maps/contrib/107939537804983990405/reviews?hl=zh-TW,5,False,11,推薦的套餐490～份量很多滿讚
 AMOS LEE ,https://www.google.com/maps/contrib/111436632215500646981/reviews?hl=zh-TW,4,True,663,單個人份燒肉套餐，份量調整的剛好，肉質可以，就排隊需耗些時間~
 Ming-Fong Hong ,https://www.google.com/maps/contrib/114372716644205743259/reviews?hl=zh-TW,3,True,959,牛五花，橫隔膜，松阪肉都好吃，米飯就還好，不過可以直接選350g吃很飽。網子非常容易焦，也容易著火，讓烤肉很不順利。沙拉很好吃。幫客人加水應該可以事先說一聲，避免直接拿走加。平日12點來不用等，接近一點就開始排隊。地板黏黏的。
 台北西門-emma ,https://www.google.com/maps/contrib/111509653716236051371/reviews?hl=zh-TW,4,True,524,牛舌好好吃😋跟朋友一起點了不同的套餐Share，吃到六種肉😍（附菜單）食量大的可以點300g的🤤掃QR點餐！上菜速度快👏👏
 T ,https://www.google.com/maps/contrib/118386179988680635847/reviews?hl=zh-TW,4,True,284,"餐點：肉品推薦牛舌、橫膈膜，牛舌吃起來很有嚼勁、橫膈膜滿滿的牛味爆棚、這家都都有先醃漬過吃起來甜甜的，加上多種醬料可以選擇，多種口味能在一餐中都品嚐到！道地的日式咖喱配飯吃也非常棒，加八十蠻值得點的。

服務：需要加水的時候常請不到店員，小扣分。

環境：位於京站外，轉乘或經過時能來品嚐，非常方便的地點。

總結：日本來的單人燒肉、真的蠻有趣的、也被好多餐廳爭相模仿，但燒肉LIKE食材新鮮、價錢平價，只是生意太好；不開放訂位、只能現場候位，有時候一等就一小時起跳，蠻可惜的…可以刷卡非常方便！"
 Kaloo Lai ,https://www.google.com/maps/contrib/113804144463576775538/reviews?hl=zh-TW,4,True,503,"第一次來品嚐想說人潮退燒平日12:00排了8分鐘
入座店員提醒有松露系列
我還是點五花肉+橫膈膜200g$390/單點牛舌$160
等了很久約15分才來餐點
烤牛五花好油到火燒了
橫膈膜肉質好吃
牛舌還好
味增湯一般般
花了一小時用餐🍴⋯⋯$550免服務費"
 江寧 ,https://www.google.com/maps/contrib/112257773566310198476/reviews?hl=zh-TW,5,True,79,以單點燒肉來說算是難得平價、吃得飽、又好吃的選擇
 9 “90” 0 ,https://www.google.com/maps/contrib/112688072781221892150/reviews?hl=zh-TW,5,True,345,"中餐、晚餐吃飯時間得現場排隊，可避開。
下午16:00點前比較不用排隊！！！

點餐APP裡有各種套餐、單點與飲料，直接點選自己要的品項進購物車，在購物車裡可以選擇數量。還有，白飯是可以免費升級的喔！食量大的朋友務必點選大碗的，沒有選的話會是小碗的份量，都選好了就按確認點餐。

建議點套餐200g至300g的肉量，
飯有150g/200g/350g可供選擇，
建議飯量200g或350g(150g真的很少)
套餐內容含(肉+飯+湯+泡菜)
第一次選飯量一定要選好，額外不夠加點要💰
有生菜沙拉可加點(清爽好吃)

#超級不推香檸蘇打(真的不好喝)😒
#不推牛舌(貴又還好，CP值低)

推推推他家牛五花，個人覺得比豬肉再好吃一點
#第一次吃最推薦【牛五花&松阪豬套餐】的組合

牛五花本身有烤肉醬醃過
吃起來就是甜甜鹹鹹烤肉味
拌著越光米飯一起吃很搭。非常唰嘴

松阪豬也有先用鹽調味過
所以烤完不用沾醬可以直接吃
或是沾點蒜泥一起吃更對味

然後可隨時Gue工作人員換‘’鐵網‘’嚛⋯⋯

#台北#台北美食#台北甜點#甜點#日本#口袋名單#愛吃#排隊美食#好吃#收藏#秘密#台灣#台灣美食#推薦#美食推薦#環島#護理師#美味しい#美味#達人#分享#外帶#京站#北車#北車美食#燒烤#烤肉

看完文章喜歡的、或覺得文章實用的朋友們，歡迎按讚支持或追蹤，將會有更多動力為大家詳細報導。"
 F H ,https://www.google.com/maps/contrib/100624556046336863558/reviews?hl=zh-TW,4,True,365,好吃！好吃！要吃得滿足大約要花600元。牛五花是最佳選擇～
 黃鎮富 ,https://www.google.com/maps/contrib/110042084397536117140/reviews?hl=zh-TW,5,True,83,"飯量點300g吃得飽！牛肉豬肉新鮮，雞肉軟嫩，一個人都能自在的吃一餐,值得推薦"
 軒 ,https://www.google.com/maps/contrib/110699750207931120487/reviews?hl=zh-TW,5,True,100,滿足一個人想吃烤肉時的心願雞肉滑嫩豬五花不會有油膩感牛肉肉質新鮮點餐超便利上餐迅速真的很貼心
 Chen Eddie ,https://www.google.com/maps/contrib/102950583801716905229/reviews?hl=zh-TW,5,True,252,"以價位跟牛五花的肉質來說，這家店的用餐體驗是十分愉快的，其他評論提到的服務以及店內清潔維護個人覺得Ok.

應該是在平日的下午加上疫情期間，省卻了排隊的時間浪費，不然可想像以這附近人來人往的常態，大多需要久候。

位置在京站一樓，座位不多，每人有自己的烤肉空間，以掃QRcode點餐的餐點每份含肉品(不同份量有不同價格)＋白飯＋味噌湯＋泡菜，食量不大的人會覺得划算。其他加點就CP值較低。
醬料搭配也在桌前有詳細POP介紹，個人覺得單用鹽佐最為美味，建議顧客可以多試試。當然，白飯的口感也是十分優異，值得嘉獎。"
 Monica Wu ,https://www.google.com/maps/contrib/100941633619136202410/reviews?hl=zh-TW,4,True,304,朝聖日本來的單人燒肉店～平日開店前半小時已大排長龍，使用QRcode點餐蠻特別的，整個裝潢視覺很好拍照，也很乾淨舒適，有特製的六種醬料，個人很喜歡柚子胡椒醬剛好緩和了肉的油膩感，抽屜的餐具跟紙巾擺放的非常整齊。套餐價格170元起跳很平易近人，這次店的牛五花跟橫隔膜套餐雖然份量不多但是整個套餐吃完是有飽足感的～
 Lily Chang ,https://www.google.com/maps/contrib/101236383907387509074/reviews?hl=zh-TW,4,True,219,"牛五花+松阪豬
大推這個！松阪豬好好吃很有彈性🥰🥰
和牛牛五花+橫隔膜
我覺得普普通通還不如便宜的🤣🤣
週一晚上5:40排隊前面約25人約30分鐘就排到了～
個人建議
如果人潮太多需要排一小時我覺得就不太值得
小插曲
最後結帳時給店員兩張收據一起結
店員只結一張跟他說還有一張他還一臉狐疑
讓我們覺得這麼糊塗是不是應該就讓他自己賠錢了🤣🤣"
 嫻 ,https://www.google.com/maps/contrib/101028963725128217122/reviews?hl=zh-TW,5,True,343,"很好吃，牛五花非常好吃😋這價格令人驚艷的好吃，乾淨服務好又快速，在京站轉角處。飯可加大建議加大量，不加錢。
飯煮的很好吃。搭配牛五花的油脂下飯好吃下次會再來。
人多座位少，需要人到齊才能入坐。但等待很值得好吃"
 Laura Peng ,https://www.google.com/maps/contrib/110798135282346817467/reviews?hl=zh-TW,4,True,51,就算只有一個人，也可以好好吃燒肉了！今天點雞豬三品套餐，有豬五花、松阪豬、雞肉共300g，附白飯、泡菜、味噌湯，份量對女生剛剛好～肉質也不錯！
 Tingya W ,https://www.google.com/maps/contrib/105345514366050538946/reviews?hl=zh-TW,4,True,372,"一個人也能吃的燒肉，
在突然想吃的時候是好選擇！
不過以cp值來說有點低，
肉量滿少的，
不過牛舌跟松阪豬好吃！"
 Ivy Chuang ,https://www.google.com/maps/contrib/104163218051933774706/reviews?hl=zh-TW,5,True,429,平日大約下午五點過來完全不用排隊，不過陸陸續續還蠻多人進來，可能晚點就要排隊了。點餐方式蠻特別的，每個人有一組QRcode直接線上點餐。一個人一爐，不用跟別人搶，一個人也能吃的燒肉。200g的牛五花，切的非常薄，很快就會熟，但每一片得份量就很少。不過也因為切很薄變的很多塊，烤到最後覺得手蠻酸的。飯蠻好吃的，粒粒分明，可以選不同份量。加價的沙拉吃起來很清爽。醬汁很多種，柚子辣椒好吃！除了一般肉還有提供素肉，吃素的人應該也能一起享用。
 Randy C ,https://www.google.com/maps/contrib/108499633199851684345/reviews?hl=zh-TW,5,True,195,"烤網不大,因此若是兩人用餐反而會烤的有點彆扭,也不太適合多人聚餐。肉品價格合宜,當天吃的和牛五花與橫膈膜套餐,與加點的松阪豬品質也都不錯,不過和牛五花有點太肥了,吃到嘴裡反而沒啥口感,相較店內的美牛五花反倒比較有吃肉的感覺,但整體用餐體驗還是很好。

不過現在排隊的人潮有點可怕,用餐尖峰時間要排超過2個小時,不喜歡排隊的人大概要找冷門時間再來吃了,也希望能再多開幾家分店。"
