user_name,user_profile_url,rating,local_guide,comment_num,comment_text
 weifen ,https://www.google.com/maps/contrib/104550584760211020991/reviews?hl=zh-TW,5,True,13,"每次經過都大排長榮（誤）的Like燒肉店，週六下午晃過去發現竟然沒排隊，立馬開吃一波。
這次點的是100g牛五花（180元）+200g和牛+橫隔膜套餐（1020元）。

牛五花很柔軟新鮮，絲毫沒有冷凍的痕跡，經過特殊調味，簡單火烤過後，搭配Q彈粒粒飽滿的白米飯🍚，滿滿油花香，超級開胃，令人驚艷不已。

橫隔膜稍微烤久一點，肉質鮮美、口感軟嫩，也是很下飯的選擇。
本來重頭戲應該是A3和牛，確實入口即化，奈何油脂量實在太豐富，又沒有烤牛肉的油花香跟口感，有點吃不習慣，下次應該會主要點牛五花，是CP值最高又美味的選擇。

特別要推崇一下他們的沾醬，這次有用柚子胡椒醬、蒜香沾肉醬兩種，都很解膩，搭配著沾別有一番風味，尤其是柚子胡椒，略帶酸V的滋味，將五花牛的香氣提升到另一個層次，美味程度也大幅提升。

初訪的感覺還不錯，不愧是排隊名店，肉的部分處理得很好，香味四溢，會令人回味再三，貼心的是這家店也很適合一個人豪邁吃肉，看到許多男男女女一個人大快朵頤，不尷尬也能盡情享用美食。

是會想再光顧的店。"
 Ruby K ,https://www.google.com/maps/contrib/113774671486846415163/reviews?hl=zh-TW,5,True,211,"適合一人用餐的日式燒肉店太棒了，簡直是獨自用餐愛好者的福音！平日中午11點用餐，完全不用排隊，點好餐立刻出餐。今天點牛五花套餐（300g），只要320元，而且沒有加收服務費，白飯可以免費換成沙拉，需要控制澱粉攝取的也ok，套餐份量從100到400g，白飯可選擇大小碗，不夠吃都可以加點（單點有50、100g可選），非常貼心，不用擔心一份不夠吃、二份吃不下的尷尬狀況。無煙燒烤爐直接按鍵調整火力，對不擅長烤肉的人也很友善。
入座時會給你一張小單子，上面有QRcode，點餐採用掃描QRCode線上點餐，餐點選擇後按左上角購物車送出點單，不需要再口頭告知服務人員喔。
地點也很優，就在台北京站一樓，交通便利，有機會會再回訪~"
 沈啟鴻 ,https://www.google.com/maps/contrib/110495882046395298803/reviews?hl=zh-TW,4,True,"1,142",一人燒肉店，來這邊建議點平價的餐點體驗一下即可，要吃高價款乾脆去吃一般單點燒肉店的CP值比較好。飯量可以選擇，且白飯還滿好吃的，隨附的味增湯不夠味很難喝，旁邊架上有很多種醬料任君挑選。店門口時常大排長龍，排隊時仔細觀察了一下，不知道是店內SOP很多要照著做才要放下一組人進來，或者是人手不足所導致無法順暢地讓空桌盡快安排客人入座，看到店內明明有空位但遲遲不放門口排隊的人進去的感覺不是太好。
 張巧媛 ,https://www.google.com/maps/contrib/102730003686733591913/reviews?hl=zh-TW,5,True,113,"在台北京站外面1F
目前沒有電話訂位
只能現場候位
去的時間是星期日大概11:40到
排到的時候是12:00左右
點餐會有QRcode提供線上點餐，可以刷卡
一個人可以盡情吃燒肉的地方
飯量大的話，直接選擇400g的肉一次品嚐豬雞牛&白飯選擇300g的就對了👍👍👍
吃完很飽
途中需要換烤網的話，可以跟服務人員說哦～
除了白飯還有附味增湯跟泡菜
跟肉搭配很搭
有六種醬料可以選擇
柚子胡椒醬、鹽醬、辣味噌醬、蒜香沾肉醬、岩鹽、蒜泥。
大推柚子胡椒醬跟蒜香沾肉醬
跟白飯也很搭～
唯一缺點就是要排隊…
但美味值得等待
下次想一個人吃燒肉這兒推推👍👍👍"
 Sophia Zhang ,https://www.google.com/maps/contrib/100186633689077047160/reviews?hl=zh-TW,5,True,272,"初次體驗即回饋，有機會不排除回訪。

本次消費400g（牛五花/豬五花/牛赤肉/雞腿肉）套餐，結論是「只要不是牛的都好吃」，但至少不是硬梆梆的冷凍肉上桌，符合期望；另附一片海帶末在獨舞的味噌湯、小皿而普通的泡菜，與白飯中的帝王XD

說說亮點：
外場帶位及結帳人員都很親切有笑容、聲音明亮，基本桌邊介紹讓初次到訪而困惑的客人能快速理解；還有那台晶透米飯機（？）看著好療癒呀~~總體而言，是一人用餐能置身熱鬧人群但不會因此缺乏儀式感的地方，稍微留意左右兩旁獨食客人是有趣的事，有認真觀察一片片蛋白質遇熱變化的男性顧客，也有彷彿來喝可樂紓壓與追求一人空間的白髮蒼蒼的女客人。

平鋪直敘的事實：
提供常溫水與冰開水；六種醬料各有特色，任君挑選；桌下附籃能擺置隨身物品；人潮絡繹不絕需要久候；烤網不太沾、熱度最大值為五，尚足夠使用；翻桌時工作人員都會清潔消毒，對桌噴灑酒精時都有確實出手阻絕；一律使用QRcode點餐，遇到長者時外場女服務生很貼心蹲下在旁協助。

說說缺點：
硬體設備有待加強。是循著google評論而至，所以在外排隊等待時，幾次瞥見右手邊第一張桌子不時竄升火苗，不確定是否為某則評論中所說的烤焦肉機台？
二則很困擾我的，B2座位的抽屜關不起來...左側邊角有貼上膠帶，可見狀況持續有一段時間，還請修好他吧~
最後，不曉得設計原因，結果是座位間的透明隔板只隔一半。用餐途中，隔壁女士的塑膠瓶蓋特技般的滾落下烤盤、坐著時的視野死角，引來兩人一陣慌亂XD；雖無傷大雅，但這樣荒謬的小意外若能避免會安心許多吧~"
 啾咪白萌萌 ,https://www.google.com/maps/contrib/118233230428407491526/reviews?hl=zh-TW,3,True,472,"京站個人燒肉！每次經過還是很多人，難得過了七點不用排隊就可以入座👍500內一個人也可以爽吃燒肉～400g的肉量女生吃超級超級飽～只要$450其實200g選擇就很多了

可惜火爐很迷你，火很小！開到五最大也還是不太熱的感覺～建議烤肉先丟肥油下去助攻～肉故意切的很小片也是策略！烤到來不及吃！肉質很嫩，本身就有醃漬，不用特別沾醬

提供很多種沾醬，用玫瑰鹽其實就很好了

Highball淡得像喝水一樣"
 Yuting wong ,https://www.google.com/maps/contrib/105846202996122700367/reviews?hl=zh-TW,4,True,181,"來好幾次了，適合想吃燒肉時解個饞，簡單快速。
店員還是會視狀況主動來換烤網，還不錯。

喜歡單吃燒肉，不喜歡燒肉血水沾到白飯一起吃，所以每次必點生雞蛋：攪拌後淋在白飯上、澆一圈蒜香沾肉醬，生蛋拌飯好吃👍

堅果醬沙拉也是必點👍

-
用餐時段都會大排長龍，建議離峰下午時間不用等。
不過今天來前有一組團體客，沒有要拆桌，裡面明明有兩人桌空著，店員卻不先帶我們入座，直到團體進去才帶我們入位那桌，不能理解。

-
此次一人消費$730"
 T JH ,https://www.google.com/maps/contrib/105885571629201316979/reviews?hl=zh-TW,5,True,52,"活動滿多的，會有很多有意思的口味，目前是夏日桃醬，吃起來甜甜的很有趣！

中午十一點多的時間不太需要排隊

套餐部分一般食量的朋友建議可以直上四百克組合，飯量可調整，不然兩百克的組合份量蠻高機率連小食量也可能吃不飽

松阪豬表現佳，肉品新鮮度還可以，賣相稍微有點過濕，但醃漬的味道很不錯

一個人也可以放心用餐到完食，有機會會再訪"
 潘芸柔（小小） ,https://www.google.com/maps/contrib/105128222304257225245/reviews?hl=zh-TW,4,True,34,"燒肉界的速食店，在西門、北車這一帶還算划算的店家，一個人吃價位落在300-800之間。

❗️無法訂位，需現場排隊，且人數到齊了才能入座❗️
雖然每次都大排長龍，但其實上菜速度快，翻桌率也很高，所以蠻有效率的
不想排隊建議五點前來吃，五點後人潮湧現就可怕了
兩人以上用餐要注意，因為店內有點吵，聊天聽不太清楚

菜色部分肉品還可以，依一般女生份量抓肉品300g即可,飯量正常。可以視個人喜好加點，個人推薦牛舌，橫隔膜蠻特別的，牛五花好吃，但吃到後面稍嫌膩口。松阪還不錯，但有一點厚，加上烤盤火力不大夠，有點可惜了松阪豬。

醬汁真的不錯，選擇很多而且好吃。
環境有點可惜，抽油煙的設備不足，裏面稍嫌悶熱，且餐桌上的物品都有點油油的，但整體瑕不掩瑜。

整體而言還不錯，會想再訪。"
 井暐淳 ,https://www.google.com/maps/contrib/110268518425860544558/reviews?hl=zh-TW,5,True,139,該店位置在京站外側，可以依自己份量點個人的餐點(分100g、200g、300g及400g等)，套餐白飯可換成生菜沙拉；使用手機掃QRcode點餐，酒的種類不多；個人烤盤比較迷你，只有正中間部分熟的比較均勻(將肉鋪開太多快容易熟的不均勻)，提供6種醬料(推薦辣味增、柚子味增)，肉質及醃製美味好吃。在京站一個人突然想吃燒肉的好去處，但不適合4人以上的聚餐。店內空間乾淨，空氣不會充滿燒肉油煙，個人吧檯座位空間適中，但提供放東西的籃子在空間中就顯得有點卡腳不舒服，與旁邊座位有隔板。
 Hsing Chi Lin ,https://www.google.com/maps/contrib/102066623486722592116/reviews?hl=zh-TW,4,True,70,"突然想吃燒肉的好選擇，點牛五花（200g)$260，白飯依然煮的很好吃，沾醬醬也一樣都很優秀，尤其是蒜香燒肉醬，跟烤肉是絕配，直接淋飯上也好吃。
小可惜今天吃的牛五花，似乎沒有之前的香，紋理較硬稍微沒彈性。烤肉加熱燈三支最左邊那支似乎壞了，只有半邊能烤。
有不定期活動限定餐點，很多樣套組選擇能參考看看！不能訂位，吃飯時間很常要排隊，可以避開尖峰時間來用餐。"
 Hsuan Hsuan ,https://www.google.com/maps/contrib/107052214970034712933/reviews?hl=zh-TW,3,True,517,"2022/03/08造訪

服務人員換網粗魯，直接用丟的，且請我們將烤盤上的肉拿起來也沒有提供新的盤子，只能勉強先將半生熟的肉放生肉盤...
肉質普通，一般女生應該吃200克套餐就飽了。

可稱讚的點應該是上菜非常迅速、醬料選擇多元....
現在飯可以選擇換成沙拉，不過可請他沙拉醬少一點，不然有點醬太多。

人均250-500元。"
 Ed Wu ,https://www.google.com/maps/contrib/117893849750169660843/reviews?hl=zh-TW,4,True,94,"發揚單身經濟最成功的餐廳之一「燒肉LIKE」，個人覺得很值得一個人在想不到吃什麼的時候、或是想吃燒肉但找不到同伴一同大塊朵頤之時來嚐一嚐。
肉質不錯、可以依據個人食量決定份量（100克到400克的肉量都可以任君選擇）。用餐環境乾淨舒適、上菜速度快，點餐後約莫3-5分鐘即可享用，加上是屬於線上點餐，更減少了人與人之間的距離，符合店家的本意！"
 Lala ,https://www.google.com/maps/contrib/114734612168166273449/reviews?hl=zh-TW,4,True,956,"雖然排隊隊伍有點長…
不過真的很方便，自己烤，自己吃，獨享空間不被打擾，醬料自己看想加什麼加什麼，五花肉蠻好吃的，橫隔膜也還不錯，快速完成想吃燒肉的心卻又不會被份量侷限，讚！"
 sun annette ,https://www.google.com/maps/contrib/114447264978037568800/reviews?hl=zh-TW,5,False,21,去過多次，好吃不在話下，才有再訪之因！！也碰到不少服務人員，大多優良，僅有一次踩雷，但不影響，畢竟優多於劣！！本日再訪，值得特別一提！！有位黃軍皓！！於結帳前主動詢問湯品容器意見，且說已觀察許久，想多聽聽個別（尤其是老客戶-在戴口罩的期間仍可認出不容易）的想法。顯見其對消費者用心，貼心之處！！能主動留意對消費者安全且方便的心意與前瞻。於這年紀的年輕人著實是不可多得。查詢貴公司並無客服電話。特於評論處書寫。祁總公司能看見值得稱許的黃軍皓。應是能成為貴公司拔擢的領導人才！！還有還有本日所有服務人員均優👍。
 YunXuan Peng ,https://www.google.com/maps/contrib/113771270095816497816/reviews?hl=zh-TW,1,False,4,於3/718:25用餐，大蒜的罐子擠不出來、門一直開著，外面的冷風持續吹進來，超冷，此外，更讓人生氣的是火爐，已經將火力調至最小了，火還是一直噴上來（噴上來的高度比坐著的人還高），造成無法專心用餐，必須一直擔心火會不會燒到我的臉上，到後來受不了只好捧著碗後退吃飯，可以說是吃的非常克難，之前來吃的時候都沒有遇到這種情況，品管似乎有問題，大家去用餐的時候可以避開門口進來右手邊那桌，火爐真的很有問題，糟糕透了！火燒的跟火爐的火一樣大😡
 惟翔的旅遊食記 ,https://www.google.com/maps/contrib/114157756712556780444/reviews?hl=zh-TW,3,True,27,"🥄黑胡椒風味醬牛五花&豬五花套餐$260
評分：🌕🌕🌕🌗🌑
評論：牛五花我烤到差不多沒有看到紅血就吃了，這樣比較不會太老，個人覺得他的肉吃起來真的蠻普，網路上看到蠻多人說不錯吃（或是不敢真實評論🙃），可能我味覺不太一樣吧🤣，但他的沾醬真的吃起來蠻特別等下放下面個別介紹，牛五花建議沾蒜泥味增醬

🥄黑胡椒風味醬松阪豬&豬五花套餐$330
評分：🌕🌕🌕🌑🌑
評論：豬肉的部分我就真的有烤到全熟再熟一點，老實說這家我真的吃不出來豬五花跟松阪豬的口感有什麼差，就頂多一個油花看起來比較多，松阪豬&豬五花建議沾柚子胡椒醬

-

這間店是日本連鎖品牌，大概在去年插旗於北車附近，打破以往燒肉就是要一群人去吃的觀念，這間推出了單人烤肉套餐，烤肉爐也蠻小一個，當天我還是有跟朋友去吃，但單人烤肉爐跟雙人烤肉爐都一樣大小，我覺得雙人烤起來很不方便，可能是它就是想要你一個人來吃吧🥲

在沾醬部分他總共有四種醬：柚子胡椒醬蒜泥味噌醬蒜香沾肉醬鹽醬，個人最推前面兩個柚子胡椒醬有點偏甜，可以幫肉提味味道也蠻特別的可以試試看，蒜泥味噌醬蠻解膩的，吃起來比普通的蒜蓉醬油好吃

我回到家才發現這組照片我拍的好爛，修圖都救不了我，但我還是想分享🥹造福一些不敢自己一個人吃飯的人，因為裡面超多自己來吃的

他的飯可以選150g250g350g或是換沙拉，我是點350g，以我的食量而言剛好可以吃飽，正常人大概點250g就夠了，但我覺得價錢一樣就點大一點的（肉有點少會吃不飽）

-
❗️祝各位單身或沒朋友的人趕快找到陪你吃飯的人🥹
-
CP值：🌕🌕🌕🌑🌑
再訪率：🌕🌕🌕🌑🌑
個人喜愛程度：🌕🌕🌕🌗🌑
追蹤IG:wilson_eating_diary鎖定更多美食"
 陳旻祥 ,https://www.google.com/maps/contrib/106245788549058710368/reviews?hl=zh-TW,4,True,67,平日晚上就要排隊了！個人套餐份量還算足夠，有冰水可以解膩，平價燒肉的肉質算不錯，豬、牛、雞烤起來都好吃，肉盤上桌前有淋醬汁有獨特的風味，豬肉真的有水蜜桃的香味，值得一去。
 Annie Chiu ,https://www.google.com/maps/contrib/114103659321765603000/reviews?hl=zh-TW,4,True,502,是還不錯，（常常大排長龍）年輕人喜歡來的地方，價錢也很公道，要份量多一點的也有套餐400塊錢的，（裡面有4種肉）但套餐內的湯（像洗碗湯），泡菜略少，一晚白飯，若要加咖哩醬要多80元，整體一餐下來要530元一個人，要點260的套餐也有。只是肉很少。
 Bart Jan ,https://www.google.com/maps/contrib/112245433836438759166/reviews?hl=zh-TW,3,False,113,"點了牛五花&松阪豬套餐330元
牛五花很好吃但松阪豬肉腥味
肉的份量太少，他寫200g
松板豬6塊，超薄牛肉片8片
後來加點了100g的豬五花才吃飽點（比松阪豬好吃多了）
整體來說不難吃，但cp值太低了！
這餐花了450有點覺得去吃燒丼就好啦…."
 Chiu-hsia Liao ,https://www.google.com/maps/contrib/100330007170591906646/reviews?hl=zh-TW,4,True,73,"在營業時間打了兩通電話都沒接，星期一晚上現場候位沒有等很久，每個人都要掃QR碼點餐，上餐很快，覺得肉量400-600元的肉配200-350公克的飯比較會飽

座位中間有透明隔板，抽屜有筷子紙巾濕紙巾牙籤，醬料在上方兩人共用，6種選擇蠻下飯的，火力分為5種，肉品油脂太豐富會噴火要小心，也可以換烤網，備有常溫水跟冰水自行取用

突然想吃燒肉或揪不到朋友會回訪～"
 溫在銘 ,https://www.google.com/maps/contrib/115481622274315605752/reviews?hl=zh-TW,4,True,"1,192","一個人就可以吃的燒肉！男生的話肉可能要點到200-300克才吃得飽。

P.S.牛五花烤一烤油脂滴下去時火焰會爆出來，瞬間高溫會使油脂噴出來，今天就沾到衣服了。若是清洗麻煩的衣物須特別留意！"
 Jenny Yu珍妮 游零極限 ,https://www.google.com/maps/contrib/117845160831682823038/reviews?hl=zh-TW,3,True,166,一人燒肉店，來這邊建議點平價的餐點體驗一下即可，要吃高價款乾脆去吃一般單點燒肉店比較好。
 張Lei ,https://www.google.com/maps/contrib/104860002091502477680/reviews?hl=zh-TW,4,True,122,"京站1樓個人燒肉，牛豬雞套餐+單點。飯量可選100g.200g.350g價格都一樣，食量大的選350g
調味料種類多，調味好的，可惜沒辣的，對愛吃辣的就不夠味了，建議可在提供辣醬。沒有預約的，現場排，像我假日晚餐4:30-5:00去都不用排，但5:20分後就一推人在排了，建議提早去"
 Eric Lee ,https://www.google.com/maps/contrib/114744223592039572979/reviews?hl=zh-TW,5,True,216,一個人也可以享受日式無煙燒肉，依肉量分400g、300g、200g及100g，有牛、豬雞肉及6種沾醬可任選，套餐有飯及韓式泡菜，飯量可自選。CP值高，座位多，無訂位服務需現場排位。
 陳信樺 ,https://www.google.com/maps/contrib/112657140619612748107/reviews?hl=zh-TW,2,True,17,"還好曾經待過服務業，試著同理心體會服務人員的辛苦，不然我應該會有情緒，櫃檯接待的服務態度還可以再提升。

我剛好坐到一桌的烤爐不夠熱，烤肉的速度很慢，如有來消費的客人有這樣的感覺，要請服務生處理更換桌位。

我是男生，我沒有特別食量大，這個是吃巧不會吃飽，基本飽足感是沒有的，所以男生除非你本來就胃口不大，不然你會想再去吃別的

看評論都說小資小資，可價格我不覺得有小資，點一個套餐加點沙拉，這樣就$400元，因為知道單點的量也是小小的，所以決定不再點，因為在稍微加點一兩樣，價格會上去$500-$600元，這樣的價格我可以選擇別的。

這是一家適合小鳥胃的女生/男生的店。"
 A my ,https://www.google.com/maps/contrib/111678875041558440874/reviews?hl=zh-TW,3,True,29,"1.牛五花套餐最小份$180元，肉份量太少(同樣價位別家12片肉），飯量大中小皆一樣價錢，第一次點餐就要選好。
2.味增湯太淡。
3.肉份量太少，火太小烤太久。
4.只接受現場排隊，要有等很久心理準備
5.可使用台灣pay。"
 王敏芬 ,https://www.google.com/maps/contrib/114296646512265662019/reviews?hl=zh-TW,5,True,92,"每天都大排長龍，注意要人全數到齊才可以入座！
牛五花套餐就非常好吃了
其他牛舌什麼單價較高的套餐覺得普通還可以！"
 哲因林 ,https://www.google.com/maps/contrib/104851617054561821256/reviews?hl=zh-TW,5,True,31,"從來沒有料想到日式燒肉可能有素食的選項，
沒想到焼肉LIKE做到了！
Next牛肉真的非常好吃，全素，
醬料也都是Veagn的，
一定還會再回去吃的！"
 Reinhard Chang ,https://www.google.com/maps/contrib/102435762176421314316/reviews?hl=zh-TW,5,True,13,這間店平時都是人潮滿滿，今天難得假日中午看到居然沒人排隊於是就抓緊機會用餐。餐點是燒肉like三週年活動的復刻3q套餐，價格合理。很適合一人食用燒肉的好地方。
 feng Lee ,https://www.google.com/maps/contrib/111910489342928258534/reviews?hl=zh-TW,3,True,197,肉質普通，貴點的肉cp質不高東西略顯單調（基本肉跟飯）、醬料好吃沒排隊想吃單純烤肉飯可以試試。
 Jin ,https://www.google.com/maps/contrib/107691365031686029671/reviews?hl=zh-TW,4,True,38,"就像燒肉界的麥當勞ㄧ樣
一個人去吃也不會怪
畢竟就是速食店的概念
所以那個肉質也是不用太要求了
菜跟肉都是還是很新鮮的
是突然一個人想吃燒烤時的便利好選項"
 謝宛蓁 ,https://www.google.com/maps/contrib/104631011896088144078/reviews?hl=zh-TW,5,True,420,"疫情關係採梅花座，座位更少，一人現場排隊等了大概一小時多。且因為排隊的地方在京站出入口，外面就是吸菸區，等於是要吸一個多小時的二手菸QQ介意的人可能要三思(但排了還是給它硬等下去嗚嗚我的肺)

第一次體驗一人燒肉我覺得很划算，牛五花松阪豬200g，飯選中的200g，再加沙拉總共$360，飽度剛剛好，很多醬汁放旁邊可以沾，好吃又好玩。松阪豬沾柚子胡椒、牛五花沾味噌或燒肉醬準沒錯。

沙拉是堅果醬沙拉跟想像中不太一樣它是真的有「堅果味」的沙拉醬，總之會有點杏仁茶感有些人可能會不喜歡。

白飯的分數可以有95up，個人覺得如果把它安置在定食中有一些日式漬物或清淡的菜去襯托的話可以表現得更好（？，在這裡因為肉汁和油味有點被蓋過，不過是好吃的。"
 원디Wendy Chen ,https://www.google.com/maps/contrib/100214238011065888284/reviews?hl=zh-TW,4,True,362,"肉好吃
白飯不多不能續加
沙拉份量不多
橫膈膜跟牛舌很嫩！
烤盤需要自行跟店員說才會過來更換
醬汁選擇多還不錯
晚餐最後加點時間為20:30"
 Momo ,https://www.google.com/maps/contrib/116408956715932625688/reviews?hl=zh-TW,4,True,178,"單人燒肉粉喜翻(///▽///)對於小鳥胃的我來說4天堂
下圖為男友吃的300g牛五花肉質不算上等但OK🥓
推薦的地方是有六種調味料！！鹽岩+味增愛不釋手🧡
無接觸掃描QRcode科技點餐實在方便📱
餐點皆付有白飯、味噌湯、泡菜(不能續)
唯一的缺點是抽屜沒有筷子、衛生紙、濕紙巾。"
 PW H ,https://www.google.com/maps/contrib/113594069701605081281/reviews?hl=zh-TW,4,True,48,"小資的燒肉選擇
可以依照自己的食量調整白飯或是肉品
燒肉的醬汁都蠻有特色的
點了一個夏季限定的蜜桃醬汁味道蠻清爽的
有點小驚艷
.
當天遇到pos機故障不過店員的服務態度都很好
除了是當天最後一組客人之外還意外獲得店長招待"
 黃多多 ,https://www.google.com/maps/contrib/116528214891278541709/reviews?hl=zh-TW,3,True,79,"我很常跟朋友來
東西偏貴還不錯吃醬料種類蠻多的
可惜他們的塑膠杯油油的（3次來都有這問題）
肉的顏色同一款有色差？（黑人？）"
 Sky chun Huang ,https://www.google.com/maps/contrib/117947500461525726329/reviews?hl=zh-TW,4,True,151,"個人的燒烤店，簡單方便就能吃到燒肉❤️
要在門口排隊，只是告示牌不夠明確！"
 黃丞銨（Sean） ,https://www.google.com/maps/contrib/113740040975989968615/reviews?hl=zh-TW,5,False,30,很簡單的套餐，一個小火爐烤肉，火不大要稍微烤一下子，和隔膜和白飯很好吃，適合一兩個人快速簡單的用餐。
 DY ,https://www.google.com/maps/contrib/106820337341468690730/reviews?hl=zh-TW,4,True,171,一個人一個烤爐很方便，套餐份量對男生來說很不夠，烤豬肉的油脂會一直起火，整體餐點口味還可以。
 鄭英英 ,https://www.google.com/maps/contrib/105763314927893318626/reviews?hl=zh-TW,4,False,160,"差不多11:50到，不是假日，所以不用排隊。餐廳乾淨，出餐很快，收盤清潔很快，另外服務員還會問是否來過，沒來過的，會解釋用餐方式。
菜單有多種套餐組合（基本組合-飯/肉盤/味增湯/泡菜）或單點食材，雖然不是吃到飽，但肉質算很不錯。缺點就是泡菜給的太少了。
今天點400克的套餐組合，比較合算，可以一次吃到2牛1豬1雞，
飯有：150/200/350克選擇，
調味料有：柚子胡椒/鹽醬/蒜香沾肉醬/味增醬/蒜泥/玫瑰鹽，
建議，點200克白飯，一般人這樣是吃得飽的，大胃王客倌可能就要點350克白飯和加點其他肉類喔！若要「包肉的生菜」是要另購。
帶位前，會給一張QRcode點菜單，只要手機掃描就能點餐，若吃不夠，就繼續掃描加購食材。"
 アストレ ,https://www.google.com/maps/contrib/108198577034888056961/reviews?hl=zh-TW,4,True,51,"點餐用線上點餐的方式，桌面上有很多醬料種類可供挑選，白飯與肉品都不錯，尤其是搭配蒜香沾肉醬的肉特別下飯，味增湯的味道有些許淡，也沒什麼料所以不太優。
店內燈光明亮，位子空間適當，要來最好早一點來，外面真的大排長龍。"
