user_name,user_profile_url,rating,local_guide,comment_num,comment_text
 Elaine Dai ,https://www.google.com/maps/contrib/111592022056469563475/reviews?hl=zh-TW,3,True,91,醬料選擇多可嘗試不同口味，單人設計蠻特別，用餐節奏快速，白飯和湯都需要加價才能續，吃完會有點空虛。如果有點嘴饞又不用等太久，是可試試看看此店。
 Bo CHen柏斯 ,https://www.google.com/maps/contrib/110284102417743129161/reviews?hl=zh-TW,3,True,173,"這次點餐內容牛五花300g+350白飯+角hi
1.調酒[角Hi]很淡
2.飯其實有點米心沒熟(等上菜已經等超久)
3.肉片太薄，這種厚度是火鍋肉片，不是燒肉片
4.泡菜完全沒味道，不酸不鹹不辣

結論：如果真的很想要吃燒肉又只有一個人的時候可以來吃，但不是一間可以追求美味的餐廳"
 A-Kwon Fang ,https://www.google.com/maps/contrib/103714456755345789855/reviews?hl=zh-TW,3,True,"2,971","北車京站時尚廣場的華陰街開口入口上，就屬這家的排隊人潮是最為鮮明的、甚至一行排不夠還要折回來兩三折的隊伍，而最不幸的話，排上個一個多小時才能入座的情況都有；店內說真的空間也算蠻寬裕的，但也是因為位子沒有插滿所有空間的緣故使然，不然排隊的情況是可以緩解些。
要價390元的牛五花&橫膈膜套餐200g可以給足夠量飽的飯，不過配菜給個一小碟泡菜就實在有些陽春；肉選的算是不錯的品質不過作為單人燒肉為噱頭的情況下也就是那樣的口感。"
 Chanel P. ,https://www.google.com/maps/contrib/115346361931165110749/reviews?hl=zh-TW,4,True,210,"#肉食性動物
可以直接點300g
にんにくごマダし推薦
不用怕一個人吃燒肉但還是要一個人排隊😆
後面的座位比較熱⋯"
 蘇皮皮 ,https://www.google.com/maps/contrib/114260386878890365746/reviews?hl=zh-TW,4,True,176,很特別的個人自助燒肉，肉質普通，飯量小中大都是均一價(看現場每個人都選大)，配菜只有泡菜跟味噌湯，單純吃肉配飯，(可另外點配菜沙拉、蛋)
 紀嘉淯 ,https://www.google.com/maps/contrib/103010987590483124915/reviews?hl=zh-TW,5,True,664,週六下午3:25到只等了十分鐘！好吃～份量吃的很舒服，松阪豬很好吃，多種醬也很好吃，用手機掃QRcode點餐很有趣，但餐具有點不太乾淨，烤夾還沒用就擦了一層黑起來，醬瓶也都黏黏的
 岸間晴乃 ,https://www.google.com/maps/contrib/106797494458321470247/reviews?hl=zh-TW,4,False,63,一個人吃燒肉的好去處，可選單點或套餐，惟需現場排隊。
 YEN ,https://www.google.com/maps/contrib/115479813343989240596/reviews?hl=zh-TW,5,True,132,"1090621來店用餐
平價美味的燒肉店
份量選擇很多可以依照自己的食量選擇客數
餐點精緻白飯很好吃加大碗不用加錢"
 蕭宇俊 ,https://www.google.com/maps/contrib/109485567890846059246/reviews?hl=zh-TW,5,True,168,肉質份量很剛好，cp值很高比吃到飽店品質好很多，可惜排隊等待時間算久，如要來吃要有心理準備排1小時，還有可惜的醬料瓶都油油膩膩的因該每次換客人前最好都擦拭一下
 Mimi ,https://www.google.com/maps/contrib/105802050589243518472/reviews?hl=zh-TW,4,True,42,"男友說高雄的要排很久所以來台北吃就好
一開始吃還不錯，但吃一陣子之後發現我的肉根本沒少⋯(◐‿◑)﻿？
我以為我吃到聚寶盆
總之就是點200g的份量就還蠻多ㄉ
食量小的姐妹不要輕易嘗試
但這是正面的評論所以四星🤩🤩🤩🤩"
 張育榕 ,https://www.google.com/maps/contrib/116045461585059077221/reviews?hl=zh-TW,4,True,53,"肉品質很好👍完全不會有肉腥味
但吃牛喜歡吃牛肉味的人就失望了🤣
飯也是好吃的飯，粒粒分明且Q彈😲
基本上一份的分量吃起來剛剛好
是會讓人想要再去吃的
然後貌似熱潮還沒過……排隊真的要有耐心ORZ(排了快2H...
吃小資、吃品質的，如果想要單點“吃到飽”荷包君會哭的🤣🤣🤣"
 彭芋泥 ,https://www.google.com/maps/contrib/110895440576152032335/reviews?hl=zh-TW,2,False,26,"點了一份餐一開始白飯選200g因為怕吃不完浪費
後來不夠吃想問店員能否再加飯加到原本最大的飯量350g
店員表示不能需要的話都要再做加點
真的不懂為什麼
我點了一份餐你就有提供完整的量的義務
所以先點150或200的人飯吃不飽是活該嗎
阿對了白飯一碗要40怎麼不去搶==
而且怎麼沒有客訴管道真的好想客訴錢這麼好賺的嗎"
 Woo (θ‿θ) ,https://www.google.com/maps/contrib/104317467356857708123/reviews?hl=zh-TW,4,True,228,非常適合單人享用，吃飽喝足後會很滿足
 Skuo Kuo ,https://www.google.com/maps/contrib/113340462906678930759/reviews?hl=zh-TW,3,True,220,素食餐點只有一項，乏善可陳，不建議專門去吃
 謝宛真 ,https://www.google.com/maps/contrib/116434191822542203631/reviews?hl=zh-TW,1,False,9,"第三次回訪，記得前兩次的肉都蠻好吃的。
今天與友人點了兩份牛五花，一盤的肉每片有1/2是肥肉，油滴到過程一直像發爐一樣，要不斷拿起來等火滅掉，另一盤大概1/5是肥肉（正常好吃的）。
與店員反映可否換一點瘦一點的肉，店員回覆：你去外面買牛五花也是這樣（可是外面買我可以挑欸⋯），除非肉有問題不然不換！
肉品的品質不一，300g的肉（150g是肥的）後面只剩下滿滿的油膩感，沒有服務費也不用期待他的服務態度，這次蠻失望的，不會再回訪了。"
 mm mm ,https://www.google.com/maps/contrib/118306539510870540633/reviews?hl=zh-TW,4,True,59,"來自日本東京超夯的一人燒肉「焼肉ライク（燒肉LIKE）」主打一個人也能輕鬆吃燒肉自選部位、量、醬料，皆可自由選擇。獨特個人風格的燒肉還有迷你無煙烤爐！
入座時每人桌上都附有一張QRCODE紙條，只要用手機掃一下就能線上點餐，套餐還有分為100g、200g、300g不同份量!
新春期間有:
ALLSTAR套餐10種超人氣品項
日本和牛、牛舌、特選牛五花、橫膈膜
售價490元(cp值不高)
雖然一次能嘗到10種品項，但單品分量很少，不推!

推薦牛五花套餐300g-售價340元--cp值最高
建議白飯份量可以加大不加價!

座位旁邊附有搭配的6種醬料：
玫瑰鹽、蒜泥、鹽醬、柚子胡椒醬、蒜香沾肉醬、味增醬，可以換著吃!喜歡重口味的朋友個人推薦(蒜香沾肉醬+蒜泥)2種沾醬混合在一起很好吃唷～"
 張tiffany ,https://www.google.com/maps/contrib/113746674672406939923/reviews?hl=zh-TW,5,True,31,"小巧精緻，醬料選擇也很多
對於小食量又選擇障礙的人真的是很棒的選擇🤣
可以來試試看呦"
 陳佳樺 ,https://www.google.com/maps/contrib/100895005090728837728/reviews?hl=zh-TW,4,True,10,"雞豬三品套餐300g+白飯350g$370
加購綜合堅果迷你沙拉$30

對一個胃口普通偏大的女生來說是會飽
不過感受上會有點像是吃飯吃飽的

如若是想在城市中一個人吃烤肉
且願意自己烤肉的話是蠻友善的

但若以CP值來說
尖峰時間要排隊（約20-40分）
想吃好多好多的肉而非米飯
（不過現在有選項可以換沙拉）

總之吃下來會覺得久久吃一次就足夠
給四星主要在
🌟CP值覺得可以更優化
因為服務態度還算不錯！
所以值得給四星～

補充：
不過印象中上次來吃時，
松阪豬是比較好入口的，
這次烘烤時間長短肉質都仍然不受影響不好咬斷，
不曉得有沒有其他人有遇到這個問題🤷‍♀️"
 大毛 ,https://www.google.com/maps/contrib/112144832465495317907/reviews?hl=zh-TW,4,True,293,"很喜歡
一個人也能開心的吃燒肉
醬的部分都很好吃
特別推鹽醬跟蒜泥燒肉醬
唯一缺點
五花肉真的很油
噴的到處都是
放在飯碗裡
吃到最後底層都是油"
 Dabby Liao ,https://www.google.com/maps/contrib/108213541534373761414/reviews?hl=zh-TW,5,True,62,服務人員接待很細心貼心，肉品口感、味道佳，乾淨衛生，網路點餐，上菜快速。
 嵐洛斯 ,https://www.google.com/maps/contrib/100067062819402583915/reviews?hl=zh-TW,4,False,156,整體上肉還不錯，但是缺點在於火太小爐子也太小…兩個人公用一個根本不夠吃…
 Xuan Lin ,https://www.google.com/maps/contrib/105798782750305600575/reviews?hl=zh-TW,1,True,58,"【請你們自己好好檢討】
用餐過程找不到服務生！！
點餐頁面也沒有服務鈴...第一次遇過這種連鎖店
我坐後面的位置，店員忙著備料可以理解，但是後面完全沒人顧客人，客人有需求還要跑到前面櫃台講。這樣就算了，講了過10分鐘後還沒來，再跑去前面講一次，才把碗送過來。
態度、管理規劃都有問題，服務=0、很差勁"
 Pat H ,https://www.google.com/maps/contrib/103245016430205464506/reviews?hl=zh-TW,5,True,77,"地點方便，排隊動線也算簡單好懂
餐點內容雖然不算非常多元但對單獨用餐的客人已經算足夠👍🏻
加購的沙拉份量跟醬料口味普通，來這裡單純吃肉就可以了"
 Jack Kuo ,https://www.google.com/maps/contrib/101528616623912169831/reviews?hl=zh-TW,3,True,"1,150","需要排隊，份量不多。
更換烤網速度快。
服務親切。"
 湘 ,https://www.google.com/maps/contrib/113120077725039212815/reviews?hl=zh-TW,4,True,108,"📍燒肉like@京站店

牛五花300g+白飯200g💲320

牛油花蠻美的，我是烤久一點讓肉比較不油膩，醬料選擇很多，我是「蒜香沾肉醬」偏甜一點。

很單純的大口吃肉，
一個人兩個人都很適合去～
會有燒肉味，畢竟是燒肉店😂

凱若下班後🐼@carol_offduty_"
 生活紀錄 ,https://www.google.com/maps/contrib/101349966427864395572/reviews?hl=zh-TW,3,True,99,"服務很好
排隊速度也很快
沒有等很久

肉...沒有我想像的好吃
烤盤略小2個人使用...有點不方便

咖哩不錯吃
味噌湯有酸味...
有點喝不習慣
不知道是不是這味噌本身味道偏酸...
第一次喝有酸味的喝的有點問號❓"
 Hui-Ying Yu (Nicole) ,https://www.google.com/maps/contrib/103599660404812243198/reviews?hl=zh-TW,4,True,98,"N訪～想吃燒肉就會來吃。只是小菜和味增湯的水準下降了，有點可惜😣。主餐的部分還是有維持
2021/10/25這次不吃飯可以換成沙拉，很適合不吃澱粉的我👍🏻"
 Jane Chen ,https://www.google.com/maps/contrib/107732972750263994278/reviews?hl=zh-TW,3,True,91,"我覺得太貴了，倒不如吃好一點的吃到飽餐廳
想吃飽真的CP太低，肉是不錯吃
如果不太餓吃這家是一個選擇，但價格需三思"
 陳小詩 ,https://www.google.com/maps/contrib/110834683090299049416/reviews?hl=zh-TW,4,True,147,"燒肉LIKE(京站店)2訪
主打一個人也可以來享用燒肉美食
我點了人氣商品牛五花套餐300g
小鳥胃姐妹點了牛五花套餐200g
套餐均附白飯、味噌湯及韓式泡菜
一人一爐想吃什麼樣的熟度自己來
牛五花肉質軟嫩好吃而且很下飯👍
單點的牛舌彈牙沾玫瑰鹽就很鮮甜
一個人大口吃肉也很開心呀😍😍
還能滿足偶而想吃燒肉的口慾呢😂"
 Dylan Wu ,https://www.google.com/maps/contrib/107223001229778792077/reviews?hl=zh-TW,4,False,29,適合一人吃飯或者沒朋友的人造訪，復刻3Q套餐(300g)份量還OK，上餐速度快、醬料選擇多元，但是加點的生菜份量很少，還帶有苦味，希望多附湯匙及空盤裝烤熟的肉。
 陳柔伊 ,https://www.google.com/maps/contrib/116479425843194469671/reviews?hl=zh-TW,5,True,349,"用餐時間絕對大排長龍，建議離峰期再來嚐鮮～套餐分為100g,200g,300g的肉量，內建白飯、泡菜、味增湯，女生其實200g就非常夠了，說超級好吃也稱不上，但一個人想簡單吃個燒肉是個不錯的選擇（但要排超過十分鐘就可以算了🤣🤣🤣"
 廖昌晧 ,https://www.google.com/maps/contrib/103384203396525260530/reviews?hl=zh-TW,5,True,117,單人燒肉就是爽，價格蠻平價，200-400一份，但對於男性來說可能吃不太夠
 Sunny baby Mommy boy ,https://www.google.com/maps/contrib/115091665751520237865/reviews?hl=zh-TW,5,True,541,覺得很棒！cp很高。肉質也很好。平價但不失品質。座位也蠻大不會不舒服。
 Judy Weng ,https://www.google.com/maps/contrib/111942709808963355156/reviews?hl=zh-TW,5,True,61,"季節限定的蜂蜜口味五花肉+松阪豬超好吃😍
是台南人會喜歡的味道❤️
會為了這個味道再次造訪！
一個人平日午餐去不用排隊，
突然想吃燒肉也不用擔心揪不到人～"
 Renee Chen ,https://www.google.com/maps/contrib/111604783789186263376/reviews?hl=zh-TW,2,True,26,"豬五花+雞腿肉套餐200g$230
含豬五花100g、雞腿肉100g、白飯、泡菜、湯韓式海苔另單點$40
服務態度非常不佳，桌邊詢問服務員問題，服務員安靜不回應；請服務員協助加水，態度不是很情願；結帳時詢問服務員怎麼和送餐的單據金額不同時，櫃檯人員回應的方式也很不耐。
感覺是日式料理的店家，但整體服務很不日式，而且服務員感覺很躁，用餐感受不是很理想。"
 sansan Kuo ,https://www.google.com/maps/contrib/103449165218862940314/reviews?hl=zh-TW,4,True,33,"沒吃過牛橫隔膜，第一次吃但是真的很不好吃，沒味道呀😭😭而且橫隔膜超級貴...

反而點牛五花非常美味～配著泡菜和白飯一起入口真的很幸福！雖然京站店永遠是滿滿的排隊人潮，我們快9點到還是要排隊餒！而且真的有挺多一人來吃燒肉的，如果真的很想吃燒肉又懶得揪人喬時間，可以選這家過過癮"
 Jo Chang ,https://www.google.com/maps/contrib/117316757605476837349/reviews?hl=zh-TW,5,True,908,有社恐的人很適合喔！！！
 Tony liu ,https://www.google.com/maps/contrib/101137694369410766413/reviews?hl=zh-TW,5,True,246,優質肉品，醬料選擇多
 黃翊嘉 ,https://www.google.com/maps/contrib/113648204741170226169/reviews?hl=zh-TW,3,True,139,"是個吃粗飽的燒肉餐廳，
以不貴的價錢就能吃到多樣化的肉品，
如果可以排隊不要太久，其實性價比值得四顆星"
 Christina Hsieh ,https://www.google.com/maps/contrib/102544760575364520498/reviews?hl=zh-TW,4,True,113,"服務蠻好的，
餐點也還不錯，
只是人很多要等一下子。

用手機掃描QRCODE自行點餐，
非常方便，可以節省等候服務人員的時間。

如果不是很餓點200克還算夠，
它們白飯給蠻多的，
牛五花不錯吃，
如果點300克的會比較大片，
只是油花更多網子容易著火；
松阪豬相較牛五花厚一點點，
要稍微注意火候，
火若太大或烤太久肉質會過硬，
若是控制到剛好，
肉質軟嫩挺不錯的。

不過可能是要友人的牛五花油太多，
我們這邊的網子一直起火，
都會燒到松阪豬肉，
以至於肉質都有點硬。

個人燒肉用餐時間不用太長，
若是喜歡同時吃更多種肉類，
或是想要吃到飽什麼都有的類型，
可能就沒這麼適合。"
 YvonneLiang RUNI in Taiwan ,https://www.google.com/maps/contrib/101496233407044698347/reviews?hl=zh-TW,5,True,181,"2022/4/29初嚐一人燒肉套餐(牛五花+橫隔膜200g$430)

大愛肉質&泡菜&醬料
但不適合大胃王"
 Tyler Chen ,https://www.google.com/maps/contrib/110742930196592467978/reviews?hl=zh-TW,4,True,92,只想簡單吃點燒烤，不錯的感受。肉質佳，點多少，烤多少，精緻。
 Alex Hsu ,https://www.google.com/maps/contrib/109484247971225063662/reviews?hl=zh-TW,4,True,84,一個人的時候，很想來點燒肉的話，是個還不錯的選擇。但肉質就是較一般，符合他的單價。
 Vagus Huang ,https://www.google.com/maps/contrib/112430169049293957097/reviews?hl=zh-TW,5,True,343,還不錯單人想吃燒肉的好選擇
 毓宣 ,https://www.google.com/maps/contrib/114021145935919851331/reviews?hl=zh-TW,4,True,179,"點餐的時候是用自己手機掃碼點餐很方便～
我點的是豬五花&雞腿肉200g套餐
有白飯還有小菜、味增湯
湯喝起來蠻日本的、白飯燙燙的很好吃
都是自己烤～所以就很考驗技術了🤣"
 日新陳 ,https://www.google.com/maps/contrib/115173404116164044942/reviews?hl=zh-TW,4,True,72,肉不錯吃可惜有點偏油沾醬很好吃飯可以選分量正常男生吃大碗應該蠻夠的
 Anne Chiu ,https://www.google.com/maps/contrib/115930449275208935925/reviews?hl=zh-TW,4,True,436,可單人享用的燒肉套餐很適合一個人在台北轉運站中停的時候品嚐，肉質不錯搭配上白飯讓人很飽足
 Shanti Lin ,https://www.google.com/maps/contrib/105094979705895943728/reviews?hl=zh-TW,4,True,320,"今天是第二次到京站燒肉LIKE用餐，比起第一次是開幕時來，需要排隊兩個小時，今天排了快一小時，也算是某種快的了ＸＤ
點餐不同於一般餐廳，是需要使用手機掃QRCode進行點餐，並且每個人點選自己的餐送出，我覺得對於3C產品不太熟悉的長輩，可能比較沒有那麼友善。（我的老媽就不太會操作ＸＤ）
至於餐點裡，最喜歡的肉品是帶有一點Ｑ勁牛舌和松阪豬，五花肉也蠻好吃👍🏻👍🏻個人不喜歡橫隔膜吃起來的口感，然後白飯是可以自行選擇想吃的size，一個加量不加價的概念唷！"
 邱奇奇 ,https://www.google.com/maps/contrib/116350016483018020659/reviews?hl=zh-TW,5,True,12,"肉質好
小份50g(豬五花5片)
一個人也可以開心吃燒肉😘
可惜沒有全豬肉套餐
只好單點兩項豬肉"
 pp liu ,https://www.google.com/maps/contrib/116662644135143138612/reviews?hl=zh-TW,2,True,43,"一次店，不會再回來。以店家繁忙的程度來說服務態度算是很好了。

沾醬選擇豐富，不過我吃牛肉習慣原味所以醬料的部份無法給分。

環境整潔有待加強，乍看之下好像很乾淨，但實際上，烤爐邊的油都沒擦乾淨就安排我們入座了，烤肉夾也是有焦黑的殘留物附著在內並未清洗乾淨。

我單點了50g肩胛肉+50g橫隔膜，肉上來是醃漬過的，個人覺得有點偏甜。

如果你對肉的要求嚴格的話，我覺得可以不用嘗試。"
 柯易明 ,https://www.google.com/maps/contrib/106474096204727819422/reviews?hl=zh-TW,4,True,33,"很酷的燒肉店,點餐方式掃ＱＲＣＯＤＥ價位不算太高,一個人吃算是剛剛好,白飯部分可以選擇大中小碗,記得點大碗的,怕吃肉不飽,飯淋上桌上的燒肉醬也很好吃"
 王Ruby ,https://www.google.com/maps/contrib/108171554171489761399/reviews?hl=zh-TW,4,True,39,價格平價，肉質也不錯，很適合想吃燒肉又不想吃吃到飽的人，而且有多種醬料選擇，排隊的人雖然很多，但是也很快就輪到我們，有機會會再考慮來
 孔亭之 ,https://www.google.com/maps/contrib/103498387305529517504/reviews?hl=zh-TW,5,True,124,"蒜香沾肉醬最好吃
還有咖哩💕"
 Rophy ,https://www.google.com/maps/contrib/114664729190843553185/reviews?hl=zh-TW,5,True,87,一人也能來的燒肉店，有套餐和單點非吃到飽制，肉品還不錯，而且沒什麼煙不會留下氣味在衣服上
 Kenny Hu ,https://www.google.com/maps/contrib/113103801023943754259/reviews?hl=zh-TW,5,True,88,"特別的經驗！
體驗一下一人燒肉的感覺～
吃蠻飽的～但有點受熱不均～技術不好肉蠻容易烤焦的～
想不焦只能慢慢烤～然後很餓這樣😂"
 Poching Chiu ,https://www.google.com/maps/contrib/100947961913609046891/reviews?hl=zh-TW,5,True,771,個人版的燒肉店，好吃，方便，價格可以接受
 Chia Chia Hu ,https://www.google.com/maps/contrib/103098224448902828196/reviews?hl=zh-TW,2,True,82,"普普通通，但確實可以解一下下對燒肉的饞。
一人下班來吃一下是可以的。
肉質算可以，就價格上來說。泡菜今天吃起來口感沒入味的感覺，點的是300g牛五花&400g的牛肉類（有雞肉）"
 黃sam ,https://www.google.com/maps/contrib/106478121474764064502/reviews?hl=zh-TW,3,True,128,"平日下午等15分鐘，入場後點這樣是$320元（300克），牛五花套餐
肉量算滿多的，但肉質真的非常非常一般...
當然這價位不能苛求肉質要多好，
大概就是適合突然想吃燒烤，但不想花太多錢，也不在乎肉品質的人
有六種不同醬料可以搭配，就是靠醬料撐場的店...
嚐鮮可以，但應該不會再二訪了..."
 Miranda Huang ,https://www.google.com/maps/contrib/113209555179943125160/reviews?hl=zh-TW,4,True,119,還不錯吃，價位微高，第一次吃燒肉後身上沒味道的，好神奇！
 許嘉凌 ,https://www.google.com/maps/contrib/107406682377879683915/reviews?hl=zh-TW,3,True,108,"點餐方式很特別，送餐速度很快速。
白飯很好吃，建議以中份開始選擇。
烤爐不大，如果是雙人共用一個爐很容易打架，而且一次不能烤多，如果是雞肉這樣的食材要烤非常久，會一直等待，是比較美中不足的地方。"
 Yuti Cheng ,https://www.google.com/maps/contrib/100877827467686387219/reviews?hl=zh-TW,2,True,256,"之前在日本吃過就覺得肉質普通
現在回到台灣陪朋友去吃
覺得吃起來就.....更......嗯........
然後不知的為什麼排隊排很長.....
至少排了一小時吧.....
真的很普通.....而且這個肉質單人套餐200g就大概299起跳，不飽加點下去大概四五百跑不掉....
我自己花了六百多還沒有吃飽的感覺，可是又覺得太油很不舒服.....
然後如果去的一定要沾金桔醬（唯一人生解脫）
唯一清爽的醬.....
總之排隊時間上、份量價格上、品質上、
整體CP質我覺得划不來，這個單人價格在外面一定可以找到更好吃的.....
真心不推"
 Betty ,https://www.google.com/maps/contrib/109646804897284660112/reviews?hl=zh-TW,4,True,254,雖然不是大口吃肉的感覺但還是蠻不錯吃的套餐，可以加點肉品
 羅文璘 ,https://www.google.com/maps/contrib/116579014822263743932/reviews?hl=zh-TW,5,True,19,"很好吃😋
cp值很高
$180就可以吃到好吃的烤肉
建議事先定位不然要等一段時間"
 Wu Evelyn ,https://www.google.com/maps/contrib/111329770409648436821/reviews?hl=zh-TW,5,True,41,肉肉好吃份量多，疫情期間去的，坐位安排梅花座，讓人安心，只是排超級久的
 Heltt ,https://www.google.com/maps/contrib/109498668369298140123/reviews?hl=zh-TW,1,True,79,"相比開幕當月第一次吃的時候，這次的肉品新鮮程度很打折（牛五花套餐）：沒有牛肉香就算了，肉品的油耗味變得很重，明顯放太久，飯也煮得有點過油且過軟，再者，店內明明有座位還是依然要大排長龍，加總起來並沒有獲得燒肉的幸福感，吃到最後還覺得很無奈。

至於套餐旁邊的泡菜從以前吃就不太合胃口，而味噌湯依然好喝！可以和店員要檸檬，加在水裡成為檸檬水的解膩效果不錯。"
 Dylan Chuang ,https://www.google.com/maps/contrib/109415521029596964169/reviews?hl=zh-TW,3,True,92,燒烤時油脂滴至加熱管引起不小的火苗，服務人員卻遞來一個碗告知油脂不要滴到加熱管，要先濾油，整個很傻眼，第一次碰到吃燒烤還要自己濾油
 Jeffery Chen ,https://www.google.com/maps/contrib/115796701198177553389/reviews?hl=zh-TW,1,True,48,禮券張數算錯，櫃檯處理半天，消費金額差點多收$100，結果多了$80停車費，很差勁
 Kay Lin ,https://www.google.com/maps/contrib/115871914936117954728/reviews?hl=zh-TW,5,True,20,一個人也能好好吃燒肉的地方👍
 鄭鵂鶹 ,https://www.google.com/maps/contrib/100484313937275841565/reviews?hl=zh-TW,2,True,329,肉片很薄呀，瞬間以為在吃火鍋
 魚（Yu） ,https://www.google.com/maps/contrib/101255631238144736797/reviews?hl=zh-TW,5,True,13,邊緣人的燒肉，非常適合單身、一個人、沒朋友的人也可以享受烤肉的樂趣，非常願意二訪👍🏻👍🏻
 Yu Kuan Lin ,https://www.google.com/maps/contrib/108269824159328762270/reviews?hl=zh-TW,4,True,16,"環境還不錯，點餐機制方便，非用餐時段可能也需稍微排隊一下！肉的等級尚可，五花有點偏油，推薦給偶爾想解解吃燒肉癮的人。晚餐時段還是建議去一般的燒烤店，cp值會比較高！
ps.對坐的位子中間有隔板，一個人用餐也不會尷尬"
 Ada Liu ,https://www.google.com/maps/contrib/117228316423799692680/reviews?hl=zh-TW,4,True,67,牛肉品質很好，醬料總類眾多，泡菜味增湯普通，平日需排隊半小時。
 Keith Liu ,https://www.google.com/maps/contrib/117043161256412898049/reviews?hl=zh-TW,5,True,170,真的是要排隊等候才能吃到！真的滿期待能快點吃到😂份量滿剛好的！吃起來真的滿棒的！所以等待是值得的！
 武佐オサム ,https://www.google.com/maps/contrib/104175572967304224673/reviews?hl=zh-TW,4,True,68,"總評：
價格不低但品質不差，CP值中上

上菜快，服務也好，松板豬好吃，豬五花普通，牛五花中上，建議7分熟，沾岩鹽就好
味噌湯普通，泡菜不太行，白飯加量不加價
建議100g肉配150g飯比較剛好"
 Bibi Cheng ,https://www.google.com/maps/contrib/105887798381866334986/reviews?hl=zh-TW,4,True,65,"味增湯偏淡，肉質整體算是中等
搭配沾醬有種我在日本的感覺
對於ㄧ個人吃燒肉來說很方便
但吃完總覺得少了什麼
若是有附贈甜點或是茶會更好"
