user_name,user_profile_url,rating,local_guide,comment_num,comment_text
 personal ,https://www.google.com/maps/contrib/111315928247816506377/reviews?hl=zh-TW,4,True,117,"#晴光美食
#韓式料理

天氣變熱就想吃開胃爽口的餐😀
這家紅飯捲在小巨蛋附近時一吃驚為天人😋
後來搬到晴光市場今天是第一次再訪！

現在皆採線上點餐，冬粉已售完真可惜😅點了當初很愛的核桃奶油芝士飯捲，註飯少，裡面有紅白蘿蔔，牛蒡、小黃瓜、蛋皮、盒桃、費城奶油芝，套餐升級選了魚板湯+醃蘿蔔，飯捲有著韓式飯捲才有的麻油香，爽口不膩，搭配開胃醃蘿蔔一下就完食😋魚板湯裡面有幾片蘿蔔，微微胡椒辣？超滿足😀

很可惜的所謂內用（點餐要點外帶），取餐若要現場享用，只有外面一張長桌，面對面可坐8人，還有前面一張小桌可坐二人，疫情未解除前，在沒有隔板的情況下，大部分的人應該不會希望對面或旁邊是不認識的人吧！"
 00愛食記 ,https://www.google.com/maps/contrib/101069712395746259579/reviews?hl=zh-TW,4,True,67,"晴光商圈道地韓式飯捲底佳₍ᐢ⑅•ᴗ•⑅ᐢ₎♡
還好臺灣的美食文化很多元
才能解解對韓國的纏🥹
而且這家的老闆是韓國人唷～
飯捲裡面的餡料爆多一口快要塞不下
分兩口又會讓料仙女散花
推薦敢吃辣的朋朋一定要加辣醬❗️
加了口味升級很多耶😍
核桃奶油的奶油芝士好好吃
覺得這邊飯捲口味都滿特別的！

可以先打電話或是使用line預定
🈯️以免想吃的口味售完唷
-
☁️酸白菜鮪魚飯捲$130
☁️特醬牛肉飯捲$150
☀️核桃奶油芝士飯捲$140
☀️紅辣醬+$10
-
instagram🔍00.loveeat"
 KALI ,https://www.google.com/maps/contrib/116091317751698484818/reviews?hl=zh-TW,4,True,86,"用UberEats點了外送，餐點包裝乾淨完整。

飯捲料多實在，味道也很不錯！
份量適中，不會吃不飽但吃完也不會撐肚皮，
而且可以客製不要的食材（我恨紅蘿蔔）超加分！

雖然加辣醬要10元，但是非常推薦喜歡吃辣的人加購，飯捲沾上辣醬味道會更上一層樓，而且辣度也很夠！非常喜歡。

魚板湯偏普，但喝起來舒舒服服，還可以。
但是小菜辣蘿蔔就不太ok，有幾塊完全沒有入味，咬開裡面是白的。"
 Mars Lu ,https://www.google.com/maps/contrib/114322431680386793824/reviews?hl=zh-TW,3,True,69,"第一次韓國飯捲
點了辣魚板口味加上套餐（蘿蔔+飲料）
覺得蠻普通的感覺
有些評論上寫著海苔有麻油香
但我倒是吃不出來耶
不知道是不是我自己的問題
水梨汁感覺也蠻普通的
但是有果粒是蠻特別的
餐點裡唯一覺得驚艷的是辣蘿蔔
真的是蠻不錯的
酸甜辣的口味
有著很棒的平衡感
不會有任一方太過突出"
 張小玉 ,https://www.google.com/maps/contrib/110271578630039736275/reviews?hl=zh-TW,5,True,907,現點現做新鮮無誤～可用官網Line先點餐、付費，再選擇「自取」或外送。因爲新鮮所以「堅果」脆口、每捲的黃瓜也相當脆甜。韓式冬粉帶辣味、麻油香，夠味好滋味。值得一試的店家。服務親切和善推推推～～
 th kuo ,https://www.google.com/maps/contrib/110154011648567487375/reviews?hl=zh-TW,5,True,320,"辣炒魚板飯捲$140
飯捲內餡很多大概中辣
芝麻油的香氣也很足
韓式拌冬粉$35
也是很香很好吃"
 金毛小蘋果 ,https://www.google.com/maps/contrib/108518863939314649331/reviews?hl=zh-TW,5,True,65,"非常的韓，
我想說是記憶中韓國的味道，
但不是啊！
韓國哪吃得到包這麼多料的Kimbap，
已經超越當地。

不過點餐有點麻煩，還要加line，
現場有點混亂，
不過看到廚師們都是韓國朋友，
可能韓國比較習慣這樣的點餐付費模式吧！
噢！魚板湯也好好喝，
只是那個海帶有點微微不搭。"
 Crystal Chi. ,https://www.google.com/maps/contrib/113699814435372331850/reviews?hl=zh-TW,2,False,26,"飯捲份量很多也不錯吃，但整體下來沒辦法給高評價
-
點餐的部分，人已經到現場站在櫃檯，被女店員指著QRcode告知只能加line點餐就直接離開了，旁邊男店員態度很好先詢問餐點內容說先幫我做，我再補單進去給他們。
如果只是加個line也還好，但加Line後在送單前要填寫一系列完整個資，包括姓名、手機號碼、生日、email等等，對於一個第一次來只是想嚐鮮的客人來說著實很不方便，也不想填寫這麼多個資。
-
餐點的部分，飯捲是好吃的，但是小菜韓式拌冬粉下午一點多就賣完了，有點誇張。
另外我們還點了2份小菜「醃魷魚+魚板」，只吃到魚板而已，兩份裡面都連一塊魷魚也沒有，份量和價格也不成正比。
魚板湯好喝，但是勾選需要餐具卻沒有附湯匙，希望店家以後可以提供。
-
基於公司附近沒有其他比較好吃的韓式飯捲，想吃的話還是會過來光顧，但整體消費體驗並不是太好，不會推薦身邊的朋友來消費。"
 Iku Lin ,https://www.google.com/maps/contrib/114638331426331539728/reviews?hl=zh-TW,4,True,18,"終於吃到心心念念的韓國김밥
坐火車前就先用line線上點餐
所以到了就直接拿餐點
也很幸運外面有位置可坐著吃🥰
友人點了辣炒魚板飯捲
我點了醃辣椒鮪魚飯捲
不得不說醃辣椒真的很夠味
是辣的有後勁，超愛❤️
如果참기름（芝麻油）味道可以再強一些就更完美了🙂"
 郭芷維 ,https://www.google.com/maps/contrib/106655048521665772806/reviews?hl=zh-TW,4,True,186,飯捲口味選擇很多、製作過程看得到、非常衛生安心，飯捲口味也清爽好吃，不過一盒$130-$180，覺得價格有點高、份量偏小，嚐鮮還能接受！
 Yi-Shing C. ,https://www.google.com/maps/contrib/105365227237647060217/reviews?hl=zh-TW,5,True,192,"忠武飯捲
早期飯捲內包入配菜怕飯捲保存不久，所以就出現只包飯的飯捲再另外搭配容易保存的小菜，忠武飯捲就這樣產生了！

海苔飯捲+蘿蔔泡菜+辣魚板=簡單的異國中餐"
 evon fola ,https://www.google.com/maps/contrib/101339270002699355176/reviews?hl=zh-TW,5,False,8,"我們點了五色菜拌飯
牛肉飯捲，忠武飯捲，豆泡飯捲
真的好吃。飯也不會硬硬的
大人小孩接受度高
牛肉飯捲家裡銷路不好
其他都吃光光了😋😋😋"
 陳煜翔 ,https://www.google.com/maps/contrib/110558901715149829366/reviews?hl=zh-TW,3,True,47,"這次買的是牛肉飯捲（大概等5-10分鐘
裡面如果用看到的大部分以蛋的比例占比最重
外面的芝麻油還是吃得出來但沒有很香就是
蛋皮單吃還是有香滿好吃的很用心
但是如果是以一整個飯捲吃下去來說
蛋皮的存在感可能被肉和蘿蔔和黃瓜壓過
以吃下去的口感評斷的話
會先吃到小黃瓜的脆感且有水
之後才是醃蘿蔔但蘿蔔沒有很酸
如果不是嗜酸者就會覺得應該是提味層次用的
最後是牛肉本身的肉感
胡蘿蔔基本上就不大感覺到
整體來說是個吃下去舒服不會口味很重的飯捲
不過蛋皮沒有出來還是偏可惜
但是外帶的擺設一樣好看整齊
如果在晴光附近可以去吃或嚐鮮
但可能不會為了他特地跑來晴光
晴光附近印象中韓式的店也沒有很多
所以也算是晴光韓式的其中一個選擇！"
 哆啦B夢 ,https://www.google.com/maps/contrib/110050334064681151112/reviews?hl=zh-TW,5,True,58,真韓國🇰🇷飯卷！現做新鮮好吃，內部的包料很充實，飯跟海苔的味道都搭配的剛剛好，重點是小菜道地韓國口味超好吃😋，最後還🈶️那一碗熱湯真是暖胃啊！
 Wuliii ,https://www.google.com/maps/contrib/108338842093532157763/reviews?hl=zh-TW,3,True,66,"飯捲口味有不少選擇
點了特別的酸白菜鮪魚酸白菜味道比較明顯
但是是好吃的～不會違和
店面小小的幾乎都是外帶外送為主
下班之後去買人滿多的要等20分鐘以上"
 _122 Sss ,https://www.google.com/maps/contrib/114580248814331540054/reviews?hl=zh-TW,5,False,5,第一次點這家店的外送，價格一般，但味道賣相不錯👍，雖然紅辣醬要加10塊，不過很香很好吃，魚板湯比其他店來說相對清淡無負擔，整體來說很好，有機會會再回購
 吳小綠 ,https://www.google.com/maps/contrib/114407847826892306653/reviews?hl=zh-TW,4,True,58,"魚板飯捲好吃
香油味可以再重一點會更好吃
辣魚板很辣很夠味"
 Cherie Yang ,https://www.google.com/maps/contrib/111811607144600567041/reviews?hl=zh-TW,2,False,31,看到菜單照片以為是韓劇裡那種長魚板，想嚐鮮吃看看，結果出餐是超小塊三角型，問了店家說是一樣的魚板，但跟餐點照片不一樣就不是我想點的呀，湯喝起來超空虛，就是超重胡椒湯。
 Macaria Tseng ,https://www.google.com/maps/contrib/103143423989918841190/reviews?hl=zh-TW,5,True,76,"有天叫了ubereats才知道這家好好吃🤤
辣蘿蔔好讚喔，配著飯捲一口咬下超開胃😍而且除了主角以外的配角蛋絲和紅蘿蔔絲都調味很剛好又有濕潤感，比日式壽司還要讚👌🏻外層的海苔塗上麻油➕芝麻真的是超加分的！週日因為公休的關係我點了別家才知道原來海苔飯捲很容易踩雷..後來台北的gimbap信仰就是這家了🥺♥️"
 Seng Kei ,https://www.google.com/maps/contrib/109270278894502592430/reviews?hl=zh-TW,2,False,1,"牛肉飯捲的牛肉蠻硬的吃起來像牛肉乾，
沒有麻油香，飯偏硬吃起也很乾。
$150一份CP值不高"
 鄭憶萱 ,https://www.google.com/maps/contrib/110911966069441667745/reviews?hl=zh-TW,4,False,12,"很漂亮的韓式飯捲麻油味很香
這次點了特醬牛肉跟醃辣椒鮪魚
醃辣椒真的有在辣眼淚直接飆出來"
 佩凌 ,https://www.google.com/maps/contrib/111102536901745939826/reviews?hl=zh-TW,3,False,24,"跟我熟悉的忠武飯捲有點不一樣，飯捲配的辣魚板加少少魷魚有點不習慣，不過蘿蔔泡菜很好吃！
可能有名的是一般的飯捲吧，下次再嘗試看看！"
 E E ,https://www.google.com/maps/contrib/110784391326081391113/reviews?hl=zh-TW,5,True,17,"點了「黑椒厚切火腿飯捲」
$130
裡面料超滿的
有紅蘿蔔、白蘿蔔、牛蒡、
小黃瓜、蛋皮、特製黑椒火腿

調味的部分
其實蠻簡單的
幾乎是每樣材料原本的味道

但！
紅蘿蔔是生的！
這個有點嚇到我🤔
平常吃的飯捲
很少吃到連紅蘿蔔都是生的🤔"
 徐小狗 ,https://www.google.com/maps/contrib/109312417635708567922/reviews?hl=zh-TW,5,True,174,"酸白菜鮪魚130元
總共10小塊，口味層次豐富，酸白菜不會過酸，裡面還有醃蘿蔔，搭配在一起很下飯。"
 Wendy ,https://www.google.com/maps/contrib/112410444309829057269/reviews?hl=zh-TW,4,False,24,"座位是外面人行道的桌子
動作稍慢
及格的飯捲有香油味料也不錯
飯稍微普通
辣的口味有點辣會比較吃不到香油味"
 Jane Chu ,https://www.google.com/maps/contrib/114582579183350101687/reviews?hl=zh-TW,5,True,69,這次點了辣炒魚板飯捲不得不說真的很豐富而且飯捲最怕的就是飯太多但這個完全相反裡面的料多於飯所以很滿足
 Sue ,https://www.google.com/maps/contrib/107144068272523674855/reviews?hl=zh-TW,4,False,77,女兒喜歡吃飯卷，大部分店家的飯卷口味其實差不多。這家的魚板湯料不多。
 teresa none ,https://www.google.com/maps/contrib/111825242995666831440/reviews?hl=zh-TW,1,False,4,"今天點了牛肉卷和醃魷魚+魚板
但小菜吃到最後才查覺到怎麼都是吃到魚板，完全沒有看到魷魚。不像上次有吃到長條的魷魚。還以為是不是給錯有單純的醃魚板，但查了菜單並沒有這個選項。"
 Serene ,https://www.google.com/maps/contrib/103638269740637721865/reviews?hl=zh-TW,4,True,59,"辣魚板飯捲$140
吃得出來用料很新鮮

但點餐要加line有一點點麻煩～"
 悠寶 ,https://www.google.com/maps/contrib/104529697923417154591/reviews?hl=zh-TW,3,True,835,"黑椒厚切火腿飯捲
辣炒魚板飯捲
這兩個口味的主食蠻搶味的
火腿就只吃得出火腿味
魚板就只吃得出辣辣的味道
旁邊的配菜基本上是無任何味道

如果真的要推比較推薦辣炒魚板
它的辣度真的蠻韓式味

兩個口味基本上吃不太出來麻油味可惜了
生意真的很好建議先訂餐(要用LINE點餐操作小麻煩

⭐悠悠飲食時參考：
甜：手搖飲半糖>偶爾3分糖
鹹：蠻重鹹的
辣：中辣"
 Sabrina ,https://www.google.com/maps/contrib/107355607908290378245/reviews?hl=zh-TW,4,True,198,"醬牛肉飯捲還不錯吃👍
建議先線上點單可以不用等。
用ubereats/foodpanda價錢較高不划算"
 Shane Jhong ,https://www.google.com/maps/contrib/100529211004354556960/reviews?hl=zh-TW,4,True,18,"第一次吃點了辣炒魚板飯卷，蠻好吃的，只是沒有韓國麻油香氣有點可惜（還是我鼻子壞掉😅）
希望可以有單純的鮪魚飯卷
有機會再嘗試其他口味🤗"
 歐陽羽 ,https://www.google.com/maps/contrib/117315748893196839550/reviews?hl=zh-TW,5,True,110,"涼拌冬粉超好吃👍👍👍👍
因為慶生會點的份量比較多，謝謝女店員很耐心告訴我怎麼填線上單跟使用配合的外送"
 卓盈妤 ,https://www.google.com/maps/contrib/117176603225149295360/reviews?hl=zh-TW,2,True,14,"這個魚板湯這個價錢$35🤣🤣
這不是便當店會送的湯嗎

主要吃過行天宮站旁gimbaP同樣$35釜山煮魚板湯也差太多哈哈哈

中午來就說沒冬粉了？

飯卷可以飯卷給2顆星"
 Robbie Lo ,https://www.google.com/maps/contrib/110327894080985145673/reviews?hl=zh-TW,5,True,59,先訂再取餐，相當方便省時；牛肉和鮪魚酸菜都不錯，會再回來試試其他口味。
 Sasa Rose ,https://www.google.com/maps/contrib/113024782849108075282/reviews?hl=zh-TW,4,True,143,雖然要等很久⋯但是值得！醃辣椒鮪魚飯捲～既辣又好吃！一口接一口！
 Elaine Lee ,https://www.google.com/maps/contrib/110327302036068209819/reviews?hl=zh-TW,5,True,31,飯捲濕潤飽滿，食材新鮮，灑上芝麻更提味，會想再回購！
 Chi Lo ,https://www.google.com/maps/contrib/117458549661818025790/reviews?hl=zh-TW,4,True,91,"很好吃雖然現在疫情期間不可以內用，但外面的把台可以吃，也還是不錯，醃蘿蔔如果可以切小塊一點完全就堪稱是滿分了，冰冰的又很有味道，超讚
火腿飯卷可以給3.5分，如果是牛肉的話分數會更高，後面那個牛肉拌飯真的好吃！
但點飯卷+拌飯兩個人吃還是太多了，建議女生點其中一項即可。"
 林昭吟 ,https://www.google.com/maps/contrib/117395335437734543863/reviews?hl=zh-TW,5,False,32,"一個月犒賞自己一下的美食😊
整個價格上稍稍偏貴一些
只有提供外帶及外送服務喔！

由道地韓國歐巴及歐妮一起開的韓式料理
真的很好吃😋😋😋
從飯捲、拌飯、冬粉、醃蘿蔔、魚板湯、飲料每樣餐點都讓人回味無窮

本身推薦《辣魚板飯捲》辣度🌶️🌶️
很適合現在炎熱的天氣，不管是當正餐或是下午茶
都很適合

另外《辣魚板五色菜拌飯》也不錯👍
搭配的蔬菜真的很新鮮，蛋絲也是有厚度的喔

再來是《韓式拌冬粉》最讓我驚艷
整個非常香非常Q彈，是涼拌的耶～

整個最愛的就是《醃蘿蔔》
超級脆口又不死鹹，超開胃
一份30元，但只有3小塊😭😭😭😭😭

魚板湯個人覺得普通，比較沒什麼特色

飲料可以有三種口味可以選擇
1.甜麥芽汁（偏甜，有果粒）
2.葡萄汁（氣泡水，有果粒）
3.水梨汁（像糖水一樣）"
 スフレ ,https://www.google.com/maps/contrib/115259034066880953208/reviews?hl=zh-TW,3,True,168,"飯捲內料蠻實在，
但就是少了麻油香氣有點可惜；
魚板湯搭配著飯捲還不錯喝，
但裡面只有兩片魚板
喝得有些空虛感😣
醃蘿蔔小貴……"
 gina chi ,https://www.google.com/maps/contrib/108891434376513317057/reviews?hl=zh-TW,5,True,42,"跟在韓國吃的味道好像🥺🥺好好吃
忠午飯捲看似單調但很有味"
 Jonathan Liu ,https://www.google.com/maps/contrib/110548854863380156245/reviews?hl=zh-TW,5,True,"1,365",現場吃比uber外賣更新鮮又好吃.飯捲層次豐富
 林Luke ,https://www.google.com/maps/contrib/105286800564072859046/reviews?hl=zh-TW,4,True,317,防疫外帶，韓式飯捲拌飯，很多人排隊，覺得飯捲比拌飯優，配料基本相同，飯捲是用麻油味海苔捲的，拌飯沒海苔多一坨辣椒醬飯也比較多，配料中黃色醃蘿蔔特別，忠武飯捲是純海苔包飯，再加上辣魚板跟辣醃蘿蔔。
 Aurora Hernández ,https://www.google.com/maps/contrib/117044441856380763932/reviews?hl=zh-TW,4,True,"1,825",飯卷好吃，很有韓味，可以Linepay很方便
 Yong Xian Cool ,https://www.google.com/maps/contrib/117480500949029783347/reviews?hl=zh-TW,4,True,36,個人覺得比較偏台式飯卷，沒有像韓國飯卷這麼香（香油的關係），但整體也沒有不好吃！但魚板湯真的就跟韓國魚板湯有差了，對我來說有點偏鹹～但都是我個人口味！建議可以自己去吃吃看喔～
 Bei Lin ,https://www.google.com/maps/contrib/106360283227997931450/reviews?hl=zh-TW,3,False,14,"沒有難吃，就一般般，沒什麼麻油香，酸蘿蔔基本上蓋過其他食材的味道，讓整體吃起來很像日式壽司
#醬牛肉飯捲"
 達達 ,https://www.google.com/maps/contrib/107064074094802697538/reviews?hl=zh-TW,3,True,18,"之前訂過酸白菜鮪魚蠻喜歡、紙盒裝得乾淨美美的，撒上白芝麻相當清爽。怎麼知道今天定了兩份（牛肉跟起士核桃），可能為了省錢變紙碗裝、連白芝麻都沒了⋯失望（雖然起士核桃的味道不錯

——"
 Sandy CS ,https://www.google.com/maps/contrib/104569180908051339236/reviews?hl=zh-TW,3,True,148,這間的米飯很乾～覺得稍微可惜了
 黃修方 ,https://www.google.com/maps/contrib/100275861315604464412/reviews?hl=zh-TW,4,True,287,很道地的韓式飯卷，這天點了紅飯卷及忠武飯卷，配上韓式辣蘿蔔及魚板很對味，很好吃。老闆很像是韓國人，小小的飯卷吃起來也很有飽足感～
 Yanen안은 ,https://www.google.com/maps/contrib/109657945795922532957/reviews?hl=zh-TW,5,True,149,"一年前的評論，現在還是會特地來一趟吃飯卷，當然還有大份的冬粉～希望你們繼續加油💪🏻
浪漫🌹微出國享受著二個月前偽出國造成不少人借用創意。（微出國，來到一個嚴謹的🇰🇷飯捲達人的店，享受著浪漫的氛圍，耳邊傳來老闆為大家播放韓文音樂，我是🇰🇷真韓粉～以前因為政治不喜歡🇰🇷但喜歡研究其他國家文化的心沒有改變。大家一起發掘異國文化來捲當紅的飯捲相信會與我相同感受🇰🇷老闆帶給我們的韓食🙂(韓🇰🇷風"
 Janet Chou ,https://www.google.com/maps/contrib/111701019931392499895/reviews?hl=zh-TW,5,False,6,"飯捲和冬粉很好吃～～
希望店家能長久經營下去
要吃到好吃的飯捲已經不多了
沒有圖片，因爲來不及拍照
真心推薦👍👍👍👍"
 beatrice hsieh ,https://www.google.com/maps/contrib/108906019672261406418/reviews?hl=zh-TW,5,True,137,"單點辣魚板飯捲140一盒10個
中辣🌶🌶真的辣到需要配水
份量:餡料蠻豐富包的很紮實
食量大的可能要再加點其他品項"
 Hsuan Jung Lin ,https://www.google.com/maps/contrib/111392225535376526897/reviews?hl=zh-TW,2,False,8,飯捲沒有芝麻油味用料也沒有味道重點是工作人員一副很想下班的樣子這樣的餐點是要怎麼好吃
 Cherry Lin ,https://www.google.com/maps/contrib/105484675728856879940/reviews?hl=zh-TW,3,False,14,點了特醬牛肉飯捲，飯捲沒有韓國麻油香氣，裡頭的牛肉有點像牛肉乾，白蘿蔔也有點搶味道，整體味道不太協調，吃了有點失望🥲
 YU ,https://www.google.com/maps/contrib/102729715095130833933/reviews?hl=zh-TW,4,True,30,服務人員態度佷好，餐點了話，飯有點硬，普普通通。
 Carol Wu ,https://www.google.com/maps/contrib/112524619013209304287/reviews?hl=zh-TW,1,False,15,"利用QRCode點餐模式居然比現場點餐的人還要晚拿到餐點
服務人員還說比現場點餐的人多等10分鐘而已啊…
所以先點餐的人活該嗎
而且真的沒有到必點必吃的餐點
應該以後不會再光顧了"
 妮可何 ,https://www.google.com/maps/contrib/113589361575884287388/reviews?hl=zh-TW,5,True,56,"週六看醫生偶然經過買來吃！
好好吃耶！清爽口感，用料多咬下去紮實美味！只營業到19：30，平日下班根本吃不到真可惜～"
 Yu Chieh ,https://www.google.com/maps/contrib/111228344151178306715/reviews?hl=zh-TW,5,True,93,"在Ubereats上面看到很多次，已經想吃很久了，但因為價格有點小貴，一直遲遲沒有下訂單～
今天心血來潮想說好吧！就來訂訂看！！
餐點品質沒有因為外送悶著而改變，紅蘿蔔有醃漬過吃起來酸酸甜甜，害怕紅蘿蔔的我也吃得津津有味！真的蠻好吃的🥺"
 Miau Huang ,https://www.google.com/maps/contrib/106242055386218788720/reviews?hl=zh-TW,3,True,523,點了覺得可能是招牌的紅飯捲，原價100元，可能因為自備餐盒而折扣5元。份量與內容如照片，覺得較適合當點心，當正餐吃不飽。包得很好切得也漂亮但內容物大多都是蛋絲，除了少量泡菜之外都沒什麼味道，非常清淡。不知道是否很道地但實在吃不習慣，有點失望。
 Wun Jyun ,https://www.google.com/maps/contrib/103988419125736577072/reviews?hl=zh-TW,4,True,59,適合夏天的清爽口味，奶油核桃很淡，幾乎被醃蘿蔔等配菜壓過味道，魚板湯很好喝開胃，像醬油高湯＋胡椒粉，可惜的是分量真的太太太～少，小小一碗彷彿隨餐附贈的湯品，要價35元貴得讓人震驚，但除了價格偏高，其餘都還可以
 Cng W ,https://www.google.com/maps/contrib/100380698365754259289/reviews?hl=zh-TW,5,True,54,"超好吃～
已經連續吃兩天了🤤🤤
很爽口吃不膩
魚板湯甘甜不會太鹹
紅飯卷每次來必點，再搭配老闆特製的芥末醬絕配🤤🤤"
 Neysa OU ,https://www.google.com/maps/contrib/103583585446417875215/reviews?hl=zh-TW,5,True,33,很喜歡這家店的飯卷～這次是買醬燒牛肉口味！超級好吃！味道很夠味，因為自己不敢吃紅蘿蔔，請老闆特別幫我剔除紅蘿蔔，因為是現點現做所以老闆有答應幫忙，非常感謝！飯的部分跟一般外面吃的口感也不太一樣，很夠味不會乾乾的，整體吃起來非常夠味，不過有點小油，但不影響整體表現，女生吃份量也算足夠，男生的話可能需要加點個其他東西。
 Yi Chen Liu ,https://www.google.com/maps/contrib/118323181460569857217/reviews?hl=zh-TW,4,True,59,"當天是外帶餐點因為是現做等了一點時間
原本以為份量會吃不飽
但以女生來說份量是夠的，有機會會再嘗試其他口味～"
 lita Pan ,https://www.google.com/maps/contrib/111089894245372115797/reviews?hl=zh-TW,2,True,"2,432",老闆政策朝令夕改，原本自備環保餐盒有折價，現在又改為衹有飯捲才有，要加辣醬還要加錢❓⁉️是在哈嘍嗎⁉️，不是錢的問題是做生意心態問題，謝謝不聯絡
 Siang Ling Lai ,https://www.google.com/maps/contrib/111429626461828091151/reviews?hl=zh-TW,5,True,68,"建議打電話先叫！那天等到差點遲到了～（剛好蛋絲沒了😭）太好吃了！所以先吃了幾個才想到要拍照
老闆們都很用心大推💪值得回購！
我住永和專程早起搭捷運去買的❤️"
 Mok Liu ,https://www.google.com/maps/contrib/112030183180920782931/reviews?hl=zh-TW,5,False,16,難得在台灣可以吃到這麼到地的大推飯卷，加了青陽辣椒的醃辣椒鮪魚飯卷好好吃👍
 Aaron H ,https://www.google.com/maps/contrib/100592464751229984104/reviews?hl=zh-TW,1,True,177,"如果他們跟你說。在包了
那就表示還沒做
基本要等15分以上
還沒做就直說就好
連這個都在騙
一顆星都嫌多💤"
 老吳 ,https://www.google.com/maps/contrib/117816938833784932567/reviews?hl=zh-TW,5,False,4,第一次吃到道地韓式飯捲，忠武飯捲很特別，外面都沒有，簡單好吃
 Bella Lee ,https://www.google.com/maps/contrib/102786064869396339558/reviews?hl=zh-TW,5,True,20,辣魚板飯捲很好吃，同行朋友點牛肉捲味道偏清淡，建議加一點泡菜或辣醬會更棒！
 Annie ko ,https://www.google.com/maps/contrib/118002439953102219731/reviews?hl=zh-TW,5,False,3,推薦辣炒魚板飯捲！這款很韓，個人覺得小辣而已，店員說覺得不夠辣下次來可以加他們自製的辣醬。
 Winnie Hsu ,https://www.google.com/maps/contrib/102517035973548379371/reviews?hl=zh-TW,4,True,267,"招牌紅飯捲+韓式拌冬粉味道都很不錯，也不會太油膩！老闆是韓國人🇰🇷人很Nice
不過這份量對男生來說可能偏少，對女生算蠻剛好😋"
