user_name,user_profile_url,rating,local_guide,comment_num,comment_text
 Nobuhiro Wang ,https://www.google.com/maps/contrib/105212955619805442369/reviews?hl=zh-TW,3,True,390,"串串還行
湯頭不錯
價格合理
但肉品價格偏高
環境衛生稍差了點
醬料不知為啥死都不補😂"
 2mao Y ,https://www.google.com/maps/contrib/105215877933520904600/reviews?hl=zh-TW,5,True,282,"服務滿分💯
服務員活潑熱情可愛

雖然是麻辣串串但還是有賣一盤一盤的
湯是固定鴛鴦鍋一邊是麻辣另一邊可以選酸菜白肉或大骨湯$150/人
麻辣鍋可以選辣度平常吃中小辣這次點小辣完全可以接受覺得不夠可以請店員加辣！
大骨湯就是很清淡的白湯

推薦點鮮毛肚吃起來脆脆的很新鮮
敢吃麻且重口味的人推薦「重慶小麵」超讚！吃完麵的醬當沾醬很讚！

串串部分一支是$15
「天堂」店員說是豬頰肉吃起來很脆挺特別的
米血糕因為串起來所以煮很久也不會粘鍋而且超好吃的！
希望可以多些根莖類白蘿蔔、土豆片、蓮藕等⋯

這次兩人吃了1380$小貴～不過服務環境都很好，還會再來！"
 tzu-lin Lien ,https://www.google.com/maps/contrib/111337869272313471257/reviews?hl=zh-TW,3,True,249,"偶爾想吃個串串解饞的話可以來一下，店員很親切！
吃下來不便宜，心裡要有個底。"
 LiRu _TW ,https://www.google.com/maps/contrib/109271610649430523878/reviews?hl=zh-TW,5,True,382,"驚為天人啊！
各位重慶小麵必點！哈哈哈
吃完麵後湯汁可以當沾醬！跟串串絕配！
然後嚕串的湯底基本上一定會吃麻辣對吧～
建議依照平常吃的辣度再降一點
像是我平常都吃大辣那還這邊湯底可以先叫中辣
不夠爽再請老闆娘幫你加

只不過口水雞川渝比較好吃比較辣
他們的一般般
然後我是一定會二訪啦！很希望冰箱的串串選擇可以多一點！"
 Kai Cheng ,https://www.google.com/maps/contrib/106209914148251573406/reviews?hl=zh-TW,5,False,19,第二次來吃，運氣不錯有空位，服務佳，串類多，飽足一波！
 Ina N ,https://www.google.com/maps/contrib/115486653146453153588/reviews?hl=zh-TW,5,False,12,"之前在大陸常吃，回台灣就很少吃到了
好懷念香菜牛肉超讚😋"
 Ning Ning ,https://www.google.com/maps/contrib/108233371670704765672/reviews?hl=zh-TW,4,True,111,"以擼串來說湯頭真的不錯，二訪的湯頭少不了大辣麻辣湯頭加上大骨湯頭真的好喝！
串串選擇還可以，黃牛胸肉質偏油花多、牛舌也還不錯"
 雅小芳 ,https://www.google.com/maps/contrib/104668897314443542232/reviews?hl=zh-TW,3,True,203,麻辣有香氣，但吃起來味道不夠，沒有厚實感，吃了個寂寞😏
 zzz ww ,https://www.google.com/maps/contrib/116695133162310646192/reviews?hl=zh-TW,1,False,7,"吃了一個小時，從頭到尾醬料區的的醬跟料都是空的，我從座位站起來走到醬料區至少走了十趟，跟服務員說了不下五次就是死不補，能幫新客人帶位、送鍋送菜、就是不補醬料，從開始到最後要離開時都是空的有夠好笑⋯我能體諒可能是上層的人力配置有問題導致人手不足，啊外場連店裡面的客人都顧不好，還在那邊接電話？？？是要接新訂位嗎還是？？看不懂
單就食物本身來講也是差到不行，主打四川麻辣火鍋但麻辣鍋底一點牛油味都沒，吃起來像摻了水的夜市百元火鍋，食材放進去煮完根本沒味道也不辣，另外兩種白湯也是喝起來除了味精跟水沒啥其他味道，冰櫃裡的串也非常不新鮮，內臟類全部都有很腥一個都不例外，肉類乾柴感覺像品質差又放了不知道多久了。聽到隔壁桌也在抱怨說趕快吃完去吃下一家🤣絕對是我有史以來吃過最垃圾的麻辣鍋/串串，別被星星騙了"
 Shu ,https://www.google.com/maps/contrib/115864982281664743978/reviews?hl=zh-TW,1,True,15,"很適合讓酒客帶酒店妹去的店，可以讓酒客體現自己荷包的厚度，而且反正喝了酒也吃不出東西好不好吃
吃了幾串之後決定回家吃維力炸醬麵"
 Jason Wang ,https://www.google.com/maps/contrib/105079823454318791321/reviews?hl=zh-TW,4,True,"1,395","價格有點太高，580的牛肉只有12-15片
麻辣很香
天堂跟香菜牛必拿"
 alec tsai ,https://www.google.com/maps/contrib/117902283192807237105/reviews?hl=zh-TW,1,True,74,很糟的用餐體驗。隔壁條巷子同樣產品的店客滿。這家店裏完全沒客人。但糟的是牛肉，毛肚，豆皮等等，即使煮過後，都吃到強烈的噁心冰箱味道。。。
 Lin小宛 ,https://www.google.com/maps/contrib/117913609246276875884/reviews?hl=zh-TW,4,True,82,宵夜好去處，每一串$15約一口大小，一口一口煮有點吃不夠味，故我們點大份的梅花豬肉盤$320(忘了拍)，較划算也較有口感，其它肉串就當吃好玩有趣的。一開始點小辣後覺不夠味又再加一大匙辣，辣感刺激度瞬間升級，好過癮邊吃邊冒汗，兩種湯都是可以喝的，店員妹妹服務好親切笑容甜美，兩人消費1555(18天$130，台灣金牌$100)，吃得很開心(除了一直被3隻蚊子打擾，冷冷天到底哪來的蚊子怪怪@@)
 sho ji ,https://www.google.com/maps/contrib/101756641168492936704/reviews?hl=zh-TW,5,True,"1,066","兩個人吃了1290
叫了一盤肉、冷麵
其他都是串串，挺好吃的
店員很熱情、好客"
 曾揚恩 ,https://www.google.com/maps/contrib/107653883804491289534/reviews?hl=zh-TW,5,False,6,非常好吃，份量又足。謝謝阿群的貼心服務，讓我們有非常開心的聚會體驗。
 lita Pan ,https://www.google.com/maps/contrib/111089894245372115797/reviews?hl=zh-TW,5,True,"2,420",店家的氣氛可以很放鬆的用餐，服務親切，沒有壓迫感，鍋底湯頭好，半自助的方式，要吃什麼自己去拿，價格平實值得一試
 Tomorrow CU ,https://www.google.com/maps/contrib/113539566816239350248/reviews?hl=zh-TW,5,True,697,有牛油及花椒香味，現切的牛羊肉涮起來口感都不錯，串串的方式挺適合想吃多種料卻又吃不多的朋友（尤其女生更適合）即使一個人來吃也不會負擔太大。位在條通巷內，車子停在新生高架下走路五分鐘就到。老闆娘很客氣，不錯的地方
 Hiteru Jama ,https://www.google.com/maps/contrib/100910820907595748399/reviews?hl=zh-TW,4,True,413,菜色不多、如果不單點價格合理⋯單點肉類價格都蠻高而且不怎麼樣⋯建議吃串就好
 陳綾綾 ,https://www.google.com/maps/contrib/106611574156479437874/reviews?hl=zh-TW,5,False,1,"東西好吃又便宜店員服務親切
一定再訪"
 詹凱蒂 ,https://www.google.com/maps/contrib/108822509664490750447/reviews?hl=zh-TW,5,False,11,湯頭好喝！特別推個松阪豬好吃！
 Yu Chen Wu ,https://www.google.com/maps/contrib/111713680386810915451/reviews?hl=zh-TW,4,True,253,酸辣粉好吃，湯頭美味，服務親切
 T.K. Shou ,https://www.google.com/maps/contrib/104977981731817009298/reviews?hl=zh-TW,5,False,1,肉質美味，CP值高的一家店
 蔡kiwi ,https://www.google.com/maps/contrib/116969132915282941760/reviews?hl=zh-TW,5,True,20,"好吃，維尼人很好！！
湯頭很好
東西很新鮮！！！
好吃(*¯︶¯*)"
 黃政德 ,https://www.google.com/maps/contrib/101185018365472064282/reviews?hl=zh-TW,5,False,17,超讚，小香超貼心，食材百分百值得我真心推薦
 wan yu ,https://www.google.com/maps/contrib/102573418243191745743/reviews?hl=zh-TW,1,True,44,完全不想讓人二訪的大雷店🥲🥲整間店好像只有一個女員工，完全找不到人可以幫忙😫一開始就沒醬油，一直到吃完都沒補，點餐時也沒問辣度（後面聽到別桌要大辣才知道可以調整…）導致吃了一整頓都不辣的麻辣鍋…燙出來的所有東西都沒味道😭😭😭不知道自己在吃什麼……干碟也不辣，反而有點甜味？😢兩個人吃完快兩千，倒不如去吃海底撈…………跟我在大陸吃的串串質量差太多了🤯順道一提，東西都不太新鮮了…冷藏櫃的絲瓜明顯看得出來超乾癟，我猜應該不會有人願意拿🤣🤣滿分100，我應該只會給20分😅
 曾佳琪 ,https://www.google.com/maps/contrib/102849551548795615388/reviews?hl=zh-TW,1,False,6,"東西沒串好
我一拿掉地上
還跟我算錢
真的是死要錢
不推薦"
 凱莉 ,https://www.google.com/maps/contrib/107813727190820949703/reviews?hl=zh-TW,4,True,520,"麻辣湯頭不錯
酸菜覺得不夠酸
串串想吃什麼自己拿
東西還蠻多樣的"
 CHI-HAO HUNG ,https://www.google.com/maps/contrib/115183792013940858769/reviews?hl=zh-TW,5,True,525,串串超級好吃😋，店員小姊姊特別熱心可愛！
 謝青穎 ,https://www.google.com/maps/contrib/117287764179080206350/reviews?hl=zh-TW,5,False,3,"店員很親切，而且服務很好
串串很好吃，價格很親民
麻辣很夠味👍🏻👍🏻👍🏻
下次還會想再來，推推～"
 Leona Chang ,https://www.google.com/maps/contrib/103447503126880886639/reviews?hl=zh-TW,2,False,11,店員只有一位，紅湯死辣也不香，死辣到沒辦法再吃下一隻，白湯完全不香，醬料區亂七八糟，選擇少，吃了十分鐘直接換餐廳。很失望的體驗⋯
 Q ueena ,https://www.google.com/maps/contrib/106904670063248222343/reviews?hl=zh-TW,2,False,7,食物味道很普通大骨湯基本沒味道然後衛生也不太好醬料區也是有點不乾淨店員服務一言難盡剛進店完全沒有店員等了一陣子才有店員從後面出來用餐途中需要找店員問東西走去後面才發現是躲在後面聊天就整個體驗都很差兩分是給麻辣鍋的畢竟麻辣鍋要難吃很難再也不會去
 曾薏珊 ,https://www.google.com/maps/contrib/110033605112332300731/reviews?hl=zh-TW,1,False,6,"這次去覺得偏貴且衛生條件不佳也沒有特別驚艷

1.泡椒牛肉的泡椒好像壞了，味道完全不對還有一股藥水味，吃完留下一股奇怪噁心的味道，需要好好清潔一下口腔

2.本來想使用沾醬，但大部分調料沒有蓋子，一拿起生辣椒湯匙準備取用的時候，一大群果蠅從裡面飛出，讓人食慾全消

3.串串的部分有個擺在牛肚旁一片一片的東西不知到是牛的哪個部位，不管怎麼煮都不會爛，咬起來跟很韌的塑膠一樣還越來越硬，完全無法吞嚥很可怕"
 Roger Yu (Rogie) ,https://www.google.com/maps/contrib/109988819059297433888/reviews?hl=zh-TW,5,True,34,夠麻夠辣鴨血好吃！食材新鮮。
 周bella ,https://www.google.com/maps/contrib/117433144664431544848/reviews?hl=zh-TW,5,False,1,服務員很讚，東西好吃
 Arita _ ,https://www.google.com/maps/contrib/116662063220965837043/reviews?hl=zh-TW,1,False,1,"別點黃牛胸肉…實在是不怎麼好吃，選擇很少、食材不新鮮，不會想去第二次
吃的晚餐，結果半夜肚子痛醒來，拉了肚子………"
 徐師涵 ,https://www.google.com/maps/contrib/117968977338817996729/reviews?hl=zh-TW,5,False,1,酸菜白肉鍋超夠味/小姐姐好可愛好熱情/下次還要來
 Candy Chao ,https://www.google.com/maps/contrib/116251591769029517674/reviews?hl=zh-TW,5,True,38,"五顆星都給可愛的店員小姊姊，到底是什麼惡老闆在客朋滿座的禮拜五只僱一位撐全場，營業額要分她一半才對🤣
BTW只有東區店有小龍蝦跟筍乾"
 Mandy ,https://www.google.com/maps/contrib/101897941908687961938/reviews?hl=zh-TW,1,False,2,"串串的數量亂算從頭到尾也只有一個女店員
而且店員一直打電話問什麼都說不知道
還有一堆蚊子在飛零錢也沒辦法找"
 Freya FU ,https://www.google.com/maps/contrib/116752497272653981073/reviews?hl=zh-TW,1,True,68,湯頭完全沒味道，雞肉豬肉超硬，牛肉羊肉也幾乎沒味道...食材不好吃且也不夠新鮮，第一次吃到這麼可怕的狀況。
 Josie Lee ,https://www.google.com/maps/contrib/103074708248410011547/reviews?hl=zh-TW,5,False,18,"中辣就辣到飛天真才實料
黃牛胸肉跟牛舌好好吃
重慶小麵香濃味重
店員聰敏機靈真的是老闆的福音!!!
白湯相較之下很普怕辣的人真的就不要勉強去吃了~~~"
 Sodaowl ,https://www.google.com/maps/contrib/106616875819249255201/reviews?hl=zh-TW,4,True,731,"不差
便宜

冷麵好吃"
 Nick T s ,https://www.google.com/maps/contrib/106938011479394040352/reviews?hl=zh-TW,5,False,12,"酸菜白肉湯好喝到爆，
一串15的麻辣串串怎麼能不愛❤️"
 Nikiy Lin ,https://www.google.com/maps/contrib/108146621337507529870/reviews?hl=zh-TW,5,False,1,嚐鮮，嚐新，嚐先，今天第一名，好開興吃好料的，大家快來試試
 Ariel Chen ,https://www.google.com/maps/contrib/102774863236445429256/reviews?hl=zh-TW,5,False,3,好好吃，有四川的味道，服務員妹妹親切貼心，大推的店。是金稻子老闆開的耶
 Aeola Wu ,https://www.google.com/maps/contrib/103291126257937208439/reviews?hl=zh-TW,5,True,20,朋友說麻辣鍋的麻辣很對他的口味～～而且辣得很香，我自己是覺得酸菜鍋的酸很剛好很好吃，涼粉也好吃！店員超可愛，問他問題都超認真跟我們解釋，推～❤️
 吳沛kkk ,https://www.google.com/maps/contrib/104385029885007738068/reviews?hl=zh-TW,5,False,3,好吃服務親切😍
 chi chun chang ,https://www.google.com/maps/contrib/108869050848270454907/reviews?hl=zh-TW,5,False,3,來了第二次才決定要評分，味道實在太正宗！一涮就知道是真正牛油味！味道實在太好，真的與外面麻辣火鍋不一樣！！老闆親切又可愛！這家已收入口袋名單
 許嘉容 ,https://www.google.com/maps/contrib/107677088782611191840/reviews?hl=zh-TW,1,False,6,"七人用餐均價快800桌上堆滿清空食材的盤子也沒收拾，鄰桌還有人抽煙(違反室內禁煙的規定)
用餐體驗以這個價位來說不是很好，非麻辣的湯底豬骨跟酸菜白食之無味
同價位連鎖也有更好的選擇不會來訪"
 xoxo BTS ,https://www.google.com/maps/contrib/111738899672672825603/reviews?hl=zh-TW,5,False,1,店員非常友善辣鍋很正宗好吃
 沒鹹 ,https://www.google.com/maps/contrib/101449062406558386421/reviews?hl=zh-TW,5,False,3,"底料豐富，辣味非常夠勁
喜歡吃辣的一定要來吃看看
尤其是很道地的串串
服務也很周到，老闆待人親切
還會親自送客，很暖心"
 Yu-Cheng Lin ,https://www.google.com/maps/contrib/118349657880069937135/reviews?hl=zh-TW,4,True,153,"小辣就很過癮
大骨湯的著喝也很舒服"
 lio liu ,https://www.google.com/maps/contrib/110229335642339812165/reviews?hl=zh-TW,5,False,3,"自從看過了「創業時代」

一直想嚐嚐，嚕串是什麼滋味....
這間超級推推👍👍
老闆道地內地人，食材不僅新鮮；
麻辣-麻而不辣，還不躁！
真的很不簡單。

店裡擺設很復古，店名咋看還以為是關東煮....
#東道煮
#客滿
#一人$100
#一串$10
#適合邊嚕串，邊小酌"
 民阿 ,https://www.google.com/maps/contrib/101798662275923148875/reviews?hl=zh-TW,3,False,19,"不知道我怎麼吃的
兩個人2980
三盤肉一些串
價格沒仔細看但感覺有些貴
不難吃也不特別普普通通"
 周潤澤 ,https://www.google.com/maps/contrib/113996071551980197574/reviews?hl=zh-TW,5,False,2,家鄉的味道，真的太好吃了啊啊啊
 高宋琬如 ,https://www.google.com/maps/contrib/116247443617317221732/reviews?hl=zh-TW,5,False,2,"服務態度很好👍
正中宗四川火鍋，如果愛吃辣的一定要去吃味道超夠，價錢也在合理的範圍內，值得去吃推！"
 W Jerry ,https://www.google.com/maps/contrib/115503647110616536304/reviews?hl=zh-TW,3,True,255,口味還可以！豬內臟類食材感覺不怎麼新鮮！其它類食材還不錯～
 UbiQuiTousLy ,https://www.google.com/maps/contrib/104246833503747199140/reviews?hl=zh-TW,4,True,"1,610",想吃辣，尤其是香菜牛肉串喜歡～
 Yi Hsing ,https://www.google.com/maps/contrib/114555275667496521420/reviews?hl=zh-TW,5,False,2,"Winnie幫我撥蝦一百分的店員
蝦子超好吃都超好吃服務一百分"
 Rita Huang ,https://www.google.com/maps/contrib/106589348628163967986/reviews?hl=zh-TW,4,True,87,可以小串多樣的食用方式尤其非常適合胃口不大的人，麻辣湯頭香氣足，不重鹹，沾香菜蔥花白醋特別搭，很不錯👍值得嚐鮮
 Chang Robin ,https://www.google.com/maps/contrib/115626487058172593228/reviews?hl=zh-TW,3,True,111,如果想吃飽，價格太高，還是吃完飯去喝一杯。
 Dori Chen ,https://www.google.com/maps/contrib/110259155518914359321/reviews?hl=zh-TW,2,True,231,備料少，紅湯不辣、白湯不香，湯頭不值一人一百，花干硬且有冰箱味，店內很多蚊子。
 張淑芬Dora ,https://www.google.com/maps/contrib/106831605614377076346/reviews?hl=zh-TW,5,False,5,好吃！服務人員親切
 CHiEN ,https://www.google.com/maps/contrib/117432533264760664731/reviews?hl=zh-TW,5,False,124,店員親切，喜歡吃麻辣火鍋的朋友可以嘗試看看，很標準串串香的吃法，有別一般麻辣火鍋，屋內裝潢舒適。
 Ann Hsieh ,https://www.google.com/maps/contrib/113107617849244071628/reviews?hl=zh-TW,5,True,59,"牛油+花椒道地麻辣不混目魚珠~牛肉捲香菜超好吃
老闆人很爽朗親切愛撩妹"
 清泉このき ,https://www.google.com/maps/contrib/104349630546312573336/reviews?hl=zh-TW,5,True,18,"道地四川味，從湯頭就能感受到店家的用心
串串種類很多，內臟齊全
太牛逼了"
 Renee ,https://www.google.com/maps/contrib/113517667156931223562/reviews?hl=zh-TW,5,False,8,"好吃，便宜，又道地！
老闆又很親切，招待清酒又招待新菜色！
環境又舒適，值得再來的店噢！"
 ThreeChiBTC ,https://www.google.com/maps/contrib/115966593757445064268/reviews?hl=zh-TW,5,False,4,店員調的醬汁讓我覺得這世界還有光
 Elie Wang ,https://www.google.com/maps/contrib/100716069979520750152/reviews?hl=zh-TW,1,True,21,大約三月時去的，吃到不新鮮的食物，而且餐具盤子也油膩膩黏黏的⋯⋯
 王立翰 ,https://www.google.com/maps/contrib/110798335318121532834/reviews?hl=zh-TW,1,False,15,給你六顆星這顆是多出來的啦😎
 M LB. ,https://www.google.com/maps/contrib/116061044053268744054/reviews?hl=zh-TW,1,False,7,給你六顆星這是多出來的那顆
 金桔檸檬 ,https://www.google.com/maps/contrib/110431831813991423022/reviews?hl=zh-TW,5,False,6,東西好吃！服務周到！店員又親切😋下次會在光顧
 EMMA PAN ,https://www.google.com/maps/contrib/102716591428646802953/reviews?hl=zh-TW,5,False,13,"服務生妹妹服務很棒👍🏻
麻辣鴨血超嫩超好吃！"
 趙RYAN ,https://www.google.com/maps/contrib/114585792191158361531/reviews?hl=zh-TW,5,False,14,"服務生妹妹很熱情很可愛
服務很好味道也很道地
推薦！"
 王宣文 ,https://www.google.com/maps/contrib/108900325719061609640/reviews?hl=zh-TW,1,False,3,完全不地道，明顯人員不足，不會在來訪
 李佳珊 ,https://www.google.com/maps/contrib/113138478460200606735/reviews?hl=zh-TW,5,True,58,"大骨湯的鍋底好喝的沒話說
暖胃的最佳選擇"
 林姝岑 ,https://www.google.com/maps/contrib/105548315418732384794/reviews?hl=zh-TW,5,False,9,食材新鮮服務周到真心推薦聚餐好地方
 洪聖恩 ,https://www.google.com/maps/contrib/102269857941817935847/reviews?hl=zh-TW,5,False,3,飲料大概一瓶100吧滿便宜的
 Mark Huang ,https://www.google.com/maps/contrib/112811136096848849677/reviews?hl=zh-TW,5,True,102,麻辣燙串串辣香好吃…老闆熱情健談
 Lance Lee ,https://www.google.com/maps/contrib/115941027151334719493/reviews?hl=zh-TW,4,True,209,還不錯
 永正 ,https://www.google.com/maps/contrib/116554324302992352233/reviews?hl=zh-TW,4,True,257,很特別的風味有特色且用心的料理
 林柏樺 ,https://www.google.com/maps/contrib/108875186732516952018/reviews?hl=zh-TW,5,False,12,鍋底味道很道地，而且老闆妹妹很可愛
 高嘉宏 ,https://www.google.com/maps/contrib/116300140622409483810/reviews?hl=zh-TW,5,False,3,串串辣得很好吃，大推薦！
 King Zakinthos ,https://www.google.com/maps/contrib/106088808114566263926/reviews?hl=zh-TW,5,False,4,味道特別正宗，服務態度好
 ㄜ ,https://www.google.com/maps/contrib/111477092680289659394/reviews?hl=zh-TW,1,False,1,食材不新鮮，不推
 林俊言 ,https://www.google.com/maps/contrib/105396882526007477015/reviews?hl=zh-TW,1,False,6,營業時間不實也不改
 邱奕陽 ,https://www.google.com/maps/contrib/101341989659956618008/reviews?hl=zh-TW,5,True,23,"非常好吃
老闆客氣
服務非常好"
 Jia Hong ,https://www.google.com/maps/contrib/107748829819783674077/reviews?hl=zh-TW,1,False,7,CP值不值這個價
 劉虹妤 ,https://www.google.com/maps/contrib/111781710622049059090/reviews?hl=zh-TW,5,False,4,老闆親切幽默，東西不錯，推推！！
 Elliot Ling ,https://www.google.com/maps/contrib/109668382125430275455/reviews?hl=zh-TW,5,True,24,東西好吃，老闆客氣👍
 陳圓圓 ,https://www.google.com/maps/contrib/110875356877404939879/reviews?hl=zh-TW,5,False,2,很好吃吃得很飽。
 楊紹熙 ,https://www.google.com/maps/contrib/107447429718364451355/reviews?hl=zh-TW,4,True,985,讚，不便宜但值得
 SA Y ,https://www.google.com/maps/contrib/101335615464092907635/reviews?hl=zh-TW,5,False,1,店長親切，麻辣鍋好吃
 Yu-Xuan Lai ,https://www.google.com/maps/contrib/116264840964027933397/reviews?hl=zh-TW,3,True,176,我覺得不值這個價欸
 nathan Liao ,https://www.google.com/maps/contrib/106761594079452538921/reviews?hl=zh-TW,5,True,43,店內寬敞🤙🏻🤙🏻
 張朵拉 ,https://www.google.com/maps/contrib/103066487834933359675/reviews?hl=zh-TW,5,False,6,服務親切又好吃
 支向聖 ,https://www.google.com/maps/contrib/114930880127330748603/reviews?hl=zh-TW,5,False,2,道地美味，價格優惠
 許芸瑄 ,https://www.google.com/maps/contrib/113148743998953992818/reviews?hl=zh-TW,5,False,5,非常正宗的四川火鍋!
 蔡少樺 ,https://www.google.com/maps/contrib/118089868397918346629/reviews?hl=zh-TW,3,True,6,吃辣好去處
 偉竣簡 ,https://www.google.com/maps/contrib/112545763359998551844/reviews?hl=zh-TW,5,True,26,很多樣
 王昱喬 ,https://www.google.com/maps/contrib/107843860111765962906/reviews?hl=zh-TW,5,False,3,讚啦
 뚜루리 ,https://www.google.com/maps/contrib/109571800506119798041/reviews?hl=zh-TW,5,True,86,"(由Google提供翻譯)我第一次吃中國火鍋，絕對好吃！！！瑜珈湯真的很棒👍
麼，湯底又香又好吃沒停止來喝湯辦法

(原始評論)
첨으로중국식훠궈먹었는데완죤맛나요!!!요기국물이정말끝내줍니당👍第一次吃中國的火鍋！沒想到這～～
麼好吃，湯底又香又好吃沒辦法停下來喝湯"
 劉馨泽 ,https://www.google.com/maps/contrib/112680625827106032673/reviews?hl=zh-TW,5,False,16,"(由Google提供翻譯)道地大陸味！想擼串的可以大快朵頤。價格實惠十分值得期待！手切羊羊肉十分美味。涼拌夫妻肺片很有咬勁Q彈Q彈的最後在一碗冷面這一餐實在太爽了。

(原始評論)
道地大陆味！想撸串的可以大快朵颐。价格实惠十分值得期待！手切羊羊肉十分美味。凉拌夫妻肺片很有咬劲Q弹Q弹的最后在一碗冷面这一餐实在太爽了。"
 羅翊凱 ,https://www.google.com/maps/contrib/111171637807720803219/reviews?hl=zh-TW,5,False,6,"(由Google提供翻譯)好吃的串串火鍋

(原始評論)
好吃的串串火锅"
 Chen Bob ,https://www.google.com/maps/contrib/116723252839780511111/reviews?hl=zh-TW,5,False,7,超爆好吃
 阿潔 ,https://www.google.com/maps/contrib/106826601622160261188/reviews?hl=zh-TW,5,False,1,好吃
 Vincent Yu ,https://www.google.com/maps/contrib/111428512206347715811/reviews?hl=zh-TW,4,True,45,"(由Google提供翻譯)日本友好，味道是(^O^)/

(原始評論)
日本人に優しい、味はね(^O^)/"
 米克 ,https://www.google.com/maps/contrib/102315384575895553232/reviews?hl=zh-TW,5,False,13,"好吃
小姐姐很nice"
 4plus hostel taiwan taipei ,https://www.google.com/maps/contrib/118188643441538299753/reviews?hl=zh-TW,5,True,249,"(由Google提供翻譯)推薦麵條碗！

(原始評論)
麺🍝オススメです！"
 姜辰翰 ,https://www.google.com/maps/contrib/108935033923345770120/reviews?hl=zh-TW,5,False,3,美味
 GA L ,https://www.google.com/maps/contrib/103737881329522932807/reviews?hl=zh-TW,5,False,10,好吃
 Viki C ,https://www.google.com/maps/contrib/110531238044181034916/reviews?hl=zh-TW,3,False,9,"(由Google提供翻譯)味道不錯，但食物不夠新鮮

(原始評論)
Niceflaviour,butfoodisnotfreshenough"
 duo geng ,https://www.google.com/maps/contrib/107936927931764488647/reviews?hl=zh-TW,5,True,24,口味正宗牛油辣炒
 allen lin ,https://www.google.com/maps/contrib/100577874114294272459/reviews?hl=zh-TW,5,True,277,好吃
 藍Blue ,https://www.google.com/maps/contrib/106799229119029906682/reviews?hl=zh-TW,5,True,29,好吃
 卓立維 ,https://www.google.com/maps/contrib/100143439117765462028/reviews?hl=zh-TW,5,False,10,"(由Google提供翻譯)吉林小寶可愛

(原始評論)
吉林小宝可爱"
 倪安安 ,https://www.google.com/maps/contrib/107351998969878032549/reviews?hl=zh-TW,5,False,1,非常好吃
 TAI RITA ,https://www.google.com/maps/contrib/106318538992947396347/reviews?hl=zh-TW,5,False,1,😋😋
