user_name,user_profile_url,rating,local_guide,comment_num,comment_text
 Ming Li ,https://www.google.com/maps/contrib/108605714481787797902/reviews?hl=zh-TW,5,True,88,"今天吃到晚餐，非常好吃，但價格也是......可是真的很不錯，老闆也很好聊，雖然兇兇的

有一道“靖魚握壽司”比較可惜有點魚腥味，其他每一樣都很棒，生食級葡萄蝦的兩段作法、星鰻握壽司最令我驚艷"
 Jackie Wu ,https://www.google.com/maps/contrib/112111302984514252514/reviews?hl=zh-TW,5,True,152,"非常有個性的一家店，店家不給電話預約，只能現場候位，而且內用時間只有45分鐘。如果吃飯速度較慢的人會吃的很趕！
但餐點非常新鮮好吃，鮮魚味噌湯的部分也是現煮，可以續碗！
非常推薦！是吃完後還會想要二訪的店！！"
 郭柏睿 ,https://www.google.com/maps/contrib/100180774392916610826/reviews?hl=zh-TW,5,True,369,"2022/07更新
變成只有中午有丼飯了
/
台北吃到最划算的生魚片！
食材超級新鮮，湯的料也是多到不行
需要提早來排位子"
 Liam Lin ,https://www.google.com/maps/contrib/109437678500873200113/reviews?hl=zh-TW,5,True,31,"老闆用料實在手藝好，食材新鮮美味，每一口都很驚艷
丼飯很好吃，肉質肥美Q彈甘甜
味增湯用料誠意十足，有魚肉，湯的味道鮮甜甘美，很超值
人潮蠻多的需要提早來排隊"
 Michael Tai ,https://www.google.com/maps/contrib/101036036975707227430/reviews?hl=zh-TW,5,True,150,"親切的老闆、無限量供應的飯及每碗都現煮的味增湯
精緻且高CP的美食
就是有種讓人不惜排隊也想一再回訪的魔力"
 Yummy chuan ,https://www.google.com/maps/contrib/115030907189406640435/reviews?hl=zh-TW,5,True,109,非常好吃~免費的味噌魚湯誠意滿滿！
 Sylvie C. ,https://www.google.com/maps/contrib/101427618510970632742/reviews?hl=zh-TW,1,False,13,服務態度非常不佳，預約時沒說明保留十分鐘，之後完全不會考慮這家，除了看起來不錯的CP值。需要排隊我想只是因為座位少。不適合想要好好享受食物跟用餐時光的人。
 蘇芷嫻 ,https://www.google.com/maps/contrib/115367918528179195457/reviews?hl=zh-TW,5,True,112,"位於中山站與雙連站之間的一個隱密小店，藏在小巷弄中，如果不注意看還不容易發現呢！但是，是非常值得一來的喔喔喔！！（晚餐時段）是5:30開始，午餐/晚餐時段開始前15分鐘可以開始登記位子，登記位子要到店內，門上掛著一個超大登記板板😂如果沒辦法一開門就來的話，建議要來的各位也不要太晚到，因為店內只有9個位子，真的不大！當天（週四晚上）6:30左右到去登記時已經登記到最後一輪，原本說大概8.才會有位子但後來蠻幸運的7:20多就有位子了，如果今天的登記滿了的話，就不會再開放了哦！在吃的時候有好多人想要登記但太晚來只能下次請早啦！！所以建議要吃的人早點來～以免向隅😂😂
再來說說餐的部分，丼飯真的是無法形容的好吃和滿足，我們點的是「大滿足丼」，真的是好吃到爆炸，生魚片新鮮當然不用說，重點是料多味美，還吃得到海鮮的那種「鮮甜」，真的超級棒，沒有吃過一次真的無法想像！也難怪會這麼夯呀🥺🥺只要點丼飯就會附味噌湯，是可以無限續加的，味噌湯一上來的時候真的會很訝異，料竟然這麼多，還有蝦頭來熬湯～魚也很多！而且再續加的湯料也很多！真的覺得很值得～～～
推薦大家一定要來吃吃看！"
 Sunnie Wang ,https://www.google.com/maps/contrib/104329487452074750268/reviews?hl=zh-TW,4,True,44,"丼飯非常新鮮美味！免費加飯續湯超級佛心。師傅對回答客人問題很有耐心，免費附的湯裡面有蝦頭跟滿滿的魚肉，而且居然是一碗碗煮的！

小小的店面僅能容納約10人，即使是平日午餐生意也非常好，11:40抵達就已經排隊到第二輪，但有用餐限制40分鐘，所以不用等很久。

要注意等待送餐的時間也包括在用餐時限裡，吃的慢的人會有點壓力，建議排隊時就決定好餐點，才不會浪費時間。

免服務費。"
 Smin Lew ,https://www.google.com/maps/contrib/109704479733969976815/reviews?hl=zh-TW,5,True,228,"人生很矛盾就像來旨丼吃飯一樣超級划算又好吃想要偷偷私藏但又想要大力推薦

如果大家有來吃必須要用力地點味增湯用料誠意十足還可以按有沒有對蝦子過敏分開煮其他不需多說這個價錢真的流淚的美味！！

下次絕對不要孤軍作戰我要空著肚子來！"
 Shirley Hu ,https://www.google.com/maps/contrib/108632132661273497182/reviews?hl=zh-TW,5,True,68,"2021年10月剛開放內用餐，且店家重新裝潢，店內更像日式小店，座位也更舒適，最好的是可以馬上吃到新鮮又甜美的鮮魚片，真是開心!沒想到是竟然提前1小時前往排隊竟然已經有人排隊囉!決定下周再更早去排隊才行!
2020年時~小小店面，好有日本攤的樣式，只有吧檯座位，但老闆及服務人員都很親切!看到生魚、生蝦等肥美鮮嫩真的要說おいしい讚!!
但要有心理準備喔!幾乎都要排位，值得耐心等候!
2022／10月起可以預約一週內訂位，太好了！魚肉就是新鮮，湯頭就是甜濃香好喝，裡面魚肉，蛤蜊不會少。價位雖然提高，但絕對值得。"
 Shen Jeff ,https://www.google.com/maps/contrib/105848441737538756903/reviews?hl=zh-TW,5,True,27,"聽說有忘記戴上眼鏡出門的客人給一星，特地來幫忙回血一下
老闆門口不是有告知訂位已滿的牌子
嗎？
怎麼還怪老闆呢？
記得要去配一副清楚的眼鏡啊"
 JR Yang ,https://www.google.com/maps/contrib/113136952913605576374/reviews?hl=zh-TW,5,True,71,"相見恨晚我浪費了太多時間跟金錢在尋覓高CP值日料旨丼絕對是我會N訪並且帶朋友來會覺得很有面子的店，排隊要先入店登記,防疫武漢肺炎期間店內有額溫槍先量體溫門口還有消毒潔手酒精棒棒！
入店先上一碗現煮的鮮魚味噌湯我覺得名不符實根本爆錶的CP值應該要改叫""究極·鮮魚味噌湯EX""整顆天使紅蝦頭融進湯裡一口入魂鮭魚肉白菜頭蛤蠣豐滿的配料光這碗湯就有150的價值重點是竟然還可以續湯!!
今天點的豪華大滿足丼直攻點內最高價餐點送來才知道何其豪華星鰻海膽鮭魚肚干貝天使蝦何其滿足生魚片極厚切一口無法駕馭料多到碗放不下要放旁邊光這口海膽完全沒有腥臭味鮮甜在喉腔釋放再一口天使紅蝦肉彈味鮮甜配著剛剛湯裡的蝦頭這隻蝦子在我肚子裡圓滿了扒幾口鮭魚卵攪和這醋飯在口裡嗶嗶啵啵最簡單的幸福沒過於此啊男生吃一碗絕對飽足完全不空虛！
硬要講缺點大概只能挑剔他店內只有9個位置而且不能預約，還有桌子抽屜太大導致置腿空間有點侷促，不過整體而言真的瑕不掩瑜啦！"
 使博 ,https://www.google.com/maps/contrib/101484609563333597894/reviews?hl=zh-TW,5,True,20,"一大早去排隊真的很值得
生魚片都很新鮮
份量又足夠，可以在加飯也可以再續湯
重點是他附贈的味噌湯，有蝦頭有魚肉，真材實料，續湯是在煮一碗，而不是單純從大鍋湯裡撈一碗而已。
在台北CP值最高的生魚片丼飯之一"
 Cate C ,https://www.google.com/maps/contrib/112761323312541941098/reviews?hl=zh-TW,5,True,25,"4月份一週內去了兩次。
第一次去之前有聽朋友說點有蝦子的飯味增湯裡才會有蝦頭，
因為我喜歡蝦，就兩次都點有蝦的餐。

門口就有貼主餐價目，店內菜單也有一些品項可以單點，
裡面牆上有塊黑板寫一些看起來像是期間限定的食材，
比如說第一次去沒有但第二次去有出現的葡萄蝦。
店內9個座位、桌下有鉤子可掛包包，
熱茶跟醬油、小碟子都是在吧台上自己取。

醋飯口味清甜，
個人蠻喜歡的，我們還有加飯，但其實不用加就很飽了。
味增湯裡面還有白蘿蔔、魚肉（有刺），可以加湯。

單點品項可做生魚片或握壽司（看食材），
需要炙燒可以跟老闆說（我點的是比目魚鰭邊）。

黑板上的單點富山螢烏賊是五隻搭配一片紫蘇葉，
雖然是寫熟的但口感很鮮嫩，甜味也保留著，吃起來很新鮮。

冰箱小杯裝的山田錦是順順的清爽口味，
跟店內餐點很搭。

吃兩次都覺得食材很新鮮很嫩，
蝦卵也彈牙，
台北市區內卻有如東港享受的魚，
很難用一樣價位在台北吃到這樣好吃的。
也可能我去的地方不夠多？但真的是好吃～"
 Anderson Chen ,https://www.google.com/maps/contrib/101548881232250791182/reviews?hl=zh-TW,5,True,639,現場登記固定時段內只有一組客人，用料非常豐富，附贈的味噌湯內容物取決於你點的餐點，一定都有魚肉，但有沒有蝦頭就看你點什麼了。價格跟食材原料大方比起來，真的非常划算，在市中心很少能吃到那麼划算的丼飯，真心推薦。
 劉烜龍 ,https://www.google.com/maps/contrib/117344732559580980825/reviews?hl=zh-TW,5,False,8,"位於中山區巷弄內的一間小店，
每次僅能個位數人入座，
老闆用心準備的餐點上桌，
光外表就令人食指大動。

點主餐有附贈海鮮味噌湯，
裡面有大量白蘿蔔與魚肉，
佐以蛤蜊與蝦頭，
光料多就先給高分。
湯的味道鮮甜甘美，
感受得到老闆的用心與滿滿的誠意。

這次點的主餐是與招牌同名的旨丼，
有七片時令生魚片、一尾天使蝦、一片花枝與蝦卵。
生魚片新鮮甘甜，
不沾醬搭配蝦卵便可出現小當家的畫面。
天使蝦更不用說，
甘甜之餘，肉質肥美Q彈，
幸福的滋味洋溢口中。

做這麼好吃犯規就算了，
老闆還提供飯、湯無限供應的服務。

說到此，
大家最在乎價格，
根本不用擔心。
旨丼配味噌湯一共$250，
怕吃太飽可點今日鮮魚丼才$180，
雖然少了天使蝦與花枝，
但兩百內能吃到這麼新鮮美味的生魚片丼飯，
絕對值得！"
 Aurora Hernández ,https://www.google.com/maps/contrib/117044441856380763932/reviews?hl=zh-TW,5,True,"1,827","林森北路附近小巷超高cp值日式丼飯，離中山捷運站步行約10分鐘，店內僅有7到8個座位，開店前15分鐘開放登記候位，完全覺得值得等候，點了炙燒丼，豐富新鮮的生魚料，醋飯也非常講究，還附贈一晚非常鮮甜的味增湯，裡面有蝦頭、魚肉跟蛤蜊，湯跟醋飯都可以再續，非常值得一訪。
Definitelydeserved5stars,freshanddeliciousrawfishdon,freemisosoupwhichcookedwithsalmon,clamsandshrimphead,onlycostNT$320,definitelywillvisitagain."
 Amber Hsu ,https://www.google.com/maps/contrib/116733862809970019866/reviews?hl=zh-TW,3,True,32,"丼飯附贈的味噌湯很鮮而且吃得到蝦頭和魚片等料，份量足夠。
總體來說炙燒盛合丼比較有味道，大滿足丼雖然吃得出海鮮很新鮮（除了天使蝦），但吃完記憶點不足，反而是炙燒讓鮭魚、比目魚鰭邊的魚油香味四溢，覺得驚艷。
海膽為時價份量很少，但又新鮮又甜入口即化；生蠔不算大顆，新鮮但稍嫌味道不足。
總體來說份量算多，食物新鮮味道中上。不過沒有好吃到會讓人想回訪"
 Yohji (Yohji) ,https://www.google.com/maps/contrib/107860083039168197644/reviews?hl=zh-TW,1,False,3,老闆態度不好，提前一週預約，但來的路上遇到交通事故稍微晚到，進去直接被告知沒有了就被趕出來了，那這樣預約的意義何在？
 gape lin ,https://www.google.com/maps/contrib/107577014688285373883/reviews?hl=zh-TW,5,True,203,"食材算是還可以
性價比高主要是便宜
高單價的食材不建議點
味道上還是差了一些
內用的味噌湯相當不錯"
 yuchin chang ,https://www.google.com/maps/contrib/115918322995634780959/reviews?hl=zh-TW,5,False,11,"需現場候位（店家有候位規則，可以接受再前往捏），旨丼就好好吃！價位親民，魚也給的大方，剛剛好的厚度吃起來超滿足🥺每份餐附的味增湯也好好喝！湯內的魚料也意外的很多塊！
推推！
雖然用餐時間只有40分鐘，想多喝一碗湯會有點趕XD"
 yu ed ,https://www.google.com/maps/contrib/109165083044230958388/reviews?hl=zh-TW,5,True,237,"內用位置不多，提供平日用餐經驗：1720來登記已經排到第二輪，1730開始營業，約1810入店，大概1840登記滿四輪就賣完了！

送餐速度快，附湯誠意滿滿，續湯依然有魚塊！炙燒盛和丼280花枝鮭魚干貝天使蝦...應有盡有👍👍尤其比目魚鰭邊一整大片好滿足，飯是溫的醋飯，飯湯都可以續，五星當之無愧"
 lobo psy ,https://www.google.com/maps/contrib/117514282202065817523/reviews?hl=zh-TW,5,True,31,非常好吃，雖然排了快1小時，但是食材新鮮，非常棒，附的鮮魚味噌湯都是現煮的，十分有誠意，內用可以續湯，品質超高，這是我少數會給五顆星的店家呀，非常推薦
 張家瑄 ,https://www.google.com/maps/contrib/100355318385137248265/reviews?hl=zh-TW,4,True,979,只能現場候位，因此要先向店家登記，午餐分三個梯次，平日中午來11:40到，登記13:10的，剛好前一梯客人用完餐先離開，於是幸運的12:40入場用餐，點了炙燒生魚丼附湯，料超多，還可以免費續飯跟湯，這樣一個set才300，實在很超值。但是味道吃起來並沒有特別驚艷。老闆非常熱情也很親切。有機會再回訪。
 吳穎 ,https://www.google.com/maps/contrib/114506344257159661399/reviews?hl=zh-TW,5,True,79,"第一次來
有種相見恨晚
點了一份大滿足和七貫
老闆很貼心怕吃不完
說等主食吃的差不多了再上
主食吃完後才發現真的吃不下了😂
在雙北吃過數不清的日料
這家讓我印象深刻！
食材、味道都是一流！
我一定會再回來光顧！讚啦！"
 蔡琮淵 ,https://www.google.com/maps/contrib/110347303984195162863/reviews?hl=zh-TW,5,False,67,"海鮮丼飯，我稱這家笫一名。無論在味道、服務、衛生、CP值都值5顆星，已納入我的最愛餐廳。

第二次帶老婆，點灸燒丼及天使蝦丼，都是5星級的評價。"
 王詩婷 ,https://www.google.com/maps/contrib/108399353377214417551/reviews?hl=zh-TW,5,False,17,cp值很高！星鰻很好吃，干貝很鮮，生魚片很厚，這樣一份才$650，很超值！
 Evelyn Tan ,https://www.google.com/maps/contrib/110344236361242792341/reviews?hl=zh-TW,5,False,5,我們點的是一份鮭魚親子丼跟大滿足丼，老闆對於食材的堅持真的讓人感受得到，每樣食材都很新鮮，生魚片入口即化，份量也很足夠，點主食都會附贈一碗湯，湯裡有魚肉、蘿蔔、蛤蜊，主食有蝦的話，湯裡會有蝦頭，強烈建議主食點有蝦的，雖然沒有蝦頭的湯也很好喝，但那個蝦頭感覺讓這碗湯又上了一個檔次，每碗湯都是現煮，非常用心，價格以台北來說很平價。不過因為店面很小，一定要早點去候位，真的要說唯一缺點是要等很久，不過吃完會覺得等待是值得的：）
 劉釋允 ,https://www.google.com/maps/contrib/104989173392450699128/reviews?hl=zh-TW,5,True,431,生魚片非常新鮮（但魚肉的風味展現其實需要一點熟成），分量很足，CP值最高生魚片丼飯之一（好吃的東西才能稱作有CP值，難吃的東西付我錢要我吃我都不想）
 Angel Kuo ,https://www.google.com/maps/contrib/102044214758621437166/reviews?hl=zh-TW,5,True,117,"味增湯有蝦頭，鮮甜好喝，生魚片、干貝、蝦子都很新鮮好吃。
記得要先來登記，我來了四次才終於吃到🥺"
 Tom Yang ,https://www.google.com/maps/contrib/101042707524357329054/reviews?hl=zh-TW,5,True,55,"開店前就會有人在排隊
還好有排到用餐時間大概是40分鐘
這次點的丼飯都很好吃！
而且這家店的味噌湯是現煮的會加蝦頭下去熬！
湯裡還會加蛤蜊和魚肉
連平常都不喝湯的我都整碗喝光👍🏻
湯跟飯都可以再續
整體來說是cp值超高的一間店！"
 濃湯棒 ,https://www.google.com/maps/contrib/109889414219670532916/reviews?hl=zh-TW,5,True,"1,965","店內座位少建議提早來
CP值很高，味噌湯料很多有很多魚肉超讚還能再續湯

主食價位約：220~650無服務費"
 司馬江州 ,https://www.google.com/maps/contrib/101133985055243516922/reviews?hl=zh-TW,4,True,249,"天龍國林森北路巷弄有個性日式料理丼飯，店小小的只有老闆和一位員工，環境很迷你空間使用到極致，8席座位而已限時用餐45分，規矩多預約放鳥直接在FB公佈手機XXX後三碼，列入OK(奧客)名單，品項簡單明瞭，刺身、炙燒、握壽司三種套餐，就算你有點餐障礙也沒問題。

臨店客通常得候位半小時以上，運氣不錯剛好有空位，點了炙燒盛合丼(星鰻+炙燒鮭魚+比目魚鰓邊+天使蝦+玉子燒+花枝+干貝)用料不手軟舖的滿滿，附上有鮮魚的味噌湯，還可以續湯續醋飯，也是滿料誠意十足，在這冬至天冷時節真的暖心又暖胃！......."
 Brenda Chen ,https://www.google.com/maps/contrib/100492763795516055772/reviews?hl=zh-TW,5,True,96,"湯超鮮甜，蝦頭味很濃郁~丼飯也超級好吃，CP值世界無敵高，不過位子不多，每日接待人數也有限，建議提早去侯位
不吃可惜😋吃完又想再吃了啦"
 Yuwen Lai ,https://www.google.com/maps/contrib/101037718722098170444/reviews?hl=zh-TW,5,True,443,"在台北吃過CP值最高的生魚片丼飯
原本很不想PO！怕以後去都沒位子

老闆賣這個價錢有賺錢嗎🤔
丼飯可以續飯鮮魚味增湯也可無限續（續的不只有湯一樣有魚肉）

最愛吃鮭魚親子丼居然只要250🥺
會想一直回訪"
 Julie Chu ,https://www.google.com/maps/contrib/108054897793182719190/reviews?hl=zh-TW,5,False,8,CP值非常高，用料非常新鮮，連味增湯都非常好喝，用白蘿蔔熬煮湯頭很甜，如果點的有含蝦，店家會把蝦頭拿去煮湯，湯頭更鮮！湯、飯都是免費續加，用餐限時40-50分鐘，沒太多時間讓你拍照聊天。店內只有9個位置，要提早去排隊才吃得到，開店前15分鐘開始登記，通常到開店就會滿額滿位。這價位與用料新鮮度，會讓我願意這樣排隊等候。
 Katie Chen ,https://www.google.com/maps/contrib/117111464521372375328/reviews?hl=zh-TW,5,True,168,"2020/07拜訪
🕛開店時間11:30，我們11:35到已經要在外面排隊現場候位了(第二輪)
🍣鮭魚親子丼$270:鮭魚生魚片7片、鮭魚卵⁣
🍣炙燒盛合丼$300:炙燒鮭魚2片、花枝、干貝、星鰻、天使蝦、比目魚鰭邊⁣
🍣豪華大滿足丼$650:時令生魚片7片、花枝、干貝、星鰻、天使蝦、比目魚鰭邊、鮭魚卵、海膽⁣
🥣味噌湯$50⁣

炙燒盛合丼，生魚片真的很新鮮很嫩，第一次吃比目魚鰭邊真的超嫩。
它家的湯料超多，有魚有蝦頭。"
 愛吃鬼拉拉 ,https://www.google.com/maps/contrib/116253032676614569434/reviews?hl=zh-TW,5,False,23,"這CP值有夠高，大滿足丼380還送你湯喝，重點是還可續湯加飯....老闆一定虧錢在賣.....
生魚片天使蝦超級新鮮，推爆了🤤

二訪：炙燒盛合丼320,入口即化的鮭魚跟比目魚邊,讓人滿意👍👍"
 Eric Jhong ,https://www.google.com/maps/contrib/102124988468295902917/reviews?hl=zh-TW,5,True,129,CP值爆表的好吃生魚片丼飯！魚新鮮又切的很厚且價格超便宜！點丼飯都會附贈一碗味噌湯（裡面一堆魚肉蘿蔔跟蝦頭）湯非常鮮甜料又很多重點是可以續碗！整體來說超級值得吃一波！但是位子真的很少，6點來登記候位大概6:30就停止登記了！而且大概到8點多才吃到，建議早點來吧！
 Max Hsieh ,https://www.google.com/maps/contrib/105462213083594972642/reviews?hl=zh-TW,5,True,26,"總是在中午的時候
看到很多人排隊
今天第一次去吃晚餐
-
店面小小但是很精緻
店員態度很親切
隨時都有人在排隊的感覺
建議早點去
-
原本以為附贈的味增湯是簡簡單單的
沒想到裡面料非常豐富
味道很濃郁
居然還可以無限續碗什麼！！！
-
丼飯也是滿到不可思議
生魚片超厚玉子燒跟其他海鮮都超好吃
然後醋飯也可以續什麼！！！
-
中午有一個限定料理
肯定也是經濟實惠大家才會排成這樣
一碗飯一碗湯就飽到不行
感覺握壽司也超棒的
-
總之還會再去
推薦給大家."
 Peckie Chu ,https://www.google.com/maps/contrib/109533221582167723228/reviews?hl=zh-TW,5,True,421,"超～好～吃～
價格非常便宜，海鮮都很新鮮，米飯煮的非常Q，點丼飯還會附一碗有滿滿魚肉&一個大蝦頭的味噌湯，而且還可以無限續湯！
店內位子很少，要早點來登記候位以免吃不到。"
 Yu Hsuan Chuang ,https://www.google.com/maps/contrib/108437459796776547112/reviews?hl=zh-TW,5,True,65,"大推味增湯，料多湯也不死鹹👍👍
生魚片很新鮮，海鮮很鮮甜，份量也剛剛好
吃完很心滿意足❤️
但是太熱門了，需要早點去登記候位"
 Steven Chao ,https://www.google.com/maps/contrib/110378429733843992438/reviews?hl=zh-TW,3,True,157,"優點：份量充足，附贈的味噌湯很有誠意，海膽跟干貝不錯
缺點：味道普通，魚料該有的鮮味都沒表現出來，醋飯就只是有醋味的飯，鮭魚卵有返苦味
結論：可以試試一次看的店家，個人應該不會再訪"
 xann huang ,https://www.google.com/maps/contrib/113654642988622235954/reviews?hl=zh-TW,5,False,10,"CP值超高！太好吃了！讚👍🏻
P/s:附贈的味增湯超多料
（免費續湯，我老公就續了2碗滿滿的魚肉）"
 童仔米糕 ,https://www.google.com/maps/contrib/100192652152983177303/reviews?hl=zh-TW,5,False,6,有個性的老闆、配上超高手藝！新鮮食材！大推！不過要記得訂位喔！
 黃子維黃子維 ,https://www.google.com/maps/contrib/115255241333847329911/reviews?hl=zh-TW,5,True,178,"#才開一個月的高品質日本料理嘗鮮
這味增湯驚人，料豐富、魚肉厚，
每碗都附贈一支蝦頭🦐，有鮮有鮮。
丼的部分名符其實，有滿足，
生魚片很鮮甜又軟，入口即化，各種類都給了。
用料很實在，找不到可以嫌的厚度。
上次平日午餐吃的cp值更高。
•-•-•-•-•-•-•-•-•-•-•-•-•-•-•-•-•
IG孤食日記：🔎bualonefoodie"
 楊晨郁 ,https://www.google.com/maps/contrib/112424511562553745097/reviews?hl=zh-TW,4,True,67,"今日鮮魚丼$160

店面很小巧
拉開門簾走入會有一點點酸酸的醋味跟魚味衝進鼻腔

吧台下面有掛勾可以掛包包
但是椅子的高度有點尷尬下面腳不能踩
坐起來沒有很舒服

有兩個店員在幫忙點餐及收拾
倒茶要自己來
主要是老闆在工作所以需要等候一小段時間

味噌湯跟丼飯幾乎是同時來的
湯裡面有蘿蔔、魚片、蛤蜊
別人都有蝦頭但我剛好沒有😂
魚片有一些有帶刺，要小心吃

雖然點的是最便宜的今日丼，但也是誠意滿滿
魚肉的大小及厚度都很不錯

不過醋飯有點偏市場裡台式壽司的那種感覺
不是我喜歡的類型
玉子燒也有點過甜了

因為不符合個人口味所以扣了一顆星
但總體還是CP值很高的店！"
 彭小米 ,https://www.google.com/maps/contrib/105298155169367817671/reviews?hl=zh-TW,4,True,10,"慢了，滿位
有錢也吃不到
不接客就是不接客

#CP值⬆️
#現場候位
#炙燒盛盒丼
#炙燒握壽司六貫
#愛台灣🇹🇼#hot_arice"
 Shih Ying Tseng ,https://www.google.com/maps/contrib/109415618416471435623/reviews?hl=zh-TW,4,True,87,免費送的味增湯真的很好喝，魚肉在裡面也是很大塊很讚，點了豪華大海鮮丼，因為較愛吃鮭魚所以有請師傅時令生魚片7片的其中三片換成鮭魚，鮭魚好吃，但不確定是不是鮭魚要補鮭魚卵的差價？所以沒有鮭魚卵，當下沒注意到回家看了別人照片才發現，整體不錯，旨丼的cp看起來很高，下次有經過可以再試試。
 Heidi Lin林映竹 ,https://www.google.com/maps/contrib/117670604772432401173/reviews?hl=zh-TW,5,True,113,"週五晚上17:20到已有人在外面排隊等17:30營業
第二輪才到我們進去用餐
CP值真的高！食材很新鮮附湯用料也不吝嗇
有滿足到我當天想吃生魚片的心情啊🤪🤪
會再來訪下次的
可以中午平日來吃吃160的鮮魚丼
推推！"
 jason. TSao ,https://www.google.com/maps/contrib/100682480810269589006/reviews?hl=zh-TW,5,True,"2,267",不錯吃生魚片還蠻新鮮的因為位置少所以通常都要在外面排隊今天吃的是旨丼一碗230元有送一碗海鮮味噌湯有料的喔吃了很滿足湯還可以免費再續但是沒有那個肚子在喝湯很好喝下次要來挑戰大滿足360元或者是680元的豪華大滿足
 曾漢堡 ,https://www.google.com/maps/contrib/115811668618971086268/reviews?hl=zh-TW,5,True,49,"點了豪華大滿足和炙燒盛合丼，生魚片都很厚很滿足，海膽更是美味，新鮮度更不用說！味增湯更是海味十足，還可以續碗喔！單點的松葉蟹肉因為太碎反而沒吃到甜味。
店內位子有限必須現場候位，盡量避免完食後聊天久待，請禮讓給下一組客人。
建議店家空調可以再強一點，中午去吃感覺有點悶。
列入口袋名單，必會再訪！"
