user_name,user_profile_url,rating,local_guide,comment_num,comment_text
 betty1625best Betty ,https://www.google.com/maps/contrib/105465506514052174175/reviews?hl=zh-TW,5,True,144,公司附近開的小店，每次午餐經過都很多人在排隊。很幸運開在公司附近，所以想吃又不想排隊就早點出發，這一吃可真是讓我驚喜連連！CP值爆表，味噌湯有大大的蝦頭，還有不少鮭魚肉，而且竟然還可以續湯！主餐無論是魚肉或干貝、蝦肉、花枝個個都新鮮美味！列入帶朋友來吃的店！比較美中不足的是店內位置只有9個，但CP值很高！難怪每次經過幾乎都大排長龍👍
 祐增林 ,https://www.google.com/maps/contrib/113697872999843361805/reviews?hl=zh-TW,2,True,38,"事先聲明已空腹6小時、本人是食品技師。

109.07.09吃完大滿足丼後一小時即全身紅腫發癢過敏，明顯是魚體不新鮮導致組織胺過高，分析了一下大滿足丼，其中含有旗魚易生成組織胺，其餘的鮭魚、蝦品評時已接近腐敗的肉質口感，建議你們重新檢視保存方式以及嚴格要求運送過程中的溫度管控，解凍肉品到餐桌耗時勿超過兩小時，別讓這種情況再度發生。
最後提醒，每年台灣皆有因組織胺濃度過高造成的食品中毒案件。

我願意相信這次只是單一事件，希望你們可以改進，不要愧對稱讚你們菜餚的人。"
 Melody Lee ,https://www.google.com/maps/contrib/113256305541849679825/reviews?hl=zh-TW,5,True,56,CP值超高～以這個價位在台北能吃到食材這麼實在的生魚片實在很超值！光是可無限續的味增魚湯(我怕太撐所以沒續）生魚片/海膽都非常新鮮，尤其是海膽沒有腥味，還有丼飯的醋飯也是很用心，味道剛剛好！如果真的要說改進的地方就是生魚片可以切小一點，知道老闆想讓客人吃飽，但一片一口的份量吃下去會讓人大大滿足🌟一定還會再去光臨的
 Gina Chang ,https://www.google.com/maps/contrib/104047068305724820178/reviews?hl=zh-TW,5,True,55,非常鮮美的生魚片丼飯，內用鮮魚湯可暢飲。只開到九點，但食材賣完就會提早打烊。老闆很真誠，是一次很舒服的用餐經驗。目前只開兩個月，內用座位不多，隨著知道的客人們越多，勢必以後會越來越難候位。值得一訪！
 Uson Lai ,https://www.google.com/maps/contrib/111391822411429885488/reviews?hl=zh-TW,5,True,433,"📍旨丼﻿
🔹今日生魚丼$160﻿
﻿
美味：🌕🌕🌕🌕🌕﻿
服務：🌕🌕🌕🌕🌕﻿
環境：🌕🌕🌕🌕🌗﻿
UScore：8.0(商業午餐CP破表，超級好吃)﻿
———————————————————﻿
位在林森錢櫃隔壁巷子內，﻿
店家小小的，大約十席，但客人滿滿滿﻿
還沒12點才剛入座沒多久，就客滿在排隊了﻿
菜單就在正前方，所有主餐都附湯﻿
﻿
平日中午限定的今日生魚丼，160﻿
7片當日鮮魚、蝦卵，味噌湯，﻿
其他主餐也都230起，一樣CP值高﻿
一直說CP高，好怕老闆想漲價了😅😅😅﻿
﻿
這個味噌湯不是隨便的湯﻿
裡頭滿滿的料，兩三片魚肉、魚下巴、蛤蜊、大根，湯鮮味美，雖然今日丼沒有蝦頭，﻿
但是這個CP值已經破表了，還能免費續湯，﻿
續湯還有魚骨和蘿蔔，蘿蔔細嫩鮮甜😍﻿
上次看到這麼澎湃的是六張犁井上禾食😂﻿
﻿
今日生魚片，包含旗魚、鮪魚、鮭魚肚、鯛魚、玉子燒、蝦卵、海帶絲，﻿
厚切的生魚片真的是非常過癮，﻿
重點是第一口就能感受到魚肉的鮮甜😍﻿
吃到鮭魚肚時，那油脂的香氣蔓延口腔，﻿
真的好吃到爆❤️﻿
忘了說說醋飯，味道還不錯，只是口感偏軟﻿
﻿
就連服務也是沒話說，旁邊的還在客製化調整飯少，隔壁的吃完飯大滿足套餐還想加飯😅﻿
﻿
同一個禮拜才吃了松山躼腳，難吃到不行，﻿
肉鬆沒味道，連鮭魚肚也沒什麼香氣，還被說CP值超高，令人瞠目結舌🙄﻿
﻿
經過這次初體驗，一定會想再來品嚐其他丼﻿
———————————————————﻿
🌍台北市中山區中山北路二段59巷54號﻿
⌚️11:30~14:00，17:30~21:00(週一公休)﻿
﻿
延伸閱讀：﻿
井上禾食
﻿
#台北#美食#台北美食#taipei#taiwan#food#restaurant#popyummy#popdaily#yummy#yummyfood#foodporn#foodie#生魚片#刺身#sashimi"
 Yu-Ting Lin ,https://www.google.com/maps/contrib/100911446127679313186/reviews?hl=zh-TW,5,True,18,"非常美味、新鮮、滿足。
這樣才650，價格漂亮。
湯可續碗，湯料多實在也有鮭魚，但光吃完豪華大滿足，湯已經塞不下胃了。離家才三分鍾步行就能吃到頂級享受。"
 ナシャ ,https://www.google.com/maps/contrib/111140682166115073675/reviews?hl=zh-TW,5,True,83,"合理的價位大約250就能吃得很飽
沒錯250大約是基本款""旨丼""的價格
可以無限續飯跟湯(只要你吃的下)
店家很敢給，不會吝嗇。
連續的湯都還有滿滿的料。
食材都蠻新鮮的，醋飯的調味也相當不錯。
湯頭算是獨特，耐喝不膩。
唯一的缺點，大概就是湯裡面的迷你蛤，腥味有點重，但是沒影響到湯的味道，不吃就還好。
其他口味，環境大抵上都是上乘，對得起價格，個人認為物超所值。"
 楊謹亦 ,https://www.google.com/maps/contrib/111017493910061216534/reviews?hl=zh-TW,5,True,67,"非常需要提早排隊~很值得！
第一次來直接點«豪華大滿足»，保證滿足到做夢都在笑，湯免費續喝還有蝦鮮味，用餐40分鐘，請一定謹慎計算「拍照時間」跟「享受時間」
總之一生必來一次"
 Yang Yang (楊楊) ,https://www.google.com/maps/contrib/106325505477892223541/reviews?hl=zh-TW,5,False,27,"📍大滿足丼$360
真的好好好好滿足～
剛上的味增湯超大碗熱騰騰的也不會死鹹
魚塊很多料很多本來想續湯但吃完丼飯真的太飽了！

丼飯真的很優質！鮭魚卵鮮味超足、生魚片都很新鮮很好吃、飯剛剛好的酸味👍

當天排到快七點吃到，但聽到後面的候位已滿有嚇一跳！才七點！要吃的話不建議太晚來～可能會售完

我愛旨丼！！"
 Melissa Chen ,https://www.google.com/maps/contrib/100333106292907883394/reviews?hl=zh-TW,5,True,35,生魚片非常新鮮入口即化，完全沒有任何腥味。吧台上也非常乾淨，可以看出來老闆的細心。推薦想吃的人一定要提早劃位避免撲空，食材用料非常實在，味增湯雖然是附贈的，但濃郁熱騰騰湯頭配上滿滿的魚肉，還可以續碗，實在太滿足。另外，醋飯也非常好吃正配新鮮生魚片，推薦豪華大滿足還能客製替換時令生魚片，大推已回訪兩次。
 王俊亢 ,https://www.google.com/maps/contrib/101519041873897413560/reviews?hl=zh-TW,5,True,94,"炙燒握壽司一定要點
放入嘴巴後，找不到形容詞來形容它的好吃
另外，來了一定不要單點
一般餐點才有附味噌湯
這裡的味噌湯根本是隱藏的主打菜色呀
鮮"
 Love eat ,https://www.google.com/maps/contrib/107921833621630000342/reviews?hl=zh-TW,5,True,411,"老闆佛心的可以續味增湯跟飯
湯裡面有：蝦頭、蛤仔2顆、各種魚排、蘿蔔。
這兩碗湯=七貫了吧
照片：炙燒盛合丼、大滿足丼"
 胖鍾 ,https://www.google.com/maps/contrib/117974452186280066118/reviews?hl=zh-TW,5,True,18,生魚片很新鮮，魚肉很大片，給的附湯很大碗還有天使蝦蝦頭！可以加飯續湯，續的湯也是魚肉給很多，可以吃很飽很滿足。
 Chou Benjamin ,https://www.google.com/maps/contrib/107335998495231959597/reviews?hl=zh-TW,5,True,141,很推薦，座位數不多有大機率要等一陣子才吃的到。
 陳欣銳 ,https://www.google.com/maps/contrib/109165818831811443784/reviews?hl=zh-TW,5,True,16,"第一次吃選了豪華大滿足丼非常讚
尤其生魚片的厚度和味道令人相當驚艷
海膽的味道也很順
附湯有蝦頭的味增湯還可以續口味超好

唯一美中不足的是星鰻沒有刷醬，個人沒那麼愛

另外有加點炙燒的握壽司，飯有烤的微焦並沒有那麼喜歡。

豪華大滿足就超多應該不用加點不然會太飽（個人食量應該算不小）"
 綱湧 ,https://www.google.com/maps/contrib/105696677878554169210/reviews?hl=zh-TW,1,False,6,食材新鮮好吃吃得出差距可惜米其林沒有五星最多三星貴店在我心中有一星。
 江振廷 ,https://www.google.com/maps/contrib/114041397180064712101/reviews?hl=zh-TW,5,False,6,"無菜單料理每道都很好吃，
會依照每位客人的飲食喜好調整菜單。👍"
 San Yang ,https://www.google.com/maps/contrib/104721293666176502612/reviews?hl=zh-TW,5,True,467,"1.需登記候位，若6：30分前沒登記，撲空機會大，
2.醋飯味道剛剛好，飯粒口感佳，食材鮮，附有料味噌，平價好吃"
 跬步千里 ,https://www.google.com/maps/contrib/108929356001652908817/reviews?hl=zh-TW,5,True,522,"大滿足丼360、炙燒盛合丼280、特上甜蝦丼400(當日特餐)
來了很多次，都很喜歡
+食材好、便宜、份量足、附贈的湯還有魚肉、蛤蜊，免費加湯都有
-位置少、一定要現場排隊，11.00到都不一定排得到第一輪(11.30開門、用餐)...."
 Wen C. ,https://www.google.com/maps/contrib/114710674403451158382/reviews?hl=zh-TW,5,True,645,好吃～湯的料也很豐盛，因不吃蝦，店家會另外煮，非常貼心！
 may eat ,https://www.google.com/maps/contrib/114803389575056479202/reviews?hl=zh-TW,4,True,920,"誠意十足，但座位及人手不足，服務態度不錯，只是忙時可能有疏乎，可外帶。

炙燒丼因料偏甜，故醋飯若酸ㄧ點可更解膩。
湯有白蘿蔔、魚肉（少刺），可續。

以此價位言，不論是湯、飯、料都很有誠意。"
 Wei-Han Hsu ,https://www.google.com/maps/contrib/118045260345710695547/reviews?hl=zh-TW,5,True,177,"生魚片丼飯的生魚片很新鮮，醋飯味道不會很濃郁
內用可以無限續鮮魚味增湯，魚肉給的很豐盛
CP值高，感受得出老闆很用心，但要早點登記候位"
 Sylvia Wang ,https://www.google.com/maps/contrib/104243545244073226034/reviews?hl=zh-TW,2,False,11,今天點了旨丼+海膽一份$430，上來時候擺盤很美，蝦頭湯也的確不錯，醋飯微溫吃一吃發現被刺到，旗魚生魚片裡面居然有刺，老闆人很好的換了兩塊給我，但吃生魚片被刺傷嘴角還是有嚇到，另外加點的日本進口海膽，一入口有甜但還是帶著消毒水味，因為本身對海膽跟蝦的消毒水味特別敏感，吃了不是很舒服，鮪魚旗魚都有點軟，沒有香氣還有筋，可能跟我預想的品質不太一樣，整碗飯裡面最喜歡的是天使蝦很甜很好吃，但吃了受傷心情還不好不會再去。
 佳佳（天秤女） ,https://www.google.com/maps/contrib/115822475431701790694/reviews?hl=zh-TW,3,True,414,"有人說這家可以跟金魚日本料理比，我覺得跟多摩食堂比較適合，

旨丼只有9個座位，必須開門營業前15分鐘登記，(多摩食堂可訂位)，

今天排到第一輪，店內冷氣不太涼，我旁邊的吃到一直擦汗，

網路上比較多人推薦炙燒盛合丼$280，連天使蝦都是炙燒過的，不吃生食可點這碗！

大滿足丼$360，內容很多樣，生魚片有筋是敗筆，最好吃的反而是海帶絲跟鮭魚卵，

丼飯的飯是熱的，點主餐均附鮮魚味噌湯，裡面有蝦頭跟很多魚肉(有刺)還有蛤蜊，

店內吃飯很安靜完全沒有聊天聲，因為限40分鐘，等弄好上菜就剩30分鐘，吃得好趕，

生魚片跟環境是「多摩」勝，湯「旨丼」勝！

PS:後面還有人站著在等位很壓迫@@"
 Ning Wu ,https://www.google.com/maps/contrib/107855417746237934809/reviews?hl=zh-TW,5,True,60,"剛唱完歌看到附近的日本料理店😍
店面小小位子不多～
點主餐都會附湯，料多超大碗
還可以無限續湯😋
圖上的餐點是鮭魚親子、豪華大滿足
大推😍"
 Nobuhiro Wang ,https://www.google.com/maps/contrib/105212955619805442369/reviews?hl=zh-TW,4,True,390,"生魚片夠新鮮
份量足
唯一缺點是芥末
太過嗆辣
可以使用品質好點的現磨芥末的話
整體味道會再提升很多層次"
 Sindy Wang ,https://www.google.com/maps/contrib/117269332870403009903/reviews?hl=zh-TW,5,True,84,第一次嚐鮮，第二次再去，很喜歡這美味。澎湃的旨丼與招待味增湯，大大滿足！雖然有點遠，就是要繞過去享用。
 黃詩盈 ,https://www.google.com/maps/contrib/105769530221672494857/reviews?hl=zh-TW,5,True,56,"這次北上愛人排了這家壽司店
還跟我說了，這家五點一定要去排隊不然吃不到⋯到了門口真的有好幾組客人已在門口😣
店內位置不多，用餐時間為40分鐘
其實很綽綽有餘了
不是很敢吃生魚片丼飯的我
選了這個炙燒的～還附了一大碗的味增湯
以價格來講真的是很便宜魚料又新鮮
不會讓人吃的怕怕的～好吃!"
 Liling Yu ,https://www.google.com/maps/contrib/110486103757571520810/reviews?hl=zh-TW,5,True,110,"新鮮好吃無外帶內用只有9個位置
中午分3個時段要提早現場登記喔！"
 瓦哈拉valhalla ,https://www.google.com/maps/contrib/100002030337961998209/reviews?hl=zh-TW,5,True,334,價格合理，食材新鮮好吃，味增湯很好喝，可以續湯加飯，大推絕對可以多次再訪！只是位子不多
 林定垣 ,https://www.google.com/maps/contrib/109945222073847328313/reviews?hl=zh-TW,5,True,36,值得排一小時的生魚片丼，魚料都是厚切，而且很新鮮，鮭魚、青甘的油脂都很豐富，吃起來很飽嘴，如果丼飯內附蝦子，附贈的味噌湯內就會有蝦頭，湯內魚肉也是滿滿的，飯跟湯都可以續，整體用餐下來很滿足。
 Kiki L ,https://www.google.com/maps/contrib/103864812665646455638/reviews?hl=zh-TW,5,False,57,"很幸運經過時剛好還有位置就直接入座了！
點的是「炙燒盛合丼」內有干貝、天使蝦、比目魚、鮭魚、花枝及星鰻，食材都非常新鮮好吃！一定會回訪。"
 Marcus Yang ,https://www.google.com/maps/contrib/112758410089506906035/reviews?hl=zh-TW,5,True,604,湯、飯可無限加，不收服務費，餐點也不貴，在這地段性價比真的超高。
 Pinoko Chen ,https://www.google.com/maps/contrib/110953666101504410237/reviews?hl=zh-TW,5,True,29,完美好吃😋⋯⋯還會再來！老闆很帥又風趣、食材新鮮100分
 Odin Husky ,https://www.google.com/maps/contrib/117173030099730883379/reviews?hl=zh-TW,5,True,142,"Cp值很高

魚肉很大塊也很新鮮
刀工很細
鮮魚湯免費料多到爆炸
超級推"
 alec tsai ,https://www.google.com/maps/contrib/117902283192807237105/reviews?hl=zh-TW,5,True,74,滿分推薦！！！如果你喜歡丼飯你一定會喜歡這邊。不論食物。服務親切等給滿分。CP值極高！！！老闆日料師傅10多年。認真親和力高。
 Pinky Chung ,https://www.google.com/maps/contrib/100542004000452042500/reviews?hl=zh-TW,5,True,23,"點了炙燒盛合丼、海膽、螢烏賊
炙燒丼CP值非常好，特別是裡面星鰻令人驚艷！附送的湯很鮮甜，注意到老闆在上桌前才將蝦頭下下去一起煮，可再續湯、續飯相當大方！推～"
 WEI-TING HSU ,https://www.google.com/maps/contrib/113555471733088181676/reviews?hl=zh-TW,4,True,677,"食材新鮮
工法細緻
好吃

位置有點太擠
覺得預約制會比較好，避免遠道而來的人撲空
大太陽也不用被曬暈"
 AQin_Yang ,https://www.google.com/maps/contrib/110684856096212699348/reviews?hl=zh-TW,5,False,12,"料多實在的好味道
雖然只能現場登記候位，但好吃值得等待
如果要排隊等候，建議可以先去中山商圈走走在回來
可以續飯又續湯
續湯的部分老闆也很大方的多了魚肉，真的會喝的很滿足

好店值得再訪👍🏻"
 Jason Huang ,https://www.google.com/maps/contrib/105213427776749743323/reviews?hl=zh-TW,5,True,178,總體來說cp值很高湯很鮮甜內容物也蠻多的點的旨丼就很飽哩唷老闆很有個性也滿照顧店內的客人算很棒的店儘量早點去唷座位有限！
 尤俊雄 ,https://www.google.com/maps/contrib/104993306552024125344/reviews?hl=zh-TW,5,True,103,味鮮美，物實在，一吃再吃，揪親朋好友共享美食的好店！
 Coco Chang ,https://www.google.com/maps/contrib/100125632172810726560/reviews?hl=zh-TW,5,True,295,內用加湯加飯不用錢，新鮮、CP值非常高，隨時都有季節性食材，今日巧遇松葉蟹😋
 Evonne ,https://www.google.com/maps/contrib/110781573703306102601/reviews?hl=zh-TW,5,True,178,"醋飯很好吃，食材新鮮也很讚。
還可以續飯湯，👍🏻謝謝"
 林子敬 ,https://www.google.com/maps/contrib/116105405902567181945/reviews?hl=zh-TW,5,True,59,"生魚片新鮮好吃，天使龍蝦Q彈到超驚艷
續湯還有滿滿的魚肉覺得超值"
 YVONNE H ,https://www.google.com/maps/contrib/111574534843105852363/reviews?hl=zh-TW,4,True,79,"店裡味道滿重的
食材普通價錢中等～尚可
但味增料超多很佛而且可以續👍👍
因為味增湯給4顆🌟"
 Liam Chiu ,https://www.google.com/maps/contrib/116170934063383517369/reviews?hl=zh-TW,5,True,171,"特上葡萄蝦丼。湯可以續很讚。
生魚片新鮮好吃！"
 Lylin Chien ,https://www.google.com/maps/contrib/104383645795095733567/reviews?hl=zh-TW,5,True,461,生魚片丼飯好吃，特別推薦炙燒，更令人驚豔的是味噌湯，料好實在！
 小劉 ,https://www.google.com/maps/contrib/102866688954108719539/reviews?hl=zh-TW,5,True,27,味增湯超級新鮮好喝，老闆手藝一流，晚餐多無菜單料理要事先預約，位子少值得等待，每季有不同的當季新鮮魚貨，希望品質能一直穩定下去，好店推薦
 Carol Su ,https://www.google.com/maps/contrib/103180183636890548440/reviews?hl=zh-TW,5,False,15,"晚上套餐好讚喔！真的要來試看看
老闆也很有趣！"
 Monday Chiou ,https://www.google.com/maps/contrib/113656243399592906000/reviews?hl=zh-TW,5,True,91,"店面雖小，食材一流，價位合理;唯一缺點~座位只有9個+中午,晚餐各兩輪...賣完收工!明天請早!"
 Jose Hu (Jose Hu) ,https://www.google.com/maps/contrib/105299939030872360755/reviews?hl=zh-TW,5,True,328,老闆十分用心於每一個呈現在客人面前的握壽司，也會讓人感到充滿熱情的地方，晚餐真的值得事先預約，前往一嚐。
 Tang ,https://www.google.com/maps/contrib/103460574067592523789/reviews?hl=zh-TW,5,True,116,"今日鮮魚丼$160(平日中午限定)
太久沒吃生魚片了
很感動在台灣可以無時無刻吃到便宜又新鮮的海產料理
另外加點了干貝和天使蝦
各$70
干貝的鮮甜真的讓人很感動！
可以點看看
今日坐我旁邊的上班族
可能是常客
讓我知道了
飯可以續加湯可以續點
但是！但是！
用餐時間只有40分鐘
不要耽誤到下一組客人
很謝謝店員提醒吃飯很慢的我
下次可以挑戰吃吃看其他系列！"
 Noel Lu ,https://www.google.com/maps/contrib/106968682859980755580/reviews?hl=zh-TW,5,False,6,料多美味又新鮮，超值！味噌湯超好喝的👍
 Thomas Tian ,https://www.google.com/maps/contrib/117407460718965458386/reviews?hl=zh-TW,5,False,62,丼飯新鮮美味，味噌湯料多好喝而且不像很多店很鹹，重點是可以續而且續湯也是料滿滿，讚
 YiaMei ,https://www.google.com/maps/contrib/116358559629448949350/reviews?hl=zh-TW,5,False,21,"圖為炙燒盛合丼，這家的炙燒醬塗的不多，但更能吃到魚的原味，不過如果熱愛炙燒醬的人可能會有點失望。

但生魚片真的新鮮的沒話說，也給的很大方！同行女性友人點了旨丼，飽到吃不完拜託我幫忙，我自己也很飽，但真的捨不得浪費這超級新鮮的生魚片努力幫忙吃掉，就知道老闆給的份量一點也不小氣。

還有隨餐附送的味增湯，裡面也是滿滿的魚片，湯超級「鮮甜」，真的會喝到有點淡淡的甜味充滿口腔，超愛，要不是飽到不行絕對想再續一碗（免費續湯）。

CP值高到我都不太想分享給大家，因為店內位置不多，超怕以後變成排隊名店吃不到。"
 LiJHE Chen ,https://www.google.com/maps/contrib/104811486222488616773/reviews?hl=zh-TW,5,True,34,"東西好，湯濃郁，可惜位子設計的比較差。一坐上去去敲到膝蓋痛到哭
不過仍是瑕不掩瑜！"
 Leah Feng ,https://www.google.com/maps/contrib/112566255619006737530/reviews?hl=zh-TW,5,True,52,"新鮮又好吃價錢也很便宜
味增湯認真有料、蝦頭
已經太推啦"
 郭雅如 ,https://www.google.com/maps/contrib/114966738046866048371/reviews?hl=zh-TW,5,True,46,"完全符合一間日本料理店的水準
魚蝦量給的不吝嗇肉質口感很脆很鮮甜
如果菜單上不知道要吃什麼還可以點勝手丼
自己搭配食材吃自己想吃的丼飯這點很吸引我
能夠客製化真的很棒👍🏽
餐廳座位只有九個
因此排隊要有耐心
此外食材沒了就不會再接客了
這次去吃大概七點出頭就不接了
所以要吃的饕客們要儘早來"
 Vic Chen ,https://www.google.com/maps/contrib/101260407460282559407/reviews?hl=zh-TW,5,True,112,"為了要吃只好早一點來排隊
不然吃不到怎麼辦
畢竟賣完就沒了

然後老闆說他們不是以食材跟服務取勝

是靠顏值"
 Chuang Yu-Chen ,https://www.google.com/maps/contrib/101935806769558281835/reviews?hl=zh-TW,5,True,30,太好吃了，完全能夠明白為什麼這麼多人願意在開店之前，就開始排隊了
 Patrick Hsu ,https://www.google.com/maps/contrib/101572375185733873926/reviews?hl=zh-TW,5,True,84,"非常好吃價格合理cp值高
缺點是座位少排隊人多
目前防疫期間不知有沒有提供外帶"
 S.B. Chen ,https://www.google.com/maps/contrib/110512551670708496395/reviews?hl=zh-TW,2,False,34,晚餐的無菜單有空間更好~
 Lynn Chen ,https://www.google.com/maps/contrib/110838134273969694130/reviews?hl=zh-TW,5,False,6,"來第二次了，給料依舊佛心到不行(比目魚鰭邊肉！)
味增湯改良後更鮮美好喝了！
重點是好飽啊啊啊啊啊啊啊啊！"
 Sally ,https://www.google.com/maps/contrib/109120103658962637600/reviews?hl=zh-TW,5,False,16,食材新鮮，美味可口
 蕭小姐 ,https://www.google.com/maps/contrib/110669833549809320740/reviews?hl=zh-TW,5,False,7,"海膽新鮮，全部生魚片新鮮肥美很厚，入口即化。
只要有空，一定都會帶朋友去吃！
非常推薦饕客❤️"
 黃少暐 ,https://www.google.com/maps/contrib/114690980902080488578/reviews?hl=zh-TW,5,True,14,"今天點了炙燒盛合丼，只能說CP值爆表了👍
每樣食材都很新鮮，味增湯現煮還可以續碗也太佛，這地段還有這種價位真的是找不到；用餐環境也夠乾淨，位置雖少也需要排隊，但是為了可以維持水準，這點是可以接受的，感覺真的沒什麼好挑剔，只能給💯"
 Cassandra Chen ,https://www.google.com/maps/contrib/109122815193844155679/reviews?hl=zh-TW,5,True,15,"超好吃生魚丼!!!
食材新鮮，老闆親切!店內座位小而巧~
鮮魚味噌湯，大推!!從來沒喝過料這麼豐富的湯，還可以續湯，續湯的料依舊實在!!
五星大推♡♡♡"
 Spike Chu ,https://www.google.com/maps/contrib/105849803107582931426/reviews?hl=zh-TW,5,True,19,近期名店，豪華大滿足丼果真份量十足，每一樣食材入口都可感受極新鮮的程度，味增湯還含了蝦頭下去熬煮（使用我丼飯內的蝦頭）超級鮮美，而且無限續碗，簡直比扯鈴還扯，除了位置少要現場排之外沒有任何缺點名不虛傳的好店
 yanng ping ,https://www.google.com/maps/contrib/109846460535449883856/reviews?hl=zh-TW,5,True,37,意外經過發現這間，第一次嘗試後讓我印象深刻！CP值不錯高！點丼飯還會送湯！湯也是很好喝！可惜沒拍到！有機會會再去吃～
 Irene Chen ,https://www.google.com/maps/contrib/112147554537698675139/reviews?hl=zh-TW,5,False,9,"食材很新鮮我平常不太吃生魚片也很愛❤️
味噌湯料很多很實在～用蝦頭熬的湯頭很鮮甜超好喝👍🏻👍🏻👍🏻👍🏻👍🏻
價格又親民～～～整個CP值爆高呀～～～～
每次吃完都覺得大大滿足"
 鄭博仁clark88.cheng ,https://www.google.com/maps/contrib/108383150417859448431/reviews?hl=zh-TW,5,True,67,好吃沒踩雷...共去了3次.吃了2次.品質穩定.推
 RUOLIN KUO ,https://www.google.com/maps/contrib/100979797775100358681/reviews?hl=zh-TW,1,True,70,老闆一邊向上一組客人收錢，一邊轉身手捏壽司、抓蔥花，手都沒洗，不然就是隨便沖水兩下，非常不衛生，在吧台前觀察了很久，對於已經吃下肚的東西只能一邊安慰自己應該無妨，紙鈔跟硬幣的細菌很多，特別這裡販賣的都是生食，應該特別注意吧，尤其現在還是疫情期間，病毒會在紙鈔上活存數小時，這是一般人都有的常識吧，再好吃也不敢回訪了（怕）建議老闆應該裝設投幣機或是請一位外場收錢。
 yu yu ,https://www.google.com/maps/contrib/100950883900947866622/reviews?hl=zh-TW,5,False,7,"好朋友推薦果然是好吃😋
一間店把隨餐附贈的湯做到這樣不得不稱讚了～～～～海鮮味增湯超鮮又料多👍重點是可以續碗呀！"
 Tiffany Lan ,https://www.google.com/maps/contrib/111362995118354725972/reviews?hl=zh-TW,5,False,5,吃生魚丼超好吃湯也很好喝老闆很大方加湯還加很多魚肉
