user_name,user_profile_url,rating,local_guide,comment_num,comment_text
 李彩瓊 ,https://www.google.com/maps/contrib/105396806958210671455/reviews?hl=zh-TW,5,False,53,"大推！生魚片厚實新鮮，好吃！鮮蝦大大一隻，新鮮Q彈！完勝！！
230元的價錢，老闆實在太佛心了，味增湯料多味美，還可續湯，完美"
 Yf L ,https://www.google.com/maps/contrib/106761565261036335228/reviews?hl=zh-TW,5,True,108,真的是好吃到吃完整天心情都很好，整個鮮味、湯頭、品質比活美燈立高級多了~~~醋飯也是沒吃過這麼粒粒分明又不會太甜，超級大推
 莊佳瑜 ,https://www.google.com/maps/contrib/106182079223415693692/reviews?hl=zh-TW,5,True,47,CP值蠻高的，價格不貴，食材新鮮，味增湯超豐富超好喝，唯一的缺點是他只有9個位子，不能訂位，所以好幾次我5點去排隊都要7點才能吃到
 林群易 ,https://www.google.com/maps/contrib/115162574143482930316/reviews?hl=zh-TW,5,True,20,"魚料新鮮、厚度夠
飯煮的恰到好處
味噌湯又鮮甜
整體份量夠，重點是好吃
以它的價位來說，太超值了！"
 大頭海水愛好者 ,https://www.google.com/maps/contrib/111159184147004640043/reviews?hl=zh-TW,2,False,703,好吃，新鮮，便宜CP值破表，老闆很有個性，常客滿位置少是缺點，最近取消外帶，只能內用，明明位子就只有幾個，大熱天還要客人在外面等，還取消外帶只能內用，這根本忽視客戶權益與服務品質，原本五顆星評價直接扣掉剩兩顆，以後不會再去了。
 wow小史 ,https://www.google.com/maps/contrib/106726425279800930539/reviews?hl=zh-TW,5,True,50,食物，新鮮好吃，吃完有幸福的感覺。
 ciao you ,https://www.google.com/maps/contrib/105657017502894281059/reviews?hl=zh-TW,5,False,19,胭脂蝦好濃郁，胭脂蝦頭煮的味噌湯蝦味也很濃厚，下次想試葡萄蝦或豪華大滿足！
 小葉 ,https://www.google.com/maps/contrib/117725709462155761124/reviews?hl=zh-TW,5,True,126,"CP值超高的生魚片丼飯專賣店
平日中午限定160丼飯還附湯
老闆味噌湯非常好喝
裡面還有很多料
（蘿蔔蛤蜊魚肉約4片偶爾有蝦頭）
湯頭甜又鮮千萬不要錯過了
生魚片也非常新鮮
講求食材內用位子不多
喜歡炙燒的非常推薦
老闆炙燒功夫蠻好
提醒大家店家沒有預約
想吃的提早來排隊吧"
 wang Frank ,https://www.google.com/maps/contrib/109028338977448613688/reviews?hl=zh-TW,5,False,3,食材新鮮好吃，不是像其他店家的生魚片充滿難咬的筋
 Joe H. ,https://www.google.com/maps/contrib/112843597526160420159/reviews?hl=zh-TW,5,True,611,這間店的地址實在風水不好，過去沒有店家可以撐超過兩年。但是憑著食材和料理的硬實力，這間丼飯做到了，我尤其喜歡它的散壽司，好吃。
 WY C ,https://www.google.com/maps/contrib/113426225322845650137/reviews?hl=zh-TW,5,False,17,"本來以為丼飯都差不多沒有太期待，這一次去吃真的驚為天人～～比小六好吃cp高
1.鮭魚親子丼飯
鮭魚每片都軟嫩入口即化，油脂分布平均大小也是，是我近期吃過最好吃的生魚片，玉子燒比錦市場的好吃太多😍
2.炙燒生魚片丼飯
魚烤的超香又鮮甜，並且多樣化，擺盤美又大份
3.味增湯
真的超好喝QQ老闆有注意到越煮越鹹，所以會等客人入座點好後才加熱，會有大片的魚肉白蘿蔔，喝起來鮮甜不死鹹還可以無限續喝

用餐環境乾淨，雖然是吧台不至於像部分拉麵店連走道都犧牲
老闆注意很多小細節切生魚片的刀功會大大影響生魚片的口感，再新鮮的生魚片沒有好的刀功都是徒然，老闆就是有這功力跟日本職人的細心，可以理解為什麼天天都排隊了，在離峰時來吃可以避開排隊人潮"
 Emilia ,https://www.google.com/maps/contrib/106584534445189998066/reviews?hl=zh-TW,5,True,19,新鮮平價好吃CP值超高
 台北日本職人店面大搜查 ,https://www.google.com/maps/contrib/104699999623714929993/reviews?hl=zh-TW,5,True,419,"～嚐過絕對讚不絕口！來過絕對不會後悔！～
🍣食材的新鮮份量的滿足遠遠超過價格的付出！
經🇯🇵日本友人介紹來到這間躲在國賓飯店後面的小店以為就是一般的丼飯小屋當裝滿🐟🦐海鮮的魚蝦誇張的填滿在碗內還以爲置身在日本築地市場一般只見吧台前的師傅熟練的手法製作出一道道的海鮮丼送到客人眼前當大家瞪大眼思考要怎麼開始吃這碗海鮮丼門口早已排成一條長龍...感謝店家提供這麼優惠💰價格讓大家都能吃到這碗💖幸福的海鮮丼飯！
2020.05.28"
 sharemate66@hotmail.com金艾花 ,https://www.google.com/maps/contrib/112970953088279351321/reviews?hl=zh-TW,4,True,389,就是好吃新鮮16:50就要去排隊不然要等很久還有限時用餐要吃快一點像我習慣慢慢吃每次吃到後來都要隨便吃吃了事無法好好品嚐湯可續碗不要忘記可以續湯因為湯裡有鮮美鱼塊哦
 Guanwen Chen ,https://www.google.com/maps/contrib/109085832232361717436/reviews?hl=zh-TW,5,True,34,真的好好吃🥺味噌湯也好好喝
 Peggy Kao ,https://www.google.com/maps/contrib/113029476877019419359/reviews?hl=zh-TW,5,False,33,"大台北地區很少有cp值那麼高的生魚片丼飯😍😍
新鮮又好吃
唯一缺點是排隊要等很久～～但還是值得五顆星"
 Lily Zhan ,https://www.google.com/maps/contrib/112185609126773899020/reviews?hl=zh-TW,3,False,38,湯真的是十分大方，裡頭有許多料，又可續湯，美中不足的是點的丼飯的飯有點太酸，但不知道是不是日本當地風味就是如此，但以價格來說算滿實惠的
 Chich Liu ,https://www.google.com/maps/contrib/118197967695530020568/reviews?hl=zh-TW,5,True,16,CP值超高˙˙˙食材可口˙˙˙推˙˙˙有空再去品嚐美食。
 Monica Lee ,https://www.google.com/maps/contrib/101885532650955603317/reviews?hl=zh-TW,5,False,17,今天第二次到訪，一樣幸運的一人好入座，醋飯跟湯都沒有第一次感覺稍甜，覺得剛剛好，魚材一樣新鮮美味，謝謝款待。
 ChunChun Chun ,https://www.google.com/maps/contrib/102481811729709299653/reviews?hl=zh-TW,4,True,12,炙燒盛和丼味增湯玉子燒👍🏻👍🏻👍🏻
 Rick ,https://www.google.com/maps/contrib/115978697178395374787/reviews?hl=zh-TW,5,True,17,生魚片、蝦子及魚卵新鮮又大塊，而且續的湯料還如此澎湃！！真的給六顆星都不為過～
 Audrey Chou ,https://www.google.com/maps/contrib/101514492915898171712/reviews?hl=zh-TW,5,True,29,因為疫情影響剛好吃到外帶丼飯，第一次吃，令人為之驚艷，食材新鮮，口齒留香，附贈的味增湯也完全不敷衍，真材實料，值得一再回訪。
 B Mr. ,https://www.google.com/maps/contrib/103160795023150788956/reviews?hl=zh-TW,5,True,98,目前全台北市吃過數一數二的好吃海鮮丼飯
 黑 ,https://www.google.com/maps/contrib/104535797759770627797/reviews?hl=zh-TW,5,True,44,"推！生魚片給的大方，份量足，湯加入蝦頭很爽，湯和飯都可續，還可以客製化餐點，怎麼這麼爽～

個人總體評價：77"
 陳欣熊 ,https://www.google.com/maps/contrib/107264247990156603833/reviews?hl=zh-TW,5,True,23,生魚片新鮮好吃，價錢實在，味增湯非常好喝濃郁，很值得來嘗試
 Louis Lu ,https://www.google.com/maps/contrib/117135124132543658526/reviews?hl=zh-TW,5,False,16,食材新鮮美味價格實惠
 林珈佐 ,https://www.google.com/maps/contrib/116358118422263176418/reviews?hl=zh-TW,5,False,15,大滿足丼+單點，老闆還會貼心詢問是否放在丼飯上，原本還有點7貫，老闆也說等我們吃完丼飯再決定要不要上☺️感受到老闆愛惜食材的心❤️食材新鮮，是一間絕對值得回訪的好店👍👍
 Rod Huang ,https://www.google.com/maps/contrib/109239627655523003349/reviews?hl=zh-TW,5,True,315,生魚片，天使蝦都很好吃，特別推味增湯，料多味美還可以再來一碗，讚！
 Xanthe LI ,https://www.google.com/maps/contrib/114997281658792488058/reviews?hl=zh-TW,5,True,18,"味增湯非常豐富在晚上暖暖的喝下一碗真的超滿足
丼飯也很好吃
最讓我喜歡的是炙燒鮭魚壽司真的很甜好吃QQ"
 009陳翌誠 ,https://www.google.com/maps/contrib/110432618594188058456/reviews?hl=zh-TW,1,False,9,笑死超爛去了店裏沒客人還說客滿有人預約不會把鐵門拉下來嗎不懂做生意？
 Jojo Lin ,https://www.google.com/maps/contrib/104378018234657881016/reviews?hl=zh-TW,5,True,178,超級新鮮！干貝很大顆！
 annisui ,https://www.google.com/maps/contrib/103892073093983625564/reviews?hl=zh-TW,5,True,81,"排隊是值得的！
驚喜滿足的一餐尤其是他們的味噌湯！"
 Li Jyun Chen ,https://www.google.com/maps/contrib/107553179100717943262/reviews?hl=zh-TW,5,False,5,生魚片新鮮是基本，醋飯上來時溫度剛好，味增湯表現也非常好，價格也很親民👍👍
 Leader Liou ,https://www.google.com/maps/contrib/110699931836061435369/reviews?hl=zh-TW,4,True,522,"店裡只有老闆一個人做料理
需要耐心等候
跟朋友一起來最好多準備一些話題
以免冷場
情緒管理不穩定的人不適合到這裡用餐

整體而言
不論用餐環境
料理擺設新鮮程度都有水準

只有九個位子人多來店家比較不好安排
建議要有B方案(也就是先想好其他用餐地方)"
 簡詠恩 ,https://www.google.com/maps/contrib/108471757059845857468/reviews?hl=zh-TW,5,True,21,很新鮮很好吃，湯很好喝
 DISCOVERY201 ,https://www.google.com/maps/contrib/106133073672892074088/reviews?hl=zh-TW,5,False,9,出餐速度快鮭魚片有夠厚湯好喝又有料還可以續只是位置少要提早去排對
 michelle huang ,https://www.google.com/maps/contrib/109263682175304034341/reviews?hl=zh-TW,5,True,37,超值美味，附贈的湯令人驚豔，不僅是現煮的，續湯還有魚肉在裡頭；炙燒盛合丼內的每個食材皆新鮮好吃，不過是店內位置較少、用餐時間較短（40分鐘），需提前來候位。
 光 ,https://www.google.com/maps/contrib/112909248407005316721/reviews?hl=zh-TW,5,False,4,太好吃了！但店面小稍微晚一點不是吃不到就是等很久但幸福感真的是其他店家無法比擬的
 克利斯 ,https://www.google.com/maps/contrib/109468100364658840756/reviews?hl=zh-TW,5,True,20,非常好吃生魚片鮮的不可思議本來不喜歡吃海膽的我都新鮮到有甘甜的感覺了很值得多去幾次
 陳怡寧 ,https://www.google.com/maps/contrib/103428925516271818349/reviews?hl=zh-TW,5,False,34,"東西新鮮，價格實在，師傅親切，會讓人想一再回訪的小店！
重點是，吃到今天最後一份，好開心🥳🥳🥳"
 Stanley Wu ,https://www.google.com/maps/contrib/102887146692554938578/reviews?hl=zh-TW,5,False,2,經過很多次，第一次踏進本店，結論⋯還好有進去。食材已超越價格，好吃😋真的很讚，希望老闆繼續堅持⋯加油！
 台北日本職人店面大搜查 ,https://www.google.com/maps/contrib/105045440086420996896/reviews?hl=zh-TW,5,True,40,真材實料湯頭鮮美每到開業必人龍綿延店主真心烹煮海鮮料理平價的供應消費者值得一訪！🍎
 Bin Jerry ,https://www.google.com/maps/contrib/111941701517466734899/reviews?hl=zh-TW,1,False,30,真的變好貴支持不下去
 Funny ,https://www.google.com/maps/contrib/112260347171619950940/reviews?hl=zh-TW,4,True,84,"CP值真的好高！排隊排得值得！
湯裡面的料也是很大方的再給還想在二訪！
（壽司也好吃但吃完這一碗就已經飽到快吐了）"
 丁噹噹噹 ,https://www.google.com/maps/contrib/109067556324244419629/reviews?hl=zh-TW,5,False,8,多種配色，看了食指大動😝😝老闆相當客氣😄😄
 Amy Cheng ,https://www.google.com/maps/contrib/111228943073003629566/reviews?hl=zh-TW,5,False,16,"相當好吃！新鮮！還有時令餐，味噌湯可以續碗！
可以外帶，吃起來過癮度很高，還會再去吃！"
 Wang Athena ,https://www.google.com/maps/contrib/114701591831517344670/reviews?hl=zh-TW,5,False,14,CP值很高！炙燒丼很好吃，食材很新鮮，搭配的湯很有誠意，還可以續湯，會再來♥️
 Izume Morino ,https://www.google.com/maps/contrib/103863202348044990247/reviews?hl=zh-TW,5,False,5,食材新鮮，湯用料大方
 Raymond Luan ,https://www.google.com/maps/contrib/100503584192033418073/reviews?hl=zh-TW,5,True,92,材料新鮮，尤其是味噌湯，CP值相當高
 Jimmy Chen (Jimmy) ,https://www.google.com/maps/contrib/108712415497093282487/reviews?hl=zh-TW,4,True,66,"坐位只有8個
所以想吃的人
建議下午4點就要去排隊
生魚片算便宜"
 Katherine Lu (Ljumeg) ,https://www.google.com/maps/contrib/112055479280422246218/reviews?hl=zh-TW,5,True,34,很好吃，魚很新鮮！玉子燒也很成功，附贈的湯很豐盛
 藍趴趴 ,https://www.google.com/maps/contrib/112739635333580616583/reviews?hl=zh-TW,5,False,16,排隊候位請準時，旨丼滿足好品質
 陳科全（科科） ,https://www.google.com/maps/contrib/117375265273541302423/reviews?hl=zh-TW,5,True,146,"價格親民用料實在真的美味
內用的湯可以一直續
而且超大碗料超多
老闆很親切的服務態度
超級推薦"
 ShenXu ,https://www.google.com/maps/contrib/101193893787448689916/reviews?hl=zh-TW,5,True,147,全台北最好吃的生魚片蓋飯
 vivi vivi ,https://www.google.com/maps/contrib/103676420071148816920/reviews?hl=zh-TW,5,True,120,食材新鮮、老闆專業又親切
 林維治 ,https://www.google.com/maps/contrib/102481074207993405716/reviews?hl=zh-TW,5,True,17,好吃且要先排隊登記的餐館，料好實在~
 高成章 ,https://www.google.com/maps/contrib/106460352216680360731/reviews?hl=zh-TW,5,True,410,好吃、新鮮，價高、合理！
 Paul JI ,https://www.google.com/maps/contrib/107147844823986249825/reviews?hl=zh-TW,5,True,81,醋飯好吃
 八珍玉食 ,https://www.google.com/maps/contrib/102814743233969348276/reviews?hl=zh-TW,5,True,150,"以這價位來說，生魚片份量很足了。
高腳椅實在難坐，不舒服。"
 LINPING FANG (Anne Fang) ,https://www.google.com/maps/contrib/106067419389308349731/reviews?hl=zh-TW,5,True,81,生魚片新鮮又大塊，味增湯是現煮的，還可以續湯，CP值很高
 Sharon Hung ,https://www.google.com/maps/contrib/109997653054187264246/reviews?hl=zh-TW,5,False,6,隱身巷弄裡的美食，味增湯料多實在大碗，生魚片丼飯魚片切很厚，誠意十足！且又不貴～👍
 Isaac LIN ,https://www.google.com/maps/contrib/111963113250186151186/reviews?hl=zh-TW,5,True,30,座位少，東西好吃
 林林繼聖 ,https://www.google.com/maps/contrib/113986264242481438804/reviews?hl=zh-TW,1,False,2,爛，好聲好氣詢問現場有無位置，沒位置願意現場等，結果換來一句超沒禮貌的兩位今天沒有了？？？？？？？？，你語氣這麼秋，祝你生意興隆。
 林彥安 ,https://www.google.com/maps/contrib/105391849556809085881/reviews?hl=zh-TW,1,False,4,等候機制需改進，建議告示牌可以立在門前，不然排隊人潮會擋住貼在門上的告示，或是工作人員可以定時出來提醒。
 Joe Weng ,https://www.google.com/maps/contrib/114192307953375667893/reviews?hl=zh-TW,4,True,235,丼飯很好吃，附的味增湯也不錯喝，可續，缺點要排隊！
 Joyce Lee ,https://www.google.com/maps/contrib/113402581898159335244/reviews?hl=zh-TW,5,True,19,超好吃好吃到特地來寫評論便宜食材又新鮮吃一口整個大海就在嘴巴裡了相見恨晚
 IC Chen ,https://www.google.com/maps/contrib/110732288903520133763/reviews?hl=zh-TW,5,True,72,東西好吃，以這價位來說滿划算的。座位少，不過值得等待。
 陳聖豐 ,https://www.google.com/maps/contrib/117396598455109355632/reviews?hl=zh-TW,1,False,8,開門你店員很跩的說，有預約嗎？我們說了句沒有，更跩直接講那沒有了，不好意思不會講就算了，語氣有必要這麼秋？
 黃敏嘉 ,https://www.google.com/maps/contrib/114593589591876119042/reviews?hl=zh-TW,1,True,33,"員工訓練欠佳
打電話詢問餐點現況態度兇巴巴
好像是我欠他錢"
 geroro12 ,https://www.google.com/maps/contrib/118377013275776899379/reviews?hl=zh-TW,4,True,88,真的值得來吃，位子只有9位，但食材新鮮，飯可以加飯，湯也可以續湯
 胡candy ,https://www.google.com/maps/contrib/112789690015944432048/reviews?hl=zh-TW,5,False,4,便宜新鮮又好吃，cp值高，不想排隊11:20就要先到唷～
 KT Chien ,https://www.google.com/maps/contrib/104395477216196691887/reviews?hl=zh-TW,1,True,16,只是開門詢問是否有空位，但態度好像欠他錢，不知到在秋條幾點。祝福不會倒閉
 Young 漾 Chen ,https://www.google.com/maps/contrib/115342029550107442017/reviews?hl=zh-TW,4,True,192,有日本的格局，食材感覺老闆用心，免費續湯。要預約哦。
 Tina Tseng ,https://www.google.com/maps/contrib/103677847818088996018/reviews?hl=zh-TW,5,True,241,美味又划算，超新鮮，味增湯料很多還可以續，佛心店家
 Yi-Hsuan Lu ,https://www.google.com/maps/contrib/112738336270555564643/reviews?hl=zh-TW,5,True,42,"新鮮的海鮮+恰到好處的醋飯
附上真材實料超美味的味噌湯
太滿足了！"
 祺祥林 ,https://www.google.com/maps/contrib/105217566497005673525/reviews?hl=zh-TW,5,True,2,"新鮮又美味，
服務很親切，
價位超平民，
要吃就趁早，
晚了吃不到。"
 LingFang YEN ,https://www.google.com/maps/contrib/110196732750763457923/reviews?hl=zh-TW,5,True,28,食材超鮮！CP值超高！目前吃到最優秀的生魚片料理~
 Hui Ling Lee ,https://www.google.com/maps/contrib/108344133865728452235/reviews?hl=zh-TW,5,True,161,撲空兩次這次早點來排隊終於吃到了😆但也趕上了八月漲價ㅠ.ㅠ
 wei Li ,https://www.google.com/maps/contrib/104517744864402193485/reviews?hl=zh-TW,5,True,78,食材非常新鮮，但要需要現場候位，不適合趕時間的人
 黃柏智 ,https://www.google.com/maps/contrib/103097461526242110750/reviews?hl=zh-TW,1,True,57,態度超差不會再回訪
 啾啾力 ,https://www.google.com/maps/contrib/113579957599120363578/reviews?hl=zh-TW,5,False,43,"Cp值沒話說很新鮮讚
免服務費續味增湯還有料老闆佛心"
 Youjia Chen ,https://www.google.com/maps/contrib/114836874960242603073/reviews?hl=zh-TW,5,True,20,"丼飯CP值很高，味增湯無限續料又很有誠意👍🏻
收錄口袋名單"
 Liz ,https://www.google.com/maps/contrib/114353106730262574661/reviews?hl=zh-TW,5,False,24,"便宜實惠東西新鮮推薦品嚐
內用坐為不多需候位等待"
 龔旭恒 ,https://www.google.com/maps/contrib/116393815700220472404/reviews?hl=zh-TW,5,True,163,食材美味有新鮮，才千元不到就可以盡享美食，優質浪漫
 徐士航 ,https://www.google.com/maps/contrib/109930941965826514248/reviews?hl=zh-TW,5,True,78,就好吃，要排隊
 Enhui Wu ,https://www.google.com/maps/contrib/109993027838694507412/reviews?hl=zh-TW,5,True,40,位置很少排隊排很久，你們別來了！我來幫忙吃就好。
 Liang Chen ,https://www.google.com/maps/contrib/112429681026991771593/reviews?hl=zh-TW,5,True,18,吃好幾次了就是新鮮就是讚！
 Regigi ,https://www.google.com/maps/contrib/112998236747234770770/reviews?hl=zh-TW,5,True,67,魚肉經過稍微的炙燒，濃香的油脂滲透到飯中，喔，美味到飛上天.大推🤗👍👍👍
 CL ,https://www.google.com/maps/contrib/113388556969170439231/reviews?hl=zh-TW,5,True,64,新鮮好吃
 YAO CHEN ,https://www.google.com/maps/contrib/104883046297187087172/reviews?hl=zh-TW,1,False,14,營業時間到2:00，1:30到就說不接單，那可以麻煩更改一下資訊嗎不然千里迢迢來卻撲了個空
 羽羽 ,https://www.google.com/maps/contrib/112524081982175218259/reviews?hl=zh-TW,5,False,30,"160元的生魚丼，CP值超高
還有料多實在的味增湯👍👍"
 Yu Lovin ,https://www.google.com/maps/contrib/104174127545267565771/reviews?hl=zh-TW,5,True,547,"真的有夠棒的，太好吃了
而且質量並重
飯和湯也一樣講究"
 中山下智久 ,https://www.google.com/maps/contrib/111954183658368315632/reviews?hl=zh-TW,3,False,31,我準時請你也準時上組客人沒走怪我嘍害我晚點餐也晚上餐然後我要準時走？
 董澤宏 ,https://www.google.com/maps/contrib/112205384869775257952/reviews?hl=zh-TW,4,True,108,座位太少，扣了一顆星。餐點CP值頗高阿
 Kiri Chen ,https://www.google.com/maps/contrib/104916271871677534087/reviews?hl=zh-TW,3,True,33,今天特別去買，七點初就打烊了，殘念啊！
 weichin Chang ,https://www.google.com/maps/contrib/115868076981046681862/reviews?hl=zh-TW,5,False,3,很棒，肉大塊、湯多料還可以續，高CP值!!!
 Gray SUN ,https://www.google.com/maps/contrib/100695663327352413500/reviews?hl=zh-TW,5,False,17,規則很清楚，不爽的可以不要來吃，絕對是你的損失
 YuFan Lin ,https://www.google.com/maps/contrib/116358129311267133767/reviews?hl=zh-TW,5,False,53,好吃，味噌湯不可思議
 CJ ,https://www.google.com/maps/contrib/111170742521853892931/reviews?hl=zh-TW,5,False,9,雖然上菜的時候不小心打翻了但東西還是很好吃推推
 Zhi-Qiang You ,https://www.google.com/maps/contrib/109527841105854200192/reviews?hl=zh-TW,5,False,5,大碗滿意超好喝的味噌湯可以一直續
 海海 ,https://www.google.com/maps/contrib/111946580816048952972/reviews?hl=zh-TW,5,True,39,"份量超值
座位少但是大家都吃很快
現場排隊"
 李老師 ,https://www.google.com/maps/contrib/104903557382069543642/reviews?hl=zh-TW,5,False,51,"排隊非常值得
很好吃！！！
味增湯真的非常厲害"
 Wang Simon ,https://www.google.com/maps/contrib/103928210625940199434/reviews?hl=zh-TW,5,True,"1,085",好吃划算，就是要開門之前排隊不然等很久
 陳建彰 ,https://www.google.com/maps/contrib/113810936466375952654/reviews?hl=zh-TW,5,True,81,就一句話我會再訪
 River Ho ,https://www.google.com/maps/contrib/116962978982844219821/reviews?hl=zh-TW,5,False,17,很好吃，價格實惠，大家不要再去了，不然我去都沒位子。
 YUAN ,https://www.google.com/maps/contrib/112019593644169619485/reviews?hl=zh-TW,5,True,265,"食物好吃
服務親切"
 一滴歪 ,https://www.google.com/maps/contrib/114949946075755702938/reviews?hl=zh-TW,5,True,108,CP最高是旨丼，蝦湯無限喝，建議中午來吃
 Gary Lin ,https://www.google.com/maps/contrib/112782259430336270090/reviews?hl=zh-TW,5,True,202,食材新鮮，平價美食
 姚恒毅 ,https://www.google.com/maps/contrib/111089191646637360060/reviews?hl=zh-TW,5,True,238,讚！
 萊恩 ,https://www.google.com/maps/contrib/117592631536872363796/reviews?hl=zh-TW,1,False,2,爛透了，只准少位客人進去吃，其他後面一律不接
 盛方揚 ,https://www.google.com/maps/contrib/115546473196130217106/reviews?hl=zh-TW,5,True,16,食材新鮮且有服務熱忱，搭配自由度高，價格實惠
 Janie Chen ,https://www.google.com/maps/contrib/100782711778641005677/reviews?hl=zh-TW,4,True,280,"好吃！
要提早來劃位然後還是要等"
 樂樂 ,https://www.google.com/maps/contrib/115095802881063332197/reviews?hl=zh-TW,5,True,199,"主餐會付湯，魚肉很大塊，丼飯可續飯
湯也無限續"
 廖敏妤 ,https://www.google.com/maps/contrib/116296244475766017793/reviews?hl=zh-TW,5,False,7,好吃！剛開店10分鐘不到就客滿了
 廖恩泰 ,https://www.google.com/maps/contrib/111316804061325964406/reviews?hl=zh-TW,5,False,14,鮭魚親子好吃！附送的味噌湯超棒🙌🏻
 Chen dennis ,https://www.google.com/maps/contrib/104098710682477937986/reviews?hl=zh-TW,5,True,47,好吃～令人驚豔
 張凱（Chang Kai） ,https://www.google.com/maps/contrib/106466787195147682944/reviews?hl=zh-TW,3,True,33,看得到吃不到，原因沒有先登記卻在旁排了將近一小時隊
 SE VEN ,https://www.google.com/maps/contrib/108010297331668893673/reviews?hl=zh-TW,5,False,45,"東西很好吃
但夏天店內真的偏熱
容易流汗"
 吉貴興 ,https://www.google.com/maps/contrib/104337638602637521958/reviews?hl=zh-TW,3,True,199,路過，未品嚐。應該是好吃，排隊要一陣子。
 Anco Chen ,https://www.google.com/maps/contrib/112694424244978072049/reviews?hl=zh-TW,4,False,17,食材新鮮，味增湯的蝦味很棒！
 randy chen ,https://www.google.com/maps/contrib/102045496903373052252/reviews?hl=zh-TW,5,False,17,"如此的價位與食材，佛心無誤
祝店家生意興隆"
 賴尚青 ,https://www.google.com/maps/contrib/106109084348086520118/reviews?hl=zh-TW,5,True,81,湯很厲害
 Wendy ,https://www.google.com/maps/contrib/106313185182789039826/reviews?hl=zh-TW,5,False,14,免費續的魚片蛤蜊味噌湯超級無敵好喝！
 廖俊傑 ,https://www.google.com/maps/contrib/105397102281660888070/reviews?hl=zh-TW,5,True,443,"喜歡自選的丼飯！
我依照個人喜好CP值很高"
 班傑明 ,https://www.google.com/maps/contrib/112943409642929306436/reviews?hl=zh-TW,5,False,5,物超所值，食材新鮮，老闆太佛心
 WEIJYH LIN ,https://www.google.com/maps/contrib/106481497186846973352/reviews?hl=zh-TW,5,True,16,值得排隊等候的美食體驗
 Aden Huang ,https://www.google.com/maps/contrib/111906324766418312927/reviews?hl=zh-TW,5,True,"1,098",簡直是我心目中庶民版的小野二郎。
 Layla Hsu ,https://www.google.com/maps/contrib/104551670759067642127/reviews?hl=zh-TW,5,False,11,推ㄧ下.希望能開很久很久很久.這樣才吃很久很很久
 24蔡以仁 ,https://www.google.com/maps/contrib/105411367480207197710/reviews?hl=zh-TW,5,False,42,這裡的食物好吃有特色非常推薦
