user_name,user_profile_url,rating,local_guide,comment_num,comment_text
 CW ,https://www.google.com/maps/contrib/103548456945961649813/reviews?hl=zh-TW,5,True,187,"週末營業前15分鐘來排隊，大約等了40分鐘入座
味噌湯和醋飯可續，湯加了蝦頭，鮮味十足，喝個兩碗不是問題
生魚片都是新鮮的，沒有腥味
唯一可惜的是海菜蠻多的，剛好我又不太喜歡這味道，感覺會蓋掉魚片的鮮甜"
 王品娟 ,https://www.google.com/maps/contrib/113602698720033976972/reviews?hl=zh-TW,5,False,4,$1080可以吃到瑩烏賊、葡萄蝦、鮪魚赤身、鮪魚中腹、一夜乾、比目魚鰭邊、海膽鮭魚卵⋯⋯真的是物超所值，每一口都很驚艷，尤其是蝦殼飯，同行的朋友一開始還在想說葡萄蝦怎麼沒有連同蝦膏一起，沒想到蝦頭直接包飯變成蝦殼飯，除了蝦囊以外都能吃，吃到蝦膏的時候簡直要升天了。此外，比目魚鰭邊讓我發現原來壽司飯不是單純拿來增加飽足感，而是比目魚鰭邊的油脂讓飯升了一個層次（醋飯原本就很讚了）。鮪魚赤身跟中腹讓我這個不吃牛的人也能嚐到和牛的口感，體會一下什麼叫入口即化。最後來一碗旨丼必喝魚肉多到爆炸的味噌湯，此生無憾了。
 Yuyu Wu ,https://www.google.com/maps/contrib/107565452481223695995/reviews?hl=zh-TW,5,False,7,已經回訪無數次的店家，老闆用料實在手藝也很好，所有東西都超級好吃，最愛甜蝦丼跟炙燒盛合，生魚片有厚度而且都很鮮甜美味！蔥花鮪魚泥手捲/細卷也都好好吃，這間絕對是高CP值啊～等再久都願意❤️
 Arthur ,https://www.google.com/maps/contrib/116911417216306411041/reviews?hl=zh-TW,5,True,99,"11:30開門最好11點前就來排隊
我絕對不推薦你們這家
因為人太多我自己都吃不到了
價錢跟品質來說不會貴
店內位置很少
但是東西都很新鮮
干貝炙燒後咬下去
簡直完美.無敵的吧！
.
湯的部分也很有料
有一堆魚肉蛤蜊蘿蔔蝦頭
重點是還超大一碗"
 Hana ,https://www.google.com/maps/contrib/112503436664667551984/reviews?hl=zh-TW,5,True,25,"CP值很高的丼飯～
發在IG限時動態超多朋友詢問
很不想分享給大家因為這樣下次更難排XD

當天很幸運約10:50到店門口排第一個
老闆會請客人先量額溫消毒後才入座
座位只有8個店面雖小但我覺得不會很擠👌

除了菜單上固定的餐點外
也可以看看黑板上有一些比較特別的餐點
例如我圖片上的葡萄蝦丼❤️
餐點都會附免費的超大～蝦頭味增湯
裡面的料也是🈵️🈵️🈵️！

打完這段評論又想再去吃一次叻⋯⁽⁽◞(˃̣̣̥᷄⌓˂̣̣̥᷅=͟͟͞͞˃̣̣̥᷄⌓˂̣̣̥᷅)◟⁾⁾"
 Scarlett Chang ,https://www.google.com/maps/contrib/100126778819195731477/reviews?hl=zh-TW,5,True,286,"2022/05/05
味噌湯驚艷，海鮮湯底很好喝，底下蠻多魚肉，竟然還可以續，續湯沒有蝦頭，一樣有魚肉噢，但是還是有點鹹，芥末也是真材實料，很香！"
 Maureen Chen ,https://www.google.com/maps/contrib/101135940776243907265/reviews?hl=zh-TW,5,True,24,"星期六中午12:20到，等了一個半小時後入座
老闆蠻親切的
黑板的菜單有任何問題都可以詢問
旁邊的客人加點五隻蝦老闆還問不會痛風齁🤣

旨丼的生魚片丼飯新鮮又好吃
連隨餐送的味噌湯都比很多日本料理店賣的好喝
兩個人吃下來大概比壽司郎貴一點而已
下次還是會願意繼續排隊等候☺️"
 廖志鈞 ,https://www.google.com/maps/contrib/115667085542044737671/reviews?hl=zh-TW,5,True,49,"常路過⋯看到排隊人潮！終於找個時間來吃，為了吃，再久也是排下去😘⋯這次排了一個小時💗💗💗
點了（豪華大滿足）好吃🤤
日料最重要就是要新鮮，真的夠新鮮
我本人愛吃日料⋯賀甲"
 井川哲 ,https://www.google.com/maps/contrib/106196652581772895599/reviews?hl=zh-TW,5,True,81,"餐點點下去份量很多，又新鮮，物超所值.
湯裡的料也豐盛.
店內空間不大，位置不多，所以很常客滿.
但是在小小的店空間裡還有瓦斯爐，讓我有點心驚驚."
 Liu Jenny ,https://www.google.com/maps/contrib/106261556855194553308/reviews?hl=zh-TW,4,True,18,食材非常新鮮、好吃，味噌湯超讚。可惜座位太少，用餐時間限制40分鐘，入座30分鐘就被親切的提醒還有10分鐘。後面因為時間關係，快速的乾完味噌湯結帳離開。吃飯速度慢的不是很適合。
 Calvin Lee ,https://www.google.com/maps/contrib/101381357866672590781/reviews?hl=zh-TW,5,True,152,"這家旨丼十一點半開門還有二十分鐘
門口就已經有好幾組客人在排隊了
因為位子不多沒擠進第一輪用餐
所以店員先將未進第一輪用餐者
的姓名和電話登記在門上的白板
客人可先離開約四十分鐘後回來即可

還沒進店裡我看了一下Google評論
得知除了菜單上固定的餐點外
牆上黑板還有一些比較特殊的餐點
於是一進店就直接看黑板上菜單
這次點了沒吃過的葡萄蝦丼飯
另外加點了兩個握壽司
結果師傅看錯以為是加點兩片生魚片
就把加點的兩片生魚片放進丼飯裡面
想說奇怪⋯師傅對我那麼好ㄛ
我這碗的生魚片怎麼好像比較多
邊吃邊數吃了幾片才發現是搞錯了

食後感
葡萄蝦真的鮮甜美味
生魚片厚切口感很好
醋飯粒粒分明酸到恰恰好
鮮魚味增湯料多味美
醋飯跟味增湯都可續很佛心
價格方面算是非常超值
要不是我食量實在太小
不然真想試試超浮誇的豪華大滿足丼

總結
旨丼是值得推薦給大家的美食餐廳"
 Jane Chou ,https://www.google.com/maps/contrib/112690436258777987934/reviews?hl=zh-TW,5,False,6,湯非常大碗湯頭鮮甜是用蝦頭熬煮+滿滿的鮭魚肉。生魚片丼飯也非常好吃不愧對價格！店內位置不多所以及早來排隊較佳！
 周鈴鈴 ,https://www.google.com/maps/contrib/114092727655527875915/reviews?hl=zh-TW,5,True,82,"11:30開始營業
建議11點就要先來排隊
因為他餐廳總共就8位子，現點現作，我這次大約11:5分到，已經要排第二輪了（今天還是雨天喔），午餐只作三輪，我大約12點入座就聽到已經不再接客了，這生意真的很好，今天點的是大滿足，看到隔壁的點了豪華大滿足就有點後悔，多了一整份生魚片，對於少吃飯的我非常適合，味增湯一直是超值賣點，蝦子鮮味很夠，魚肉份量也不少，這很值得一訪再訪，要記得提前到就是了😊"
 萬士 ,https://www.google.com/maps/contrib/117672482190564230113/reviews?hl=zh-TW,5,True,527,"吃過一次就回不去了
直接列入愛店
每種都好吃
可以直上豪華大滿足
餐點都附料滿滿的味噌湯
還可以續湯
只是人潮蠻多的需要提早來排隊"
 Rora Yu ,https://www.google.com/maps/contrib/104059345656749148887/reviews?hl=zh-TW,5,False,21,老闆人超好，晚上的無菜單壽司980元很良心價，食材物超所值～～不敢吃亮皮魚的我都敢吃老闆的鯖魚了
 Hu Rosie ,https://www.google.com/maps/contrib/108441966588848426401/reviews?hl=zh-TW,5,True,274,"中午才能吃到的海鮮丼飯cp值超高！最便宜的320塊一碗，另附幾乎跟丼飯一樣大碗的味噌湯一碗！裡面還有滿滿的魚肉！吃不夠還可以續飯續湯～先放進我愛吃鬼小資族的口袋名單裡面惹🤤順帶一提，內用的茶水意料之外也蠻好喝的，店家真的很用心！

店內目前沒有做外帶，內用空間小巧座位不多，如果特地跑一趟會建議事先預約。師傅說人都到齊了才能進店裡。有低消也有用餐時間限制。如果是晚上來，就只有一千塊的無菜單料理可以選擇囉！"
 Ssu Ya Hsieh ,https://www.google.com/maps/contrib/101926987956646926237/reviews?hl=zh-TW,5,True,317,"2022.1.29/2022.1.30/2022.2.27
跑來了3次
終於在第三次才成功入到店內用餐
入座後還跟老闆說我來了3次
今天終於可以吃到了

第一次點了豪華大滿足
一吃就愛上
生魚片很新鮮醋飯也好吃
師傅處理海鮮手法很好生魚片厚度剛剛好
生魚片在口中鮮味滿滿
天使蝦好鮮甜花枝透過好刀功更顯脆口
比目魚鰭邊油脂豐富配上醋飯整個就是合拍
干貝也很大顆微炙燒後超美味的
唯一可惜的是我來的這天沒有海膽
老闆用了北寄貝替代雖然也好吃
但我還是愛海膽啊
免費提供的味增湯也好喝
用了天使蝦蝦頭一起下去煮
味增湯內還有魚肉和白蘿蔔
湯頭不會過鹹也不會過淡整碗海味十足
而且還可以續湯真的超級棒的

因為太喜歡了隔天立馬又跑來吃了
這次點了旨丼也不錯
但因為昨天才先吃了豪華大滿足
所以旨丼就有點不能滿足我
（純粹是個人觀感）

第三次帶家人來吃
這次我點了炙燒盛合丼
海鮮一樣新鮮
但因爲炙燒我個人喜歡微炙
當天鮭魚和天使蝦就覺得稍微炙燒過頭
可能下次有再點炙燒盛合丼
我要先跟師傅說我只要微炙燒就好

其實老闆和師傅沒有一些網友說的態度不好
店家規定說的很清楚
能接受的就來不能接受的就不要來
我自己也是跑了3次才吃到
一開始抓不到多早就要來排的時間
以至於前兩次都吃不到
但實際入到店內用餐後
會發現食物的品質真的很好
買單要離開時老闆也會客氣的說謝謝
其實真的是很棒的一間店
以後只要想吃丼飯都會來旨丼"
 鄭HAO HAO ,https://www.google.com/maps/contrib/107504134103416783471/reviews?hl=zh-TW,5,True,265,"親切的態度，細心的服務，鮮美的食材！
三歲的小孩一同用餐，老闆特別的弄一碗無刺的味增湯，湯頭非常鮮美，大人小孩都喜歡！"
 孫子貽 ,https://www.google.com/maps/contrib/113658438053205627475/reviews?hl=zh-TW,5,False,10,"平日中午去吃，十一點五分左右到，剛好沒排進第一輪🥲登記後先去旁邊的7-11吹冷氣等候。
生魚片丼飯真的很讚！味噌湯續還會加鮭魚肉🥺"
 陳彥銘 ,https://www.google.com/maps/contrib/103192514882023517345/reviews?hl=zh-TW,5,True,110,平日一點左右去，不用排隊直接入座，店內較小大約十個座位左右，看評分評價肯定是夯店，所以不想等的平日離峰是個好選擇，就是要注意中午營業到兩點就休息。
 c chiu ,https://www.google.com/maps/contrib/117122237297323671987/reviews?hl=zh-TW,5,False,6,去吃了好幾次午餐的丼飯，這是第一次體驗晚餐。每一樣都很棒且用餐節奏非常得宜（比午餐慢一些，更有餘裕的感覺）激推
 Keven Tseng ,https://www.google.com/maps/contrib/106238169707060360490/reviews?hl=zh-TW,5,False,13,"隱藏在中山區巷子內,高C/P值爆表旨丼,一位難求晚來就沒了,今天點炙燒盛合丼+大滿足丼,湯有料含魚肉+蛤蜊+蝦頭,還可以免費無限續,好吃好吃:P"
 ViVi ,https://www.google.com/maps/contrib/100795234451874918572/reviews?hl=zh-TW,5,False,11,當晚與老闆相談甚歡，晚上只有套餐可以點，每道料理都是老闆配選，從第一道至最後一道都很好吃！先生和我都很喜歡吃日本料理，吃過這麼多家，覺得許多都大同小異，這家卻讓人覺得驚艷～
 Chou Shih-En ,https://www.google.com/maps/contrib/107540763743907874700/reviews?hl=zh-TW,5,True,18,"數次用餐體驗下來
用料新鮮實在
每樣海鮮都用其適合的方式調味得當
連醋飯都清爽不乏味
丼飯附的味噌湯更是一絕
寒冬入肚倍感至福
以午餐菜單這數百元的價位來說
四個字無懈可擊

有機會會願意嘗試晚餐菜單！"
 張佳茹 ,https://www.google.com/maps/contrib/115928995157378943085/reviews?hl=zh-TW,5,False,42,"店內約可容納8人營業時間前半小時抵達店內已滿登記到第三輪候位約等候一小時入內
午餐時段登記四輪候位後就不受理登記大約營業開始後半小時四輪候位就會額滿

餐點不可思議的美味生魚片退冰得恰到好處入口驚訝到重複思考：「這是怎麼回事？怎麼這麼好吃？」"
 Tina Chao ,https://www.google.com/maps/contrib/118410948924716078623/reviews?hl=zh-TW,5,True,97,"生魚片新鮮，高CP值。份量很足夠。
中午時段不接受預約，建議可提前登記～
位子不多但因為有用餐時間限制因此也不會等太久🙃"
 Yih Hubert ,https://www.google.com/maps/contrib/106495715350742740430/reviews?hl=zh-TW,5,True,72,非常棒的體驗，老闆對魚鮮的處理與熟成的功夫都非常到位，真的是物超所值的享受。
 JongRuey yang ,https://www.google.com/maps/contrib/110552633863127289474/reviews?hl=zh-TW,5,True,24,"吃過最好吃的丼飯
醋飯粒粒分明又不致於太硬
魚鮮甜好吃
甜蝦超級好吃原本看起來怕會很腥（我是對腥味很敏感的人）但真的只有鮮濃可以形容
太滿意了！！！"
 廖耕新 ,https://www.google.com/maps/contrib/109115479383569297999/reviews?hl=zh-TW,5,True,18,"更多美食和抽獎活動都在我的IG👇🏻
🔎@update_foodiary
⁡
🌱近林森北路超人氣生魚片丼飯(勝王旁邊)
🌱Cp值極高美味份量又多
🌱除了基本菜單還有黑板上當季限定品項
🌱免費續醋飯和味噌湯
🌱採登記制但需全部人到齊才能入坐
🌱強烈建議要早點去登記店家會提早不收客
——————————————————
⁡
🔻大滿足丼(圖四)🅽🆃𝟹𝟾𝟶🔥🔥
🔻炙燒盛合丼(圖五)🅽🆃𝟹𝟸𝟶🔥
🔻旨丼(圖六)🅽🆃𝟸𝟼𝟶🔥🔥
🔻松葉蟹壽司🅽🆃𝟿𝟶(一貫)
⁡
這家已經躺在我的名單許久終於來吃啦
店內每個品項的份量都很多又新鮮
光是最簡單的旨丼都配七塊生魚片和天使蝦
而且每塊生魚切片和蝦子都很厚實
一口搭配嗆辣的芥末整個超滿足😚
新編在這要特別強調這家用的時令生魚片
絕對不是隨便的那種魚邊肉的切片
連紅甘店家也是大方的給了兩大塊
另外很驚艷的就是免費的鮮蝦魚肉味噌湯
湯超級鮮甜又有整隻蝦頭和四五塊魚肉
大大一碗喝不夠還可以續
整體用餐體驗超級舒服🥰
⁡
🤞🏻新編總評🤞🏻
Cp值首推旨丼‼️
想吃多一點可以點大滿足或直上豪華大滿足
新編吃的少數生魚片丼飯吃完超飽的店
重點是超級好吃是肯定會常回訪的
⁡
-
🌻用餐環境🌕🌕🌕🌕🌗
🌼服務態度🌕🌕🌕🌕🌗
🌺美味程度🌕🌕🌕🌕🌗
🌹CP值🌕🌕🌕🌕🌗
🌸回訪率🌕🌕🌕🌕🌕"
 __毛貓__ ,https://www.google.com/maps/contrib/106769406723565335666/reviews?hl=zh-TW,3,True,199,"是很好吃的店，老闆手藝也很好，會想為了吃你們家的丼飯搭半小時的車過來中山，希望可以在店門口貼一下禁煙，貴店人氣很旺，午餐時段都要排隊才吃的到，門口等候的人都很多，為了躲煙味過號真的挺難過的。
也希望老闆收完錢可以深度的手部清潔，畢竟現在疫情很嚴重。"
 Fenier Lee ,https://www.google.com/maps/contrib/112029463479544231728/reviews?hl=zh-TW,5,True,34,"晚餐改為套餐，雖然單價變高但是還是很棒的愛店！
PS.有兩隻蝦是因為我有額外加點一隻"
 Sharmy Wang ,https://www.google.com/maps/contrib/110036361240965037601/reviews?hl=zh-TW,5,True,26,"鰻魚超好吃！！口感很特別，很像棉花糖一樣鬆軟～
蝦殼飯也是好吃到不行，很讚：）"
 黑心經紀（黑心經紀） ,https://www.google.com/maps/contrib/100512515922160324515/reviews?hl=zh-TW,4,True,190,"中午享用特餐
表現不錯
食材新鮮
份量與cp值都很高"
 Alice Wei (Alychee) ,https://www.google.com/maps/contrib/105102402579235783767/reviews?hl=zh-TW,4,True,15,味噌湯超有誠意，餐點也非常好吃，唯一缺點是要早早來等待，到場之前都很擔心今天會不會滿位😂
 Cheng Yan Lu ,https://www.google.com/maps/contrib/118392717857832861565/reviews?hl=zh-TW,5,True,625,"超好吃，整體都很新鮮，味噌湯裡面滿滿的魚肉，還可以無限續，價格也算台北便宜的老闆很健談，位置有點少然後要排一下，可是我覺得很值得再次來。

2022/01/29更新：炙燒從280吃到即將變成350，我相信還會是台北cp值最高的丼飯。每次來排隊最期待的就是黑板上的東西，近期印象最深刻的就是葡萄蝦和日本赤海膽(照片附的兩個)，每樣食材都非常新鮮，吃到非常飽兩個人基本上1000有找(目前午餐)，途中也漸漸認識了許多海鮮，如果時間允許，每週來吃兩碗飯+三碗湯真的不是問題XD"
 陳咕嚕 ,https://www.google.com/maps/contrib/104985700300277564156/reviews?hl=zh-TW,5,False,7,"炙燒丼吃完好滿足，味噌湯上桌時根本靈魂溫度，濃郁新鮮又好喝還吃得到魚塊😍
謝謝師傅好用心的料理"
 阿文 ,https://www.google.com/maps/contrib/110727031274673992495/reviews?hl=zh-TW,5,True,174,非常好吃十分滿意，覺得很厲害東西新鮮魚肉到嘴裡化開
 CHIA CHUN LIU ,https://www.google.com/maps/contrib/114254497891959013340/reviews?hl=zh-TW,4,True,142,新鮮好吃，推薦炙燒盛合，味噌湯給的算大方。座位少，離捷運站較遠，需到現場劃位。
 Lily C ,https://www.google.com/maps/contrib/104026759295207279996/reviews?hl=zh-TW,5,True,187,生魚片新鮮、醋飯味道也很棒，味增湯魚肉竟然也是滿滿的，cp值真的很棒！
 Yung Chi Luo ,https://www.google.com/maps/contrib/106299649210233594655/reviews?hl=zh-TW,5,False,28,午餐好吃、晚餐也很讚，個人認為每樣都蠻實惠的
 趙Shiang ,https://www.google.com/maps/contrib/105389800852306594109/reviews?hl=zh-TW,5,True,83,丼飯還附料很多的味噌湯，食量小的會吃的很飽，吃不飽也可以加飯，可以直接看到師傅在料理平台處理食材，也蠻有趣的。
 傲嬌貓 ,https://www.google.com/maps/contrib/117629614543036277278/reviews?hl=zh-TW,4,True,440,"目前晚餐時間沒有丼飯僅有無菜單料理
中午的鮭魚親子丼飯從$250調整到了$350
其他價格也有變動要過去的人需要自行注意一下哦～
食材也新鮮店面裡面位置較小
不接受訂位人多可能需要稍微排隊一下"
 劉鎮鼎 ,https://www.google.com/maps/contrib/103849845607382999967/reviews?hl=zh-TW,5,True,48,非常、非常優秀的丼飯，不論是價格上還是品質真的在水準之上，從一開始的鮮魚味噌湯甚至是醋飯的味道，真的非常的令人滿足！至於海鮮的本體就不用多說了，是間排隊也值得多次來訪的店家
 Frances Lin ,https://www.google.com/maps/contrib/117077320135932505206/reviews?hl=zh-TW,5,False,13,"海鮮處理的很好，很新鮮，很美味！可以說對日本料理的高標準要求，這家店都達到了；但是價錢是佛心價，而且是我喝過最鮮美的味噌湯竟然免費，還可以續湯！！！

吃完只有讓人滿懷感恩的滿足啊~~~好爽！

不過提醒大家，到場後要先登記喔，依照登記順序入店用餐，門口有張貼很清楚的說明~中午我到的時候大概是12點（大概等了50分鐘左右進去點餐），接我後面2組客人後就「現場候位已滿」，然後我就陸陸續續看到後面來的顧客沒辦法用餐了，所以饕客一定要切記提早來才不會撲空喔！！"
 I ping Huang ,https://www.google.com/maps/contrib/118005365211487834304/reviews?hl=zh-TW,5,True,22,十天內造訪四次，可以加飯、加湯，除了滿足，還是滿足！
 Eric Yu Shaw ,https://www.google.com/maps/contrib/107041650117312750650/reviews?hl=zh-TW,5,False,5,今天晚餐很有幸的訂到位。跟傳說中很有個性的老闆邊吃邊聊。吃的東西贊啦！握壽司都很新鮮，挑不出毛病。炙燒比目魚邊壽司更是一絕！大概是我吃過最好吃的。分量剛好，女生差不多吃到飽，男的大概也有9分飽。期待下次回訪傳說中的超強午餐丼飯！
 粗粗 ,https://www.google.com/maps/contrib/114659038828947365963/reviews?hl=zh-TW,5,False,5,受朋友推薦而來，三個字超級好吃，推薦所有人來吃，至少要知道「好吃的生魚片」嚐起來是什麼味道，魚肉非常厚實又大塊，一片可以抵上別人三片，且每一種魚的品質都很高，非常鮮甜且沒有任何帶筋，我個人覺得生魚片好不好吃鮪魚就知道，因為多數店家鮪魚都非常難吃，另一個是蝦跟紅甘的肉質，好不好吃差距會非常明顯，這間店$420-$480的上丼CP值都非常高，味噌湯大手筆給料口味相當有層次，是完完全全的五星好評，可惜老闆決定要漲價80元，$500元的鮭魚親子丼說出去可能就會讓人卻步，但6片魚肉抵別人15片都不為過，漲80元後對我來說可能僅剩4.6顆星，雖漲價但也只是漲到合理的價格，晚餐的板前壽司則還是很便宜，未來還是會推薦大家晚上來嚐嚐老闆的美好手藝
 Amy Su ,https://www.google.com/maps/contrib/117565990287367616263/reviews?hl=zh-TW,5,True,"1,003","身為一個生魚片丼/壽司控，最喜歡到處發掘厲害的日式料理
看到4.9顆星想說來朝聖一下，果然海鮮食材新鮮好吃，生魚片口感佳，味噌湯鮮美，價格也非常合理，大推！！

小缺點是座位間距離較近，有點擁擠，也因為座位數不多，尖峰時段要排隊排一段時間才能入座
但再訪意願仍是非常高

————————
晚上時段再訪更新
無意間路過發現晚上改成無菜單壽司套餐的用餐形式，一客980元
有前菜、生魚片、握壽司、烤魚、味噌湯

紀錄一下當天吃到的菜色
軟絲醋
現流葡萄蝦真鯛鰤魚

握壽司：
小鯛
日本鯖魚
尖梭
烤葡萄蝦蝦頭飯
鮭魚肚
黑鮪魚中腹
比目魚鰭邊
海膽鮭魚卵

烤白帶魚
玉子燒
味噌湯
最驚豔的是葡萄蝦跟味噌湯，新鮮好吃"
 RITA SHIH ,https://www.google.com/maps/contrib/111950042380964848116/reviews?hl=zh-TW,5,True,7,"要提早來排隊，且候位的話要在現場等哦~
可能因為店面很小，用餐時間只有40分鐘，感覺有點太短，會吃得有點急。
點了炙燒盛合丼和豪華大滿足，味道都蠻不錯的，海膽完全不會有怪味、腥味👍很好吃~
生魚片蠻新鮮的，炙燒的部分比較喜歡天使蝦、干貝、海帶芽和比目魚鰭邊這些~

湯好喝，而且是無限續！不過裡面的魚肉有一點而柴~"
 SANGEL YOYO ,https://www.google.com/maps/contrib/108624159757626983468/reviews?hl=zh-TW,5,True,241,"我是台中來的朋友
提早15分鐘到還是等了大概半小時
但吃過之後真的覺得等待是值得的
激推炙燒系列🔥🔥🔥🔥
好吃到會嘴角上揚😃
而且點丼飯還會附一晚超大碗蝦頭鮭魚味噌湯
可以看圖片就知道多大碗料多多
Cp值超高
服務也非常專業快速
想吃要提早來排隊
不接受預約
一次只放9個人進去喔！"
 小潔 ,https://www.google.com/maps/contrib/113832087720717478177/reviews?hl=zh-TW,5,False,4,"非常精緻的日本料理
食材新鮮，完全吃不到腥味
老闆很認真的在做料理和介紹食材，店裡只有8個位置，完全是放鬆式的用餐感覺。
適合兩三個朋友小聚，可以再去的地方，棒👍"
 陳昱潔 ,https://www.google.com/maps/contrib/104757734341812050970/reviews?hl=zh-TW,5,True,128,"第一次來吃旨丼就決定一定要二訪！

但因座位區不多，會建議大家提早去排隊
用餐有限時間，40分鐘
其實不用怕等太久
我們5:40去候位，等半小時而已，大家可以在附近晃晃
我們是平日去，如果是假日可能等候時間就較長喔。

我點的是招牌旨丼$230
份量真的蠻大的加上一碗超多料味增湯
我覺得女生吃就很剛好。
（這邊的味增湯及醋飯都可以續喔！）
食材新鮮100分！真的很好吃😋
吃完很懷念在日本生活的日子

男友則是吃大滿足丼飯$360
份量真的很滿足！撲滿滿的生魚片

我們還加點握壽司8貫

因為實在太餓了所以點蠻多😄
老闆也很細心先幫我們上丼飯
在看我們是否確認有要再加點壽司

我想也是因為怕吃不完浪費，我很喜歡老闆的細心及對食材的珍惜❤️

我一定要誇獎他們的味增湯！
實在是太好喝！不像外面附贈的味增湯只有海苔豆腐柴魚片

他們的料多有鮭魚有蛤蠣有蝦頭（是超大隻的蝦）
還有蘿蔔還可以續！真的很讚。
大家一定要去吃。

也請大家體恤服務業的辛苦，如果等候時間較長也不要抱怨喔！"
 黃俊棋 ,https://www.google.com/maps/contrib/103262248734275874640/reviews?hl=zh-TW,5,False,1,"每樣都好吃，炙燒比目魚鰭邊-炙燒鮪魚中腹超級好吃😋
建議赤海膽跟玉子燒可以加強一點！
綜合1350元/食材都很高級，料理也是很美味，推一個！4.5顆星"
 me b ,https://www.google.com/maps/contrib/114005916465036389679/reviews?hl=zh-TW,5,False,21,"讓人感到很幸福、很滿足的店
巨巨的味增湯竟然可以續碗
生魚片丼飯份量足又鮮
有固定菜單、旁邊黑板也有其他選擇
老闆說話方式比較直白、但也很阿莎力

位置只有八個，最好提早去現場先登記"
 D Wang ,https://www.google.com/maps/contrib/106988278251387631729/reviews?hl=zh-TW,5,True,78,"有夠好吃😭😭😭
價錢超佛，叫了一碗實在太喜歡又加點一盤刺身
因為不吃花枝老闆還讓我換成魚～
味增湯也好好喝！！可以免費續湯但實在太飽了只喝了一碗～
美中不足的是座位實在少、每天接客量不高
希望可以擴店嗚嗚真的太好吃了"
