user_name,user_profile_url,rating,local_guide,comment_num,comment_text
 黃小南 ,https://www.google.com/maps/contrib/111088013202025203126/reviews?hl=zh-TW,3,True,297,湯頭很普通，生魚片不甜，但火鍋的海鮮都滿新鮮的。整體來說物有所值，也可以吃很飽，但是就是不知道特色是什麼。
 林素鶯 ,https://www.google.com/maps/contrib/110428875873541524354/reviews?hl=zh-TW,5,False,1,"場地很寬敞，東西很新鮮，服務很好！
下次還可以再來吃喔⋯⋯
是一個聚會的好地方！真的好開心喔"
 Jing ,https://www.google.com/maps/contrib/112490014962024821453/reviews?hl=zh-TW,1,False,3,"員工教育訓練需要加強第一輪基本盤點餐就有漏單的情況等了快一小時才把基本盤餐點上齊
說要把餐點補給我們講了四五次都沒有確實補齊推說廚房再忙正在處理中海鮮食材不太新鮮"
 陳佳渝 ,https://www.google.com/maps/contrib/100178969781876120207/reviews?hl=zh-TW,5,False,1,"海鮮和肉盤都新鮮又好吃，還可加點,下次家人聚餐時會再來這裏！"
 Chun Chun ,https://www.google.com/maps/contrib/104024590534084747812/reviews?hl=zh-TW,1,False,40,如果你不太在意食材的新鮮或是食材都有點髒髒的，然後肉有極度的肉腥臭味，若也不在意環境的衛生，不在意餐具的衛生，如果都可以接受，那可以考慮，如果有在意建議還是別吃算了，雖然便宜，但一吃就完全再也吃不下去了，還剩了8成不堪的食材，真的好浪費。
 黃emy ,https://www.google.com/maps/contrib/117114044671504637379/reviews?hl=zh-TW,5,False,9,享受好環境、貼心服務及高cp值新鮮美食
 T W ,https://www.google.com/maps/contrib/114679287804394705129/reviews?hl=zh-TW,5,False,1,"2週前
用餐環境很好寬敞
裝潢棒
個人鍋菜色正常美好
湯頭還不錯"
 李欣容 ,https://www.google.com/maps/contrib/114028941743368487927/reviews?hl=zh-TW,5,True,35,餐點普通，服務很好，用餐環境不錯，可以來嚐鮮一次~
 夏川草芽 ,https://www.google.com/maps/contrib/102228038927094841666/reviews?hl=zh-TW,4,True,199,近兩百個座位，女廁卻只有兩間？熱茶用玻璃杯裝覺得不夠貼心，但是整體定食來說cp值很高，黑豆和鯖魚處理的很好(雖然魚有點太乾，但幾乎沒刺)
 Bonnie S. ,https://www.google.com/maps/contrib/115804357106849719188/reviews?hl=zh-TW,3,True,40,"覺得石頭鍋不錯～
味道剛好！
上餐速度也很快！
唯一的缺點就是找服務生問有沒有小碗時，服務生叫我自己去拿裝醬料的碗...
我是要裝湯的說..."
 fat_amy tseng ,https://www.google.com/maps/contrib/100587393469011056713/reviews?hl=zh-TW,3,True,71,地點大可眾多人聚餐，火鍋菜新鮮量多但一般湯底沒有什麼特殊的味道，整體價格在300左右，無服務費，但吧台的飲料都不是很好喝，醬料方面有基本的生辣椒，沙茶，醬油，蔥花，白醋，蒜泥及比較少見的蘿蔔泥，算乾淨，去前聽說店員態度不好，但其實3/2去的服務太度還好，我覺得如果你對他們有禮貌，態度也不會太差。
 Leo Lee ,https://www.google.com/maps/contrib/118407719200968647992/reviews?hl=zh-TW,1,True,136,1樓唰唰鍋點了頂級沙朗牛肉，結果服務生端盤過來後看起來很像大眾牛肉（廉價肉片），份量也很少也難吃，cp值很低不建議大家去這家
 Gary L ,https://www.google.com/maps/contrib/103671737205359298856/reviews?hl=zh-TW,4,True,122,"單人鍋300元起，分量算足夠，不大需要另外加點
飲料只有醋飲、茶2種，醬料自行調配
用餐時間90分鐘

整體個人認為用餐環境很不錯，但餐點並沒有讓人感到驚艷"
 黃玉米_打開你的攝影眼 ,https://www.google.com/maps/contrib/110936709027051803225/reviews?hl=zh-TW,5,True,144,這裡來之前最好訂一下位，以免要等待。火鍋用料都很新鮮，還有生魚片與日式丼飯，飲品自己倒的部分可以無限續杯。
 J he ,https://www.google.com/maps/contrib/117149920648249845700/reviews?hl=zh-TW,1,True,98,"沒有可樂還要另外買
然後我牛排點五分熟結果這牛排根本只有一分熟吧超級扯切面完全是粉粉嫩嫩的吃到反胃=="
 洪敬惟 ,https://www.google.com/maps/contrib/102670817348243500503/reviews?hl=zh-TW,3,True,98,平日中午用餐觀光客居多的樣子座位數很多用餐還算舒適寬敞火鍋部分提供壽喜燒、和風、石頭火鍋、麻辣鍋價位就非常地「觀光」菜盤提供的食材也不夠豐富沒有特色之處肉品的部分份量給的很夠很大片可惜當天同行的人點了海陸送上來的透抽非常不新鮮表皮已經失去彈性跟發紫希望店家可以注意食材的新鮮度飲料也只有一款果汁跟綠茶可以選擇這樣的價位跟內容算是平平吧
 陳盈孜 ,https://www.google.com/maps/contrib/103054938297874812400/reviews?hl=zh-TW,1,False,6,非常糟糕，我們已提早訂位20位，原本要開心慶祝父親節，但是卻告知我們沒有單點鍋的位子只能去共鍋區，因為他們要接待旅行團的客人用餐，而他們要坐單點鍋區，才剛點完餐發現還有一整排的單點鍋區都沒有人坐。如果無法一次接受那麼多顧客那為何要接受訂位呢？讓人感覺一般散客較次等，非常不舒服
 Lung-Cheng Wei ,https://www.google.com/maps/contrib/102708508086956256500/reviews?hl=zh-TW,1,False,5,"火鍋魚肉單點的品質很不好，
用巴沙魚片有土味(多利魚)有可能是越南的，加沙魚，像是餘料，
請服務員換，說拿出來就不能換，

奇怪ㄟ東西是你們拿的，又沒有讓我選，之前也有一樣的情形，問他們她們說有什麼給什麼，沒得選。
客人很無奈啦。"
 Lee Bruce ,https://www.google.com/maps/contrib/113410617755844145473/reviews?hl=zh-TW,1,False,23,滑嫩雞柳鍋一點也不滑嫩⋯以前還會醃過再上桌。10/25那天用餐再點雞柳，上桌肉品跟超市看到的未處理雞柳沒兩樣，完全沒醃（筋也沒去除），連有無清洗我都懷疑？煮過後超乾又硬，一點也不滑嫩⋯以往的好印象全毀，以後不會再上門。劣化有夠誇張的一家店。
 -- ,https://www.google.com/maps/contrib/114589298202977384346/reviews?hl=zh-TW,2,True,25,不知道是為了省電還是冷氣壞了店裡很熱大家吃到滿頭大汗和服務生反應但沒有下文。不到7點所有免費的飲料都沒了只剩白開水一直到離開都沒有人來補充。食物方面就一般的火鍋。(更正：不是免費的飲料，是餐費附的飲料）
 A lin ,https://www.google.com/maps/contrib/104372169091683889482/reviews?hl=zh-TW,5,False,1,菜點平價美味我們10個人來聚餐都吃的很開心服務生很親切尤其是嘉敏下次還會想再來
 Tim lin ,https://www.google.com/maps/contrib/106226366002591749955/reviews?hl=zh-TW,1,False,1,飲料杯超級髒，完全沒洗乾淨，我拿了五個，每個上面都有不規則茶色的點。價位便宜所以味道也沒啥好要求的了，但把杯子洗乾淨真的有那麼難嗎？
 黃歡歡 ,https://www.google.com/maps/contrib/111691099360730711956/reviews?hl=zh-TW,1,True,33,"櫃台點餐付款時，櫃台強調一盤5片，建議點1肉品2盤以上，還說低於2盤內場來不及出菜，所以點了各肉品各2盤，結果來一盤超過10片，整個傻眼😱
變成想要點其他東西都不能點了
後面服務超差的，桌子不清，加點還不來
都懷疑店家是故意整客人嗎？？？"
 曾採雲 ,https://www.google.com/maps/contrib/107178145304728818619/reviews?hl=zh-TW,5,False,1,"推薦火鍋店火鍋好吃食材新鮮服務號會讓我們有賓致如歸感覺
美麗服務最好我們不懂他都幫我們用很熱心"
 Julie Chiu ,https://www.google.com/maps/contrib/103379296284021786004/reviews?hl=zh-TW,5,False,21,"環境寬敞舒適，適合親友餐敘。
食材新鮮，和風湯頭口味佳，
服務親切，用餐愉快的火鍋餐廳。"
 鄭芸青 ,https://www.google.com/maps/contrib/111731755651878672789/reviews?hl=zh-TW,2,True,87,石頭鍋應該改名較蒜頭鍋🥲
 Quenna ,https://www.google.com/maps/contrib/100538991486293084994/reviews?hl=zh-TW,5,True,111,"服務親切價格平價本來以為外觀看起來華麗用餐價格一定很高沒想到超出我預料不僅味增湯超好喝套餐做的用心,生魚片新鮮CP值很高,尤其當天我吃不完打包走看到他們盛裝的容器感到很滿意,環境舒適地很大一定還會再光顧的"
 rossetti8012 ,https://www.google.com/maps/contrib/101959091915706458789/reviews?hl=zh-TW,5,True,21,好吃！每樣菜都很新鮮美味種類很多選擇多樣價格合理cp值挺高的一間餐廳服務也很好👍👍推
 黃俊潾 ,https://www.google.com/maps/contrib/101558581802050281697/reviews?hl=zh-TW,1,True,26,"東西還行但服務態度非常不佳
這次服務生何承X先生居然收東西還打斷客人聊天叫我們幫忙收、上菜時也一樣沒禮貌的態度，請再教育"
 pc lin ,https://www.google.com/maps/contrib/114750107378337470377/reviews?hl=zh-TW,5,False,5,這邊餐點好吃服務員妮萱不錯，環境很大，吃的很飽量好多哈哈哈哈
 Ping Hao Su ,https://www.google.com/maps/contrib/106548943851743508082/reviews?hl=zh-TW,1,False,1,"1/6晚上去用餐
1.沒有帶位人員，門口服務員給份菜單就不管了，還要自己找人詢問
2.我們兩個人用餐被帶坐6人位，後來來客人併桌也完全沒詢問，中間也未隔開，而且明明空桌還一堆，這樣的安排十分糟糕
3.服務人員態度散漫，請幫忙加湯，完全沒反應(似乎是建教生完全沒訓練好，就叫上來服務)
4.服務生推車撞到客人~湯水撒到桌上，也是完全不管客人，只顧著拿拖把拖地，還murmur跟同事說是客人(韓國人)撞到他
5.服務人員收桌上空盤也是不管你是否還在用餐..手直接伸過去拿空盤...
6.送餐餐車有打翻的水漬或掉落的火鍋青菜等~沒有清乾淨，持續使用，感覺衛生不佳

整體用餐體驗非常之糟糕，餐點部分則是普通"
 王憲德 ,https://www.google.com/maps/contrib/100840290482571409100/reviews?hl=zh-TW,3,True,214,火鍋價格算是很親民，一般到豪華型都有，整體而言比較一般火鍋店，空間舒適許多，食材也新鮮，不適合帶幼兒來吃，假日會有許多觀光團用餐，會有些不便。
 Santis Kate.T. ,https://www.google.com/maps/contrib/118170700789678326054/reviews?hl=zh-TW,5,False,5,"定食套餐很好，吃的到食材的原味與對料理用心的溫度。套餐的角色分配也很明顯；不會有互相搶味的因素。

另外，煎茶很順口；不會過於濃厚。環境明亮閒靜。有機會會再來品嚐。"
 08林妮萱 ,https://www.google.com/maps/contrib/115137645924574487777/reviews?hl=zh-TW,5,False,4,"今天天氣有點熱~但是衝著168也要再來吃一次啦！
服務今天也不錯也落實拿醬料要帶口罩！不錯"
 Lin ,https://www.google.com/maps/contrib/114647015131680940752/reviews?hl=zh-TW,1,False,83,"今日來用餐，我本人是餐廳外場主管
老實說這樣的價位給我的服務真的太普普通通，服務生話術真的有待加強，領檯阿迪阿一臉死氣沉沉....給顧客的感覺不是很ok
主管們拜託督導一下好嗎？
餐點的部分真的普普，配菜太少"
 吳忠衛 ,https://www.google.com/maps/contrib/100486981158366555970/reviews?hl=zh-TW,5,False,4,很多人說服務不好，但人家沒收服務費本來就是半自助，服務的魏小姐一直都很積極的服務，原本看評價都說服務不好很怕踩雷想換別家，看來是多慮了。
 Sally Chuang ,https://www.google.com/maps/contrib/113184485342693682767/reviews?hl=zh-TW,5,True,23,座位寬敞，環境乾淨。個人鍋有四種湯頭可以選。除了火鍋之外還有其他蠻多種選擇的
 I’m Shan ,https://www.google.com/maps/contrib/112411134516882633903/reviews?hl=zh-TW,5,True,23,"我2/3號下午五點在打狗霸昆明店消費
結帳女服務生態度不良
消費結帳時我們還沒付款！點單出來我們連人都還沒離開！
跟服務生說有樣餐點要更改
但服務生卻是態度強硬說不行
我們也委婉的問說真的點錯且點單才出來不到1分鐘連錢都不能付！為什麼不能改單呢
服務生卻回答單出來了就是不能改！說我們在為難他（臉臭加口氣不佳
但其實當下我也可以不付款說我整個餐點都不要了！我不懂為何餐點完全還沒出，而且我們也不是點單十幾二十分鐘才說要更改！憑什麼不行改呢？
難得出來消費卻遇到這麼糟糕的服務態度
在昆明店消費了多次
從未遇過服務這麼差的人員！"
 柯遵義 ,https://www.google.com/maps/contrib/109804547961766397077/reviews?hl=zh-TW,3,True,17,"我和老婆吃火鍋，喜歡吃肉（我是牛肉為主）的應該會吃得盡興，牛奶魚久煮不柴，好吃。
美中不足的是不該突然想喝點單上的可樂，加點時候請取單大姐幫我勾選可樂一罐，菜都陸序上桌，惟獨不見可樂。請服務小姐幫忙看看，也未見回覆。只好把第二張加點單子勾選可樂一罐，請服務人員送飲料。她來回幾趟，好像沒事一般，只好直接找收銀櫃台，小姐說沒缺可樂，應該是耽擱，她會請服務人員儘快送來。
哈哈哈，老婆說我像小孩子一樣，外面有小七，想喝外面買就好，我就是不太服氣，連續三次，有或沒有竟然是沒人要理，我不是爛客人，做不來追加5人分沙朗牛肉，五人分白蝦糟蹋一堆可以吃的食物，只是一罐可樂要了四次，連影子都沒見到。
唉呀呀呀~~~~~"
 陳婕 ,https://www.google.com/maps/contrib/112935049882547139887/reviews?hl=zh-TW,3,True,242,"服務水準與環境水準一直不斷在下滑...真是令人難過，以前很喜歡這裡，但每一次都會發現整體表現一直走下坡.....
員工態度以前很有禮貌且親切，但上幾次去都懷疑自己是否欠她們錢？😢
有一次拿一盒牛肉，味道很怪，怪到懷疑人生。"
 C ,https://www.google.com/maps/contrib/107370750376006269953/reviews?hl=zh-TW,1,True,41,等了一個半小時詢問兩次為何肉都沒來，一個半小時後詢問主管。主管說：喔點這肉品人少所以不會那麼快，一上來的肉整個都是肥肉。還硬凹說我們都是這樣子的。
 Jenny Yang ,https://www.google.com/maps/contrib/111299535827060273075/reviews?hl=zh-TW,1,False,14,"醫護優惠到現場才得知需先訂位，宣傳沒有告示清楚。
打電話訂位，接電話的服務員態度超級差！！態度搞的像醫護訂位又來增加麻煩一樣。
還限定只有""醫院工作者""才可以使用優惠，所以在診所.安養中心.護理之家就不是醫護身份(?)"
 alisa kuo ,https://www.google.com/maps/contrib/100605280490250326433/reviews?hl=zh-TW,5,False,2,東西新鮮好吃，沙朗牛好吃
 張珠玲 ,https://www.google.com/maps/contrib/103605827272751758661/reviews?hl=zh-TW,5,False,1,"用餐環境整潔
服務員態度親切

菜盤紅白蘿蔔厚度
建議可以再對切
以利軟透

雞肉塊也希望可以對切
以免外柴內嫩"
 Lai Chu ,https://www.google.com/maps/contrib/102842317988463254852/reviews?hl=zh-TW,4,True,42,"很滑算的火鍋店，量大到吃不完，肉多菜盤多，來的是食量還好的女孩，就點普通的。不要點吃到飽的。就能吃很飽，飲料無限，但湯頭感覺還好。
但吃到飽可以點魚，湯頭不限，喜歡麻辣的差不多很滑算。
生魚片要分開點，合在一起給的魚片感覺，，，很小"
 YunJu Ye ,https://www.google.com/maps/contrib/100987398881154292496/reviews?hl=zh-TW,5,True,160,食材很新鮮服務人員態度佳物超所值
 Anne Lin ,https://www.google.com/maps/contrib/102737217064098978730/reviews?hl=zh-TW,5,False,6,餐點很好吃，服務超棒👍👍👍👍👍
 阿波 ,https://www.google.com/maps/contrib/100535362283550689169/reviews?hl=zh-TW,4,False,10,"新春假期再度相約打狗霸，寬敞的座位，飄揚的爵士樂，在寒風厲厲的嚴冬，身心都得到溫暖安頓。
來過一次，妳會上癮...聽jazz吃火鍋👍"
 Jessie C ,https://www.google.com/maps/contrib/101997762688794200841/reviews?hl=zh-TW,4,True,302,附屬於飯店內，還蠻多團體或房客用餐，這次來是從網路上預訂活動有加贈一盤蛤仔，火鍋選擇多，價位從二百多開始，份量蠻多的，只是環境比較吵些，桌子大講話較聽不到。
 Ar Kob ,https://www.google.com/maps/contrib/109669674268578831232/reviews?hl=zh-TW,4,True,19,極力推薦這真的是一家還算平價的火鍋店，一般湯頭就已經不錯喝了更別說是麻辣鍋的，它有單人餐點與4人餐點，但我個人不太推薦，因為覺得價位高，如果喜歡海鮮的可以參考，不管是個人單點或是4人單點還是大胃王餐點都不收一成服務費有限時間用餐，但價位最高的4人餐點沒有限時間。台北有兩家分店，一家在昆明街46號（昆明店）裝潢很漂亮，另外一家在延平南路110號（德立莊店）這兩家我都去過空間大坐位多德立店位置最多而且寬廣，但德立店比較特別的是它有地下一樓，而且是類似超級市場，你要什麼食材現拿現付費然後下鍋，煮來吃嘍😁，高雄有兩家但沒去過。PS:台北這兩家店都有旅店如果有朋友從外國來，南部來都可以住在這，交通車方便，個人覺得得立店最方便捷運搭到西門站4號出口走2分鐘就到了。記得要去請訂位人很多。
 Nikki Chen ,https://www.google.com/maps/contrib/101309232539758249207/reviews?hl=zh-TW,3,True,20,我覺得東西不是很新鮮，但是算蠻大的一間店，不用擔心沒位置，希望可以更注重食材新鮮，應該會有更好的業績！
 PARALLEL FANTASY SPACE CENTURY PLANET ,https://www.google.com/maps/contrib/114641741236057583607/reviews?hl=zh-TW,1,False,19,"衛生不及格的一家餐廳
飲料機有蟑螂（有每天清飲料機嗎？）
就連加湯壺裡面也有蟑螂（有沒有洗過）
咖啡喝到一半就看到整隻小強
（向店員反應時瞄到他們清理飲料機跟加湯壺裡面）
加湯壺打開就看到一堆小小隻蟑螂在裡面
我是吃到一半直接去廁所嘔吐...真是太噁心了"
 Sophia Ja ,https://www.google.com/maps/contrib/102804606012911872885/reviews?hl=zh-TW,5,False,3,服務環境非常好👍菜色不錯服務人員親切溫柔同事推薦來的時候下次聚會會再來
 Alan Chen ,https://www.google.com/maps/contrib/104372943134305461842/reviews?hl=zh-TW,1,False,3,"從來沒在google上面評論過餐廳，但今天吃的這家餐廳真心是我近幾年來吃過感覺最差的餐廳，幹話不多說直接列點敘述
1.服務生素質差到不行，介紹菜單講不清楚，每個人講的都不一樣，問個問題也答非所問，相當讓人啼笑皆非．
2.上菜速度慢到不行，點完餐後等了15-20分鐘才上只有湯底的鍋，後面加點各種菜也是慢到誇張，連罐裝汽水都可以等半小時．
3.吃到飽的選擇超少超爛，根本不划算，海鮮還超不新鮮，天使紅蝦丟下去煮整鍋湯臭掉，魚片滿滿土味，生魚片更不用說，超難下嚥
4.肉跟菜盤就是普通尚可接受，整個晚上菜吃得比肉跟海鮮還多
結論就是果不其然，我晚上回到家開始肚子絞痛，拉得慘慘慘，真心覺得吃到飽方案可以改名成吃到拉，同場至少三桌以上不含我們這桌再跟服務生抱怨東抱怨西，希望我的評論可以不要再有人去踩到這個大地雷，如果要去吃建議點一般單點火鍋然後不要點海鮮，但真心不推這家餐廳"
 陳曦 ,https://www.google.com/maps/contrib/113122517302630142476/reviews?hl=zh-TW,1,True,26,"醫護優惠上沒有說明要先訂位，到了現場也無法直接在櫃檯訂位，一定要打電話到指定的號碼才能訂位
另外
走進店家完全沒有看到店員也不知道要問誰，東張西望很久才有一位店員過來，問了幾位之後，回答一位，直接說一位不能使用優惠，另外詢問是否醫護優惠也是的時候，才說要訂位，但是位置都訂滿了

補充：剛剛打去訂位表示，臉書上的宣傳（4/20開始的活動，4/23才更新）有更新，但發給醫護的海報沒有啊，這算哪門子更新"
 M-y Li ,https://www.google.com/maps/contrib/110877560935929414044/reviews?hl=zh-TW,1,False,11,"朋友推薦所以來，但現在貴店服務態度從帶位就開始讓人覺得感受很差，連吃都不想吃
貴店生意很好，預約都滿了，所以現場候位的人就要被「良好服務」恭候，這樣能做到副理，可見貴店的教育都如此的優秀，
坐在位置上久侯也無人來詢問點餐。
祝貴店生意興隆"
 Phương Hữu ,https://www.google.com/maps/contrib/106787793734090537388/reviews?hl=zh-TW,5,False,1,今天跟朋友來用餐坐在1樓的位子點了石頭火鍋湯底好好喝！東西都是新鮮的！飲料不錯👍金蓮好熱情幫我們加湯🥰
 何孟潔 ,https://www.google.com/maps/contrib/101430230713452099395/reviews?hl=zh-TW,2,False,7,"至少最後還是有喝到再多給一顆...

反覆跟服務生反應飲料沒來都沒有用
吃完火鍋了都還沒來太誇張了吧
隔壁桌點了冰沙也是最後沒吃到就走了錢也沒退
拿到兌換券才來吃的
服務不改進發再多兌換券都沒有用的
發了我也不會來吃"
 張小昭 ,https://www.google.com/maps/contrib/110371858442911520012/reviews?hl=zh-TW,5,False,3,價格合理cp值高.之前吃過龍蝦套餐這次二訪吃一般石頭鍋一樣美味！
 Irene Chen ,https://www.google.com/maps/contrib/112120812463893419882/reviews?hl=zh-TW,3,True,168,人員太繁忙，食材不錯
 Hsin Y ,https://www.google.com/maps/contrib/114759459931997788997/reviews?hl=zh-TW,4,True,"1,019",份量很夠，日式和風的湯很好喝，喝到最後味道也沒有跑掉。食材新鮮、價格合理不貴！下次還會想吃這裡的鍋
 林冠婷 ,https://www.google.com/maps/contrib/112806060944408148828/reviews?hl=zh-TW,5,False,1,東西很好吃，值得一來
 連GEORGE ,https://www.google.com/maps/contrib/105532425449979362288/reviews?hl=zh-TW,5,False,2,餐點美味，氣氛不錯，服務佳，小點心很可口
 洪瑞陽 ,https://www.google.com/maps/contrib/114027723900858035016/reviews?hl=zh-TW,5,True,39,場地寬敞，還有氣派的中庭造景、座位數也很多！可以訂位，菜單選擇多樣（火鍋，石頭火鍋，壽喜鍋，生魚片丼飯等）價位不貴
 ZY Lee ,https://www.google.com/maps/contrib/100280076452476832738/reviews?hl=zh-TW,5,False,3,服務好環境漂亮滿奕非常貼心聽到湯頭比較鹹會主動詢問需要加清湯非常貼心
 SinSin ,https://www.google.com/maps/contrib/115186036869020199959/reviews?hl=zh-TW,5,False,6,"用餐環境超寬敞的，很舒服！
麻辣鍋好吃，也一定要加點水晶餃，絕配。"
 Kristy ,https://www.google.com/maps/contrib/110917451220875203047/reviews?hl=zh-TW,2,False,4,"魷魚的外膜沒有處理好口感差就算了嚼到天荒地老還差點沒被噎死！虧他還是老字號海鮮餐廳旗下店真的是很失望，隨餐附送的飲料也很難喝像是化工調成的水果冰沙。
不管是在服務上還是用餐的環境上，很多細節都做得不夠周延，像是座位的安排都得與陌生人尷尬的面對面吃飯還要坐在超高腳椅上，對個子太高或太嬌小的人來說都很不舒適。"
 張竹萍 ,https://www.google.com/maps/contrib/112849734227702607498/reviews?hl=zh-TW,4,True,464,物美價廉！cp值算高！在西門町的地點
 Ting Chang ,https://www.google.com/maps/contrib/105128295227161249234/reviews?hl=zh-TW,1,True,400,地下一樓的<前鎮水產>，有一位穿著黑色應該是領班級的女性服務人員，態度非常的差，提供錯誤的資訊，讓客人白白在那邊花了二30分鐘排隊，客人提出了反應還不會認錯道歉，海霸王你們員工教育訓練是怎麼做的，沒有問題處理能力和臨場應變能力嗎？還是說公司比較大間員工就可以自以為是的一直打斷客人的提問，並且用傲慢的態度來回應自己的過錯嗎？態度比較囂張就是贏家嗎？我相信現在餐廳這麼多間，你們這種態度，民眾早晚會看清的。
 匡玟宇 ,https://www.google.com/maps/contrib/111839079711757992577/reviews?hl=zh-TW,5,False,20,好吃又超新鮮
 Annie Ann ,https://www.google.com/maps/contrib/114506520177673273474/reviews?hl=zh-TW,5,False,9,"用餐環境好，服務人員態度佳，
食材內容豐富，海鮮鮮美。"
 Henry Wei ,https://www.google.com/maps/contrib/114814289948844231562/reviews?hl=zh-TW,1,False,3,"德立莊(吃牛排下午茶的那部分)
很差很貴很髒。
飲料杯幾乎沒一個是乾淨的；到處都是小飛蟲；有個又肥又瘋的奧客死肥婆是常客，聽服務生私下小聲聊起，經常跟其他客人吵架。第一次來用餐就看到真的有個瘋婆子客人在跟另一名男客人吵架，最後被那男客人罵跑！真是大快人心啊！
總而言之，絕對不會來第二次，原本還打算推薦給其他長輩，吃了一次後悔一世，絕不推薦！"
 趙旭華 ,https://www.google.com/maps/contrib/103526987323266366251/reviews?hl=zh-TW,4,True,191,食材不錯，價位中上
 康榮富姚大為 ,https://www.google.com/maps/contrib/109857905482251019411/reviews?hl=zh-TW,2,True,33,餐點普通，火鍋的沾料略顯少，二人份的菜竟然用一盤裝在一起，湯底味道略顯不足，並沒有讓人想再次去的感覺
