user_name,user_profile_url,rating,local_guide,comment_num,comment_text
 陳維澤 ,https://www.google.com/maps/contrib/109831760276411817323/reviews?hl=zh-TW,1,False,4,"服務很差！態度不好！點一輪要30分鐘！
只點了一份肉四瓶飲料需要花30分鐘？

加湯服務員把湯底下的渣渣全倒進我的鍋了"
 Alberta Hsiao ,https://www.google.com/maps/contrib/101405112075313376167/reviews?hl=zh-TW,4,True,281,食材還不錯，就是自助bar少了些，如果增加熱飲和冰淇淋會更好😐
 amy chang ,https://www.google.com/maps/contrib/106391108667296961340/reviews?hl=zh-TW,5,True,172,"住宿一泊二食

晚餐雖說餐點份量減半
但吃完也有點飽
環境很好寬敞

食材滿意"
 David Chan ,https://www.google.com/maps/contrib/117078518232104219709/reviews?hl=zh-TW,5,True,45,"這麼豐富的定食火鍋午餐都是TWD1,388二人價錢（總數），海鮮好新新鮮，配菜都好好味，牛肉定要選擇雪花肥牛👍🏻👍🏻👍🏻。在這裡是點餐後先付錢，食物就好快送上，服務員態良好有禮貌，地點鄰近西門町站步行數分鐘，座位舒適空間歡堂。性價比高"
 Hungpu Lin ,https://www.google.com/maps/contrib/100206687138284433228/reviews?hl=zh-TW,4,True,102,價格適中，麻辣湯底不是單純辣油，有中藥湯底。有單點項目可以加點，也有日式料理可以加點。
 Hanshin Feng ,https://www.google.com/maps/contrib/110414289881362049707/reviews?hl=zh-TW,3,True,841,"這一次利用老婆到附近開會的空檔時間，一個人到這家餐廳吃吃看，反正沒來過想試試，故意點最普通的套餐試味，結果味道普通，小菜和主食搭配的不是很好，很粗糙，連最基本的味噌湯都做的像速食包泡出來的味道似的，不是大碗就代表是好吃的喔。這種基本功作的不夠紮實，可以想像到其他的套餐或火鍋類是不是都差不多吧(看到其他桌上擺的副菜似乎都一樣耶)
統一菜色&味道，握壽司的飯粒水水黏黏的，是師傅手工不到位還是製作握壽司前沾太多水才再捏飯?還是廚師是新人?飯粒稍許偏酸，使的握壽司吃起來怪怪的，不加以批評是好是壞，就是想嫌它菜色和價位不符，不會有那種吃過後會想再去的那種感覺就對了。說不定是我挑嘴吧?反正我定位它是今後有人揪也不會去的一家日式餐廳就對了。
壞的說了，好的有要提。就是它的地理位置好，餐廳內席次也多，是個供多人一同聚會的地方是沒錯。整體上只能達3個星的評價吧。"
 Cid Tung ,https://www.google.com/maps/contrib/100050584312754962426/reviews?hl=zh-TW,5,True,207,座落在舊力霸百貨內，氣勢磅礡的一家餐廳，地下室的中庭有噴水池跟石獅裝飾。我點的是和風牛肉鍋，肉質鮮嫩，價格以台北來說相當便宜，菜盤的東西也很豐富，適合各式聚餐的好地方
 Tsung Hui Hung ,https://www.google.com/maps/contrib/108554098560371474143/reviews?hl=zh-TW,5,True,20,和風鍋底不會太鹹，口味剛好，非常適合長者食用，店裡氣氛良好
 Jessie Liu ,https://www.google.com/maps/contrib/112027079718130742162/reviews?hl=zh-TW,2,True,78,"看到培根牛上菜時直接傻眼，這肉片超級小，涮過之後就跟金桔一樣大而已...
一鍋250元雖然平價，但品質也是要顧一下。"
 melody melody ,https://www.google.com/maps/contrib/112597433927317899444/reviews?hl=zh-TW,4,True,823,"在台北要找到空間如此大的火鍋🍲店太難得了！
但是我力推同棟大樓B1的「前鎮水產」，今天帶媽媽去吃「前鎮水產」是海霸王最新的火鍋超市，在德立莊的打狗霸B1，捷運西門站四號出口直走就是了！到了B1就是登記處，登記好坐位置後，就可以拿菜籃🧺車去選購自己的火鍋料，60元一個人含鍋底＋飲料＋滷肉飯+麵是仼選吃到飽，超級好玩！尤其麵的種類繁多，加上魯肉飯非常好吃，醬料選擇又多，喜歡混搭的你一定喜歡💕！每様單品價格平實，CP値太高了，昨晚五人吃，還因為吃石頭火鍋，在包廂用餐，大包廂內還有沙發呢！超級高級！用餐🍴時間90分鐘！建議不要一次買太多，低銷一人250元！值得去"
 Ruyu Yuan ,https://www.google.com/maps/contrib/105217886240116821244/reviews?hl=zh-TW,2,True,650,"菜色和餐點CP值高,餐廳的空間感覺很時尚,但是用瓦斯爐燒,有點安全上的顧慮,"
 JH. ,https://www.google.com/maps/contrib/100727197674155303709/reviews?hl=zh-TW,2,True,198,冷氣超弱，吃到全身流汗，要找服務生也常常找不到，超無言
 Frances Chen ,https://www.google.com/maps/contrib/103193355878241108145/reviews?hl=zh-TW,4,True,559,今日吃火鍋，還不錯吃，下次有機會要來試試吃到飽的火鍋^^
 TSAICHEN YANG ,https://www.google.com/maps/contrib/115750522556999846515/reviews?hl=zh-TW,3,True,520,用餐區很大，星期六七點快八點到可直接入座，環境乾淨，菜盤新鮮，石頭鍋有很多紅蔥頭，湯頭普通
 Chu Ella ,https://www.google.com/maps/contrib/105333746429474626939/reviews?hl=zh-TW,5,True,36,"寒冷的天氣大家一定都想吃鍋，點了雙人套餐還吃不完！份量非常足也很新鮮
服務人員很忙，辛苦了！你們都很棒
也感謝你們幫我們打包！
同樣身為服務業的我，可以明白忙不過來、分身乏術的感覺！打狗霸的員工辛苦了！謝謝🙏
給五顆心都不夠😄"
 Joe Wang ,https://www.google.com/maps/contrib/100175370502690110582/reviews?hl=zh-TW,3,True,139,"-訂7個位子，得到6個，在取得同意後，共鍋的兩人不收共鍋費用。
-B11桌（大門第一排）因為門開開關關的風流，溫度很不穩定，很不舒服，加上因為跟家人來，有訂位，給這個位置不妥，希望能改善。
-肉好吃，份量也夠。
-菜盤正常，蟹肉條感覺比一般好。
-有個服務人員（講話有印尼口音）來跟我講話，我沒聽清楚內容，然後有另外一個服務員來把她拉走。然後？到底發生什麼事了？？
-廁所沒有明顯的標示，男廁空間很小，擦手紙滿了。
-加點的飯等的太久，建議一開始就先決定好，不然就等等離開再吃點別的填胃。"
 Chen葛蕾絲 ,https://www.google.com/maps/contrib/116575743071296080290/reviews?hl=zh-TW,2,True,46,"入座時店員告知點兩鍋送價值$149的鱸魚感覺還不錯，但是我跟朋友都不吃魚，送餐的服務人員說可以打包，先幫我冰起來，但因為不是馬上回家，後來離開前，詢問收銀人員能否晚點來取，收銀員面有難色的說：應該不行吧！雖然覺得店員不懂變通，的但也不想為難服務人員，就只好放棄送的鱸魚

點餐時收銀人員也漏點，還好這間店沒有收服務費，因為其實也沒太多服務可言

用餐前跟用餐結束離開前都去廁所要洗手，但是都沒有洗手乳，防疫當前，洗手乳一個多小時都沒有補充很不ok"
 In Jet Feng ,https://www.google.com/maps/contrib/100389577459487804620/reviews?hl=zh-TW,4,True,35,食物，環境都很好，但人員的教育訓練有待加強，結帳動線設計也仍有很大的改善空間
 H Wen ,https://www.google.com/maps/contrib/116204544564656786272/reviews?hl=zh-TW,4,True,174,這個環境、這個價錢，真的非常適合聚餐，份量也相當多，飲料可以暢飲，空間寬廣舒適，未來也會介紹去用餐。
 Wayne Chen ,https://www.google.com/maps/contrib/111698291988629585589/reviews?hl=zh-TW,5,True,101,吃到飽的餐太讚了，蔬菜肉海鮮丸子鴨血麻辣豆腐基本盤就吃不完了，生魚片好吃啊！
 PUIFEN LAU ,https://www.google.com/maps/contrib/113476901346915824477/reviews?hl=zh-TW,5,True,31,"價格合理肉品食材很新鮮地點佳交通方便！
funnow訂位打卡有送肉
當月壽星還有打8折"
 Ying Chan ,https://www.google.com/maps/contrib/102378500243155871279/reviews?hl=zh-TW,2,True,73,口味上覺得還可以，但菜盤好少，石頭火鍋湯很少，不如你去吃石二鍋~~~但裝潢不錯。
 JOE HSIEH ,https://www.google.com/maps/contrib/117400925905447768410/reviews?hl=zh-TW,2,True,733,服務普通動線詭異坐長廊服務員一直猛推車跟奔跑，這樣顧客感受會好嗎櫃檯結帳老鳥在顧客面前還一直猛罵菜鳥服務是這樣做的？？！
 林凌峰 ,https://www.google.com/maps/contrib/108114217787009597507/reviews?hl=zh-TW,4,True,177,"食材很新鮮,好吃的東西最主要的因素就是食材要新鮮。"
 Adam Chen ,https://www.google.com/maps/contrib/101027954704702923223/reviews?hl=zh-TW,1,True,982,很糟糕的店，要六百元吃到飽出的生魚片，可以請他們自己吃吃看，再拿出來好嗎？怪不得沒有人來吃了喔！
 ANGEL KING ,https://www.google.com/maps/contrib/100529897369747349634/reviews?hl=zh-TW,4,True,487,"超級寬敞的用餐空間
今天點的是鮮魚和風鍋，吃的舒適，可惜飲料僅醋飲和煎茶可選"
 Hua Hua ,https://www.google.com/maps/contrib/106481227644240939121/reviews?hl=zh-TW,5,False,11,食材新鮮服務很好下次一定會在來用餐😍
 DEAN HSU ,https://www.google.com/maps/contrib/102195231071050566633/reviews?hl=zh-TW,3,True,394,中庭及地下室用餐環境佈置很有意境，服務態度好，食料擺盤優，麻辣鍋香麻不辣
 淼淼淼 ,https://www.google.com/maps/contrib/115801269093706438577/reviews?hl=zh-TW,1,True,50,"過年湯頭鹹到不像話，魚也不新鮮，煮湯後很臭！
東西少給，還認為我們已經吃完了！
肉非常非常薄～薄到很透光啊"
 陳比比 ,https://www.google.com/maps/contrib/115972625936054843406/reviews?hl=zh-TW,5,False,16,"西門Cp值最高的火鍋店
不收服務費
菜盤還有蝦子
副餐可以選的也很多
最喜歡副餐的滷肉飯了

Ps假日一群人怕沒地方吃飯
來這邊就對了
用餐空間超大"
 Howard Shen ,https://www.google.com/maps/contrib/112466753351515789067/reviews?hl=zh-TW,1,True,84,開店就不要怕人吃，吃到飽的價格，給的份量居然是這樣，四個大人給二塊凍豆腐和三片絲瓜是欺負人嗎，加點至少等20分鐘才送來，百分百雷店!
 王品喻 ,https://www.google.com/maps/contrib/115274478386384508176/reviews?hl=zh-TW,5,True,83,料好味美，環境舒適且頗有氣氛。
 York Lin ,https://www.google.com/maps/contrib/115057537865134155970/reviews?hl=zh-TW,4,True,23,食材還不錯，服務人員態度也好，但我們12:33點餐，白飯1:04才來，湯底食材都上了，唯獨沒飯，反應了3.4次才終於送上，那天客人不多，不明白兩碗白飯為什麼可以拖這麼久
 Chris Wei ,https://www.google.com/maps/contrib/104213972509148730938/reviews?hl=zh-TW,4,True,109,用餐環境寬敞舒適，位子多，就算熱門用餐時間，也不用等太久，小火鍋內容豐盛，用餐過程讓人蠻享受，很適合全家或朋友間相約同來聚餐。
 林敬恩 ,https://www.google.com/maps/contrib/106116902296900289643/reviews?hl=zh-TW,3,True,75,結帳速度超慢，火鍋湯底沒味道，肉也沒什麼味道，生魚片還可以，生魚片壽司也還ok
 Mark Wu ,https://www.google.com/maps/contrib/112084732964897877673/reviews?hl=zh-TW,5,True,263,"價格實惠肉類食材的價格很有誠意
滷肉飯跟泡麵飲料能無限供應"
 Desh W ,https://www.google.com/maps/contrib/115516352386837774779/reviews?hl=zh-TW,3,True,98,"交通方便，位置最多僅有六人座，餐點選擇較單一。
價格中等，飲料杯建議使用前自行再清理過，其他沒什麼問題。"
 Evan Wu ,https://www.google.com/maps/contrib/109051305360567099630/reviews?hl=zh-TW,3,True,143,還不錯！適合預算不高的團體聚餐，食物尚可
 Enoch Hsu ,https://www.google.com/maps/contrib/106016538662220735301/reviews?hl=zh-TW,5,False,13,這裡很吃吃，很多選擇，服務好，用餐環境舒適
 俊平 ,https://www.google.com/maps/contrib/111120787384452051454/reviews?hl=zh-TW,2,True,469,菜色看起來感覺很豐富但吃完卻有空虛感醬料台有點單調今天吃的是麻辣湯底感覺少了一味
 吳麗雯 ,https://www.google.com/maps/contrib/115085187375382326446/reviews?hl=zh-TW,5,False,1,"餐很新鮮，很好吃
交通方便，環境優美
石頭鍋好吃"
 Davee Blue ,https://www.google.com/maps/contrib/109542194006024433380/reviews?hl=zh-TW,4,True,171,"1.在捷運出口旁，交通方便。
2.位在飯店內，裝潢有氣氛。
3.食材新鮮，自製沙茶醬棒。
4.價格與食材相比下很實惠。"
 朱朱 ,https://www.google.com/maps/contrib/116774053900446619234/reviews?hl=zh-TW,5,True,58,"服務人員很棒，餐點新鮮好吃😋
平價火鍋店👏👏👏"
 鍾晴羽 ,https://www.google.com/maps/contrib/115942859960735382435/reviews?hl=zh-TW,3,False,111,"跟男友一致認為培根豬太硬了！！
不想咬所以最後剩下一堆肉🥲🥲
飲料種類也好少～"
 羅元佑 ,https://www.google.com/maps/contrib/113651059074227368596/reviews?hl=zh-TW,3,True,391,"這次吃的是打狗霸裡面的定食系列，價位大多落在180到240間，以生食壽司來說算是很划算，但相對的品質就沒那麼精緻，個人覺得炙燒鮪魚捲還不錯，但炙燒的香氣可以再加強一點，特色不足；其他蝦子或生魚都滿普通，僅高於爭鮮等級，醋飯也不是很優，但整體來說以這價位吃得到這樣的定食和環境已算不錯。
這裡服務生似乎有不少是外籍，中文可溝通但似乎不是非常好，用餐環境寬敞舒適，裝潢也精緻，有茶可以暢飲，算是平常想吃好一點又不用太高檔的好選擇。"
 Lo Steve ,https://www.google.com/maps/contrib/114706474952910049668/reviews?hl=zh-TW,2,True,318,座位安排在後側，燈光不足，又有一排推車置放在旁，員工推來推去，用餐感覺很差
 Eddie Chou ,https://www.google.com/maps/contrib/106413843660603392042/reviews?hl=zh-TW,5,False,2,交通方便。料多實在。很適合家庭聚餐。下次一定再來用餐。
 盧滋璽 ,https://www.google.com/maps/contrib/118104286379874641187/reviews?hl=zh-TW,2,True,66,店內座位寬大舒適，環境算是美觀安靜，價格實惠，但是食材比不上台北，魚丸軟軟粉粉的沒有彈性，蛤蜊完全沒有浸泡乾淨，湯底全是沙子超噁心的，害我不敢把湯匙晃動，以免沙子全跑上來沾到別的食物，吃得滿嘴都是黑黑的沙子。結帳先生超慢，前面排隊只有兩個人，我就等了差不多二十分鐘，旁邊另一個結帳小姐更誇張，從我排隊開始到結束還沒有結完一個帳單，真的好佩服佩服她。來過了一次用餐就不想再來第二次了。
 JennyG chiu ,https://www.google.com/maps/contrib/114236899396962093259/reviews?hl=zh-TW,5,True,169,食材新鮮好吃，麻辣鍋也很夠味，推薦。
 夏凱莉 ,https://www.google.com/maps/contrib/112458841985752390135/reviews?hl=zh-TW,4,True,130,冬天最愛的小火鍋～留給自己慢慢享用、環境明亮乾淨、食材分量超足夠～
 Sochi Lin ,https://www.google.com/maps/contrib/111541517867054403220/reviews?hl=zh-TW,1,False,7,今天5/12傍晚5點20分左右，到德立莊店買外帶餐盒，門口女性員工一直在講電話，而且沒提供發票，回頭詢問是否有發票?另一位員工進去拿，等了超過5分鐘，後來從門口保溫箱拿一張中午開的發票應付。
 shin chang ,https://www.google.com/maps/contrib/105461863293612967269/reviews?hl=zh-TW,4,True,70,附近有收費停車場，消費方式有個人鍋、日式定食、吃到飽或單點，不另收服務費，小火鍋普通，飲料讓人不想續杯，但用餐環境不錯，選擇多樣，下次還會再來嚐試
 Monica Z ,https://www.google.com/maps/contrib/112524283717328011799/reviews?hl=zh-TW,5,True,57,"藥膳麻油鍋底滋味濃醇，好吃又暖身，適合冬季跟親友一起享用！
肉盤、菜盤、海鮮盤都充滿誠意，大推！"
 黃德智 ,https://www.google.com/maps/contrib/102790517382420387710/reviews?hl=zh-TW,4,True,"1,478",前鎮水產，這是海霸王新開的超市火鍋，火鍋料種類超多樣，價錢也合理。
 Ed Lu ,https://www.google.com/maps/contrib/111147868174587077926/reviews?hl=zh-TW,1,True,79,"雷店誤入
用「95%純肥油豬肉」充當「全豬松阪豬肉」，其他產品的用料等級應該也堪慮
深覺受到欺騙！"
 ㄓㄓ喳喳 ,https://www.google.com/maps/contrib/114187869409246877920/reviews?hl=zh-TW,5,False,1,"用餐環境讚，餐點很好吃！服務也很周到～
壽星可以打八折"
 Seph Yang ,https://www.google.com/maps/contrib/112744804988501590331/reviews?hl=zh-TW,3,True,67,"吃了三次只有吃到飽很划算海鮮非常新鮮鮪魚生魚片不錯肉品質普通餐點的份量很充足
喜歡吃海鮮的人滿推
沒有水果而且飲料太少也沒有冰淇淋

單點非常普通偏貴不推"
 小宇宙 ,https://www.google.com/maps/contrib/110251642572965552293/reviews?hl=zh-TW,4,True,769,石頭火鍋不錯吃，裝潢也不錯，氣氛佳。
 choko senkawa ,https://www.google.com/maps/contrib/112760675097781678294/reviews?hl=zh-TW,5,True,29,火鍋好吃，食材乾淨新鮮，用餐環境寬敞，離捷運站很近，來西門逛街的用餐好選擇！而且價錢也不貴，CP值很高
 Kai-Chieh Tyan ,https://www.google.com/maps/contrib/117072204742096396153/reviews?hl=zh-TW,1,False,12,"拜託不要被裝潢騙了，服務完全0分，食物也毫無cp值可言，生魚片要切半小時，用餐前也未告知茶水自取，上來味增湯還是冷的
師傅啊師傅，您的刀工連蘿蔔都切不斷，是今天唯一讓我笑出來的項目"
 陳誌章 ,https://www.google.com/maps/contrib/104524993409848545310/reviews?hl=zh-TW,1,False,7,本來很期待，但米心沒熟，湯又一半差不多又溫的⋯⋯沒有熱湯
 紀維芬 ,https://www.google.com/maps/contrib/113212533760664878547/reviews?hl=zh-TW,4,True,116,今天吃498食材有些縮水，玉米有瘀青😅高麗菜及肉品都不甜可惜😢老公沒吃飽(只好煮南瓜😂)
 CHUN-FU Hsieh ,https://www.google.com/maps/contrib/103335752672785439547/reviews?hl=zh-TW,2,True,"1,689",火鍋是最爛的食物，毫無廚藝可言
 mrgame070 ,https://www.google.com/maps/contrib/115283911989692661395/reviews?hl=zh-TW,3,True,137,高貴普通貴，聽說要出吃到飽了
 郭峻宇 ,https://www.google.com/maps/contrib/115358381754177928721/reviews?hl=zh-TW,3,True,39,東西是蠻好吃的，但是員工點餐完後的送餐速度真的很慢，桌上原本付得菜盤都吃完了，東西才來約一兩份，後來因為主管幫忙點菜才有恢復正常。這三顆星是給當天那位主管的。如果沒有她會0分
 Chen George ,https://www.google.com/maps/contrib/101946019090382278134/reviews?hl=zh-TW,5,False,2,這邊餐點不錯我吃了和風雙拼鮮魚好吃吃到都有點撐了哈哈服務員妮萱很好
 Emma Hung ,https://www.google.com/maps/contrib/107858921426110777871/reviews?hl=zh-TW,3,True,155,"平日下午5點多去，服務沒有大部分評論的那麼糟。但剛進去經過生魚片的料理台有點魚腥味，後來要走時就沒有了。

個人鍋300上下就有，點了霜降與沙朗。菜盤蠻好吃的，肉質o普通，肉的厚度算厚，也蠻多片的，不是大胃王的話，份量很夠。單點滷豆腐有點麻辣，很好吃。吃粗飽ok。"
 Joyce Li ,https://www.google.com/maps/contrib/113736041496349716051/reviews?hl=zh-TW,5,True,61,店家生意很好，雖然服務生臉上雖然少了點笑容，但沒有遇到其他評論上說的那麼差勁，服務生很辛苦值得體諒他們，遇到問題他們也會快速解整體來說不錯
 趙小士 ,https://www.google.com/maps/contrib/114804786761406682401/reviews?hl=zh-TW,4,True,75,東西好吃，湯頭實在，最重要的是肉量超豐富，絕對讓你吃飽撐著的呀！
 Issa ,https://www.google.com/maps/contrib/103245424901263721007/reviews?hl=zh-TW,1,True,474,服務生完全不會介紹，加湯跟醬料區放超級遠，肉薄到一個極致，菜盤沒料又少，湯頭也完全不行錢都都可以直接打趴，打狗霸就是看什麼時候倒而已
 Danny Lin ,https://www.google.com/maps/contrib/100865494893213842507/reviews?hl=zh-TW,5,True,13,"火鍋吃到飽CP值超高，超大蝦子（頭一份),超大仙貝，上肉速度超快，四個人趕工都趕工都趕不過。我超愛花枝，超好吃~"
 林豐榮 ,https://www.google.com/maps/contrib/105220004121495173532/reviews?hl=zh-TW,2,True,476,食材新鮮，魚片有一點點土味，菜盤火鍋料都不錯吃，店內空氣不流通，沒開冷氣，吃到中後段有點悶熱。
 DAN WU ,https://www.google.com/maps/contrib/110261377582969682804/reviews?hl=zh-TW,1,True,323,服務人員訓練待加強，送菜流程過慢，才剛吃完而已，馬上桌面被清空並被要求協助收拾碗筷，明顯催人離開。
 曾英倫 ,https://www.google.com/maps/contrib/108878322317869306474/reviews?hl=zh-TW,5,True,110,"喜歡這邊的用餐環境，
東西也好吃，加油喔！"
 Sammi Sammi ,https://www.google.com/maps/contrib/106177997213308462099/reviews?hl=zh-TW,5,True,142,（海陸雙鮮雙人套餐）龍蝦和蝦子味道鮮美有新鮮，覺得物超所值！唯一缺點就是夏天去吃時覺得冷氣不夠強，還沒開吃時就覺得不涼，開吃後開始狂流汗.
 Pat H ,https://www.google.com/maps/contrib/103245016430205464506/reviews?hl=zh-TW,3,True,77,"打狗霸和前鎮水產入口是同一個，前台只有一個人同時確認訂位與現場候位的客人導致等候時間有點久
當天前往打狗霸並在B1用餐，結帳的時候該到哪個櫃檯也沒有明確的指示
不過餐點內容與價錢都可以接受，服務人員態度也還算專業與親切"
 黃kobe ,https://www.google.com/maps/contrib/115742665064483676379/reviews?hl=zh-TW,2,True,410,四不像，牛排館不像牛排館，吃到飽不像吃到飽，東西少味道不喜歡
 Emma Lee ,https://www.google.com/maps/contrib/102552553284979833501/reviews?hl=zh-TW,3,True,29,"湯頭好喝，肉品質也不錯
唯一可惜。。。。
因為玻璃杯不潔，沒喝到飲料
下次想去試試季節鍋物（第二鍋半價有點心動）"
 鴻基詠康中心 ,https://www.google.com/maps/contrib/104939405866671712935/reviews?hl=zh-TW,5,True,76,牛排厚切，芋頭塊好吃(雖然20cm縮小到10Cm。
 Sandy Liu ,https://www.google.com/maps/contrib/110304773588101375250/reviews?hl=zh-TW,3,True,104,菜盤豐富，但白飯等到最後，催了三次以上才來……
 陳和杰 ,https://www.google.com/maps/contrib/114455490723362340391/reviews?hl=zh-TW,3,True,41,新鮮好吃，家庭聚會推薦地方。
 Rita Chen ,https://www.google.com/maps/contrib/109372913385716597633/reviews?hl=zh-TW,5,False,9,物超所值又美味，服務親切環境優美，值得一來再來~推推!!!!
 Liju C ,https://www.google.com/maps/contrib/108443027930556957717/reviews?hl=zh-TW,3,True,467,"是參加旅行團去吃的，在地下室用餐，空間很大環境不錯。

肉是事先切好的，上桌時肉都攤了
吃的時候覺得菜盤量有點少，有空虛感
後來到googlemap看別人的照片，少了好幾樣食材"
 楊志傑 ,https://www.google.com/maps/contrib/117948046240902601189/reviews?hl=zh-TW,5,True,132,食材還不錯，只是上菜有點慢。
 Crould ,https://www.google.com/maps/contrib/100093390040425126139/reviews?hl=zh-TW,5,False,8,以個人小火鍋的角度來看相當好
 葉品佑 ,https://www.google.com/maps/contrib/109563575856691628467/reviews?hl=zh-TW,5,False,5,芷菱餐桌服務很好，非常好的用餐體驗。吃的很飽
 Yang-Ming Huang ,https://www.google.com/maps/contrib/116132481025124307565/reviews?hl=zh-TW,1,True,81,"場地不錯，東西有點騙錢，不要點什麼套餐，說什麼餃類盤，結果少到不行的雙人菜盤放在一起，讓人傻眼。然後附的生魚片不新鮮，只吃了一口。點餐流程很沒效率，人多的時候要排很久

所以，場地大概是唯一的優點"
 林申樺 ,https://www.google.com/maps/contrib/100126352087745990448/reviews?hl=zh-TW,1,True,61,"真的如評分，傻眼，整體價格味道Cp低

蛤蜊臭掉換來還是一樣，最後說換魚，服務員還驚訝的語調😐我才驚訝！因為我們點的那是一大碗的大海鮮，蛤蜊看起來那麼大那麼可口，換那個不怎樣的魚片…因為那魚片真的也…說它評價我也昏了，平價好吃的多的是"
 Claire lee ,https://www.google.com/maps/contrib/113325291593238715958/reviews?hl=zh-TW,3,True,275,場地裝潢的很漂亮，但火鍋cp值太低
 王嬿琳 ,https://www.google.com/maps/contrib/100949508934147179091/reviews?hl=zh-TW,4,True,16,"餐廳整體空間寬敞，有開放式吧台坐位，也有隔間提供較獨立的用餐空間。
食材部份：海鮮新鮮，肉片稍薄，肉質中上。
湯底藥膳鍋則是太鹹了，完全不需要再用沾醬佐料。
服務員收空盤和加湯速度都很迅速，
。因餐廳也有做團客生意，所以當晚用餐完畢無法久坐就被請出去了。
Thewholeplaceisspaciousandprovidebothbarseatandcubeseatforaquieterdiningspace.
Theseafoodwasfresh,thequalityofmeatismoderateandnottothick.Thehotpotsoupwaswaytoosaltythatotherdressingisnotneededatall.
Thewaitercleaneduptheemptyplatereallyquick,sodidtheyaskyoutoleave."
 KARL A佑珩 ,https://www.google.com/maps/contrib/106972578556237096626/reviews?hl=zh-TW,1,True,22,真的很不好吃，菜盤和肉盤都很稀疏，點石頭火鍋，發現湯裡加了大量的油蔥酥，果然喝起來有統一肉燥麵的味道....真心推薦不要來，去錢都吃實在的吧!!
