user_name,user_profile_url,rating,local_guide,comment_num,comment_text
 RT Y ,https://www.google.com/maps/contrib/100231786323974483829/reviews?hl=zh-TW,2,False,79,"認真寫食記
平常都吃馬辣，今天馬辣都滿位改吃打狗霸
1.海鮮部分，小花枝有處理乾淨（超級加分）/蝦子普/魚片軟嫩QQ很好吃/扇貝冷凍的很腥。
2.肉品第一次點跟第二次點一樣多，而且品質還是很優，牛肉真的都很好吃
3.菜盤擺盤用心，食材多樣化，金針菇處理很乾淨（不會有土或是只切掉根部一點點）
4.可以續點生魚片的吃到飽真的還蠻特別的

缺點
1.因我與朋友都不愛火鍋料，點餐時詢問，可否菜盤將火鍋料拿除，畢竟都不吃火鍋料（覺得會浪費食物），店員：沒辦法，不然你們菜盤都不要，全部用單點的。
之後點餐也跟店員說「菜盤不要」但對方仍給了我們，似乎溝通出菜部份有誤。
2.麻辣鍋跟和風鍋，湯頭真的都很普，沒什麼驚艷的，尤其麻辣鍋不能調整辣度（加辣），只能調成不辣（店員說加白開水或高湯，如果擔心太辣）。
3.調味料部分，蘿蔔泥一堆水分，蒜泥也一堆水分，都沒什麼味道，沒有黑醋，但蔥準備很足。
4.飲料吧選擇很少。
5.廁所靠近洗手台那間，鎖頭有一處毀損，可以直接看到如廁的人，卻也沒寫勿用，進去要鎖門才發現，洞超大，且沖水無力，廁所骯髒且臭。
6.桌上衛生紙盒髒的不可置信，工作人員比用餐人數多，將我們帶位後，衛生紙只剩1/5，並沒有補齊。
7.用餐的餐具都沒有洗乾淨，不知道是不是一直擺在桌上的關係，還是真的沒洗乾淨，都有黑色髒髒的，我拿衛生紙擦拭，可清除。
8.一踏入店內地板黏的不可置信，一直有看見工作人員在清掃，但仍未改善。
9.吃到飽部分要續單，因店員不會一直巡，所以填寫完單子，要親自拿到櫃檯，希望可以增設按鈴，或是定點巡視，因為加湯什麼的，也是要等人送餐上來，才可以有店員可以幫忙。
10.千萬不要點老油條，真的有夠難吃，也不要再加點鴨血，真的「超級鹹」

最重要的特色是店員包容力很強大，有一桌小孩大吵大鬧哭著吼著大概我們用餐兩小時沒停過，用餐快結束前，因為店內沒人，小孩直接在餐廳沒人處的吧台奔跑各種玩跟尖叫，沒人要制止，真的很適合改成親子餐廳。

他們的食材品質真的很好，但也止於此。"
 謝宛窈8車 ,https://www.google.com/maps/contrib/105507221388883850749/reviews?hl=zh-TW,3,True,80,"今天特地去西門站-海霸王旗下的打狗霸海產火鍋店消費,嚐味道,在門口服務人員說中午用餐時間90分鍾下午只到2點,我1點前進去吃時間應該還很足夠,menu上的價位不貴約300元以上蠻親民的,也有日本料理,生魚片及手握壽司可以另外加點,用餐期間服務人員也會主動詢問是否加高湯桌邊服務,飲料只有3種,芒果味和冬瓜茶及白開水~菜盤和主餐雙魚盤$331不貴,一個人的份量剛好足夠~人多也可以點海鮮豪華套餐,食材新鮮不錯~有機會會再去嚐先"
 Sindy Oppo ,https://www.google.com/maps/contrib/108107155411649014202/reviews?hl=zh-TW,5,True,56,服服務人員態度好，豬排厚實做的很好兩大塊，鱈魚排也滿滿蛋白質，沙拉很夠意思蝦有三隻，有自助吧（太飽沒拿咖哩飯）飲料種類繁多，個人喜歡醋類，也有冰淇淋，平日中午這樣前菜主餐甜點跟自助吧299很超值👍座位寬敞很適合商業午餐洽談氛圍佳
 謝富名 ,https://www.google.com/maps/contrib/109887931319267472187/reviews?hl=zh-TW,5,True,82,點了498嫩肩牛排跟398鮭魚，排餐有一定水準，沙拉吧以牛排附贈的來說真的無敵，東西超多又新鮮比中和我家還棒，服務人員也都有禮貌也會固定來收餐盤，cp值高不過卻沒什麼人知道的好店，以後會帶朋友常常來報到了👍👍
 曦 ,https://www.google.com/maps/contrib/100019040701038349649/reviews?hl=zh-TW,4,True,84,"店面超大，用餐座位區寬廣，單點的鍋就能吃得很飽了！湯底還不錯，肉跟海鮮品質也讚～就是青菜…感覺放了很長的時間
飲料🥤有2款.加湯要自己去拿壺.沒有收服務費～"
 Yv. P ,https://www.google.com/maps/contrib/117096791677755424883/reviews?hl=zh-TW,5,True,485,因為疫情完全沒有人，肉質菜品其實都不錯。佔地太多外場人較少，服務不是太即時。套餐蠻划算的。
 Vivian Yang ,https://www.google.com/maps/contrib/112222710001354068731/reviews?hl=zh-TW,3,True,71,"今天點了石頭火鍋和暖暖沙茶鍋。
肉片和花枝滑都不錯。但湯頭普通，豆皮可能因為放太久的關係，有點油耗味，滷鴨血有點太鹹了，海鮮中的蝦子有幾隻不太新鮮。
整體感覺來說，不是很優。"
 Wang Erika ,https://www.google.com/maps/contrib/115986767481179571682/reviews?hl=zh-TW,4,True,650,裝潢很時尚，不過火鍋感覺普通，沒有太多特別感受，但價位270左右石頭鍋340上下，頗親民，飲料可暢飲。旁邊他們的另一家餐廳有排餐+沙拉吃到飽，下次想去試試
 fish Yellow ,https://www.google.com/maps/contrib/105627403960380556804/reviews?hl=zh-TW,3,True,306,"吃過三還四次了
真的蠻喜歡便宜又近又好吃
只給三是今天服務態度有夠爛雖然元旦上班很累
但滷肉飯很久沒到只是問一下什麼時候會來
不需要一臉很跩的說：「喔我知道啊」
到底在兇什麼請加強員工訓練謝謝^_^"
 風火輪 ,https://www.google.com/maps/contrib/106172413070456701469/reviews?hl=zh-TW,4,True,355,"大家好，我是googlemaps在地嚮導風火輪

給所有消費者最真實的感受以及整體體驗過程

我的instagram歡迎追蹤

我的個人帳號doctorshie

朋友生日約這邊慶生

很大一間站在門口接待處等了很久才有人接待…

先說缺點飲料的選擇真的非常非常的少…..

連可樂都沒有有點囧

然後啊醬料的醬油都沒了

還不第一時間補上有點囧

優點在西門町鬧區捷運西門町捷運站出口出來非常之方便

價格上也是非常親民不需要店吃到飽一般鍋物的份量上就能吃的飽了

點餐前有先googlemaps查了一下

蛤蜊鮮蚵雙鮮鍋313元

鮮蚵真的超多吃到會膩哈

但蛤蜊沒很多也很小顆

單點培根牛肉132元很雷份量少肉又很碎…

早知道不要亂加點🤣

雙人套餐1888元沒吃過不知道推不推

朋友是蠻常來吃的"
 wu chiayun ,https://www.google.com/maps/contrib/104512420936059606233/reviews?hl=zh-TW,1,True,433,"結論:絕對不會再訪!
服務:點餐需先付款，點餐我們坐B05結帳點菜單寫B06，初次上菜沒差錯，後來我沒吃飽去加點時，我跟服務生說我們哪桌，結果我遲遲等不到加點才發現單號打錯。傻眼怎麼會打錯，不催單的話我直接被坑欸。
美味:我點壽喜燒牛培根。
1.肉盤OK，菜盤葉菜類分量不多，
2.最可惜是壽喜燒「超級鹹」，服務生沒講解醬汁可以稀釋，我加很多次開水還是很鹹。
3.配上滷肉飯完全是一場災難。
4.單點青菜的分量不算多，單點肉的cp值會高一些。
環境:普通，廁所沒有放酒精。
Cp值:
1.只有開水跟2種飲料，
2.「沒有甜點亦無冰淇淋」，
3.單點火鍋配料都很貴，整體cp值過低。"
 Connor Chung ,https://www.google.com/maps/contrib/118220444141491852873/reviews?hl=zh-TW,3,True,127,"-附簡單自助吧，醬料、飲料無限提供。
-平日晚餐時段，無訂位用餐，場內客人約6-7成滿。外場忙得一團亂，哪位服務人員要帶位內部協調不良，還在客人用餐區爭執；送餐時肉品未上齊，需要提醒才發現漏掉。
-肉品的質與量都有待加強。雞柳乾柴、豬肉片份量太少，以這個價位可以有其他更好的選擇。

無論是海霸王抑或立德莊，都不應該有這樣的服務品質，令人失望…"
 Markush H ,https://www.google.com/maps/contrib/100786026137022216195/reviews?hl=zh-TW,5,True,75,"蛤蚵雙鮮火鍋🍲
其實真的不錯欸
吃完後不會有一般火鍋的油膩感
吃完後湯頭超輕甜而且有海鮮的鮮甜味
很好吃😋
要不然我平常會吃他們的石頭鍋～"
 廖格為 ,https://www.google.com/maps/contrib/108500561567925324099/reviews?hl=zh-TW,3,True,186,"便宜是便宜
但環境普普
座位地上有油污
桌上也擦不乾淨
重點來了，好訂位是假象嗎？
來現場還要等…
之前吃到飽品質不錯
轉成個人鍋後整體降低了…
大失所望
在這地方素質高價位高我可以接受。但這價位跟停車費不成正比欸…
原本要給一顆星，但服務人員真的很辛苦。多給兩顆鼓勵服務艱辛的服務生。"
 GENE KUO ,https://www.google.com/maps/contrib/114948264514751133330/reviews?hl=zh-TW,5,True,93,"2021/10月份中午平日來吃。份量真的很划算。最入門的梅花豬肉鍋268元或是極品海陸鍋488元。配菜的量真的超多的（絕對吃得飽）。肉質給予美味而且高品質的讚美。而且店內的座位很舒服。靠近窗邊有很好的視野（高腳椅）中間是四人-六人座位區。飲料推薦日式無糖煎茶🍵很好喝。附餐推薦“魯肉飯”很好吃快要跟鬍鬚張打成平手了，雖然稍微油膩一點，但是真的很想要上面灑白胡椒粉，身為台南人能夠吃到好吃魯肉飯真的開心。

關於自助區的問題，日式醬油真的是很鹹（沒有稀釋還是廠牌的選擇？）。建議不要加太多避免過鹹干擾舌頭，如果真的不小心加太多醬油，請回去自己的桌上，舀一匙高湯進到醬料稀釋。

餐點的部分，海鮮新鮮口感質地很好，我是有參考其他網友留言，大部分都是滿意好的。湯滾肉片下鍋之後20秒撈上來也能保持正常的大小不會嚴重脫水萎縮，這一點給予高分。

餐廳位置也在西門町捷運站四號出口走出來兩分鐘可以到。整理會推薦別人來吃，或是下次來台北的時候，一個人自己吃也不會尷尬。"
 美麗少婦 ,https://www.google.com/maps/contrib/107277535587186918550/reviews?hl=zh-TW,4,True,272,第一次吃，梅花豬、培根牛和風鍋，味道不錯，氣氛也很好，唯一美中不足的是飲料品項有點少。
 Kelvin Ho (Kelvin Ho) ,https://www.google.com/maps/contrib/100154978742600743751/reviews?hl=zh-TW,4,True,65,吃得飽又價格公道的連鎖火鍋店，滷肉飯真的大推有水準。
 Jack Dawson ,https://www.google.com/maps/contrib/117101459697974123129/reviews?hl=zh-TW,5,False,17,火鍋與其他料理新鮮美味份量足，服務人員親切積極，顧慮到顧客，食材未食用完需要外帶時主動附上2個袋子分別裝未煮食材與熟食，介紹menu時也很用心易懂，下次會再來體驗排餐與buffet。
 Yialo Lu ,https://www.google.com/maps/contrib/100379527742244420375/reviews?hl=zh-TW,4,False,7,"雖然離公司很近，但是很久沒來了
今天晚上想來個美味的晚餐
發現蚵仔給的份量很足夠"
 Sam Liao ,https://www.google.com/maps/contrib/116431339817843167639/reviews?hl=zh-TW,5,False,6,"重新來到德立莊，發覺整個不一樣，也多了時下流行的598吃到飽.重點是還沒有服務費,海霸王不愧是以海鮮為主,竟然有日本料理等級生魚片以及海鮮盤吃到飽,個人覺得很超值，送餐突然跑出一個機器人在你前面,感覺很有趣"
 Yuting ,https://www.google.com/maps/contrib/104692893163443459013/reviews?hl=zh-TW,5,True,390,"空間超大超漂亮！
位置也很多
上餐速度普通，肉通常都要等一陣子（晚餐時間）
雞肉很嫩，壽喜燒湯底很有味道！
整體來說很滿意👍"
 Nicole Wang ,https://www.google.com/maps/contrib/115307580266013873585/reviews?hl=zh-TW,2,True,279,吃與龍共舞雙人餐，份量足，只是龍蝦蛤蜊蝦肉本身還沒沾醬就已經好鹹，沒提供冷熱開水和醬料選擇少都有點弱，醬料區的碗沒洗乾淨還有污漬，醬料中的醬油不知為何超鹹，吃完後會渴很久....
 魯阿味 ,https://www.google.com/maps/contrib/100362062914909474817/reviews?hl=zh-TW,4,True,134,"石頭湯底不錯，海鮮新鮮，菜盤中上。
缺點：服務稍嫌冷漠，但也沒收服務費。飲料太化學口味，難以入口。"
 Jessie Ying ,https://www.google.com/maps/contrib/106618888522360603387/reviews?hl=zh-TW,5,True,40,"適合家人朋友聚餐的好地方，
家人買的美食展餐券，海陸龍蝦四人券，
和風昆布湯底很搭，肉質也不錯。"
 Tom Lung ,https://www.google.com/maps/contrib/109637085576286191812/reviews?hl=zh-TW,3,True,265,"空間真的大
一樓有店面
地下室也有
沒有人指引會不知道往哪裡去
但服務人員不夠
容易收草
溝通也不良
樓上樓下貌似分開的通訊系統
互相不清楚對方的決定"
 Rosa_08.29 ,https://www.google.com/maps/contrib/111326118465938420033/reviews?hl=zh-TW,5,True,639,"店內裝潢跟氣氛都很不錯
餐點份量多價格也很合理
服務態度還蠻好的～"
 Lin ling ,https://www.google.com/maps/contrib/106736650690354138487/reviews?hl=zh-TW,4,True,76,"吃火鍋
湯底多樣
一人一鍋
牛肉也有很多款選擇
我選梅花牛肉
較瘦、脂肪少
切的薄薄的
刷一刷就相當好吃
可以大聲說話、聊天的地方"
 Jenny Yen ,https://www.google.com/maps/contrib/109914446421317231935/reviews?hl=zh-TW,3,True,586,假日晚餐沒訂位，坐吧台位，頂級莎朗牛345還不錯，不用加服務費，飲料品項有點少，整體上中規中矩
 廖無奈 ,https://www.google.com/maps/contrib/115793290399688781491/reviews?hl=zh-TW,3,False,8,"路上看到門口有滿多口味的便當
選了雞腿親子洞飯120$附味增湯
味道還不錯，只是第一口咬下去有碎骨頭
牙齒差點斷😮‍💨
後續還有兩根碎骨頭"
 AK 777 ,https://www.google.com/maps/contrib/109680564256485488215/reviews?hl=zh-TW,2,True,137,今天來打狗霸食用的是個人鍋×4部分過程服務人員認真誠懇值得讚許食材表現的也算中規中矩畢竟這是海霸王的老本行但是作業上的失誤就覺得讓人覺得不是很愉快點了餐付了錢半個小時都沒上鍋/菜提醒後才送來服務主管也只是口頭道歉還是希望客人給好評給五星好評！？我們非事後來撻伐給兩顆星已經是給現場其他小服務人員的鼓勵否則打狗霸只能給予一星鼓勵生意若祈做大做旺其服務流程與客人應對態度和方法或許都需要再加把勁加油😅
 Pin Yu Chen ,https://www.google.com/maps/contrib/100009269652750011970/reviews?hl=zh-TW,2,True,54,"這次點麻辣鍋+培根豬
優點：離飯店距離近
缺點：
1.豬肉看起來很「不美味」，可以點一份看看就知道我在說什麼了。
2.肉盤味道有點腥味。
3.麻辣湯底不推薦，鴨血口感很奇怪。"
 L ,https://www.google.com/maps/contrib/105929241964797254567/reviews?hl=zh-TW,4,True,"2,063","隨性的一家店。東西實惠好吃，建議：要主動出擊＋坐人少的地方
門口預訂後位置說，這邊等等有人會來帶位，等了一陣子沒人鳥我們，我們自行走去店裡站著一陣子，還是沒人帶位。點餐時也是要等店員沒事他才會來，付款時店員也是固定站在那，記得沒服務費覺得沒關係，這樣的工作環境對店員來說也不錯，不過客人要主動出擊
因為是很空曠無隔間的座位區，也沒什麼吸音的料子，吵雜聲都會聚在中間，我們剛好坐在中間那排，超過吵，高腳吧台桌客人的歡樂聲、店員收桌摔摔摔的聲音、前後左右的聊天內容收音清晰，去裝醬料走到後方的區域，變得很安靜"
 FJ L ,https://www.google.com/maps/contrib/109977828195603230897/reviews?hl=zh-TW,5,False,3,"環境優美物超所值
598黑鮪魚生魚片吃到飽
還有機器人送餐"
 Chih Yun Chen ,https://www.google.com/maps/contrib/116745234832713579418/reviews?hl=zh-TW,3,False,13,"點了蛤蜊鮮蚵石頭鍋，石頭鍋有油蔥跟胡椒味不喜歡，但蚵仔超多一個人吃不完，還有店裡是用機器貓送餐很不錯，會一直用巧虎的聲音喊我來了

吃到一半一個路人過來說可以給他一顆蛤蜊嗎，給他之後就徒手拿走，邊念著一串不知道啥走掉，害我少一顆蛤蜊，不知道是不是常出沒在店裡的人"
 吳小嬋 ,https://www.google.com/maps/contrib/110864494811982165795/reviews?hl=zh-TW,5,True,39,"湯頭很好
連麻辣鍋的湯都可以喝
不像外面一般整個都是油"
 J H ,https://www.google.com/maps/contrib/115829142481050996238/reviews?hl=zh-TW,5,True,180,"用餐環境大又舒服
喝完湯底不會口渴
菜盤新鮮，沒想到很多小火鍋地雷的高麗菜在這裡沒有出現
牛肉很大一盤肉質也不錯
刷新了之前對海霸王的印象
價格實在，選擇性也很多
推薦～"
 renn david ,https://www.google.com/maps/contrib/103780343065661601882/reviews?hl=zh-TW,5,True,"1,087",昨晚去用餐，感覺這裡和一般的火鍋店不同，座位寬敞舒適，最重要的還有機器人送餐，超可愛的愛咪機器人，第一趟忙著端盤子，他就跑掉了，等著他第二趟來送餐，抓緊拍照說。
 艾小莫 ,https://www.google.com/maps/contrib/112290384438526140158/reviews?hl=zh-TW,4,True,82,寬敞菜盤OK肉盤不錯量不會太少品質優~~蠻適合聚餐的!!如果自助吧的飲料選擇可以再多一點會更好~~~
 海豚掀肚子 ,https://www.google.com/maps/contrib/110316798050668530859/reviews?hl=zh-TW,3,True,442,"我知道貴店的打烊時間，也說了我來過。
但不要一直重複跟我說「注意打烊時間」，櫃檯一次，點餐時一次，餐點來時一次，我沒有聾，OK？"
 Wei T ,https://www.google.com/maps/contrib/113564875800628805223/reviews?hl=zh-TW,2,True,304,"就吃粗飽的火鍋。
動線詭異，拿醬料跟飲料要走很遠，走道不大，又很多推車在通過。
可能是怕人吃了就跑，要先結帳才能用餐，但結帳又只有一人在櫃檯，浪費許多的時間在排隊結帳"
 曾辰辰 ,https://www.google.com/maps/contrib/112575168771622724381/reviews?hl=zh-TW,4,False,245,"口味還可以
服務普通
生魚片區帥哥非常有禮貌"
 陳宣聿 ,https://www.google.com/maps/contrib/102305469192348367222/reviews?hl=zh-TW,4,True,45,"餐點448海陸餐蝦子不錯蛤蜊也大顆
但飲料選擇太少只有綠茶白開水芒果汁芒果汁不太好喝太稀
培根牛建議吃全熟不然會有一個味道"
 張耀祖 ,https://www.google.com/maps/contrib/103493944368252923281/reviews?hl=zh-TW,1,True,54,"團體預約來用餐
外場明顯溝通不良且混亂，員工訓練不足
用餐半小時飯還沒上，肉也只上了部分
已經知道今天有大預約的狀況下，卻有明顯疏失，希望可以改進"
 蜀漢 ,https://www.google.com/maps/contrib/107605325951703414982/reviews?hl=zh-TW,4,False,18,"壽喜燒的醬最後才給變成乾煎ㄌ
一鍋三吃實在很有創意

蔥請服務人員補講了四次
一個小時後終於看到蔥了👍🏻
還好沒收服務費不忍苛責太多👍🏾"
 Cynosure花蓮阿鴻 Chang ,https://www.google.com/maps/contrib/100957501103072745672/reviews?hl=zh-TW,3,True,451,第一次來用晚餐。單人火鍋有多樣選擇性，雙人海鮮鍋就不推薦，海鮮食材沒那麼鮮美。
 fang jia ,https://www.google.com/maps/contrib/114108293272873889687/reviews?hl=zh-TW,4,True,71,"與龍共舞雙人套餐
海鮮+兩個菜盤另外再點了壽司小點
份量很夠大概可以三個女生吃或是兩個男生
食物正常發揮龍蝦豬肉都不錯吃
店員只有男店員比較親切態度好
有個女店員態度不是很好
需要桌邊服務的時候會找不到店員
感覺不大會巡桌服務這塊扣一顆星"
 RAIN CHENG ,https://www.google.com/maps/contrib/116809767107462015353/reviews?hl=zh-TW,1,False,10,海鮮盤很寒酸，豬肉不新鮮有腥味，鴨血味道淡如水，失敗中的失敗，錢都刷刷鍋都比這好吃
 陳怡婷 ,https://www.google.com/maps/contrib/113793821584241936618/reviews?hl=zh-TW,1,False,59,"四個人用餐
菜盤品項少、了無新意
飲料吧：只給三樣
開水、無糖茶、芒果汁
也太寒酸了吧？大開眼界

沒有甜點
沒有冰淇淋
不會再訪👎👎👎"
 許妍珠（Liu Hsiang） ,https://www.google.com/maps/contrib/117439023736113316000/reviews?hl=zh-TW,3,True,16,"用餐服務體驗不好
12月和友人聚餐選在貴店，我們劃單有劃寬粉，結果寬粉沒來還多兩碗飯。我們跟服務生反應，服務生只拿著出餐明細核對，殊不知結帳時人員向友人覆述卻點錯了，我們請服務生回去看一開始劃的單，你們竟表現出一副是客人的錯的樣子。
吃到一半人員詢問是否要加湯，我還沒來得及看湯還有多少，人員就走了，之後其他人員可能接到加湯的指令經過但走向別桌，只好再等待，後來有位大約是管理階層的員工經過，跟她說要加湯，她又把人員叫過來加我們這桌。指令不清楚不一致，讓下面的員工無所適從，請貴店好好改善。
走道窄，推車和客人經過會擠在一起
其他部分都不錯！火鍋很平價也吃得很飽👍"
 洛神花 ,https://www.google.com/maps/contrib/103583811613185833318/reviews?hl=zh-TW,5,True,377,"店裡空間、座位大
食材新鮮不用服務費
讚"
 ChungHua Chu ,https://www.google.com/maps/contrib/101993342252511354435/reviews?hl=zh-TW,3,True,824,"空間偏小是會旁邊人手肘打架的空間
而且很悶整個店裡都是火鍋熱氣
是很熱是悶那種感覺

東西中規中矩"
 恩寧陳 ,https://www.google.com/maps/contrib/114667547495483234406/reviews?hl=zh-TW,2,True,35,"1.海鮮有點不太新鮮，尤其是蛤蜊，感覺放久不鮮，
2.服務人員不足，光要醬料或飲料或更換新碗，需要等待

優點：
1.有確實要求梅花座

以上都是個人感觀，目前不考慮再吃一次"
 你還是注意一點 ,https://www.google.com/maps/contrib/114225809378527888743/reviews?hl=zh-TW,1,True,23,"假日聚餐
和朋友都點梅花牛和風火鍋
品質真不一樣啊哈哈哈
我吃左邊QQ"
 劉素真 ,https://www.google.com/maps/contrib/117050392162520419076/reviews?hl=zh-TW,5,True,"1,028","食材新鮮好吃～附近有停車場方便停車～可以線上訂位～先付款點餐～出餐非常快速，但是有限制用餐時間90分鐘(同桌一起計算)
（目前因疫情關係沒有限制用餐時間喔）"
 火龍果Coriander_Fiona ,https://www.google.com/maps/contrib/100193924306295746143/reviews?hl=zh-TW,1,True,105,"我點綠咖喱，朋友點壽喜燒，
兩個人差點以為自己在喝甜湯，
甜得嚇人～
不推
對不起～"
 Joan Lin ,https://www.google.com/maps/contrib/103934598957800705497/reviews?hl=zh-TW,2,True,57,餐點尚可。下午2點用餐，用餐人數不多，服務人員動作卻都非常慢、非常慢。四人用餐，點吃到飽，第二輪點了四份沙朗牛肉，等了很久，只來照片這一盤！第三次只點兩瓶飲料和一份魷魚，不知道為什麼也需要超過15分鐘以上等待，最後只好直接走人。（非常不建議點吃到飽）
 Xavier Siang ,https://www.google.com/maps/contrib/111582315780341673643/reviews?hl=zh-TW,4,True,180,消費平實，衛生乾淨，只有兩種飲料，火鍋湯頭尚可，稍微比較沒有超值滿足感。
 林忠炫 ,https://www.google.com/maps/contrib/104810251527505664838/reviews?hl=zh-TW,5,True,416,"2022.10.09
星期日晚上
位於台北市中正區德立莊打狗霸用餐
鍋物料理"
 Wen Hsuan Chen ,https://www.google.com/maps/contrib/106636663594697676296/reviews?hl=zh-TW,2,False,2,"住在德立莊，看到房間裡的特價資訊，住房有九折優惠。到店後了解有加20元有四種海鮮可以選，但不能和九折同時使用。
加20元選了魷魚，鍋物選了和風頂級沙朗牛肉鍋。等待的時候到自助吧選飲料，選擇不多大概只有四種冷飲。醬料也只有基本款，沒什麼特別的。
上菜時有點傻眼，魷魚感覺退冰後直接端上來，眼睛都還在，煮完確定內臟骨頭都沒清，筷子一夾內臟墨囊就擠出來，清了一些漿狀物後嘗試咬了一口，腥臭味超重，還被骨頭磕到牙。後請服務員拿回去處理一下，去掉了眼睛內臟後煮完味道並沒有好一點，最後沒吃完。
沙朗牛油花色澤很漂亮，吃起來牛味很重，算不錯吃，但無法拯救魷魚的低分。
期間想找服務員，將近10到15分鐘現場沒有服務員，直到有人吃完離開，服務員出來整理才能反應問題。
總之體驗超差，之後不會再光顧了。"
 lucas hao ,https://www.google.com/maps/contrib/115528383784569886762/reviews?hl=zh-TW,5,True,129,"無論是生魚片還是海鮮都非常之新鮮
很棒"
 小明 ,https://www.google.com/maps/contrib/116906123553465946922/reviews?hl=zh-TW,3,False,1,"11/8在火鍋使用飯店給的268卷用餐餐點份量蠻足的吃的很飽！晚上8點去隔壁Icepapa換購冰品及熱湯一位中分頭的小姐對待客人態度差臉很臭且回答問題非常的不耐煩，還有在我的面前對別人說髒話後面另一位小姐來處理（不清楚名字是有瀏海的妹妹）態度和善清楚的解釋才讓我了解才沒那麼生氣
後面11/9也有到火鍋店用餐經過icepapa櫃檯一樣也覺得這位小姐的臉非常臭雖然冰很好吃但不會想買！
希望貴店可以加強員工訓練！
因原本帳號沒辦法評論所以借用朋友的發文！"
