user_name,user_profile_url,rating,local_guide,comment_num,comment_text
 愛吃鬼P ,https://www.google.com/maps/contrib/114222852358838595483/reviews?hl=zh-TW,1,False,8,"石頭火鍋只是石頭鍋裝湯，上桌後就失去信心了
培根豬只吃了四片，豬味太重整個難以...
石頭鍋的湯沒有爆香的味道就算了，也沒有日式高湯的味道，有個...怪味！
點了小海鮮培根牛，一個湯頭連煮了菜跟海鮮都...不優的很少
而且菜跟火鍋料煮了也附著怪味
導致浪費很多食物，友人吃了竹輪整個反芻...想吐，嚇到我了
醬料區的醬油跟沙茶都沒有該有的味道
身為一個鍋控，實在吃的...心情不好..."
 李海燕 ,https://www.google.com/maps/contrib/106424995268325101367/reviews?hl=zh-TW,1,False,6,"我昨晚去吃吃到飽的428+海鮮吃到飽.
蔬菜跟火鍋料都是要去自取,進去的時候你們工作人員說取餐要戴口罩,我去夾菜的時候有一兩次忘了戴,你們櫃檯一個胖胖高高黑襯衫的男員工就提醒我要戴口罩.算還蠻有禮貌.後來我看其它桌也有人忘了戴口罩去拿菜,你們的員工不管穿襯衫或穿那個顏色很奇怪T恤的,也都會提醒客人要記得戴,我覺得為了防疫這樣很好,大家難免忘了戴口罩,員工也客氣的提醒,很合理~

但後來有看到一個黑黑胖胖臉圓圓長髮的阿姨,也許是你們的常客,都不戴!還臭臉,你們員工都沒提醒她?還跟她問好?明明那個大媽態度很差,你們還賠笑臉還不請她戴口罩?請問防疫的規範是因人設事嗎?還是怕得罪常客怕她以後不來吃飯?

建議你們如果怕得罪客人可以用私下舉發的方式,讓那種不配合的高姿態的阿姨去被罰款,不然如果她有武漢肺炎,傳染給大家怎麼辦?我今天去用餐消費不是為了要得病耶!!!!"
 林冠廷 ,https://www.google.com/maps/contrib/104290777357577404481/reviews?hl=zh-TW,3,True,83,"價錢可以食材尚可服務不行的火鍋店
+
火鍋有提供多種鍋底包含壽喜燒
價錢堪比錢都但鍋種跟海鮮豐富
食材就是尚可料豐富但肉質還好
服務唯一可以的地方就是今天聖誕節有聖誕老人發糖果
-
服務待人口氣不錯但是整體太兩光了
上菜時間花太久了菜盤肉盤差10分鐘...
上菜時帳單收據在桌上也看了還是送錯菜盤
壽喜燒上來有備醬汁但忘了備水
服務生太少導致要加水加湯偶爾會找不到人
至於配料跟飲料區只有錢都一半吧可以豐富一點或是飲料好喝一點...無糖綠茶有點小酸味

建議其實如果沒收服務費有些可以自助的地方ex加湯水可以自助"
 YenChen Chou ,https://www.google.com/maps/contrib/107341239355775559312/reviews?hl=zh-TW,1,True,72,菜都吃完了肉還沒上....
 Ben Chen ,https://www.google.com/maps/contrib/105651719716798113288/reviews?hl=zh-TW,5,True,42,"從開店到現在，每次去都是點吃到飽的。CP值很高，食材也好，但是加點的流程管理實在很讓人抓頭。幾乎每次去，加點的料都一定會漏上，幾年了都改不好，而且加點的都會很久才上。雖然看也沒收服務費的份上就算了，但還是希望餐廳對自己的管理要有期許

2019/9/10更新:最近兩次去，加點流程改善了，大推！"
 振成蔡 ,https://www.google.com/maps/contrib/111879682075375229113/reviews?hl=zh-TW,3,True,31,氣氛佳.牛羊鷄豬肉質不錯.海鮮很新鮮.各式套餐可選擇
 Elsa Wu ,https://www.google.com/maps/contrib/105394899140124503735/reviews?hl=zh-TW,5,False,24,用餐環境很好~餐點也好吃，CP值很高！
 宜蓁李 ,https://www.google.com/maps/contrib/113206822246862984953/reviews?hl=zh-TW,1,False,9,今天1/26日下午5:50分打包二包火鍋回來。兩包袋子都是破的，弄到我的包包都弄髒了，這家員工真的不行，需要再加強
 唐豆 ,https://www.google.com/maps/contrib/115328649389467582454/reviews?hl=zh-TW,5,True,96,"最喜歡吃前鎮水產了～
可以選擇個人鍋、鴛鴦鍋；+$30可升級麻辣湯頭
然後再到展示冰箱前選擇你想要的食材，再進行結帳，服務人員就會替你代位、介紹
松阪豬、米血、梅花豬、冬粉丟至麻辣湯頭裡，那味道真是絕配～～～
旁邊也有多種麵類、滷肉飯、雞蛋提供，通通不用錢，只要你吃的下！"
 小五 ,https://www.google.com/maps/contrib/106922616803895087387/reviews?hl=zh-TW,5,False,5,"空間寬敞舒適，398元+10%(豬排丶雞腿丶鮭魚)可享排餐+沙拉吧～
(牛排498+10%)
取餐要求戴口罩，加分！"
 安柏 ,https://www.google.com/maps/contrib/103929197564847426527/reviews?hl=zh-TW,1,False,5,在快吃完的時候在鍋裡吃到兩張煮不爛咬不破的紙，然後請人員來他們只幫我們換了全新的一套餐，卻沒有給我們合理的解釋及道歉，讓人非常傻眼！不會想再來第二次及推薦友人。
 Eric Han ,https://www.google.com/maps/contrib/113391092915748259824/reviews?hl=zh-TW,3,True,48,"本次消費是選擇火鍋類單點消費,不是吃到飽消費,坦白說並沒有很驚豔,價格並不便宜,菜盤跟海鮮都很普通,飲料選擇非常少,只有無糖綠茶跟果汁,消費過一次就不想再消費,下次會嘗試牛排類"
 八寶羅 ,https://www.google.com/maps/contrib/105158257066123733266/reviews?hl=zh-TW,3,True,118,"1.入口管制的方式很棒，但被沒有預約卻排在預約區的客人被店員安排在我們之前而不是從我們後面排隊！

2.雖然國內疫情受到嚴格要求，但座位卻沒有落實區隔，讓我們用餐時須跟鄰座的客人保持距離，另外飲料架需用杯身去壓出水器，而杯緣沾有客人的口水！在這樣多人使用下很難不保證會不會沾到別的客人口水？

3.因為是吃火鍋所以會有一定的熱度，但用餐環境的溫度變化多端，所以感覺偏熱。"
 小花 ,https://www.google.com/maps/contrib/101572863922659778372/reviews?hl=zh-TW,1,False,3,"看網路評價都是五顆星
所以來專程來用餐
結果服務人員都在聊天
領台人員帶位無精打采
感覺很失望😞
原來是評論五星送海鮮
不推👍
台中輕井澤比他們優多了⋯"
 徐麗美 ,https://www.google.com/maps/contrib/108281553632946006585/reviews?hl=zh-TW,5,False,3,餐點豐富服務親切
 打遊戲不氪金 ,https://www.google.com/maps/contrib/103961302588717639276/reviews?hl=zh-TW,3,True,27,吃得飽，偏貴
 Rukawa Chen ,https://www.google.com/maps/contrib/111803210527181568073/reviews?hl=zh-TW,1,False,16,價格平價，但規定較不合理，90cm以上需單點一鍋，因有優惠活動又不能用共鍋費，吃不完想打包也不行，試問一個100cm左右小朋友怎麼吃的完一份鍋物，擺明不歡迎有小朋友的家庭！
 藍慶堂 ,https://www.google.com/maps/contrib/113387084042750224816/reviews?hl=zh-TW,4,True,48,到店裡的時間約14點多所以店內客人不多。所以感覺很舒服沒有感覺需要防疫區隔問題。食材質與量都OK.
 黃于姍 ,https://www.google.com/maps/contrib/103706040646178152128/reviews?hl=zh-TW,5,False,3,服務態度良好，說要打包速度也很迅速，下次會在光臨
 yani chi ,https://www.google.com/maps/contrib/110497223656514896302/reviews?hl=zh-TW,5,False,5,環境非常優雅，服務員的態度都非常有耐心，我覺得食材很新鮮，中肯的建議大家來這邊光顧。
 Orion Wang ,https://www.google.com/maps/contrib/105783532560501126775/reviews?hl=zh-TW,3,True,351,簡單火鍋料理坐位不擁擠
 Yang Funny ,https://www.google.com/maps/contrib/101479009300561122470/reviews?hl=zh-TW,5,True,11,食材新鮮味美讚👍
 綾川晴瑠 ,https://www.google.com/maps/contrib/103018447143930625507/reviews?hl=zh-TW,1,True,64,"想說這家在南部也很有名，應該不會踩雷了吧！
殊不知踩了大雷！！
冷氣壞掉也不問一下客人會不會熱，我看你們員工沒吃火鍋都滿頭大汗了，我鍋才吃一半欸，原本還以為是我太怕熱，後來發現其他人也一樣，反應之後更過份了，右後面一桌跟左方都有電風扇吹，我們兩人剛好坐中間是沒人權嗎？
都反應過了，服務實在太糟糕了，吃個鍋滿身大汗，還以為在路邊攤吃火鍋"
 Jui-Yun Chang ,https://www.google.com/maps/contrib/100456017373415642613/reviews?hl=zh-TW,1,True,44,"⚠️零顆星的餐廳衛生環境⚠️
Spotarataround9:30pmintherestaurant,disqualifiedenvironment.Wouldnotrecommendtocomehere!

10/13/2020來和朋友至水產火鍋這邊用餐（自助式），大約晚間9:30的時候，在隔壁桌位置看到一隻長約10cm的老鼠流竄。頓時失去所有胃口，非常不好的體驗！希望餐廳要改善衛生環境"
 ally ,https://www.google.com/maps/contrib/110570863619670998582/reviews?hl=zh-TW,4,True,410,"隔了半年以上再度光臨，
發現有點進步，
湯頭感覺有變比較好喝，
保守點了牛肉套餐覺得還不錯，
(上次點海鮮被雷到，魚肉不太好吃)
其中一顆星是給環境，
座位大、位距也大，坐起來還是比較舒服。"
 鄭為玲 ,https://www.google.com/maps/contrib/106065550590813915165/reviews?hl=zh-TW,5,True,66,食材新鮮CP值頗高值得再訪！
 巧巧 ,https://www.google.com/maps/contrib/111037315841420533373/reviews?hl=zh-TW,3,True,50,"服務還可以，但是火鍋真的很一般般
湯頭much淡，要吃有味道的可以點壽喜燒
壽喜燒吃起來還行，但是竟然沒有付蛋啊啊啊
然後加點了蛋一顆18元（？？？
在貴什麼的不懂
平價是平價啦，但是如果只是為了火鍋
我會選擇去吃兩鍋百元小火鍋😂

Ps生魚片不好吃不要為了生魚片來
但是裝潢滿漂亮的可以來吃氣氛哈哈"
 Edward Chen ,https://www.google.com/maps/contrib/101599362701720134137/reviews?hl=zh-TW,5,True,428,B1火鍋超市用餐環境佳，整體CP值還不錯
 蘇俊雄 ,https://www.google.com/maps/contrib/110515162811568970240/reviews?hl=zh-TW,5,False,2,4人用餐，每個人花費330元，菜色很多，吃得很飽，服務人員又很親切，一直關心要加湯，真是服務週到，下次再揪團。
 孫于琇 ,https://www.google.com/maps/contrib/104292347312646171812/reviews?hl=zh-TW,1,False,1,"曾經在高雄博愛路分店用過餐泰式與義式奶香
深得我家人的心不免俗給予高度評價及讚賞！
聽聞台北為創始店裝潢及環境景觀氣派華麗
並推薦有人一同前往用餐⋯確是惡夢的開始！
極力推薦朋友點季節限定鍋物。不知是南北口味差異
故意有所區隔泰式鍋只剩有酸鹹口感。少了濃厚鮮甜味及南洋風味越煮越腥造成反胃效果⋯
義式奶香油水分離嚴重鍋具清潔也不好。呈現灰灰濁濁的。烹煮到後面猶如鹹豆漿一般真的很糟糕！
龍蝦海鮮拼盤也組合的歪七扭八龍蝦切的破破爛爛
感覺上像切好在冰冷凍再退冰的感覺。
扇貝也都退冰很久的樣子。貝肉都乾乾皺皺
魚肉片也大小不一。魚肉玫瑰花也很隨便疊放
首推的必點滷肉飯飯有一股悶騷味也太油膩
碗底還有一大層油⋯我們還點了高雄店沒有的日本料理也是很慘壽司飯沒什麼味道魚肉也很糟糕
大小片不一致握壽司不服貼感覺只是擺上去的
想喝點水服務員指引到另一個自助餐廳裡的飲水機
差點迷路出餐口的環境很擁擠送餐車上湯湯水水嚴重
還看到服務員上一秒拿著對講機一個轉身用手去喬剛切好的肉跟裡面切肉的人員嬉鬧。
可能生意好很多東西都很隨意但應該不會在來了"
 K As ,https://www.google.com/maps/contrib/116703414666688989872/reviews?hl=zh-TW,1,True,49,"服務有夠差，本人吃火鍋，坐在D01位置，似乎是剛好在廚房附近。
看到在我後面員工在打情罵俏、還有一個小鬼突然在大叫嬉鬧，給人觀感很差，還有一個小鬼在推推車，結果轉角內側差點撞到我。
菜單隨手扔也不介紹，
燈光略顯不足，兩人座時東西擺盤等等都空間明顯不足。
要介紹也不會介紹，女友問個廁所在哪也愛理不理的，更扯的是吃到一半想要一碗白飯，不知為何還得跑去櫃檯才要得到，而且櫃檯小姐（發票上名字寫""操XX""不知是否是這位）臉很臭，在想什麼好像都寫在臉上，也沒有敬業的服務態度，我只是要結帳而已錯了嗎??
然後做的位置附近的飲料機不僅寒酸，旁邊的嬰兒椅、推車跟一些雜物都放在略微陰暗的角落，給人感覺覺得就是差。
唯一勉強可以說上優點的就只有食材新鮮跟湯頭還可以。其他部分感覺就是爛可以形容。"
 張Yvette ,https://www.google.com/maps/contrib/105448379221015704616/reviews?hl=zh-TW,1,False,4,"東西粗躁又不好吃，服務完全不專業。
一開始完全沒說明如何點餐，畫了2張單，一桌6人等了一個小時，完全沒上肉，一直送其他桌的，反應多次後店員請我們畫第3張單，並說以第3張為主，之後連續來了3、4個店員，重複上一樣的餐，讓人傻眼，用餐感覺極差！
不會再光顧！"
 姜脩宇 ,https://www.google.com/maps/contrib/106996771858474959662/reviews?hl=zh-TW,1,False,1,"服務差勁程度西門町應該名列前茅
之前於昆明街點了雙人龍蝦與宵夜餐感覺不錯
去年線上購買套券因為方便選了德立莊用餐
現在正考慮是否將剩下的拿起去退票
1.進門就表示用套券了，一直強調樓下有新選擇
一副很為難樣。怎麼，用套券不歡迎嗎？
2.入座後強調這次優惠可以升級龍蝦海鮮雙人套餐，
但不能合併票券使用？就是另外點套餐不是嗎？
3.不死心再三強調龍蝦選擇湯底比較多可以搭配
限量湯底，是有沒有這麼想要業績都說用票券了
4.上餐速度⋯環境大可以理解。但也太久。剛上桌
的湯只有一半。還需要走個九拐十八彎自取
5.醬料台服務人員在補下放冰塊碎冰都倒進
醬料甕裡了未補完冰塊黑盒依然放在旁邊無視
6.向服務員麻煩補個沙茶一種哀怨厭煩指引
另一個方向醬料台有。又是一個十八拐路也太小
7.上餐過程少了一盤火鍋料拼盤反應給服務人員
服務人員表示火鍋料都放在菜盤裡還自豪說
我們用料比昆明街豐富，哦。想必兩家店非連鎖
標準可以挑選的。且感情不好綠菜才2、3片
用料豐富。實在！？金針菇斷爛嚴重
8.送來的白飯除了乾硬還是冷的。烏龍麵有壓痕
想必食材疊放很嚴重。有確定碗底乾淨嗎？
9.同組服務員補充綠茶的桶子也太髒了吧
阿不還好沒喝飲料。不然回去不就拉個過癮
綜合以上。除了人員懶散。管理散漫。或許300多元的價值就如此。雖然兩間火鍋大店共同通病是送餐服務較緩慢之外，德立莊真的水準之下。"
 yin xin ,https://www.google.com/maps/contrib/109212255902133000907/reviews?hl=zh-TW,4,False,2,"第一次吃598吃到飽的時候
每次加點食物送上來服務員都會先說
「不好意思，幫您送一下加點餐。」
然後就慢慢把食物放上桌
可是一年後回來吃
感受到的卻是快速走過
然後直接把肉放在桌上還押到筆差點倒地
我就想說應該是因為太忙
畢竟這邊經常會有團體客來吃
就想說算了
第二次上飲料的時候也是一樣
直接就往桌上放
甚至放的時候還有一點「碰」的聲音
我其實就有點不開心了
只是覺得放兩瓶飲料
以及說出「幫您送兩杯飲料」有很難嗎
推車還像是飆車一樣⋯⋯
邊飆車邊送餐的感覺⋯"
 壹柒學習中 ,https://www.google.com/maps/contrib/101883489141127565612/reviews?hl=zh-TW,3,False,11,"肉質可以，但切的好薄好小沒口感，建議加點
雙人宴的照片是龍蝦，實際給的是波士頓龍蝦（螯蝦）湯頭可以石頭火鍋味道很不錯👍🏻蔬菜新鮮手卷味道也好吃"
 Wei-Lun Hu ,https://www.google.com/maps/contrib/104229615269036942038/reviews?hl=zh-TW,5,True,32,用餐環境優良，服務人員態度很棒，東西美味好吃，份量足夠！下次會再來，也會推薦朋友過來！
 黃麗莎 ,https://www.google.com/maps/contrib/107695918698392913093/reviews?hl=zh-TW,5,False,14,環境舒適，適合商務或家庭聚餐的好地方，特別大讚一下店長貼心服務，某天用餐時孩子不小心將肉盤打翻了，店長主動主動喔！貼心的又送上一盤肉片，非常感謝讓聚餐完美。一個好的服務大大加分，離捷運西門一號站非常近，走路30秒交通非常便利
 楊雅琪 ,https://www.google.com/maps/contrib/109602925620514633369/reviews?hl=zh-TW,4,True,27,這家還算滿有名氣，應該很多人都對它做很多推薦與好評，所以反向思維講講不足的地方。個人觀感，非吃到飽的醬料區標誌不清位置不佳，加上回收餐盤車放在飲料區旁，有民眾要幫小孩拿小碗結果以為收盤車是乾淨的而拿取。用餐時間為一個半小時，才剛過不到20分鐘服務人員頻頻靠近查看菜單，導致我們一直有被催時間感覺，最少整個時間下來翻了不下10次以上。另外，從在門口詢問到點完餐，都沒有任何服務人員提醒用餐時間為1個半小時。當天發現的問題以上。
 廖婉婷 ,https://www.google.com/maps/contrib/105814381229462897783/reviews?hl=zh-TW,1,True,26,以為有點像輕井澤才來的...差太多了...帶位的方式很沒效率，帶到位位子都是髒的，換桌桌上還是很多渣渣，要去拿醬料結果醬料碟也是髒的沒洗乾淨，蔬菜盤上完過了18分鐘肉才上來....員工感覺也不熟悉，肉也薄的跟紙一樣都快變透明的，也有一股腥味，麻辣鍋的鴨血也有很重的藥水味....很想找優點但愈吃愈生氣，這個價錢可以吃很多好吃的...用餐體驗極差！一星都不想給！
 侯大偉 ,https://www.google.com/maps/contrib/101157587097848539994/reviews?hl=zh-TW,5,False,5,服務人員態度良好，食材新鮮，真的值得推薦的用餐環境
 nien chung tsao ,https://www.google.com/maps/contrib/102326873762593384559/reviews?hl=zh-TW,1,True,158,服務人員應對超爛的真懷疑是否有員工訓練教育，把這種未經勤前教育的員工擺在第一線只會砸了自己的形象招牌。餐點cp值太低還不如三媽臭臭鍋～絕不二訪
 謝沁嫺 ,https://www.google.com/maps/contrib/115100786751041326834/reviews?hl=zh-TW,5,False,2,阿如副理好親切餐點好吃又新鮮
 周峻毅 ,https://www.google.com/maps/contrib/117719554180574723313/reviews?hl=zh-TW,1,False,5,店面裝潢看起來很高級，但是環境真的不優，湯匙上頭有疑似殘膠的東西，高的座位區熱的要死，火鍋店還不把冷氣調強一點，是沒被投訴過喔？醬料區的設置也是讓人一頭霧水，用扁的湯匙讓人裝醬油？？？你的醬料桶有夠深你知道嗎？裝個醬油是要讓人裝多久？？再來，高的座位區也給個置物籃，只有一個小掛勾，是要我們東西放地上嗎？以這間餐廳的價位來說，這種體驗也不可能再來第二次了
 楊子鑫 ,https://www.google.com/maps/contrib/109370371984101638061/reviews?hl=zh-TW,1,False,1,"本日選擇自助火鍋招待好友下午茶
裝潢設計及行銷推廣都很大手筆
但內部餐點及服務需要好好加強
服務生對餐點內容似乎不是很了解
相信滿櫃海鮮95%都是冷凍海產
竟然牽扯船隊捕撈新鮮直送！？
究竟是教育訓練的話術還是瞎掰
非用餐時間我相信保持醬料新鮮少量補
可以接受但完全沒了要求服務員補一些
一副欠他很多一般。說什麼主管說不用補！？
要嘛非用餐時間關一關不要浪費人力不要經營了"
 劉小嫻 ,https://www.google.com/maps/contrib/116878468490231670903/reviews?hl=zh-TW,3,False,4,"一直以來都非常喜歡去打狗霸吃火鍋，原因不外乎食材新鮮、價位親民。不過上週五晚上1/25，因為昆明店大排長龍的關係改到德立莊店面用餐。可能是服務人員不夠，也因為座位不夠。我們一家被安排到出餐口的區域，服務人員人來人往，推著餐車瘋狂地跑，甚至多次差點撞到正在拿取醬料的我及孩子，對於餐點有疑問時請教服務人員，因為對方太忙頭也不回的直接回答，但出餐口區域聲音太過吵雜根本聽不見，又再次詢問時，服務人員不耐煩地頭也不回的作答。
雖然沒有收取服務費用，但這真是一次不愉快的用餐經驗。
隔壁桌（韓國人）一家四口，菜盤全上齊了，已經煮完，但肉品還沒上桌，礙於服務人員不諳英語的關係吧，遲遲無法解決客人的需求。最終...只能讓隔壁桌的客人不歡而散。

而我們一家坐在一桌，也因為被安排在出餐口的關係，服務人員把整籃剛洗好的餐具包含刀叉放在旁邊擦拭乾淨，聲音很吵雜到比推叫賣的茶餐廳還誇張...最後只能選擇吃東西就好，別說話吧，因為根本聽不到對方的聲音。

反之昆明店則沒有這樣的問題，建議想來嚐鮮的朋友們需要注意一下自己被安排的座位區域。
食材部分仍是屬於值得推薦的好餐廳。"
 Anny Fang ,https://www.google.com/maps/contrib/101416288443054372418/reviews?hl=zh-TW,3,False,11,"不推壽喜燒，真的太鹹了
不管怎麼加水還是一樣。
但昆布火鍋看起來很不錯～
可以嘗試看看！"
 高級小麥種植戶 ,https://www.google.com/maps/contrib/108858037852009502430/reviews?hl=zh-TW,1,True,99,"營業時間到九點，八點多打去訂位，響了十多分都沒人接。才被告知訂位電話在八點就拔電話線了哦。直接寫在網頁寫節省大家時間很難嗎？

實際去吃的結果，料理一般，動線極糟。加上服務人員素質低落，幾乎都不是台灣人，跟服務人員反應問題，完全無法解決。

訂位八個人，給了我們只能坐六個人的椅子，還說位子就長這樣，叫我們擠一擠，忍耐一下。

餐點也整個遺忘，比我們晚進來二十分鐘的客人都拿到餐了，我們的餐還沒上。從點完主餐到拿到主餐花了近五十分鐘。

特地買券去的，320的低價也沒有朋友想再去一次了。浪費時間和吃進一堆讓人不開心的食物。"
 陳秀玉 ,https://www.google.com/maps/contrib/100932420387889427012/reviews?hl=zh-TW,5,False,1,餐點豐富好吃，肉質新鮮，服務人員很讚家人都很滿意，很感謝魏小姐讓全家有個開心的午餐時光😊
 廖彩雲 ,https://www.google.com/maps/contrib/115080381971137127788/reviews?hl=zh-TW,5,False,1,餐點服務品質很好很棒環境寬敞會讓人在想來一次
 曾慧星 ,https://www.google.com/maps/contrib/116169646766795308915/reviews?hl=zh-TW,3,True,263,點了麻辣鍋雙人海鮮加肉套餐（忘了店家名稱）$398*2，沒收服務費，內容物有生魚片、菜盤、2分肉、海鮮（白蝦、魚片、小花枝），麻辣不會辣算是小小辣，海鮮算新鮮，肉質還可以，餃類吃起來覺得有消毒水的味道不ok，服務倒是不錯，無論是外場、內場、櫃檯人員，吃完覺得一般般沒有特別其他感覺。
 yin shan wong ,https://www.google.com/maps/contrib/111321248052812711269/reviews?hl=zh-TW,4,True,341,好抵食，份量夠，好味又新鮮，如再到台灣，一定會再來
 亞卡 ,https://www.google.com/maps/contrib/110670523281057288917/reviews?hl=zh-TW,5,False,3,第二次來了，用餐體驗依舊很好，感謝服務人員用心介紹。
 李昀儒 ,https://www.google.com/maps/contrib/101307624691046952015/reviews?hl=zh-TW,1,False,5,"從踏進去就完全沒人招呼一進門就看到兩個店員在旁邊聊天沒理會客人主管拿菜單來態度很差兇巴巴介紹廁所跟店內位置說稍後來介紹菜單也沒來第一次去消費根本不了解13個人去吃光點餐就花了快半小時上菜速度慢也不介紹問店員問題態度差還兇巴巴送餐的餐車也髒一堆店員遊手好閒逛來逛去加湯還倒到整個桌子都是！店員菜都還沒上完主管就跑來在客人面前員工訓練？還直接把餐盤搶走人家菜都還沒上完就去服務別桌最後還沒吃完就一直趕人家走不來介紹然後說從踏進去店裡就開始算時間一開始也沒講吃到飽東西選擇也不多點的東西有很多也都沒上真的很想給負分是絕對不會再去消費的店！高價位餐廳服務態度能這麼差的實在不多
是在地下室右手邊區塊用餐選擇吃到飽的方案
只能建議加強員工訓練不然真的會害你們損失更多客人"
 許鈞 ,https://www.google.com/maps/contrib/103402894493933967831/reviews?hl=zh-TW,5,False,18,"已價格來說，符合俗又大碗的形象，
對於價格無可挑剔，對於餐點也是如此，
唯一的遺憾，離我家太遠，
這次的家族聚餐，都會指定要在來這邊，
去年來吃的時候的確是不怎麼理想
一直在猶豫到底要不要在來這邊聚餐，
看來我的選擇是對的，點主餐還有buffet
可以吃，尤其是牛排有水準，值得讚賞！"
