user_name,user_profile_url,rating,local_guide,comment_num,comment_text
 Judy Foster ,https://www.google.com/maps/contrib/112537822147572513564/reviews?hl=zh-TW,4,True,71,"※服務人員上餐飲甜點、整理餐盤（刀叉筷匙）等訓練有素，有標準作業程序（sop）固然可喜😁，但督導人員若過於嚴苛，容易讓新進服務生神經太過緊繃😥，建議避免在顧客面前指責同仁🤐，造成不必要的尷尬😅。
～和風創作料理套餐$568（1成服務費另計），有沙拉、前菜、湯、主餐、和食、甜點及飲料，多元組合搭配供選擇。
🎉偶適時推出創新菜色，以及令人驚艷🎊
～沙拉
#季節鮮果沙拉盅（蘋果、鳳梨、哈密瓜、生菜+百香果醬）～清爽
#番茄海鮮沙拉盅～推推推😋😋😋[酸甜番茄搭配鮮甜蝦肉及干貝]，讓夏季味蕾有LV級般的享受。
※new※+89升級#燻鮭魚捲凱薩沙拉～煙燻鮭魚豐腴油脂搭配清爽水果丁香氣風味十足，爽脆新鮮生菜點綴爆漿鮭魚卵，富有層次完美滋味。
～前菜
#醬燒杏鮑菇
#干貝海鮮茶碗蒸
～湯
#蒜香海鮮燉湯（鮮蝦、魷魚、蛤蜊、魚片）～推推推😍😍😍，湯頭極為鮮甜甘美。
#黑松露佐蕈菇濃湯（黑松露、香菇、紅蘿蔔）～黑松露搭配濃郁奶香，風味絕佳。
～主餐
#炙燒陶板魚～肉質細緻，搭配特製醬汁很好吃（若再另附小碟醬料更佳）。
#鹽烤鮭魚（魚頭+魚鰭）～肉質Q彈鮮甜肥美，搭配超讚芥末椒鹽、蓮藕片、有機栗子地瓜，營養豐富，健康無負擔。
～和食
#照燒雞肉炸飯糰～推推推🤗🤗🤗，相較之前鮭魚飯團，表皮更酥香，口感更佳，融化之雞油將米粒完整包覆，鎖注米粒水份散發飯香，醬燒碎末雞米粒錦上添花，口味極佳。
#鮭魚茶泡飯～普
～甜點
#蔓越莓優格起司蛋糕～尚可
#抹茶布朗尼佐冰淇淋～New風味蠻獨特(建議搭配玄米抹茶奶蓋…完美）
～飲料
#焦糖醇香奶茶～香醇可口。
#日式玄米鹹奶茶～讓胃暖呼呼，好舒服。
#玄米抹茶奶蓋～推推推😘😘😘，最愛這味，療癒又養生，完美ending。"
 Hannah ,https://www.google.com/maps/contrib/106911254663088588338/reviews?hl=zh-TW,5,True,30,食材新鮮好吃，服務品質也很好，唯一的缺點就是周遭客人說話極為大聲😅
 張書銓 ,https://www.google.com/maps/contrib/100313979537747508618/reviews?hl=zh-TW,5,True,449,用餐體驗非常的不錯，服務也很好，餐點也很美味，跟家人聚餐的好地點
 Margie W ,https://www.google.com/maps/contrib/111075477535125359245/reviews?hl=zh-TW,5,True,89,"需要預約。
假日的時候人山人海。
餐點好吃。
服務周到。
CP值超高。
套餐有多元選擇。
適合與朋友聚會。"
 劉怡婗 ,https://www.google.com/maps/contrib/117855782849113091500/reviews?hl=zh-TW,4,True,98,"餐點好吃
服務親切
然而座位空間稍嫌擁擠
每桌之間無適當距離不利防疫"
 準準 ,https://www.google.com/maps/contrib/116625730817262526186/reviews?hl=zh-TW,5,True,33,"這家店的服務態度非常好，副店長李小姐的服務態度沒話說。昨天來這邊用餐的時候，前半場送餐速度行雲流水，無可挑剔；後半場比我媽的媽媽的媽媽的媽媽還慢，而且我懷疑我的餐點根本被遺忘，原本一小時左右可以結束,結果硬生生拖更久，寫完意見卡我們就走了，但是後來發現忘記帶錢包，店員通知我們，因此折返回去拿。

給我皮包的是副店長，他說他看到我們的評論，因此想要跟我們致歉沒有把現場的狀況控制好，並且退還我們服務費及副餐券兩張，但是這並不是我留滿意的原因，而是能夠傾聽顧客的聲音。

如果把我們的評價看完但是並沒做出任何回覆或改進，其實我們也不會怎麼樣，因為對我們來說這件事情已經過去了，但是副店長還特地跑出來跟我們致歉並且承諾做出改變，我覺得這是一件非常了不起的事情，我也很感謝李小姐，讓我這次的用餐體驗比以往都好，謝謝您:)。"
 Zoe H. ,https://www.google.com/maps/contrib/108804340023060619301/reviews?hl=zh-TW,4,True,216,"服務態度非常棒！
我的湯品裡有蝦子，服務員開蓋子時不小心拉到蝦子的鬍鬚，連同蝦子一起撈起，隨後補上一碗。

香烤半雞醃料調味剛好，肉質不會乾。

較令人驚艷的是蔓越莓優格蛋糕，不會太甜，濃度恰到好處。

熱帶水果茶有點甜，配上隨桌附的茶稀釋掉剛剛好。"
 Jesse Jiang ,https://www.google.com/maps/contrib/110003622016839500380/reviews?hl=zh-TW,5,True,182,服務人員動作很快，很親切，是附近商務談事情的首選，餐點還是有一定的水準。
 Jarod Chen ,https://www.google.com/maps/contrib/105470044866760544533/reviews?hl=zh-TW,2,True,203,"套餐568+10%
此次與家人前來慶祝生日
就個人點的餐點與用餐情形作簡單評論
圖片有些不是我評論上寫的餐點是同行人點的

沙拉：季節鮮果沙拉盅
簡單的水果切片（鳳梨、蘋果等等）淋上百香果醬
水果有甜好吃不過淋上的百香果醬稍微過甜了些
水果嘛能出錯嗎？

前菜：醬燒杏鮑菇
好吃從以前到現在就不太變的味道

湯品：蒜香海鮮燉湯
普通湯有點味精味？內含海瓜子蝦子魷魚鯛魚片

主菜：炙烤蒜香羊排（+100元）
鹽烤鮭魚頭沒了來選這個
味道算是還行好吃羊排有先醃過
肉嫩不過總覺得太油吃下來一整根滿多地方是脂肪有點油膩灑上蒜片增添風味有畫龍點睛的效果

和食：野菜天婦羅胡麻烏龍冷麵（+79元）
本日最滿意的餐點雖說烏龍麵普通
但野菜天婦羅的炸香菇地瓜紅蘿蔔紫蘇葉等頗有單點的水準是現炸的麵衣酥脆整體不會太油膩
天婦羅的油有瀝乾淨用油感覺算乾淨沾醬汁好吃

甜點：冷月紫米
第二滿意芋泥總是不會讓我失望不會太甜頗溫和的但紫米粥不怎麼好吃有點淡啊

飲料：美式咖啡（熱）
普通的美式

生日壽星的慕斯蛋糕
咖啡慕斯底為抹茶海綿蛋糕
慕斯不錯抹茶蛋糕普通沒特色

可能最近越吃越高檔開始挑嘴了......懂得去分辨
食物給個3星建議想來吃真正好吃排餐的不用來這裡這裡的是來吃整套算下來的CP值的
餐點豐富選擇多樣不用花太多錢又吃得飽
但加上王品集團振興優惠是划算的

用餐整體下來的感受出餐很...
陶板屋總是同種類餐點同桌別桌一起上造成每次都要等一下同桌的某餐點到齊才開動
我認為好的餐廳應該是同桌餐點一起上
服務生上菜很急促的感覺
用餐環境嘈雜接近9點時出餐口地板很濕滑經過兩次都快滑倒看到廚房地板都水。。。不ok啊
廁所不到髒亂但我也說不出它算感覺鏡面水槽可以再整潔些

但至少服務人員態度都很好親切熱情

只是整體用晚餐後不知道該如何形容但有種廉價感

小時候高級餐廳的美好印象就留在回憶裡吧
大概是因為長大了"
 YiChun ,https://www.google.com/maps/contrib/105314337657340640245/reviews?hl=zh-TW,4,True,268,"前菜鴨胸沙拉的醬感覺有點多，味道太重。前菜點茶碗蒸很鮮甜蠻好吃的。湯品牛肉湯是用牛腩（很嫩），但是紅蘿蔔感覺是冷凍的，湯品應該是湯包來的。主餐是蒜香牛排五分熟，熟度剛好味道很香，但是吃不太出來牛肉本身味道。再來是牛肉炊飯，很香有好吃的鍋巴。最後甜點是哈密瓜冰淇淋，冰淇淋下面有抹茶蛋糕跟紅豆，好吃！家人點了一個起司蛋糕，不好吃，不是想像中的起司蛋糕，吃起來很像奶酪（不建議）。
最後是服務的部分，非常時期進去店裡要量體溫，服務員都很親切，收盤上菜手腳都很俐落，用餐環境很乾淨，廁所也保持的不錯，有個缺點就是沒有wifi。"
 黃秀瑛 ,https://www.google.com/maps/contrib/111987782528007087561/reviews?hl=zh-TW,2,True,101,"座位很擁擠，服務生托盤上的餐點重疊，食物被層層壓疊感受不佳。調味過鹹過甜不好吃。
兩顆星給服務良好的服務生，辛苦了！"
 Shanlon Lin ,https://www.google.com/maps/contrib/112829761822837639690/reviews?hl=zh-TW,3,False,19,以前很喜歡全家到陶板屋慶生，這次覺得飲料變很淡，食物也沒以前好吃了，是換廚師了還是我吃膩了？
 DEBBY ,https://www.google.com/maps/contrib/113511169157420265855/reviews?hl=zh-TW,4,True,254,"「陶板屋」用餐環境舒適、服務人員態度親切，讓一切很加分。

沙拉：袖香鴨胸沙拉，吃起來很爽口

前菜：茶碗蒸和杏鮑菇，味道溫和順口，杏鮑菇帶著黑胡椒的醬料，吃起來很開胃

湯品：肉質（雞肉和牛肉）稍微偏柴，但幸好三種口味的湯頭都好喝

主餐：香蒜瓦片牛肉、香烤半雞、鹽烤鮭魚、果香酥烤鴨胸，無論是擺盤還是菜色，讓我們都非常滿意。

和食：照燒雞肉炸飯團，外面酥脆，咬下去香氣十足，下次若有機會想要嚐嚐野菜天婦羅烏龍麵，看別人在吃，口水都要流出來，看起來好豐盛。

甜點：最喜歡冷月紫米，芋頭泥搭配紫米剛剛好，熱熱的、不甜膩很好吃。

飲料：玄米抹茶奶蓋，超級濃郁，非常推薦。

推👍"
 Chiaos Chen ,https://www.google.com/maps/contrib/108553097783804841971/reviews?hl=zh-TW,4,True,639,套餐式的餐點，主菜選擇還算蠻多樣化的，個人來說覺得吃蠻飽，服務也還算積極，但主菜牛排熟度感覺不是很穩定，每次都點七分熟但有時會太熟有時又太生⋯，其他餐點的品質就比較穩定。
 Gawa Chia-Hua Chen ,https://www.google.com/maps/contrib/112897825172052161347/reviews?hl=zh-TW,4,True,204,美味與服務兼具的餐廳
 Gordon Tseng ,https://www.google.com/maps/contrib/115047586068698405471/reviews?hl=zh-TW,1,True,81,上菜時間過久，且餐點也沒有以前好吃，以後可能不會再去吃了。
 陳佳佑 ,https://www.google.com/maps/contrib/105120469698215886249/reviews?hl=zh-TW,5,False,308,東西美味好吃～
 Seven Chen ,https://www.google.com/maps/contrib/115218723948318052480/reviews?hl=zh-TW,4,True,208,點餐的男生有點冷漠，不會多做介紹還會催促趕快點餐，餐點算好吃其他服務都不錯，羊排筋有點太多七分熟有點像五分咬不太動
 rourou zheng ,https://www.google.com/maps/contrib/102097088758969062747/reviews?hl=zh-TW,4,True,198,"聚餐好地方花旗（享樂？）卡平日還九折

餐點分量女生很ok也滿好吃的"
 陳柏維 ,https://www.google.com/maps/contrib/102275738142979501473/reviews?hl=zh-TW,2,True,82,吃過很多次陶板屋，但這次的經驗真的讓人很不開心，事先預約的生日壽星完全被忽略（別家店都會主動再次詢問）就算了，從一進店的點餐開始，就讓人覺得很壓迫又催促，店員完全沒有想要介紹餐點的意思，站在桌邊直直看著等我們點餐就算了，點完餐後，從前菜出餐開始一道比一道趕，前湯都還沒喝完，主餐就送上來了，不誇張真的不到10分鐘的時間，完全沒有顧慮客人前道菜是否用完就想要收。用餐時間是8點，推想是因為接近打烊，有出餐與營業時間壓力，但應可事先與客人說明或提醒，而不是讓客人感受到如此明顯且異於常態的*壓力*，餐點品質也明顯變差，事後有寫服務評價回報，但似乎石沈大海，為了避免更多人花錢受氣，建議大家可選擇其他分店！！
 凃宥聰 ,https://www.google.com/maps/contrib/111497543651920935582/reviews?hl=zh-TW,4,True,75,出餐速度非常慢，40分鐘只來了沙拉跟前菜，等得肚子很餓，主餐炙烤牛肉雙味建議可以從菜單移除了，肉質非常乾柴難嚥，甚至不如路邊便當店或百元牛排店，我點的是7分熟，但如圖完全不是7分該有的色澤，好在其他食物都很美味，服務也不錯，值得嘉許。
 陳逸軒 ,https://www.google.com/maps/contrib/100020207317359072732/reviews?hl=zh-TW,4,True,253,老實說以前的陶板屋我一直覺得很普通，不過近期因為有更新過菜單的關係，所以想說再來吃一次!結論是我覺得變好吃了哈哈，陶板屋主打的是日式和風式的餐廳，首先店內的環境是很符合約會或是朋友聚餐的場合，服務人員也都很親切畢竟王品對服務員的要求很高，再來食物部分也都很精緻且口味有一定的水準，在份量也很足夠男生的話都可以吃得飽，而針對自己不太喜歡的菜色也可以做其他類型的跟換，例如飲料在換一個甜點。主餐的部分我覺得表現的很好，尤其是加價的10盎司牛肉大推!!很入味非常好吃~~但唯一美中不足的地方我覺得是他的檸檬塔，跟塑膠一樣真的很難吃BJ4，其他甜點我覺得都還可以，但唯獨檸檬塔不知為何真的很難吃，不要點!!哈哈~~但王品旗下的店我覺得都還不錯啦^^
 Sabrina ,https://www.google.com/maps/contrib/111826474887510859730/reviews?hl=zh-TW,5,True,201,今天的香蒜瓦片牛肉依然好吃，新菜色>蕃茄海鮮生菜很驚喜!喜歡😊，鮭魚茶泡飯很清淡爽口，只是飯太多已經吃不下了，唯一想挑剔的是咖啡不太好喝，週六客人滿滿服務水準一直好的没話說👍大推
 CHIAO JOU Hsieh ,https://www.google.com/maps/contrib/111765987406916952834/reviews?hl=zh-TW,5,True,79,"服務熱忱
東西好吃
價格合理
愉快的用餐體驗"
 Wei Cheng ,https://www.google.com/maps/contrib/112108457339072136247/reviews?hl=zh-TW,3,True,136,東西還好比西堤差生日也沒什麼表示不像西堤還會送小蛋糕
 XD Jocelyn ,https://www.google.com/maps/contrib/115740433883038278956/reviews?hl=zh-TW,5,False,2,餐點好吃〜服務人員也很親切〜
 Jason Lin ,https://www.google.com/maps/contrib/107074127549796596979/reviews?hl=zh-TW,5,False,64,餐點好吃，服務雖然已經沒有古早時期的那麼好，但還算不錯了，價格也算實惠。
 Allison Lee ,https://www.google.com/maps/contrib/113629250532106458608/reviews?hl=zh-TW,4,True,17,主菜點蒜片牛和牛排都蠻好吃的，最不怎樣的就是炸飯糰了，裡面的飯口味好膩，肉末很硬，吃完每道菜的最後一口，服務生都在10秒內收走盤子，然後很快的上下道菜讓我壓力好大，建議可以給客人多點時間，不要過於緊迫盯人
 chi chi ,https://www.google.com/maps/contrib/117896884906815599046/reviews?hl=zh-TW,5,False,70,"來訪多次～還是一樣好吃
不論是聚餐、慶生都非常合適💗"
 YQ Chen ,https://www.google.com/maps/contrib/105138567585582723813/reviews?hl=zh-TW,5,True,116,雖然母親節當天生意很忙訂位很多，但是服務人員還是非常的親切有活力，忙碌之餘不忘露出笑容~辛苦大家了!!
 嚴小雯 ,https://www.google.com/maps/contrib/113119221850149854702/reviews?hl=zh-TW,3,True,294,"食物還OK不過上菜很慢
服務很普通總結來說CP值不高"
 Rafael Tang ,https://www.google.com/maps/contrib/109625613308114146756/reviews?hl=zh-TW,5,True,463,服務員很好喔！都會詢問餐點滿意度，也可幫忙外帶餐點。很愉快的一餐！只是冷氣下次可以調整一下，我迎風面吹的比較冷些。謝謝你們還是很棒喔。
 Huang Rita ,https://www.google.com/maps/contrib/113965040237157871050/reviews?hl=zh-TW,4,True,129,有一陣子沒來吃陶板屋了，主餐蒜味牛肉瓦片及鴨胸一樣好吃，但南瓜湯、飲料及甜點有點退步，南瓜湯不夠純，冰拿鐵感覺是即溶咖啡泡的，有點可惜！
 Ling yung Liao ,https://www.google.com/maps/contrib/116651752346746655923/reviews?hl=zh-TW,4,True,433,好久沒吃陶板屋了，感覺菜色和之前相比，還是大同小異，沒有驚艷，也沒有不好吃，唯一最可取的地方就是服務，王品集團的服務訓練真的很有一定的水準。
 Yu-Hsuan Chien ,https://www.google.com/maps/contrib/110824454741707538390/reviews?hl=zh-TW,4,True,95,"出餐快速！東西蠻好吃的！
環境舒服，交通方便！
唯一缺點就是甜點的菜單與實際上的品項有出入（例如：菜單/起司蛋糕，實體吃起來是奶酪的型態，但卻沒奶酪的香味。菜單/哈密瓜冰淇淋，實體應該是宇治金時蛋糕哈密瓜冰淇淋）希望可以將名字或者敘述多➕描述。謝謝！"
 W “王小兔” ,https://www.google.com/maps/contrib/116426667698318425280/reviews?hl=zh-TW,2,True,42,沒特別喜歡，醃過的肉口感怪怪的，熟度選5分送全熟，湯喝完會口渴，炸飯糰與燉飯感覺是運用餘料製作沒特色，水果茶很好喝，桌與桌很接近，聽得到臨桌談話內容，給兩顆星是因當日服務人員很親切
 Grace Gau ,https://www.google.com/maps/contrib/116095607836513528457/reviews?hl=zh-TW,4,True,133,"陶板屋
地點：位於台北車站附近重慶南路上，二樓，樓下有個全家，地點還算好找。
環境：近期陶板屋布置改走木質系，色調柔和溫馨，空間寬敞，嬰幼兒座椅也會備妥。
服務：服務生親切，也會不定時到桌邊添加熱麥茶，小小提醒，點餐時若有告訴用餐客人會贈送開胃菜(應該是炸餃子)，沙拉送上桌時還沒有看到前菜就可以提醒服務生贈送的開胃菜可以上桌了，這樣子比較不會拖到最後喔！(中午用餐後線上填完問卷，下午3點左右就接到值班經理來電，感覺很進取~服務態度很好)
餐點：每道菜都在一定水準之上，但是主餐的牛肉如果不想要太熟，可以提醒，如果過熟肉質會偏硬，個人不愛，他們說廚師會幫忙準備新的。
飲品：星梨蜜桃冰茶→不是我們以為的PeachTea，它是楊桃汁喔，提醒怕酸的不要點這個。"
 Au Yeung Tsui Fong ,https://www.google.com/maps/contrib/108709915341053545619/reviews?hl=zh-TW,5,True,70,"之前已食過一次，
對蒜片牛柳念念不忘，
所以再來吃，
果然不負所望，
美味很好環境舒服
上菜速度會因應食的進度，
而中途服務人員亦有走上前問客人覺得食物如何
推薦！"
 のきたゆ乃木田侑 ,https://www.google.com/maps/contrib/114867531624590502052/reviews?hl=zh-TW,5,True,988,"廁所有一點髒而且有尿騷味地上都是尿餐點的話蒜片牛肉好吃飲料因為沒有附贈吸管只能拿著大杯自己喝建議可以自己拿吸管就不求人

建議要先訂位打電話問問看有沒有位置即便是前一個小時也應該要訂位不然在現場會等超久你到時候我中午12點的時候才訂到1點半的位置這樣子我一進去就不用等可以直接入座泡飯系列都還蠻難吃的有點像是吧肉粽放在水裡面吃的感覺如果是炸飯的話也蠻像肉粽直接放去炸的吃起來很乾有說很好吃中常會在煮餐之後才會上來如果是在主餐之前就上來的話那麼建議可以直接不用吃免得主餐吃不下

陶板屋的特色是所有的餐點都會有一個有造型的餐盤餐點的話算不錯吃唯一要注意的事中餐只用到3點他就關門了所以如果是親朋好友來聚餐的話建議可以11點多就開始吃"
 Reika You ,https://www.google.com/maps/contrib/117316187917369519389/reviews?hl=zh-TW,3,True,262,"服務態度不錯，但是很少主動來倒茶水
餐點我覺得只有沙拉和湯品算好吃
前菜和牛排跟菜單圖片實在差太多
尤其牛排真的很普通
而且過熟，不知道是不是因為用料不好的關係不敢上太生的料理"
 Pony Liao ,https://www.google.com/maps/contrib/113175978921866535736/reviews?hl=zh-TW,5,True,210,給五顆星是因為很推薦這間的服務態度，服務人員客氣且主動。只是從隔壁桌聽到我們這桌有人是本月壽星，後來就主動送上蛋糕及生日帽。整體菜色口感仍維持一定水準，特別喜歡炸飯糰跟今天的新主食-紐約客牛排，飲料一般，甜點芒果冰淇淋很好吃。
 Ethan Huang ,https://www.google.com/maps/contrib/104208501585804658342/reviews?hl=zh-TW,2,True,113,吃到主菜過後發現手機，包包，餐桌以及餐具上佈滿落塵，跟服務員說想請店長過來後，有另一個服務員馬上來瞭解幫我們換了位置，但是因為已經剩下甜點了就請她幫我們打包，店員的服務態度很好，星星是給他們的；但是用餐環境實在需要改善，家人生日常會到陶板屋用餐，但是這些裝修粉塵吃下後實在讓人很感到失望。
" Kai Bun, Ben LEE ",https://www.google.com/maps/contrib/107278122443687135301/reviews?hl=zh-TW,5,True,104,"今次係第二次到陶板屋，第一次係苗栗
依間店俾我感覺服務高級，食物質素中上，價錢就係平民嘅西餐廳！
點解講服務高尚，首先你點完餐，佢有張點菜紙係台頭，唔需要件食物黎到再同佢講邊個叫左咩，佢地會自己睇，其次就係不時關心你食嘅進度，遲黎嘅時候就會主動幫你跟進同報告情況，最後問埋你滿唔滿意，總之由頭到尾你會俾人服務緊，但唔會有壓力
其次講食物，佢每樣食物都係少少，但佢有7樣野食連野飲，其實好似去飲咁，去到中間都已經有D飽
而價錢就只係大約百幾蚊港幣，唔會好貴
各位如果係台灣想試下西餐，依間係一間唔錯嘅選擇😬😬"
 筠兒 ,https://www.google.com/maps/contrib/118249937802726340602/reviews?hl=zh-TW,5,False,9,服務親切友善食物美味
 湯玉萱 ,https://www.google.com/maps/contrib/106431945558647651440/reviews?hl=zh-TW,5,True,187,"菜色清爽
齒頰留香

用餐環境佳

【外場長】【芸萱】服務專業完美

負責【生日慶生活動】的外場主KEY親切活潑，將慶生活動帶到最HIGHT點

陶板屋臺北重慶店
是會令人還想一來再來【有溫度】的餐廳"
 Pocky He (何波奇) ,https://www.google.com/maps/contrib/116309865629311154584/reviews?hl=zh-TW,4,True,426,套餐精緻菜色有定期更改，也有貼心替兩位壯漢安排較為寬敞的位置，唯服務送餐態度需加強。
 吳景堯 ,https://www.google.com/maps/contrib/111517229901723881958/reviews?hl=zh-TW,4,True,136,王品的排餐店，食物維持一貫水準，可以吃到整套料理，從前菜的主菜甜點飲料都可以吃的很高興
 Y belleuve- ,https://www.google.com/maps/contrib/103303567127381385170/reviews?hl=zh-TW,4,True,"1,520",這間剛好經過就想吃，點了蒜香羊排真是讓我滿意，服務生很親切，店內環境佳，下次有機會再來訪！190926
 NANA ,https://www.google.com/maps/contrib/117955541215313692505/reviews?hl=zh-TW,4,True,206,沙拉現在有加價80升級軟殼蟹，現炸的軟殼蟹非常好吃！牛排雖然有厚度卻軟嫩入味。反而是湯品內的牛肉比較沒有軟。推薦茶碗蒸跟甜點！
 Betty Lo ,https://www.google.com/maps/contrib/107300400314852360554/reviews?hl=zh-TW,4,True,148,"食物沒什麼好挑惕的～
但慶生拍的照片洗出來是模糊的，臉部都晃到糊了，有點小失落😭
也不好意思再請店員重拍......
去別間店都不曾有這種狀況發生，服務人員都會很細心的幫忙確認，甚至洗出來前還會拿相機讓我們確認o不ok......"
 Yilin K ,https://www.google.com/maps/contrib/116108863247084715285/reviews?hl=zh-TW,4,True,744,價格還可以，能吃到很飽。食物也還可以，份量很多。
 LEN ,https://www.google.com/maps/contrib/101703072047547989037/reviews?hl=zh-TW,1,True,47,"女朋友昨日去貴店用餐，沙拉點了蕃茄海鮮，第一次上爛蕃茄，第二次上沒蝦子的蕃茄，第三次上看起來正常結果吃起來是爛的蕃茄，她就索性不吃了。備註：是味道爛掉，不是外觀爛掉
後來上飲料拿鐵，發現杯子上有一排口紅印，是杯子沒洗就送上嗎？還是上個客人喝剩的?
今天早上因為肚子不舒服就連早餐也沒吃就去上班，結果才剛到沒多就就上吐下洩，現在在醫院看醫生。。。
一間連鎖餐廳這到底是什麼品質。。。太扯了吧!!!!!"
 珊珊 ,https://www.google.com/maps/contrib/106560680686806801037/reviews?hl=zh-TW,4,True,231,好久沒吃了，覺得服務以及餐點都在走下坡，沒有以往那麼好了...
 艾西莫夫瑪 ,https://www.google.com/maps/contrib/105531386946755824796/reviews?hl=zh-TW,5,True,943,20201127_內有座位約有40-50個，服務好，餐點多樣，品質穩，是聚餐好選擇。
 Aden Huang ,https://www.google.com/maps/contrib/111906324766418312927/reviews?hl=zh-TW,4,True,"1,096",這間生意很好，服務人員每個都很忙，中規中矩、服務到位餐點牛肉熟度也恰到好處
