user_name,user_profile_url,rating,local_guide,comment_num,comment_text
 Yuki ,https://www.google.com/maps/contrib/111920524916155567989/reviews?hl=zh-TW,3,True,25,"服務五顆星/餐點三顆星

分開點餐但都是飲料先上，其中一杯飲料講了三次然後已經不知道吃到哪一道料理了才上來

壽星送生日蛋糕上面會畫畫裝飾，以前印象中用巧克力，現在畫得五顏六色不知道可不可以食用因此詢問服務生，結果答案是：我不知道。
然後沒下文了😅

餐點增加很多需要加價的，剛好要加價都是我喜歡吃的，所以性價比就變得非常低
598+99+89+150+10%=1029

野蔬蒲燒鯛魚沙拉-鯛魚兩片一大一小口感都微硬/蔬菜中規中矩
干貝海鮮茶碗蒸-屬於很湯水的那種，湯跟蛋比例大概2:1好吃推薦👍
馬賽番茄海鮮燉湯-裡面好像是兩隻蝦跟幾個料，喝起來就是只有蕃茄味的湯
嫩煎豚排-這是第一次吃王品集團給一顆星的評價，圖片上看起來跟牛肉一樣美味，但實際上是豬里肌肉切片煎過熟撒七味粉，名叫嫩煎但卻要一塊肉一口茶才有辦法吃下去的乾，我跟同事的都是一樣乾，花椰菜還根本咬不斷，有～夠～刮～
果香酥烤鴨胸-直接多加一顆星，鴨胸熟度控制完美鮮嫩多汁，口味偏重所以沒有羶味，主餐點這絕不會錯🤤
濃咖喱雞肉炸飯糰-身為澱粉控的我也對這飯糰失望，完全沒有香氣，連所謂的濃咖哩都只有微咖哩，炸到吃起來還會刮嘴
冷月紫米-萬年不變好滋味，大家可以在全聯買冷凍包來吃～
飲料都很中規中矩想像得到的味道，不喜歡酸的我覺得所有飲料裡面免費提供的桑椹醋更好喝😅"
 蔡佳宏 ,https://www.google.com/maps/contrib/115089056180376077772/reviews?hl=zh-TW,5,True,39,"這次選擇這邊幫朋友慶生

餐點心得如下：

1.餐點升級的軟殼蟹味道很棒，沒有什麼腥味，吃起來有點像蝦餅

2.鴨胸很嫩，可以很輕易的切開&入口，很值得點一份

3.唯一的缺點就是炸飯糰，只有咖哩的味道跟油炸的口感，吃到後來很容易有油膩的感覺

4.最後的甜點哈密瓜冰淇淋，哈密瓜味道很重，小朋友應該會很愛

最後不得不提一下，今天幫我們服務的是美惠

很熱情也很貼心，讓人心情愉悅

即使那麼忙也能夠保持滿分的服務態度

很讓人佩服

最後這位服務員的名字

也會讓人想到亡命天涯小包包😆

（懂的人就會懂👍）"
 Wei ,https://www.google.com/maps/contrib/115065426829540276322/reviews?hl=zh-TW,4,True,829,"#焗牛肉鮮蔬溫沙拉（7.5分）
焗牛肉上桌完全溫的，沙拉和風醬上面有橘瓣，清爽好吃
#干貝海鮮茶碗蒸（9分）
應該是小珠貝配蟹肉風味條，不過蛋滑嫩，整體很好吃
#輕蔬牛肉湯（9分）
感覺是沒有放番茄的羅宋湯，牛肉竟然有五塊讓人驚豔
#御選紐約客牛排五分熟（9.5分）
牛排非常軟嫩，熟度也剛剛好，個人比較喜歡紅酒醬，黑胡椒醬稍辣
#松露雞肉炸飯糰（10分）
海苔飯糰裹著雞肉，再酥炸成金黃色，裡面雞肉拌著松露香氣，搭配蜂蜜芥末醬非常好吃！
#Line兌換的炸可樂餅（不列入評分）
小小一顆，蜂蜜芥末醬還行
#伯爵茶杏仁慕斯蛋糕（9.5分）
竟然是好吃的甜點，底部巧克力蛋糕上面還有夏威夷果仁，伯爵茶跟杏仁搭配的恰到好處
#橙香烏龍水果冰茶（5分）
普通，沒什麼特別的
#壽星招待檸檬塔（9分）
非常好吃，酸甜不膩口
弘凱服務可再加強。"
 Ssu Ya Hsieh ,https://www.google.com/maps/contrib/101926987956646926237/reviews?hl=zh-TW,4,True,317,"2022.07.23
很明顯店內服務人員不足
90分鐘的用餐限制時間
餐點都還無法上齊
即便我們這桌是那一區第一組的客人
但還是整區域一起上菜的節奏
隔壁2人桌入座比我們約莫晚30分鐘
菜品卻比我們早上桌
因為人員不足的關係
就不用想用餐期間會有主動的服務
但上菜時服務客氣

等餐期間有個意外插曲
陶板屋補上主廚私房料理作為補償
但可惜的是酥炸的可樂餅
應該要熱騰騰時就送上桌
但上桌我們入口時
外層的可樂餅都已冷掉回軟一點都不酥脆
我們有點傻眼補償料理是這樣？

個人覺得好吃的有
前菜-干貝海鮮茶碗蒸
主菜-果香酥烤鴨胸（7分熟）
其它很普通
但果香酥烤鴨胸熟度控裝完美
真的非常好吃
因為今天完美的鴨胸我多加了一顆星
家人其它主菜的肉品也好吃
今天主菜表現非常出色"
 Ada chen ,https://www.google.com/maps/contrib/110989729583557668702/reviews?hl=zh-TW,4,True,64,"服務品質🌕🌕🌕🌕🌗
菜色評價🌕🌕🌕🌕🌑
肉類評價🌕🌕🌕🌕🌘
環境清潔🌕🌕🌕🌕🌗

沙拉🥗焗牛肉鮮蔬溫沙拉/野蔬蒲燒鯛魚沙拉-🐮還可以，沙拉一直都有的菜色。🐟新品鯛魚，非常好吃，鯛魚不會有其它的怪味，非常新鮮。
-
前菜🍴海鮮干貝茶碗蒸-還是跟以前一樣很好吃，小小一碗的料很豐富，滿滿的海鮮。
-
湯🥣百合牛肉湯/奶香牛肝菌野菇濃湯
🐮牛肉湯跟以前一樣好喝，肉塊很多很嫩。清甜可口。
🍄新品：非常濃郁。奶香味十足。
-
主餐🐮香蒜瓦片牛肉/紐約客牛排🥩
香蒜牛排七方熟🧄煎的剛剛好，不會很柴，非常嫩，沾醬有黑胡椒醬/和風紅酒醬，蒜片炸的很甜非常好吃不會有苦苦的味道。
紐約客五分熟/也是煎的相當嫩，適合男生的份量。
以上下配菜有日本甜地瓜🍠甜口蓮藕片和馬鈴薯🥔花椰菜🥦
-
和食🍙松露雞肉炸飯糰/起司牛肉炊飯
每次吃到炸飯糰的部分，都有點太飽了😂，兩種品項都很好吃。
-
甜點🍮冷月紫米/芒果橙香鮮奶酪🍊/-
紫米不會太甜，非常健康的甜品，不喜歡太甜的甜點，可以選擇。
奶酪單吃就很好吃，奶香味十足，加了醬汁就是不同風味。
爆米花非常特別有創意的甜點。沒有吃過的可以嘗試看看。
-
飲料🥤橙香烏龍水果冰茶🍊/沁涼百香果氣泡飲🫧-
🍊冰茶烏龍香氣非常重，跟橙汁搭配非常清爽好喝。
🍸百香氣泡個人滿喜歡的，非常適合不喜歡喝甜飲料的人。
-
免費提供的桑椹醋，很解膩好喝，也可以一直續杯。推推👍🏻👍🏻
-
服務人員態度很好。
上菜速度很快。環境乾淨衛生。
上菜時間到晚上9點，營業要晚上10點。"
 Anderson Lee ,https://www.google.com/maps/contrib/104434796614057851013/reviews?hl=zh-TW,4,True,384,一如大家的反應，時間一到，門一開果然迅速滿座，也讓服務人員忙到完全不理睬我們，看著一桌一桌的點完還輪不到我們也是無奈，好不容易輪到我們點餐，坦白說，我不太清楚這位服務人員在急什麼，我們也挺有耐心的等了十幾分鐘到妳有空過來點餐，基本上她說的話，我都聽不太清楚，好不容易點完餐了，基本上就是等餐點了，看著服務人員瘋狂的穿梭，就算想要請他們多給一點醬料，多倒一杯水，我都會覺得不好意思！等待著下一道餐點，還好有多一個位置讓我們放用完的餐盤，等待著上菜等待著收盤子，餐點一如往常的有著以往的水準，牛菌菇湯點嚐起來還好，沒啥驚艷之處，香蒜瓦片牛肉一樣維持著以往的水準，完全不想換別的口味，升級後的天婦羅炸蝦捲餅，嗯...不如不升級了！甜點還不錯，哈密瓜冰就凍得很，不適合小朋友，水果茶一般般，服務人員週到的把所有該做的流程都跑完，包含慶生、蛋糕、拍照、印照片，接下來還沒拿到照片，其他服務人員就在催促時間到了，其實我們也想離開，只是你們菜上的太慢了，而且這些流程如果服務人員做起來非常趕，其實也不需要特地要這樣安排，總是服務是一種心意，當客人都感受到服務人員是在跑流程了，那意義就不再了！何必大家互相配合演出呢？尤其是到櫃檯結帳，櫃檯人員還特地的問是否有安排慶生流程，當下立刻回有，不然還真擔心我們那桌的服務人員事後被唸！吃飯吃到這樣就累了！生意真的太好了！
 Chi Chi Kang ,https://www.google.com/maps/contrib/115908409666450093884/reviews?hl=zh-TW,4,True,312,"第一次到這家門市用餐
12點到時
服務人員很忙碌
等了一會兒才有服務人員來代位
個人覺得好吃的有干貝海鮮茶碗蒸、香蒜瓦片牛肉、哈密瓜泡芙、生日的芒果蛋糕
其餘餐點就很一般般
但飲料真的很失敗
可以吃蠻飽的
服務來說就是忘了給生日蛋糕、加賴送的主廚料理、茶也忘了補
需要提醒才上
第二年用花旗享樂卡消費真划算
不可以併用身分證2&0套餐升等優惠"
 dolby calvin ,https://www.google.com/maps/contrib/114099879678389072323/reviews?hl=zh-TW,5,True,27,"餐廳環境幽雅，食物品質不錯👍款式也很多選擇，餐廳客滿的時候冷氣不夠。一邊吃一邊出汗😅某些座位的燈光設置有待改善（射燈直射到人客的額頭）很刺眼😓～其餘都沒有什麼問題。
餐廳服務員十分熱心和有耐性，都很有禮貌🙏🏻但有人覺得這個是基本的～但是我暫時在台北吃過的餐廳內，這是其中服務態度最好的👌一間
期待下一次有更好的體驗😉"
 Cindy Chang ,https://www.google.com/maps/contrib/115279847110220785025/reviews?hl=zh-TW,4,True,382,"🍴餐廳-陶板屋

王品集團的餐廳一直以來我都會比較在意服務的完整性及餐點的品質，這次剛好遇上換菜單，可以詳細的說明一下餐後感。

水果沙拉的鳳梨完全沒味道，吃下去只有一堆水但是沒有味道，問了朋友她吃也是沒味道，不曉得是什麼鳳梨🍍

海鮮清湯變成了薑湯，喝起來味道沒有之前的好，而且裡面的貝類吃起來沒有很新鮮，也沒有什麼特別的味道。

三角飯糰從以前的鮭魚茶泡飯變成了起司牛飯糰，吃起來還不錯，甜點的布蕾也還不錯。

但我覺得這樣子吃起來要6百多有點貴，覺得整體而言讓我滿意的餐點數量下降，但價錢略貴，有點失望，因為有花旗卡所以每年都會來，加上家人特別喜歡陶板屋所以品嚐的次數很多，整體的水平少少下滑覺得可惜。"
 Laura Liu ,https://www.google.com/maps/contrib/108620104611698793318/reviews?hl=zh-TW,4,True,77,這次來陶板屋幫家人慶生，當月壽星下載王品瘋美食會有本人套餐85折的優惠券可以用，此外還會送一片生日小蛋糕和幫忙拍合照洗出來做紀念。這間陶板屋已經開了很久了！很久以前就常常來這吃，這裡的裝潢好像有一點改變，座位空間變得更大了！一直都很喜歡他們的蒜片牛排，每次來都點這個，以前都點7分熟，但這次點點看5分熟發現更適合更好吃更嫩！！牛排配上蒜片真的很好吃！茶碗蒸很嫩裡面蠻多海鮮的！紐約客牛排是菜單上的推薦餐點，5分熟吃起來也很嫩很好吃！而且他們的肉感覺本身是有醃漬過的直接吃都很夠味！最近有活動是填問卷會送兩片小披薩！這次吃下來真的好飽！
 呂小昇 ,https://www.google.com/maps/contrib/102577187849076403017/reviews?hl=zh-TW,5,False,20,王品集團的餐點品質一直都有一定的水準，整體口味我覺得都很好吃，不管是沙拉、前菜、主餐、甜點都讓人很滿意，不過湯品的選擇部分可以再加強一點，另外服務的部分真的是很好，這次菜單的湯品同行的朋友不太喜歡，服務人員有注意到這點，特別加送一個茶碗蒸給我們，讓我們感覺很貼心，之後也會詢問我們餐點合不合口味，雖然晚餐時段客滿很忙碌，但是服務水準並沒有降低，讓我們有一個愉快的用餐體驗
 Kevin Pan ,https://www.google.com/maps/contrib/111038121853165030943/reviews?hl=zh-TW,5,True,472,"這次選擇與家人團聚慶生
服務態度不錯
環境也算整潔
沙拉、前菜、主餐、副餐、飲品、甜點
的內容多樣可以自行搭配選擇
很推薦他們另外加點的醬燒牛肋排及烤鯖魚
另外跟店員說生日
他們除了有精緻點心一份之外
還會幫你拍照
並現場列印照片出來做成卡片
揪感心！"
 Pablo ,https://www.google.com/maps/contrib/105474759688943396004/reviews?hl=zh-TW,5,True,230,"不錯不錯
前菜的焗烤牛肉稍嫌不滿意焗烤的部分是溫的吃起來不好吃裡面也是稠稠的白醬我個人不喜歡旁邊的沙拉醬很清爽不錯
再來是加價的軟殼蟹這個價錢吃得到軟殼蟹也是不錯啦但螃蟹有點腥就是了還好不是我點的我只吃一口
再來是茶碗蒸上面還有柴魚高湯蒸蛋吃起來很滑順很好吃裡面料也很多真的是不吃香菇的福音想想以前的陶板屋只有杏包菇的選項真的是逼死人
湯的部分我覺得海鮮湯很普海瓜子也是腥味很重扇貝跟蝦子不錯吃下次改點牛肉湯
再來是招待菜兩片小小的披薩話說我們這桌三個人看了也是挺尷尬的但也是因為我們只有一個人願意填手機問卷咯所以只能怪我們自己
再來是主餐紐約客普普帶筋吃起來口感不錯缺點就是切太薄了厚度不到一公分的牛排咬起來真沒勁如果想吃牛還是乖乖點蒜香瓦片牛排吧
烤半雞很大一份送上來熱呼呼的而且吃起來不輸外面的烤雞不吃牛的或不想吃牛的可以考慮
飯糰的部分兩個都好吃咯看你要吃炸的還是要有起司的我覺得兩個各有特色各有千秋
甜點部分我覺得泡芙跟奶酪都很好吃另一個還好到最後三個甜點都有吃完同樣是王品集團陶板屋的甜點好好吃反觀單價更高的夏慕尼甜點真的是慘不忍睹可以請陶板屋甜點師傅教教夏慕尼的嗎😄
這家店重新裝潢過
整體來說乾淨整潔
我個人很在意的廁所部分也是非常乾淨
服務生也都很親切友善從開始用餐到結束我的茶杯從來沒空過
不愧是王品系列的店家真的是不用太擔心服務不周到
再次給予五星肯定
還是有能加強的
希望你們能夠更好咯
順帶一提冷氣有點冷但我是不怕冷啦
但吃可以帶一件小外套就是了
以上"
 Bo Bo ,https://www.google.com/maps/contrib/113977198446880782562/reviews?hl=zh-TW,5,True,913,和同事下班一起來用餐，好幾年沒吃陶板屋了，套餐總共有七樣，點了沙拉燻雞野蔬凱薩沙拉，前菜海鮮干貝茶碗蒸，湯品蔗香海鮮清湯，主餐果香酥烤鴨胸，和食起司牛肉炊飯，甜點冷月紫米，飲品日式玄米鹹奶茶熱，以上覺得點的都不錯吃很合我胃😆，茶碗蒸和烤鴨胸好吃，玄米鹹奶茶第一次喝滿特別的鹹鹹甜甜不難喝，今天和同事一起用餐愉快，聊的開心吃的開心，服務員也不錯。
 Shyme Huang ,https://www.google.com/maps/contrib/101356364332324337048/reviews?hl=zh-TW,4,True,48,"餐點份量比起以前明顯的減少了
餐點的細節部分希望再加強
例如盤子送來醬汁沾黏也沒有擦乾淨
對我而言影響了美觀
畢竟這裡價位也不便宜
這些細節也是應該要注意的
一如既往的，最後的飲料部分還是沒有讓我挑到喜歡的
最愛的還是中間免費送上的冰沙"
 Jenny ,https://www.google.com/maps/contrib/110277884550791141856/reviews?hl=zh-TW,4,True,85,"第一次來這家分店吃飯
整體裝潢氣氛都很不錯
餐點都有在一定的水準之上
雖然有位看似是新來的服務生送餐流程還不太熟悉
但希望可以給予多一點鼓勵不要太苛責~~
也期望她能夠趕快上手👍"
 Lisa Li ,https://www.google.com/maps/contrib/108347505146401792718/reviews?hl=zh-TW,5,False,4,必點主餐香蒜瓦片牛肉，肉質香嫩，不用淋醬，單搭配香脆蒜片層次口感好美味，套餐附上的每道餐點在視覺和味覺上都很棒，服務人員的態度很好，非常用心送上生日蛋糕，也拍了全家福照，陶板屋真是慶生的好地方。
 Michael Tai ,https://www.google.com/maps/contrib/101036036975707227430/reviews?hl=zh-TW,4,True,152,"王品集團，吃的就是服務的感覺
面對突發事件，員工不會推諉
而是儘快進行處理
就在我們重回歡聚的氛圍中
員工帶著一人一份的主廚私房菜向我們表達歉意
在這邊，不僅東西好吃、份量充足
更藉由這個插曲讓我們有了十分滿意的歡聚時刻"
 Nick ,https://www.google.com/maps/contrib/103758425028595118348/reviews?hl=zh-TW,5,False,13,"鴨胸的外皮烤的很酥，肉質嫩，配上醬汁很好吃
前菜沙拉配上醬汁很可口
茶碗蒸一點也不馬乎，吃起來很嫩
不推薦蘑菇濃湯上面的鮮奶油
因為跟湯汁較不搭
炸飯糰口味普通
最後的甜點鮮奶酪味道很濃，伯爵蛋糕濕潤不乾燥，很棒"
 迪麗歐爸 ,https://www.google.com/maps/contrib/106898605513419475021/reviews?hl=zh-TW,5,True,718,自從某次去國父紀念館用餐後，（晚上8點冷氣開到夭壽強在趕客人，印象深刻），好久沒來陶板屋用餐，一樣的親切，一樣的豐盛，一樣的美味，好吧！有機會會再來用餐
 shan-ming Huang ,https://www.google.com/maps/contrib/105647612369923593812/reviews?hl=zh-TW,5,True,346,"各項防疫措施均有做好
桌與桌之間保持適當的間隔
服務人員輕聲細語、態度謙和，讓人舒服。
餐點合乎口味，不疾不徐的上菜，能讓朋友相聚時刻好好聊聊、好好吃一頓豐盛餐點。"
 星野綾奈 ,https://www.google.com/maps/contrib/115056942812149317235/reviews?hl=zh-TW,5,True,14,"來這裡吃家庭慶生晚餐～
套餐精緻美味，價格也十分合宜💓
慶生的小甜點和合影相片很有紀念價值！
每次家裡有人生日都會來王品集團的店吃生日餐🎊"
 謝依容 ,https://www.google.com/maps/contrib/103972840051397729795/reviews?hl=zh-TW,5,True,252,"公司聚餐~座位必須坐滿才能開始點餐!
服務人員上菜速度銜接很好~
餐點也很好吃!第一次吃烤半雞份量很足
吃得好滿足啊！"
 yiying li ,https://www.google.com/maps/contrib/112237210763660958049/reviews?hl=zh-TW,5,True,161,王品集團一貫的套餐和服務，雖然這次有些品項吃起來沒那麼喜歡，但是服務人員都太客氣到讓人不忍反應，結帳後還幫忙處理之前去肉次方的消費問題，只能說這種服務實在是太貼心，所以下次聚餐應該還是會再去。
 陳彥儒 ,https://www.google.com/maps/contrib/105932543841034778845/reviews?hl=zh-TW,4,True,50,"來跟家人慶祝生日🎂
不得不說王品真的很適合過節
氣氛好服務也好

不過餐點還是很優質
只是感覺有縮水😅"
 無段道楓 ,https://www.google.com/maps/contrib/108089191503389213461/reviews?hl=zh-TW,3,True,715,"週末用餐建議一週以上之前定位。
服務.環境都普通，口味還OK。單一價位(可加購)。
餐點跟菜單基本上一致，但有種莫名的違和XD
可能是角落的位置本來太微妙，兩三個服務生，都會服務到前一桌，手上東西就滿了，或是醋飲就沒了，就被跳過了(不會再回來)XD"
 Chang Jung Chen ,https://www.google.com/maps/contrib/110969914541078093369/reviews?hl=zh-TW,4,True,15,本來想要吃紐約客20牛排，後來想試試平時比較不容易吃到的鴨胸，結果比想像中的多汁，很好吃喔！
 Rolo Chang ,https://www.google.com/maps/contrib/117067546880160640178/reviews?hl=zh-TW,3,True,29,湯喝起來有點粉，似乎是比例沒調好，加點的鱸魚醬汁跟魚肉不搭，絲瓜味道也太重，三種味道很不調和，主菜倒是還不錯。
 宏麟陳 ,https://www.google.com/maps/contrib/110381496553030902191/reviews?hl=zh-TW,5,True,97,這次生日特別選擇陶板屋，餐點不錯，主餐我是選擇半雞，烤的很棒，中間還有一小杯冰沙去油膩，當月生日壽星，店家會幫你拍張全家慶祝照片，還有一個小蛋糕，真的不錯
 盧俊孝 ,https://www.google.com/maps/contrib/112030558898063012848/reviews?hl=zh-TW,2,True,13,"陶板屋一直是每年慶生的首選，餐點方面沒有什麼問題，但今年慶生就在12月12這天，11點50點餐時告知服務人員用餐的我與父親兩位皆是十二月壽星，直到用餐完，閒聊至將近一點，收拾餐具的人員來收盤子，父親主動詢問怎沒有慶生的小蛋糕，雖然服務人員事後為此表達不好意思之意，將慶生甜點打包並額外送上招待桑椹醋以表歉意，但給人的感覺已經掃興，也許是今日用餐的人數眾多，外場服務人員一時忙碌忘了，使得父親用餐後臨走時仍對此有點微詞，祈望貴店能夠加強人員訓練並且提升服務水準，今年的慶生用餐在陶板屋留下相當掃興的印象，非常惋惜！
此為今日用餐後的心得評論，非憑空捏造，可為此留言評論以示公評！"
 Hδu侯 ,https://www.google.com/maps/contrib/104387697212873946951/reviews?hl=zh-TW,5,False,3,"服務態度很好母親節還有送花拍照
服務生很有耐心的完成客人要求
以後會再去用餐的"
 Wey Wey ,https://www.google.com/maps/contrib/109459237329401739259/reviews?hl=zh-TW,4,True,60,颱風天放鬆一下，剛好有陶坂屋禮券就獨自享用美食了。因為疫情很久沒有去了，菜色上有了些調整。吃的主餐是果香酥烤鴨胸，讚！其他附餐醬燒杏鮑菇和馬賽蕃茄海鮮燉湯比較普通外，其他的都滿不錯的。
 小香吳 ,https://www.google.com/maps/contrib/109173041162158760370/reviews?hl=zh-TW,3,False,21,點完餐後，不到二分鐘，就開始出餐，速度快是不錯，但感覺有點在拼翻桌率，湯品，主餐上來都溫溫的，好像都已經準備好了，時間到就裝盤上菜了，有點遺憾。
 Keith Yun ,https://www.google.com/maps/contrib/107578814704626331508/reviews?hl=zh-TW,4,True,607,食物美味、烹調適中，服務員細心度待加強，內部電信訊號不好又無提供wifi，讓消費者斷絕與外部聯繫，期待改善。
 ulica VP ,https://www.google.com/maps/contrib/114461314990425511845/reviews?hl=zh-TW,5,False,89,"今天來用餐，整體覺得物超所值，非常滿意🌟🌟🌟🌟🌟

尤其主餐瓦片牛排超級好吃、嫩，前菜甜點等等也都很好吃，比起高價位的cp值高很多，服務也很周到。下次還會想來吃，超讚！"
 tarcy cheng ,https://www.google.com/maps/contrib/116615267686890891996/reviews?hl=zh-TW,3,False,23,服務人員雖然親切有禮但都很匆忙，餐點好吃尤其是魚很新鮮，加價的海老天婦羅野菜捲餅很難吃，飲料很普通，環境吵雜。
 chiu chiu ,https://www.google.com/maps/contrib/107971811593154276178/reviews?hl=zh-TW,4,True,465,王品的招牌與服務一直是備受推崇的，也是讓美味升級的必要元素。家庭聚餐選在了陶阪屋，因為時間較趕人也多，先在官網依菜單自行選餐，以利節省時間能快速出餐，然而入座後才知更新菜單，又回到起點重新選擇，幼兒招待了餐包與濃湯挺貼心，餐點口味也不錯份量充足，但菜單的失誤必須被扣一星，希望能快改進讓官網和現場菜色一致。
 Letter Case (Ks) ,https://www.google.com/maps/contrib/106326116538191856031/reviews?hl=zh-TW,4,True,43,"一樣只有服務可圈可點。
菜色製作真的要好好用心。不要隨隨便便就出餐。如果不是服務太好，化解食材危機。我會毫不留情給你一顆心。
希望後廚不要留垃圾給前臺人員難看。謝謝。"
 吳侑家 ,https://www.google.com/maps/contrib/108469595727496683076/reviews?hl=zh-TW,5,True,51,"紐約客牛排🥩超好吃！
沒有很多筋、五分熟恰到好處
店員服務、其他套餐的品項都很棒"
 Jonas Ron阮游世雄 ,https://www.google.com/maps/contrib/112198789934489079954/reviews?hl=zh-TW,3,True,39,"牛排盤不保溫，一下子就涼了；加熱了一次，還是吃溫熱牛排。
肉質有一點太軟的不像真的，厚度與照片也有些差距。
感覺上，質量都不如以前了。"
 廖偉康（小太陽） ,https://www.google.com/maps/contrib/118435426285459952127/reviews?hl=zh-TW,5,True,40,服務親切，非常客氣還送一份炸蝦🍤說是讓我們等了一下深感抱歉。裝潢改裝及餐點改版後特別不一樣👍👍適合家庭聚餐生日吃飯推薦
 S L ,https://www.google.com/maps/contrib/101301310211792072631/reviews?hl=zh-TW,3,True,40,"王品集團餐廳一直是慶生好選擇🥺不無小補的打折優惠！
這次用餐有一點小插曲，雖然立刻被道歉了...但還是覺得...該加油😂
餐點部分，東西多數都還是好吃或不錯～不過...飲料真的好難喝喔XD也或許是不合我的口味吧🙈"
 藍玲劉 ,https://www.google.com/maps/contrib/114871386251019692964/reviews?hl=zh-TW,5,True,118,非常多樣化的主菜，前菜，開胃菜，飲料，甜點，沙拉，還有梅子醋任你喝，CP值高的餐廰，值得一去再去，與朋友，家人聚餐的好地方。
