user_name,user_profile_url,rating,local_guide,comment_num,comment_text
 王賽門 ,https://www.google.com/maps/contrib/104654220957538354250/reviews?hl=zh-TW,4,True,141,對我而言，王品旗下的餐廳只有品田牧場有兼顧到cp值(雖然後來也是漲價了)，其餘的店吃下來真的還是賣他們的服務品質，餐點的水準也算可以就是了，如果你重視的是氣氛，環境，服務態度品質，選王品不會失望。
 meee o ,https://www.google.com/maps/contrib/106070079255616590202/reviews?hl=zh-TW,5,False,13,黃姓員工態度可嘉值得嘉獎
 廖jimmy ,https://www.google.com/maps/contrib/110439624489718589447/reviews?hl=zh-TW,5,True,31,整體用餐舒適，餐點味道好，生日蛋糕好看！
 林傑績 ,https://www.google.com/maps/contrib/104838315215707271576/reviews?hl=zh-TW,4,True,187,服務很好（王品特色），菜色則比較類似西堤，想換換口味，可以考慮
 李Ben ,https://www.google.com/maps/contrib/100726041362456241505/reviews?hl=zh-TW,5,True,70,服務熱心周到，主餐香蒜牛肉、鴨胸非常軟嫩好吃！
 小雨。 ,https://www.google.com/maps/contrib/104520519159437035198/reviews?hl=zh-TW,5,True,112,"餐點都很好吃，有問題時會很積極處理
加價的炸物冷麵很好吃，但是有一次炸物麵糊太硬，希望能維持品質"
 もり ,https://www.google.com/maps/contrib/112488171731288508447/reviews?hl=zh-TW,3,True,97,開胃菜前菜湯品表現傑出，主食之後的餐點待改進，瓦片牛醃製的味道甜膩肉的口感過軟，牛肉的原味不凸顯，飯類主食、和食烏龍麵不夠精緻份量過多且炸物說實在不如定x八炸物的酥脆可口讓同行友人吃得不愉快，甜點起司蛋糕沒有蛋糕體是慕斯所以感覺很膩口，服務態度不錯只是上菜的時候建議等客人吃完一道再上菜或是口頭詢問一下再上，直接上菜會讓人覺得被催促的感覺。
 Izzue Lin ,https://www.google.com/maps/contrib/105850522511853414990/reviews?hl=zh-TW,3,False,13,半開放包廂區裡面的用餐座位安排的量過多，有大桌客人的聊天聊不停的音量的確有影響到享用美食的品質，服務人員們都很專業和禮貌，真的很可惜這次用餐的經驗不是很好
 紅光 ,https://www.google.com/maps/contrib/102338181264002418892/reviews?hl=zh-TW,3,True,"1,012","時間：2020/05/03
外帶松阪豬不好吃，筋很多，唯一好的是炸飯糰"
 方佳玉 ,https://www.google.com/maps/contrib/108098146901153772594/reviews?hl=zh-TW,5,False,38,服務好，餐點精緻好吃，還想再去吃的口袋名單。
 Victorya Wu ,https://www.google.com/maps/contrib/102865510032098367571/reviews?hl=zh-TW,4,True,89,前菜的沙拉醬料不錯，百合牛肉湯略鹹，但味道組合是不錯的，忘記點的排餐是什麼名字（加一百塊的那個😆），味道不錯，雖然更喜歡朋友點的瓦片牛肉（太愛香蒜瓦片），飲料還不錯，可惜對飲料需求量大的人，可能略少，起司蛋糕尚可，不過這次去，覺得主要遇到的服務生的等級，好像沒有之前的平均，態度沒有不好，也沒有做錯什麼部分，是在細節的處理沒有之前細緻，但不影響用餐體驗👍
 張詔傑 ,https://www.google.com/maps/contrib/118120645875139633517/reviews?hl=zh-TW,1,False,4,蒜香瓦片牛排原來是我最愛的主食，今天來吃結果水分變超多，經過反應是原本用煎的牛排換成了用蒸烤箱？？？牛肉的香氣都沒有了，水分過多，肉質軟爛，不改回來怕是以後不會再來了
 jimmy c ,https://www.google.com/maps/contrib/101492635837665007403/reviews?hl=zh-TW,4,True,235,服務中規中矩，感覺不錯！
 溫蒂 ,https://www.google.com/maps/contrib/102757337900681230400/reviews?hl=zh-TW,5,False,26,好吃，服務也好，主餐好吃到不行！
 Henry Wu ,https://www.google.com/maps/contrib/114263880580787999428/reviews?hl=zh-TW,5,True,56,"好品質的用餐環境!
服務人員也都很親切！"
 林辰翰 ,https://www.google.com/maps/contrib/111976520187120758542/reviews?hl=zh-TW,2,False,2,重慶店的主餐與南京店的主餐圖一跟二，南京店太優了
 NANCY TAMI ,https://www.google.com/maps/contrib/101854874814185686888/reviews?hl=zh-TW,5,True,297,服務親切，餐點好吃
 楊Allen ,https://www.google.com/maps/contrib/110700774296232363910/reviews?hl=zh-TW,4,True,18,服務親切、套餐豐富、餐點可口
 陳秀英 ,https://www.google.com/maps/contrib/109083624397867730709/reviews?hl=zh-TW,5,False,26,落地窗外景美，食材新鮮及主食、副食搭配絕美，滿齒生香。幸福感飄逸……
 黃小喬 ,https://www.google.com/maps/contrib/102773805061546673048/reviews?hl=zh-TW,5,True,26,"餐點好吃,服務人員親切"
 筠晴.芊晏媽咪 ,https://www.google.com/maps/contrib/100692793926833781297/reviews?hl=zh-TW,2,False,147,"服務人員收餐收的很急
還沒吃完一直要收走
而且很多次
雖然當下服務員有道歉
因為我們餐盤內食物根本還沒吃完
但也太多次.....
一直問能不能收
我們會「還沒吃完」或「先放著」
才又道歉...
完全不能慢慢享用慢慢吃
-
飲料點冰拿鐵
喝起來像三合一咖啡.......傻眼
-
優點
出餐速度快
今日肉質烹調熟度都不錯"
 Yujou Kudo ,https://www.google.com/maps/contrib/110751620070542198822/reviews?hl=zh-TW,4,True,150,好吃，但是感覺服務沒有旁邊的藝奇好😶
 HONGYU CHOU ,https://www.google.com/maps/contrib/104937139537671259226/reviews?hl=zh-TW,1,False,17,"許久沒去吃品質已與價格配不上
撇開服務態度跟之前來時有落差不講（人多忙起來沒空很妥善的照料我們能體諒）餐點送上時都是溫的湯品溫的主菜牛排溫的擺明就是太忙所以放了一陣子才上桌。"
 Jamie Yang ,https://www.google.com/maps/contrib/109620978878936403654/reviews?hl=zh-TW,2,False,24,"出餐有點太急了，還沒吃完又送下一道來🥺😅
可能是剛開店的尖峰時刻，餐點多是一次做大量，許多桌一起上
吃飯節奏很快的一餐
整體偏不精緻（氣氛與食物都是

甜點是最好吃的一道🤣"
 Alfie ,https://www.google.com/maps/contrib/104235634396403276090/reviews?hl=zh-TW,4,True,95,餐點服務都不錯
 陳炘 ,https://www.google.com/maps/contrib/107683482958112656110/reviews?hl=zh-TW,5,False,3,服務100%超用心很適合聚餐慶祝🎉
 Little Mo ,https://www.google.com/maps/contrib/115962273839465112088/reviews?hl=zh-TW,4,True,254,今天的陶板屋依舊好吃，主菜是品項中第一。牛排，鴨胸，都極美味。前菜跟湯品，普通，要加油。最近吃幾家王品系列，覺得cp最高，味道最好的是石二鍋，簡單卻處處顯得😋滋味。較高價位體系，食物本身品質卻沒有那麼讓人驚艷了。
 凝愔 ,https://www.google.com/maps/contrib/100640686064368285013/reviews?hl=zh-TW,5,False,12,"和家人用餐
愉快的用餐體驗
謝謝辛苦的服務人員~
升級的沙拉跟蛋糕好好吃~"
 Steve Chen ,https://www.google.com/maps/contrib/101011491003294970427/reviews?hl=zh-TW,4,True,189,香蒜牛肉過於軟嫩，疑似有加木瓜精之類。
 Tony Wu (吳董) ,https://www.google.com/maps/contrib/108924516002320841271/reviews?hl=zh-TW,4,True,"1,295",餐點不錯，但人多
 林威漢 ,https://www.google.com/maps/contrib/109318355515000512479/reviews?hl=zh-TW,4,True,232,服務人員親切，但環境偏吵雜~~
 鄭淨雯 ,https://www.google.com/maps/contrib/103784120977720287290/reviews?hl=zh-TW,3,False,9,餐點口味退步許多
 李政源 ,https://www.google.com/maps/contrib/118356148563756245537/reviews?hl=zh-TW,1,False,5,牛肉不像牛肉，友人點的紐約克牛排整份沒吃！海鮮湯就少少的幾片海鮮+清湯，鮭魚泡飯就是湯+飯+1公分的小鮭魚……品質很糟糕，實在令人大失所望。
 Chia-Chien Hsieh ,https://www.google.com/maps/contrib/104765563551356292795/reviews?hl=zh-TW,2,False,35,"1.上菜時間過慢，餐點是冷的，尤其是湯品和牛排。
2.兒童餐等很久，等到大人都在吃甜點才上餐。服務人員說是現做的所以上菜的時間較久，好不容易上菜，結果肉是冷的且焦黑，漢堡是冷的。不是說‘現做’的嗎？餐點應該是熱騰騰的吧！
有向店家立即反應，餐廳有馬上重做一份熱餐給小孩，但還是希望餐廳上餐速度能讓用餐人都可以同步，以及餐點溫度不夠熱能改善。"
 王靜儀 ,https://www.google.com/maps/contrib/104115171093205002734/reviews?hl=zh-TW,4,False,13,環境乾淨，食材擺盤等都不錯，但倘若有提供餐前麵包那就又更讚了。哈哈
 王仲男 ,https://www.google.com/maps/contrib/102725159746296508949/reviews?hl=zh-TW,4,True,8,整體來說還不錯!不失為聚餐的好所在!但有些餐點久久不來，似乎被遺忘了！得向店員反映才會補送過來。另主餐牛排都快吃完，醬汁佐料才送來!這些是有待改進的缺失!
 Sin Ping Yang ,https://www.google.com/maps/contrib/105479216802599605461/reviews?hl=zh-TW,4,True,95,食物品質還可以，但可能是尖峰時段的關係，上菜偏慢，請服務人員補衛生紙跟加水後許久沒有回應。
 chingyi chang ,https://www.google.com/maps/contrib/103594392735445766963/reviews?hl=zh-TW,2,False,10,"前菜、湯品、主餐大致上還可以，但對於不吃牛肉的人，選擇性太少。
魚類套餐裡，不想吃重口味的陶板魚，就剩鮭魚套餐可以點，偏偏鮭魚套餐是魚頭和魚鰭，只好點烤半雞套餐，卻是很雷，雞胸雞腿都乾柴，私乎是預烤後再復熱的，且不易切割，吃的很狼狽。這兩套餐點，完全看不出創意何在？
餐後甜點的冷月紫米，沒有註明是芋頭，不吃芋泥看到甜點上桌有點傻眼，去冰的芒果優酪甜膩到無法入口。"
 po-ta Sung ,https://www.google.com/maps/contrib/111418977686775288069/reviews?hl=zh-TW,5,True,12,謝謝陶板屋給我跟家人很好的餐飲及服務。我很喜歡一道有蕃茄的前菜及羊排嫩極了。特別謝謝招待的服務員很專業，特別是其中兩位一個名牌是X俊憲，幫我的桌子很快速的調整平穩，旋某個腳螺旋＋折紙墊，桌子微不穩在餐廳是偶會見到的，他是第一個可以迅速混用不同方式解決的，可見公司訓練很好及個人智慧素質聰穎，另一位服務員的名牌是X霓裳，居然可以主動發現我想幫家人合照，在忙碌中還是抽身主動幫忙照相，讚讚讚。
 charley cheng ,https://www.google.com/maps/contrib/107480922056671036297/reviews?hl=zh-TW,4,True,177,感覺量一次比一次少，不過還是蠻好吃
 軟綿綿 ,https://www.google.com/maps/contrib/108790714854918734814/reviews?hl=zh-TW,1,False,1,"為什麼打一天電話都不接
想訂今晚的位子
但不是通話中就是完全不接電話
這樣是要怎麼訂位"
 林之瑛 ,https://www.google.com/maps/contrib/110373415024584433092/reviews?hl=zh-TW,3,False,45,價錢中等，吃整套，只可惜海鮮湯的味素化料湯底，稍嫌噁心，吳郭魚片腥臭味重了一點，水果沙拉用奇怪化料洗過，吃了嘴有點痛，其他是還好啦！
 沈鳴 ,https://www.google.com/maps/contrib/117301655359838728342/reviews?hl=zh-TW,1,False,3,"焗牛肉跟沙拉不搭
海鮮茶碗蒸用料很普通
主菜鮮烤海鮮的蝦子吃起來超油不像用烤的肉超老沒有鮮味干貝超小顆
牛肉炸飯糰咬一口直接散掉飯超爛吃不出來有牛肉
其他桌有大嬸聊天距離很遠還聽得到超吵用餐環境很差
服務人員態度不錯"
 Xiaochun Tung ,https://www.google.com/maps/contrib/106764074862317947556/reviews?hl=zh-TW,5,False,23,"今天一家人幫小犬慶生。
餐點好吃。
服務依舊貼心，今晚的服務人員都很熱情，下謝謝你們給我們一家美好的記憶。"
 Ailsa Chang ,https://www.google.com/maps/contrib/105813853438098830078/reviews?hl=zh-TW,3,True,76,"生意很好，所以感覺服務人員都很忙比較無法即時幫忙，不過遇到的服務人員態度都很好！
很多年沒吃陶板屋了，感覺很以前吃起來的感覺差蠻多，蠻可惜..."
 BLAKE ,https://www.google.com/maps/contrib/110760885269949357539/reviews?hl=zh-TW,3,True,75,"情人節客人很多
上的慢東西幾乎都冷冷的"
 陳雅慧 ,https://www.google.com/maps/contrib/110334559910920300723/reviews?hl=zh-TW,4,False,21,恰到好處，物超所值的饗宴
 詹舜翔 ,https://www.google.com/maps/contrib/113332507808171235050/reviews?hl=zh-TW,4,False,77,"食物算是正常陶板屋的水準
但在各分店中算是比較偏小的，用餐區比較沒那麼有氣氛
適合家族熱鬧聚餐，不適合情侶或需要安靜氛圍的客人"
 Hanna baby Angel 漢娜小妞吃播 ,https://www.google.com/maps/contrib/109508499521633776080/reviews?hl=zh-TW,1,True,30,廁所的清潔度非常糟糕，在外面都可以聞到濃濃的尿臭味，更別說廁所裡的味道，簡直要暈倒。點餐點了三份，有兩張餐券，所以結帳時有告知店員要用花旗點數折抵，但是店員沒有告知超過一千才能折抵，就直接結帳，結帳完才告知超過一千才能折抵，這做法令我感到錯愕。我也可以只用一張券就可以超過千元來折抵點數，直接結帳的作法非常感到不被尊重，請加強員工訓練！餐廳的冷氣溫度非常的不夠，一遍吃飯一遍流汗！
 國光 ,https://www.google.com/maps/contrib/109581602191200722657/reviews?hl=zh-TW,5,True,60,從新裝潢非常舒適，服務人員很有禮貌貼心
 王沂霖 ,https://www.google.com/maps/contrib/101379782096113721907/reviews?hl=zh-TW,1,False,10,電話打了十幾通，都不接，一點服務態度都沒，超爛，時間未到，也一直催，服務生也差，還未吃完就急著收盤，好像一直在趕人，
 mei a ,https://www.google.com/maps/contrib/109081045963253440363/reviews?hl=zh-TW,3,True,76,"815去吃的不是很愉快，餐點上的不是很順，餐點品質沒有如以往的好。
我記得以前不管服務還是餐點都很不錯阿。怎麼現在變的沒如預期。
我想我不就是為了他們的sop服務跟餐點再去的嗎？
難道是因為客滿所以........"
 Connie Chuang ,https://www.google.com/maps/contrib/108919149774914678020/reviews?hl=zh-TW,3,True,47,早在2個禮拜前已經訂好位，當天到現場，發現排在我之前的還有2組客人還未被帶位，但是現場非常多“乾淨的”空桌，直到輪到我時早已超過訂位時間，無法理解為什麼會是這樣安排的！！
 堯堯 ,https://www.google.com/maps/contrib/108893555656690943260/reviews?hl=zh-TW,3,True,536,王品系列的店服務當然是一流，但是他算平價系列不建議點牛肉製品，因為那會讓你失望，其他東西都有一定水準
 Sasa Liu ,https://www.google.com/maps/contrib/101900118019697598756/reviews?hl=zh-TW,3,True,634,牛排上菜時是溫的，不是熱的！吃沒幾口，很快就都全部冷掉了，肉也不夠嫩，雖然味道是好吃的，但最期待的牛排就因為我不是熱的很失望。
 大衛 ,https://www.google.com/maps/contrib/109606173925156264695/reviews?hl=zh-TW,5,False,5,服務良好，食物美味
 Yu-Jia Liang ,https://www.google.com/maps/contrib/115967322330184289019/reviews?hl=zh-TW,3,False,11,等一個小時還沒吃到主餐，小孩等得不耐煩也沒任何圖畫可以打發時間，我看隔壁桌四個人看手機也看了一個小時，大家都在等主餐。很久沒吃陶板屋了，吃頓飯要等一個小時是基本的嗎？餐點是還不錯啦，但只能給到3星
 Cecilia ,https://www.google.com/maps/contrib/115305179319514998938/reviews?hl=zh-TW,3,True,788,精緻好吃到撐
 Bryce Chen ,https://www.google.com/maps/contrib/104212106386649543371/reviews?hl=zh-TW,5,False,12,標準的王品服務流程，沒有很好也不壞，
 熊熊（Ccino） ,https://www.google.com/maps/contrib/109859881199317430110/reviews?hl=zh-TW,2,True,31,去年第一次來這家時，炸飯糰整顆都超硬，看到其他顧客也多難以下嚥，不吃，也沒見餐廳主動詢問，更別說主動道歉。今年因交通較方便，再給予一次機會，其服務態度依然不優，至於食物配上這價位，只能說普通，且整套餐有些餐點也不怎麼好吃。
 陳雅琴 ,https://www.google.com/maps/contrib/113105026661905515931/reviews?hl=zh-TW,4,False,22,交通方便服務佳價格標準化
 Rita Wu ,https://www.google.com/maps/contrib/117581887478965977812/reviews?hl=zh-TW,5,True,44,個別化的餐點、空間很大，疫情漸緩時，外出聚餐的好去處；服務員親切專業，推∼
 longder gao ,https://www.google.com/maps/contrib/108652566509538330499/reviews?hl=zh-TW,1,False,5,非常差，騙說當月生日打75折，但是結帳時進一步要求加line以獲取本人的出生年月日等個人資訊才可以。
 Weikuo Lee ,https://www.google.com/maps/contrib/109002029144002785147/reviews?hl=zh-TW,4,True,576,"感覺到店家非常努力的在經營餐廳，食材、餐點、烹調、飲料、服務...連餐具都有一定的講究！
如果在沒有使用生日優惠或信用卡折扣情況下，我可能會考慮價格和餐點間的CP值是否夠高！對我來說價格還算是偏高的...。"
 Li Ying ,https://www.google.com/maps/contrib/104545329717025851289/reviews?hl=zh-TW,2,True,93,"服務生雖然表面上服務都帶著笑臉
卻是皮笑肉不笑的
甚至感覺得出來大小眼
會對打扮貴氣的婦人服務特別殷勤
其他就普普通通
餐點很不穩定
同樣的餐點熟度卻差別甚大
份量也不多
環境衛生也明顯感覺出可以再加強
餐具刮痕一堆也改換了吧
都不知道有沒有洗乾淨
整體而言我認為並不值得這個價位
越來越退步"
 ching yang ,https://www.google.com/maps/contrib/108253044138591547558/reviews?hl=zh-TW,3,True,203,可能是服務人員不夠，感覺熱誠減少。因女兒生日特別至陶板屋慶祝，對工作人員說了幾次有壽星，對方都沒反應，直到媽媽問，是不是客人生日照相的部份取消了，才有一位先生匆忙的幫忙拍照。
 YU CHUN SU ,https://www.google.com/maps/contrib/112462480765749819866/reviews?hl=zh-TW,1,False,12,肉質很差，上菜速度又慢，吃完沙拉遲遲不來前菜，想找店員一直不來，詢問票券問題態度也差，整體吃下來用餐體驗相當差
 yang yangman ,https://www.google.com/maps/contrib/102646510507200946323/reviews?hl=zh-TW,5,True,343,餐點好吃，服務佳
 吳致浩 ,https://www.google.com/maps/contrib/105675225788518470449/reviews?hl=zh-TW,5,True,232,服務不錯，服務人員態度也都很好，吃飯過程需要多一些醬料也都很快就拿過來了，去吃當天是母親節人非常多，不知道平常是不是人也很多，現場有一邊的小區塊裡面中華是幾乎沒信號的，就當成要你好好吃飯不要用手機
 張嘉蕙 ,https://www.google.com/maps/contrib/106658524676469620775/reviews?hl=zh-TW,5,False,6,今天是母親節~家人裡面又剛好有三位五月的壽星，所以選擇陶板屋來做為我們聚餐的地方，結果結帳時因為我們幾個人的手機操作壽星禮、新會員見面禮一直沒弄好，大過節的又是用餐交接時刻搞得結帳的店員手忙腳亂，但是我真的要謝謝「李季穎小姐」在櫃檯非常有耐心的幫我們解決問題，態度與服務都超好，讓我們有個難忘的節日~😘
 Kain Son ,https://www.google.com/maps/contrib/113298213125678195577/reviews?hl=zh-TW,1,False,12,牛排都是筋切不下去塊，留了半塊。服務生問要不要收，我跟她說切不動，她笑了笑，轉頭就走了。請問部門主管有收到我對肉品不滿意的回饋嗎？。沒有第一時間處理就算了，你當副理第二次也沒處理，著才是要擔心的
 林政宏 ,https://www.google.com/maps/contrib/105220122838283558696/reviews?hl=zh-TW,4,True,293,"王品集團旗下的店，氣氛感覺不錯，店員服務很好，總是笑臉迎人。
牛排主餐及蔬果主餐蠻好吃的，沙拉及甜點也不錯，豬肉飯糰蠻特殊的，品相好看，餐後焦糖奶茶好喝。"
 林傳傑 ,https://www.google.com/maps/contrib/107271833928234746013/reviews?hl=zh-TW,1,True,69,點七分熟牛排，第一次送來是全熟，經反應收回換新的，竟送來一分熟的牛排，店長來道歉，說要好好教育員工，並要再換一次，我婉拒了，這一份雖然沒有算錢，但我心疼的是，台灣一個好好的知名品牌怎麼會經營成如此，整個服務品質都鬆垮掉了，不止此家，集團裡其他品牌亦是在退步，從他們對客戶的招呼，很明顯以前那種熱情及自信不見了。可惜了，創建一個好品牌要花多少時間，但要毀了他卻是很快的，一味的擴充，一味的在衝業績，卻忘了初心，管理階層不知是否知道他們已經走在自我毀滅的道路上了。
 Abby ,https://www.google.com/maps/contrib/109727941016366332534/reviews?hl=zh-TW,5,True,17,服務人員親切細心，餐點更是不用說推薦推薦❤️
 玄華絳月 ,https://www.google.com/maps/contrib/109844658543049161736/reviews?hl=zh-TW,3,True,33,"本來想給4顆星，但是疫情期間室內完全沒有保持社交距離，還是扣分扣掉了
在三重分店吃過很多次
陶板屋在家人心中一直份量足味道好的聚餐好場所
但是重慶店讓人有些失望，大型節日人手明顯不足，請加水講超過3次，炸物餐點明顯料理時間不足即出餐，非常軟爛
桌子之間間距目測不滿一尺，建議如果不著急慶祝，可以晚些時候再來"
 張涵涵 ,https://www.google.com/maps/contrib/110534460321085426872/reviews?hl=zh-TW,1,True,62,上菜盤子放下時力道都不會注意，感覺盤子是用力放下來的，眼前食物吃到一半要上新菜時因為服務人員沒有手拿，位子也實在太小，直接要硬上桌，用新菜的盤子推著桌上本有的食物盤移出位子，感覺不是很好，而且飯糰比起之前難吃很多，很不符合自己的胃口啦！整個套餐吃下來感覺吃不飽，少了一顆飯糰下肚更是空虛，不會想再來吃。
 吳依庭 ,https://www.google.com/maps/contrib/113510301129102342726/reviews?hl=zh-TW,2,False,25,"用餐時有隻小蟲在餐桌附近飛來飛去:(
衛生品質令人擔憂"
 F SY ,https://www.google.com/maps/contrib/105474112060364201231/reviews?hl=zh-TW,1,False,111,"陶板屋此次體驗真如太太之前說的看來沒變但是餐點已經不OK
-湯品是雞湯不騙你有如自助餐提供的水準
-我點紐約客牛排真的比我家貴族還難以下嚥
-服務人員其實是OK但是因為有比較級只能說已經不復過去精緻細膩的熱忱和精神

還是一樣的招牌原來的形式但是已經失去原有的美味和熱情。不對的高層和理經營念，真的是可以毀了一家公司

從過去崩壞的夏慕尼到陶板屋令人不剩唏噓

應該是跟陶板屋說掰掰時候了....哀~~~"
 林富銘 ,https://www.google.com/maps/contrib/105641287170078241554/reviews?hl=zh-TW,3,True,27,菜色與服務人員退步許多，需加強。
 crystal lin ,https://www.google.com/maps/contrib/106202605721367562438/reviews?hl=zh-TW,4,False,75,整體用餐品質都還不錯，但生日的主廚招待菜調味很怪不喜歡，海鮮沙拉裡的焗烤溫溫的不夠熱有待加強，湯裡的豬肉偏柴偏硬有待改進。甜點的檸檬塔和銅鑼燒很好吃，熱奶茶也很好喝。
 郭蘋果 ,https://www.google.com/maps/contrib/107754825861833223272/reviews?hl=zh-TW,3,True,208,客滿！但餐點一次不如一次，和風式的配菜沒了，湯及茶碗蒸不如路邊小店！最後點的甜點聖代端上來是液態，舀一口，天呀！泡過水的抹茶蛋糕......，不是平價，應該更用心，沒了理想，請加油！
 Ann Chen ,https://www.google.com/maps/contrib/107439956952327139411/reviews?hl=zh-TW,5,False,9,"非常良好的用餐經驗
孕期中遇到最貼心的餐廳詢問靠枕餐點要不要換品項或提供熱牛奶佐餐等等其實當天餐廳非常忙碌還能有這樣的服務品質辛苦了謝謝❤️"
 Debby Chen ,https://www.google.com/maps/contrib/115899800263287837237/reviews?hl=zh-TW,3,True,371,甜點及主餐好吃，但付餐還有進步空間，如炸飯糰稍嫌冷了點。。。濃湯也不夠熱。上餐點的速度應該可更快些。Wife收訊不良又是一個殘念。空間座位也稍嫌擁擠。
 夏目目（朝暮） ,https://www.google.com/maps/contrib/118236132980003226005/reviews?hl=zh-TW,3,True,67,"炸飯糰真的很難吃，口感差，味道也不好
嫩煎豬排不怎麼樣，沒什麼亮點
蒜香瓦片牛排還不錯

服務態度雖然很好，但也只有表面
牛排沒問要幾分熟、冷月紫米內容跟菜單不一樣，一問才補上芋頭、續個果醋講了兩次，沒人來處理

後來結帳反映之後有送兩杯果醋外帶，還可以啦"
 謝天雯 ,https://www.google.com/maps/contrib/112741144625310822019/reviews?hl=zh-TW,4,True,72,牛肉肉質太燸嫩了點，服務生親切，但感覺服務生人太少
 Tatum ,https://www.google.com/maps/contrib/110532014240372429142/reviews?hl=zh-TW,4,True,151,"來吃生日餐，整體算滿意，唯一美中不足有個平頭服務生上菜是用撞的,這算美式上菜ㄇ😅😅"
 Wen Hsin Cheng ,https://www.google.com/maps/contrib/111547169977649346543/reviews?hl=zh-TW,4,True,165,含朋友聚餐，沒預約但有位置。只是點了餐20分鐘後還是沒上菜，說了趕時間但是12點10分到了1點20，還是沒把所有菜上完。但除了上餐慢，其他服務倒也還不錯，很關心餐點是否合胃口，茶水也是不待要求，不時有人添來添加。
