user_name,user_profile_url,rating,local_guide,comment_num,comment_text
 tone hector ,https://www.google.com/maps/contrib/114443572853817007313/reviews?hl=zh-TW,4,True,789,"環境乾淨整齊，現在小卷米粉附的不是滷蛋是魚丸，裡頭有地瓜還滿神奇的，湯頭因為天氣熱只喝了幾口，喝起來微微鮮甜，但的確味道沒有進到米粉裡，但吃米粉口味會不夠重，小卷不到一隻吃起來不太過癮，如果有單點小卷就好了。
小菜因疫情關係，只有油豆腐，希望疫情快過去，這樣才有更多好吃的可以吃！"
 平民百姓 ,https://www.google.com/maps/contrib/104720963124202675408/reviews?hl=zh-TW,4,True,305,小卷米粉湯好吃！米粉粗細適中，湯頭用雞湯熬煮；味道鮮美，小卷新鮮，油蔥酥香氣十足。一碗100！交通方便。聽老闆娘說附近區域五碗有外送
 陳善嶽 ,https://www.google.com/maps/contrib/105846732687928297458/reviews?hl=zh-TW,4,True,209,樸實的好味道，對重口味的人來說也許清淡了一點，但湯頭清甜、搭配簡單且唯一的小菜油豆腐、沾點辣椒醬油膏，吃起來完全沒有負擔，對外食族來說也是一種很好的搭配選擇！
 YUNCHING YANG ,https://www.google.com/maps/contrib/112912017277331598379/reviews?hl=zh-TW,4,True,331,店裡沒有賣太多種類的餐點，大概就是湯的或乾的米粉。湯底是雞湯，可以喝得出來但味道不會很重，還有用櫻花蝦提味，和小卷很搭。小卷新鮮，入口很脆不會要不動。搭配虱目魚魚丸和一塊地瓜，地瓜的出現是比較奇妙的。
 川頁貿 ,https://www.google.com/maps/contrib/100920792586545150361/reviews?hl=zh-TW,4,True,481,"服務態度親切，內用環境寬敞明亮，目前只有看到兩種口味的餐點，分別是泰式小卷米粉（乾）、小卷米粉（湯），湯頭個人認為有點鹹，吃了會口乾，用料有小卷、蝦殼、貢丸、地瓜、蔥、海帶，份量給夠足，可以吃的飽，不錯的用餐體驗。
內用可以自己加辣椒、醬油等配料，有興趣的朋友可以嘗試看看，不雷不錯吃"
 fish Yellow ,https://www.google.com/maps/contrib/105627403960380556804/reviews?hl=zh-TW,4,True,306,"份量蠻多可吃滿飽
一碗100小捲應該有個四五個滿Q的
湯普通不過加了辣好很多
有地瓜跟魯蛋滿酷"
 Jason Yo ,https://www.google.com/maps/contrib/112030197873777045248/reviews?hl=zh-TW,5,True,36,老闆很親切，很喜歡泡椒和辣油，為小卷米粉增添風味。只是吃完下午很快就餓了😭
 Angela Sun ,https://www.google.com/maps/contrib/109829435251212565381/reviews?hl=zh-TW,2,True,204,"以前想要一點無負擔的晚餐就會來這兒。

現在碗裡沒有滷蛋、地瓜也很小一塊、小卷也不是一隻（因為我根本沒吃到小卷的腳）多一顆司目魚丸，小卷上有黑黑的不明物🥲湯頭也沒有這麼鮮甜了。

這些改變都讓我覺得蠻可惜的。"
 Link Jee ,https://www.google.com/maps/contrib/118168247926101920697/reviews?hl=zh-TW,4,True,48,充斥著海味的小卷米粉湯，配上店家的獨門辣椒條，搭配著櫻花蝦米、海帶、地瓜，湯頭清爽卻層次豐富。
 Solange L ,https://www.google.com/maps/contrib/102104240068543740924/reviews?hl=zh-TW,3,True,84,"因為被某則留言說可以跟台南小卷米粉媲美，決定試試看。

湯頭偏淡也沒有台南的鮮甜味、米粉是細米粉，份量有點多、配料貢丸跟地瓜蠻特別。

整體而言，跟預期有段落差，體驗過就好"
 YVONNE H ,https://www.google.com/maps/contrib/111574534843105852363/reviews?hl=zh-TW,4,True,79,"$100
小卷沒有異味
湯底喝不太出是雞湯非常清淡
吃起來感覺身體沒有負擔
輕輕淡淡的～又有營養
會再訪～"
 KWEN KWEN ,https://www.google.com/maps/contrib/112848879157238222888/reviews?hl=zh-TW,4,True,"1,027",店內乾淨寬敞可以很快速的用完午餐，小捲米粉湯頭鮮美價錢實惠，小捲新鮮，辣椒夠味很香。
 COZY周蜜 ,https://www.google.com/maps/contrib/105860820563881561588/reviews?hl=zh-TW,5,False,22,"小卷份量很多而且新鮮，湯頭鮮醇，還有老闆自製的泡椒可以讓湯頭更鮮甜～
很喜歡！"
 Tseng Chelsea ,https://www.google.com/maps/contrib/112611591174861814071/reviews?hl=zh-TW,5,False,1,"環境：簡單木頭桌椅，有冷氣，約可納20人。

餐點：推招牌「主廚小卷米粉」！米粉是細長型，感覺像新竹米粉，不是一小段一小段的那種。小卷有嚼勁、很新鮮，旁邊點綴的甜地瓜、滷蛋、小蝦米、海菜、蔥，看得出主廚用心在美味外，也注重豐富性及美觀。再加上店內提供的紹興酒泡椒，多了ㄧ種風味，很搭。ㄧ碗用$100就可以吃到這麼花功夫搭配而成的米粉湯，已吃了不知多少回了，是會讓人懷念型的鄰家餐點。

價格：$100/碗

捷運：101世貿站步行約5分鐘

真心：希望它生意長紅！"
 Tanro Huang ,https://www.google.com/maps/contrib/106654551950994577132/reviews?hl=zh-TW,4,True,64,小卷很鮮甜，但湯頭口味略顯清淡
 蘇偉仁 ,https://www.google.com/maps/contrib/116761383955977572971/reviews?hl=zh-TW,4,False,33,2.趁著下午在附近看牙醫還有很多時間，特地的再來享用，美味味道仍然不變！只可惜美中不足大打折扣，原本的滷蛋改成ㄙ目魚丸，從原本整碗都原型食物的美食，突然裡面出現一顆加工食品，除了飽足感大打折扣外，也讓一些注重養生不吃食品加工品的人們望之卻步！😮‍💨⋯⋯希望能有機會再看到改回來！🙏
 Celeste Kek ,https://www.google.com/maps/contrib/106004186503515473368/reviews?hl=zh-TW,4,True,163,"小卷米粉100元一碗，有分乾和湯的，湯的是雞湯熬的主廚小卷米粉，乾的是泰式小卷米粉，配辣椒好吃。可以加湯和米粉，加的份量蠻多的。除了點小卷米粉，也點了燙小卷80元，是泰式涼拌口味。

用餐環境乾淨舒適，老闆很親切，離開前還會問口味適合嗎。

這家和花蓮的那家比起來湯頭較清淡，雖然花蓮那家不能免費加米粉，但比較好吃。"
 Yang發 ,https://www.google.com/maps/contrib/110286509472164244712/reviews?hl=zh-TW,3,True,66,"湯頭跟小卷是還不錯
但米粉本身就有點分離（麵是麵湯是湯）
跟台南小卷米粉還是有一大段差距的
順路可以吃不用特別來"
 Angelanini ,https://www.google.com/maps/contrib/105582724642035697895/reviews?hl=zh-TW,4,True,165,"小捲非常鮮甜，份量非常足
湯頭有點清淡，感覺很天然
限量的泰式小捲，酸酸甜甜，必點！
環境非常乾淨唷！"
 陳智偉 ,https://www.google.com/maps/contrib/106348582799701781925/reviews?hl=zh-TW,5,True,"2,004","湯頭清甜甘美好喝不油膩
整隻的小卷新鮮彈牙沒腥味
地瓜鬆軟綿密也香甜
小卷米粉還會附上一整顆滷蛋
辣椒用的是整支沒切的泡椒很特別
我承認我是被這整支泡椒吸引來的
沒想到這整支的泡椒
咬開來裡面是真的有辣的
簡單的泡椒單純的辣味
一點都不會破壞湯頭單純的美味
這泡椒搭這湯頭選的可真是好
如果用的是一般辣油或其他辣椒醬
加下去應該會直接壞了……
這碗湯頭的單純的甘甜美味吧
但這泡生椒也有點不美之處
因為是生椒下去泡
所以咬開來還是會有些許苦澀之味
這種辣中微苦帶澀的味道
能不能接受就看個人的感受跟味覺了"
 Grace Chao ,https://www.google.com/maps/contrib/107700449412208509663/reviews?hl=zh-TW,5,True,74,"這間店專賣小卷米粉
可選擇湯的或是乾的～

可以吃得到小卷的鮮甜！
若吃不飽或是想要多喝湯
皆可免費續湯和加麵哦！
老闆真是太佛心了！！

下次還要再去捧場👍"
 知足 ,https://www.google.com/maps/contrib/114073427439681464542/reviews?hl=zh-TW,4,True,191,"吳興街上～好吃新鮮美味的《小卷米粉》～湯鮮甜～米粉Q彈⋯沾醬泡椒微辣⋯沾小卷佷撘～內用➕湯➕麵免費～超級佛心

#2021/3/5"
 Star ,https://www.google.com/maps/contrib/104776803083619524564/reviews?hl=zh-TW,5,True,212,"很好吃。店內總共就只有小卷米粉(湯)和泰式小卷米粉(乾)兩種，一碗一百元。
湯米粉味道很清爽，乾的是涼拌酸辣的風味，但不怎麼辣(桌上有泰式的酸辣汁可以自己加)。米粉口感很好。"
 ShaSha ROU ,https://www.google.com/maps/contrib/109427615281854450178/reviews?hl=zh-TW,5,True,420,小卷米粉$100店內用餐可以免費加湯加米粉，雞湯底還不錯，整體來說好吃，店內也舒適
 g06 g06 ,https://www.google.com/maps/contrib/107402884522220419776/reviews?hl=zh-TW,5,True,200,先喝一口湯~美味！小卷脆脆QQ感覺新鮮小配菜看起來簡單卻各有千秋粉紅色的小蝦皮也特別香就別說那少少的油蔥頭😍😋滷蛋也是脆Q有味接近鐵蛋了！😀還有一小塊超甜的地瓜！？😕咦！？為什麼有地瓜！？😆😂😆😂
 林庭右 ,https://www.google.com/maps/contrib/106698237873502829887/reviews?hl=zh-TW,4,True,72,"小卷超級新鮮！推薦招牌的湯小卷米粉，乾拌的雖然好吃，但是湯米粉的湯頭真的是一流的，非常鮮甜美味！
座位空間寬敞舒適，出餐速度適中
內用區有洗手間
（2022/10更新）漲了10元，味道有些許改變沒以前這麼好吃了"
 麵包人 ,https://www.google.com/maps/contrib/117985227113469743587/reviews?hl=zh-TW,5,True,225,只有賣湯和乾的米粉，食物擺盤用心也很美味，小菜即使放在冰箱也會用保鮮膜包起來鎖住食物水分和味道很貼心。湯的會多一顆滷蛋。老闆娘很客氣，空間也很舒服乾淨，餐具也都消毒過看得出店家衛生把關很好，廁所也有酒精等消毒工具。是非常好的用餐經驗，也會再去，唯一要挑出可以改進的我想就是希望老闆娘可以多賣燙青菜這個選項。
 王國權 ,https://www.google.com/maps/contrib/101340644690287048989/reviews?hl=zh-TW,4,True,46,小卷米粉湯好吃，價格都100元，有主廚小卷米粉(湯)及泰式小卷米粉(乾)，可加湯加米粉免錢建議點時就可加大，小卷多，湯味道清淡好喝，推薦美食。
 Benjamin L ,https://www.google.com/maps/contrib/114618225083408744829/reviews?hl=zh-TW,5,True,70,"店內專售主廚小卷米粉(湯)，還有限量的泰式酸辣米粉(乾)，選項不多，但是都非常好吃。

用餐環境明亮整潔，餐具也是放在消毒箱內，令人感到安心舒適。

內用的話，還能免費加湯加米粉，真的非常划算。

吃完充分感受到這家店專賣小卷米粉的堅持，或許這份用心正是美味的關鍵原因吧。"
 Andy Yu ,https://www.google.com/maps/contrib/105088571692483819731/reviews?hl=zh-TW,3,True,530,不是很厲害跟令人驚豔，很正常發揮的水準，優點是清爽，不過調味蓋過小捲的鮮甜，稍嫌可惜！
 JY Lin ,https://www.google.com/maps/contrib/110369943439470594207/reviews?hl=zh-TW,5,True,23,跟花蓮的小卷米粉很相似！一樣的超級好吃，雞湯跟米粉都可以免費加，小卷超級好吃！
 Frank Chang ,https://www.google.com/maps/contrib/100358334103745321685/reviews?hl=zh-TW,5,True,35,有乾的（酸辣泰式口味）與湯的小卷米粉，都100元，口味不錯，可以來試試看
 Allen Lin ,https://www.google.com/maps/contrib/104613316345648347622/reviews?hl=zh-TW,5,True,508,好吃美味，湯頭不錯。滷蛋也很棒，一定要點油豆腐，感覺會會到花蓮喔！內用加湯加米粉還免費老闆佛心，推！
 張茂源 ,https://www.google.com/maps/contrib/111248853507535486622/reviews?hl=zh-TW,4,True,133,推薦泰式酸辣小卷米粉，清爽夠味，可惜現在滷蛋換成了虱目魚丸，如果能加點碎花生及香菜，會更美味～
 張大黑 ,https://www.google.com/maps/contrib/103782609453762564868/reviews?hl=zh-TW,5,True,34,"主廚小卷米粉-100元

份量多，口味清爽，小卷口感彈牙
湯頭是使用雞清湯，帶有雞的清香但不會油膩

小卷給的份量很大氣，旁邊還灑有一些蝦米提味，但吃下去沒什麼感覺僅為陪襯

內用加米粉與雞湯免費

店內裝潢簡單整潔明亮，不會給人舊髒亂的刻板印象

這家店下次有經過也是會列為考慮之一"
 陳韋志 ,https://www.google.com/maps/contrib/114500764180146894576/reviews?hl=zh-TW,5,True,41,"環境乾淨
主廚小卷米粉及泰式乾米粉好吃，清淡可口"
 Rebecca ,https://www.google.com/maps/contrib/101803801908919130814/reviews?hl=zh-TW,4,True,326,小卷米粉湯頭清甜、小卷新鮮軟嫩，配上好吃的滷蛋及地瓜，吃得出店家處處用心。
 Phoebe Chen ,https://www.google.com/maps/contrib/109783702622150358464/reviews?hl=zh-TW,5,True,45,"量多實在還有滷蛋跟地瓜🍠😋好吃
這次試了湯米粉下次想試試乾米粉
在101附近可以有100元覺得很划算"
 Babii ,https://www.google.com/maps/contrib/114845628609159711728/reviews?hl=zh-TW,4,True,222,共有兩種口味，湯的口味為雞湯底，乾的口味為泰式酸辣口味並附一碗高湯，兩種口味皆好吃，如果趕時間點湯的口味會比較快上菜。
 Sylvia Peng ,https://www.google.com/maps/contrib/111967501698654662557/reviews?hl=zh-TW,5,True,213,口味不錯的小卷米粉，小卷並不算少，雖然不便宜但配料也比一般米粉多，吃完一碗真的會有飽足感！
 Milly Ou ,https://www.google.com/maps/contrib/101896304423954622218/reviews?hl=zh-TW,4,True,"1,427",米粉湯有五塊小卷，大概是一隻，算是新鮮，只是米粉量少，吃完不太飽，需要再吃點其他東西。其他人拍的照片有滷蛋，現在也消失了？
 A.W. ,https://www.google.com/maps/contrib/105235287259422116967/reviews?hl=zh-TW,5,True,177,"湯的乾的都好吃！！！
比台南的小卷米粉好吃很多！"
 胡如如 ,https://www.google.com/maps/contrib/101782049846778788511/reviews?hl=zh-TW,5,True,36,"真的很不錯的喔
在101旁
還有這樣便宜的美食
小卷米粉鮮甜
辣椒也好香喔
謝謝老闆用心❤️"
 謝岳儒 ,https://www.google.com/maps/contrib/100462328046371560039/reviews?hl=zh-TW,5,True,38,料多實在CP超高內用又可以免費加湯加米粉優質！
 Summer ,https://www.google.com/maps/contrib/104538798860055858471/reviews?hl=zh-TW,5,True,142,鮮甜小卷配上簡單的米粉地瓜蛋，就是好吃😋
 vivian Ho ,https://www.google.com/maps/contrib/109594863034796778054/reviews?hl=zh-TW,4,True,302,"喜歡吃小卷的人真的可嚐嚐。
必加辣。
那小辣椒🌶️真的香"
 WenLing Tsai ,https://www.google.com/maps/contrib/110620992824104884527/reviews?hl=zh-TW,4,True,116,"料滿多的、湯頭味道不錯
以台北市這個價位可以了😌"
 Jonathan Wang ,https://www.google.com/maps/contrib/109135139215829095481/reviews?hl=zh-TW,5,True,92,湯頭清爽，若嫌味道不夠的可另加辣椒或醋等，內用可以加湯加米粉很佛心，小菜也不錯，環境潔淨
 Han Heyhey ,https://www.google.com/maps/contrib/112705577831929501630/reviews?hl=zh-TW,5,True,599,長輩喜歡的簡單味道精緻用心的傳統小吃
 Juei-En Su ,https://www.google.com/maps/contrib/106034687873439178810/reviews?hl=zh-TW,5,True,228,"101附近料好實在
湯頭鮮甜花枝很新鮮Q彈
加湯麵不用錢唷"
 MuMu Yang ,https://www.google.com/maps/contrib/110943497460639452501/reviews?hl=zh-TW,4,True,73,口味清爽，用料新鮮實在，重口味可把調料加到湯裡面
 kate lin ,https://www.google.com/maps/contrib/116375914583734926695/reviews?hl=zh-TW,3,False,19,不知道是不是換老闆了…口味和之前比有些差異，料也一直縮減…現在整體算還ok，只是之前表現很突出，所以有比較有差…
 汪汪 ,https://www.google.com/maps/contrib/103106642389402710723/reviews?hl=zh-TW,4,False,115,"小捲好吃
其它普普(湯頭米粉配料)"
 MASA T ,https://www.google.com/maps/contrib/114443188100932855544/reviews?hl=zh-TW,5,True,111,"餐廳空間大，整潔。菜單選擇...很少。
米粉調味輕淡。4.5顆星。"
 Justin ,https://www.google.com/maps/contrib/103283168640286913570/reviews?hl=zh-TW,4,True,162,材料跟湯頭很新鮮好吃好吃好吃
 Sabrina Chang ,https://www.google.com/maps/contrib/102356495661390156024/reviews?hl=zh-TW,5,True,302,小卷非常新鮮、清甜！泰式酸辣醬(乾米粉)調製的非常適合夏日享用！清爽沒有負擔的一餐！室內座位乾淨、翻桌率快，完全無煩惱的解決一餐！
 Wu Yawen ,https://www.google.com/maps/contrib/103903943524372865718/reviews?hl=zh-TW,4,True,510,不是台南的甜口味（但我個人不偏好甜的所以覺得調味不錯），不喜歡蝦米味的人可能要考慮一下。配料豐富。店內只有兩種品項相對單調。用餐環境舒適，隔一陣子之後願意再訪。
 Linda Wu ,https://www.google.com/maps/contrib/107367482715800027770/reviews?hl=zh-TW,4,True,122,環境整潔，小卷米粉湯有加油蔥酥很香，還有滷蛋，平價美食。
 CC Lin ,https://www.google.com/maps/contrib/107018904362063252967/reviews?hl=zh-TW,4,True,35,兩道100元料理小卷米粉（湯）及泰式小卷米粉（乾、辣），湯頭鮮甜，小卷新鮮Q彈，蜜地瓜配上湯頭剛剛好；小菜自取每盤30元，有待加強；店裡乾淨如同照片般，餐具擺放在烘碗機裡（自取），如偏愛辣的可以嘗試辣椒泡的水或是公共區域的辣椒。
 Jiachen Tseng ,https://www.google.com/maps/contrib/117700257248396574664/reviews?hl=zh-TW,4,True,188,小卷有鮮，一定要配辣椒🌶️！
 葉崇文 ,https://www.google.com/maps/contrib/117827633633478865102/reviews?hl=zh-TW,5,True,27,湯頭鮮甜，自製泡椒與蒜醬都很香。一百元價格還可免費加米粉加湯十分划算
 Kate Lin ,https://www.google.com/maps/contrib/108820770948029700001/reviews?hl=zh-TW,5,True,69,食材新鮮真材實料，湯頭清甜，保留了食材的原味。店家準備的調味料滿齊全的，重口味的人可以自由添加。吃完覺得很舒服沒有負擔，下次有機會還會再光顧👍🏻
 Da-Wen Tseng ,https://www.google.com/maps/contrib/102406597410432330505/reviews?hl=zh-TW,4,False,58,"不錯啦
覺得100小貴
大概80差不多"
 Chen Joanna ,https://www.google.com/maps/contrib/115553870452800466654/reviews?hl=zh-TW,5,False,43,湯頭好喝健康，小捲新鮮，搭配獨門的辣椒真是好吃，內用還可以免費加湯加米粉。大推薦，會常來光顧的！
 Chuanz ,https://www.google.com/maps/contrib/104309099935216052718/reviews?hl=zh-TW,5,True,59,小卷超級新鮮！料多味美，雞湯讓人驚喜～老闆又很客氣。超級推薦這家！
 Aurora Wei Huang ,https://www.google.com/maps/contrib/105064291343893154547/reviews?hl=zh-TW,5,True,86,湯頭好喝，食材也很營養，有地瓜跟海菜，另外附的辣椒也夠味，重點的小卷鮮美好吃，一定會再光臨！
 Ellie ,https://www.google.com/maps/contrib/116121792913304422838/reviews?hl=zh-TW,5,True,35,食材新鮮，老闆娘很大器的續點免費且不厭其煩的服務客人感覺很棒，泰式口味令人欲罷不能，每次去都忍不住想點泰式！有湯的小卷米粉也是超高人氣
 Charmine Chen ,https://www.google.com/maps/contrib/116082900680636506425/reviews?hl=zh-TW,5,True,120,小卷新鮮辣椒夠味上菜數度快
 吳正華 ,https://www.google.com/maps/contrib/104523728684161432342/reviews?hl=zh-TW,4,True,160,真材實料的美味，清淡湯頭，配上好吃米粉，再加上大塊的小卷，如果你懂吃，就來一趟吧！
 Sandy Chang ,https://www.google.com/maps/contrib/115185823792826753017/reviews?hl=zh-TW,4,True,101,小卷很嫩，湯頭也不錯👍🏻
 Misa Wu ,https://www.google.com/maps/contrib/102182253680042898452/reviews?hl=zh-TW,5,True,299,湯頭好，小卷優，米粉好吃，會再回訪的好店，全店只賣乾跟湯米粉，很獨特，不撞口味。
 Lancelot Tsai ,https://www.google.com/maps/contrib/110333552546319365027/reviews?hl=zh-TW,5,True,25,湯頭怎麼可以這麼清甜！好吃到我內心淚流滿面，小卷處理的又嫩又新鮮。真的不要錯過吃起來吃起來！！！！
 王智勇 ,https://www.google.com/maps/contrib/104755689777979916348/reviews?hl=zh-TW,5,False,654,"吃過花蓮的雞湯小卷米粉以後，竟然發現台北也有一家小卷米粉很像，於是也來嚐個味道。
店面不算大，不過也不像花蓮那家店需要排隊，味道則是差不多，有地瓜，另外有雞湯與油蔥酥以及芹菜的味道，小卷算是十分新鮮，大約有一隻小卷的量，可以享受到小卷的鮮味和彈性。
另外令人驚豔的，是米粉裡面的滷蛋十分香Q有味，其實單賣滷蛋也十分可以。
還有水果泡菜十分地酸香辣，與米粉很配。
店內座位大約有五桌，算是大小適中，不過燈光有點暗，如果更亮一點就更好了，拍照或看起來應該都會更好。
這家店適合推薦。"
 Dynasty Chung ,https://www.google.com/maps/contrib/112608400705469158452/reviews?hl=zh-TW,5,True,150,不去花蓮也能吃到的無負擔美食
 Kay Wang ,https://www.google.com/maps/contrib/116604307972687005857/reviews?hl=zh-TW,4,True,165,"還可以
可惜辣椒不香"
 陳志榮Raymond ,https://www.google.com/maps/contrib/105990003297101501042/reviews?hl=zh-TW,5,True,862,湯頭不錯，小捲爽口，可免費加湯加米粉。來一點桌上的泡辣椒增添風味。
 黃淑珍 ,https://www.google.com/maps/contrib/114746994412083853374/reviews?hl=zh-TW,3,True,63,感覺小卷米粉配料變少了
 江東坡 ,https://www.google.com/maps/contrib/105028895050305876200/reviews?hl=zh-TW,5,True,2,在台北市信義區吳興街32號(♥♥世貿101.小卷米粉♥♥)位於信義區的美食街超級戰區，(101.小卷米粉)的店長用天然新鮮食材熬煮的湯頭，(★★★完全不添加味精★★★)，希望讓信義區的上班族，多一個享受健康、美味的好地方，本店特色~料多，味美，不加味精。(♥♥內用，加湯，加米粉，不加錢♥♥)。歡迎世貿展覽館、台北101、台北市政府、四四南村(眷村景點)、adidas101籃球場..附近公司、行號訂購捧場。也歡迎美食部落客，大胃王蒞臨指教。(♥♥101/世貿.捷運站2號出口，在adidas101籃球場旁，走路3~5分鐘♥♥）。在網路或FaceBook用★★★(101小卷米粉)★★★搜尋，也可以找到(101小卷米粉)網站呦。電話(02)2736-3749
 Wendy E ,https://www.google.com/maps/contrib/112572763188789414174/reviews?hl=zh-TW,5,False,13,好吃沒負擔！每種食材都很新鮮還可以加湯加米粉～老闆也很親切～一個禮拜吃好幾次😂
 Richard Chen ,https://www.google.com/maps/contrib/106690390341958936393/reviews?hl=zh-TW,4,False,123,100塊一大碗小卷米粉在台北101附近算是價廉物美，湯頭清淡，可另外加辣，小卷味道新鮮
 黃永泰 ,https://www.google.com/maps/contrib/105023567701374225241/reviews?hl=zh-TW,4,True,98,經濟實惠地瓜魯蛋，紫菜稍嫌少一點，摻加胡椒粉黑醋提味湯汁稍清淡。
 Willis Chen ,https://www.google.com/maps/contrib/109311584420960397748/reviews?hl=zh-TW,4,True,137,小卷好Q彈，泡椒的辣椒很辣，需要酌量服用
 Susan Chen ,https://www.google.com/maps/contrib/112030125729954334663/reviews?hl=zh-TW,5,True,151,很乾淨衛生的小食~
 Nicole Li ,https://www.google.com/maps/contrib/100931759777378973218/reviews?hl=zh-TW,5,True,26,現場吃免費加湯加米粉，好吃！
 OOkey Lai ,https://www.google.com/maps/contrib/110221005064310537814/reviews?hl=zh-TW,4,True,34,只能說好吃！
 Constance Hsia ,https://www.google.com/maps/contrib/112466547379856433982/reviews?hl=zh-TW,4,True,36,好吃，只賣小卷米粉，乾的跟湯的。
 Hsiao Yi Huang ,https://www.google.com/maps/contrib/103196367784304137342/reviews?hl=zh-TW,5,True,288,稍貴但很好吃
 天琪幼兒園劉曉蕙 ,https://www.google.com/maps/contrib/105197410311906546506/reviews?hl=zh-TW,5,False,3,料多味美湯頭讚食量大的還可以加湯加米粉喔！
 張哲修 ,https://www.google.com/maps/contrib/102945449550349883691/reviews?hl=zh-TW,5,True,"1,007","今天有吃到了。
來好幾次都休息。"
 儀修智 ,https://www.google.com/maps/contrib/110013835862840193186/reviews?hl=zh-TW,4,True,34,湯頭好，小卷新鮮，加米粉不加價，物超所值。
 許慧娟 ,https://www.google.com/maps/contrib/104423346328634196310/reviews?hl=zh-TW,5,True,88,小卷米粉，一碗100元，可續米粉，續湯，不加價，很有誠意👍
 Pearl Kao ,https://www.google.com/maps/contrib/112725220443333469444/reviews?hl=zh-TW,4,False,12,餐點很好吃！個人蠻喜歡湯的口味而且還可以加大份量
 P E U ,https://www.google.com/maps/contrib/108458577830027349237/reviews?hl=zh-TW,2,False,2,營業時間最後半小時不注重品質米粉幾乎短的不超過五公分之前吃過再次回顧感覺很差
 Cassie ,https://www.google.com/maps/contrib/104230350995706495987/reviews?hl=zh-TW,4,True,39,不錯👍🏻
 Hui-Wen Cheng (Hui Wen Cheng) ,https://www.google.com/maps/contrib/105078069009569559259/reviews?hl=zh-TW,4,True,712,只有湯，乾兩種，小卷米粉，店內用餐可加湯，米粉，可來試試。
 Parker Ou ,https://www.google.com/maps/contrib/105177977489235117864/reviews?hl=zh-TW,5,True,56,小卷米粉好吃，可以加大，這樣才吃得飽
 Kuo-Wei Chang ,https://www.google.com/maps/contrib/110642405963221845917/reviews?hl=zh-TW,5,True,252,平價美味的小吃
