user_name,user_profile_url,rating,local_guide,comment_num,comment_text
 stanly Good Luck Su ,https://www.google.com/maps/contrib/102275225698801507008/reviews?hl=zh-TW,5,True,73,雖然這次是下午時間用餐，但是鍋貼上來的速度算是快的，讓我覺得應該是之前一批煎好放著吧！結果意想不到的竟然是熱的耶！真的不簡單在這時間可以吃到熱真的是有點感動，服務員也是很親切的服務，東西雖是家常吃的鍋貼但就是多了一點的味，人情味～
 陳宥騏Yuki老師音樂教學—鋼琴個別課、幼兒音樂團體課教學 ,https://www.google.com/maps/contrib/114617595285885925861/reviews?hl=zh-TW,2,False,42,味道可以，常買，但回家要吃才發現，今天買到一碗沒有旗魚花枝丸的旗魚花枝丸湯😶
 アン ,https://www.google.com/maps/contrib/112873818903090914694/reviews?hl=zh-TW,3,False,1,"鍋貼皮完全不焦脆，環境也不怎麼乾淨
酸辣湯還可以"
 Cherry Su ,https://www.google.com/maps/contrib/104105884264894085992/reviews?hl=zh-TW,5,True,588,品質ok，店員也蠻親切的。
 Jay Lin ,https://www.google.com/maps/contrib/117155042403147466401/reviews?hl=zh-TW,3,True,302,還行，慢慢增加直營門市的品項，就松山工農的學生多，用完餐不收，環境差一點。
 Jia-yun Chen ,https://www.google.com/maps/contrib/110802810493865058230/reviews?hl=zh-TW,1,True,538,一直以為八方雲集都是點餐後現做⋯只有這家是做好了放在那、等客人點了再重新加熱⋯整個口感很差啊⋯
 周怜吟 ,https://www.google.com/maps/contrib/104742759150589639056/reviews?hl=zh-TW,4,True,93,去博愛國小打球完路過吃起來，吃起來還可啦，送餐速度也滿快的，水餃確實包的有點不夠紮實，感覺餡很容易露出來，除此之外都還可。（2021.04.02）
 CL Chang ,https://www.google.com/maps/contrib/115985030737236860539/reviews?hl=zh-TW,1,False,1,店員態度很差、外帶沒檢查回家才發現少給燙青菜
 171A091劉嘉衛 ,https://www.google.com/maps/contrib/115377442949956921278/reviews?hl=zh-TW,1,False,7,"第一次遇到這種狀況
等了半小時跟客人說你要的東西沒了
要不要換品項本來點一個酸辣湯餃其中一個員工頻頻漏單好幾位客人不斷問自己的餐點好了沒
那個員工的態度依然慵懶不屑
更改為玉米湯餃後發現裡面還少一顆水餃
雖然有補償一杯豆漿但是等了半小時也沒主動告知還要等客人一個一個問實在令人不滿"
 Bo Y ,https://www.google.com/maps/contrib/114880482793127856601/reviews?hl=zh-TW,1,False,9,"雷，不知道在瞎忙什麼
取完餐，便到附近停到路邊停車場車上用餐
但鍋貼放到冷掉才出餐就算了
酸辣湯也是冷冷的
平常沒在留評論的
冷掉的酸辣湯越吃越火大"
 Ryo Alpha ,https://www.google.com/maps/contrib/109567376612847490003/reviews?hl=zh-TW,4,True,142,熟悉的老味道八方雲集，個人最喜歡喝這邊的玉米濃湯了，酸辣湯也是蠻好喝的，如果要吃的話，建議內用，湯會比較大碗，雖然說稱不上高級美食，但是比起其他分店來說並不遜色，尤其多增加其他的麵類料理後，這家店已經不是單純的鍋貼水餃店了。在台北市信義區附近，能夠找到如此物美價廉的美食，已經是難得可貴了。店內的用餐環境取決於來店用餐的客人的公德心，如果是環境髒亂或是餐盤沒收，我覺得不太能夠苛責店員。
 歐叡錡 ,https://www.google.com/maps/contrib/115004457006680402601/reviews?hl=zh-TW,5,True,39,"他這裡的飲料好喝然後鍋貼又更好吃
酸辣湯又更好喝，水餃又超好吃
這一家剛好在我學校對面又近
而且旁邊是有賣油飯，甜不辣，冰紅茶
的小吃店更旁邊的是早餐店最後一家是讓我想稱讚的那一家店是泰式奶茶店的奶茶好喝又想起自己在家裏現做的奶茶而且沒有像泰式奶茶只不過很好喝
八方雲集他們做任何的食物都是用心做的
而且他們是用自己的身體來扛一些疲勞，
辛苦，體力，他們真的真的太辛苦了
要記得多喝水才有體力活下去
加油努力的活下去辛苦你們了，辛苦了。"
 林鼎鈞 ,https://www.google.com/maps/contrib/109530222003265418876/reviews?hl=zh-TW,5,True,544,進步了，速度變快很多，連吃三天都有辣椒和蒜末，二種加一起有醋的味道
 Louise kaufmann ,https://www.google.com/maps/contrib/105289185563378608177/reviews?hl=zh-TW,4,False,77,"平常蠻常吃的，出餐速度一般可接受。建議電話點餐，可街口、linepay支付

疫情期間，點餐取餐時觀察人員口罩均有戴上，裝鍋貼的店員也有噴酒精。

罷特，外帶回去吃時，旗魚丸湯的紫菜有點過少，旗魚丸也煮的不夠久，湯就如圖。
希望店家疫情期間繼續保持戴口罩噴酒精，出餐狀況漸入佳境。"
 P. H. ,https://www.google.com/maps/contrib/115289236032126309200/reviews?hl=zh-TW,1,False,1,明明沒有什麼客人，為什麼出餐速度可以這麼慢。
 Rani ,https://www.google.com/maps/contrib/104729190331232384886/reviews?hl=zh-TW,5,False,14,老闆人很好，魚丸湯沒有魚丸了，退我湯費用還送一碗湯❤️
 tone yu ,https://www.google.com/maps/contrib/106765401308230965153/reviews?hl=zh-TW,1,True,54,玉米濃湯肉都是沒煮熟的，有些店都不用生肉放玉米湯內煮了，別說那是火腿，沒熟肉自己去google。
 man ka ,https://www.google.com/maps/contrib/107579423286993754509/reviews?hl=zh-TW,5,True,12,"靜，方便
員工態度沒什麼差。。。
早上來，兩個都是過了40（？"
 李浩實 ,https://www.google.com/maps/contrib/107989366842800544602/reviews?hl=zh-TW,1,False,3,爛透了電取說15分鐘到店還等了半小時一直看著店員作別人的單我的單都不做其他店員也各安本分也不幫忙分裝害一堆客人在等也不會不好意思！！
 錢柄匡 ,https://www.google.com/maps/contrib/103517122695269377560/reviews?hl=zh-TW,1,True,72,動作慢，不論是外送平台點餐還是電話訂餐，收銀台的男子總是冷漠的看著出餐工讀生忙不過來，台前等待的客人會需要自行確認是否為自己的餐點，經營者不思索動線流程如何提高效率，只會冷眼旁邊固守工作職責劃分，感受欠佳。
 陳沛萱 ,https://www.google.com/maps/contrib/114083613359751965329/reviews?hl=zh-TW,1,True,27,"只是點的種類較多，但數量至少有五個以上！
就在那邊大聲跟員工討論客人的不是！
說什麼這種人就機車一族啦，還有什麼菜籃族的啦。
沒水準的員工，沒家教！沒職業道德"
 Cure Tobe ,https://www.google.com/maps/contrib/106935675449854352444/reviews?hl=zh-TW,1,True,58,店員都忙自己的，沒有打算要理客人
 栋宾 ,https://www.google.com/maps/contrib/108565328297560759046/reviews?hl=zh-TW,1,False,1,忠孝五店，12:55電話訂鍋貼，到店付好錢，等13:15問好了沒？結果店家回剛放進煎！傻眼怎麼了？2點等著下班！這已第二次，生意會好才怪，等著關門大吉吧！
 李海泉 ,https://www.google.com/maps/contrib/116396596349310913540/reviews?hl=zh-TW,3,True,250,生意忙用餐時間最好先打電話。
 Jacky Lee ,https://www.google.com/maps/contrib/108055162198026569503/reviews?hl=zh-TW,3,True,469,鍋貼.水餃皆便宜好吃又衛生。
 沈鴻彬 ,https://www.google.com/maps/contrib/109673283385113041377/reviews?hl=zh-TW,1,False,2,上菜忘記上苦等30分鐘友人都吃飽了就是不給上才10顆水餃而已反應後改成要外帶服務人員硬是覺得有上菜在那邊灰吃八方那麼久第一次遇到這種情況感覺不好
 鈞慧 ,https://www.google.com/maps/contrib/113910345023688084200/reviews?hl=zh-TW,3,True,103,新蔬食鍋貼還不錯吃～
 Daniel Chang ,https://www.google.com/maps/contrib/101357582602818919535/reviews?hl=zh-TW,1,False,2,我想當的不喜歡店裡的歌尤其是某個團體名稱叫bts的團體令我耳朵流產
 汪文俊 ,https://www.google.com/maps/contrib/109350526611714132830/reviews?hl=zh-TW,5,True,263,田園蔬菜鍋貼有素食醬料好吃😋
 沈婉瑜 ,https://www.google.com/maps/contrib/116197348844061899029/reviews?hl=zh-TW,1,False,6,店員非常不合善，有次等了半小時鍋貼，反應等太久，前台店員就摔鍋蓋，真的是很爛的店，從此沒再去買過
 Jessica Chen ,https://www.google.com/maps/contrib/115081320372565380202/reviews?hl=zh-TW,1,True,165,"服務態度超差超爛超敷衍動作超級慢只顧著包外送等了四十幾分鐘問了也沒要處理的樣子自己急著外送就敷衍一句水餃比較快傻眼...店裡蚊子超多站在那邊被叮還是等不到店面的酒精噴霧器也沒用....真的是+$（#！&超不爽不會再來祝倒閉

餐具極度不環保塑膠湯匙每一個都有塑膠套酸辣湯比起其他家料少"
 陳小九 ,https://www.google.com/maps/contrib/104963843818898151693/reviews?hl=zh-TW,4,True,381,都一樣，沒特別好或不好
 別離leave ,https://www.google.com/maps/contrib/116318168759239582729/reviews?hl=zh-TW,1,False,3,店員態度超差，之前去的時候問請問可以點餐嗎直接超兇回等一下，點餐的時候還一直「蛤」，我覺得我講話挺大聲的？之後餐好了還直接用丟的方式給我超沒禮貌。嗯..我之後想吃八方應該寧可走遠點也不會再來這家=.=
 王睿駿 ,https://www.google.com/maps/contrib/107341864452264218246/reviews?hl=zh-TW,3,False,16,環境可以在乾淨一點就更好
 Chia Tai ,https://www.google.com/maps/contrib/115349101836877399205/reviews?hl=zh-TW,1,False,9,"每次來都說酸辣湯賣完，又說他們是賣完過又有重煮，又不是靠近打烊時間，賣完就該重煮吧？如果沒有賣這品項就直接招牌貼起來，不要每次都說賣完，去兩家八方雲集距離都差不多，早知道就去另一家，比撲空好。這一家就是常常買不到酸辣湯然後說賣完。
然後胖胖的女店員每次點餐都把客人晾在一旁等，後來還是別的店員來幫我點餐，沒見過當店員那麼跩的，如果她是老闆，我會為了抵制她不再去用餐。"
 MK ,https://www.google.com/maps/contrib/101532830925440564995/reviews?hl=zh-TW,1,False,26,"不愉快的經驗。下午5:00剛好經過，告知店員要買2包冷凍水餃，最後是被當隱形人。店員消極態度，讓我等到都火大了，直接走人。平常都是在信義松山店購買，從來沒有碰過這種態度的員工。難怪信義店的google評價高達4.1,但你們只有3.2。"
 jhon風 ,https://www.google.com/maps/contrib/100940265458374386294/reviews?hl=zh-TW,1,True,48,爛！！！跟隔壁那家7-11一樣！就是有態度非常差，好像欠她會錢一樣！一個胖胖的女生~要點個餐愛理不理的！站在收銀台旁多久了？八方雲集這家店也沒人要管是嗎？要不要收一收別做了？
 邱崑城 ,https://www.google.com/maps/contrib/110663241615609483834/reviews?hl=zh-TW,1,False,14,招牌鍋貼吃到沒熟的，裡面豬肉餡咬不斷，打開發現都粉紅色的肉，說要補給我等到同事都吃完了還沒補給我，直接走人，真的第一次吃到這種的煮沒熟的鍋貼
 娛樂小哥哥 ,https://www.google.com/maps/contrib/102637540593347928157/reviews?hl=zh-TW,5,True,82,每次看到都是一個人在煎鍋貼、每次都感覺會等很久、但其實不會耶、手腳滿快的、出乎我預料之外、值得誇讚👍
 于向彥 ,https://www.google.com/maps/contrib/112555564459954915377/reviews?hl=zh-TW,2,False,1,等我點的招牌水餃等了25分鐘都還沒來，比我晚來晚點的客人所點的餐全部都上了，就我還沒有上，若沒有去詢問說不定還得等到半小時以上
 周宸右 ,https://www.google.com/maps/contrib/116963391708746569503/reviews?hl=zh-TW,1,False,21,這家非常不環保.大多數店家只有筷子是一次性的.盤子是重複利用的.而我吃過所有的就只有這筷子是一次性.盤子也是一次性的.除了不環保也不健康.畢竟盤子上也會有一層塑膠模.真的想吃水餃鍋貼可以考慮永春站3號出口的四海遊龍
 E L ,https://www.google.com/maps/contrib/108853920972279524107/reviews?hl=zh-TW,1,True,116,"拜託把這間店員開除好嗎？七月五日下午14:48分，點了睡覺，女店員一臉不耐煩的說，水餃要等，我說沒關係，結果她一臉怒氣的瞪我，說要等半小時，半小時之後才會煮我的水餃，我問為什麼，她說現在才要煮水。
好，水要煮半小時沒關係，那個態度實在令人不敢恭維，這麼不想上班乾脆不要開店了。噁心至極"
 Ryan Zheng ,https://www.google.com/maps/contrib/106457133186592939137/reviews?hl=zh-TW,1,False,1,"超級爛。可以接受平日中午時段人多送餐慢。
12點07分點的餐，12點33分還沒送來。
隔壁桌晚一點來和點餐的卻先送餐了。
反映後才急急忙忙送來。

可以接受點餐人多送餐慢。
但是跳過點餐順序送餐是怎樣
而且那桌也是有點鍋貼。
爛爆了"
 Tom Ho ,https://www.google.com/maps/contrib/110231959972262120365/reviews?hl=zh-TW,1,False,13,在櫃台要點餐，店員看到一副當你空氣一樣遲遲不來。點餐時，要什麼沒什麼，問有什麼鍋貼，店員說剩下的都有，隨即問是否有田園蔬菜口味，店員卻說這沒了，當下有一種被耍的感覺
 James Kuo ,https://www.google.com/maps/contrib/102268275782470407200/reviews?hl=zh-TW,1,False,12,八方好吃，但這家的SOP還是服務態度有負分一定非給不可。我排外帶54，點15個原味鍋貼等了快20分鍾，去問她才從某張大一點的訂單抽出，顯然是沒發現，但她確回我才剛排到。外帶單都跑到58號，內用67號。妳當客人都不知道嗎？說一句抱歉有這麼困難?難以接受。
 0000 0 ,https://www.google.com/maps/contrib/115531200396923407852/reviews?hl=zh-TW,1,False,9,有老鼠，別來
 Poppy Chen ,https://www.google.com/maps/contrib/101566879597792059769/reviews?hl=zh-TW,1,False,11,"裡面有個男店員脾氣很差。
看他在罵女員工。
私下談不能嗎。要當著客人面前怒罵女員工。
如果你是店長。我真覺得你做的很失敗。"
 Kevin Chang ,https://www.google.com/maps/contrib/102077378893303265319/reviews?hl=zh-TW,4,True,41,店面雖小，但有地下室座位，各種醬料充足，最近好像不能刷悠遊卡了。
 韓曼 ,https://www.google.com/maps/contrib/111985615480117480348/reviews?hl=zh-TW,1,False,1,"電話整整打了半小時都不通
到現場問櫃檯只一句電話沒掛好
都不覺得餐期沒人打電話外帶很奇怪？
沒自覺的店家沒負星可以給真可惜"
 楊子樟 ,https://www.google.com/maps/contrib/113574183573439619199/reviews?hl=zh-TW,1,True,5,"餐點等半小時豆漿等更久
店員餐點丟了轉頭就走等我們自己在那邊猜
主管講話不會控制音量用餐品質很糟糕
旁邊空桌的垃圾也是從我們入座到用餐完都不整理
總結雷店一間"
 S ,https://www.google.com/maps/contrib/107620664906881715503/reviews?hl=zh-TW,1,False,34,戴帽子白髮黑衣服的女生是在跩什麼東西不能用街口支付就不要擺出來，態度那麼差我是欠你的？
 Cooper The Lop ,https://www.google.com/maps/contrib/100240775722498957718/reviews?hl=zh-TW,3,False,72,10/5平日下午三點來吃。明明只有一桌客人，好幾桌（目測約四桌）都有吃剩的垃圾，但服務員卻遲遲不收垃圾，是要放到等蒼蠅過來嗎？
 老梁 ,https://www.google.com/maps/contrib/103023132658978790995/reviews?hl=zh-TW,1,False,7,廁所很臭，水餃夾不起來，蒼蠅很多，湯給很少，沒有蒜頭，飲料太少，鍋貼不錯吃，素葷不分，邊緣素食。
 湯克定 ,https://www.google.com/maps/contrib/104618953687098944348/reviews?hl=zh-TW,4,True,45,店面雖小但有特製提供的辣椒醬，非常入味，各品項都在水準之上。
 Hsiang Liu ,https://www.google.com/maps/contrib/115520653855359419624/reviews?hl=zh-TW,1,False,10,買20顆給10顆，還要凹，你們都有開發票怎麼凹
 周家緯 ,https://www.google.com/maps/contrib/114755995461192463972/reviews?hl=zh-TW,1,True,45,等了半小時，出餐流程必須改善，可以去學學南陽街八方雲集那邊的效率
 Marco ,https://www.google.com/maps/contrib/110609180472452297702/reviews?hl=zh-TW,1,False,14,"水餃包的很不ok,還有破的，裡面內餡很少，請問再吃水餃皮嗎"
 郭DAI ,https://www.google.com/maps/contrib/112567750592311463760/reviews?hl=zh-TW,1,False,1,做錯餐就算了，在那裡等還被說”那個女的在那裡幹嘛”。沒做錯我也不用在那等^_^
 pan yz ,https://www.google.com/maps/contrib/105655643025261962057/reviews?hl=zh-TW,1,False,16,在櫃檯等了五分鐘依舊無人來幫忙結帳點單，不知道是人員不足還是不想服務
 黃資城 ,https://www.google.com/maps/contrib/104958438659339674923/reviews?hl=zh-TW,5,True,75,生意好，難免忙中有錯，那麼苛求，愛給1顆星是什麼概念？別把服務業當成奴隸一樣！
 郭彧綾 ,https://www.google.com/maps/contrib/117093584260377378558/reviews?hl=zh-TW,1,False,2,"出餐速度太慢
而且餐點還漏看
說話又沒邏輯
浪費客人時間真的很傻眼"
 Bonjour Jay ,https://www.google.com/maps/contrib/109240919052834118040/reviews?hl=zh-TW,2,False,5,鍋貼現煎好吃，但是店員服務態度比較不和善，感覺老闆是不是欠員工薪水。
 Barney KONG ,https://www.google.com/maps/contrib/110696517811736775580/reviews?hl=zh-TW,1,True,114,點單用吼的，叫單用吼的，收錢用摔的，煎台一直在罵人碎碎念，你以為只有你們有脾氣，我操你媽。
 wooo A ,https://www.google.com/maps/contrib/116603822335407851649/reviews?hl=zh-TW,2,True,322,"要體諒他們的辛苦我會體諒
但是態度完全不能接受
只是說要點餐而已
不懂斜眼瞪人是什麼意思"
 johna wen ,https://www.google.com/maps/contrib/111821511515301041815/reviews?hl=zh-TW,3,True,53,"假日中午用餐時間只有一位服務人員,以致訂單需等候過久的時間"
 jason chiang ,https://www.google.com/maps/contrib/110232033032799356641/reviews?hl=zh-TW,1,True,82,"是要多不環保，用個餐全部都是免洗餐具
速度超慢不說服務態度很不怎樣"
 Jackal Hsu ,https://www.google.com/maps/contrib/112779375765322142899/reviews?hl=zh-TW,5,True,11,上餐快速，因為人多而上錯不會拿回送錯的餐點，會再補送正確的，店長教的不錯，給予鼓勵
 N. Chang ,https://www.google.com/maps/contrib/111260180505015066604/reviews?hl=zh-TW,4,True,170,鍋貼好吃，店內整潔，不過在地下室吃的話手機收訊不太好，有冷氣還算不錯。
 李安臣 ,https://www.google.com/maps/contrib/112590575089466985494/reviews?hl=zh-TW,1,True,19,如果可以，人員請全部換掉，服務態度差到哭杯，來吃東西的，不是來受氣的。高層都沒在管理的，爛透了。
 譚傳永 ,https://www.google.com/maps/contrib/110837586222530533821/reviews?hl=zh-TW,4,True,467,有兩層，可是通常只會開一層，人多時要並桌。
 Emmalee Liao ,https://www.google.com/maps/contrib/115441208127443938772/reviews?hl=zh-TW,1,True,15,上菜速度超慢！我等了“幾乎1個小時”才和我說沒湯了！
 何汶諭 ,https://www.google.com/maps/contrib/110521231484031903005/reviews?hl=zh-TW,1,False,5,爛，只准外帶我能理解人力問題，連基本的提醒給醬包和餐具都沒有....爛
 董信宏 ,https://www.google.com/maps/contrib/115784267623664196290/reviews?hl=zh-TW,3,True,56,連鎖店口味差不多，但這裡的玉米農湯在跟其他分店比起來的量很少
 陳韋廷 ,https://www.google.com/maps/contrib/105017782048532784047/reviews?hl=zh-TW,1,False,9,"點咖喱沒咖喱換鮮蝦沒鮮蝦點玉米還少3顆
地下室沒網路人手不足速度很慢總之夠爛"
 廖翌茜 ,https://www.google.com/maps/contrib/107563578749308092460/reviews?hl=zh-TW,1,False,2,都用免洗餐具，很不環保，上餐很慢，東西常常點了買完了
 Luke P. ,https://www.google.com/maps/contrib/112774976204777581622/reviews?hl=zh-TW,1,True,106,一個死胖妹店員，態度有夠差的，自己心情不好，無差別攻擊同事、客人
 潘爺Odin Pan ,https://www.google.com/maps/contrib/109704784213428276109/reviews?hl=zh-TW,4,True,720,服務好很多～
 葡萄爸爸 ,https://www.google.com/maps/contrib/110750834290792036253/reviews?hl=zh-TW,1,True,100,沒主動給發票，出菜順序混亂！以後不會再來買！
 杜維圃 ,https://www.google.com/maps/contrib/108854694460567024016/reviews?hl=zh-TW,5,True,282,招牌鍋貼就不必說了，酸辣湯更是棒！
 CEA Tim ,https://www.google.com/maps/contrib/106860030084713427960/reviews?hl=zh-TW,3,True,105,這邊座位較少，且只有鍋貼（沒有麵點類）
 周宏旺 ,https://www.google.com/maps/contrib/103130761028476604284/reviews?hl=zh-TW,4,True,401,美味可口，早中晚餐都可滿足饑腸填飽肚子，好地方
 Ling Ling ,https://www.google.com/maps/contrib/114214812934605418767/reviews?hl=zh-TW,2,True,55,吃很多次幾乎每次鍋貼都是破掉的沒包好
 Benson Chen ,https://www.google.com/maps/contrib/104964227742681505766/reviews?hl=zh-TW,1,False,3,男店員無視排隊順序，態度差👎
 Daniel Chang ,https://www.google.com/maps/contrib/118135682789293925485/reviews?hl=zh-TW,3,True,28,工作人員太辛苦了，所以口氣都很不耐煩？
 李炳宏 ,https://www.google.com/maps/contrib/107443083331306331874/reviews?hl=zh-TW,5,True,25,現煎的鍋貼需要點時間，但是很好吃。
 顏士桂 ,https://www.google.com/maps/contrib/117168489788000257100/reviews?hl=zh-TW,1,False,9,等了25分鐘送過來的還是冷的有夠誇張
 劉廷緯 ,https://www.google.com/maps/contrib/100703245039746731163/reviews?hl=zh-TW,1,False,5,東西真的送的很慢，明明第一個先點的，後面點的人先給
 kris huang ,https://www.google.com/maps/contrib/108022244189932580346/reviews?hl=zh-TW,1,False,3,服務態度不好好像老闆欠員工多少錢
 陳芯庭 ,https://www.google.com/maps/contrib/101190913134209402000/reviews?hl=zh-TW,1,False,8,"點菜常常搞錯餐點
態度又差"
 王承偉 ,https://www.google.com/maps/contrib/117886487828605235230/reviews?hl=zh-TW,3,True,355,上班日中午用餐時間都要等很久，約20分鐘。
 林瑀暄 ,https://www.google.com/maps/contrib/102561176721939567742/reviews?hl=zh-TW,1,False,2,打了好幾通電話要都沒接乾脆別裝市內電話了好嗎
 Calvin Lee ,https://www.google.com/maps/contrib/108302519325970925284/reviews?hl=zh-TW,4,True,127,口感不錯。韭菜口味挺好辣味的鍋貼好
 神秘人 ,https://www.google.com/maps/contrib/115039317071156703726/reviews?hl=zh-TW,1,False,13,都電話叫自取了到現場才做又不是現場很多人
 陳萩紘 ,https://www.google.com/maps/contrib/107029019318541530467/reviews?hl=zh-TW,1,True,19,樓下座位區大蟑螂爬動活力四射慟
 鍾治頡 ,https://www.google.com/maps/contrib/101144651215859334572/reviews?hl=zh-TW,2,False,14,水餃吃到塑膠
" ,Austin Austin ",https://www.google.com/maps/contrib/105116667742118237667/reviews?hl=zh-TW,5,True,250,平價，1樓用餐環境優，音樂特別、好聽
 程毓恆 ,https://www.google.com/maps/contrib/105785632261862109909/reviews?hl=zh-TW,3,True,72,內用環境整潔舒適，快速用餐非常適合
 劉巧克 ,https://www.google.com/maps/contrib/111488288121138986590/reviews?hl=zh-TW,2,False,8,有時會做錯單
 謝宗仁 ,https://www.google.com/maps/contrib/102431707252478904697/reviews?hl=zh-TW,5,True,410,吃飽又省錢的好所在，酸辣湯最高。
 張右 ,https://www.google.com/maps/contrib/110736794132247660031/reviews?hl=zh-TW,1,False,7,結帳店員態度差.動作慢
 Ripley Huang ,https://www.google.com/maps/contrib/102408112147729450938/reviews?hl=zh-TW,2,True,169,鍋貼太軟一夾就破了
 簡宇廷 ,https://www.google.com/maps/contrib/114197584018010211590/reviews?hl=zh-TW,1,False,13,極差，出菜超慢，別來
 Parco J ,https://www.google.com/maps/contrib/117264473034403912305/reviews?hl=zh-TW,5,True,682,消費金額小數點部分，無條件折讓很讚
 Niou Bao Xian ,https://www.google.com/maps/contrib/104252138435342696535/reviews?hl=zh-TW,4,True,239,店員雖然動作不快，但算是親切！
 鄭立群 ,https://www.google.com/maps/contrib/111400317538426553001/reviews?hl=zh-TW,4,True,147,中午用餐，使用免洗餐具不太環保
 翁偵佐 ,https://www.google.com/maps/contrib/103296915768074258162/reviews?hl=zh-TW,2,False,6,消費者是他的痛、好像欠他、應該的
 洪定國 ,https://www.google.com/maps/contrib/111702637999422359604/reviews?hl=zh-TW,4,True,357,乾淨鍋貼好吃，價格合理
 北風 ,https://www.google.com/maps/contrib/110442162630090200955/reviews?hl=zh-TW,3,True,51,好吃，生意好人多難免有錯。
 Paul Jou ,https://www.google.com/maps/contrib/116142822661495509834/reviews?hl=zh-TW,3,True,154,電話訂餐沒有用，不會比較快
 王啟名 ,https://www.google.com/maps/contrib/101725826476143096561/reviews?hl=zh-TW,5,False,7,店長服務態度良好，有賓至如歸的感覺
 Ray Chien ,https://www.google.com/maps/contrib/108994339688185108230/reviews?hl=zh-TW,4,True,552,這間八方雲集沒有賣蕈菇湯！
 A Fu ,https://www.google.com/maps/contrib/102943814368563474678/reviews?hl=zh-TW,1,False,1,"十分差勁的服務態度
notrecommended,extremelyunfriendlyservice"
 楊琇曼 ,https://www.google.com/maps/contrib/107389492083970246338/reviews?hl=zh-TW,3,True,31,就鍋貼脆脆的還不錯吃
