user_name,user_profile_url,rating,local_guide,comment_num,comment_text
 Liao Tim ,https://www.google.com/maps/contrib/105805100340443423392/reviews?hl=zh-TW,1,True,31,飯裡面有蟑螂，其他顧客兩個月前也有一樣的經驗，衛生完全沒有改進，真的非常噁心
 何至軒 ,https://www.google.com/maps/contrib/105566829799980009608/reviews?hl=zh-TW,4,False,17,"優點：支援刷卡、行動支付、送餐速度快
缺點：附贈衛生紙淋到湯汁，不便使用"
 吉女圭女圭 ,https://www.google.com/maps/contrib/102600921144559187183/reviews?hl=zh-TW,3,True,654,吉野家吃起來都差不多，但這裡店員態度好差，愛理不理好像不想講話
 王苡城（Ashen） ,https://www.google.com/maps/contrib/102388610700363724213/reviews?hl=zh-TW,5,True,62,跑熊貓也要吃午餐
 楊明達 ,https://www.google.com/maps/contrib/112078744151374390339/reviews?hl=zh-TW,4,True,118,環境乾淨，店員親切。餐點可以
 林萌 ,https://www.google.com/maps/contrib/108786967772579147368/reviews?hl=zh-TW,2,True,235,"牛丼89
茶葉蛋49
溫泉蛋
//
洋蔥還沒煮透，薑汁顏色很淡，丼飯的醬汁給的不多甚至於有瀝乾的感覺，半熟溫泉蛋搭著吃依然不夠濕潤，白飯也是偏乾的，牛肉片微柴沒有影響太多，蒸蛋裡面有玉米、豬肉、魚板，鹹度偏重一點，蛋的比例比較多，吃起來很滑順。"
 H.P. Yen ,https://www.google.com/maps/contrib/104587925007020789143/reviews?hl=zh-TW,5,True,523,套餐有牛丼飯+泡菜+茶碗蒸+味噌湯+冰檸茶，才178元很超值有飽足感。營業到2點宵夜好選擇。大夜班的服務很親切有加分！
 Dear John ,https://www.google.com/maps/contrib/101984288879877920135/reviews?hl=zh-TW,5,True,752,24H方便可吃到飯的地方，東西好吃，價格合理，服務好，環境舒適，簡單用餐的好去處。餐點推陳出新。
 陳健傑 ,https://www.google.com/maps/contrib/117326494509074844000/reviews?hl=zh-TW,3,True,64,牛丼飯套餐價格120多元有點小貴有附飲料跟小菜牛丼飯還不錯吃不過份量偏少飲料的話冰塊給的太多喝完還有半杯冰塊小菜泡菜的部分就普普營業到兩點適合宵夜族群來吃看看
 黃太宇Beck.1943 ,https://www.google.com/maps/contrib/113764024847416190675/reviews?hl=zh-TW,1,True,33,下午四點多去買可能碗太大份量少很多
 Arvin Wu ,https://www.google.com/maps/contrib/116233918120691075053/reviews?hl=zh-TW,1,False,1,晚上7點去點了一份小牛丼外帶，等了10分鐘都還沒聽到叫號，我去櫃檯問，結果得到的回覆是餐點的菜單紙飛走了，所以忘記做我的，我直接問說在搞什麼，為何會搞這個烏龍，櫃台人員又不回話，繼續幫別的客人點餐，我整個一肚子火都上來，後來另一位櫃台人員跟我解釋一樣的話。就是餐點紙飛走了所以忘記做我的，只給我一個道歉然後什麼補償也沒有，之後做餐不到一分鐘就好了，卻整整讓我白等10分鐘，態度又差，整個火冒三丈。奉勸其他要到這家餐廳消費的客人多三思，今天有發生這種事，以後就有可能發生到別的客人身上
 minnie yu ,https://www.google.com/maps/contrib/113214389783793074670/reviews?hl=zh-TW,5,True,59,服務人員態度親切，讓我印象深刻。而且現在加入會員還可以集十點換餐，真的不錯
 Oliver Lin ,https://www.google.com/maps/contrib/113169720946943528011/reviews?hl=zh-TW,2,False,8,店家明文規定不能帶狗進去，但是不少客戶帶狗進去，店員看到也不勸導，影響其他客戶權益。
 繡羽 ,https://www.google.com/maps/contrib/107197419225472123108/reviews?hl=zh-TW,1,True,247,"把花椰菜拿掉
就只有肉跟白飯而已?
因為我曾在其他連鎖店
花椰菜裡吃蟲子所以才
會叫店員把花椰菜拿掉，
但把花椰菜拿掉就只有
肉跟白飯而已?
難道吉野家配菜就只會有
花椰菜不能有其他配菜嗎？
這樣吃我會大腸癌跟痣瘡的"
 華風雪 ,https://www.google.com/maps/contrib/108025421334809102385/reviews?hl=zh-TW,2,False,8,"剛外帶一份大牛丼套餐回去吃，
說真的有點不滿意，
牛丼飯幾乎是乾的沒汁，
另外，
我想知道湯裡的塑料片是哪來的？？"
 王浩勇（曉凱） ,https://www.google.com/maps/contrib/105314899411908406201/reviews?hl=zh-TW,5,True,"1,670",吉野家(昆陽門市)！位於昆陽捷運站正對面！在此開業二十多年！品牌商譽良好！員工服務態度親切！給5顆星！！！
 hellen su ,https://www.google.com/maps/contrib/109099744973258872818/reviews?hl=zh-TW,4,True,101,"可樂餅牛丼

現點現炸
店開到兩點
可以當宵夜吃😋"
 Alex Lin ,https://www.google.com/maps/contrib/107519951562079169953/reviews?hl=zh-TW,1,False,1,"牛丼裡面有蟑螂，差點吐出來🤮
Cockroachinfood,absolutelydisgusting"
 Turtle Chiu (小龜) ,https://www.google.com/maps/contrib/102570422839321319381/reviews?hl=zh-TW,4,True,112,雖然稱不上美味，但員工很親切，服務不錯，想想大半夜的，選擇性本來就不高，有個親切的地方，還是很開心的。
 許弘祿 ,https://www.google.com/maps/contrib/111234978275297091531/reviews?hl=zh-TW,1,False,6,難怪都是一星評論不意外
 彥伶 ,https://www.google.com/maps/contrib/100968284010900038654/reviews?hl=zh-TW,5,True,167,"很喜歡吉野家的肉和溫泉蛋～
但飯每次都多到吃不完😋"
 stanley Shu ,https://www.google.com/maps/contrib/103554313779601858712/reviews?hl=zh-TW,3,True,67,"20190209(pm7:00)
餐點普通
環境好，乾淨
某女店員點餐訴度超慢，明明客人沒很多，但後方不斷塞車，排隊要排7分鐘

希望改進，謝謝"
 Alan Chen ,https://www.google.com/maps/contrib/114341646590959738617/reviews?hl=zh-TW,5,True,939,可能是前一個使用者打開瓶蓋倒七味粉的關係，我只是想撒點七味粉，整個蓋子就掉下來了。謝謝昆陽吉野家幫我處理這碗翠玉牛。
 陳宣蓉 ,https://www.google.com/maps/contrib/110969385684392356408/reviews?hl=zh-TW,2,True,208,食物的圖片比'實際產品'還豐富。麻婆豆腐的豆腐非常少塊，青蔥不是鮮嫩的，而是切好放了很久乾乾的。只有味增湯還不錯喝味道不會很淡，然後烏龍麵有Q度。
 鄭英英 ,https://www.google.com/maps/contrib/105763314927893318626/reviews?hl=zh-TW,4,False,160,位於昆陽捷運站的日式牛丼店，有段時間沒去，最近好像變更一些菜單像梅乾扣肉丼，麻婆豆腐牛/豚丼，咖哩牛/豚丼，客倌們可嚐鮮看看。
 Ashley Su ,https://www.google.com/maps/contrib/103535979097078189031/reviews?hl=zh-TW,1,False,23,因為十點才下班也因為有折價劵才會去（要掏錢吃應該不會）去了五次四次沒雞（剩下一次兩三片）泡菜也是兩三片……既然打着開24hrs的店，什麼都不足就乾脆收起來不要開了
 劉政杰 ,https://www.google.com/maps/contrib/101608762554909731579/reviews?hl=zh-TW,2,True,29,兩年多沒去了，現在早班這批店員沒溫度，環境也沒很好，下次如果非必要，不會選擇這用餐。畢竟附近店家很多可選擇
 權 ,https://www.google.com/maps/contrib/118292470643111574649/reviews?hl=zh-TW,1,False,5,點了一份快兩百的餐然後看到的時候真的傻眼，一碗飯幾片肉一小盤泡菜一杯綠茶，然後還聽到店員在那邊碎念客人沒收餐盤，只是收兩三個餐盤而已
 hsuan C ,https://www.google.com/maps/contrib/111112086448041123040/reviews?hl=zh-TW,4,True,353,"環境乾淨舒服
服務不錯
麻婆牛丼飯有點鹹不過大致上還可以"
 Terry Fan ,https://www.google.com/maps/contrib/116007872551930202728/reviews?hl=zh-TW,1,True,50,份量縮水超多，有夠坑爹
 Roger Chiang ,https://www.google.com/maps/contrib/112593310607374816497/reviews?hl=zh-TW,5,True,350,"強烈推薦大家用這個支付在吉野家付費,2018年12月31日前都會有回饋,等於打折,很棒,很好吃."
 Phyllis Tsai ,https://www.google.com/maps/contrib/107874065587019432094/reviews?hl=zh-TW,3,True,332,昆陽店的服務人員態度都很好但餐點怎麼和以前吃的差那麼多飯沒有醬汁肉也沒有味道本來想重溫一下小時候最愛的吉野家結果.....很失望
 笑天 ,https://www.google.com/maps/contrib/109408645348995113187/reviews?hl=zh-TW,4,True,19,還不錯內用座位蠻舒適的
 greatman woo ,https://www.google.com/maps/contrib/112563799144169306278/reviews?hl=zh-TW,3,False,14,"謝謝您的回覆，您可以看一下其他人的評論，至少有四則在說醬汁很少，飯很乾，這是一個普遍的問題，應該存在很久。醬汁才多少錢，不應該吝嗇的給。希望能再加強，若客人有要求，應該給多一點醬汁，味偏淡也是個問題。謝謝您。

剛叫了餐，牛丼飯～味道淡以外，整碗飯沒淋多少醬汁，白飯還是白白的，真的很不優。

別家的丼飯送餐時，會將牛肉及醬汁與白飯分開包，給客戶自己淋。"
 BFF ,https://www.google.com/maps/contrib/116363098733833206810/reviews?hl=zh-TW,1,False,14,連白飯都超難吃⋯以前吉野家絕對不是這樣，真是太誇張了
 Charles Tan ,https://www.google.com/maps/contrib/107441066143460505436/reviews?hl=zh-TW,3,True,"1,109",交通方便，環境整潔，可以快速簡單用餐
 Zack Chen ,https://www.google.com/maps/contrib/111781843695820405199/reviews?hl=zh-TW,5,True,164,外送平台每次點套餐，餐點吃起來不膩，外包裝也處理很細心，避免湯品，飲料打翻。
 浩浩 ,https://www.google.com/maps/contrib/110564183905188220261/reviews?hl=zh-TW,1,False,15,每次從外送平台備註拌飯醬要多，從來沒多過，很不用心的一家店
 黃大大 ,https://www.google.com/maps/contrib/106625384429935035023/reviews?hl=zh-TW,1,False,14,今天晚上去買店員連介紹都不會，都沒什麼客人了還這種擺爛態度，過太爽是嗎？不差我一位客人嗎？附上的蛋還有碎蛋殼hello?反正也不用回應我了，都罐頭訊息
 靈魂黃 ,https://www.google.com/maps/contrib/117529847806201405834/reviews?hl=zh-TW,1,True,254,"不便宜肉又少洋蔥入味好吃但幾乎都沒入味甚至根本沒熟
特別講要多汁還是很少飯吃起來很乾不好吃這麼一點都不肯給等著市場淘汰吧

明明以前可以做的好吃
現在每家都差不多一樣的問題是不想做了吧"
 神州溫刀 ,https://www.google.com/maps/contrib/106150630567022305342/reviews?hl=zh-TW,1,False,5,外送訂單常常搞錯。東西少了也不知道。電腦訂單出單項目是對的但實際上東西就是少給客戶為什麼？當客戶都是盤子嗎？！
 Judy Cheng ,https://www.google.com/maps/contrib/112498530753430614562/reviews?hl=zh-TW,3,True,269,雖然不是第一次吃吉野家，但還是覺得食材的新鮮度不夠，午餐後一直胃脹氣，點了翠玉子豬肉丼135，加A套餐63，通常蔥一旦新鮮就能畫龍點睛，但真的不夠新鮮，醬汁不足而吃掉肉後飯都白白的，且價格相較sukiyaki高，不過份量是相當足夠。三月份的活動也蠻奇怪，悠遊卡送C餐，但其實A餐也包含這些配菜卻沒有優惠⋯
 Susan Chen ,https://www.google.com/maps/contrib/114029385341522476615/reviews?hl=zh-TW,5,True,127,連鎖店還是有差別，這家很好吃😋，高雄的不怎麼好吃
 Angel Chen ,https://www.google.com/maps/contrib/101702843244170225165/reviews?hl=zh-TW,1,False,3,"我一顆心都不想給，單點也不用給餐具嗎！是叫客人在外怎麼吃，用手挖飯啊
我不是訂外送，是店內購買外帶。搞清楚"
 楊穩 ,https://www.google.com/maps/contrib/115955316839338636527/reviews?hl=zh-TW,5,False,11,買了幾次，都遇到夜班的林小姐，服務很優質、聲音很甜、下班疲倦的來買宵夜，每每都好心情的回到家，繼續加油💪林小姐
 皮質 ,https://www.google.com/maps/contrib/107225028377658752596/reviews?hl=zh-TW,4,True,104,內部環境乾淨，外帶也很方便
 拍 ,https://www.google.com/maps/contrib/114439013468589781549/reviews?hl=zh-TW,1,True,57,Foodpanda外送已經晚了20分鐘下去取餐結果外送員說店家餐點給錯最後拿到餐點已經晚了一小時結果還少給茶碗蒸聯繫店家說下次再訂會補給我或送過來這不是我花錢該拿到的嗎不懂這種補償是什麼我也沒辦法再等送過來不知道還要多久上大夜班早該吃完準備休息這次訂餐經驗真的很差
 chiung-ya wang ,https://www.google.com/maps/contrib/102272559257824455283/reviews?hl=zh-TW,1,False,3,"剛剛買了午餐跟小姐說了三次要刷發票載據
確告訴我要先付錢
然後就印發票給我
我告訴她我不是跟妳說要用載據嗎？
她就把發票丟在收銀台
也不理我繼續幫下一個客人點餐
後來餐點好了拿餐給我發票也不給我
還要我跟她要
態度非常的差
一週至少三天會買這間因為方便食物也覺得還蠻好吃的
但今天真的讓我非常失望"
 Benson Lee ,https://www.google.com/maps/contrib/109328173557114530455/reviews?hl=zh-TW,3,True,60,吉野家，就連鎖的，我想反映為何不能跟日本同步有出寶可夢系列的餐具那樣，我超期待的誒誒，而且現在又不能出國，如果跟日本一樣就好了。
 Quinn Liu ,https://www.google.com/maps/contrib/107908820153854175480/reviews?hl=zh-TW,2,True,54,不到10分鐘車程的距離，叫外送要我們用他們的平台叫，結果等了一個小時（11點叫），都沒有來，說他們外送員在汐止有些狀況，結果又等到現在12:43跟我們說他們自己送好了，？？？那為什麼一開始就不自己送，飯都冷了大家也餓死！！氣死！！！！！！！！！！
 邵長勇 ,https://www.google.com/maps/contrib/114411536025359885560/reviews?hl=zh-TW,3,False,3,感覺碗內沒有什麼東西，一碗的消費將近200元左右，我是第一次到貴店消費的感覺沒有那個價值，我沒有什麼惡意只是表達我的看法
 sws wsw ,https://www.google.com/maps/contrib/114842026131772401146/reviews?hl=zh-TW,1,True,75,身為一個日本企業，員工福利欠佳、店長個性也有問題，沒有員工餐，都要自己買單，食材方面不ok，你知道你們吃的丼飯的湯汁和味噌湯、燒肉醬大部分是化學調成的嗎？賣天然食材的錢，飯給一般的米也斤斤計較，對外欺騙消費者，明明是屏東產的紅薑，硬要騙是日本的，不可取
 溫在銘 ,https://www.google.com/maps/contrib/115481622274315605752/reviews?hl=zh-TW,2,True,"1,192","2020.02.1923:00

吃習慣了Sukiya家，偶然換換口味來吉野家嘗鮮。以牛丼、配餐和使用者友善度而言，完全大輸Sukiya，不會想再訪。值得一提的是，櫃檯的店員很有精神的招呼客人，值得嘉許。

1.牛丼的口味個人偏愛sukiya，這裡的牛丼沒啥味道。

2.泡菜、檸檬紅茶、紅薑也不怎麼樣，反倒是sukiya的燙青菜超好吃，紅薑也更新鮮。

3.sukiya一入座就有一杯茶，還可以續杯。每個座位都有附餐具調味料和菜單，相當友善，這邊則否。"
 florence liu ,https://www.google.com/maps/contrib/115655628671256877403/reviews?hl=zh-TW,2,False,11,"晚上點了兩碗飯外帶。
一打開就看到很大一片蛋殼（出餐人員怎麼沒看到？
半熟蛋部分，只有一點點蛋白水水的在飯上。
毛豆也比其他間鹹到有點吃不下去。"
 吳秉政 ,https://www.google.com/maps/contrib/112036310743863296906/reviews?hl=zh-TW,1,False,5,店員態度很差在櫃檯點餐等很久問了內用外帶之後走掉過了1.2分鐘又再問一次問完就看著我也不問要點什麼
 神賴 ,https://www.google.com/maps/contrib/111858048473303806601/reviews?hl=zh-TW,5,False,17,餐點我還沒吃但是短頭髮的店員有夠正
 蔡瑋哲 ,https://www.google.com/maps/contrib/116317157959649840610/reviews?hl=zh-TW,1,False,4,"櫃臺服務小姐胖胖的那位態度極差不耐煩，
我點主餐都有說A餐，自己沒注意聽在按
點餐機故意按的很用力，到底欠妳多少錢？"
 張涵褘 ,https://www.google.com/maps/contrib/108132213993315983326/reviews?hl=zh-TW,3,True,274,覺得普通的牛洞還好
 David MAC ,https://www.google.com/maps/contrib/107458365301378673899/reviews?hl=zh-TW,2,True,219,"不知是不是少了配方，還是食材差異。
第一次發現味道相差這麼大的分店！！
店員都很Nice也努力，希望改善囉！"
 Sh Oy (D.r_oysh) ,https://www.google.com/maps/contrib/117026238267098356191/reviews?hl=zh-TW,3,True,703,大部分員工都不錯但是沒有24hr喔是04~05中間休息1hr嗯嗯員工都頗平易近人的！態度基本上都不錯！只是上夜班的員工需要細心一點準備食材！鬆餅好好拿著回家居然膨開而且打蛋沒戴手套！
 Wei Hsu ,https://www.google.com/maps/contrib/106634887950068163112/reviews?hl=zh-TW,1,False,16,動作有夠慢，出餐要等也不會事先講
 詹雅杰 ,https://www.google.com/maps/contrib/109441549836334911912/reviews?hl=zh-TW,1,False,8,"店員服務很棒。
破公司，大夜只放一個人上班，又要做過路客又要做外送，公司一個小時多花150是會倒是嗎？"
 李俊申 ,https://www.google.com/maps/contrib/114492550662588371660/reviews?hl=zh-TW,1,False,14,份量小價格也不合理
 Chao Hsu ,https://www.google.com/maps/contrib/102071003123983919957/reviews?hl=zh-TW,1,True,367,雞肉是冷的，店員態度也是冷冷的。
 鄭詠玲 ,https://www.google.com/maps/contrib/116377747061527775346/reviews?hl=zh-TW,1,False,7,"10月7號星期一
十二點半買了牛丼跟咖喱牛丼
有點半熟玉子可是沒放進去....
打電話過去好幾通都不接"
 王力平 ,https://www.google.com/maps/contrib/112115064575465849385/reviews?hl=zh-TW,3,True,229,反正每一家店口味與服務都差不多，價格都一樣，最大的優點就是離捷運站很近。
 郭秀燕 ,https://www.google.com/maps/contrib/103528611501655292704/reviews?hl=zh-TW,1,False,11,"很失望，招牌牛肉丼
醬汁完全沒味道@@
跟以往的口味差很多"
 檸檬花開 ,https://www.google.com/maps/contrib/109497212126771649193/reviews?hl=zh-TW,3,True,410,很久沒吃吉野家的牛丼飯，經過這裡進來回味一下，覺得肉片和泡菜都變得好少，要靠白飯才有飽足感
 1208 Groundhog ,https://www.google.com/maps/contrib/116162376666026129271/reviews?hl=zh-TW,2,True,107,加大還是吃不飽
 YC M ,https://www.google.com/maps/contrib/113238541670008233010/reviews?hl=zh-TW,3,True,64,連鎖店水準，味道標準化，可惜的是冷氣出風口吹著沙發座位，讓人覺得不舒服
 李友翔 ,https://www.google.com/maps/contrib/113521166855432360969/reviews?hl=zh-TW,3,False,15,白飯太乾了幾乎沒有醬汁，白飯白到我眼睛快瞎了
 洛 ,https://www.google.com/maps/contrib/108043717279704424348/reviews?hl=zh-TW,5,True,41,店員弟弟的服務很好，建議丼飯的汁可以多一些會更美味！
 annie (misschen 9319) ,https://www.google.com/maps/contrib/111000290593666551903/reviews?hl=zh-TW,3,True,12,去的是隔壁的摩斯漢堡，如果要熱乎乎早餐還是要現做較好，天冷的時候櫃台上的三明治會非常冷....
 嫑又双叒叕森焱垚鑫淼 ,https://www.google.com/maps/contrib/106576312748616670138/reviews?hl=zh-TW,5,False,2,點菜快速，服務員態度佳。只要避開繁忙人潮時間，來這用餐絕對是一大享受
 Rita Hsu ,https://www.google.com/maps/contrib/103491284964579512241/reviews?hl=zh-TW,5,True,72,想念的味道，疫情期間，客人都很稀少，希望大家多多支持！
 吳hatung ,https://www.google.com/maps/contrib/113935741354398782324/reviews?hl=zh-TW,3,True,136,燒肉丼飯好吃口感粒粒分明有咬勁，但清葱太少肉煎得太老，韓國泡菜量好像有少
 Chang Frank ,https://www.google.com/maps/contrib/107918787283809329278/reviews?hl=zh-TW,2,False,99,校門關等於鬼門開，禮拜天中午兩個沒禮貌又聒噪的哈日宅男一直在旁邊大聲地機哩瓜啦大放厥詞講一堆讓人聽了就煩的X話，耳根完全不得清淨，吵都吵死了，東西再好吃也沒用。
 丁丁鈞 ,https://www.google.com/maps/contrib/109886698487620597433/reviews?hl=zh-TW,3,True,230,這家牛丼飯的牛肉煮得太久，跟其他店比起來不太優，不過服務和環境還不錯
 Shusky Peng (蔣正妹) ,https://www.google.com/maps/contrib/107381126570735012195/reviews?hl=zh-TW,3,True,56,因為是連鎖店餐點味道統一店員臉色超酷只是單純吃飯的地方不是惟一選擇很難會讓人再造訪
 Kevin Chang ,https://www.google.com/maps/contrib/102077378893303265319/reviews?hl=zh-TW,3,True,41,主要為牛肉飯，搭配泡菜或毛豆，味增湯或紅茶，空間不是很大，常要等候。
 Zhi rong LIn ,https://www.google.com/maps/contrib/106453631213445724639/reviews?hl=zh-TW,1,True,25,"有一個女服務生在7/29禮拜一晚上
幫客人點餐服務態度很差臉很臭
影響用餐心情"
 OSSO Yeh ,https://www.google.com/maps/contrib/117467159940446472642/reviews?hl=zh-TW,5,False,5,服務態度很棒，親切並且照顧到顧客的需求，食物美味，跟記憶中的味道一樣，滿分。
 Ricky Fun ,https://www.google.com/maps/contrib/101789286293500165525/reviews?hl=zh-TW,3,True,"1,151","奇怪…明明是連鎖店==超雷的唷!!!
我在其他分店吃的味道怎麼不同…"
 Jeannie Yen ,https://www.google.com/maps/contrib/108316739876782828868/reviews?hl=zh-TW,4,True,60,餐點滿好吃的！
 earbaby earbaby ,https://www.google.com/maps/contrib/108293005550842143432/reviews?hl=zh-TW,2,True,23,習慣去吃，但服務越來越差了，晚班，很不想服務的態度。怎麼了呢？加強一下吧？
 林小凱 ,https://www.google.com/maps/contrib/100165474627234116483/reviews?hl=zh-TW,3,False,108,"中秋限定燒肉丼好吃
其餘中規中矩"
 陳譽文 ,https://www.google.com/maps/contrib/106421335029716023505/reviews?hl=zh-TW,5,True,44,可以牛豬雞肉一起來的簡餐店，冷氣挺強的，也是能吃喝聊天的好地方。
 賴錕堯 ,https://www.google.com/maps/contrib/111934028333086322840/reviews?hl=zh-TW,4,True,121,方便便宜好吃的日式便當
 熊小楓 ,https://www.google.com/maps/contrib/113492398149676137892/reviews?hl=zh-TW,5,True,15,店員親切有禮，即使顧客臨時更換內用與外帶（關係到包裝器具）笑臉迎人！
 Justin Tsai ,https://www.google.com/maps/contrib/106865891384435286580/reviews?hl=zh-TW,2,True,8,僅工讀生無廚師，服務熱誠不佳，食物冷熱不一，臨場反應服務態度不佳。
 鴻兒 ,https://www.google.com/maps/contrib/112293425432125866082/reviews?hl=zh-TW,4,False,2,"飽足感十足店員貼心和熱情的服務
給4星不是沒原因就是讚室內環境乾淨整潔
昆陽的吉野家就是讚"
 林介友 ,https://www.google.com/maps/contrib/110677849387030692452/reviews?hl=zh-TW,4,True,159,丼飯量多稍鹹，價格是一般便當店的2倍左右
 Ching Lin ,https://www.google.com/maps/contrib/114762695735917970474/reviews?hl=zh-TW,5,True,21,人員服務好，丼飯現做好吃，店內也乾淨！
 Max Wei (KEVIN3688) ,https://www.google.com/maps/contrib/112333209126516070486/reviews?hl=zh-TW,2,True,26,毛豆跟味噌湯都過鹹，內長人員搞不清楚內用跟外帶的先後出餐順序
 涂志銘（Chih-Ming Tu） ,https://www.google.com/maps/contrib/104863808990699854167/reviews?hl=zh-TW,4,True,262,"冷氣很強，用餐空間舒適，但中午用餐時間人很多，常需要排隊。
喜歡牛丼和雙寶丼。"
 JIM HUNG ,https://www.google.com/maps/contrib/101725415115348716523/reviews?hl=zh-TW,3,True,44,點餐動線亂一堆人點完餐卡在櫃檯店員也不會引導
 Albee Liu ,https://www.google.com/maps/contrib/115947484265237891460/reviews?hl=zh-TW,3,True,49,希望飲料可以問一下需不需要加冰塊，另外飲料只有紅茶這種嗎？
 Chris Hsieh ,https://www.google.com/maps/contrib/114638677433253635299/reviews?hl=zh-TW,4,True,81,"我認真的說，吉野家，真的不錯吃啊，為什麼有人覺得不怎樣？
真心好吃！"
 邱啟銓 ,https://www.google.com/maps/contrib/116560717701453368796/reviews?hl=zh-TW,5,True,51,"東西好吃豬肉丼入味泡菜新鮮又開很晚
宵夜的好去處"
 靖ㄩ ,https://www.google.com/maps/contrib/100085247852139742155/reviews?hl=zh-TW,4,True,95,等的有點小久不過沒關係燒肉很好吃
 明明呂 ,https://www.google.com/maps/contrib/114319181472851112578/reviews?hl=zh-TW,4,True,179,有幾次外帶，湯的蓋子都沒蓋好。
 leo lin ,https://www.google.com/maps/contrib/114321033007415612164/reviews?hl=zh-TW,2,False,6,飲料要去冰沒去加點了茶碗蒸也漏給失望至極
 葉枝靈 ,https://www.google.com/maps/contrib/110823429887551692667/reviews?hl=zh-TW,4,True,156,量不算多，一個套餐對男生來說吃不飽
 linda Su ,https://www.google.com/maps/contrib/113383870727329763931/reviews?hl=zh-TW,3,True,81,以前營業到凌晨兩點，最近不知道了
 許庭綱 ,https://www.google.com/maps/contrib/107016871956965932987/reviews?hl=zh-TW,3,True,"1,186",店面空間蠻大的桌面清潔度有待加強上菜速度快
 Neil Huang ,https://www.google.com/maps/contrib/108944760904822295718/reviews?hl=zh-TW,5,True,29,一陣子就想吃的美味，何時汐止才會在有，期待，去昆陽好遠，老闆幫幫忙
 鄭一一 ,https://www.google.com/maps/contrib/115650186909683354664/reviews?hl=zh-TW,5,False,3,點了外送，雞肉丼太好吃了，沒吃過這麼好吃的東西
 鄭中遠（Arthur） ,https://www.google.com/maps/contrib/109960864408898425309/reviews?hl=zh-TW,5,True,242,一出捷運站對面而已趕車時的好夥伴，吃完再上！
