user_name,user_profile_url,rating,local_guide,comment_num,comment_text
 KK ,https://www.google.com/maps/contrib/112901716596190946931/reviews?hl=zh-TW,5,True,40,一秒回到義大利!麵條保留米心是難得的正統義大利麵❤️豬肉片沙拉豬肉入味沙拉新鮮，油封鴨腿皮酥肉香嫩，點的菜色都吃的到食物本身的新鮮度，很是滿意。燉牛頰不是軟爛的那種，有點難咬，適合喜歡Q彈口感的人。
 醒來就想吃 ,https://www.google.com/maps/contrib/115452953439918976223/reviews?hl=zh-TW,5,True,163,"海鮮很好吃（平常不吃海鮮人驚艷）
牛非常的嫩
提拉米蘇好喜歡
燉飯是道地硬的那種

很多需要預定哦！
下次要試試大家很推的紙包魚"
 Vivian ,https://www.google.com/maps/contrib/114936105509912240287/reviews?hl=zh-TW,4,True,117,"南港一間外表很不起眼很容易忽略的地中海餐廳
建議要先預定
很多餐點也要先預定不能現場點
外場只有老闆一人.所以接客不多
餐點都單點.沒有套餐

-香煎台灣黑豬肋眼蓋👍🏻👍🏻👍🏻
這個超嫩.有驚豔到
-海鮮義大利麵
網路超多人推這個
醬有點重口味
海鮮料給很多但不至於到驚豔
-法式油風櫻桃鴨腿
有點鹹要配著沙拉一起吃.蠻特別的
-番茄濃湯
超酸"
 Daniel Lo ,https://www.google.com/maps/contrib/116574167759258742225/reviews?hl=zh-TW,5,True,13,"老闆兼廚師用台灣的食材義大利的佐料燒出好吃的pasta，我們吃得很開心，鄭老闆很友善又健談，以後還會去報到。

【7月16日】今天吃得非常愉快，鄭老闆推薦馬祖來的新鮮淡菜，通常大的綠淡菜老口感不好，馬祖淡菜不但超大而且肥嫩，加上完美的烹飪，真是好吃！鄭老闆也推薦兩支橘花跟海鹽口味的啤酒，也是風味絕佳。最後謝謝鄭老闆招待的crepe甜點，我的朋友都很喜歡今天的午餐."
 torun Born ,https://www.google.com/maps/contrib/100315509271570523634/reviews?hl=zh-TW,5,True,15,超道地義大利料理。紅酒白酒都有單杯大加分！前菜小鮑魚很嫩熟度剛剛好。油封鴨腿義大利麵很好吃配紅酒很合。
 立仁 ,https://www.google.com/maps/contrib/109523547295723956754/reviews?hl=zh-TW,5,True,72,海鮮該新鮮就新鮮，豬肉該嫩就嫩，義式飯的米心就該不全熟，義大利麵該入味麵條中的佐法，這家店都做到了！
 Lu Farn ,https://www.google.com/maps/contrib/114575468743617446652/reviews?hl=zh-TW,5,True,195,"#義薩格餐廳是一家低調但美味的小餐館，老闆非常友善，用餐氣氛輕鬆，價格平易近人，值得專程再訪！
.
每道料理都有獨特的記憶點，即使前菜冷盤的豬肝豬舌鹹豬肉，都讓人印象深刻而讚不絕口，烤花椰菜也是創新的料理手法！
.
各項主菜用料實在，烹調用心，份量十足，味道鮮美，魚蝦豬牛都在水準之上，搭配精選的香檳與紅酒，最後再以Lovi's巷弄手工雪糕結尾，的確是一頓完美的聚餐！"
 Chou Achi ,https://www.google.com/maps/contrib/113376945499220787204/reviews?hl=zh-TW,5,False,17,"鴨胸必點好吃
就是外國廚師很道地
份量有點小但是很平價👍🏼
暫時好像沒有飲品有餐酒
想吃甜點要預約會為了甜點再訪"
 林姿妘 ,https://www.google.com/maps/contrib/104588905739086720588/reviews?hl=zh-TW,5,True,119,"來店日期：2022.05.28
法式烤蛋塔、波隆那義大利麵
餐點好吃，擺盤很漂亮，肉醬麵擺上雪點般的起司很讓人驚艷❤️
用餐環境明亮舒服，有機會還會再訪"
 Hsu Amy ,https://www.google.com/maps/contrib/113540416963389322694/reviews?hl=zh-TW,5,True,65,每道都精緻好吃，油封鴨腿蛋黃麵和松露筆管麵是最愛
 Everglown ,https://www.google.com/maps/contrib/117563481844030684975/reviews?hl=zh-TW,4,True,161,"餐點都不錯，不便宜但食材口味都很棒
甜點選項較少，比較可惜"
 曾璿安 ,https://www.google.com/maps/contrib/111381908563596480074/reviews?hl=zh-TW,5,True,50,用料不馬虎，大多使用在地食材，還有需預約的當日海鮮，會在回訪
 hugo kuo ,https://www.google.com/maps/contrib/103113112273777052285/reviews?hl=zh-TW,5,True,246,口味很特別應該算道地？很驚艷的料理，雖然價格略高但值得
 Avery Li ,https://www.google.com/maps/contrib/113474964064212768995/reviews?hl=zh-TW,4,True,966,海鮮很新鮮~麵條跟米心的口感恰到好處
 Scarlett H ,https://www.google.com/maps/contrib/103003142352287471508/reviews?hl=zh-TW,5,False,8,"別有一番風味的義式料理，淡菜鮮甜、牛頰軟嫩、豬肉驚人鮮嫩最後上的義大利起司蛋糕令全場驚艷！

老闆很和善又幽默，推薦好吃、好聊又放鬆的餐廳！"
 Groove Huang ,https://www.google.com/maps/contrib/103879870087685567863/reviews?hl=zh-TW,5,True,106,"南港路上的地中海料理餐廳，不特別注意的話就算每天經過可能也不會發現。

進入餐廳，木質調的裝潢，明亮的燈光，寬敞的座位，感覺一切都是恰到好處。

主廚是個斯文的法國人，每道菜都會親自送餐；菜單上有一些菜色是需要先預定的，前往用餐建議訂位跟提早想好大概要吃的東西。

用餐這天特別預定了一個菜單上沒有的《馬賽魚湯》，普羅旺斯湯底，實實的大海味道，行前滿滿的期待完全沒有落空；搭著麵包一起吃，一開始就心滿意足了。只是隱約感覺到鹽味似乎不太足，跟老闆閒聊後發現是因應台灣人的口味做出調整，除了鹹度之外，道地的馬賽魚湯據說海味超級濃厚以至於可能會吃不慣；不過有機會還是想要體驗正宗版本。

主菜點了一個《紙包鮮魚》，這天選的魚是紅笛鯛，老闆對海鮮的來源跟處理方式非常講究，對料理的知識也很豐富；如果想嚐嚐一些少見的高級魚種或是有特別的料理需求都可以提早幾天跟老闆討論；做菜就應該是這個樣子活活潑潑的，保持它的傳統，但又是流動的。

主食選擇《油封鴨腿佐起司蛋黃麵》，這裡的麵撼動了我心目中的義大利麵排行榜，吃了兩口直接榮登榜首。（更替了長期盤踞的SoloPasta）如果沒有什麼特別想吃的，輕輕鬆鬆地走進來吃一盤義大利麵，也是十分愜意。

最後甜點是可麗餅，這可麗餅是法國正宗的軟嫩口感，內裏簡單包著一些香蕉片跟巧克力醬。其實正不正宗倒是其次，好吃才是王道；這裡的可麗餅好吃的不得了，我在想、門道應該是在麵粉跟奶油裏。

總而言之，是會令人想一來再來的餐廳。"
 yasuike Q ,https://www.google.com/maps/contrib/106783384668658551517/reviews?hl=zh-TW,4,True,"1,020","👉燻肉起司蛋黃麵：我想會採用蛋黃醬的店家，其用心程度我想就不必說明了，搭配煙燻黑豬五花更是別有一番風味。⠀
⠀
👉義式米蘭燉牛頰：慢慢切開，輕鬆自如！，輕輕咀嚼，輕鬆自如！方方黃黃伸縮自如（並沒有），我默默的在心裡想著好一塊燉牛頰！即使冥頑不靈如老頭的筋膜也不必費大勁就能輕鬆食用，蕃茄醬汁的香氣從肉的深處爆發開來，再再都顯示牛頰火候到位。⠀
.⠀
從菜單來看，這間店主要都是販賣義式料理，而表現確實道地且不俗，有一點我不得不提我喜愛義薩格義薩格的原因，能融合部份在地食材表現傳統義式料理，也是十分難能可貴的，畢竟有些食材取得不易，如果一昧的追求異國食材未免有捨本逐末之憾。另外店內也有一位法國師父專做可麗餅，想來也是有趣，列入下次食用清單吧。
.
二訪
👉奶油松露筆管麵：很喜歡松露味道的筆管麵，好吃到我忍不住偷偷舔了盤子。
👉油封鴨腿佐起司蛋黃麵：用又鹹又香的鴨腿取代經典的培根，有趣又好吃的蛋黃麵。
👉牛肝箘菇燉飯：不錯可以的燉飯。
👉舒肥牛小排：意外的好吃，雖然舒肥讓肉味少了幾分風味，不過店家用有趣的香料補足，讓這道料理別俱特色。
👉紙包魚：味美的紙包魚，佐以白酒、茴香與洋蔥，鮮美好吃。"
 史秉然 ,https://www.google.com/maps/contrib/101509738053598672035/reviews?hl=zh-TW,5,True,684,第一次來，不錯吃，有些餐點要先訂
 LO WU ,https://www.google.com/maps/contrib/104000286085406830839/reviews?hl=zh-TW,4,True,257,第一次來，餐廳位置算方便，鄰近捷運站，店內擺設多樣，空間感大，不會有擁擠感；蕃茄湯非常濃郁，小鮑魚新鮮搭配佐料，味道特別且口感佳，燉飯配料豐富，但較為清淡，鴨胸令人驚艷，鮮嫩好入口，搭配的娃娃菜增添口感，也點綴這份餐點，份量也夠，服務態度佳；整體而言，偶爾會去的店。
 Sumi Chou ,https://www.google.com/maps/contrib/103407178869506652940/reviews?hl=zh-TW,5,True,345,"每道優秀，價格合理，服務親切優良，環境可，推薦來品嚐很道地的地中海佳餚。

此次造訪嚐了三道菜：
1.布拉塔生起司蔬菜沙拉
沙拉葉菜新鮮、擺盤好看，布拉塔起司軟嫩口感良好，這道菜比預期中再鹹一點點，但口感是均衡的。

2.煙花女義大利麵
就是很煙花女的重口味，保留傳統會有的除了酸豆、橄欖、番茄外，意外的是居然有鮮蚵！喜歡傳統菜餚結合在地特色，吃得了稍重口感的麵可以試試。

3.香煎台灣黑豬肋眼蓋
一直以來少碰豬肉，原因是很容易處理失誤而導致口感過乾，但在這家店請放心的託付期待。
菜單上的介紹寫著「選用本地黑豬翅仔肉（每頭只取兩片），因形似羽毛且肉質鮮嫩，西班牙稱之為”Pluma”.」
物以稀為貴，這個部位取自肩部、里脊部中間兩塊片狀肉，口感軟嫩（如果有吃過鹽麴後的口感可以參照）、穠纖度恰到好處，只能用驚艷來形容第一口的感受。"
 Lin chi ,https://www.google.com/maps/contrib/102414266772879092801/reviews?hl=zh-TW,5,True,436,餐點非常道地，因為去歐洲嘗過義法料理，和在國外吃的十分相似，雖然還是有調整台灣口味，但嚐起來仍有義法料理的精髓，鴨胸跟豬肉都料理地非常鮮嫩好吃，燉飯也保留帶點硬的口感，番茄湯的鹹和在歐洲吃的一模一樣！因疫情無法出國能來嚐點道地的地中海料理，也算解點饞，非常推薦！
 Chris Chen ,https://www.google.com/maps/contrib/103974250852756400065/reviews?hl=zh-TW,5,True,132,今天試吃了一家新餐廳，餐廳裝潢近工業風。店面的飲品就是酒～～老闆擠出無酒精Mojito給我。主打義式料理，廚師是法國人，下次應該要點他的甜點試試！
 Phyllis Yu ,https://www.google.com/maps/contrib/115456242355239355714/reviews?hl=zh-TW,3,True,216,口味一般，份量對女生來說蠻多，餐點有附免費湯品！
 Flora Lin ,https://www.google.com/maps/contrib/106160453338433927090/reviews?hl=zh-TW,5,True,177,在台灣吃過最道地的義大利麵，國外主廚親自送餐點，非常親切，肉類主餐好吃的沒話說，老闆收藏的紅酒味道很棒，餐廳很像自家客廳，很接地氣
 Tseng Sara (小不點) ,https://www.google.com/maps/contrib/112954610483611848024/reviews?hl=zh-TW,5,True,18,"超厲害老闆，細心用心知道每個客戶的餐點，且都沒送錯。
大家都用心品嚐，手機還來不急享用。"
 Roy Wang ,https://www.google.com/maps/contrib/115821839970722887064/reviews?hl=zh-TW,4,True,353,點了鴨胸跟小羔羊排當主餐，食材新鮮吃得出品質好的香味（非冷凍過久又柴又無味），料理火候到味口味鹹度適中。湯品好喝，甜點一般。以裝潢跟環境整潔（重點：廁所乾淨無異味）來看，綜合來講價位合理。
 Dianne Chung ,https://www.google.com/maps/contrib/114718780590290420244/reviews?hl=zh-TW,5,True,30,"料理滿有水準，松露筆管麵、海鮮麵料多豐富，
惟服務可再精緻化一些。"
 house chen ,https://www.google.com/maps/contrib/116359530920335674963/reviews?hl=zh-TW,5,True,47,"這次用餐點了三道菜，裡面最喜歡的是花園沙拉。

新鮮花園沙拉煙燻豬肉片，裡面有大量的翠綠蔬菜和豬肉厚片，加上鮮嫩欲滴的小蕃茄，蔓越莓乾，淋上少許的義大利油醋醬，非常爽口！

煙花女義大利麵，用酸豆、蕃茄丁，橄欖油炒鯷魚末，吃起來微酸開胃！

燻肉起司蛋黃義大利麵，燻肉類似傳統的三層鹹豬肉，搭配看似濃郁卻吃起來不膩口的蛋黃醬，較鹹的燻肉加上清淡的義大利麵，搭配的天衣無縫。

店家有在街口聯名卡11月份26%回饋活動名單中，但是街口方面有問題，支付時會出現店家未加入街口，要使用街口支付的人可以先打電話和街口客服確認反應。"
 hy lin ,https://www.google.com/maps/contrib/109621309353353616772/reviews?hl=zh-TW,2,True,148,"高單價的同時感覺不到食材或是料理的價值欸。份量很小，和朋友（女）合吃沙拉，一人點義大利麵，一人點燉飯，沒人吃飽XD
這樣就超過千元了。想吃的甜點沒有就沒點。
沙拉使用的起司很特別，但可能是因為其他配料，幾口吃起來太甜，有時太鹹。
煙燻起司蛋黃手工麵的煙燻豬肉很香好吃，但是拌麵的蛋黃感覺已經結成小塊，印象中在別家店吃到的不是這個樣子，麵本身不Q也找不到特色。
朋友吃燉飯，飯的咬勁不錯，但是味道普通，還有擺盤是薄薄一層舖在平盤上，所以吃到一半就冷掉了……
感覺不到任何吸引我再訪或是推薦給別人的特點，覺得很可惜。
同樣的價位可以找到更好吃而且對食材也講究的店家。"
 Garbagemew ,https://www.google.com/maps/contrib/105975562580243883594/reviews?hl=zh-TW,5,False,4,"不走一般便宜大碗的西餐路線，給一堆麵糊調成的湯或麵包塞飽肚子，從湯品、沙拉、主餐、甜點、飲料都是單點，每類餐點選擇不多但都非常美味，食材也都很新鮮，覺得價格很剛好，環境舒適，老闆很親切
如果喜歡點主餐就附一堆小點或是希望免費續湯或不喜歡偏硬的道地義式麵條的不要去"
 鄭柏林 ,https://www.google.com/maps/contrib/102149282801803197302/reviews?hl=zh-TW,4,True,352,"餐點和湯品都很好吃，但是份量不多，出餐速度比較慢，需要耐心等待

松露筆管麵和每日濃湯必點

馬祖淡菜有海鮮的甜味，很鮮美"
 Wing ,https://www.google.com/maps/contrib/103129058464056153100/reviews?hl=zh-TW,4,True,194,CP值高也好吃，建議來之前先預訂想吃的菜，選擇比較多
 林威漢 ,https://www.google.com/maps/contrib/109318355515000512479/reviews?hl=zh-TW,5,True,232,油封鴨肉滿好吃的，最令人印象深刻的是勒眼蓋豬肉，非常軟嫩，調味也非常棒！大推！！
 Zoe Huang ,https://www.google.com/maps/contrib/109606910474013448434/reviews?hl=zh-TW,3,True,123,廚師為法國人，但這是義大利餐廳，想想吃義式餐點又離此不遠的話，可考慮到訪。
 Amma Chen ,https://www.google.com/maps/contrib/112603826056681964700/reviews?hl=zh-TW,4,True,30,餐點點了鴨胸跟豬肋眼餐點不錯吃，吃的到食物的原味，擺盤美觀，沙拉味道也不錯只是份量有點少，壽星有送一份甜點美味又好吃
 Winnie Lee ,https://www.google.com/maps/contrib/114726911351048484187/reviews?hl=zh-TW,5,True,237,牛肉番茄義大利麵彈牙好吃料好，海鮮麵蛤蜊大醬香濃，豬肉沙拉豬肉別具風味，芝麻香蕉蛋糕是完美的結束
 chen ander ,https://www.google.com/maps/contrib/105904606885274954071/reviews?hl=zh-TW,4,True,115,環境優，牛排、羊排非常嫩，感覺入口即化，真的很棒，老闆服務熱心
 Yeelon Lin ,https://www.google.com/maps/contrib/116413586078102657781/reviews?hl=zh-TW,5,True,120,"感覺很少人知道這家店？我們去的時候人很少
隱秘隱密的感覺也不錯
老闆有在帶旅遊團！老闆之前在非洲！！"
 海倫 ,https://www.google.com/maps/contrib/102328887002204550413/reviews?hl=zh-TW,1,True,27,蛋黃麵只有滿滿黑胡椒味⋯東西都偏鹹！狂灌水就飽了。實在吃不習慣！
 Gemma Wu ,https://www.google.com/maps/contrib/100161361752273973495/reviews?hl=zh-TW,5,True,96,燉牛頰真的很好吃，其他點的餐點像是沙拉、紙包魚也不錯，老闆很親切平實、樂於分享，吃得很開心的一頓晚餐。
 rong sh ,https://www.google.com/maps/contrib/114999744053748804552/reviews?hl=zh-TW,4,True,90,"義大利麵好吃，有義大利麵該有的硬口感，醬汁味道佳，油封鴨腿好吃～
環境很棒，看到店內有酒，應該算是餐酒館!
餐點都是單點，價位偏高"
 Drunk Ice ,https://www.google.com/maps/contrib/116885794917754977602/reviews?hl=zh-TW,5,True,131,拖著只愛亞洲料理的另一半踩店，每次都被念爆的我，這次平安下莊，而且還有幾句讚美，覺得感人，終於有能好好吃飯的餐廳了。
 Hsu Ron ,https://www.google.com/maps/contrib/116236395667587837053/reviews?hl=zh-TW,4,True,131,餐點都很義式，好吃～奶油松露筆管麵味道十分濃郁，值得一試！！！
 Mi Chen ,https://www.google.com/maps/contrib/100725237777683409028/reviews?hl=zh-TW,5,False,9,老闆自己招待自己料理，倍感温馨！樸實的料理跟用心的食材，是輕鬆可以小酌的地方
 HSIN YING CHOU ,https://www.google.com/maps/contrib/101892895623720328932/reviews?hl=zh-TW,5,False,12,店裡明亮整潔乾淨，餐點好吃份量足夠！
 陳彥儒 ,https://www.google.com/maps/contrib/108147890788537114960/reviews?hl=zh-TW,5,True,402,"新鮮的食材
簡單的料理
很舒服的一餐
沒想到南港有這麼棒的餐廳"
 Rita Huang ,https://www.google.com/maps/contrib/113435742146896057044/reviews?hl=zh-TW,5,True,544,"喜歡～～
默默吃了很多松露筆管麵"
 吉米 ,https://www.google.com/maps/contrib/115606097381631099982/reviews?hl=zh-TW,5,True,78,有點不顯眼，但非常好吃且道地，價格又親民，特別喜歡燻肉起司蛋黃義大利麵，濃郁且入味，食材的香氣非常協調美味，加點店家特調辣椒粉超好吃的！
 Ben Chang ,https://www.google.com/maps/contrib/104175554607409463594/reviews?hl=zh-TW,5,True,18,可以吃到好的食材和風味，還有厲害的單杯酒搭配，價位和菜色很可以；在乎cp值可以單點酒🤣🤣🤣
 Phil Liu ,https://www.google.com/maps/contrib/110185839868704611714/reviews?hl=zh-TW,5,False,12,老闆很親切，口味很道地！是南港少有的優秀義式料理～而且營業時間蠻晚的，值得推薦。
 翁紹儒 ,https://www.google.com/maps/contrib/115295091068140703617/reviews?hl=zh-TW,5,True,81,出餐快餐點好吃。平日中午點餐會附義式油醋沙拉和每日湯。份量適中。
 Michael Chang ,https://www.google.com/maps/contrib/105873844939168041676/reviews?hl=zh-TW,5,True,24,價格中間，食物調理很美味，唯一小缺點是單杯酒選擇比酒單上少很多
 周早安 ,https://www.google.com/maps/contrib/108774591770352803691/reviews?hl=zh-TW,5,True,235,"午間套餐非常豐盛，還有主廚現做可麗餅！
口味上不迎合台灣人的口味，拿捏的恰到好處。"
 Cliff Pai ,https://www.google.com/maps/contrib/100732180309539998963/reviews?hl=zh-TW,5,True,322,口味非常道地，老闆很親切，沙拉調味好美味
 BOBO HUA ,https://www.google.com/maps/contrib/111512791010287288638/reviews?hl=zh-TW,5,True,202,"2017：當家很貼心、懂酒、懂待客之道
2018：桌邊服務細心又溫馨，悄悄滿足願望，很感動...thebestmomentin2018"
 梅毅翔 ,https://www.google.com/maps/contrib/105395996935467139521/reviews?hl=zh-TW,5,True,302,絕佳的用餐時光，牛頰肉超棒的！
 Henna HH ,https://www.google.com/maps/contrib/100097473617118593006/reviews?hl=zh-TW,5,True,86,好好吃😋。海鮮超新鮮。
 Thomas Chang ,https://www.google.com/maps/contrib/115662879329590206677/reviews?hl=zh-TW,5,True,7,"義蕯格的法國人廚師，名叫Yohhan，他祖藉是俄羅斯，媽媽是阿爾及利亞人，娶了台灣老婆，在台灣餐飲界多年，跟拿了台北米其林一星的Fabien(Cocotte法式餐廳)很熟，是法式可麗餅的大師級人物。

Yohhan的可麗餅有甜的也有鹹的，口味很多樣，我非常推薦，大家可以坐捷運到南港站，來嚐嚐可以當正餐吃的可麗餅。當場現作的可麗餅，真～的～很～好～吃！

這家小店，各種料理真的很好吃，而且價格很合宜，交通又方便，沒吃過的朋友可以來嚐鮮。
小虎推薦：燉台南牛頰、松露筆管麵丶手工冰棒
T大推薦：烤豬大骨丶紙包魚丶油封大蝦丶米蘭燉飯丶煙花女蛋黃麵"
 林桓平 ,https://www.google.com/maps/contrib/107348522174124619706/reviews?hl=zh-TW,5,False,15,七人的聚餐，老闆非常親切。食物非常道地和義大利當地的口感很像，每個人都開心賦歸
 張善傑 ,https://www.google.com/maps/contrib/117653952659184522521/reviews?hl=zh-TW,5,False,9,餐點好吃也有特色，比起大部分好吃的義大利麵口味更豐富，乳酪的香氣或是酸豆的鹹酸都讓風味更上一層樓。
 ichun yeh ,https://www.google.com/maps/contrib/105024074000195990940/reviews?hl=zh-TW,1,False,5,義大利麵很鹹吃了還會拉肚子
 Josephine Huang ,https://www.google.com/maps/contrib/111809564792715033202/reviews?hl=zh-TW,5,False,1,兒子帶我們來這吃飯，聽說是法國主廚的義式餐廳，心裏有些懷疑？等看到菜單，明白了，人家明明門口說了是地中海料理麻！南法跟義式在我心中是通的啦。4人點了油封鴨蛋黃麵、兩份煙花女義大利麵、一份海鮮義大利麵、布拉塔生起司沙拉、蕃茄湯、前菜（大蒜橄欖油鮮蝦）、甜點。每道都好吃，油封鴨酥軟鹹香，蛋黃麵有好吃的鹹豬肉，煙花女說鯷魚就是鯷魚，我第一次看到沙拉給滿滿芝麻葉的，那道蝦前菜連挑食的女兒都來者不拒。歐對了，提拉米蘇，香濃潤滑，再給我一杯咖啡就完美了❤️總結，料好、實在、道地！
 jocelyn lin ,https://www.google.com/maps/contrib/110329332231578923862/reviews?hl=zh-TW,3,True,172,鴨腿好鹹，但環境寬敞很舒適
 陳志道 ,https://www.google.com/maps/contrib/112079843043949620181/reviews?hl=zh-TW,5,True,302,海鮮配料，各式主菜，品質超棒，價位合理！讚！
 Charles Chen ,https://www.google.com/maps/contrib/118444914626016501349/reviews?hl=zh-TW,5,True,61,非常好吃，很用心料理，有愛的餐點！
 Wayne Chien ,https://www.google.com/maps/contrib/105357564877428943467/reviews?hl=zh-TW,4,False,22,疫情期間老闆採取隔離了好幾桌的方式安排座位，點菜時很親切的介紹每道菜的內容，用餐很愉快。
 劉肇邦 ,https://www.google.com/maps/contrib/102059941485197426278/reviews?hl=zh-TW,5,True,88,味道很棒，環境很舒適
 Trissie Yang ,https://www.google.com/maps/contrib/105699174550742203881/reviews?hl=zh-TW,3,True,35,二訪的餐食似乎不若第一次好吃。不知道是食材還是其他問題
 Charley Cheng ,https://www.google.com/maps/contrib/118245299109734259418/reviews?hl=zh-TW,4,True,169,"米蘭海鮮燉飯裡面的蝦子中卷還有義大利米煮的飯都很不錯可惜蛤蠣有些腥味。
奶油松露筆管麵也不錯就是份量少了些。
義大利肉醬麵則有點鹹。
最後整個菜單的品項有點少，感覺稍微單調了點。"
 Kungchunlee李冠群 ,https://www.google.com/maps/contrib/108720829547888656251/reviews?hl=zh-TW,3,True,131,"6/28晚間去用餐，點了香腸義大利麵與蔬菜燉飯，以及凱撒沙拉，每一道都偏鹹，口味很重，老闆雖然解釋香腸本身是很鹹的，也忘了提醒我們，但實際上菜色本身都偏鹹是無法掩蓋的事實。
長期在外飲食，不介意吃到口味過重或太清淡的食物，但如果主打健康卻口味重成這樣，實在有點矛盾。
尤其在過了用餐完後5個小時，喝了一堆水仍然難以忘懷那個鹹味，原本想給一顆星，但結帳時老闆主動打了九折，整體服務其實也算不錯的，因此仍然給了三顆星。
真心建議，如果不喜歡吃太重口味者，這間餐廳不適合你。除非剛好我吃到的只是餐廳烹飪的意外。"
 CH tsai ,https://www.google.com/maps/contrib/108652076886622571948/reviews?hl=zh-TW,5,True,188,真材實料的好吃！
 FFMM ,https://www.google.com/maps/contrib/110338722269262853156/reviews?hl=zh-TW,3,True,368,"老闆很客氣，晚間餐點都是單點的，義大利麵加湯跟沙拉及甜點大約要6~700,裝潢很有風格但不一定會再去"
 Chung-Yuan Huang ,https://www.google.com/maps/contrib/103652213509593662113/reviews?hl=zh-TW,5,True,71,海鮮新鮮好吃，紅肉採舒肥料理法肉質軟嫩。家庭式用餐環境氣氛溫馨。
 heinrich kuo ,https://www.google.com/maps/contrib/116278853708639372516/reviews?hl=zh-TW,5,True,84,"初體驗一個人的中餐，蕃茄清湯酸度高但是清爽好喝，沙拉新鮮狀態很好，油醋醬味道也不錯，波隆那肉醬寬麵好吃，寬麵嚼勁適當肉醬份量十足味道非常好。
350元含沙拉、湯跟義大利麵真是太滿足了。
要盡快找時間來吃晚餐。"
