user_name,user_profile_url,rating,local_guide,comment_num,comment_text
 Carlos Chen ,https://www.google.com/maps/contrib/111697724717298764379/reviews?hl=zh-TW,4,True,345,"來過幾次
覺得差一點4星
（本來給3，後來改4）

分項給分
廣州炒麵4.2⭐，一定要內用！（外帶回去已經軟掉了，味道的部分還可以），內用份量感覺大不少，而且麵體很香脆，口乾很好，醬汁也是很順口不會太鹹，其他都算還不錯

三寶飯3.5⭐
味道不差，配菜也可以，但份量偏小，如果可以出個XL份量的賣個140,150應該會不錯，肉量增加加倍，不然那個叉燒幾片薄薄的真的是不過癮，個人認為燒肉>油雞>叉燒

（更）
炒牛河3.8⭐
覺得是表現更好的，味道好，牛肉也嫩，拉高平均分數

（再更）
牛肉炒麵4.0⭐
本來就覺得他的炒麵不錯，廣州炒麵是因為豬肝太老不行，牛肉炒麵就沒這個問題，牛肉鮮嫩，麵體酥脆，醬料好吃，不錯！"
 鄭小七 ,https://www.google.com/maps/contrib/116497644738724454731/reviews?hl=zh-TW,5,True,113,蔥油雞蔥香濃郁，雞皮晶瑩剔透，肉質鮮嫩；蕃茄牛肉湯鮮甜；麻婆豆腐滑嫩且入味，連調味的朝天椒醬香氣都很飽滿。
 努力不過厭世生活 ,https://www.google.com/maps/contrib/104544141048698481682/reviews?hl=zh-TW,5,True,1,"被店內用餐跟外帶的人潮吸引進去
看菜單有炒類、燒臘便當跟合菜料理
單點一些盤菜跟燒臘，還有很著名的廣州撈麵
口感很特別，而很有記憶點的金沙豆腐也不錯
非常下飯
一個人或是一群人都很適合來的地方"
 Betty Lin ,https://www.google.com/maps/contrib/113392292054138508817/reviews?hl=zh-TW,5,True,109,「廣州餐廳」是很適合個人打牙祭、多人聚餐的好地方。在這可享用特製燒臘、中式快炒、精選合菜，除了內用也可買便當外帶。料理種類繁多可供選擇，看得出主廚真功夫，且價錢實惠百元上下就能享用銷魂美味，歡迎喜歡中式料理的朋友來這品嚐，讓一天充滿元氣及活力。
 Mako ,https://www.google.com/maps/contrib/103559898468670331295/reviews?hl=zh-TW,5,True,145,"這間廣州餐廳與一般燒臘便當店很不一樣

在店裡用餐的感覺真的就像是餐廳一樣的規格

食物美味又精緻，可以感覺到老闆的用心唷！！"
 HSU Julia ,https://www.google.com/maps/contrib/114944545922566479615/reviews?hl=zh-TW,3,True,441,開很久的老店了，用餐時間客人絡繹不絕。菜色的選擇很多，今天2022.08.09中午點了一個蒜泥白肉飯，白飯減量。上菜的時候肉和菜飯是分開的，但肉片份量很少，算一算只有7片，肉下面還墊了一層厚厚的豆芽菜，這樣份量120我個人覺得並不便宜。為了增加蛋白質，加點了2顆滷蛋。
 Bonnie Huang ,https://www.google.com/maps/contrib/113691405105098662486/reviews?hl=zh-TW,3,True,322,111/6/18點了招牌飯115元，主餐叉燒和油雞都不錯，鴨肉很柴不推，配菜真的很隨便有待加強，生意不錯，動作很快，不用排隊。
 Wen Kuei Lin ,https://www.google.com/maps/contrib/110490049721168754428/reviews?hl=zh-TW,4,True,458,"廣州炒麵味道很好，麵炸到香酥脆，淋上醬汁風味獨特。只是配料有好幾片台式魚板，口感不佳。

港式燒臘拼盤$290味道也很好，底部鋪上酸菜墊底，配著燒臘一起去別有風味。冬瓜蛤蜊湯尚可，冬瓜切片沒煮透，中間部份還是硬的，都留在碗裡無法下肚。"
 艾家主婦 ,https://www.google.com/maps/contrib/105557773996594852955/reviews?hl=zh-TW,5,True,48,在地人推薦的好味道！喜歡燒臘飯的港味還有炒河粉的鍋香氣！好吃推薦！
 C'est Lizzz ,https://www.google.com/maps/contrib/115363580058930197986/reviews?hl=zh-TW,5,True,121,臘肉、肝腸味美不會死鹹，京都排骨也是鹹香醬汁不甜膩好吃，推推在地美食！
 amberogolightly ,https://www.google.com/maps/contrib/104914918673843905688/reviews?hl=zh-TW,5,False,11,還不錯，麵條很脆，但出現魚板和雞捲（？），下次要請餐廳拿掉才行
 洪芭芭Barbra ,https://www.google.com/maps/contrib/101341646727602451844/reviews?hl=zh-TW,5,True,32,大推苦瓜牛肉，牛肉軟嫩入味，搭配清脆苦瓜，爽口又下飯
 Seven Chen ,https://www.google.com/maps/contrib/114052311362826460065/reviews?hl=zh-TW,4,True,108,點了廣州炒飯粒粒分明，撈麵的料也蠻多的，下次想來點合菜試試
 小宇宙 ,https://www.google.com/maps/contrib/110251642572965552293/reviews?hl=zh-TW,5,True,769,有熱茶可以喝，這次點烤鴨，不錯吃，可以再回流的店。
 林米果 ,https://www.google.com/maps/contrib/109368770180798851819/reviews?hl=zh-TW,5,True,102,"點餐很迅速，內裡的用餐空間也很乾淨，服務很周到。
燒肉燒臘飯好吃，但對我而言還是偏鹹（個人口味偏淡，淡出鳥那種😂，一般正常人食用應是正常的），燒肉完全水準內，皮夠脆肉夠嫩。
廣州炒飯好吃，飯粒粒分明又不油，上一次吃到這樣的炒飯還是幾年前的事了😭"
 陳志鑫 ,https://www.google.com/maps/contrib/117285421684589747453/reviews?hl=zh-TW,4,True,72,"難得休假同為餐飲業廚師的我去住家附近的老店覓食進去之後發現裝潢都改了人都不認識了當然價位也上揚了不少問了一下店員據說老闆娘退休了點了一個蝦仁蛋炒飯想說試試看畢竟吃炒飯最準(內行的都知道)回家吃了一口我感覺應該連內場師傅也換了
蛋炒飯飯硬沒有蛋香加點醬油也沒有整碗都是白色的也不夠鹹沒鼎氣這樣的水準我個人認為並不符合他目前的價位但願新接手團體能夠努力加油同勉之"
 WI Lu ,https://www.google.com/maps/contrib/101468154958610613950/reviews?hl=zh-TW,3,True,23,懷念以前的65-70的價碼。現在太貴了。之前點一次滑蛋牛肉飯感覺只裝了一半而已。可惜了這幾十年的味道
 KIKI波妞麻 ,https://www.google.com/maps/contrib/118368489326696380718/reviews?hl=zh-TW,5,False,11,用餐環境很舒服，師傅炒飯做的好好吃，完全不油，味道是剛好不會吃完口渴，店家也有提供免費的香片茶，很美味的一餐^^
 賴阿拉丁 ,https://www.google.com/maps/contrib/117331782197515943559/reviews?hl=zh-TW,1,False,1,現在的廣州餐廰，完全走位，沒有港式的味到，鹹魚雞粒炒飯，真的有夠走味，建議去港式餐廳吃吃看，不會再去消費，以前是一個月總去個幾次，現在，是貴又沒品值，
 黃仁宗 ,https://www.google.com/maps/contrib/101037690275671473059/reviews?hl=zh-TW,5,False,12,蝦仁炒飯+番茄牛肉湯，番茄牛肉湯味道很優。
 劉益彰 ,https://www.google.com/maps/contrib/114358799819007545853/reviews?hl=zh-TW,4,False,21,"年輕人接班
燒臘味道，滷汁味道稍有不同
（以前味道較重現在清淡些）
但是整體還是好吃的"
 只說真話 ,https://www.google.com/maps/contrib/110552252274474610939/reviews?hl=zh-TW,3,False,18,建議老闆可以漲價一點點，配菜青菜用好一點，相信生意會更好，因為肉類還可以但配菜都很難吃，丁州路二段的上旺廣鳳燒臘肉以及配菜也不錯吃，生意自然就好。
 Reynold Hsu ,https://www.google.com/maps/contrib/108126757828820698771/reviews?hl=zh-TW,5,False,9,這裡的三寶飯超好吃(叉燒燒肉肝腸)，炒飯也是不錯粒粒分明，料和飯的比例也ok，鑊氣還行。給推!
 白white ,https://www.google.com/maps/contrib/100092077742307158719/reviews?hl=zh-TW,4,True,"1,029","店家服務親切內用有附一壺熱茶
整體口味都還不錯沒什麼雷
個人較喜歡他們廣炒麵跟叉燒飯"
 Ciara ,https://www.google.com/maps/contrib/106027860010918809537/reviews?hl=zh-TW,5,False,5,服務親切，做餐速度快😁
 Mabel Yang ,https://www.google.com/maps/contrib/116239868003647340975/reviews?hl=zh-TW,5,True,26,乾淨、好吃😋
 豪森巴 ,https://www.google.com/maps/contrib/118277159828190854731/reviews?hl=zh-TW,5,False,49,從小吃到大超級好吃！我最愛他的炒飯和廣州炒麵
 黃詳育 ,https://www.google.com/maps/contrib/101508831550744509184/reviews?hl=zh-TW,5,False,2,本店的招牌飯可以一次品嚐到三種肉的口感，肉汁甜美，不會油膩，另外推薦雞腿飯，雞腿相當的大隻，肉質Q彈，非常適合牙齒不好的老人家來品嚐，本店不僅只有燒臘部，另外還有賣炒飯、炒麵（麵是先炸的，所以脆脆的，口感特別）……等，菜單種類玲瓏滿目，除此之外本店地下室設有酒席，可以跟親朋好友聚餐，是一間CP質很不錯的餐廳👍
 王建珠 ,https://www.google.com/maps/contrib/117560750119954609436/reviews?hl=zh-TW,5,False,1,"上菜快速
餐點美味
經濟實惠
用餐環境舒適
服務快速態度佳"
 陳希傑 ,https://www.google.com/maps/contrib/109605959421663410967/reviews?hl=zh-TW,4,True,859,"#台北市中正區
#廣州餐廳
突然想吃燒臘
想吃鴨腿+有點肥的叉燒
找了一間老店
本來想去家鴻
想想那太難停車
哈哈哈"
 王奕捷 ,https://www.google.com/maps/contrib/108345911336654934477/reviews?hl=zh-TW,5,False,3,"油雞腿很好吃！
裡面還有一隻可愛貓咪"
 吳紹宗 ,https://www.google.com/maps/contrib/116266254930062681561/reviews?hl=zh-TW,4,True,685,2022.6.11(首訪）疫情嚴峻，因隔壁麵店不開放內用，信步來此店用餐，環境寬敞，桌距很大，服務很親切，帶位後會先上一壺茶，茶質不錯，給一顆星，鴨腿飯120元，口味稍淡，用餐很悠閒。
 黃楚儒 ,https://www.google.com/maps/contrib/102575795596068651504/reviews?hl=zh-TW,4,True,310,"三寶飯中規中矩還算順口
雞鴨飯給的是都是雞腿這點要加分
而且與其他燒臘相比算比較不油膩的
來附近想吃燒臘又不想負擔太大是平穩的選擇👍"
 蔡佳勳 ,https://www.google.com/maps/contrib/106050831930700346378/reviews?hl=zh-TW,4,True,849,廣州炒麵好吃!上面的淋醬很香，也很開胃！內用會附熱茶。
 陳亞米 ,https://www.google.com/maps/contrib/101960599874801101459/reviews?hl=zh-TW,5,False,1,配菜多樣化不會重鹹好吃
 oakley Lee ,https://www.google.com/maps/contrib/101261370702870823011/reviews?hl=zh-TW,4,True,97,"不談外送，個人情緒，突發狀況的一隻好吃懶惰美食豬

顆星
口味：4.5
環境：3.5
價格：4
服務：4.5
平均：4"
 Jocy Wang ,https://www.google.com/maps/contrib/107806730858018812234/reviews?hl=zh-TW,3,True,240,燒臘味道很好，雞肉軟嫩嫩，廣州炒麵料多，只可惜價格年年漲，一盤要120
 Eunice Wu ,https://www.google.com/maps/contrib/111844352345576606337/reviews?hl=zh-TW,5,False,32,燒臘口味很不錯，個人很喜歡酸菜，很解膩，撈麵也很好吃～
 Elena Tsai ,https://www.google.com/maps/contrib/108717415531694440319/reviews?hl=zh-TW,4,True,318,店家特調的醬汁有淡淡的中藥香氣滿特別的，也因此是不提供油蔥的喔，燒腩酥脆口感佳，配菜可再精緻一點，覺得都是有點廉價的配菜，飯的份量不多。
 ha ha ,https://www.google.com/maps/contrib/117031914768647628448/reviews?hl=zh-TW,1,False,1,"廣州炒飯沒有加鹽巴==
我還以為我確診
我去吃鹽巴有鹹味
嚇死我"
 江愛坤 ,https://www.google.com/maps/contrib/111739966049235506125/reviews?hl=zh-TW,5,True,740,"裝潢變的不一樣
服務依舊很優
內用主動提供熱茶
上餐迅速
餐點都蠻重口味
配料也大方給足

以下為舊文
炒牛肉河粉不錯"
 趙小士 ,https://www.google.com/maps/contrib/114804786761406682401/reviews?hl=zh-TW,4,True,75,在地70年以上的老店，雖然是屋齡超過40年以上的店面，但店內的圓桌與方桌仍能讓人在用餐時有種回到50年代的感覺，道地的港式料理值得老饕們光顧。
 Teresa Sun ,https://www.google.com/maps/contrib/109365271060586873792/reviews?hl=zh-TW,1,False,6,從小吃到大，現在的餐點和以前完全不能比。主菜肉品還過得去，配菜慘不忍睹。
 Kuang jen Yang ,https://www.google.com/maps/contrib/110531368721630959008/reviews?hl=zh-TW,4,False,158,我點廣州炒麵內用，味道不錯，感覺是老店，用餐環境衛生非常舒適。在南機場很少有這樣的餐廳，我一定會在去消費
 李月英 ,https://www.google.com/maps/contrib/109288671204520924943/reviews?hl=zh-TW,5,False,1,叉燒跟燒肉都好吃
 廖如真 ,https://www.google.com/maps/contrib/118137565201333299669/reviews?hl=zh-TW,5,False,1,師傅炒功一流，色香味俱全
 蘇媚妍 ,https://www.google.com/maps/contrib/105459575091285010180/reviews?hl=zh-TW,5,False,1,蕭厚呷外帶一樣風味不減
 李研懷 ,https://www.google.com/maps/contrib/101167051039058266101/reviews?hl=zh-TW,5,True,66,換裝潢有新氣象，但牛肉炒飯還是好吃
 陳麗媚 ,https://www.google.com/maps/contrib/111455698897934240812/reviews?hl=zh-TW,5,False,1,之前吃過一次之後就常常來光顧
 蕭吏淳 ,https://www.google.com/maps/contrib/106638445549991254303/reviews?hl=zh-TW,5,False,8,"今天點了牛肉河粉，加了小辣非常夠味！
值得再光臨！"
 林小小佳慧 ,https://www.google.com/maps/contrib/103815339800239055735/reviews?hl=zh-TW,5,True,39,小時候吃的到現在還是超好吃(老店)
 陳宇庭 ,https://www.google.com/maps/contrib/101385636951800162962/reviews?hl=zh-TW,5,False,1,便當好吃飯多菜好吃很下飯
 言思齊 ,https://www.google.com/maps/contrib/107581292538224848635/reviews?hl=zh-TW,5,False,7,物價飛漲的年代，這裡彷彿時間暫停，口味佳價格合理，很適合日常光顧。
 林姍姍 ,https://www.google.com/maps/contrib/115825009907542348078/reviews?hl=zh-TW,5,False,1,熱茶好喝有溫暖的感覺
 Wayne Yang ,https://www.google.com/maps/contrib/115746731423927839325/reviews?hl=zh-TW,3,True,959,"主菜不錯，配菜很不怎樣。
若定義為一間便當店的話則還可以。
期待有所改善囉！"
 起子內內內 ,https://www.google.com/maps/contrib/117508170054790984196/reviews?hl=zh-TW,5,False,2,在這邊點過廣州炒麵，滑蛋牛肉飯，蔥爆牛肉飯都很好吃，順口還而且嘴裡留香🥰
 葉宜君 ,https://www.google.com/maps/contrib/104599208492581918648/reviews?hl=zh-TW,5,False,1,餐點美味可口價格也不貴
 Yiwei Chang ,https://www.google.com/maps/contrib/101977854865069051234/reviews?hl=zh-TW,5,False,2,廣州炒麵料多
 盧禹晴（阿晴晴） ,https://www.google.com/maps/contrib/109691596175430329868/reviews?hl=zh-TW,5,False,5,東西好吃，服務人員態度很好
 JB ,https://www.google.com/maps/contrib/100231682313549258593/reviews?hl=zh-TW,5,False,4,最近重新裝潢過，環境乾淨，東西好吃、老闆很親切！大推！
 Cheng-Zong He ,https://www.google.com/maps/contrib/101089116027094205787/reviews?hl=zh-TW,4,True,244,"份量稍少口味不錯烤鴨能在酥一點

附茶"
 吳植安 ,https://www.google.com/maps/contrib/115957827099413596869/reviews?hl=zh-TW,5,True,50,從國中吃到現在，算是用料實在的燒臘店，很推薦八珍豆腐羹&滑蛋牛肉飯
 陳雨潔 ,https://www.google.com/maps/contrib/113934505040211285991/reviews?hl=zh-TW,5,False,1,出餐動作快服務態度不錯
 羅紫君 ,https://www.google.com/maps/contrib/105590630845244665870/reviews?hl=zh-TW,5,False,1,炒飯很入味，香氣十足
 王彩萍 ,https://www.google.com/maps/contrib/111955606120454055048/reviews?hl=zh-TW,5,False,1,內容物完全對的起價格
 陳美嬌 ,https://www.google.com/maps/contrib/117506862183307050316/reviews?hl=zh-TW,5,False,1,味道不錯用餐環境佳
 陳兔子 ,https://www.google.com/maps/contrib/110337878242981779372/reviews?hl=zh-TW,5,False,5,蔥爆牛肉燴飯好吃
 Glory Andy ,https://www.google.com/maps/contrib/103212126537838880794/reviews?hl=zh-TW,5,True,145,很好吃呢😋喜歡燴飯
 Tommy ,https://www.google.com/maps/contrib/111204314645120534398/reviews?hl=zh-TW,2,True,"2,562","原本看了菜單
店家有一些熱菜大菜
想說味道應該不會太差
牛燴味道尚可
燒臘的部分鴨腿肉質偏硬皮不脆
燒肉則是烤到過乾過硬
沒有提供油蔥
醬汁也不若鳳城那般入味跟下飯
燒臘部分真的不是很優"
 曉詩李 ,https://www.google.com/maps/contrib/105953495374574458716/reviews?hl=zh-TW,5,False,1,主、配菜水準兼具
 陳殷芳 ,https://www.google.com/maps/contrib/110915985158777161874/reviews?hl=zh-TW,5,False,1,店家態度親切，生意很好
 minyu li ,https://www.google.com/maps/contrib/106168370576118037039/reviews?hl=zh-TW,2,True,25,"給2顆星是因為東西還算不錯
但是因為剛去買了2個雞腿跟玉米湯，還有本來我點牛肉炒河粉但立刻改廣州炒河粉，可是老闆沒注意到我是要改成廣州，害我本來應該390元最後付了510元多花120元，結果我最後多的也就丟掉了"
 Joanna Tai ,https://www.google.com/maps/contrib/106319228269967951967/reviews?hl=zh-TW,4,True,594,炒粉好吃服務人員親切環境乾淨
 李珍珊 ,https://www.google.com/maps/contrib/111064511317221323729/reviews?hl=zh-TW,5,False,1,挑嘴的我都給過真好吃
 廖淑美 ,https://www.google.com/maps/contrib/102124921402951650435/reviews?hl=zh-TW,5,False,1,值得推薦的燒臘便當
 呂玉梅 ,https://www.google.com/maps/contrib/113883223075594480080/reviews?hl=zh-TW,5,False,1,店面乾淨明亮食物好吃
 嚴心儀 ,https://www.google.com/maps/contrib/110116374294916497976/reviews?hl=zh-TW,5,False,1,價格實惠，份量十足
 lee ping ,https://www.google.com/maps/contrib/113293138122476759746/reviews?hl=zh-TW,4,True,360,滑蛋牛肉跟什錦湯麵都不錯
 陳淑芹 ,https://www.google.com/maps/contrib/109609648768253634972/reviews?hl=zh-TW,5,False,1,真心覺得好吃推薦各位
 李美淑 ,https://www.google.com/maps/contrib/113557342009408014452/reviews?hl=zh-TW,5,False,1,白飯香Q配上主菜完美搭配
 賴惠文賴惠文 ,https://www.google.com/maps/contrib/105000832870468276412/reviews?hl=zh-TW,5,False,4,環境乾凈，味道好
 蕭美茵 ,https://www.google.com/maps/contrib/106495315356300390510/reviews?hl=zh-TW,5,False,1,肉新鮮好吃，強力推薦
 楊淳如 Rebecca ,https://www.google.com/maps/contrib/100794240187298317777/reviews?hl=zh-TW,5,False,8,從小吃到大的美味~
 Aaron Yuan ,https://www.google.com/maps/contrib/106728768908287731794/reviews?hl=zh-TW,2,True,25,老字號燒臘店，以前味道很好，不知是否師傅換了，今天外帶滑蛋牛肉飯，味道跟品質跟以前差很多，變成滑蛋牛肉湯泡飯....
 江宏 堯 ,https://www.google.com/maps/contrib/109744161817028490177/reviews?hl=zh-TW,5,False,52,"好吃，分量很多
我太太跟小朋友合吃廣州炒麵還會很飽。
老闆服務也很親切。
還很貼心提供一整壺的茶水。"
 陳玉香 ,https://www.google.com/maps/contrib/103867415365242198322/reviews?hl=zh-TW,5,False,1,各種燒臘都很好吃
 黃鼎鈞 ,https://www.google.com/maps/contrib/116703018928311631501/reviews?hl=zh-TW,1,False,1,以前不錯不知是否廚師換人。廣州炒麵味道變了，外帶未分裝，整碗軟爛死鹹
 毛小君 ,https://www.google.com/maps/contrib/111878967922233587756/reviews?hl=zh-TW,5,False,1,不油膩很好吃
 小蘋許 ,https://www.google.com/maps/contrib/115447163879633382968/reviews?hl=zh-TW,5,False,6,蔥爆牛肉
 Ray ,https://www.google.com/maps/contrib/105474050922990678245/reviews?hl=zh-TW,1,True,778,"2021/7又漲價了，燒肉飯竟然要100元，CP值越來越低
燒肉、燒鴨、叉燒、炒飯味道還可，但燒鴨常給骨頭多的角料，炒飯份量有點少"
 Umar Turdiev ,https://www.google.com/maps/contrib/103349730885890883061/reviews?hl=zh-TW,1,False,2,"完全不推薦，老闆娘態度極差，我只是問她「鴨肉飯的鴨肉可不可以不要切，因為碎骨頭會掉到飯裡。」然後老闆娘就擺著臭臉說「不切就不切啊！」這是什麼態度？我從頭到尾好好的講，不管你是不能切還是不爽切，那你就說不行，我就不要買就好了啊！這是一個正確對待客人的方式嗎？
**老闆娘如果你讀到這則評論，請你回答！**"
 Bruce Wang ,https://www.google.com/maps/contrib/117662915151199394231/reviews?hl=zh-TW,4,True,538,燒臘的味道還不錯，不過快餐的配菜不僅份量少，口味也單調跟普通，只能給三顆星。配菜有改善，四顆星。
 汪巧雲 ,https://www.google.com/maps/contrib/118214927235213634845/reviews?hl=zh-TW,5,False,1,真材實料廣州炒麵
 kk beer ,https://www.google.com/maps/contrib/106688037940632341096/reviews?hl=zh-TW,5,True,226,炒飯好吃，有鍋氣
 蔡碧娥 ,https://www.google.com/maps/contrib/105832347966553769606/reviews?hl=zh-TW,5,False,1,三寶飯主菜、配菜不錯喔
 周傑特 ,https://www.google.com/maps/contrib/115424834228264075131/reviews?hl=zh-TW,5,True,"2,398",料好實在在地好店
 Chi史東 ,https://www.google.com/maps/contrib/108236970095083056615/reviews?hl=zh-TW,5,True,"1,606","三寶飯還不錯
就是骨頭有點多"
 Yu-Shen Liu ,https://www.google.com/maps/contrib/102128724345685127648/reviews?hl=zh-TW,5,True,138,從小吃到大！滑蛋牛肉飯三寶飯都是我的愛老板也老了不切肉了交給徒弟味道一樣
 楊明 ,https://www.google.com/maps/contrib/108092415465964427656/reviews?hl=zh-TW,4,False,732,燒鴨淡淡的中藥五花香，燒肉脆脆的，調味剛剛好，只是份量不夠，男生可能要加飯才會飽喔!
 李怡潔 ,https://www.google.com/maps/contrib/114779514558007352753/reviews?hl=zh-TW,5,False,1,便當菜色豐富美味
 蘇彩麗 ,https://www.google.com/maps/contrib/117640906557437666797/reviews?hl=zh-TW,5,False,1,平價美食真佛心
 Allen KU ,https://www.google.com/maps/contrib/106949730882724266905/reviews?hl=zh-TW,1,False,1,"吃個最普通的燒鴨燒肉飯，比一般的燒臘店稍貴，燒鴨瘦的皮下無肉俗稱皮包骨，燒肉全肥肉。
拿邊邊角角捨不得丟的做給過路客。老闆娘像欠她錢似的臭臉，這輩子不會再去了。"
 林阿翔 ,https://www.google.com/maps/contrib/108166422012299086575/reviews?hl=zh-TW,4,True,217,除了空間環境老舊一點，餐點口味都很好吃，推薦大家可以去品嘗，店家人也很親切
 許朝屹 ,https://www.google.com/maps/contrib/101400877076830280562/reviews?hl=zh-TW,1,False,3,字可以寫好看點，一群人點根本看不出來這是什麼
 James Huang (西狂) ,https://www.google.com/maps/contrib/115982711963304300407/reviews?hl=zh-TW,4,False,2,今天辛苦了!~祝生意興隆
 Chioutung Wu ,https://www.google.com/maps/contrib/107576372887293782673/reviews?hl=zh-TW,4,True,45,萬華地區少數用餐環境清幽價格合理.臘味料理皆是自行滷製風味佳.是用餐聚餐好地方。
 吳季涵 ,https://www.google.com/maps/contrib/115570972828687413313/reviews?hl=zh-TW,5,False,8,除了燒臘，撈麵和公仔麵也炒的很好吃。態度親切。
 KaiKai A- ,https://www.google.com/maps/contrib/101620061740238749690/reviews?hl=zh-TW,3,True,780,物價飛漲前的配菜跟三寶都很好吃，不過現在的配菜就稍微變差了點，但是燒臘叉燒都還是不錯吃!
 Garfield Lins ,https://www.google.com/maps/contrib/111365333945245974028/reviews?hl=zh-TW,3,True,227,環境佳，價錢實惠，只吃過牛肉燴飯跟撈麵，會再來嘗試其他餐點
 呂美君 ,https://www.google.com/maps/contrib/116438254229373688568/reviews?hl=zh-TW,5,False,1,叉燒好好味!!!!
 鄭佐民 ,https://www.google.com/maps/contrib/104082101374202307030/reviews?hl=zh-TW,5,True,23,東西好吃雖然有點鹹，但茶剛好彌補這一點，工作人員態度佳，但就是貴了點但值得
 Keith Kuo ,https://www.google.com/maps/contrib/108379523068974188359/reviews?hl=zh-TW,3,True,103,味道、食材等等都算是非常優秀，只可惜份量有點少，不過仍算是不錯的選擇
 陳文馨 ,https://www.google.com/maps/contrib/104606387072105463394/reviews?hl=zh-TW,5,False,1,師傅手藝很好
 時は止まる! ,https://www.google.com/maps/contrib/115257633738827608173/reviews?hl=zh-TW,3,False,41,在地果腹的餐廳，沒有期望就不會失望。
 vinci da ,https://www.google.com/maps/contrib/113662855878632917706/reviews?hl=zh-TW,3,True,108,"份量有點越來越少,店內用餐有附壺茶可喝"
 Tsutang Chen ,https://www.google.com/maps/contrib/114831518379734558072/reviews?hl=zh-TW,5,True,422,最近發現菜色很有進步，快餐、合菜、點菜價錢都仍然合宜。
 林明璋 ,https://www.google.com/maps/contrib/116612831275161348117/reviews?hl=zh-TW,4,True,874,口味道地，服務親切，假如重新裝潢一定生意做不完！（廣州炒飯推）
 錢志裕 ,https://www.google.com/maps/contrib/103468037150821543460/reviews?hl=zh-TW,5,False,2,衛生、美味、可口
 馬中和 ,https://www.google.com/maps/contrib/112353874209518660620/reviews?hl=zh-TW,4,False,37,好吃，價位OK，停車較不方便。
 Chaojen Hsiao ,https://www.google.com/maps/contrib/106342835502193399378/reviews?hl=zh-TW,4,True,289,最愛牛肉燴飯，肉嫩滑香甜，疏菜搭配恰到好處，如有訂桌需等侯
 timhigh bot ,https://www.google.com/maps/contrib/112216466481604172029/reviews?hl=zh-TW,4,False,7,價格偏貴但是可以吃飽，內用附有熱茶，推薦招牌飯與東坡飯。
 E. Li ,https://www.google.com/maps/contrib/116755315995818147007/reviews?hl=zh-TW,5,True,109,常去，地道香港菜。服務非常親切👍🏻，座位舒服。就算你一個人來，也有招待的一壷熱茶☺️
 Jay a ,https://www.google.com/maps/contrib/116841859971272113968/reviews?hl=zh-TW,4,True,169,快餐真的快又好，茶水也來很快，只是茶有時冷了點
