user_name,user_profile_url,rating,local_guide,comment_num,comment_text
 Mia Huang ,https://www.google.com/maps/contrib/112974115287116112555/reviews?hl=zh-TW,5,True,15,"朋友生日來到美人兒黃晴推薦的餐廳「Muzeo」，當天四人用餐，把主食全點了～結果服務人員相當貼心的對我們說：這樣份量會太多哦^^所以只好先捨棄溫野菜，畢竟我們喜歡大酒大肉的！

首先，雞肝西米露脆餅登場，以西米露制成的脆餅搭配濃郁的雞肝醬，一入口…對座的朋友頻頻點頭，我想我訂對餐廳了☺️☺️

接下來，法義麵包籃、胡蘿蔔濃湯及主食酥炸松露薯條、蘑菇爆鮮蝦(辣)、芋泥油封鴨、炸雞豆乳、炭烤東北小卷、洛克菲勒焗烤生蠔、澄清奶油蟹肉堡陸續上桌，其中無雷～特別推薦「芋泥油封鴨」，酥脆外皮裹著細緻的芋泥及鴨肉，佐上松露芋泥醬，另外附有鹹蛋黃醬可供沾取。此菜色相當令人驚豔、回味無窮～

肉食的部分有14天鴨胸、伊比利老饕上蓋肉、牛排及當日的隱藏菜單「牛小排義大利麵」，各道料理後的口感彈嫩、香氣十足，皆相當有水準。
搭配當天挑選奶油氣息的Chardonnay，圓潤順口且餘韻悠長。

最後以開心果提拉米蘇結束美好的一餐，蛋糕綿密細緻，融合著酒香及堅果香氣，每一口都是幸福！

餐廳價位為中價位，若想和朋友約會、慶生及家人聚餐，都非常合適🧡"
 YOGG ,https://www.google.com/maps/contrib/101207210109972130874/reviews?hl=zh-TW,3,True,114,"-前菜酪梨鮮蝦水準之上，麵包的口感也很搭
-芋泥油封鴨包口感特殊，味道也還行
-覺得吃下來最好的大概是蟹肉三明治，對蟹堡也另一種詮釋，值得一試

-Alacarte的部分，牛肉義大利麵味道普通，豆瓣醬甚至有炒焦的傾向，價位高份量少到只能裝一半，擺盤令人完全不理解
-雞肝西米露餅再搭配上沒有掩蓋雞肝的腥味，口味不能接受的搭配
-甜點開心果提拉米蘇，鮮奶油過於油膩掩蓋開心果的氣味，全無蛋糕體的口感更是令我失望

調酒部分有水準以上還是建議可以嘗試
整體來說不太會去用第二次晚餐，也許他會考慮前菜配酒的宵夜地點，但價位還會考慮一下"
 Renee Hung ,https://www.google.com/maps/contrib/107385062094287837954/reviews?hl=zh-TW,4,True,17,"🥑酪梨蝦$290
🐙火烤透抽沙拉$290
🦆芋泥油封鴨$360
🍝紅蔥牛油牛排麵$520
🐔炸雞豆乳$390
🥩伊比利老饕上蓋肉$920

隱藏菜單牛排麵的紅蔥牛油醬汁很厲害！味道相當濃郁，帶有微辣越吃越涮嘴，上桌兩分鐘清盤（笑）切片牛小排口感軟嫩，鳥巢麵軟硬度也恰到好處。

當天最喜歡芋泥油封鴨！神似小餃子的可愛外型，酥脆外皮內有滿滿綿密芋泥，還帶點松露香氣～吃得到小碎塊鴨肉，整體搭配意外很和諧，芋泥控一定會喜歡！

餐點份量比較精緻，需要多點幾道才能吃飽。酒類選擇豐富，沒有用餐時間限制，三五好友聚會可以聊得盡興～"
 Bryan Shen ,https://www.google.com/maps/contrib/102738874166625428157/reviews?hl=zh-TW,4,True,219,"〈酪梨蝦〉$290
酪梨蝦給的份量還算是充足，蝦子的部分會去殼切段，讓人可以一次小口小口的吃到每隻蝦子的鮮味及酪梨的香氣與甜味。

〈火烤透抽沙拉〉$290
無特別有印象的記憶點，但還不錯吃。

〈芋泥油封鴨〉$360
芋泥油封鴨真的是一絕，外面包裹著酥脆的外衣，裡面一口咬下撲鼻而來的松露味難以抵擋，再來是芋泥非常綿密，還可以吃到一點點鴨肉的碎塊增加香氣與口感。

〈紅蔥牛油牛排義大利麵〉$520
牛排義大利麵的醬汁令人難忘，肉質的部分也是非常軟嫩，不會有乾柴嚼勁難咬的情況發生。

〈炸雞豆乳〉$390
炸雞不錯，但沒有什麼亮點，吃起來有點像是夜市的無骨鹽酥雞。

〈伊比利老饕上蓋肉〉$920
伊比利老饕上蓋肉吃下去的口感與牛肉相差無幾，軟嫩到我以為這是牛肉，一口咬下的感想是先彈再脆，接著軟嫩的口感一路到咀嚼吞下，必點。

唯一缺點：綜合來講份量偏少。"
 YiYun Wang ,https://www.google.com/maps/contrib/114227986906904164048/reviews?hl=zh-TW,5,True,53,"食材非常新鮮，每道菜都很驚豔很有特色，而且上菜速度剛剛好，都是吃完一道菜後另外一道菜沒過多久就上了，服務生態度也很好，聽到我們之後還有行程，還幫我們趕下一道菜的上菜時間。
我們一致認為最好吃的事有一道芋頭的料理，雖然第一口有點燙，但每一口都很扎實，一點都不會膩。湯也很好喝，一開始我們只點了一碗，還加點第二碗，三個人分兩碗其實剛剛好，才不會光喝湯就飽了。
這件的酒也很好喝，我們點了三杯調酒，喝起來都很順，香氣也夠。
下次會再回訪，也會介紹朋友一定要來吃！！！很適合情侶家人節日聚餐，餐廳座位不算太多，建議訂位再來訪，餐廳內燈光較暗，不是非常適合拍照～～～"
 佛手姐姐 ,https://www.google.com/maps/contrib/116497886997509300910/reviews?hl=zh-TW,4,True,73,"以中高價位的餐館來說整體處於基本水平，先從失望部分說起，從進門領檯誤會已經先入座的客人是我的朋友，讓我尷尬了一下，再來上餐時手觸碰到我的餐具且裝作沒事，（畢竟現在全球疫情又敏感，這個小動作顯得不專業），廁所清潔很差，這個「很差」是來自於不符合自身品牌定位，垃圾桶爆滿堆到地上、馬桶周遭到處水漬，體諒餐飲業能熬過疫情已經很不容易，人力減縮了吧。

雖然很多可以更好的地方，但就產品而論絕對值得滿分，開胃菜另人驚豔，甚至贏過相比起來保守的主餐，有機會還是會再訪的。"
 Chen Chen ,https://www.google.com/maps/contrib/102047286561858709596/reviews?hl=zh-TW,1,True,143,內部裝潢看起來很高檔，但是食物沒有達到預期水準。五個人吃了一萬多，點了蠻多道。蝦子藥水味有點重。蟹肉飽的麵包有種超市麵包，讓我想起小時候福利社賣的蛋沙拉麵包。濃湯配的麵包太硬。油封鴨的鴨肉切的很小，沒感覺到鴨肉的味道。感覺大量使用醬汁來營造味覺，但是醬汁的味道跟主菜不太搭，例如牛排搭配的奇怪黑黑的醬(我覺得味道很像芝麻醬)，不小心沾到就GG。不搭嘎的炸牛絲也一直出現。烤小卷有些焦味。燉飯也是感覺太生了，這應該不是歐式的生是感覺沒熟。餐菜單沒有套餐所以都是分食，有些菜色一定要公用刀叉切，但是店員沒有提供分食工具還要特別問，換盤子也不是很勤快。裝盤也蠻特別有的菜裝半邊，視覺上效果有點凌亂。感覺好吃的有烤生蠔，干貝，豆乳雞這三道，鴨胸&牛排肉質還不錯但是醬汁又批怪。甜點看似很有創意的但是味道不和諧，大酸又大甜。開心果提拉米蘇也沒有很愛，我只想要傳統提拉米蘇！感覺不太符合這個價格的期待。不過這裡沒有限制用餐時間。可以聊天到很晚！外面的煙味有時候會飄進來。
 林東東 ,https://www.google.com/maps/contrib/110245729878565028325/reviews?hl=zh-TW,4,True,78,"份量都偏精緻少量

滿適合約會用餐、慶生、小酌
當天點了

酪梨蝦（酪梨很清新爽口）
🌕🌕🌕🌕🌖
芋泥油封鴨（特別的一道）
🌕🌕🌕🌕🌕
炸雞豆乳（嗯……）
🌕🌕🌕🌑🌑
洛克菲勒焗烤生蠔（soso）
🌕🌕🌕🌑🌑
開心果提拉米蘇(還不錯)
🌕🌕🌕🌗🌑
隱藏版：牛排麵（特色料理）
🌕🌕🌕🌕🌖"
 YH Huang ,https://www.google.com/maps/contrib/107571508820055914458/reviews?hl=zh-TW,3,True,139,"表現平平，沒有什麼特別出色的餐點，
調酒還算可愛，但沒有特別好喝。

硬要選的話，
芋泥油封鴨、酪梨蝦還算可以。"
 hemin huang ,https://www.google.com/maps/contrib/109272771449193184986/reviews?hl=zh-TW,3,True,196,"點了酪梨鮮蝦、芋泥鴨封、干貝青醬燉飯、主餐選圓鱈干貝龍蝦汁
最推芋泥鴨封，沾蛋黃醬真的很不錯👍🏻👍🏻👍🏻
燉飯米心也表現的很好👍🏻

但其他品項我都覺得普通，沒有不好吃，但有種家常菜的感覺

這樣點下來2000多，2個人都有吃飽，但也覺得這個表現不便宜"
 隋先生 ,https://www.google.com/maps/contrib/103573840567040650419/reviews?hl=zh-TW,5,True,49,"扣掉酒錢的話大約800/人
最喜歡的菜是
龍蝦蟹肉三明治，連外層的麵包都有小巧思。
芋泥油封鴨是炸餛飩的方式呈現，分數算高。
第一個脆片的開胃菜也是超級推薦。

肉品的話，比較推老饕豬肉！"
 林凱西 ,https://www.google.com/maps/contrib/103804701488627582763/reviews?hl=zh-TW,4,True,5,朋友生日來Muzeo慶生，整體氛圍感很好，環境乾淨也安靜，酒類很多種類可以選擇，當天喝的白酒蠻順口！唯一小缺點要注意就是餐點比較精緻大概都一人份量，如果三五好友一起來的話，建議點多道菜分食。
 Minna Kao ,https://www.google.com/maps/contrib/105338504553060516735/reviews?hl=zh-TW,5,True,131,"餐點都很優秀，鹹淡適宜！
店家的創意調酒味道很協調，重要的是都很清爽好喝，今天喝了三杯，都很喜歡💗
重要的是在餐酒館來說價格很宜人～
相當推薦！"
 楊善妤 ,https://www.google.com/maps/contrib/116543782387425611774/reviews?hl=zh-TW,4,True,109,"這邊的份量都是小小的，所以可以點多一點，不然吃不飽😂或是去別的地方吃了
主餐的牛排個人覺得很普通，沒有很推薦，比較喜歡魚的部分，燉飯印象中還不錯，可以試試看～～
前菜部分還算中規中矩，沒有特別好吃或是不好，唯一覺得不推應該是很像洋芋片黑黑的那個😂濃湯蠻濃郁，喝了兩碗還不錯👌
這邊最愛的應該是酒水了，都剛好是我喜歡的
最後甜點部分也挺好，因為蠻特殊的，在外面其他地方很難吃到像這樣的甜點"
 MF Hsieh ,https://www.google.com/maps/contrib/112188867172724512318/reviews?hl=zh-TW,4,True,289,"每一道菜都好吃！蘑菇炒得很好；麵包挑選的也好、烤得脆脆熱熱；圓鱈真的是圓鱈，非常Q彈，而且表面煎得很脆；伊比利豬處理得偏軟，如果部位再挑得更Q彈一點會更好；加點的三明治應該是近來吃到的第一名！
唯一的缺點~~份量很小XD
喔~~單杯酒如果可以多一點選擇，甚至提供3杯setwinepairing，應該更可以搭你們的餐、提高客單價！"
 Daphne Jen ,https://www.google.com/maps/contrib/114511486705667913440/reviews?hl=zh-TW,4,True,151,"339千層麵
320開心果提拉米蘇

千層麵口味還行，附餐的濃湯好喝，沙拉新鮮。
提拉米蘇包裝很用心，店員包了一包冰塊放在提拉米蘇下面保持溫度，有機會會想到店裡用餐看看～"
 Cindy Huang ,https://www.google.com/maps/contrib/110866042292301291042/reviews?hl=zh-TW,3,True,12,"普普通通。
但也有可能是因為我是庶民嘴。
前菜是雞肝西米露脆餅，是最吃不懂的一道料理，一口咬下去又酸又甜又脆又軟，很奇妙的口感，就像把所有好的元素集合卻吃不吃美味。不確定是自己不習慣還是真的有腥味，每吃完一口都要配一杯水整頓一下口腔，想多給這料理一個機會，但第二片最後一口真的無法勉強自己吃完。
第二道芋泥油封鴨，很少吃芋頭，和評價中一樣的好吃，芋泥很綿密，而且芋頭味不會到很重。綿密程度就像去日式料理店的可樂餅內餡一樣的超級綿密而不膩，但也同時因為夠綿密其實不知道鴨肉藏在哪。但不追究鴨肉的話，單就味道來說很不錯，搭配的特條南瓜醬也不錯。
義大利麵就是義大利麵，中規中矩的好吃。"
 Alice Chen ,https://www.google.com/maps/contrib/117865204132793918032/reviews?hl=zh-TW,4,False,4,"焗烤生蠔真的很好吃，推推！
外面很多焗烤生蠔因為進烤箱加熱，生蠔會偏乾口感不好，所以有被生蠔還保持著Q嫩的口感以及鮮味驚艷到、所以後來又加點了一次😂

調酒與甜點也都還不錯，但主餐份量偏少
店內服務很好，整體用餐體驗不錯"
 Carolina Zeng ,https://www.google.com/maps/contrib/102285534764443610802/reviews?hl=zh-TW,5,True,708,"芋泥油封鴨真的是必點～還有濃濃的松露香！
小卷也很好吃，旁邊的醃漬東西有點辣，但搭起來很不錯！
豆乳雞中規中矩～
米香好拍也好吃！
環境也寬敞有氣氛，推推！"
 Elsa Lin ,https://www.google.com/maps/contrib/112067106879604587403/reviews?hl=zh-TW,5,False,16,"當天點的每道菜都不錯，尤其是芋泥油封鴨！
Winepairing每杯也很順口，唯獨牛排有點冷，如果是熱的會更好吃。以這個價位來說整體cp值算高了～店員服務也很周到"
 S L ,https://www.google.com/maps/contrib/110711282777530745077/reviews?hl=zh-TW,5,True,14,環境氣氛及餐點表現都在水準之上，店員推薦的酒單和當天的餐點搭配的恰到好處。是一頓視覺、嗅覺及味覺皆感到滿足的一頓晚餐。
 WENDY CHEN ,https://www.google.com/maps/contrib/117430401467916041637/reviews?hl=zh-TW,4,True,189,"最喜歡14天鴨胸軟嫩入味
那天點的每日濃湯是紅蘿蔔濃湯
紅蘿蔔味很濃郁翔天蠻好喝
最期待開心果提拉米蘇
但吃起來感覺開心果的味道不夠重
整體來說餐點份量都蠻精緻的
兩個人也點了7樣餐含湯品
用餐環境氣氛不錯
桌距滿開的所以聊天不會很吵雜"
 Hsuan-Chih Kuo ,https://www.google.com/maps/contrib/108723021762919627011/reviews?hl=zh-TW,5,True,289,前菜小點雞肝慕斯鬆脆餅，有雞肝的鮮鬆脆餅的部分提供好的口感；海鮮熟度很棒搭配的醬汁果香酸香提味；海鮮的部分魚和干貝熟度可以說完美，油脂多的部分軟嫩煎的部分微微酥香，搭配的醬有濃郁的蝦味海味，這道滿喜歡的；燉飯的部分米心偏硬，是我喜歡的硬度，半熟蛋讓入口滑潤；伊比利老饕肉的部分熟度也非常好，外頭有煎的焦香的部分，裡頭則是軟嫩多汁，搭配蘋果可以解膩；開心果提拉米蘇滿有新意，有手指餅乾有浸酒好吃。整體來說編排很好，食物很好吃，值得再訪。
 Carina子頤 ,https://www.google.com/maps/contrib/100018537353563264395/reviews?hl=zh-TW,5,True,58,"詳細食記請看IG@carinating_(尚未發文）

好好吃欸這家大推芋泥鴨
和牛可麗餅部分個人認為較普通一點
吃完出乎意料很飽
慶生的還會上插著蠟燭的馬卡龍很勾追"
 Kof ,https://www.google.com/maps/contrib/117407748407696722370/reviews?hl=zh-TW,4,True,7,"每樣餐點都有自己的特色，調味與火候都控制得宜，每樣食材都發揮的不錯值得推薦
空間氛圍很適合情侶約會"
 Claire Wang ,https://www.google.com/maps/contrib/112316931643785609941/reviews?hl=zh-TW,5,True,44,口味很特殊好吃香味夠麵包硬碎好嚼勁蘑菇很新鮮奶油芬芳濃郁干貝軟甜有汁透抽很彈塩增度剛好硬麴新型麵軟硬適中蟹堡炸香海味佳服務也很讚及時反應
 Yu H ,https://www.google.com/maps/contrib/106018751552488515142/reviews?hl=zh-TW,5,False,49,"非常好吃的一家創意餐酒館
菜式很多變，味道層次都很有水準
適合3-4位朋友一起來
（2個人可能無法點太多道菜）

可以嚐到不同的餐點
酒品的部分也不錯
容易喝，適合對調酒不熟悉的朋友嘗試

特別推薦油封鴨還有前菜的鵝肝西米露脆餅
非常美味！"
 meiling chang ,https://www.google.com/maps/contrib/111417054972508430213/reviews?hl=zh-TW,2,False,4,"被其他人的五顆星騙來的
同價位真的有更好的選擇，拜託大家再找找

或是推薦大家只點前菜和主食前再配一杯酒

燉飯和肉類的真先不要
飯類感覺沒煮熟，有咬不下的問題
請廚房再料理過後干貝卻冷掉硬掉了

鴨胸的肉煎的很漂亮肉質也不錯
但真的蠻油會反胃

真的想問打五顆星的人是認真的嗎
為了平衡就打兩顆星了^_^"
 Rio Chen ,https://www.google.com/maps/contrib/102205950364145776950/reviews?hl=zh-TW,4,True,212,"整體來說還不錯
一整排pairing酒蠻好看但酒感比較普通
料理還不錯伊比利豬料理的好吃
雖然擺盤不怎麼樣。但食物都蠻好吃的"
 Mindy Huang ,https://www.google.com/maps/contrib/108402776770800996373/reviews?hl=zh-TW,5,True,15,"我們吃了火烤透抽沙拉、芋泥油封鴨、松露薯條、烤生蠔、蟹肉麵包、開心果提拉米蘇～～

芋泥油封鴨很香、很芋泥，口感非常好吃😋

份量較精緻，真的需要多點幾道才能吃飽唷～但基本上每道都很好吃。
可能疫情加上大雨，當天客人很少，氣氛很棒，非常適合約會的地方～～"
 Che shien Lin ,https://www.google.com/maps/contrib/100401428012228523470/reviews?hl=zh-TW,5,True,28,"當天點了湯、三道前菜、兩道主餐。
最推薦的雞肝西米露脆餅、芋泥油封鴨。
這兩道吃了真的是會想牽起對方的手轉圈圈。（還在約會階段的朋友吃了直接牽手達陣）

主餐覺得沒有前菜來的驚艷，下次好像可以多吃幾道前菜。

店員當天推薦的白酒也好好喝好讚，順口直接喝完那瓶。"
 洪瑞宏 ,https://www.google.com/maps/contrib/100906835536069598070/reviews?hl=zh-TW,5,True,33,"整體用餐氛圍很棒！
餐點部分很特別且精緻好吃
擺盤很美很好拍"
 Mia lee ,https://www.google.com/maps/contrib/116424525720027619876/reviews?hl=zh-TW,4,True,50,"美好氣氛的餐酒館，餐點精緻份量偏少

🔺法義麵包藍麵包本身偏硬，口感較有嚼勁，若人數較多用餐可以拿來墊肚子

🔺芋泥封鴨外皮很脆，口感像春捲，裡頭有濃厚的芋泥及鴨肉，真的好好吃😊

🔺炸雞豆乳cp值很高的一道，炸雞上有滿滿的起司條，外皮超級脆

店員服務很貼心，幫忙換盤子及倒水非常積極"
 曾嘉柔 ,https://www.google.com/maps/contrib/116951924497545713321/reviews?hl=zh-TW,4,False,10,"氣氛好，適合約會的餐廳

當天菜色無雷
酪梨蝦、芋泥油封鴨、牛排、透抽火烤燉飯
調酒不合胃口(純屬個人喜好"
 Emma Peng ,https://www.google.com/maps/contrib/113950648981799679824/reviews?hl=zh-TW,4,True,214,"芋泥油封鴨必點口感特別的一道菜
🦐炒菇也不錯吃但牛排的表現有點普通（此道價格也偏貴）
店內氛圍💯"
 Yipei H ,https://www.google.com/maps/contrib/104937393390438554085/reviews?hl=zh-TW,5,False,5,"台北最強餐酒館，不管是情侶約會還是朋友聚餐都很合適。
這樣的價錢可以吃到finedining等級的料理，不可能再更超值了～"
 袁守成 ,https://www.google.com/maps/contrib/118274156215809552921/reviews?hl=zh-TW,5,True,30,"環境乾淨衛生，東西又好吃！
服務態度超好！
而且干貝青醬燉飯好讚，很難得是有米心的那種!
還有甜點的萊姆提拉米蘇好愛😍
一定會推朋友來吃~"
 Sunnia S. ,https://www.google.com/maps/contrib/117218820980126340429/reviews?hl=zh-TW,2,False,41,"餐點口味還不錯(伊比利老饕肉好吃)但份量偏少以這個價位來說附近有很多其他選擇
服務也普通服務生不會主動介紹餐點對於這種菜單內容比較特別的店來說服務生不主動介紹就扣分
而且其實原本可以給到三星以上
但吃完回家馬上拉肚子(當天只有吃這家店沒吃別的)"
 Sandy Chen ,https://www.google.com/maps/contrib/104054754135150082183/reviews?hl=zh-TW,4,True,362,推芋泥油封鴨其餘餐點普通尤其是鮭魚義大利麵非常膩口
 Brian Liao ,https://www.google.com/maps/contrib/114337307926258040480/reviews?hl=zh-TW,5,True,68,"氣氛不錯、服務很好、餐點也好吃！
今晚點
⭐️雞肝西米露脆餅
精緻開胃小點，肝味適中不會太重搭配酥脆西米露餅，很適合當第一口調酒敲杯後的前菜！

⭐️炸雞豆乳
香酥脆的外皮包括著充滿肉汁的雞翅、腿，意外的出乎意料，切記慢慢咬開避免被肉汁燙到！搭配一旁的醃漬蘿蔔非常解膩，吃完一隻一定要配上一片！

⭐️澄清奶油蟹肉堡
蟹肉絲做成的餅搭配酥炸（？）的麵包，會不小心一下就吃完的美味！

⭐️主餐：14天鴨胸
服務人員有提醒鴨味會稍重一些，我吃起來味道剛好沒想像中的重。
肉質非常軟嫩、肉汁充滿口腔彷彿鴨子在嘴裡游泳？（誇張）。搭配兩種不同風格醬汁（名字忘了，其中一種是蘋果底），私心推這道料理

⭐️Cocktail
No.8、10
酒感清爽fruity，酒精味也不會太重，想小酌的很適合！

（意外的是服務人員請我們試喝茶酒，尾韻的茶香湧上有驚艷到！）

整體⭐️⭐️⭐️⭐️⭐️有機會會再訪👍"
 Meng Ju Chou ,https://www.google.com/maps/contrib/114603509712751562767/reviews?hl=zh-TW,5,False,3,"餐點美味程度和顏值成正比👍
是會再回訪的一間餐廳
很適合聚會和朋友來喝酒聊天"
 EagleHan ,https://www.google.com/maps/contrib/115453137502309006705/reviews?hl=zh-TW,5,False,10,"好吃欸！餐點好吃，擺盤也頗具用心
用餐環境佳，服務品質很不錯，給讚"
 Jackie LIN ,https://www.google.com/maps/contrib/101273106369174426250/reviews?hl=zh-TW,5,True,85,"來外帶、每道都好吃，牛肉的熟度適中粉嫩、不油膩。松露炒蛋和海鮮燉飯都好香滑順入口～

五顆星=會記起來、記得要再來
四顆星=如果想到、會再來
三顆星=在附近會再來
二顆星=自己不會再來（朋友約就配合）
一顆星=絕對不會再來"
 梁詠嘉 ,https://www.google.com/maps/contrib/100028947642986712686/reviews?hl=zh-TW,5,False,9,餐點口味都不錯，隱藏的豆乳炸雞很好吃，配酒剛剛好
 Michael HSU ,https://www.google.com/maps/contrib/113525076315061549360/reviews?hl=zh-TW,2,True,98,"餐點口味上需要加強⋯
服務環境還可以"
 Allen Sunshine ,https://www.google.com/maps/contrib/107920561122277060536/reviews?hl=zh-TW,4,True,128,"前菜的湯很入味，麵包口感紮實。
米餅的味道溶入上層調味中，非常清爽和新奇。
小卷沙拉的醋味較明顯，有別於一般沙拉醬。
餅乾式的內餡口味很特別，值得一試！
Risotto香氣不錯，收汁有入味，推！
主餐喜歡清爽口感的可選魚，想要重口點的則選牛。都不錯吃。
甜點大推，不可錯過喔～飲料很普通，配著喝。"
 Ry Hio ,https://www.google.com/maps/contrib/100530977280802955029/reviews?hl=zh-TW,5,False,48,"食物非常好吃份量充足
服務人員細心介紹菜單內容
並適當提醒不要點太多怕吃不完
環境舒適調酒也好喝順口"
 Danny Sung ,https://www.google.com/maps/contrib/108851046913981319601/reviews?hl=zh-TW,3,True,822,餐點份量很少，吃巧不吃飽，開瓶費葡萄酒一瓶500，烈酒1000，裝潢還行，服務人員親切有禮，酒類選擇還算多樣，啤酒可進義大利精釀搭餐應會比較配搭，整體來說還行。
 yu ,https://www.google.com/maps/contrib/108147364682550407749/reviews?hl=zh-TW,1,True,59,"當初也是被高評分還有亡美發文騙去
但餐點高價又沒有那種質感主餐都要八九百以上但品質都是普下沒有什麼肉味魷魚飯超貴但還沒一條完整魷魚就只有幾片跟小指一樣的肉真的是笑死人
吃過很多餐廳的人就會知道其他更好更便宜的餐酒館品質還不會那麼差
然後餐廳整間不知是不是裝潢的關係鬧轟轟隔壁講話聽得超清楚要走高價還讓人坐起來心情煩躁
兩個人點了兩個主餐圓鱈干貝鹽麴魷魚燉飯兩個前菜芋泥包龍蝦堡跟兩杯酒就三千三了（含一成服務費）覺得真的沒必要"
 SaintEagle Wang ,https://www.google.com/maps/contrib/109132753705648766523/reviews?hl=zh-TW,5,False,14,每道菜都超好吃無雷！
 Parker Cheng ,https://www.google.com/maps/contrib/113526319839028714579/reviews?hl=zh-TW,1,True,80,"打電話來預約時，告知午餐也有單點品項，但12/12實際到店後，服務生居然說不行，只能吃套餐？後來看到別桌單點豆乳雞，他才解釋他沒搞清楚午餐可以單點什麼，連自己店賣什麼都不知道？服務品質很差。

上菜非常非常非常非常慢，擺盤很美，味道普通，沒有驚艷感。"
 Fang-Chi Chang ,https://www.google.com/maps/contrib/107492924119219845213/reviews?hl=zh-TW,1,True,40,"大概是近期吃過最失望的店。

尤其是菜單上沒有列的special海鮮燉飯。米蕊過生、沒有收汁。
最糟糕的是，上面小管想烤出漂亮的烤痕
但嚴重燒焦，入口後只有非常苦的燒焦味。
牛排的佐醬也是滿滿燒焦苦味。

環境和服務人員很棒，餐點完全不行。"
 R R ,https://www.google.com/maps/contrib/104970022137327732669/reviews?hl=zh-TW,5,True,49,"*松露什錦菇起司燉飯$299（Ubereat)
（含南瓜濃湯/半熟蛋/麵包）

包裝完整，餐點美味：燉飯米心還帶有嚼勁，附餐的南瓜濃湯跟麵包，味道都很棒，且送來的溫度都都還維持的很好。

雖然用Ubereat訂餐價格稍微貴一點，但還是覺得很值得。因為很常使用外送，同價位的餐點，幾乎沒辦法吃到那麼美味又有附配餐的餐點😂。感謝在疫情中在家還可以吃到那麼美味又用心的餐點♥️

#防疫餐"
