user_name,user_profile_url,rating,local_guide,comment_num,comment_text
 Lee Mark ,https://www.google.com/maps/contrib/115395485048061578926/reviews?hl=zh-TW,5,True,21,"台北最強平價Finedining
Draft的調酒又好喝👍"
 Yu吃吃 ,https://www.google.com/maps/contrib/103886518099032733430/reviews?hl=zh-TW,4,False,6,餐點有特色，料理方式符合大眾口味，餐點份量2人共享差不多。調酒No.24很適合女孩兒的口味。用餐氣氛上上，值得再訪！
 Haru哈魯享生活 ,https://www.google.com/maps/contrib/104130274804180583607/reviews?hl=zh-TW,5,True,243,意想不到會那麼好吃耶！起司鴨肉開胃菜樣樣都懹人驚艷甜點提拉米蘇搭配開心果顆粒甜兒不膩反而增加層次感最後一道吃到有著滿滿幸福感紅酒選擇也滿多我自己選到我摯愛的Shiraz大推
 Carmen ,https://www.google.com/maps/contrib/101934327095976476081/reviews?hl=zh-TW,5,True,497,"每一道都好吃，大推開心果提拉米蘇，不過問了店員，似乎每ㄧ季都會換菜單，所以大家推薦的很多東西都點不到。

由於我們是採分食，店員每道都會更心分食用的小盤，盤子還注重溫度，非常貼心。"
 Sam Su ,https://www.google.com/maps/contrib/115241993485355682740/reviews?hl=zh-TW,5,True,144,"真是太開心又經高人介紹來到一家美味餐廳了！👍👍👍料理餐點不多，簡單明瞭很好點菜！據說還會不定時換菜單呢。

前菜有許多推薦，我印象比較深的是黑色蟹肉奶油泡芙，吃起來有點隨意鳥地方的味道，黑色創意泡芙卻把料理更推上一個層次。👍👍👍

皮蛋白菜🥬🥚也是很特別的一道料理，很少看到皮蛋入菜，搭配起清爽白菜很是特別。

一定要推薦是主菜一道豬肉料理，選用上頰肉部位，先烤再煎，來來回回五次之多，才能料理出外面焦香，裡面軟嫩的口感！來這邊一定要必點這道👍👍👍👍👍👍👍👍👍👍👍👍👍

這邊的裝潢很有味道，而且營業時間到凌晨1點，跟三五好友來這邊聊天配著美食真是太放鬆了。

這裡的交通很方便，就在繁忙的東區內，如果真的開車過來，餐廳的對面也剛好有個室內的地下停車場，真是太棒了👏👏"
 愛吃鬼辣炒雞 ,https://www.google.com/maps/contrib/105348587643936587840/reviews?hl=zh-TW,5,True,87,"趁著疫情在家裡好好整理前陣子吃到很用心的餐酒館
大推等級🌟🌟🌟🌟🌟
用心等級🌟🌟🌟🌟🌟
餐廳環境🌟🌟🌟（燈比較暗不太好拍照
Yummy等級🌟🌟🌟🌟🌟😋😋太好吃了

————

14天鴨胸肉$690
肉質軟嫩沒有鴨的味道處理的很好
可能是因為厚厚的口感比較好滿有嚼勁的愈嚼愈香多汁旁邊的白醬是用蘋果泥製成的搭配咖啡濃縮甜菜根
-
芋泥油封鴨$290
Cp值最高
真的必點之一
搭配松露芋泥油封鴨腿炸金針菇沾取鹹蛋黃醬汁絕配啊～絕配真的完美搭配醬料味道很濃郁另人食指大動哈哈哈😂
-
三色海鮮千層麵$480
踩過無數遍雷到爆的千層麵終於有一間讓我覺得值得可以再訪了，感覺完全是餐廳自己的招牌菜搭配白醬青醬紅醬麵皮Q帶有韌性好入口點一份大家一起分食
-
蟹堡（好像沒有在菜單上，可以詢問店員還有沒有，有隱藏菜單
蟹肉風味濃郁麵包烤的好脆好脆
-
開心果提拉米蘇👍絕對必點$280
以前對於提拉米蘇都是巧克力是標配
是堅果粉絲的必點啊啊不會太甜膩口奶油不會太多溶於口中好好吃啊啊啊啊😋

整體來說值得再次來訪吃吃看每一次的隱藏菜單以及他們的調酒好喝到爆"
 陳瀅竹 ,https://www.google.com/maps/contrib/105801749710222785852/reviews?hl=zh-TW,5,True,297,"氣氛裝潢挺好，服務優秀，比想像中還正式一些。食物份量少，特別喜歡溫蔬菜，泡菜乾提味，白蘆筍鮮甜，chorizooil拌入半熟蛋鹹香美味。伊比利豬肉質固然好，火侯稍欠。小捲配青蔥芥末和gazpacho還不賴。

甜點開心果提拉米蘇邪惡又澎湃，實在太好吃，蛋糕體浸滿酒液，忍不住吃光。housewine選得不錯，酸度偏高適合搭餐。"
 Chun-Ming Chang ,https://www.google.com/maps/contrib/103728390737120615711/reviews?hl=zh-TW,5,True,"2,730","2019.04.16=一家GQ雜誌力挺的潮流餐酒館！看某部落客推薦引起我的興趣…搭配大罐950ml的餐酒，其實相當不錯！😁

卡布里(270)=絲綢乳酪+彩色番茄+接骨木凍(慢慢弄起司)，起司乳酪的部分還不錯，不過我一像不太喜歡這種冷盤，清爽但味道不會有太多驚豔。4分。我個人下次會挑熱前菜。

法國麵包籃(190)=自製的豚油沾醬，搭配兩種不同口味的麵包，還算不錯。5分。

酪梨肉丁(210)=酪梨沾醬+根莖脆餅+炸藜麥。藜麥很夯，這道菜很好吃。這道前菜給今晚的美味起了個頭，酪梨醬跟肉丁的味道很搭，夠鹹，跟脆餅口感搭配很巧妙，6分。

蘇格蘭炸鵪鶉皮蛋(290)=荖葉絲+娃娃菜+皮蛋美奶滋。一團金黃色炸物，上面放上檳榔葉，裡面包覆炸皮蛋，捲起一層美奶滋來食用，好吃，6分。

炸雞豆乳(320)=怕達諾+醃漬時蔬+焦糖洋蔥。寫成這樣...這就是炸雞，一塊好吃的炸雞!!炸雞皮厚又酥，肉質相當鮮嫩挺能刺激食慾，搭配padano起司調味後...嘖嘖，7分。

野生的魚(880)=香茅泥+青豆油+椰奶泡泡。本來很少點魚，但是廉吃很多家高級餐廳魚料理都讓我驚艷，又聽到今天是紅甘，試試。不多說，魚過熟，4分。

茴香燉豬(主廚招待)=煙燻茄子泥+茴香奶油醬+醋漬小洋蔥。我覺得我運氣不錯，常能遇到主廚招待。炎勳茄子泥搭配熟度恰到好處的豬舌頭，另外用醃漬洋蔥替篇膩的口感提升一點酸度醒嘴層次，7分。

鴨胸(710)=紅蘿蔔泥+焦洋蔥+肉汁。鴨子熟度可以，皮酥皮香，很可以，6分。

法蘭西多士(280)=布里歐+花生泥+楓糖雪花。上桌還搞個視覺藝術，不過法式吐司一上桌就傳來濃濃的香氣...wow....很難擋。入口，濕軟的吐司...欸...好色情的感覺，嘖嘖嘖，7分。

★★★★★C/P值粉~高，就是為了那950ml餐酒跟好吃的餐。"
 Vivian Wen ,https://www.google.com/maps/contrib/100250798918813446588/reviews?hl=zh-TW,5,True,119,"東西好吃，服務態度好，上菜速度快，餐點是精緻風格，份量都不多喔！

雖然價格偏高，但店內氣氛很舒服，讓人有種放鬆的感覺。很適合兩人約會或是三五好友聚餐～

開一瓶紅酒搭配著吃，非常推薦！"
 Allen Lo ,https://www.google.com/maps/contrib/100625133281836404776/reviews?hl=zh-TW,5,True,166,"#Muzeo

有著餐酒美術館的稱號，也有跟#Draftland合作的好幾款調酒，令人很好奇他的食物的表現

#皮卡索調色盤五種不同的調酒，很有趣的組合

#炭烤東北小卷新鮮彈牙

#酪梨蝦酪梨的清爽搭配新鮮的蝦，好吃

#芋泥油封鴨很像Longtail的一道菜，雲吞皮包裹油封鴨跟芋泥，我挺喜歡的

#炸雞豆乳配上現刨帕瑪森乳酪，雞肉軟嫩多汁

#溫熱綜合野菜補充纖維值

總體來說很不錯的餐酒館，食物跟酒的搭配很優秀，完全可以再去的一間餐廳"
 Emily Chan ,https://www.google.com/maps/contrib/104413632722953573395/reviews?hl=zh-TW,5,True,31,"餐點精緻，用料實在！
尤其主餐的海鮮燉飯非常入味且海鮮的料給的非常大方！另外是牛小排煎的熟度非常剛好，外皮焦脆，中間軟嫩，搭配的千層馬鈴薯也非常的特別。
價格上也合理，非常值得一試。"
 HY Tsai ,https://www.google.com/maps/contrib/101864116247387749825/reviews?hl=zh-TW,3,True,28,"菜單選擇很簡單，也有隱藏菜單可供選擇，每道口味都相當不錯，印象比較深的是芋泥袋，炸得酥脆芋泥很香與鴨很搭。比較可惜的是隱藏菜單的義大利麵，調味雖好但上菜時已有點涼掉，吃起來是沒熟的感覺大於Q彈。
最後要提及的是每道菜的份量，在看菜單時會覺得價格不會定價太高也有預想的正常份量，但上菜時可以說擺盤用心但看到可憐的小份量，擺盤再好印象還是會扣分，因為連四個人都不夠分，一人分到兩口就算多了，所以會讓人覺得太貴。三個人應該才是這家餐廳的最適人數，不過相對地會覺得消費更高就是了。"
 Kelly C ,https://www.google.com/maps/contrib/108584156916164256446/reviews?hl=zh-TW,5,True,200,"食物跟服務時好的
可惜就是上菜速度比較慢
價錢其實很合理
這次是五個女生一起分所以會覺得份量不夠
感覺可以兩或三人來分享比較適合
才可以飽足又吃到多一點料理
調酒以女生的口味覺得好喝"
 L ,https://www.google.com/maps/contrib/109849002535977947335/reviews?hl=zh-TW,5,True,44,晚餐採單點，每道菜份量不多，平均一人約1500，推薦芋泥油封鴨和法蘭西多士，特別又好吃，而其他菜及隱藏菜單，則表現一般不到驚艷，但不至於失望。整體來說都還行，平日客人不多、服務也很好，適合約會、小酌放鬆。
 Ken ,https://www.google.com/maps/contrib/113486172143029241952/reviews?hl=zh-TW,4,True,174,"食物上的表現感受得出用心和想表達的內容，但覺得還有一點點的進步空間

服務上或許可以再細心一點，一個月以前就訂位2人的生日聚餐，一開始竟然是安排在廁所門口的角落位置，不過請求更改位置有立馬處理好也覺得很棒

看得出野心的店家，但總是會漏掉一些細節"
 Su Su ,https://www.google.com/maps/contrib/117347818298272540655/reviews?hl=zh-TW,5,True,154,"看起來超繽紛的擺盤，每道都很有趣（如果胃比較大可能需要多點幾道）
食材新鮮好吃有特色👍🏻會想再來試其他菜色
當天點的芋頭濃湯印象深刻！
推薦指數🌼🌼🌼🌼🌼🌼"
 Sonia Chang ,https://www.google.com/maps/contrib/113553974759497708371/reviews?hl=zh-TW,5,True,80,餐點屬創意料理，標示餐酒館應屬於用餐為主，對於專門要去小酌的不適合。
 WT Chiu ,https://www.google.com/maps/contrib/116154965865699851993/reviews?hl=zh-TW,3,True,55,餐點ok但沒有很驚艷，點威士忌但配的冰塊是很快融化的小冰塊，覺得既然要賣酒可以再用心一點
 吃貨小夜貓 ,https://www.google.com/maps/contrib/113561994607894962587/reviews?hl=zh-TW,5,True,99,是一家新創料理，吃的到法式料理的質感。從開胃菜到主菜都吃的到食材的新鮮感，不會過度調味、擺盤有美感可以感覺到廚師的用心，是一家走向米其林星等級的餐廳。唯一缺點是服務人員都不在外場(可能是當天外場只有2桌)，服務人員都擠在廚房，所以要加點甜點需要自己走到廚房喊人，唯一小缺點，不會影響到用餐心情！
 Lillian ,https://www.google.com/maps/contrib/112506775735999901185/reviews?hl=zh-TW,4,True,296,"主餐主打直火烹調，但不知為何，入口時菜餚都是涼的；炸物類的小點熱呼呼很正常

調味的精準度很不錯！每道餐點份量約3人分食剛好"
 Chu Fen Yang ,https://www.google.com/maps/contrib/107936289742796987371/reviews?hl=zh-TW,5,True,225,"來這裡過生日～服務與體驗都非常的好！
巧克力燉牛排燉飯榮獲現場朋友最驚豔的料理！"
 Iris Chen ,https://www.google.com/maps/contrib/110145444069966926368/reviews?hl=zh-TW,5,False,333,"二訪了～
前菜大推奶油蟹肉泡芙！炒蔬菜點綴鹹香烏魚子融合水波蛋濕潤口感很推！
主餐類沒有雷，無論牛豬鴨魚都很值得推薦～
氣氛佳價位也很合理！"
 Ting-Yu chang ,https://www.google.com/maps/contrib/115714516839420925456/reviews?hl=zh-TW,5,True,96,每道菜都精緻且好吃，最喜歡伊比利豬和芋泥油封鴨。酒類有瓶裝和啤/調酒，單杯約200-350不貴。店裏燈光微暗氣氛很好。
 Coco ,https://www.google.com/maps/contrib/112375837273677121302/reviews?hl=zh-TW,4,True,39,木瓜絲讓小卷整個清爽許多，鹹蛋黃慕斯的味道很香醇，法國吐司整體有些過甜
 Hung Jenny ,https://www.google.com/maps/contrib/111571549486878299913/reviews?hl=zh-TW,5,True,103,"週末來享用午間套餐
非常值得來吃
主菜選油封鴨腿
旁邊有千層馬鈴薯配北非小米
非常軟嫩也不會過鹹

空間人多會感覺吵雜
廁所關門聲音會嘣一聲有被嚇到"
 YT H ,https://www.google.com/maps/contrib/107408332223530243492/reviews?hl=zh-TW,3,True,68,奶油蟹肉泡芙好特別好好吃！服務很棒，開放式廚房也很不錯，燉飯很香推薦！豬肉很鮮嫩但是豬肉味蠻重，餐點份量小份建議點多道大家配酒一起分！有點Fusion可是菜色不夠特別
 Angelanini ,https://www.google.com/maps/contrib/105582724642035697895/reviews?hl=zh-TW,4,True,165,"每道料理都非常有創意，但又不失食材的原味
烹飪方式恰到好處，真的非常好吃😋
PS.必點「風暴貝」、「牛排」、「鴨胸」"
 Cecilia Hsieh ,https://www.google.com/maps/contrib/104573757336479112456/reviews?hl=zh-TW,5,True,130,"海鮮很新鮮
肉類的烹調方式都很不錯
可以嘗試店家提供的隱藏菜單
最後建議吃一下他們家甜點做為完美ending❤️"
 Carrie Wang ,https://www.google.com/maps/contrib/101373576954997269437/reviews?hl=zh-TW,4,True,91,餐點很好吃，只是小孩不適合來，大人倒是很開心😁第一瓶酒不收開瓶費哦👍👍👍
 Cindy Chang ,https://www.google.com/maps/contrib/111959164218019329278/reviews?hl=zh-TW,5,True,489,午間套餐的部分還蠻超值的，東西很多元，有幾道前菜口感蠻特別的，擺盤很美，主食的牛排跟甜點的奶酪都很好吃。
 Meimei ,https://www.google.com/maps/contrib/108288503000047323633/reviews?hl=zh-TW,4,True,310,"芋泥袋袋太好吃了吧！
然後豆乳雞翅盤是我看過餐酒館裡面最驚人的size
豪～大啊！"
 Cha Cha ,https://www.google.com/maps/contrib/106912000702265690567/reviews?hl=zh-TW,4,True,182,"因為人夠多，所以可以
「菜單上的全部都上」😂
除了已經賣完的，不然全部都吃了
這裡很讓我覺得印象深刻的是
「不收服務費」
本想說是不是該自己端盤子還怎樣
結果確是「服務超好」
會介紹菜色，收桌子，本來還要幫忙倒酒
但我們婉拒說自己來就好
也不時的會巡桌
看我們湯要分喝還拿碗給我們
這樣的服務，真的可以讓很多收服務費的餐廳好好檢討一下了

餐點部分：每道菜擺盤的都很美，照片很上相
但味道的部分就沒那麼出色
大家最愛的居然是炸雞😂"
 Wen C. ,https://www.google.com/maps/contrib/114710674403451158382/reviews?hl=zh-TW,4,True,649,"每道菜份量都不大，但充滿創意，也很美味。環境也相當舒適。
芋泥油封鴨：芋泥讓人很驚艷！"
 S Sharon ,https://www.google.com/maps/contrib/111974495163366954502/reviews?hl=zh-TW,4,True,219,Asahi跟Chef’sclub聯名，7/26-8/4由主廚GastonSusli帶來9道不一樣的餐點，菜單上每道餐點都會建議搭配的啤酒🍻價格在$190-450之間。每樣都很美味很好吃，但如果份量再多一點就好了😆都是下酒菜呀！
 N W ,https://www.google.com/maps/contrib/107823742603966150002/reviews?hl=zh-TW,5,True,109,"餐點滋味、口感的組合新鮮有趣，感受得到主廚的用心，沒有許多fusion餐廳只是為了創新而賣弄的毛病，盤飾也相當精緻。
第一瓶酒不收開瓶費，也不收服務費，但服務仍然溫暖貼心六星級，絕對願意回訪的餐廳！

*****
回訪補充：改制酌收服務費5%"
 Evelyn Chuang ,https://www.google.com/maps/contrib/115007999465564474271/reviews?hl=zh-TW,4,False,33,"週一晚上去，人不多，空間很舒適！雖然整體裝潢顏色偏暗色系，但每桌有可愛的小蠟燭造型桌燈，氣氛特別好，即使拍照臉上光線也不錯。

餐點口味很特別，很用心的調味與醬汁，對西式餐點不太熟悉，但是多種醬汁與食材的搭配很好，吃到嘴巴裡很舒服！

甜點的水果巴沙雍的味道真是太太驚奇了，嘴巴裡彷彿有十個煙火齊放，各種味道交錯，非常喜歡！

小小缺點是坐在靠近門口的位置，時不時有煙味飄入，還好有其他空桌可以換位置，也謝謝店員很客氣的馬上答應更換。"
 ZH ,https://www.google.com/maps/contrib/117790548978071947880/reviews?hl=zh-TW,4,True,118,"餐點非常的精緻好吃，比較適合作為飯後喝酒聊天的場所，不適合當正餐，餐單中缺少簡單的配酒小物，如起司火腿之類的，有點小可惜

外場太過生嫩，員工訓練有待加強"
 YUJU CHAN ,https://www.google.com/maps/contrib/102311463567798492447/reviews?hl=zh-TW,5,True,19,不追求華麗或極簡的擺盤，回歸到食物最初帶給人的感動，就是兩個字「好吃」！不定時推出期間限定餐點與合作，滿適合多人一起享用；酒的選擇除了瓶裝紅白酒，更有裝在龍頭內（ontap)的紅酒.梅子氣泡酒與調酒。
 JAZZ CHEN ,https://www.google.com/maps/contrib/105536123269610511388/reviews?hl=zh-TW,5,True,81,"當天的餐點
前食：法義麵包籃（好吃但沒有到非常驚艷，算是主食前墊胃用的）
前食：卡布里（乳酪的味道清香，味道蠻新穎的偏清淡）
前食：烤章魚沙拉（當天章魚換成花枝，這道料理味道很出乎意料，有融合台灣南部料理及法式的調味，層次很豐富）

主食前：炒季節蔬菜（菜名很普通，味道非常不普通，這道一上桌馬上被掃空）

主食前：豬舌料理（料理名稱忘了，第一次吃豬舌，覺得超嫩，口感有點類似雞肉，很特別）

主食：薩索雞胸（搭配蒜泥及肉汁可以吃出不同的口感，好吃但驚艷稍微不足）

主食：野生的魚（青豆泥真的很強，魚肉搭配豆泥超棒，也是一道很快被掃光的菜

總結：一個人不喝酒的話約700-1000台幣，以這樣的環境及料理我覺得很划算，是會想再回訪的店，美中不足的是當天店員大部分時間聚在廚房口，所以需要服務時要一直起身走到廚房呼叫

心中實際的星評為⭐️4.5顆星"
 Rebecca ,https://www.google.com/maps/contrib/101803801908919130814/reviews?hl=zh-TW,4,True,316,"好吃的菜色：炸雞豆乳、辣味燉豬、14天鴨胸、伊比利豬。
還不錯但有點普通的菜色：栗子湯、火烤透抽沙拉"
 Jaquie C. ,https://www.google.com/maps/contrib/103562271224352114922/reviews?hl=zh-TW,5,True,29,喜歡這間餐廳，菜色價格平易近人，創意跟美味並重，服務人員態度也非常好。（沒有收服務費也是很讓人驚喜）
 ELLE W ,https://www.google.com/maps/contrib/114060051641503278015/reviews?hl=zh-TW,4,True,387,"以這個價位可以吃到類似Mune這種finedining覺得CP值高，不算酒的話，一人均消約800～900元，酒的話一瓶約1000元起，推薦和朋友聚餐！
不用另收服務費很佛心"
 Jill Cheng ,https://www.google.com/maps/contrib/115145241126334095657/reviews?hl=zh-TW,4,True,350,裝潢非常有風格的一家餐酒館，桌距很寬敞讓人很舒服不會有挨著鄰桌的感覺，主餐份量偏小份精緻，可能需要一人點一份，整體感覺很舒服的一家店。
 Genie ,https://www.google.com/maps/contrib/105109689806213736445/reviews?hl=zh-TW,3,True,40,"餐點滿精緻的
但份量有點少
比較適合喝酒
晚餐的話可能就是重氣氛～"
 Ann Lee ,https://www.google.com/maps/contrib/102080173569147075136/reviews?hl=zh-TW,5,True,112,氣氛很好，桌與桌之間的距離不會很近，舒適且不會受他人打擾，甜點令人非常驚艷，不收服務費並沒有讓服務打折，相反的，服務生態度都非常親切，很棒！
 Penny Chen ,https://www.google.com/maps/contrib/101614898786573982010/reviews?hl=zh-TW,4,True,234,口味鹹淡合宜。量偏少。二個女生吃到五樣還沒飽。適合配點酒（但不配也吃得下去不錯👌）
 Amba Wuu ,https://www.google.com/maps/contrib/117060014827845924641/reviews?hl=zh-TW,5,False,8,"一直以來都是口袋愛店，
這次和asahi的活動，果然還是Muzeo的菜
最深得我心💕
推雞肝、豆乳雞、綠咖喱、肋排！！！
期待你們的新菜單👍🏼"
 許馬兒 ,https://www.google.com/maps/contrib/101751918402154207106/reviews?hl=zh-TW,4,True,214,"第二次來用餐了
用心料理的好餐廳
值得推薦"
 Evonne ,https://www.google.com/maps/contrib/110781573703306102601/reviews?hl=zh-TW,5,True,178,餐點都很好吃，氣氛很自在，適合下班放鬆聚會小酌🍷👍🏻
 兔麻吉 ,https://www.google.com/maps/contrib/104520760132222620214/reviews?hl=zh-TW,4,False,60,"最推薦美味蟹堡還有鴨胸也很棒哦
蝦餅雞肝我覺得還好"
 Charles Yu ,https://www.google.com/maps/contrib/102548240400481774446/reviews?hl=zh-TW,5,True,397,食物真的好吃！雖然價格不是很親民。服務生態度好，會慢慢介紹菜色酒單。
 Stephanie Chien ,https://www.google.com/maps/contrib/109782514882275723558/reviews?hl=zh-TW,5,True,37,環境舒適，適合朋友小聚聊天，輕鬆喝酒晚餐～處理食材的方式很有創意，沒想過的搭配在口裡居然很和諧。還有很多隱藏料理，充滿驚喜的地方!
 Jerry Chen ,https://www.google.com/maps/contrib/111548705476939280071/reviews?hl=zh-TW,4,True,239,"海鮮表現不錯，喜歡
炸物餐點過多，但服務不錯
很適合小酌"
 挑嘴的I ,https://www.google.com/maps/contrib/105944380839755283376/reviews?hl=zh-TW,4,True,"1,805",Uber外送，點了鮮蝦干貝蔬菜燉飯，食材新鮮味道不錯，醬汁濃郁，對得起價格的餐點。讚一個～
 Daisy Huang ,https://www.google.com/maps/contrib/113385868184874126110/reviews?hl=zh-TW,5,True,36,咖喱真的太好吃了，豆乳雞也是讚不絕口，快閃店結束前一定要去嚐嚐
 jamie W ,https://www.google.com/maps/contrib/113834784128822227035/reviews?hl=zh-TW,5,False,5,"吃過一次就難忘的好滋味！
別忘了點上酒跟好友小酌兩杯，舒適自在的氛圍讓人不會過度拘束，帶著放鬆的好心情，享受美味。
座落在東區的巷弄裡，不過度張揚的外觀，低調並富有質感，成為我口袋裡的不二選擇。
毫不膩口的份量，勾動食慾的擺盤，令人驚艷的味道，每一次，都讓我期待下次。"
 Yumyum L ,https://www.google.com/maps/contrib/110693356990969747569/reviews?hl=zh-TW,4,True,63,"東西美味、好看又精致，但份量有點少、選項也有限（可能因爲剛好和Asahi做季節限定菜單）

牛肉三寶千層麵有點普通、但芋泥鴨好好吃"
 Jochi Hsu ,https://www.google.com/maps/contrib/116755562209202508086/reviews?hl=zh-TW,5,True,467,每道菜都很好吃，會想再去🍷
 Eddy LIN ,https://www.google.com/maps/contrib/115716105976136955726/reviews?hl=zh-TW,4,True,62,博物館的設計氛圍確實不錯，份量不多的分子料理及肉類餐點也是驚豔到!但良心建議葡萄酒侍酒實在很外行很需要加強。
 王沛慈 ,https://www.google.com/maps/contrib/115679186863767324042/reviews?hl=zh-TW,1,False,3,"我點的是外送，也知道照片本來就僅供參考！
但是一份紅酒燉牛肉蕃茄炊飯329
打開只有3塊牛肉！真的令人蠻傻眼的"
 余涵宣 ,https://www.google.com/maps/contrib/107623149636230201170/reviews?hl=zh-TW,5,False,5,"慶生帶女朋友來吃飯，餐點好吃，還有小小驚喜
謝謝店家"
 Son森 ,https://www.google.com/maps/contrib/113021820810057478314/reviews?hl=zh-TW,5,True,458,"酒好喝餐點也很用心
服務輕鬆舒服裝潢有點可愛"
 Kent Ma ,https://www.google.com/maps/contrib/117670113311169207526/reviews?hl=zh-TW,4,True,"1,762",Decentfusiondishesataffordableprices.味道還可以的創意料理，可惜沒有特別驚豔的地方。
 張羽婷 ,https://www.google.com/maps/contrib/103899525890117961842/reviews?hl=zh-TW,5,False,5,芋泥油封鴨很特別芋泥很綿密～好讚！提拉米蘇也很好吃！是親朋好友聚餐的好地方😆
 Yingchen Tsai ,https://www.google.com/maps/contrib/114489593630611177824/reviews?hl=zh-TW,4,True,53,"點幾道料理配點酒，視覺味覺都兼顧,優雅輕鬆的晚餐."
 Ariel Hsu ,https://www.google.com/maps/contrib/110764032399193104643/reviews?hl=zh-TW,5,True,85,"三訪這件店了，非常喜歡！
東西好吃、價格親民、服務親切～
這次朋友慶生選在這，大家都很盡興😋"
 Raymond Sung ,https://www.google.com/maps/contrib/112469599429300418795/reviews?hl=zh-TW,5,True,195,每道好吃，東西真的不貴，趁著asahi活動來，全部點一輪真的很棒！
 Mikala K ,https://www.google.com/maps/contrib/115490018095069715066/reviews?hl=zh-TW,5,True,"1,763",餐點特別又好吃，服務親切，價格略高，但不收服務費。
 Martin Liu ,https://www.google.com/maps/contrib/114447121402167991767/reviews?hl=zh-TW,5,True,31,隱藏菜單也美味，記得詢問服務人員當日內容。
 Winnie Weng ,https://www.google.com/maps/contrib/102189149991396967116/reviews?hl=zh-TW,5,False,13,每道都精緻又美味的創意料理，值得一訪再訪！
 CJYuyu ,https://www.google.com/maps/contrib/105256511194248361760/reviews?hl=zh-TW,5,True,310,餐點用心，服務也很好，若晚上不想大量進食、這裡很合適。
 Atkinson ,https://www.google.com/maps/contrib/112126229816349830385/reviews?hl=zh-TW,5,True,57,氣氛佳，主廚廚藝好，調酒非常好喝！
