user_name,user_profile_url,rating,local_guide,comment_num,comment_text
 黃思穎 ,https://www.google.com/maps/contrib/109651569908988596525/reviews?hl=zh-TW,4,True,20,"餐點整體味道不錯，推薦芋泥油封鴨，芋頭愛好者不會失望。
點了三款調酒都較偏甜，很適合喜歡喝帶香氣的人。
甜點大推開心果提拉米蘇，酒感適中且吃完不會有甜膩感。
缺點就是店門感覺無法關緊，室內還蠻冷的，外面有人抽菸的時候味道會吹進裡面。"
 Yu An Chou ,https://www.google.com/maps/contrib/100032219220292341679/reviews?hl=zh-TW,5,True,255,只有飲酒的體驗，單杯酒的價格都很平實，喜歡這裡的氣氛以及藝術畫作們。目前正與Draftland合作，本身也有賣純飲及雞尾酒，平日只喝酒坐吧台似乎沒有低消。
 Tsao Joanne (INTEGRATE) ,https://www.google.com/maps/contrib/112781934763365247364/reviews?hl=zh-TW,5,True,188,"服務好氣氛不錯
餐點也好大推豆乳雞"
 Sylvie C ,https://www.google.com/maps/contrib/109458980548033386606/reviews?hl=zh-TW,5,True,309,"芋泥鴨非常特別很好吃，
豆乳雞也很不錯，只是比較普通"
 花輪哥 ,https://www.google.com/maps/contrib/109794546293763843398/reviews?hl=zh-TW,5,True,439,一個朋友聚餐聊天的好餐廳，氣氛很佳，環境好，不錯
 YH Kao ,https://www.google.com/maps/contrib/101211485131276787690/reviews?hl=zh-TW,4,False,259,氣氛跟料理都不錯的小館
 C. Shun ,https://www.google.com/maps/contrib/102590433573200709864/reviews?hl=zh-TW,1,True,265,"上菜超級慢！！！！！！
吃了一個半小時主菜還沒上
七點入座九點烤雞才上，雞肉拿回去切又要等十幾分鐘，結帳也要等，等等等慢死了
餐點份量、美味程度與價格不符"
 H조 희 ,https://www.google.com/maps/contrib/118428715940756879696/reviews?hl=zh-TW,5,True,109,朋友招待我來這裡慶生，超滿意，蠻意外東區裡面還有這樣CP值高但是價位又不浮誇的餐廳。下次還想再來
 Cora Chang ,https://www.google.com/maps/contrib/118340966001050524344/reviews?hl=zh-TW,1,False,45,foodieamber是很好的餐飲指標Asahipopup餐點和酒飲非常棒但服務非常糟服務生有待加強訓練
 Chloe Lai ,https://www.google.com/maps/contrib/101163103022308952862/reviews?hl=zh-TW,3,True,55,Maincourse還不錯，但前菜還好～燈光有點太暗，音樂還行，服務素質還可以
 Edison Wang ,https://www.google.com/maps/contrib/108435991565311665285/reviews?hl=zh-TW,1,True,64,"網美餐廳，東西有點少，味道也普通。
不是很推薦"
 Saviianna Su ,https://www.google.com/maps/contrib/103487672118321011243/reviews?hl=zh-TW,4,False,66,芋泥鴨很好吃服務不錯私房鹹派也好吃
 Sinead Yang ,https://www.google.com/maps/contrib/106120886973364067970/reviews?hl=zh-TW,4,False,6,菜色有創意，份量偏少。
 Ya chu Chang ,https://www.google.com/maps/contrib/103554161248607760352/reviews?hl=zh-TW,5,True,47,"除了有點吃不飽以外沒有缺點
點了主食伊比利豬、牛排、蟹堡、魚餅、牛肉麵、酪梨蝦、提拉米蘇
還是沒吃飽XD
每樣都是非常好吃的
精緻度很高裝潢也很棒
加飲品兩人下來快五千沒吃飽，就是有點可惜～"
 Yvonne Wu ,https://www.google.com/maps/contrib/114629326055058441793/reviews?hl=zh-TW,5,True,84,調酒裡運用了很多的水果跟花的元素，適合女生來喝
 Wendy Ma ,https://www.google.com/maps/contrib/110767316861554057167/reviews?hl=zh-TW,3,False,81,餐點和酒沒記憶點，環境和整體感受必須給些星，有點東西。
 JoeBo Chen ,https://www.google.com/maps/contrib/114397030474129184534/reviews?hl=zh-TW,4,True,707,"法義麵包籃$190：自製法義式乾麵包，略嚼勁但不難咀嚼，淡淡麵粉香氣撲鼻，沾上特製豚油醬著實開胃。

酪梨蝦$280：清爽酪梨醬上灑可可脆片增加口感，配於酥脆蝦餅與鮮蝦，沙拉盤般相當爽口與清新的口味。

特製調酒~$250：提供相當多的創意酒單，也可以單點紅.白酒一杯。當天喝了一杯帶有茶香的酸甜調酒，非常喜歡！

火烤透抽沙拉$290：青木瓜絲上點綴火烤的透抽，搭配西瓜冷湯與芥茉美乃滋，口味偏清淡，是開胃小點。

芋泥油封鴨$290：傳統料理芋泥鴨，使用創新的包覆手法，酥炸的外皮像是湯包般的包裹著濃厚的芋泥與鴨肉，底部是松露芋泥醬，香味四溢，鹹蛋黃醬汁增加整體味覺，層次豐富。

辣味燉豬$330：墨西哥辣醬炒豬肉丁，肉質偏肥，是個人比較不喜歡的一道，但一旁的豬皮被炸得吹彈可破，稍帶油膩感，搭配四川花椒巧克力，口感算獨特。"
 Ivory Ho ,https://www.google.com/maps/contrib/114903460219848268364/reviews?hl=zh-TW,5,False,6,鴨胸超好吃，梅子氣泡酒好喝(˘³˘)♥
 陳曉東 ,https://www.google.com/maps/contrib/100650593548552375986/reviews?hl=zh-TW,5,False,3,好喜歡來這裡用餐，老闆人好又帥☺️
 Nattt Tsai ,https://www.google.com/maps/contrib/114550793180810407384/reviews?hl=zh-TW,5,True,20,東西好吃店員服務優😍必定2訪還有好多想吃
 Lyn Loo ,https://www.google.com/maps/contrib/104901488063623254975/reviews?hl=zh-TW,5,False,1,疫情間人比較少，但食物好吃服務好，會再回訪
 Irene C ,https://www.google.com/maps/contrib/109014945352137000540/reviews?hl=zh-TW,5,True,29,精緻美味，份量小巧
 Lawrence Cheng ,https://www.google.com/maps/contrib/117827819971546624747/reviews?hl=zh-TW,4,True,296,"餐廳內裝非常前衛，金屬波浪天花加上裸露的水泥，讓整個感覺很新潮摩登。

店內的菜色也是相同的感覺。菜色是融合式料理。用新式的料理方式，展現出食材的原味。

前菜是最讓我驚艷的，菜色非常的多元，炸豆乳雞加上起司，必點菜色，炸雞酥脆多汁，加上刨起司，整個拉高一個層次。

海鮮類也是非常有亮點，烤透抽加上青木瓜絲佐西瓜醬汁，非常清爽，也能吃到透抽的鮮味。還有烤小捲，也是非常出色。

店內有些當天的秘密菜色。可以向服務生詢問。我們當天是蘑菇炒蝦，有點中式的做法，非常開胃。

主餐的鴨胸和鮮魚，火候拿捏的剛剛好，也沒有過度的調味，重要就是讓食材的鮮味，完全展現。

整個用餐完，留下了蠻好的印象，給我一種西班牙餐酒館的感覺，前菜非常的多元好吃，更適合搭配不同的酒類，服務生建議搭配的餐酒也很舒服清爽，價格也很合理。蠻期待下次再訪開心😃"
 jaess mr ,https://www.google.com/maps/contrib/102333289540358726966/reviews?hl=zh-TW,2,False,20,價格中高食物份量少、創意料理但很難讓人理解…只有芋泥封鴨比較特別..其他都還好…
 Blue ,https://www.google.com/maps/contrib/113107550319022623362/reviews?hl=zh-TW,1,False,17,"ASAHI快閃活動有Happyhour就別怕客人喝
提供暢飲容量明顯與文宣不符
詢問店家還硬扯，服務態度與誠信頗差

不會再二訪..."
 J.Y ,https://www.google.com/maps/contrib/117547479572427872997/reviews?hl=zh-TW,4,True,"2,197",鮮蝦干貝蔬菜燉飯醬汁濃郁，有滿滿的蝦味，整體可以感覺到用料紮實，蝦子和干貝也都好吃，是飽滿的一餐~
 葉韋伶 ,https://www.google.com/maps/contrib/103145228553891063972/reviews?hl=zh-TW,4,True,31,味道不錯！
 林chengtao ,https://www.google.com/maps/contrib/114048082246227629939/reviews?hl=zh-TW,5,True,44,雖然只有週末有提供午餐服務，但是我真的要說，他們的餐點實在是用心又美味。而且物超所值，我不是單純說食材，而是他們對每一道菜所下的功夫，還有對客人的服務水準，絕對遠超過所收餐點價錢！
 蘇峻霆 ,https://www.google.com/maps/contrib/102536993879243811157/reviews?hl=zh-TW,2,False,8,上菜太慢，慢到必須點薯條充飢，且各道菜都不夠熱；服務和口味都不值得每人2000元的套餐價值。
 Jeff Su ,https://www.google.com/maps/contrib/112334520312421499002/reviews?hl=zh-TW,3,True,30,菜色份量偏少吃完略空虛😓
 蔣晶晶 ,https://www.google.com/maps/contrib/111344485261766725742/reviews?hl=zh-TW,1,True,29,牛排很難吃主餐超少完全不是1~2人份網美餐廳很失望酒水也很淡……
 Macey H ,https://www.google.com/maps/contrib/101612954879245965309/reviews?hl=zh-TW,2,True,404,"上菜速度超級慢
又吃不飽cp值爆低
超不推"
 Jade Tsai ,https://www.google.com/maps/contrib/110528961901714773632/reviews?hl=zh-TW,4,True,288,酒類平價也有水準．本次點餐：No.31&梅酒，紅酒基底的調酒口感很平衡，酸甜帶有果香，酒的裝飾不會喧賓奪主
 Drew C ,https://www.google.com/maps/contrib/110746011427877218174/reviews?hl=zh-TW,5,True,25,餐廳氣氛很好，服務生非常貼心又有禮貌。食物真的很特別、很好吃。推薦前菜可以點皮蛋沙拉（娃娃菜佐皮蛋黃蘸醬）味道令人難忘！主菜推薦牛排的橫隔膜部位，非常軟嫩，牛味稍微比較重，斟酌考慮。梅子氣泡酒蠻好喝的！
 ChunHun Lin ,https://www.google.com/maps/contrib/108468607545478506276/reviews?hl=zh-TW,5,True,41,"情侶去非常適合，尤其是剛熱戀的那種，少份量的食物可以掩飾你外號是大食怪，或是客套煽情的說自己吃不多。如果吃飽喝足沒有進行成人活動，剛好可以再吃一份鹹酥雞，幫鹹酥雞老闆多賺一筆。

對了，開心果慕斯真的很開心果，吃了很開心。"
 C C ,https://www.google.com/maps/contrib/102659418014842018125/reviews?hl=zh-TW,2,True,75,餐點除了雞肝那道，其他都很普通....裝潢偏冷色系，服務人員講解菜色講太快完全聽不清楚，感覺想趕快講完趕快了事，餐點份量偏小
 陳品伃 ,https://www.google.com/maps/contrib/117952229415985430115/reviews?hl=zh-TW,5,False,3,服務態度很讚！！適合朋友聚餐！
 Lawis Wu ,https://www.google.com/maps/contrib/103486701045260634740/reviews?hl=zh-TW,5,False,6,"期待已久晚餐
Asahi啤酒跟餐點都很搭配
我們4個人每人白+黑白+黑啤
沒記錯9道菜都有點到
印象深刻
雞肝西米露餅炸豬皮牛三寶千層
汙泥鴨鴨雞胸
份量剛好原本fusion菜就不是吃量
何況是用來搭酒的
聽到隔壁大座又小孩又大人在嫌份量少又嘈
真的想跟他們說直走蘋果工房吃到飽
辛苦服務員整晚都很忙
但是整體評價我們也滿意
下次再跟朋友來"
 Sa Sa ,https://www.google.com/maps/contrib/108908680408375975082/reviews?hl=zh-TW,5,True,27,燈光氣氛都到位的好店😋
 Ian Chen ,https://www.google.com/maps/contrib/108617940288318524426/reviews?hl=zh-TW,1,True,40,"我們在8/138：45用餐，遭遇到非常糟糕的用餐經驗，以及服務人員Joanna(綁包包頭女性,身高約150-155cm,無眼鏡,臉部有點嬰兒肥)很粗魯的對待

1.訂位時間為20：40，我們提早20：25到，入座的位子已清空，但Joanna依然告知仍然要等到20：40才能入座，讓我們在門口空等10分鐘以上

2.等待時我們希望能先杯啤酒，點完後Joanna先跟吧台同事聊天聊了大概一分鐘才開始工作，彷彿聊天才是她的優先項目

3.等到20：45依然沒有入座，直到我們「主動」提醒我們的訂位時間才有人帶入位，帶位的男姓服務人員沒有任何道歉或不好意思

4.剛入座不到一分鍾，帶位的男生（往後梳油頭、身高大約175-180、沒有戴眼鏡、原本崗位在靠近門口的Asahibeer區）要求我們移動到最靠近廁所的位子，理由是這桌之後有3位入座，但之後前來的客人卻是一對情侶，讓我們有被欺騙的感受

5.Joanna為我們點餐，但走來點餐時非常明顯的翻了白眼，讓我們感到十分的不被尊敬及不舒服

6.我們點的是綠咖喱鮮蝦花椰菜，但上桌的卻是豆乳雞，因此要求更換正確餐點。但前來處理的Joanna-根據她的說法：我有跟你們確認餐點，你們沒有說有錯，現在沒辦法消單，不管你們吃不吃這道都會在帳單上。我們感到非常的震驚，並感到被威脅，不解為何需為了未吃的餐點付款。我們可能沒有再次確定餐點，但追根就底也是她一開始聽錯餐點，但Joanna對此完全沒有歉意，沒有任何道歉，只是把錯推到客人身上-是客人沒有核對餐點，這對客人是非常不公平的。而被威脅的感受讓我們非常氣憤，久久無訪忘懷

餐點非常美味、氣氛很棒，但很不幸的因為Joanna等服務人員粗魯的對待，毀了美好的夜晚，這是我們當初無法想像的

行銷固然是餐飲業相當重要的一環，但服務更是美好顧客體驗的重要因素，我希望這件事能夠了解並改進第一線服務人員的素質不了及改進，而不是不了了之。"
 Patrick Su ,https://www.google.com/maps/contrib/105984276419875698574/reviews?hl=zh-TW,5,False,9,好吃，燈光美、氣氛佳🤩
 Koupen Chan ,https://www.google.com/maps/contrib/107150646145437698730/reviews?hl=zh-TW,3,False,"1,136","看了許多壞評幾乎都提到上餐慢、服務糟糕的體驗⋯⋯我們也是第一次嘗試這家餐廳，沒有特別期待但最後的結局是晚間後身體一直產器氣.....且很臭😭😭😭可能是料理中有比較容易產氣的食物😭
提早訂位可能比較合適安排一個舒服的用餐區，六點訂位進餐廳後馬上有兩位服務生接洽量體溫的事宜。
餐從點餐到結帳都蠻順利的，上菜有順序不會像台灣餐廳把做好的菜放上桌擠滿了桌面，滿意。
第一道菜我們都非常喜歡，雖份量小但很適合當開胃菜！起士非常的美味！番茄很新鮮！泡沫酸酸的也很好吃，有趣的組合搭配。
溫野菜非常好吃，很多蔬菜綜合一起口感特殊，還有半生熟蛋混在一起很美味，擺盤漂亮。
鴨肉普通，份量小。燉飯味道我個人不喜歡，有一個說不出的怪味。
推薦朋友聚餐但吃不飽，會再訪！

唯一缺點洗手間不太乾淨，需要多巡視洗手間衛生整潔........！"
 pei fen liao ,https://www.google.com/maps/contrib/102393694408491365315/reviews?hl=zh-TW,4,True,170,"精緻美好的食物一場開心的用餐經驗適合跟好朋友一起分享共渡夜晚的時光
餐廳環境舒適價位中等
本次消費共1860元，2人。"
 ben chen ,https://www.google.com/maps/contrib/100055317348287080254/reviews?hl=zh-TW,5,False,9,"超級好吃😋
會在回訪
推推推！"
 weiping Chang ,https://www.google.com/maps/contrib/107055249075962013784/reviews?hl=zh-TW,5,False,1,餐點用心，用餐氣氛佳！
 溫育銓 ,https://www.google.com/maps/contrib/111454621538726352996/reviews?hl=zh-TW,5,True,277,非常驚艷的一間餐廳！
 Lee Claire ,https://www.google.com/maps/contrib/113067355318323476647/reviews?hl=zh-TW,4,True,189,每道菜都還滿好吃的，尤其是芋泥油封鴨，讓長輩們也覺得很特別好吃，對小孩也很友善，服務很好～
 louis wu ,https://www.google.com/maps/contrib/113507395519184947195/reviews?hl=zh-TW,5,True,46,食材/服務都很棒
 Maggie Wang ,https://www.google.com/maps/contrib/100193604720144443763/reviews?hl=zh-TW,5,True,418,餐點好吃，午餐價格很棒，晚餐採單點。特別推薦可以一次喝到啤酒、白酒、紅酒與2款調酒的Set（名字忘了）
 J ,https://www.google.com/maps/contrib/110762481532227687750/reviews?hl=zh-TW,5,True,95,疫情期間叫外送每樣都非常好吃包裝可愛店員態度也非常好推推
 yanhung Lin ,https://www.google.com/maps/contrib/113508350659986954958/reviews?hl=zh-TW,5,False,5,"前天路過進去吃飯
建議提前預約，晚上生意很好
餐點、調酒種類多，店員也會熱情介紹👍🏻
下次還會去光顧
p.s店長酒量很好😁"
 Chang Jeff ,https://www.google.com/maps/contrib/110040763822847187156/reviews?hl=zh-TW,5,False,4,超棒的餐廳！餐點都非常的用心，店裡氛圍也會讓你除了吃頓飯以外想多喝幾杯酒！
 周碩賢 ,https://www.google.com/maps/contrib/106994745153699990337/reviews?hl=zh-TW,2,False,15,"上次來用餐體驗非常的好
但這次來給人的感受不只廚房問題滿多的
外場的應對反應也不如之前

點餐時想要點調酒所以問飲料還有什麼選擇
結果服務員只有一直提到商業午餐的飲料怎樣怎樣
單點的部分竟然誤會成要單點全部的主餐
完全沒有考慮到很少有客人一人點一道套餐還要單點主餐反而沒想到我們是要點單點

餐點基本上沒什麼
但是單點的炸雞完全就是生的
跟服務人員反應之後竟然表示肌雞肉本來就做這樣這樣的答案並不是那麼讓人可以接受

最後會讓我想上來打這份評論的原因是
我們離開後才發現
少上了一道提拉米蘇
可是服務人員也是完全沒注意到
這樣的用餐體驗真是讓人失望"
 Steph Lee ,https://www.google.com/maps/contrib/105977815234265497073/reviews?hl=zh-TW,2,True,101,asahi系列餐點蠻失望的，鮭魚慕斯腥味頗重、千層麵也很普通，較推薦來喝東西搭配炸雞即可
 Yuling ,https://www.google.com/maps/contrib/115449423707786916836/reviews?hl=zh-TW,5,True,46,"開心果提拉米蘇好吃😋
炸雞與蛤蜊也很驚艷🌹
還有隱藏菜單（圓鱈與干貝）
十分美味的一餐"
 廖廖 ,https://www.google.com/maps/contrib/112063014001002230333/reviews?hl=zh-TW,2,True,25,服務很好，價錢跟食物就不評論了......
 Eddie Chang ,https://www.google.com/maps/contrib/102782771553388557204/reviews?hl=zh-TW,5,False,7,"服務人員非常親切，餐點也非常精緻！
絕對是約會餐廳首選！"
 Pika Kuo ,https://www.google.com/maps/contrib/115623646158950600330/reviews?hl=zh-TW,5,True,41,"餐廳裝潢高貴典雅，整個很有氣氛，食物精緻好吃！
蠻適合約會，或是偶而跟朋友來這邊聚餐的，推一下~"
 Sophie Cheng ,https://www.google.com/maps/contrib/109734680263019831665/reviews?hl=zh-TW,5,True,20,"服務和餐點都非常優質
食材新鮮，混搭的很協調，調味也很相襯
服務很客氣貼心，算是相當平價的finedining"
 Yuning Su ,https://www.google.com/maps/contrib/112448638894240084069/reviews?hl=zh-TW,4,False,13,"餐點水準不錯，特別推薦主餐的肉類料理。
相較之下前菜稍微普通一些，但整體來說還是值得推薦。"
 Erie Nan ,https://www.google.com/maps/contrib/108951052630366837747/reviews?hl=zh-TW,5,True,31,"精緻美味
服務親切
是個美好的夜晚～"
 Veda Chang ,https://www.google.com/maps/contrib/108461253262972816922/reviews?hl=zh-TW,5,False,1,"氣氛輕鬆自在，餐點非常用心
也適合搭配紅白酒或服務人員推薦Draft酒款
會讓人想再訪的餐聽"
 FOX Cheng ,https://www.google.com/maps/contrib/110174420611839938774/reviews?hl=zh-TW,5,True,35,藝術般的料理！就算是ㄧ滴醬，都能觸碰味蕾~是個下班可以舒服品酒的好地方!
 Kaka瑜 ,https://www.google.com/maps/contrib/108329784626209459050/reviews?hl=zh-TW,5,True,168,好吃、氣氛好😊😊
 Elisa Chen ,https://www.google.com/maps/contrib/117477297106572978605/reviews?hl=zh-TW,5,False,9,每道料理跟sauce都調得恰到好處，也都好吃又很下酒，裝潢與燈光配置都很大器，最大的亮點是音樂!!!太有品味了
 傅得正 ,https://www.google.com/maps/contrib/108544415338626134571/reviews?hl=zh-TW,5,True,16,店長、服務生很熱情，調酒超好喝、餐點好吃有深度，會在二訪～
 eva shao ,https://www.google.com/maps/contrib/100048661079171765730/reviews?hl=zh-TW,3,False,5,食材與食物不錯，但是服務人員太少，上菜速度慢到請客的人都尷尬！
 apriilll.c ,https://www.google.com/maps/contrib/114629523171892033088/reviews?hl=zh-TW,5,False,8,"餐廳服務生態度超級讚！！！
食物烹飪的非常有水準
重點表揚！：
豆乳炸雞&黃啤superdry"
 李豪（HOW） ,https://www.google.com/maps/contrib/105651212158462856672/reviews?hl=zh-TW,5,True,179,"餐點美味推牛排！
調酒推14號濃順"
 李晨維 ,https://www.google.com/maps/contrib/116742170061965329467/reviews?hl=zh-TW,1,True,45,"真的是頓很糟的晚餐
主菜要等兩小時==
別桌也同樣等那麼久，甚至看到大家等到在打哈欠⋯
帶朋友去慶生但我感覺很差勁
完全不會想再訪第二次！"
 李肥欣 ,https://www.google.com/maps/contrib/103865279785358461083/reviews?hl=zh-TW,1,True,51,"餐點非常非常非常無敵慢
主餐需要兩個小時才會上
吃一頓飯需要四小時起跳
以這樣的價位服務品質這樣非常不ok
燈光昏暗氣氛還行冷氣爆冷"
 Shelly Hsiao ,https://www.google.com/maps/contrib/102741675970940997993/reviews?hl=zh-TW,5,False,11,氣氛輕鬆，環境舒適，餐點富有創意而且都很好吃！非常適合跟三五好友聚餐小酌🍻
 Charles Lee ,https://www.google.com/maps/contrib/109177901422698217064/reviews?hl=zh-TW,4,True,20,食物很棒，但是午餐時間坐在靠門口的位置會相當熱，建議空調可以改善一下
 竺葶 ,https://www.google.com/maps/contrib/102954421769444638764/reviews?hl=zh-TW,5,False,14,氣氛超讚～東西好吃～～
 劉姵妘 ,https://www.google.com/maps/contrib/109292698269196574466/reviews?hl=zh-TW,5,False,3,超好吃～讚啦👍🏻
 VK Wang ,https://www.google.com/maps/contrib/110200928177741697848/reviews?hl=zh-TW,5,False,12,吃了烤雞套餐份量很夠還贈送一瓶氣泡酒，而且服務態度很好～
 許景閎 ,https://www.google.com/maps/contrib/102003686035530691446/reviews?hl=zh-TW,5,False,5,"食物和酒水皆相當有水準，
氣氛舒適。
可以放鬆喝酒吃菜聊天的那種。"
 黃品誠 ,https://www.google.com/maps/contrib/118089198757304044586/reviews?hl=zh-TW,5,False,1,"用餐環境很棒！
服務人員態度很好
餐點很棒推薦泡芙蟹肉跟炸鵪鶉皮蛋"
 八翡 ,https://www.google.com/maps/contrib/103545732953253314257/reviews?hl=zh-TW,5,False,1,氣氛超好，draft居然有紅白酒！水準也夠！一定會在回訪
 Ruby Chen ,https://www.google.com/maps/contrib/116816399122533565423/reviews?hl=zh-TW,3,True,35,氣氛及服務都很好但是餐點對我來說並不突出有點失望
 Wanyulee Lee ,https://www.google.com/maps/contrib/110855593886111042427/reviews?hl=zh-TW,5,False,4,"新型態的餐酒館，餐點精緻不貴。適合久留，
喝好幾杯。"
 LY C.C ,https://www.google.com/maps/contrib/114526634911240240150/reviews?hl=zh-TW,5,True,30,餐點、氣氛、服務都很好。很適合下班後與朋友來個小約會。
 Travis Feng ,https://www.google.com/maps/contrib/117138341405274428357/reviews?hl=zh-TW,5,False,6,"服務態度很好
餐點很棒
很喜歡Asahi的活動期待之後可以推出新的餐點!!!!"
 陳amanda ,https://www.google.com/maps/contrib/114779873691645825901/reviews?hl=zh-TW,4,False,16,會讓人驚呼想要再來品嚐更多其他菜色的舒適慵懶餐酒館
 Yen-Chieh Chang ,https://www.google.com/maps/contrib/100238052972691579466/reviews?hl=zh-TW,4,False,98,"餐點好吃
但是如果能減少油炸的方式去料理會更好"
 Carol Chen ,https://www.google.com/maps/contrib/100871384735937585249/reviews?hl=zh-TW,4,True,23,餐點很有特色
 Chia chi Kuo ,https://www.google.com/maps/contrib/114748426422548068637/reviews?hl=zh-TW,5,False,15,近期吃過表現算好的創意料理，只可惜部分餐點份量少
 Carol Yu ,https://www.google.com/maps/contrib/106632814377588222694/reviews?hl=zh-TW,2,False,3,燉飯太硬、還冷冷的，讓人失望
 UbiQuiTousLy ,https://www.google.com/maps/contrib/104246833503747199140/reviews?hl=zh-TW,3,True,"1,610",不喜不厭，餐點技術含量相對低，有很大進步空間～
 黃思華 ,https://www.google.com/maps/contrib/110207569072347402679/reviews?hl=zh-TW,5,False,8,好吃😋服務又讚👍🏼
 王慶鴻 ,https://www.google.com/maps/contrib/104820695098477225674/reviews?hl=zh-TW,1,False,6,快閃店辦得夠爛，酒容量跟文宣不符合，還硬凹
 Jeff Tai ,https://www.google.com/maps/contrib/106846336760846317204/reviews?hl=zh-TW,5,False,6,"珊蒂服務很好Lawis很帥
東西很好吃！"
 Sher ,https://www.google.com/maps/contrib/118152980744868013404/reviews?hl=zh-TW,1,False,1,食物與服務皆差強人意。
 Lun Lee ,https://www.google.com/maps/contrib/100303343085798431486/reviews?hl=zh-TW,4,True,87,環境不錯，餐點偏創意
 Yu-Chung Hsu (Nagy) ,https://www.google.com/maps/contrib/117594848904675737692/reviews?hl=zh-TW,4,True,49,氣氛佳食物美
 Alice Chou ,https://www.google.com/maps/contrib/113392312783787661621/reviews?hl=zh-TW,5,False,1,餐點每樣都超好吃，完全無雷，推薦！！
 蔣孝東 ,https://www.google.com/maps/contrib/114023504592446209136/reviews?hl=zh-TW,1,False,4,"服務差狗眼看人低當非顯赫身分的人是狗一樣
態度差服務也做不好差"
 林欣穎 ,https://www.google.com/maps/contrib/117831224357471048317/reviews?hl=zh-TW,4,False,18,可能剛好坐在風口下，冷得有點食不知味。
 王鼎 ,https://www.google.com/maps/contrib/100062002289092766510/reviews?hl=zh-TW,5,True,544,精緻優質的餐點與用心且細緻的服務
 Aislinn Hsu ,https://www.google.com/maps/contrib/106398240123382663100/reviews?hl=zh-TW,5,False,2,活動辦得超棒，期待Xavier主廚的快閃波段☺️
 吳東嶸 ,https://www.google.com/maps/contrib/111033325712691140005/reviews?hl=zh-TW,5,True,500,好吃而精緻，台灣食材的西式精緻料理
 張慈伶 ,https://www.google.com/maps/contrib/112461045947772565400/reviews?hl=zh-TW,5,False,6,餐廳氣氛好、又好吃，極推☺️
 Ed Wang ,https://www.google.com/maps/contrib/109615572190061623134/reviews?hl=zh-TW,5,True,388,好吃卻不到驚艷，餐廳內很冷
