user_name,user_profile_url,rating,local_guide,comment_num,comment_text
 Lin Shelly ,https://www.google.com/maps/contrib/113329860545758154414/reviews?hl=zh-TW,5,True,90,"餐點很清爽，嫩雞很好吃不油膩無負擔
大推附的辣醬！怕辣的我也覺得很好吃😋
下次想去試試看牛肉😏"
 Sonia Lin ,https://www.google.com/maps/contrib/112620527921983089809/reviews?hl=zh-TW,5,True,49,早午餐好吃風格舒適愜意適合好友們聚會很好拍照餐點也好吃早午餐也適合減脂低醣餐
 小小 ,https://www.google.com/maps/contrib/101790646471564594397/reviews?hl=zh-TW,4,False,88,"⚓讓人意猶未盡,時常回訪的低碳健康美味料理😋😋😋😋😋"
 Gloria ,https://www.google.com/maps/contrib/105805356670618764937/reviews?hl=zh-TW,4,True,181,"健身人的餐點！！讚！！
位置很方便，真的就在市府站旁邊
但不好找，要仔細找店
牛排很好吃😋"
 李婕如 ,https://www.google.com/maps/contrib/108215981232944071713/reviews?hl=zh-TW,5,True,14,"真的超喜歡他們家的餐點
一個禮拜午餐都吃他們家的料理
沒想到還可以瘦個兩公斤
真的是吃得開心就瘦的開心耶🥰🥰"
 邱彥宜 ,https://www.google.com/maps/contrib/111314930457050356471/reviews?hl=zh-TW,5,False,4,米飯很Q、蔬菜新鮮不是冷凍蔬菜！！份量大方，cp值很高👍👍👍推推
 Tina L ,https://www.google.com/maps/contrib/100062414691060986963/reviews?hl=zh-TW,4,True,148,"環境不錯～跟TamedFox走的路線有點像，喜歡這種加州美式健康食物的人可以來嘗試！
當天點的是鮭魚碗，個人覺得很好吃～可以整碗吃光光，尤其是小魚辣椒整個畫龍點睛！
但是飲料就蠻不推薦點，因為單價真的比較高，蠻小一杯沒有也沒有特別好喝～"
 KUANYU WENG ,https://www.google.com/maps/contrib/115032954214087682438/reviews?hl=zh-TW,5,True,172,店內氣氛佳，餐點份量對女性來說剛好，對身體負擔少又好吃。
 Cz Lian ,https://www.google.com/maps/contrib/100364222685275845794/reviews?hl=zh-TW,5,False,11,"喧囂繁華的都市裡
趁著陽光依舊溫柔的冬午
忠孝東路旁的小巷
屏息靜神尋覓一地
在這
那一處美味與健康遇見的美好"
 李欣蓉 ,https://www.google.com/maps/contrib/107797341866076521124/reviews?hl=zh-TW,4,False,10,覺得餐點沒有不好吃環境也沒有不好但內場員工在幫客人料理卻全程口罩戴在下巴那我覺得在這非常時期的狀況下這樣很不美觀跟衛生希望能改進這一點🥹
 Bonnie Lin ,https://www.google.com/maps/contrib/107181693782117326758/reviews?hl=zh-TW,1,True,6,外送貴量超少，買一送一是沒有圖片的地雷。南瓜湯稀又沒料，照片這樣的內容，要這種價錢，很坑很薛，欺騙
 White Bai ,https://www.google.com/maps/contrib/114505318719943269566/reviews?hl=zh-TW,5,False,28,"氣氛很不錯，餐點口感清爽順口，份量也很適中
早餐午餐晚餐或下午茶都很適合"
 Hsin Yueh Chuang (Una) ,https://www.google.com/maps/contrib/110663871926429822263/reviews?hl=zh-TW,4,True,78,"挺健康的餐，調味適中，非常清爽！
食材好多～雖然菜比想像中少、澱粉比較多😂
價位偏高哦！"
 許靜 ,https://www.google.com/maps/contrib/105297527771714845498/reviews?hl=zh-TW,5,False,2,"環境舒適有提供熱水很貼心
餐點飲料好吃😋"
 Genie Yeh ,https://www.google.com/maps/contrib/111480510877116408207/reviews?hl=zh-TW,3,False,29,看起來很漂亮～環境舒服，但鮭魚很鹹腥味有點重，紫米飯不夠配
 林家弘 ,https://www.google.com/maps/contrib/111408291305073765948/reviews?hl=zh-TW,5,False,7,"點了嫩雞沙拉早餐盤，整體來說滿好吃的，有驚艷到

濃湯、嫩雞、麵包都好吃"
 Stanley J. ,https://www.google.com/maps/contrib/115208223162312392543/reviews?hl=zh-TW,5,False,12,好吃順口不油膩，色香味俱全，三不五時就叫他們家的便當來吃希望可以推出更多的菜色🤗🤗🤗🤗
 Wen L ,https://www.google.com/maps/contrib/105172453758621731782/reviews?hl=zh-TW,5,True,14,檸檬雞腿很好吃！
 Sam Chen ,https://www.google.com/maps/contrib/115691989424602783462/reviews?hl=zh-TW,1,False,2,"今天我點了一份雞肉平衡餐再單點一份雞肉，由於有單點一份雞肉，向店家要一份麻花醬來沾，卻被告知一份醬料20元，其實店家一份餐點並不便宜，我因爲單點想額外索取一份醬料並不為過,而且以前麻花醬也不需要額外收費..。從他店家剛開幕，我就一直是常客，即使價位偏高，我還是持續支持，希望這部份店家能夠改善，以留住客源。謝謝"
 YuYi Shih ,https://www.google.com/maps/contrib/101496100354743856170/reviews?hl=zh-TW,5,True,25,好吃的低GI餐點，磅蛋糕也讓人驚艷。必推
 Molly Wong ,https://www.google.com/maps/contrib/101299002879269870491/reviews?hl=zh-TW,5,False,8,美味營養兼具，最推鮭魚跟嫩雞，番茄牛肉湯跟南瓜湯也很好喝！店內採光很好，不限時又有插座，店員們也都很友善不會趕客人，待一個下午都沒問題😂
 阿中 ,https://www.google.com/maps/contrib/102622159373530088634/reviews?hl=zh-TW,1,True,18,自從老闆跟老闆娘不再店裏，只剩下員工顧店後，品質和服務都變很多！
 Vincent Qoo ,https://www.google.com/maps/contrib/117682895476871195955/reviews?hl=zh-TW,5,True,101,微辣麻花醬特色十足，小辣微麻卻爽口，整體食材健康且美味，價格划算。
 Lily Chen ,https://www.google.com/maps/contrib/113029099296278062744/reviews?hl=zh-TW,4,True,601,"烤大蝦沙拉🦐
健康又美味的餐盒"
 y.c. s ,https://www.google.com/maps/contrib/111361196808733975044/reviews?hl=zh-TW,4,True,606,"好吃。
健康滿分。。美味
環境舒適"
 Hsiao Yi Huang ,https://www.google.com/maps/contrib/103196367784304137342/reviews?hl=zh-TW,4,True,288,食物不錯，店內舒適，價位偏高
 陳河谷 ,https://www.google.com/maps/contrib/117815709274296915425/reviews?hl=zh-TW,1,True,5,南瓜湯很水，舒肥雞很柴，買一送一沒圖片會誤買超雷的，我以為便當，二個人等了二小時的晚餐傻眼，大哥這是熱門餐點？另外熊貓外送很爛要二三小時送達，我才住十分鐘路程
 陳透抽 ,https://www.google.com/maps/contrib/101685434654570780370/reviews?hl=zh-TW,4,True,945,飯好吃！相當有水準，軟硬黏度適中恰當。調味合宜，值得一試。
 何卓澔（Jerry Ho） ,https://www.google.com/maps/contrib/114217625027743124823/reviews?hl=zh-TW,5,False,2,"1.餐點好吃且兼具健康的特色
2.店內用餐環境乾淨整潔且舒適
3.店員親切用心提供點餐服務"
 chaojung wu ,https://www.google.com/maps/contrib/113165330004511244925/reviews?hl=zh-TW,1,False,4,訂餐寫錯地址，害我們花了超級多時間找一個便當！差勁的服務！
 NEO Chuang ,https://www.google.com/maps/contrib/118115242798762830879/reviews?hl=zh-TW,3,True,62,"外帶兩個餐盒，無論是米飯、主食、或是配菜都是冷的，配菜除了高麗菜沒味道之外，其餘味道還不錯；
另外點了一碗番茄牛肉湯，牛肉是碎肉？然後整碗味道有夠鹹，鹹到可以拿來拌麵當肉醬的程度，建議廚師出餐前都先試一下味道，不然實在有愧於消費者。"
 蔣依容 ,https://www.google.com/maps/contrib/111722055754904883390/reviews?hl=zh-TW,5,True,82,"藏在不起眼的巷子，價位ok~
端上來份量蠻多的醬料也好吃！"
 陳郁芬 ,https://www.google.com/maps/contrib/112485229093428123148/reviews?hl=zh-TW,5,False,141,午夜嫩雞沙拉加微辣麻花醬，口感很清爽，值得二訪
 Howard Yu ,https://www.google.com/maps/contrib/118213720238045559579/reviews?hl=zh-TW,5,True,54,"舒服的餐廳環境舒適餐點健康
但是不要點湯不划算"
 Chocolate Chen ,https://www.google.com/maps/contrib/115674815310330268338/reviews?hl=zh-TW,5,False,8,牛肉很嫩，餐點份量很多～店裡氣氛很棒很美！❤️
 PoYa Chang ,https://www.google.com/maps/contrib/104047377605449753661/reviews?hl=zh-TW,3,True,80,"環境跟餐點都OK。地點位在鬧區。
以原型食物餐點（餐廳）來說表現一般，
比較適合偶爾想吃健康的人！
對於飲食控制中的人來說餐點口味偏重，份量也不太夠（如果想要低碳組合的話）。
但推薦給跟朋友一起聚餐逛街時可以選擇囉！"
 Chun-Ting Cheng ,https://www.google.com/maps/contrib/114659448251746063543/reviews?hl=zh-TW,5,False,1,公司離午葉很遠所以不在外送平台的服務範圍內，還是和同事一起請店家外送了好幾次，忍不住就是想吃！辣椒小魚超級下飯！微辣的沙拉醬也好特別！雖然是健康餐但怎麼會這麼好吃啦～
 Jia-Yi Lin ,https://www.google.com/maps/contrib/117246419770320337857/reviews?hl=zh-TW,3,True,216,店內舒適，餐點配色好但美味度普通
 Lin Shuan ,https://www.google.com/maps/contrib/115930237857503000940/reviews?hl=zh-TW,1,False,21,"今天訂位去，坐下來店員上完水要点餐才告知所有酪梨的餐點都不能點不供應，但此店把酪梨拿來做最大賣點，我問店員：但是你們幾乎所有餐點幾乎都有酪梨誒那我們要點什麼？
店員支支吾吾的回：呃那可以換麵包..或蛋…或菜多一點？
我跟朋友？？？餐點裡面本身就有蛋，還再換蛋？然後餐點也有麵包但能抵酪梨嗎？
店裡明顯沒有訓練好店員
建議可去十分鐘內可到達的tamedfox"
 朱珮瑄 ,https://www.google.com/maps/contrib/106153248669524361391/reviews?hl=zh-TW,5,True,91,"第一次在店內用，店員非常耐心解釋
中午午餐可以吃到鮭魚卵幸福"
 Emily Ho ,https://www.google.com/maps/contrib/116734616073750228128/reviews?hl=zh-TW,2,True,68,"餐廳空間明亮乾淨，唯一美中不足是詢問菜單餅乾茶是什麼，店員回答:""就是一種茶阿~""讓我們不知所措。如果餐點的解釋或員工教育訓練加強會更加專業，謝謝。"
 黃思穎 ,https://www.google.com/maps/contrib/110286410524092420083/reviews?hl=zh-TW,1,False,9,"買沙拉送活生生肥滋滋扭來扭去新鮮蛋白質
吃沒兩口就發現被嚇到超想吐直接爆哭
想有如此體驗的快來吃"
 孫慧珊 ,https://www.google.com/maps/contrib/117118756076500284665/reviews?hl=zh-TW,5,True,30,前幾天跟公司同事一起點餐盒，辣椒小魚讓人非常驚豔！蔬菜種類也很多樣，豐富好吃~~~好可惜防疫期間不能內用，希望可以快點到午葉坐下來好好吃一頓飯。
 Ann Ann ,https://www.google.com/maps/contrib/117766440880137035899/reviews?hl=zh-TW,1,False,21,"用ubereat訂餐寫有優惠，結果賣家用不實照片誤導讓人以為有蔬菜，結果兩百多只有飯跟一點肉，味道也不好吃，氣到讓人來留google評論，其他五星評論還配了一對食物濾鏡照，感覺就是業配，無良店家，欺騙消費者，為什麼還可以洗到四顆星？？？
補充評論：明明從2019就開始在其他平台騙人，還說是近日照片誤植，店家這種顛倒是非的說法也是領教了～"
 J Huang ,https://www.google.com/maps/contrib/106188683758448136284/reviews?hl=zh-TW,3,False,31,"內用舒肥嫩雞餐，內用需外加一成服務費。

優點：食材新鮮（節瓜川燙處理就有甜味且無苦味、沙拉葉新鮮且無冒水等）

缺點：上餐時間意外的慢，餐點的組成感覺都是可以預先做好的東西
1)紫米飯－上的時候是冷的
2)辣味小魚乾
3)各種沙拉葉
4)毛豆
5)紫薯
6)南瓜
7)炒菇－也是冷的
8)舒肥雞－感覺是舒肥放冷後略烤然後撒上胡椒鹽
9)一小片醃番茄
10)半顆溏心蛋

以上都算是冷食

對於上班族而言，上餐速度略久（可能有等近15分）。

環境雖營造的很乾燥風，但有一些體驗上的改進之處
1)每兩三桌桌上就有一盆擴香，容易影響食物的嗅覺體驗
2)椅子的布面部分有污漬

如其他評論所建議，食材的處理，建議參考新光三越A4底下的Danny'sGreen

但從業者的角度來說，如果搭配餐盒，加上吸引不求快、求聊天、客單價能高於500元的客人的話，應該仍能經營的下去。

不過應該不能吸引到預算位於180-260的上班族客群。

謝謝食物🙏"
 Sammi Wu ,https://www.google.com/maps/contrib/107183473701755428800/reviews?hl=zh-TW,4,True,66,喜歡蔬食健康料理的朋友，很推薦
 Mo Mo ,https://www.google.com/maps/contrib/102622982998610255019/reviews?hl=zh-TW,5,True,29,"板娘是正妹～被板娘圈粉
如果說孫芸芸讓做家事變得優雅
那午葉正妹板娘讓吃中餐變得時尚"
 Bear Chang ,https://www.google.com/maps/contrib/116750437467498027617/reviews?hl=zh-TW,4,True,28,還不錯吃但價格有點偏高..
 Michael ,https://www.google.com/maps/contrib/103972621606184288913/reviews?hl=zh-TW,5,False,6,健康好吃，口味清爽不油膩～
 Lilian Chen ,https://www.google.com/maps/contrib/106245951775339566762/reviews?hl=zh-TW,5,True,"1,128",便當好吃，雞肉牛肉肉質不錯
 Yayun Lo ,https://www.google.com/maps/contrib/101464173767492875132/reviews?hl=zh-TW,5,True,62,南瓜濃湯裡有小顆的蒟蒻，很令人驚喜。店員親切且不會趕人，空間雖小但乾淨，如果有提供置物藍可以放包包會更好！另外內用有加收一成服務費。
 Peiyun Huang ,https://www.google.com/maps/contrib/108650244784448395664/reviews?hl=zh-TW,4,True,102,叫外送吃的，價格偏高但是味道真的好，感受得到烹調的用心！會再回購😋
 MARTIN ,https://www.google.com/maps/contrib/110868684988929590208/reviews?hl=zh-TW,5,False,1,氣氛舒適餐點清新有深度店員服務態度親切
 s l (JasonPi) ,https://www.google.com/maps/contrib/111768725861850059657/reviews?hl=zh-TW,1,True,40,這也差太多了吧
 蘇霈楦 ,https://www.google.com/maps/contrib/103005239376881447093/reviews?hl=zh-TW,1,False,2,水杯有魚腥味。很不乾淨
 Julie ,https://www.google.com/maps/contrib/100268045728996073393/reviews?hl=zh-TW,1,False,11,外送拿到牛肉是冷的，也不具舒肥處理的口感，飯是冷的，沙拉內容物也很簡單，一個舒肥牛里肌餐盒要298再加上外送費，一點都不值得！非常不推薦
 王愉玄 ,https://www.google.com/maps/contrib/116150617514662846782/reviews?hl=zh-TW,5,True,103,烤鮭魚超好吃我的天！
 WEI WEI LIU ,https://www.google.com/maps/contrib/117424917334908770435/reviews?hl=zh-TW,5,False,23,"實在太美太好吃以致於忘記拍照了！
食材新鮮且美味，醬料令人驚艷！
外送到家一樣很好吃～～～～
店家還打來問口味如何實在太用心了
下次還會再回購：）"
 Jess Liu ,https://www.google.com/maps/contrib/111174665568183374712/reviews?hl=zh-TW,5,True,231,環境舒適，健康好吃
 Patty.C ,https://www.google.com/maps/contrib/108064145665671939326/reviews?hl=zh-TW,5,False,7,"好吃，不只是外觀好看而已！
很推薦麻花醬，搭配沙拉超對味！"
 沈昱丞 ,https://www.google.com/maps/contrib/100487988780865536960/reviews?hl=zh-TW,4,False,1,這次點了鮭魚碗跟嫩雞平衡餐，跟媽媽吃的很滿足覺得很健康調味也很夠，只是店面有點難找在暗巷裡面。
 陳怡君 ,https://www.google.com/maps/contrib/110528136799441954198/reviews?hl=zh-TW,5,False,9,很好吃，沙拉新鮮，雞肉軟嫩，尤其番茄牛肉湯，真的令人驚喜，好喝！
 stanley chen ,https://www.google.com/maps/contrib/104785134238642944685/reviews?hl=zh-TW,5,False,4,"信義brunch首選
美味好吃健康"
 Li-Li H ,https://www.google.com/maps/contrib/101504541924099239339/reviews?hl=zh-TW,5,False,123,"第一次吃到麻花醬，超好吃！
應該是花椒跟胡麻的感覺～
雞肉也很嫩，選用紫米好健康
健康便當都能吃光光～推推！"
 廖偉堯 ,https://www.google.com/maps/contrib/112514473773956712758/reviews?hl=zh-TW,1,False,3,外送說要等10分鐘，之後再來取餐，櫃台說飯沒有了，還要在等....把人當猴子耍嗎？
 Rose Chiu ,https://www.google.com/maps/contrib/115131219942329378336/reviews?hl=zh-TW,5,False,4,台北最好吃的餐盒，好看又好吃，沒想到沙拉紫米飯可以如此美味，外帶餐盒走在街上，彷彿置身在紐約曼哈頓前往公園野餐的路途中。
 Patty Pung ,https://www.google.com/maps/contrib/102069023869952918304/reviews?hl=zh-TW,5,False,5,氛圍不錯。服務好
 Sabrina ,https://www.google.com/maps/contrib/105512839187140884264/reviews?hl=zh-TW,5,False,20,"每個口味都非常的用心，食材相當新鮮。
最特別的是獨門醬料，大開我的味蕾，再強調一次，醬很強！❤️"
 lin salt ,https://www.google.com/maps/contrib/112041197399771265086/reviews?hl=zh-TW,5,False,11,"吃完才想到忘記拍照😅
看我吃得這麼乾淨就知道多好吃
那個菜真的夠脆又好吃算是洗刷我以往對沙拉的印象
雞肉也是嫩到一個爆炸我懷疑到底吃了什麼
畫龍點睛的醬料真的很讚超開胃
最後配上一瓶酸酸甜甜的綠森林

人生如此已無遺憾"
 willy yeh ,https://www.google.com/maps/contrib/112915678850723220669/reviews?hl=zh-TW,1,True,24,在台塑後面巷子買到……餐盒幾乎都冷了，而且蔬菜部份還有臭酸味……價錢還要130（很貴）東西又少！
 王駿翰 ,https://www.google.com/maps/contrib/100607458571073067968/reviews?hl=zh-TW,5,False,3,用餐環境跟餐點出色。
 蔡加雯 ,https://www.google.com/maps/contrib/101938509363820566205/reviews?hl=zh-TW,5,False,4,"超好吃的餐盒
本身是健身顧問，非常適合我們的飲食需求。
重點是還很好吃！"
 Christy ,https://www.google.com/maps/contrib/113807817154814712560/reviews?hl=zh-TW,4,False,6,"今日的麻花餐盒有部分雞肉沒熟
請再注意哦"
 Connie L ,https://www.google.com/maps/contrib/113016737463891722444/reviews?hl=zh-TW,5,False,3,超精緻的餐盒，打開後超驚艷，擺盤配色超美超用心，尤其醬料超好吃的，我這個禮拜已經點三次了
 評鑑師 ,https://www.google.com/maps/contrib/104784012497173288155/reviews?hl=zh-TW,1,True,19,服務真的是瞧不起人？看人低的概念！我看你們餐點也好吃不到哪去！
 孫翼芬 ,https://www.google.com/maps/contrib/104629177968464413316/reviews?hl=zh-TW,5,False,5,清爽可口不油膩該有的營養成分都有了，擺放裝飾有美感，但重要的是好吃、好吃、真好吃
 Ava Hung ,https://www.google.com/maps/contrib/111821494564611808263/reviews?hl=zh-TW,5,True,79,信義區可以排上前三名的沙拉輕食餐🤍
 Jemp Wu ,https://www.google.com/maps/contrib/105960974135830835293/reviews?hl=zh-TW,5,False,1,偶然路過的驚喜，蔬菜滿盤主餐也健康好吃，店內氣氛佳！
 Maxine Chan ,https://www.google.com/maps/contrib/111701727180001856135/reviews?hl=zh-TW,5,False,9,美味的午餐，沙拉醬微辣很開胃！還會再來光顧的！
 羽汝鄭 ,https://www.google.com/maps/contrib/108910479366613541203/reviews?hl=zh-TW,5,False,3,環境很舒服、漂亮，餐點非常好吃！超推舒肥牛里肌餐盒👍🏻
 黃筠筑 ,https://www.google.com/maps/contrib/100362296168038053727/reviews?hl=zh-TW,4,True,45,"服務人員很熱心的一直要倒水~
餐點很好吃"
 Osushi Liu ,https://www.google.com/maps/contrib/113620451505205753708/reviews?hl=zh-TW,5,False,6,"牛肉好吃、紫米飯很Q,豌豆濃湯也很推薦喔！"
 Charlie Duncan ,https://www.google.com/maps/contrib/114899781042792145532/reviews?hl=zh-TW,5,True,17,食材新鮮健康美味
 Sandra Lin ,https://www.google.com/maps/contrib/113962557620990317583/reviews?hl=zh-TW,5,False,9,美味且用料實在，店內裝潢很美，適合拍照
 R L ,https://www.google.com/maps/contrib/107165521837422424050/reviews?hl=zh-TW,5,False,2,肉很嫩菜新鮮，整道很清爽，還會再來！！！
 Wan-Ling Tseng (ioloi) ,https://www.google.com/maps/contrib/114491679987681255882/reviews?hl=zh-TW,4,True,157,"地點方便,清新的早午餐"
 美美 ,https://www.google.com/maps/contrib/113384384330797431391/reviews?hl=zh-TW,5,False,12,喜歡！
 黃勁淇 ,https://www.google.com/maps/contrib/104172749597898450267/reviews?hl=zh-TW,5,False,4,出乎意料整體吃的夠飽適合健身的人補充好的蛋白質跟纖維
 Hua-Sheng Tseng ,https://www.google.com/maps/contrib/101927831924247492312/reviews?hl=zh-TW,5,False,14,雞肉很嫩，沙拉很新鮮份量很夠，推！
 Frank Lin ,https://www.google.com/maps/contrib/100269304844802369681/reviews?hl=zh-TW,5,False,5,👍
 Ru-Yun Chiu ,https://www.google.com/maps/contrib/110562319029955736222/reviews?hl=zh-TW,5,False,2,"好吃健康的餐盒
吃得飽又營養
推薦❤️"
 RY L ,https://www.google.com/maps/contrib/107866407583652137357/reviews?hl=zh-TW,5,False,5,闆娘又正又用心，食物超好吃，是用心經營的好店👍
 sunny yuan ,https://www.google.com/maps/contrib/110454160179515463783/reviews?hl=zh-TW,5,True,22,嗆的很好吃～
 Amber Liu ,https://www.google.com/maps/contrib/118360279599178087124/reviews?hl=zh-TW,5,False,7,今天在播BorisBrejcha的歌！必須給五顆星
 Happy061415 ,https://www.google.com/maps/contrib/118410137740556617999/reviews?hl=zh-TW,5,False,10,舒肥雞非常嫩很好吃喔😋
 Vivian Chen ,https://www.google.com/maps/contrib/110812658347696843130/reviews?hl=zh-TW,5,False,6,健康的餐點但食物調味很好，好吃
 johnny ,https://www.google.com/maps/contrib/108487288311667517233/reviews?hl=zh-TW,5,False,11,用料實在，餐點美味，氣氛佳，適合約會
 Jackson Chang ,https://www.google.com/maps/contrib/117293108927012632127/reviews?hl=zh-TW,5,False,2,菜色看起來很健康又很好吃
 Sharon FU ,https://www.google.com/maps/contrib/100553319536166945082/reviews?hl=zh-TW,1,False,94,不好吃～不值得這價位
 Kim Wu ,https://www.google.com/maps/contrib/113356870659586499537/reviews?hl=zh-TW,5,False,1,環境很棒😊
 Yen-Ling Liu ,https://www.google.com/maps/contrib/113999925006305914737/reviews?hl=zh-TW,5,False,8,"心中健康便當的第一名🍱
美味可口👍🏻👍🏻👍🏻"
 Ellen Lin ,https://www.google.com/maps/contrib/110252243935691908709/reviews?hl=zh-TW,5,True,28,超級好吃的希望有月套餐選擇
 Jie Hong Lin ,https://www.google.com/maps/contrib/110163665113654782114/reviews?hl=zh-TW,5,True,183,餐點美味，老闆帥氣，會在回訪
 Y Y ,https://www.google.com/maps/contrib/118282654573462218817/reviews?hl=zh-TW,1,False,4,餐點又貴又難吃服務人員態度又不好
 Cola Coke ,https://www.google.com/maps/contrib/118040011158820167124/reviews?hl=zh-TW,5,False,2,第一次吃到這麼好吃的健康餐
 MICHAEL CHAN ,https://www.google.com/maps/contrib/110594238114185480107/reviews?hl=zh-TW,5,False,2,肉超級好吃真的要哭出來了😭
 Grace Chang ,https://www.google.com/maps/contrib/115501506728130584117/reviews?hl=zh-TW,5,False,13,好吃老闆很可愛服務超親切
 JH Huang ,https://www.google.com/maps/contrib/113390498160254952752/reviews?hl=zh-TW,5,False,8,餐點好吃，服務態度親切
 小蘇 ,https://www.google.com/maps/contrib/110758144500848167692/reviews?hl=zh-TW,4,True,27,健康清爽的早午餐，環境乾淨。
 EVA Fu ,https://www.google.com/maps/contrib/109607410781349407769/reviews?hl=zh-TW,5,False,18,好吃又健康美味的便當
 Jocelyn Chen ,https://www.google.com/maps/contrib/110564597352124280780/reviews?hl=zh-TW,4,True,84,服務員很忙
 徐玉珍 ,https://www.google.com/maps/contrib/113316381359436971760/reviews?hl=zh-TW,5,False,23,東西好吃
 郭奕宏 ,https://www.google.com/maps/contrib/106908148582706265681/reviews?hl=zh-TW,5,False,8,"環境乾淨,東西好吃！"
 Rocky Sheng ,https://www.google.com/maps/contrib/107635248946709811710/reviews?hl=zh-TW,5,False,3,雞胸肉沙拉非常優秀！
 楊書瑋 ,https://www.google.com/maps/contrib/114063938139759256752/reviews?hl=zh-TW,5,False,3,就是好吃不用多說
 LI Siong-ian (まこチャン) ,https://www.google.com/maps/contrib/102807221568892666235/reviews?hl=zh-TW,5,True,124,蔬菜很多，適合減醣的人
 kuo oo ,https://www.google.com/maps/contrib/101277370827434744928/reviews?hl=zh-TW,5,False,4,新鮮食材健康美味👍👍👍😋
 Yu-Chun Lin ,https://www.google.com/maps/contrib/100887027652342552689/reviews?hl=zh-TW,5,False,14,清爽飲食新選擇：）
 于兒 ,https://www.google.com/maps/contrib/104362797315773009797/reviews?hl=zh-TW,5,False,7,健康午餐的選擇～
 Stanley Chen ,https://www.google.com/maps/contrib/108255544091960149348/reviews?hl=zh-TW,5,False,3,什麼都好好吃～😋😋😋
 Ken Huang ,https://www.google.com/maps/contrib/118169386619187583853/reviews?hl=zh-TW,5,False,16,新鮮好吃
 Tony Huang ,https://www.google.com/maps/contrib/112697429712167520351/reviews?hl=zh-TW,5,False,14,好吃不油膩
 Betty Lin ,https://www.google.com/maps/contrib/110649463283083358997/reviews?hl=zh-TW,5,False,4,色香味俱全
 Kevin Chang ,https://www.google.com/maps/contrib/110131577976734851570/reviews?hl=zh-TW,5,True,64,新鮮好吃
