user_name,user_profile_url,rating,local_guide,comment_num,comment_text
 fox Wang ,https://www.google.com/maps/contrib/103818901286293521508/reviews?hl=zh-TW,5,True,40,"刀削麵跟細麵都蠻有嚼勁的，很好吃，蕃茄半筋半肉的湯頭味道很好，一般牛肉麵湯頭也不錯，加點辣椒味道更好，辣油比較偏向有辣味但不辣口的，另一種辣椒則是味道很出頭。
小菜的豆乾很好吃，豆芽菜感覺有蝦油調伴。
用餐環境一般，冷氣算蠻涼的👍"
 H Rybby ,https://www.google.com/maps/contrib/105171633606913002247/reviews?hl=zh-TW,4,True,306,炸醬偏稍甜，中規中矩；番茄湯頭很棒，辣椒油更是一流，刀削麵是機器削的，麵體稍硬，但還可接受，價格合理，是cp值很高的餐廳
 Ron Kao ,https://www.google.com/maps/contrib/106110325381221219804/reviews?hl=zh-TW,5,True,72,"蠻好吃的而且搭配疫情內用也很講究衛生
很落實實名制
筷子也都有高溫消毒
覺得店家很用心"
 Jamie Zeng ,https://www.google.com/maps/contrib/114657778537768575083/reviews?hl=zh-TW,5,True,38,點的是「牛肉炒麵（刀削麵）」，麵體Q彈好吃，也很入味。以平日三餐的標準值得一吃。
 金慧橋 ,https://www.google.com/maps/contrib/101318281606047512753/reviews?hl=zh-TW,5,False,16,目前吃過牛肉炒飯、香腸炒飯、牛肉麵、水餃、蕃茄湯，沒有一個是不好吃的！超級推的店家喔！天天吃也不太膩😋
 Penny Yu ,https://www.google.com/maps/contrib/105080638556957511206/reviews?hl=zh-TW,5,True,52,"環境很乾淨內用餐桌上有隔板筷子有消毒
還有小朋友碗帶小朋友來吃也沒毛病店員也很親切🙂每次都在糾結要吃牛肉麵還是炒麵炒飯還是水餃🤣"
 Rainie Chien ,https://www.google.com/maps/contrib/112463315368617858016/reviews?hl=zh-TW,5,True,63,"刀削麵Q,牛肉大塊很嫩,番茄湯頭也不錯"
 Secret Hsu ,https://www.google.com/maps/contrib/108988340190716271034/reviews?hl=zh-TW,5,True,74,"手工麵不規則狀滿滿的手工感
刀削麵的口感是偏硬的但也不失Q彈
牛肉厚實且份量大
這碗蕃茄牛肉刀削麵
湯頭相當夠味

本人家裡常常自製牛肉湯因為自己要喝的常常不計成本味道很濃厚對於外頭的牛肉湯我常常喝不習慣
但這家真的有滿足我的口味忍不住就把整碗湯喝完了
桌上都有滿滿的牛油可添加味道會更香

小菜的選擇也滿多的本日拿的小菜也很好吃調味香甜且越嚼越香"
 elsie huang ,https://www.google.com/maps/contrib/102440967067954959229/reviews?hl=zh-TW,5,True,71,"我吃過
蕃茄牛肉麵（細麵）$1604塊蠻厚的超軟牛腱肉。湯頭有番茄跟牛肉的甜不油。很夠味。麵也很好吃！是有嚼勁的麵。
榨菜肉絲麵（刀削麵）$80。湯很驚艷看起來清淡但有牛油香味。刀削麵也是有嚼勁的那種。好吃。
兩個份量都蠻大的。推！"
 Izu Shin Sai ,https://www.google.com/maps/contrib/115578443496095968088/reviews?hl=zh-TW,5,True,69,湯頭好喝，蕃茄跟牛肉湯底都很棒，味道很夠，不小心就把湯喝光了，小菜的茄子也不錯，喜歡🥹
 林阿奇 ,https://www.google.com/maps/contrib/100727027564450416144/reviews?hl=zh-TW,5,True,27,好吃😋回訪率高，木須炒麵👍🏻👍🏻👍🏻
 T L ,https://www.google.com/maps/contrib/104937960943293322422/reviews?hl=zh-TW,4,True,739,"老闆娘沒帶口罩，
但會要求客人要先噴酒精，，

吃麵的人比較多，
湯品類價格較高。

份量很足，，
味道也不錯，，不會過鹹

整體環境乾淨，
自製牛油，很霸氣，
每桌都一大桶，，，"
 CK Lam ,https://www.google.com/maps/contrib/111046283526826934807/reviews?hl=zh-TW,5,True,153,很好吃，每種麵的湯底都很好吃，麵條口感很讚，另外小菜的豆乾也很厲害，大推👍👍👍
 Ethan Tai ,https://www.google.com/maps/contrib/100808598216694757520/reviews?hl=zh-TW,4,True,238,木須炒麵（刀削麵），料豐盛，麵有咬勁，調味正派，炒得有鑊氣，好吃。
 Andy Hung ,https://www.google.com/maps/contrib/107455892342674746517/reviews?hl=zh-TW,4,True,"1,856",2020-01-點蕃茄牛肉麵刀削、蕃茄湯、酸辣湯、蛋炒飯，酸辣湯屬於微甜算不錯，刀削麵Q彈，牛肉麵好吃，蕃茄湯新鮮，機器削的刀削麵，服務迅速，用餐環境乾淨明亮
 Johnny Lin ,https://www.google.com/maps/contrib/110380167673782951027/reviews?hl=zh-TW,3,True,30,"先說沒點牛肉麵。
店內乾淨整潔，用餐環境舒適
95元牛肉蛋炒飯肉是切超小條狀，量也少肉質普通，調味普通。果腹可以，但偏貴。
6元水餃皮薄可透色，沒有肉腥味，雖然比較小顆，但味道不錯，可點。
30元蛋花湯恩，就是一般的店家蛋花湯，有需要就點。"
 黑麻糬 ,https://www.google.com/maps/contrib/111243561262487599992/reviews?hl=zh-TW,5,True,150,"店內很乾淨，桌子沒有髒污油膩，筷子統一放前方殺菌機內，點了一碗蕃茄牛肉湯麵，蕃茄味較淡，但是湯頭清甜不死鹹，很簡單就能喝光不會有負擔；桌上的麻辣油應該有加牛油進去，很香、有辣又不鹹，適合加燴飯、小菜裡，會再來
P.S阿嬤很可愛"
 林仔 ,https://www.google.com/maps/contrib/114667207431489440383/reviews?hl=zh-TW,5,True,40,"超好吃的刀削麵！
木須炒麵很香料很多！
番茄牛肉麵，牛肉很大塊吃起來口感很棒！
蕃茄湯味道甘甜！
櫃檯阿姨人很好
服務妹妹蠻可愛的

一級美食檔案庫+1"
 cindy12022 ,https://www.google.com/maps/contrib/105296154721054329499/reviews?hl=zh-TW,5,True,294,"番茄牛肉麵真的推，湯頭清爽非常甜，刀削麵偏硬、很有咬勁也好吃。
酸辣刀削湯麵湯頭是酸甜的，不辣，但也不錯。
水餃和炒飯都有及格。"
 Angela Wu ,https://www.google.com/maps/contrib/112072059019502002216/reviews?hl=zh-TW,4,True,260,"一進門就聞到濃濃的牛肉湯香，
刀削麵吃起來Q彈
湯頭不死鹹
份量很多，物美價廉"
 Sabrina Tu ,https://www.google.com/maps/contrib/101020928418980106989/reviews?hl=zh-TW,4,True,189,"麵條Q彈好吃！
店內環境整潔，會請客人用酒精消毒手再入座，看得出店家有在為防疫用心：）"
 FFMM ,https://www.google.com/maps/contrib/110338722269262853156/reviews?hl=zh-TW,3,True,368,刀削麵很有嚼勁，牛肉偏少
 有熊氏布熊 ,https://www.google.com/maps/contrib/101018813601061752834/reviews?hl=zh-TW,4,True,47,"因為年節送禮要去隔壁三統買餅，到了飯點時間看到門口櫃檯阿姨熱情招呼，乾脆進去吃。
點的是蕃茄牛雜刀削麵，和想像中的濃郁紅燒蕃茄湯不同，清湯相當清爽不油膩，因為加了很實在的蕃茄而帶點酸甜。
麵附上牛雜沾醬，除了牛肉麵店必備的酸菜之外，還有很香的牛油，覺得不夠油可以自己加，辣椒也很香，是間會再想回頭嚐嚐其他料理的店：D"
 Alan ,https://www.google.com/maps/contrib/111009615699913466807/reviews?hl=zh-TW,3,True,65,還不錯，但是外帶的話炒麵用紙盒裝裡面還是塑膠袋，非常熱感覺不太健康
 羅隆華 ,https://www.google.com/maps/contrib/117380466505632849035/reviews?hl=zh-TW,5,False,184,山西刀削麵馆，有水餃.麵.小菜.炒飯，还不錯吃，没吃过的人，可去品嚐哦!
 吳阿法 ,https://www.google.com/maps/contrib/105349604351555542889/reviews?hl=zh-TW,5,True,443,"點了番茄牛肉麵，湯頭、麵條、牛肉都不錯，但對大食量的人可能要加大
牛肉炒飯，酸辣湯也都不錯"
 C·H Lin ,https://www.google.com/maps/contrib/108792854360953414495/reviews?hl=zh-TW,1,True,74,"早餐沒吃東西
中午外送，
吃完約下午五點開始肚子痛，
拉到無力"
 Charles Tan ,https://www.google.com/maps/contrib/107441066143460505436/reviews?hl=zh-TW,4,True,"1,109",湯頭好喝，牛肉麵好吃，小菜當天現做，也值得推薦。
 Thomas Tsai ,https://www.google.com/maps/contrib/103345127395409954348/reviews?hl=zh-TW,5,False,18,湯頭不錯，肉軟度適中，麵有咬勁
 莊勝傑 ,https://www.google.com/maps/contrib/113791503022226598618/reviews?hl=zh-TW,5,True,32,"刀削麵口感讚、辣油非常棒、牛肉湯清甜，牛肉的細嫩度在水準之上，完全不輸給知名牛肉麵店
一定會再去吃"
 謝宗宏 ,https://www.google.com/maps/contrib/108281040215577321278/reviews?hl=zh-TW,5,True,143,推薦湯頭蠻好喝的
 lita Pan ,https://www.google.com/maps/contrib/111089894245372115797/reviews?hl=zh-TW,4,True,"2,422",店家服務態度客氣和善，用餐環境整潔，刀削麵的口感有筋性好吃，但是本人喜歡湯汁收乾一點，算是小遺憾吧
 Liu Liu ,https://www.google.com/maps/contrib/111736954804033743199/reviews?hl=zh-TW,3,True,101,"刀削麵有點軟爛、不是很合口味
牛肉不錯吃"
 鍾明修 ,https://www.google.com/maps/contrib/103976717077984713754/reviews?hl=zh-TW,5,True,9,"第一次品嘗罕見的牛油,展現南米北麵的中國文化,是必嘗的醬料。"
 Shanti Chen ,https://www.google.com/maps/contrib/112122398821134347740/reviews?hl=zh-TW,4,True,66,"蕃茄牛肉刀削麵好吃，自然鮮甜
加酸菜跟辣油也好吃，很香"
 Y.Y. ,https://www.google.com/maps/contrib/107823454953171906034/reviews?hl=zh-TW,4,True,264,番茄湯頭好喝，炒麵比較普通
 靈魂黃 ,https://www.google.com/maps/contrib/117529847806201405834/reviews?hl=zh-TW,2,True,254,"木鬚炒麵120味道淡料也不多不好吃
蕃茄麵100只有番茄湯頭一般偏甜

水餃6元韭菜口味普普偏小顆"
 王嘉平 ,https://www.google.com/maps/contrib/113146907121365765160/reviews?hl=zh-TW,5,True,132,"電話購買300元以上，有免費外送服務；當然不能太遠啦！
小菜1盤30元，也算便宜。
菊色牛油、酸菜、辣椒油免費提供。"
 Jc ww ,https://www.google.com/maps/contrib/103297772121921396718/reviews?hl=zh-TW,4,False,5,好吃強推番茄牛肉麵料多實在肉多麵多又Q
 陳皇羽 ,https://www.google.com/maps/contrib/113700357353879642799/reviews?hl=zh-TW,5,True,24,刀削麵很Q彈。很值得推薦
 Andy Liu ,https://www.google.com/maps/contrib/110158336338831935960/reviews?hl=zh-TW,5,True,189,好吃，不多說，炒飯非常優秀（炒飯控）。番茄牛肉湯也很好喝，店內乾淨整潔，想不到什麼理由不給5星。
 火龍果Coriander_Fiona ,https://www.google.com/maps/contrib/100193924306295746143/reviews?hl=zh-TW,4,True,105,"炒飯朋友給四分除了飯有點乾其他他覺得吃起來不錯。
刀削麵部分個人覺得略遜中永和知名的李家麵館的刀削麵，而同行朋友覺得麵糊味太重（個人猜測應該是煮麵水加入跟醬汁悶煮導致，也或許是醬油加太少沒把麵糊水覆蓋過）
店內的刀削麵跟台中某家刀削麵一樣使用機器人製作^_^
外場服務很好👍"
 C-I Ho ,https://www.google.com/maps/contrib/105153265106173043886/reviews?hl=zh-TW,5,True,273,好吃，夠味，木須炒麵好好吃
 Emily Ho ,https://www.google.com/maps/contrib/116734616073750228128/reviews?hl=zh-TW,4,True,68,獨愛他的清燉牛雜麵，湯頭彈嘴然後料也很多，必點的小菜還有細細的豆腐絲(這家最好吃)還有小黃瓜。炒飯也很強!
 林倢伃 ,https://www.google.com/maps/contrib/114377783540006945451/reviews?hl=zh-TW,5,True,96,"麵條很有韌性，
湯頭不會死鹹，
有蕃茄的清甜，
很好吃，店嬤超級親切的，
很少在台北市有這種人情味，
真的很棒，
希望有配合外送，這樣公司也能點餐!

好吃到只拍菜單，東西吃完沒拍…"
 黃于庭 ,https://www.google.com/maps/contrib/111697803106463633456/reviews?hl=zh-TW,4,True,138,牛肉麵湯頭鮮甜、肉質軟嫩；酸辣湯味道特別好喝；炒麵類麵條口感很好軟Q，小菜沒吃過，下次可試試。
 蔡幸穎 ,https://www.google.com/maps/contrib/102629616260714705890/reviews?hl=zh-TW,5,True,29,"喜歡QQ的刀削麵～
每一口都有嚼勁～
番茄牛肉麵好吃不會太鹹，
老闆娘親切～會想再來吃💕"
 凡妮亞 ,https://www.google.com/maps/contrib/110036651648494522964/reviews?hl=zh-TW,5,True,45,牛肉湯麵的牛肉湯非常清甜好喝，麵煮得剛好，聽說炒飯也滿好吃，粒粒分明，服務態度非常好，店面乾淨明亮，菜單內容選擇很多，小菜也好吃~!!是還會回去光顧的一家店~
 Megan ,https://www.google.com/maps/contrib/100538977148079556556/reviews?hl=zh-TW,5,True,52,"很推薦吃麵的時候加上店家自製的牛油
真的會讓整個湯變更香～
這家真的連炒飯也好好吃大推！"
 柯建任 ,https://www.google.com/maps/contrib/112590516961442904323/reviews?hl=zh-TW,5,False,6,"番茄牛肉麵湯頭好
牛油無限加到爽"
 Yen ,https://www.google.com/maps/contrib/110434548117955602667/reviews?hl=zh-TW,5,True,19,"東西平價好吃
麵很有嚼勁很入味
牛肉軟嫩
湯底也很有味道
非常好吃
每次經過都會進去吃🤩"
 Wu Wu Wu ,https://www.google.com/maps/contrib/117129802799927330580/reviews?hl=zh-TW,4,True,24,番茄牛肉麵好吃，牛肉入味軟嫩，份量偏少，小菜也好吃，店內環境整潔，三不五時可以來吃👍
 Sarah Chen ,https://www.google.com/maps/contrib/101759870210918763627/reviews?hl=zh-TW,5,True,81,牛肉湯頭味道夠卻不死鹹，好喝！酸菜超好吃，很新鮮！下次想試試看木須炒麵
 HC Lin ,https://www.google.com/maps/contrib/114773389023290082095/reviews?hl=zh-TW,5,True,559,信義區一帶外送吃過最好吃的牛肉麵，湯頭、麵體和牛肉都很不錯，別忘了加辣牛油
 Hui Ni Lu ,https://www.google.com/maps/contrib/102709901744642970788/reviews?hl=zh-TW,4,True,703,機器削麵，麵條和一般刀削麵比起來沒那麼粗厚有嚼勁，但湯頭醇厚好喝，店內環境乾淨整潔，整體來說好吃。
 Yalun Yu ,https://www.google.com/maps/contrib/115443533138238713392/reviews?hl=zh-TW,5,True,99,木須炒麵刀削麵條粗有嚼勁配料豐富清爽不油膩外不失美味會令人一口接一口
 sasha CHEN ,https://www.google.com/maps/contrib/102469621554795599711/reviews?hl=zh-TW,5,True,104,老闆娘好親切，店家服務都很好，還主動把酸菜拿到我們桌上給我們加，原本我不打算加，因為我不喜歡吃太鹹，沒想到酸菜不鹹，好好吃。昨天也吃了小菜，都很滿意，絕對會再來！！👍
 羽諾（柯基） ,https://www.google.com/maps/contrib/116697952468934331149/reviews?hl=zh-TW,4,False,362,"餐點除了牛肉麵外還有炒飯及炒麵、水餃、小菜、湯品可以選擇
選擇性相當豐富
而且牛肉麵可以可以加湯　加分許多
算是尚可一試的店家
歡迎Follow羽諾➡️iG🔎:noya59629"
 LAMAMAO Josie ,https://www.google.com/maps/contrib/116922874605525179207/reviews?hl=zh-TW,5,True,241,真的是道地刀削麵，不是那種軟啪啪又沒嚼勁的可怕刀削麵，這個是超級Q配上那個蕃茄湯ohmygodI'msohealthyitssogoodthenoodlesarejust.....nowordsjustgoeatforyourself!冷氣還不錯而且老闆服務生都很可愛很nice!繼續Q下去!
 Jaymes Wu ,https://www.google.com/maps/contrib/114253241527376133705/reviews?hl=zh-TW,2,True,42,牛肉麵的湯頭可以，但是牛肉不優（$130），比其他$110還要差。刀削麵煮的也沒有其他家好吃。
 溫婷婷 ,https://www.google.com/maps/contrib/101650404356105698559/reviews?hl=zh-TW,5,False,7,推炒飯(不早點去就會賣光哈哈)和木須炒麵還有酸辣麵刀削的超好吃的哈哈哈哈水餃也不錯都很大份超級物超所值的拉但食量小的建議兩人吃一碗不然食物浪費就太可惜了
 B.C. Oaks ,https://www.google.com/maps/contrib/100819999436558093040/reviews?hl=zh-TW,3,False,4,食物不錯，人員親切，但三月初去吃，電視一直播放TVBS，真的很影響食慾。希望改播公視等無線台，甚至不開電視
 弘兒 ,https://www.google.com/maps/contrib/112693651207069397936/reviews?hl=zh-TW,5,False,6,"番茄牛肉燴飯有番茄淡淡的香氣卻不會帶走牛肉原本的味道牛肉那恰到好處的口感和飯粒完美的結合
如此完美的餐點在配上帥氣的男店員及美麗的女店員大推大推👍👍"
 Jiayu Cai ,https://www.google.com/maps/contrib/108910799696789027640/reviews?hl=zh-TW,5,False,7,番茄牛肉麵真的很好吃，刀削麵很厲害，每週都會去吃，另外店員妹妹很可愛
 Victoria Lu ,https://www.google.com/maps/contrib/107743086977595068823/reviews?hl=zh-TW,1,False,3,今天內用羊肉炒麵，羊肉只有3-4片，剩下都是麵，這樣還要100元。太貴了！
 王以芳 ,https://www.google.com/maps/contrib/111753121788471630287/reviews?hl=zh-TW,3,True,77,剛點了一碗牛肉湯麵大店家的自製牛油放進麵裡面好吃，筷子在前面有消毒設備，價錢有點小貴
 Venci ,https://www.google.com/maps/contrib/102969820757043545127/reviews?hl=zh-TW,3,True,285,番茄牛肉湯麵清淡，麵、番茄和菜都少許，份量不多，很適合減肥中的女生們食用。
 serena lin ,https://www.google.com/maps/contrib/102237226683103990039/reviews?hl=zh-TW,5,True,88,店家很親切服務好，炒飯不錯份量又足，刀削麵也具口感，推薦親子客人來喔！
 不知道 ,https://www.google.com/maps/contrib/104204520894116215661/reviews?hl=zh-TW,5,False,2,木須炒麵真好吃，麵Q料超多份量非常足~大推！下次一定還要再來吃！
 Shieh Eric ,https://www.google.com/maps/contrib/116779943928298373341/reviews?hl=zh-TW,5,True,100,我點番茄牛肉麵，牛肉超嫩，湯超鮮甜，值得再訪的好店
 朱熾清 ,https://www.google.com/maps/contrib/117608436617825556085/reviews?hl=zh-TW,5,True,93,點了木須炒麵（刀削）很不錯，服務態度也超棒。
 劉彥均 ,https://www.google.com/maps/contrib/117642928244031778236/reviews?hl=zh-TW,5,True,28,"刀削麵很有嚼勁
內用酸菜跟牛油都可以免費加
好吃"
 HsiaoYun ,https://www.google.com/maps/contrib/101791443291014186302/reviews?hl=zh-TW,5,True,319,"木須刀削麵120元
麵有勁道，富有鍋氣~太有水準拉拉"
 江柏豪 ,https://www.google.com/maps/contrib/113398597717968148791/reviews?hl=zh-TW,5,True,21,炒飯跟炒麵很好吃，鹹菜不會死鹹又有口感，好吃。
 國軒黃 ,https://www.google.com/maps/contrib/114440931387075218067/reviews?hl=zh-TW,5,True,33,湯頭真的好喝，闆娘和藹可親，廚師們都是女性，十分認真面對每個餐點
 CC Cheng ,https://www.google.com/maps/contrib/115935353384662230039/reviews?hl=zh-TW,5,True,56,"超級好吃，蕃茄湯頭、炸醬面都好好吃❤️❤️
麵Q湯甜👍👍👍"
 A min ,https://www.google.com/maps/contrib/111156123513295336010/reviews?hl=zh-TW,5,False,4,細麵好讚
 蔡忠倫 ,https://www.google.com/maps/contrib/104173337079749013123/reviews?hl=zh-TW,2,True,112,酸菜難得是我不喜歡的，木須不錯，但牛肉麵普通
 Voshkie Chiu ,https://www.google.com/maps/contrib/110526030298403121208/reviews?hl=zh-TW,5,False,5,真心推薦最好吃的牛肉麵店😍清燉牛雜麵不得了啊啊啊～～～
 Ruei-Chung Wang ,https://www.google.com/maps/contrib/112679321156317936458/reviews?hl=zh-TW,4,True,765,好吃的番茄刀削麵愈來愈難找了，這裡算是美味又不貴，列入收藏！
 Wei Lin CHEN ,https://www.google.com/maps/contrib/110161636366844742368/reviews?hl=zh-TW,1,True,53,"別訂這家
他們會讓你等三小時後取消訂單"
 朱錦蓮 ,https://www.google.com/maps/contrib/109771519523990018374/reviews?hl=zh-TW,5,False,7,刀削蕃茄牛肉麵超好吃👍麵很有嚼勁，會再光臨🍜👌
 范煌欽 ,https://www.google.com/maps/contrib/111493207697484398166/reviews?hl=zh-TW,5,True,62,我不會，言語，行容就是好，吃，我去吃N次了，有路過還是會去吃的，👍
 李惠蘭 ,https://www.google.com/maps/contrib/111976335752333788743/reviews?hl=zh-TW,5,False,3,對人親切！而且東西更好吃！湯頭越來越好！小菜也好吃！
 M H ,https://www.google.com/maps/contrib/105906546584252496431/reviews?hl=zh-TW,5,True,27,大推木須炒麵！有夠好吃！
 夜小海 ,https://www.google.com/maps/contrib/104831672101245191898/reviews?hl=zh-TW,5,False,13,"服務態度很好，東西很好吃
小菜豆乾必點(˶‾᷄⁻̫‾᷅˵)"
 sheena H ,https://www.google.com/maps/contrib/108279173283592208596/reviews?hl=zh-TW,3,True,34,好吃，牛肉大又厚多，嫩，麵條Q
 Luc Chen ,https://www.google.com/maps/contrib/105550727301020832579/reviews?hl=zh-TW,5,True,6,店面乾淨，刀削麵好吃有嚼勁，服務親切。
 阿Yen ,https://www.google.com/maps/contrib/115066461319237150399/reviews?hl=zh-TW,5,True,98,店家的牛雜麵，業界頂尖，米酒加的洽到好處
 Abby Hsu ,https://www.google.com/maps/contrib/106230974027335316846/reviews?hl=zh-TW,5,True,70,炒飯真的好吃蕃茄湯也很好😙
 尤廣斌 ,https://www.google.com/maps/contrib/117011095842898638861/reviews?hl=zh-TW,5,True,120,便宜又大碗，還非常好吃！
 振道 ,https://www.google.com/maps/contrib/105208816243996520282/reviews?hl=zh-TW,3,False,31,櫃檯阿嬤很親切，小菜好吃，牛肉大塊
 Yu Lin Jiang ,https://www.google.com/maps/contrib/102089068142764873279/reviews?hl=zh-TW,5,False,23,"店面乾淨、服務親切
餐點豐盛好吃！"
 Tony Chang ,https://www.google.com/maps/contrib/117192741807628770574/reviews?hl=zh-TW,4,True,39,小菜木耳以梅汁泡過，微酸甜有特色
 李月娥 ,https://www.google.com/maps/contrib/111913493358161565648/reviews?hl=zh-TW,4,True,25,味道不錯，現點現作，環境很乾淨
 林嘉瑩 ,https://www.google.com/maps/contrib/116941670589430806972/reviews?hl=zh-TW,4,False,10,番茄牛肉麵水餃都不錯吃
 Stanley Wu ,https://www.google.com/maps/contrib/107810051810900662123/reviews?hl=zh-TW,5,True,600,好吃份量大，每次都是飽飽的
 Sophie Yeh ,https://www.google.com/maps/contrib/116335366045463847203/reviews?hl=zh-TW,5,True,63,份量大又好吃，價格平價
 Tina Fang ,https://www.google.com/maps/contrib/115234353041928432295/reviews?hl=zh-TW,2,True,36,食物普通，價位有些高，有些失望
 Jay Lin ,https://www.google.com/maps/contrib/106613276751888812032/reviews?hl=zh-TW,5,True,39,好吃服務親切
 楊坤坪 ,https://www.google.com/maps/contrib/107405169255228977874/reviews?hl=zh-TW,4,True,985,料好味實在，服務親切
 David WOO ,https://www.google.com/maps/contrib/114408432416437995837/reviews?hl=zh-TW,4,True,69,味道不錯，但稍貴
 謝婷妮（Ni） ,https://www.google.com/maps/contrib/111730316898681604695/reviews?hl=zh-TW,3,True,691,"麵Q,牛肉軟硬適中"
 Pin Hsin Hou ,https://www.google.com/maps/contrib/112192612804537707977/reviews?hl=zh-TW,5,True,15,炒飯蕃茄牛肉麵好吃
 mila watan ,https://www.google.com/maps/contrib/105913266178467058751/reviews?hl=zh-TW,4,True,633,刀削麵好吃，水餃可
 康康起來 ,https://www.google.com/maps/contrib/101795152471210073980/reviews?hl=zh-TW,5,True,57,東西都很好吃推推
 李默 ,https://www.google.com/maps/contrib/105415938867410281858/reviews?hl=zh-TW,5,True,50,好吃味道好料實在
 WEI ,https://www.google.com/maps/contrib/108333489548219001654/reviews?hl=zh-TW,5,True,169,好吃炒飯也不錯
 yan ling liu ,https://www.google.com/maps/contrib/116271202695213329007/reviews?hl=zh-TW,5,False,23,沒得挑剔的好店
 張Robert ,https://www.google.com/maps/contrib/104520425954955194158/reviews?hl=zh-TW,4,True,74,番茄牛肉麵讚
 Cecilia Liu ,https://www.google.com/maps/contrib/107113209356741600732/reviews?hl=zh-TW,5,True,33,老闆親切東西好吃
 朱小柔 ,https://www.google.com/maps/contrib/103805706202116708033/reviews?hl=zh-TW,5,True,36,好吃，老闆親切
 polar chang ,https://www.google.com/maps/contrib/104239257880693236376/reviews?hl=zh-TW,5,False,42,好吃不鹹香
 王立柏 ,https://www.google.com/maps/contrib/107148233676983723899/reviews?hl=zh-TW,3,True,27,湯汁不膩
 王Vicky ,https://www.google.com/maps/contrib/100261836123340726488/reviews?hl=zh-TW,4,False,13,👍
 潘爺Odin Pan ,https://www.google.com/maps/contrib/109704784213428276109/reviews?hl=zh-TW,3,True,720,😂😂😂
 戴裕豐 ,https://www.google.com/maps/contrib/105130011875185672588/reviews?hl=zh-TW,4,True,18,食材好料實在。
 黃俊元 ,https://www.google.com/maps/contrib/116250991136057093556/reviews?hl=zh-TW,5,True,327,蠻好吃的
 welanamyhi ,https://www.google.com/maps/contrib/116721983523450074581/reviews?hl=zh-TW,5,True,403,是可以回訪的店
 廖賀田 ,https://www.google.com/maps/contrib/103433216374089126387/reviews?hl=zh-TW,4,True,39,還行
 歐莫兒 ,https://www.google.com/maps/contrib/106935959454152035406/reviews?hl=zh-TW,5,True,10,喜歡！好吃
 許鈞傑 ,https://www.google.com/maps/contrib/104495467334564482008/reviews?hl=zh-TW,5,True,73,蠻不錯的
 Lucy ,https://www.google.com/maps/contrib/106840854953029675426/reviews?hl=zh-TW,4,True,107,不錯吃
 Kuan Li ,https://www.google.com/maps/contrib/108357101048430372120/reviews?hl=zh-TW,4,True,35,特別
 劉津津 ,https://www.google.com/maps/contrib/101419386203201438557/reviews?hl=zh-TW,5,False,5,不錯
 地球怡 ,https://www.google.com/maps/contrib/107372325738786162860/reviews?hl=zh-TW,4,True,125,炒飯好吃
 かど:Dノバイオリンだいすけのヸオロン ,https://www.google.com/maps/contrib/113479600816603374812/reviews?hl=zh-TW,5,False,51,staff親切
