user_name,user_profile_url,rating,local_guide,comment_num,comment_text
 Phoebe Liao ,https://www.google.com/maps/contrib/114244760216298713349/reviews?hl=zh-TW,5,True,65,"這家01Burger走個台式路線，很特別誒
麵包是使用淋過熱油的『刈包』，吃起來像是炸饅頭。
菜單上口味也有許多很『台』的選項，像是蔥油雞，五花豬...

但是當天想吃牛肉，於是點了比較沒那麼台的選項：蒜味牛。
這大蒜的份量...給的真大方。肉排上滿滿一層生大蒜，很過癮！
但建議吃完要嚼口香糖，不然嘴巴真的會很臭

01Burger也會每兩週推出新的限定堡，這次剛好碰到叻沙炸蝦。
雖然不是本人吃的，但看起來很不錯。
裡面的烘蛋倒是挺吸引我的，真的很台誒
還會附上叻沙醬，因為太早淋上去可能炸蝦就濕掉了～

以漢堡來說，價格確實不便宜。
但是很有創意，值得試試看呦～
-

01Burgerisafusionstyleburgerplace!CombinedbothTaiwaneseaspectswithwesternburgers.

Insteadoftypicalbuns,theyusedfriedsteamed-baos!
AndhaveextremelyTaiwaneseflavors,suchasgreenonionchicken,porkbelly…etc.

Feltlikebeefthatday…soIgotthe“garlicbeef”.
Andboydotheygivealotofgarlic.(Sopleasechewgumafter).
Evenaddedafriedegginmyburger…verysatisfying.

Theycomeupwithanewlimitededitionburgerevery2weeks.
Thistimewebumpedinto“friedwontonshrimp”.
Ididn’teatitmyself,buttheomeletteinsidewasreallyattractive.

Notexactlycheapforaburger,butveryinnovative&defsworthatry."
 Serene lo ,https://www.google.com/maps/contrib/113445175975822717252/reviews?hl=zh-TW,5,False,1,"美式漢堡片地開花的台北市，今年疫情期間在東區插旗的01Burger🍔
展現了獨樹一格「法餐色彩的台式漢堡」

“01Burger""零壹零零，做一款屬於台灣人的漢堡。
「一件事，如果不做就是0；要做，那就要做到100」

麵包採用台灣小吃—刈包，源自於其中一位廚師的爺爺祖傳口味，初嚐的畫面，讓人聯想到外省人會吃的饅頭夾紅糖，亦或是鹹酥雞的炸銀絲卷🤤
除了基本盤牛肉外，為呼應台灣漢堡的slogan，研發了古早味豬，酥脆麵糊包裹著Q皮豬五花🐖口感層次更升級。雞腿也不讓紅肉專美於前🐓怎麼吃最台灣？當然是配蔥油呀！這也是我非常喜歡的口味。

隨著慕名而來的饕客越來越對，激發了店家的「廚師魂」創作期間限定的limitedburger。如果已經錯過了「松阪豬」「軟殼蟹」，請記得followinstagram&Facebook，這邊就先不爆雷給大家🤫

因為疫情，改變了現代人用餐的模式，我也親自體驗了01的「外帶」和「內用」
🥡外帶盒包裝簡約，且事先電話點餐，店家為了維持最佳的享用時機會抓時間準備餐點，每次拿到的時候都是熱騰騰的(當然取餐也要準時哦)。BTW本身是上班族，通常都會跟同事「團訂」午餐，外送平台價錢又高，所以可以提前預訂就享有店內餐價了(預定規則以店家方案為主)
🍴店內選用時髦的高腳椅，像我本人身高比較迷你，遇到高腳椅的店家不免一開始會有需要爬上椅子的感覺，但這裡的椅子除了軟好坐外高度也是意外的無距離感，想必是用心挑選過的。用餐性質通常吃飽就會準備離開去下一攤了，整體環境算是中上，大家可以親身體驗看看。

另外想寫給我最愛的01以及閱讀完這一串文字的foodie們
有口福之人運氣都不會太差
一間值得前往的餐廳不會因為網路上的惡意評論影響我們去挖掘美食的心❤️‍🔥❤️‍🔥❤️‍🔥"
 林萌 ,https://www.google.com/maps/contrib/108786967772579147368/reviews?hl=zh-TW,5,True,235,"從第一口到最後一口都顛覆了我這個超討厭吃漢堡人的想法！
//
經典牛260
［套餐（A+B)折扣20元］
零壹炸雞翅（椒麻）100
康普茶（紅茶）180
//
炸雞翅原本要點椒鹽口味誤打誤撞在指菜單的時候跟店員沒有共識⋯⋯變成椒麻口味，由於我都敢吃錢錢也有帶夠，沒想到那個雞翅麵衣外面還有多放一層很像蜂蜜芥末的醬料，讓椒麻顆粒能好好的停留在上面不會亂飛，同時也在吃的時候不會被粉末嗆傷，麵衣好好保護住了內層的雞翅肉質，讓整體口感外脆內嫩！因為只有在有依附醬料的地方比較軟，搭配醬料吃更加開胃不膩口，所以外層油炸的雞翅麵衣我都吃光光了！只能用酥、香、脆、嫩去形容那種口感上的起承轉合！麵衣剝掉的時候發現裡面的雞翅很像鹽水雞的色澤，還有輕微烘烤過的痕跡很特別！大口咬下雞翅，肉質多汁又柔嫩令我驚豔不已，咀嚼的時候還有一股淡淡蜂蜜味道。
-
第一口到最後一口都好吃的漢堡！漢堡皮給我一種炸銀絲卷的口感，外脆內鬆軟也有那種拔絲的感覺，滋味也有點甜甜的，不過外皮酥脆所帶來的嚼勁會讓我想到酸種麵包的嚼勁，口感一開始在我咬下去的當下傳遞到我腦中的資訊是，厚皮披薩的麥香，瞬間好像有股大量的資訊一擁而上，芝麻葉、番茄、洋蔥、漢堡肉、加點的切達起司！起司跟蛋基本裡面都沒附，但我覺得漢堡的靈魂還是要有起司的滋味去調和，沒想到加進去之後，滋味上讓鹹度與油脂比例變得穩定，芝麻葉跟白色的醬料真的是一拍即合，如果可以加點芝麻葉我也想要加量，真的沒想過我會這麼想吃芝麻葉，裡面那微微嗆口的讓我反感的芝麻味幾乎是不存在，還讓我有種再加一些會更好吃的想法都湧現了！漢堡排的絞肉是用熟成肉製作的，裡面的鹹味帶給我的感覺，是一片煎好的牛排，切成好幾片沾上玫瑰鹽配著吃的滋味，每一口的咬下、咀嚼，就好像又送入一口切片牛排的感覺，持續性且均勻的鹹味！漢堡肉不柴同時也相當多汁，吃的時候要小心肉汁會一直滴出來。
-
氣泡型的康普茶很像零酒精的啤酒，可能是因為都是發酵的關係，反而會有股酒氣的氛圍，有生烏龍跟紅茶兩種口味可以選，上桌時那瓶身……看起來真的很像文青麥酒，設計得很漂亮，用紅茶發酵的康普茶色澤很像蜜桃茶，視覺上蠻可愛的。建議怕酸的人不要喝太快，盡量不要一口氣倒完全部進杯子裡，不然會不好倒回去瓶子裡，濃度太高承受不住要記得加冰塊稀釋，喜歡喝果醋的人應該會很喜歡。"
 陳利安 ,https://www.google.com/maps/contrib/109358030349733255781/reviews?hl=zh-TW,3,False,28,"說是刈包取代漢堡皮的漢堡店
點了推薦「蔥油雞」、「蒜味牛」
私心本日MVP是「迷迭香薯條」

刈包紮實的口感更像是炸過的早餐店饅頭～～～

蒜味牛：真的多汁的牛肉排，搭配蒜泥跟酸奶醬
牛油香有！蒜泥不苦！好濃且耐吃不油膩！
層次豐富、每個味道各司其職好平衡～～～～

蔥油雞：直覺想到燒臘店吶鹹香的胡椒蔥油醬汁
雞排有點乾唷，爆多的蔥油醬汁
因為搭配生菜太苦，蓋過了蔥油的香以及雞肉的美味，稍嫌可惜

迷迭香薯條：有古早味薑糖的風味
外皮是甜脆的香料糖衣，彷彿像是吃到薯條版的晴光脆皮甜甜圈

店裡油煙味很濃，鼻孔被油煙味堵了50%
七孔裡頭兩孔喪失功能，難免影響食慾
但食物滿美味的唷"
 jin ,https://www.google.com/maps/contrib/101484766404364313254/reviews?hl=zh-TW,5,True,99,"漢堡五顆星好吃到不行🥹
先講講他的麵包
從頭吃到尾都會是脆脆的那種！
吃起來很特別
漢堡很多汁但沾到漢堡流出來的肉汁麵包也不會軟掉><
個人不喜歡軟軟爛爛的口感這個麵包先加100分
蒜味牛280元加蛋+20元
蒜味更濃吃完嘴巴會是滿滿的蒜味
非常推薦加蛋
但是七分熟那種配蛋液很滑順！
調味很簡單就是鹽巴胡椒跟蒜
搭在一起真的太好吃ㄌ🥹
六角獸360元
男生朋友點的份量大概是男生吃完也會飽
炸雞很厚實也是有蒜味的那種
嘴巴不夠大會沒辦法一口吃到全部的料～
原味薯條80元
（我們有加套餐）
是粗的那種薯條冷掉吃依然脆！
套餐薯條沒有很大份
但女生的食量來說會是剛好
男生也不會吃不飽的套餐份量！
店鋪很乾淨明亮我蠻喜歡的
煎台離座位很遠
吃完不會全身都是油煙味超讚
後面還有行程也不會影響
絕對會再回訪太喜歡了～～～"
 黃Huang書偉Shuwei ,https://www.google.com/maps/contrib/116445018838135484619/reviews?hl=zh-TW,5,True,224,"一時興起的走進店裡，六腳獸的雙主菜瞬間吸引了我，友人也被中式調味的蔥油雞給誘惑，首先開胃菜的薯條中規中矩，雞翅多汁醬料增添香氣。
漢堡的主食炸雞味道跟市面上常見味道不一樣，有自己美味的秘訣，牛肉表現高分沒有恭喜，但多加的半熟蛋跟麵包相得益彰超級舒服的口中爆開。"
 Tobey Liou ,https://www.google.com/maps/contrib/118377312689857095697/reviews?hl=zh-TW,5,True,31,"欸很好吃耶你真的不吃吃看？
口味不無聊麵包有創意
中西合併蹦出好味道😋

點兩個

油蔥雞+蛋
蒜味牛+起司
100升級套餐
馬鈴脆薯原味
地瓜薯條甘梅

非常特別的漢堡堡麵包
是刈包的麵團
口感很扎實一點也不虛
上面的油蔥滿滿的
突破了漢堡很美式的口味
夾層有一個洋蔥圈

雞肉很嫩
很想抽出來單吃

但那個雞肉
是讓人想要天天吃到的嫩雞
汁汁汁汁汁液滿出
溢到你能允指😆
------------------

2021/12/19更新/補照片
限定版軟殼蟹🦀️
有濃濃的台灣味又帶點家常味
🦀️🦀️的螯被我一口咬下
Oh!好酥啊！
雖然有辣椒不過不會很～辣真的
菜菜很搭😋
你你你各位快來吃吃其他口味啦！
健身完來吃真的特別爽😜"
 Anna Tien ,https://www.google.com/maps/contrib/100424035529191381868/reviews?hl=zh-TW,4,True,336,"漢堡是好吃的，也能感受到店主對食材的用心。
少一星是想建議既然收取服務費，可以提供解膩的台式特色飲料（烏梅汁、楊桃汁等）更能襯托店家台式漢堡的理念以及待客的溫度。"
 New Chen ,https://www.google.com/maps/contrib/114258198259892572351/reviews?hl=zh-TW,5,True,430,"外觀看起來像髮廊或是賣女性衣服的小店
在巷子裏容易錯過

#僅收現金#有載具

漢堡的麵包皮口感讚讚！如同其他留言所說很像銀絲卷
炸雞無骨頭紮實
生菜番茄醬汁都很獨特有吃西餐/義大利麵的滋味😋

包覆的方式很完美不會咬完就開始結構鬆散倒塌🤩讓自己吃得很狼狽

起司+15元
蛋+20元

#10%服務費"
 Evelyn L ,https://www.google.com/maps/contrib/113170991717352412818/reviews?hl=zh-TW,4,True,75,台北的美式漢堡店已經過於浮濫，這家店可以帶給你新鮮的味覺體驗，麵包像是炸銀絲卷的口感，蒜味牛的醬是類似大蒜麵包的抹醬，蔥油雞的醬有降低鹹度，牛肉與雞肉的熟度都是恰到好處，因為漢堡裡面的每個細節都是精心雕琢的，所以要稍作等候，建議到現場來吃現作的餐點，會比外帶的體驗來的好，沒給五顆星的原因是內用的椅子不太好坐，以及希望能擴充菜單的豐富性，除此之外，是個味覺上的絕妙體驗。
 Sean chen ,https://www.google.com/maps/contrib/102625402920704984203/reviews?hl=zh-TW,5,True,230,"蒜味牛非常濃郁，肉汁都是蒜味，肉排厚實，肉汁滿滿，漢堡皮很特殊，感覺是用炸的，皮脆，內層吸飽肉汁，讚

炸雞堡肉排超大，肉質很嫩，雞皮酥脆，剛上非常非常燙口，要小心燙到上顎皮，痛。

迷迭香薯條，放在鼎裡面，可愛。感覺較像「甜薑粉薯條」，淡淡薑味+白糖粉，好吃酥脆，可惜涼的快

用餐環境舒服，有質感。"
 仲浩袁 ,https://www.google.com/maps/contrib/107650537321487489266/reviews?hl=zh-TW,5,False,6,"漢堡皮的部分炸的剛好不油膩
趁熱吃酥脆的感覺很像銀絲卷
蒜味牛加上起司更香
蒜香跟肉汁一口咬下非常滿足

六角獸是雞牛組合
炸雞跟牛肉沒想到這麼搭
裡面多了番茄片吃起來更清爽

可以搭配店家推薦的精釀啤酒
吃起來更對味！！"
 Jelly ,https://www.google.com/maps/contrib/108148121500697733774/reviews?hl=zh-TW,3,True,346,"店內空間挺好的，沒吃過的人可以來嚐鮮。但可能自己比較沒那麼喜歡吃炸過的漢堡皮加上牛肉沒有吃到juicy口感，所以3顆星。
牛肉漢堡目前自己第一名還是sheep+pony"
 SHERRY LIN ,https://www.google.com/maps/contrib/110254135933028766840/reviews?hl=zh-TW,4,True,78,"藏身在鬧區小巷裡的一間質感漢堡店，全店漆清水模、帶點工業風的感覺，從店裡的盆景、音響選擇到餐具都可以感覺到是間有用心設計的店

點餐時服務人員有用心且親切的來介紹，並有端上招待的日式醬油糰子；菜單上漢堡的口味有偏美式的、也有較富台式風味的選項

我這次點了花生味的牛肉漢堡，麵包可能是有先炸過？外表較酥脆，裡面則富有嚼勁，不會一吸汁就變得軟爛；麵包兩面都抹有花生醬，每一口都吃的到，不過漢堡裡重要的配角洋蔥則不是每口都吃的到，稍微有點可惜

整間店的氣氛很好，漢堡肉質也很不賴，只是單點的漢堡、薯條（而且還滿少的🥲）和飲料加起來價位實在不是CP值很高⋯（還有加一成服務費）
可能吃慣了普通的美式餐廳，會期待350$-400$左右的價格是要含薯條飲料的
總體而言認為是個滿用心的店家，還是很值得鼓勵的^_^"
 黃翊婷 ,https://www.google.com/maps/contrib/108118191691552386896/reviews?hl=zh-TW,5,True,381,"🔹經典牛＋半熟蛋💵280
🔸蔥油雞💵240
-
東區新開幕的台式漢堡店，特別之處在於使用炸刈包當作漢堡皮，漢堡口味除了有各式風味的牛肉，還有台式的蔥油雞及古早味手撕豬蹄膀。

這顆蔥油雞必點阿！太無敵了～炸刈包與蔥油醬超搭超合拍，雞腿的烤功更是一絕，外酥內彈又多汁，炸洋蔥的加入更是多了一個層次感。炸刈包的口感吃起來有點像是炸銀絲卷～

經典牛除了有美國熟成牛、煎烤洋蔥、生菜、番茄，Greta還加了一顆半熟蛋。雖然這顆沒有蔥油雞來的驚豔，但味道也還不錯，牛肉有厚度，肉質軟嫩，帶有淡淡的牛肉味。

雖然漢堡個頭不大價位偏高，但味道真的不錯，尤其是台式蔥油雞超對味～下次要來嚐嚐看古早味手撕豬蹄膀漢堡！
-
🔺10%服務費"
 Tu Tu ,https://www.google.com/maps/contrib/110793413558179671515/reviews?hl=zh-TW,4,True,61,"平日晚上前往用餐，無需等候，店內座位不多，環境乾淨、餐點美味。
簡直跟桑原髮型一樣的六腳獸，漢堡外皮也是較有口感的，炸雞外皮酥脆內部多汁軟嫩，牛肉排大約五分熟同樣軟嫩美味，配上烤蒜及醬汁，雖然吃到最後會有點點油，整體來說滿足！"
 Ethan Liu ,https://www.google.com/maps/contrib/115953763728940143619/reviews?hl=zh-TW,5,True,"1,138","漢堡牛肉和雞肉都很好吃
牛肉現拍肉汁充盈
雞肉炸皮酥脆肉質鮮嫩

配餐則建議椒麻雞翅
起司搭配椒麻醬十分合搭

薯條的話原味>迷迭香

整體來說食物美味環境舒適，店員人也很不錯"
 Saunter with OU ,https://www.google.com/maps/contrib/102158609460276216160/reviews?hl=zh-TW,5,True,248,"🔍𝐈𝐧𝐬𝐭𝐚𝐠𝐫𝐚𝐦:𝐒𝐚𝐮𝐧𝐭𝐞𝐫𝐖𝐢𝐭𝐡𝐎𝐮

台式元素揉合西式概念，顛覆對漢堡的想像！
將刈包油淋後再烤過，創造出銀絲卷般的外皮，再夾入中西合璧的內餡
打造出台灣面孔的漢堡包！

——
𝑎̀𝑙𝑎𝑐𝑎𝑟𝑡𝑒
•蒜味牛+蛋
•馬鈴脆薯

——
🕚
𝗪𝗲𝗲𝗸𝗱𝗮𝘆𝘀｜𝟭𝟭:𝟬𝟬~𝟭𝟰:𝟯𝟬；𝟭𝟳:𝟯𝟬~𝟮𝟮:𝟬𝟬
𝗪𝗲𝗲𝗸𝗲𝗻𝗱｜𝟭𝟱:𝟬𝟬~𝟮𝟮:𝟬𝟬
𝗠𝗢𝗡𝗖𝗹𝗼𝘀𝗲𝗱

☎️
𝟬𝟮-𝟮𝟳𝟳𝟴-𝟮𝟴𝟳𝟳

📍
台北市大安路一段𝟱𝟭巷𝟮𝟵號"
 Foodie Sakura ,https://www.google.com/maps/contrib/103636755395698237467/reviews?hl=zh-TW,5,True,152,"台北｜01BURGER
💡蒜味牛+切達起司295
💡蔥油雞+蛋260
-
有掛包靈魂的罪惡漢堡！

麵包體真的很特別
油炸過的表皮脆脆的
咬下去是比較鬆軟的口感

熟成牛肉漢堡排
加上起司美乃滋烤蒜烤洋蔥
是期待中的食材組合
吃起來軟嫩鹹香
蒜香十足

蔥油雞的醬汁微微辣
讓整個漢堡吃起來更有中西結合的風味
很喜歡脆脆的炸洋蔥搭配烤雞腿的口感反差
再加上半熟蛋那種蛋黃爆漿
嗯不多說了

這樣熱量驚人的漢堡確實不能每天都吃
但絕對是值得收藏的靈魂食物吧！

名片包裝的設計也很有巧思
灰+橘配色深得我心

也想補充下用餐感受
原本因為行程關係是需要外帶漢堡的
店家因為理解初訪想拍照留念的心情
就有先把漢堡裝進內用的碗中
等拍完了再幫裝入外帶餐盒和牛皮紙袋中
等待外帶餐點時還消毒了一個座位請我坐著等
感覺很暖心辛苦店家又多洗了兩隻碗🙏🏻
-
IG：@foodie.sakura
FB：Sakura'sFoodJournal"
 謝宛蓁 ,https://www.google.com/maps/contrib/104631011896088144078/reviews?hl=zh-TW,3,True,420,"業者是被盜ㄛ亂回一通：0
------------
外帶等了超過半小時，走回不到50公尺外的家漢堡卻是冷的，就價格來說非常失望。起司和蛋都要再加錢。

薯條皮薄脆很好吃、地瓜薯條也滿讚的是那種香香地瓜，可是一份就要80量也不多。

標榜特色的炸刈包因為冷了吃不出美味，如果現吃熱熱的應該很不錯吧。

這次點的是蔥油雞、蒜味牛、經典牛。跟評論說的一樣雞很美味，配上蔥鹽醬（碎蔥，但不吃蔥花的我OK）頗鹹，雞皮是脆的，可以快樂吃掉。蒜味牛是上面有超大量蒜末，吃完會變得超級大蒜（？

感覺花的錢沒有反應在食物上而是反應在看起來成本很高的名片上。可能只會回訪薯條（？"
 Molly ,https://www.google.com/maps/contrib/105928546633148851241/reviews?hl=zh-TW,5,True,277,"台北東區內的新漢堡店，創辦人是從米其林餐廳T+T一起出來共同創業。漢堡結合台灣口味，漢堡包是炸過的刈包，牛肉相當厚實多汁，嘴巴小的人可能會吃的比較辛苦。
薯條的餐盤很特殊，乍看起來有點像香爐。

🍔#經典牛加起司加蛋
🍟配#馬鈴脆薯
🍡評論送醬油糰子"
 阿奏你不合喔 ,https://www.google.com/maps/contrib/103305930279893853724/reviews?hl=zh-TW,5,True,213,"這肉煎得很香
感覺沒有絞得很細口感很好又多汁
恰到好處的黑胡椒香氣

麵包像是炸刈包個人覺得還好
但是因為那個肉
整體是我很愛的漢堡"
 Zach Chang ,https://www.google.com/maps/contrib/104902741681348451255/reviews?hl=zh-TW,4,True,275,蔥油雞漢堡的蔥油醬很香，可惜半熟蛋拿到的時候就破掉了，蛋黃直接從袋子流出來🤔另外覺得炸雞翅有點太鹹了，然後外皮有點偏油，整體算不錯，價格偏中上
 Riley Hsiao ,https://www.google.com/maps/contrib/100134609479117381095/reviews?hl=zh-TW,5,False,8,"從進到餐廳店員就很親切介紹
大蒜牛+迷迭香薯條
都超讚的！
吃完完全不會膩口👍🏼
還招待了自製可愛的黑糖團子🍡"
 Kevin Wang ,https://www.google.com/maps/contrib/116625073144638242324/reviews?hl=zh-TW,5,True,27,"漢堡包的很有美感，很適合拍照
牛肉汁多、有彈性，雖然不是和牛，但牛肉的品質不錯
開放式廚房，可以聽到廚房在拍肉的聲音，現點現做，所以要稍等久一點
漢堡好吃，會再訪"
 Yamy ,https://www.google.com/maps/contrib/100563297614746248896/reviews?hl=zh-TW,4,False,8,"經典牛💸260（+蛋20+起司15）-平常就很愛吃漢堡，這顆厚度很厚，肉排肉汁很多，吃起來真的爽
馬鈴脆薯💸80（原味/迷迭香）-是好吃的薯條，但原味很鹹，而且不習慣迷迭香的味道（偏甜）
原味炸雞翅💸90-雞翅多汁，不油膩，感覺椒麻的會更讚
糰子（招待）-好吃，免錢的最香
一開始看到裡面沒什麼人其實很擔心踩雷，但這間真的有料，不是虛有其表的網美店！"
 徐捷中 ,https://www.google.com/maps/contrib/114700458590602542691/reviews?hl=zh-TW,4,True,240,"迷迭香薯條➡️不後悔嘗試，但不會再點了，甜的.....interesting!

六腳獸漢堡➡️牛+雞的漢堡，調味不錯，很有層次，推薦加蛋與起司，美中不足的是雞是用炸的，皮的口感我不喜歡，但瑕不掩瑜，小推！

蔥雞漢堡➡️台式風味漢堡，這個非常好吃，店員主動推薦加蛋不加起司，非常獨特的好味道，價位也比較合理，大推🌟"
 Douglas Lin ,https://www.google.com/maps/contrib/113488354149384998124/reviews?hl=zh-TW,5,True,38,"價格偏高，麵包有點酥酥脆脆融合台灣味的好吃漢堡，下次要再去試六角獸！
Alittlebitexpensive,niceburgerwithcrispybunsandalittlebitTaiwaneseflavor,wouldliketotry六角獸nexttime!"
 Shekinah ,https://www.google.com/maps/contrib/106569229718410566889/reviews?hl=zh-TW,5,True,81,"無可挑剔的完美✨
漢堡皮香、肉多汁、有芝麻葉大大加分👍
迷迭香薯條香甜可口！糰子也好好吃！

食材很好～服務親切～椅子好好坐
是一家眼睛舒服嘴巴舒服肚子舒服屁股也舒服的好體驗❤️"
 S H ,https://www.google.com/maps/contrib/112081865159992100175/reviews?hl=zh-TW,5,True,70,"滿有特色的新開漢堡店，漢堡麵包是炸過的掛包，肉類表現也很好，有個特色品項是松阪豬跟紅心芭樂的組合很清爽，非常推薦。

另外加點的炸雞翅跟薯條也都很滿意。

主要是目前人潮還不多，店裡的服務品質很好，不用排隊就有位置，希望生意興隆之後也會繼續維持。

非常推薦前往。"
 CLAUDIA H ,https://www.google.com/maps/contrib/109642042199133658029/reviews?hl=zh-TW,5,False,9,漢堡的麵包皮炸過，外層非常酥脆但內層仍十分柔軟、香氣十足不油膩。肉排多汁，口感富有層次、整體口味清爽又有特色，值得試試。炸雞翅也很好吃～
 vicky Liang ,https://www.google.com/maps/contrib/104430469714115974971/reviews?hl=zh-TW,5,False,14,"小小的店店內的小姊姊接待很親切
因為是開放是廚房所以看得到裡面有兩位酷酷的主廚雞翅意外的酥脆多汁耶⋯⋯
漢堡皮口感就像小時候吃的炸銀絲卷
我們點了蒜味牛跟經典牛兩者蒜味牛比較重口味適合大人吃牛肉也很多汁
台味豬讓我想起割包內餡豬肉調味的很棒
女兒一直問我菜單內容不是有紅豆嗎？怎麼都沒吃到⋯⋯我仔細看了一下應該是跟豬肉餡炒在一起了⋯⋯因為我們沒有點飲料所以吃到後面有點膩⋯⋯如果內用有提供免費檸檬水服務費收取才算合理"
 陳嘉瑀 ,https://www.google.com/maps/contrib/100346747543624755726/reviews?hl=zh-TW,5,True,76,"大愛蒜味牛～中間的蛋黃會流出來！
喜歡迷迭香薯條每次都要來兩份！
油蔥雞也超好吃😋
飲品的選擇不多～
空間舒適、推薦！"
 游志仲 ,https://www.google.com/maps/contrib/105410371355742009829/reviews?hl=zh-TW,5,True,24,很有台灣味的漢堡，刈包麵糰以熱油淋燙而成，外皮酥脆內裡紮實有嚼勁。古早豬-搭配台灣口味的五花爌肉+香菜味道ㄧ絕。花生牛-美國熟成牛肉+花生醬及麵茶多汁美味。還有蔥油雞-烤雞腿肉+蔥油醬滿滿的台味。很棒的用餐經驗，值得專程品嚐的美味。
 Tingyao Hsieh ,https://www.google.com/maps/contrib/109637737383303910658/reviews?hl=zh-TW,5,False,3,單看外觀可能看不出是一家漢堡店，不論是環境、器皿、料理，都可以看的出店家的用心，想要呈現給大家不一樣的用餐環境和體驗，就目前所吃過的漢堡店，這裡的漢堡風味是讓人印象深刻及意猶未盡，服務恰到好處，適時的關心餐點風味，聆聽顧客分享用餐心得，待客送客，非常好的一次用餐體驗。
 Chen Allison ,https://www.google.com/maps/contrib/118195236798244027726/reviews?hl=zh-TW,3,True,44,"麵包體很有趣有點像天天炸饅頭好吃👌
經典牛的肉排吃起來雖然肉汁很多，但肉排外面沒撒什麼鹽巴胡椒，吃起來比較沒味道

不過迷迭香薯條很不錯，炸的剛好不會過頭保持綿密，淋上些微糖霜有趣，香氣舒服，值得再去吃一次薯條"
 Bo Bo ,https://www.google.com/maps/contrib/106987897655762175315/reviews?hl=zh-TW,4,True,127,"牛肉堡加蛋加起司優秀
原味薯條優秀
零卡可樂調味怪怪的應該是飲料機的問題
還不錯囉"
 K L ,https://www.google.com/maps/contrib/117545191971547097682/reviews?hl=zh-TW,3,True,517,"外送點了蒜味牛
味道很新奇但個人吃不慣覺得不搭
整體偏油份量不多
價格高建議內用比較好"
 Pin-Hsuan Wu ,https://www.google.com/maps/contrib/109164209650511571950/reviews?hl=zh-TW,4,True,93,"食物的部分漢堡好吃肉汁很多口味也還不錯
麵包有點像佛卡夏的口感個人喜歡再軟一點的
但起司、蛋、薯條、飲料都要額外加錢還要收服務費
整份吃下來一個人可能要五六百塊
店裡還沒提供水覺得有點overpriced"
