user_name,user_profile_url,rating,local_guide,comment_num,comment_text
 Webber ,https://www.google.com/maps/contrib/113710437296582981493/reviews?hl=zh-TW,5,True,100,"漢堡跟雞翅都很好吃
漢堡是用炸麵包，蠻像炸銀絲卷口感
漢堡的牛肉肉餅風味濃郁且多汁
椒麻雞翅的麻香味很足"
 悠寶 ,https://www.google.com/maps/contrib/104529697923417154591/reviews?hl=zh-TW,4,True,839,"▪️蒜味牛×口味較重肉汁很Juicy😋
▪️蔥油雞×口味比較清淡一丁點蔥油好吃😋
▪️馬鈴脆薯/原味×炸的超酥脆
▪️地瓜薯條/甘梅×就是地瓜條🤣
▫️可樂▫️薑汁汽水
📢套餐+100摳(薯條+50元內飲品)

漢堡皮是用炸的(很像吃炸銀絲卷🤤🤤
很大一顆漢堡櫻桃小嘴的女孩悶無法一口塞😂
漢堡內的生菜是芝麻葉&水田芥
幾片的葉子點綴也沒有太大的生菜味
對於不愛生菜的我來說我OK耶👏

⭐悠悠飲食參考：
甜：手搖飲半糖>偶爾3分糖
鹹：蠻重鹹的
辣：中辣"
 Y Lim ,https://www.google.com/maps/contrib/107788722482976823426/reviews?hl=zh-TW,5,False,2,"極度優秀🧡

東區新開的漢堡店，裝潢美麗，餐超好吃

首訪外帶「秘製雞」、「蔥油雞」，炸雞無敵好吃（驚艷），蔥油雞的味道也很棒，麵包尤其讚，吃到最後都不會軟爛。

二訪內用「古早豬」，身為焢肉控的我覺得讚，之後再慢慢把菜單吃過一輪。因為太好吃於是逢人就推薦，吃過的朋友都愛上！"
 林大祐 ,https://www.google.com/maps/contrib/112093470837504181300/reviews?hl=zh-TW,5,True,66,獨特的漢堡麵包口感，價格中上，食物美味值得再訪！！單點份量就偏少了😂😂
 Ellie F ,https://www.google.com/maps/contrib/112538712384074977311/reviews?hl=zh-TW,5,False,6,"限定的軟殼蟹超～好～吃
蒜味牛很香很juicy，肉汁超多
會吃的狼狽但真的很推
最後還幸運吃到闆娘手作的泡芙
HURJIALA👍🏽"
 Peter Huang ,https://www.google.com/maps/contrib/118368205617509871815/reviews?hl=zh-TW,5,True,338,優秀。炸過的麵包，還維持軟香；漢堡牛肉厚又有肉汁；折得精緻的小袋，不會吃得滿手油；椅子看來簡單，但坐起來就是舒服。
 sun NASH ,https://www.google.com/maps/contrib/112333715928347302401/reviews?hl=zh-TW,2,False,5,"單點薯條這樣賣80我也是開眼界了、有收10%服務費、但我不知道我的服務費花在哪？？？
漢堡也是有空間進步"
 陳昱超 ,https://www.google.com/maps/contrib/104151665926714859015/reviews?hl=zh-TW,5,True,361,"非常特別的口味與口感，吃過一次就會想在二訪！
實在非常好吃！"
 Sybil Cheng ,https://www.google.com/maps/contrib/107350438283332016194/reviews?hl=zh-TW,4,True,132,"麵包熱的時候吃超級Q
不過漢堡肉本身略乾這才是漢堡最重要的呀"
 Michael Wu ,https://www.google.com/maps/contrib/113496743761422951335/reviews?hl=zh-TW,5,True,134,"蒜味牛重口味好吃
炸過的麵包很紮實蠻特別的
椒麻雞翅好吃不辣
招待的鳳梨泡芙蠻特別的
缺點是等很久跟椅子很矮
但不妨礙給五星"
 米米兒 ,https://www.google.com/maps/contrib/104001408500198904345/reviews?hl=zh-TW,5,True,36,"當刈包的麵團變成漢堡包在油鍋中炸的滋滋作響
當咬進嘴裡時耳朵聽到的那標準的酥脆聲

「喀滋」「喀滋」

請好好享用這如此好吃的台式漢堡
都到了現場，
請不要錯過內用限定的六角獸
牛雞的結合讓一個漢堡可以左吃右吃一起吃
多汁又…..
喔不～是爆汁的肉成了橋樑串起所有食材
在你的嘴裡擾動你的味蕾
外面吃不到的蔥油雞口味
在漢堡的組合下也搭的不得了
有別於酥脆得讓人印象深刻的炸雞肉
蔥油雞的嫩香也帶來了另一番滋味
在炸洋蔥的陪襯下使口感不單一

另外，請絕對不要錯過小點的
迷迭香馬鈴薯條與梅粉地瓜薯條
帶著甜味的迷迭香會送上新的味蕾體驗
酥脆的地瓜薯條在旁也讓你無法忽視
還有那超好吃雞翅
是的，那雞翅香脆多汁的讓你停不了手
能接受點微辣的請務必要選擇辣的
那將會讓雞翅的肉香更上一層

上次吃過的古早豬也讓人印象深刻
雖然因為外送酥脆度無法像內用一樣
但還是讓人很有記憶點

如果想吃漢堡，請絕對不要錯過
請絕對不要錯過那剛出爐的酥脆「喀滋」"
 TungTung ,https://www.google.com/maps/contrib/113250287836341317513/reviews?hl=zh-TW,5,False,19,"開幕嚐鮮
基於不吃🐂的關係，兩個雞肉跟豬肉都很想吃
店員貼心的建議如果第一餐不想太油就試試蔥油雞
貼心的服務讓人心情愉快❤️
⭐️蔥油雞
初入口是蔥油雞濃郁豐厚的口感，接著漢堡裡的蔬菜帶出田園風味爽口餘韻半熟的蛋融入在菜與肉之間漢堡皮令人意想不到的酥脆整體令人驚艷
老闆餐點搭配非常用心店裡氣氛非常舒服
下次蒞臨一定要把其他幾樣餐點都點過一次
很開心第一次消費就抽到不錯的折扣

饕客們一定要去吃吃：）"
 E L ,https://www.google.com/maps/contrib/112309840443704004210/reviews?hl=zh-TW,5,True,30,"01漢堡進來之前是0出去的時候是1
如果你還搞不懂來吃看看就知道了"
 Funny Fang ,https://www.google.com/maps/contrib/113295903289503276695/reviews?hl=zh-TW,1,False,12,"我點的是蒜味牛肉堡，裝潢是不錯，漢堡用油炸過也是很特別，但整個感覺在吃蒜，牛肉味道完全被蓋過，薯條過油，雞翅太鹹，整體吃下來會感到太油膩。
-
12/18回覆店家：
請搞清楚狀況，我沒有遺失耳機！
沒搞清楚狀況就亂罵人，素質還真高。
-
12/19回覆店家：
你有紀錄那就太好了，請調出來確認！
再來耳機又跟素質扯上什麼關係？
謝謝你的回覆，我會再跟好友們分享"
 Peter Chen ,https://www.google.com/maps/contrib/105043739251313978441/reviews?hl=zh-TW,4,True,65,無意間找到的漢堡店，結果非常驚艷，不是用一般漢堡麵包而是把割包拿去炸，脆脆的又不會太油，好吃！
 en yi Peng ,https://www.google.com/maps/contrib/108036883675197451873/reviews?hl=zh-TW,5,False,4,"外帶跟內用都一樣好吃，環境簡單乾淨，很適合跟朋友在這邊小聚用餐！👍🏻👍🏻👍🏻
店內裡還有很多可愛的裝飾品"
 Kuo alley ,https://www.google.com/maps/contrib/110014773966758772277/reviews?hl=zh-TW,5,True,53,"擺設簡單舒適但不馬虎
採用類似負壓式的空氣循環
吃完一餐不讓身上沾染油煙
別於一般美式漢堡吃完膩口
濃淡之間的平衡拿捏得很好
簡稱美味啦
還有宜龍的陶瓷餐具賞心悅目

從餐點到用餐環境非常滿意
希望每次去都能有這麼好的消費體驗🥰
五星好評"
 曾小晉 ,https://www.google.com/maps/contrib/115197658412321210956/reviews?hl=zh-TW,5,True,27,很好吃精緻的漢堡，特別的漢堡皮配上精緻的餡料！👍推薦蒜味牛
 Yun ,https://www.google.com/maps/contrib/117718834886929063585/reviews?hl=zh-TW,5,True,152,"我點的是蒜味牛，好吃！
還有點迷迭香薯條，迷迭香薯條是甜的，超級特別ㄉ"
 C Alice ,https://www.google.com/maps/contrib/108381931216587079762/reviews?hl=zh-TW,5,False,8,原味馬鈴薯薯條香脆好吃，香爐造型也很有趣！蒜味牛漢堡很多汁，再加上起司跟蛋真的絕配🤤
 Abby Chou ,https://www.google.com/maps/contrib/111209610932616111170/reviews?hl=zh-TW,5,False,9,"迷迭香薯條必須嘗試！獨特香氣，口味吃起來甜甜的～
蒜香牛的蒜味非常夠，肉排非常Juicy，好好吃😋"
 Ryan Lin ,https://www.google.com/maps/contrib/113246512819872380816/reviews?hl=zh-TW,5,True,65,"炸刈包式的漢堡麵包，值得一試。
蒜味牛/椒麻辣子雞翅/薯條"
 林政錡 ,https://www.google.com/maps/contrib/113945389992725242715/reviews?hl=zh-TW,5,True,134,漢堡薯條都非常精緻特別刷新我對漢堡的定義
 Alice Liu ,https://www.google.com/maps/contrib/110309213234297892536/reviews?hl=zh-TW,5,False,12,"蒜味牛非常驚艷好吃！其他的例如經典牛或是蔥油雞也獲得朋友好評。
麵包不是一般漢堡麵包，是掛包的皮下去炸，相當扎實而且麵皮很香。
推薦要加一顆蛋，飽足感十足！
是值得回訪的一家店。
目前是我的漢堡店第一名，讚！"
 aking 306 ,https://www.google.com/maps/contrib/116185549592112391023/reviews?hl=zh-TW,1,False,5,改一下google的營業時間很難嗎？看過去的評論，這已經不是第一次臨時停業了，做生意最基本的東西都做不到。
 童怡文 ,https://www.google.com/maps/contrib/104802604070245272599/reviews?hl=zh-TW,4,True,77,點了大蒜牛肉堡，麵包體&大蒜醬非常讓人驚艷！但牛肉稍嫌過生…不愛絞肉是生的口感😅，如果可以在點餐時詢問一下就太棒了！
 游佳祺阿JOE ,https://www.google.com/maps/contrib/111440469015367500906/reviews?hl=zh-TW,5,False,6,超級好吃牛肉多汁麵包獨特香脆😋
 登傑瑞 ,https://www.google.com/maps/contrib/115618691189055559784/reviews?hl=zh-TW,1,False,4,"其實走到忠孝東路上的麥當勞不遠
這是吃完走出餐廳馬上浮現的想法

說漢堡好不好吃普通
漢堡皮油味蠻重蓋掉許多裡面配料的風味
結帳被收服務費？真的不知道被服務了什麼
連一杯水也沒有；餐桌釘太高，椅子挑太低
時不時因為椅子的設計一直往後滑
只能說吃完身心靈沒有一個被撫慰到
更不用說餐點份量的部分了！"
 TZU-HSUN LIN ,https://www.google.com/maps/contrib/110808094520243116793/reviews?hl=zh-TW,5,False,15,很好吃！！！！！那個麵包那個肉非常滿意😋
 吳家輝 ,https://www.google.com/maps/contrib/104801853868020440070/reviews?hl=zh-TW,4,True,68,"餐點蠻有特色漢堡肉味道不錯
唯一缺點算是份量比較小一點食量大的可能會吃不飽"
 CC ,https://www.google.com/maps/contrib/111536339744938305237/reviews?hl=zh-TW,3,False,3,"餐點好吃，但也稱不上驚艷，份量小
收服務費但連一杯水都沒有，只有桌邊點餐而已
整體來說價格太高了"
 張鉦鑫 ,https://www.google.com/maps/contrib/113288774133335033193/reviews?hl=zh-TW,5,False,5,漢堡麵包超級脆，很香，雖然比較小，但是味道豐富，很有層次
 高子珺 ,https://www.google.com/maps/contrib/111755675715448508916/reviews?hl=zh-TW,1,True,42,特地跑來吃結果營業時間到了現場卻發現鐵門是拉下來的，打電話也是無人接聽，十分失望！
 邱韜誠 ,https://www.google.com/maps/contrib/101013728161988202881/reviews?hl=zh-TW,4,True,137,價格不便宜，但可以試試
 Doris Tai ,https://www.google.com/maps/contrib/106032324129015227520/reviews?hl=zh-TW,5,False,3,"餐點裝潢服務全部都值得大力推薦👍🏻
每月限定堡必嚐，絕對是想像不到的好味道"
 陳勇豪 ,https://www.google.com/maps/contrib/113427245241791829176/reviews?hl=zh-TW,5,True,70,蒜味牛+起司蛋我給10分就是我喜歡的味兒，麵包難得我是會吃掉的，會再來的。
 Yu-Ting Wu ,https://www.google.com/maps/contrib/100483305154063239500/reviews?hl=zh-TW,5,True,479,"朋友推薦蔥油雞，說比花生牛更厲害一些
很有層次很好吃，只是很多汁考驗吃相XD"
 沈祐陞 ,https://www.google.com/maps/contrib/100058626231742307827/reviews?hl=zh-TW,5,True,212,"漢堡皮超讚的！
還有招待小團子
超推"
 An ,https://www.google.com/maps/contrib/115741683885178218886/reviews?hl=zh-TW,5,False,4,"漢堡很好吃😋服務也很好👍🏻
下次要再來吃別的口味！"
 Sammi Wu ,https://www.google.com/maps/contrib/117527402001247505713/reviews?hl=zh-TW,5,False,9,牛肉多汁而且麵包炸的很酥脆，是近期吃過算很好吃的漢堡👍
 William Lee ,https://www.google.com/maps/contrib/113269348009303536235/reviews?hl=zh-TW,5,True,72,漢堡口味比較偏重，店員服務態度非常好，店裡氣氛也不錯
 Robin Liu ,https://www.google.com/maps/contrib/103135921138009162846/reviews?hl=zh-TW,5,False,16,"麵包很特別，牛肉非常好吃，很香肉汁又多
店家還招待了一個小甜點"
 庭庭 ,https://www.google.com/maps/contrib/103517857284554938779/reviews?hl=zh-TW,5,True,253,"價格太貴但食物外帶吃起來還不錯
麵包很脆"
 Agnes Lo ,https://www.google.com/maps/contrib/110223481248607349303/reviews?hl=zh-TW,5,False,3,"有台灣特色的漢堡店！
炸雞很嫩、醬好吃，加蛋也好吃～"
 Kazakh Yeh ,https://www.google.com/maps/contrib/110076655187518777186/reviews?hl=zh-TW,5,False,6,漢堡超多汁，還有限量椒麻雞翅也超棒👍
 海洋 孤帆荒島 ,https://www.google.com/maps/contrib/104758268482730252199/reviews?hl=zh-TW,5,False,41,很有創意的漢堡店，我喜歡，真的好吃。
 莊五更 ,https://www.google.com/maps/contrib/116229126228891907666/reviews?hl=zh-TW,5,True,175,好吃~不枉費我等了一個小時才吃到
 p86111 ,https://www.google.com/maps/contrib/102495087023761052213/reviews?hl=zh-TW,4,True,523,"薯條現炸好吃
漢堡也好吃
漢堡皮微炸過滿特別"
 W. L ,https://www.google.com/maps/contrib/113001239287000395241/reviews?hl=zh-TW,5,True,"1,264",滿有特色的漢堡，座位略少，但可外帶。
 Shelly Liu ,https://www.google.com/maps/contrib/106209968162199143436/reviews?hl=zh-TW,5,True,37,"蒜味牛、經典雞！！用料有用心～
啤酒也很好喝😍"
 Shihjie Lin ,https://www.google.com/maps/contrib/112060573153018777797/reviews?hl=zh-TW,5,True,15,端上來時光看漢堡外觀就知道這家店非池中之物，麵包口感類似炸過的饅頭非常巧妙，夾層餡料風味層層堆疊卻又十分和諧，招待的點心（先前的泡芙和最近的醬油糰子）也毫不馬虎。誠摯希望在這美感低落的時代，01Burger能持續堅持自己的獨特美學。
 李健銘 ,https://www.google.com/maps/contrib/101507676877831535235/reviews?hl=zh-TW,5,False,4,傳統掛包，做成西式漢堡皮，搭配多汁的牛肉👍🏻👍🏻👍🏻👍🏻
 Lin eddy ,https://www.google.com/maps/contrib/103575400332924460426/reviews?hl=zh-TW,3,False,7,店內高腳椅加上超冷的空調擺明叫你吃完快滾，然後今天的經典牛調味貌似沒勻，快結束才吃到鹹味。其他ok、原本看到薯條小小一撮插在香爐上滿傻眼，但好險漢堡吃完是有飽足感的所以還可以接受。
 Marco Shih ,https://www.google.com/maps/contrib/109455905492323790130/reviews?hl=zh-TW,5,True,239,五星推薦，台北漢堡店前三名。
 王心貝 ,https://www.google.com/maps/contrib/100334242053476618058/reviews?hl=zh-TW,5,False,4,從0到1都是主廚親手製作，「六腳獸」兩層肉品的搭配鹹香多汁，加上手工刈包的創新組合，值得特地前來品嚐呦！（搭配迷迭香馬鈴脆薯，絕不讓你失望）
 Nina Lin ,https://www.google.com/maps/contrib/104973242311570024518/reviews?hl=zh-TW,3,True,86,"吃的是花生牛，麵茶的味道不明顯不知道是不是因為其他食材太鹹
結帳時看到要加服務費，點餐是自己到櫃檯、從進店裡到離開沒有水沒有餐巾紙甚至連服務態度都稱不上親切，實在不明白這服務費的定義"
 Emily Huang ,https://www.google.com/maps/contrib/109258329852826737073/reviews?hl=zh-TW,5,False,13,非常好吃！立刻客滿～慶幸早一步進來🤣🤣
 kao Bruce ,https://www.google.com/maps/contrib/112533712603303681634/reviews?hl=zh-TW,5,False,4,松露薯條好吃！
 張家源 ,https://www.google.com/maps/contrib/113497230211267757078/reviews?hl=zh-TW,5,False,2,"漢堡具有中西合併的新口味及口感，卻很完美的結合，打破中西合併的高牆，味道又好！
真的非常好吃，是那種會想再來吃的好吃！"
 Chloe Huang ,https://www.google.com/maps/contrib/114400087346722336678/reviews?hl=zh-TW,5,True,22,"東西都很好吃，經典雞，肉很軟很入味
加點的附餐，地瓜條梅子口味很推，喜歡梅子的味道
但美中不足的是漢堡皮是炸過的，很油膩

位置很貼心，桌子下有掛勾可以掛包包"
 蘇柏禎 ,https://www.google.com/maps/contrib/101130404301133425958/reviews?hl=zh-TW,5,False,3,蒜味牛漢堡肉汁超多，味道豐富，蔬菜比例搭配的剛剛好，建議大家可以加點蛋跟起士絕對不會後悔，薯條炸的很酥脆超級喜歡👍👍👍
 ting yu ,https://www.google.com/maps/contrib/107392904472331986236/reviews?hl=zh-TW,5,False,3,"好吃好吃😋
推薦大家來吃吃看～～
蒜味牛加起司無敵👍🏿👍🏿"
 Jill ,https://www.google.com/maps/contrib/117475431110367977728/reviews?hl=zh-TW,4,True,157,漢堡真的好好吃，但薯條就炸到有點太硬，另外就是開門時間有時候跟Google地圖上顯示得不一樣，有次去就撲空了，看粉絲頁也沒有公告營業時間異動，白跑一趟😅
 Jayco Cheng ,https://www.google.com/maps/contrib/101964998656755792741/reviews?hl=zh-TW,5,True,28,本身就喜歡吃美式漢堡的我，吃下去就覺得這個麵包真的很好吃，而且蔥油雞的調味也很好吃，很清爽的美乃滋搭配油蔥，感覺到料理的用心，下次我要再試試其他口味。
 徐鈺傑 ,https://www.google.com/maps/contrib/115846591320911794391/reviews?hl=zh-TW,5,False,12,"令人驚艷的美味漢堡皮

牛肉多汁😋

激推👍🏻👍🏻👍🏻👍🏻👍🏻"
 王筠茹 ,https://www.google.com/maps/contrib/110727815677125143019/reviews?hl=zh-TW,5,True,28,真的好好吃一定會再訪的🥰
 施介紘 ,https://www.google.com/maps/contrib/108220331400483722067/reviews?hl=zh-TW,3,True,28,餐點好吃。座位配置不好聚會（只有面牆）價格偏高，量偏小。
 Alice Lee ,https://www.google.com/maps/contrib/106836946225388137866/reviews?hl=zh-TW,5,True,99,"誤打誤撞找到超好吃漢堡❣️❣️❣️
結合有一點台式感覺，麵包皮像在吃炸銀絲卷！整體非常好吃，會再回訪"
 Wei Lin ,https://www.google.com/maps/contrib/117272582117864302558/reviews?hl=zh-TW,5,False,6,"東區最好吃的漢堡
平價又好吃"
 ponyson lin ,https://www.google.com/maps/contrib/115934600633245139180/reviews?hl=zh-TW,5,True,16,目前吃過最好吃的漢堡
 N ,https://www.google.com/maps/contrib/108345260103403306936/reviews?hl=zh-TW,5,False,20,超好吃😋牛肉的熟度非常剛好❤️
 Lisa Liao ,https://www.google.com/maps/contrib/113283668783238440265/reviews?hl=zh-TW,5,False,11,"刈包變成漢堡皮很好吃！
蔥油雞口味雞肉炸得剛剛好
充滿雞汁混著蔥油⋯好吃👍"
 Elyse Tung ,https://www.google.com/maps/contrib/108581098505881111823/reviews?hl=zh-TW,5,False,5,"發現家裡附近新開的漢堡店
順路經過外帶回家吃
沒想到這麼好吃
意外到連拍照都沒拍就吃完了
漢堡非常juicy
漢堡皮還是炸過的但不油膩
整體就是非常驚艷"
 Phoebe Liu ,https://www.google.com/maps/contrib/104017935060826321803/reviews?hl=zh-TW,5,False,34,很好吃環境也很乾淨❤️還有招待日式醬油糰子，薯條味道也很特別！服務人員態度很親切♡
 Chiawen Chen ,https://www.google.com/maps/contrib/106410883506183170893/reviews?hl=zh-TW,1,True,33,油膩、不香、不鮮美，吃完懷疑自己失去味覺。這個口味搭配這個價位只能給1星。
 佳玲洪 ,https://www.google.com/maps/contrib/105733676508685499128/reviews?hl=zh-TW,1,False,8,該店家沒有提供水卻收服務費，個人感覺有點差，份量也少的傻眼
 黃皓 ,https://www.google.com/maps/contrib/110895974195165833475/reviews?hl=zh-TW,5,True,22,熟成牛肉堡厚實多汁，很棒！
 Jay Chou ,https://www.google.com/maps/contrib/117199362163745249690/reviews?hl=zh-TW,5,False,4,肉汁多，風味組合也超特別！！
 許家綺 ,https://www.google.com/maps/contrib/110489112295191265458/reviews?hl=zh-TW,5,False,2,漢堡裡的肉汁都有鎖住，漢堡皮雖然炸過但不油膩！真的很推薦很好吃👍🏽👍🏽👍🏽👍🏽👍🏽
 陳冠伶 ,https://www.google.com/maps/contrib/101371839634739412744/reviews?hl=zh-TW,5,False,12,"蔥油雞蒜香牛超好吃
唯一缺點料多到吃的很狼狽
滴了一堆肉汁覺得好浪費
（不過外帶附濕紙巾超讚
店男帥女美氣氛好東西又好吃
推～～～～～"
 Jean Jellybean ,https://www.google.com/maps/contrib/111091120775293068176/reviews?hl=zh-TW,1,False,3,"Cp值低比較像在吃炸饅頭堡
薯條、起司、蛋都還要另外加
台北其他好吃的漢堡店太多了"
 紀力華 ,https://www.google.com/maps/contrib/102070890060685849388/reviews?hl=zh-TW,5,False,2,"蒜味牛味道濃郁
炸雞好吃"
 Fiona Cheng ,https://www.google.com/maps/contrib/116239085846999573736/reviews?hl=zh-TW,5,False,2,"經典漢堡跟油蔥漢堡非常美味👍
配餐的甘梅薯條還有炸雞也非常好吃，
感覺用了很乾淨的油。"
 蔡佳茵 ,https://www.google.com/maps/contrib/113390409325803753314/reviews?hl=zh-TW,5,False,10,"好吃！！！全部都好吃
店很乾淨"
 李峰銓 ,https://www.google.com/maps/contrib/111827041941512922389/reviews?hl=zh-TW,5,False,1,炸過的麵包很特別.好吃
 羅偉誠 ,https://www.google.com/maps/contrib/101139166485038288893/reviews?hl=zh-TW,5,False,7,北市最強漢堡，還不來吃吃？
 Antso Cheng ,https://www.google.com/maps/contrib/108186998268288231528/reviews?hl=zh-TW,3,False,140,可以😌但就一班..對我
 An Chan ,https://www.google.com/maps/contrib/105751765275050305515/reviews?hl=zh-TW,5,False,7,岩漿般的瀑布起司，炸銀絲卷的漢堡皮，扎實撲鼻原汁鐵板牛肉。一定會再來！
 鄭凱翔 ,https://www.google.com/maps/contrib/108546463361909160546/reviews?hl=zh-TW,1,True,57,為什麼要收服務費？？尤其是在沒服務的情況下…….
 張舒雁 ,https://www.google.com/maps/contrib/113546891841416481084/reviews?hl=zh-TW,5,False,9,"好吃😋
很推期間限定！"
 Kuan-Chieh Fu ,https://www.google.com/maps/contrib/106643869246655222555/reviews?hl=zh-TW,5,True,13,台式情懷的麵包搭配很不賴，牛肉很多汁，用餐環境明亮舒適。
 林彥廷 ,https://www.google.com/maps/contrib/102104977485961944015/reviews?hl=zh-TW,5,False,2,口口吃到酥脆麵包外皮卻又鬆軟的內在，肉多汁又Q彈，恰到好的醬汁！
 廖佑昇 ,https://www.google.com/maps/contrib/114326674065949639416/reviews?hl=zh-TW,5,False,3,經典牛可以呦～
 鍾晴羽 ,https://www.google.com/maps/contrib/115942859960735382435/reviews?hl=zh-TW,5,False,111,推推蔥油雞🍔🍔
 高鈺翔 ,https://www.google.com/maps/contrib/101889195512990390358/reviews?hl=zh-TW,5,False,8,"東區最強漢堡店！
店內環境很優漢堡也大推👍🏼👍🏼👍🏼"
 wen Ai ,https://www.google.com/maps/contrib/110155978769728505141/reviews?hl=zh-TW,1,False,3,服務態度極差，給意見反倒生氣，麥當勞漢堡都比你好吃😋
 趙偉志 ,https://www.google.com/maps/contrib/107209585859709775929/reviews?hl=zh-TW,5,True,155,經典牛就是齁甲啦
 Chloe ,https://www.google.com/maps/contrib/117260924179844050809/reviews?hl=zh-TW,1,True,34,如果覺得不好吃給一星會被店家罵😢
 sheng ,https://www.google.com/maps/contrib/106686201019192133631/reviews?hl=zh-TW,5,False,8,蠻好吃的，會再回訪
 陳聖文 ,https://www.google.com/maps/contrib/114723519943267733701/reviews?hl=zh-TW,5,True,27,六腳獸好吃
 ben niffer ,https://www.google.com/maps/contrib/115334528944815619037/reviews?hl=zh-TW,5,True,40,薯條很好吃
 王佳彥 ,https://www.google.com/maps/contrib/106165203168249489361/reviews?hl=zh-TW,5,False,2,好好ㄘ的漢堡之後會常來吃
 王信捷 ,https://www.google.com/maps/contrib/105381858867839491274/reviews?hl=zh-TW,5,True,40,起司搭配就是超滿足！推一個
 游弦璁 ,https://www.google.com/maps/contrib/116742872135088590605/reviews?hl=zh-TW,5,False,2,好吃！！！！北市最強漢堡
 鐘麗玉 ,https://www.google.com/maps/contrib/105049824793306254207/reviews?hl=zh-TW,5,False,9,蒜味牛超讚！好吃！
 林麗玲 ,https://www.google.com/maps/contrib/100125095986170035034/reviews?hl=zh-TW,4,True,109,好吃的特別漢堡
 AMY ,https://www.google.com/maps/contrib/106662027313034005318/reviews?hl=zh-TW,5,False,7,很好吃一定要來吃🥰
 Kandy Tsai ,https://www.google.com/maps/contrib/116357770122346468929/reviews?hl=zh-TW,5,False,18,我覺得很好吃😋
 胡鈞翔 ,https://www.google.com/maps/contrib/110899744466654537443/reviews?hl=zh-TW,5,False,8,糰子好吃
 陳映璇 ,https://www.google.com/maps/contrib/102902867495220406595/reviews?hl=zh-TW,5,False,7,👍
 白子揚 ,https://www.google.com/maps/contrib/105120312222379501508/reviews?hl=zh-TW,5,True,30,牆面乾淨
 盧怡瑾 ,https://www.google.com/maps/contrib/115305977083282769429/reviews?hl=zh-TW,5,False,3,好讚🥺🥺🥺
 李廣居 ,https://www.google.com/maps/contrib/117253281877079776321/reviews?hl=zh-TW,5,False,7,👍👍
 ichen ,https://www.google.com/maps/contrib/103989022076594506949/reviews?hl=zh-TW,4,True,45,可以試試
 Huang Michael ,https://www.google.com/maps/contrib/105633128609259292235/reviews?hl=zh-TW,5,True,20,極品辣雞翅
 李崑豪 ,https://www.google.com/maps/contrib/117801648848594066480/reviews?hl=zh-TW,5,False,9,讚👍
 林辰樺 ,https://www.google.com/maps/contrib/109252583646591678745/reviews?hl=zh-TW,5,False,7,主廚帥帥的
 Lin Leo ,https://www.google.com/maps/contrib/115783871926771562304/reviews?hl=zh-TW,5,False,2,餐點很讚
 Pei Liao (Yvonne x Sandy) ,https://www.google.com/maps/contrib/115817696322424483483/reviews?hl=zh-TW,5,True,39,超讚的啦
 陳明惠 ,https://www.google.com/maps/contrib/106364319151955677339/reviews?hl=zh-TW,5,False,1,很特別的漢堡
