user_name,user_profile_url,rating,local_guide,comment_num,comment_text
 陳品妍 ,https://www.google.com/maps/contrib/102687916625829451991/reviews?hl=zh-TW,4,True,"1,130","這家比較容易有位置
有菜可以選，對於不想吃米飯的人是可以去的壽司店
比其他分店好吃
烤鯖魚和軟絲很優
啤酒80很便宜"
 Elton Lu ,https://www.google.com/maps/contrib/103140782666895763876/reviews?hl=zh-TW,5,True,26,這一段時間中午推出商業套餐，個人覺得品質有一定的水準，份量又足夠，價格可接受，相較該區域的餐飲供給，實為不錯的選擇。
 Hsien-Lung Wu ,https://www.google.com/maps/contrib/100959049978887127660/reviews?hl=zh-TW,1,False,15,"請問你們做外送食物是這樣包裝的嗎？？

會有人把包裝袋打結地方打在側邊的嗎？？

壽司全部倒在一起，是要給消費者吃餿水是不是呀！

不想好好做外送服務就不要上UE呀！

這種餐點出來是想氣死消費者是不是呀！"
 Tweety ,https://www.google.com/maps/contrib/107626539386077481061/reviews?hl=zh-TW,3,True,128,"平日下班晚上來吃，服務人員人手有點不足
帶位結帳按服務鈴都需要等一下
迴轉台上的壽司不多，我們大多用直接點餐
感覺壽司品質似乎有下降趨勢沒有以往美味了"
 彥博廖 ,https://www.google.com/maps/contrib/106747830980423744328/reviews?hl=zh-TW,5,True,12,用餐環境不錯，餐點也很好吃，家人朋友都適合
 Shan Ku ,https://www.google.com/maps/contrib/101328889097087310085/reviews?hl=zh-TW,5,True,716,很不錯誒不過感覺店員普遍厭世服務希望可以好一點
 VI chen ,https://www.google.com/maps/contrib/102990099816606179880/reviews?hl=zh-TW,5,True,294,價位稍高，但優點是「從來沒看過他客滿」，所以我都是很餓不想等的時候就會來吃。
 Blinda Lin ,https://www.google.com/maps/contrib/114557934117436651324/reviews?hl=zh-TW,4,True,118,"近期回訪，因疫情解封已開放內用，但點餐時發現握壽司品項，多數單品已售完？或無備料？有點小失望。

防疫情間，醬料採小包裝，值得讚許，但現場未提供薑片，與之前用餐方式有一點小落差。

分享方式：一人就可獨享
建議食用時機：午餐、晚餐
飽足度：份量約等於坊間迴轉握壽司"
 Joanne Hsieh ,https://www.google.com/maps/contrib/116755095370997131310/reviews?hl=zh-TW,5,False,3,"生魚片新鮮好吃店員服務態度親切
用餐環境舒適開心(´▽｀)"
 HONG LIAN GAO ,https://www.google.com/maps/contrib/110153572185759758414/reviews?hl=zh-TW,5,True,104,"這邊提供的菜色跟其他分店不太一樣
喜歡吃日料的可以嚐嚐看"
 B.T ,https://www.google.com/maps/contrib/104895436916435388252/reviews?hl=zh-TW,5,False,744,"店員服務態度非常親切讓人很窩心，因為帶著嬰兒用餐店家特別提供比較寬敞安全的位置給我們，讓爸媽可以放心的在安全的環境中用餐並餵食照顧嬰幼兒，真的非常棒！！
握壽司食材魚生新鮮，師傅料理手法不錯醋飯不會太乾或太緊且調味剛好；需要兒童餐具也會提供還會送一個玉子燒和一個豆皮壽司給小朋友吃，真的非常非常加分，雖然沒有訂位可能要花點時間現場候位，但是候位的環境舒適也不太會等太久，同樓層還有廁所和哺乳室，整體用餐體驗非常愉快，大推薦👍👍"
 Woody ,https://www.google.com/maps/contrib/111297661237281150720/reviews?hl=zh-TW,5,True,163,一週來了二次的海壽司松高店，除了用餐環境佳、食物好吃外；主要是香港朋友上次來此用餐後，他們非常喜歡吃海壽司。
 Cn Yu ,https://www.google.com/maps/contrib/100780830482012457546/reviews?hl=zh-TW,4,True,596,服務態度不錯，不過感覺人手不足。一直在等餐點⋯反應後也有馬上處理。如果人手不足就多安排人力，客人等待餐點吃的很累，服務人員也有道歉讓我們餐點等這麼久，但是上來看留言，發現之前也有人反應。餐點是不錯吃，看師傅握好了放在出餐檯上，服務員都來不及送，又要帶位、送餐、收桌、結帳⋯霸台的位置也不多，大多都是要送餐的座位，真是辛苦服務人員了。真是你累我吃的也累。不過食材讚讚的，推薦給不趕時間，能慢慢食用的人。
 Neo Kung ,https://www.google.com/maps/contrib/101038651735695220081/reviews?hl=zh-TW,4,True,953,"店內環境舒服，壽司好吃
上的速度也很快

QRCode掃碼點餐，不太好掃

桌上給杯子跟熱水，茶包在旁邊
用的是天仁茗茶"
 Vita ,https://www.google.com/maps/contrib/103315290211830270321/reviews?hl=zh-TW,4,True,532,"海鮮食材新鮮好吃。
跨年餐些許特色不足，樣式不豐富。飯很多。
海壽司的概念應該是精緻而不是粗飽。

有機會這樣跟朋友一起聚聚，吃吃喝喝談笑自若。輕鬆享用餐點。是個經驗。"
 安娜 ,https://www.google.com/maps/contrib/108650057565637114516/reviews?hl=zh-TW,2,True,174,帶著2個小男生.真的需要坐吧台看壽司轉.一杯溫開水到結帳還是沒送來！人多服務就差了！😤
 CHIU YC ,https://www.google.com/maps/contrib/107857231348165076155/reviews?hl=zh-TW,2,True,29,這裡最喜歡吃的是明太子炙燒鮭魚和鮭魚生魚片，簡餐的壽司普通，直接點單點的就好了，不過附餐的茶碗蒸和紅豆湯都是好吃的。服務生的態度很差，說直接跟他點或下載手機app點餐都可，不過詢問了關於餐點的內容時，整個不耐煩到極致，這樣誰還敢跟他點餐，於是趕緊自行摸索點餐系統，免得看人臉色。
 易凱末爾 ,https://www.google.com/maps/contrib/111405541955900078027/reviews?hl=zh-TW,4,True,172,突然想吃魚就來了服務生禮貌用餐空間乾淨食材新鮮上菜因為人多稍微要等一下不過值得等待的美食!!
 Hubert Lu ,https://www.google.com/maps/contrib/105769724023890912835/reviews?hl=zh-TW,3,True,391,餐點基本上跟其他分店差不多.服務人員可能是新進同仁，對於流程還不是很熟悉.還好值班主管要隨時指導並協助處理.
 羅友 ,https://www.google.com/maps/contrib/105819060371422031214/reviews?hl=zh-TW,4,True,181,點餐方式很先進，使用Wi-Fi點餐會送一道小菜，食材還不錯，不過價格比起臧壽司稍微貴了點
 Wang ,https://www.google.com/maps/contrib/114440555488304684635/reviews?hl=zh-TW,5,True,83,超級好吃的啊貴不是沒有道理🥰服務員很帥
 Ching-Yao Chuang ,https://www.google.com/maps/contrib/118153542032966159742/reviews?hl=zh-TW,4,False,4,非常推薦鮪魚壽司，入口的軟嫩和香甜令人回味。調味和炙燒版本味道微重，會蓋過原本生魚片的甜味。少的那一顆星就在cp值吧
 C.H. LAI ,https://www.google.com/maps/contrib/103169437285262475389/reviews?hl=zh-TW,4,True,336,價格稍高，但食材新鮮好吃，服務也不錯，如果平價餐點能多一些更好，不然吃下來比起很多五星級飯店還貴。
 Dylan T ,https://www.google.com/maps/contrib/111971850547277498522/reviews?hl=zh-TW,4,True,514,幾年沒吃了，跟以前很不一樣。多了很多選擇也有熱食了，很棒。
 郭彥廷 ,https://www.google.com/maps/contrib/107975985554009247976/reviews?hl=zh-TW,5,True,559,可預約，要服務費，有非吧台位置，環境佳view也佳
 hsuseagull ,https://www.google.com/maps/contrib/103068649889432720058/reviews?hl=zh-TW,5,True,110,松高店服務人員的水準與應變能力為海壽司最佳，如果這間店不行，其他店就更不值得期待了。
 Super 8 Engineer ,https://www.google.com/maps/contrib/113735082216762770767/reviews?hl=zh-TW,4,True,133,餐點品質是OK，但是折扣算法詭異又斤斤計較，都要做折扣促銷還是大氣一點吧。
 eshow eshow ,https://www.google.com/maps/contrib/116333196335158377848/reviews?hl=zh-TW,5,True,103,海壽司的海鮮、牛肉、茶碗蒸、炸豆腐等小菜都吃的出食材很新鮮連菜單上的甜點都很美味！每次去信義區只要想吃家常料理就會來松高店海壽司服務雖然普通但上菜速度快食物美味新鮮座位不需等候都是超級棒的優點！
 Jane C'est la vie! ,https://www.google.com/maps/contrib/114442487393818207198/reviews?hl=zh-TW,5,True,86,食材新鮮好吃👍👍推
 Fish cheng ,https://www.google.com/maps/contrib/102201524879877876078/reviews?hl=zh-TW,1,False,35,"吃過再也不會吃海壽司......
價位偏高食物也沒特別好吃
最愛鮭魚，但吃一口貴店家的徹底失望
幾乎沒有可以推薦食物

但值得嘉許服務親切有禮貌^_^"
 miko ,https://www.google.com/maps/contrib/108592567689096317220/reviews?hl=zh-TW,5,True,62,"今日晚餐很正點☺️
鮭魚入口即化
海老好大好豪邁
茶碗蒸非常好吃
大蒜蜆湯補元氣
整體食材新鮮💯
#加入會員500折50
#國泰信用卡打9折💳"
 小芸芸 ,https://www.google.com/maps/contrib/110710636064093497860/reviews?hl=zh-TW,1,False,2,食物普通卻昂貴，吃過一次就不會再去吃了
 林育立 ,https://www.google.com/maps/contrib/102909903600752614824/reviews?hl=zh-TW,4,True,299,海壽司新型態門店，裝潢調性凸顯年輕化市場的貼近，符合門店位置的商場特性，商品除保留原來的內容外，更增添上選海鮮食材，增加品牌的個性。
 catlinging ,https://www.google.com/maps/contrib/116288716093836949604/reviews?hl=zh-TW,5,True,825,食材新鮮美味。服務人員態度佳。國泰世華，澳盛，匯豐銀行信用卡可打8折。
 Dean Lu ,https://www.google.com/maps/contrib/118234414858320959500/reviews?hl=zh-TW,5,True,77,"食材很棒，很常來用餐。
加入會員有優惠。"
 PY Chen ,https://www.google.com/maps/contrib/114168381018216475930/reviews?hl=zh-TW,3,True,264,餐點品質一直維持不錯。但是即便兩人用餐超過2000元還沒坐滿一小時，服務人員仍舊會持續詢問是否有餐點沒上，暗示客人應該離開。
 Ching Chi ,https://www.google.com/maps/contrib/116540638694766282336/reviews?hl=zh-TW,2,True,416,品質變差很多，過年期間來吃還好好的。蒸蛋變稀，握壽司米飯變小顆，牛肉也不像以往大片且厚度均勻，拿到的竟然是又小厚度也不均的奇怪切法。本來是很喜歡的一間分店，品質一口氣下降到應該不會再去了...
 Weng Anny ,https://www.google.com/maps/contrib/100765104149388654683/reviews?hl=zh-TW,5,True,143,環境乾淨食品好吃，附近工作肚子不是很餓的選擇。請善用他的優惠券，每次都有不一樣的優惠握壽司，味增湯味道不錯，刷微風聯名卡有9折優惠。
 Henry Chang ,https://www.google.com/maps/contrib/102622762632155727940/reviews?hl=zh-TW,5,True,75,最愛的店家之一，推薦!!可點火鍋搭配握壽司一起吃~CP高~
 May Lee ,https://www.google.com/maps/contrib/108851868170823018305/reviews?hl=zh-TW,5,True,64,握壽司新鮮好吃，也很推薦烤魚，很軟嫩。
 陳立信 ,https://www.google.com/maps/contrib/112795981695230276736/reviews?hl=zh-TW,4,True,232,不錯吃（建議假日去ATT吃飯的要先預約）海鮮都還新鮮（吃的到海鮮的甜味）蔥花鮪魚壽司，生魚片拼盤都好吃，火鍋普通，炙燒牛肉壽司不合我口味，價格不貴，服務中上。
 J W ,https://www.google.com/maps/contrib/108091480308354308363/reviews?hl=zh-TW,1,False,3,"上菜上超級慢10分鐘來一盤非常浪費時間餐具也沒洗乾淨請服務人員換過之後一樣是髒的
不推！！千萬不要來"
 吳寶春 ,https://www.google.com/maps/contrib/116663049007675008547/reviews?hl=zh-TW,1,False,6,同樣的東西藏壽司跟壽司郎價錢便宜很多，重點是出餐慢到爆，我吃迴轉壽司還以為我在法式餐廳。
 Ivy ivy ,https://www.google.com/maps/contrib/118384321540219268757/reviews?hl=zh-TW,2,False,9,"在熊X叫了炙燒分享餐跟其他定食，真心建議叫生魚片或炙燒類的不要用外送，真.的.很.難.吃

又乾又不新鮮，吃了馬上過敏拉肚子😱

但必須要說，在現場真的不會有這樣的問題，現場的服務非常好，人員都很貼心，真心建議不要叫外送"
 ZONGHAO HE ,https://www.google.com/maps/contrib/110958191225614869389/reviews?hl=zh-TW,4,True,94,第一次吃，味道還不錯～
 W ang ,https://www.google.com/maps/contrib/106395637072196160387/reviews?hl=zh-TW,4,True,356,用手機點餐很方便！
 Ting Yang ,https://www.google.com/maps/contrib/117212104718222013656/reviews?hl=zh-TW,4,False,8,"組合餐很划算好吃
但櫃檯人員素質需加強
連製作壽司的人員態度都比她好"
 Yi-Cheng Tsai ,https://www.google.com/maps/contrib/106225868087383290041/reviews?hl=zh-TW,4,True,73,沒有高科技，人總是少少的，但其實味道還算有一定水準，熟食好吃
 陳冠全 ,https://www.google.com/maps/contrib/102233772481708304406/reviews?hl=zh-TW,1,False,2,難怪整層只有這間不用排隊
 Luka ,https://www.google.com/maps/contrib/113860996711734874067/reviews?hl=zh-TW,5,True,92,"咁嘅價錢對比香港算抵，個人認為同香港千兩咁上下

埋單647台幣"
 DurainBoy 匿名者、 (DurainBoy凜) ,https://www.google.com/maps/contrib/114167935122317456448/reviews?hl=zh-TW,1,False,6,"現場等位明明就有位置我這邊兩個人等了將近三十分鐘有桌不收成年人的用餐時間需要那麼久嗎
吃個壽司需要花那麼多時間嗎？"
 阿瑩 ,https://www.google.com/maps/contrib/108407930550587916485/reviews?hl=zh-TW,5,True,146,握壽司新鮮好吃物超所值
 Mi L ,https://www.google.com/maps/contrib/116485732339352745363/reviews?hl=zh-TW,3,True,76,我一入坐就請服務人員給我一杯冷開水，服務人員要我從轉盤上的水壺取用，水壺幾乎沒水也沒人補，後來我隔壁的一家人要求服務人員補冷水壺，服務人員補滿水壺時，順便給隔壁那家人一杯大杯的冷開水。從餐點/價格/服務細緻度/點餐方便性，我寧願去日本平價連鎖壽司店。
 Rong-Yi Lee ,https://www.google.com/maps/contrib/108324191449773077922/reviews?hl=zh-TW,1,True,78,公司規定死板，明明就叫海壽司，兌換券還要分這間店不行那間店可以，體驗很差。
 江承儒 ,https://www.google.com/maps/contrib/100593920623091256524/reviews?hl=zh-TW,4,True,"1,076",商業午餐還不錯，但缺點就是人手有點不足，上菜速度有點慢
 闕米亞 ,https://www.google.com/maps/contrib/100578240636102054329/reviews?hl=zh-TW,5,True,60,服務親切食材新鮮👍
 簡綺真 ,https://www.google.com/maps/contrib/105620259673657053876/reviews?hl=zh-TW,5,True,206,餐點好吃服務好
 Alex Lin ,https://www.google.com/maps/contrib/100872602151850656593/reviews?hl=zh-TW,1,True,90,"[20209月]時隔已久再度來訪，品質跟服務都下降的非常嚴重

8:30不到靠近餐廳，店員反覆的確認「我們點餐只到8:45喔，我們8:45前一定要點完喔？」加上那個不耐煩的態度，好像很怕我進來用餐一樣。我知道你有打烊的壓力，但是我就是有把握才走進來，也沒有想浪費你時間的意思，我吃完八盤在等你茶碗蒸邊打評論的此時此刻都還不到九點

今天點的八盤裡面，紅甘跟鮭魚卵軍艦的腥味都極重，我不知道是放在轉盤上很久還是什麼原因，但這麼重的腥味真的是不能接受，我吃過的壽司也不少了，有這麼腥的還真的沒幾次，而且還不只是一盤

看著以前的評價真的非常失望，又少了一間願意踏入的店，可惜

—-

新式的獨立店舖，用餐體驗非常好。雖然一開始坐下來用手機點餐有點霧煞煞，但用習慣之後覺得非常方便。單價相比爭鮮雖然較高，但是生魚片的品質在水準之上，握壽司、手捲、軍艦都有佳作。服務人員態度佳，反應快，目前迴轉壽司店吃過最滿意的。cp值個人覺得算高，會再來訪"
 Debuc PIT ,https://www.google.com/maps/contrib/100464016107447993658/reviews?hl=zh-TW,4,True,112,乾淨壽司好吃但價格比較貴服務品質一般
 wayne FAN ,https://www.google.com/maps/contrib/109912692876670098665/reviews?hl=zh-TW,5,True,57,服務態度好環境棒信義區這間海壽司分店大推
 Calvin Yu ,https://www.google.com/maps/contrib/115887609097715841848/reviews?hl=zh-TW,1,True,74,很糟糕的用餐體驗，握壽司直到我們等得抱怨了，隔壁桌比我們晚來都吃完離開了，才開始上，有些料理完全走鐘，芥末章魚鹹死人不償命，日本真鱸又柴又粗絲完全不當冷凍，比爭鮮還糟。十幾年吃過臺北所有海壽司，這次真的嚇一大跳，老闆換人了嗎？
 Mere Fan ,https://www.google.com/maps/contrib/112151733505158825670/reviews?hl=zh-TW,1,True,68,"吃過很多間海壽司，這間真的有讓人眼界大開！
首先，慢！非常慢！慢到不催單大概會等1小時，帶位也慢，位置空在那卻讓人在門口等待，服務更是漫不經心⋯⋯除非常非常有耐心和時間，不然寧可去統一阪急吃⋯⋯"
 謝錒寶 ,https://www.google.com/maps/contrib/115798835267227888838/reviews?hl=zh-TW,1,False,12,"覺得這家天很誇張今年二月底去吃一次
那天幾乎沒什麼客人我記得才三組客人
內場的一直忘了我們的餐點，點超久的然後等到我們反應才說在做了一個，外場的也一樣爛一男一女一直在哪聊天......我建議你我要去這家了爛透了"
 羅昌明 ,https://www.google.com/maps/contrib/106195744362833513730/reviews?hl=zh-TW,4,True,142,店員(可能是店長)表情哀怨，點完菜友人說這樣生意會好才怪😂，後來發現其實他服務很好喔！餐點品質也到位。如果逛街累了(真的會累，百貨公司都很巨大且離太遠)，走進海壽司隨意點自在吃還不錯喔！
 Zhe Wu ,https://www.google.com/maps/contrib/118115408917194071468/reviews?hl=zh-TW,1,True,50,8/31大約下午五點左右站櫃檯的一位戴眼鏡男服務員態度差超有夠不專業
 X-Ray ,https://www.google.com/maps/contrib/100596890446880779527/reviews?hl=zh-TW,1,True,32,"真的價位高，也沒有特別好吃....
要不是藏壽司、一蘭都爆滿只好來吃
小菜醃蘿蔔還不能續，是有這麼摳？
絕對不會來第二次....."
 Mac Luk ,https://www.google.com/maps/contrib/113701344200396904563/reviews?hl=zh-TW,4,False,15,從這家店一開始營業到現在，幾乎每個星期都去一次。很喜歡他們的服務與新鮮的食材，之前的經理（男）服務非常周到，很親切。上個星期去，好像變成了一位女性經理（不知道是我們那天去，原來的經理剛好休假還是已經換掉了）服務品質就差了很多。我們已經買過單了，又有一位服務生來問是否要結帳，顯然管理上有點問題。
 EY Chiang ,https://www.google.com/maps/contrib/102322856440241142738/reviews?hl=zh-TW,5,True,379,不時有特惠，這次是鮭魚頭味噌湯，握壽司以迴轉壽司而言材料品質都不錯。還有附甜點，人不會太多，用餐相對比較不緊張。
 Chi Tung ,https://www.google.com/maps/contrib/104224809886172745567/reviews?hl=zh-TW,1,False,15,"壽司好吃！
但用餐觀感不佳，營業時間到21:30，員工21:00就在清潔打掃，連基本的熱開水、薑片都收光了，是在趕客人嗎？"
 郭娟綺 ,https://www.google.com/maps/contrib/101185007211738160969/reviews?hl=zh-TW,1,False,12,"上菜速度真的超慢，每次點餐都要等15分鐘以上，而且迴轉台真的沒什麼東西可以吃，重點是價格真的頗貴，CP值低到不會想去第二次
（我在跟男友抱怨的同時隔壁的人也在跟服務生說東西都還沒上）建議大家深思熟慮過後，想要享受當有錢人的感覺再去"
 ANANi ,https://www.google.com/maps/contrib/106634840687674093062/reviews?hl=zh-TW,5,True,496,這裡應該是信義南港地區海壽司裡面，用餐最舒服的一間
 sxskr1001 ,https://www.google.com/maps/contrib/100068844440356736017/reviews?hl=zh-TW,2,True,69,點餐網頁作得很爛，為啥不能顯示哪些出過了，還要自己按計算機加總價格，太爛了，相比藏壽司，明顯比較貴又沒比較好吃，不推。
 Penny Wang ,https://www.google.com/maps/contrib/104015928792317902566/reviews?hl=zh-TW,5,True,44,用餐環境明亮乾淨，壽司品質好，喜歡海膽、干貝、辛醬鮪魚、花枝、明太子玉子燒等都很好吃，服務人員態度好，服務速度很快，吃到飽一個人大概五百到六百多，常常回訪。
 Daniel Khoo ,https://www.google.com/maps/contrib/101796941382706628826/reviews?hl=zh-TW,1,True,42,"服務超爛，8個客人訂位8:00結果8:37才讓我們進來。還一直說在整理位子。整理36分鐘是不是效率有點可悲？管理會不會太糟？這就算了，還把我們拆散在分別兩桌？而且不是在旁邊兩桌，是拆散開來的，大家同學聚餐的心情完全毀了。

懶人包：糟糕的服務態度，毀了一場聚會"
 周羅 ,https://www.google.com/maps/contrib/113422511864355479632/reviews?hl=zh-TW,2,True,112,種類很少本來印象中海壽司比一般迴轉爭鮮價格偏高品質也會好一些但這間的品質跟爭鮮沒有差別但還是比較貴
 鄭伊涵 ,https://www.google.com/maps/contrib/104167124078181160440/reviews?hl=zh-TW,5,False,3,"環境很好食材新鮮服務人員都很不錯
是一個用餐的好地點
而且生蠔非常好吃👍👍👍
下次一定再來吃飯"
 蘇昱群 ,https://www.google.com/maps/contrib/103834526522342638671/reviews?hl=zh-TW,4,True,42,納豆細卷真的很讚，別家吃不到的
 Joen Chen ,https://www.google.com/maps/contrib/113895818588615487932/reviews?hl=zh-TW,5,True,19,價格實惠，才有其包分店沒有的菜項，不錯
 Berlin Zhuang ,https://www.google.com/maps/contrib/116828959872168579159/reviews?hl=zh-TW,1,True,75,在旋轉壽司台上的壽司超難吃的，wifi點餐的送餐速度實在太慢了！在價格上也完全劣勢，看來藏壽司跟壽司郎會排隊不是沒有原因的
 卡夫卡愛旅行 ,https://www.google.com/maps/contrib/101664340612574545757/reviews?hl=zh-TW,5,True,199,"海壽司微風松高店，可以吃到高級、新鮮又美味的迴轉壽司，推薦限量紅甘握壽司及鹽之花炙澳洲和牛，除了現點現做的握壽司，還有手捲、揚物、沙拉、湯品及海鮮鍋等多種選擇，想吃多少點多少，是到信義區逛街或是平日上班族們午餐的好選擇，店內空間寬敞舒適，找個舒服的位子，慢慢品嘗美味的握壽司
詳情請看『卡夫卡愛旅行』深入報導"
 嬷嬷榕 ,https://www.google.com/maps/contrib/112023140394570424900/reviews?hl=zh-TW,5,True,132,獨自一人不知道要吃什麼的好去處！生意並沒有很熱絡⋯⋯但服務人員一樣很敬業！料理也很好吃😋魚壽司🍣都很新鮮！
 Evonne Huang ,https://www.google.com/maps/contrib/107073473956365256081/reviews?hl=zh-TW,4,True,186,還不錯
 Mister ,https://www.google.com/maps/contrib/104822487141703026154/reviews?hl=zh-TW,4,True,70,"東西很好吃，且餐點精緻
服務生水準很高、語文能力都不錯
服務很不錯
現場排位等候過久都有補償
只是價格有點偏高（（信義區嘛
值得推薦的餐廳"
 Josh C ,https://www.google.com/maps/contrib/108058385374904022215/reviews?hl=zh-TW,4,True,41,出餐速度太慢，入場時說有告知餐點需要等候15至20分鐘，但是餐點間隔都等候超過20分鐘之後，而且現場顧客只坐滿一半
 Chany Wang ,https://www.google.com/maps/contrib/108992281753906142594/reviews?hl=zh-TW,3,True,763,"太難了
吃25-30盤才轉到一個扭蛋
然後真的都是壽司🍣
吃到讓人很膩"
 Cha ya ,https://www.google.com/maps/contrib/103823003890130744108/reviews?hl=zh-TW,5,False,20,海壽司的炙燒真的無敵好吃！服務生有個好像叫靜玟矮矮的很可愛服務態度也很好👍🏻
 frost cloud ,https://www.google.com/maps/contrib/102704038242850308733/reviews?hl=zh-TW,4,False,16,價格真心偏貴，壽司會因為不同盤子顏色而分價錢，但是一分錢一分貨，壽司真的很好吃，就連最普通的稻荷壽司都美味無比
 C L ,https://www.google.com/maps/contrib/114251968316593548576/reviews?hl=zh-TW,4,True,353,氣氛不錯，佈置得很漂亮，不過優惠套餐並不優惠，而且不能適用會員折扣這點很不可愛。
 綠蛙鬼 ,https://www.google.com/maps/contrib/115148900442316440418/reviews?hl=zh-TW,2,True,53,好吃是好吃，可是有些盤子的價位很高，吃起來心理壓力很大，會一直顧忌價錢
 劉永信 ,https://www.google.com/maps/contrib/106097824894091902529/reviews?hl=zh-TW,5,False,70,握壽司很好吃但若點它的組合餐更是價廉物美。
 Pei Li ,https://www.google.com/maps/contrib/114995747355136867392/reviews?hl=zh-TW,5,False,3,餐點好吃，服務人員態度良好，有需要幫忙的地方，都會馬上幫忙處理，是個用餐的好地方～
 Julie ,https://www.google.com/maps/contrib/116493938976300327234/reviews?hl=zh-TW,5,False,1,東西新鮮好吃，店長和服務人員都很nice，各式優惠活動也非常划算，值得推薦！
 柏廷柏廷 ,https://www.google.com/maps/contrib/102448737670814396639/reviews?hl=zh-TW,5,False,1,壽司很好吃尤其是秋刀魚跟牛小排還有松葉蟹都超級好吃下次會再來吃😍😍😍😍😍😍😍😍😍
 Stanley Wu ,https://www.google.com/maps/contrib/112987887126049357523/reviews?hl=zh-TW,4,True,419,這裡的服務很好，生魚片很新鮮，味噌湯非常好喝，炙燒不錯，炸雞鮮嫩多汁也是常點的，
