user_name,user_profile_url,rating,local_guide,comment_num,comment_text
 j Ken ,https://www.google.com/maps/contrib/101521005997187762743/reviews?hl=zh-TW,5,False,52,"單品菜單點了偽小牛抹茶鮪魚，法式肉排洋梨，松露薯條，麵包部分點了海藻海苔拖鞋麵包，蘇格蘭炸蛋，可麗露，甜點部分點了網友推薦的感官花園，酒香栗子磅蛋糕（外帶）。
偽小牛友人吃覺得口味特別但容易膩，法式肉排光看沒有很大實際肉排非常厚實，切開沒有一點縫隙，外型做成像蘑菇一樣可愛，但紮實程度會讓人嚇一跳（看起來小盤實際是可以吃飽的😅），肉排部分據說是雞與豬肉加上栗子混合而成，可以吃得到兩大顆栗子，佐洋梨部分也很豪邁給了4片滿入味的，隨餐附的小沙拉內容也很豐富，除了常見的生菜番茄以外，還加了桑葚及花椰菜並淋上紅酒醬汁，跟蔬慕比起來使用的雖是相似的醬汁但多了視覺及風味。麵包部分推蘇格蘭炸彈，上方肉球吃得過癮，下方麵包捲折層次每一口都好好吃。松露薯條的松露味不夠重，可麗露就如同網友說的外硬脆內軟（雖然有心理準備但還是比想像中硬）。期待的感官花園水果量豐富，搭配內餡酸甜得剛剛好，就是外層裹的焦糖有點太甜（螞蟻應該會比較喜歡），另外外帶拖鞋麵包跟磅蛋糕，海藻海苔味聞起來香味濃郁，但隔日吃口感卻有一股說不出來的怪味，或許要烤過之後比較好（？），磅蛋糕（$600）個人覺得不夠綿密，用料紮實但酒味偏淡，小小一條的價位相比，或許下次可以嘗試其他不同種類的蛋糕。
從入店開始，每位店員服務都非常熱忱，不論是入座，介紹菜品及蛋糕種類，引領客人至後方麵包區挑選，每一項麵包的用料口感等都介紹得詳盡（很難想像一天要介紹幾次，完全沒有不耐煩，還會詢問客人喜歡的麵包口感來推薦）還有接下來即將出爐的麵包之類（已經裝不下了哈哈），服務部分💯。店裡麵包蛋糕也提供外帶及事先預約服務，是疫情中的好選擇。"
 劉冠妤 ,https://www.google.com/maps/contrib/117890097091341875931/reviews?hl=zh-TW,5,True,44,"最近母親節比較忙碌沒有麵包，到母親節後才有麵包喔～
甜點非常熱門！（吃套餐有不少人來外帶呢）建議都要先提早預訂才不會撲空唷

點了午間套餐，前菜跟主菜各一份，但份量非常足夠，吃完很有飽足感，其中，蜂蜜麵包外酥內軟，搭配橄欖油及巴薩米克醋膏非常好吃，好吃到還續了一次麵包！
主菜透抽蛤蜊，蘋果酒味濃厚，食材新鮮，好吃好吃～
甜點套餐是附千層派，酥脆口感真的很讚，搭配奶油草莓及雪酪，推薦推薦再推薦～
另外加點的感官花園更是驚為天人，外層的焦糖脆脆的口感，裡面則是有奶油及莓果內餡與濕潤的蛋糕體，不只是味道好吃，莓果的酸甜與香氣讓甜點體驗有豐富的層次，再一個推薦推薦再推薦！
最後分享外帶的可麗露，長條形狀比較少見，但外皮微硬內裏濕軟一點都沒少，是水準之上讓人回味無窮的可麗露～"
 CY Joyce Ko ,https://www.google.com/maps/contrib/115316804837083661391/reviews?hl=zh-TW,4,True,49,2022/7/18生日當天平日造訪，餐廳有限時一個半小時，跟朋友有約我提早到，但因為天氣太熱店員很好心讓我先入座，我也詢問限時的問題，店員說如果沒客滿可以繼續讓我們坐，當天內用時沒什麼人，只有兩桌，餐廳環境優雅整潔，廁所也很乾淨，非常喜歡店內千鳥格地板，餐點價位落在$400左右，內用有低消，價格上只有糕點跟茶飲其實有點貴，偶而來一次，平常應該就不會常來，當天糕點只有三樣選擇，選擇項目不多有點失望，朋友點了起司蛋糕跟熱咖啡，本人點了法式莓果塔跟伯爵茶，莓果向來是我的最愛，酸酸甜甜內餡柔軟外層有焦糖酥脆，口感綿密非常好吃。伯爵茶就比較一般般，服務人員很熱情，但女生在聊天時服務人員真的不用一直來詢問餐點或是收盤清桌之類的，因為會有點打擾到我們，只能說服務好像『太多』😅，但還是謝謝！以上為人造訪經驗僅供參考！
 王逍遙 ,https://www.google.com/maps/contrib/106319365447155500350/reviews?hl=zh-TW,5,True,35,"鹹食令人驚艷，雖然價格真的不便宜，但“透抽/蛤蜊/櫛瓜/蘋果酒”非常好吃，醬汁很特別又帶有海鮮的甘甜。肉醬麵也有一定水準，推薦。

相比之下，甜食及飲品反而有點不如預期，也可能是因為原本期待太高。蒙布朗裡面是整顆西洋梨，個人不是很喜歡它的口感，但外層的栗子泥是好吃的，推薦玉子燒乳酪蛋糕，外表不起眼但口感跟味道都很棒，有別於一般的乳酪蛋糕。飲料點了拿鐵，喝起來很普通。"
 Sunny H ,https://www.google.com/maps/contrib/102941590480007283105/reviews?hl=zh-TW,5,True,39,訂了生日蛋糕，真的好吃死了，我不是螞蟻人，莓果超好吃配上蛋糕外層還有烤薄焦糖，只是有點貴，很少有蛋糕能讓我流連忘返，之後過了一陣子有再次進店內吃下午茶，甜點水準都不錯，只是的確價格不斐，但確有所值～
 Pinky chen ,https://www.google.com/maps/contrib/112808761068385198387/reviews?hl=zh-TW,4,True,112,"食物我給滿分，但是用餐時間太短了
90分鐘很難吃完套餐加甜點

原本是要來吃甜點的，但沒想到鹹食也很有水準！當天最驚豔的是套餐的甜點，芒果千層塔，刷上楓糖的塔皮香氣逼人，配上水果跟清爽的鮮奶油，很好吃！"
 Royle Hsieh ,https://www.google.com/maps/contrib/118005527845431571792/reviews?hl=zh-TW,1,True,227,用餐環境非常吵雜，整間像菜市場一樣，用餐位置狹小，雖說是法國料理，但一點都不法式，很像一般的西餐，口味普通，花了2000多塊很不值得。
 Faye Chen ,https://www.google.com/maps/contrib/106989744427539336096/reviews?hl=zh-TW,4,True,603,"原來高檔的真材實料蛋糕如此美味。
非常喜歡整體的搭配，
很有層次，和以往吃到的蛋糕確實不同。
如果你有重要的慶生可以來訂看看喔！"
 Milky Chiu (牛奶) ,https://www.google.com/maps/contrib/104758900018567292609/reviews?hl=zh-TW,5,True,453,"很好吃的甜點店！第一次吃到用整顆西洋梨當主體的蒙布朗，超好吃的！栗子泥非常綿密！巧克力冰淇淋很濃郁，夾著酒釀葡萄乾好香。

拿鐵普普。"
 Alice ,https://www.google.com/maps/contrib/114107787902575704570/reviews?hl=zh-TW,4,True,752,松露熱可可不會太甜，很可以～甜點的表現個人覺得一般，沒有特別驚艷之處，倒是肉醬麵非常驚艷！必點！肉醬很香很純，讚不絕口及一口接著一口停不下來。透抽跟蛤蜊也都新鮮，但因為有蘋果酒，湯汁的基底味道偏烈和重鹹了一些。
 Ellie Chung ,https://www.google.com/maps/contrib/108395719528737734032/reviews?hl=zh-TW,4,False,20,"吃了珍珠與蚵仔做的創意菜。
超驚豔的，因為可以把珍珠奶茶裡的珍珠與彷彿是蚵仔煎的濃湯完美搭配著，溫沙拉🥦的青菜熱呼呼之外，每一口都很清甜。
薯條🍟也是一根接著一根，停不下手的夾來吃。搭配松露醬或是原味吃，就很迷人。

培根直蔬菜義大利麵，女生朋友蔬菜吃的很過癮。培根不死鹹，吃起來無負擔。

迷迭自然豬🌿排餐，已經幫我們去骨頭，放在盤子上，一整塊。無豬騷味道，肥豬肉部分烤得剛好，吃起來好嫩。

飲品跟甜點：
飲料是伯爵茶跟奶茶。奶茶附的粉紅棉花糖，讓我們女生吃的好開心，是夢幻國度來著。

餅乾盒子,吃之前要先把包裝盒拆開，用湯匙敲打蛋白餅，裡頭有著濃香的冰淇淋。
＃儀式感很足夠，上面還有台灣夜市隨機挑選的造型口味餅乾，鹹酥雞，珍珠奶茶，米血

感官花園，愛吃酸的莓果女孩，上頭不僅漂亮，滿滿的花跟莓果類在上頭，裡面還有入口就化開的內餡。平衡的很棒。"
 theGooji ,https://www.google.com/maps/contrib/118416792398022954632/reviews?hl=zh-TW,4,True,98,"想吃特別的甜點就來吧！

花園真的好好吃，非常講究味道的平衡！脆脆軟軟的口感超讚的🤤

可麗露（白色紙包著一長條）必吃。必吃！

沒有不好吃東西的一家店，坐在裡面才一下子，至少來了8組取預訂蛋糕的客人，生意超好。"
 tzu ,https://www.google.com/maps/contrib/116440345813386284451/reviews?hl=zh-TW,5,True,94,"無論鹹食甜食每樣都好吃😋
蒙布朗很特別主體不是蛋糕體而是整塊熟成西洋梨第一次吃到這個做法！
蘋果派是今天最喜歡的一道必點👍
謝謝店家親切招待～
唯一的缺點是用餐時間90分鐘希望店家可以考慮改2小時～💕
（最後吃的比較倉促🤣）"
 Tony Ch ,https://www.google.com/maps/contrib/112884649780186744212/reviews?hl=zh-TW,4,False,106,"一進店就感到服務人員的切親
幫忙收傘很是貼心

分享午茶套餐的心得
雪酪清爽可以先醒味一下
再來想必大家也會跟我一樣困惑
那一長條極入味的豆乾是什麼法式點心
它是有天使之鈴稱號的｛可麗露｝
這也是我頭一次看到這種形狀的可麗露
因為它扁長所以口感厚度會減少
美感呈現也差了點但真的夠特別

今天的主角為了千層慕名而來
一送上桌時因為上網爬文的
多半是草莓款居多特別別緻
所以這款當季千層上桌時
外觀跟我想像的有些落差
如果說草莓像極奢優雅的少女
這款真的很像矮矮肥肥的米其林寶寶
這家千層是有厚度的千層
左右各一片中間有卡士達與上層鮮奶油含有蜂蜜的甜香
上面的焦糖小泡芙口感硬脆
千層是鬆脆叉子輕切即碎
搭配起來真的非常好吃
糖衣留在齒間的甜香滋味
選一杯喜歡的飲品更是完整

可能剛好用餐客人不多
所以每食用完一個碗服務員就會上來收拾
服務還是很好但覺得比例有點點高
感覺可以減少次數客人會更自在一些

服務親切，價位中高，甜點美味，外帶也有很多選擇，非常推薦！"
 Elaine Shou ,https://www.google.com/maps/contrib/109396544083023221416/reviews?hl=zh-TW,5,True,29,最愛的餐廳，鹹食及甜點都美味又美觀，主廚充滿創意及對餐點的熱情。服務專業且貼心，是會一去再去的餐廳！必點推薦：燉牛尾、感官花園
 Tommi Quek ,https://www.google.com/maps/contrib/104356210806864737896/reviews?hl=zh-TW,5,False,6,"甜點推薦感官花園千層派聖多娜黑蛋糕國王餅
鹹食推薦煙花女義大利麵
用餐環境服務採光很好的店家🙂"
 Kelly Chang ,https://www.google.com/maps/contrib/100217190127072534770/reviews?hl=zh-TW,4,True,84,蛋糕真的蠻貴的，但是，我個人非常喜歡，吃起來有冰淇淋口感，外層是脆脆的烤布蕾，莓果們有點酸，整體不會過於甜膩，也不會有大家懼怕的奶味，除了太貴，一切都很好👍大愛❤️
 Howard Shou ,https://www.google.com/maps/contrib/112795921653018804220/reviews?hl=zh-TW,5,True,36,空間雖不大，不過所有料理都很有水準，且有持續創新中，已拜訪無數次，甜點強力推薦「感官花園」！
 Ut-iông Lí (Maxx) ,https://www.google.com/maps/contrib/111486789071394643735/reviews?hl=zh-TW,5,True,222,"真的太好吃了！
不像附近的網美甜點那樣虛有其表，
吃到season的甜點，直接打動味蕾，讓人點頭讚嘆不已。"
 Lynn ,https://www.google.com/maps/contrib/111980632734587176807/reviews?hl=zh-TW,4,True,576,"📍SEASONArtisanPâtissier
🚇信義安和站1號出口步行5分鐘

🌰超級蒙布朗$380
🍒感官花園$220
🍓波拉克$220
🍝波隆納肉醬麵$320

秋天限定的蒙布朗🍂終於登場啦！內餡是一整顆西洋梨🍐外層減醣的法式香緹、最後再淋上無敵療癒70g法國栗子泥✨只要點蒙布朗就可以到後面的工作室欣賞這一步步的製作🤎真的是無敵療癒

蒙布朗可以升級變甜點套餐$660有一杯飲料跟三款法式小點（雪酪、焦糖布丁、千層酥）

蛋糕另外還點Season✨招牌的感官花園，個人大愛！

還有店長大推、基底是杏仁蛋糕，吃起來偏海綿蛋糕搭配CreamCheese的波拉克

另外沒有在照片上的🧀️玉子燒芙朗，也很！好！吃！

最後是鹹點也不輸甜點的義大利雙管麵，雖然甜點到鹹點價位都不便宜，但這些甜點真的只有在Season才吃的到

不過要注意⚠️蒙布朗、千層黨現做甜點都要到傍晚或下午才會有師傅可以做喔！午餐時間只有蛋糕櫃的蛋糕

💰低消一人$400可刷卡
⏰限時90分鐘
⌚️11:30-19:00
☎️可訂位"
 Ivy Kao ,https://www.google.com/maps/contrib/117847807839040841125/reviews?hl=zh-TW,3,True,52,"有事先訂位但被安排在奇怪的地方（算是廚房了吧？），拍照不好看、工作人員也在一旁忙著出餐，滿怪的。
甜點蒙布朗有點不符期待，千層派還不錯。"
 ALBEE SUNG ,https://www.google.com/maps/contrib/110571173886901268035/reviews?hl=zh-TW,5,True,31,"朋友生日來踩點
點了甜點套餐
選了巴斯克跟收藏很久的感官花園
很好吃很精緻
每一口都👍👍👍
服務人員態度也很好
期待推出小尺寸聖多諾黑"
 Eric Chen ,https://www.google.com/maps/contrib/102926705009333871762/reviews?hl=zh-TW,5,True,188,"上次幫朋友慶生吃過這家的新鮮莓果蛋糕之後就ㄧ直想再嘗試,前天終於有機會去現場取我三天前預訂的蛋糕了!他們的蛋糕口味與層次非常豐富,側邊的焦糖讓整體的口感更提升....."
 isis wu ,https://www.google.com/maps/contrib/101304987246988085137/reviews?hl=zh-TW,4,True,53,"雙人套餐份量十足，很好吃
洋蔥豬腳鹹可麗餅味道口味特別又美味
甜點大推！

只可惜被茶壺燙到兩次，這方面需要多加強保護"
 陳冠穎 ,https://www.google.com/maps/contrib/117748692172297020076/reviews?hl=zh-TW,4,True,33,"今天預訂最近推出的金磚可麗露，期待越大失望也越大😂真的不能算是好吃😓

我是個很愛吃可麗露的人，但season刻意將可麗露做成薄長的形狀，確實彰顯出脆殼的特色，但我覺得實在太硬了😅尤其是頭尾部位根本考驗牙齒硬度～只能用手掰開再勉強咬下😅

可麗露聞起來真的很香，但強調脆殼特色的同時也突顯了甜味，比起一般可麗露偏甜許多，非常不建議一個人吃完一整條…真的太甜會鎖喉😅

以上純屬個人喜好😂

/

‼️‼️預訂5條可麗露自取，取貨時順便內用餐點(費用$720)和其中2條可麗露(費用$200)，最後收取的總服務費會包含另外3條外帶的可麗露唷！😊🙃🙂

/

Season是我一直以來的愛店！芒果、草莓千層派真的非常經典必吃！

之前疫情期間也有請店家外送感官花園、酥烤千層派、玉子燒乳酪蛋糕～都非常美味！千層派外送到府依然酥脆，真的超強！而且外送品質非常好👍蛋糕完全不會支離破碎！

但經過上述的內用經驗後，以後大概只會吃招牌經典的甜點了～很怕亂嚐鮮踩到雷🤣

/

本次消費品項：
布列塔尼蕎麥鹹可麗餅(口味一)$320
金磚可麗露$100
感官花園$220
熱拿鐵$180

內用低消$400/人"
 林瑋家 ,https://www.google.com/maps/contrib/101625100589432160163/reviews?hl=zh-TW,2,True,30,"感官花園（$220）普通，莓果有點酸；
照片中的甜點（忘記品項名稱了）（$200）不喜歡，下層海綿蛋糕體除了浸了酒之外沒有其他餡料（上層鮮奶油內有包一顆荔枝），味道也不好，有種人工糖漿的味道

甜點偏貴，份量小，口感偏濕，味道個人不喜歡
*消費滿500才能刷卡"
 Joyce ,https://www.google.com/maps/contrib/118011242872592635867/reviews?hl=zh-TW,2,False,65,"份量都不多期望太高失望很大...
沙拉280+10%千層派380+10%美式160+10%
奶茶200+10%都小小份小小杯...
價格偏高
最期待的感官花園很膩口....
千層派算大份但也是大約200左右的口感
沒有意外不會再訪"
 With Luck ,https://www.google.com/maps/contrib/100129988473176884433/reviews?hl=zh-TW,5,True,651,滿滿新鮮莓果，加上外層烤布蕾薄脆焦糖，酸、甜、苦豐富滋味一次滿足！建議冷凍後退冰食用，內層滑順慕斯有冰淇淋的口感，搭配卡士達醬毫不甜膩，令人意猶未盡。
 YC C ,https://www.google.com/maps/contrib/112149692803751819515/reviews?hl=zh-TW,5,True,19,"草莓千層派💯
肉派是冷的，但意外還不錯
熟布丁也令人驚艷，惟是用塑膠杯和塑膠封膜，有點格格不入，期望能是玻璃杯"
 Luna HSIEH ,https://www.google.com/maps/contrib/112049492106129312582/reviews?hl=zh-TW,5,True,84,"感官花園認真好吃👍
買到2021最後一份，蛋糕外面的焦糖很香，搭配中間的莓果餡甜而不膩，上面的水果擺好擺滿，吃完覺得意猶未盡
感覺店裡蠻忙的，但店員還是客氣有禮～
下次要直接買4吋獨享🤣"
 Knight Tseng ,https://www.google.com/maps/contrib/110346007328449831464/reviews?hl=zh-TW,5,True,359,"如果點蒙布朗可以去廚房看他們做喔
現場製作的員工非常認真還會跟我們解釋
很喜歡這樣的體驗
老闆跟我們聊天還送我們餅乾
我覺得很好吃
有機會還會再去吃正餐的😊"
 喵喵 ,https://www.google.com/maps/contrib/115348246580844420473/reviews?hl=zh-TW,5,True,79,"第一次吃到這麼有層次感的蛋糕
搭配很有品質的美式，一定會回訪"
 曹庭輔 ,https://www.google.com/maps/contrib/100886354556220723708/reviews?hl=zh-TW,5,False,7,"整體味道很不錯~~~小蛋糕的部分有驚艷到！
「玉子燒乳酪」的口感很好而且吃的出酒香

他們的招牌「感官花園」也很不錯，長得很可愛

推推"
 RZ ,https://www.google.com/maps/contrib/104098314004761651767/reviews?hl=zh-TW,5,True,96,"最深值人心的生日蛋糕之一非感官花園莫屬ｖｖｖ
擁有藝術品般的美麗．豐富充滿層次感的味道．視覺與味覺雙重感受．蛋糕體不多．由慕斯、酸感較重的果漿、莓果、及滑順不甜膩的卡士達搭配相得益彰，外圍薄脆的焦糖更是錦上添花
真的愛屬惹～～～～～～～～～～～～～
其餘小點個人覺得中規中矩　後來推出的台灣小吃餅乾蠻別出心裁"
 Daybreak Lee ,https://www.google.com/maps/contrib/117158837521708253620/reviews?hl=zh-TW,5,True,318,"Season敦南旗艦店。

雙人套餐，
每道都是水準之作，
田螺泡芙好好吃，
自然豬豬排油花部分超美味。

甜點每道都讓人驚艷。
千層採用台灣第一批香水草莓美味得令人驚喜。
花束蘋果塔又美又好吃，
薄片蘋果考驗手工，塔皮香酥可口。
洋梨雪酪風味濃郁，入口芬芳。最喜歡。

感官花園不愧是招牌之作，
好好吃，甜酸適中平均。

服務細微貼心。

整體大推薦。
慶祝的首選。

#seasonartisanpâtissier
#seasonartisanpatissier
#season敦南旗艦店
#season敦南"
 Chih Wei Yeh ,https://www.google.com/maps/contrib/115660185600848541883/reviews?hl=zh-TW,5,False,20,很少見這麼細緻的甜點，層次感爆棚。早上剛開門去店員說有些蛋糕還沒做好，今日有有新品。哈哈哈聽到完全不會擔心買到雷。沒看過新品也很放心的的回答“好”XD
 Fong Zeng ,https://www.google.com/maps/contrib/107060142818263299740/reviews?hl=zh-TW,5,True,222,"訂了好多次感官花園
酸甜的新鮮水果與薄脆的焦糖真的很對味"
 曾郁雯yuwen ,https://www.google.com/maps/contrib/115015206293688373137/reviews?hl=zh-TW,4,True,275,"台北法式料理、甜點名店。之前吃過大直店的蛋糕「感官花園」，又美又好吃，印象深刻。今天偶而路過，決定試試他們家的餐，出乎意料的好。沙拉新鮮爽口，搭配油醋、無花果醬，絶佳的口味，光是這道沙拉就很出彩。馬鈴薯千層派更是令人驚豔，把一顆小土豆晉升為法式高級料理，刀工及烘烤火候幾近完美，搭配微辣的明太子醬汁，不論視覺或味覺都得到極大的満足。甜點是需要現烤的舒芙蕾加上酸酸的荔枝、覆盆子雪碧、小餅乾、莓果蛋糕，非常奢侈的組合，絶對的法式風格，沒想到就在敦化南路的小巷弄裡遇見了。
#裝璜、空間、動缐、俱佳，可以當網美店
#現場還有販賣麵包、甜點及各類食材
#咖啡可以再優一點"
 BB ,https://www.google.com/maps/contrib/103185265238027904808/reviews?hl=zh-TW,5,False,4,來吃過非常多次，餐點和甜點都讓人心滿意足
 F F ,https://www.google.com/maps/contrib/107446749414767386313/reviews?hl=zh-TW,5,False,10,"店內環境很棒，餐點漂亮也超好吃～
整體用餐感受我覺得很值得推薦，有機會一定可以去踩點吃吃看👍🏻👍🏻"
 James Chen ,https://www.google.com/maps/contrib/100255836840059443462/reviews?hl=zh-TW,5,True,239,"感官花園好好吃啊～～～
買回家當生日蛋糕家人全部吃光光
強烈建議要冷凍吃
還會回購一百次！"
 Amber Huang ,https://www.google.com/maps/contrib/105809806023448580890/reviews?hl=zh-TW,4,False,6,"慶生預定了新款蛋糕🌟開心果巴黎環🌟
很令人驚豔，有別於以往的蛋糕款式
好吃😍"
 張耀木 ,https://www.google.com/maps/contrib/100274898166629406361/reviews?hl=zh-TW,5,True,294,法式料理好滋味休閒餐敘好食館服務親切感十足推薦！
 JoJo Chen ,https://www.google.com/maps/contrib/112088460135710642413/reviews?hl=zh-TW,4,True,41,"很好吃的法式甜點，雖然定價真的偏高，但整體吃下來是有符合期待值的
自製的冰淇淋每個口味都很好吃，印象中最喜歡的是伯爵茶的味道，茶味很濃郁，吃起來也很順口～
法式小點心也是每個都好吃，雖然已經不太記得確切吃了什麼🤣
千層派也沒有辜負我的期待，酥酥脆脆的，奶油也很好吃不膩
唯一缺點大概是飲料稍微普通了點，不過無傷大雅
下次會想試試看他們家的感官花園！"
 Chloe Tsai ,https://www.google.com/maps/contrib/102568173182235761215/reviews?hl=zh-TW,5,True,60,"於疫情期間外帶，感官花園非常驚艷好吃，別的地方吃不到的味道，切開還有一層水果餡，甜而不膩，完全可以再來一份！
旁邊的巴斯克不推，可以以更少的價格買到類似的味道及口感，普通。"
 廖雅萍 ,https://www.google.com/maps/contrib/110525776684652769967/reviews?hl=zh-TW,3,True,295,用餐空間很小，我個人不太適應餐點😅
 Sophia Fan ,https://www.google.com/maps/contrib/100123280705354944736/reviews?hl=zh-TW,5,True,190,蛋糕外層的焦糖好好吃，中間是冰淇淋口感，不會太甜膩，整體滿意。
 Ariel chen ,https://www.google.com/maps/contrib/117052901425802418175/reviews?hl=zh-TW,4,True,37,"是一間會定期創新的店，這點給予肯定，不過店家一些行為覺得有點被佔便宜，而且甜點總是覺得未臻完美境界，因此目前給予3-4顆星
這次點兩個餐，一個320，一個380，其中一個加套餐，回家後才想到店家直接低價甜點算套餐，高價算單點（而套餐價錢是均一價660！），因此被多收了70元左右，在這點方面感覺被店家佔了便宜，心情有點受影響～
另外，店家設有500刷卡門檻，先前現金付款時就不會收到發票，刷卡付款就有發票，覺得微妙⋯
不過整體而言還是願意跟隨店家汰換菜單再訪的，只是結帳時可能要注意一下
本次甜點部分，杏仁這款冰品吃起來很趣味，拾穗這款吃起來有股微妙的培根味，不知道是店家故意還是作業失誤，雖然整體而言不難吃也蠻有趣的。馬卡龍味道是好的，但中間有噴汁，懷疑沒有全烤熟

—
更新：店家好像有跟信用卡公司要退我錢，蠻有誠意的"
 Rong Li ,https://www.google.com/maps/contrib/107099245238457472365/reviews?hl=zh-TW,1,False,3,"男店員是不是很想拉低評價？

8/30預訂兩個小感官蛋糕，與女店員核對品項、日期跟姓名電話皆順利

到預定拿蛋糕當天9/2下午三點，一位男店員接連打電話來、口氣很不好地問什麼時候要去拿蛋糕，我表明還在上班，5點會去取蛋糕。可是男店員似乎不滿意我的回答，突然大聲冒出我沒說過的話

男店員：可是你不是說11:30要過來拿嗎？！
我：？？我從來沒有跟你們留過任何時間
男店員：…好喔謝謝拜拜

對於自己態度不佳、資訊不對稱、胡亂質疑顧客沒有一句回應，敷衍一聲就急著掛掉電話，觀感非常差！

到店取蛋糕時，因為兩個蛋糕是分送給不同人需要分裝，男店員這時才說多分裝一個盒子要加10塊錢

不管是男店員自行認為蛋糕是同一個人要吃所以直接裝在一起，還是想讓我了解分兩次買就會有獨立包裝、不會被加錢，都讓我對貴店邏輯感到更奇妙了

你們規則特殊可以尊重，但請事前提醒，不想被多收錢的顧客至少還可以帶容器去裝🙂"
