user_name,user_profile_url,rating,local_guide,comment_num,comment_text
 min hsuan Chuang ,https://www.google.com/maps/contrib/117674968638219943593/reviews?hl=zh-TW,4,True,211,"這顆蛋糕完全是視覺和味覺的享受
表面鋪滿了各種莓果
有#草莓、#藍莓、#小紅莓、#覆盆子、#桑椹等各種莓類
外圈基底是#杏仁蛋糕裹著香脆炙燒#焦糖
裡面是綿密的#紫羅蘭慕斯和#黑醋栗果漿
細膩帶點微酸的口味
時而咬到脆脆的焦糖
好吃到媽媽說她自己可以吃完整顆蛋糕💃"
 Nancy Huang ,https://www.google.com/maps/contrib/116456394268451105830/reviews?hl=zh-TW,5,True,54,超美又好吃的蛋糕，連上面的花瓣都是可食用的喔～
 Lu Chang ,https://www.google.com/maps/contrib/101810702902116631180/reviews?hl=zh-TW,4,True,641,餐食也很厲害的甜點店
 yang ataru ,https://www.google.com/maps/contrib/104372839211861555374/reviews?hl=zh-TW,4,True,582,甜點好吃，價格不便宜
 CeliaKat Wu ,https://www.google.com/maps/contrib/104619339965517181712/reviews?hl=zh-TW,4,True,71,主餐很美味附近可停車價格稍高但氣氛很好店員很親切服務很好
 Alma ,https://www.google.com/maps/contrib/107020061536795937659/reviews?hl=zh-TW,4,True,17,訂購了感官花園與波拉克這兩款蛋糕，口味有點接近，感官花園外面有微苦的焦糖裡面是有點類似慕斯蛋糕口感與莓果醬，整體搭配起來酸甜苦綜合，第一次嘗試到這種口味的蛋糕，蠻新奇的
 Kay Yang ,https://www.google.com/maps/contrib/116546532399434720991/reviews?hl=zh-TW,5,True,55,"環境很棒，氣氛很好，除了甜點之外也有鹹食，都很好吃！喜歡吃甜點一定要來試試他們的蛋糕，顛覆你的印象，外觀美麗，內陷又很豐富也很有層次！
外場服務人員很親切又專業！"
 Chaohsien Huang ,https://www.google.com/maps/contrib/114817823461941669448/reviews?hl=zh-TW,5,True,70,吃了個千層派，口感風味都很好。雖然擺盤有點普通，飲料也馬馬虎虎，不過甜點好吃可以蓋過小缺失。
 Shu-Hao Chang ,https://www.google.com/maps/contrib/107986819707941191981/reviews?hl=zh-TW,1,False,4,"好幾天前已經預訂餐點會今天11:30～12:30送到，今天一點自己打過來說今天餐點都會延遲，這個已經有問題了，然後說餐點已經出了13:30會到，到了兩點還沒到我們回電在詢問得到一樣的回覆，然後外送人14:10才說他收到通知要取餐，
自己沒處理好，還騙人，說餐點已經出了，外送人還在等餐點!爛到極致!"
 H H ,https://www.google.com/maps/contrib/106126377731949464559/reviews?hl=zh-TW,4,False,36,服務人員非常熱心介紹與說明產品，樂於和店內客人交流互動，雖店面不算大但內部氣氛熱絡。這次先消費甜點，感官花園蛋糕甜而不膩，下次再找機會嘗試鹹食餐點。
 陳BO ,https://www.google.com/maps/contrib/112647692128710485416/reviews?hl=zh-TW,5,False,1,女店員活潑可愛.服務用心
 Vincent Wu ,https://www.google.com/maps/contrib/111060978741134756216/reviews?hl=zh-TW,5,False,170,"台北數一數二的甜點店，氣氛非常好，裝潢與佈置狠溫馨，店員非常非常貼心，而且讓人感覺很親切，會詳細介紹所有甜點，上餐點時也會提供食用建議。
會想要再訪，吃吃看不同的蛋糕。"
 Minnie C ,https://www.google.com/maps/contrib/116009988309769708933/reviews?hl=zh-TW,5,True,21,甜點及服務相當有水準！值得一去再去😊
 Kristine C ,https://www.google.com/maps/contrib/111208949938670675431/reviews?hl=zh-TW,1,True,14,豬肉燉飯很雷😓甜點雖是強項，價格偏高。不會再訪。
 Edlyn Wang (Chia) ,https://www.google.com/maps/contrib/110236139034946123056/reviews?hl=zh-TW,5,False,9,千層派是心目中排名前三，派皮夠酥夠脆，水果也很新鮮，服務也很到位。雖然一開始乍看價錢覺得小貴但吃完覺得值回票價，到現在回味還是會流口水的境界。咖啡的部分，建議可以再慎選咖啡豆，可能是千層派太強大了導致覺得相差甚遠，但已收入口袋名單，是下次還會再回去拜訪的店。
 Jessica Wang ,https://www.google.com/maps/contrib/109517134201910684055/reviews?hl=zh-TW,4,True,419,鹹食和甜食物有所值，味道都好。鹹食份量不多，就是吃完一份300多的主餐，會覺得再來兩個豆皮壽司才飽的那種份量。可能地點店租貴，價格不親民，適合剛發薪水，或者心情不好很想花錢開心但不想踩雷時的選擇。
 uh f ,https://www.google.com/maps/contrib/102784686043283723733/reviews?hl=zh-TW,4,True,184,義大利肉醬麵很好吃麵條與外面餐廳的都不同醬汁充分的沾裹在麵條內外含小費約350元下次想試試他們家的甜點~好想試千層只是價格好像真的更高了~~
 林佩璇 ,https://www.google.com/maps/contrib/105350007499623185746/reviews?hl=zh-TW,5,False,3,"甜點精緻美味尤其服務人員非常親切
使我有個愉快的一天"
 Ballawyerina Chow ,https://www.google.com/maps/contrib/117700248224300059013/reviews?hl=zh-TW,4,True,64,巧克力洋梨千層派好吃。洋蔥豬腳可麗餅的餅皮苦苦的。
 Miku ,https://www.google.com/maps/contrib/116467112395341089895/reviews?hl=zh-TW,1,False,23,請問可麗露研發人員有吃過嗎？像石頭一樣的東西⋯⋯週末限量石頭一個$100！？
 I-Chun Chiu ,https://www.google.com/maps/contrib/104530410410414646484/reviews?hl=zh-TW,5,True,26,店員服務態度超溫柔，整間店都充滿著法式的優雅！
 家豪麥 ,https://www.google.com/maps/contrib/100437762415026339532/reviews?hl=zh-TW,5,False,6,"這是這個月第二次到訪SEASON用餐，同行的朋友都是第一次吃也給了相當高的評價㊗️
很謝謝服務人員用心的介紹各式餐點，用餐的過程中主廚也會到桌介紹今日料理並詢問顧客口味上是否還滿意，我其實蠻喜歡這樣的舉動！推薦給愛料理的你或是愛吃甜點的達人共襄盛舉✨✨✨

謝謝SÈÀŚÓŃ各位"
 Vivian Chu ,https://www.google.com/maps/contrib/100177752356523669644/reviews?hl=zh-TW,4,True,16,"過去都在大直店品味,現在專程前往旗艦店,雖然有點不好找,但果然有旗艦店的人氣.用餐氣氛愉悅.下午茶兩人套餐份量不算小,口味依舊保持著特殊甜點帶著主菜風味的菜系.茶品有講究.仍希望台北仍能夠保持兩個店最好."
 May T ,https://www.google.com/maps/contrib/117575579658003643846/reviews?hl=zh-TW,3,False,36,一棟十分老舊公寓的一樓改裝，整棟樓看起來太老舊髒污，所以影響了想進去的意願！為何不選擇在內科開店？街廓與建物都新
 Eris Yao ,https://www.google.com/maps/contrib/111849558733784230500/reviews?hl=zh-TW,5,False,145,碰巧路過看到有供應法式甜點就被吸引進門，點了店員推薦的千層派+套餐，套餐包含泰奶冰淇淋、可麗露、飲料與主餐千層派，泰奶冰奶香濃、口感又帶點黏牙吃起來很有趣。千層派令人印象深刻，一刀切下，蓬鬆的派皮立即斷開，配著加了卡士達的鮮奶油一起吃下，每口都能享受到豐富的層次，再加上頂層的糖片、覆盆子雪酪與草莓互相搭配，整個主餐吃下來都不會覺得膩，真不愧是招牌甜點！唯一可惜的是現在不是草莓盛產的季節...不然草莓應該會更好吃吧。
 王亭云 ,https://www.google.com/maps/contrib/106886503361963408367/reviews?hl=zh-TW,4,False,364,"位於敦化南路巷內
以霧面質感綠的色調和玻璃窗打造
店內地板是黑白花磚的圖樣
帶點工業風的佈置
店內空間雖不大
但座位的距離還算適中

服務人員非常熱心的介紹菜單
詳細的解說每道餐點的特色及食用方式
與客人互動熱絡，十分親切

蛋糕櫃和陳架上也擺滿了各式小點
非常適合帶回家慢慢品嚐或是送禮

店家有提供鹹食及甜點，還有飲品可選擇

🥂輕食
🥂雙人分享餐
🥂下午茶套餐
🔅精選蛋糕套餐
🔅現做甜點套餐
🔅飲品
🔅秋季限定現做甜點

🎂現做甜點套餐

⚜️雪酪

店家會先上奇異果雪酪
帶有冰沙的口感
酸中帶甜，清爽不甜膩的奇異果香氣

⚜️法式小茶點（3款）

一共有三款茶點

🍓草莓棉花糖
軟綿有帶有些微嚼勁口感的棉花糖
草莓的氣味在口中散開，完全不甜膩

🍓玫瑰覆盆子杏仁餅

上層是玫瑰覆盆子口味的的杏仁角
下層為法式甜塔皮
酸甜的味道，配上甜塔皮細緻的口感
非常適合配茶享用

🍓自然酒乳酪球

起司蛋糕的口感，呈現小巧可愛的骰子狀
奶油乳酪、鮮奶油、糖及奶油酥餅
組合而成
口感比冰淇淋厚實，慢慢在口中入口即化
搭配上底部的香脆餅乾，堪稱絕配
使用西班牙的自然葡萄酒
讓小點多了幾分迷人的香氣

⚜️現做甜點（7選1）

🌰酥烤千層派

最上層是杏仁糖片，先輕輕敲碎
搭配新鮮的草莓
及綿滑細緻的香草鮮奶油卡士達
底層是以手工壓製兩天半
再烘烤至酥脆的千層派皮
濃郁奶油和麵粉香氣的派皮
經過烘烤後層次細密，口感蓬鬆酥脆

一旁的新鮮草莓加上百香果微酸的滋味
以及覆盆子雪酪帶著水果的微酸香氣
口感味覺多層次且豐富

🌰超級蒙布朗

秋季限定款
只要戴上口罩便可以進入廚房看製作過程

以香脆的咖啡蛋白餅為基底
上面放上整顆熟成的西洋梨
外面擠上少糖的鮮奶油
中間搭配黑醋栗果醬
最後擠上蘭姆酒香栗子泥
一旁會搭配一杯西洋梨雪酪佐橄欖油

層次和口感非常豐富
帶有酒香的栗子泥非常紮實
因為用萊姆酒提味，所以完全不甜膩
搭配著爽口微酸的西洋梨，十分清爽
因為是熟成的西洋梨
所以一刀就可以切到底
還帶著些微鬆軟口感的咖啡香
與西洋梨雪酪一同食用，份量非常足夠

⚜️160元內飲品任1款

☕️法國瑪黛茶-皇家結婚曲茶

為混合茶，一直都很愛這一款茶品
以黃金阿薩姆為基底
有著麥芽香氣的圓潤口感
搭配上巧克力和焦糖
香氣溫潤順口
聞起來有濃郁的的奶油香氣
非常好喝

整體而言
每一個甜點都感受得到師傅的用心
食材上的搭配，令人驚艷
口感層次豐富，味覺上的饗宴
服務人員也非常親切且專業
座位可以再更舒適會更好"
 木子一田 ,https://www.google.com/maps/contrib/114767211414636726293/reviews?hl=zh-TW,5,True,167,感官花園蛋糕，驚人的美味，朋友們一致好評。
 廖虎 ,https://www.google.com/maps/contrib/107445786216306120793/reviews?hl=zh-TW,2,False,28,之前有吃過店內的招牌(莓果蛋糕)，非常喜歡，所以今天又去店面看看是否有機會買到，但可惜沒有現貨，所以購買一個栗子餡的蛋糕(或是派)，吃後覺得整個蛋糕都太甜了，有些失望，建議甜度可以不要那麼甜。
 Y.T T ,https://www.google.com/maps/contrib/101318089449257165860/reviews?hl=zh-TW,5,True,88,"內外兼具的感官花園
口味不甜不膩
男女一致盛讚"
 K C (Kai) ,https://www.google.com/maps/contrib/108089936228455584165/reviews?hl=zh-TW,4,True,73,服務人員態度好昨日陽光百香果跟巧克力很搭但吃到最後沒百香果就會膩飲品略小杯
 Michael Lee ,https://www.google.com/maps/contrib/115562757043163291657/reviews?hl=zh-TW,4,True,92,"很霸氣，也好吃。不過價錢稍高。
回訪率：65%"
 悠寶 ,https://www.google.com/maps/contrib/104529697923417154591/reviews?hl=zh-TW,4,True,841,"🍹精選蛋糕套餐🍰
▪️雪酪:👍🏻⏳需3分內吃完
▪️🍨:上面是麵包浸泡白蘭地搭配奶油,假日限定,⏳需3分內吃完
▪️波拉克:這款蛋糕很推,很大人的蛋糕,不會過甜也不會不甜😂吃起來很特別～((好爛的比喻🤣
▪️雲朵鮮奶茶:我以為會有雲在上面,結果是分開放？棉花糖用手剝,然後奶茶很不甜這樣😟"
 San-Yung Hung ,https://www.google.com/maps/contrib/111385582982909919523/reviews?hl=zh-TW,5,False,32,"和雀巢合作的新品翻轉花都非常好吃一入口在舌頭上化開的香草和可可味讓人有幸福的感覺不會過甜尾韻的微酸讓層次更豐富

是法式甜點的口袋名單愛店
老闆人熱情又有才華介紹非常仔細有耐心
還特別招待了雪酪
甜點的口味和搭配都是高水準

推薦有聚會慶生節日等可選擇感官花園一定不會後悔

餐點感覺很用心有機會一定要去嚐嚐看"
 PHOEBE CHANG ,https://www.google.com/maps/contrib/105810697850975686412/reviews?hl=zh-TW,5,True,20,"購買了感官花園6吋，上面佈滿了許多莓果，店家還有特製慶生巧克力片在上面～
服務態度很好，價格稍高，口味個人很喜歡！"
 Michael Lin ,https://www.google.com/maps/contrib/100859248991731792255/reviews?hl=zh-TW,5,True,364,"我生日蛋糕訂錯日期，店員很Nice的做出了很棒的處理，非常的感謝！
今天去現場買了香梨塔，全家都很愛，之後要努力把每種口味都吃遍！"
 Alax Kao ,https://www.google.com/maps/contrib/110694922232562778955/reviews?hl=zh-TW,5,True,80,"不只甜點很棒，鹹食也蠻有水準。
因為用餐時佐葡萄酒，現場杯型有限，或是能改進之處"
 Zerous Chin ,https://www.google.com/maps/contrib/117844387654478998332/reviews?hl=zh-TW,5,False,4,感官花園94讚
 vivian Tsong ,https://www.google.com/maps/contrib/112826252499660927256/reviews?hl=zh-TW,5,False,16,千層酥好吃，服務不錯，但主食很普通。可以單吃甜點就好。
 Bbbb Qqb ,https://www.google.com/maps/contrib/113311892729247644130/reviews?hl=zh-TW,3,True,604,餐點品質這幾年下滑很多
 Renee Tsai ,https://www.google.com/maps/contrib/112731243154791061504/reviews?hl=zh-TW,5,True,73,"服務人員很親切地說明～蛋糕真的很美味，吃了有滿滿幸福感!
一直在找莓果類(尤其是覆盆莓:D)的蛋糕，這家不僅有而且很美味~大愛！"
 Michaela H ,https://www.google.com/maps/contrib/117372448067870266964/reviews?hl=zh-TW,4,True,246,餐點部分還好，但蛋糕真的好好吃，是會忍不住一口接一口的好吃！只要路過都會停下腳步買一份～～
 Rock Su ,https://www.google.com/maps/contrib/106302596905173280569/reviews?hl=zh-TW,4,True,220,"口味不錯蛋糕價格偏高
但都可以事先訂購（急單）
店員都很親切介紹每一項產品
店內改為裝過一次
目前內用用餐位子較少"
 Cynthia Chang ,https://www.google.com/maps/contrib/115481553319899106106/reviews?hl=zh-TW,3,True,563,波拉克酸酸甜甜..比預期中的好吃....
 Blair Hsieh ,https://www.google.com/maps/contrib/113949550899530668655/reviews?hl=zh-TW,5,True,163,每一道甜點都很細緻用心。
 Sean Yeh ,https://www.google.com/maps/contrib/109782250869684198377/reviews?hl=zh-TW,4,True,60,甜點還不錯，但雙人餐點選擇和內容還可
 Dasiyy Chen ,https://www.google.com/maps/contrib/112564604197102726401/reviews?hl=zh-TW,4,True,55,需要訂位甜點漂亮口味精緻但價位偏高
 Benson Hsu ,https://www.google.com/maps/contrib/106501359725554089888/reviews?hl=zh-TW,3,True,427,環境尚可，甜點口感也不錯，但性價比不好！本人認為價格偏高，消費方式也偏強制點飲料，現在已經很多店家不強制點飲料，只要有點二種商品以上即可！
 喬伊 ,https://www.google.com/maps/contrib/102383417197649292224/reviews?hl=zh-TW,5,False,59,"下午三點來享用甜點～
氣氛不錯餐點美味酥皮草莓千層派好吃😋"
 挑嘴的I ,https://www.google.com/maps/contrib/105944380839755283376/reviews?hl=zh-TW,4,True,"1,805",環境舒適，甜點味道味道一流，Neruda美麗得像朵花一般，漂亮又好吃。千層派的卡士達醬美味不膩，馬卡龍皮厚了點軟了點。整體來說是水準之上的甜點店，值得光臨。
 Sayumi Chen ,https://www.google.com/maps/contrib/102021360328076638173/reviews?hl=zh-TW,5,True,53,午餐點了碳烤雞肉西瓜Pascade非常特別第一次吃到西瓜做成鹹的入菜鹹鹹甜甜脆脆的不會很突兀雞肉很嫩很好吃像是舒肥的口感薯泥口感滑順最好吃的是盛裝的pascade麵包碗外壁薄脆一切下去啪一聲應聲即斷有點療癒ww泡軟後像是法式可麗餅的味道
 Hui-ling Guo ,https://www.google.com/maps/contrib/103009984526760300206/reviews?hl=zh-TW,5,False,9,服務親切，甜點好吃，環境舒適，裡面還有一張主廚餐桌，可以近距離觀看師傅製作甜點，好特別👍🏻👍🏻👍🏻
 張正麇 ,https://www.google.com/maps/contrib/101729833213790991256/reviews?hl=zh-TW,2,False,18,蛋糕好吃但是櫃檯服務小姐態度極差，臉很臭不知道是欠她多少錢？
 Kate Chen ,https://www.google.com/maps/contrib/110670404072620252345/reviews?hl=zh-TW,5,True,545,擅用有機食用花卉，點心好看又好吃！
 OO Melody ,https://www.google.com/maps/contrib/101075891634904551558/reviews?hl=zh-TW,5,False,41,甜可頌🥐超級好吃，裡面的千層很酥脆～當小甜點吃讓人心滿意足～流連忘返😊
 ZHI-WEI TAO ,https://www.google.com/maps/contrib/111194024517910281170/reviews?hl=zh-TW,5,True,393,可以內用了，感覺真好！
 雷Ray ,https://www.google.com/maps/contrib/113749077186991042202/reviews?hl=zh-TW,1,False,9,我知道貴店確實是標註營業時間是到八點整沒錯，但剛八點前致電於貴店時還在通話中，8.01分後才終於打進去卻被選擇性拒接，感覺貴店對於自家的服務態度是否不太在意呢？
 VVN Li ,https://www.google.com/maps/contrib/108893035887149995280/reviews?hl=zh-TW,5,True,148,吃精緻推，但cp不高
 Lizzy Weng ,https://www.google.com/maps/contrib/109671313343044839324/reviews?hl=zh-TW,1,False,3,雖然平時很喜愛的餐廳，但是訂位母親節前一天，要帶媽媽去吃飯，訂位當天半小時前電話說餐點提早賣完沒有供餐，請問這樣大節臨時取消訂位真的很令人失望傻眼，再喜歡也再也不去！
 Mendel Chang ,https://www.google.com/maps/contrib/102963905645807201755/reviews?hl=zh-TW,4,False,9,"牛尾偏膩建議三人以上分食
其他都很優秀！"
 Senia ,https://www.google.com/maps/contrib/112062915487648624670/reviews?hl=zh-TW,4,True,388,感官花園生日蛋糕非常好吃，最外層鋪一層焦糖，表面覆蓋滿滿的藍莓、草莓、覆盆子，美味！
 魏柏宣 ,https://www.google.com/maps/contrib/118345335153616378632/reviews?hl=zh-TW,5,True,413,很棒的一家法式甜點，生日蛋糕精緻好吃
 Arika Chen ,https://www.google.com/maps/contrib/111608994119933599707/reviews?hl=zh-TW,5,True,10,法式吐司好好吃，裡面很鬆軟，切下去的瞬間以為會有蛋汁或奶油流出來的感覺XD
 Eason Chen ,https://www.google.com/maps/contrib/107057028386605118373/reviews?hl=zh-TW,4,True,56,"8/913：30購買6吋感官花園
感謝現場兩位女性店員詳細說明，並細心協助保冷包裝

扣一顆星因為感受到現場結帳的男性店員莫名的擺態😑

2013年到現在，始終能有倍感貼心的消費體驗"
 董琳琳 ,https://www.google.com/maps/contrib/108420655181840617802/reviews?hl=zh-TW,5,True,77,"#感官花園#emotionalexplosion#我的巴黎
甜點超讚！店員也超會介紹
不只外表美
層次超豐富
香味也很值得細細品嚐"
 w111aine ,https://www.google.com/maps/contrib/106505491000807838402/reviews?hl=zh-TW,4,True,36,服務親切這次點的雪花冰裡面還有千層派增加口感很好吃，唯獨上方的焦糖泡芙太硬了可惜
 May Ko ,https://www.google.com/maps/contrib/116353275134546422979/reviews?hl=zh-TW,5,True,32,食材新鮮，甜點好吃有特色。
 Jessica Jae Liu ,https://www.google.com/maps/contrib/108894387168926533084/reviews?hl=zh-TW,2,True,88,甜點很粗，根本就是時下IG店，只能照些照片，看到實物，比照片粗糙多了，口味也是很平庸毫無亮點
 CK W ,https://www.google.com/maps/contrib/115739549081885973440/reviews?hl=zh-TW,3,True,226,台北市專業甜點店，點心不差但也不特別驚艷而且價格頗為高貴是個吃氣氛的地方，C/P值不算太高。
 Judy Ma ,https://www.google.com/maps/contrib/112107354048055033584/reviews?hl=zh-TW,5,False,16,這次坐到裡面隱藏版的長桌，很舒適～甜點餐點都超好吃！！店員又親切～推推！
 WEN HUI HUANG ,https://www.google.com/maps/contrib/111048793357836089940/reviews?hl=zh-TW,4,True,46,少一分因為價錢對我而言偏貴，服務與甜點都非常棒，服務生也很漂亮，一進門就很認真介紹每一個甜點，令人感到細心，還招待檸檬費南雪，意外的很好吃！
 Stacie Stacie ,https://www.google.com/maps/contrib/110207127407262002766/reviews?hl=zh-TW,4,True,262,"多年前吃到的感官森林讓我念念不忘
盤飾甜點也不錯"
 Kelly Huang ,https://www.google.com/maps/contrib/111657571863895531055/reviews?hl=zh-TW,3,True,"1,002","太會推薦的餐廳
現作甜點不錯
相對單價也很高
套餐小點還好"
 Otis Hong ,https://www.google.com/maps/contrib/114173204896738012325/reviews?hl=zh-TW,5,True,406,"番茄燉牛肚波隆那肉醬麵超神
栗子好吃唯獨就是茶具餐盤普通了點
大推"
 bbkid0208 ,https://www.google.com/maps/contrib/112039470197566451095/reviews?hl=zh-TW,5,False,1,"餐的味道很好，細緻有層次
餐後再搭一個草莓千層派，完美

真心推薦"
 lin cc ,https://www.google.com/maps/contrib/117855285805900491158/reviews?hl=zh-TW,5,True,123,"甜點好吃價格也不便宜。但真的可以感受到用心。
鮮奶茶茶香奶香微甜很久沒喝到這種用心了"
 Bonnie Li ,https://www.google.com/maps/contrib/102088464495056816759/reviews?hl=zh-TW,4,True,82,意外走進去的好店，茶點與蛋糕令人驚豔的好吃，茶也很好喝，下次還會想再去試試其他餐點。
 谷民陳 ,https://www.google.com/maps/contrib/106440249669544134809/reviews?hl=zh-TW,5,False,32,服務態度很好，自從吃到了感官花園，每週都想盡各種藉口去買感官花園，生日蛋糕從此就只買感官花園！
 黃麗娜 ,https://www.google.com/maps/contrib/111804075854830199362/reviews?hl=zh-TW,5,False,5,茶點與蛋糕令人驚豔的，茶也很好喝，下次還會想再去試試其他餐點
 UU Huang ,https://www.google.com/maps/contrib/102762266888487632425/reviews?hl=zh-TW,5,False,6,鹹食好吃甜食驚艷
 Nadia LIN ,https://www.google.com/maps/contrib/101378077050525718475/reviews?hl=zh-TW,5,True,20,不論料理、甜點或是店內的人都令人舒服😌
 Ian Liu ,https://www.google.com/maps/contrib/109012000112220187627/reviews?hl=zh-TW,4,True,122,成人的甜點。職人現做，歐日風味，細緻優雅。食用環境稍待進步。
 李權紘 ,https://www.google.com/maps/contrib/110030121351331023991/reviews?hl=zh-TW,5,False,16,百香果巧克力超級好吃啊啊啊啊！
 子晴（晴晴子） ,https://www.google.com/maps/contrib/114425789899192576352/reviews?hl=zh-TW,5,True,233,超棒的甜點環境超讚
 jin jin Ye ,https://www.google.com/maps/contrib/116349996438694614512/reviews?hl=zh-TW,5,False,5,預定了蛋糕想更換口味、感謝店員全力幫忙👍👍nice~
 逸猶未盡 ,https://www.google.com/maps/contrib/102587082221235577240/reviews?hl=zh-TW,5,True,17,店員很貼心，本來想說快打烊了買不到生日蛋糕，但是還是現做一個給我，太感動了😹
 yuyucxx (Wen Yue Chen) ,https://www.google.com/maps/contrib/107515549466754803694/reviews?hl=zh-TW,5,True,29,莓果控的一定要來，已經吃了他們家的甜點很多年，滿推薦當日現做的甜點，每次都很驚艷😍
 韎緹 ,https://www.google.com/maps/contrib/106471986028209410329/reviews?hl=zh-TW,4,True,30,好吃但價格很貴
 顏妤璇 ,https://www.google.com/maps/contrib/107684164729629070395/reviews?hl=zh-TW,5,True,191,台北最愛的法式甜點，建議點經典款甜點或蛋糕就好👌
 liz Lin ,https://www.google.com/maps/contrib/116694355376342450978/reviews?hl=zh-TW,5,True,62,風格類似的店吃過幾十家了，season的服務、餐點水準、裝潢、整體評下來始終是CP值最高的店!!!
 PF Chen ,https://www.google.com/maps/contrib/116721454612594528568/reviews?hl=zh-TW,5,True,145,喜歡所有的塔皮類甜點和波拉克，生日蛋糕常東挑西挑最後還是訂了這一家。
 蕭雲 ,https://www.google.com/maps/contrib/117516782027201893062/reviews?hl=zh-TW,5,True,148,絕對會再訪的一家店！服務親切，蛋糕甜點好吃，茶品好喝！
 巧克 ,https://www.google.com/maps/contrib/107768961536177771174/reviews?hl=zh-TW,5,False,18,店長其實人超nice的🖤
 Paulinchen Lee ,https://www.google.com/maps/contrib/116323434094692620419/reviews?hl=zh-TW,5,True,373,好吃。用心經營。
 Christine Yeh ,https://www.google.com/maps/contrib/113618503973382109858/reviews?hl=zh-TW,2,True,147,位子少，食物普通且貴。麵包好吃
 李壁郎 ,https://www.google.com/maps/contrib/100852104148850814681/reviews?hl=zh-TW,4,True,555,菜色佳，服務人員親切。
 Vicky ,https://www.google.com/maps/contrib/114391172367224604641/reviews?hl=zh-TW,1,False,16,期待～但無論什麼形狀可麗露不好吃🤮
 卓卓 ,https://www.google.com/maps/contrib/106884315242187896290/reviews?hl=zh-TW,5,True,118,千層絕對值得吃！那天剛好是吃到他們的焦糖千層，帶點焦糖的苦，吃不膩♥
 yu51688 Chiang ,https://www.google.com/maps/contrib/102586901322391698793/reviews?hl=zh-TW,5,True,65,燉飯、沙拉、義大利麵都很好吃甜品也很棒！服務人員介紹的很詳細用心👍🏻
 Pin Pin ,https://www.google.com/maps/contrib/114044307303648237690/reviews?hl=zh-TW,5,True,232,蛋糕精緻好吃，價格稍貴但值得
