user_name,user_profile_url,rating,local_guide,comment_num,comment_text
 劉秀英 ,https://www.google.com/maps/contrib/110140233880916244983/reviews?hl=zh-TW,4,True,101,充分優雅的擺盤風味跳躍堆疊現點現做風格全台寥寥可數season當年可以説是台灣馬卡龍的始作俑者甜點界一哥的一哥多年過去已捲起萬丈風雲的甜界還有season奔走廚房充滿興味繼續創作遊走甜鹹之間有空去嚐嚐必有當令驚喜！
 LChun L ,https://www.google.com/maps/contrib/113043257310273461158/reviews?hl=zh-TW,5,True,62,"甜點跟飲品、法式小點精緻美味，每一口都是享受跟驚喜。
店內服務良好貼心，解說店內商品用心。
很認真美好的一間店，值得細細品味跟一訪再訪。
看到隔壁桌點的主食鹹食也非常誘人，令人期待。"
 Amy Tsai ,https://www.google.com/maps/contrib/107416104391959265608/reviews?hl=zh-TW,5,True,240,"感官花園不愧是店裡的必點，裡面的卡士達完全不會覺得甜膩，外面也明明是焦糖，但就是不會覺得膩。
我的巴黎外面用的是覆盆莓，那圈很特別，不知道怎麼說，有點像美國那種一條的軟糖糖果，薄薄一片。

有機會想要訂一個蛋糕，真的很好吃"
 Veggie Love ,https://www.google.com/maps/contrib/105852723081168313251/reviews?hl=zh-TW,5,True,37,"IwouldlovetocomeeverySEASON!

每次吃到season的蛋糕就是一個驚豔
這是第一次親臨本店，店面不但比想像中的大和漂亮，下午茶的種類也比想像中的多，而且還有鹹食餐點，很推薦揪朋友一起來分享！

店員很親切，用ipad很專業的解說各種甜點的內餡，我是只要看到＂每日驚喜＂就無法放棄的類型，這次的是蜂蜜檸檬碎冰和起司，不但口感"
 yuti su ,https://www.google.com/maps/contrib/117270784130986304601/reviews?hl=zh-TW,5,True,20,"甜點真的太美味了🎉
甜而不膩且讓人驚豔😍
真的是吃得出用心和創意的甜點
點蒙布朗還可以現場看製作過程唷
老闆人很好，說明的也非常詳細
期待下一次再訪❤️"
 陳正宏 ,https://www.google.com/maps/contrib/101621001276816819521/reviews?hl=zh-TW,4,True,58,"有特色，且讓人感到舒適的店面。
飲品冰咖啡的部分...個人感覺喝起來非常的順，不失風味亦不爭風采。
甜點有巧思，擺盤以及風味搭配很明顯都是下過功夫的。
略有不足的部分...可能我最近太養生，突然吃那麼一堆甜點有點不適應，雖然咖啡很好但果然還是喝茶會更適合甜點。
QAQ"
 Lin Eason ,https://www.google.com/maps/contrib/103753416305293762432/reviews?hl=zh-TW,5,True,235,"千層派超級好吃，酥到不行，然後芒果配百香果，有很搭，奶油也不膩，淡淡奶香，大推！！！
感官花園也好吃～外面糖霜好吃"
 Ching chiang ,https://www.google.com/maps/contrib/114036575272453903720/reviews?hl=zh-TW,4,True,106,千層派口感香氣十足，主菜為中日混合創意口味，推薦給喜愛嚐鮮的人。餐廳氣氛非常舒適，服務人員也很親切，【情感爆炸】口味草味濃厚，喜愛花果甜點的朋友慎入。
 Angelanini ,https://www.google.com/maps/contrib/105582724642035697895/reviews?hl=zh-TW,4,True,165,"建議13:00前打電話預約現場小蛋糕唷！
今天點了現做甜點系列，東西很新鮮且有層次口味
喜歡蒙布朗裡面的洋梨，很特別的搭配"
 Britany ,https://www.google.com/maps/contrib/103646787246375358810/reviews?hl=zh-TW,5,False,3,"餐點還不錯，蛋糕很好吃（尤其是感官花園蛋糕）
今天去現場才問還有沒有四吋的蛋糕可以買，雖然沒有提前兩天預訂，但店家還是幫我做了一份給我，人非常親切。而且本來說要製作兩個小時，結果最後在我們用完餐的時候就做好了，超級感謝！"
 Chun ,https://www.google.com/maps/contrib/113654275880788825701/reviews?hl=zh-TW,5,True,29,層次豐富的感官花園蛋糕，酸酸甜甜還帶有焦糖香氣，滿足甜點美味
 Orson Chang ,https://www.google.com/maps/contrib/101866162416149156257/reviews?hl=zh-TW,5,True,125,"#盤飾甜點
#法式甜點
#麻辣

用餐幾次都覺得甜點真的是甜點而不是什麼健康飲食，豐富多層次的味道與口感，色香味俱全的用餐體驗，一流的服務品質。"
 Debby Hsu ,https://www.google.com/maps/contrib/110997685946014682282/reviews?hl=zh-TW,5,True,197,"氣氛好，座位不多，空間寬敞舒適，大家說話都很小聲，是美好的用餐體驗，服務人員態度也很親切，介紹很詳細，有位男服務生，感覺像主管，也把紅白酒介紹的很詳細。

每一道料理都細細說明是使用什麼食材、什麼方式製作，會有什麼樣的口感，建議怎麼吃，搭配什麼吃，都講得非常清楚且令人感到專業又舒服～

感官花園蛋糕大推！餐點從第一道菜到甜點，完全0負評！是殿堂等級的法式餐廳😭😭😭

我們點雙人分享套餐，價位物超所值！第二次以及第三次造訪服務員都還記得我，還很幸運的被招待了NG甜點，真的是天使小姊姊😇😇😇

每次來都很開心，真的是一個月去一次了吧🤣🤣"
 李美玉 ,https://www.google.com/maps/contrib/109796008354067678513/reviews?hl=zh-TW,5,True,192,"拖鞋麵包，沙拉，燉牛筋牛肚佐皇帝豆，油封鴨腿與馬鈴薯麵疙瘩佐多種野菜，雙人分享餐裡每一道都好吃，調味清爽不油膩，以甜點為主的店家對鹹食絲毫不妥協馬虎，令人讚賞~

甜點味道融合不突兀，飲品香氣十足。服務人員親切有禮，時常幫忙注意是否需補水，點餐與上餐時都會主動詳細介紹。

整體絕對水準之上，肯定會再回訪~"
 Eating Machine ,https://www.google.com/maps/contrib/103542698180853369290/reviews?hl=zh-TW,4,True,200,"高價位的蛋糕。
4吋的感官花園$660，但味道口感很細緻，家人吃過都喜歡。
店內環境十分舒適、座位較小。"
 7 7 ,https://www.google.com/maps/contrib/100814263215550441123/reviews?hl=zh-TW,5,True,131,"老闆人很熱情
蛋糕非常好吃不愛吃甜食的我都驚豔到
千層派非常酥脆、內裡裹的奶油甜而不膩
蒙布朗以為會很甜但是非常清爽
老闆也讓我們看蒙布朗的製作過程（一定要戴口罩）
雖然甜點價位偏高但整體體驗非常好
有低消一人400，所以建議不要吃飽後再來會很撐🤣"
 W. L ,https://www.google.com/maps/contrib/113001239287000395241/reviews?hl=zh-TW,5,True,"1,266",店面不大，但當季現做甜點水準很不錯，咖啡製作也頗用心，常溫點心略為遜色。
 Chérie Ashley ,https://www.google.com/maps/contrib/106451935126483378353/reviews?hl=zh-TW,5,True,523,"店內是黑色系列的擺設
店員很貼心也很親切，都很細心的介紹
甜點真的讓人迷戀！
我覺得這很適合姐妹們聚餐拍照的好地方
我們是家庭用餐，也不錯只是哥哥們都說吃不飽😂
但對於女孩我覺得份量其實挺足的！"
 Chang Jenner ,https://www.google.com/maps/contrib/117472418418792447683/reviews?hl=zh-TW,5,True,70,"要找小尺寸但又好吃、好看的蛋糕一定要來這家！！！
而且上面的水果份量也很多、蛋糕也不會太甜✔️
店內環境很漂亮，不過離捷運站有點遠走路會有距離"
 YU-JYUN LIN ,https://www.google.com/maps/contrib/105789397182762449504/reviews?hl=zh-TW,5,True,157,"草莓千層派要先預定
兩人一共點了一個千層派及一份套餐、以及兩杯飲料，共$1100。甜點多層次、精緻好吃，環境安靜舒適，服務專業"
 Bamboo Chen ,https://www.google.com/maps/contrib/100137162681449560670/reviews?hl=zh-TW,5,True,80,"非常好吃，能感受到用心和好食材的高水準餐廳💗✨
鹹食、甜點都吃得很幸福😋
（而且看起來就很好吃，看得也開心）
價格偏高但很值得！"
 chiang rare ,https://www.google.com/maps/contrib/111341725057682263522/reviews?hl=zh-TW,3,True,786,"午間套餐油封鴨腿肉很嫩但是肥油太多
下面墊的麵疙瘩有點可怕😱就是沒味道的麵糰
不如別放多放點烤蔬菜去膩
麵包很好吃番茄湯是冷的有點不習慣
榛果巧克力泡芙淋巧克力醬太甜太膩"
 Tipsycat C ,https://www.google.com/maps/contrib/103442718276721744290/reviews?hl=zh-TW,5,True,56,第一次吃燉牛尾，好吃！像豬腳一樣充滿膠質的濃厚滋味。蜂蜜拖鞋麵包越嚼越香。酥脆的千層派是奶油跟麵粉香。
 Fanfan Tsai ,https://www.google.com/maps/contrib/115720638331917046390/reviews?hl=zh-TW,3,True,44,"多年前內用過兩次（第一次在大直、第二次在敦南這邊），印象都非常好，甜點鹹食口味都很好。

近年因為節慶，家人訂購了這款8吋感官花園兩次（兩年前在餐廳、前兩天回家吃），外表很美、味道也不錯，但兩次入口都覺得裡面冰霜不少，內餡像是冰過的重乳酪蛋糕口感偏硬（官網上說是杏仁蛋糕），尤其剛好都在晚餐後吃，感覺特別冰冷🥶...

吃過不少法式甜點，全世界歐美日都吃過名廚開的店，就是沒吃過冰霜口感的蛋糕。是Season主廚設計這款蛋糕的特殊創意？或是店裡的冰箱溫度過低導致內餡凍結了？

想提醒其他客人，若非喜歡冰淇淋蛋糕，外帶感官花園這款大蛋糕，需要三思🧐"
 Chen Po Ru ,https://www.google.com/maps/contrib/102175758637317001106/reviews?hl=zh-TW,5,True,40,"讓人吃撐的一餐
與友人最先在IG看到明水路的店家
立馬決定要去嚐嚐
好在出發前先在google查詢
發現明水路店已歇業
當下就打去敦南旗艦店訂位

餐點附的鄉村麵包超好吃
外層酥脆內層軟綿
喜歡這種
單純的麵粉香
詢問店家不定期會有提供外賣服務
所以日後會想來外帶給家人吃吃看

油鴨松露薯條
香氣濃郁好吃

焦化紅蘿蔔
外層感覺微微的焦糖感
紅蘿蔔吃起來是綿密的口感
搭配撒在上方店家自製的瑞可達乳酪
很特別還不錯吃

其實吃到這邊已經有點半飽了
所以店家在上豬腳的時候
很貼心的詢問真的吃不完
要取消甜點也沒關係
（在點餐的時候店員也有提醒豬腳份量不算小）

一開始還擔心腸類會太鹹
還好season處理的鹹度非常適中
即使單吃也不會覺得死鹹
料理內的帶皮馬鈴薯
吸附這湯汁也很美味
到了主角豬腳
餐刀中間劃一刀
自然就分成兩半
真的非常軟Q
豬腳本上是比較有鹹味
會建議跟麵包搭配食用

最後到了今天最期待的甜點時間
我只想說
沒取消甜點是正確的決定
這個千層派真的好好吃
卡士達醬
最上層的糖衣
大滿足
餐後完美的甜點做ENDING
讓人感覺幸福🤤🤤

享用餐點
#阿爾薩斯水煮豬腳$880
#鴨油松露薯條$320
#焦化紅蘿蔔$320
#酥烤千層派$380"
 郭阿布 ,https://www.google.com/maps/contrib/116887449892590306137/reviews?hl=zh-TW,5,True,196,"SEASONArtisanPâtissier
無法去日本吃栗子甜點
那就在台灣吃吧
😭😭😭

#season#栗子船

🌰栗子泥
🍐西洋梨雪酪
🍮焦糖布丁
🍴蘭姆酒巴巴蛋糕
🍇蘭姆酒漬大葡萄乾
🌰糖漬栗子
🍴卡士達醬
🍫巧克力雪酪
🍁秋葉奶油千層酥
🍴可可碎蛋白

#台北美食#台北甜點
#栗子蒙布朗#SEASONArtisanPâtissier
#kuo台北"
 Jessie Huang ,https://www.google.com/maps/contrib/110112637765870299711/reviews?hl=zh-TW,5,True,114,"Amazing!從進門開始就是一場饗宴(文長慎入）
裝潢/氣氛/音樂/貼心服務/茶/甜點/燉飯，無懈可擊！
．
服務生好像有讀心術又很會介紹餐點，還以為她有入股或者全部都是她做似的，連長相都跟餐點ㄧ樣精緻❤️
．
彷彿這間店的宗旨就是沒有平庸，只有驚喜精緻和驚艷（也許我運氣好都點到很好吃的😋
．
甜點-「夏香」，濃濃的巧克力在口中化開，有點過甜隨即而來的是ㄧ抹微酸的水果清香和巧克力搭配的剛剛好，不！是甜與酸完美交織，超．好．吃，沒想過百香果和巧克力這麼搭，層次感十足還以為在喝單一麥威士忌呢"
 Alex Wang ,https://www.google.com/maps/contrib/114834303464610667775/reviews?hl=zh-TW,4,True,264,"這是家在敦化南路的中山醫院附近巷子裡的著名精緻蛋糕甜點咖啡廳，也有精緻好吃的簡餐。咖啡和茶品都不錯。
因為有知名度，在大直明水路的高價住宅區內，也有家新的分店，室內裝潢設計更有現代感，品質也同樣講究。
也許對一般人來說，價位稍微高一點，不過廚房的用心和努力，創造出的相對精緻美味，我真的感覺是值得的。"
 Hsuan-Chih Kuo ,https://www.google.com/maps/contrib/108723021762919627011/reviews?hl=zh-TW,4,True,289,Gardenofsenses許多層次，上頭的莓果咬開的汁液與蛋糕體，外頭的焦糖，裡面的mousse融合，風味平衡很好吃不愧是招牌。Sorbet也清爽好吃，其他的甜點、茶還不錯。
 王雅蘭 ,https://www.google.com/maps/contrib/117974252723480380162/reviews?hl=zh-TW,4,True,50,"麵疙瘩用馬鈴薯製作，很道地！好吃！
但份量不多，小鳥胃者適合！"
 Pei Chen ,https://www.google.com/maps/contrib/108757776070563993999/reviews?hl=zh-TW,5,True,452,真心推薦千層派！配香水草莓跟覆盆莓超好吃❤️
 Wu Ker Shing ,https://www.google.com/maps/contrib/106418131214754082275/reviews?hl=zh-TW,3,True,718,不是你想像中的法式甜點，有點像在吃分子料理的飯後甜點，店家整體裝潢跟幾年前剛開幕差很多，已經失去那種想讓人愜意在店內用餐的氛圍，連吧檯都擺滿商品，看來是外帶生意比較好賺
 Anita Chen ,https://www.google.com/maps/contrib/101462221553191103138/reviews?hl=zh-TW,3,True,35,"點了兩份下午茶套餐，餐點很豐盛，可惜口味偏甜，吃多有點膩

建議飲料搭配茶會比較適合

桌子小座位也小，店面座位全朝外的，陽光特扎眼又讓人覺得熱，若有窗簾能遮擋陽光就更好了"
 毛毛 ,https://www.google.com/maps/contrib/114992367687745298258/reviews?hl=zh-TW,5,True,164,"有層次的美味蛋糕可以感受到主廚的用心
值得推薦老闆和店員都很熱情好久沒遇到
對自家產品這麼有熱情的店家"
 BC ,https://www.google.com/maps/contrib/113145542250526888138/reviews?hl=zh-TW,5,True,142,"阿爾薩斯媽媽塔：350元，附贈杏桃烏龍茶冰沙跟野莓醬，塔的味道偏酸，可以綜合塔皮的膩感，一塊份量算大，可以吃得很有滿足感
感官花園：220元，上面有很多野莓系列，外圍是烤焦糖，內餡是藍莓口味，不酸，很適合女生，甜而不膩
蒙布朗：220元，真的有栗子，建議要搭配底下的塔皮一起入口，甜以及一點點苦綜合，非常好吃"
 YuHsuan CHENG ,https://www.google.com/maps/contrib/103474883852502695788/reviews?hl=zh-TW,1,True,158,"一顆星給無限創意，其他部分真的沒辦法給更多。
1.小甜點中規中矩，極普通，但是本日亮點。
2.本日限定草莓千層酥，份量足，油不好，鮮奶油卡士達口感蓬鬆可是香草香味頗淡，略甜。草莓本身好吃。
3.蘋果花束塔的吐槽點太多。花束的外觀認定標準似乎太寬，焦糖太焦而不是苦香，西洋梨雪酪甜到爆。塔本身中規中矩，優點也是份量足。
4.肉圓，創意無限，無限創意，勇氣可嘉，老闆真是充滿冒險犯難精神的勇者。"
 Steve Yang ,https://www.google.com/maps/contrib/111076628373764069031/reviews?hl=zh-TW,5,True,178,表現令人驚豔的佳餚與甜點。阿爾薩斯水煮豬腳、陸地海裡的牛奶、蜂蜜拖鞋麵包、天使蒙布朗、我的巴黎！
 J.Y ,https://www.google.com/maps/contrib/117547479572427872997/reviews?hl=zh-TW,4,True,"2,197","以甜食為主的法式餐廳~鹹食也非常好吃！盛裝沙拉的是南法著名點心pascade，邊緣吃起來酥脆，後面吃起來像軟軟的可麗餅，和沙拉形成新的搭配；主餐波特酒燉牛尾非常香濃，滿滿的膠質吃起來讓人回味。

甜點波拉克讓人印象深刻，酸酸甜甜的口感配上裡面的creamcheese一點都不會太甜膩；飲料黑松露巧克力也好喝~情人節當天每桌招待一份童趣棉花糖，看起來可愛又甜蜜~"
 Saunter with OU ,https://www.google.com/maps/contrib/102158609460276216160/reviews?hl=zh-TW,5,True,248,"栗子船甜點組合ChestnutParfaitDessertSet

𝑇ℎ𝑒𝑓𝑙𝑎𝑣𝑜𝑟𝑜𝑓𝑎𝑢𝑡𝑢𝑚𝑛,𝑐ℎ𝑒𝑠𝑡𝑛𝑢𝑡𝑖𝑠𝑐𝑜𝑚𝑖𝑛𝑔.
𝐶ℎ𝑒𝑠𝑡𝑛𝑢𝑡𝑃𝑎𝑟𝑓𝑎𝑖𝑡ℎ𝑎𝑠𝑡ℎ𝑒𝑟𝑖𝑔ℎ𝑡𝑏𝑎𝑙𝑎𝑛𝑐𝑒𝑜𝑛𝑡ℎ𝑒𝑝𝑙𝑎𝑡𝑒.𝑇ℎ𝑖𝑠𝑏𝑒𝑎𝑢𝑡𝑖𝑓𝑢𝑙𝑝𝑙𝑎𝑛𝑒𝑡𝑖𝑠𝑟𝑖𝑐ℎ𝑤𝑖𝑡ℎ𝑒𝑥𝑐𝑖𝑡𝑖𝑛𝑔𝑒𝑙𝑒𝑚𝑒𝑛𝑡𝑠,𝐶ℎ𝑒𝑠𝑡𝑛𝑢𝑡𝑃𝑢𝑟𝑒́𝑒,𝐵𝑎𝑏𝑎𝑎𝑢𝑅ℎ𝑢𝑚𝑜𝑟𝑏𝑒𝑡,𝐶ℎ𝑜𝑐𝑜𝑙𝑎𝑡𝑒𝑆𝑜𝑟𝑏𝑒𝑡,𝑊𝑖𝑙𝑙𝑖𝑎𝑚𝑠𝑃𝑒𝑎𝑟𝑆𝑜𝑟𝑏𝑒𝑡...

白露以降，秋意漸濃，就是栗子的季節了!
這艘船拿捏恰當好處的平衡並擁有完美的組合，這美麗的甜點富含令人興奮的元素，糖漬栗子泥、蘭姆酒芭芭、巧克力雪酪、西洋梨雪酪、蘭姆酒漬葡萄乾、巧克力雪酪、西洋梨雪酪、奶油千層酥餅、卡士達醬、蛋白霜...等，一起譜出各種口感與風味

🍽
𝑺𝒆𝒕𝒎𝒆𝒏𝒖套餐𝒐𝒓
𝑨̀𝒍𝒂𝒄𝒂𝒓𝒕𝒆單點

💰
𝑨𝑽𝑮.𝑵𝑻𝑫500~800𝒑𝒑

🕚𝑶𝒑𝒆𝒏𝒊𝒏𝒈𝒉𝒐𝒖𝒓𝒔:
MON-SUN｜1130~2030"
 Connie Tsai ,https://www.google.com/maps/contrib/113820458919158645594/reviews?hl=zh-TW,5,True,59,"幾乎是沒有預訂就吃不到的感官花園，超級美，訂給朋友當生日蛋糕大受好評。
另外買了草莓塔也超好吃的❤️❤️"
 Patricia Kuo ,https://www.google.com/maps/contrib/113841567441981227473/reviews?hl=zh-TW,4,True,16,一早無意間經過的小店！一開始覺得門口的裝潢跟從窗格透進室內感覺滿吸引我。想說吃吃看！沒想到東西都意外的精緻好吃.店員也都很親切。讓我會想再去的店！！
 C ,https://www.google.com/maps/contrib/105166977347774713214/reviews?hl=zh-TW,5,True,64,去的時間為平日五點多，到的時候點心已所剩不多，我們點了千層蛋糕跟其他兩個小蛋糕，都非常好吃，服務也很周到，值得一推！
 M R ,https://www.google.com/maps/contrib/108702615602794535861/reviews?hl=zh-TW,4,True,277,"甜點不錯，但我覺得蛋白糖霜有股腥味
以這個價位來說應該再更細緻一點"
 Bruise Chang ,https://www.google.com/maps/contrib/116952627144234105484/reviews?hl=zh-TW,5,True,375,主菜是令人驚艷的雞胸肉，烤的軟嫩又多汁，搭配柳葉魚酥跟火腿肉塊，還有魚卵杏仁油醬汁，味道跟口感都很富層次！甜點也讓人念念不忘，色香味俱全，下次會跟閨蜜一起點不同口味一次滿足！
 Peggie Sung ,https://www.google.com/maps/contrib/101148743451544430626/reviews?hl=zh-TW,5,True,98,甜點非常好吃，橄欖油雪酪佐蘋果汁令人驚嘆連連！草莓千層派非常酥脆，需要事先預定！
 jade chiang ,https://www.google.com/maps/contrib/106124858048279331339/reviews?hl=zh-TW,5,True,36,服務人員態度良好介紹甜點時也會依照客人喜歡的口味作推薦各式冰茶也很好喝千層派搭配水果真的很好吃雖然價格不低但是很值得哦😊
 Clio C ,https://www.google.com/maps/contrib/118000261975726539352/reviews?hl=zh-TW,5,True,28,"Season最經典的「感官花園」（左一）在高中試過一次就愛上，外層脆脆的焦糖搭上內餡藍莓布蕾，跟蛋糕體上搭上的酸甜莓果類十分合適，難怪是Season屹立不搖的代表作，也是今天我們一致最喜愛的甜點！
而且店員也會熱情來關心餐點滿意，詢問意見，是非常適合來一壺茶放鬆的好店哦！"
 James Hsia (Ezworker) ,https://www.google.com/maps/contrib/113219711930560722913/reviews?hl=zh-TW,5,True,562,服務親切，甜點一極棒，來前最好先訂位，用餐時間90分鐘
 張士新 ,https://www.google.com/maps/contrib/111812904632318037717/reviews?hl=zh-TW,5,True,87,"20週年紀念日來的
剛好遇到換新菜單的第一天
餐點精緻蛋糕好吃
很推薦給沒來過的人記得八點就打烊了
要吃晚餐得早一點去喔"
 BK ,https://www.google.com/maps/contrib/101211084212420881721/reviews?hl=zh-TW,5,False,3,"服務態度非常好👍
出爐的餅超級香的.
很有水準."
 _G Anthony Hsu ,https://www.google.com/maps/contrib/100704815010105169482/reviews?hl=zh-TW,4,True,531,"環境好，有氣氛，空間座位寬敞，甜點水準之上，熱美式咖啡屬淺烘焙有香氣順口,巧遇2017台新圓環音樂祭
再續《藝術擴散計畫—咖啡館的跳舞時光》「舞」進仁愛圓環咖啡館
延續10月初台北表演藝術中心策畫《藝術擴散計畫—咖啡館的跳舞時光》，台新藝術基金會與北藝中心合作，再次邀請編舞家楊乃璇與小事製作舞者們重現《咖啡館的跳舞時光》，將於12月第三個週末(16-17日)仁愛圓環街區的5家咖啡館，呈現10場各15分鐘「滲透性」的演出，由「音樂」啟動「舞蹈」，「舞蹈」則與「生活」巧妙結合，民眾邊喝咖啡的同時，表演就在身邊發生，親密體驗城市就是表演舞台的驚喜。小事製作/楊乃璇、林素蓮、張雅媛、陳詣芩、張汶皓、潘佑熏、沈樂、歐陽志明"
 Cindy Chou ,https://www.google.com/maps/contrib/112730795669632116540/reviews?hl=zh-TW,1,False,16,今早跟貴公司訂蛋糕去店家領取，小心翼翼的拿回來，過程約一小時，雖然當時看的時候是好的，但一打開呈現崩壞狀態。打去店家反映，卻得到店長回覆說可能是搖晃造成、或者天氣太熱，導致崩壞！聽到這樣的回覆感覺很不好，原本開開心心的去領蛋糕，回來卻是慘不忍睹，尤其是店家的回應令人不解？再致電回去建議是否未來可提供保冷劑，或加上透明邊條固定蛋糕，再次得到懷疑帶回的過程中有晃動，且說這是第一次有人反映有這樣的問題，一直反駁客人說法，還傳了人員在店家測試搖晃蛋糕的影片給我！試問若當場從冰箱裡拿出來測試並無天氣之影響，還能相提並論嗎？建議想外帶「感官花園」蛋糕的人請自行斟酌。順帶一提，訂了蛋糕要送人，這要我怎麼送得出去？
 H Rybby ,https://www.google.com/maps/contrib/105171633606913002247/reviews?hl=zh-TW,3,True,306,蛋糕類雖然精緻但與單價相比似乎cp值較低，咖啡味道普通也偏小杯；店內裝潢乾淨整潔。
 Jess Chang ,https://www.google.com/maps/contrib/116827971562975383528/reviews?hl=zh-TW,3,True,129,"官感花園傍晚慶生完先冰起來
隔天一大早焦糖直接融化................
覺得很傷心蛋糕口感也完全吃不出要呈現什麼
但味道還是ok的
蛋糕真的是放不到12小時
想送人這款的必定三思！！！！！"
 陳Debbie ,https://www.google.com/maps/contrib/101419866423587167789/reviews?hl=zh-TW,5,True,117,"巷弄內的下午茶☕️
很適合與閨蜜一起聊天☺️"
 謝依容 ,https://www.google.com/maps/contrib/103972840051397729795/reviews?hl=zh-TW,5,True,252,"感官花園真的很好吃~店員很親切介紹店內商品~回到家雖然有點溶化但仍不減美味!
下次有機會再試試其他甜點~"
 CTL ,https://www.google.com/maps/contrib/101183778021883223062/reviews?hl=zh-TW,2,True,138,"甜點ok
鹹食都蠻普通的
番茄冷湯的冰塊有冰箱味
餐前麵包的肉泥抹醬口味像早餐店的那種豬肉漢堡排"
 angel chen ,https://www.google.com/maps/contrib/107748109434526453777/reviews?hl=zh-TW,5,True,166,"服務餐點都無話可說
氛圍舒服
千層好好吃🥳"
 徵徵 ,https://www.google.com/maps/contrib/117109689460802366393/reviews?hl=zh-TW,5,True,113,"非常好吃的法式料理
點心也非常精緻美味"
 Xaviera Ho ,https://www.google.com/maps/contrib/102889768062443175451/reviews?hl=zh-TW,5,True,379,"Season烘焙坊店中店開張，那個金磚可麗露真的是脆到不行好療癒❤（適合很喜歡啃東西的我）

希望有天可以遇到巴斯克可頌和蘇格蘭蛋胡椒捲來上班！

20220521"
 Cindy Huang ,https://www.google.com/maps/contrib/101368687011434977958/reviews?hl=zh-TW,3,True,120,"有一個朋友大推他們家的草莓千層派（要預訂），所以來吃吃看，千層派真的好吃，皮非常酥內餡很香很實在
其他的甜點⋯⋯就是勝在創意，份量真的很精緻到迷你的程度⋯⋯吃起來的話感覺普通
Cp值覺得沒有很高"
 John Huang ,https://www.google.com/maps/contrib/105193189881100205070/reviews?hl=zh-TW,5,True,321,"令人驚艷的作品
將冰品、水果與烘焙結合的非常完美
味道非常平衡"
 Mandy Jhong ,https://www.google.com/maps/contrib/104610327785058687116/reviews?hl=zh-TW,5,True,110,感官花園蛋糕真的很好吃😋大推給喜愛吃莓果的朋友～～～水果下方是脆脆的焦糖，內陷是乳酪，真的很特別！拿蛋糕時剛好在店內喝杯咖啡，及點一份餐點都不錯呦！
 crack wu ,https://www.google.com/maps/contrib/114131972742518104286/reviews?hl=zh-TW,4,True,61,其實值得這個價錢，今天的創意甜點跟一般的甜點餅乾都很好吃，除了低消比較高之外其實跟一般法式蛋糕沒太大價差，店員老闆也很親切。
