user_name,user_profile_url,rating,local_guide,comment_num,comment_text
 WOW ,https://www.google.com/maps/contrib/106546298325436875543/reviews?hl=zh-TW,3,True,22,"很就沒來season了，有點失望。當天吃了草莓波拉克和黑麥布丁塔。草莓醬和起司搭配頗諧調，中規中矩但很耐吃；布丁塔就有點令人費解，黑麥風味有出來，但質地很怪有分離的感覺，口感不是很好，派皮的部份則是軟掉了（外帶15分鐘內就享用）

服務很棒親切熱情！"
 Lilian Chen ,https://www.google.com/maps/contrib/106245951775339566762/reviews?hl=zh-TW,5,True,"1,134",感官花園令人震驚，大概是我吃過數一數二厲害的生日蛋糕
 Raúl Tsai ,https://www.google.com/maps/contrib/116560647942785770654/reviews?hl=zh-TW,5,True,181,甜點好吃，法國料理很有特色
 Elva Chang ,https://www.google.com/maps/contrib/102371114200653629902/reviews?hl=zh-TW,5,False,15,中午點了義大利麵：清炒培根蔬菜的白花椰很香，番茄鮪魚冷麵好吃不油膩，義大利麵口感很好！加一份手作甜點套餐，我選了夏日的蘋果花束塔。水果冰沙微酸爽口，小三件口感都是意外地好，手作甜點蘋果花束塔是蘋果片用焦糖奶油烤過，直直插好：-）咖啡色是焦糖。現作熱熱的，很好吃！吃了心情很好，也很喜歡大面落地窗。
 charlie Hsu ,https://www.google.com/maps/contrib/113981427907594672535/reviews?hl=zh-TW,4,True,236,招牌莓果塔，整體香氣和風味挺讓人驚豔的，第一次吃感覺不錯
 Elaine chen ,https://www.google.com/maps/contrib/115350309927294700883/reviews?hl=zh-TW,5,True,401,用料新鮮大方，服務人員有讀心術沒說就知道妳需要什麼!!油封鴨好正點❤️❤️❤️鹹甜食都令人滿意，可刷卡大加分😁
 shinmi ,https://www.google.com/maps/contrib/116972107874344350371/reviews?hl=zh-TW,5,True,60,每樣都無雷都超讚👍我超愛吃鹹派這家的派真的好好吃😋甜點🍰也都好好吃啦～我們點的蛋糕吃一口可以吃出層次感😘天呀超推～今天喝了特別的可可茶哈哈😆可可香但是是茶很妙很順口💕
 Lysh Chiu ,https://www.google.com/maps/contrib/109915606598099996374/reviews?hl=zh-TW,5,True,20,店員服務非常親切！蛋糕上的水果豐富，水果和焦糖的酸甜...:P。爸爸不吃甜點的人，竟然吃到第二塊！從沒看過他吃到第二塊蛋糕，最後還稱讚好吃
 Morris Wu ,https://www.google.com/maps/contrib/116698113765116133301/reviews?hl=zh-TW,4,True,198,服務真的很好，女生肯定會喜歡的店吧。價格不便宜，但品質的確在水準之上。現場環境略小，適合2-4人小聚午茶。
 Ling C. ,https://www.google.com/maps/contrib/109603386570727025649/reviews?hl=zh-TW,5,True,64,"數週前和朋友去吃下午茶
一進到店裡，店員親切招呼與解說內用甜點
最喜歡他們家的千層派跟sainthonoré🥴🤤
還有蠻意外mariagefrère家的茶葉用成冷泡茶會這麼順口～
雖然他們家整體價格不低
甜點很精緻而且真的很好吃😭😭
我覺得是很值得一試的法式甜點店喔！"
 Cybill Liu ,https://www.google.com/maps/contrib/115093781779446199479/reviews?hl=zh-TW,4,True,105,甜點精緻，服務態度良好，桌間距離寬敞，但是消費頗高，小朋友快速出走。
 Wei-Wei Sun ,https://www.google.com/maps/contrib/116811138307402457492/reviews?hl=zh-TW,4,True,23,現烤的千層派酥脆美味，酸甜剛好，非常推薦；國王餅現烤要等很久，適合喜愛巧克力的人，搭上法國瑪黑茶，是個幸福的下午時光
 Chiayu Chang ,https://www.google.com/maps/contrib/114995715024873667054/reviews?hl=zh-TW,5,True,95,宅配服務也很可靠
 Yang-Ming Huang ,https://www.google.com/maps/contrib/116132481025124307565/reviews?hl=zh-TW,5,True,81,食物品質很好，價格算是公道，若要享受一下的時候，會考慮去這裡。
 Alan Tsou ,https://www.google.com/maps/contrib/110595423642407815817/reviews?hl=zh-TW,4,True,138,甜點很多選擇，他的下午茶套餐很特別，最令我驚豔的是蛋糕，外層烤了一層焦糖，不是螞蟻也會喜歡哦
 crystal chen ,https://www.google.com/maps/contrib/112673914495852430717/reviews?hl=zh-TW,5,True,428,甜點和義大利麵都很好吃，服務人員超親切的
 Jessie Liu ,https://www.google.com/maps/contrib/112027079718130742162/reviews?hl=zh-TW,5,True,78,氣氛悠閒，店員美麗親切，甜點很美麗而且口味豐富有創意，送禮也絕對不會失望!
 Mina Chou ,https://www.google.com/maps/contrib/112852431131309789361/reviews?hl=zh-TW,4,True,268,"千層蛋糕很好吃！皮很酥脆！
用餐環境舒服，服務態度佳～適合聚會！"
 Vanessa Liu ,https://www.google.com/maps/contrib/107120780957355882793/reviews?hl=zh-TW,4,True,119,"蜂蜜拖鞋吐司真的超級好吃😋
餐點中規中矩，甜點樣樣驚喜❤️"
 Lala Hey ,https://www.google.com/maps/contrib/106499643249321355484/reviews?hl=zh-TW,4,True,163,"店裡不大，用餐環境舒服餐點精緻
下次會想試試甜點"
 Gimi Kao ,https://www.google.com/maps/contrib/108624316156838662976/reviews?hl=zh-TW,4,True,468,甜點好吃不膩。服務超好。空間燈光可以再更柔和些
 Sandy Tsai ,https://www.google.com/maps/contrib/101703399854299765027/reviews?hl=zh-TW,4,True,73,"酥烤千層派、盆栽2.0、感官花園
三種甜點都好吃，很特別"
 Ting Chuang ,https://www.google.com/maps/contrib/116870083807298539795/reviews?hl=zh-TW,1,False,17,第一次覺得不錯第二次吃覺得不好吃水果和蛋糕體變得很不搭裡面內餡的莓果類有種藥水味不喜歡
 Jeff Hsu ,https://www.google.com/maps/contrib/112710367460540006661/reviews?hl=zh-TW,2,False,9,"上週去店內用餐，用餐體驗並不佳
內用帶位沒明確的指示，揮手示意點餐
也並沒有服務人員前來，還得走到櫃檯詢問
才有人員前來點餐，服務人員也並未主動告知店內有低消，隨後點餐完才說，
店內也無空調，用餐時感到空氣很悶
蛋糕部分吃起來的確特別，但是價位真的偏高
用餐體驗過後會覺得服務費收的不值"
 EMMA YU ,https://www.google.com/maps/contrib/109997158011035237508/reviews?hl=zh-TW,5,False,18,"服務餐點都無話可說
氛圍舒服
蘋果塔好好吃🥳"
 Fang Qi Liu ,https://www.google.com/maps/contrib/101434199395004414041/reviews?hl=zh-TW,5,True,10,"咖啡好喝,環境不大,桌跟桌比較近人多就會覺得較吵雜!但整體而言是不錯的"
 張文山 ,https://www.google.com/maps/contrib/108325871348157081079/reviews?hl=zh-TW,5,True,318,燉飯松露味十足，清爽不膩，蔬菜脆爽，等候現烤的千層派，酥脆不甜膩，
 王姿穎 ,https://www.google.com/maps/contrib/101298486463921595683/reviews?hl=zh-TW,5,True,24,"1、店內環境佳、氣氛好，服務人員親切
2、感官花園真的很棒，但是粉紅莓果真的有點酸"
 Anson Chen ,https://www.google.com/maps/contrib/109312088892537108852/reviews?hl=zh-TW,3,False,7,蛋糕精緻好吃，但外帶包裝讓我感受不到該店對產品的重視。當日購買四個小蛋糕，因為其中的兩個較高，店內提供的外帶紙盒無法闔上否則會壓到，只好用透明膠帶左右黏著；擔心騎車震盪會傷了蛋糕於是當天坐公車前往購買，店員表示雖無提供保冷劑但離開冷藏三十分鐘左右是可以的，結果吃到的是底部濕軟的蛋糕⋯可惜了，如果對外帶客人貼心一些的話會更好。
 Chialing Kung ,https://www.google.com/maps/contrib/111290386627122922454/reviews?hl=zh-TW,4,True,87,生日老公送的蛋糕！價格很適合大日子拿出來用，很好吃喔！
 朱展輝 ,https://www.google.com/maps/contrib/108031611688213169082/reviews?hl=zh-TW,4,True,394,麵包沾橄欖油真好吃，豬排好嫩
 ravity G ,https://www.google.com/maps/contrib/111933390232612964435/reviews?hl=zh-TW,4,False,141,給3.5顆星，酥烤千層派好吃，但低消為一杯飲品和蛋糕，整體CP值一般般
 cherry ,https://www.google.com/maps/contrib/102937094445049686271/reviews?hl=zh-TW,5,True,69,平日下午人不多，用餐氣氛舒適，甜點一樣水準很好！
 Huangいさお ,https://www.google.com/maps/contrib/110064105449273228529/reviews?hl=zh-TW,5,True,141,點超級蒙布朗可以進入廚房觀看製作過程，對甜點有疑問的地方店員也都很認真的解釋
 N. P. ,https://www.google.com/maps/contrib/117399634692748980602/reviews?hl=zh-TW,5,True,259,台北最愛的店之一，甜點鹹食都很棒。
 Tseng Tien ,https://www.google.com/maps/contrib/105127719336862897343/reviews?hl=zh-TW,5,True,18,甜度剛好的閃電泡芙+膠囊咖啡，令人回味無窮。
 Angela Tang ,https://www.google.com/maps/contrib/107230236218605764193/reviews?hl=zh-TW,1,True,181,以前有買過感官花園，蛋糕雖然好吃，但現在被接電話的服務人員態度嗆到不想買了。
 Alfred Lu ,https://www.google.com/maps/contrib/108965834541773300651/reviews?hl=zh-TW,1,False,6,5/9~5/15要清消你5/11才寄信說取消？搞什麼鬼，如果沒有要開店就不要開網站的訂單或放公告有很難嗎？
 Ken S. ,https://www.google.com/maps/contrib/117751247028791535049/reviews?hl=zh-TW,5,True,199,用餐環境舒適，餐點口味級及食材都不錯，黑咖啡的口感也順口不帶酸！
 丁佳伶 ,https://www.google.com/maps/contrib/109278936619244096059/reviews?hl=zh-TW,4,True,77,"店員介紹ㄉ很讚！
情感爆炸很好吃～"
 阿旺 ,https://www.google.com/maps/contrib/100218759794871414979/reviews?hl=zh-TW,4,True,119,蛋糕甜點好吃可能是太忙了坐在裡面一陣子才有人招呼我們
 George Hu ,https://www.google.com/maps/contrib/116723912043666963106/reviews?hl=zh-TW,5,True,100,特別的下午點心有別以往都是甜食，來這吃吃蔬菜花朵捲吧！
 Jennifer Hung ,https://www.google.com/maps/contrib/103760186336720720591/reviews?hl=zh-TW,5,False,11,"好好吃喔！鹹食跟甜點都好無敵
沙拉外面的烤麵粉蛋皮真的太美味了😍😍😍"
 Angel Ko ,https://www.google.com/maps/contrib/102927946968887593767/reviews?hl=zh-TW,5,True,85,"感官花園是生日蛋糕首選！
可愛又好吃！酸酸甜甜的好滋味"
 Vanessa ,https://www.google.com/maps/contrib/100248470172666830461/reviews?hl=zh-TW,4,True,195,下午茶時間選一個有葡萄柚的甜點，酸中帶點苦，是個有很多層次的創新甜點。服務也很好，可惜低消是一個甜點+一杯飲料，有點太多
 鄧運隆 ,https://www.google.com/maps/contrib/106697669532743185771/reviews?hl=zh-TW,5,True,29,感官花園果然名不虛傳，大家都吃的很喜歡，獨獨美中不足的地方是價格不斐，非重要日子可能只能遠觀。
 WEI LU ,https://www.google.com/maps/contrib/101938546591418137167/reviews?hl=zh-TW,2,True,134,"莓果稍酸吃起來好硬像是冰淇淋
店員說本來就是這個口感不喜歡可以提前說
我沒有不喜歡⋯也只是第一次吃
所以才詢問吃起來像冰淇淋口感是正常嗎
帶去聚餐剩好多覺得傷心😢"
 suya Hong ,https://www.google.com/maps/contrib/117390125376204877076/reviews?hl=zh-TW,5,True,38,服務品質不錯也好吃雖然價位高了點不過是可以再來的。
 林宥 ,https://www.google.com/maps/contrib/111669113189597619342/reviews?hl=zh-TW,5,True,115,"今天買感官花園幫朋友慶生
成功滿足了不愛吃鮮奶油的朋友
撥電話詢問時非常有耐心
到現場取貨時服務態度也很好"
 Jj HUNG ,https://www.google.com/maps/contrib/107365091192305421787/reviews?hl=zh-TW,2,False,24,內用低消400/人偏貴，店員人很好讓我外帶一個翻轉蘋果塔達標，但回家食用的時候發現蘋果塔有點濕濕的，不知道是不是沒有烤得不夠。
 Qilian ,https://www.google.com/maps/contrib/113035859762920911560/reviews?hl=zh-TW,5,True,26,感官花園外焦糖酥脆、內口感綿密，搭配著各種莓類，讓人倍感幸福👍👍👍
 Yu Sophia ,https://www.google.com/maps/contrib/106590190217863434560/reviews?hl=zh-TW,4,True,"1,052",與大直的餐點有所不同，現做千層派是招牌，餐點有巧思且味美！
 米米粒 ,https://www.google.com/maps/contrib/105191841654773249859/reviews?hl=zh-TW,5,True,32,烤的脆脆的甜焦糖很搭酸甜內餡與莓果
 Fun LI ,https://www.google.com/maps/contrib/113372101862101835625/reviews?hl=zh-TW,4,True,34,"甜點創意豐富
鹹食味道也不錯"
 Nina Lu ,https://www.google.com/maps/contrib/104181128247056491083/reviews?hl=zh-TW,5,True,35,服務態度很好，自從吃到了感官花園，每週都想盡各種藉口去買感官花園，生日蛋糕從此就只買感官花園！
 Sean Li ,https://www.google.com/maps/contrib/107889702875885476915/reviews?hl=zh-TW,5,True,70,外帶感官花園蛋糕，有點焦糖感的外皮，蛋奶主題像冰砂一樣清爽，覆盆子醬香氣非常細膩，好喜歡，家人分完以後覺得根本想馬上訂第二個
 Ace ,https://www.google.com/maps/contrib/110117494683635015370/reviews?hl=zh-TW,5,True,69,真心推薦，外盒精緻蛋糕超級漂亮又好吃！
 侯蕾蕾 ,https://www.google.com/maps/contrib/102341578898285327292/reviews?hl=zh-TW,5,True,676,精緻好吃的餐點，感官花園好美又好好吃😋
 Euphy Hsu ,https://www.google.com/maps/contrib/113490120946153056889/reviews?hl=zh-TW,5,True,138,第一次在朋友的生日宴上吃到莓果蛋糕，驚為天人，口感綿密，馬上就打電話預定想外帶回家享用。
 E Fun ,https://www.google.com/maps/contrib/103729326127500076786/reviews?hl=zh-TW,5,True,133,感官花園蛋糕價格高了一點但內容物非常扎實推薦！布丁味道也非常棒～
 peggy lee ,https://www.google.com/maps/contrib/117653195381649141433/reviews?hl=zh-TW,4,True,378,蛋糕好吃！中間是莓類慕斯加底部濕潤又充滿焦糖香氣的蛋糕體。但是價格不便宜，6吋$1200
 Dana Lin ,https://www.google.com/maps/contrib/105883792825366273925/reviews?hl=zh-TW,5,True,795,"感官花園，很挑動感官。完全被繽紛莓果吸引、切開蛋糕，還有驚喜😃。酸甜合宜的味道，焦糖布丁融合近似冰淇淋口感的內餡，極特別的蛋糕體驗❤。
大人和大孩子都很喜歡這款蛋糕，只是有嗜甜小孩吃不慣覆盆子酸味，打退堂鼓😃😅。"
 Yu-Chin Lin ,https://www.google.com/maps/contrib/111494816432159668275/reviews?hl=zh-TW,1,True,107,"一週前訂位，要紀念家庭節日，結果被帶到廚房用餐，廚房裡拉一張鐵桌子這真的是座位嗎？還一副無所謂的樣子，這不是不喜歡就走人的問題，整個假日的規劃及心情都被破壞了。
看之前的留言就知道，這家店是有小編在回應顧客意見的，但對我的遭遇及留言卻是毫不理會，只能說惡劣了吧。

詳情如下
------------------
三年前來過，吃甜點，很好吃，座位寬敞，擺飾很美。
三年後的今日抱著期待，還在一週前訂了四人位，打算中午用餐兼吃甜點，然而到訪時，卻是荒腔走板不足以形容。
店內的座位只剩下以前的一半不到，僅有的一張四人桌也有人坐了，帶位的男性說帶我們到後面坐，還以為後面別有洞天，哪知是帶我們到廚房，有張八人坐的大鐵桌，就讓我們就坐。
坐在廚房裡面的大鐵桌，旁邊就是冰箱，然後好整以暇的向我們介紹一人一千元的高價餐點及數百元的甜點。
我們質疑，這真的是貴店的位子嗎？男性服務生肯定的說""是的""。
向另一位女服務生反應，說我一週前就訂了，也沒被告知座位已滿要坐廚房，還是你們打從心底覺得坐廚房和坐外面是一樣的用餐品質？
女服務生連忙說幫我們換位子，但是外面正常的座位根本沒有四人桌，只好勉強將兩張兩人的小圓桌併起來，我們已經興致全失，就離開了。
如果店家真心認為坐在四周都是冰箱及廚具，還不時有工作人員發出聲響的廚房用餐，品質和坐在一般座位是相同的，那請將網頁上的照片加上廚房內的用餐環境，不然就是欺騙。
很可惜我沒將廚房內的用餐環境照下來發布，這和貴店網頁上的用餐環境是天壤之別，這樣收相同的價錢合理嗎？
一週前訂位，被安排在無法接受的廚房內用餐，也沒事先告知，這不是不想吃就走人這麼簡單的事情，整個安排好的用餐計畫都被破壞了。男服務生的應對及認知也令人為之氣結。
很糟糕的一次經驗。"
 許hiyu ,https://www.google.com/maps/contrib/114399023761936436838/reviews?hl=zh-TW,5,False,2,"用餐環境舒適
感官花園很好吃！😋😋😋"
 lipu yeh ,https://www.google.com/maps/contrib/107106614580277405524/reviews?hl=zh-TW,4,True,406,"價格因為加了冰淇淋比較貴
草莓千層不錯
但距離最吃過最好吃的還有一點距離
其他的沒吃"
 鄭婷文 ,https://www.google.com/maps/contrib/100979745555436158517/reviews?hl=zh-TW,5,False,44,慶生為朋友準備了感官花園蛋糕，蛋糕視覺與味覺上都很滿意，價格偏高。
 GaGa Lee ,https://www.google.com/maps/contrib/113613953650151296328/reviews?hl=zh-TW,5,True,216,"招牌莓果蛋糕既漂亮又美味
就是價格高了點
滿滿的莓果中間夾帶著像是乳酪慕斯的內餡"
 se fu lee ,https://www.google.com/maps/contrib/105718467612615448117/reviews?hl=zh-TW,5,True,956,好吃有特色，櫃檯小姐親切，推薦
 Liu chia ,https://www.google.com/maps/contrib/104660083929999772725/reviews?hl=zh-TW,5,True,54,價格偏中高，不過蛋糕很美味，偶爾可以奢侈一下
 Hardin LEE ,https://www.google.com/maps/contrib/107479478352543155405/reviews?hl=zh-TW,5,True,112,"這家的甜點非常有特色。客人絡繹不絕。
點了水果蛋糕。果香味很足，蛋榚潤濕可口。
咖啡也好。低銷400元。"
 李麗琴 ,https://www.google.com/maps/contrib/110974129334412308140/reviews?hl=zh-TW,5,False,1,"剛換新的餐點.點了""魚卡在薯片"",退還附—份時蔬沙拉.極具特色又好吃"
 Jessica Tseng ,https://www.google.com/maps/contrib/110278217023253748943/reviews?hl=zh-TW,4,True,210,餐點與甜點都不錯，但價格略貴
 Mela Abby ,https://www.google.com/maps/contrib/116988997571941240191/reviews?hl=zh-TW,5,True,15,感官花園非常好吃！！！買過好幾次，每一次的品質都很有水準！送給朋友大家都很喜歡，外型好看又好吃，吃完還想再吃😋絕對是值得送朋友的前三名蛋糕！大推！
 林昆合 ,https://www.google.com/maps/contrib/102741114867363437845/reviews?hl=zh-TW,2,True,130,千層酥的千層有些許油耗味，卡士達內餡鮮奶油比例太多吃不到香草味道
 Jonathan Liu ,https://www.google.com/maps/contrib/101136760988477051159/reviews?hl=zh-TW,5,True,100,"現做的甜點讓人驚豔
味道和口感都很棒！"
 吳梅英永信會計師事務所 ,https://www.google.com/maps/contrib/109282906468815216485/reviews?hl=zh-TW,1,False,1,2/12購買感官花園8吋但糕，蛋糕竟然沒有蛋糕體，這是我第四次購買的商品，在切的過程整個蛋糕下塌，切到第四片整個糊掉，真的很失望，下次不會再推薦朋友了，也不會回購了
 影片EA ,https://www.google.com/maps/contrib/106645694589974482092/reviews?hl=zh-TW,5,False,10,"雖然太晚到快打烊了
但櫃台人員還是招待了甜點
超級大心🥰🥰🥰"
 Vivi Huang ,https://www.google.com/maps/contrib/113005545293631839776/reviews?hl=zh-TW,5,True,69,招牌蛋糕🎁感官花園不只外觀好看，視覺跟味覺通通顧到了，超厲害的蛋糕
 Joanne Huang ,https://www.google.com/maps/contrib/114326686172054597729/reviews?hl=zh-TW,4,True,131,水果塔很好吃！奶油也很綿密～
 violeste c ,https://www.google.com/maps/contrib/112104079773052848743/reviews?hl=zh-TW,5,True,264,"當天來外帶甜點時沒有太多單片蛋糕選擇，後來選了店員推薦的感官花園。蛋糕價位偏高，但從外觀來說就覺得應該會符合期待，光外型就像很美的藝術品。
內餡的crème很細緻滑順，蛋糕體是鬆軟的杏仁蛋糕，最外層是像烤布蕾上層的脆焦糖，所以從內到外的口感層次鮮明非常豐富。再加上豐富的水果topping，當偏酸甜的果汁搭上蛋糕體的甜味，真的是絕妙！蛋糕不便宜但完全值得，我下次絕對會想要再試試其他甜點。"
 Nilson Cheng ,https://www.google.com/maps/contrib/113892192647935129770/reviews?hl=zh-TW,5,True,78,美味又不甜價格實在👍
 蔡ㄚ ,https://www.google.com/maps/contrib/104179236519644844620/reviews?hl=zh-TW,3,True,66,個人偏好不太甜的蛋糕，所以這次訂的感官花園蛋糕不太適合我們家的口味，但水果滿滿的蠻有誠意
 Daniel Chou ,https://www.google.com/maps/contrib/110718455078148376811/reviews?hl=zh-TW,4,True,72,餐的部分中規中矩還過的去，甜點還是做的不錯，下午茶時間來吃甜點還是比較推薦一點。
 Wuuu ,https://www.google.com/maps/contrib/107156893644859177789/reviews?hl=zh-TW,5,False,48,"從外到內品質沒話說的甜點，尤其""感官花園""除了細緻繽紛的外觀，口味搭配的也特別卻和諧好吃，拿來當生日蛋糕送人賓主盡歡~"
 Chuppy ,https://www.google.com/maps/contrib/107394329345892205274/reviews?hl=zh-TW,5,False,12,餐點十分有水準牛肚、麵包、豬腳非常好吃調味跟用料都很好，有很多香料加上一些台灣在地食材做變化，讓味道多了層次，不是隨便的簡餐而是真材實料的前菜主菜。另外草莓千層派真的必須點！！！！這家的甜點真的有夠好吃鮮奶油草莓千層派都是一時之選大的感官花園蛋糕也真的很好吃老闆很用心在經營我認為是對的起價錢推薦～（在意cp值的客人真的去饗食天堂拿免費蛋糕就可以囉^^）
 川頁貿 ,https://www.google.com/maps/contrib/100920792586545150361/reviews?hl=zh-TW,5,True,481,好吃，但錢包君會哭哭唷，要有心理準備
 Sharon L. ,https://www.google.com/maps/contrib/104888458034719424955/reviews?hl=zh-TW,5,True,46,感官花園，官網上的圖片實在太吸引人了所以訂了，價格不斐。真的非常驚豔，名符其實的感官體驗，漂亮又好吃。
 Jose Lin ,https://www.google.com/maps/contrib/113282698750633160801/reviews?hl=zh-TW,5,True,318,先存起來，來吃過再補照片。
 Chen Wei Tseng ,https://www.google.com/maps/contrib/115137810203587132539/reviews?hl=zh-TW,5,True,47,主廚精通法式，德式，歐洲料理。反正我就知道很好吃的料理。可以打開味蕾的百寶盒讓你節食的計劃瞬滅。加上致命的點心，蛋糕，和每次來他又換主菜。絕對不會膩。拖鞋麵包也有夠棒。服務妹妹們也超級無敵漂亮和親切。寫著寫著都感覺自己在寫業配文了。反正太太大人很開心。女兒們也很開心。晚上我也會很開心～記得預約一下，主廚可能有驚喜料理要準備幾天。
 Longman Weng ,https://www.google.com/maps/contrib/101635088852068390111/reviews?hl=zh-TW,1,True,48,店員都有戴口罩，但一位男性主管站櫃台側卻沒戴口罩，不斷侃侃而談介紹產品，卻絲毫沒有認知到食品業在防疫期間該有的注意
 Chen-Yen Liao ,https://www.google.com/maps/contrib/111033913968636670078/reviews?hl=zh-TW,4,True,202,甜點都很好吃，精緻且份量算滿大，適合幾個人一起去分享。容易沒位子，有時候有點難訂
 Shu-Ting Chang ,https://www.google.com/maps/contrib/101584922367086163849/reviews?hl=zh-TW,3,False,10,甜點很好吃，但是網站上訂購明明選了宅配，卻還是要人填到店取貨日期與時間，工作人員還在應到的宅配日期打電話來告知記得到店取貨，後來才說是店員未注意，所以沒有宅配出去，結果比原定日期晚一天送到，真的很糟糕
 Rebecca Peng ,https://www.google.com/maps/contrib/107805161514664028858/reviews?hl=zh-TW,5,True,265,朋友送的禮物，很美味！包裝設計都很滿意
 臭臭 ,https://www.google.com/maps/contrib/104608414658672498547/reviews?hl=zh-TW,5,False,5,"這裡的員工真的出乎我意料細心！
在6月底的時候因為幫朋友慶生第一次踏進這間店，外帶了蛋糕也都是笑容可掬的員工替我服務跟打包，再下一次光顧就是7/18外帶了蛋糕
結果！幫我結帳的女性員工直接認出我也很親切問我說上次蛋糕喜不喜歡！真是讓我驚訝不已也會再回訪的！謝謝您們❤️❤️❤️"
 Grace Chiang ,https://www.google.com/maps/contrib/103452232155615116301/reviews?hl=zh-TW,5,True,124,都是手作的甜點～～非常推薦千層派！！
 郭明麗 ,https://www.google.com/maps/contrib/108552910563870409322/reviews?hl=zh-TW,5,True,79,選擇店家的招牌蛋糕，滿滿的新鮮莓果鋪在蛋糕上，漂亮的裝飾，吃起來有香濃的卡士達餡、新鮮的莓果醬及焦糖烤得恰到好處。非常好吃。價位屬高價位，不過很值得！
 Kay Wen ,https://www.google.com/maps/contrib/105352748602473395444/reviews?hl=zh-TW,5,True,80,環境氣氛都很好，工作人員對蛋糕的解釋很詳細，服務親切。喜歡鹹蛋黃餅乾，很好吃！也喜歡栗子船，不過份量較建議兩人一起享用，口味偏重，麵包體有泡2種不同口味的酒，酒味明顯！
 VIVI Chiu ,https://www.google.com/maps/contrib/104597561485015990152/reviews?hl=zh-TW,5,True,183,現做的甜點都超好吃的而且店員都很貼心
 小方糖 ,https://www.google.com/maps/contrib/101625687270143178589/reviews?hl=zh-TW,4,True,675,甜點超花俏好可愛
