user_name,user_profile_url,rating,local_guide,comment_num,comment_text
 吳怡潔 ,https://www.google.com/maps/contrib/111357957639865722196/reviews?hl=zh-TW,2,False,2,"在南京店用餐點了雙人套餐(石頭火鍋+辣子雞鍋),用餐期間僅拿了一個菜盤+2杯飲料+2疊沾醬.......""整個桌面就滿了"",目測雙人桌的大小只有約70x80cm,等服務人員上肉盤上來時桌面幾乎是沒有空間能放的下,服務人員就站著看要我們自己挪出空間來讓他放下手上的肉盤,這個肉盤是以類似tray盤相疊的方式呈現,其實和其它一般火鍋的肉盤來的省空間了,就算如此還是沒空間放的下,就可以知道這樣的桌面有多不可思議的小了,如果我們二位是各拿一個菜盤試問上來的肉盤是要放到哪裡去??我必須說這是我來所有王品系列裡最讓人不舒服的一個用餐空間了,為了要增加容客量,而把桌子的空間設計的這麼小,和鄰桌的距離也不到50cm,一樣的價格我寧可去築x鍋物,用餐過程中就看到周遭的客人的菜盤和肉盤掉落桌面的情形,我的身形都已經是一般了,如果對身形比較大的人是不是就更不友善了,擠在那樣的小桌子吃飯真的<很不舒服>"
 周欣穎 ,https://www.google.com/maps/contrib/110360849578283023174/reviews?hl=zh-TW,5,False,5,很喜歡剝皮辣椒雞湯！還有蒜頭雞湯！第一次來南京店用餐，覺得服務員都很親切！謝謝服務員佳玉紫綺和菇菇！ps.霜淇林尬麵茶加黑糖醬，推推！
 ren ,https://www.google.com/maps/contrib/101289800598792566596/reviews?hl=zh-TW,3,False,4,口味還不錯，不過可能是外帶，肉吃起來有點粉粉的。領取餐點時，店員請我稍等，先結了後面內用的客人，原以為是我的外帶餐點還沒好，結果不是！！難道內用的客人都一律優先處理嗎？內用客人搞不清楚狀況走到旁邊要求結帳，店員引導她們到我後面排隊是對的，但聽到我是外帶竟要我先等候，然後先結她們，讓人很不開心。另外我訂單有選需免洗餐具也沒附上，讓我走到一半又折返去拿...加油喔！
 齊亮 ,https://www.google.com/maps/contrib/108730812315721706355/reviews?hl=zh-TW,1,False,2,五星評論應該都是用點心換的吧？點蒜頭雞餐少放肉只給湯頭原本就有附的肉，跟店員反應也是愛理不理，直到第三次講才補上一份肉，另外店員教育訓練明顯不足，一個男的只顧自己上菜跟收桌講話不清不楚，跟他要筷子假裝沒聽到，收桌時客人要出來也不會讓一下。
 陳染汛 ,https://www.google.com/maps/contrib/116055531367496992772/reviews?hl=zh-TW,5,False,12,"超推剝皮辣椒雞，湯頭微甜，正是我愛的湯頭口味❤️這次跟萬波合作冰淇淋超好吃的！！淋上黑糖超香～～大推，非常滿意還會再訪
辣子雞真的有辣還帶麻，湯頭煮到後面會有點過鹹…"
 May ,https://www.google.com/maps/contrib/110435269150029891450/reviews?hl=zh-TW,1,False,2,"超級失望的一餐，不會再來了！自助吧東西超級少就算了，自助吧的火鍋料吃起來就是最爛的那種！大集團旗下的公司⋯？？ㄜ⋯⋯⋯
麻煩拜託去築間吃看看什麼叫好吃又有誠意的火鍋
兩家比起來價位沒差多少"
 JungChih Chien ,https://www.google.com/maps/contrib/107044702059619314107/reviews?hl=zh-TW,3,False,182,"10/12晚上八點半許B8桌，直髮及腰的小姐，服務態度不好
明明還有很多位置，且客人在排隊
櫃檯小姐其中一位在滑手機，少部分員工需要再教育
大部分還是很認真，感覺不會想再來
加99元的雞肉，是湯底的老雞肉很難吃
飯後甜點很早就上桌放著冷，還號稱台式料理…好像不對吧！
服務優先的王品集團，讓人很失望
希望現場能有主管可以顧著，不要讓年輕小朋友亂搞"
 鄭小君 ,https://www.google.com/maps/contrib/110312681477489429181/reviews?hl=zh-TW,1,False,26,"我很少給負評。

但今天覺得花的很不開心，覺得單價中等，品質卻比一般火鍋店還不優，我想這是最後一次了。

我們特別從南港搭車前往，有打電話訂位，時間快到了，怕趕不上有打電話通知，說我們到了就直接進來即可，我問不然改時間呢？竟然說後面都滿，最後才說目前都有位子，這樣的回答，讓我覺得很怪⋯⋯

到了現場，也沒多跟我們介紹該如何點餐，所以我們點的很亂，另外有個疑問低消1人279元，我們想點雙人套餐，那金額已經999，為何只限定2人而以，其餘人還需要共鍋費呢？很不能理解？？"
 Emily ,https://www.google.com/maps/contrib/115440300611886043533/reviews?hl=zh-TW,4,False,5,"回訪過N次，食材新鮮
湯頭口味都很讚
但這次的剝皮辣椒雞湯頭相較之前淡了許多
生意太好過於忙碌餐檯整潔有待加強～"
 Shin Wu ,https://www.google.com/maps/contrib/109987671033495366842/reviews?hl=zh-TW,2,False,3,昨晚第一次吃這家，東西好吃，大多數店員態度都非常好，但要吃霜淇淋的時候小湯匙沒了，另一位別桌的男客人向一位女店員反應，但女店員看起來很不耐煩，去廚房拿小湯匙出來的時候，以為她會補回放小湯匙的桶子裡，但沒想到她居然把整把湯匙通通塞進男客人手中然後轉頭就走，真的蠻傻眼的⋯
 H. C. ,https://www.google.com/maps/contrib/105442557527875748898/reviews?hl=zh-TW,1,False,5,"蛤蜊鍋只有7顆蛤蜊，剝皮辣椒鍋吃不到剝皮辣椒的味道，石二鍋都比尬鍋好吃，雙人套餐的石頭火鍋也是，只感覺一堆油，點了兩份雙人套餐失望無比，套餐的白糖炸雲朵又油又甜，冷掉後好像在咬橡皮筋，青菜自助餐台沒有整理凌亂不堪，醬料區超髒，以後絕不會再去尬鍋，這個價位聚的品質更優。
最後，壽星禮這部分，只能說寧可別送，吃了一口就吐出來了"
 Doris ,https://www.google.com/maps/contrib/112975996030132433792/reviews?hl=zh-TW,1,False,10,"7/11晚上外帶了一份剝皮辣椒雞
怎麽撈都沒有剝皮辣椒，也完全喝不出有剝皮辣椒的味道（我快篩過確定沒確診）⋯⋯我本來很期待的說，結果是巨大的傷害😮‍💨
一顆星是給服務親切的櫃檯人員"
 tlkm0216 ,https://www.google.com/maps/contrib/114589874283673154225/reviews?hl=zh-TW,1,False,1,"用餐時加點了兩次肉，第一次點四盤來一盤之後等15分鐘都沒上肉，等再次告知人員後才補上後續的三盤，第二次加點肉一盤許久未上，當人員來告知用餐時間快要到時，反應還有一盤加點的肉未上，每次加點人員都會拿新的帳單放在座位旁，要結帳前有確認過金額為2700多，當到櫃檯結帳時，卻變成2900多，最後一次加點的肉變成兩盤

當同行友人再三確認被多key一盤肉後才收原本的價格，要灌單也不是這種做法"
 陳盈廷 ,https://www.google.com/maps/contrib/103473584104099297746/reviews?hl=zh-TW,2,True,76,"認真覺得湯底可以更好更入味，有點可惜。梅花豬口感不錯，辣子爆雞的雞肉部分沒炒入味。
自助火鍋料區沒有特別驚艷的食材，唯一覺得還不錯的是米血。同行者表示凍豆腐味道有點….母湯。
冰沙我個人最愛芭樂，甜而不膩。
霜淇淋配紅豆還不錯，珍珠可以再留意Q度。

服務人員滿親切和積極的，雖然感覺得到妳很緊張，但還是很積極和我們介紹菜單，謝謝妳：）"
 KaiDir ,https://www.google.com/maps/contrib/112695224144327856434/reviews?hl=zh-TW,5,True,54,蒜頭蛤蜊雞鍋，蒜香夠味、板腱牛肉辣子爆雞鍋，香辣帶勁。自助吧的蔬菜和鍋料也不錯，喜歡豆奶的霜淇淋。
 Fumiko ,https://www.google.com/maps/contrib/100460754730444527971/reviews?hl=zh-TW,5,False,1,"有別於一般火鍋湯底，
這次點的是蒜頭雞和剝皮辣椒雞的湯底。

推薦想嚐鮮的新朋友！"
 Sherry Tseng ,https://www.google.com/maps/contrib/106640918800004024383/reviews?hl=zh-TW,5,False,3,我是疫情期間的外帶常客，雖然外帶時少了菜盤，路程不算近，由店內員工馬上補貨到府，還加碼作了補償，服務到位，外帶也是能有五星級的服務，超棒！
 minfang shih ,https://www.google.com/maps/contrib/115721031024950267206/reviews?hl=zh-TW,5,False,7,食材新鮮，沾醬好吃，空間舒服，是個可以吃很飽的地方
 林孟榛 ,https://www.google.com/maps/contrib/103836926547130705725/reviews?hl=zh-TW,1,False,5,"9/23晚用餐感受很差！爲什麼兩人不是兩個鍋，而是ㄧ鍋鴛鴦鍋？還收兩鍋的錢？不合理吧！鴛鴦鍋就收ㄧ鍋的錢啊而不是多收？王品集團旗下的也太爛了吧！第一次聽到鴛鴦鍋收兩鍋的費用！然後限用餐1小時半是能吃什麼鬼？是怕人吃垮自助吧還是怎樣？服務態度有夠差！六人訂位也沒有坐一起，位子分開也應該說吧！另兩個人變邊緣人！爛爆！
花這錢很不值得！小氣的火鍋店！還寧願吃三媽臭臭鍋還比你們好！鴛鴛鍋收兩鍋錢，沒辦法提供像西門店的就不要開分店啦！"
 葉小亦 ,https://www.google.com/maps/contrib/110939763503061812590/reviews?hl=zh-TW,5,False,5,今天是第二次來吃了，上次點了大蒜蛤蜊烏骨雞湯底口味真的很棒，雞肉很嫩份量真的很多呀😃😃所以今天改成都吃石頭火鍋肉增量就好，免得又太飽了。青菜自助吧也是棒呆了，對不吃火鍋料的我來說，真是超級好的選擇，想吃火鍋時一定來這🥰🥰🥰
 han han ,https://www.google.com/maps/contrib/111437705970892677713/reviews?hl=zh-TW,4,True,108,"服務人員很親切
當時入座時遲遲沒有服務員過來點餐,後來服務員詢問我們後,主動將我們的用餐時間延後,很貼心。
湯底味道好喝是其他火鍋店沒有的味道,唯一美中不足的是自助吧選擇少飲料選擇少,冰沙要等它溶解才能喝無法即使解渴,建議提供其他多種飲料。"
 柯文傑 ,https://www.google.com/maps/contrib/103383353337320467714/reviews?hl=zh-TW,1,False,7,"剝皮辣椒雞鍋
湯底：非常香甜微辣爽口
雞肉五塊幾乎骨頭（湯底的感覺，沒有肉盤）
接近400的價格實在難以接受
奶茶霜淇淋好吃

不會在光顧"
 陳彥儒 ,https://www.google.com/maps/contrib/105932543841034778845/reviews?hl=zh-TW,5,True,49,"好吃😋
辣子鍋有點辣，同事吃的剝皮辣椒很香"
 Jennyc Chen ,https://www.google.com/maps/contrib/111586061378935666343/reviews?hl=zh-TW,4,False,2,"第一次品嚐尬鍋～
蒜頭蛤蜊和剝皮辣椒湯頭，味道很夠
蒜頭超多，霜淇淋採自助吧旁邊另有配料可以自己添加，整體感覺還不錯😊😊"
 WenWen ,https://www.google.com/maps/contrib/102698257692258275667/reviews?hl=zh-TW,1,True,137,"整個桌面及餐具很油
餐盤及水杯都沒有洗乾淨
地板更油
走去夾菜或洗手間都深怕滑倒
雪花牛整盤幾乎都是肥肉
海鮮不新鮮
座位間很擁擠
桌面可以擺放的空間真的太小
服務員太少
要點餐或需要收拾桌面都要起身去找服務人員
只能說很沒有王品該有的水準
還是王品越開越多
品質就下滑了？？？
不如去吃一般的涮涮鍋"
 劉睿烽 ,https://www.google.com/maps/contrib/101178901762031314943/reviews?hl=zh-TW,3,False,9,食材還可以直接坐風口冷氣開超強直吹到非常不舒服其他位子都還有全部人擠到同一區用餐看不懂單純就是冷氣風口就扣兩顆星了可以請你們在風口下吃90分鐘看看會不會冷
 DEBBY ,https://www.google.com/maps/contrib/107521209002163337336/reviews?hl=zh-TW,3,False,164,"有一位服務員叫竹庭,服務不錯
但,蒜頭蛤蜊雞湯湯頭太鹹了。。
還有餐具清潔做得不夠好
杯子不乾淨。。"
 李潔昀 ,https://www.google.com/maps/contrib/100690751398409267256/reviews?hl=zh-TW,3,False,8,很喜歡西門店終於展店於是來吃吃看有點失望湯頭一樣很棒自助吧的菜也很新鮮霜淇淋更不用說出乎意料的是變成了鴛鴦鍋不像西門店的個人鍋加不了多少菜一起煮桌面空間也很小雖然有提供邊桌但出入上變得不方便燈光也不像西門店明亮雖然可能是潮流但個人不喜歡這種氣氛
 楊筱萱 ,https://www.google.com/maps/contrib/100808811540332064759/reviews?hl=zh-TW,1,False,7,"登記服務員態度非常離譜，等了50分鐘後跟我說inline的等候時間不準，還問我原本是講幾點可以用餐？
如果會不準也該提前告知，而不是這種散漫的態度，雖然給一顆星，那也是因為Google沒有0顆星的選項。"
 Ning Tseng ,https://www.google.com/maps/contrib/105453474382071963823/reviews?hl=zh-TW,5,False,8,好吃！這次點了麻油雞、剝皮辣椒、蒜頭蛤蠣湯頭～湯頭都好好喝！雞肉飯跟麵線、炸蛋也都喜歡～
 Jennifer Ke ,https://www.google.com/maps/contrib/103975310182848678993/reviews?hl=zh-TW,5,False,7,"雞肉飯加炸蛋好好吃！
湯頭也是100分"
 葉靜澐 ,https://www.google.com/maps/contrib/117845179948612315264/reviews?hl=zh-TW,5,True,19,"單一鍋辣子鍋一鍋萬波鍋~
辣子鍋加價起司,非原本自己想像,可以另外沾雞肉吃,而是端來時,起司片已丟入鍋自己乾煮,不管火多小,多小心攪拌,還是沾鍋~
萬波奶辣鍋,有無糖珍珠.紅茶.奶茶雲朵~用鍋有一定的步驟,很特別湯頭也好喝
小小的遺憾是自助吧的蔬菜及火鍋料重覆性太大"
 polly tsai ,https://www.google.com/maps/contrib/110360187938523192943/reviews?hl=zh-TW,5,False,5,麵線很美味，大家可以來品嘗看看喔。
 Miranda Liu ,https://www.google.com/maps/contrib/101120438151190988477/reviews?hl=zh-TW,2,True,66,人手不夠，杯子有點油，蔬菜新鮮玉米芋頭好吃，但是覺得菜不知道有沒有洗乾淨。冰不錯，飲品單調，Cp值不高
 陳亮羽 ,https://www.google.com/maps/contrib/118423041675493383233/reviews?hl=zh-TW,5,False,8,"讚讚好吃的鍋😋大吃特吃
無限吃菜吃到爆，健康吃起來"
 h.j___c ,https://www.google.com/maps/contrib/111548069070167443272/reviews?hl=zh-TW,2,False,10,向櫃檯表示預約17:00的朋友已經先進去了，想詢問要往哪走，櫃檯直接手一指說：「在那邊，你要不要自己找？」然後又開始忙自己的。蔬菜、火鍋料採自助吧，加湯也是自己加，加上櫃檯這樣的態度，服務費收得不是很合理耶
 Ting-Yu Li ,https://www.google.com/maps/contrib/117937607001693776979/reviews?hl=zh-TW,5,True,24,"吃過兩次
蠻不錯的
青菜類甜點飲料吃到飽
吃到飽品項口味都還不錯沒有因為免費就馬虎
炸蛋必點！配飯超級好吃
整體推"
 Abby Chen ,https://www.google.com/maps/contrib/115671392907635538987/reviews?hl=zh-TW,4,False,4,珍珠奶茶霜淇淋好吃，火鍋也特別
 Michelle Yu ,https://www.google.com/maps/contrib/108696051836853607425/reviews?hl=zh-TW,4,True,99,傳說中的增量50%，實際上菜看不出差在哪裡。一直到隔壁桌上菜，確定我的應該沒有增量。詢問服務人員，原來所謂的增量，是「秤重」的，只會多兩三片。所以，增量50%的說明是不是有問題？
 踢歐歪力A告 ,https://www.google.com/maps/contrib/106759642706638246384/reviews?hl=zh-TW,5,True,26,覺得很好吃服務也很不錯讚讚
 mengchang Tang ,https://www.google.com/maps/contrib/113546611995087692828/reviews?hl=zh-TW,1,False,29,說是王品有點期待過頭了，除了服務員瑞x外，另外兩位同事小姐080421:00～22:00(非金髮)，上菜錢講話含糊不清、使用說明也講不清楚，詢問加湯服務也是唐突的倒下普通高湯有些無奈ㄏㄏ
 林怡妏（Albee） ,https://www.google.com/maps/contrib/115285826188320465627/reviews?hl=zh-TW,1,False,7,"一顆星給的是服務、霜淇淋
（只有這兩項最優）

其它：
餐點口味、自助動線、菜的種類
都是西門店大勝！
（西門店真的五顆星）

剝皮辣椒雞湯：
並沒有我在西門店喝的那麼濃郁、剝皮辣椒的味道也沒有出來

自助動線：
大家都擠在門口、結帳區域

菜的種類：
選擇偏少、玉米的品質參差不齊
（西門店的玉米就好吃很多！）"
 Singwen Lee ,https://www.google.com/maps/contrib/105285046026634439991/reviews?hl=zh-TW,5,False,2,蒜頭蛤蜊雞狂推！海鮮份量剛剛好又新鮮！
 Jerry Chiu ,https://www.google.com/maps/contrib/111550473446330223572/reviews?hl=zh-TW,1,True,116,都已經上餐外場有位先生，還一直來問客人上餐到期了沒，請問我今天是來吃飯還是被拷問的？你們自己上餐應該要自己記上到哪邊吧，怎麼會來問我，而且還問了兩三次，真的很糟糕，而且有位女店員送餐時還把我盤裡的東西撞出來（上海鮮塔的時候），東西很好吃希望服務再細心點
 要不要吃哈密瓜Gua ,https://www.google.com/maps/contrib/102191406162802723377/reviews?hl=zh-TW,5,False,20,環境空間及自助吧食材新鮮度很優，雖然自助吧選擇不多，但都很精緻新鮮乾淨，今日用餐點了牛、豬石頭火鍋，肉量雖稍為偏少，但這價格還是覺得cp值很高，尤其這次與萬波合作的珍珠奶茶冰淇淋稍微甜了點，但真的好吃配料也不馬虎👍👍
 jing Juile ,https://www.google.com/maps/contrib/115454663549496108147/reviews?hl=zh-TW,5,False,9,服務親切，環境乾淨，湯頭味道好，雞肉飯超級好吃👍🏻爆推，霜降牛超嫩，生意越來越好，是不可否定的好吃👍🏻
 Lily ,https://www.google.com/maps/contrib/116402379763650397975/reviews?hl=zh-TW,5,True,224,尬鍋湯頭好喝（今天點了剝皮辣椒和麻油雞湯頭）、肉好吃、紅茶好喝👍雞肉飯超級好吃！！！尬鍋的人員服務親切，感謝瑞宇Rolex幫我們點餐、介紹、十分親切👍
 ooo xxx ,https://www.google.com/maps/contrib/113890002857818062160/reviews?hl=zh-TW,4,True,83,蒜頭蛤蜊雞味道超濃很推青菜也都很新鮮缺點就是桌子超小東西隨便擺就滿了桌子的間距也很小走路不方便還有90分鐘的時間真的太短了吃到後面很趕
 大胖熊 ,https://www.google.com/maps/contrib/100121867282198294041/reviews?hl=zh-TW,1,False,1,食材不新鮮，蔬菜都爛爛的，玉米乾扁，東西選擇少少，湯頭很油膩，溫熱的湯喝起來還有酸味，煮過的食材吃來也是酸，肉類品質超不優，用餐時間好短，沒啥服務到還要收取服務費，整體用餐感覺很失望，要我再給它一次機會，我也不想浪費我的錢了。
 li wen Hsu ,https://www.google.com/maps/contrib/110742502573613258589/reviews?hl=zh-TW,5,True,38,餐廳場地寬敞服務人員態度親切餐點好吃～
 Jaseph Hsu ,https://www.google.com/maps/contrib/106053787039450991792/reviews?hl=zh-TW,4,True,252,"獨特的湯頭值得一試，飲品選項雖少但夠用。
自助菜盤彈性大，符合大眾口味。"
 大頭頴 ,https://www.google.com/maps/contrib/107433730863764821387/reviews?hl=zh-TW,5,True,42,太厲害了。食材新鮮。冰沙也很好喝（紅心巴樂）可惜只有台北才有。希望台中也能開一間
 Tw Wanchi ,https://www.google.com/maps/contrib/112792688752487893424/reviews?hl=zh-TW,5,True,229,"我今天現場看櫃檯速度很快
覺得店裡生意非常非常好需等
得做好沒訂位要排蠻久的準備
不過還是可感覺是王品用心
好加在是點剝皮辣椒很辣很爽
吃得很滿足。"
 張芝菀 ,https://www.google.com/maps/contrib/101959315339847610798/reviews?hl=zh-TW,1,False,3,用餐不到1小時就ㄧ直頻繁的提醒只剩多久可以吃，還沒用餐完就一直要幫我們清潔桌面，已經告知說不用，隔10分鐘就換另一名服務員問要不要清潔桌面，整個感覺很差..
 Viola Huang ,https://www.google.com/maps/contrib/118417586339332882445/reviews?hl=zh-TW,1,False,11,"我覺得則店內拍宣傳照很討厭！
閃光燈不停的閃客人，你們沒有尊重在吃飯的客人。請回想一下，下午拍照的時候！"
 蔡心怡 ,https://www.google.com/maps/contrib/114575448952571038524/reviews?hl=zh-TW,5,False,4,新開的尬鍋come值高好吃又便宜喔
 陳羽 ,https://www.google.com/maps/contrib/116803034497815281580/reviews?hl=zh-TW,1,False,1,今天用餐有兩份是點梅花豬，其中一份有加量，回家看照片發現一盤是9片、一盤是11片，請問加量只多兩片是正常的嗎？
 Kim Tseng ,https://www.google.com/maps/contrib/115702465263604492663/reviews?hl=zh-TW,4,True,29,6人聚餐.位置在窗邊角落.(分2人桌與4人桌).鍋底好吃.食物也新鮮.服務生也很勤快一直來收空盤.服務生很詳細介紹餐點.並告知取配菜須戴手套口罩.唯獨現場有些微髒亂(回收餐車在走道上.走道又很小.要繞道而行).桌子略小.盤子不夠放.整體而言.算不錯
 PZ Cheng ,https://www.google.com/maps/contrib/106907545268012506107/reviews?hl=zh-TW,5,True,18,蒜頭蛤蠣雞湯很好喝整體氣氛蠻喜歡的很有台式的風格生意非常好一定要先訂位下次還會想要來～
 Yu shan ,https://www.google.com/maps/contrib/117517373509484468010/reviews?hl=zh-TW,5,True,114,終於訂到位置來嚐鮮惹！！
 林秉璇 ,https://www.google.com/maps/contrib/114415172379360912620/reviews?hl=zh-TW,5,False,17,湯頭好喝，菜很甜，自助吧選項較少，冰淇淋好好吃，珍珠也很軟Q，會想再來！
 wen Chu ,https://www.google.com/maps/contrib/100312020315343764729/reviews?hl=zh-TW,5,False,4,今天第一次來用餐，整體感覺非常的好，服務人員也都很客氣，下次有機會會再來用餐，讚👍
 黃楸晴 ,https://www.google.com/maps/contrib/109893985126968841906/reviews?hl=zh-TW,4,False,5,東西好吃！不過碗盤沒有洗得很乾淨，拿菜盤、醬料碟，都可以看到一些小東西在上班。
 李澤泉 ,https://www.google.com/maps/contrib/117308946230991346705/reviews?hl=zh-TW,4,True,156,第二次來，這次帶孩子來吃，很喜歡，不過地板有點滑。還是一樣好吃。建議可以有咖啡的供應。
 Hao Lee ,https://www.google.com/maps/contrib/116851222388966893762/reviews?hl=zh-TW,4,False,4,"湯頭很香，冰好吃，服務態度好
唯一缺點應該是人手不足，出餐速度慢，有些還忘記"
 啾啾力 ,https://www.google.com/maps/contrib/113579957599120363578/reviews?hl=zh-TW,3,False,43,"食材品質不錯
但雙人位子太擠了點雙人套餐盤子都快放不下
盤子收的很慢
還算可以同價位有更好的選擇"
 急凍鳥波加曼 ,https://www.google.com/maps/contrib/109630693383572095106/reviews?hl=zh-TW,5,True,18,"這裡的餐點美味上餐速度也很快
不會讓客人餓肚子
服務員都很親切
因為來吃過很多次
認識了不少服務人員
服務人員瑞宇、昱甄、佳玉、辣椒、依宸、志賢、Coco、凱涵都很熱情服務大家，是我遇過最好的服務人員，還有其他叫不出名字的服務人員
也都很棒棒"
 chen annie ,https://www.google.com/maps/contrib/102967192713253043772/reviews?hl=zh-TW,5,True,83,因我吃素，與家人去用餐。夾菜夾子，是葷/素共用，而素食可食的菜色少，個人日後不會再去。
 賴小天 ,https://www.google.com/maps/contrib/117372546164205918276/reviews?hl=zh-TW,5,True,51,今天來鍋，王品的新品牌，超好吃😋
 張惠雯 ,https://www.google.com/maps/contrib/107176422028951430915/reviews?hl=zh-TW,5,False,7,"今天吃剝皮辣椒和酒香薑煸麻油。
酒香薑煸麻油湯頭好喝，一開始酒全加👍煮完最後喝也很清甜甘甘的，下次還是會點一樣的。"
 林奕廷 ,https://www.google.com/maps/contrib/104458218531470674054/reviews?hl=zh-TW,5,True,128,"珍奶鍋不是想像中恐怖味道，超級好吃！
珍奶冰淇淋也意外好吃！真的會讓人想念的味道！"
 Stella Yang ,https://www.google.com/maps/contrib/100381592868021647346/reviews?hl=zh-TW,5,True,13,服務很棒！東西不錯吃！
 Penny Lu ,https://www.google.com/maps/contrib/101707081320051399922/reviews?hl=zh-TW,2,False,6,"第一位介紹餐點的員工說打卡送蛋，
結果點餐的員工說送炸雲朵，
畫完菜單舉手請員工點餐，
大概有4-5個員工經過都裝作沒看到，
結帳的時候螢幕上顯示生日招待餐點金額，詢問員工後告知系統會直接把錢扣除，收完錢就直接走了，重新再算一次結果還是有把生日招待算進去，留下我跟朋友在櫃檯，完全沒有人要處理，服務真的太差了，
石二鍋兩倍的價錢，東西比石二鍋還普通，不如去吃石二鍋，
麻煩請加強教育訓練。"
 muscle Chemical ,https://www.google.com/maps/contrib/117414746638400046447/reviews?hl=zh-TW,1,False,12,"肉品Cp值低，自助蔬菜吧廉價，甜品選擇少。
評價懶得多講，
兩個字：普通。
四個字：華而不實。"
 傅晟瑋 ,https://www.google.com/maps/contrib/102975600349731166929/reviews?hl=zh-TW,4,True,49,冰沙一極棒，火鍋湯底挺不錯，配菜就普普通通，服務人員很積極～總體很不錯！
 林卿書 ,https://www.google.com/maps/contrib/104042227519523827732/reviews?hl=zh-TW,1,False,27,"花費要看你吃什麼煱,第一次去吃也是看UT平台才去的結果看到了東西價錢是不一樣,想要吃東西確比較貴因該不会再去吃了。"
 小7 ,https://www.google.com/maps/contrib/102970086675648521615/reviews?hl=zh-TW,3,False,5,前一桌用完的勺子沒有收回需要客人提醒吃到一半很常一直受到服務人員突然的打擾甚至一群在旁邊有點影響到用餐體驗
