user_name,user_profile_url,rating,local_guide,comment_num,comment_text
 邱明哲 ,https://www.google.com/maps/contrib/103809949456913442820/reviews?hl=zh-TW,5,True,16,餐點非常好吃，店員講解仔細，紅芭樂冰沙和萬波奶茶很好喝，紅茶也不會很死甜，推薦大家來吃。與西門店相比下，多了一樓的辛苦服務報到人員安排下，感覺店門口不會擠了一堆客人，另外今天湯底非常快速的送達，整體的服務感覺非常好，感謝今天服務很好的瑞宇，講解上非常的有耐心與仔細，結果會員點數也只有這次有累積到，上次西門店都沒有提醒客人可以累積會員點數，偏偏上次的消費比較高，唉！另外真心建議加湯的湯底可以是原本客人點的，吃到最後才會都是一樣好吃的味道，相信王品集團應該都會是以顧客的需求致上，另外因為整家店只有兩間廁所，不要再分成有限制男女了，對男性來說真的不友善，最後覺得今天的用餐心得非常高興，辛苦各位服務人員。
 李雅鈴 ,https://www.google.com/maps/contrib/112607854306585803844/reviews?hl=zh-TW,5,False,2,用餐環境很好，服務人員態度優良，海鮮、肉品、蔬菜都很新鮮，聚餐的好地方。
 Jessica Lin ,https://www.google.com/maps/contrib/113473461606709555036/reviews?hl=zh-TW,5,False,26,可愛又好吃！能在這裡吃到白糖粿也蠻特別的
 郭子毓 ,https://www.google.com/maps/contrib/114392800299236230253/reviews?hl=zh-TW,5,True,34,"昨天打電話問可不可以訂位，服務人員說訂位時段有5點跟幾點我忘了，然後我們就說那要訂五點，結果服務人員說五點客滿無法訂位，實在是不太懂他想表達什麼意思
但還是很想吃，所以改吃中午
歐買尬真的好好吃，蝦子很甜，蛤蜊很鮮，石頭鍋的湯底就很讚，冰淇淋更讚
麵線好好吃！！！！！味道很夠也不會太乾
服務人員態度很好，實在是找不到什麼缺點（餐點部分），跟另外一間台式火鍋相比，這間表現好很多，CP值也很高，吃得很開心
BTW我也覺得用餐時間有點偏短🥹"
 葉小英 ,https://www.google.com/maps/contrib/115041136023399171435/reviews?hl=zh-TW,5,False,6,湯頭清甜、肉質不祡，蔬菜總類雖不多但吃到飽。適合家庭平日用餐
 陳家慧 ,https://www.google.com/maps/contrib/107600891412432213752/reviews?hl=zh-TW,4,True,154,湯頭選項多，且食材新鮮，只是因為人潮眾多，用餐限時90分，對於想細細品嚐鍋物，稍嫌短
 林肯 ,https://www.google.com/maps/contrib/104588718859656721431/reviews?hl=zh-TW,3,True,26,"王品系列的台式鍋物，一進入店內雖然有笑臉迎客，但菜單種類多，店員以超快速的口語帶過，但壓根都聽不清楚他在講什麼，另外自助菜盤區，種類真的有少到，連自助飲料吧飲料也只有紅茶還有寫著忘情水的白開水，再加上兩種冰沙，怎麼連基本汽水機台都沒有呢，對於晚上用餐不想吃冰又不能喝有咖啡因的客人只能喝白開水。正式的鍋上來，湯頭也算尚可，肉也普普。
王品加油吧！"
 Lisa Lai ,https://www.google.com/maps/contrib/117522856827336459073/reviews?hl=zh-TW,4,True,45,"湯頭非常濃郁！！蒜頭蛤蜊雞鍋十分清甜，蒜頭味不會很重。素食湯底是剝皮辣椒和中藥材，適合煮蔬菜。湯頭滿油，不須要沾醬就很夠味。上鍋時會附上加湯的壺子，不用一直揮手請服務生加湯滿棒的，畢竟用餐時間只有90分鐘。
自助區菜色略少。冰淇淋的配料有oreo碎片、黑糖QQ、麵茶粉等。
裝潢和播放的音樂是五、六零年代台灣的風格，復古但不俗氣。
桌距偏小，可以聽到隔壁的對話。
最大的缺點是，碗盤油油的，不知道是沒洗乾淨還是服務生手上的油沾的。"
 Annie Lin ,https://www.google.com/maps/contrib/112338249752203502627/reviews?hl=zh-TW,5,False,10,真的要來尬鍋一下，湯頭好吃……肉質新鮮，服務好……環境舒服！
 李小儒 ,https://www.google.com/maps/contrib/115998629989415714029/reviews?hl=zh-TW,5,True,27,"辣子鍋、剝皮辣椒鍋、蒜頭蛤蠣鍋都很夠味
炸蛋、雞肉飯跟雞油辣椒醬也都很好吃
大推👍👍👍"
 Melody Lai ,https://www.google.com/maps/contrib/118327244896136220612/reviews?hl=zh-TW,2,False,17,"1.湯頭多種選擇，以雞腿底的鍋類為主
2.青菜自助吧可以選自己喜歡的
3.萬波聯名霜淇淋推薦👍🏼

總結：跟萬客石鍋90%像，個人推萬客石鍋(每種湯頭都很有各自風味)，蔬菜自助吧的話比肉多多品項來的少！

打卡五星評論送甜點～(炸年糕跟炸地瓜球都不好吃！)"
 charles wu ,https://www.google.com/maps/contrib/110334687420874895567/reviews?hl=zh-TW,5,True,473,湯頭副餐種類很多，蔬菜火鍋料自助式吃到飽，台式冰沙、豆奶花生霜淇淋，味道都很好。
 raychin chi ,https://www.google.com/maps/contrib/111199195524152345482/reviews?hl=zh-TW,5,True,44,五星評論可換1元加購白糖粿，因有用到優惠，不改星數，但應該不會去吃第二次。肉很薄+1，火鍋料品項沒有很多，主食類（肉片，海鮮盤）大概點餐超過40分才上桌，白糖粿是期間限定的奶茶口味，但沒有像網宣一樣有茶粉灑在上面，就真的是霜淇淋最好吃。附圖是大概兩份白糖粿的份量。
 Hsueh Fi ,https://www.google.com/maps/contrib/111244903613679874006/reviews?hl=zh-TW,5,True,32,"太好吃一家店啦！剝皮辣椒雞鍋、蒜頭蛤蜊雞鍋都很推薦！
副餐真的很驚艷：銷魂雞肉飯、油蔥麵線、尬個炸蛋，最重要的是白糖炸雲朵：
這甜點超好吃的，有地瓜球外型和空氣感、有白糖粿的口感，太幸福的一道☺️"
 蒖菽蓊 ,https://www.google.com/maps/contrib/112336456204544450794/reviews?hl=zh-TW,5,True,26,服務態度佳，火鍋菜盤是自助式，湯頭飲料蠻台式特別的
 Transform Yang ,https://www.google.com/maps/contrib/105947093582999784973/reviews?hl=zh-TW,5,True,184,蒜頭蛤蜊不錯喝，肉也算滿嫩的，菜可以吃到飽是優點
 筱涵Natalie ,https://www.google.com/maps/contrib/110427055918141428810/reviews?hl=zh-TW,5,True,63,"青花椒的愛好者🙌🏻附近再開一間火鍋店覺得很開心只是店員好像忙昏了我們點蒜頭蛤蠣鍋但上來的沒有蛤蜊朋友還說蛤蜊應該只是提味😂😂😂😂好好笑
王品集團可以再多開一些火鍋店"
 Rachel Lin ,https://www.google.com/maps/contrib/111693145857038395161/reviews?hl=zh-TW,5,False,14,服務人員很貼心，餐點也很快上的，CP值很高👍🏻👍🏻👍🏻
 許家榮 ,https://www.google.com/maps/contrib/103732243140526508058/reviews?hl=zh-TW,5,True,19,餐點美味又有創意，服務人員親切有禮，備感尊榮，很棒的消費體驗，會想再訪～❤️
 姲妡林 ,https://www.google.com/maps/contrib/101725631542658012778/reviews?hl=zh-TW,5,True,11,"剝皮辣椒雞湯和蒜頭雞湯都超好喝的！
現在還有google評論活動呦！
超讚的！"
 Chiwen Chan ,https://www.google.com/maps/contrib/108540930052041864626/reviews?hl=zh-TW,5,False,8,"鍋底好喝
蔬菜自助吃到飽
服務態度佳佳👍"
 Chien-Ting Lien ,https://www.google.com/maps/contrib/110023979451621551213/reviews?hl=zh-TW,5,False,11,宵夜新選擇！石頭鍋和剝皮辣椒雞鍋都很好吃~而且打卡加購炸雲朵只要1元🤩🤩
 Hui Ju慧如 Rita Chen陳 ,https://www.google.com/maps/contrib/101460302957770068755/reviews?hl=zh-TW,3,True,215,"沒吃過的可以來嚐試一次。湯頭兩種：蒜頭蛤蜊、剝皮辣椒。裡頭料多味足👍👍👍雙人套餐很不錯。
但一個半小時用餐太趕！因為這是火鍋！要拿蔬菜料還要煮熟才能入口…連我們一家四口大胃王，一坐下跟打仗似的，時間到了才剛好吃完…不知其他扶老攜眷的怎麼夠時間…
服務很好，年輕人很認真在做。"
 羅摟雷（i.am.olafood） ,https://www.google.com/maps/contrib/114228347724287539696/reviews?hl=zh-TW,5,True,620,"王品集團的新火鍋品牌
以特色雞湯鍋為主，搭配鍋底雞腿肉與牛豬肉片的一鍋雙饗體驗
滿滿的台式元素除了在餐點中窺見外，
裝潢也能感受復刻新台式潮流感
帶朋友來拍照打卡也很適合✨

鍋底有金熬剝皮辣椒雞、辣子爆雞、金銀蒜頭蛤蜊雞、酒香薑煸麻油雞和石頭鍋的選擇
充滿精華的湯頭光喝的就很讚
搭配的牛、豬肉也不馬虎，
是使用原塊肉現點新鮮現刨的
最棒的是這邊還有自助bar，蔬菜、飲料和冰品都是無限供應～～
副食部分銷魂雞肉飯和日曬油蔥麵都很推薦，搭配炸蛋更是犯規
家庭和朋友聚餐都很適合，推薦給喜歡打卡、喜歡台式元素和美食的大家🥰
更多介紹請看Instagram：@i.am.olafood"
 柯奇甫 ,https://www.google.com/maps/contrib/111291952837727082467/reviews?hl=zh-TW,5,False,14,謝謝佳容美女的服務，食材新鮮好吃，服務也是一流，超親切，以後會再來消費👍
 王利利 ,https://www.google.com/maps/contrib/116815764455796288227/reviews?hl=zh-TW,5,False,3,"看他開了一陣子了～今天來嚐鮮
好吃好吃
剝皮辣椒雞👍🏻👍🏻"
 Brian ,https://www.google.com/maps/contrib/112908475959419221316/reviews?hl=zh-TW,2,False,10,王品集團旗下新開的品牌火鍋，我覺得目前還不太行，太混亂了，而且海鮮感覺好像有問題，結果服務人員說師傅說在冷凍放太久了，這回答好像也不太行吧，所以尬鍋都給客人吃在冷凍庫放很久的東西囉？所以我認為服務以及食材上都有大大的進步空間，王品真的越來越多分支公司，但希望能好好維持品質。
 艾西莫夫瑪 ,https://www.google.com/maps/contrib/105531386946755824796/reviews?hl=zh-TW,4,True,944,20220611-有台灣特色食材火鍋料理。很熱門，假日須提早訂位，內用時間：90分/從訂完餐開始針算。
 Kiki Chu ,https://www.google.com/maps/contrib/113354119293580313958/reviews?hl=zh-TW,4,True,62,"剛開幕不久的王品集團火鍋品牌
主打剝皮辣椒雞湯
但覺得蒜頭蛤蜊雞湯更好喝！

當月壽星有送炸年糕，個人覺得紅豆年糕本身不夠甜，不推薦
FB、Google評論不論幾顆星都有送白糖粿，喜歡白糖粿的人可以試試看

整體環境不錯，食材湯頭也在水準之上，想念蒜頭蛤蠣雞湯的時候可以二訪

美中不足的是，可能剛開幕服務人員有些手忙腳亂
帶位跟介紹活動都有待加強
但也有細心手腳俐落的服務人員，可以看出顧客的需求"
 Cindy Lai ,https://www.google.com/maps/contrib/107868899588059687179/reviews?hl=zh-TW,5,False,27,餐點乾淨價格實在，菜類可以吃到飽而且很新鮮，值得推薦。👏🏻👏🏻只是桌子有點小，菜盤肉配放下去就滿了。
 柯瀚晴 ,https://www.google.com/maps/contrib/112890323480994361127/reviews?hl=zh-TW,5,False,9,剝皮辣椒雞湯很好吃～🍲🍲芭樂冰沙也好喝，還有白糖炸雲朵☁️
 Monday Yang ,https://www.google.com/maps/contrib/105284954365375614192/reviews?hl=zh-TW,5,True,21,南京店新開，一定要來尬一下，乾鍋超好吃
 陳威守 ,https://www.google.com/maps/contrib/110292174609622333983/reviews?hl=zh-TW,1,False,4,非常糟糕連一星感覺都是多了，昨天第一次去吃飯滿心期待，結果九孔吃的食物居然沒清理就上桌了～本來單點牛肉貢丸因為九孔事件變成招待但是吃第二顆的時候居然吃到沙子一整個無言….雖然瘋狂給折扣優惠臨走前又給了名片但我還是丟了～畢竟這樣的品質誰敢再來第二次啊～超瞎的
 Ting-Yu Su ,https://www.google.com/maps/contrib/100372491343098030632/reviews?hl=zh-TW,4,True,19,交通方便，街景漂亮舒心的好用爘談天處所。
 張小可 ,https://www.google.com/maps/contrib/105866055634930126264/reviews?hl=zh-TW,5,True,22,"二訪尬鍋
剝皮辣椒雞大推
下次想吃辣子雞"
 Ashley ,https://www.google.com/maps/contrib/102275563623165278928/reviews?hl=zh-TW,4,True,41,"初次訪點的是
蒜頭蛤蠣雞腿鍋+雪花牛，湯頭很濃郁，蒜頭蛤蠣雞腿好吃，冰淇淋也很Ok，店員熱情有禮貌

唯一缺點，兩人位的桌子很小😅"
 陳翊屏 ,https://www.google.com/maps/contrib/103192380180014520558/reviews?hl=zh-TW,5,False,9,"王品新品牌火鍋，
菜、飲料、冰淇淋可以吃到飽，
平價又好吃的新選擇👍"
 Hsin Kuang ,https://www.google.com/maps/contrib/117721630548360660626/reviews?hl=zh-TW,5,False,10,"朋友聚會第一次吃尬鍋好吃🫶🏻
蔬菜還可以自己盡情拿而且很新鮮給過"
 Cate Huang ,https://www.google.com/maps/contrib/111910816221188624517/reviews?hl=zh-TW,4,True,244,王品旗下新品牌，今日第一次吃，用餐90分鐘，這裡是吃鴛鴦鍋，湯頭和食材都還不錯，我們今天吃金銀蒜頭蛤蜊雞鍋和辣子爆雞乾濕雙響鍋，湯頭裡的雞肉都滿嫩的，自助bar有青菜和火鍋料可以拿，也可以另外單點，飲料滿普通的，有冰淇淋可以吃，整體來說算不錯，可以來吃吃看唷！
 姜彥丞 ,https://www.google.com/maps/contrib/112767510136335797334/reviews?hl=zh-TW,5,False,14,東西好吃新鮮，只不過不像西門店是以個人鍋呈現，只有鴛鴦鍋限制了客人的座位配置彈性，如果能調整就更完美了！
 王貞霽 ,https://www.google.com/maps/contrib/113568662123189307154/reviews?hl=zh-TW,5,True,71,打卡有送東西🤣但事實上東西也蠻好吃的，且cp值高！！！
 林欣諭 ,https://www.google.com/maps/contrib/102755008776999108710/reviews?hl=zh-TW,5,False,4,"剝皮辣椒雞好吃！
蛤蠣蒜頭雞湯的湯很鮮蒜頭味十足超讚的啦！"
 黄正武 ,https://www.google.com/maps/contrib/111379027020252012189/reviews?hl=zh-TW,4,True,46,鍋類選項豐富，菜類自助夾取，又有冰淇淋可吃，唯獨服務人員的敏感度能再加強。
 a35118 ,https://www.google.com/maps/contrib/105287599700484532875/reviews?hl=zh-TW,5,True,35,好吃的蒜頭蛤蜊鍋，取餐要戴口罩跟手套，很衛生！好吃
 黃姿綺 ,https://www.google.com/maps/contrib/104829608750016989868/reviews?hl=zh-TW,5,True,33,"辣子爆雞辣的很剛好
很像花雕雞的吃法
先吃乾的再煮湯

蒜頭蛤蠣雞鍋
蒜味很剛好
沒有把雞蓋過
很香
很好吃

白糖炸雲朵很好吃
比萬客的好吃

服務很好
廁所很乾淨
防疫都有做好
用餐距離也有感覺很安全"
 吳佳樺 ,https://www.google.com/maps/contrib/106124217532212402599/reviews?hl=zh-TW,5,True,19,"剝皮辣椒雞很好吃，雞肉很嫩
自助吧青菜很新鮮
服務員態度很棒"
 蘿蔔. ,https://www.google.com/maps/contrib/107385633230169271769/reviews?hl=zh-TW,5,False,35,"覺得很不錯cp值很高！
湯頭好喝特別大家可以試試看！
蔬菜是自助的～～
冰淇淋有花生口味好讚啊👍"
 琥犽 ,https://www.google.com/maps/contrib/106258839738116108188/reviews?hl=zh-TW,5,True,161,新開幕來吃看看，麻油雞和剝皮辣椒雞都超好吃！！雞肉飯大推一定要吃！妮妮服務很棒☺️
 D W ,https://www.google.com/maps/contrib/118430407605147242589/reviews?hl=zh-TW,5,True,16,今天點了剝皮辣椒&蒜頭蛤蠣，火鍋有這兩個口味也太幸福！服務很棒～
 楊喬伊斯 ,https://www.google.com/maps/contrib/101902422157722502247/reviews?hl=zh-TW,5,False,15,"湯底味道很不錯，蔬菜可以吃到飽而且蔬菜都很新鮮
最近跟萬波聯名的奶茶冰淇淋很好吃😋"
 Naughty Dog ,https://www.google.com/maps/contrib/105538146924772181620/reviews?hl=zh-TW,5,False,8,素食者可以吃到飽的素菜，素菜都很新鮮，葷素朋友可以約的好地點
 NCKY ,https://www.google.com/maps/contrib/115718805394401562941/reviews?hl=zh-TW,2,False,3,"購買雙人套餐，選用蛤蜊雞鍋
缺點1.座位真的太小菜都沒地方放
2.蛤蜊雞真的少的可憐
3.加價購的雞飯，雞絲超少，跟照片不符，真心建議不要加價購
4.冰沙YT上說的的真的很差，不要喝。
5.0白糖貴不好吃，不要點。
5.海鮮，蝦子粉粉不新鮮，差勁。

優點湯頭不錯，冰也不錯

總結，總體來說價位偏高，吃一次就不會再去，除非是王品的忠實户，不然真心建議不要去。"
 Misaki Shinomiya ,https://www.google.com/maps/contrib/104056633896583357831/reviews?hl=zh-TW,3,True,137,"想要反應一下今天晚上大約21、22點多用餐的狀況。
一開始店員把我們的湯頭搞錯，有在詢問之下換了湯頭，後來是一位好像叫做顏姓（好像叫瑞宇？）的男性店員服務我們，本來覺得店員的態度都很好，但後來因為同行的友人詢問是否可以幫我們補充湯底，結果被這位店員再送來時直接用力的摔在桌上⋯感覺很差，希望服務品質可以再改進。
不過最後服務我們的是叫做書妞（？）的店員，後來的態度就很親切，也會關心我們吃的好不好，覺得至少離開之前感受上沒有到很差了。
另外，雙人餐的蛤蜊沒有吐沙，但其他部分的餐點都很好吃，有覺得雙人餐有超值到✌🏻"
 Gaga Wang ,https://www.google.com/maps/contrib/112355632173929959488/reviews?hl=zh-TW,5,True,22,"湯頭好喝～青菜也可以按照自己喜歡的份量去拿取
也有提供兒童座椅兒童親善
推薦大家可以來用餐～～很不錯👍👍👍"
 nalalie S. ,https://www.google.com/maps/contrib/113964925944549610669/reviews?hl=zh-TW,5,True,44,"好吃!雞湯湯底很香，冰沙好喝~自助吧管控的菜類也很新鮮,但桌子太小然後只有90分鐘用餐有點可惜"
 洪卉柔 ,https://www.google.com/maps/contrib/103101908373779176665/reviews?hl=zh-TW,5,True,74,菜吃到飽，湯底選項豐富，附餐也有多種選擇，價錢合宜，捷運中山站2號出來直直走就到了。
 王芷維（Elison） ,https://www.google.com/maps/contrib/101552618424813301858/reviews?hl=zh-TW,5,False,2,冰淇淋很好吃，白糖炸雲朵吃起來像客家炒湯圓好吃
 Chih-Chiang Wang (王志強) ,https://www.google.com/maps/contrib/110569518936793941862/reviews?hl=zh-TW,5,True,152,"第一次嚐鮮、很喜歡這邊用餐環境
超用心服務人員、推薦菇菇親切
東西多元化新鮮好吃"
 栗子羅 ,https://www.google.com/maps/contrib/101998593725580034243/reviews?hl=zh-TW,5,True,58,"好吃的剝皮辣椒雞湯鍋
越煮越香甜

雪花牛肉的肉質超嫩
帶皮豬五花油質豐富較有口感"
 Dora Miao ,https://www.google.com/maps/contrib/109550110121984939534/reviews?hl=zh-TW,5,True,35,這白糖粿真的是台北最美味！青菜吃到飽、湯頭一百分👍🏽👍🏽👍🏽
 Ariel Chu ,https://www.google.com/maps/contrib/113750914326685209492/reviews?hl=zh-TW,4,True,118,"可以自己選火鍋料94讚👍🏼還有花生豆奶冰淇淋～有我最喜歡的巧克力球、Oreo碎片、黑糖雪Q球，最喜歡這種不健康甜點配料了😍😍😍肉也很不錯～CP值很高！

缺：高麗菜都很硬，可能是季節問題，石頭鍋有點微油，醬油超鹹（台式那種），麻油麵線的整個碗外面都是麻油（？"
 五告送カイト ,https://www.google.com/maps/contrib/101089277214899272364/reviews?hl=zh-TW,2,False,5,"服務人員很好，環境也棒，
只是主餐的霜降牛肉很像平行宇宙的板腱牛，
吃起來也很硬，
吃了兩片後跟服務人員確認是不是送錯了呢？
他拿去廚房確認後回來說是霜降沒錯，
嗯…好喔…😂
不過自助區的菜都很新鮮。"
 黃聖婷 ,https://www.google.com/maps/contrib/110808691075417700591/reviews?hl=zh-TW,4,True,167,"適合吃飯為主，聊天為輔的人~
因為用餐時間限制90分鐘，肉都還沒吃完，甜點就來了🥲
兩人座位桌面很小，食材都放不下，不太舒適~
食材我沒問題，也很飽，金銀蒜頭蛤蠣湯底&有個酸甜的冰沙蠻讚的👍🏻"
 林小詩 ,https://www.google.com/maps/contrib/108204023503224925280/reviews?hl=zh-TW,5,False,22,"今天點剝皮辣椒雞湯跟蛤蜊蒜頭雞湯頭濃郁好喝😍
但牛肉沒有很推可能不是主打
服務貼心"
 林小花 ,https://www.google.com/maps/contrib/107792582625986353701/reviews?hl=zh-TW,4,False,5,"蒜頭雞湯很不錯欸！越煮越鮮甜🤩
雞肉飯配炸蛋在湯滾前就可以嗑光了😂"
 Summer Lee ,https://www.google.com/maps/contrib/117981758178464853631/reviews?hl=zh-TW,3,True,28,"這是真實評價！實在無法昧著想參加店裡活動給五顆星，從一開始在樓下接待人員就在跟自己的朋友聊天，一路到用餐時店員還是很認真在聊天示意很久都沒看到，餐點也沒有介紹上菜也是，能理解疫情期間客人少上班難免想輕鬆一下！

自助式的菜盤飲料區很不錯👍🏻"
 Josh Yang ,https://www.google.com/maps/contrib/113216116371435627321/reviews?hl=zh-TW,5,True,68,"已經吃過西門店數次。得知開新店來吃，採鴛鴦鍋模式。

一樣好吃，還遇到郭妖拍片好幸運🥹🐶👍🏼"
 Tsai Simon ,https://www.google.com/maps/contrib/110706465562551317807/reviews?hl=zh-TW,5,True,217,好吃物超所值，但難訂位
 尼拉 ,https://www.google.com/maps/contrib/116135207872386931325/reviews?hl=zh-TW,3,False,20,用餐90分有點趕，因為這是火鍋需要煮而且會燙，和一般簡餐套餐不同，在點餐時、剩半小時店員會一直提醒告知，但讓人一直吃得很有壓力，能體會店家為了賺錢拼翻桌率，但本人吃那麼多王品集團系列，尬鍋讓人吃得很不放鬆，雙人吃1230，這價位在西堤或陶板屋已可以很優雅愉悅的用餐
 Mac ,https://www.google.com/maps/contrib/113366760926850918345/reviews?hl=zh-TW,5,True,205,服務人員態度良好，領台應該衝一點，業績會更好，加油
 吉米楊 ,https://www.google.com/maps/contrib/100766348045405300104/reviews?hl=zh-TW,5,False,136,"平心而論服務絕對是破萬的高分，完全沒有其它則什麼一直被服務人員打擾啦給位置很小桌、還是什麼桌子之間距離很近（怕死就不要出來用餐不會哦！？都跟疫情共存了，是要分多遠？）

菜色普通，但講白一點火鍋料就是這些，是能擺出什麼多樣？？至少我們是沒有花個3、400百塊，然後要去期待什麼像吃破千元的大餐還是排場啦～
海鮮我們當天就是冷凍蝦拿出來退冰，所以煮的時候殼都紅通通，結果一剝裡面還是處於冰凍狀態，然後有我們肉品有一個是雪花牛，油脂部分真的多到吃到後面幾片就不吃了😅

冰沙給過，紅茶就普通，霜淇淋是好吃的！下次還是會上門消費，但就選擇單點不選雙人套餐了～

主要是服務人員，真的都算態度好（帶位女生個頭小小又是櫃檯帶位又是上餐，真的是親切有效率的沒話說）"
 Irene Huang ,https://www.google.com/maps/contrib/117324712611994339456/reviews?hl=zh-TW,5,False,6,蒜頭雞湯濃郁阪腱牛與雪花牛很嫩，CP值高！👍
 NOX CHEN ,https://www.google.com/maps/contrib/101490217619379294055/reviews?hl=zh-TW,5,True,27,"蒜頭蛤蜊雞湯真的很不錯！
想吃什麼菜最好第一批就煮下去比較不會影響湯的原味"
 張筎筎 ,https://www.google.com/maps/contrib/112931974737160823496/reviews?hl=zh-TW,5,False,13,"王品集團平價鍋，來嚐鮮～
醬油很死鹹，個人覺得水晶餃沾米豆醬很搭，整體店內飲料比食材還優🤦🏻‍♀️🤷🏻‍♀️（紅茶好喝），廁所空調比座位空調還強，廁所只有兩間。"
 OR ,https://www.google.com/maps/contrib/101363594639653822256/reviews?hl=zh-TW,4,True,360,"湯頭濃郁好喝
現炸鹹酥雞好吃😋
芋頭綿密蔬菜多
雞肉飯很好吃穿👍"
 周固廷 ,https://www.google.com/maps/contrib/115088057952957003487/reviews?hl=zh-TW,5,True,40,"火鍋蠻好吃
自助吧雖然小一些但該有的都有"
 Francis Chen ,https://www.google.com/maps/contrib/117087292636846819974/reviews?hl=zh-TW,4,True,328,口味特別，雞油辣椒醬很香，愛吃辣的一定要嘗試。贈送的白糖粿油耗味有一點。
 greencat6182 ,https://www.google.com/maps/contrib/114144109384473141558/reviews?hl=zh-TW,5,True,84,因為很驚訝有火鍋店敢在西門旺角石頭火鍋旁開，決定來試試，反正王品集團全台口味統一。雞肉飯、麻油麵線、炸蛋、白糖粿真的超超超好吃。剝皮辣椒雞真的是難失敗的料理，拿來做火鍋真的很聰明。石頭火鍋就是把石二鍋搬進來。雙人套餐量非常多，吃很飽。總體而言，沒有讓人失望。
 莊采芸 ,https://www.google.com/maps/contrib/112792766365712743177/reviews?hl=zh-TW,5,True,54,"環境乾淨
店員也很親切
上餐快速
蒜頭蛤蠣鍋湯頭好喝！"
