user_name,user_profile_url,rating,local_guide,comment_num,comment_text
 Somei Yang ,https://www.google.com/maps/contrib/110061727255676287738/reviews?hl=zh-TW,4,True,423,王品集團的新品牌，比較強調的是湯頭，今天點的是蒜頭蛤蠣湯，以及剝皮辣椒湯，這兩個湯頭都還不錯，青菜全部採自助式，我覺得選擇性不多，跟聚火鍋的自助吧差很多，再者，肉片很薄，吃起來很空虛，我比較喜歡的是花生霜琪淋，可以自己在上面加料…總之，服務不錯，湯頭不錯，自助bar要加強….另外，正值疫情期間，訂位時詢問如果有可能是否可以靠邊的坐位，不要夾在中間，因為訂位用餐時間很晚，想說客人不會太多，小姐非常親切說可以，當然還是要以現場為主，我希望她能夠備註，但到現場時，空位很多，但小姐將我們帶到二組客人的中間位，我詢問可否有靠邊的坐位，小姐才‘勉為其難’的帶到其他靠邊位，這讓我覺得她們並沒有備註或溝通好，這點有點失望😓
 李瑞臻 ,https://www.google.com/maps/contrib/108079884190821646784/reviews?hl=zh-TW,4,True,38,"這次點雙人套餐（鴛鴦鍋-剝皮辣椒雞跟石頭火鍋）
肉品是雪花牛跟坂腱
餐點本身：
1.剝皮辣椒雞真的推，剛上桌時喝一整個就很濃郁很香
2.因為總共4個朋友一起，兩個雙人套餐，畫單時有特意分開畫，但服務人員上餐時，將兩邊的肉混在一起上了，這點真的不行
3.炸蛋好吃！其他自助把的就不多提
服務方面
1.總共用餐時長90分鐘，但我們入桌到點餐大概就去了10分鐘，後面上餐跟肉盤速度又很慢，大概等了20-30分鐘才上齊，造成吃得很趕
2.因為這次有其他朋友有帶小孩子（2個小1、1個中班），服務人員看到也未主動詢問要不要兒童餐具，直到家長提出才給，希望能改進
3.有時候會有整個外場看不到服務人員的時候，要請補高湯壺內的湯都找不到人😅
氣氛部分
1.火鍋咩，我們很吵，就不予置評
2.地板會跟著音樂震動，感覺在演唱會搖滾區😅，在餐廳這樣有點可怕

總結：食物很讚，服務需再加強，氣氛良好"
 fanny yuan ,https://www.google.com/maps/contrib/108731348241758771935/reviews?hl=zh-TW,4,True,58,"今天經過想說火鍋的口味蠻有特色.....就跟朋友來試試
點了雙人套餐
剝皮辣椒鍋跟辣子雞鍋飯（忘記名稱）
#裡面都還有雞肉喔！！
湯頭我覺得可以啦....現在在台北市隨便吃個火鍋也都要5-6百吧🤣🤣
有青菜吧台.選擇性不多但我也覺得可以！！我主要也不是來吃菜吧.....
雙人套餐附麵線/海鮮/肉品/還有一個像地瓜球的口感....
整個套餐對我們兩個女生我覺得還蠻飽的😂😂
肉品部分我就覺得一般般囉〰️
如果喜歡吃辣的可以到佐料有辣椒醬是有辣度的〰️搭配麵線把整個想吃的慾望都提升

整體來說我是會二度拜訪的店家〰️〰️"
 Xin Jing Lin ,https://www.google.com/maps/contrib/106061150187484778295/reviews?hl=zh-TW,3,True,227,"剝皮辣椒雞湯真的很不錯，很濃剛好的辣，不會過鹹，會讓人只想買剝皮辣椒雞湯🤣喝一個完全欲罷不能，哪裡還管的上我其實是在吃火鍋😆
蒜頭雞超～普通～有淡淡的蒜頭香味，但還是無法跟勁敵辣椒雞相比🥲板腱牛的口感還蠻好吃的😋👍
王品旗下平價火鍋店都是蔬菜火鍋料、醬料、冰淇淋無限自取，這家也不例外，個人認為這家的飲料及霜淇淋更為普通🙃
服務員服務都超親切的～去用餐心情氛圍是很舒服的，不過位置略擠，兩人桌跟隔壁的距離超級近，彼此聊天聽的超～清楚
⚡️炸蛋跟白糖粿超雷，完全是吃油無誤，白糖粿感覺就在吃油渣，沒有吃出甜點的雀躍，倒是吃出反胃的感覺🤢"
 Ada chen ,https://www.google.com/maps/contrib/110989729583557668702/reviews?hl=zh-TW,4,True,64,"服務品質🌕🌕🌕🌕🌕
菜色評價🌕🌕🌕🌑🌑
肉類評價🌕🌕🌕🌘🌑
海鮮評價🌕🌕🌕🌖🌑
環境清潔🌕🌕🌕🌕🌘
-
總評語：自助菜盤區菜色有點無聊，東西選擇少，跟別家自助菜盤火鍋比真的差太多了。
用餐時間規定90分鐘有點逼人，還沒拿第二次菜盤時間就差不多快到了。
雞肉飯搭配炸蛋滿好吃的。
環境算乾淨，地板有點黏黏滑滑的。
服務人員態度非常好。
王品集團平價火鍋，有點小失望。
-
雙人套餐💲999元
湯頭⭕️金熬剝皮辣椒雞湯（含雞肉）
湯頭鮮甜，雞肉沒什麼味道。

湯頭⭕️經典石頭火鍋
普通，中規中矩。
-
⭕️雪花牛X2
尚可。
-
⭕️極致黑鑽海鮮拼盤
（含草蝦/鮮蝦/淡菜/鯛魚/蛤蜊）
海鮮新鮮，蛤蜊大顆，份量有點少。
-
經典熟食⭕️尬個炸蛋/兩份
炸蛋配上白飯，非常搭！好吃！

經典熟食⭕阿明白糖炸雲朵乙份
店員介紹是珍珠奶茶口味的炸雲朵，但吃不出來啥味道，不會太甜，是好吃的，就像炸湯圓。
-"
 張豬皮 ,https://www.google.com/maps/contrib/105514852454762953339/reviews?hl=zh-TW,3,True,49,蒜頭蛤蠣湯真的好好喝，可惜整鍋的蛤蠣都有砂子（大概就是你攪拌湯後把筷子伸進去撈一下就能發現有砂子附著的程度）不知道是沒確實吐砂還是食材吐砂前就掛了，一開始的砂子只有一點點，想說蒜頭蛤蠣湯那鍋沒打算煮東西，喝湯前沉澱一下不影響所以沒有反應工作人員，但吃到後面雙人餐的蛤蠣砂子真的太誇張了，舉手好幾次、每次都舉高很久但都沒有服務人員來，因為有限時所以只好放在旁邊先繼續用餐，最後因為時間快到了，店員強制上了甜點，生日的壽桃甜點好好吃，好吃到不小心就忘記那爆多砂子的蛤蠣（還忘記要再去拿薄豆皮吃）（還有王品集團依舊舒適到讓人讚嘆的廁所）🙂
 Tzu Chieh Chu ,https://www.google.com/maps/contrib/110951958673130560520/reviews?hl=zh-TW,4,True,52,"我們三人點了剝皮辣椒雞鍋（358元）、海鮮總匯蒜頭蛤蠣雞鍋（538元）、梅花豬肉酒香薑煸麻油雞鍋（398元）以及油炸那個鬼鬼（99元）

油炸那個鬼鬼是將海鮮漿鋪在油條上，可直接食用或泡入湯中，推薦可以點來試試。

這次點的三鍋味道都很不錯，最推薦剝皮辣椒雞鍋，比較不油，微帶點辣味，十分順口。
麻油雞鍋會附一小瓶米酒，酒味很重，有點油膩。
蒜頭蛤蠣湯底很好喝，蒜頭有生的跟炸過的，但也是稍微太油膩了一點，煮青菜時都會帶起一層油。

看到其他評論有說到店內桌子餐具不乾淨的問題，確實桌面跟地板的清潔要再加強。

蔬菜吧幾乎跟聚的一樣，都不錯吃！

平日店內外場只有一人（根據服務人員所述）有點忙不過來的感覺，建議視情況可增加人力。

推薦自己擠冰淇淋，好玩也好吃！"
 軒仔（軒仔） ,https://www.google.com/maps/contrib/110224656954320590541/reviews?hl=zh-TW,2,True,142,"用餐日期7/1711:30
尬鍋是王品旗下新開的火鍋店
說不上好吃，但也不難吃
就是一個中規中矩的火鍋店
但價格不低
雙人套餐999
肉質真的普通
大概就是錢都、肉多多這種等級
肉品升級要加價
雞肉飯、麵線要加價
最後結帳金額2405
重點是！！！
用餐時間太短了！！！
90分鐘而已！！！
研究完菜單
點完餐大概只剩75分鐘了
明明沒有下一組客人要等著進來
卻急著趕我們走
坦白說服務也沒有多好
算是令人失望的一間店
這間店真的該檢討一下了"
 shenny (shenny) ,https://www.google.com/maps/contrib/100642473010141959669/reviews?hl=zh-TW,5,True,114,"捷運中山站2號出口出來後一直直走就到了
要記得先訂位～
環境乾淨很有網美打卡店的風格喔！
👉🏻餐點部分今天點的是
✅酒香麻油雞鍋酒香太讚讚讚了❤️大推👍🏻
✅爆炒辣子雞鍋喜歡吃辣的一定要點這個
✅剝皮辣椒鍋湯頭不錯～很好喝
今天沒有點到蒜頭雞但是聞著隔壁都香～
自助吧的蔬菜很新鮮就是飲料種類非常少
真的是一家絕對會來很多很多次的！
王品集團的服務當然就不用說啦
絕對5顆星打滿🌟
一定要去吃！去吃！去吃！"
 personal ,https://www.google.com/maps/contrib/111315928247816506377/reviews?hl=zh-TW,4,True,117,"#台式火鍋
#捷運中山站附近
#用餐時間90分鐘

王品集團旗下的台式火鍋，標榜可一鍋二吃，點主鍋，菜類自取，品項沒有聚火鍋的多😅

用餐只有90分鐘超級趕，若朋友聚餐要忙著煮、忙著聊天，根本來不及好好品嚐，整個吃的超趕囫圇吞棗，用餐時間到準時請你結賬，因爲客滿，後面時間的人到了，鍋裡還一堆東西沒吃完所以想不起來口味如何😂

萬波奶霜淇淋是在等結賬時趕快去裝些來吃，是好吃的霜淇淋👍"
 Hsueh-Hua Chen ,https://www.google.com/maps/contrib/100516047163035267339/reviews?hl=zh-TW,5,True,144,"首先，想吃要先預約，最好提前3-4天。
套餐的部分是以雞湯為主的湯火鍋加肉片，雞肉很香沒有腥味很不錯。主食有白飯，可以加錢換購其他主食，加了20元換麻油麵線，麵線很香Q。
醬的部分，隨便調都很好吃。
自助bar的部分主要有蔬菜跟魚板甜不辣等火鍋料，選擇不多，但青菜都很新鮮好吃😋，芋頭很鬆軟香甜，吃的時候發現桌上有一碟胡椒鹽，搭配甜不辣魚板很好吃，是鹽酥雞用胡椒鹽。
甜點的部分有兩種口味的冰淇淋，旁邊有黑糖醬、美祿球、芝麻粉、Oreo粉跟黑糖雪Q，黑糖雪Q口感很好，很喜歡。
整體而言，乾淨舒服、食材有該有的表現，也許選擇不多，但對我來說已經很夠，比起同價位選擇多的餐廳那些吃了覺得雞肋的食物，已很不錯了。會再回訪。"
 Natalia Liao ,https://www.google.com/maps/contrib/117871636102882866658/reviews?hl=zh-TW,4,False,14,"優點：萬波霜淇淋跟鹹酸甜冰沙好吃，雞肉飯也好吃。
缺點：自助餐吧空虛，肉品量少，雞肉柴且無味，牛肉肉質也頗差，鍋底口味重又油，吃完立刻嘴破，店員背了半天產品介紹，還是不懂消費怎麼算，地板黏，牆壁滿是髒手痕，椅子上還有清桌後殘渣。
總結：不值那個價位，無法想像是王品旗下餐廳，同價位有其他更多選擇，本想給三星，給四星是因為鍋底沒加到肉（好扯），店員有補償小菜，且願意勉為其難的換大桌給我們（如果不能換，其他店員在旁邊打pass也別這麼明顯）
P.S有給5星就可以+$1吃炸雲朵，有興趣的都可以來給5顆星😀"
 SAM FAN ,https://www.google.com/maps/contrib/108345272912744018688/reviews?hl=zh-TW,4,True,43,"衝著網路上廣告尬鍋跟萬波聯名的珍珠奶茶鍋來的嚐鮮～
我覺得整體來說跟泰國椰奶鍋那種蠻像的🤣
以嚐鮮來說是酷的也不難吃但應該不會再點珍奶鍋，
他旁邊附的珍珠也是完全無糖的原本以為是黑糖珍珠食之無味有點可惜，
可能是要讓人丟下去煮所以就沒有調味，
菜是採自助式總類也算多所以這部分還不錯，
肉的品質也算中規中矩主食我覺得雞絲飯很好吃～
下次可以不要點珍珠奶茶鍋，想吃珍珠他自助吧甜點就有了🤣🤣🤣"
 林子庭 ,https://www.google.com/maps/contrib/117479628736537600839/reviews?hl=zh-TW,4,False,143,"第一次吃～新潮的台式熱炒鍋～
鍋底香濃好吃👍🏻辣子雞👍🏻剝皮辣椒雞👍🏻
海鮮肉品新鮮👍🏻
唯一美中不足的地方就是我跟結帳人員說炸雲朵的花生粉有「油挨味」她說她聽不懂😂
可能我真的老了⋯⋯
但請你們再看看花生粉的味道哦～真的感覺放蠻久的
還會二訪，因為蠻好吃的😍😍😍"
 Xaviera Ho ,https://www.google.com/maps/contrib/102889768062443175451/reviews?hl=zh-TW,5,True,377,"蔬菜火鍋料無限自助(我愛蔬菜自由💚)、雞油辣醬又香又辣🌶、大蒜蛤蜊雞鍋底有海量大蒜🧄，料好實在，但我是不喜歡火鍋煮帶骨的雞啦，短時間難入味，吃起來雞味重XD(等等還是它只是拿來熬湯不是要吃的?)，最大的驚喜是水晶餃!我不喜歡裡面包貢丸(內餡一整顆、吃不出肉的口感)的餃類和湯圓，他們家的裡面是細的絞肉，雖不到完美但是完勝市面上大部分水晶餃。

20220701"
 Grace H ,https://www.google.com/maps/contrib/100239359249452541600/reviews?hl=zh-TW,4,True,165,"第一次來，是網路評價很高的店！

今天點了梅花豬石頭鍋&金銀蒜頭蛤蜊雞鍋，副食點白飯&麻油麵線，蒜頭雞湯好好喝、麵線好吃！

自助餐檯的魚板、水晶餃、豆皮、芋頭都非常推薦，白菜、金針菇跟高麗菜自然是必備的菜品，整體而言，環境明亮、餐檯整潔、服務人員親切有禮、湯頭非常棒，值得推薦喔！

📌霜淇淋吧台的紅豆ㄧ定要加，超級好吃的😋"
 Joy Wang ,https://www.google.com/maps/contrib/101323575720328021114/reviews?hl=zh-TW,5,True,75,湯頭選石頭跟蒜頭雞，配菜bar很多青菜，配料新鮮，水晶餃超Q彈，甜點阿明白糖炸雲朵微甜但非常美味，萬波合作霜淇淋也很棒😎
 ashley chang ,https://www.google.com/maps/contrib/101476078144770218849/reviews?hl=zh-TW,3,True,583,裝潢特別，鍋底種類也不少，今天跟朋友點了兩套雙人餐，自助吧菜色種類雖不多，但都讓人感覺乾凈放心，飲料種類都是冰飲，熱飲就茶包，還有霜淇淋，不過對於不怎麼甜食的我，是太甜了點...服務也還不錯，因為我們避開尖峰時段，下午三點半用餐，所以一切都很快，用餐90分鐘
 Huang Jenny ,https://www.google.com/maps/contrib/102867269897703562524/reviews?hl=zh-TW,4,True,69,湯頭非常棒、用餐環境算乾淨，價位中等：鍋單點299-498，雙人套餐999，特色小點大約59起。除了熟食小點外，蔬菜、鍋料、醬料跟飲料吧自助取用。
 Ruri Tseng ,https://www.google.com/maps/contrib/110327498041298390645/reviews?hl=zh-TW,5,True,47,"新開幕尬鍋
第一次嚐鮮、很喜歡這邊用餐環境
超用心服務人員、推薦菇菇親切
東西多元化新鮮好吃"
 米妞妞 ,https://www.google.com/maps/contrib/108548818739515021568/reviews?hl=zh-TW,5,True,176,"服務態度好👍感覺每個服務人員都蠻認真的
櫃台特別介紹開幕打卡活動🎡
積極推廣只要有詢問都會介紹～
外帶🥡餐點還會附上主廚姓名和體溫
及餐點食用品嚐的最佳方法
內用有沙拉吧🥗可以取用
紅心芭樂冰沙～和霜淇淋🍦都蠻吸引人的
雞肉飯的特製醬汁下飯～下次想多加一點❤️
蛋🥚一定要半熟蛋！戳破配飯讚👍👍👍"
 Dean ,https://www.google.com/maps/contrib/108982821619748174937/reviews?hl=zh-TW,5,True,227,"來嘗試王品旗下新的火鍋品牌價格親民自助吧吃到飽
大推米血吃得到糯米顆粒剝皮辣椒雞湯頭很棒
環境乾淨舒適人多時排隊動線較亂
紅心芭樂冰沙不好喝化學味道重"
 Irene LIN ,https://www.google.com/maps/contrib/104917835221093568000/reviews?hl=zh-TW,5,True,47,"第一次來尬鍋，以後應該會常來🤣
這次點雙人鍋，剝皮辣椒雞湯&蒜香雞湯，裡面都有5-6塊雞肉跟蛤蜊，然後套餐還可以選兩盤肉，蛋白質滿滿！
套餐還有炸雲朵，伯爵口味的地瓜球，非常好吃！
套餐也有附炸彈，加白胡椒很好吃！也可以把炸彈放在白飯上吃，蛋黃流出來配白飯超讚！
現在還有跟萬波聯名出的湯頭，下次再來嘗試🥰"
 只吃好料 ,https://www.google.com/maps/contrib/118056394838495255004/reviews?hl=zh-TW,1,True,91,"(更.降為一星)
更新在這邊送給怕踩雷直接看最低評分的重點整理
A.餐點品質差白飯是軟爛的
B.用餐環境會有蒼蠅在飛
C.外場服務員完全不知道在幹嘛

另外補充一下為什麼更新評論
我覺得在這種餐廳有蒼蠅在飛就已經夠離譜了外場的處理態度更讓人匪夷所思

原本我想說有可能剛好我衰當天狀況特例就照著店經理的回應留言寄了信給『想聽取意見和建言的』店經理結果超過一週以上了也沒有收到任何回覆
所以我想店經理的職務大概就是上Google評論『維穩』
罐頭回覆打的好像很認真一樣
八成也只是做做樣子給上層看的吧
然後之後推出什麼評論五星送食物的活動來靠喪屍手法洗評價數

店經理都如此會有這種等級的食材品質管控、衛生管控、還有外場服務
我相信都不是很意外也讓我相信我用餐當天絕對不是特例
奉勸想來這家店嘗試的最好三思你的錢有更值得花的餐廳

--------------（原始評論）---------------
之前吃過尬鍋西門店覺得很不錯
看到有新開南京東店剛好前天晚上在附近忙到很晚還沒吃晚餐就來吃了但經驗實在是不太好xD

食材的部分基本上跟西門店一樣但唯獨銷魂雞肉飯表現的非常差
當初在西門店點了覺得很好吃但不知道是什麼問題可能當天煮飯的水比例不對導致白飯過於軟爛整個風味很差
其他食材的部分就跟西門一樣算是不錯的

服務的部分就有點尷尬了
不知道是不是因為新開店的關係外場們感覺蠻多值得改進的地方
像是我單人用餐卻在介紹時跟我介紹雙人套餐不過這點只是小疏失無傷大雅

比較嚴重的是我快吃完時居然有蒼蠅在飛…還好我當時已經吃得差不多
後來因為蒼蠅一直在我座位附近飛身邊沒有工具索性拿了菜單把蒼蠅打死在牆上接著我就告知外場店員我用他們的菜單打死蒼蠅並指了蒼蠅在牆上的屍體給他看然後把菜單交給他清理雖然我沒有講明所有的動作可以算是我的疏失但我認為一般外場看到蒼蠅屍體在牆壁上不是應該要出來清理嗎？！
結果外場拿菜單去清理後似乎就繼續做他其他的工作了等了一陣子蒼蠅屍體一直掛在我後面我受不了直接拿衛生紙處理但還有些蒼蠅的血水殘留在牆壁上最後還要我離場時跟收銀的講說要清理不然我猜一般應該不會特別清牆壁吧說不定就有細菌繼續在那邊滋生了
以上全部都是屬實我知道王品集團都會有主管級的認真看評論當天是6/15星期三蒼蠅大概是晚上22:20~40前後發生的事

簡單整理
衛生問題：為何會有蒼蠅在飛
品質問題：內場的白飯是否沒有品管
外場服務的問題：遇到突發事件的解決很荒謬
大概是這樣除了飯以外的食材大概值得4星但如果有人想要吃我會建議去西門店體驗反正距離也不遠"
 sisley shih ,https://www.google.com/maps/contrib/117016241226625152561/reviews?hl=zh-TW,4,True,235,石頭火鍋湯頭跟麻油雞鍋湯頭不錯，其他的還有剝皮辣椒鍋、蒜頭雞鍋等特色風味，菜盤採自助式吃到飽的方式，肉品就比較普通，雪花牛跟霜降牛都有點肉腥味，反而是豬肉好吃，厚度夠且完全沒有腥味，價格平實服務也不錯，生意非常好很受年輕人歡迎。
 周雅雯 ,https://www.google.com/maps/contrib/110689867498200664060/reviews?hl=zh-TW,1,True,13,"初體驗，也是最後一次機會
原本預想一人一鍋，居然給我來個鴛鴦鍋
桌面其實有點擠，菜盤肉盤也放上去
就已經沒什麼位子放碗
梅花豬肉片八片，但對我來說剛好
有些太薄就是了，沒有滿足
湯底有點油
餐後除了吃了冰淇淋
還泡了熱茶，去油解膩不錯
自助區菜菜跟火鍋料選擇不太多
但菜菜吃到飽是可以的
用餐時間太短，90分鐘吃鍋真的很尬
好歹扣掉點餐時間
CP值真的不高
所以沒有下次了"
 han jessica ,https://www.google.com/maps/contrib/102335651081904871497/reviews?hl=zh-TW,4,True,40,今天外面又下雨，突然很想吃火鍋，住晶華的最後一晚（住了一個禮拜想要回家了），老公下班過來也快八點，就一起散步去吃晚餐，沒想到聲音這麼好，竟然還要候位一組，但店員人很好馬上清理吃完的客人，讓我們10分鐘內就入座了。第一次來尬鍋，對於自助菜盤區覺得新鮮，可能是我年紀漸長，對於重口味的湯鍋真的不太行，口味其實不錯，推薦喜歡鍋物的人去吃吃看。唯一美中不足，竟然有蒼蠅，但慶幸的是他來的時候，我已經吃飽了…
 葛蕾絲 ,https://www.google.com/maps/contrib/115006240284238809095/reviews?hl=zh-TW,3,False,31,"服務蠻差的，話都含在嘴巴裡，加上口罩都聽不清楚
收餐盤的時候建議廚餘不要放在桶子裡面一起推出來，還沒吃飯就覺得噁心
口味尚可，湯頭有點淡
聽說是學萬客的風格，但還有段距離，應該不會再去了"
 Sabrina Huang (薩賓娜) ,https://www.google.com/maps/contrib/110361410775272478006/reviews?hl=zh-TW,5,True,102,"自助醬料少了黑醋有點可惜，自助取菜區選項不多，但很新鮮。
自主冰品普通，但搭配的小東西還不錯。
湯頭很棒！"
 雅庭施 ,https://www.google.com/maps/contrib/105414382698928574101/reviews?hl=zh-TW,4,True,167,第一次吃尬鍋，麻油雞湯頭不錯，很濃郁！青菜吃到飽的部分有不錯食材看的出來很新鮮！但種類不多醬料有店家特製辣油調製出來很香的醬料！冰淇淋是萬丹奶茶口味吃起來很有茶味！空間乾淨明亮！小小聚餐的不錯選擇！
 蕭冠孝 ,https://www.google.com/maps/contrib/118219471935481629508/reviews?hl=zh-TW,4,True,21,剝皮辣椒雞湯與蒜頭蛤蜊雞湯很濃郁，香氣十足。美中不足是雙人桌不夠大，食物擺滿桌面且有一座三層置放食物的架子，很有壓迫感，看到別人有桌邊小桌便詢問店員才提供，但其他桌即有主動提供，這部分需改善。用餐限1.5小時略感倉促。
 Francis Li ,https://www.google.com/maps/contrib/103281796222275115216/reviews?hl=zh-TW,4,True,151,"原打算去台中台式風味的火鍋店「湯棧」嚐鮮，因故取消

突然看到王品的一個新品牌「尬鍋」也以類似像是剝皮辣椒雞湯、蒜頭蛤蠣雞湯，麻油雞湯為訴求的火鍋

湯頭好喝，這次又是他們與「萬波」合作，點心的雙淇淋還可自己灑上紅豆、珍珠、黑糖汁，真的好吃極了。

再點上一份「萬波奶茶炸雲朵」，完美ending"
 Hsu Yiling ,https://www.google.com/maps/contrib/104632919868882961024/reviews?hl=zh-TW,3,False,6,"1.兩人位空間不大，一些碗盤和高湯罐只能被迫放在座位旁邊沙發上，或是坐位後方窗台。
2.自助吧的菜色、飲料、醬料選擇不多，拿了一輪就不知道要再拿什麼了，也沒有冰的無糖茶飲可以解膩。
3.環境略吵鬧擁擠，去拿自助吧或去廁所的動線，常常會跟服務人員的收桌推車碰上。
4.海鮮完全不行，蛤蜊很小，5隻蝦裡面有2隻肉質乾硬，2顆淡菜其中1顆超小而且肉只有一半；鯛魚土味超重無法入口。
5.湯頭一開始味道還不錯，但不管什麼口味都是加一樣的高湯，到最後吃起來都一樣死鹹。
6.炸蛋蠻普通的，就是荷包蛋，期間限定的炸雲朵就像更油膩版的地瓜球。而且有交代炸雲朵餐後上，還是跟大家說的一樣吃鍋吃到一半就突然端上來了。
7.雙人套餐說是肉有加量，但實際送上來的量並不讓人感覺有加量。

整體來說有待加強，不會想再訪。"
 wuro M ,https://www.google.com/maps/contrib/118103122548970387487/reviews?hl=zh-TW,5,False,17,"尬過真的很讚耶，吃過西門附近的尬過就愛上，但南京店女生服務生更棒(˶‾᷄⁻̫‾᷅˵)！
不管是湯底、炸蛋等小菜，上桌女服務生們都會主動分享不同的吃法，嘗試過後真的很不錯，烏骨雞嫩到翻掉！❤️❤️肉盤有點晚上🥲來的時候完全沒地方下，稍微可惜軟掉才煮ಥ_ಥ但服務品質各種推推推。"
 邱冠霖 ,https://www.google.com/maps/contrib/108210985747899131386/reviews?hl=zh-TW,5,True,60,"尬鍋開幕一年左右才第一次去吃
以價格來說的話算是挺不錯的
就算不點999元的雙人餐
也可以點個200多的豬肉片
再拿些青菜吃到飽
菜單推薦的剝皮辣椒雞湯確實不錯
如果再次光顧的話也會選同樣的湯頭
霜淇淋口感比較偏清爽
特色主要是有附贈一些巧克力粉跟麵茶粉可以加上去
麵茶粉跟霜淇淋滿搭的
推薦有去尬鍋的人試試看

交通方式最好以捷運優先
尬鍋就在捷運站旁邊
走路一下就到了
如果要開車的話反而很麻煩
中山捷運站周邊是精華地帶
如果想停車的話都要排隊一段時間"
 Lara Chang ,https://www.google.com/maps/contrib/111044647394794806455/reviews?hl=zh-TW,2,True,36,用餐時間為90分鐘（內含排隊加菜）夾菜區靠近門口，當日假日店員人手不足，導致現場凌亂＋應該給予餐點，卻需要再次提醒後才上。當日壽星的甜品，裡面慕斯被冰凍硬到炸，口感完全難吃到不行。
 小老百姓 ,https://www.google.com/maps/contrib/118162672765915745636/reviews?hl=zh-TW,4,True,214,"服務人員親切
自助吧cp值高，種類不少
只是有些菜黑黑的，可以加強一下
素食和石頭湯底口味美味
送的甜點不錯
奶茶冰淇淋好吃，蜜紅豆讚
豆乳的還好，珍珠有Q，不過沒有甚麼甜味
環境也乾淨
願意再回頭"
