user_name,user_profile_url,rating,local_guide,comment_num,comment_text
 KK ,https://www.google.com/maps/contrib/115366030490792049634/reviews?hl=zh-TW,4,True,83,"點了一份套餐與一個10吋披薩
套餐裡面的奶油蘑菇濃湯不是我的菜，跟理想中有點不一樣，但是沙拉還不錯吃，麵包很有嚼勁（但個人覺得烤過的話會更好吃）。
主餐選擇海鮮義大利麵，料給的滿大方的，口味偏清淡，我比較喜歡健康路線，所以覺得還不錯！
飲料選擇烏龍奶蓋，味道是偏淡但喝得到茶葉，應該是用茶葉沖泡，有淡淡的茶香。
披薩的話口味則是偏Q彈，不脆，口味還不錯！
還有加點一份炸飯糰，這個有點小失望，感覺很像在吃薯泥😂。
兩個人的話建議披薩點8吋即可不然會太飽～整體而言是用料口味都偏健康路線的店，吃重口味的人可能比較不會喜歡！"
 zeus chou ,https://www.google.com/maps/contrib/112294638091937677395/reviews?hl=zh-TW,3,True,90,義式薄片比薩…在台北算道地。😃
 陳偉群 ,https://www.google.com/maps/contrib/117967941509918900898/reviews?hl=zh-TW,3,False,44,可能習慣台灣牛排店若不要麵雖不會退錢也會多加顆蛋，這家店則飲品超過加錢合理也應該，但當飲品金額不符60塊時，就會說只提供一瓶，不會退錢也沒有額外得到什麼，即然如此我建議氣泡水也賣120這樣就不會爭議，這次處理我是不太滿意，僅僅如此。
 Yiru Tzeng ,https://www.google.com/maps/contrib/118400027185968271290/reviews?hl=zh-TW,4,True,10,餅皮口感紮實有嚼勁，店內客人不多，氣氛舒適，服務也很親切。
 小庭劉 ,https://www.google.com/maps/contrib/103830428486593840744/reviews?hl=zh-TW,4,True,95,環境美，空調夠，餐具也漂亮，餐點好吃
 林家禾 ,https://www.google.com/maps/contrib/106450630357615739705/reviews?hl=zh-TW,2,False,10,"南瓜湯/蕈菇湯：鹹度不夠，口感不細緻
青花筍義大利麵：鹹度不夠，水份太多，風味普通
茴香豬肉比薩：很濕、餅皮都泡爛了
烏龍奶蓋：很水很淡

環境優美、餐具優美，但是一間餐廳的命脈絕對是餐點的品質啊啊啊啊啊啊🙄🙄🙄

由於點餐要先結帳，不小心加了兩百元辦會員，因為之後外帶比薩第二個半價，沒想到這麼雷，吐血。"
 Jorie H. ,https://www.google.com/maps/contrib/114768596691423103972/reviews?hl=zh-TW,5,False,6,"在常經過的街區突然開的新店舖，在連假的午餐時段沒有多做功課決定前往一訪。由於沒有訂位，有一段可以預期的等候時間，還好食物讓我們都很滿意。

沙拉與湯表現中規中矩，喜歡水牛乳酪披薩與carbonara扁麵。
披薩餅皮吃起來沒有負擔，口感清爽、有嚼勁又不至於吃力，個人本身偏愛buffalomozzarella的味道，一旁有提供自取的橄欖油，淋上後與橄欖油的微辛辣感搭配也很美味。但盤底有點濕，不曉得是披薩出汗還是什麼原因。
麵的部分，麵體料理的很好，適合不是那麼習慣吃正統麵心偏硬的義大利麵的人，厚切培根也不是很常可以在餐廳遇到，因此加了很多分，唯一就是個人沒有很喜歡大量的黑胡椒。

可惜西西里冰糕賣完了，下次希望可以順利吃到。

**特別欣賞店員告知沙拉可能會晚點上，是否介意披薩先來這點。"
 J W ,https://www.google.com/maps/contrib/117954634392380097424/reviews?hl=zh-TW,5,False,6,手做的窯烤披薩好好吃～店裡的裝潢很有異國情調，紅白酒喝起來很順口，聽說是老闆嚴選的酒莊，東西的價格很實在喔～推推推
 Robin Lin (Robin Lin) ,https://www.google.com/maps/contrib/104690538295949580015/reviews?hl=zh-TW,5,True,124,"pizza非常道地，酒醋、油、芝麻葉，都給到位。
義大利特色餐點很多，可以慢慢挑戰，但不是每種都合台灣人口味。"
 KC Chen ,https://www.google.com/maps/contrib/116018661529393140957/reviews?hl=zh-TW,5,True,73,"來這吃過兩次，兩次都很滿意，但讓我感到一定要來寫評論的卻是另一家店。

今晚滿心期待去了某家標榜拿坡里式披薩的店，因為根據報導他們拿過一些比賽的第一名、第二名，而且還要排隊，沒想到湯、披薩、附餐、飲料，不是很平凡就是不好吃，且內用也是免洗餐具，自助取餐和收盤。這一切都讓我滿心想念薩朵。

薩朵的一切顯示出用心，對客人整體用餐感受的用心。餐點好吃是當然的，寬敞明亮的空間，精緻美麗的餐具，隨和有禮又自信的服務......

薩朵，請原諒我現在才知道要珍惜你。"
 Benson Lee ,https://www.google.com/maps/contrib/112395237687403493307/reviews?hl=zh-TW,3,True,398,食物還不錯！服務就別太要求，點餐過程就是麥當勞模式，自己到櫃台，盤子餐具自己拿，這都可以，因為沒有服務費，但我覺得可以不用這麼冷默，一附在跟販賣機說話沒什麼兩樣，老闆都這樣，員工勢必也是囉！餐點上完，特地走去櫃台告知咖啡可以上，非常冷默的員工，沒有任何表情跟回話，你要當她已經聽到，機器人可能還會回應你，當然少數一兩個高高的男女還是有熱情一點，但我看大概這家店就這樣了吧！別太強求，就是樓下不錯吃的小吃店吧！別要求太高
 Yuanfu Chang (張元福) ,https://www.google.com/maps/contrib/112152643642644691641/reviews?hl=zh-TW,4,True,23,餐點滿特別的，可以吃吃看
 林群華 ,https://www.google.com/maps/contrib/116608154262150802953/reviews?hl=zh-TW,5,False,15,這裡很有網美氣氛，一進門服務生很親切，廚房師父，不知道是有選過還是怎樣，每個顏值都很高，我點了海鮮麵跟有火腿的披薩（忘記菜名）麵的海鮮真的是豐富，披薩跟外面打沒熱斃剩殼等等都不一樣，餅皮真是絕的好吃，後悔沒有點大份，下次去吃一定要點個大份，來滿足我的胃
 Jerry Ho ,https://www.google.com/maps/contrib/100195386131716163564/reviews?hl=zh-TW,2,True,18,餐點可以，服務不行，荒唐的是多拿一個水杯竟然說有配量...又沒有客滿在那邊...
 黃俊元 ,https://www.google.com/maps/contrib/116250991136057093556/reviews?hl=zh-TW,3,True,327,"今天跟朋友約在這間林口街附近新開不久的餐廳，
一進去服務人員看到我太太抱著小嬰兒，
就很友善地幫我太太提嬰兒推車，
也很貼心的幫我們安排到比較適合小嬰兒的座位，
這點真的很加分！

美中不足的是我結完帳是中午12點02分，
但我和我朋友點的義大利麵卻遲遲不來，
過了12點半，眼看著我太太點的披薩都吃光，
看著別桌比我晚結帳的都滿桌餐點，
我驚覺我們是不是被漏單了。
稍微詢問了服務員主餐還沒來，
但又過了數分鐘依然沒下文，
只好又再問另外一個服務員，
總算在12點46分我們的麵出現在桌上了，
但我早就餓扁了！

我覺得用餐環境舒適、餐點也不錯，
但漏餐這點真的讓我吃得很不高興，
餐廳我們訂的，
結果讓朋友餓這麼久覺得對她很抱歉，
而且最後只得到服務人員說「不好意思」四個字，沒有其他說明或補充。
我聽隔壁桌的說好像是送錯餐點到別桌了，
只能說員工訓練還要再加強。"
 jammy2704 ,https://www.google.com/maps/contrib/112333289273609081412/reviews?hl=zh-TW,4,True,90,披薩跟開胃菜還不錯吃但量不多CP值普通嚐鮮還可以～
 Tina Lht ,https://www.google.com/maps/contrib/102026871207568229919/reviews?hl=zh-TW,4,True,130,環境明亮、餐點精緻👍👍👍
 CL Chin ,https://www.google.com/maps/contrib/106755745385315624530/reviews?hl=zh-TW,5,True,620,餐點都非常好吃，使用的橄欖油感覺品質相當不錯，匹薩的面皮軟Q帶勁，個人覺得非常好吃，點的前菜也在水準之上，價格較一般店家稍高一點點，不過比起換來的品質相當值得，非常推薦喜歡義大利美食的人來嘗試，記得先訂位以免久候。
 Skang ,https://www.google.com/maps/contrib/112395029576838791735/reviews?hl=zh-TW,5,False,7,"想吃披薩的首選,餅皮好吃!"
 盧威辰 ,https://www.google.com/maps/contrib/106546197660428269751/reviews?hl=zh-TW,5,True,53,"吃過最好吃的pizza
感動~"
 薛屹廷 ,https://www.google.com/maps/contrib/101446708401881127379/reviews?hl=zh-TW,5,True,37,好吃😋我們比薩點了起司五重奏和佛羅提那，比薩皮薄但嚼起來很Q韌有彈性，越嚼越香，餡料的調配也很好吃，燉飯點了墨魚和松露野菇，墨魚燉飯一致好評，每一口都感覺墨魚在嘴裡游泳那樣夠味，燉飯的飯粒是偏硬的我喜歡。
 George Georgechiyeh ,https://www.google.com/maps/contrib/117029982148768572912/reviews?hl=zh-TW,5,True,20,好吃，尤其是麵包跟前菜水準都很高，披薩也不錯吃
 林惠儀 ,https://www.google.com/maps/contrib/109865449323368631716/reviews?hl=zh-TW,4,True,504,整體都很好吃～
 Virginia Chou ,https://www.google.com/maps/contrib/117369604003420570870/reviews?hl=zh-TW,5,True,58,"好吃～～～～
尤其是青醬麻花麵，喜歡偏硬的麵體+帶葵花香的青醬～～～第一次吃超喜歡！"
 蓉 ,https://www.google.com/maps/contrib/100193730988644664001/reviews?hl=zh-TW,1,True,215,"一年多前我在Napoli花不到10歐元，點了瑪格麗特+咖啡，就已經8、9分飽了
回臺灣以為這間可以讓人回味一下當時的風味，沒想到價錢不僅是當時的1.7倍就算了，點了這間的500元set還只有5分飽的感覺，Pizza口感和飲品風味也輸多了"
 Kuo Fish ,https://www.google.com/maps/contrib/100693335770429290694/reviews?hl=zh-TW,5,True,28,"pizza、義大利麵、燉飯都很好吃！
不過這次點的海鮮pizza皮跟料會分離，吃的時候有點小不方便

特別推薦辣雞翅，雞翅烤的很脆，附的辣醬很香也會有點辣，超級好吃😋"
 入江百合 ,https://www.google.com/maps/contrib/100949208132093192593/reviews?hl=zh-TW,5,True,83,"超級好吃～～～～～
只是因為上班必經之路，很好奇決定光顧一下
天哪～～～薯條真的不誇張
是我吃過餐廳裡最好吃的薯條沒有之一
松露味超香！！！！
我可以一個月吃一次沒問題"
 T Carrie ,https://www.google.com/maps/contrib/117515113226518794886/reviews?hl=zh-TW,4,True,703,"披薩好吃，但是底下好多油😲
皮也好薄，很容易垂下來🤣
薯條跟沙拉都很好吃🥗😋
服務生親切，廁所乾淨
有看到一桌義大利人在這待了很久～"
 張一凡 ,https://www.google.com/maps/contrib/115555469059650188298/reviews?hl=zh-TW,3,True,209,"或許是純正義大利口味，感覺味道過於清淡，習慣台灣味義大利麵的朋友可能會極不習慣。
現場裝潢氛圍很美，尤其夜晚。"
 Penny Chen ,https://www.google.com/maps/contrib/109427993282615148274/reviews?hl=zh-TW,2,True,84,"看了評論以為能在台北吃到接近於義大利式的披薩
結果頗失望

點了兩分pizza餅皮底部都是濕的
義大利麵帶有奇特味道

可刷卡不收服務費自助式取餐具和加水"
 Wen-yuan Chan ,https://www.google.com/maps/contrib/110012121372061566300/reviews?hl=zh-TW,5,True,71,披薩皮很Q味道都很不錯，想起了義大利吃的披薩，松露野菇燉飯也很夠味（這應該是五辛素才對不該只標素食），提拉米蘇只能說完美，非常濕潤滑口，風味十足，我可以天天吃。
 蕭雲 ,https://www.google.com/maps/contrib/117516782027201893062/reviews?hl=zh-TW,5,True,148,披薩很有口感，炸海鮮拼盤食材新鮮，火腿搭配麵包也很好吃；提拉米蘇味道濃郁，但希望能把裝飾的小金球換掉，誤食會影響口感
 Mike HSIEH ,https://www.google.com/maps/contrib/109560723475944828498/reviews?hl=zh-TW,5,False,1,這家拿坡里披薩超極道地好吃、店家也超好拍，聽店家說牆上的插畫還是請有名的藝術家畫的，還有供插畫的服飾拍照，店家人也很nice，總而言之不囉嗦，店家鹹的pizza也好、甜的pizza也好、還有些義式料理都讚讚讚，真心推薦唷真的真的真的唷！我吃n次啦😂😂吃不膩
 李鴻甫 ,https://www.google.com/maps/contrib/109125847998787483978/reviews?hl=zh-TW,4,True,38,起司四重奏披薩很好吃，豬肉和白醬菌菇就一般般沒有特別印象，當天3人用餐，其中2個女生，點兩個大披薩並加購了兩個298套餐，老闆仍多次建議需要加點個沙拉or炸雞，所以決定多點了炸雞翅，但最後真的有點太多吃不完，而且炸雞真的不算美味也沒炸透，骨頭邊都還是紅的，讓我學到教訓就是到披薩店就吃披薩就好。
 吳逼逼 ,https://www.google.com/maps/contrib/110875873437274857656/reviews?hl=zh-TW,2,True,65,"外帶的披薩是冷的,其他開味菜份量也很少,口味還可以"
 Jason Wu ,https://www.google.com/maps/contrib/102508673757710846922/reviews?hl=zh-TW,5,True,264,Pizza超好吃，麵皮鬆軟，烤的恰恰好。推薦來吃！
 Hsin ai Shen ,https://www.google.com/maps/contrib/115539746316450507928/reviews?hl=zh-TW,5,True,37,非常道地的義式Pizza餅皮Q彈，邊緣脆薄，如果習慣連鎖pizza店口味應該會不習慣。當天點選白松露蘑菇口味，松露與起士結合口味相當好。非常推薦，店員服務也很好
 Chang Jack ,https://www.google.com/maps/contrib/114140087459600254038/reviews?hl=zh-TW,1,False,4,餐點份量少，cp值不高。點了燉飯340元，完全吃不飽。比東區ㄧ級戰區的同價位燉飯份量還少。不推薦。
 果果女友 ,https://www.google.com/maps/contrib/117397309551105768218/reviews?hl=zh-TW,5,False,48,非常美味但吃不飽
 Jing Sun ,https://www.google.com/maps/contrib/104686170995539470368/reviews?hl=zh-TW,4,True,120,餐點還不錯吃但是要注意套餐的甜點會有限制
 louis ,https://www.google.com/maps/contrib/109288814637989944250/reviews?hl=zh-TW,1,False,12,"這間店的披薩和義大利麵味道與水準非常非常的不穩定,似乎有不同的主廚在輪流排班掌廚,如果遇到手藝不好的內場人員,只能摸摸鼻子!"
 林胖胖 ,https://www.google.com/maps/contrib/110567998177027749437/reviews?hl=zh-TW,3,False,18,"披薩跟甜點都還不錯吃
今天去的時間可能不對因為只有披薩跟甜點可以選擇，但是被安排的座位剛好在地雷區，旁邊有一大桌員工的親友團，小孩很吵還在沙發上跳，然後媽媽從頭到尾都用丹田在講話，單獨的椅子小孩一直撞來撞去，感覺好像親子餐廳。用餐到一半隔壁也來了一家帶兩個小孩，小孩直接掛在我椅子上玩⋯其實有點崩潰！
餐點可以但是用餐的環境太令人崩潰可能是挑的時間點不對⋯⋯但也不敢去了！"
 han daddi ,https://www.google.com/maps/contrib/112306235768171828428/reviews?hl=zh-TW,5,True,210,"道地的義大利風味，有點軟Q又有窯烤焦香味的pizza！
在國館附近的店面就愛上這間店，現在搬到永春還是一樣是死忠顧客！
喜歡捲著吃配上芝麻葉＋沾一點葡萄醋，超級美味

另外推薦炸海鮮，有一次吃到店家的創意加上炸檸檬片，覺得驚為天人！超推薦！"
 鄭承珞 ,https://www.google.com/maps/contrib/100059604448588961683/reviews?hl=zh-TW,3,False,17,點了拼盤，墨魚燉飯及鮮蔬歐姆披薩，整體食物味道偏淡，我個人還可以接受，喜歡重口味的朋友得有心理準備，總體而言並沒有特別驚豔
 Hsin1 ,https://www.google.com/maps/contrib/100677240894971770786/reviews?hl=zh-TW,3,False,13,用餐環境跟服務品質不錯，麵包跟比薩餅皮好吃，但餐點味道都偏淡，尤其墨魚燉飯很沒味道...整體來說不太合我們口味
 kaochi kiki ,https://www.google.com/maps/contrib/115462479287296866269/reviews?hl=zh-TW,2,False,33,白色頭髮中年男子講話讓人不舒服、服務態度差
 YJC Make Friends with the World ,https://www.google.com/maps/contrib/102959838693800612256/reviews?hl=zh-TW,5,False,49,忘記留過評價了沒有。白松露野菇披薩超好吃，過了幾天還是很想念那個味道
 瞇瞇眼 ,https://www.google.com/maps/contrib/116726688283605639353/reviews?hl=zh-TW,4,True,64,每面牆都很特別，很適合網美來，pizza比義大利麵好吃，特推焦糖瑪茲卡邦，甜甜的，不會太甜，餅皮外酥內Q
 佬天爺房仲Jenna&Jim ,https://www.google.com/maps/contrib/107018026132783918287/reviews?hl=zh-TW,5,False,13,東西超好吃，老闆人超熱心，下次會再來
 Michelle Chun-han Hsu ,https://www.google.com/maps/contrib/111884008264930810662/reviews?hl=zh-TW,5,True,44,店家曾赴拿坡里學藝，披薩遵循拿坡里作法，外圈餅皮偏厚講究筋道，內圈薄軟，醬酪相融。
 Leo Lee ,https://www.google.com/maps/contrib/114650143938844648667/reviews?hl=zh-TW,4,True,152,道地的北義pizza義大利餐廳，pizza的餅皮鬆軟Q度剛好，食材也不錯。雖然換過老闆，但能在東區這個一級戰區開那麼久，口味還是有相當的實力。
 Olive Li ,https://www.google.com/maps/contrib/104277318247064164724/reviews?hl=zh-TW,1,False,4,披薩餅皮完全是爛的，拿起來上面的料都掉下去了，完全感受不出特地到義大利學藝師父的功力，價位頗高但是料卻很少，海鮮義大利麵完全沒有調味，非常難吃一口都吃不下去，端上來是冷的，服務人員身上煙味超重過年期間又不能刷卡完全不推薦的一間店！
 楊蘇菲亞 ,https://www.google.com/maps/contrib/109084833487713668954/reviews?hl=zh-TW,5,True,29,"自己釀的啤酒很順,在夏天喝時候最沁人心脾。開胃小菜也很棒,貓耳朵料理及披薩都超級推。"
 Jill ,https://www.google.com/maps/contrib/117475431110367977728/reviews?hl=zh-TW,4,True,157,披薩很好吃，但試過沙拉、炸飯糰跟卡諾里都很普通⋯
 Yukai Chen ,https://www.google.com/maps/contrib/113544565270370237040/reviews?hl=zh-TW,5,True,447,披薩口感口味都獨特，非常美味
 李茹婷 ,https://www.google.com/maps/contrib/116458049177433713938/reviews?hl=zh-TW,1,False,2,"只有兩個字———「難吃」
義大利麵吃起來有種非常奇怪又噁噁的感覺
就連最重要的披薩也很糟糕，吃到最後都想吐了
建議大家不要來這裡花大錢壞了自己的胃"
 張璿 ,https://www.google.com/maps/contrib/114249076516280521755/reviews?hl=zh-TW,1,False,3,Pizza味道普通，但底部整個是濕的，拿起來後料全掉下來。炸海鮮味道普，但80%的內容物都是小蝦跟魚，其他種類只有1塊。
 想好了沒 ,https://www.google.com/maps/contrib/103240865242447643890/reviews?hl=zh-TW,5,False,10,第一次來吃，就是好吃
 Jimmy Wang ,https://www.google.com/maps/contrib/112097909714561137920/reviews?hl=zh-TW,5,False,1,"禮拜五來用餐，餐點美味不在話下！重要對是服務人員的態度讓我非常滿意！
當天下午接到服務人員來電告知，洗手間因為馬桶堵塞，當天可能無法使用洗手間！當下覺得哪有一家餐廳能細心到這種地步！雖然只是一通短短的通知，確讓我覺得受到尊重！點完餐後先結帳，居然不收服務費！說真的！這比台北市絕大部份的餐廳（有收服務費的）服務還好！太讓我驚豔了！"
 張家榮 ,https://www.google.com/maps/contrib/103464075937917077547/reviews?hl=zh-TW,3,True,61,"我推義大利麵，Pizza就我個人感覺是還好，可能點的東西不適合我，
服務的部分中上程度，環境也不錯"
 Loretta Cheng ,https://www.google.com/maps/contrib/102128814628609227959/reviews?hl=zh-TW,5,False,11,薄片餅皮有麥香，中間餡料是濕潤的口感，雖然和我想像的不太一樣，不過餡料新鮮不錯吃～重點是甜點的烤布蕾細緻滑口，提拉米蘇也好好吃！
 鬍子才是本體 ,https://www.google.com/maps/contrib/104006375832139607403/reviews?hl=zh-TW,5,True,94,不只是網美店，主廚有在國外磨練真功夫。好吃的也不只是披薩，前菜一樣美味。
 yilin wang ,https://www.google.com/maps/contrib/112407971379435654266/reviews?hl=zh-TW,5,False,1,餐廳氣氛舒服，前菜湯品料多好喝，墨魚燉飯驚豔，披薩好吃，雖沒有收服務費，但期間不斷幫我們加水，謝謝。
 章阿彬 ,https://www.google.com/maps/contrib/107109511839081721708/reviews?hl=zh-TW,5,False,13,很貼心的服務！餐點非常好吃
 Fion K ,https://www.google.com/maps/contrib/107229719655796522844/reviews?hl=zh-TW,5,False,9,不同口味pizza都有獨特風格，超好吃，紅石榴無花果超好喝～～～讚讚讚～～～戶外區也很適合開party。
 湛有慈 ,https://www.google.com/maps/contrib/115357633327510218829/reviews?hl=zh-TW,4,True,58,批薩真的好吃，感覺得出來是有到義大利學過的手藝，但服務態度可以再好一點，女店員感覺愛理不理
 Michelle Lee ,https://www.google.com/maps/contrib/101628524777267967800/reviews?hl=zh-TW,3,True,752,點了瑪格麗塔跟義式臘腸披薩，最愛餅皮，軟Q有彈性，料不是台披薩花樣這麼多，單純的滋味。（沒遇到餅皮濕濕沒烤好的狀況）
 DAVID CHOU ,https://www.google.com/maps/contrib/107673655960274111683/reviews?hl=zh-TW,1,True,33,"Pizza麵皮可以但料很普通尤其拿起來料全掉感覺很差
炸海鮮還可以
安地帕斯拼盤悲劇了那個量...
燉飯不ok
整體..cp值極低
可惜了漂亮的裝潢"
 Mei Lin ,https://www.google.com/maps/contrib/108907777327354899333/reviews?hl=zh-TW,5,True,31,第一次光顧點了店家推薦的披薩口味，真的很好吃!之後還會想再試其他的.
 WanYing Lin ,https://www.google.com/maps/contrib/117856777993125764347/reviews?hl=zh-TW,5,True,30,服務親切，也不會很有壓迫感，店內空間裝潢不算特別突出，但很舒適，披薩非常好吃，已經二訪，會願意再訪！
 泰咪 ,https://www.google.com/maps/contrib/107957758421647280552/reviews?hl=zh-TW,4,True,63,"Pizza皮Q本身有鹹度
風味不錯
燉飯的飯是屬於醬跟飯較分開飯粒大顆的
田園沙拉的料跟份量較一般"
 Michael Chang ,https://www.google.com/maps/contrib/107074187611218389122/reviews?hl=zh-TW,5,False,29,餐點水準高，用餐環境舒適
 陳聖穎 ,https://www.google.com/maps/contrib/110355389086401520447/reviews?hl=zh-TW,5,True,58,比薩很好吃，餅皮香酥，口感Q軟，各食材味道都有表現出來，口齒留香
 Nana Chen ,https://www.google.com/maps/contrib/113274212717777107573/reviews?hl=zh-TW,3,False,9,"燉飯份量非常少，其中的米飯更是少，以這個價位來說實在不划算。
披薩的料太少，不夠紮實。"
 Kenta Lin ,https://www.google.com/maps/contrib/110750166034389114364/reviews?hl=zh-TW,5,True,15,"好吃死了
服務員也很熱心的介紹餐點與推薦
自己去櫃檯點餐省了一筆服務費
這個價格可以品嘗到高級餐廳的口味
上餐速度也很剛好
道道都覺得很驚喜很值得再回來消費的店👍
不給5顆星太對不起自己了"
 Ming Li ,https://www.google.com/maps/contrib/116687894784561240098/reviews?hl=zh-TW,4,True,37,披薩好吃！價位偏中高，但跟其他披薩不太一樣蠻有特色的
 Sui Lee Kang ,https://www.google.com/maps/contrib/100237503696073218865/reviews?hl=zh-TW,5,False,33,"披薩的手工餅皮真的好好吃
每個月五號外帶買一送一也不馬虎
好可惜七月份好像要停業了😢
希望可以換地方台北市數一數二的餅皮💕"
 陳淑玲 ,https://www.google.com/maps/contrib/106764263265191738111/reviews?hl=zh-TW,5,False,1,"氣氛佳~服務態度良好!出餐速度快!
餐點項目多非常好吃喔~👍"
 iris i ,https://www.google.com/maps/contrib/112296475357522817140/reviews?hl=zh-TW,1,False,7,完全沒有人的一間店，店員素質有點低說話時菸味很重，吃東西一直看。價格又貴！pizza餅皮很多地方燒焦且沒有什麼料，不會再去第二次了。超雷的一間店
 OOO Liu ,https://www.google.com/maps/contrib/104653336197150004736/reviews?hl=zh-TW,4,True,136,"窯烤披薩皮很好吃，不過有的口味可能料容易出水，餅皮也變得爛爛的
義大利麵也不錯，味道豐足"
 Tiffeny Chen ,https://www.google.com/maps/contrib/111332308755813124311/reviews?hl=zh-TW,5,True,16,Vegetarianfriendly~料理是比較西式的做法，燉飯米心有點硬的那種，口味整道吃下來不會太膩。商業午餐點主餐會附沙拉/湯/飲料，附餐有一定的品質，生菜鮮甜，麵包柔軟，湯也沒有加雞粉之類的加工品。一群人如果有吃素的朋友聚餐可以列入考慮。
 Fish Yao ,https://www.google.com/maps/contrib/101778450430052127888/reviews?hl=zh-TW,2,False,26,"之前第一次吃的時候覺得很好吃
今天吃的時候味道都變了
無論是義大利麵還是披薩都很鹹"
 Chou Tien-chi ,https://www.google.com/maps/contrib/117348031986823530573/reviews?hl=zh-TW,1,True,219,烤焦的海鮮披薩，麵皮上整個水水的。炸乾乾的雞翅配上辣醬就稱辣味雞翅，這樣的品質還那麼貴的價位，超不推薦，讓他自然淘汰吧
 黃阿雅 ,https://www.google.com/maps/contrib/106954400235418219117/reviews?hl=zh-TW,2,False,46,"無花果比薩完全沒味道非常清淡
義大利麵過鹹過油膩
南瓜湯也沒味道
烏龍奶蓋好難喝"
 Z L ,https://www.google.com/maps/contrib/116595748468662207005/reviews?hl=zh-TW,4,False,30,"披薩口味都喜歡，麵類也好吃。
二訪保持一樣的好吃。
半自助式，服務人員服務好。"
 曹時瑋 ,https://www.google.com/maps/contrib/117354398250204261196/reviews?hl=zh-TW,5,False,5,當天用餐服務和餐點都滿分
