user_name,user_profile_url,rating,local_guide,comment_num,comment_text
 Amulet Tsao ,https://www.google.com/maps/contrib/110377575402771971002/reviews?hl=zh-TW,4,True,124,上班日的中午來用餐，商業午餐的組合蠻划算，一般晚餐可能會有點小貴。餐點pizza正宗，麵餅很道地，據稱拿坡里風格的配料也有些在台灣很難嚐到的美味。家人點的燉飯也還不錯，用料大方，青醬口味很協調。套餐沙拉一點也不隨便，油醋恰到好處，值得好評。可惜洗手間不太乾淨，給人感覺髒舊，在這個價位的餐廳來說，算是不太應該的問題。
 Liu Chang Yi ,https://www.google.com/maps/contrib/110951843728656392749/reviews?hl=zh-TW,5,True,286,隱身東區的美味Pizza店，老闆比賽得過很多獎，真是頗好吃，環境跟服務都很棒
 Steven Jang ,https://www.google.com/maps/contrib/102947610175814472879/reviews?hl=zh-TW,5,True,27,東西超好吃，披薩個人喜歡濕軟的皮，口感真的好到沒話說，跟我在台北其他地方吃的披薩店非常不一樣
 Rosa Liu ,https://www.google.com/maps/contrib/115625096482276399597/reviews?hl=zh-TW,4,True,493,道地好吃，奶油蕈菇燉飯搭配芝麻葉很對味。可惜松露薯條味道很淡
 王文慶 ,https://www.google.com/maps/contrib/111083344418440299177/reviews?hl=zh-TW,5,True,60,飯麵披薩都還不錯吃，但份量少了點
 Hsiaoai Chang ,https://www.google.com/maps/contrib/116733474000509466997/reviews?hl=zh-TW,5,True,158,綜合海鮮細扁麵和pizza都很好吃，甜點也很有水準。
 Wen Chang ,https://www.google.com/maps/contrib/117124644513760680578/reviews?hl=zh-TW,5,True,18,餐點好吃，更推餐前麵包
 Tu Amos ,https://www.google.com/maps/contrib/112813150895398280239/reviews?hl=zh-TW,5,False,17,之前去了義大利拿坡里吃過不少披薩，就算在拿坡里當地也很難吃到像這家店這麼用心做出的餅皮，真的很推薦來品嘗！
 hann cheng ,https://www.google.com/maps/contrib/101315542886354757855/reviews?hl=zh-TW,4,False,28,"二訪，披薩很好吃，非常喜歡。（甜、鹹）

但套餐的南瓜湯很淡感覺沒味、飲料點拿鐵很普通。"
 Johnny Yum ,https://www.google.com/maps/contrib/104443592867395748041/reviews?hl=zh-TW,5,True,167,好吃!披薩餅皮鬆軟、材料新鮮味道很好!!前菜拼盤也很滿意，用餐環境很舒適，服務親切，餐廳裡也有球賽轉播。
 Nicolla Chen ,https://www.google.com/maps/contrib/115827683107832621047/reviews?hl=zh-TW,5,True,103,道地，用料實在新穎，很久沒有吃到會讓人驚豔的食物了，裝潢擺設很美，適合拍照
 TERESA HUNG ,https://www.google.com/maps/contrib/108616693882987831147/reviews?hl=zh-TW,5,True,67,服務很好，Pizza超好吃，Pizza的皮很Q且不會乾，目前吃過最好吃的Pizza!這間店很多蛋奶素的餐！
 A C ,https://www.google.com/maps/contrib/114157504918416500186/reviews?hl=zh-TW,5,True,39,"約會的好地方，披薩好吃😋
建議先預約，有些口味晚餐可能點不到"
 Phyllis Tsai ,https://www.google.com/maps/contrib/107874065587019432094/reviews?hl=zh-TW,4,True,333,美味的pizza和海鮮義麵烤綜合蔬菜值得等待餐具精心挑選看了心情好要再回訪
 陳雯淇 ,https://www.google.com/maps/contrib/102118823465601764577/reviews?hl=zh-TW,4,False,3,環境明亮，座位寬敞，比薩味道中規中矩，吃得出來麵皮的勁度。聽說是從東區搬到林口街，在當地又多一處美食，挺樂見的。半自助方式，無服務費。需至櫃台點餐和先結帳。
 Lisa wang ,https://www.google.com/maps/contrib/115488719991847796899/reviews?hl=zh-TW,1,False,3,"跟朋友聚餐

一個“高高短髮，染頭髮的女店員

服務態度差！！盤子放在餐桌上很大力
感覺欠她錢似的！

有夠跨張！扯！😡😡😡"
 YuHuei Huang (Pinao Cat) ,https://www.google.com/maps/contrib/107309913742531377310/reviews?hl=zh-TW,5,True,568,"聚餐好地方
可以多人一起分食披薩
餅皮很Q不油"
 Meg Lee ,https://www.google.com/maps/contrib/110317030162087186288/reviews?hl=zh-TW,5,True,24,"氣氛服務都好
甜的披薩也很好吃👍
價位很ok!!!!!
濃湯真材實料愛菇類不可錯過"
 fifi Huang ,https://www.google.com/maps/contrib/104277761952187126449/reviews?hl=zh-TW,3,True,"1,141","服務態度很積極，pizza是還蠻好吃的，但pizza底部會出水或油，用手拿起來吃會沾的手上都是，
奶油磨菇湯好喝，tiramisu也不錯~"
 jade chang ,https://www.google.com/maps/contrib/114156240220454483327/reviews?hl=zh-TW,4,True,16,Pizza好吃，價格已份量來說稍貴。假日中午人少舒適，店員親切
 小路班比 ,https://www.google.com/maps/contrib/112081077865745340172/reviews?hl=zh-TW,5,True,865,"義式批薩
好吃
店內舒適
可惜平日有午休
價日全日"
 lu sophia ,https://www.google.com/maps/contrib/111634987009831223808/reviews?hl=zh-TW,5,True,76,"餐點好吃，
披薩非常可口，
適合全家大小一起！"
 Jay Huang ,https://www.google.com/maps/contrib/106841327020721358216/reviews?hl=zh-TW,4,True,485,"價位偏中上，但吃的出來是真材實料。
東西都好吃！服務也算蠻親切的。"
 周早安 ,https://www.google.com/maps/contrib/108774591770352803691/reviews?hl=zh-TW,5,True,235,每樣餐點都好吃，吃完很滿足，會微笑！
 萬花筒天空 ,https://www.google.com/maps/contrib/111925425236256275810/reviews?hl=zh-TW,3,True,346,Pizza好吃但上桌不夠熱，有點可惜。
 Chen CC ,https://www.google.com/maps/contrib/114688814249037916135/reviews?hl=zh-TW,4,True,111,2022/01/01在此用晚餐，點選貓耳朵麵，瑪格麗特比薩，粉紅熱情比薩，炸薯條等。其中兩份主餐搭配了套餐，而套餐組合有湯，沙拉，小麵包及餐後飲料。貓耳朵麵稍微有點辣味，麵本身煮的相當有彈性和嚼勁，非常好吃。瑪格麗特雖然是普通的菜式，可是此地的起司很香甜，與一般的瑪格麗特又有些不同。粉紅熱情除了肉片還加上起司及無花果，熱的麵餅配合冷的起司和甜的無花果，吃起來口感令人驚艷。薯條也非常可口美味，外表酥脆內在鬆軟，沾上餐廳的沙拉醬也是一絕。噢對了，生菜沙拉的橄欖油和黑醋很捧。唯一美中不足的是美式咖啡，不知是否採用羅布斯塔豆，總之口感不甚令人滿意。
 林博臣 ,https://www.google.com/maps/contrib/114342217280728036341/reviews?hl=zh-TW,5,False,1,"環境舒服、餐點道地、服務自然不刻意
今天吃了佛洛提那披薩，餅皮香味很夠配料豐富，松露野菇燉飯松露味很濃還有起司的鹹香
下次再來試試看其他口味。"
 鄭鈞瀚 ,https://www.google.com/maps/contrib/117827472149243499645/reviews?hl=zh-TW,3,True,76,餐點普通，網紅店的裝潢
 蘇美瑾 ,https://www.google.com/maps/contrib/107217903703501132016/reviews?hl=zh-TW,4,True,182,高朋滿座，座椅舒適，海鮮拼盤很特別，可惜營業時間太短^^
 Chany Wang ,https://www.google.com/maps/contrib/108992281753906142594/reviews?hl=zh-TW,4,True,763,"環境很乾淨、清幽
整體讓人感覺很輕鬆
用餐完全沒有壓力

餐點很道地～
服務人員態度也很好👍"
 yu S ,https://www.google.com/maps/contrib/109258268972806159035/reviews?hl=zh-TW,5,True,189,店很美、餐具也很美，燉飯普通份量偏少，pizza好吃。
 Jia ,https://www.google.com/maps/contrib/102525628730651289053/reviews?hl=zh-TW,5,True,303,"披薩麵皮有嚼勁有麵香，口味都蠻特別的，試了好幾個口味都很不錯
義大利麵表現也很好，喜歡貓耳朵，麵皮體有嚼勁跟麵香，起司番茄醬汁濃郁不會太酸又帶一點點辣，超療癒👍
提拉米蘇也好吃，但相較之下較為普通"
 ʕᴥ· ʔ Medea ,https://www.google.com/maps/contrib/116216580610434309670/reviews?hl=zh-TW,2,False,1,"餐點還算不錯，上餐速度也很快，以份量來說價位偏高，但是是一間對學生很不友善的餐廳。

一位梳油頭的老先生看我們兩位是學生佷不耐煩的接待我們，和其他客人形成明顯的對比，令人觀感不佳，並且在用餐期間還會不斷的盯著客人，讓人壓力很大。

希望這位服務員下次見到學生來消費不要再讓人從進門開始就看你的臉色！我們並沒有在店內喧嘩吵鬧，餐點也不是只點一兩杯飲料，這一餐好歹也是花了近一千，朋友難得相聚還得吃得那麼難過實在很不值得！只是詢問一下套餐的問題就要那麼不耐煩，隔壁桌的客人說對食物過敏就用恭敬的態度和人聊了近5分鐘以上。還有放餐點下次請記得輕放！不要見到制服就好像獲得了怪力一樣！如果瞧不起學生，覺得我們的消費力不足請直接在門口寫拒絕接待！如果要花錢才能感受到服務就直接收取服務費！

ps．其餘的服務生人都很親切，只有那位白髮油頭男需要學習尊重二字怎麼寫"
 Evelyn Liao ,https://www.google.com/maps/contrib/103358249936297633993/reviews?hl=zh-TW,4,True,537,東西蠻好吃，但份量較少，不太適合多人來用餐！
 周佳婕 ,https://www.google.com/maps/contrib/102615549431723394725/reviews?hl=zh-TW,5,False,16,好吃的披薩店會再來訪的啦
 十人土土 ,https://www.google.com/maps/contrib/102167472317101661803/reviews?hl=zh-TW,5,True,137,"很道地的義大利家庭料理
自帶酒開瓶費才50／杯子
很適合小酌配下酒點心，吃吃披薩度過滿足一餐"
 雅涵雅涵 ,https://www.google.com/maps/contrib/115255329113639237150/reviews?hl=zh-TW,5,True,45,好吃～環境舒適
 Samira Hsu ,https://www.google.com/maps/contrib/109244950580536109654/reviews?hl=zh-TW,3,True,36,"當天吃了雙拼瑪格麗特披薩最好吃
友人吃其他口味偏鹹CP值中等"
 Webber Linking ,https://www.google.com/maps/contrib/107752446644290749626/reviews?hl=zh-TW,5,True,369,食物及服務都相當不錯，非常值得用披薩度過一個美好的夜晚。
 IC ,https://www.google.com/maps/contrib/113255745846985694779/reviews?hl=zh-TW,4,True,277,味道不錯，冷氣很強，餐廳佈置很美很用心
 TingTing Teng ,https://www.google.com/maps/contrib/113496633952416005549/reviews?hl=zh-TW,5,False,2,"環境優美
人員友善
上菜快速
值得推薦"
 Chih Emel ,https://www.google.com/maps/contrib/116225775662505160119/reviews?hl=zh-TW,4,True,194,一開始以為是一般的拿坡里披薩炸雞（完全不一樣），結果是比較高級的餐廳，價格偏高，服務生最推薦點的起司四重奏很棒但稍顯單調膩口，略微失望，肉拼盤不錯然而份量也偏少，但之後願意再來試試不同口味！
 Chang Queena ,https://www.google.com/maps/contrib/110104243189848978134/reviews?hl=zh-TW,1,False,4,"昨日晚上致電欲訂""芝麻葉火腿8吋披薩""，也告知店家說約一個小時後再去取，並且告知是由一位先生去取。
六點多我爸去取完後，回到家我馬上打開來吃的確有火腿因此也沒有多看盒子外的標示是甚麼。吃到一半我爸突然問我，我稍早LINE貼給他披薩圖片上圈起來$280是甚麼意思，我就說披薩的錢啊~。他說但店家收400耶，當下感到疑惑當然馬上再打去店家確認了~因為打開看到有火腿就馬上吃了也沒多想是吃錯了~

我馬上打去跟店家確認，店家並沒有馬上提出說，我表示點的是芝麻葉火腿，但店家說剛剛給的是義式生火腿，我表示我點的是芝麻葉不是義式，對方也沒有表示聽錯了還是甚麼，才告知:那妳看的是原本的正常菜單吧，我們現在只有防疫菜單喔，所以沒有那個口味!剛剛那個是義式生火腿，所以價格沒有收錯。

我馬上提出說，我是GOOGLE搜尋菜單圖片馬上就打去點了~我不知道現在是防疫菜單。那稍早電話為何沒有告知我現在沒有這個口味???即使換了菜單，我點的口味沒有也應該告知我一下~而不是自行幫我換了口味。

我覺得店家在電話裡可能沒有意識到我點的是現在沒有的，但是電話裡也店家沒有任何表示可能聽錯了或甚麼，聽到我那樣反映只說那妳可以來退款阿~~我表示我已經吃了，店家再說那妳心裡不舒服的話我寧願退妳錢~~~當下我是愣住了~沒有預料店家會這樣回復，我只說那我再跟爸爸在討論一下。

後來決定不過去接受退款，是因為在電話裡沒有感覺到店家的口吻或字句感到抱歉，表示聽錯了或是甚麼，感受上就像是寧願退款沒有感覺抱歉，而我得到的反應讓我覺得好像我是奧客?我心裡的確不舒服，也不想我過去店家收退款時，還要再承受無法預期店家是否和善的心理壓力。

我心裡覺得最不舒服的原因，已經不是沒有被告知下被換了口味多收了錢，而是店家處理的方式，還表示是客人自己看錯了菜單吧，但是當下並沒有被告知現在沒有那個口味了，自行被更換口味。無論當時電話店家知不知道我點的現在沒有，還是聽錯了。事後處理爭議的態度即可以知道店家對待客人的方式，即使披薩許多人推薦或是評價高，也不推薦去這家店消費。"
 林霓安 ,https://www.google.com/maps/contrib/105171372559001088778/reviews?hl=zh-TW,3,False,7,很有特色的壁畫，環境舒服，沒有收服務費要自行去櫃台點單，要先結帳。比薩就是比薩，經典的味道。
 Rodman Michael ,https://www.google.com/maps/contrib/116953757592715270447/reviews?hl=zh-TW,5,True,481,很有特色的Pizza料理好食服務人員親切
 CHIH HO HUANG ,https://www.google.com/maps/contrib/116075573477973475420/reviews?hl=zh-TW,5,True,278,可以吃到濕起司的披薩店
 張Bella ,https://www.google.com/maps/contrib/103222219743478441279/reviews?hl=zh-TW,4,True,38,環境優美，現做餐點美味可口
 doris lee ,https://www.google.com/maps/contrib/100918209454179828321/reviews?hl=zh-TW,2,True,125,"服務生的態度有待加強，
第一組客人有招待薯條🍟"
 Hello Beck ,https://www.google.com/maps/contrib/104565248236739556625/reviews?hl=zh-TW,4,True,434,披薩跟燉飯味道很好，雞翅普通。
 Melinda Chiu ,https://www.google.com/maps/contrib/115569761775901869040/reviews?hl=zh-TW,4,True,540,燉飯米心不夠、但是意大利麵條Q度很足。pizza是薄皮的，風味也還不錯。
 Ian Chen ,https://www.google.com/maps/contrib/117074102866566038298/reviews?hl=zh-TW,1,False,3,東西好吃，服務0分。老闆還在旁邊叫員工說去收餐盤。剛吃完馬上叫你滾的意思。
 Li Li ,https://www.google.com/maps/contrib/117730650039876067660/reviews?hl=zh-TW,4,True,440,瑪格莉特披薩好吃，價格合理
 yu hung ,https://www.google.com/maps/contrib/107319466664881369169/reviews?hl=zh-TW,2,True,16,"其實來過好幾次了，
好像女服務員比較有服務熱忱.....這次點了咖啡、濃湯跟麵，喝完濃湯後，等了約十五分鐘，麵才上桌。等不是問題，
是所有比我們晚到的客人的餐點都到了，只有我們還在等...
讓客人等了很久，也完全無感的服務人員....我真的不知該說什麼"
 Sherry ,https://www.google.com/maps/contrib/106776511801334601465/reviews?hl=zh-TW,2,True,19,"蘑菇湯好喝
但～～～～～
外帶回家食用，都快喝完時發現湯裡居然有塑膠袋==
重點是不知道的我還特地用電鍋再加熱過
吃進了一堆毒？？？"
 Vito Lee ,https://www.google.com/maps/contrib/117615253695473844750/reviews?hl=zh-TW,4,False,9,很道地的義式餐廳，價位中等，CP值不錯
 Bamboo Cai ,https://www.google.com/maps/contrib/106463706752586535688/reviews?hl=zh-TW,5,False,12,"喜歡的店
環境很美pizza超好吃
天天都想去吃"
 ya-fen Lai ,https://www.google.com/maps/contrib/100664563593248475891/reviews?hl=zh-TW,4,False,15,"餐點飲料多樣、墨魚麵口感味道很好，Pizza份量夠大，洛神花茶加金桔好喝。
服務態度良好，還會再去。"
 林映如 ,https://www.google.com/maps/contrib/109806544809169342110/reviews?hl=zh-TW,4,False,"1,136",餐點好吃，環境雅緻，服務非常親切，可惜價位微貴
 I-chin Yeh ,https://www.google.com/maps/contrib/101461359802093396944/reviews?hl=zh-TW,5,False,1,義大利肉腸道地好吃，而且價格實惠！
 S.Y. Kuo ,https://www.google.com/maps/contrib/118130972750385588850/reviews?hl=zh-TW,3,True,10,"紀錄一下在Uber訂餐的體驗：
由於訂的披薩在食用的時候已經""完全涼掉""了，所以打電話詢問店家。
經店家確認後，從""出餐""到送達只經過5分鐘的時間，而我洗完手後就開始食用的披薩之所以會是涼的，店家推論可能是因為外送員接了其它的單子，把披薩和其它冰的東西放在一起所致，店家表示會向Uber反應。
建議還是去店家吃熱騰騰的披薩，涼掉的味道吃起來真不怎麼樣。
※當天氣溫27度，雨，室內沒開冷氣。"
 CY Yeh ,https://www.google.com/maps/contrib/112725032786804996026/reviews?hl=zh-TW,1,True,22,Pizza上的料很濕，導致皮變得很濕軟口感很差，上面還有小蟲爬出，水瓶的蓋子也很髒，有黑黑的水垢，整個糟糕的體驗，因為評分很高才來嚐嚐，完全過譽了，覺得失望
 Vibes Good ,https://www.google.com/maps/contrib/104370640217908989181/reviews?hl=zh-TW,5,True,370,"很棒的小店，創新的口味。
新鮮的無花果披薩，值得一試"
 shu fai chan ,https://www.google.com/maps/contrib/117344763777467089190/reviews?hl=zh-TW,4,True,71,因為疫情的關係只能帶回家，不過就算是放一段時間，再烤一下一樣美味。份量不會很多，味道是很ok。如果要現場吃現在是可以，情調ok唷唷，不過要隔著隔板吃是有點....。基本上追求吃到飽pizzer的朋友就不建議這家。但如果你對美食有一點點執著，這一家是ok的。完全解封後再去應該更好，之後再提供評論。
 黃依葶 ,https://www.google.com/maps/contrib/103267903492022504018/reviews?hl=zh-TW,5,False,49,"披薩的餅皮q彈有勁吃得到麵粉的香氣，義大利麵的硬度夠,不需要特別提醒，很多餐廳賣的義大利麵其實是陽春麵的硬度,他們家自製的提拉米蘇超好吃，基底蛋糕濕潤帶酒香，是我在餐廳吃過最好吃的提拉米蘇，巴沙米可醋炒菇炒得有點不到位，有點油炒的不夠乾,沒有炒出菇的香氣，除了炒菇全都在水準之上絕對會再來第二次第三次，聽到店員說2021五月一號要換新菜單太棒了好期待"
 Maggy Huang ,https://www.google.com/maps/contrib/115523251968819535912/reviews?hl=zh-TW,3,False,8,佛羅提那比薩好吃，可惜老闆態度很差…不會再回訪了
 陳建文 ,https://www.google.com/maps/contrib/106719316844042885554/reviews?hl=zh-TW,4,True,42,東西好吃，價格中等，要注意不能帶外食唷，飲料也不行
 Teng-I Wang ,https://www.google.com/maps/contrib/114201285209847578589/reviews?hl=zh-TW,4,True,298,起司四重奏層次感豐富，非常好吃，用餐環境也不錯，可惜整體價位偏高，且要服務費。每月五號有外帶買一送一優惠，可以試試。
 Chris Wu ,https://www.google.com/maps/contrib/111449744886457899358/reviews?hl=zh-TW,4,True,53,Pizza有嚼勁口味不錯。但並非必勝客的那種脆的喔。
 嚴展堂 ,https://www.google.com/maps/contrib/107885830183355722370/reviews?hl=zh-TW,4,False,3,"我不是要抱怨服務不好，因為在沒有收服務費的餐廳，過多的要求其他服務，也不合理。事實上，我還真心覺得服務人員挺親切的。
但不愉快的感覺還是抱怨一下。
假日用餐限時2個小時。大概1個半小時就好心來提醒1次了。約十分鐘左右又來告訴我後面的人提前到了，我真的不知道是什麼意思？但是我吃飽了，只剩茶還沒喝完，就起身離開吧！
隔壁桌併桌超過10人，比我們早到也早用餐，我離開時，他們還坐著聊天呢！"
 永 ,https://www.google.com/maps/contrib/113026883913414805598/reviews?hl=zh-TW,5,True,401,披薩非常好吃，但品質浮動大，依據不同師傅會吃到不同等級的披薩，運氣好你會給五星，運氣不好可能只有三四星，但總體而言用料與價格絕對值得五星評價
 Monica Chang ,https://www.google.com/maps/contrib/105475075909571663577/reviews?hl=zh-TW,4,False,32,用餐環境舒適，餐點美味，無花果搭配生火腿👍👍👍
 K Mr. ,https://www.google.com/maps/contrib/112006346692660861663/reviews?hl=zh-TW,4,True,340,"服務還不錯
環境還不錯
食物不錯吃
炸物好吃
價錢普通"
 Ann Kao ,https://www.google.com/maps/contrib/104559464996313917202/reviews?hl=zh-TW,5,False,10,餐點服務都👍🏻適合小酌的好地方🍷🍺
 Vivian Shiao ,https://www.google.com/maps/contrib/111931472236153050003/reviews?hl=zh-TW,4,True,82,環境舒服自在，是聚餐的好地方，不過餐點份量不多
 Zack ,https://www.google.com/maps/contrib/111858213457559983087/reviews?hl=zh-TW,4,True,54,Pizza口感蠻紮實的，餐廳裝潢也還不錯👌
 楊錫山 ,https://www.google.com/maps/contrib/113077560497081840012/reviews?hl=zh-TW,4,True,130,環境不錯食物也好
 TINA ,https://www.google.com/maps/contrib/107156364285027966568/reviews?hl=zh-TW,1,False,1,"今天~天氣好，心情更愉快爬完虎山，特別搜尋評價頗高的薩朵拿坡里披薩餐廳，要好好享用美食……一進餐廳沒有感受店家的熱情也就算了，最令人傻眼是噁噁的檸檬水，披薩餅皮也是軟軟的食材都掉下來，讓人很無言……，海鮮義大利麵更是食不知味，這是黑暗料理嗎？👎
在回家路上肚子就怪怪的，慘烈的事終於發生……拉肚子。根本是花錢又受罪……店家應該多注意食材新鮮和保存……
我要收回給的一顆⭐"
 Sucy Lu ,https://www.google.com/maps/contrib/109561021592227555488/reviews?hl=zh-TW,5,True,95,環境優美氣氛佳，食物也不錯吃！推薦貓耳朵～
 Yuhua Cheng ,https://www.google.com/maps/contrib/116077035893765395696/reviews?hl=zh-TW,5,False,7,餐點美味，服務又好😍😍收藏愛店❤️
 Wenchang YANG (Wayne) ,https://www.google.com/maps/contrib/108333814261523294033/reviews?hl=zh-TW,1,False,14,"東西還蠻真材實料的，東西也算合胃口，但店員結帳處理的方式很有問題。

一開始點了兩瓶啤酒，雖沒被特別告知有折扣，但帳單上有第二瓶半價，覺得很驚喜，後來朋友去點第二次時，也被口頭告知啤酒全品項都是第二件半價，在第三次點餐時，一樣是點了兩瓶啤酒，也是之前點餐的店員幫忙結帳，但卻沒有折扣！在反應前次有打折，店員在沒有任何說明的狀況下給了跟之前一樣的折扣，讓人感到困惑⋯雖然可理解不收服務費所以一切自助，但費用前後不一樣，還在提醒後沒有任何說明，讓人不太舒服。

如果不介意商店誠信與服務態度的話蠻推薦來吃。"
 Melody ,https://www.google.com/maps/contrib/109215853241744190546/reviews?hl=zh-TW,3,False,42,桌號是一隻恐龍很可愛(((o(*ﾟ▽ﾟ*)o)))
 吳宛蓉 ,https://www.google.com/maps/contrib/113184919194398759775/reviews?hl=zh-TW,5,True,46,"餐點氣味調和，選品用心，環境舒適。
份量參考附圖，大食怪玩家可能要點兩份😆"
 Yuling Hsu ,https://www.google.com/maps/contrib/114704646659967750578/reviews?hl=zh-TW,4,True,128,"網紅餐廳，有一些可供拍照的裝潢和道具。但二訪之後還是要以餐點本身的CP值為主要考慮。
強調到拿坡里學的窯烤披薩，但其他餐點比披薩好吃∼
推薦松露野菇燉飯和新鮮水果茶。

以價位來說並不便宜，適合聚餐聊天久坐，沒辦法常常光臨"
 ANNA HO ,https://www.google.com/maps/contrib/116713286864257711715/reviews?hl=zh-TW,4,True,76,整體口感跟以前沒搬家前沒有落差太大
 林星宇 ,https://www.google.com/maps/contrib/116941487725083207519/reviews?hl=zh-TW,5,True,463,"Pizza餅皮烤的很到位，麵也不錯吃。
環境很好，座位區有南歐的感覺。
加點了一個甜的pizza，因為擔心會等較久，特別問了一下，結果店家盡快地做出來，很貼心的服務。
唯一缺點就是服務人員一直出現觀望，會有是否在趕客人的錯覺。當時限定的用餐時間還有半小時。"
 鍾佳翰 ,https://www.google.com/maps/contrib/104304734096159533185/reviews?hl=zh-TW,4,True,289,批薩好吃的網美店，批薩餃有點弱，其他不錯
 pony do ,https://www.google.com/maps/contrib/106808955542223466712/reviews?hl=zh-TW,5,False,18,進來用餐時，店員主動詢問是否第一次用餐，點餐時需要出示動物公仔。食物方面，披薩餅皮有點焦，苦苦的，細扁麵口感偏硬，味道還不錯。超過21:00點餐，店員還是有讓我們點，服務態度很好。
 范宸瑄 ,https://www.google.com/maps/contrib/103331046898473042551/reviews?hl=zh-TW,5,False,18,好吃好吃！尤其是臘腸披薩雖然有點辣，但是餅皮濕潤～提拉米蘇跟開心果乳酪蛋糕也好吃
 張郡薰 ,https://www.google.com/maps/contrib/109464442851505775598/reviews?hl=zh-TW,5,False,3,"第四次來吃
還是一樣好吃
店員服務親切、主廚張的帥帥的😍😍
餐點真的好好吃
超級推薦"
