user_name,user_profile_url,rating,local_guide,comment_num,comment_text
 Karen ,https://www.google.com/maps/contrib/117555647839867302648/reviews?hl=zh-TW,3,True,43,"來訪第三次，最喜歡披薩系列，但這次用餐體驗不是很好。

蕈菇濃湯：很濃郁好喝，只是湯上來時已經是冷的了，跟店家反應，說是剛好單很多，湯要出的量很多，沒有顧及到。（但餐廳生意好，所以要客人喝冷的湯，？！這樣的邏輯不合理啊🤔我錢沒有付比較少呀！）

套餐麵包：前兩次吃都覺得非常好吃，Q彈有嚼勁的，但這次卻是乾硬無法咬下。

披薩：餅皮Q彈好吃，可惜有部分太焦黑了（但店員說正常）
1.最喜歡佛倫提諾披薩，口味獨特，是吃了會有印象的好味道。
2.青醬燻雞味道較淡，雞肉太乾柴。
3.松露野菇味道還不錯，不是會膩口的那種。
4.松露燻鮭魚竟然加美乃滋，整個很膩口，最不愛。

義大利麵：麵條屬於有嚼勁的
1.海鮮義大利麵：海鮮蠻多蠻新鮮的，口味清淡
2.蔬菜義大利麵：清淡口味的會喜歡

貓耳朵麵：麵體屬於比較軟的口感

提拉米蘇：還不錯吃，但不至於必點

飲料：紅茶有點太濃烈，咖啡還ok

服務：由於不收服務費，基本上是自取水跟餐具。店員除了女生店員服務不錯，男生服務人員都蠻冷淡的，特別是白髮中年男子，講話感覺讓人不是很舒服。"
 Michael Wu ,https://www.google.com/maps/contrib/113496743761422951335/reviews?hl=zh-TW,5,True,134,"晚餐人均消費$550
整體評價：
物有所值的餐廳，pizza有不少特別的口味可以嘗試。不收服務費的關係，要自己去櫃檯點餐，餐具和水也要自己拿自己倒，不覺得服務人員的態度差，這種不收服務費的微自助店應該要成為主流👍
羅馬式烤豬五花：
上來的豬五花是完整一塊，需要自己切，以開胃菜來說份量不小，吃起來有點客家鹹豬肉的感覺，佐的醬料偏甜，有一個特別的香味，好評。
義式生火腿披薩：
有一個甜甜的香味不確定是來自生火腿還是蕃茄，雖然是價格比較高的披薩但很好吃。
漁夫鯷魚披薩：
服務人員有提醒這個披薩沒有起司，就是番茄醬搭配鯷魚與一些點綴的佐料，鯷魚是條狀的而非碎肉，口味很重，鯷魚的鹹味比較明顯。
海鮮義大利麵：
口味很清淡，可以說是今天最平淡的一道，其實方方面面都做得不錯，但沒留下特別的印象。
最後總結一下，是會想要再訪的店，希望不要被疫情影響營業。"
 O Jim ,https://www.google.com/maps/contrib/110223194543746301772/reviews?hl=zh-TW,5,True,624,"非常不錯的披薩店，以薄皮披薩為主，起司味非常重，分為八吋以及十吋兩種不同選擇，如果要搭配套餐，建議選擇八吋即可，不然會過飽，套餐蘑菇湯的菇味非常濃，喜歡濃厚湯頭的朋友會喜歡上這道。
魚子醬燻鮭魚披薩是我本次最喜歡的選擇，微酸的口味更加帶出了起司的香氣，讓整體味道昇華，茴香豬肉則是香氣十分充足，豬肉搭配上披薩葉讓整體的口味更為特殊，讓人不禁一口接著一口。五種起司則是喜歡起司的朋友一定會喜歡的口味，非常濃厚且多元的起司香。生火腿則是非常完美的融合披薩以及配料之間的關係，在互相不搶彼此風采的情況下，讓兩者的口味都做出了最完美的發揮，實屬佳作。
炸海鮮的部分香氣非常重，如果喜歡海鮮炸物的朋友會對這道是愛不釋手。整體而言，這是一間價格稍偏高，但食材以及口味都對得起他的價格的店，我會願意再訪。"
 愛吃鬼的D ,https://www.google.com/maps/contrib/102711240119127243028/reviews?hl=zh-TW,5,True,67,"saltopizzeria師傅是到拿坡里學習正統拿坡里披薩的做法，並在當地披薩學院取得合格披薩師父證書，光是有合格證書就知道好吃😋
這裡不收服務費，價格又實在。
當天點了粉紅熱情披薩
墨魚汁醬料燉飯
卡諾里甜點
用餐心得：
會點粉紅熱情披薩沒吃過新鮮的無花果，無花果搭火腿與起士滿特別，餅皮較軟可以用手直接拿著吃。
墨魚飯味道超鮮的，義式的口感米粒偏硬，墨魚跟米飯融為一體
還要推薦很特別的義大利甜點西西里的卡諾里，酥脆餅皮夾入冰涼香甜的ricotta起司，並灑上開心果仁和軟糖，好吃極了。"
 吳宜瑾 ,https://www.google.com/maps/contrib/111315466240317392986/reviews?hl=zh-TW,4,True,98,"其實已經是四訪了，是想吃披薩會想到的店。
尤其是芝麻葉生火腿披薩，之前吃過真的是魂牽夢縈，披薩的餅皮濕軟卻又帶有烤過的酥脆，香氣十足，配上生火腿、芝麻葉，各種味道在嘴裡化開真是一場饗宴。不過，今天特地來回憶這個味道卻覺得有點退步，還是好吃，只是那個厲害的餅皮好像不見了？

貓耳朵麵似乎是以前沒有的新品，老闆說會有點微辣其實還好，味道雖然是紅醬偏重但整個吃完卻不會膩，麵體本身也嚼勁剛好，是會讓人一口接著一口的一道料理。提拉米蘇個人覺得好吃，不過同行友人覺得普通。

整體來說還是很推薦；至於老闆態度也不是不好，只是口氣很容易讓人不大高興就是了～"
 Jyun Syu ,https://www.google.com/maps/contrib/102649452594915154453/reviews?hl=zh-TW,5,True,41,生日約吃飯，薩朵披薩餐酒館南義料理，蠻喜歡他們家的義式生火腿披薩，好吃不膩配上Q彈的餅皮超喜歡，酥炸綜合海鮮超適合配酒的可惜當天騎車，提拉米蘇好吃很對個人胃口，下次再去試試其他口味的披薩。
 莊伶萱 ,https://www.google.com/maps/contrib/100050348882428541333/reviews?hl=zh-TW,5,True,167,披薩很美味，麵皮本身帶有鹹味，點一道重口味、一道清爽的披薩，兩者交替吃真的很棒！提拉米蘇令人驚艷，配上香氣十足的紅烏龍，真的很享受！
 10 Hu ,https://www.google.com/maps/contrib/117324609518210945464/reviews?hl=zh-TW,4,True,425,"披薩：餅皮很有嚼勁，很香，不過番茄味道很淡，有點可惜。

披薩餃：蠻正統的披薩餃，味道跟口感都很道地。

沙拉：很普通的蔬菜沙拉

濃湯：蘑菇濃湯非常棒，味道不會過強烈，喝起來很舒服，料也很豐富。

臘腸：這個也是義大利特色菜，味道調的也很好，不會太鹹，搭配櫛瓜一起吃，很推薦喔。

室內裝潢很美，看了心曠神怡，採光也很明亮，店內環境乾淨，整體感覺還不錯，不過想吃的起士跟義大利甜點都沒有賣，覺得很可惜也很失望。"
 YH ,https://www.google.com/maps/contrib/108911102880521435020/reviews?hl=zh-TW,5,True,178,"非常好吃的義式小酒館，這家店的披薩吃起來會讓我懷念起以前在義大利旅行天天吃披薩的日子，口感跟在義大利吃起來非常的接近，Q軟的餅皮、多汁的餡料，讓人十分回味。其他主餐類的餐點也有一定的水準，餐點的價位不高，跟台北其他同類型的小酒館相比非常的划算。

此外這間也是台北少見的葡萄酒友善餐廳，葡萄酒的選項不算少而且單價也不高。就算自行帶酒，店家也十分佛心的只收50塊洗杯費，在結束了忙碌的工作後，很喜歡悠閒的喝杯葡萄酒搭配這裡的披薩，會讓人有一秒到義大利的感覺。"
 Chi-Chen Lee ,https://www.google.com/maps/contrib/100616571712207973499/reviews?hl=zh-TW,5,True,224,"超好吃義大利認證窯烤pizza！
除了pizza還有提供義大利麵、燉飯、排餐等選擇，服務人員當天非常nice，因為點餐時想點的沒有了，但是因為服務人員當下專業處理，吃到了超好吃的無花果布拉塔開胃沙拉，pizza的濕度和餅皮的軟硬度都恰到好處，一吃完立馬收入成為愛店，當天不太餓所以沒嚐到其他的，改天絕對再訪。"
 Barbara Huang ,https://www.google.com/maps/contrib/117587482707223875872/reviews?hl=zh-TW,5,True,23,"1）空間寬敞舒適色調柔和，用餐氣氛很好（這次是中午沒訂位用餐，人不會很多，其他桌是有訂位的）
2）加180升級套餐（沙拉/麵包/濃湯，還有咖啡或紅烏龍），內容滿划算，新鮮好吃
3）海鮮都蠻新鮮（單點的白酒淡菜很大顆）、pizza現烤薄Q軟，窯烤的香氣不會壓過食材鮮味
4）cannoli的甜度剛剛好，帶有橘皮的清香&開心果香氣，不會膩口，配咖啡跟烏龍都很好"
 Winnie ,https://www.google.com/maps/contrib/113599881842884989088/reviews?hl=zh-TW,5,True,121,"𓅷魚子醬燻鮭魚披薩：非常喜歡！皮薄、每一口都吃得到鮭魚、魚子醬很香！
𓅷松露野菇燉飯：好吃且義大利米很添風味！但菇味很重，吃到後面覺得蠻膩～
𓅷冰茶：比預期還更順口好喝！可惜份量少"
 林政宇 ,https://www.google.com/maps/contrib/114154041447319224905/reviews?hl=zh-TW,5,True,539,"不收服務費我覺得很讚

價格實在地反應餐點的品質

前菜的蘑菇湯、麵包、沙拉都很不錯

海鮮披薩料多實在

鯷魚披薩鹹鮮有味，小缺點是底部有點濕。

點餐，送餐的人員態度都很親切

廁所也很乾淨

2022/8。二訪。點了炸海鮮、白酒淡菜、海鮮披薩和生火腿披薩

炸海鮮底下舖有芝麻葉，配上炸海鮮和炸檸檬的香味。三種香氣，交織成令人受不了的誘惑。炸蝦香酥，炸花枝Q彈，炸丁香魚鮮鹹。有夠讚

白酒淡菜也是很好吃，肉質媲美馬祖當地吃到的口感。湯汁沾上麵包也是一絕。

生火腿披薩我覺得不錯吃，但驚艷感不如前二道。而且芝麻葉的香氣也沒有什麼存在感。"
 Connie Chen ,https://www.google.com/maps/contrib/109022312453442015799/reviews?hl=zh-TW,5,True,33,"披薩超好吃，尤其是生火腿，很值得再找大批人馬用餐口味各點一輪

六個人點三個十吋披薩、一麵、一飯、一份沙拉、兩份薯條、一道提拉米蘇很飽，如果不是為了週五晚上一人低消350應該可以少點一道主食，這餐平均五百有找划算到不行

義大利麵表現普普，布拉塔番茄義大利麵看起來很厲害但攪拌後吃起來就是番茄義大利麵，偏偏我就只有把這道拍好看只好上傳給各位欣賞我不推的食物

墨魚飯的小卷味很重，個人不太喜歡但友人說很鮮但不腥，看來是道看人的餐啊

期間限定的松露薯條很小一份上來有嚇到，松露味不重

提拉米蘇蠻讚的"
 Zhang WEI ,https://www.google.com/maps/contrib/114690997316827259734/reviews?hl=zh-TW,5,True,256,"LV.星星：⭐⭐⭐⭐⭐（滿分5
⭕南義大利Pizzeria，薄披薩總能驚艷到我、餐點發揮的恰當、平均的完美⭕
-_-_-_-
(1)墨魚醬汁燉飯💰360：海鮮處理的很好、鮮甜，鎖住海味卻不腥，墨魚會爆汁。粒粒米飯完美的呈現外面微硬、內部Q彈，是目前吃過最棒的燉飯。帕達諾起司讓其帶著淡淡奶香。
(2)青花筍香腸貓耳朵麵💰320：加入了一點點青辣椒，點綴酸甜的肉醬，乳酪的奶香也完美融合其中。
(3)義式生火腿披薩💰460：鬆軟、濕潤的薄披薩，熱呼呼的吃，口感奇佳！莫扎瑞拉、帕達諾起司恰當的奶香搭配生火腿的鹹甜入口非常柔順。
(4)海鮮沙拉💰350：小卷、干貝、淡菜都很鮮甜、油醋醬搭的很好，微苦的芝麻葉也能更顯得清爽。
(5)杜蘭小麥粉炸海鮮💰220：雖然海鮮很鮮甜，搭配檸檬吃起來也不油膩，但是除了新鮮之外，海鮮的味道還是因為炸過，被蓋掉了。稍微可惜，較不推。
(6)套餐_松露濃湯、麵包、沙拉💰180：湯濃郁好喝，沙拉的起司也很棒。
-_-_-_-
🌟整體烹調「能力值發揮的非常恰當，而且平均」從味道上挑不到不好的地方
-_-_-_-
#旺旺的驚嚇舌頭😋#薩朵披薩餐酒館#義式料理#台北美食#台北必吃#披薩#義大利麵#信義區美食#燉飯#晚餐#美食#美食日記#美食推薦#美食攝影#聚餐#好吃#沙拉#套餐#濃湯#網美餐廳#氣氛#乾淨#pizza#risotto#salad#pasta#seafood#cp值高#海鮮"
 H. L ,https://www.google.com/maps/contrib/111053996602291428400/reviews?hl=zh-TW,4,True,520,"拜訪日期:Aug/14/2022
濃湯喝起來好喝，不會鹹剛剛好
松露野菇燉飯$340
青花筍香腸貓耳朵麵$300
水牛馬自拉蕃茄乳酪披薩$360（8吋）
松露薯條$180
每一道料理都好好吃
三個人吃起來剛剛好不會太撐☺️☺️☺️"
 mermaid atcitypool ,https://www.google.com/maps/contrib/112999529751666965787/reviews?hl=zh-TW,4,True,93,懷念義大利的風味，隨著評價找到這，期待能吃到和記憶中拿坡里pizza光餅皮的香氣都能齒頰留香的烙印魅力。運氣很好的換了窗邊的座位，粉紅色的海龜及網美的裝潢風格，原本擔心是追求氛圍勝過食物，言過於實的餐廳，但從蘑菇濃湯的香氣、配湯的麵包、到主角生火腿及義大利臘腸Pizza都充滿驚喜感，應該是回台以來最近似當地風味的pizza體驗，提拉米蘇也可圈可點，唯一美中不足的地方，housewine的白酒不合口味，過於酸澀，期待下次再訪試試其他餐點。
 J W ,https://www.google.com/maps/contrib/100888005311922231231/reviews?hl=zh-TW,5,False,2,很喜歡他們家的披薩！因為疫情關係選擇外帶！雖然有點冷掉！一樣好吃，餅皮依舊濕軟有嚼勁！香味十足！
 Kelly Chiang ,https://www.google.com/maps/contrib/102324186397349185127/reviews?hl=zh-TW,5,True,23,"台北最愛的pizza店
每一道都非常好吃！！！
上菜速度也很快
最常吃的是弗洛提那pizza和番茄莫札瑞拉
這次改吃茴香豬肉和無花果沙拉的也是非常喜歡🫶🏼"
 A. H ,https://www.google.com/maps/contrib/117469648842357526955/reviews?hl=zh-TW,5,True,22,道地的義大利披薩、依照時節挑選新鮮肥美的海鮮，最近是馬祖淡菜，超級鮮嫩可口！價格平易近人，是約會聚餐的好選擇🤍
 Eric Liu ,https://www.google.com/maps/contrib/108158299385781874298/reviews?hl=zh-TW,5,True,209,"Taste:5/5
Service:5/5
Youmusttrytherestaurant.
海鮮義大利麵、茴香豬肉披薩、隱藏料理（南義風白帶魚卷）、炸海鮮。"
 D D ,https://www.google.com/maps/contrib/109475825218578267334/reviews?hl=zh-TW,4,True,241,"藏身在巷弄裡的美食餐廳🍴
要不是好友邀請還真不知道原來在這裡有這樣的店家
原以為是網美店沒想到餐點都很美味
下次有機會一定要再找朋友一起來吃其他口味！"
 OHIAMGOOD ,https://www.google.com/maps/contrib/116177456072152158890/reviews?hl=zh-TW,5,True,419,"義式生火腿披薩，餅皮偏厚，稍微軟而不太有脆感，乾濕適中，氣孔大，很有空氣感和彈性。料的味道都不錯，芝麻葉比較少一些。

卡諾里，外殼薄酥，像是蛋捲或法國薄酥的感覺，稍微有點油軟，輕咬就碎，起司餡味道很好，質地稍微有些沙沙顆粒感"
 Lilly Kuo ,https://www.google.com/maps/contrib/107152374995940623900/reviews?hl=zh-TW,4,True,65,"Pizza餃蠻好吃的
墨魚燉飯，海鮮味濃厚，裡面有干貝和花枝小捲
甜點是沒有吃過的卡布里，像是餅乾包著奶油，好吃不膩口！很特別的點心👍🏻不收服務費，不過總體價格偏高"
 YuHung D ,https://www.google.com/maps/contrib/112680729871109714100/reviews?hl=zh-TW,4,True,43,"Pizza餅皮香氣濃郁
開胃菜牛肚搭配番茄風味和諧不膩口
用餐氛圍良好"
 Mikala K ,https://www.google.com/maps/contrib/115490018095069715066/reviews?hl=zh-TW,4,True,"1,763","蘑菇濃湯好喝，沙拉的油醋比例很棒，松露野菇燉飯松露香氣淡，燉飯和一般義式餐廳不太一樣，整體是好吃的，披薩餅皮較濕軟，餡料沙拉米份量有點太小片，感受不太到。
飛機窗戶的隔板非常有創意，兼具防疫、美觀和隱私，店家清消確實，客人一離開馬上消毒桌面、座位。
不收服務費，女店員很客氣。"
 謝承璋 ,https://www.google.com/maps/contrib/115293800665949048324/reviews?hl=zh-TW,5,True,76,"真的豪好吃男生一人吃8吋剛好10吋滿足
卡諾里跟披薩真的都很道地很好吃
特別是披薩
麵香Q彈窯烤的香氣水牛馬扎瑞拉的牽絲
一定會多來幾次"
 Wesley Fine ,https://www.google.com/maps/contrib/112002912879518139942/reviews?hl=zh-TW,5,True,356,相當美味的義大利風味披薩，用料和搭配都很細心，感覺得出職人老闆的用心
 戴芷薇 ,https://www.google.com/maps/contrib/108557674083610422762/reviews?hl=zh-TW,5,True,27,"❣️墨魚燉飯裡面有滿滿的蛤仔跟透抽（推
❣️披薩口味濕潤好吃
❣️烏龍奶蓋奶蓋厚度好好喝驚艷！
❣️Ricotta甜點第一次吃蠻酷的，一人一根剛剛好兩個有點會太膩"
 紫君宋 ,https://www.google.com/maps/contrib/104768319705488872503/reviews?hl=zh-TW,4,False,144,佈置典雅輕鬆舒適，披薩與一般吃過的有些不一樣，值得嚐試。
 Lou Chen ,https://www.google.com/maps/contrib/112147551717099669599/reviews?hl=zh-TW,5,False,10,道地的義式pizza，週日晚上去人不會太多可以慢慢享受，吃到剛出爐的美味披薩真的好幸福～讓人懷念起歐洲旅遊時吃過的義大利餐廳，甜點也很特別值得點！
 s.h ,https://www.google.com/maps/contrib/110135160154798694792/reviews?hl=zh-TW,5,True,98,"進門就看到美麗的大理石餐桌搭配玫瑰金餐具好美，桌子乾淨又漂亮，明亮舒適的空間，椅子坐起來也舒適，洗手間男女仕各一間可使用，女仕間有小鏡子剛好可以補儀容裝使用，很貼心，環境優雅舒適可以帶親朋好友聚餐的地方。

佛羅提那披薩含菠菜和水波蛋，搭配莫札瑞拉起司和培根太開胃了！不愛吃蔬菜的朋友也許可以試試。
鮭魚披薩搭配的醬汁好好吃，有飽足感，開一瓶紅酒很讓人放鬆，是個完美的餐點搭配👍

ig:shang.chen.yu"
 謝孟 ,https://www.google.com/maps/contrib/101865232898053580083/reviews?hl=zh-TW,5,True,55,"佛羅提納披薩必點好吃😋秒殺款
湯選擇南瓜濃湯麵包非常的Q彈"
 Jean.C ,https://www.google.com/maps/contrib/104542527523499236983/reviews?hl=zh-TW,5,True,24,"吃到很不一樣的義式甜點,pizza也非常好吃,整體氛圍也非常好,值得再造訪的一間餐廳"
 彭玉澤（Cupid） ,https://www.google.com/maps/contrib/115871501362417719843/reviews?hl=zh-TW,4,True,310,披薩好吃，很特別，不同於一般外面店家，套餐價格稍貴
 Metha Chang ,https://www.google.com/maps/contrib/108420295681365310387/reviews?hl=zh-TW,5,False,9,"空間：明亮、位置多、空間氣氛讓人放鬆（推推）
菜色：新鮮、份量夠、比薩超好吃
超喜歡的，🥰🥰"
 陳安柏 ,https://www.google.com/maps/contrib/104832911108902517932/reviews?hl=zh-TW,5,True,19,"好吃，且吃完感覺身體沒負擔，吃的出食材原味。
紅烏龍奶蓋喝的出來是好的茶葉泡出來的，甜度也剛好。pizza餅皮很有彈性，上面的芝麻葉也很提味，五星好評，會再造訪^_^"
 Lin Lin ,https://www.google.com/maps/contrib/105435118343604370053/reviews?hl=zh-TW,5,True,74,明亮的用餐空間，美味獨特的餐點，海鮮披薩及薯條限量供應今未能品嚐到，期待下次的到訪
 Kuma Chen ,https://www.google.com/maps/contrib/111444955255003976355/reviews?hl=zh-TW,5,True,130,這一帶最喜歡的義式餐廳，每次都點燉飯，因為太好吃了上面還有芝麻葉，附餐飲料是奶蓋茶！希望下次可以吃看看比薩
 Kenny Liao ,https://www.google.com/maps/contrib/101520686966703346745/reviews?hl=zh-TW,1,False,11,"外帶一個10吋綜合海鮮,中間醬汁是水的，皮又薄又軟，完全無法接受"
 Mandy Pan ,https://www.google.com/maps/contrib/102625956324811811805/reviews?hl=zh-TW,5,False,2,每個餐點都真的好吃！pizza皮好Q，義大利麵也好香，真的很用心，一定會再回購。
 許詠鈞 ,https://www.google.com/maps/contrib/111100048708987587770/reviews?hl=zh-TW,5,True,390,pizza好吃麵皮香Q，很類似東京石壁家的麵皮。
 Yuan Chang ,https://www.google.com/maps/contrib/107911811905530214854/reviews?hl=zh-TW,4,True,251,"還不錯的一個比薩餐廳，白天空間明亮，室內寬敞，沒有空間壓力。

叫的兩個比薩餅皮薄但Q彈，內陷多汁但不會過鹹，沒得挑

凱撒沙拉口味特別，不是奶味重的美式，而是較為輕盈帶點酸味。以$180的價格來講，似乎份量少了點

令人有點困擾的是，他們要求每個客人必須各點一個餐點：我們本來兩大兩小想說分兩個10""比薩加沙拉，被要求要點四份。真的蠻意外的...

服務是半自助，所以沒有收取服務費"
 Shelly Lin ,https://www.google.com/maps/contrib/117066406169196586610/reviews?hl=zh-TW,5,True,626,非常推薦披薩，餅皮超Q彈～
 Bruce Liu ,https://www.google.com/maps/contrib/111017769492871452462/reviews?hl=zh-TW,5,True,23,"Pizza好吃!沙拉也很讚,口味很特別!炸物也相當豐富美味!簡單說,食物真的是沒話說,以其品質來說,價位也相當合理.可能因為疫情關係,內用客人不算多(但是外帶很多,生意還是很好的),這樣用餐也很安全安心!"
 玲阿 ,https://www.google.com/maps/contrib/107597038361427232030/reviews?hl=zh-TW,5,False,1,"疫情關係特地從桃園來外帶，披薩真的好吃到爆！
還有點了其他的開胃小菜，沒想到外帶到家餐點一樣美味可口餒….那個油錢的部份值得啦😁😁"
 WOW AN ,https://www.google.com/maps/contrib/116915609982531990589/reviews?hl=zh-TW,5,True,26,"吃了披薩、燉飯、義大利麵、甜點，味道口感都很好，連快2歲小朋友都吃得津津有味，必須說真的沒有雷，附餐湯的料也很豐富，紅茶烏龍(？)忘記全名也十分好喝！
桌與桌之間都有空間，不會坐得很擠，餐廳氣氛也很舒適。"
 李皇逸 ,https://www.google.com/maps/contrib/111403505535435182990/reviews?hl=zh-TW,4,True,15,點餐時給我們一隻蜥蜴模型當成標記非常有意思，Pizza口味有比較特殊的選擇，但大概是沒特別選到自己喜歡的口味，覺得吃起來比較一般，內部座位給我安排偏向兩人內用的形式，但考慮到如果是想嚐鮮的角度（每份六片），其實三個人來吃或許更剛好，點三種口味，每種吃兩片也比較不會膩。
 Irene ,https://www.google.com/maps/contrib/104100626953598855014/reviews?hl=zh-TW,5,True,"1,091","環境很不錯，披薩也還不錯吃
價格算平價"
 Joyce ,https://www.google.com/maps/contrib/109065683150547371496/reviews?hl=zh-TW,5,False,1,常跟朋友來吃！點個披薩跟義大利麵加紅白酒，兩個人ㄧ張小朋友就搞定！超便宜的！而且他們的餐點都超道地，紅白酒都義大利的！全台北應該就這家義大利餐廳cp值最高了…打趴ㄧ堆華而不實的名店！就是喜歡這種像義大利小巷內低調的小餐館，不收服務費，頂多就是去櫃檯點餐！服務員高高那個男生跟高高那個女生都很專業也很熱情，除了那個白頭髮的中年人講話比較不耐煩，其他都不錯！
 La Lo ,https://www.google.com/maps/contrib/115338961402090253060/reviews?hl=zh-TW,5,False,1,餐點好好吃！服務親切！高貴不貴的義大利餐廳，
 Pippen “P” S ,https://www.google.com/maps/contrib/104136794072666508475/reviews?hl=zh-TW,5,False,8,ㄧ個義大利朋友介紹來的！地理位置不算是很靠近捷運，下大雨晚上竟然滿滿的人！感覺很低調的一家餐館，餐點很好吃，也很便宜！應該是台北最好吃又實惠的義大利餐廳了！不收不服務費，但服務不錯！口味道地不道地，看滿滿的老外應該是還接近當地口味的。
 Zoe Li ,https://www.google.com/maps/contrib/117384985679172027863/reviews?hl=zh-TW,5,False,9,披薩口感濕潤有嚼勁，與一般市面上吃到的都不一樣，非常有特色又美味，食材亦非常新鮮、用餐環境乾淨整潔，是會想要反覆光顧的好餐廳！
 Mars Gu ,https://www.google.com/maps/contrib/105894695032944420376/reviews?hl=zh-TW,5,False,9,"真心覺得好吃，會回訪！
CP質高，服務親切
松露燉飯香氣十足，很有異國感，口味濃郁
臘腸披薩味道也很棒，尤其是麵皮很Q，讓人念念不忘🤩"
 Diego Chen ,https://www.google.com/maps/contrib/104104316577624060420/reviews?hl=zh-TW,5,True,353,瑪格麗特披薩好好吃喔，完全顛覆對披薩過去的認知。
 Maple Tsao ,https://www.google.com/maps/contrib/112066670425668768654/reviews?hl=zh-TW,5,True,186,店內空間不大，但佈置的很有感覺，點主餐+180會包含湯、沙拉、麵包、飲料(咖啡或烏龍茶)，從湯、前菜到主餐，每道料理都可以感受到食材處理的用心，口味也都很不錯，這次的餐點完全無地雷，離家不遠以後想聚餐不怕找不到地方去～可惜今天沒機會吃到義式甜點卡諾里，下次再來嘗試。
 大貓 ,https://www.google.com/maps/contrib/108794491714509529873/reviews?hl=zh-TW,5,False,8,"1.麵包、披薩的麵皮嚼起來很香。
2.絲綢乳酪沙拉好吃。
3.甜點cannoli很驚艷，
皮脆，內餡口感濃郁，
且不會過於甜膩。"
 Sean Hsieh ,https://www.google.com/maps/contrib/110344143665421029767/reviews?hl=zh-TW,5,True,28,披薩和燉飯都太好吃了吧！光是聞到香氣，已經沈醉其中，萬一以後吃不到這麼好吃的燉飯和披薩怎麼辦？
