user_name,user_profile_url,rating,local_guide,comment_num,comment_text
 麗瑩 ,https://www.google.com/maps/contrib/113017674709994502984/reviews?hl=zh-TW,3,True,89,"大概下午兩點半到店門口還是大排長龍(前面大概有20幾個人左右XD)大概排了半個小時左右進去用餐
內用座位約28位
但尖峰時刻用餐時間是50分鐘所以大家也沒有太多時間可以在裡面聊天玩手機
-
今天點了兩份餐
*清燉牛肉湯+銷魂麵
湯頭口味像是大骨熬很久的味道，挺濃郁的，因為沒有去蔥所以味道覺得不錯！
肉的部分就有點出乎意料，像是火鍋肉片的那種，但是肉的份量十足(很多啊!!)肉質不錯，有點脂肪吃下去挺順口的
再來是附菜-鴨血*2(不吃鴨血可以換豆皮*2)
豆皮不錯入味味道蠻好吃的
鴨血就滿水嫩的，一上桌店員會請你儘快食用鴨血~(我也沒問為什麼)
銷魂麵真的粉好吃~~~我會回訪的話大概會為了乾麵去吃XD銷魂麵有不辣跟辣的，我選辣味，但沒有很辣！
乾麵上的溏心蛋就普普，就是普通的蛋沒有很驚艷
另外旁邊會附一小格的醬料，有點像是醬油膏(淡淡口味的)+一點酸酸的味道，用來沾牛肉湯內的料，個人覺得還不錯～

*麻辣半筋半肉牛肉湯+銷魂麵
這邊介紹麻辣的半筋半肉牛肉湯
他的湯頭沒有想像中的辣!味道也沒有想像中的那麼好!有點像滷味的感覺XD
但是他的湯頭可以再加辣、調整口味是沒問題的，但我沒有加辣所以也不知道味道會變得怎樣，大家可以去試試看
然後牛筋的部分真的非常軟嫩，入口即化，有種滿滿膠原蛋白的感覺XD，份量依然很多，我覺得很讚
其他部分就跟清燉的差不多

*小菜老油條
份量很多，大概有6.7大條，泡了麻辣湯之後軟了一點覺得不錯！但是因為麻辣湯頭沒有很讓我喜愛所以我就覺得普普摟！但是份量真的很大就是了

排隊時間+價位+CP值所以我只給了3顆星星>~<
麻辣湯頭沒有讓我很驚艷(´･ω･`)所以覺得普普，反而相對的我覺得清燉的湯頭就很不錯！
#可以免費加湯、加辣調整口味
#需一成服務費
#只可現金付款，不可刷卡
#僅可內用，不可外帶，也不提供打包
以上為個人體驗，每個人口味不同就當參考嘍!"
 Hsuan ,https://www.google.com/maps/contrib/105643477420555880897/reviews?hl=zh-TW,4,True,32,"建議平日非用餐時間去吃！
個人覺得超好吃
麻辣鴨血跟豆腐愛好者><
麵的話個人滿喜歡他的嚼勁口感
（因人而異吧）"
 Nick Hung ,https://www.google.com/maps/contrib/118300281847344790490/reviews?hl=zh-TW,2,True,195,"麵條Q，但沒煮好，兩碗都有結塊，麵條都黏著拔不開。
湯頭淡，不敢吃重辣的可以嘗試，雖稱麻辣，但已改良，可以直接喝湯，卻失去麻辣的神韻。
另，雖在美食街，卻不能刷卡，亦無其他支付方式，扣分。
用餐要加服務費，限時50分鐘。"
 Andy Tsai ,https://www.google.com/maps/contrib/117098654003265390617/reviews?hl=zh-TW,5,True,183,每到吃飯時間就大排長龍，大部分是賣牛肉料理，非牛套餐是搭配鴨血，乾麵很Q不錯吃。
 Chih-Hsuan Lee ,https://www.google.com/maps/contrib/104169668856201463583/reviews?hl=zh-TW,5,True,174,麻辣乾麵，配上清燉半斤半肉牛肉湯，超好吃，缺點就是幾乎都要排隊，今天下午4點去吃也是排了一下
 ベイ ,https://www.google.com/maps/contrib/111522726496074232836/reviews?hl=zh-TW,5,True,198,店非常小，可是麵真的好好吃！搭配牛肉、鴨血、溫泉蛋，真的是種享受～我平時不愛吃麵食，可是大師兄是我會特別推薦朋友去的店。
 Gina Kao ,https://www.google.com/maps/contrib/110583654741627175128/reviews?hl=zh-TW,5,True,153,"週日的晚間七點半
我們大概排了也有四十分跑不掉才輪到我們

這間店的人都很忙碌應該是生意太好的關係

等一陣終於到我們了
我點的是麻辣牛肉湯+銷魂麵這個套餐

銷魂麵的部份，你可以選擇要辣還是不辣
當然喜歡來點微辣的我是選擇辣的

麵送上來很有Q度，好吃，本身是吃不太辣的人
我個人覺得也不辣
麵送上來也不是燙口的是溫溫的

一口麵淋一口湯這樣的第二種搭配吃法也是不錯了

另外單點了油條油條泡上麻辣湯好對味吸的飽滿的湯汁
一口咬下去很脆又好吃
PS他的油條是脆的像是剛炸的，不像有的潤潤的

烏梅汁→因為我怕太辣所以我點了烏梅解辣
但重點不辣也
烏梅汁喝起來也是挺濃郁的有點像北京乾隆烏梅湯這個牌子烏梅汁的口感

鴨血的部份我能說他吃起來是很滑嫩的但不到入味

總體感覺得還不錯所以有機會不要這樣排隊我想我會再光臨的!"
 Lucy Yang ,https://www.google.com/maps/contrib/100096230145179584443/reviews?hl=zh-TW,5,True,93,"很符合我的口味❤️
湯很清淡又香可加湯
麵是我愛的拉麵～
只可惜我胃口不大吃不完😭"
 William Yao ,https://www.google.com/maps/contrib/114649788613005068136/reviews?hl=zh-TW,4,True,610,4.4🌟好吃！麵條Q彈有嚼勁，醬料蠻香的，淋一點麻辣湯更滑順。麻辣湯裡有蒜丁不會過麻過辣，反而可以一口接一口很過癮！雪花牛肉片油脂不太多，嫩而不膩，鴨血也相當出色。可以續湯就試了清燉，不鹹不淡反而有點蛤蜊蜆湯的感覺，也很順口，推👍
 Edward Hsieh ,https://www.google.com/maps/contrib/115020061290683681865/reviews?hl=zh-TW,5,True,266,銷魂麵味道香辣，湯頭搭配豆腐口感不錯，喜歡吃辣的朋友有機會可以嘗試，假日人潮眾多建議提前去。
 a29544345 ,https://www.google.com/maps/contrib/107396132303389806443/reviews?hl=zh-TW,4,True,103,"排隊名店，但不會久等，員工收桌、清潔、出餐有效率，翻桌很快

餐點價格偏高，味道都差不多

兩道餐點的麵都一樣，算好吃，淡淡的鹹味，淡淡的辣味，很Q的麵，味道很協和

老油條：非常脆，油耗味重，沾麻辣牛肉湯到後來會有苦味，不推

附餐的鴨血：軟嫩，但不入味，不夠鹹，才附贈兩塊就有點膩⋯

麻辣牛肉湯麵：麻辣湯味道單調，且不夠鹹
不適合沾老油條，不推

清燉半筋半肉湯麵：清燉湯算有味，但不夠特別，牛筋軟嫩好吃，但沒什麼味道

兩碗湯麵的牛肉：薄片算好吃，但就有點像火鍋的那種培根牛⋯

最厲害就沾醬！沾牛肉非常好吃！"
 V V ,https://www.google.com/maps/contrib/100965535149633204201/reviews?hl=zh-TW,4,True,257,麵很好吃😋但肉片油花多顯得湯偏油😑
 Miss Chen ,https://www.google.com/maps/contrib/116528041190236107603/reviews?hl=zh-TW,4,True,43,"麵條Q彈搭配麻辣湯頭很開胃
份量算是女生會吃飽的量
推薦大家豆腐鴨血也都很入味٩(˃̶͈̀௰˂̶͈́)و
但加上服務費後價格其實偏高且位子偏窄
建議大家不要在用餐時間尤其假日來吃～"
 Bonjour Cindy ,https://www.google.com/maps/contrib/100559331988598629007/reviews?hl=zh-TW,4,True,65,麵條很Q，味道也不錯，牛肉很嫩，牛筋也滷得很好，鴨血很好吃，可惜豆腐沒入味，然後不能刷卡、不能外帶、不能打包，規定超級多，搞不懂吃不完的不能打包是什麼概念，是在逼我們食量小的人浪費食物嗎？？？
 liang X ,https://www.google.com/maps/contrib/115481255969050317725/reviews?hl=zh-TW,3,True,278,"乾麵Q彈有勁好吃。
湯，碎肉片都普通到差。
只點乾麵就好。
不值一訪，"
 ball lin ,https://www.google.com/maps/contrib/101897060493570691629/reviews?hl=zh-TW,3,True,115,整體來說好吃，尤其鴨血嫩、肉片算多，麵體一開始入口Q彈，但過了兩口就糊爛，跟湯頭一樣，變得油鹹過膩⋯建議排隊人潮過了再去嚐鮮就好～不然會小小失落
 王小蔚 ,https://www.google.com/maps/contrib/106503094085289968161/reviews?hl=zh-TW,2,True,170,"太油太鹹
除了麵條還不錯
口味ㄧ般
沒什麼特色
價格偏貴
嚐鮮還可"
 Fangmeidy Fang ,https://www.google.com/maps/contrib/102453094151635811569/reviews?hl=zh-TW,4,True,507,"滿滿的排隊人潮~
還好今日等候時間不會太久~
第一次來亨用，麵跟湯的味道很不錯，
牛肉雖然是牛肉片，
但有肉的鮮甜，牛筋滷的軟而不爛，
很不錯，回訪機會高~"
 賴英峰 ,https://www.google.com/maps/contrib/104381891398181096559/reviews?hl=zh-TW,1,False,24,"在A11美食街，一家人用餐排隊排了25分鐘，因為有人想吃別的所以要外帶，等了這麼久竟然說不能外帶，也不能端到外面吃....門口5步的距離自己端也不行...
感覺真的挺差的（如照片這麼近就坐在門口也不行，挺失望的"
 H Lobo ,https://www.google.com/maps/contrib/111038980208882549831/reviews?hl=zh-TW,2,True,23,麵Q但是太鹹，牛肉鴨血豆腐都沒入味，算被雷到
 CHIEN-TING LIU ,https://www.google.com/maps/contrib/117809400628614666631/reviews?hl=zh-TW,4,True,450,"麵有麻辣感Q勁
麻辣湯頭麻麻辣辣的還不錯
不過牛肉是牛肉片有點可惜
半筋肉全是筋還不錯"
 Cindy Tsai ,https://www.google.com/maps/contrib/116936156507938053635/reviews?hl=zh-TW,5,True,128,"颱風天的週六約12:30排隊，約等15鐘左右，點了麻辣牛肉湯+銷魂麵（內含鴨血、一顆溏心蛋）價格230元，以及一分老油條40元，以上需另加一層服務費

牛肉湯花椒的香氣濃郁！味道十足，搭配老油條更是絕配！麵條Q彈入味有嚼勁，很推！

不吃辣的人可以事先告知，有不辣的可以選擇呦！😀"
 Vina Wang ,https://www.google.com/maps/contrib/116103994201547409552/reviews?hl=zh-TW,5,True,310,"平日5:30左右到等個10分鐘就輪到我們
乾麵好吃湯可無限續
整體好吃～

！提醒！新光店結帳只收現金或禮卷不收信用卡"
 JL ,https://www.google.com/maps/contrib/115381625682141827789/reviews?hl=zh-TW,4,True,27,"銷魂麵麵條偏硬，很有嚼勁。醬汁吃得出微微油蔥香、烏醋與些許辣油的香氣，整體搭配得宜。

麻辣湯裡肉片很多，都是五花肉片，雖然搭配肉片的醬汁微酸有提味，但吃到後面還是覺得很油膩。
鴨血雖然不到很入味，但很滑嫩感覺很新鮮，是我喜歡的口感。

店面裝修與餐點擺盤都算講究，但座位少且間隔很近也很擁擠。"
 Hong So ,https://www.google.com/maps/contrib/113794805286407754607/reviews?hl=zh-TW,3,True,310,"味道中上，一試無妨
湯同麵分開上
湯頭不夠熱，麵條q彈有麥味
鴨血都是不值錢的東西
畀多少少不會虧本吧
這個價錢有其他選擇"
 Jessie Pai ,https://www.google.com/maps/contrib/111939296183038246453/reviews?hl=zh-TW,5,True,214,麵條Q彈好吃，調味的很不錯，麻辣湯頭可以喝，店員也會熱心提醒辣度可調整，肉片及鴨血豆腐豆皮都很好吃。
 PinPin Hsu ,https://www.google.com/maps/contrib/116680706779152036398/reviews?hl=zh-TW,4,True,78,"平價、不可刷卡(?)、不可打包(?)、不提供訂位、值得排隊一試

個人口味評分
1、麻辣牛肉湯
分數：★★★★☆
湯可續、肉給的挺大方的，湯頭味道還行。
其實湯的分數只想給個3.5，但是湯內的牛肉片有提供「獨家秘方醬料」，這醬料神啊！酸酸的很解辣，無違和感，於是瞬間分數給到4

2、銷魂麵
分數：★★★★★
手工麵條非常Q彈，配上銷魂辣油，再淋上一點湯，很快的一碗麵馬上就吃得精光！
如果很喜歡他的麵，吃飽後還可以至櫃檯購買方便麵，免排隊在家就可享用啦～

3、鴨血
分數：★★☆☆☆
每個set都附上兩塊大鴨血，但很抱歉！真的不好吃😭完全沒入味⋯⋯

關於餐廳
環境：★★★★☆
衛生：★★★★☆
服務：★★★★☆"
 Nature ,https://www.google.com/maps/contrib/105462718066225101095/reviews?hl=zh-TW,1,True,117,"超級貴！
不愧是信義區，
跟在延吉的分店比起來貴了快$100吧？
送一杯水就要收服務費一成，
超級坑，
還不收信用卡或行動支付，
都什麼時代了還這麼八股，
真的不推薦，
也不會再光顧。"
 Shaynah ,https://www.google.com/maps/contrib/106681144654240227720/reviews?hl=zh-TW,3,False,5,"清燉三寶380+10%服務費
牛腱超硬超乾，完全咬不下去，好不容易扯下一塊入口後，是滿嘴的肉乾味，感覺是滷到過頭的肉🥲"
 WENCHI LI ,https://www.google.com/maps/contrib/102394546863875230432/reviews?hl=zh-TW,3,False,39,先說排隊排了15分鐘。以為是疫情人數控管，有3.4桌沒人，但我們入座後塞到滿🤷🏼‍♀️。然後是麵條是很Q很好吃，口味也還不錯，但麻辣湯頭真的不怎麼樣，有點死鹹，油條還行。清燉湯ok。吃一次知道味道就夠了。鴨血普通。
 MU ,https://www.google.com/maps/contrib/108019133432967278860/reviews?hl=zh-TW,2,True,281,"排了近一小時，在肚子超餓的情況下吃了第一口麵，嗯⋯麵條不Q、有蠻重的麵粉味，吃幾口就整碗給男友吃了💔💔
鴨血不入味但沒有可怕的腥味，麻辣湯頭蠻普通，不過男友喝完清燉後說我的好喝很多，信義店需加收10%服務費，吃過一次就夠了。"
 藍精靈 ,https://www.google.com/maps/contrib/105729256816864022303/reviews?hl=zh-TW,3,True,26,"這樣的ㄧ份套餐價格偏高，
而且我沒吃過半筋半牛的商品，
為什麼會出現牛肉片呢？
ㄧ般的麵店都是牛肉塊，只能說名氣大於商品（失望）"
 Chien-Yu Chen ,https://www.google.com/maps/contrib/100487742217884580923/reviews?hl=zh-TW,3,True,38,"1.	平日中午時段過去用餐，排隊時間約莫35分鐘，店內用餐環境挺擠的，要聊八卦需要輕聲細語。
2.	當天點清燉湯頭，湯頭表現的中規中矩，喝下去很溫順，但是牛肉很像是一般火鍋店肉片啊！沒有特別出色。銷魂麵的部分吃前幾口還可以，後面略乾，頗有嚼勁、微辣微辣的口感。
3.	一人一份低消，需加收10％服務費，雖然沒什麼被服務到，但是工作人員態度親切，沒因為擁擠的工作環境和滿店的人潮而有態度不佳的問題。
4.	CP值略低，若經過沒人潮排隊或是用餐環境更舒適些，可以再訪！"
 Yan Solomon ,https://www.google.com/maps/contrib/100787684838107625601/reviews?hl=zh-TW,5,False,5,"麵條四顆星
辣度微微微微微辣
整體用餐環境三顆星"
 Michael Chen ,https://www.google.com/maps/contrib/118204327421769997284/reviews?hl=zh-TW,4,True,243,"服務用心，主動積極。
麵條好吃，牛肉湯頭一般，鴨血可以更入味些。"
 Lyn Lin ,https://www.google.com/maps/contrib/113949417694045679834/reviews?hl=zh-TW,4,True,159,鴨血好吃相較於清燉湯頭個人比較麻辣的湯頭
 溫信維 ,https://www.google.com/maps/contrib/111710434774438967075/reviews?hl=zh-TW,5,False,6,麻辣類的湯頭味道很棒。這裡的麵條和湯是分開吃的。麻辣湯頭裡有麻辣滷鴨血、老豆腐，滷豆皮。他的麵條吃起來很Q彈，拌著蔥油的清香很好吃。
 YTyoyo ,https://www.google.com/maps/contrib/116151926732649460293/reviews?hl=zh-TW,3,True,49,我吃清燉牛，麵超好吃，很有嚼勁，牛肉吃到後面稍微膩了一些，朋友點了麻辣口味，朋友表示吃到後面超膩，
 俞德欣 ,https://www.google.com/maps/contrib/117447414263320339452/reviews?hl=zh-TW,3,True,318,麵條主打辣味但是辣味程度一般人還可以接受。麻辣湯頭就真的很辣了，味道還不錯。麵條與湯頭分開，湯頭喝完可以免費加湯（清湯的味道很棒），加上豆皮或是鴨血，一份套餐吃起來含小費大概都要300多元。
 劉兆軒 ,https://www.google.com/maps/contrib/109724212002839836451/reviews?hl=zh-TW,4,True,344,"乾麵好吃麵條軟硬適中
清燉牛肉湯好喝牛肉不會乾柴恰當好處
價位稍高"
 Circle chuang ,https://www.google.com/maps/contrib/108282203673751521600/reviews?hl=zh-TW,4,True,119,因為內用要10%服務費付不下去，選擇了外面美食街的座位！第二次吃份量依舊足夠…
 Avon Lin ,https://www.google.com/maps/contrib/101558171343344693466/reviews?hl=zh-TW,2,True,27,"兩分給服務不錯跟沾醬。
湯、肉、鴨血都普通～
麵調味不錯，但對我來說太硬"
 林恆雯 ,https://www.google.com/maps/contrib/116232993236590009019/reviews?hl=zh-TW,4,True,87,"店內空間不大，座位不多，但用餐時間有限制50分鐘，所以等候時間不會太久。平日晚上約等20分鐘。
必點！麻辣牛肉口味+油條！很過癮～湯也麻而不辣！不油！"
 wei chih chang ,https://www.google.com/maps/contrib/107515992255588177684/reviews?hl=zh-TW,5,True,119,好吃的麵條，麻辣鴨血也不錯
 Colin Jao ,https://www.google.com/maps/contrib/103392837778089918435/reviews?hl=zh-TW,1,True,"1,207",座位窄小，服務不佳，吃飯的過程，非常的不舒適！想坐在外面的公共區也不行，說什麼會被罰錢等有的沒的.......，第一印象就很差！慕名而來普普而已，沒有什麼特別的。
 孫孫 ,https://www.google.com/maps/contrib/112737253465195552232/reviews?hl=zh-TW,4,True,33,麵很好吃味道很讚清燉的湯蠻清淡的整體價格偏高適合嚐鮮的一家店
 珊珊 ,https://www.google.com/maps/contrib/106560680686806801037/reviews?hl=zh-TW,4,True,231,"座位很擠不舒服，等店員加湯等很久。
麵很好吃，香辣有入味！"
 我的天啊 ,https://www.google.com/maps/contrib/114462517922295095893/reviews?hl=zh-TW,5,True,234,兩個月前許願改天再來吃，今天我來了，果然還蠻好吃的，下次再來排隊，再等30分鐘*1/2。
 GIANT TOUGH ,https://www.google.com/maps/contrib/102442847347675800392/reviews?hl=zh-TW,3,True,747,吃一次即可湯沒溫度牛肉片是不少但很普通唯一特別的是麵條蠻q彈調味的還可以但感覺外面麵店也做得出這種口感為此排隊不值得這家店還要收一成服務費喔
 Mag Tsai ,https://www.google.com/maps/contrib/104262906473295949010/reviews?hl=zh-TW,4,True,37,"清燉牛肉湯喝起來像韓國的神仙雪濃湯，紅燒牛肉湯比較一般，麵體Q，湯可以續加。
烏梅汁中規中矩，建議不用點油條，因為不如搭配麻辣鍋這般好吃。"
 Dok Wen ,https://www.google.com/maps/contrib/102872830833338479734/reviews?hl=zh-TW,3,True,19,"因為排隊人潮所以進來看看
店名很有特色但是用餐感覺普普"
 段熊熊 ,https://www.google.com/maps/contrib/112271972873200273897/reviews?hl=zh-TW,4,True,35,"銷魂麵的麵是真的蠻好吃的，口感很Q
湯的部分清湯跟麻辣口味的都蠻不錯的
尤其是麻辣的加上老油條真的很夠味
鴨血的部分我就覺得普普了
整體上來說還算不錯，會回購"
 yiyo ,https://www.google.com/maps/contrib/115453815404512074797/reviews?hl=zh-TW,2,True,125,很普通，店裡又很擠。
 Haogogo Liu ,https://www.google.com/maps/contrib/117957459212178398552/reviews?hl=zh-TW,4,True,31,麻辣湯頭清爽不油膩，麵條Q彈鹹香順口，值得一試⋯
 愛吐司 ,https://www.google.com/maps/contrib/106220489271632314901/reviews?hl=zh-TW,3,True,135,"在百貨公司美食街，不能刷卡，卻要收10%的服務費,這點不OK。麵條Q彈，鴨血不錯，牛肉湯很普通。喜嗑麻辣鍋的，可以解解饞。"
 我是Norah ,https://www.google.com/maps/contrib/105645031478371958585/reviews?hl=zh-TW,4,True,190,"乾麵超好吃的
但牛肉湯普通，不吃牛的人可能就比較不適合你"
 TingYu ,https://www.google.com/maps/contrib/109776539888461087953/reviews?hl=zh-TW,5,False,12,"超愛吃！麵Q度非常剛好
湯頭好喝牛肉量多又嫩"
 Chloe Tsai ,https://www.google.com/maps/contrib/115083899043881732201/reviews?hl=zh-TW,4,True,33,趁著微風南山剛開幕，終於這裡不用大排長龍，之前聽公司裡的同事說，平常中午來排隊的話都要等一個小時以上，心裡想說也未免太誇張了吧，總想著有一天可以來朝聖一下，終於皇天不負苦心人，週末來的時候居然前面只有幾個人，馬上就決定坐下來的等，拿到菜單的時候，選擇其實也還蠻簡單的，基本上就是要加辣的或是不要辣，心得就是銷魂麵還不錯吃，但是沒有到這麼驚艷的程度，之前在A9老鼎旺吃到的銷魂麵，真心有讓我驚艷到，在一起端上來的是牛筋湯，可能我心裡已經有段純真當作比較，所以覺得表現也是中規中矩，整體來說如果可以不用大排長龍的話是蠻值得來吃吃看的。
 BEAViS ,https://www.google.com/maps/contrib/101653708054556198829/reviews?hl=zh-TW,3,True,155,"平日週末晚間，排隊約等候25-30分，分桌率算快，有限時50分鐘用餐時間。
初次嚐鮮還算OK，但是憑良心講未到口耳相傳中的「非常好吃」，百貨店的唯一優點是可以吹冷氣排隊，但是加收服務費實在是有點不解，也沒有什麼桌邊服務，入座前就會先結帳，感覺像是消費者幫忙出房租的概念。"
 陳冠綸 ,https://www.google.com/maps/contrib/116832423723770429828/reviews?hl=zh-TW,5,True,310,"麵很勁道很好吃
醬料湯頭都不錯，價格偏高偶爾吃一次還可以"
 布萊恩恩 ,https://www.google.com/maps/contrib/106551518244581545053/reviews?hl=zh-TW,3,True,307,湯頭跟鴨血豆腐都很普通，唯一好吃是麵條！很Q彈！
 Ken Chen ,https://www.google.com/maps/contrib/108938904938677357140/reviews?hl=zh-TW,5,True,503,麻辣半筋半肉湯和清燉湯都很棒，牛筋量還滿多的！銷魂麵麵條很Q，口味微微酸辣，很好吃😋
 Hugo Liu ,https://www.google.com/maps/contrib/114766055378541757977/reviews?hl=zh-TW,4,True,50,清燉麵很特別的湯頭和烹調方式，和清燉牛肉麵完全不同，乾麵很Q也很乾，但是價格略貴一點。
 Irena Chang ,https://www.google.com/maps/contrib/114533395828086908040/reviews?hl=zh-TW,3,True,169,"個人覺得
銷魂麵好吃還有蛋
其他真的還好
麻辣湯的湯頭很淡
所以搭配油條就真的還好
若可以只吃麵就好
牛肉湯的肉是火鍋肉片
普普通通
推薦麵是真的不錯👍"
 Raphy L ,https://www.google.com/maps/contrib/118365973581301559554/reviews?hl=zh-TW,5,True,159,好吃，麵彈湯鮮，服務親切，小妹妹巡場加水，清燉牛肉湯續湯喝飽飽，平日三點去不用排隊。價錢有點貴但在百貨美食地下街來說算普通。
 Kiki Li ,https://www.google.com/maps/contrib/104375787361096159925/reviews?hl=zh-TW,5,True,10,不得不試，請預留現金。麵質超級彈牙，喜歡的可以買幾個包裝版回去吃。
 陳讓傑 ,https://www.google.com/maps/contrib/113642720608534642303/reviews?hl=zh-TW,4,True,38,"微辣，沾點微酸醬，風味絕佳
麵條微帶嚼勁扎實，值得一試"
 海玉子 ,https://www.google.com/maps/contrib/114814937934942804268/reviews?hl=zh-TW,5,True,62,"因為麵有油蔥，但我不吃油蔥，本來想用加麵的方式，換一碗沒有油蔥的麵，但店員發現我的麵沒動過，店員就免費換了一碗沒有油蔥的麵給我，十分的貼心

1.鴨血Q彈
2.我女友很正
3.肉的價性比很高
4.豆腐入味"
 周筱雅 ,https://www.google.com/maps/contrib/101817666863394199803/reviews?hl=zh-TW,5,False,8,湯頭清淡好喝肉量多非常好吃
 Ice Panda ,https://www.google.com/maps/contrib/104822031858942048630/reviews?hl=zh-TW,4,True,316,口味不錯，老油條和溫泉蛋很不錯，態度親切服務好
 youlin_0126 ,https://www.google.com/maps/contrib/105456300565406138404/reviews?hl=zh-TW,5,False,5,"不敢吃辣也可以接受這裡的麵
好吃份量很多CP值很高"
 RICHARD CHANG ,https://www.google.com/maps/contrib/101261927609536210197/reviews?hl=zh-TW,4,True,241,很跨張的排隊人潮，半筋半肉牛肉麵好吃。
 Parie Lin ,https://www.google.com/maps/contrib/114227546417464047652/reviews?hl=zh-TW,3,True,598,"優點：
餐點的部分都不錯，這次點了「非牛特餐」、「清燉牛肉湯+銷魂麵」、「老油條」，清燉牛肉湯很好喝，麵的味道也很夠很好吃，肉跟其他料也都不錯～就是肉的沾醬是酸的，吃不太習慣。
缺點：
每人最少要點一份餐這很正常也能理解，畢竟是內用。但沒辦法打包跟調整麵的份量覺得很可惜，因為我們都吃不完，剩下了一堆麵覺得很浪費食物⋯
另外，湯只有辣跟不辣兩種，辣度沒辦法調整，所以吃的我們有點崩潰😂😂"
 葉任航 ,https://www.google.com/maps/contrib/102081736503731212481/reviews?hl=zh-TW,5,False,5,鴨血入味豆腐好吃麵蠻Q彈的可以加湯加辣總體來說是不錯的體驗
 Kuni ,https://www.google.com/maps/contrib/118286747047873517333/reviews?hl=zh-TW,3,True,141,"銷魂麵舖吃完卻一點也沒銷魂，名過其實

店內只有四種套餐可選，我點了麻辣半筋半肉的set，
牛肉湯的味道還可以，牛筋燉得入味卻不會太過軟爛，
但牛肉片真是一大敗筆，吃起來就是冷凍的牛肉片，
肉很柴、而且有一種讓人不愛的肉味

銷魂麵的麵條有嚼勁，但油蔥味太重，
麵的量其實不算多，但吃沒幾口很快就膩了，所以我最後也沒吃完

以一碗280元的麵來說，我覺得他沒有達到應有的水準，
信義店還要多收一成的服務費，在百貨公司裡卻只收現金也很不便，
總之應該是不會有再光顧的慾望"
 Justin Mei ,https://www.google.com/maps/contrib/100105683527284376716/reviews?hl=zh-TW,3,True,39,乾麵不錯，只是溏心蛋沒有糖心，幾乎全熟！其他都普通。
