user_name,user_profile_url,rating,local_guide,comment_num,comment_text
 丁寶 ,https://www.google.com/maps/contrib/104032354013503180401/reviews?hl=zh-TW,4,True,53,"麵好吃👍，Q度也夠、整體醬料拌麵上恰到好處
糖心蛋適中、鴨血普通😑
🍖半筋半肉：牛肉湯的牛油過多，牛五花應該是清水燙後丟入，無味🙄，牛筋軟嫩👍
沾醬特別😂，可以彌補牛五花的無味感
🥬無肉餐：豆腐普通、豆腐皮可以，湯油...

後來要了一碗牛油少的湯，比較好一點，但吃的出胡椒很重...
服務態度還ok"
 N. W. ,https://www.google.com/maps/contrib/105174001357427515410/reviews?hl=zh-TW,3,True,118,"低消為一份套餐280加一成
乾麵不錯吃
但是湯很普通，筋有點太爛，吃了有點怕
滷鴨血沒什麼味道
加點了一份老油條只吃兩根...沾這個湯不搭，還是要沾麻辣鍋才夠味⋯⋯
如果可以單點乾麵評分應該會高一些"
 L¡n Sam ,https://www.google.com/maps/contrib/118216107635907755370/reviews?hl=zh-TW,1,True,108,一碗泡麵配滷味賣快300元
 Leona Chen ,https://www.google.com/maps/contrib/113307325820334704985/reviews?hl=zh-TW,5,True,29,服務親切，耐心解說，餐點也很好吃！
 Yen-Jung Lee ,https://www.google.com/maps/contrib/112635210077467763510/reviews?hl=zh-TW,4,True,195,麵條口感有嚼勁，可選麻辣或不辣，牛肉湯是肉片，有清燉也有麻辣湯頭可選，旁邊的沾醬可以沾牛肉一起吃，鴨血普通，整體吃起來還不錯。
 xxin.L ,https://www.google.com/maps/contrib/107835438184520194771/reviews?hl=zh-TW,3,False,49,麻辣湯很香、麵條Q彈有咬勁，但三百的價位只有牛肉片而不是肉塊，需要排隊的情況不會想再吃
 easonponpon ,https://www.google.com/maps/contrib/101801288817975113496/reviews?hl=zh-TW,2,True,151,又是間純靠名氣、口味普通的餐廳，麵條跟湯頭沒特色且平淡，附的鴨血也完全沒味，覺得沒有吃跟排隊的價值，下次不會再光顧。
 Michelle Huang ,https://www.google.com/maps/contrib/108372079681014718756/reviews?hl=zh-TW,3,True,457,"麵稍微有點乾，需要加一點湯！
推清燉牛肉湯！湯頭蠻甜與濃，嘴唇會黏黏的！但不推清燉半筋半肉，口味太淡以致筋很膩、有點噁心～還是麻辣紅燒與牛筋比較搭～
多點了豆腐感覺普通～

份量夠、可續湯，翻桌率算快。
如果排隊人少一點還是可以來值得一試！"
 彭翊晴 ,https://www.google.com/maps/contrib/103563486561346888129/reviews?hl=zh-TW,2,False,9,"有低銷每個人需購一份套餐還需10％服務費限制五十分鐘不得外帶打包…
點麻辣牛肉套餐牛肉是像火鍋店的牛肉片…
其餘麵條，糖心蛋鴨血都很好，但覺得光這個不能那個不能還有沒啥服務還收服務費就覺得不行，推薦大家不如去吃阿二麻辣食堂🙃"
 Yuan Liu ,https://www.google.com/maps/contrib/105922727730096885581/reviews?hl=zh-TW,4,False,15,麵微辣很好吃，湯頭跟沾醬都很棒，湯裡的肉片雖然很多但真的太肥了，跟湯非常不搭。吃到後面會非常膩。
 Didi Super ,https://www.google.com/maps/contrib/101434388105401365014/reviews?hl=zh-TW,3,True,130,坐到的座位是在櫃檯旁狹小的桌位，對於身材較高大的顧客有些不便，左手會頂到牆面，右手則是要閃隔壁桌走動的客人，桌下的置物空間也十分不足。味道與其他分店沒有太多的不同，值得一提的是昨天整日未進食，晚上用餐後至今早拉了兩次肚子，就連吃麻辣鍋也不曾拉肚子的我感到十分新奇。
 yiting hsieh ,https://www.google.com/maps/contrib/102489681067776880509/reviews?hl=zh-TW,4,True,38,我點的是麻辣口味的牛肉半筋半肉、麵的味道很好吃！口味鹹淡剛剛好。沾醬沾起來也很好吃。鴨血吃起來也是算蠻爽口的，半筋的部分也不錯，酸梅湯的部分沒有很甜算還可以。
 葉欣蓓 ,https://www.google.com/maps/contrib/102038702073290333222/reviews?hl=zh-TW,1,True,17,對待外送人員態度極差，不尊重人，差別待遇，建議不要點這家外送，會耗很久才給外送員，包裝也很爛，小心送湯還是會灑，餐也很普通又貴
 陳冠廷 ,https://www.google.com/maps/contrib/112769421053256510450/reviews?hl=zh-TW,2,True,28,"那樓層相對熱門，需要排隊的店面
餐點是套餐搭配，一個牛肉湯一碗辣拌麵
麵口感調味，吃起來像近年流行名人代言的麻辣拌泡麵
牛肉湯有分麻辣/清燉簡而言之就是辣辣的水/高湯粉；搭配品質不高的火鍋肥牛肉片
吃起來平淡又膩，導致用餐大多數人的牛肉片都有剩"
 KH Y ,https://www.google.com/maps/contrib/102651682578223560577/reviews?hl=zh-TW,4,True,977,每次經過銷魂麵舖都有很多人在排隊，不過由於有用餐時間五十分鐘的限制，所以翻桌速度還算蠻快的，半個小時內幾乎都能夠排到。特別要注意的是銷魂麵舖不提供外帶服務及不能使用信用卡！銷魂麵都伴有微微麻辣的特製辣油，非常香且順口。當天點了一份正常的麵及一份主動備註煮軟一點的麵，正常麵的Q度非常夠，吃起來很彈牙，稍稍比一般的麵硬一些；備註煮軟的麵吃起來較濕潤卻不會有爛爛的感覺，意外的好吃。湯頭部分可以續湯，清燉湯很爽口，喝起來頗有層次感；麻辣湯不會過份辣，雖然稍微鹹了點但是和牛肉片很搭。套餐鴨血有兩塊，一樣很入味。現場有賣銷魂麵單包裝可以回家自己煮。
 Pei Wu ,https://www.google.com/maps/contrib/112232647398271666550/reviews?hl=zh-TW,4,True,75,好吃歸好吃，價格高，還有服務費。
 PEI CHI PAN ,https://www.google.com/maps/contrib/100073079820069720662/reviews?hl=zh-TW,5,True,872,"齁齁甲！
惟價格較高"
 Sid H ,https://www.google.com/maps/contrib/108668368099441721540/reviews?hl=zh-TW,2,True,24,湯頭不錯，麵味道滿普通。A11店要收一成服務費，店員雖然親切，但其實沒什麼需要服務以及被服務到的感覺；飲料喝不完想改外帶杯，店家也無法提供外帶打包服務。若是因為百貨店所以收費會高點，不如直接把單價提高，不要轉嫁到服務費，感覺還比較能接受。
 Dacia Yao ,https://www.google.com/maps/contrib/113616141869456168531/reviews?hl=zh-TW,1,False,14,建議排隊前先看評價，麻辣湯風味不足，麵一般，店內擁擠用餐還要排隊，整體表現對不起這價格。如果麻膳堂80分這家只在不及格邊緣。
 臻臻 ,https://www.google.com/maps/contrib/106109212557063982011/reviews?hl=zh-TW,5,True,30,有麻辣與清燉兩種口味選擇，麻辣湯底很夠味，適合喜歡吃辣的人，清燉則是相當清爽，同時也有大骨湯的濃郁感，推薦給喜歡清淡的人。湯中的牛肉片需要沾醬，或是跟著湯一起吃。配餐的麻辣鴨血或是豆皮都十分入味。主餐的麵是香辣的，很好吃，不會太鹹，搭配蔥與塘心蛋很讚~
 Natalie Tsai ,https://www.google.com/maps/contrib/100811277817196565306/reviews?hl=zh-TW,3,True,16,"1.麵條有嚼勁口味不錯
2.味素疑似放的很多吃到一半就覺得太鹹吃不下去，已經喝很多水回家後依然整晚口渴到睡不著（本人平常已經是吃重鹹）
3.如果最近或平常吃比較清淡就不要點麻辣，一定會拉肚子
4.雖然說可以免費加湯但是麻辣湯很鹹、很像沾醬，不像可以喝的湯

總而言之CP值不高經過可以吃絕對不要特別來吃"
 陳信光 ,https://www.google.com/maps/contrib/115358056826203306282/reviews?hl=zh-TW,2,True,585,跟第一次吃比起來，價格貴很多，味道也普通，評價是用贈品洗的
 李泰瑞 ,https://www.google.com/maps/contrib/117978160868665229337/reviews?hl=zh-TW,2,True,19,"湯頭清淡，沒有麻辣湯的精髓：花椒
辣椒也沒炒過的味道，似乎只用辣油下去提味
唯一優點就是麵條好吃，需要收10%服務費；一碗麵要250以上
結論：不如去吃萬家香滷味加中辣可能還只要100多。"
 Garry Yeung ,https://www.google.com/maps/contrib/109408391225484508113/reviews?hl=zh-TW,4,True,"1,054","基本上就只有牛肉麵有分半筋半肉跟清燉麻辣
特色是湯跟麵是分開來吃的麵本身就有調過味但怕太乾也可以把湯加進去
肉份量蠻多的有筋跟雪花牛沒有那種一塊的牛肉
豆皮蠻好吃的滷的很徹底
可以加點油條更有麻辣鍋的感覺
溏心蛋搭配麻辣的東西有點突兀
整體來講不點其他單點的東西就會吃的很飽"
 YANG ANT ,https://www.google.com/maps/contrib/108426687909970115417/reviews?hl=zh-TW,1,False,2,"餐點品質下降（食材湯頭越來越淡，熱度也不夠）
從開幕吃到現在越來越退步

收銀小姐態度強勢，下午在門口排隊等候時，
用餐內場服務員很貼心協助座位準備，請我們先入座，但我們要入座時櫃檯小姐正在幫其他客人結帳，特別喝止我們請我們門口稍等，門口等候一會，內場人員再度請我們入座，我們也不敢座，只能等櫃檯小姐同意後才入座。

櫃檯小姐用字措辭真的需要再加強，聽了很不舒服！"
 Cs L ,https://www.google.com/maps/contrib/110742436073188645512/reviews?hl=zh-TW,1,False,3,鴨血很一般，麵不熱.不麻.不辣.不香(在家煮過多款市售的麻辣麵還比較好吃)，湯還ok，但其中有1條筋，吃起來像橡皮筋，一整個大失望。
 J.Y ,https://www.google.com/maps/contrib/117547479572427872997/reviews?hl=zh-TW,3,True,"2,197",銷魂麵好吃夠味，麵也煮得很有嚼勁，不過味道偏油。半筋半肉牛肉湯還行，牛筋好吃但是牛肉片還好；旁邊的鴨血完全沒有入味~
 Daisy Linn ,https://www.google.com/maps/contrib/104656323575451514778/reviews?hl=zh-TW,2,True,25,"半筋半肉牛肉麵是用火鍋肉片...有點失望
不能刷卡不能打包外帶收一成服務費
只有倒水送餐結帳有被服務到的感覺
在附近上班有急事要走吃一半又不能打包蠻困擾的而且一份還不便宜呢
麵很有彈性但有點鹹湯頭不錯但很像鼎王那種湯頭如果一份200我願意但一份280+一成大概只有吃這次"
 Eva Chiu ,https://www.google.com/maps/contrib/108185304555053386444/reviews?hl=zh-TW,3,True,148,很會行銷的店，讓人抱著超高度期望
 林怡萱 ,https://www.google.com/maps/contrib/112399874896852255866/reviews?hl=zh-TW,1,False,8,跟朋友去吃飯，麵都來了才發現原來只有我們沒有上到水，跟服務生說，送來的兩杯裡面，一杯有毛，一杯杯子裡面超髒，舉手跟服務生說，還被白眼，不懂這服務費到底是在收心酸的？剛好坐在廚房外面的位置，裡面吵的要命，完全不顧外面是不是有滿滿的客人，這樣的服務，這樣的環境，這樣的餐點，不太懂10％的服務費到底為什麼要收？
 Kang Hsu ,https://www.google.com/maps/contrib/115387009093641582285/reviews?hl=zh-TW,4,True,102,整體份量很足，不過牛肉是火鍋肉片那種，吃到最後會蠻膩的，麵跟溏心蛋蠻好吃的，湯也不錯喝！店員服務態度佳
 Anne Chou ,https://www.google.com/maps/contrib/117404008066240034313/reviews?hl=zh-TW,4,True,864,2018/12/05初訪：中午用餐排隊花了蠻多時間的，這次點了清燉半筋半肉麵（$280），這是一碗牛肉湯與一碗乾拌麵，還有兩塊鴨血的組合，牛肉部分是牛肉片搭配牛筋，牛肉片油花頗多，感覺是五花部位，但是切的很薄，因此吃起來不會覺得很肥然後怕怕的；鴨血真的很軟嫩，吃起來像鴨血布丁的感覺，很好吃；乾拌麵的上面還有溏心蛋，蛋很好吃，麵條是台灣拉麵，很Q彈很有嚼勁，是好吃的麵條，雖然點的是不辣的清燉牛肉組合，但是乾拌麵還是有拌辣湯，也就是乾拌麵依然是辣的，鴨血也是辣的，但是真的很好吃；古早味紅茶（$40）真的蠻古早味的，覺得不錯喝，也跟乾拌麵很搭配，這邊用餐有一成服務費唷。
 Andy Chen ,https://www.google.com/maps/contrib/114500199711348108577/reviews?hl=zh-TW,5,True,84,"雖然排隊要一段時間不過值得
麵Q彈有勁感覺得到有下功夫
湯的部分麻辣的味道也很足
清燉也別有一番風味
沾肉的醬是酸甜的很有層次
鴨血的部分就相對比較普通一點
整體都還不錯"
 SHAWN TSENG ,https://www.google.com/maps/contrib/102134257223047701233/reviews?hl=zh-TW,5,False,4,好吃美味、上菜快速，逛街吃飯好選擇！
 陳慧芳 ,https://www.google.com/maps/contrib/111953299154703482673/reviews?hl=zh-TW,5,False,38,麵超Q超好吃的！服務也超好的
 daniel chien ,https://www.google.com/maps/contrib/111528648749954038403/reviews?hl=zh-TW,5,True,210,很久沒吃了感覺湯頭有進步
 Andy Hsieh ,https://www.google.com/maps/contrib/116210303721105051339/reviews?hl=zh-TW,1,True,227,麵條就一般麵店該有的水平；牛肉就更不必說了，根本就肉片怎麼混充牛肉麵賣？還低消每人一份套餐，再加10%服務費，只收現金！一份肉片麵套餐最低價230元！！CP值真的太低了。
 Damon He ,https://www.google.com/maps/contrib/114289898461610963020/reviews?hl=zh-TW,1,True,125,"麵條調味香氣十足、Q彈好吃
但
牛肉麵的肉是肉片，讓我大失所望
牛筋又沒有口感
鴨血、豆皮、烏梅汁我就不說了
結語：
毛利率應該很高吧？"
 洪淑苓 ,https://www.google.com/maps/contrib/107674717241003580773/reviews?hl=zh-TW,5,False,7,麵Q湯濃，唯有空間小，美中不足。
 Jaina Hsu ,https://www.google.com/maps/contrib/100520857708416788631/reviews?hl=zh-TW,4,True,335,新光三越的位子不多，很容易客滿，但是飯桌速度還算快，用餐前會先結帳才入座，費用會另算9%服務費，只收現金或新光三越的禮券，不能刷卡。麵條真的是非常好吃，Q彈且味道均勻，會讓人再回訪。
 林姵君Lucy ,https://www.google.com/maps/contrib/117620999205702024600/reviews?hl=zh-TW,4,True,582,麵有彈性，牛肉湯不錯👍
 Yt Chou ,https://www.google.com/maps/contrib/103506542252822110063/reviews?hl=zh-TW,2,True,173,(麻辣半筋半肉/麵辣)麵條本體很有咬勁，適合喜歡吃粗麵的人。溏心蛋，鴨血，牛筋都算中規中矩。麻辣湯頭缺乏層次，肉片量多但非常非常薄，完全吃不出肉味。拌麵其實滿好吃(雖然完全不香的油蔥酥讓我很納悶)，但調味與麻辣湯頭調性太接近，吃到一半便覺得膩口。街頭小吃的菜式但口味過於單調，最關鍵的香氣完全沒有，價格上也頗令人卻步。
 Jerry C ,https://www.google.com/maps/contrib/110402645779531993958/reviews?hl=zh-TW,3,False,11,"女友吵著要吃才來
麵Q彈味道不差
但牛肉是用肉片吃起來老老的不嫩
280加一成這不值得一吃"
 Arvin ,https://www.google.com/maps/contrib/109963624016642971969/reviews?hl=zh-TW,3,False,23,"整家店外場只有聽到宣竹服務生很熱情推公司掃條碼的贈小菜活動，該名服務員值得鼓勵！
本人過往吃過該麵鋪各分店因個人因素不吃鴨血以往服務人員都會主動兌換豆皮類的，今櫃檯人員X赫點餐我的後組賓客也不食鴨血x赫主動告知兩名小姐可以換豆皮，奇怪了我怎麼只有一盤麵跟一碗湯？"
 郭子安 ,https://www.google.com/maps/contrib/117800370462422146040/reviews?hl=zh-TW,4,False,25,"麵很QQ很好吃又夠味道，清燉就夠味道了～
油條一份很多，不建議一個人點…
不過信義店有點小，比較喜歡中山店的場地"
 呂佩珊 ,https://www.google.com/maps/contrib/114619460695009831728/reviews?hl=zh-TW,5,False,17,"麵很Q湯很濃
鴨血很入味"
 Jie Yu Li ,https://www.google.com/maps/contrib/110776311388287964815/reviews?hl=zh-TW,5,True,924,"清燉湯頭濃郁湯可以無限續
看似份量小其實可以吃很飽
另外加的辣油很香很好吃
加點的豆腐還好沒入味"
 Esther Tsai ,https://www.google.com/maps/contrib/100787792159092251634/reviews?hl=zh-TW,4,True,32,"牛肉套餐$230，半筋半肉$280
再加收10%服務費。

麵條很Q帶點微辣，湯頭麻辣或清燉都蠻有味道的。
鴨血普通。

整體來說會再想吃，只是價格偏貴"
 高文君 ,https://www.google.com/maps/contrib/113408173819290381713/reviews?hl=zh-TW,3,True,10,麵條跟湯頭是不錯，可惜牛筋煮的太爛沒有Q度，吃多了會怕，還有覺得收服務費有點不妥，因為沒服務到啊！（沒外帶也沒打包服務）
 黃敬傑 ,https://www.google.com/maps/contrib/106505349333987723338/reviews?hl=zh-TW,4,True,426,麵跟湯都好吃，雖然肉是給肉片，可能比較不符合一般人對牛肉麵的想像，但份量十足，吃起來好吃又很飽。
 小黑子 ,https://www.google.com/maps/contrib/116056025924981525626/reviews?hl=zh-TW,5,True,60,麵很好吃，裡面的醬我很喜歡
 RYaN LiU ,https://www.google.com/maps/contrib/109555120421128003879/reviews?hl=zh-TW,1,True,257,不懂在百貨公司美食街只能收現金是什麼落後的店家？還有點外送就不是客人嗎？
 阿岳 ,https://www.google.com/maps/contrib/103691625218182948182/reviews?hl=zh-TW,5,True,22,東西好吃、乾淨，美食街最好的選擇✌🏻
 Emma Peng ,https://www.google.com/maps/contrib/113950648981799679824/reviews?hl=zh-TW,5,True,215,信義區午餐好選擇
 yu S ,https://www.google.com/maps/contrib/109258268972806159035/reviews?hl=zh-TW,4,True,189,"不用排隊的情況下可以吃看看，要排隊就根本不值得，優點是麵很Q彈。店員帶位速度不快，裡面有空桌3桌卻還是在門口等了約5分鐘，幸好有椅子不然會怒。

銷魂麵鋪的新光三越店會多收10%我可以接受，但是不能用skmpay的理由是要配合其他門市，統一付現，只有傻眼，定價都沒有一致了，收費方式卻談一致，科科......"
 Kai ,https://www.google.com/maps/contrib/104840629071972612298/reviews?hl=zh-TW,1,True,54,"就是牛肉麵把麵跟肉分開吃，而且使用的像似火鍋肉片，還沒煮開，就一團肉要自己撥開，麵也沒煮開一坨一坨的，麵的味道很普通，湯頭感覺被稀釋的很淡。
帶位都省了，叫你直接走去他講得數字座位，點完餐還要自己去櫃檯先結帳，價位不便宜，還要一成服務費？"
 Joy Huang ,https://www.google.com/maps/contrib/101746990995794657637/reviews?hl=zh-TW,3,True,67,"乾麵味道普通但麵條有嚼勁
鴨血口感不錯，且肉量和套餐整體份量非常足夠
湯頭的話推清燉(覺得麻辣湯完全沒有層次)

用餐環境來說桌椅擺設方式的關係稍嫌狹窄，尤其入口左側區域"
 Sheldon Yu ,https://www.google.com/maps/contrib/118195077189273223994/reviews?hl=zh-TW,4,True,97,"中山店拜訪過n次，這次剛好在附近就來吃了。麵、湯頭、整體味道跟中山店一樣，算是品質一致，值得讚賞。而且只排了10分鐘，中山店的候位時間令人
卻步。唯一小缺點，這裡要收10%服務費。"
 Wendy Tsai ,https://www.google.com/maps/contrib/105396899736439763375/reviews?hl=zh-TW,4,True,288,午餐時間大排長龍，不過翻桌也蠻快的，麻辣牛肉湯配上鴨血、老油條真有在吃麻辣鍋的過癮感，單點鴨血60元、老油條50元份量非常多，每人低消需點一份套餐，麵量不少，一般女生食量可以吃很飽
 妃 ,https://www.google.com/maps/contrib/112703840481445813622/reviews?hl=zh-TW,5,True,177,"吃過很多次
清燉牛肉湯好喝牛肉很嫩
麵微辣非常開胃又好吃"
 P G Huang ,https://www.google.com/maps/contrib/117350617030310813872/reviews?hl=zh-TW,3,True,94,"一直很想朝聖的銷魂麵但吃完有點空虛
我點清燉牛肉湯+銷魂麵這樣$230
鴨血是真的很好吃但麵一般般
麵的口感感覺到處小吃店都吃得到的口感
牛肉湯不是一塊塊牛肉而是一片片火鍋肉片
其實蠻失望的期待感太高😓😓"
 Kyle Chen ,https://www.google.com/maps/contrib/116522997713529058888/reviews?hl=zh-TW,3,True,32,清燉湯頭好喝、肉也滿嫩。麵很Q，鴨血味道普通，價格有點貴230，而且新光信義店還要加一成服務費我不懂為什麼。
 李文娟 ,https://www.google.com/maps/contrib/103720588956013972424/reviews?hl=zh-TW,3,False,4,麵太鹹了，剛吃覺得不錯，越吃越鹹，後來加入湯裡才能平衡鹹味。只接受現金，居然在新光三越裡會出現只收現金的店家，有點傻眼
 Yolin Su ,https://www.google.com/maps/contrib/103631495728346420986/reviews?hl=zh-TW,5,False,7,非常好吃，價格也非常合理。肉量十足！
 范哲瑋 ,https://www.google.com/maps/contrib/115066683205176519135/reviews?hl=zh-TW,5,False,5,麵有夠好吃牛肉也是😍
 修伊 ,https://www.google.com/maps/contrib/108576050100306259643/reviews?hl=zh-TW,3,True,88,"麵看起來真的很好吃但是吃起來卻沒有想像中Q彈
然後麻辣一點也不辣其他料吃起來也都普普通通
只有賣相是100分適合上傳IG打卡"
 S JN ,https://www.google.com/maps/contrib/115490849545668803275/reviews?hl=zh-TW,5,True,379,"我真的好喜歡麻辣牛肉銷魂麵，他的賣點就是很想吃麻辣鍋的時候，又不必花這麼多錢，還可以吃超飽。
第一次吃是南京三民站大師兄咖啡，這家是最不用排隊的，除了牛肉湯跟麵，會送紅茶，但沒有兩塊鴨血，其他分店沒有紅茶有附水，但都有兩塊鴨血。再來是排隊排的最狂的中山站大師兄銷魂麵，這排隊真的很誇張，平日中午11:30開始營業，11點就有人開始排，我11點多到差點進不去第一輪，好驚人！然後是新光三越A11，B2的大師兄，平日中午小排隊，店員人很好不會硬把你併桌，A11有貴一些，其他分店都230，A11還要加10%服務費253。"
 Alice Lan ,https://www.google.com/maps/contrib/100846887782088915575/reviews?hl=zh-TW,5,False,1,香香又不會太辣，好吃😋
 Olivia Chang ,https://www.google.com/maps/contrib/115337819932514012249/reviews?hl=zh-TW,4,True,155,套餐價位有兩種，牛肉片230元與半筋半肉280元；只敢吃微辣的人，乾麵記得要選不辣或比正常再少些辣；推薦加點小黃瓜，很爽口。
 Adam Wu ,https://www.google.com/maps/contrib/106490702266338770290/reviews?hl=zh-TW,2,False,7,店內有多處兩人座位，但因為排在第一個的是五個人的家庭，帶位的店員因此不讓排在後面等兩個位子的人進去。有人跟帶位的店員反應，店員僅說要先保留位子給五個人的。等到輪到我跟友人要進餐廳的時候，店員問我們兩個人想做坐兩個人的位子還是四個人的位子。這告訴我們：1）4-5個人有特定的四人座位不影響等兩個位子的客人，2）店員想把兩人放在四人座位，3）店員要不然就是邏輯不好要不然就是老闆有交代故意要讓後面的人等。進去店然後送餐的服務生態度不錯但是心情已經被帶位的店員的低效率影響。
 吳恩宗 ,https://www.google.com/maps/contrib/103192926221402231130/reviews?hl=zh-TW,1,False,2,"服務生態度真的很差
對客人面無表情，好像去吃東西跟欠他錢一樣
對外送員也是愛答不裡的"
 謝忠宏 ,https://www.google.com/maps/contrib/106435470788616671800/reviews?hl=zh-TW,3,True,73,服務不錯。送餐人員有發現有位媽媽帶小朋友用餐，照單送上辣麵後馬上與點餐同仁討論辣麵的事，點餐人員立馬幫顧問換不辣的麵並吩咐廚房換回的辣麵不能再使用要銷毀。不能刷卡有進步的空間。
 Joshua Wang ,https://www.google.com/maps/contrib/110668751214844726505/reviews?hl=zh-TW,2,True,131,麵好吃，但是不能單點銷魂麵，套餐其他東西很坑，牛肉是肉片，筋太軟，鴨血不入味，是一份實際價格300初頭的乾麵。
 Michaela H ,https://www.google.com/maps/contrib/117372448067870266964/reviews?hl=zh-TW,3,True,246,"不錯吃，可惜就是不能外帶或是在外面用餐區用餐，只能乖乖花時間排隊入內食用。
餐點不錯，整體來說我還蠻喜歡的。但對我而言小可惜就是湯頭到最後就是濃濃的蒜味。"
 Candy Chen ,https://www.google.com/maps/contrib/107693766930526546935/reviews?hl=zh-TW,2,True,400,目前屬著名排隊麵館，價格不親民，口味一般，廚房人員屬年少，需更多的約束，在食物前挖鼻孔與滑手機有點不衛生
 潘尹婷 ,https://www.google.com/maps/contrib/102158536502479285268/reviews?hl=zh-TW,4,True,251,"銷魂麵如其名久沒吃好讓人回味啊！特別是那乾麵～麵條咬勁、醬汁調味一絕。牛肉湯是絕佳配角，雖然不是非常驚艷，卻也是不能少的一味😋

By
IG：followmeto_eat
FB：走～我們一起去吃"
 Jenny Shen ,https://www.google.com/maps/contrib/102868730618907403930/reviews?hl=zh-TW,3,True,349,"牛筋超嫩好吃,肉片很薄,無感.麵的調味好吃,但是整體不會到好吃想要再訪.況且不能打包刷卡的名店態度我覺得也很不ok"
 hh Y ,https://www.google.com/maps/contrib/103043551523054599069/reviews?hl=zh-TW,5,True,35,好吃五顆星！乍看之下份量還好，吃起來很飽啊，因沒有太多人知道新光A11有新開的分店，所以沒有等太久是小確幸。
 Gene Belcher ,https://www.google.com/maps/contrib/101520088493155568125/reviews?hl=zh-TW,3,True,448,"很多吃不完可以一直加湯還不錯但我覺得麵沒什麼特色
然後朋友的水杯裡有頭髮上餐前麻煩注意一下"
