user_name,user_profile_url,rating,local_guide,comment_num,comment_text
 Yk Chen ,https://www.google.com/maps/contrib/112450439295243819020/reviews?hl=zh-TW,5,True,34,"Cp值蠻高的
披薩口味很多種有甜有鹹
最推起司披薩🧀️

一定要趁熱吃才會牽絲！
其他炸物也都是現炸熱騰騰的

服務人員也很親切👍"
 Nicole Wu ,https://www.google.com/maps/contrib/108145721805731959253/reviews?hl=zh-TW,5,False,2,"炸雞腿美味多汁
披薩酥脆可口"
 余姵頡 ,https://www.google.com/maps/contrib/106060187915288775940/reviews?hl=zh-TW,5,False,6,"餐點都很好吃
上餐速度快
披薩🍕口味種類有夠多
每個服務生的服務態度都很好
下次一定還會再來"
 Tia CHEN ,https://www.google.com/maps/contrib/100310623615512949971/reviews?hl=zh-TW,5,False,36,披薩是薄皮的，意外好吃，炸雞腿很推，麻辣牛筋飯也很好吃，服務非常好，上菜很快，幾乎沒有等，可能是平日用餐，但座位幾乎八成滿，用餐體驗很舒服～
 Jumin Lu ,https://www.google.com/maps/contrib/100199440210559314633/reviews?hl=zh-TW,1,False,5,"中午吃單點餐點義大利麵不好吃～～蛤蜊有腥味，還炒了白菜在裡面，好想再吃中式炒麵！不過是青醬！

重點完全沒有服務，服務人員只有端一盤麵不像吃到飽一直送餐點！！這樣也收服務費～～其他自助吧也都是自助，沒有餐點服務，服務不如何～～完全不划算！！！重點價格跟吃到飽基本一樣😭😭傻眼"
 希望 ,https://www.google.com/maps/contrib/112836993426026025779/reviews?hl=zh-TW,5,True,86,蠻喜歡他的披薩的比一般的不油膩，炸雞也很讚。以299來說真的超值，難得現在還有這麼超值的店。
 winnie Chuang ,https://www.google.com/maps/contrib/110946131147420770331/reviews?hl=zh-TW,1,True,25,我個人覺得冰淇淋是洗碗精口味的，女服務生態度差對我們愛理不理，披薩炸雞也是過十幾二十分鐘才送到，感受很差！
 涼涼 ,https://www.google.com/maps/contrib/104697457140473741892/reviews?hl=zh-TW,5,False,7,披薩跟炸物都熱騰騰的很好吃，剩半小時會詢問最後加點，想吃什麼都能點，服務生們都相當親切，用餐沒有壓力，有機會還想再訪(*´ч`*)
 伊凡 ,https://www.google.com/maps/contrib/102572486134900878469/reviews?hl=zh-TW,3,True,20,第一次吃很好吃，隔一段時間再回去不知道發生什麼事，主食沒味道，炸雞跟油煮的一樣，服務差一大截，體驗相比第一次完全可以說是兩家餐廳。
 Wan Chen Huang ,https://www.google.com/maps/contrib/105234206417100407879/reviews?hl=zh-TW,1,False,4,主餐點了焗烤麻辣茄汁牛筋麵，用餐時間快結束時，服務人員看我主餐沒什麼吃，直接對我說：下次如果不吃主餐，可以不要點主餐，而不是詢問我菜色不合胃口嗎？其實；是很鹹吃不下口，整體口味偏鹹，應該不會再光顧了！
 林小庭 ,https://www.google.com/maps/contrib/117035435198093920791/reviews?hl=zh-TW,5,False,11,"服務員超級親切、很貼心，讓我們用餐很愉快，值得推薦一家大小&朋友聚餐好餐廳👍🏽
我們是週六用餐～外場的短髮姊姊&髮圈長髮姊姊和一位男服務員，都很勤快詢問需不需要pizza，真的很不怕人家吃👍🏽🤣"
 Chien Louis ,https://www.google.com/maps/contrib/104858867238694201496/reviews?hl=zh-TW,5,False,10,麻辣牛筋味道真好，配飯好好吃😋CP值高
 とも ,https://www.google.com/maps/contrib/117216029597628196482/reviews?hl=zh-TW,5,False,2,"299加一成服務費的披薩吃到飽
除了披薩外也能點炸物，自助吧的東西也不少，一定是大拇指的啦"
 邱子恆 ,https://www.google.com/maps/contrib/104805056409881083602/reviews?hl=zh-TW,5,True,495,"還不錯
送pizza服務生很熱心"
 吳祥祥 ,https://www.google.com/maps/contrib/116884116923834399308/reviews?hl=zh-TW,5,False,6,我覺得很好吃…一餐400元包含服務費，我選的是起司雞腿排，服務態度很好啊，店員不論男女都很親切，雖然有的評論2極化，但我目前受到的待遇就是如此，故此給出此評價。
 榮哥 ,https://www.google.com/maps/contrib/100571261409566371042/reviews?hl=zh-TW,1,True,19,"美式餐廳竟然沒有提供番茄醬…🙄🙄🙄
翻白眼…炸雞好吃…"
 陳彥廷 ,https://www.google.com/maps/contrib/107539804246887926425/reviews?hl=zh-TW,5,True,20,"好吃不油膩又多汁👍👍
吃得hen開心🥳"
 宋至正 ,https://www.google.com/maps/contrib/100435439213607614352/reviews?hl=zh-TW,5,False,2,感覺超級便宜的，披薩覺得也很特別。感覺比一般披薩不油。cp值很高，加上炸雞腿感覺讚。
 yi wan ,https://www.google.com/maps/contrib/116796818557949300107/reviews?hl=zh-TW,3,True,270,"服務人員態度不錯~~
只是剛到的時候餐點需要等一下~
最後+點時間可以一次點足自己需要的量~

不過主餐義大利麵有夠難吃...
建議點一般價格的就可以了~~"
 沒有幾次之後 ,https://www.google.com/maps/contrib/112969464095316387223/reviews?hl=zh-TW,5,True,47,"肉類普
但是薄披薩沒話說！好吃！
（高高的店員也好可愛）
平日午餐時間服務態度可以！"
 李佳璟 ,https://www.google.com/maps/contrib/103695712720303847958/reviews?hl=zh-TW,5,True,33,比薩、炸物、湯品味道都在水準之上，90分鐘的用餐時間看似短促，不過服務人員很勤快的不斷送上餐點，不會讓人嘴巴有停下來的機會
 陳玉珍 ,https://www.google.com/maps/contrib/117970494550397808385/reviews?hl=zh-TW,2,False,10,自助吧的湯根本沒一塊肉，麻辣牛筋也都醬汁而已沒一塊肉，披薩的料也少的可憐就是在吃薄薄的皮，沒什麼誠意，物價上漲可以調價格，不然給人像在吃空氣
 Bob Tsai ,https://www.google.com/maps/contrib/104585424155271727775/reviews?hl=zh-TW,5,True,265,"上菜速度快
服務超好
這樣的價位在台北遠超其他餐廳
多種口味的雞塊很厲害
霜淇淋很對味
雖然僅短短90分鐘但是吃的超級滿足"
 john xenia ,https://www.google.com/maps/contrib/110888103933545859115/reviews?hl=zh-TW,5,False,13,大人小孩都吃得好飽呀！
 陳盛瑋 ,https://www.google.com/maps/contrib/100294592841129041746/reviews?hl=zh-TW,1,False,6,冰難吃味道超奇怪、咖啡根本套水套到都沒味道、上餐速度超級慢、自助區沒有碗，還要自己跟服務生要....還有很多不想說了
 首席王子 ,https://www.google.com/maps/contrib/102710307667808039726/reviews?hl=zh-TW,5,False,17,"吃到飽整理來說非常划算，店員會一直過來問要不要些菜，可以一直續自己想吃的東西
氣氛還不錯喔～"
 卡滋卡滋卡拉拉 ,https://www.google.com/maps/contrib/117216712204416598518/reviews?hl=zh-TW,5,False,8,pizza現烤、雞腿現炸，多汁美味
 龜肉肉 ,https://www.google.com/maps/contrib/114664593743685635583/reviews?hl=zh-TW,5,True,28,吃ㄉ很爽肉好多披薩也好多
 張睿穎ALice ,https://www.google.com/maps/contrib/109676323443203382784/reviews?hl=zh-TW,5,True,23,"吃到飽現烤pizza🍕&🍗
很適合聚餐😄"
 allianz623 ,https://www.google.com/maps/contrib/113089884472849960618/reviews?hl=zh-TW,3,True,231,"CP值很高的餐廳。
薄皮披薩，炸雞腿，雞塊，薯條，小點心。牛肉湯，沙拉，吃到飽。
299元起，很划算。"
 張娓娓 ,https://www.google.com/maps/contrib/104245422424180418998/reviews?hl=zh-TW,5,False,4,炸雞腿和薯條好吃～另外店員服務很好👍🏻用餐快結束時還有最後加點
 Ciao ,https://www.google.com/maps/contrib/101606054177379692979/reviews?hl=zh-TW,5,False,7,非常好吃，外場的服務人員供餐速度算快，炸物、披薩吃的都很滿足！
 鄧德秀 ,https://www.google.com/maps/contrib/109730121706640635309/reviews?hl=zh-TW,5,False,8,服務人員親切有禮貌食物出爐現做現吃非常好如果可以隨時清理桌面會更棒
 N C ,https://www.google.com/maps/contrib/109910262342490311453/reviews?hl=zh-TW,5,True,746,"炸雞不錯
好飽"
 Mac Wong ,https://www.google.com/maps/contrib/104256245335490402043/reviews?hl=zh-TW,4,True,211,主餐普通，但炸物跟披薩都不錯，CP值不差
 chou cat ,https://www.google.com/maps/contrib/117734428495948268986/reviews?hl=zh-TW,1,True,18,主餐可以這麼難吃也是不簡單，上披薩炸物的速度很慢、能不能吃到完全看運氣。🙁
 I-Fan Huang ,https://www.google.com/maps/contrib/108632462173029631514/reviews?hl=zh-TW,4,True,177,CP值很高啦信義區有這種吃到飽的學生價很佛
 chi min sue ,https://www.google.com/maps/contrib/116856050635006870700/reviews?hl=zh-TW,2,True,60,"沒有那麼神
上餐速度慢
披薩普通料少
當月壽星9折
加賴9.5折"
 鄭鈞瀚 ,https://www.google.com/maps/contrib/117827472149243499645/reviews?hl=zh-TW,2,True,76,"紐約客...吃不出這價位
炸物是唯一亮點"
 Ray Chang ,https://www.google.com/maps/contrib/115498005809488739343/reviews?hl=zh-TW,5,True,75,不錯吃，很可以，下次可以考慮再來吃。
 Bruna ,https://www.google.com/maps/contrib/117255388037504377175/reviews?hl=zh-TW,4,True,103,假日傍晚用餐，餐廳位置在ATT，入座時間約5點半，不用排隊，收費方式為如不點主餐，可享用沙拉吧、湯品、炸物、飲料、滷牛筋飯及冰淇淋，如果加上主食價位(一般燉飯及義大利麵)價格約是400上下(含服務費)，湯品當天有兩種，玉米濃湯及牛肉湯，炸物跟pizza都是桌邊服務，服務人員會將剛出鍋的料理拿到桌邊詢問是否需要，炸物部分選擇還蠻多的，地瓜、馬鈴薯薯條、甜不辣、韓式炸雞、雞腿等，pizza部分口味也很多，而且都是蠻有特色的薄餅pizza，最有印象的是蘆薈卡士達，意外地跟餅皮還蠻搭的，整體是相當台式的義大利料理，不太正宗，但是如果想要品嘗多元口味，又有預算考量，就還蠻推薦的~
 台湾イケメン ,https://www.google.com/maps/contrib/102258001941647972679/reviews?hl=zh-TW,4,True,18,"送餐速度很快
以這樣的價位來說披薩意外的很不錯"
 Abby ,https://www.google.com/maps/contrib/106979610897662105434/reviews?hl=zh-TW,2,True,47,"店內披薩皆為薄披薩，
披薩料不多，
主餐義大利麵亦同，
沒有想吃的慾望。
披薩有口味有些蠻「特別」的，
雞腿、甜不辣、薯條還行，
湯品普普，
飲料一般般，
沙拉品項選擇有限，
披薩、炸物吃到飽是由服務人員逐桌詢問送餐非自助，
當天服務人員巡桌算頻繁，
用餐時段客人不算少，
吃粗飽應該沒問題，
但以個人喜好，
回訪的機率不高。"
 S Ann ,https://www.google.com/maps/contrib/100648973473130965927/reviews?hl=zh-TW,5,True,122,"服務佳
會一直上前問你要不要那些炸物
所有的炸物都是現炸的
---------------------------------------------------
披薩為薄皮的，可以吃很多片
有多種披薩口味，不會讓你感到膩
日式柴魚披薩，上面有芥末，簡單且美味～
炸物不會炸得太乾，每一個都好吃
吃完再搭配無糖綠茶～舒服
-----------------------------------------------------
吃完的感覺只有，被餵食的感覺真讚"
 余小慧 ,https://www.google.com/maps/contrib/108399814429201341720/reviews?hl=zh-TW,5,True,21,"今天中午去享用了！CP值超高！
服務親切有禮，而且桌邊服務非常勤快！
披薩是薄餅披薩，口味很多也很好吃💯
炸物有吃到炸雞腿、薯星星、馬鈴薯薯條、地瓜薯條、甜不辣、炸雞（韓式、椒鹽、起司），每一種都很有水準！而且都是熱的！
自助吧的部分飲料除了汽水外還有簡單的花茶（不是茶包）可以喝，覺得很棒！
個人最愛的是『牛筋湯』真的是非常棒！料多又好喝，喝了好多碗！
自助吧還有麻辣牛筋、白飯、玉米濃湯、霜淇淋、沙拉吧等等，但實在太飽了就沒吃了XD

缺點就是停車好困難😅

但整體是我會再去的一間餐廳！！非常推薦！"
 金少 ,https://www.google.com/maps/contrib/115042421968668760400/reviews?hl=zh-TW,5,True,22,服務人員服務態度非常好，餐點也很豐富，這價位很便宜划算
 Mei Tea ,https://www.google.com/maps/contrib/105632187188060501406/reviews?hl=zh-TW,5,False,147,義麵好吃份量剛好霜淇淋清爽不斷送披薩炸雞吃很飽服務親切
 H Tracy ,https://www.google.com/maps/contrib/113363849567454807015/reviews?hl=zh-TW,4,True,38,很適合帶小孩來吃因為光是吃到飽的薯條pizza小孩開心到幾乎不用吃主餐
 Hinata Kou ,https://www.google.com/maps/contrib/101425508455583821873/reviews?hl=zh-TW,5,True,69,"主餐以及吃到飽品項出餐的速度都很快，披薩有很多起司、炸物熱氣騰騰的也很療癒。
口味都有一定水準，自助的飲料、湯品也很有誠意。
服務人員親切熱情，店內的氣氛輕鬆隨意，讓人覺得很舒服。
價格實惠，不論餐點或服務都令人滿意。"
 林念新 ,https://www.google.com/maps/contrib/105334582528641438890/reviews?hl=zh-TW,5,False,10,"第一次去
外籍員工態度不錯，不過好像有點忙不過來
一開始上些微笑薯餅甜不辣
後來陸續上主餐和披薩雞腿炸雞薯條地瓜
不定時詢問加點，整體算吃粗飽也不貴
其他大多自助自取，不過當天胃口還好，大致隨桌的就吃滿飽"
 ウジウ ,https://www.google.com/maps/contrib/114492555714977369337/reviews?hl=zh-TW,5,True,27,"店員親切友善
炸物和披薩都很棒很好吃，都是現炸現烤的
但沙拉吧感覺沒有到很新鮮"
 oxox N ,https://www.google.com/maps/contrib/103078583808019033464/reviews?hl=zh-TW,1,True,85,"二更我現在在餐廳內已經等了三十五分鐘沒披薩吃了實在受不了了去跟店員反應店員才讓我點我想吃的現在讓我們來看還需要等多久才能吃披薩
三更最後在等了四十八分鐘我終於拿到了披薩吃：）"
 Jen Hung ,https://www.google.com/maps/contrib/106508252634776658859/reviews?hl=zh-TW,5,True,21,"好吃吃得好飽！各種口味的比薩都吃到了，相當滿足！
店員服務也很親切，經過可以來吃看看~"
 琳琳 ,https://www.google.com/maps/contrib/117442932221727474211/reviews?hl=zh-TW,2,True,91,披薩很普通，義大利麵超級鹹，自助區的東西也不好吃。吃完回家後，我跟男友都拉肚子，不會再去了
 林宇婕 ,https://www.google.com/maps/contrib/115092407769717606523/reviews?hl=zh-TW,5,False,26,披薩很薄，起司又給得很大方，吃起來脆又很起司，炸物與雞腿也都表現不錯，不過最愛的是它的牛筋蘿蔔湯，清甜好喝又有滿滿的牛肉！
 LWJ ,https://www.google.com/maps/contrib/115795916074124009464/reviews?hl=zh-TW,5,False,10,推披薩很多口味好吃，抹茶冰淇淋也很好吃
 Hazel ,https://www.google.com/maps/contrib/117447721503448043500/reviews?hl=zh-TW,5,False,13,"餐點很好吃，服務員態度也很好🥰
尤其是國孝！超有服務熱誠(˶‾᷄⁻̫‾᷅˵)推推～～"
 呂彥儒 ,https://www.google.com/maps/contrib/111112442462604906673/reviews?hl=zh-TW,5,False,2,"披薩種類多，炸物新鮮，價格實惠
很適合家長帶小孩來吃
建議加價搭配主餐"
 Roy Lin ,https://www.google.com/maps/contrib/103615022606639455816/reviews?hl=zh-TW,4,True,25,下修為四顆星，披薩炸雞好吃，跟朋友聚餐約會都蠻適合，現場給五顆星評價打9折
 渡邉裕子 ,https://www.google.com/maps/contrib/115909201794106540318/reviews?hl=zh-TW,5,False,3,"送餐速度快又衛生
看到店員不小心用掉桌上的衛生紙架，他沒有直接放回去，是重新換了一個乾淨的👍🏻"
 桃佐兒 ,https://www.google.com/maps/contrib/104722114811661766084/reviews?hl=zh-TW,1,True,75,"個人觀感：用餐下來我覺得有點瞎
我們有不吃牛肉的幾個人，但pizza上來的時候也沒有讓我們講話的空間非常迅速的夾了牛肉口味給我們態度很敷衍。
義大利麵的蝦子很不新鮮同桌朋友吃完5分鐘馬上皮膚開始過敏還有肚子痛的
說是雞腿吃到飽但每次都上pizza,員工人少要請他上炸雞也不是常常可以找得到人這樣還要收10％服務費！？
pizza除了鹹蛋蝦仁之外其他口味料都很少好像只是在吃餅皮……搪塞客人的胃！
最後結帳完櫃檯有百貨活動，我們還說剛好有滿額可以去B2櫃檯參加，去了B2才知道活動都過了，但餐廳櫃檯人員都不知道也沒有撤立牌。員工訓練很不佳……"
 Yeh Miyu ,https://www.google.com/maps/contrib/102739770871320690956/reviews?hl=zh-TW,3,True,66,現在只有最後加點可以選想吃的口味，基本是廚房出什麼味道，就等巡迴的服務員出餐。
 曾楷茗 ,https://www.google.com/maps/contrib/114412157707397296656/reviews?hl=zh-TW,2,False,2,4/27星期三下午一家四口去吃，點了兩個肉類的主餐，星期四有三個人拉肚子，沒拉肚子那個人因為年紀還小沒有吃紅肉相關的餐點～另外…雞腿有點太乾～
 Yu Jeff ,https://www.google.com/maps/contrib/109607390075933773899/reviews?hl=zh-TW,5,False,3,Pizza&炸雞，沙拉吧吃到飽只要339，在台北信義區哪還找得到！重點是好吃～大推！
 ailin ,https://www.google.com/maps/contrib/111305329475006692072/reviews?hl=zh-TW,5,True,128,送餐速度快選擇多服務親切
 黃淑珍 ,https://www.google.com/maps/contrib/114746994412083853374/reviews?hl=zh-TW,3,True,63,"披薩口味選擇多，義大利麵尚可，但主餐的（牛排）肉質不優,偏油"
 Jill Lin ,https://www.google.com/maps/contrib/108873180505793602673/reviews?hl=zh-TW,5,False,17,"送餐人員積極配送餐點。
有時會忘了問。雞腿有隻沒熟。"
 富士奶奶 ,https://www.google.com/maps/contrib/106615323792711904911/reviews?hl=zh-TW,5,True,15,好吃～人多但服務好
 陳家豪 ,https://www.google.com/maps/contrib/108254767241790273714/reviews?hl=zh-TW,5,True,54,在批踢踢上有看到，之前開幕的時候就有看到了，今天午餐來吃，口味還不錯，送餐的速度也很快。
 A Liu ,https://www.google.com/maps/contrib/115792205174075491757/reviews?hl=zh-TW,5,True,435,"服務很好，也沒有像評論說的那樣，
上菜很快，服務人員也很親切，
東西很熱也很多汁好吃，
價格也很實惠"
 吳宗諺 ,https://www.google.com/maps/contrib/115075890981120623736/reviews?hl=zh-TW,5,False,1,服務員很親切，完全不用動手煮。披薩炸物湯品都很不錯
 劉妍廷 ,https://www.google.com/maps/contrib/107768382123678756838/reviews?hl=zh-TW,5,False,27,比薩、雞腿、自助吧吃到飽，種類豐富，好吃👍下次還會光臨！
 語意鳥 ,https://www.google.com/maps/contrib/110683549896437866993/reviews?hl=zh-TW,4,True,70,"可以放鬆吃到飽的餐廳
CP值高
在信義區中算是難得的地方
值得去吃看看"
 王建斌 ,https://www.google.com/maps/contrib/111732911726312005380/reviews?hl=zh-TW,5,True,12,第一次來吃得很飽很開心，東西都是現烤出來的，好吃
 Michael Chung ,https://www.google.com/maps/contrib/108770575260165062172/reviews?hl=zh-TW,4,True,117,非常超值的披薩炸雞吃到飽，服務人員非常親切。
 lin dark ,https://www.google.com/maps/contrib/104663572337935718913/reviews?hl=zh-TW,4,True,34,"炸雞腿👍、炸甜不辣吃起來有像魚酥的香味，吃到飽餐點是現做的果然品質很好
然而缺點也是現做，出餐間距較長，而且剛開店時人力明顯不足，入店前半個多小時披薩和炸雞只有各來一次，只能坐在座位上傻等店員(披薩出爐後店員會一桌桌問)，還常常等到半途就被前面幾桌拿完了😭
要去吃的人最好要有點心裡準備，不然容易等到火大"
 Mei Yang ,https://www.google.com/maps/contrib/116584118392219358104/reviews?hl=zh-TW,5,True,66,"用餐環境不錯，出餐很快服務人員態度很好👍
披薩是薄皮的這樣可以吃多一點👍
最推薦炸雞腿，外酥內嫩而且剛炸起來超燙超好吃，不用另外加粉就很有味道，價格也很平價！
聚餐好選擇！"
 Phenix Chen ,https://www.google.com/maps/contrib/100666563211741391289/reviews?hl=zh-TW,4,False,39,"平日下午去吃大概算是第二輪感覺人力不足員工忙著送餐，清潔桌子跟結帳，整理好的座位空很久才讓排隊人潮進去，作業SOP有點卡卡...
炸物,Pizza是出爐時員工一桌一桌問是否需要有時會被忽略掉=""=…
主餐點了焗烤麻辣牛筋麵＆法式牛肝菌飯，後來很後悔，應該把胃留下來吃PIZZA&炸雞腿....因為pizza跟炸物比主餐好吃多了~"
 陳冠廷 ,https://www.google.com/maps/contrib/109019456499158352069/reviews?hl=zh-TW,4,False,17,"這個價位在台北市我覺得已經是超級優質的選擇了
主菜點西班牙海鮮義大利麵
中規中矩，不會雷
但重點在於披薩，很多種類也很好吃
沙拉吧也蠻不錯的
牛筋湯好喝，沙拉菜種類豐富
炸雞現炸的很好吃

唯一缺點，給披薩的動線很亂
我常常看到我隔壁的一直有披薩可以拿
但就是不走來我這
到我這桌已經空了，只能眼巴巴的看著服務員走，等待下一次的披薩到來"
 張珈瑄 ,https://www.google.com/maps/contrib/102393998499749750852/reviews?hl=zh-TW,3,False,14,雖然在信義區這價位沒得挑惕，但食物的質⋯現在披薩跟炸物一樣都是店員送來桌邊詢問，有的口味一直重複來，想吃的口味確吃不到（尤其坐中間，可能還沒輪到就沒了），時間到了雖然沒客滿不會趕，但也不會給你食物了，所以很大機率你想吃的口味會吃不到⋯不會想再去⋯
 Aya Hsu ,https://www.google.com/maps/contrib/111469937649625523560/reviews?hl=zh-TW,5,True,110,"一點完主餐，服務人員就會一直上披薩、炸物到桌邊，也可以跟服務人員點口味，炸物都很好吃，最愛前三：炸雞腿、炸雞跟甜不辣！熱騰騰上桌馬上吃，冷掉也沒有油耗味，讚！湯品喝了網友推薦牛筋清湯，白蘿蔔吸飽湯汁很好吃，飯前暖胃。
披薩是薄皮，滿滿起司！！趁熱吃很美味！但我大概七片左右就巨飽，最後來個甜披薩結尾~我這頓午餐只點自助吧，沒想到這餐飽到隔天，有機會朋友聚餐一定會再來。"
 張家瑄 ,https://www.google.com/maps/contrib/115154584248662331432/reviews?hl=zh-TW,4,False,11,"覺得食物本身很好吃在信義區有這個價位非常不錯
牛筋湯料很多披薩的起司也都灑滿滿炸雞也很好吃👍🏼

但不知為何我們這桌一直被服務人員略過
左右兩邊的客人都一直被詢問是否需要加炸物
到了我們這桌就會先被跳過
能體諒店員可能有時沒注意忽略一兩次
但我們被忽略了有5.6次以上🤣
甚至最後怕一直吃不到炸雞只好直接通知服務生
結果剛出爐還是先給別人
覺得這點就吃到飽而言非常可惜
因為我們的成員有吃不夠的情形

不過綜合整體而言覺得cp值很高若能改善的話還會想再去吃～"
 薪水小偷 ,https://www.google.com/maps/contrib/106754931307233900325/reviews?hl=zh-TW,5,True,89,"好吃！年初二人潮少，
手機看影片也不會打擾別人
服務員很有禮貌、耐心
大部分時間都在座位上用餐不需要自取，拿飲料沙拉才需要移動，
因為在座位上一直吃所以很快就飽了
體驗很好"
 王思允 ,https://www.google.com/maps/contrib/112426153005410486000/reviews?hl=zh-TW,5,True,363,披薩很好吃，炸雞類都沒有雷，牛筋湯是經典，只是人多時，服務生隨桌送餐的順序很奇怪😅😅😅有的一直送，有的一直跳過，都要特別喊
 黃小剛 ,https://www.google.com/maps/contrib/107471005443016967740/reviews?hl=zh-TW,5,True,43,"鋪上滿
滿起司的現烤披薩，新鮮多汁的現炸雞腿，絡繹不絕的送上餐桌，主餐點的是羊肋排滿滿一大塊鮮嫩多汁，服務生親切熱情，是一間適合大人小孩CP值超高的親子餐廳"
 陳佳欣 ,https://www.google.com/maps/contrib/113519067879826858879/reviews?hl=zh-TW,5,False,19,跟老公來信義區逛逛，不知道要吃什麼路過就進來了，平價東西好吃，炸物也好吃，麻辣牛筋飯推推，外場人員(應該是外籍學生來打工的先生)很親切，主動問還需要什麽，要特別嘉獎，還會再來吃哦…
 Mark ,https://www.google.com/maps/contrib/114747781028824396369/reviews?hl=zh-TW,1,False,21,"不能自己點餐店員會自己來給
披薩還行
其他味道都不值
便宜是便宜"
 李昕洧 ,https://www.google.com/maps/contrib/116043342243237782688/reviews?hl=zh-TW,5,True,45,披薩吃到飽頗為吸引人，雖然主菜水準與市場上的平價義大利餐廳相比有一段落差，但提供暢飲的選擇多樣，不單單只有披薩，還有炸雞腿、甜不辣、薯條等，此價位與對面兩餐相比，划算程度顯而易見，如果對口味沒有苛求，此餐廳會是朋友聚餐好選擇。
 林子鈞 ,https://www.google.com/maps/contrib/113837387152060594116/reviews?hl=zh-TW,3,True,17,"如果店內客人不多的話大概是3.5顆星
店內客人多的話2.5顆星
炸雞腿很酥脆大概像頂呱呱那樣
pizza普通而且有些口味可能在其他桌就分完了要看風水
炸物也普通
如果你肚子很餓建議可以加價點主餐
桌邊服務比較慢的話至少可以先填肚子
如果有耐心待得夠久的話是可以吃飽沒問題的"
