user_name,user_profile_url,rating,local_guide,comment_num,comment_text
 S. Y Wang ,https://www.google.com/maps/contrib/105571189604974658311/reviews?hl=zh-TW,1,False,5,"非常不愉快的用餐經驗..…
2022.7.3....中午預定11.30兩大一小
因為有事情耽誤了一下，打電話告知大約晚10分鐘到達餐廳。
11：45入座之後開始用餐.....
服務人員送上來，三片不同口味的披薩，兩份薯條，炸甜不辣以及一小搓的無骨炸雞塊。
很歡樂的開始用餐…
期間我發現左右兩桌都有炸雞腿....…
於是詢問了一下服務人員...…
工作人員給的回應是：炸雞腿剛剛那一輪剛剛發完，下一輪要等20分鐘後
我心中自己想著，因為我們有事耽擱晚入席，所以這輪沒吃到，等下一輪也沒什麼關係.…
吃著...吃著.…時間20分鐘就過去了
服務人員又開始在各桌親切詢問發送炸雞腿..
左右兩桌都有分到炸雞腿，就這麼巧到我這桌的時候都發完畢了.…
服務人員告訴我，非常抱歉，下輪一定會往這裡先發送
我也就只能淡然的說沒關係.…
吃著...吃著.…時間20分鐘又過去了…
服務人員又開始在各桌親切詢問發送炸雞腿…
一位男服務員，手腳俐落的把炸雞腿發送完畢，左邊那桌每人還分到兩隻炸雞腿，大家的臉上都喜孜孜油膩膩的…
我看著我們這桌空蕩蕩餐盤，忍不住舉手詢問了一下，我們這桌的炸雞腿呢？
男服務生說：你們這邊等等，等那位女服務人員會過來發放....
ok.
我的眼睛看著那位女服務生像蝴蝶採蜜一樣，手邊的炸雞籃內的雞腿不斷發放。可能她覺得家腿還很多吧，還重複詢問某一桌還需不需要，我看那桌炸雞腿都堆成一座小山了。
於是我忍不住舉手了，酸了一下我還要等下一輪嗎？
女服務員發現之後馬上把剛剛發放的炸雞腿回收三隻回來，緊急擺放到我們這一桌應急。
我心裡有點火，畢竟我體諒你的辛勞與作業程序，可以稍微等待...但你卻忽視我的權利，我可是跟大家一樣是花錢近來消費的。
女服務生當下雖然跟我說抱歉，並允諾下輪一定立即當下往你們這一桌開始送..…
當然了，我臉色肯定很差，忍不住開始噴出抱怨.......女服務員灰溜溜的就退場
沒多久來了另一位女服務員.…
她說：一開場就是說，很抱歉今天的用餐不愉快，所以本店等等打個八折你。
她走之後，由於我火氣尚未消除....擠了把抹茶冰淇淋正要享用
服務人員過來說：現在進行最後一輪加點我真的無語了....…哥哥我來吃個寂寞的....…
用餐間90分鐘
這中間本桌拿到
.................................6片pizza
.................................3次薯條(兩次是地瓜薯條)
.................................3片微笑薯餅
.................................8小片炸甜不辣
.................................6小塊無骨炸雞
.................................四隻炸雞腿
(三隻是已經放別人餐盤，然後緊急回收。)(第四隻是通知最後加點的時候送來的.....…)
結帳的時候，櫃台小姐要幫我打折。但是很抱歉，我拒絕了...…
我並是不是台灣鯛，跟你吵吵就是要討折扣糖果…
要的只是你們的態度.....

但是處理事情的態度與後續真的令人無法恭維.…
當我結帳完畢要走人的時候.…
可能是一位主管級的人詢問櫃檯剛剛是回事
那個看人眼神真的讓人心寒，好像我是來惹事的一樣…
評分一顆星真的都是太多.…
附上我的消費發票...證明我來過...吃過一頓寂寞"
 浮生若夢 ,https://www.google.com/maps/contrib/105117717195259214024/reviews?hl=zh-TW,5,False,3,披薩口味眾多且好吃，店裡的炸物尤其值得推薦的是雞腿，外皮酥脆肉多汁。而且還有許多主餐可以搭配選擇，多次前來用餐。讚
 Roy Yuan ,https://www.google.com/maps/contrib/109083216203156121762/reviews?hl=zh-TW,4,True,320,中低價位選一主菜，披薩🍕炸物🍗吃到飽，沙拉吧稍弱，冷熱飲表現中中，熱湯ok。
 楊紋瑋 ,https://www.google.com/maps/contrib/108454581091091000937/reviews?hl=zh-TW,5,True,43,"自助吧：$299+10%
用餐時間：90分鐘

生菜*1盤
試營運招待排餐
紐約客牛排*1
綜合炸物*1盤
炸雞腿*4只
披薩全品項*14+2片
冷飲*5
湯品*2
咖啡*2
冰淇淋*1

結論/
以必勝客歡樂吧來比對的話
單自助吧算有一戰之力
但牛排就煎太熟了
出餐算快，今各三桌共五人用餐
我還能刷完主餐類外的全品項
希望能維持下去"
 Spencer Hsu ,https://www.google.com/maps/contrib/114085574734854755085/reviews?hl=zh-TW,3,True,157,"看了臉書上社團推薦，於是來用餐。

當天用餐是決定點兩份排餐加吃到飽。
不能自己想拿什麼就拿什麼，的確能精準節省浪費掉的成本。
雖然服務員會一桌桌問，但一次也不過送幾片，幾隻雞腿，在跟服務員要之前會不自覺的怕後面的人沒得吃。

羊排味道還不錯，但跟菜單上不一樣；
至於魚排，如果菜單上有魚排照片，我就一定不會點了。

比較糟糕的是，新杯子裝飲料直接浮一層油……"
 J H ,https://www.google.com/maps/contrib/117729450226649163763/reviews?hl=zh-TW,4,True,58,"薄片披薩口味滿多樣化
起士披薩牽絲滿愛的
牛筋蘿蔔燉湯出乎意料的好喝
另外霜淇淋也不錯"
 Kevin Ni ,https://www.google.com/maps/contrib/112524046715740730833/reviews?hl=zh-TW,5,True,12,這家的用餐方式是入座以後，服務員問你要不要加點主餐，然後就開始上披薩與炸物，也可以主動跟他們說想吃什麼，自助區有汽水果汁咖啡以及湯飯，不建議加點主食，主食水準很一般，內用要加服務費10%
 沙拉飯團 ,https://www.google.com/maps/contrib/105985716856226723286/reviews?hl=zh-TW,5,True,669,"信義區299元吃到飽超便宜很划算，喜歡吃肉的來很適合
空間大來這裡聚餐也合適"
 Sabrina Wang ,https://www.google.com/maps/contrib/112427901336725205136/reviews?hl=zh-TW,5,True,19,好吃，服務人員態度很好，小朋友很喜歡有機會會在來
 Nagao (胖編) ,https://www.google.com/maps/contrib/106802216724015921895/reviews?hl=zh-TW,3,True,149,"炸雞和炸物真的不錯吃，服務人員也很熱情，但是pizza很容易份量不足，到前一桌就沒有了，也沒有繼續再出，有點可惜。

還有自助區和餐桌也很擁擠，吃起來有點侷限。"
 洪靜萱 ,https://www.google.com/maps/contrib/112004080235819144078/reviews?hl=zh-TW,5,False,11,"炸雞腿超好吃😋
主餐+pizza吃到飽價位實在👍🏻
披薩口味多元甜的鹹的都有😽😽😽
甜不辣比外面鹹酥雞店的好吃😍😍😍
大人小孩都會喜歡の店推～❤️"
 果蘋 ,https://www.google.com/maps/contrib/102663630943502852060/reviews?hl=zh-TW,5,True,57,"食物好吃都還不錯，就咖啡難喝了點
服務生態度親切"
 Si-Tong Liu ,https://www.google.com/maps/contrib/107763890833014374957/reviews?hl=zh-TW,5,True,18,"羊排醬汁偏鹹，但肉還蠻不錯的！
加吃到飽只要400初，很可以"
 Vicky Chen ,https://www.google.com/maps/contrib/118119192909184833718/reviews?hl=zh-TW,5,True,"1,491","真得價格很便宜晚餐339起跳，就是只吃沙拉吧也是339，其實我覺得比薩比義大利麵或飯更好吃，所以下次再去可能就是吃吃到飽了。

湯品有白蘿蔔牛筋跟玉米，牛筋湯料多味道不錯。飲料機有很三種蘋果汁等非氣泡比較健康的，咖啡機跟茶包就一般，沙拉吧小小的，就是清口。

主菜點麻辣牛筋，泰式蝦，牛肝菌菇。麻辣牛筋的焗烤很不錯，不過味道就普通。
炸物有傳統炸雞腿跟韓式炸雞，基本上都比較鹹，我個人比較喜歡炸雞腿，雞腿很多汁。韓式有起士跟甜辣醬（？？）。炸甜不辣真得還不錯，不會太鹹太乾。炸薯條有地瓜跟馬鈴薯。

比薩都是薄皮的，印象比較喜歡的是起士，海鮮，章魚燒，另外紅豆棉花糖出乎意料之外的不錯。當天冰淇淋是芒果口味，香氣還不錯。

整體而言就是物超所值的一家店，很推薦"
 Bart Jan ,https://www.google.com/maps/contrib/112245433836438759166/reviews?hl=zh-TW,4,False,114,"主餐紐約客真的不好吃！！但是披薩跟炸雞炸物剛做好剛炸好都好吃….其他糖品沙拉飲料就是一般般在信義區這個價格很佛了
但希望可以推出不要主餐的選項…….因為主餐大家都覺得不ok，主打Pizza跟炸雞吧
服務人員態度也很好👍"
 高大毛 ,https://www.google.com/maps/contrib/102010190652898902233/reviews?hl=zh-TW,4,True,453,炸雞鮮嫩多汁，披薩熱度夠好吃，牛肝湯好喝！
 Kuokai Lien ,https://www.google.com/maps/contrib/114165427729592952588/reviews?hl=zh-TW,4,False,174,"位於ATT4樓的義式吃到飽餐廳，每個人點一個主餐後，其餘的披薩炸雞炸物等及飲料冰淇淋咖喱飯沙拉湯品都是吃到飽喔👍🏻
身高90公分以下免費，110公分以下（含）收費$99，110-130公分收費$169。"
 I Have a Dream ,https://www.google.com/maps/contrib/111432216578457736065/reviews?hl=zh-TW,5,True,430,是一家完勝必勝客歡樂吧的店！可以點主餐含附餐吃到飽或只點附餐吃到飽，附餐吃到飽有自取的沙拉吧（兩種醬起.千島.和風，七種菜.扁豆.玉米粒.紫萵苣絲.地瓜.南瓜.白花椰菜.高麗菜絲）.兩種湯品（玉米濃湯.清燉牛筋蔬菜）.香嫩不咸的滷牛筋跟白飯.茶包加各式冷熱飲機.自製飲料.霜淇淋，跟桌邊隨機提供的軟嫩多汁的韓式炸雞.傳統炸雞腿（味道像蘇阿姨的炸雞）.炸香甜的地瓜薯條.炸胖胖甜不辣.炸的可愛薯餅.起司炸雞.十四種鹹跟甜的披薩（桌邊隨機的食物如果有想吃的可以直接跟服務員點）！主餐有排餐.燉飯.義大利麵可以選，想加焗烤只要加20元！餐點的1.大漠孜然羊叻排有燒烤甜醬的香味，完全入味不鹹沒有羊騷，肉質軟嫩骨頭一拉就分離！2.焗烤麻辣茄汁牛筋麵條彈牙肉醬鹹香，上層的起司濃厚牽絲。3.墨西哥番茄鮮蝦麵有四隻新鮮的大蝦，番茄醬汁清甜不膩。如果維持現在餐飲品質，在這個地段算非常超值！
 Justina (茹) ,https://www.google.com/maps/contrib/116150168137551326752/reviews?hl=zh-TW,5,True,27,"點一主餐加一成自助吧披薩炸物吃到飽
限時90分鐘
吃到飽可直接點也有桌邊服務，服務生來的非常頻繁XD，服務生都會ㄧ個個介紹匹薩有15種各有特色，最愛金沙蝦仁，炸物也有7種，當天綁馬尾的姐姐非常認真服務速度滿分，但是建議可以增加標示（牌子、骰子等等…）服務生就知道哪些桌還需要服務，增加效率"
 Tosha.E. Tang ,https://www.google.com/maps/contrib/109369247109333239659/reviews?hl=zh-TW,5,False,7,"服務100分

吃了甜pizza後，覺得上面的棉花糖很好吃，跟店員要，他們不但給我一碗棉花糖，還加熱過😍"
 Vivienne Shang (Vivienne) ,https://www.google.com/maps/contrib/105826889020554509351/reviews?hl=zh-TW,5,False,13,"以399的價格吃到這種類型的食物很超值，不會因為價格便宜隨便亂炸亂烤食物，
用餐時間是9/17下午3:00-4:00之間，座位2/3滿，
讓我想要給五顆星的原因是因為，外場只有一位服務生（如圖），應變能力非常好，點餐上菜結帳都是她一個人完成，而且不會漏單，辛苦了！
請義米蘭的老闆一定要幫他加薪！
還會再來用餐的！❤️‍🔥"
 tommy Wang ,https://www.google.com/maps/contrib/118253497133004499853/reviews?hl=zh-TW,5,True,30,單點一份主餐，沙拉吧，炸物，pizza讓你吃到飽……重點價格不高，以在信義區來說很超值。最特別的是牛筋清湯非常好喝以往類似的餐廳都是提供羅宋湯居多。另外不得不說他們是抹茶霜淇淋不輸外面高檔抹茶冰淇淋。試營運期間11/26-12/6紐約客牛排只要299元（原價469元）以上價位需加一成。
 Mia Chu ,https://www.google.com/maps/contrib/104919410983679979628/reviews?hl=zh-TW,5,True,103,"非常推薦帶寶寶來吃。有幫寶椅。
推車也有可停放的位子。
1.因為外頭剛好沒人排隊，所以得到了充裕的用餐時間，原則上是90分鐘。
2.披薩和炸物由服務員上菜，是熱呼呼的！原本因為覺得保溫可能不容易，所以不抱期待，覺得可能會是溫溫的，但實際上是熱到燙口。很喜歡。
3.披薩口味上有甜有鹹，如果有特別想吃的口味也可請服務員幫忙上個幾片。
4.飲料有可樂機和調味飲料還有氣泡水。
5.冰淇淋有三種口味。
6.醬料台有Tabasco、玫瑰鹽、胡椒、辣粉等等。
7.價格很平實。"
 Hunger ,https://www.google.com/maps/contrib/103269125394433157417/reviews?hl=zh-TW,3,True,122,價格親民的吃到飽就是來吃粗飽的印象深刻的是超級死鹹的青醬蛤蜊義大利麵
 王致恩 ,https://www.google.com/maps/contrib/108500772335142353886/reviews?hl=zh-TW,5,True,84,"這種價格，這種牛筋湯
必須5🌟的吧！
麵跟飯也很好吃"
 Vivian Shao ,https://www.google.com/maps/contrib/117355990691105815187/reviews?hl=zh-TW,2,False,17,店員臉超臭，披薩🍕超乾，炸雞🍗也超乾。淡水店好吃很多，要不是淡水太遠🙄
 天裕 ,https://www.google.com/maps/contrib/112018558281419688742/reviews?hl=zh-TW,2,True,303,其他就不評論了，口味真的…不行…，味道很粗糙，有些甚至難吃。
 羅廷良 ,https://www.google.com/maps/contrib/116887645095057059987/reviews?hl=zh-TW,3,True,85,服務優不怕人吃的semi-buffet，可以盡情的享受炸雞、Pizza及炸番薯。但是主菜的排餐就非常的差：羊排肉老且有羊騷味，魚排有腥味也是不推；僅有牛排(非薄肉的)味道還可以接受。
 tj chen ,https://www.google.com/maps/contrib/100958167832061867138/reviews?hl=zh-TW,5,False,4,披薩、炸雞、義大利麵，好吃，CP值高，服務態度很棒！來信義區記得來吃吃看
 曾啟豪 ,https://www.google.com/maps/contrib/102641057776824769518/reviews?hl=zh-TW,5,True,94,"今天點了豬排和牛肝菌義大利面，他們的餐點都很用心，雞腿用薄皮炸，披薩用薄皮，用料實在，也不會太油膩，勝過很多吃到飽的義式料理送餐也很快速，環境寬敞，CP值很高，會在來
豬排雖然薄但是夠嫩，加上香蒜、檸檬、青醬、胡椒醬搭配著吃，有不同的層次"
 黛華何 ,https://www.google.com/maps/contrib/115270015568906012121/reviews?hl=zh-TW,5,False,4,披薩、炸雞吃到飽，口味類國父紀念館附近的×阿姨！CP值大爆錶！！！另外值得一提的是～人多時服務生會注意每桌是否都有餐可用，超貼心💕💕💕
 Andy ,https://www.google.com/maps/contrib/110747299848310663854/reviews?hl=zh-TW,5,True,88,"以信義區這個精華地段來說
這種價位還能吃到飽真的很划算
甜不辣跟牛筋清湯比較令人印象深刻"
 李畊葳 ,https://www.google.com/maps/contrib/110039598519345388851/reviews?hl=zh-TW,4,True,291,平價buffet還行，牛筋湯喝到飽，聖誕烤雞活動
 賴多多 ,https://www.google.com/maps/contrib/113611219398129758053/reviews?hl=zh-TW,5,True,15,炸雞好吃披薩炸炸物飲料湯通通吃到飽現炸送來桌邊餵食不怕吃到冷的好吃😋
 Joanne Y ,https://www.google.com/maps/contrib/103227889165716016294/reviews?hl=zh-TW,2,False,20,"披薩普通這個價位不用抱什麼期待
料少然後感覺每種口味都是起司基底
加點肉跟其他香料就變其他口味
炸雞塊不錯至少肉嫩多汁
餐點可以給三顆但出餐方式及速度扣一
披薩不是自助是服務生每桌詢問
但不是同時從2.3個方向而是只有單一方向詢問
所以人多的時候如果從門口座位問起通常中段就被拿光了後面的人根本吃不到
我們進去快1小時大概只拿了3.4輪而且有1.2輪都只拿到1片
後面開始好像改點單但也沒人知會
想說怎麼那麼久沒出餐還是聽到別人點餐我們問才說可以點
點完還沒出餐就被問最後加點感覺有點差
反映後是有說不然之後可以再加點一次
但我覺得披薩炸雞這種東西容易膩
應該是90分鐘用餐時間慢慢吃不是最後30分鐘塞好幾片"
 余大逼 ,https://www.google.com/maps/contrib/110224120454337191831/reviews?hl=zh-TW,2,True,153,"基本上就是吃粗飽，由店員出餐分送不是自助，平日午餐299元起，其他時段329元起，依照主餐計價，用餐限時90分。週六五點半用餐店內「還有不少空位」。
主餐有排餐和義大利麵（飯），今天點牛肝菌麵、起司雞腿排都不優，肉太硬。
炸物有雞腿、薯條薯餅、地瓜、甜不辣、小雞塊，基本上都不好吃，有聽到隔壁桌的雞腿沒炸熟。
沙拉吧有生菜沙拉、飲料吧（基本可樂機加上爆甜的三種店內飲料）、兩種湯、冰淇淋機，基本上只有沙拉吧可以，其他都不優。
服務生態度很好，上菜很積極。因為不好吃所以基本上不會再來用餐了～"
 anni chen ,https://www.google.com/maps/contrib/116221031212649004319/reviews?hl=zh-TW,5,True,16,東西好吃，菜色也很多！炸雞多汁好吃！大推👍
 William ,https://www.google.com/maps/contrib/100108285198534957365/reviews?hl=zh-TW,5,True,82,"牛筋湯很好喝料很多
起司披薩熱熱的吃，起司還會流動"
 王小睿 ,https://www.google.com/maps/contrib/117724331982931833364/reviews?hl=zh-TW,5,True,48,"嚐鮮一下😋
#Att4Fun
#信義區插旗
#20款鹹甜披薩隨你吃🍿️
#沙拉冰品雞腿炸物任你吃"
 許涵兒 ,https://www.google.com/maps/contrib/106109904361725483244/reviews?hl=zh-TW,5,False,5,食物美味，服務超好！cp值高~還會看小孩的需要關心，真的很友善👍👍👍👍👍
 Han Heyhey ,https://www.google.com/maps/contrib/112705577831929501630/reviews?hl=zh-TW,4,True,599,牛排太熟有點乾說是吃到飽但是服務人員補菜很慢吃到後面還會直接路過你...空等的時間佔了大部分，要人家伸手要的感覺不太好
 Ying Chen Chen ,https://www.google.com/maps/contrib/110524359102625431612/reviews?hl=zh-TW,5,False,5,炸物好吃酥脆！pizza也很讚，平日很優惠
 Jay Chang ,https://www.google.com/maps/contrib/105021101995844414639/reviews?hl=zh-TW,5,False,5,炸雞跟披薩很好吃價格也不貴cp值很高
 阿波 ,https://www.google.com/maps/contrib/112750105587244019925/reviews?hl=zh-TW,1,False,6,"「義式pizza、炸雞吃到飽」
1.員工服務品質：
帶位後服務人員直接走掉，介紹什麼的都沒有，把客人晾在一邊。
2.信用：
Pizza40分鐘吃了2片，就沒了？那一開始就別標榜吃到飽，直接單點套餐就好了。
3.動線：
桌邊服務人員出餐動線很亂，送完一輪唯獨我們這桌啥都沒有。pizza沒吃多少，冰淇淋、湯點倒是吃很多。主打的是悶氣吃個夠🙄
總結：便宜大概是唯一特色，年輕人如果想約會千萬不要來，感情會變差的。
最生氣的大概是旁邊的廣告吃的很爽很飽，我吃的很饑餓很火大"
 楊喬雯 ,https://www.google.com/maps/contrib/117729999175243155778/reviews?hl=zh-TW,5,False,8,很好吃比薩推薦焦糖瑪琪朵口味很好吃
 Sarah Lin ,https://www.google.com/maps/contrib/103700584495860533900/reviews?hl=zh-TW,5,True,63,CP值高的吃到飽速食餐廳。
 貓爵 ,https://www.google.com/maps/contrib/116355160746529646510/reviews?hl=zh-TW,5,False,8,東西好吃～上菜迅速～而且價格很優！推薦來吃～～
 王瑜 ,https://www.google.com/maps/contrib/112736523897291101103/reviews?hl=zh-TW,2,False,2,"吃完走回家的路上肚子就超痛跟我一起去的回家也拉肚子不知道是不是人比較多披薩沒烤到很熟就拿出來還是我們腸胃比較不好😅
然後炸物滿油的但蠻好吃披薩也還不錯
白飯沒了一直沒補第一次去店員也沒幫我們講解
然後送餐速度偏慢而且都會先去中間送導致旁邊的常常都拿不到"
 Regina I ,https://www.google.com/maps/contrib/115244721180575784863/reviews?hl=zh-TW,5,True,170,"不太一樣的吃到飽，炸物披薩都是由服務人員送到桌上，都是剛炸好的真的很棒，也不需要排隊等候，有需要什麼跟服務人員說一下就可以加
比較不喜歡的地方是濃湯，那個濃湯真的味素超標的味道
就是服務人員比較辛苦，要隨時注意餐桌狀況，服務態度都很好
午餐一個人不到$400有這個品質也是很不錯的"
 蔡小伊 ,https://www.google.com/maps/contrib/100496798713185366587/reviews?hl=zh-TW,5,True,107,"90公分以下免費
打卡95折（要現金付款哦）"
 子木 ,https://www.google.com/maps/contrib/118241716027068031770/reviews?hl=zh-TW,5,False,2,炸物好吃，雞肉鮮嫩多汁且不柴，有加起司的更有一番風味，飲料選擇多搭配起來有很多種選擇，抹茶都很讚！披薩現烤皮薄脆，吃完整片還能一口接一口，個人喜歡海底總動員跟四騎士起司。很難得在信義區有不錯的吃到飽！也感謝熱情的服務員！❤️
 林書淵 ,https://www.google.com/maps/contrib/115420002336992002993/reviews?hl=zh-TW,4,True,140,"沒先定位的話可以現場訂
等待到會撥語音錄音提醒
週日晚6用餐
提供紙的飲料杯跟湯碗老實說有點LOW
玉米湯味道很怪且溫度很不足
而且湯匙盤淤積很多有點噁心
牛清湯稍微好一點
汽水區芬達壞了
沙拉沒有提供碗
還有沙拉醬口味稍差有些可惜
番茄醬等醬料是有提供的要自取
剛開始坐下服務員比較會塞東西給你
太挑一直打槍的話
中間容易會有空檔是沒食物的時間
但東西冷掉就會不好吃
有拿到一隻冒出血水的炸雞腿
服務生說要幫我換但是後來還是沒吃到
服務生其實也看的出你吃飽了就不太會來問你要不要了(也有可能是廚房真的弱或是被別桌吃貨攔截了)
加LINE好友有95折(還是9.5折?)優待
老實說無法吃回本
大概一小就飽的差不多了"
 Tim Wu ,https://www.google.com/maps/contrib/102049151869161980422/reviews?hl=zh-TW,5,True,17,披薩口味多，價格實在，推薦來吃！
 柚子香香 ,https://www.google.com/maps/contrib/103718560185205593482/reviews?hl=zh-TW,5,False,7,"平日沒什麼人，所以用餐環境不會太吵太擁擠，一個人299披薩🍕多種炸物還有自助吧吃到飽我覺得CP值很高!!
非常適合一群同事或朋友一起來吃～雖然個人沒有很愛義式料理，但這家我真的覺得還不錯👍
服務人員的態度我也覺得還不錯～
吃得飽到不行😅😅😅"
 Angela Ch ,https://www.google.com/maps/contrib/116640273605598653193/reviews?hl=zh-TW,2,True,45,"我們在下午五點半左右入場
主打pizza吃到飽但一個小時只吃到兩片？
等上餐等到很火大想給零顆心^_^

但六點半之後不知道是不是廚師終於來上班
出餐速度突然變！快！很！多！

建議大家想來吃飯請六點半後再來唷😏"
 超乎預期 ,https://www.google.com/maps/contrib/100371340173084533017/reviews?hl=zh-TW,5,True,58,"Cp值真的太高了吧！不知道老闆要賺什麼！
三百塊可以披薩炸雞吃到飽真的太佛心！
不但上菜很快，而且都是熱騰騰剛出爐的！
連用餐時間快結束了，店員也還會再來問要不要繼續吃！整個用餐心情都美滋滋的呢！"
 Sapphic Hsiao ,https://www.google.com/maps/contrib/114794663324671553710/reviews?hl=zh-TW,3,True,773,紐約客牛排普普披薩跟炸雞薯條等等是由服務生一桌一桌詢問要不要的方式要的話服務生會夾到盤子裡這樣也比較衛生披薩口味頗多整體感覺普通
 Ching ,https://www.google.com/maps/contrib/106416197343033766808/reviews?hl=zh-TW,2,True,111,"出餐速度極慢
大概有1/3時間桌上都空的在等食物
倒是最後加點很積極跑來問然後不再服務
味道部分普通披薩幾乎都是洋蔥充數一片上面可能有1-2隻蝦或1-2塊小肉
只有雞腿算好吃但入座半小時後才出餐
這個價格本來也沒有特別期待但吃完還是失望了"
 亦賢 ,https://www.google.com/maps/contrib/117041963789323492576/reviews?hl=zh-TW,5,True,135,"蜂蜜菊花茶跟蘋果汁像是加了很多水一樣，跟以前來吃時，差很多，但是以前很甜想說淡淡喝，也是可以接受
但是...喝完這兩種飲料後，炸雞-起司雞就變成奇鹹無比，建議還是不要喝這幾種飲料，若是喜歡喝，就只吃披薩就好
覺得舌頭實在不舒服
不然不管是假日還是平日，價位跟食物其實這裡很適合聚餐

吃到最後，就變成太鹹了，可能挑選食物自己要注意吧，少量配合

如果你不幸，覺得炸雞都太鹹，桌上還一堆，可以沾冰淇淋吃，因為冰很甜又冰可以麻痺鹹味...的...吧....要食物真的不要貪心，情願少量拿，好吃再拿，不要拿太多

跟櫃台反應後，櫃台說會跟廠商反應，希望反應能成功，實在好鹹"
 an H ,https://www.google.com/maps/contrib/112929328080676840241/reviews?hl=zh-TW,1,False,7,"初次用餐，第一印象還不錯
服務生會隨桌詢問餐點，但甜pizza是要和人員點用,因味道不錯想續點甜pizza,卻被要求「一次點完、我不會再過來等說詞」
聽完讓人覺得莫名其妙.."
