user_name,user_profile_url,rating,local_guide,comment_num,comment_text
 全容親 ,https://www.google.com/maps/contrib/102433399156036939076/reviews?hl=zh-TW,5,True,25,"披薩口味很多種，都很好吃
炸物也都很好吃～～～尤其是起司炸雞還有甜不辣
以這個價位在台北真的蠻超值的👍🏻"
 熋多 ,https://www.google.com/maps/contrib/100361568007406880083/reviews?hl=zh-TW,4,False,1,對淡水店印象不錯，特地來信義店看看。不知道是不是有統一改規定，這次去可以直接點吃到飽選項，不必硬要搭配相對普通的主餐。披薩與炸物的表現依然很不錯，自助吧也維持得很乾淨，飲料種類多，只是沒有淡水店的爆米花。義米蘭的親切服務人員依舊，我也認為這是他們店的最大特色，可以盡情享受被溫馨餵飽的感覺。
 SMALL FAT (聽說他在減肥) ,https://www.google.com/maps/contrib/116339947550298112032/reviews?hl=zh-TW,5,True,152,"339這個價位可以做到這樣，直接給五個星了，非常推薦大家去吃吃看。
優點：雞腿個人覺得不錯吃(就是湯汁比較少一點)，但是皮很脆，而且不油。個人推薦，牛肉湯，牛肉飯，薯條，蜂蜜綠茶，冰跟綠茶。
環境很乾淨，服務人員態度非常的好。
缺點：除了上面推薦的東西外，其它東西沒很推薦，pizza是薄片，料不多，比較推薦吃甜的。可能因為人手不夠，一開始在外面櫃檯其實等有點久。"
 Ja Ra ,https://www.google.com/maps/contrib/103432718600248154585/reviews?hl=zh-TW,4,False,3,"含服務費大約417的吃到飽
一份主餐+隨機炸物和披薩
咖啡機沙拉吧霜淇淋
披薩是薄餅型的
菜色很偏碳水炸彈不過都很乾淨
CP值確實很高
比較傻眼的是玉米濃湯有股藥水味
但是牛筋湯不錯

會吃到什麼很看運氣
服務生有沒有空也是
冷門時段去比較有希望點到餐"
 菲 ,https://www.google.com/maps/contrib/112928010367374692553/reviews?hl=zh-TW,1,False,5,"用線上候位一通知馬上到,等到已經超過候位時間還沒人來帶位
沙拉吧超小，只有玉米好吃...
牛筋清湯裡面還喝到塑膠..
主餐紐約客超薄超柴
披薩普普
大概只有微笑薯餅.炸雞跟冰淇淋還可以...
不會再去第二次:-)"
 劉育樸 ,https://www.google.com/maps/contrib/115573556213288822251/reviews?hl=zh-TW,5,False,3,雞腿排好吃
 Ann Lin ,https://www.google.com/maps/contrib/100760574387197032225/reviews?hl=zh-TW,5,False,8,首推麻辣牛筋～必吃!炸物香脆美味（推：馬鈴薯條、地瓜薯條）物超所值
 黃宥愷 ,https://www.google.com/maps/contrib/104851056398403959587/reviews?hl=zh-TW,5,False,3,"披薩好好吃(⁎⁍̴̛ᴗ⁍̴̛⁎)
炸雞腿跟雞塊也很好吃！"
 Leo Zeng ,https://www.google.com/maps/contrib/104679428294965920660/reviews?hl=zh-TW,4,True,112,"位子擁擠不太舒適尤其是四人擠圓桌還要靠牆
價位來看就算沒有四人同行折扣也是很實惠

pizza的名稱跟內容關係不大
拿之前看一下就好

整體來說非尖峰時段去應該算是不錯"
 陳宏煥 ,https://www.google.com/maps/contrib/111282491035763141007/reviews?hl=zh-TW,3,False,7,預約12:30，12:25到現場沒有服務人員來接待，可能因為午餐尖峰時刻人手不足，跟現場候位的客人一切等到12:40才接續入場，感覺有預約跟沒預約是一樣的。餐點部分炸物好吃，披薩也美味，免費升等的紐約客牛排吃起來很硬，感覺是全熟，用餐期間服務人員服務很好👍
 楊沛瑜 ,https://www.google.com/maps/contrib/106530422576594852328/reviews?hl=zh-TW,5,False,5,超好吃！店員很可愛！可以在附近逛逛再過來吃！服務態度很好！
 Allen Wong ,https://www.google.com/maps/contrib/111645731225101842117/reviews?hl=zh-TW,2,False,28,不適合我。。。白飯倒是煮得很好吃，雞腿也好吃，其他就算了:')
 Yuchi Chang ,https://www.google.com/maps/contrib/112930401174357003601/reviews?hl=zh-TW,3,True,39,桌邊服務ok，吃到飽披薩的選擇有點少，自助吧的選擇也是
 eric taiwan ,https://www.google.com/maps/contrib/111998289144072739597/reviews?hl=zh-TW,5,False,1,義米蘭，環境不錯，桌邊服務不錯，披薩皮薄好吃，值得再來光顧。
 陳品妤 ,https://www.google.com/maps/contrib/113584056868286399153/reviews?hl=zh-TW,5,False,2,服務人員態度佳，餐點美味，短時間二訪，會持續長來
 Bagel Huang ,https://www.google.com/maps/contrib/116448089002179659132/reviews?hl=zh-TW,5,True,52,雖然炸物披薩是吃到飽但也不馬虎，地瓜條甜，炸雞腿皮薄多汁，甜不辣也很酥，每樣都是熱的非常好吃。大推
 李麗珠 ,https://www.google.com/maps/contrib/114603512743751917544/reviews?hl=zh-TW,5,False,1,披薩皮薄餡多很好吃的，主餐羊排超值又好吃。
 Stanley Lu ,https://www.google.com/maps/contrib/104193666525883614918/reviews?hl=zh-TW,5,True,48,"吃到飽的部分味道不錯👌🏼
餐點好吃！
而且吃的非常的飽👍🏼"
 吳奕慧 ,https://www.google.com/maps/contrib/100089368639083159982/reviews?hl=zh-TW,5,False,4,第一次來，我覺得很好吃，服務員也很親切
 Annie Chen ,https://www.google.com/maps/contrib/110819799692918273370/reviews?hl=zh-TW,5,True,24,"披薩🍕總類多元，每種口味都有吃到！基本上都很不錯，而且起司放超多，是起司控的天堂！
披薩最喜歡賽德克巴萊、和風跟肉桂蘋果口味！
主餐部分超推薦牛肝菌蕈菇義大利麵🍝
紐約客雖有優惠但不值得、肉質太硬較不推薦～"
 Wenhua Chang ,https://www.google.com/maps/contrib/107943968569313123226/reviews?hl=zh-TW,5,False,16,邊緣人的好去處，可以12種比薩單片享用，配上新鮮多樣的沙拉和飲料
 B & M “W” ,https://www.google.com/maps/contrib/117187812619943101251/reviews?hl=zh-TW,4,True,185,服務不錯，上菜也快，飽的不要不要的
 Tom L ,https://www.google.com/maps/contrib/116487104667872967072/reviews?hl=zh-TW,5,False,9,"真的很好吃！
服務態度也很好，下次會再來"
 Chin John ,https://www.google.com/maps/contrib/107592382226704684473/reviews?hl=zh-TW,3,False,14,就坐後，先選擇一份主餐，便可以取用飲料、湯品、沙拉、霜淇淋。至於其他品項，要等服務人員不定時、不定量的詢問各桌，當然也可以直接跟服務人員點餐，反正要等就是了！整餐吃下來個人覺得「炸雞」真的非常好吃，皮薄、多汁，調味也很完美，感覺會因為「炸雞」再度光臨。
 無茶 ,https://www.google.com/maps/contrib/102879377242084441164/reviews?hl=zh-TW,5,False,3,服務人員很親切，餐點也很好吃，適合跟朋朋聚餐！
 李順華 ,https://www.google.com/maps/contrib/116701132911293644690/reviews?hl=zh-TW,5,False,4,披薩起司很多，尤其是炸物吃得很飽
 李承恩 ,https://www.google.com/maps/contrib/117312698089955433895/reviews?hl=zh-TW,5,False,4,排餐好吃價格實惠
 Vanessa VV ,https://www.google.com/maps/contrib/105638070218009477651/reviews?hl=zh-TW,5,True,92,服務人員態度都超好的！
 A7221854 A7221854 ,https://www.google.com/maps/contrib/109180355000600186051/reviews?hl=zh-TW,1,False,6,"服務態度極度差勁！
客人明明不多披薩還一直不上（已經直接點餐了）
要舉手詢問服務人員兩個都看到了也不來服務讓人不愉快"
 Z ,https://www.google.com/maps/contrib/110243240895336113940/reviews?hl=zh-TW,2,False,1,"說真的，餐點上的很慢每次至少隔了10分鐘以上，自助吧東西根本不夠消磨等代的時間
還有點的披薩的最後也沒上，用餐時間有一半都是再等"
 Andrew Huang ,https://www.google.com/maps/contrib/114177604038412986078/reviews?hl=zh-TW,5,True,610,不錯吃的平價餐廳
 安哲星 ,https://www.google.com/maps/contrib/116884069001849412578/reviews?hl=zh-TW,5,False,1,"服務人員態度親切
隨時會上來詢問是否還要餐點"
 Billy ,https://www.google.com/maps/contrib/100673344923454885155/reviews?hl=zh-TW,5,True,101,Cp值高，炸雞好吃，可惜只吃到原味的
 QQ球 ,https://www.google.com/maps/contrib/106969181673163079261/reviews?hl=zh-TW,5,False,7,看了大家的評價還是去吃了，店員服務態度很好，一直問還需不需要，因為剛好坐中間，有注意到店員有時候從另外一邊開始問，所以不管坐哪都會優先被詢問到，沒有說某一邊都沒東西吃的情況，第一次遇到這麼不怕吃的，炸物都是現炸，不會有冷的問題，雞腿我覺得有點像頂XX的味道!真心大推!
 Ting ,https://www.google.com/maps/contrib/111433223885555583111/reviews?hl=zh-TW,5,False,7,"披薩味道好好吃🥺
鹹蛋蝦仁好喜歡！"
 羅子傑 ,https://www.google.com/maps/contrib/113098617579449821963/reviews?hl=zh-TW,5,False,19,第一次和老公過來吃，味道不錯，價格實惠
 晴晨美 ,https://www.google.com/maps/contrib/100930482803483775608/reviews?hl=zh-TW,1,True,32,"兒童應該比照五星飯店餐廳潮流趨勢依年齡級別收費,不然信義區歐美國際客幼稚園小孩就人高馬大每個都成人費"
 Roger Wei-Yi Chang ,https://www.google.com/maps/contrib/100992230630473514280/reviews?hl=zh-TW,4,True,12,能滿足對炸物的口腹之慾，餐點現做供應迅速
 Eric Lu ,https://www.google.com/maps/contrib/115051078737146241391/reviews?hl=zh-TW,5,True,569,很划算的親子的用餐環境！服務人員貼心親切
 William Wang ,https://www.google.com/maps/contrib/103617985112449246584/reviews?hl=zh-TW,4,True,252,義麵、燉飯、焗烤、披薩、炸雞、雞塊、薯條、地瓜、牛肉清湯、玉米濃湯、麻辣牛筋、生菜沙拉，都是平價美食中上的水準，全部打包吃到飽，對得起價格，想吃經典平價美食的話可以去吃，要找高水準特色美食就請passXD
 bound About ,https://www.google.com/maps/contrib/118308955932700716985/reviews?hl=zh-TW,1,False,2,坐裡面一點更本不用吃到桌邊服務的餐點，動線設計有問題，冰淇淋抹茶顏色挺鮮豔的跟廣告顏料差不多。
 Yu Ta Chang ,https://www.google.com/maps/contrib/111933270194104330826/reviews?hl=zh-TW,5,True,160,物超所值，不論pizza或是炸物都有一定水準，服務生也會詢問有什麼想吃的，值得一來
 joe李 ,https://www.google.com/maps/contrib/104118756563241276594/reviews?hl=zh-TW,3,True,41,主餐點了紐約客跟羊排，兩款主餐都有夠難吃，真心覺得如果主餐那麼不用心做，就賣Pizza就好了，Pizza、炸雞、沙拉、湯品味道都很棒，服務生態度也很好，冰淇淋風味怪怪的可能需要調整一下，整體吃很飽用餐也很開心，可能剛開幕很多細節還沒做好，願意再訪，但如果主餐再那麼難吃一定1星差評。
 Chan-Min Hsu ,https://www.google.com/maps/contrib/115922715586840460448/reviews?hl=zh-TW,5,False,6,"料多，吃很飽！
餐點也不錯👍"
 J radeel ,https://www.google.com/maps/contrib/110605842427449312078/reviews?hl=zh-TW,5,True,537,很實在阿派送方式出餐推薦炸雞腿韓式炸雞起士炸雞海鮮沙拉比薩
 依依 ,https://www.google.com/maps/contrib/117921562791877289094/reviews?hl=zh-TW,5,False,11,服務人員態度很好
 MD Rely ,https://www.google.com/maps/contrib/117253906990671629477/reviews?hl=zh-TW,5,True,308,"還不錯吃服務超級好的
比較可惜的是人比較多我們這桌比較沒有一直幫我們送披薩和雞塊"
 羅網乾坤崎路人 ,https://www.google.com/maps/contrib/115319842466776773439/reviews?hl=zh-TW,4,True,401,裡面自取的部分有飲料、沙拉、湯跟飯，不定時會至桌邊服務，問是否需要炸雞、披薩等等，內部裝潢明亮乾淨，氣氛輕鬆愉快
 Zu CHEN ,https://www.google.com/maps/contrib/116922616652001625137/reviews?hl=zh-TW,5,False,4,餐點皆很好吃且吃到飽，很適合小聚餐~✨
 Allen ,https://www.google.com/maps/contrib/109999940084809506211/reviews?hl=zh-TW,5,False,11,東西多樣化，服務好上餐快速，非常棒的用餐體驗
 Andy Tsai ,https://www.google.com/maps/contrib/117018600008243378947/reviews?hl=zh-TW,5,True,78,已經是第二次帶小孩來了，小孩超愛的，都很好吃
 陳小威 ,https://www.google.com/maps/contrib/105038075374141334823/reviews?hl=zh-TW,5,False,4,很開心來到義米蘭用餐。東西多服務好。東西好好吃。以後一定會再來。
 maggie Ko ,https://www.google.com/maps/contrib/116113230017997569918/reviews?hl=zh-TW,5,True,13,"便宜又好吃
服務人員都很有耐心100分"
 li Hu ,https://www.google.com/maps/contrib/102222517516426130852/reviews?hl=zh-TW,5,False,5,主餐點了泰式鮮蝦飯很好吃👍炸雞很嫩又多汁，披薩都是新鮮出爐的，不會乾乾硬硬，價格也很實惠!
 erhehj ewgeh ,https://www.google.com/maps/contrib/108430732549950314454/reviews?hl=zh-TW,4,False,11,"用餐兩次大致上滿意
希望能點主餐時順便選擇想要的披薩種類
這樣主餐上完剛好吃披薩
不然在等披薩好先吃沙拉吧
拖太久就吃不下了
不如必勝客的保溫裝置自取用披薩
服務生態度佳"
 許育瑋 ,https://www.google.com/maps/contrib/118337074415266044742/reviews?hl=zh-TW,5,False,6,"炸雞好好吃(⁎⁍̴̛ᴗ⁍̴̛⁎)
披薩也是！"
 L. U.Z. ,https://www.google.com/maps/contrib/112235744906309637595/reviews?hl=zh-TW,5,True,94,吃到飽餐廳還有桌邊服務😉很用心哦！
 Ann Hsieh ,https://www.google.com/maps/contrib/113107617849244071628/reviews?hl=zh-TW,5,True,59,披薩薄皮、料普通、口味普通、主食松茸菇燉飯加焗烤巨好吃，但是份量很迷你！這間店可點主食也可不點，經濟實惠，CP值很高，雞腿、甜不辣、咖啡跟披薩比起來都非常優秀。食物一出爐，人員就會圍繞桌邊夾給你的感覺很衛生，但是辛苦服務人員了。
 蔡長宏 ,https://www.google.com/maps/contrib/105464822403089018221/reviews?hl=zh-TW,5,False,1,服務很好，然後上餐速度很快，食物也很好吃
 賴賴 ,https://www.google.com/maps/contrib/106151899824033124353/reviews?hl=zh-TW,5,False,5,好吃～披薩自助吧種類很多👍🏻
 顏行誠（Peter yen） ,https://www.google.com/maps/contrib/105205679794292472620/reviews?hl=zh-TW,5,False,10,今天的沙拉很脆，新鮮好吃。我覺得他的炸物炸的技術很完好
 林林林 ,https://www.google.com/maps/contrib/107493704826624886385/reviews?hl=zh-TW,5,False,11,東西多樣化，比較不容易吃膩，好吃
 Chuan kuo ,https://www.google.com/maps/contrib/102400968737156460048/reviews?hl=zh-TW,5,False,1,食物美味好吃，服務又好，cp值高！
 懶覺靜（一定要有本名顯示才行嗎?） ,https://www.google.com/maps/contrib/100507418476970406394/reviews?hl=zh-TW,4,True,45,服務人員非常親切，餐點表現不俗，性價比高。整體用餐環境過程輕鬆舒服，值得前往。
 暗色 ,https://www.google.com/maps/contrib/107541463159140889064/reviews?hl=zh-TW,5,False,4,東西新鮮好吃點心餐點都是現炸
 Ashley Chang ,https://www.google.com/maps/contrib/107897904983360874584/reviews?hl=zh-TW,4,False,13,披薩炸雞好吃！！
 wiky王 ,https://www.google.com/maps/contrib/113996551570724047775/reviews?hl=zh-TW,5,False,28,非常親切的店，可以吃很飽，又能顧到素食者。
 FuJen Hsueh ,https://www.google.com/maps/contrib/106193780229473851869/reviews?hl=zh-TW,3,True,254,有點壓力的吃飯
 Jui-Yu Chen ,https://www.google.com/maps/contrib/111804277742120112973/reviews?hl=zh-TW,5,False,2,Pizza種類多，料也豐富好吃😋
 Sean ,https://www.google.com/maps/contrib/103576368175766501317/reviews?hl=zh-TW,5,False,7,🐮🍺
 宇誌管理顧問企業社 ,https://www.google.com/maps/contrib/100466179732045236871/reviews?hl=zh-TW,5,False,2,"店員親切食物美味出餐快速
重點❗️❗️九折優惠❗️❗️"
 劉淑娟 ,https://www.google.com/maps/contrib/106786285306833380804/reviews?hl=zh-TW,4,False,6,"每樣都好吃,服務生態度佳"
 殷雅惠 ,https://www.google.com/maps/contrib/105648658092891829889/reviews?hl=zh-TW,5,False,7,雞腿很好吃，披薩口味也很多
 游醫師 ,https://www.google.com/maps/contrib/112642631762942751046/reviews?hl=zh-TW,5,True,57,人不多時服務很好炸雞腿好吃CP值高
 Shao-Nung Lu ,https://www.google.com/maps/contrib/104755805221719163168/reviews?hl=zh-TW,5,False,1,餐點很不錯，推薦來吃。
 Chia Hsin K ,https://www.google.com/maps/contrib/114542646318190044626/reviews?hl=zh-TW,4,True,23,餐點普通，但cp值還可以
 陳錦宗 ,https://www.google.com/maps/contrib/100362741013639614710/reviews?hl=zh-TW,4,True,77,吃到飽是沒錯，但出餐很慢，且份量都少少的，最後被問的就沒有東西了
 Lillian ,https://www.google.com/maps/contrib/118442896964184320311/reviews?hl=zh-TW,4,False,10,披薩口味較清淡炸雞好吃
 吳映蓉 ,https://www.google.com/maps/contrib/100962238380886242871/reviews?hl=zh-TW,5,False,1,"我最喜歡跟小捲庭一起吃飯飯❤️
東西好好吃😋"
 YU-CHEN LIN ,https://www.google.com/maps/contrib/117365351013747907282/reviews?hl=zh-TW,4,True,186,"口味中上
實惠
可單點或選擇吃到飽"
 君君 ,https://www.google.com/maps/contrib/117972118295899365113/reviews?hl=zh-TW,5,False,1,炸物好吃，焦糖瑪奇朵披薩最好吃
 Wilson Wang ,https://www.google.com/maps/contrib/109396871304067470246/reviews?hl=zh-TW,4,False,20,服務良好、上菜速度快、價格親民、口味大眾、適合聚餐
 Z Wang ,https://www.google.com/maps/contrib/100562565273555652087/reviews?hl=zh-TW,5,False,8,第一次和朋友享用，印象深刻，平價卻美味。
 ashley tsai ,https://www.google.com/maps/contrib/102922050788671861038/reviews?hl=zh-TW,1,True,21,服務人員態度很差，非巔峰時間去明明裡面沒什麼人，一直說等一下，硬讓人在門口看了15分鐘的菜單，進去後又丟下菜單就跑走，不懂菜單到底要看多仔細才能點餐
 毛龍龍小子 ,https://www.google.com/maps/contrib/103262255912372463793/reviews?hl=zh-TW,5,False,4,披薩好吃，炸物也很不錯
 王穎宸 ,https://www.google.com/maps/contrib/106829185307889740420/reviews?hl=zh-TW,4,True,401,"付費點購麵類,飯類或排餐專人提供的披薩和炸雞免費
紐約客牛排很不推
在附近的餐廳中很平價"
 hidei Wang ,https://www.google.com/maps/contrib/112572705048996091948/reviews?hl=zh-TW,5,False,5,基本餐都不錯，羊排好吃。
 Vanessa Lin ,https://www.google.com/maps/contrib/114309805558471467252/reviews?hl=zh-TW,5,False,5,上傳分享用餐可以打9折，CP值高！！
 Charsiu I am ,https://www.google.com/maps/contrib/118417311131561730399/reviews?hl=zh-TW,1,False,1,不是一般難吃
 林家儀 ,https://www.google.com/maps/contrib/101893642815089276910/reviews?hl=zh-TW,5,False,27,"上菜，可以順時鐘。逆時鐘。
這樣會更好"
 蔡朝崴 ,https://www.google.com/maps/contrib/112892868241809042828/reviews?hl=zh-TW,2,False,2,"餐點除了雞腿以外都很不錯
但預約12：30卻等到12：40多分才入座
不知道預約有用嗎？"
 徐哩哩 ,https://www.google.com/maps/contrib/115605820548399297058/reviews?hl=zh-TW,5,False,8,好吃不貴，很推薦來用餐
 林麗真 ,https://www.google.com/maps/contrib/109811164524103384697/reviews?hl=zh-TW,5,True,71,服務親切，抹茶拿鐵好喝，雞腿吃到爽，披薩薄餅的會再回訪
 John Liang ,https://www.google.com/maps/contrib/104323700025341804195/reviews?hl=zh-TW,3,True,807,做活動的紐約克牛排實在難吃，薄又韌，比薩味道不錯，炸雞腿好吃，起司炸雞味道好
 林佳蓉 ,https://www.google.com/maps/contrib/109221097830470814190/reviews?hl=zh-TW,5,False,5,好吃，這裏服務員很親切
 Theodore Gao ,https://www.google.com/maps/contrib/114632082948523989424/reviews?hl=zh-TW,5,False,67,"CP值超高，推薦！
薯條，雞塊雞腿，披薩......真希望自己是大胃王"
 Try Lala ,https://www.google.com/maps/contrib/101170508740144671591/reviews?hl=zh-TW,5,False,2,很棒的店食物品質也很好讚！
 彭願 ,https://www.google.com/maps/contrib/118434742619693303442/reviews?hl=zh-TW,5,False,4,超好吃服務很棒下次再來
 我是妹子 ,https://www.google.com/maps/contrib/109231064815736409216/reviews?hl=zh-TW,5,False,9,很好吃很推薦，假日大餐首選！
 YOUJIN LIN ,https://www.google.com/maps/contrib/102925638561427497473/reviews?hl=zh-TW,5,False,19,雞塊雞肉好吃😋pizza口味特別
 賴柏郎 ,https://www.google.com/maps/contrib/117240009703016834262/reviews?hl=zh-TW,5,False,2,好吃，值得再來，服務很棒。
 陳育忻 ,https://www.google.com/maps/contrib/110388755333851249074/reviews?hl=zh-TW,5,False,4,超好吃～～♡店員好可愛而且送超快
 魚狗 ,https://www.google.com/maps/contrib/118053622349325141683/reviews?hl=zh-TW,4,True,22,"我覺得一般偏上的店
價位合理
可以試試"
 J P ,https://www.google.com/maps/contrib/103232229705405531619/reviews?hl=zh-TW,5,False,4,好好吃的披薩，推地瓜薯條
 張容慈 ,https://www.google.com/maps/contrib/106459991630815269436/reviews?hl=zh-TW,5,False,15,披薩滿好吃的服務也很好👍
 曾德綸 ,https://www.google.com/maps/contrib/105847341812192719261/reviews?hl=zh-TW,5,False,9,披薩口味選擇多味道好吃
 陳思穎 ,https://www.google.com/maps/contrib/100742121080510094777/reviews?hl=zh-TW,4,True,175,還不錯，有時間可以來一趟
 張佩芬 ,https://www.google.com/maps/contrib/103589946459976688470/reviews?hl=zh-TW,5,False,3,披薩雞腿吃到飽很划算
 WingYu Choi ,https://www.google.com/maps/contrib/105006938948083692355/reviews?hl=zh-TW,5,False,11,送餐速度很快！餐點很好吃👍🏻👍🏻👍🏻
 Lin Low ,https://www.google.com/maps/contrib/109459752783111125071/reviews?hl=zh-TW,1,False,10,工作人員流暢度是否可以在快一點！！
 is a jk srs ,https://www.google.com/maps/contrib/116715327603551928165/reviews?hl=zh-TW,5,False,12,好吃，服務態度很好。炸雞意外讓我說讚
 張開元 ,https://www.google.com/maps/contrib/116142176595202431640/reviews?hl=zh-TW,5,False,5,很飽很划算
 劉承睿 ,https://www.google.com/maps/contrib/117023998557327856129/reviews?hl=zh-TW,5,True,11,好吃，服務人員親切！
 SN WANG ,https://www.google.com/maps/contrib/107372955850094580161/reviews?hl=zh-TW,5,False,31,今天帶著小孩去，感受到滿滿的服務熱誠，鹹蛋超人pizza還滿推薦的
 胡嘉芳 ,https://www.google.com/maps/contrib/115690822527730838511/reviews?hl=zh-TW,5,True,19,"體驗很好有桌邊服務
推～"
 george ,https://www.google.com/maps/contrib/106945001200475425437/reviews?hl=zh-TW,1,True,14,"牛排都是筋比夜市還難吃
炸雞沒入味而且炸的太硬"
 NiNi Lin ,https://www.google.com/maps/contrib/107570855281367827510/reviews?hl=zh-TW,5,True,150,東西很好吃選擇很多樣！
 陳烱銘 ,https://www.google.com/maps/contrib/110143061454395236966/reviews?hl=zh-TW,4,True,15,一開始好吃，吃久就膩了
 Zhe Yu Liang ,https://www.google.com/maps/contrib/115808251031669360173/reviews?hl=zh-TW,5,False,10,東西好吃cp值高的店家～～～
 KOW SAM ,https://www.google.com/maps/contrib/111417311298156163742/reviews?hl=zh-TW,3,True,42,先不提用餐感覺，但跨年晚上不開放線上侯位也太差了吧
 許泓展 ,https://www.google.com/maps/contrib/101068947728201208350/reviews?hl=zh-TW,5,False,2,披薩好吃服務不錯
 楷 ,https://www.google.com/maps/contrib/100881718369612363143/reviews?hl=zh-TW,5,False,4,信義區吃到飽來說整體CP值高服務態度也都很好！！
 Kunliu Huang ,https://www.google.com/maps/contrib/113612331240300264298/reviews?hl=zh-TW,5,False,2,披薩不錯吃，C/P不錯
 陳俊翔 ,https://www.google.com/maps/contrib/106469202479135229363/reviews?hl=zh-TW,5,True,422,服務相當好東西也都蠻好吃的，很適合聚餐聊天
 陳筱薇 ,https://www.google.com/maps/contrib/111720907319478291598/reviews?hl=zh-TW,5,False,2,餐點美味服務人員態度良好
 y2kimd y2kimd ,https://www.google.com/maps/contrib/105455615113125866400/reviews?hl=zh-TW,5,False,4,"東西多樣好吃
吃得過癮!!"
 張配熙Jojo ,https://www.google.com/maps/contrib/101788578893781343031/reviews?hl=zh-TW,5,False,8,好吃耶！CP值不錯
" Albert Kuo BO HEN CO.,LTD ",https://www.google.com/maps/contrib/110634718565245715898/reviews?hl=zh-TW,5,False,6,東西多類，起司用的不錯
 李昀恩 ,https://www.google.com/maps/contrib/115914597834852347419/reviews?hl=zh-TW,5,True,301,西批值高，服務生親切
 林富榮 ,https://www.google.com/maps/contrib/117402799968852595629/reviews?hl=zh-TW,5,True,125,服務親切！東西好吃！
 ET Chang ,https://www.google.com/maps/contrib/113878702121856725746/reviews?hl=zh-TW,5,False,12,非常好吃，服務親切
 Yuri Zahard ,https://www.google.com/maps/contrib/110550144259701301243/reviews?hl=zh-TW,5,True,91,店員讓我感覺到阿麼怕你吃不飽的感覺
 游湘涵 ,https://www.google.com/maps/contrib/117862381370830624691/reviews?hl=zh-TW,5,False,26,炸雞披薩讚哦！這個價位有意外
 YJJJ ,https://www.google.com/maps/contrib/117504545073965088942/reviews?hl=zh-TW,5,False,11,食物很好吃！服務很好！
 Erica Lin ,https://www.google.com/maps/contrib/116728616283599467667/reviews?hl=zh-TW,5,False,2,餐點好吃，店員也親切，推薦大家來吃👍
 彭昱維 ,https://www.google.com/maps/contrib/106534990646840119379/reviews?hl=zh-TW,5,False,11,很好吃，價格實惠
 陳信翰 ,https://www.google.com/maps/contrib/110064124754560360461/reviews?hl=zh-TW,5,False,21,價格不會太貴，服務不錯
 黃註唯 ,https://www.google.com/maps/contrib/116758303058218156851/reviews?hl=zh-TW,5,False,5,價格親民，是台北市的好地方
