user_name,user_profile_url,rating,local_guide,comment_num,comment_text
 Sharon Chang ,https://www.google.com/maps/contrib/108855552936941174735/reviews?hl=zh-TW,5,True,116,"難得便宜的吃到飽，喜歡薄片披薩可以來試試，口味有12種以上，我小鳥胃的都可以吃8-9片了。炸雞都是雞腿唷！只是太鹹了🥲有點可惜。炸物馬鈴薯條、地瓜條、甜不辣、笑臉薯餅，就地瓜條看起來特別油，但還是不錯吃😜沙拉吧很可愛，我以為是工作人員的吧台。剩半小時時服務人員會來進行最後加點。
----詳細資訊----
平日1點來訪，人不多，很舒服的空間。披薩口味蠻多的呀～我今天就吃了8、9種，還有幾個沒吃的口味，絕對有12種以上。披薩的皮其實蠻香的，可以細細咀嚼～有時皮烤的脆脆的，大多時候是Q軟的，起司給的很阿莎力！我們一共吃了五片四騎士🤣、漁夫口味柴魚片多到炸掉、焦糖瑪其朵有夠肥（別輕易嘗試😂可以多人分享一塊，若想嚐鮮的話）、青椒牛肉牛肉塊小小的、
小小遺憾：一開始有蘆薈什麼的口味有巡迴，但我還不想吃甜的，所以沒說要，最後加點也沒上來～不知是什麼滋味呢"
 penny Kuo ,https://www.google.com/maps/contrib/109840195492830991508/reviews?hl=zh-TW,5,False,73,"披薩是薄片好吃不膩。炸雞腿炸雞塊和三種炸物都是熱的。桌邊服務很親切。客人較少時也可直接客製化披薩。飲品滿多樣。飯後還有抹茶霜淇淋。用餐環境舒服。服務親切。很棒的用餐體驗
隔一週又馬上帶人來品嚐，一樣很滿意。炸雞腿炸雞塊超棒。麻辣牛筋配白飯好讚。甜鹹披薩都好吃
牛筋清湯好喝
第三次來吃啦"
 Jack Lin ,https://www.google.com/maps/contrib/110016180875297834427/reviews?hl=zh-TW,4,True,144,整體而言不錯吃啦，比較可惜的是吃到飽的披薩種類有點少，而且我們三個人每次補披薩都只有兩片也是蠻妙的，而炸雞一直補很快披薩則是補很慢，但我們比較喜歡吃披薩才來的啊
 yu ,https://www.google.com/maps/contrib/112271355218886208206/reviews?hl=zh-TW,1,True,8,"不會回訪，原因如下：
1.20:20入場，20:55有朋友臨時來、想入座，店員才告知只供餐到21:00，卻沒有在入場時先說明。當下才說供餐要結束了，問我們要不要再一張披薩。這是服務生在帶位時就應該告知的基本事項吧。
2.外場男服務生欠缺訓練，動作緩慢、感覺有點狀況外，很不專業，付了10%的服務費感覺很不值得。
3.披薩口味非常特別，有蘆薈卡士達、紅豆棉花糖等等。料蠻少的，食材感覺不新鮮。
4.餐具沒有清洗乾淨，濃湯碗邊緣有一大塊不明物（有附照片，歡迎參考），超級無敵宇宙誇張！！令人不禁懷疑其他的餐具是否也沒有認真清洗。（不明物聞起來像沙拉醬的味道）
5.自助吧的蘋果汁像是稀釋過度，味道非常淡，像在喝水，不過喝到一半想到自己今天水分攝取還不足，姑且當作是在補充水分，還不錯。其他飲料也不想嘗試了，還是建議喝可樂機或咖啡機就好。
6.看其他人的評論普遍都說炸雞還不錯，但不知道哪裡出了差錯，我們吃到的炸雞腿非常普通，而且感覺不是很新鮮，有一個怪味。
7.很多口味的披薩都會加青豆（就是很多人都討厭的那個三色豆裡面的青豆），夏威夷口味有青豆、海鮮的也有、牛肉的也有，不知道店家是不是怕我們蔬菜攝取不足，放在披薩上真的是，嘔嘔嘔。
8.店員把別桌的披薩誤送到我們這桌，我們還討論了一下才確定不是我們的（畢竟他們的披薩都長得很酷我也看不出來什麼口味），向服務生反應後也是直接送到別桌。感覺有些不衛生，而且又在疫情期間，十分不妥。

不過還是值得加分的地方：
1.甜不辣、微笑薯餅和薯條都是現炸，趁熱吃還蠻好吃的。（看來是間被披薩耽誤的炸物店。
2.以吃到飽＋位在信義區而言，價位算是蠻便宜的，或許可以來狂吃炸物順便吹吹冷氣（？

貼心小提醒：
店內有五星評論可以打九折的優惠，因此評價可能有點兒失真，可自行斟酌。"
 狐狸 ,https://www.google.com/maps/contrib/111582427511921302474/reviews?hl=zh-TW,4,True,17,"限時90分鐘的薄片披薩、炸物吃到飽，有簡單的飲料吧、生菜吧及牛筋飯牛筋湯
披薩：雖品項不多、大部分都不錯吃，薄片比較不會膩，也比較能多吃
炸物：炸雞腿有醃製過炸的也酥脆有汁，但口味因人而異。炸雞塊很好吃，比外面鹽酥雞店賣的還更好吃，各種調味除了韓式很辣之外都不錯。
自助吧：牛筋飯牛筋湯都很有水準
整體來說東西還算有一定水準，披薩口味不算多、美味程度也不算太驚豔，但以這個價位來說CP值還算不錯。"
 Christine Tien ,https://www.google.com/maps/contrib/103330796956385592574/reviews?hl=zh-TW,5,True,63,"第一次到訪，感覺物超所值!

＊鹹食披薩：都是薄皮的，烤好出爐由服務生逐桌分送，料多味美，務必趁熱吃，我會為了披薩再度光臨~!

＊羊肋排：份量比預期大很多（看看照片中有幾根骨頭），是可以２－３人分食的程度，調味、鮮嫩度都超乎預期，美味多汁、值得一試～！

＊炸物系列：地瓜薯條好吃！！雞腿是薄皮的那種，沒有過多調味、過厚麵衣，雞塊意外的juicy，炸雞系列都很不錯！！

＊牛筋清湯：滿滿的牛筋、蘿蔔、菇菇，加上一點枸杞提味，非常好喝，感覺是隱藏的招牌好物

以上是我覺得美味的部分，其他餐點就比較一般，但該有的都有，以這種價位在信義區能吃到這樣的水準，非常感恩～

周一中午來消費，依然有７－８成的上座率，生意不錯。
服務生們態度很好，客人雖多也都有招呼到，謝謝您們。"
 Whei Huang ,https://www.google.com/maps/contrib/110685060107339886630/reviews?hl=zh-TW,4,True,32,"味道基本還不錯，只有些口味很雷，像是巧克力披薩，價格也很平易近人，服務也還行，餐具及環境都很乾淨，沒什麼缺點，唯一的缺點是廁所需要走出去，用餐地點沒有廁所，所以要走比較遠。
披薩算是那種很薄的披薩，雞塊也很多汁！"
 何阿寶 ,https://www.google.com/maps/contrib/102473235100664094055/reviews?hl=zh-TW,4,True,67,"用餐時間：2022/4/15午餐
種類蠻多的...味道都不錯..炸雞有三種(起士、椒鹽、韓式)、薯條、地瓜條、甜不辣、多種口味披薩都可以無限續，工作人員會自己夾給你，沙拉吧有生菜沙拉、飲料濃湯白飯等....我最喜歡起士炸雞，肉多汁又大塊，還有炸雞腿，午餐一個人才299加一成CP值頗高...會再回訪的好店"
 Brook Fang ,https://www.google.com/maps/contrib/113664502785387268121/reviews?hl=zh-TW,3,True,27,價格親民，但產品豐富度低，主餐普通，炸雞腿，炸雞肉，只要是雞肉產品都是同樣的醃製味道，有一點膩，披薩的皮好吃！但口味略普通，最好吃的是炸甜不辣，很推！夠脆夠香！整體而言，歡迎嚐鮮一次即可。
 parfait Huang ,https://www.google.com/maps/contrib/100518836738398721432/reviews?hl=zh-TW,4,True,129,"先前有看過評價，發現假日人多服務比較不周全，容易會等太久沒吃飽。極推薦平日來吃人很少，可選自己想吃比薩口味。
平日用餐服務生很勤快詢問炸物、比薩、炸雞補充，最後一輪點餐，會特別問想吃甚麼口味要幾片，專門烤給你吃，餅皮大小原本做成一塊大小，也不會有吃到大小塊不一情況。連炸物也可選自己想吃種類跟份量。
比薩偏台式口味薄餅，趁熱吃味道不錯，但有幾種口味裡會有三色豆，討厭的人事先詢問，避免吃到。
炸雞是台式古早口感，薄皮有汁，吃多會膩。
炸物甜不辣炸得最好吃，還有薯餅薯條。炸無骨雞塊味道普通、不太入味，偏油膩感，吃沒幾塊就不太想吃，味道很單一。
麻辣牛筋配飯超入口，不會很辣微微而已，可惜吃比薩炸物太飽，沒再續一碗，有點冷掉也很好吃，牛筋清湯台式味道很好喝。推薦一定要吃一下！！"
 Cookie Wang ,https://www.google.com/maps/contrib/108905794165520431994/reviews?hl=zh-TW,3,False,4,"一開始人少披薩先用點的
可以先2種口味半片或4種口味整張
可能因為已整張了隨桌頻率就少了
但人少真的比較難送餐
這樣能吃到的口味就比較少了"
 janice chang ,https://www.google.com/maps/contrib/110974692757925021573/reviews?hl=zh-TW,5,True,40,披薩炸物吃到飽，有沙拉飲品自助吧及牛腩飯湯品。炸雞腿薯條好吃，薄片披薩中喜歡瑪格麗特，單點白醬牛菌菇義大利麵味道清淡。抹茶拿鐵及奶茶好喝。個人最愛牛腩飯及炸甜不辣。CP值高吃很飽，服務不錯。
 Sylvia ,https://www.google.com/maps/contrib/113999414342869488131/reviews?hl=zh-TW,3,True,193,義大利麵太硬，披薩吃到飽還行，但整體太鹹，湯有玉米濃湯、牛骨湯，還有飲料、沙拉、冰淇淋、咖啡、白飯、牛肉醬，炸物太油，價位$399～
 Riley Pan ,https://www.google.com/maps/contrib/115218119352168957046/reviews?hl=zh-TW,4,False,67,以吃到飽來說價格很親民，主餐不錯，服務員很勤的巡桌問要不要比薩或炸物，每口味的比薩都好吃不馬虎，尤其炸雞腿👍
 Larissa Lin ,https://www.google.com/maps/contrib/111129689522296235126/reviews?hl=zh-TW,5,True,96,主打披薩炸物吃到飽的餐廳，多樣薄片披薩，蘆薈卡士達披蕯很爽口不甜膩，炸物不死鹹可自己另外加胡椒粉或番茄醬，當中甜不辣很好吃，牛筋清湯很好吃，也有義大利麵跟飯可單點，適合帶孩子一起來吃的家庭餐廳。
 M W ,https://www.google.com/maps/contrib/116862513316783586140/reviews?hl=zh-TW,5,False,37,"炸雞腿很好吃😋薄片窯烤披薩也好吃😋
配可樂/雪碧喝到飽，價格很親民。
沙拉的生菜不是很新鮮，要改進。
牛筋湯好喝。吃飽順便逛百貨公司"
 大食女 ,https://www.google.com/maps/contrib/108896620249179797723/reviews?hl=zh-TW,5,True,50,"披薩口味選擇多元，跟必勝客吃到飽不一樣，不是披薩全部擺出來自己夾；他們家的點餐方式是：店員會拿披薩到各桌巡迴，如果有需要的話，可以直接跟店員拿。
炸物稍微偏油膩了些，但整體表顯算不錯，以信義區地段來說，CP值算高。"
 Karen Hung ,https://www.google.com/maps/contrib/113533882996155733423/reviews?hl=zh-TW,5,True,103,炸物都很美味，尤其是炸甜不辣和炸雞腿。pizza有很多口味會輪流上場。店員很熱情會ㄧ直詢問怕人沒吃飽。雖然主餐比較普通，光吃吃到飽的部份已經很划算。
 Chun Yu Lin ,https://www.google.com/maps/contrib/108990666753050007136/reviews?hl=zh-TW,4,True,36,"結論：推薦
CP值：🌟🌟🌟🌟🌟
服務：🌟🌟🌟🌟🌟
種類：🌟🌟🌟🌟🌟
口味：🌟🌟🌟🌟🌟
找不到什麼特別的缺點，以這個價位
算是非常優質的餐廳
如果口味能夠有和風黃金雞、黃金泡菜燒肉、壽喜燒牛肉那就更完美了！
再有義大利麵吃到飽，那也是完美再完美
扣一顆星是因為滿招損謙受益，時時保持謙卑學習的心，精益求精，戰戰兢兢的經營才能走得更長久。"
 Lee Richard ,https://www.google.com/maps/contrib/102178283599202556369/reviews?hl=zh-TW,3,True,621,炸物的油應該很久沒換了，Pizza也非常非常普通，國高中學生或青少年相約吃一吃可以，畢竟便宜。大學生以上建議不要，會有一點雷。
 Often ,https://www.google.com/maps/contrib/114925020971860659272/reviews?hl=zh-TW,4,True,698,"這間吃到飽比較不一樣，不是整堆攤在那邊自己夾喜歡吃的那種，是店員送餐決定你吃什麼，沒有主動選擇要拿什麼的權力

一開始店員進行點餐時，可以選沒有主餐$339的披薩炸物吃到飽的選項OR想要點主餐+吃到飽(菜單旁邊的價目無須再加上$339也可享有披薩炸物吃到飽)

周邊可以自己夾吃到飽的有霜淇淋、飲料機、咖啡機、沙拉吧、麻辣牛筋飯、玉米濃湯、牛筋清湯等，個人因為胃口沒到太大，所自助選項沒享用太多，但印象霜淇淋還不錯~

店員一開始送餐的時候，可能會送許多披薩，但個人胃口真的不大，沒送幾片披薩後真的就有點飽的感覺了，再加上口渴搭個幾杯氣泡飲料，其實胃就沒有太多空間了...

但~這間絕對很適合高中大學生來聚餐，在這地段雖然是以送餐方式進行吃到飽的選項，絕對還是物超所值

至於送餐個人覺得適中，可能當天用餐的人沒有到太多，並沒有感受到有太慢的感覺，所以如果怕慢的話建議可以提早或是選個冷門的時段前來用餐，可以讓你如願在時間內吃好吃滿🤣"
 許湘涵 ,https://www.google.com/maps/contrib/109617867447271056766/reviews?hl=zh-TW,5,False,17,"服務人員很棒！披薩薄脆口味多元化！
炸物是現炸熱熱的口味好吃新鮮不油膩～
飲品選擇多湯品也不錯還有沙拉&冰淇淋
CP值👍👍👍👍👍👍"
 張思思 ,https://www.google.com/maps/contrib/102231970543655288756/reviews?hl=zh-TW,4,True,280,"在社團上看到信義區也開了義米蘭，特別來吃。
午餐299起,晚餐及假日339起外加10%服務費，這價位在信義區不算貴。

心得：
1.沒有像其他餐廳遵守防疫有間隔，位置很擠。雙人桌桌面小。
2.主餐我點西班牙燉飯，很好吃，也可以選擇不點主餐。
3.披薩口味有14種,甜鹹都有,其中我覺得最特別的就是棉花糖披薩。餅皮上面滿滿的紅豆泥+棉花糖，口感很特別但又不會很膩。
4.店員會一直來送其他食物。炸雞腿皮薄多汁，不錯!
炸雞有多種口味,椒鹽(很像鹹酥雞的味道)、起司、韓式等等,每一種都還不錯
5.薯條有馬鈴薯跟地瓜，這個要趁熱才好吃
6.飲料有汽水、咖啡機、果汁跟茶。
7.霜淇淋是抹茶霜淇淋，很濃很好吃。
8.湯品有玉米濃湯跟牛筋清湯。
9.生菜沙拉有兩種醬可以選用
10.想特別吃什麼都可以跟工作人員點餐

以上..大概是這樣"
 侑聖 ,https://www.google.com/maps/contrib/105194967981335027683/reviews?hl=zh-TW,5,True,213,長期支持的店，披薩好吃，種類多，還有甜的口味，其他配料表現得都很不錯，價格便宜CP值高，非常推薦來吃，主餐的話推薦蕈菇燉飯
 YA WEN ,https://www.google.com/maps/contrib/107213384856616723460/reviews?hl=zh-TW,4,True,469,"2022/01/02用餐
飲料自助bar有沙拉、熱湯及飲料區
披薩、炸雞腿吃到飽
每個人是$339（另加10%服務費）

今天兩個人用餐
其中一人加點餐「墨西哥蕃茄鮮蝦麵」$379（可免費用沙拉吧）
所以墨西哥蕃茄鮮蝦麵..只要加$40

服務人員會拿各種口味樣式的Pizza詢問是否需要（已含在自助餐費內）

真的喜歡吃Pizza的人是可以來用餐
但是都是澱粉類居多"
 曹盛昱 ,https://www.google.com/maps/contrib/114271966131073452233/reviews?hl=zh-TW,5,False,18,"披薩口味好吃，只是料沒有擺滿滿的感覺，但是口味好吃
炸物（炸雞腿、薯條、雞肉塊、尤其是甜不辣）都好好吃，雞肉鮮嫩多汁
抹茶冰淇淋好好吃
最後，焦糖瑪琪朵口味披薩，有滿滿的鮮奶油，真的好幸福喔！"
 任偉榕 ,https://www.google.com/maps/contrib/112145059118513056103/reviews?hl=zh-TW,4,True,55,"價格便宜，
Pizza餡料較少，但口味多元
炸物類有雞腿，甜不辣、薯條、雞塊等，都可以無限續點
沙拉、飲料、湯品也是無限自取
適合親子或朋友聚餐"
 Johnny Liu ,https://www.google.com/maps/contrib/102690337346256041177/reviews?hl=zh-TW,5,True,26,"假日不點主餐的話，炸物自助吧享用到飽一人339+1成服務費，不過這樣就可以吃的得很盡興。

自助吧的牛筋清湯是令人驚艷的一筆，湯底料給的都很實在，也幫忙解了太多炸物的膩。不過這次就沒有體驗到麻辣牛筋拌飯了，再訪會想嘗試看看。

炸物大推炸雞腿和雞腿塊，剛起鍋的炸雞腿外皮油亮誘人，咬下去的口感酥脆多汁，雞腿塊也不遑多讓，幾乎沒有骨頭且比起炸雞腿更易入口，每次服務生桌邊派送都會來上幾塊。

其他像是薯條/甜不辣/地瓜薯條/起司雞腿塊的炸物也都蠻不錯的，可惜這次沒有吃到薯餅，下次再來品嚐看看。

各種披薩口味應有盡有，披薩餅皮是薄片的，所以不會像厚片的容易有飽足感，更可以吃到不同口味。鹹蛋超人和四騎士的口味是個人最愛！

評分最多星星是要給所有為我們服務的服務人員了，每次廚房出爐後的桌邊派送都非常的到位，到口的餐點都是熱騰騰的欸，這都要感謝你們辛苦的桌邊派送了。
看到你們一桌一桌親切的派送，最後加點時間也不忘詢問是否還有想要加點的披薩口味，是我覺得這次用餐體驗最佳的一環，謝謝也辛苦你們了！

一定有機會再訪的，也期望未來都還能保有如此高水準的服務品質😋"
 賀安 ,https://www.google.com/maps/contrib/114549011579344540617/reviews?hl=zh-TW,5,True,49,"除了炸物有點冷有點油以外，披薩跟主餐都很好吃，單純吃披薩也可以吃很飽，口味都很好吃沒有雷☺️服務態度很好，cp高
339+10%不點主餐披薩吃到飽也有炸雞腿雞塊可吃。點主菜也有披薩吃到飽。"
 Shaun Chen ,https://www.google.com/maps/contrib/100174744464968760514/reviews?hl=zh-TW,5,True,271,第一次來吃這種自動送餐的吃到飽，很有趣的形式；味道好吃，服務親切，CP值很高，而且上來的餐點都是剛出爐的，非常推薦！
 Huayu Lin ,https://www.google.com/maps/contrib/117300260214206295355/reviews?hl=zh-TW,4,True,35,"平日中午價格CP值高，義大利麵、Pizza、沙拉吧都不錯，炸雞腿美味，肉質軟嫩，外皮香酥多汁。
意外的吃到甜不辣，而且居然很好吃😋"
 蕭榮興 ,https://www.google.com/maps/contrib/108139222423537660891/reviews?hl=zh-TW,5,True,163,CP值很高，披薩、炸雞好像不用錢的一直送上來，披薩是薄皮的，起司很多，好吃
 Sam Huang ,https://www.google.com/maps/contrib/104307576852709244671/reviews?hl=zh-TW,5,True,"1,185","起司雞排好吃，炸雞腿，炸雞也不錯，pizza好吃，反正性價比超高
211217又來，這次比較聰明，只吃主餐，炸雞腿，pizza"
 nini c ,https://www.google.com/maps/contrib/100768998270996355040/reviews?hl=zh-TW,3,True,140,要掃QRcode候位，不然工作人員忙的時候是不會特意告知的。內場送食物的服務人員人都很好，食材和精緻度就是比較屬於非常非常平的水準。飲料機的飲料非常淡、霜淇淋也是，披薩很常被分到比較沒有料都是餅皮的部分，沙拉吧就是⋯來了就知道不多贅述。只吃沙拉吧339元的樣子，加點豬排主餐為380左右有點忘記，還會加一成服務費（服務生都很好很親切，這點無可厚非）所以總價大概是430左右（懶得看發票大概是這樣）吃得很飽但是有一種⋯⋯。_。”的感覺
 龔裕捷 ,https://www.google.com/maps/contrib/106338270897109841119/reviews?hl=zh-TW,4,True,34,披薩、炸物直接送上桌，很方便！現炸炸雞很好吃，炸雞腿很搶手！自助吧的牛筋清湯好喝。
 陳柏華 ,https://www.google.com/maps/contrib/112587987550580663112/reviews?hl=zh-TW,5,False,8,三百多有十多種口味的披薩吃到飽，炸雞腿吃到飽，薯條薯餅甜不辣地瓜薯條炸雞塊起司炸雞塊吃到飽，沙拉吃到飽，多種飲料爽爽喝，咖啡品質很好，抹茶霜淇淋吃到飽，生活在台北二十多年我不知道還有哪間餐廳比這間還佛心，唯一一間不是為了折扣才想給評論的。最重要的是服務員小姊姊真的是有夠活潑可愛又漂亮，淚推👍👍👍
 Rumi Yi ,https://www.google.com/maps/contrib/116111568104060621763/reviews?hl=zh-TW,5,False,24,"服務很好，東西多樣，披薩、炸物都是現烤現炸很加分！！很厲害👍
平日午餐好划算(*ˉ︶ˉ*)！！吃好飽
可惜服務員不多，要服務多桌客人會有點忙不過來"
 Disney Prince ,https://www.google.com/maps/contrib/112026888071905983276/reviews?hl=zh-TW,5,True,8,這間新開幕，食材用料很實在，雞腿超猛軟嫩多汁，服務生也會很溫柔的詢問要不要加點，不用我們客人主動舉手，想幫貼心，服務周到，飲料吧選擇多樣，有沙拉有霜淇淋，比薩口味多元，值得帶朋友常常來
 柔Jou x ,https://www.google.com/maps/contrib/105768848914281349103/reviews?hl=zh-TW,5,False,4,"Cp值高的一家店，比薩種類多，服務人員親切，聽到我們不吃牛還特地幫我們特製口味，比薩炸物都是現點現做，現炸起來的甜不辣超好吃😋
一定會再訪😁"
 馬子修 ,https://www.google.com/maps/contrib/100319031965145213987/reviews?hl=zh-TW,5,True,16,一個人299吃到飽，在台北已經很難找到了，更難得的是品質很好，CP值超高！
 Rex Lin ,https://www.google.com/maps/contrib/104574760274976444635/reviews?hl=zh-TW,5,True,153,"吃貨熊雷雷推薦指數：4.5🌟
價格指數🌟🌟🌟🌟🌟
美味指數🌟🌟🌟
服務指數🌟🌟🌟🌟🌟
環境指數🌟🌟🌟🌟🌟

（滿分五顆🌟，最低一顆🌟）

中午來到ATT用餐，可能過了高峰的人潮，
不費吹灰之力就得以入座。
.
店內空間寬敞，服務生很快速的帶我入坐，並稍微介紹一下用餐方式，除了沙拉跟飲料及湯品是自助外，其餘食物是由店員送到桌邊詢問是否需要，有韓式炸雞、起司炸雞、炸雞腿、炸黑輪、比薩🍕等，沒送來的也可以跟店員反應一下，餐點都現做，熱騰騰的還不錯。
.
個人覺得炸物炸得不錯，自助吧也不錯，主餐個人覺得很普通😅，但不難吃。中規中矩的調味。
.
整體而言，送餐快速，服務不錯，價格平價，餐點口味一般。"
 hiram Lu ,https://www.google.com/maps/contrib/118164131893299974556/reviews?hl=zh-TW,5,True,52,"炸雞及義大利麵好吃,焦糖瑪奇朵的比薩很好吃,服務很親切！"
 Kaoru Komazawa ,https://www.google.com/maps/contrib/109170830995251428050/reviews?hl=zh-TW,4,False,21,"今天的第一站
炸雞腿真的不錯~
甜不辣跟地瓜也可以
沒吃薯條跟薯餅
Pizza只有吃四片鹹的
牛肉香腸蝦仁
我比較喜歡牛肉pizza
甜的就沒吃了
牛肉湯跟玉米湯還ok
泰式蝦義大利麵我覺得就是偏辣的奶油麵
沒甚麼泰式的感覺
可能是因為沒有酸吧？
他的蝦我不喜歡
霜淇淋是抹茶口味味道可以只是偏甜
飲料機有氣泡水這我很可以XDDD
吃到飽同價位來說我覺得完勝咕咕家"
 邱明正 ,https://www.google.com/maps/contrib/109451361349889113546/reviews?hl=zh-TW,5,False,17,"111/3/3晚餐
平日人少，外場服務生會一直過來詢問需要什麼食物，態度親切

炸物推薦:雞塊(同桌續了兩次)，甜不辣(續三次)，地瓜

鹹披薩味道中規中矩，紅豆麻糬比較讓我驚豔

如果感覺膩口，還有沙拉可以換口味，相當不錯

牛筋湯友人感覺不錯，清爽不油膩

吃完同桌友人表示是願意二訪的店
推薦給各位"
 朱廷霖 ,https://www.google.com/maps/contrib/118095000598636801913/reviews?hl=zh-TW,4,True,19,這次去吃牛排沒有像很多人說的過熟咬不動的情況，披薩的話尤其是剛出來的起司披薩吃起來很爽，整體來說以這個價格還不賴。
 D&C ,https://www.google.com/maps/contrib/117797998611992052900/reviews?hl=zh-TW,4,True,154,很平價的pizza吃到飽，桌邊服務很勤，炸物好吃！尤其是炸雞腿！但如果你是對pizza高度期待的人，建議還是去其他pizza專賣店，因為這裡的薄片不夠脆，用料普通，不會想為了吃pizza再來第二次。但是服務人員真的都很好，服務有加分，但pizza沒有！
 YRREB ,https://www.google.com/maps/contrib/100032567453355138157/reviews?hl=zh-TW,3,True,18,"候位登記是耍人用的，第一次來現場沒預約是客滿的，看門口有放候位登記的牌子，於是也登記了，也在旁邊等候，結果到了我們也沒像牌子上的說的會通知，直到看了兩組比我們慢的現場排隊的進場才去詢問，說有現場喊是x先生嗎，那請問你牌子上的寫會以語音或簡訊通知就是騙人的嗎，我如果不在現場等是不是就白等了
然後是這次的炸雞，有吃到多汁的，也有吃到乾癟的，品質不一，還有炸雞有事先烤過口感不是很好"
 月詠小萌 ,https://www.google.com/maps/contrib/111390205053167540714/reviews?hl=zh-TW,5,True,20,"高CP值,店員服務非常好
披薩以外基本上是台式口味w"
 Meg Chen ,https://www.google.com/maps/contrib/107480154929202303844/reviews?hl=zh-TW,5,True,43,"價格實在，東西也不錯吃
服務人員貼心地不斷詢問是否要加披薩和炸物
自助吧選項也很不錯～推👍🏻👍🏻"
