user_name,user_profile_url,rating,local_guide,comment_num,comment_text
 L Michelle ,https://www.google.com/maps/contrib/104435586839166961632/reviews?hl=zh-TW,3,True,500,"社團推薦值得吃，說好吃但人不多。在慕名而來後幾個感想：
1.羊肉咖哩這麼一碗350？
2.蔬菜湯150,很台式的一碗湯
3.這麼小店，加收服務費？
4.點餐詢問菜單時，服務員大姐似乎是臨時來幫忙，頻頻回頭問櫃檯內的印度男生。
5.甩餅比一般略小，但好吃。
6.咖哩餃不錯吃，2顆100.
7.周五不提供商業午餐，不然應該可以試試。
8.快800元的餐費，吃不飽……

綜合首次嚐鮮的以上理由……
這城市價格不容易在社區型被接受，很可惜！"
 施怡 ,https://www.google.com/maps/contrib/107140867518321976809/reviews?hl=zh-TW,5,True,175,環境舒適，餐點好吃！推薦大家來試試看～
 Duncan Chao ,https://www.google.com/maps/contrib/106850555477548799844/reviews?hl=zh-TW,5,True,38,超好吃，一定比你吃過的任何印度菜還好吃
 鄭能紘 ,https://www.google.com/maps/contrib/105660664059320470741/reviews?hl=zh-TW,5,False,12,"推薦卡戴爾香料咖哩層次非常豐富，炸蔬菜的醬很特殊個人喜歡薄荷的香氣，另外烤餅本身非常香！
整體來說點的五道菜都很棒"
 Canne Wang ,https://www.google.com/maps/contrib/108964472697715001335/reviews?hl=zh-TW,5,False,3,巴圖拉.氣球烤餅.薑黃餅配咖哩雞.羊～絕配
 PG Lee ,https://www.google.com/maps/contrib/107097378752466611552/reviews?hl=zh-TW,3,False,13,"油煙味沒有隔壁台菜討厭
開幕以來倒也相安無事員工常常將衣服掛在我家曬衣桿在不被干擾的情況下沒人去計較這些
但閉店時時常不關後巷燈真的很擾民
兩支大燈管正對別人房間窗戶，兩層氣密窗一扇遮光窗都擋不住
今日特地在閉店前十分鐘打電話提醒
口頭上說好好好知道了
結果油煙機關了、內部燈關了就是後巷燈沒關（？
無法當常客時常光顧但我們也很想當好鄰居好嗎
BTW,夏季電費很貴的整夜沒關真的好嗎？"
 Ou Pandora ,https://www.google.com/maps/contrib/116489734326616433042/reviews?hl=zh-TW,5,True,312,親切的老闆愉快的用餐！今天不想吃肉，蔬菜(茄子)咖哩很對胃口。烤餅好吃因為現點現烤很香。很少吃印度餐覺得有趣用手比用餐具多。
 YH 614 ,https://www.google.com/maps/contrib/102465581047109426908/reviews?hl=zh-TW,5,False,29,味道很香，音樂好聽，一秒來到印度
 許景棠 ,https://www.google.com/maps/contrib/104973361259054126834/reviews?hl=zh-TW,5,False,1,食物非常有印度風味、特色；附上印度地圖炒飯。
 WANG MAGGIE ,https://www.google.com/maps/contrib/113042361526951292066/reviews?hl=zh-TW,5,False,4,餐廳廚師正是印度人口味道地又獨特值得推薦！
 misaki chen ,https://www.google.com/maps/contrib/101392950230745656150/reviews?hl=zh-TW,5,True,42,吃第二次了，味道很好，會想再回來吃。
 凱尹 ,https://www.google.com/maps/contrib/110829258708977978742/reviews?hl=zh-TW,3,True,40,口味中上，但是份量對上價格真的不是一般的貴，點了咖哩跟烤餅，但是咖哩來的份量竟然讓我以為是烤餅附加的咖哩⋯小小一碗⋯真的蠻失望的。
 韓季言 ,https://www.google.com/maps/contrib/114815828362018676305/reviews?hl=zh-TW,5,True,327,氣球烤餅很有趣，像油餅😂
 旅攝YuWei ,https://www.google.com/maps/contrib/110007197332543522649/reviews?hl=zh-TW,5,True,174,"各種咖喱味道都很好
烤餅Q又酥非常推薦
烤雞及咖喱的肉都很嫩
價格實在用餐環境不錯
另外二樓有包廂"
 Yu Ling Wang ,https://www.google.com/maps/contrib/112638724574338153475/reviews?hl=zh-TW,4,True,13,雖然一開始看到裝潢有點怕怕.但實際進來廚師是印度人.烤餅很香.咖哩也很好吃～被裝潢耽誤的好吃印度咖哩店
 Johan Wang ,https://www.google.com/maps/contrib/111188599116196971522/reviews?hl=zh-TW,5,False,4,東西很好吃，太餓了來不及照相就吃光光，香料奶茶好好喝，是那種天然香料的感覺，會再回訪的店家～
 CORINA WU ,https://www.google.com/maps/contrib/107895872162992387438/reviews?hl=zh-TW,5,False,8,中式風格裝修的印度餐館，還有創意的土魠魚咖哩。烤餅好吃，讓人感覺回到印度~
 Shirley Chen ,https://www.google.com/maps/contrib/112546249340594309374/reviews?hl=zh-TW,1,True,103,冷氣有開，但遠遠不夠，還是很熱，隔壁桌一直擦汗。看起來店家不怕熱，，，深具印度風情的一家店。
 陳Mos ,https://www.google.com/maps/contrib/117586681957205866748/reviews?hl=zh-TW,5,False,1,"8/19跟朋友去吃每道料理都很棒味道特別：）吃的很飽很開心

PS.空調可能要改善蠻熱的我吃到一直流汗喝冰水"
 CHUNAN HSIEH ,https://www.google.com/maps/contrib/104374883512474012566/reviews?hl=zh-TW,5,True,53,"咖喱層次口感都很豐富
烤餅又Q又香
雞肉串的香料也很讚
值得一吃"
 Kate SHIH ,https://www.google.com/maps/contrib/107966868916826950524/reviews?hl=zh-TW,5,True,15,超好吃！會想一來再來吃的印度料理店，價位也較其他印度料理店實惠，CP算高！
 Mango W. (Mango) ,https://www.google.com/maps/contrib/106072768778317942532/reviews?hl=zh-TW,5,False,8,剛好經過很有興趣來吃吃看、好吃、道地！
 TJ Chen ,https://www.google.com/maps/contrib/117232136884265152537/reviews?hl=zh-TW,5,False,4,"香料味不會太重的印度餐廳
很適合臺灣人的口味😍😍
原本不太餓但咻咻咻就吃光光了"
 Wu Yi-Jiuan ,https://www.google.com/maps/contrib/107941101679910843248/reviews?hl=zh-TW,5,True,66,"從芝山2號出口出來，步行路程大概7分鐘內一定會抵達的距離。
點了風味咖哩魚，老闆有說他們用的是比目魚（是嗎？腦殘如我有點不確定了，總之是比較昂貴的魚類），真的好吃！
打卡送印度奶茶，有柔和的香料味，喝到底還有點茶葉渣渣，是真的用煮的奶茶。
廚師邊料理邊哼印度歌曲好可愛😆，老闆也很友善親切，不會給人壓力但介紹得很詳細。
她說之後還會推出外帶優惠，希望回饋街坊鄰居。
好店推推~"
 Sid Hung ,https://www.google.com/maps/contrib/103858076674239831000/reviews?hl=zh-TW,5,True,813,開幕未滿月的北印料理餐廳，咖哩和烤餅的味道口感極好，目前暫時沿用大安本店的菜單，據說即將開發不同的特色餐點。
 JEFF HSIAO ,https://www.google.com/maps/contrib/105206561979178356011/reviews?hl=zh-TW,5,False,15,"餐廳裝潢很特別不一樣的風格，餐點好吃😋、服務人員親切推薦大家來這邊用餐。
若有不懂服務員都會幫助你們"
 張理 ,https://www.google.com/maps/contrib/105125192646693337743/reviews?hl=zh-TW,5,True,168,"食物超所值
有道地印度口味

臥虎藏龍的地方
有眼不識泰山（老闆）

會成為排隊名店之前趕快來朝聖"
 郭修華 ,https://www.google.com/maps/contrib/101085750658021302975/reviews?hl=zh-TW,5,False,25,菠菜咖哩雞味道很棒😍
 Jiannan Che ,https://www.google.com/maps/contrib/107548616804623806988/reviews?hl=zh-TW,3,True,103,口味中上，價格偏高
 Zero ,https://www.google.com/maps/contrib/102587596914171477237/reviews?hl=zh-TW,5,False,13,"第一次來這裡吃就愛上，還有好多口味想嘗試😋
還有奶茶非常順口好喝，我喝的是原味，朋友喝的是有加香料的（有點肉桂味）也非常好喝唷⭐️⭐️⭐️⭐️⭐️"
 szeying chen ,https://www.google.com/maps/contrib/105607316306083897666/reviews?hl=zh-TW,3,True,58,"在外送平台上提早一個多小時點預約訂單也可以遲到？預約是預假的？
吃完補評論，
平心而論很好吃，香料用得很足，跟我在印度吃的很接近，所以加回2顆星。
但一碗菠菜鷹嘴豆咖哩加一個全麥烤餅要400多元，可能得內用有碗盤襯托，才不會覺得太貴，放在免洗紙杯裡，非常蕭索。"
 Joy Chung ,https://www.google.com/maps/contrib/108143474604419012924/reviews?hl=zh-TW,5,False,38,"愉快的用餐經驗。
茄子料理頗佳。
下次會來嚐鮮秋葵、菠菜等蔬食。"
 皇甫赫 ,https://www.google.com/maps/contrib/105846003539985268952/reviews?hl=zh-TW,5,False,45,東西非常好吃，我不敢吃羊肉，只敢吃這裡的羊肉料理，價格公道，已經去過好多次了
 mia lin ,https://www.google.com/maps/contrib/116502653882652479286/reviews?hl=zh-TW,5,False,8,"餐點口味很道地，
我點的是蔬菜口味的奶酪咖哩，奶酪是手工做的搭配Naan很好吃！
印度奶茶讓人驚艷，是用純鮮奶跟料製成的。
店內也很乾淨，會是想再去的一家店。"
 lee Chuckling ,https://www.google.com/maps/contrib/101167438219895904168/reviews?hl=zh-TW,1,True,18,"很貴，份量少；搞不懂為什麼裝潢服務甚麼地都不對味，但整體要價這麼貴。總之價值感極低，
回家後好奇搜尋了餐廳臉書，幾乎是老闆(?)自己一直往臉上貼金的多字文。
特此紀錄一下，怕之後自己忘記又到這裡吃。"
 Lillian Wu ,https://www.google.com/maps/contrib/113830563417961296790/reviews?hl=zh-TW,5,True,71,這家真的很好吃又不貴！！真的推推~~下次還會去吃
 楊舒婷 ,https://www.google.com/maps/contrib/113000201951897489719/reviews?hl=zh-TW,4,True,778,"菠菜羊肉咖哩味道很好，但是價格偏高
烤餅是比較Q的那種，也不錯，但是很Q又很大一片，吃起來比較麻煩"
 Jason Li ,https://www.google.com/maps/contrib/102055726446298206772/reviews?hl=zh-TW,4,True,750,一點點貴，不掩道地的印度風味，食物有特色，也很美味。
 Linda Chen ,https://www.google.com/maps/contrib/117984415747161287267/reviews?hl=zh-TW,4,True,170,"雖然店內裝潢不太合適,但餐點實在又好吃,全家人常去消費!"
 Ming Tsao ,https://www.google.com/maps/contrib/109352703070014317713/reviews?hl=zh-TW,5,False,10,"各種咖哩都好吃～
點了三款飲料都好喝～"
 Jenny Lu ,https://www.google.com/maps/contrib/101056026541622338142/reviews?hl=zh-TW,4,True,56,"烤餅不錯
烤雞塊蠻鹹的
今天外送少放一份烤餅"
 Cube Chen ,https://www.google.com/maps/contrib/110467431101558373506/reviews?hl=zh-TW,5,True,678,"日本料理店的裝潢被保留下來，木質裝潢搭配花布燈籠，卻是賣印度料理。

店名是亞瑟蘭，但外面的柱子貼的介紹都是泰姬Taj，不知道是否和市民大道的泰姬有關係。

Gomaji有賣券可以折抵消費，比較划算。

-
🍛瑪莎拉雞肉咖哩$380
🍛菠菜雞肉咖哩$380
🫓原味烤餅$70
🫓奶油烤餅$75
🫓蒜泥烤餅$90

價位算是稍微高一點，用券後可以接受。但份量也算不少，咖哩都足夠打包回去再吃一餐。

一進店裡就充滿了香料烤雞的濃郁香味，放在tikkamasala裡的tandoori烤雞塊，果然很香非常入味。

咖哩一入口，各種辛香料的濃烈風味衝擊而來，加上大辣🌶️的辣度，令人大呼過癮。

烤餅很大張，肉嘟嘟的Q彈厚實，用手撕著沾咖哩吃，或是可以請內場幫忙切開。。

近期吃過最好吃的印度咖哩！！

-
📷2022/05/05"
 Odon Sarnai ,https://www.google.com/maps/contrib/112731908190356156862/reviews?hl=zh-TW,3,True,"1,803","整間店用燈籠為主題，裝飾頗具特色。食物味道聞起來很香，味道也很好，可出菜等粉久。料理價位大多三四百元，份量不大。無論外帶還是內用，都是等到一個生根發芽地老天荒的狀態。所以我完全沒有加點的勇氣---雖然客座有兩層樓，但服務人員嚴重不足。我並不是光點碳烤料理，可進來後已經等了四十多分鐘，桌上依舊是看不到任何能吃的東西---或許這就是旁邊放很多書的原因？很想建議店家能提供點便宜的解悶小食招待~然後，因為等很久，咖哩乾酪和全麥烤餅上桌我就很餓的一直吃，沒有拍照---最後只來得及拍碳烤雞肉~並且吃完還有想買手搖飲料的微空虛。
再次說明：口味很好，但等超久---只給三星的原因是---令人沒有加點的勇氣，而這種價位給這種份量，真的應該讓人有自由選擇吃飽的自由。"
 美云咪牙 ,https://www.google.com/maps/contrib/116211528661046610683/reviews?hl=zh-TW,5,False,6,"服務親切，讓人賓至如歸。料理道道色香味俱全，是視覺與味覺的雙重享受！
我個人每次必點菜色為火紅乳酸炭烤雞、白色咖哩羊、馬鈴薯烤餅、風味咖哩魚、香料奶茶……大推薦！有選擇障礙的帥哥美女跟著我點準沒錯囉^+++^"
 Jialing Lee ,https://www.google.com/maps/contrib/116974093306672295536/reviews?hl=zh-TW,4,True,100,"咖哩餃：內餡很多馬鈴薯很有飽足感，沾蕃茄醬很好吃但覺得怪怪的不太印度
原味烤餅：很Q很好吃
香料咖哩羊：羊肉很大塊有點難咬，再嫩一點+切小塊點會更好吃，醬有點小辣
香料蔬菜優格：很冰，很有香料的風味，但我吃不太習慣，最後加咖哩羊混在一起吃完了
甜味優酪乳：很好喝，跟市售優酪乳有點不一樣
餐點不錯吃
缺點：有收服務費，但服務的大姊一直在櫃台後面要叫才會出來不會主動注意需不需要服務，我覺得蠻怪的
費用：吃得很飽，但價格稍高…我會覺得貴大概就是那服務費覺很不值吧…"
 江烏鴉 ,https://www.google.com/maps/contrib/116471657811436434998/reviews?hl=zh-TW,5,True,59,吃過菠菜、乾酪、羊肉咖喱，特別喜歡羊肉咖喱，推薦給喜歡羊肉的人，也推薦內用，熱熱地剛出爐就是好吃，看起來小小一碗，但很夠味，非常下飯，2人點一份咖喱配飯或烤餅其實都很夠吃，乳酸碳烤雞味道不錯，份量偏少。
 藍翎 ,https://www.google.com/maps/contrib/109573676544970254864/reviews?hl=zh-TW,5,False,3,咖哩跟烤餅推薦，帶馬鈴薯泥的東西很辣
 侯嘉玲 ,https://www.google.com/maps/contrib/107056921970890512069/reviews?hl=zh-TW,1,False,3,"料理雖貴但好吃，女服務生服務品質有待加強。點餐直接丟給我們填，問是否有推薦的菜單，也是態度冷漠；也不會幫忙倒水，客人忙上忙下找紙巾，也不會主動幫忙，只是一直在座位上盯著她的手機，這樣的服務品質，最後還要付服務費。
天母地區好吃的印度料理很多，我應該不會再去光顧！"
 大葛格 ,https://www.google.com/maps/contrib/114674676665110652143/reviews?hl=zh-TW,5,False,4,羊肉咖哩味道濃郁好吃，肉味足，口感鮮甜美味，與薑黃飯搭配堪稱完美。非常好吃的餐廳，我一定會再來。
 張Dennis ,https://www.google.com/maps/contrib/115627151240880891201/reviews?hl=zh-TW,4,True,152,好吃不會像很多印度餐廳都騙錢！
 張竹萍 ,https://www.google.com/maps/contrib/112849734227702607498/reviews?hl=zh-TW,4,True,464,色香味俱全😊配合輕鬆的音樂感覺很棒
 Chuan-Ching Wang ,https://www.google.com/maps/contrib/107299268019408513553/reviews?hl=zh-TW,5,True,226,"用熊貓外帶過兩次，非常美味，令人印象深刻、常常想吃。
至於其他留言說價格高，我認為有在下廚的人就會知道好的香料是昂貴的，泰姬的咖喱是滿滿的香料，其實算是物有所值。"
 Harlem Lin ,https://www.google.com/maps/contrib/105852550027041620092/reviews?hl=zh-TW,5,False,14,慕名而來，服務態度跟餐點都非常好，值得再訪的餐廳👍👍
 even Sun ,https://www.google.com/maps/contrib/109659320015604759144/reviews?hl=zh-TW,5,True,30,素食商業午餐200+10%charge份量足夠且美味！推一個
 Lee An ,https://www.google.com/maps/contrib/110780076759154331326/reviews?hl=zh-TW,5,True,29,"今天點風味咖哩跟香料烤雞，以及原味烤餅、奶油烤餅。

結論來說，全部無雷。

餅皮Ｑ，麵香足。咖哩跟日式咖哩的香甜不同，鹹香路線，此外香菜提味提的真好。烤雞香氣也很特別，可能這就是印度口味吧？好吃！搭配解膩的洋蔥實在很棒。

是會再訪的一家餐廳！"
 魏運寶 ,https://www.google.com/maps/contrib/117638426253012925124/reviews?hl=zh-TW,5,False,3,難得享用印度美食，趁生日全家聚在一起大啖異國料理，道地又好吃。
 Jason Chang ,https://www.google.com/maps/contrib/112569474618492780912/reviews?hl=zh-TW,5,True,147,素食花椰菜馬鈴薯咖哩，味道很好吃！
 蕭志聖 ,https://www.google.com/maps/contrib/111072787141510966107/reviews?hl=zh-TW,5,True,127,五辛素的菜單也很豐富喔！
 Esther Ho ,https://www.google.com/maps/contrib/102243411191840274200/reviews?hl=zh-TW,5,False,7,外帶了幾個餐點回家，對於她的咖哩驚為天人，比起天母其他的裝潢很美的印度料理餐廳，泰姬更讓我讚不絕口，雖然烤餅看起很一般，但是搭配她的咖哩更顯美味。愛吃印度料理的人一定要試試。
 Lydia Lin ,https://www.google.com/maps/contrib/104747076090036922024/reviews?hl=zh-TW,5,True,342,好吃，不吃香菜的可以事先說！😊
 李安安 ,https://www.google.com/maps/contrib/110561917924715744822/reviews?hl=zh-TW,5,True,69,廚師真的是泰國人，烹調的料理頗為道地，每道料理都由數種香料的味道，小朋友不愛辣，大概只能奶油咖哩雞…😅有任何問題或需求，都可以打電話詢問，闆娘很客氣的…現在外帶自取88折，超優惠…建議大家可以嚐鮮這米其林等級的平價美食喔！😋😋😋
 leon lin ,https://www.google.com/maps/contrib/101140559896047388606/reviews?hl=zh-TW,5,True,113,"香料烤雞很厲害很入味還不柴
而且一隻才六百這個價位很可以！！"
 Jessie H ,https://www.google.com/maps/contrib/112305688464395053564/reviews?hl=zh-TW,5,False,58,進來品嚐才更了解泰姬客棧的故事，好美的燈籠高掛。蕃茄湯很溫和順口，各種咖哩都好吃，烤餅很香。老闆娘極親切，是ㄧ位富有學識及文化的高學歷女子。客棧內有好書分享，誰說印度餐廳ㄧ定都要很制式化的全印度風格呢。耐心在等餐點製作時，好好欣賞客棧ㄧ番，希望更多客人品嚐美味，繁忙時多份包容，店會越來越穩定。最近有去市民大道泰姬印度料理用餐後，更喜歡泰姬客棧的蘭編老闆娘，可愛的人情味。我的胖老公很喜歡來吃，有點擔心會把椅子坐壞：D
 Sung Eddie ,https://www.google.com/maps/contrib/106147140192951970905/reviews?hl=zh-TW,5,True,46,"謝謝店家大年假期一樣開業，讓我們吃到一餐美味的午餐，新年快樂。

店裡不同風味的咖哩都很美味，香料自然的香，溫和不嗆的辣度，經過許久時間的燉煮，我們自然的把現烤餅皮趴滿咖哩醬和肉滿足的吃下。

相當令人開心的一餐，必再次光臨，謝謝這麼用心的經營"
 ellie tsai ,https://www.google.com/maps/contrib/111409452291937368548/reviews?hl=zh-TW,5,False,4,咖哩配烤餅跟香米好吃😋
 陳冠瑋 ,https://www.google.com/maps/contrib/117935807972976337412/reviews?hl=zh-TW,5,True,302,印度風味的薄餅配咖哩真的超讚，而且價格不算貴，唯獨印度風味奶茶我喝不太慣，是間值得來的店
 Jack Fan ,https://www.google.com/maps/contrib/112677819692673136067/reviews?hl=zh-TW,1,False,5,吃過多家印度餐廳，這裡的料理普普不甚理想，價格卻很高，並要加收一成服務費，服務就是給一杯白開水，當時餐廳內只有我們一桌，服務人員態度冷漠異常，也不會來加水，難怪沒有什麼生意，總之這是我吃過cp值最低的印度餐廳了。
 陳國勝 ,https://www.google.com/maps/contrib/118372514116695532008/reviews?hl=zh-TW,5,False,1,老闆娘親切，菜色豐富有驚艷到
 Joyce Lin ,https://www.google.com/maps/contrib/108166590325457636970/reviews?hl=zh-TW,3,False,8,"食物很美味，但外場有待加強……

點了3種咖哩3份不同口味烤餅。上第一個咖哩時詢問什麼口味，服務生表示不清楚，讓我們在那邊猜，拿菜單自己對照。我們猜是雞肉咖哩，服務生還說""應該是""……""我問問看""，後來才進廚房確認(結果是羊肉咖哩)

3份烤餅一起上桌，因為是各自點要吃的，所以問烤餅口味，服務生又一臉不知道……告知是不同人點的，服務生回""我只是送餐的""""你們吃吃看就知道是什麼口味了""(????)最後烤餅真的是我們自己吃吃看分出來的……

以上兩點是比較讓人傻眼的……其他小狀況小事。若是外場服務能再加強就更好了"
 YOU-NING HUANG ,https://www.google.com/maps/contrib/112944325205700888373/reviews?hl=zh-TW,5,True,42,超級好吃😋
 will hung ,https://www.google.com/maps/contrib/109796840363518546099/reviews?hl=zh-TW,1,True,171,"食物普通且不便宜、如果有幾道要400以上、又是一個以自助的方式的「服務」
服務到餐點還有頭髮...
但我最不能接受的是pakora香炸雜菜是隨便果粉炸出一個沒有香料沒有味道的東西、並且還用番茄醬。外面有2020米其林的照片、真的嗎？"
 林玉娟 ,https://www.google.com/maps/contrib/115401805085524827234/reviews?hl=zh-TW,5,True,85,味道很讚👍，香料搭配的很好。。
 yf lee ,https://www.google.com/maps/contrib/117114495216691352341/reviews?hl=zh-TW,5,False,15,"烤雞烤餅都好吃
咖哩也是理想中的味道
非常推薦

希望可以出個單人套餐或商業套餐滿足一人時想吃的慾望🥺"
 吳鋐堉 ,https://www.google.com/maps/contrib/109085217368144290395/reviews?hl=zh-TW,1,False,2,"350元的咖哩份量完全不值得超級少
烤餅的份量也很少
我覺得不推"
 群鴿 ,https://www.google.com/maps/contrib/102011417123413846460/reviews?hl=zh-TW,5,True,23,"朋友真心推薦
也有素食餐"
 Kai-Hong Cheng ,https://www.google.com/maps/contrib/104554660463836380527/reviews?hl=zh-TW,5,False,2,咖哩，烤餅，炸蔬菜都好吃
 Liu Kun-Hung ,https://www.google.com/maps/contrib/116173752644435801776/reviews?hl=zh-TW,2,False,23,烤雞很乾，食物普通，奶茶沒什麼味道。
 HT ,https://www.google.com/maps/contrib/106008115775726361705/reviews?hl=zh-TW,4,True,116,"今天吃土魠魚咖哩套餐，全部都挺好吃的，東西很多也很豐富，價格略高。
土魠魚咖哩套餐，含土魠魚咖哩、蔬菜咖哩（今天是鷹嘴豆咖哩）、沙拉、西米露、烤雞肉、脆餅、烤餅、飯、印度奶茶（忘了拍）。"
 宋傳 ,https://www.google.com/maps/contrib/108402887328150648150/reviews?hl=zh-TW,5,False,1,咖哩配餅美味、好吃。
 Daryl Cheng ,https://www.google.com/maps/contrib/105879598845940339708/reviews?hl=zh-TW,5,True,725,"態度親切，有個疑似印度人？的男服務生很帥，又很親切，服務態度滿分，店員都很積極熱情又很親切，令人滿意！
餐點用料非常實在，好吃又美味划算，看了天母介紹來的，非常開心，推！"
 Iok Kiat Ngoo ,https://www.google.com/maps/contrib/110381268903148122507/reviews?hl=zh-TW,5,False,16,人生第一次嘗試印度料理，意味的合胃口，尚未吃完已經和老婆討論何時再訪，美中不足的就是冷氣不太冷。
 Elsa Chen ,https://www.google.com/maps/contrib/101377578969678602313/reviews?hl=zh-TW,5,True,30,綜合香料乳酪的印式乳酪很豐盛，香料的搭配有韻味，小辣；全麥馬鈴薯烤餅很香，內餡除了有馬薩菈香料粉調味，也有香料顆粒，餅皮Q軟適口；菠菜馬鈴薯的馬鈴薯也很豐盛，口味溫和。整體來說雖然菜單價格看起來稍微高一點點，但是cp高，口味也很好吃，令人滿意。
 GARY Chen ,https://www.google.com/maps/contrib/109175788663561638399/reviews?hl=zh-TW,2,False,15,還沒吃，但我來一個小時還沒上菜，快餓死了。如果要等很久我進來的時候應該先跟我說！
 Jenni ,https://www.google.com/maps/contrib/115631874868089721161/reviews?hl=zh-TW,1,False,22,提前在ubereat上面預約訂單，11點說店家在準備訂單且12點可以送，結果到12:10突然取消訂單。如果不能送就提早說，到預約外送的時間突然取消訂單是在耍人嗎？要重訂別家又要再花至少30-50分鐘的時間，當所有人都很閒嗎？
 謝大宇 ,https://www.google.com/maps/contrib/100269186202872003043/reviews?hl=zh-TW,5,False,12,好吃！老闆娘很熱情！
 王慧 ,https://www.google.com/maps/contrib/117208116962913430276/reviews?hl=zh-TW,3,True,21,"看士林幫慕名而來，東西不錯吃，
但主餐加一個烤餅，再加服務費都要450元.
服務太太，連水都來不及倒，叫她乾脆ㄧ壺水放著，我們（8個）自己倒，縮了一下說對不起，
水也不給.裝潢也不知道走什麼風格？"
 Hsieh Kevin ,https://www.google.com/maps/contrib/103083267506625678807/reviews?hl=zh-TW,5,False,3,餐點好吃上菜速度很剛好
 柯樂高 ,https://www.google.com/maps/contrib/112368859048316603038/reviews?hl=zh-TW,5,True,15,"士林芝山區的新選擇，非常值得一吃再吃，咖喱跟烤餅連一歲的女兒都食慾大開！

停車的朋友可以停戲曲中心或家樂福或sogo
大推！"
 簡新村 ,https://www.google.com/maps/contrib/113358978842185307216/reviews?hl=zh-TW,5,True,79,享用蔬食咖哩及烤餅，非常美味可口，價廉物美。客人用餐後收拾餐具，會再使用75%酒精消毒桌面。
 Wayne Chao ,https://www.google.com/maps/contrib/103084968289795551992/reviews?hl=zh-TW,5,True,108,烤雞很讚，必點！
 廖伯霖 ,https://www.google.com/maps/contrib/111010255442941912878/reviews?hl=zh-TW,5,True,126,超級好吃
