user_name,user_profile_url,rating,local_guide,comment_num,comment_text
 Kellyの頹廢日常 ,https://www.google.com/maps/contrib/102114540470315855254/reviews?hl=zh-TW,5,True,134,"芝山-泰姬客棧印度餐廳

因為士林燈節的關係來到芝山站，想用餐順便走去外雙溪看水舞秀，附近的餐廳都查過一遍，感覺最穩的評價就是泰姬客棧。

關於價格
看完菜單真的是偏貴，但評價很穩所以先把價格放一邊。

餐點：
香料羊肉咖哩1份
印度烤餅1份
火紅乳酸碳烤雞1份
蔬菜優格1份
加服務費=941（可使用LinePay付款）

香料羊肉咖哩
羊肉很嫩但更驚豔的是咖哩風味很有層次，裡面還有放一些切碎的蔬菜提升口感，吃起來就是一種很融合的感覺，也跟日式偏甜的咖哩不一樣。

原本以為印度咖哩應該是那種很辣
（超市常賣的印度咖哩粉我超不愛）
但真的讓我對印度咖哩改觀。

印度烤餅
真的要點1份來吃，要不然真的只有一碗咖哩醬，熱熱吃很香，稍微冷的口感偏有嚼勁，初訪就先點原味嚐嚐鮮

乳酸碳烤雞
碳烤的香氣和軟嫩的雞肉我還蠻愛的，真的是出乎預料的嫩，而且香料也是很有異國風味，不過因此只有四塊雞肉，價格和份量一開始還有點困惑，但吃完這三樣之後開始有飽足感

蔬菜優格
跟市面上的優格不太一樣，整體偏酸，裡面蔬菜很香甜，整個平衡下來很搭，也是出乎預料的口感。

整體服務
感覺有一個熟練再帶一個不熟練的阿姨，阿姨正在訓練中的感覺，阿姨人很好但外場多加油，整個餐廳的回饋應該會更加分。

1.建議店家直接放水給客人自取就好
雖然有要收服務費，不過忙不過來的話，自取會比較方便。

2.菜單改成那種直接讓客人可以打勾勾或是劃正字的來點餐，一開始跟我說要填寫菜單menu，說明不完全導致我都寫菜單名稱，被阿姨糾正要寫旁邊的編號，雙方都做白工。"
 Tracy Wang ,https://www.google.com/maps/contrib/117960837559734634967/reviews?hl=zh-TW,5,True,247,"乳酸碳烤雞很入味，蒜泥葫蘆巴烤餅風味絕佳～
紫茄咖哩、土魠魚咖哩香料味豐富，好吃到點了兩張原味烤餅才能吃光
窯烤蘑菇有酸奶乳酪味，也很好吃👍
老闆人很親切，會教我們怎麼吃，印度小哥服務生雖然中文比較不通但是很熱情😆用餐經驗很愉快～
以印度料理來說價格很合理喔！值得一試～
—
2022.06再訪
這次點了許多上次沒吃到的菜色
羊肉串非常有別於台灣常見的，風味特別
很喜歡全麥烤餅本身的味道，建議搭配菠菜馬鈴薯咖哩
素食香料炒飯也是獨具特色
香料咖哩雞則是心中的經典
餐後來一杯奶茶，不管冰的還是熱的也都好喝
吃到脹破肚皮的一餐😆"
 曾俊明 ,https://www.google.com/maps/contrib/113219258915125254139/reviews?hl=zh-TW,5,True,238,"四種印度烤餅都很好吃，原味、蒜泥是必備的，再推薦全麥烤餅，入口有全麥的餅香，沾咖哩雞超讚！馬鈴薯烤餅是辣味的，不是很辣，但吃了會冒汗的那種，很舒服。
我們四個人叫了三種咖哩：羊肉咖哩的羊肉好吃、不腥，用了非常多種香料的黃咖哩；白色咖哩雞的白來自於非常多的堅果，雞肉也不會柴；綠咖哩（忘了拍，因為飽到不行）是素的。大家都非常推薦的火紅乳酸碳烤雞，多種香料的刺激，就是非常異國風到底。
點完才發現有套餐，直接可以滿足想換吃各種口味的慾望。
餐後沒喝優格就可惜了，濃純香，帶一點酸味，十分順口。
空間設計非常日式，也充滿趣味，貼了非常多印度電影的海報！"
 Wendy ,https://www.google.com/maps/contrib/117364108469865992118/reviews?hl=zh-TW,5,True,37,"沿用前日式料理裝潢的印度餐廳
空間不大先得更有溫馨感
很喜歡他們的烤雞類料理
燒烤的味道非常香
咖哩、烤餅和茴香或薑黃飯都非常搭
吃起來舒舒服服的印度餐廳

看著牆上許多人捐贈待用餐的芳名錄
老闆老闆娘肯定也是溫暖的人！
還推薦我們再試試看附近其他的印度餐廳"
 Cinna Kao ,https://www.google.com/maps/contrib/103915871442806868089/reviews?hl=zh-TW,3,True,16,"羊肉香料咖哩味道還不錯，但份量非常小，要價420
火烤乳酸雞還不錯，肉質嫩，但竟然有毛⋯⋯
奶油烤餅中規中矩
印度香料冰奶茶非常不行，沒味道，也很小杯，要價110
昨天晚上用餐冷氣又壞掉，邊吃邊流汗⋯"
 Ya-Hui Kuo ,https://www.google.com/maps/contrib/106882952561081438054/reviews?hl=zh-TW,5,False,36,"第一次來印度餐廳用餐，不愧是高評價的餐廳，個人套餐內容豐富好吃，份量十足，小鳥胃可能會吃不完。不過個人套餐只有週一到週四全天和週五中午才有。
很喜歡他們的咖哩，味道很協調，超搭烤餅的。印度奶茶很貼心的不放糖，由客人自己加，避免過甜，這點很棒。本來以為甜點吃不下了，沒想到外觀平平的印式西米露也這麼好吃，最後還是把它嗑完了。
平日中午來用餐的人比較少，交談的音量也不會太大，用餐氛圍很好，聽說假日人會比較多，下次帶家人一起來嚐嚐。"
 張小兔 ,https://www.google.com/maps/contrib/102117255259339149439/reviews?hl=zh-TW,5,True,292,"連著兩天中午吃印度餐點，今天完勝。
雖然行經這一間本來的日料餐廳裝潢，卻變身印度菜乍看有點不搭嘎，好奇之下來試試看，沒想到很好吃耶！
味道濃郁的咖哩，搭配有嚼勁認真的烤餅，真好吃！
香料奶茶昨天已經初體驗了，今天又更完勝，多了淡淡薑的香甜感～
可再訪！"
 He Xander (頸鹿) ,https://www.google.com/maps/contrib/102218833553922520750/reviews?hl=zh-TW,5,True,53,很可愛的印度餐廳，老闆娘很細心，而且一上桌就超香的，非常道地的感覺，吃起來也很合口味，非常特別，烤餅必點，超Q彈又很香，是台灣少見的口感，喜歡異國料理一定要試試，推薦朋友聚餐來點多種配菜一起吃，可以配烤餅跟白飯，很棒！
 SY KAO ,https://www.google.com/maps/contrib/106399807476587353621/reviews?hl=zh-TW,4,True,"1,176","奶油黃咖哩、印度烤雞、烤餅可以點😋
算是比較習慣的口味。
其他真的不是很習慣😅
印度菜真的小貴耶🥺"
 kl73622 ,https://www.google.com/maps/contrib/116920098772856407329/reviews?hl=zh-TW,5,False,17,"精緻小巧的店面。
味道很夠味～～
像氣球的烤餅，稍微一咪咪咪咪咪咪油。
蒜味葫蘆巴烤餅很讚！
烤雞跟菠菜羊肉咖哩沒有失望🥰"
 Charles Yang ,https://www.google.com/maps/contrib/100989695818078405604/reviews?hl=zh-TW,5,True,237,"乳酸碳烤雞超超級美味，調味醬料非常豐富，肉稍微乾但不算柴，以稍微瘦的肉的部位碳烤而言，這是非常好吃的！碳烤餅很不錯，脆餅鹹度超高，黑扁豆咖哩讓人胃口大開，滿滿的香料，怎麼吃都有味！蔬菜比較普通。
可惜店裡沒有播音樂，環境不到非常舒適，但不影響食物的美味。"
 milimew mi ,https://www.google.com/maps/contrib/107683754132718495995/reviews?hl=zh-TW,4,True,159,"好久沒有吃印度菜了,剛好在附近上課,就來試試看這家的餐點.點了帕尼爾.提卡.炭烤奶酪$420+主廚特調咖哩羊$390+蒜泥葫蘆巴烤餅$100+巴圖拉.氣球炸餅$100+印度冰奶茶$110(可以使用LinePay支付很方便),我很懷念Paneer(印度奶酪)很類似豆腐的口感,這個碳烤奶酪搭配蔬菜挺不錯的.氣球炸餅很大的兩球,我搭配咖哩羊吃完就好飽了,蒜泥烤餅很香,可惜我吃不太下只好打包回家,家人覺得冷了也好吃.冰奶茶很有Masala的風味,喜好因人而異.老闆娘說fb打卡有印度甜品招待,我深知印度甜品的甜....是螞蟻都會膩死,不敢吃.同去家人沒吃過很想試試,沒想到他居然吃得了一球,真是厲害!!有興趣挑戰的人可以試看看."
 Szuyin Chou ,https://www.google.com/maps/contrib/109423623700090845675/reviews?hl=zh-TW,5,True,110,"烤雞不柴很嫩，很令人驚艷，推薦
咖喱和烤餅也非常好吃，鹹優格和熱奶茶也與在印度吃的味道一樣，值得推薦的印度餐廳
下次想試試套餐～"
 邱璵宸 ,https://www.google.com/maps/contrib/105859026696960028068/reviews?hl=zh-TW,5,True,17,"嚐鮮異國風味餐廳，很棒的體驗。
老闆娘很熱心介紹菜單。
烤雞很香，肉質軟嫩不柴。白咖喱很濃郁，配上氣球烤餅讓人一口接著一口～"
 Allen lin 東海小王子的奇幻世界 lin ,https://www.google.com/maps/contrib/107457050683580227945/reviews?hl=zh-TW,5,True,20,"（約會日）
之前買團購餐券
一直忘了，後天就到期，趕緊來大吃一番。
我們2人吃的超飽的，怎麼會有人說吃不夠呢？？？？？而且沒花到多少錢，這樣若沒買買團購券原價包含10%的服務費也才1200左右。
重點是還不錯吃。

首推印度烤餅和6號火紅烤雞。
之後還會再去用餐，想試試其它口味的印度烤餅。"
 黃宜人 ,https://www.google.com/maps/contrib/117056407541401074599/reviews?hl=zh-TW,5,True,18,一進入店內就飄來濃厚的印度音樂和氛圍，用餐環境寬敞舒適，餐點美味份量足，推薦燒茄咖哩！
 Zana Chang ,https://www.google.com/maps/contrib/117831445242314940655/reviews?hl=zh-TW,5,True,21,非常特色美味的印度料理，每道菜色都很驚艷！服務也很親切～很推薦來試試！
 alfalfa Tsai ,https://www.google.com/maps/contrib/103112696498163913989/reviews?hl=zh-TW,5,False,13,"交通方便，服務良好，點了羊肉套餐，份量十足，又可以一次吃到多種口味，很滿足
喜歡現烤的烤餅跟濃郁的咖哩，肉口感很嫩，甜優格跟印度奶茶都好喝
不過個人不習慣印度沙拉跟脆餅的味道，西米露略甜膩"
 Ryan Y ,https://www.google.com/maps/contrib/113965029076084818059/reviews?hl=zh-TW,5,True,55,"由於沒有電動門，客人進進出出會一直不關好門，坐在門口座位會一直被風吹得不耐煩。

除了這點以外，這家店真的可圈可點。台北數一數二好吃的印度料理店，當之無愧。"
 Vinnie Fang ,https://www.google.com/maps/contrib/105462921391509265669/reviews?hl=zh-TW,5,True,76,套餐多樣化，有飯有餅有咖哩和鷹嘴豆...單點的咖哩則是份量較多，要另外加點烤餅來配。這次點了香料雞肉、風味羊肉......都好好吃!推薦!
 Louise Lin ,https://www.google.com/maps/contrib/106059246613563597750/reviews?hl=zh-TW,5,True,14,"一打開門看到靦腆的印度面孔店員以及撲鼻的香料味，就知道這間印度餐廳口味一定棒。
我點羊肉咖哩，羊肉濃香不腥而且非常軟嫩，原味烤餅嚼勁十足，再配上優酪乳，份量很夠。（我食量一般，有點太飽）建議多人一起享用會更方便分享食物。"
 Helen Chen ,https://www.google.com/maps/contrib/108358534131328615659/reviews?hl=zh-TW,5,True,49,個人套餐一次可以吃到多樣菜式，香料茶的糖是自己加，就不擔心喝到香料蜜，士林區有這樣優質的印度餐廳，很幸福～
 真誠實 ,https://www.google.com/maps/contrib/115227176954669699030/reviews?hl=zh-TW,3,True,96,"烤餅、乳酸雞、奶茶不錯，好吃。
能體會異國料理也符合台灣飲食。
其他就看個人啦！
價格小貴，但我是用團購券，
還能接受。

裝潢沿用之前的日本料理餐廳，
日式風情之下，聽著印度音樂，
享受印度料理，
那感覺還真不知道怎麼形容…

沙拉，不知道是出了什麼狀況，就是生菜加一點粉…"
 Hai man ,https://www.google.com/maps/contrib/104984428691124257118/reviews?hl=zh-TW,5,True,347,"這家位於德行西路的印度料理，非常的道地與美味，羊肉咖哩與鷹嘴豆咖哩都非常的好吃，搭配上甩餅只能說是絕配！
用餐時間最好還是提前預約，因為所有食材都是現場製作，因此需要耐心等待！"
 KO-JEN LI (LKJ) ,https://www.google.com/maps/contrib/115154138949114550315/reviews?hl=zh-TW,5,True,24,道地印度口味，好吃而且價格不貴，平均一個大人大概500～600就可以吃到很滿足又很飽。
 Judy Chill ,https://www.google.com/maps/contrib/116178434414067230815/reviews?hl=zh-TW,5,True,57,服務親切，餐點美味、食材好，非常地道的印度餐廳，環境非常帶有印度風味，會再帶朋友來享用這美味的印度料理👍
 Peishan Hsin ,https://www.google.com/maps/contrib/106733337644609610278/reviews?hl=zh-TW,5,False,20,香料咖喱羊香氣十足，乳酸碳烤雞肉質很嫩👍
 Evelyn ,https://www.google.com/maps/contrib/101197978719885950198/reviews?hl=zh-TW,5,False,11,"烤餅Q彈有嚼勁～很好吃！
今天吃的每樣都很推薦！
香料烤雞塊、風味咖哩羊、奶油雞～"
 chun ,https://www.google.com/maps/contrib/116524652358341532603/reviews?hl=zh-TW,4,True,28,相當有深度的咖喱濃郁香醇香料咖喱雞肉軟嫩味道十足套餐組合豐盛之前跑天母的印度料理現在芝山捷運走不到五分鐘而且價錢親民吃完馬上就想買料理包回家享用（需預訂隔天自取）
 人生就是要不停的吃 ,https://www.google.com/maps/contrib/114445266259781649241/reviews?hl=zh-TW,5,True,93,"店內環境整潔，用餐環境佳！洗手間也很乾淨！
在台中用過淇里思對比之下，價格差不多的情況下，泰姬客棧的份量多很多！

推薦香料咖哩味道都很不錯，美中不足就是羊肉不夠爛，不過調味很棒！

奶茶是無糖的，需要多少糖自己加，這點大推！吃過很多印度料理奶茶都甜死人
整體來說很滿意，獻上五顆星！"
 Karen Kao ,https://www.google.com/maps/contrib/102764948925585798369/reviews?hl=zh-TW,4,True,29,"平日中午來的，交通蠻方便的，捷運站走幾分鐘就到，一走進去店裡覺得有點熱，不知道有沒有開冷氣?
點了雞腿肉套餐和羊肉套餐(套餐會問要不要辣)+雞肉炒飯，四人吃蠻飽的，
烤餅餅皮Q彈沾咖哩醬蠻好吃的，雞腿肉有柴香味，印度甜點味道有點像小米粥，甜甜的很好吃，炒飯偏辣有點乾，印度奶茶香料味太重，喝不太習慣，回家有拉肚子
價位上來說有點高，另外有收10%服務費，服務生服務蠻好的，有不時來補水

我是在FunNow預定很方便又划算
下載FunNow，輸入我的優惠碼94S2D6C，還有優惠折扣喔!"
 Zoar Chuang ,https://www.google.com/maps/contrib/113613560337963212613/reviews?hl=zh-TW,5,True,442,"我的天啊
真是太好吃
聽店員推薦點餐就沒錯
羊肉末香料咖喱配餅
真是絕配"
 派大 ,https://www.google.com/maps/contrib/106266715151948128272/reviews?hl=zh-TW,5,True,149,德行西路上的印度餐廳，天母嚐了幾家印度餐廳，美味都在伯仲，但CP值亞瑟蘭略勝一籌。
 Momo ,https://www.google.com/maps/contrib/105604183311858619286/reviews?hl=zh-TW,5,True,57,"超愛印度料理的我發現新大陸♥今天第一次吃，點了香料咖哩雞＋原味炭烤餅，味道合我口味耶～我喜歡！吃每一口都有很多味道在嘴巴裡探索的感覺(美食評論家所謂的層次感?!)；烤餅熱熱的單吃就好好吃，淡淡的炭香味，配上咖喱⋯讓我又忘記拍照就吃光光了😅😅🧡💛🤎🤍

照片是在店裡等外帶時拍的，很有風格的店，期待疫情好轉帶朋友一起去內用。"
 符伯緯 ,https://www.google.com/maps/contrib/112036725716159501551/reviews?hl=zh-TW,5,True,74,"很少看到有賣個人套餐的印度料理
這樣的搭配是挺不錯的，整體味道也好
在我所吃過的印度餐廳中是最優的（踩過一堆印度雷店...）
整體四星，店長服務超好，補到五星"
 Hanabi Du ,https://www.google.com/maps/contrib/100312901317334592850/reviews?hl=zh-TW,5,False,9,雖然沒有什麼吃過印度料理，但我很推薦這間餐廳，基本上照片裡的餐點都相當好吃，尤其是火紅乳酸炭烤雞和印度烤餅，推推❤️
 Aruru Ding ,https://www.google.com/maps/contrib/113221230127227808324/reviews?hl=zh-TW,5,True,15,"老闆娘很熱情親切，點了白咖喱雞跟全麥馬鈴薯烤餅，不吃辣的很可以點，甜甜的很好吃，雖然份量多到吃不完😂
另外還有點烤雞，也很香很好吃❤️"
 Hiteru Jama ,https://www.google.com/maps/contrib/100910820907595748399/reviews?hl=zh-TW,5,True,414,不便宜但味道很香～建議點香料系列，其他有點普通尤其是海鮮，以這個價位主餐只有咖哩不付烤餅之類的有點可惜⋯
 Li Li ,https://www.google.com/maps/contrib/109319772301679054233/reviews?hl=zh-TW,5,False,1,第一次吃印度餐廳，滿滿的香料味，很特別，炭烤乳酸雞🐔蠻嫩的，好吃😋
 ChingTe Hsu ,https://www.google.com/maps/contrib/107517149687884814182/reviews?hl=zh-TW,5,True,52,"目前吃過大台北餐點最棒的餐廳
完全是印度高級餐廳水準
環境一般服務很親切"
 Chih Han Wang ,https://www.google.com/maps/contrib/108118697377508631117/reviews?hl=zh-TW,5,False,15,"真的太好吃了
這間店應該登上天母必吃餐廳
離芝山站很近
有個人套餐也有適合聚餐或過節的大菜
應該要被大力推薦的餐廳❤️❤️❤️
所有餐點份量都很足夠！
建議來吃的時候要離上一餐間隔時間久一點🤣
不然會像我們兩個大人吃不完⋯
其實我們沒有點很多
餅會很容易飽但又太好吃讓人停不下來！

餐點：
「印度奶茶」有一股香料味，不會過甜，很好喝，就是覺得有點小杯。
「奶油烤餅」「辣椒烤餅」完全不會膩，辣的也是香一點都不辣，餅超級有彈性，份量足夠，兩個人點兩份很飽！
「印度脆餅」很開胃，脆脆的充滿香料味，但不會過重。
「蔬菜優格」最令人驚艷！推到爆！絕對會為了這個優格特別再訪！還想問這個優格能不能外帶？味道覺得像酸奶，但沒那麼稠，不甜也不會酸到害怕，非常清爽真的很厲害！！
「開胃菜鷹嘴豆」很多口感，咖哩吃一半想換口味，就可以去去膩，跟酸奶一樣是我的必點！
「香料咖哩羊」份量真的很多，調味真的好好吃，有點辣，不能吃辣的建議點別的，肉塊很大，完全符合他的價錢，希望有機會把全品項都嚐過一遍！"
 H C ,https://www.google.com/maps/contrib/115279311521550889708/reviews?hl=zh-TW,5,True,107,"離捷運站蠻近的
羊肉串燒和想像中的不太一樣，搭配烤餅剛剛好
喜歡咖哩雞裡面的青椒味道搭配很好
店裡佈置的也很溫馨"
 邱馬 ,https://www.google.com/maps/contrib/110657332565299350377/reviews?hl=zh-TW,5,True,65,"簡單的說，就是平價版番紅花。平民的價格，家庭式的風格裝潢與餐具，但是口味一樣好吃。

交通位置也非常方便，捷運紅線淡水線芝山捷運站2號出口，走到德行西路左轉，大約5-8分鐘左右就可以走到。

前菜的薄餅，配上綠色的香料醬，辣辣的口感馬上不客氣的衝出來，非常的開胃好吃。

香料羊肉咖哩，非常印度式的濃醇香料，原諒嘴挫吃不出有哪些香料，只是單純感受到豐富的口感與香氣，加上帶有微微辣勁的尾韻，相當好吃😋。羊肉也處理的不錯，偶爾吃到幾塊帶點筋油的軟嫩部位，有種賺到的感覺。

點了兩種印度薄餅（Nan)，一個是原味，一個是全麥馬鈴薯。個人還是偏愛傳統的原味，QQ的口感，配上咖哩醬就是對味啊！

烤雞也有好幾種選擇，點了泰姫火紅乳酸碳烤雞半份。雞肉一送上了，就有股烤雞的香氣撲鼻。雞肉本身還有一些肉汁，但還是偏乾的口感多一些，但整體而言，是相當好吃的烤雞。如果4個人以上的話，可以考慮點一整份的烤雞，即使吃不完外帶還是很好吃的。"
 戥月謎夜 ,https://www.google.com/maps/contrib/102161060789786331321/reviews?hl=zh-TW,5,False,9,香料很香老闆很親切，是一個不錯的異國料理
 魏華萱 ,https://www.google.com/maps/contrib/116016071103452046936/reviews?hl=zh-TW,5,False,5,"這是我吃過最好吃的印度餐廳。
烤餅和羊肉咖哩讚讚讚😋"
 徐維尼 ,https://www.google.com/maps/contrib/116744627890832230000/reviews?hl=zh-TW,5,False,14,好吃、價格合理，推薦火紅乳酸碳烤雞、卡黛兒香料咖哩羊、蒜泥葫蘆巴烤餅
 徐家慧 ,https://www.google.com/maps/contrib/115282487368586313320/reviews?hl=zh-TW,5,False,10,很香很好吃，喜歡紅咖哩，烤雞也很棒！
 hsu stacy ,https://www.google.com/maps/contrib/109370066168446965976/reviews?hl=zh-TW,5,False,13,份量很夠，咖哩每項都好吃
 Huang-Chi Wu ,https://www.google.com/maps/contrib/102387099334020769754/reviews?hl=zh-TW,5,False,24,餐點非常美味，優酪乳甜中帶酸，非常喜歡印度料理的人真的可以試試！
 Lydia kee ,https://www.google.com/maps/contrib/114021942516414158005/reviews?hl=zh-TW,3,True,76,味道大不如前，讓人失望的！已經吃泰姬客棧好幾年了（現在改名了但應該還是同一個經營者），因為不便宜所以大概半年吃一次，每一次都點一樣的，每一次吃都可以得到大大的滿足感，但今天一上菜就覺得長得不太一樣，份量也變少（其實是少一點點而已是沒有很誇張），當下就立馬和前台反應，但前台阿姨沒有求證就直接否決我的疑問，說本來就是這樣的（態度沒有不好但並沒有積極處理），接著我一吃發現味道完全不對，異常的酸我甚至一度吃到懷疑是不是壞掉了…而且烤餅邊邊也變得乾乾的（以前是烤得均勻鬆軟的），但由於當下真的非常的餓，我還是將食物吃完，邊吃邊翻以前來吃這家時拍的照片，真的長的不一樣（結帳時給前台阿姨看，阿姨才去跟師父講）並反應味道的問題，因為當下廚房師父人在，所以師父有說不好意思可能是番茄放的比較多之類的解釋，這個理由我可以接受因為他們承認錯誤並且說會修正（師父已不同人，現在是新的師父），但我認為一餐$490（一人份咖哩和一人份烤餅）真的不算是便宜的餐點，前台也沒有對於這次的失誤有任何實質上的補償，只有請我跟廚房師傅反應味道是怎樣不同，讓人卻步下一次是否要再來消費，因為如果再花這樣的錢然後吃到這樣的味道，會生氣！
 Chien Po Sun ,https://www.google.com/maps/contrib/101656699022049311060/reviews?hl=zh-TW,5,True,19,店內播放著印度歌曲，邊吃著印度美食，挺不錯的，羊肉咖哩好吃！
 沙拉飯團 ,https://www.google.com/maps/contrib/105985716856226723286/reviews?hl=zh-TW,4,True,669,環境還可以，服務親切，餐點好吃，印度奶茶喝得有些不習慣外，是可以再訪的店
 Boris Lai ,https://www.google.com/maps/contrib/115542008710472391848/reviews?hl=zh-TW,5,True,137,第一次來試試必比登推薦的味道，點了兩個香料羊、風味雞兩種咖哩，建議價格接受的話可以點香料系列的咖哩，味道真的比較豐富
 WEI-AN CHEN (里長泊) ,https://www.google.com/maps/contrib/102596635228030502173/reviews?hl=zh-TW,5,True,27,超道地的口味，烤餅、咖哩都很值得品嚐。
 鄭晴之 ,https://www.google.com/maps/contrib/100414479286426734443/reviews?hl=zh-TW,5,True,96,"好吃！沒有太鹹的問題，口味溫和
上菜快速"
 Eating Cow ,https://www.google.com/maps/contrib/104941622672949238192/reviews?hl=zh-TW,5,True,18,"很道地好吃的印度料理
咖哩搭配蒜味烤餅必吃！！
烤雞非常嫩且入味
印度奶茶香料不會太重冬天來一杯超級適合～"
 Bjorn Andresen ,https://www.google.com/maps/contrib/109057783599084894977/reviews?hl=zh-TW,5,True,23,印度雞肉咖喱跟烤餅都非常棒，建議可以的話都用手抓來吃，在裡面用湯匙吃感覺會少了點味道，另外同行的友人不是很喜歡印度咖喱，在一起吃咖喱的時候感受到友人的不悅帶來的壓力，下次會帶喜歡印度咖喱的朋友再去吃一次。
 王騰鋒 ,https://www.google.com/maps/contrib/108799443152015556032/reviews?hl=zh-TW,5,True,344,"餐點非常好吃有特色，餐廳很溫暖。
咖哩味道很棒，加上手感餅配著吃，很喜歡。
麵餅Q彈有勁，推薦大家來嘗嘗。"
 Chanti Lo ,https://www.google.com/maps/contrib/102723506224981974145/reviews?hl=zh-TW,5,True,133,"吃一餐印度料理，闆娘先送上烤餅（酥脆香熱），陸續被主廚特調蔬菜湯（溫和、親切——有點台，哈！）、草本串燒烤雞、白色咖哩雞與原味烤餅（超推！筋性超棒、嚼起來很開心，但又不虐待牙齒。）款待得搖頭晃腦、滿足非常。

後上的咖哩餃，個頭屬「浩克級」，滿臉的馬鈴薯在酥酥外皮裡，飽到散步好久好久好久。哈！

和闆娘小聊，烤餅搭小米粥可能有趣，會像廣東粥的薄脆，闆娘聊起想推廣印度料理的心願。客氣、親切的服務，去試試吧！"
