user_name,user_profile_url,rating,local_guide,comment_num,comment_text
 Kiwy Ww ,https://www.google.com/maps/contrib/112439707330351136605/reviews?hl=zh-TW,4,True,281,"12月份跟同事一起訂飯

整體體驗不錯，醬燒杏包菇給的跟圖片一樣大塊，應該是有在看評論並進步的店家

但就我的便當來說，雖然跟圖片一樣，但吃起來是菜多肉少，建議大家點別的"
 陳恭平 ,https://www.google.com/maps/contrib/105829817327149888069/reviews?hl=zh-TW,4,False,3,90元的滷排骨飯、有小片香腸、蘿蔔乾、豆乾、高麗菜、胡瓜、豆棗，算是及格了，就便當來說。留下一顆空星，是為了能更進步，菜量可再佛心。
 陳瑞宏 ,https://www.google.com/maps/contrib/104873803532986146266/reviews?hl=zh-TW,1,False,5,想說沒吃過，試試看~結果很失望，我點是香酥大雞排，回家打開袋子就傻眼了，炸過頭了，都焦黑有焦味了…建議老闆下次有遇到，這種東西別給客人，寧可重做，告知客人稍等，絕對會比拿這種東西給客人好~還有配菜裡的炒蘿蔔，一樣有焦味~記得注意火侯控制~~做吃的失誤正常，但別為了怕丟掉浪費成本就一樣出餐，這樣損失會更大，希望下次再去，能夠變得更好~~
 Shih Yao Tang ,https://www.google.com/maps/contrib/111350691196520314310/reviews?hl=zh-TW,3,True,209,"整體外觀配色便當盒都不錯
茄子🍆小白菜🥬炒得好吃
其他就放生了…尤其卡拉鷄也太隨性都是粉"
 OP Chi ,https://www.google.com/maps/contrib/105166293466627245856/reviews?hl=zh-TW,5,True,223,"會議餐盒訂購此家～
料多實在好吃👍
會再回購"
 Wang Jason ,https://www.google.com/maps/contrib/101169771840218223869/reviews?hl=zh-TW,2,True,21,之前很常買這家便當，但最近買的雞排便當一個110，回家打開便當我真的不知道是在吃雞排還是在吃麵粉殼...，而且還很乾很鹹...，覺得已經沒有開始時買這家便當的信心感了...希望店家除了賺錢還是要顧到品質
 Antonio Jeng ,https://www.google.com/maps/contrib/102339752642532447389/reviews?hl=zh-TW,4,True,"1,053",看起來生意應該是很好，本來點古早味焢肉飯，他們說賣完，再換炸雞腿飯，也是賣完，只好換滷香排骨飯。等待期間，衹見Foodpanda外送人員不斷前來取餐，難怪會賣完。排骨較鹹，但下飯尚可。
 Griffin ,https://www.google.com/maps/contrib/111705085399331922820/reviews?hl=zh-TW,4,True,171,"先說結論，便當店戰區的亮眼新星，飯菜不錯反而主菜偏弱。
高麗菜炒得夠脆又甜，白飯本身可以。反倒是主菜很普通，泰式雞排的雞排很空洞。

CP值:★★★☆
美味:★★★★
環境:★★★★
服務:★★★☆
等候:★★★☆"
 jelly lo ,https://www.google.com/maps/contrib/109813143661812520315/reviews?hl=zh-TW,5,True,24,"Foodpanda外送的還是很好吃

滷排骨飯95

厚切豬排飯110
有附番茄醬豬排偏油咬起來口感紮實偏硬

附菜很多種每種便當都不一樣的附菜"
 0 0 ,https://www.google.com/maps/contrib/112981605897300646132/reviews?hl=zh-TW,4,False,31,餐點不錯啦...但希望外場弟弟能注意一下別太急躁我點個外帶還沒問什麼時候能取餐就直接掛斷是有多趕?
 Jyun Wang ,https://www.google.com/maps/contrib/101292496366194503218/reviews?hl=zh-TW,1,True,272,"外觀看起來還不錯
但整體來說有待改善
白飯偏乾硬不軟Q
配菜看起來多
實質上都是加工食品
而豆棗有異味跟常見味道差很多
另外鮭魚真的很乾
已經偏薄了還沒有汁水
感覺像是在吃魚乾
另外排骨就普通
雖然他已經在偏乾邊緣遊走
但幸好豬肉本身的油脂大大加分許多
唯一值得讚許的只有香腸
真的非常好吃
或許之後只會單點香腸了"
 Yen-Chung Chen ,https://www.google.com/maps/contrib/110163020637488913048/reviews?hl=zh-TW,4,True,178,內容相當豐富的便當盒，青菜與肉的份量均相當有料，可滿足地吃飽。可外送且地點方便，選擇也不少，可以嘗試看看。
 凱蘿 ,https://www.google.com/maps/contrib/107582823665003563380/reviews?hl=zh-TW,5,True,291,便當看起來小小薄薄的。裏面滿滿的三様配菜十豆干十魯蛋十辣蘿蔔十甜麵筋十一個主菜。每一口都有菜飯，吃起來超級満足也有飽足感。👍
 Ni H ,https://www.google.com/maps/contrib/111415377084838756535/reviews?hl=zh-TW,4,False,11,昨天吃滷雞腿便當很好吃，今天買了炸豬排便當，但是為什麼是給我番茄醬？豬排怎麼會是搭配番茄醬？真的昏倒..
 Sandy Dai ,https://www.google.com/maps/contrib/100899351039210285449/reviews?hl=zh-TW,1,False,2,品質不穩定，幾個禮拜前買過一次，味道還不錯，但這次再買，主菜和配菜都變得超鹹...而且明明買了3個相同主菜的便當，卻有一個配菜有少，專業度有待加強。
 林銓輝 ,https://www.google.com/maps/contrib/100704126312321878680/reviews?hl=zh-TW,1,False,2,外場都沒櫃檯人員叫了好幾次音樂還開很大聲然後出來也沒說不好意思等那麼久
 楊琳琳 ,https://www.google.com/maps/contrib/106372572341899259828/reviews?hl=zh-TW,5,False,71,拜託配菜可以不要是豆芽菜嗎？印象最深刻就是你們家曾經的配菜是絲瓜冬粉超美味
 Yo Yo ,https://www.google.com/maps/contrib/114847425443233442953/reviews?hl=zh-TW,1,False,13,"買了不少次，快吃完後發現飯裡面有鋼刷！
希望可以不要省鋼刷錢，脫落了該換就換，還好沒有吃下肚，再麻煩店家注意"
 黃美瑤 ,https://www.google.com/maps/contrib/104622327767147674726/reviews?hl=zh-TW,3,True,22,"剛剛熊貓外送來，滷雞腿便當看起來美味可口，可是這……杏鮑菇，只有瘦弱的四片，這麼貧乏的主菜，怎麼吃得歡🙃🙃😱有點氣
和圖片差太多了啦
然後菜也少放，另一種的還有青花菜（搖頭"
 angel chen ,https://www.google.com/maps/contrib/104478715890178389965/reviews?hl=zh-TW,2,False,22,等很久，超慢的，餐點也很普通，所以不太會再去買。
 Shun ,https://www.google.com/maps/contrib/103824543172896348950/reviews?hl=zh-TW,3,False,12,"特餐分量太少，價錢要110但吃不飽...
整體來說是好吃的"
 Lu Ekim ,https://www.google.com/maps/contrib/113475210944907128901/reviews?hl=zh-TW,3,True,59,"東西不錯吃，補上魚照片，這個厚度約店舖菜單照片的一半，也滿乾的
今天我自備外袋給店員，他說好，袋子放桌上，後來女店員還是用他們的袋子，我就把他們袋子還他們，女店員臉超臭，非常不爽把便當丟進我自備袋子
哈嘍，你們溝通問題，把脾氣出在客人身上對嗎？虧我還跟女店員說謝謝，一樣塞臉不吭聲"
 skyline ,https://www.google.com/maps/contrib/118268146670567968234/reviews?hl=zh-TW,3,False,9,之前常吃！不過最近的飯真的實在是太硬的⋯滷雞腿的肉質變差了⋯我只能安慰自己原物料上漲，所以店家要降成本⋯
 胖丁 ,https://www.google.com/maps/contrib/114225122360799455205/reviews?hl=zh-TW,5,False,6,很好吃！店面乾淨，份量足夠，主菜多選擇
 Joyce ,https://www.google.com/maps/contrib/115751390850679597428/reviews?hl=zh-TW,5,True,172,"出餐速度還算快，也感覺很衛生
可以使用街口支付！"
 chunhao Chow ,https://www.google.com/maps/contrib/110192107131585171128/reviews?hl=zh-TW,1,False,5,"提前30分鐘電話訂餐，取餐時等10分鐘
再告訴消費者雞腿賣完了。給一顆星都覺得多"
 陳品怡 ,https://www.google.com/maps/contrib/113255982504898288589/reviews?hl=zh-TW,1,False,1,"吃了很多次，店面很乾淨
唯一缺點是從櫃檯看鏡子or外面小窗口可看到內部人員在做餐點沒戴手套，真的是超級沒衛生，明明看到櫃檯小姐有戴手套，怎麼內部人員沒戴？做廚師都這樣不講求衛生？徒手抓主菜？有夠誇張
之前也有跟櫃檯小姐說，甚至打電話給店裡請店內注意
能理解店裡忙，但店內的衛生習慣有夠差
真的是看到櫃檯小姐誠心誠意的道歉，才去吃，以為有改進，當我經過買個便當，還是跟往常一樣，徒手抓主菜？？？？
超噁心，真的要再去吃，一定要深思熟慮"
 Isabel Chi ,https://www.google.com/maps/contrib/102025313660991031372/reviews?hl=zh-TW,5,True,86,"支持年輕人的店

蔥油雞，柳葉魚，焢肉，排骨
都很好吃。配菜也得宜。生意很好要排隊一下下"
 些許高 ,https://www.google.com/maps/contrib/104148277742638109167/reviews?hl=zh-TW,3,True,78,"買四個便當其中一個便當少了配菜不知道是不是沒放到還是那個本來就少一樣配菜
蔥油雞太鹹感覺是用海水醃出來的豆乾如其名真的很乾很硬很像放在空氣很久的感覺
但其他配菜跟主菜都滿不錯吃的配菜也很多樣
還是推薦可以來吃但不要點蔥油雞"
 Hsinyu Tsao ,https://www.google.com/maps/contrib/105277489326689430397/reviews?hl=zh-TW,1,True,191,買兩個便當等了20分鐘，等到天荒地老，建議下次要等很久應該要先告知客人！
 歐陽楓穎 ,https://www.google.com/maps/contrib/100640794414620351318/reviews?hl=zh-TW,1,False,9,爛透了100元的便當是三小
 吳宛儒 ,https://www.google.com/maps/contrib/109004243634396803807/reviews?hl=zh-TW,1,False,7,3/10晚上約七點半左右，我跟店家訂了今天3/14中午14個學生滷排便當，然，這天早上我們另外一個班的學生也跟店家訂了13個滷排便當，店家在沒有確認兩個班是否為同一張訂單的情況下，就只送13個滷排便當，也沒再次確認14個滷排便當還要不要，導致我的學生和老師嚴重影響上課秩序，希望店家的訂餐管理可再加強...
 IsaacMusic ,https://www.google.com/maps/contrib/111442267514272562442/reviews?hl=zh-TW,1,True,44,"2022.2月更新
最近退步非常多，排骨很柴
飯量越給越少，青菜是酸的
我知道有點打臉自己，但也想讓大家知道
有沒有持續用心在做，顧客都能感覺得到
不要把顧客當白癡
不會再推薦

我這次叫外送，點的是炸排骨便當、蝦捲便當和控肉便當
我對便當的要求非常高，很少店讓我能滿意
但是這家店讓我驚艷萬分
炸排骨和蝦捲炸得相當酥脆，控肉入口即化
配菜當中的蘿蔔乾分量有點太多
但相當好吃
是少數讓我印象深刻，會再訂購的便當。
極度推薦"
 Hsin-Ying Chiu ,https://www.google.com/maps/contrib/103879777866154281435/reviews?hl=zh-TW,1,True,66,"近期吃過最不合口味的便當🍱

飯偏硬，高麗菜是酸的，豆乾跟滷排超鹹，醬油放太多，滷雞腿🍗很柴。

外觀看起來乾淨的便當店，但便當內容物真的太不合格了🚫"
 白白 ,https://www.google.com/maps/contrib/105533047886127378873/reviews?hl=zh-TW,1,False,5,"便當蓋沒有用膠帶黏盒子已經變形也拿來用
結果就是蓋子一拿就脫落了
盒子又是油的整個便當直接翻掉：）
花100結果吃了一個寂寞希望下次改進：）"
 Allie H ,https://www.google.com/maps/contrib/103806855519085171408/reviews?hl=zh-TW,1,True,75,"訂便當居然說不能外送到醫院，要再問問看老闆
又不是要你們送進來，只是送到門口，我們再去拿而已！
如果每間便當店都都像你們這樣，請問醫護人員中午吃什麼？？？
比你們有良心又好吃的便當店很多，也不缺你們這間！
再說你們這麼怕的話，疫情沒有消失前麻煩都不要去醫院診所看醫生喔"
 Veronica妮卡 ,https://www.google.com/maps/contrib/111983246925744405372/reviews?hl=zh-TW,2,True,51,"110塊的蔥油雞便當，配菜是冷凍玉米，豆棗(紅紅甜甜的那個)跟香腸，豆干，滷蛋。
就已經不是很好的配菜了，豆棗還只給一條，香腸薄薄一片，豆干一塊。
是在哈摟?80塊就差不多了"
 Yuan De You ,https://www.google.com/maps/contrib/112106121147946478319/reviews?hl=zh-TW,3,True,96,東西還算可以，味道一般。。。就是點餐後，等待的時間至少十至十五分鐘，對於便當店來說，好像效率差了點。。不知道是不是生意太好了，還是怎麼樣。。。，他們就是讓所有人都這麼等著
 Annie Chou ,https://www.google.com/maps/contrib/102787374396777410151/reviews?hl=zh-TW,3,True,19,炸雞腿是吃過的便當中，有史以來最小一支的雞腿🍗，而且裡面完全沒味道，🍗骨頭都比肉大很多了，到底花錢買的是肉還是骨頭🍗?ubereats賣105元，這樣的水準80元都不值
 Shih Hsung Lin ,https://www.google.com/maps/contrib/110902367690461453174/reviews?hl=zh-TW,3,True,17,"配菜水煮冬粉，魯白菜，導致整個白飯濕的

滷雞腿都是雜毛，騷味重
給三星是因店面乾淨整潔"
 Lilly Chen ,https://www.google.com/maps/contrib/109467307918808766889/reviews?hl=zh-TW,4,False,17,"第一次買，點的是Ubereats

1.整體來說不錯，喜歡的部分是配菜有兩樣不同的新鮮蔬菜（茄子跟青菜），不會像有一些便當店把冷凍三色豆當一道配菜

2.另有許多不同的小配菜像是香腸菜脯油豆腐滷蛋有加分

3.今天美中不足的是排骨靠骨頭處沒炸熟，導致少吃了兩口肉，沒吃飽，有點小可惜，希望下次可以多加注意"
 林芳色 ,https://www.google.com/maps/contrib/104127207220128776745/reviews?hl=zh-TW,1,True,45,"我想前面排隊的阿嬤為什麼說飯多，所以跟著說飯多，回家一看還好有說飯多，不然還會不夠吃。
主菜滷雞腿，僅此一次。照片提供的相片飯菜並非購買相片，放棄提供建議。"
 俐妤 ,https://www.google.com/maps/contrib/103765831737884194822/reviews?hl=zh-TW,1,False,4,誇張。熊貓11:30叫到12:40外送員才告知店家漏單，沒有做到我的單。訂單延長到13:00才送。訂單大我可以理解，但是如果怕會做不出來就請不要開放接單。搞得我老公沒吃到飯就要去上班。難得叫熊貓就碰到這種事!!
 Angerie Teddler ,https://www.google.com/maps/contrib/109038869142830363571/reviews?hl=zh-TW,2,False,9,"雖然蠻精緻的
但是份量少到靠北、男生建議一次買兩個才會飽
然後今天買的配菜完全沒有蔬菜類、真是省"
 林二姐 ,https://www.google.com/maps/contrib/113747683289120954219/reviews?hl=zh-TW,4,False,19,試過2種便當，味道還不錯，會繼續嚐試其它種類便當。
 張閎棋 ,https://www.google.com/maps/contrib/117106177458717239611/reviews?hl=zh-TW,5,False,4,"菜色、價格親民，健康乾淨便當
適合附近住家公司長期當午餐晚餐的方便選項"
 co co ,https://www.google.com/maps/contrib/116830275616279815803/reviews?hl=zh-TW,1,True,21,櫃檯有個胖阿姨很沒禮貌，第一次遇到叫人取餐用手拍桌的(連續拍5聲超大聲拍完自己還在跟裡面的男同事嘻笑?)戴口罩麻煩講話大聲一點，這種店家的態度，連靠近都不想!一顆星都不想給有夠沒品!
 儕宗 ,https://www.google.com/maps/contrib/103446647589726977948/reviews?hl=zh-TW,1,False,6,"3/11晚間訂了3/12午餐便當，時間是13：45到達，我這邊等到13：28才顯示訂單取消,我就是因為那段時間沒有空才提早預定，我不就訂三個便當一隻魚而已，你們難道無法判斷那時候做不做的來，提早把我單取消就算了，我還能提早想辦法，沒人像你們這樣營業的，不是平台按取消就沒事不用面對客人，你影響的是我們幾個人的一天生活，而不是一餐，除了憤怒，我也希望其他買家看清。"
 和平 ,https://www.google.com/maps/contrib/106475861796479526905/reviews?hl=zh-TW,1,False,10,點個外送等半天！都只先做先場客人！以後不會在點了
 林Eva ,https://www.google.com/maps/contrib/104035501089910956468/reviews?hl=zh-TW,1,False,6,便當比預計的時間晚一個小時。店家説因為有另一個大訂單，所以會晚一點。這實在是太不專業了
 爵士鼓視界ANNIE周佳蓁 ,https://www.google.com/maps/contrib/108421207431238474745/reviews?hl=zh-TW,5,True,36,"好吃
雖然先點現做
等的時間有點久了
但是好吃，值得等待"
 袁宇彤 ,https://www.google.com/maps/contrib/106464707114106270794/reviews?hl=zh-TW,1,False,6,漲價菜量還減少滷蛋也一直只有一半這樣要100多以上
 Andy Lee ,https://www.google.com/maps/contrib/115358722879439802951/reviews?hl=zh-TW,3,True,22,本來吃便當還覺得不錯，喝到凍檸茶簡直傻眼，還以為是做錯跑回去跟店家確認，認真覺得如果只是為了多增加飲料品項的話不如不要做⋯完全滅了想吃這家便當的慾望
 B Lin ,https://www.google.com/maps/contrib/108021327433979567587/reviews?hl=zh-TW,1,True,127,"千萬不要用foodpand單點香腸
兩隻相加不到平常一支香腸長度
賣45
盤又超普"
 許塵 ,https://www.google.com/maps/contrib/105702161405280927982/reviews?hl=zh-TW,3,True,151,買了厚切豬排及勁辣雞排，手藝普通不難吃，但價錢有一點點對不起價值，所以只能給3星，其實是2.5星
 莊世凱 ,https://www.google.com/maps/contrib/105929401046480069484/reviews?hl=zh-TW,1,False,1,"近幾日去吃，疑似發現櫃檯愛笑小妹不見
去現場買，發現現在的效率，沒有比以前櫃檯小妹勤快，整體效率變差👎👎👎
以前動作快狠準，看到都嚇到"
 Jenny C ,https://www.google.com/maps/contrib/101572588155405340623/reviews?hl=zh-TW,1,True,71,滷雞腿滷的真新鮮，都還血淋淋的呢
 蔡樂天 ,https://www.google.com/maps/contrib/101122647678864827245/reviews?hl=zh-TW,4,True,440,口味不錯，但飯有點少
 Sonia Chang ,https://www.google.com/maps/contrib/112252483441712514642/reviews?hl=zh-TW,4,False,2,"今天訂了便當
很準時送來
便當整體乾乾淨淨
吃起來口味也剛好
不過魯排骨看起來
乾乾的感覺只有炸過沒有魯汁"
 蕭永凱 ,https://www.google.com/maps/contrib/110633658155564707977/reviews?hl=zh-TW,5,False,1,"很愛吃你們家的便當😋菜色相當豐富，店面整潔又乾淨，出餐速度也很快👍
櫃檯妹妹可愛又漂亮，服務態度佳💯，都可以天天吃了"
 我厭世 ,https://www.google.com/maps/contrib/113704401306896015785/reviews?hl=zh-TW,5,False,3,雖然沒有座位，但又清潔衛生好吃，加上最近疫情的關係，很適合外帶回家吃。
 寶寶寶 ,https://www.google.com/maps/contrib/109946846136403971039/reviews?hl=zh-TW,5,False,1,"餐店現做口味喜歡
店面乾淨漂亮
回購多次家人也都愛吃"
 Binson Shea ,https://www.google.com/maps/contrib/108363933102607205074/reviews?hl=zh-TW,5,True,80,菜色漂亮，不錯吃，生意很好
 Jerry Ou ,https://www.google.com/maps/contrib/100393313939220710145/reviews?hl=zh-TW,4,True,139,年青人新開的店，專做外帶，食物算清爽，口味不過重，生意很好。
 hong Yoo ,https://www.google.com/maps/contrib/106745661972516589928/reviews?hl=zh-TW,5,True,35,公司訂的午餐~好吃很難得吃到可以讓我驚豔美味的便當
 陳楷翔 ,https://www.google.com/maps/contrib/112944328143490428856/reviews?hl=zh-TW,1,False,17,"Google上面寫8:30結束營業
還不到8:00就關門是怎樣
店員都在趕早退？"
 謝小七 ,https://www.google.com/maps/contrib/101538530813310457934/reviews?hl=zh-TW,5,False,4,"餐點好吃不貴
重點是人員都超親切貼心的
超級大推"
 黃穗姍 ,https://www.google.com/maps/contrib/117640470393028864557/reviews?hl=zh-TW,5,False,4,東西好吃效率快現在的櫃檯比那個之前的妹妹還親切💯
 江慎 ,https://www.google.com/maps/contrib/115188178666134523530/reviews?hl=zh-TW,5,False,1,"環境乾淨配菜多樣豐富
雞排、黑毛豬好吃！"
 ChiZong Wang ,https://www.google.com/maps/contrib/101741876662928057050/reviews?hl=zh-TW,1,False,14,外送整整晚了一小時，只是因為接了另一擹比我們更大擹的，非常糟糕的經驗
 詠詠 ,https://www.google.com/maps/contrib/115448448976209444862/reviews?hl=zh-TW,5,False,2,便當豐富菜色都不一樣每天都有不一樣的感覺爆推
 Vivian Weng ,https://www.google.com/maps/contrib/111348098104013427901/reviews?hl=zh-TW,5,False,6,香檸雞和排骨是最愛，主菜選擇性多；配菜也豐富；飲料也好喝
 董昕 ,https://www.google.com/maps/contrib/108003145504904724255/reviews?hl=zh-TW,5,False,1,餐點美味，不僅經濟實惠員工服務客人的態度更是親切，值得再訪。
 Lucas Fang ,https://www.google.com/maps/contrib/101693087462389724625/reviews?hl=zh-TW,5,True,805,餐點很多種選擇、品質有一定的水準!!好吃!!
 林進 ,https://www.google.com/maps/contrib/115298994439013787070/reviews?hl=zh-TW,1,False,5,等餐態度很差
 雷門邪門尹（邪門） ,https://www.google.com/maps/contrib/115430008599406959269/reviews?hl=zh-TW,5,False,3,菜色多樣，餐點美味好吃，環境衛生整潔，價格還可接受。
 Evan Huang ,https://www.google.com/maps/contrib/113878721477858714814/reviews?hl=zh-TW,5,True,204,好吃可是希望是熱的因為有時會吃到涼掉的
 李振維 ,https://www.google.com/maps/contrib/105898809915061994960/reviews?hl=zh-TW,5,False,1,外送人員帥氣又客氣很準時東西很好吃👍🏻
 Tony liu ,https://www.google.com/maps/contrib/101137694369410766413/reviews?hl=zh-TW,4,True,249,整體上不錯，只是口味較重但也是為了配合大多數的客戶
 楊朝景 ,https://www.google.com/maps/contrib/111493342216846250412/reviews?hl=zh-TW,5,True,203,清爽料理便當，菜色樣式很多樣化。
 una ,https://www.google.com/maps/contrib/113475554349387591242/reviews?hl=zh-TW,5,False,5,這個價格菜色多特別愛高麗菜份量很多
 億通 ,https://www.google.com/maps/contrib/100151944335019447620/reviews?hl=zh-TW,5,False,7,扯終於星期天也有開好吃便當店真的爽
 高慧倚 ,https://www.google.com/maps/contrib/101701141113316190487/reviews?hl=zh-TW,4,False,7,東西不錯吃，只是有時候吃完會肚子痛。
 Fang Wayne ,https://www.google.com/maps/contrib/105017955927022400606/reviews?hl=zh-TW,1,False,46,才一種蔬菜其他是豆皮冬粉.....很差
 杜義良 ,https://www.google.com/maps/contrib/104556000872774673162/reviews?hl=zh-TW,2,True,41,停車不方便-各人認為菜色平平-
 小曹 ,https://www.google.com/maps/contrib/108609466920148477156/reviews?hl=zh-TW,5,False,6,非常好吃😋。外送也很準時。大推👍👍
 Wenhsiung Tsou ,https://www.google.com/maps/contrib/103420718572000978575/reviews?hl=zh-TW,1,False,7,有夠鹹
 陳品韌 ,https://www.google.com/maps/contrib/105899225443554662103/reviews?hl=zh-TW,1,False,5,廚房衛生環境髒亂你敢吃?
 陳尚惇 ,https://www.google.com/maps/contrib/112757646412748098322/reviews?hl=zh-TW,5,True,90,午餐方便購買的地方
 安安 ,https://www.google.com/maps/contrib/103334290962003213081/reviews?hl=zh-TW,5,False,1,好吃，量多，住天母和士林有福了，平價便當
 Eason Chen ,https://www.google.com/maps/contrib/102005784865306110380/reviews?hl=zh-TW,5,True,63,便當很好吃
 ivanddv ,https://www.google.com/maps/contrib/108842658278211386279/reviews?hl=zh-TW,1,True,98,態度很差，愛理不理
 屁桃 ,https://www.google.com/maps/contrib/108766467041457850198/reviews?hl=zh-TW,5,False,1,便當好吃每天固定買推
 可撥仔 ,https://www.google.com/maps/contrib/115585648032226157290/reviews?hl=zh-TW,5,False,3,真的好吃下次帶朋友來吃
 Xin yi Chen ,https://www.google.com/maps/contrib/118150261555935360913/reviews?hl=zh-TW,3,False,17,圓形狀的紙碗便當盒很喜歡~
 陳虹汝 ,https://www.google.com/maps/contrib/107005570947401898516/reviews?hl=zh-TW,5,True,61,不錯吃份量算多
 啊翰陳 ,https://www.google.com/maps/contrib/106349188281709919924/reviews?hl=zh-TW,5,False,6,櫃檯妹妹很可愛便當很好吃
 江誠 ,https://www.google.com/maps/contrib/104627942592369613205/reviews?hl=zh-TW,5,False,1,主菜多樣化鯖魚很大塊推薦
 小汪 ,https://www.google.com/maps/contrib/102909172507494044378/reviews?hl=zh-TW,5,False,1,真的好吃人都很好很親切
 劉昌威 ,https://www.google.com/maps/contrib/107515235180106219197/reviews?hl=zh-TW,5,True,27,我覺得不錯吃欸！
 YangHung Chang ,https://www.google.com/maps/contrib/113632058573130914732/reviews?hl=zh-TW,5,True,411,出餐快速，餐點好吃
 boi cozy ,https://www.google.com/maps/contrib/106470332756597782277/reviews?hl=zh-TW,1,False,6,難吃
 林麗華 ,https://www.google.com/maps/contrib/117599734942049861910/reviews?hl=zh-TW,5,False,1,東西•好吃美味
 簡美美 ,https://www.google.com/maps/contrib/110904259640142060671/reviews?hl=zh-TW,3,False,154,新開便當店
 Kan-Yuan Li ,https://www.google.com/maps/contrib/105179609236513738904/reviews?hl=zh-TW,1,False,6,外送大遲到
 Eric Lu ,https://www.google.com/maps/contrib/115051078737146241391/reviews?hl=zh-TW,5,True,569,天母便當no1
