user_name,user_profile_url,rating,local_guide,comment_num,comment_text
 Aurora Chen ,https://www.google.com/maps/contrib/105386362612970141863/reviews?hl=zh-TW,4,False,5,鵝肉好吃，可以去骨，腿的部位油脂豐富，但不會很難咬或咬不動（180元），油豆腐、燙青菜也不錯，乾麵就普通，整體評價算不錯
 Jeep Loopy ,https://www.google.com/maps/contrib/100937027845293719519/reviews?hl=zh-TW,5,True,272,"鵝肉很棒！！！！！
其他小菜也很出色
記得一定要去櫃檯那邊
裝辣椒醬油
沾這個才好吃！！！"
 泰瑞叔叔 ,https://www.google.com/maps/contrib/106766740699439689714/reviews?hl=zh-TW,3,True,53,"鵝肉：很軟Q、多汁超好吃
魯肉飯：偏乾、偏瘦
餛飩湯：湯好喝但餛飩餡量少表現一般，餛飩皮是有嚼勁的"
 Jay Cheng ,https://www.google.com/maps/contrib/114285358593593428478/reviews?hl=zh-TW,2,True,175,鵝肉麵又小又貴，五塊小到不行還帶骨的肉要70，別家鵝肉便當鋪滿去骨肉加三樣菜才100，難道你們是麵在貴？燙青菜量也少的可憐，切盤倒是新鮮不錯吃
 EVA EVA ,https://www.google.com/maps/contrib/108551730786771906851/reviews?hl=zh-TW,4,True,295,吃宵夜，鵝肉賣完了，油豆腐很好吃～其他餐點也不錯
 開心小龍 ,https://www.google.com/maps/contrib/103221933868002983434/reviews?hl=zh-TW,5,True,73,大老闆小老闆人都很有禮貌.我最愛吃他們的下水湯和板條湯乾意麵
 蔡瓊儀 ,https://www.google.com/maps/contrib/118312594221587827853/reviews?hl=zh-TW,4,True,25,"大推鵝肉.油豆腐和乾意麵。
男老闆推薦一人份原味鵝肉150元，去骨，鵝肉不乾柴，算是吃過第一名的鵝肉！！
健康的人可以告知店家不加味素喔！"
 Miss Tseng ,https://www.google.com/maps/contrib/102434158645289953690/reviews?hl=zh-TW,3,False,15,"餐點好吃，但是冷氣32度，邊吃邊流汗，等於沒開。
隔板放在桌子最旁邊，沒確實區隔，不知放隔板有何意義"
 寶寶 ,https://www.google.com/maps/contrib/105717244264431084996/reviews?hl=zh-TW,5,False,10,"位於通化街夜市旁巷子內（57巷3號）好懷念的滋味，所有加分點是肉真的鮮又甜，足見老闆老闆娘的專業功夫真的不是蓋的，連最普遍的燙青菜都能美味可口，鵝肉相關菜餚搭上老闆精選的配料沾醬(╯▽╰)╭♥╮，讓我們這幾位姐妹淘除了叫了滿滿一桌吃光光，更是各加外帶要購買回去給自己的家人品嚐，好東西是一定要和最親密的家人分享的。
約好了下次姐妹聚會一定抽空再來
#真的太好吃了"
 བཀྲ་ཤིས་བདེ་ལེགས། ,https://www.google.com/maps/contrib/110365289734484500288/reviews?hl=zh-TW,3,True,486,自從那次店內用餐看到....後，就沒再來過，今天2021.07.17老婆忘了那次，買不到鴨跑來買鵝，東西還是可以的。
 E P ,https://www.google.com/maps/contrib/104040092296549377543/reviews?hl=zh-TW,3,True,271,"位於臨江街夜市的隔壁小巷，餐廳座位算多的，一進門就看到好多鵝肉，有兩種口味可以選，煙燻的，鹹水的，原本說要切一份鵝肉來配麵吃，但是老闆說沒有所謂的一份，都是秤重的，所以感覺一份要不少錢，於是選了一塊來秤重，一秤之下老闆說180，我並沒有看到磅秤的刻度，所以只能相信老闆自己喊的價格，原本不想花這麼多錢的，有一點趕鴨子上架的感覺。

上菜之後，鵝肉相當好吃，份量也多，鵝胗也很脆，好吃，清湯也很鮮美，下次來可能會點麵與飯或湯就好，鵝肉還是等有錢再來吃吧

既然要秤重來算錢，一兩25元，建議將秤鵝肉的磅秤面對客人，讓客人也看的到買了幾兩重的鵝肉，不然這種算法，永遠都有爭議，或許老闆會少算錢給客人多一點肉，其實也可以讓客人知道，到底是誰佔了便宜"
 羅元佑 ,https://www.google.com/maps/contrib/113651059074227368596/reviews?hl=zh-TW,4,True,391,"還算不錯的鵝肉料理小店，鵝肉有煙燻跟原味兩種，一盤350元大約3人份，價格偏高，好吃但沒特別驚豔，不過鵝肉本來就不便宜所以還行；魯肉意麵雖然只是簡簡單單的一碗乾麵，但肉燥香、麵的口感也還不錯，拌一拌味道可以配合得很融洽，算是樸實的小美食。
其實開在這邊應該算平價，口味在平均水準之上，所以顧客頗多，用餐環境也還OK，用餐時間店內頗忙，但出餐算快，因鵝肉單價高，如果想切鵝肉嚐嚐，比較適合多點人聚會才方便分食。"
 傲嬌貓 ,https://www.google.com/maps/contrib/117629614543036277278/reviews?hl=zh-TW,4,True,440,"買很多年算是熟客
有時候想吃的時候一個禮拜會去3、4次！
這家鵝肉肉質很好懂吃的人就知道跟X城鵝肉完全是不一樣的肉質跟口感
這家鵝肉池原味做的很好
煙燻的我覺得X城鵝肉略勝一籌
少一顆星是因為我覺得有時候老闆其實有點亂算錢哈
如果他們不忙的時候去你會發現如果每次你都點一樣的部位差不多的大小有時候價格差異可以多50元或是少50
不忙的時候我覺得他們鵝肉會給稍微多一點
一方面因為我一直都點同部位所以發現了這點哈
老闆店面沒有什麼服務就是很傳統的小店
辣椒醬油很香
如果點麵食類不要豆芽菜要確定的講很多次因為老闆娘很粗心大意而且一直顧著講話玩手機
不過換成別的青菜例如大陸妹就只有兩小根還滿小氣的我覺得～
鵝胗可以說是又脆口又好吃照片中點整顆的有時候價位會超過100多還滿貴的
鵝翅一隻$50也是小貴"
 Tommy ,https://www.google.com/maps/contrib/111204314645120534398/reviews?hl=zh-TW,3,True,"2,565","乾意麵使用瘦肉燥扮上一點油膏,意麵沒有很意麵,老店頭的乾意麵比較好吃,鵝肉以兩記價,點了八十元,本身是煙燻的,味道足,下水湯清爽,料不多就是"
 Emma ,https://www.google.com/maps/contrib/102203137704592839273/reviews?hl=zh-TW,3,True,"1,048",很推薦鵝肉是煙燻的肉質鮮嫩又可以挑骨頭
 Jimmy Lin ,https://www.google.com/maps/contrib/105968761997776868340/reviews?hl=zh-TW,5,True,149,"不知道這價格的鵝肉是便宜還貴
但是東西都不錯吃
有機會會再吃"
 陳偉熏 ,https://www.google.com/maps/contrib/102928177554610204466/reviews?hl=zh-TW,1,True,56,"菜單的價格跟收費不一樣，想多賺客人錢，菜單價格也改一下，
沒特色，只是臨江夜市沒東西吃。"
 Dorothy H ,https://www.google.com/maps/contrib/109988027880616549203/reviews?hl=zh-TW,4,True,108,鵝肉$160真的滿貴，但是好吃的。餛飩湯很油不行
 隨風而去隨風流 ,https://www.google.com/maps/contrib/113108796955817499599/reviews?hl=zh-TW,2,True,318,"一碗乾麵，一盤小菜，額外再加一碗湯沒味道的湯意麵，嗯，口味就一般般。

可能看起來就是平民，沒得到基本笑容。

看到老闆玩他家的狗狗後，又煮起麵來，嗯，我覺得不舒服。"
 胡喬涵 ,https://www.google.com/maps/contrib/108780032142106356880/reviews?hl=zh-TW,1,False,1,"根本是態度不好又貴的黑店!貢丸冬粉一碗70~
然後貢丸湯30~~你們家冬粉什麼做的壓?(單點冬粉也才35)
拒絕再來難怪經過都沒客人"
 Joanne Hsu ,https://www.google.com/maps/contrib/112029097252460201353/reviews?hl=zh-TW,3,True,987,湯意麵口味不錯，喜歡他們燙青菜和油豆腐的調味；之前吃過燻鵝肉和燙花枝也不錯。來總會點上一碗滷肉飯，但因為常來，曾經在滷肉裡發現一隻小強，老闆娘還硬說是油蔥，扣一大顆星！但是老闆和小姐老闆是還不錯的。
 Hinnamnor Hung ,https://www.google.com/maps/contrib/101727229587614901439/reviews?hl=zh-TW,3,True,69,"如果住附近想吃飯算可以吃，今天吃到的菜色都普普
招牌鵝肉沒吃所以無法太公正評斷鵝肉好不好，鵝肝可以蒜蓉醬更加出色"
 阿德ㄧ肥仔商行 ,https://www.google.com/maps/contrib/114233497173487726329/reviews?hl=zh-TW,5,True,50,"好吃連我一歲會挑食的女鵝一口接著一口的吃著滷肉飯開心
推推"
 Emerald Lee ,https://www.google.com/maps/contrib/111143481715475174686/reviews?hl=zh-TW,4,True,111,"好吃便宜，透抽很甜，狗狗很可愛，老闆人蠻好的
但鵝肉有點太肥，不知道能不能調整挑部位"
 Kyle Hung ,https://www.google.com/maps/contrib/106109566612555290283/reviews?hl=zh-TW,5,False,2,"從小吃到大，
想吃鵝肉，捨鵝肉池其誰！
必吃鵝肉鵝胗還有乾麵❤️"
 Peggy ,https://www.google.com/maps/contrib/113491368544739637209/reviews?hl=zh-TW,5,True,103,"鵝肉超好吃！
也推薦油豆腐跟乾麵👍🏻"
 Fat neet ,https://www.google.com/maps/contrib/112229914132007432848/reviews?hl=zh-TW,5,False,8,幹超好吃沒吃過那麼好吃的鵝肉
 C F ,https://www.google.com/maps/contrib/117799831551518525607/reviews?hl=zh-TW,1,True,33,"老鼠超大支,
漲價菜單也沒更新結帳直接傻眼
鵝肉麵裡面只有三塊碎肉這樣能收100?"
 利斑斑 ,https://www.google.com/maps/contrib/117380568399527304291/reviews?hl=zh-TW,1,False,5,買了一份大陸妹燙青菜打開只有5片葉還賣40元
 YU CHANG ,https://www.google.com/maps/contrib/100033484721632333338/reviews?hl=zh-TW,3,True,34,好吃五星，價錢上一星(算錢切多切少都是看老闆心情)，綜合評價三星，老闆也一點也不在意，每次吃都讓人期待又怕受傷害，但還是必須說好吃。
 馬兆正 ,https://www.google.com/maps/contrib/112932750087743662051/reviews?hl=zh-TW,3,True,44,"鵝肉稍微偏乾，醬汁過鹹~
我比較推薦饒河夜市旁邊的阿池鵝肉。"
 張伸一 ,https://www.google.com/maps/contrib/102659042508400791701/reviews?hl=zh-TW,4,False,4,香甜軟嫩吃鵝肉的第一選擇。老闆、老闆娘都親切，疫情好像對生意沒影響。因為都是附近的老主顧，外帶的較多。
 Andy Tsai ,https://www.google.com/maps/contrib/102385307319313910257/reviews?hl=zh-TW,3,True,218,在地料理，外食足的好選擇，意麵，下水湯，透抽
 Sylvia Wang ,https://www.google.com/maps/contrib/112128385270921181993/reviews?hl=zh-TW,5,True,208,一個人來大推鵝肉麵，有鵝肉有麵，價錢也合理，湯好好喝，可以加湯
 m M ,https://www.google.com/maps/contrib/101287341221806054250/reviews?hl=zh-TW,2,False,24,兩顆星是給在煮東西的歐巴桑態度不知道在不爽什麼完全不理做好後收錢也不說謝謝
 徐徐 ,https://www.google.com/maps/contrib/112663632615071574740/reviews?hl=zh-TW,5,True,74,"好吃的湯意麵跟無敵的鵝肉，其他的小菜也是只有一個字""讚""，吃了超過20年了"
 Mark Chen ,https://www.google.com/maps/contrib/116271005546056907243/reviews?hl=zh-TW,1,False,6,"不老實的店家，結帳老闆才說他多切鵝肉小菜。鵝肉切250結帳收380，小菜我只要點原價老闆直接切雙倍，結帳才說。
250除以2也才125，多出130是鵝肉重量誤差嗎？"
 C.P. Lu ,https://www.google.com/maps/contrib/109399290117821041907/reviews?hl=zh-TW,4,True,111,通化夜市附近唯一一家鵝肉
 Mark Lin ,https://www.google.com/maps/contrib/108286484300858861942/reviews?hl=zh-TW,3,True,116,鵝肉是真的不錯吃可惜點了背部太肥肉太少都是皮一人份150他們的主食太弱很簡約沒啥味道的擔仔麵建議不要點主食買鵝胸肉就好
 劉賢德 ,https://www.google.com/maps/contrib/117934219475656508588/reviews?hl=zh-TW,4,True,183,在臨江市場裡面的老店，鵝肉一兩25元，煙燻的好吃，或許白斬的也不錯（因為我沒有點）。可以搭配米粉、麵等，還有豆腐、燙青菜，蠻實惠的。
 Jessica B.H Yui ,https://www.google.com/maps/contrib/106745868178921796513/reviews?hl=zh-TW,3,True,179,老實說，東西沒有很好吃，鵝肉油多不入味。雖然可以自己選部位，但是卻一定要當下整塊大小一起買。鵝胗是軟爛的口感，失望
 松雲琦夫 ,https://www.google.com/maps/contrib/115704226488790726460/reviews?hl=zh-TW,4,True,41,"鹽水或煙燻鵝肉都好吃，肉質不硬不乾柴，飽含肉汁很juice,每三四天總會來吃一次，喜歡吃軟嫩QQ，吃來不費勁的部位特推鵝背部位，約150-~180元，非常好吃的巷子口鵝肉店。"
 楊世杰 ,https://www.google.com/maps/contrib/116998379869834847035/reviews?hl=zh-TW,1,False,5,"老闆講話很大聲，很喜歡講政治！
我有兩支點油豆腐都忘記拿給我，（東西雖然好吃,經營的態度有待改進）"
 劉宗哲（研次方生技） ,https://www.google.com/maps/contrib/116538162317249159978/reviews?hl=zh-TW,5,False,47,晚上快十一點去，老闆原本態度很不好，後來我吃了第一口我就被征服了，後來和老闆聊天才知道，他就是那樣的人，老實人啦，口味真的很棒，CP值很高，我成主顧了！吃了鵝肉切盤，鵝腸湯和鵝肝，都很棒，鵝肉不材，也不油，鵝肝不乾，爽度足，鵝腸脆湯頭好，完美！！
 徐克儀 ,https://www.google.com/maps/contrib/116347836732987612471/reviews?hl=zh-TW,1,False,13,"看了很多負評我也要來說說自己的經驗
超級不推薦老闆脾氣很差之前買翅膀只是隨口說了阿城鵝肉的賣價（沒有不要買只是提起口氣平順）老闆瞬間變臉直說不可能一直碎唸......不想賣東西就算了沒有必要對上門的客人這種態度要買東西還要受氣？
東西再怎麼好吃也不會想光顧"
 黃貞瑩 ,https://www.google.com/maps/contrib/102258670915302847832/reviews?hl=zh-TW,5,False,1,"真的超級好吃‼️
覺得說貴的人是不知道鵝肉的行情吧
透抽很新鮮
每樣食材都很實在
偶爾去都會看到藝人喔❤️"
 Jane Huang ,https://www.google.com/maps/contrib/117512414946217929317/reviews?hl=zh-TW,1,True,5,"態度差環境髒
問個東西嘰嘰歪歪的
很屌一樣
直接跟你說愛買不買不買滾蛋屌"
 H.Y. Lin ,https://www.google.com/maps/contrib/106028503054308540376/reviews?hl=zh-TW,3,False,17,鵝肉價格偏貴、美濃粿條吃起來跟正宗的美濃粿條不太一樣捏。吃慣寧夏夜市附近2家鵝肉老店（雙連鵝肉小館、雙連鵝肉莊）這家就普通偏貴而已。
 蘇哲緯 ,https://www.google.com/maps/contrib/109277036411178936126/reviews?hl=zh-TW,5,True,20,"鵝肝沒有腥味～鵝血糕超Q不軟爛！！
我好喜歡！！！！"
 Brian Ray Yang ,https://www.google.com/maps/contrib/115947731985817807800/reviews?hl=zh-TW,1,False,3,先買了報價220的鵝肉覺得少，想再加一些，報了160，最後跟我要390。坑錢黑店。另外去骨很多肉，都沒放進盒子。感覺糟糕。
 Crystal Chang ,https://www.google.com/maps/contrib/116858995775170141520/reviews?hl=zh-TW,1,False,31,沒見過這麼兇的小吃店老闆，跟客人在店裡大小聲，全台北市不是只有你一家賣鵝肉，完全不懂以和為貴的生意之道。東西沒有好吃到非吃不可，價格表示不明，隨店喊價，完全不推薦❌
 梨明 ,https://www.google.com/maps/contrib/104519302077636887109/reviews?hl=zh-TW,3,True,109,"東西是真的好吃，但小菜常跟老闆說要切「一份」老闆都會切成「一顆」，確定你真的不要那麼多再跟你說沒關係他可以賣你一份
明明是老闆聽錯卻講的好像客人反悔，令人心情不佳"
 林俊良 ,https://www.google.com/maps/contrib/111261739688631795783/reviews?hl=zh-TW,1,True,41,買了300多元的鵝肉，老闆切塊剃完骨頭，剩下一點點肉，從此只剩乾義麵跟米血可以入口
 Penny Chen ,https://www.google.com/maps/contrib/109427993282615148274/reviews?hl=zh-TW,1,True,84,"標示營業到23.30
晚上八點多去很多品項都沒了
所有東西調味都是醬油醬油膏蔥油
鵝腸一份60搭配的酸菜有可怕的藥水味"
 孫林興 ,https://www.google.com/maps/contrib/106065385925193012405/reviews?hl=zh-TW,5,False,3,"真正古早味鵝肉香~切仔麵~每週必來一次
小菜新鮮推薦鵝腸、鵝肝、鵝肉~值得一試~
通化夜市美食"
 痴吃人 ,https://www.google.com/maps/contrib/108212707973880742567/reviews?hl=zh-TW,5,True,632,"鵝肉好吃
醬料好吃"
 jiro chang ,https://www.google.com/maps/contrib/117499622968166977653/reviews?hl=zh-TW,2,True,63,"東西不錯吃
但老闆很容易多算錢
即使切盤的菜講好價格也會算錯
建議各位要去吃飯時要注意一下"
 Shihchuan Lin ,https://www.google.com/maps/contrib/102193784835483678790/reviews?hl=zh-TW,4,True,449,"通化街的老店，中午就開始。
鴨肉好吃又有去骨的服務，會先講好價格再給你，乾意麵也很推薦。（比附近的“老意麵店”好吃）"
 Stacie Stacie ,https://www.google.com/maps/contrib/110207127407262002766/reviews?hl=zh-TW,4,True,262,常常就要來嚐嚐的好味道
 Sony chu ,https://www.google.com/maps/contrib/104716822821399870533/reviews?hl=zh-TW,1,False,5,誇張的店家。剛剛經過看到一個有點年紀看起來有點洋蔥的北北要付錢。北北拿了大約2-30個一元要支付！店家竟然跟對方說我們不收一元銅板。只收5元以上的銅板。還碎念的這位北北一頓。聽了一把火！什麼東西啊今天又不是拿一元買幾萬元的車。不就是一餐簡單的晚餐。有需要這樣嗎。只看到北北一邊被唸一邊不好意思的頭低低。誇張。
 傅祝耀 ,https://www.google.com/maps/contrib/117459468200219808046/reviews?hl=zh-TW,4,False,40,通化街有名的鵝肉攤有一位黑道老大最常來吃的鵝肉店我也常常帶女生來吃
 Martini Hsiao ,https://www.google.com/maps/contrib/114777787269413327718/reviews?hl=zh-TW,5,True,213,燙青菜非常嫩，鵝肉品質很好，價格划算。
 Alex Chen ,https://www.google.com/maps/contrib/107505613114964837176/reviews?hl=zh-TW,1,False,3,老闆態度不好，不會再來
 闕綉容 ,https://www.google.com/maps/contrib/113947845278900808124/reviews?hl=zh-TW,5,False,12,"沒有吃過這麼好吃的魯肉飯😍
還有鵝胗跟鵝肉
真的是第一名
吃過這家
別家就沒辦法滿足我的胃囉👍"
 Ariel (ShuYu) Chou ,https://www.google.com/maps/contrib/114151311404986597748/reviews?hl=zh-TW,4,True,45,鵝肉好吃又實惠，除了鵝肉之外也有內臟及其他小菜可以選擇，並可搭配麵、粄條和肉燥飯。
 洪瑞辰 ,https://www.google.com/maps/contrib/108727428015696688846/reviews?hl=zh-TW,2,True,400,沒有鵝肉的甜度，粉肝似乎壞掉酸味出來了，還在切給客人吃！唉...
 Helen Chao ,https://www.google.com/maps/contrib/115677961154794723117/reviews?hl=zh-TW,1,False,14,"點一盤鵝肉肉超少骨頭超多價錢還是用秤重的...
滷肉飯吃起來很油膩不會再吃一次"
 藍振鳴 ,https://www.google.com/maps/contrib/102827659776582199805/reviews?hl=zh-TW,5,True,111,好吃喔……鵝肉有嫩不材！高cp值的鵝肉店！
 蒙地拿 ,https://www.google.com/maps/contrib/116955174157061859169/reviews?hl=zh-TW,2,True,162,"店家有時不照價目表算，會刻意用重量來計價，但重量又没標價。
去個幾次，每次都搞這招，要講多次才會以價目表份數價格來切東西，味道也普通。
完全不推薦。"
 金承堯 ,https://www.google.com/maps/contrib/104725429496847708779/reviews?hl=zh-TW,5,True,341,好吃，性價比高，喜歡鵝肉香甜的滋味！
 Mei Kuo ,https://www.google.com/maps/contrib/104040109621433895307/reviews?hl=zh-TW,5,False,3,鵝肉超級好吃！每次來通化夜市一定先來吃～
 Tze Han Yang ,https://www.google.com/maps/contrib/110882000180974626205/reviews?hl=zh-TW,5,True,19,"台北最愛的鵝肉店~~傳承的好口味
店女兒也很活潑熱情
數度回訪的店囉"
 Mimi Wu ,https://www.google.com/maps/contrib/110020381567556258387/reviews?hl=zh-TW,5,True,97,鵝肉麵，豆腐，乾麵都很好吃。
 M-T K ,https://www.google.com/maps/contrib/113151281079446925435/reviews?hl=zh-TW,4,False,6,軟嫩的鵝肉，煙燻、水煮兩相宜。粉嫩豬肝也必點！
 梅子嚼感 ,https://www.google.com/maps/contrib/116631811516447388773/reviews?hl=zh-TW,4,True,177,環境稍簡陋，老闆和老闆女兒招待親切，鵝肉和黑白切品質不錯，價格合理
 就是個爺 ,https://www.google.com/maps/contrib/114217905021115094110/reviews?hl=zh-TW,1,False,8,老闆肉都亂算價錢，服務態度很差，負評
 余美慧 ,https://www.google.com/maps/contrib/106131420889689336826/reviews?hl=zh-TW,5,False,15,鮮嫩多汁，無敵美味，透抽，鵝肉原味就超好吃。
 白崇基 ,https://www.google.com/maps/contrib/116307932517198118547/reviews?hl=zh-TW,5,True,233,不錯吃的好地方，但鵝肉稍嫌貴了點。
 劉大謙 ,https://www.google.com/maps/contrib/115766033879843507328/reviews?hl=zh-TW,4,True,75,鵝肉肉滑鮮嫩還不錯吃，湯麵類就很普通
 Leo Lee ,https://www.google.com/maps/contrib/106122500560981657166/reviews?hl=zh-TW,2,True,72,味道普通，價格小貴，湯頭很油，鵝肉很少
 kevin Liao ,https://www.google.com/maps/contrib/106322658127272312108/reviews?hl=zh-TW,2,False,4,價格偏貴味道也一般上次去吃還看到老闆娘在跟客人對罵給人觀感很糟
 Aabbee Huang ,https://www.google.com/maps/contrib/106371461192071410989/reviews?hl=zh-TW,5,False,4,"好好吃喔～
通化街隱藏美食

食材都很新鮮

老闆跟老闆娘都很熱情很親切"
 frozenzh ,https://www.google.com/maps/contrib/112179412063280997044/reviews?hl=zh-TW,3,True,387,鵝肉麵味道還不錯，但肉有點少
 mei yu ,https://www.google.com/maps/contrib/112759500169059305320/reviews?hl=zh-TW,5,False,18,煙燻鵝肉好吃，份量足！
 李小華 ,https://www.google.com/maps/contrib/105373701670263551118/reviews?hl=zh-TW,3,True,353,"口味還好，價錢不貴，環境還好
血糕薄了點，份量一樣可是切法可以改變(ex長方體)，口感會比較好"
 Christy Chang ,https://www.google.com/maps/contrib/105877932749615999008/reviews?hl=zh-TW,4,True,119,"附近吃鵝肉的好選擇
老闆也親切
想吃心肝可能要早點來"
 David Lee ,https://www.google.com/maps/contrib/117920327649565968556/reviews?hl=zh-TW,2,True,57,無法評論，鵝肉4星，價格2星，服務態度負5星
 彭慧真 ,https://www.google.com/maps/contrib/100654175012485369241/reviews?hl=zh-TW,5,False,27,鵝肉一級棒👍👍
 黃美慈 ,https://www.google.com/maps/contrib/103544720300277887334/reviews?hl=zh-TW,5,True,60,飯麵好吃又便宜鵝肉多汁老闆女兒很可愛
 Elish ,https://www.google.com/maps/contrib/113003539202384579124/reviews?hl=zh-TW,4,True,306,"鵝肉好吃鵝胗脆口
乾粄條很Q"
 Amber Chou ,https://www.google.com/maps/contrib/117653506185812635528/reviews?hl=zh-TW,1,False,5,"買了無數次老闆娘的態度都是極其不好又不屑！
好像去他們家一定得花個5、6百的才是貴客"
 重磯老K ,https://www.google.com/maps/contrib/107720398850525260242/reviews?hl=zh-TW,4,True,145,蔥肉分離的包法可以品嘗到肉香與青蔥的香氣。
 沈庭安 ,https://www.google.com/maps/contrib/100886115579003645653/reviews?hl=zh-TW,3,False,5,東西少、偏貴、但好吃！
 Kurapi kou ,https://www.google.com/maps/contrib/100190414801192394388/reviews?hl=zh-TW,5,False,12,超好吃又超親切！！！！！！吃一輩子都不會膩😍😍
 曉不得 ,https://www.google.com/maps/contrib/104468963675522220090/reviews?hl=zh-TW,1,False,18,"環境吵雜.
老闆跟員工一直在聊天非常的吵....."
 eva shen ,https://www.google.com/maps/contrib/108817471791147930354/reviews?hl=zh-TW,5,True,103,很好吃，尤其是煙燻鵝肉，棒棒的！！
 Vincent Tien ,https://www.google.com/maps/contrib/102220262551227615895/reviews?hl=zh-TW,3,True,903,飯麵便宜好吃，老闆一直鼓吹切鵝肉
 曾莫敵 ,https://www.google.com/maps/contrib/111992443761046605291/reviews?hl=zh-TW,3,True,845,"肉嫩汁多不柴,下水湯料多,價格公道"
 rachellogo houng (a-hA) ,https://www.google.com/maps/contrib/101633121621229182616/reviews?hl=zh-TW,5,True,49,好吃很好吃超級好吃被我推薦的人都說很棒
 黃德偉 ,https://www.google.com/maps/contrib/115991068260166931127/reviews?hl=zh-TW,4,True,54,道地的地方小吃鵝肉最好吃
 何凡宜 ,https://www.google.com/maps/contrib/105516070693470350016/reviews?hl=zh-TW,4,False,15,味道不錯，東西都很新鮮，值得推薦
 Howie Liu ,https://www.google.com/maps/contrib/111179066135383127429/reviews?hl=zh-TW,4,False,440,還不錯吃，老闆愛評論政治XD
 Tracy Tsai ,https://www.google.com/maps/contrib/101740906529975844701/reviews?hl=zh-TW,4,True,250,東西蠻好吃的，店裡狗狗很乖。
 KK ,https://www.google.com/maps/contrib/105085978273042493477/reviews?hl=zh-TW,1,True,113,變相收費超貴的^_^
 Po-Chun Kuo ,https://www.google.com/maps/contrib/115207631754421609361/reviews?hl=zh-TW,4,True,189,CP值高，好吃的道地臺灣美食
 Wu Niki ,https://www.google.com/maps/contrib/111623245473346968082/reviews?hl=zh-TW,4,True,574,小菜選擇多樣
 Eric Lee ,https://www.google.com/maps/contrib/114744223592039572979/reviews?hl=zh-TW,4,True,217,夜市邊美食，物美價廉，CP值高
 Jason Wang ,https://www.google.com/maps/contrib/101980051172844829378/reviews?hl=zh-TW,4,True,629,還可以
 Chan Mary ,https://www.google.com/maps/contrib/116268329391038732561/reviews?hl=zh-TW,2,False,78,鵝肉價錢太貴場地差
 王娟娟 Gloria Wang ,https://www.google.com/maps/contrib/117501989727113756184/reviews?hl=zh-TW,5,True,568,食物新鮮美味、老闆親切
 嫺 ,https://www.google.com/maps/contrib/109496403661333797851/reviews?hl=zh-TW,4,True,91,餛飩湯有點鹹其他還可
 chris is ,https://www.google.com/maps/contrib/104786033392384721127/reviews?hl=zh-TW,1,True,99,鵝胸切成超薄好入口
