user_name,user_profile_url,rating,local_guide,comment_num,comment_text
 chen wei rong ,https://www.google.com/maps/contrib/108642721717075017573/reviews?hl=zh-TW,1,False,2,連兩天都夾差不多的菜色和份量，一個75元（豆芽菜那盒）一個105元（有三片黑胡椒牛肉那盒），價格會因菜色和份量有不同很正常，但是差到30元是真的太扯了，每次算價格都用目測，毫無根據！（飯都是我自備的）
 大鐵 ,https://www.google.com/maps/contrib/114991515428901419948/reviews?hl=zh-TW,1,True,51,本來就已經感覺這家自助餐不是很衛生了，果不其然，今天的涼拌龍鬚菜竟然是臭酸的，傻眼！另外夾菜空間擁擠，工作阿姨卻一直跟客人搶夾菜的位子。然後永遠不知結帳的標準是什麼？尤其被那位眉毛畫得很奇怪的女的算到錢，都會貴到以為在吃歐式自助餐。
 Carina Tsai ,https://www.google.com/maps/contrib/101464857573556042458/reviews?hl=zh-TW,1,False,5,"我一顆星都不想給！！
第一次給店家負評
我根本沒夾主菜，只有三顆小宮保雞丁
這樣竟然要$150！

這樣竟然要$150！

這樣竟然要$150！請問我有看錯嗎？
平常這樣夾差不多$75-$80
可以不要亂算錢嗎？
真是一肚子火！"
 Lee Lee ,https://www.google.com/maps/contrib/107845853085194854963/reviews?hl=zh-TW,1,False,5,"之前夾一樣的菜色都沒有那麼誇張
現在是直接亂喊價！因為沒有計價標準也不能說什麼…就這樣說什麼價錢就是什麼價錢…以後真的不會再去給人家當豬仔殺！！！
這樣兩盒165，同事跟我差不多菜色3盒170而已…會不會太誇張！"
 黃瀚瀚 ,https://www.google.com/maps/contrib/116325142850635831243/reviews?hl=zh-TW,1,True,9,"這家真的很會亂算錢，我買這樣235元
我前面一個明明我聽到215他就在掏錢於是就跑來算我的235元完，前面掏好錢要付215時算錢小姐就說是315我真的傻眼這就算了很久以前我買過一次算完錢我跑去加一點魯汁加到白飯上面結果小姐叫我回來要加5元我真的對這家評價一定要給非常爛"
 雷Sir ,https://www.google.com/maps/contrib/113450818629083741369/reviews?hl=zh-TW,4,True,"1,091",算是少數菜色豐富，質感、口感都不錯的優質自助餐，尤其魚的選擇很多。吃飯時間人多多，乾飯稀飯湯甜湯都有（當然也要算錢），菜色不錯，真的有品質，魚也有很多選擇，不過廚餘回收處要再規劃一下，連我愛環保的人也不知要怎麼丟？？但最近工作人員有點扯，忘了把白飯裝進去，回家發現沒白飯，還有，感覺變貴了。
 Sylvia Chang ,https://www.google.com/maps/contrib/107320434506219508199/reviews?hl=zh-TW,1,False,4,"氣到忘了拍照😭🤬貴到一個離譜的境界，不同人算的價錢扯到無極限，東西不難吃，但價錢真的太過份！
三～四塊長條小豆腐、兩小塊宮保雞丁的肉、約3公分*4公分大小的魚肉跟內用餐盤一小格的高麗菜與紅蘿蔔絲，竟然破百！"
 李浩宇（Cross） ,https://www.google.com/maps/contrib/104522105274662497115/reviews?hl=zh-TW,3,True,39,好吃是好吃，但價錢浮動似乎是看老板娘的心情⋯
 wawa ,https://www.google.com/maps/contrib/108015417152870235670/reviews?hl=zh-TW,1,False,2,"食物好吃不代表態度可以囂張
疫情時期特別講究衛生安全必須戴好口罩，但是站煎檯的「師傅」自己口罩都沒戴好反而還管起客人，客人既沒有動手碰到食物也沒亂噴沫，倒是員工們自己離食物最近的總是在說話聊天口罩戴下巴到處噴口水，客人都沒嫌店家店內器具乾不乾淨，店員還一點小動作就嗆客人，偶然看到店內員工近休息時間整理時都在隨意脫口罩到處聊天口沫橫飛隔空喊話，明明就還有客人在夾菜在用餐，真的是有夠衛生蛤！！！！！！！"
 Yuchao Wang ,https://www.google.com/maps/contrib/112499599809371547619/reviews?hl=zh-TW,1,False,6,只要給某個小姐結到帳，那天就是爆貴，而且越來越常遇到她結帳。這家自助餐的價格實在太靠結帳小姐的自由心證了，無法接受。
 李傳恩 ,https://www.google.com/maps/contrib/113177095571581706377/reviews?hl=zh-TW,4,True,176,看到許多負評有點嚇到，第一次用餐經驗還不錯，菜色美味、價格實惠(結帳阿姨用看的)，拿一樣主菜、三樣配菜、一碗飯、一碗湯，90元，在台北CP值算不錯，還可以免費淋肉燥。會再來吃，看品質是否穩定。
 Duc Black ,https://www.google.com/maps/contrib/117123527363633692771/reviews?hl=zh-TW,1,False,5,若看到結帳區站的人是馬尾女，就不要進去買了。價錢隨她喊==我只是把飯先裝在便當盒裡面，再把菜放上去，她就說我夾很多所以170幾元。各種負面評論我就不說了，留言一堆。這種店我是不會再去光顧了。
 Alice Yang ,https://www.google.com/maps/contrib/107246443452455497523/reviews?hl=zh-TW,4,False,19,二樓空間很大；比較不清楚結算價錢的標準；有一次吃了某種煎好的魚，覺得口感有一點缺陷，結果後來有拉肚子（雖然無法證實一定是魚的關係）....
 Aileen Chang ,https://www.google.com/maps/contrib/110599309368561153922/reviews?hl=zh-TW,1,False,3,因為地緣關係算是常客，就如同眾多網友大大分享的，這家店收費標準不一，有的人結帳後金額還好，有的人結帳後金額貴的離譜；尤其一個皮膚黑、偏瘦的店員，只要有她在結帳，結帳後就會貴30-50元，大家要注意！
 臺北客 ,https://www.google.com/maps/contrib/116502913412018070542/reviews?hl=zh-TW,3,False,55,菜色可選樣式較一般自助餐或便當店多，販售價格由掌櫃目視估算，未買單前無法預估當餐消費金額，對於三餐計劃生活的小資族恐有經常爆表的風險。
 cucu money ,https://www.google.com/maps/contrib/112264273829808901743/reviews?hl=zh-TW,1,False,1,價錢非常離譜，超級貴，超爛店，沒吃過這麼貴的自助餐一顆紅燒獅子頭炒蛋一份筍絲一份4個宮保雞丁一份炒肉180元一碗飯
 吳宥慶 ,https://www.google.com/maps/contrib/109435025825848470954/reviews?hl=zh-TW,5,True,37,"宮保雞丁
糖醋雞丁
炒豆干
家常豆腐
炒高麗菜
魰仔魚炒蛋
炒莧菜
很多菜都還不錯
可能多數偏油或重口
但自己吃習慣了，就不知道吃什麼就會來這裏亂夾"
 Tong Arthur ,https://www.google.com/maps/contrib/110364608820078873839/reviews?hl=zh-TW,1,True,129,"以前吃還覺得合理，但近來價格越來越貴，cp值直接降低。不知道是否是我的錯覺，雖然說晚上會有送湯的時間，理論上送的湯不會被計價，但是結完帳就是覺得貴……建議用餐的客人，先結完帳再拿送的湯。
另外不要在七點半後內用，因為一樓的工作人員會在還有客人的情形下““大力翻疊塑膠地墊””！把灰塵都翻起來了，一點都不尊重內用的客人，你說結帳的老闆娘沒有表情就算了，服務業不一定要去給你看笑臉，但是清潔打掃時，不能提前知會一下在一樓內用的客人嗎？這樣的做事態度別怪客人給一顆星的評價……"
 Kai ,https://www.google.com/maps/contrib/116837025120251370370/reviews?hl=zh-TW,1,False,8,菜價都比其他間貴，然後才9月就買不到冰的綠豆湯，9月是多冷？
 謝沛宏 ,https://www.google.com/maps/contrib/102040555635087539230/reviews?hl=zh-TW,3,True,159,"有一道糖醋雞丁很不錯吃，但真的價格太不準確了，有時貴有時便宜，這樣的不確定性是讓人不想去的一大因素，二樓有三台電視，想看電視來這就對了。

衛生環境方便則普通。"
 子寬楊 ,https://www.google.com/maps/contrib/105254839100595135481/reviews?hl=zh-TW,4,False,15,豬腳食材的選用不是台灣溫體豬，糖醋排骨火侯不夠，消費標準卻是其高不可攀，感覺只能用【差強人意】來形容了…
 王大衛 ,https://www.google.com/maps/contrib/105808223674229691530/reviews?hl=zh-TW,1,False,5,每次買一樣的菜，差不多的份量，每次價格都不同，有時300元，最低買過220元，差到80元，感覺很差！
 王彥文 ,https://www.google.com/maps/contrib/117409945788836067343/reviews?hl=zh-TW,5,True,173,"平價美食菜色多,內用有提供飲料還是無糖，這家自助餐廳算是豪華等級，開放式廚房衛生看得見。"
 陳德光 ,https://www.google.com/maps/contrib/113676932591535559138/reviews?hl=zh-TW,1,False,13,超級爛這樣145塊結帳時說用公克算我們怎麼知道要夾多少才算都憑感覺算價145塊我都可以去買燒臘便當了還有找這樣我也沒給你退摸摸鼻子這個實在太貴了
 陳維哲 ,https://www.google.com/maps/contrib/107682503161932642437/reviews?hl=zh-TW,3,True,105,價格不太透明，沒有標準以外，很容易亂喊價格，不是一個良好的店家。
 Gini Ou ,https://www.google.com/maps/contrib/101856530976139906058/reviews?hl=zh-TW,4,True,192,覺得好吃但有點太油，菜色多，跟男友兩人點了這麼多才210，但看了下面評論表示收費不一，下次去不知道會不會標準不一樣？有待觀察...
 FF UU ,https://www.google.com/maps/contrib/113877600984894800844/reviews?hl=zh-TW,1,False,9,😡😡買兩次都是因為隔壁素食的蕃茄蛋沒了所以才來這家😤😤第一次來買用貴店的盒子裝兩匙半算我＂15元＂覺得價錢合理🤬🤬🤬今天自帶容器裝了四匙半算我＂60元＂我問為何價錢差那麼多🤔🤔結果戴帽子眼鏡那位阿姨冷冷回我🙄🙄因為你的容器＂很大＂😠😠店裡怎麼不乾脆買個磅秤秤內容物有多少👍而是好棒棒的用肉眼看到環保盒玻璃厚就是裝的比較多😒😒回家打開⋯⋯啊！原來是因為有幫你加菜啦（吃不飽的塑膠棉線)🤮🤮🤮
 林金保 ,https://www.google.com/maps/contrib/111208908823137711769/reviews?hl=zh-TW,1,False,5,"三個菜一個薄肉片便當盒還一堆空間加一碗10元的湯和一碗白飯要價115比一個雞腿便當貴....
我還再問一次價錢確定115,
後面一個人跟我夾一樣的薄肉片是我兩倍大，滿到快出來的菜加白飯120到底是用什麼標準算錢..😱"
 羅克 ,https://www.google.com/maps/contrib/108361334989467348860/reviews?hl=zh-TW,5,True,139,菜色豐富，忍不住會多夾一盒回家。
 王璘 ,https://www.google.com/maps/contrib/116321842378824779549/reviews?hl=zh-TW,4,True,235,菜色多、味道好，價格有點小貴，服務尚可。
 T. S.遠哲 ,https://www.google.com/maps/contrib/109978234740070399014/reviews?hl=zh-TW,2,False,2,用餐尖峰時段，一般外場工作人員、收銀臺態度差勁，家人購餐聽到一盒三樣平價菜竟然要80元，向收銀臺請求詳細說明竟然還被罵打斷估價。
 Johnny Shu ,https://www.google.com/maps/contrib/104985544070870781876/reviews?hl=zh-TW,5,True,43,"東西豐富、口味適中
環境乾淨
下班之後吃飯的好去處🥳🥳🥳"
 Aria Huang ,https://www.google.com/maps/contrib/117121157482460932520/reviews?hl=zh-TW,1,False,16,看到櫃檯是戴粉紅帽子+眼鏡的阿姨千萬別進來，價錢都亂算，喜歡夾少量多樣的朋友請繞道，都會算超貴，如果有夾魚或雞腿就更不用說了絕對破百，之前只夾三樣菜沒飯沒肉要80，圖片這樣居然要一百，還沒點飯勒，還不如去吃隔壁的素食店，店家似乎也不在乎評價，不想被亂坑還只能請大家抵制。
 S YO ,https://www.google.com/maps/contrib/118118446487480288678/reviews?hl=zh-TW,3,True,"1,248","四樣青菜
半塊雞排
一碗湯、一碗白飯
這樣居然$110
雖然貴，但還不錯吃
內用空間很大
還有防疫安全距離
菜種類非常多
看起來都很好吃"
 李宜勳 ,https://www.google.com/maps/contrib/102519273826214222829/reviews?hl=zh-TW,1,True,52,"今天108年2月3日小年夜，這樣的菜色(一塊排骨+一杓子瓜籽肉+2碗白飯)竟然要價95元...
今天2/24,我家附近的自助餐休息，所以只好再到這家，看到結帳的阿姨不是上次那個搶匪就多夾了幾樣菜，結果算完帳115只比上次多20,所以在這邊買要先看結帳的阿姨是哪位，如果是搶匪的話強烈建議不要買否則受氣"
 林鈺添 ,https://www.google.com/maps/contrib/112195015169033672919/reviews?hl=zh-TW,4,True,447,"菜色種類多樣且多變，熱炒冷盤鐵板都有。還有甜湯跟飯粥麵可供選擇。
位置有分一二樓，最大缺點為上二樓樓梯狹小抖峭，無法容納兩人通過，須上下等待且端盤湯菜危險，除此之外，都極為推薦來此用餐或外帶，價格合理。"
 Daniel Liu ,https://www.google.com/maps/contrib/111978988916585410463/reviews?hl=zh-TW,1,True,33,"一時坑人一時爽，一直坑人一直爽

好好一家店，菜也好吃，一定要用目測的激怒客人
真是絕了"
 Kurt Huang ,https://www.google.com/maps/contrib/115396633524578368299/reviews?hl=zh-TW,1,True,40,沒特別好吃，同時價格還很不透明，飲料很難喝還不如不要給。
 王駿傑 ,https://www.google.com/maps/contrib/107028969471503294830/reviews?hl=zh-TW,1,True,121,"109年2月7日晚上在2樓用餐，就是有一個像員工的就坐在2樓玩手機還超大聲，用餐時間耶?
109年2月1日新增如下方照片，總價130元，排骨50元，冬瓜湯10元，其他70，還是沒改善啊？還把低價難處理的肉類削減只留貴的，都沒明價，萬物齊漲工資卻不長

紅蘿蔔炒蛋及高麗菜，豆芽菜，蛋，糖醋雞肉=120，加2碗湯20，白飯10=就150
真的是貴翻了，算錢的沒在看你內用還外袋的，讓我以為在百貨公司買，環境卻是低廉便當品質"
 Simon Chang ,https://www.google.com/maps/contrib/113414399101815476753/reviews?hl=zh-TW,5,False,32,各種菜色口味不錯吃，肉類及鱼類有專屬櫃台供選購。
 melo melody ,https://www.google.com/maps/contrib/114616466821451044907/reviews?hl=zh-TW,2,True,39,菜的品質很ok，也很用心，價格當然也的貴一點。在景美住了兩年了，有兩個女生在算帳，比較常是皮膚白白的帶帽子的大姐，價格合理一點，另一個代班的女生算錢，都讓我有一種想要把菜倒回去的衝動，今天這樣加一碗飯是190元。高級…
 Tim Huang ,https://www.google.com/maps/contrib/103562198359058754581/reviews?hl=zh-TW,4,True,56,價錢適中，附近少數不多的自助餐，缺點菜色基本一樣
 丁芬妮 ,https://www.google.com/maps/contrib/104468794443191688762/reviews?hl=zh-TW,1,False,12,"把錢直接丟到菜上面沒有任何道歉！
把錢直接丟到菜上面沒有任何道歉！
把錢直接丟到菜上面沒有任何道歉！

是嫌錢上面的細菌不夠多嗎？

店員很粗心大意又沒禮貌，因為後面有人（但是也沒很多人），所以她很急，找我錢之很隨便幾乎快像丟的一樣，我很努力接，看她的手到哪裡了，但他速度很快，居然把錢丟到我的菜上面，真的！錢直接掉在兩個菜中間，錢是經過多少人的手，是多麼的髒，店員沒有讓我換菜，連一句道歉都沒有，而且店員不是沒看到喔，他看著掉在菜上麵的錢愣了三秒，我沒有罵她，但是我已經非常不爽了，她居然一句道歉都不講，更不要說讓我換菜了，真的很噁心！以後絕對不會再來吃！更何況還是這種疫情嚴峻時期！"
 馬亞靜 ,https://www.google.com/maps/contrib/110143708970711935382/reviews?hl=zh-TW,5,True,20,"差點因為評論而錯過一家好餐廳。
菜色豐富，價格合理，味道不錯，5種素菜、雞腿、豬肝加白飯只要95塊。雖然很便宜，不過確實還是有明確的收費標準更讓人心安。但這是值得當作食堂的地方，在不知道該吃什麼的時候是很好的選擇。"
 Timothy Yeh ,https://www.google.com/maps/contrib/105220731723088018702/reviews?hl=zh-TW,4,True,526,菜色選擇豐富，口味還算好吃，用餐環境乾淨舒適，除了飯和湯一份一份有固定價格外，自助餐部分價格是老闆自己算的。
 Jackson ,https://www.google.com/maps/contrib/113759354222508386894/reviews?hl=zh-TW,1,False,30,"老闆想省錢
賣比別人貴
又不願意開空調
夏天那麼熱
內用客人丶外帶夾菜客人都快熱昏了
還有夏天沒開空調，菜也容易臭酸掉"
 許懿琳 ,https://www.google.com/maps/contrib/113508519768957754553/reviews?hl=zh-TW,1,False,9,"多年前和先生偶爾會來這吃，印象中還ok
昨天自己散步到這裡內用，
感覺上髒亂很多！從一入門的酒精消毒機再到內用桌椅的種種凌亂，時不時還有果蠅在我周圍飛😑
我是客人，都懂得離開座位必須要戴著口罩！
而在我隔壁桌享用著午餐的店內人員聊著天，還無罩起身拿紙巾從我面前經過⋯⋯對了，店內雖有隔板，但也都髒兮兮的⋯⋯餐飲環境如此，非常不好"
 程影 ,https://www.google.com/maps/contrib/105316555583215752274/reviews?hl=zh-TW,1,False,8,真的很誇張，三樣菜一樣肉，一次85元，另一次竟然145元，都沒有買飯，菜肉我都固定的（高麗菜、空心菜、豆乾、蒜味豬肉片）原來可以自己隨意判斷價位，以後完全不考慮這家自助餐。
 尤威凱 ,https://www.google.com/maps/contrib/102809712638692798460/reviews?hl=zh-TW,1,False,4,三菜一肉一飯，竟然要145元，當下聽到整個傻眼，第一次去吃也是三菜一肉一飯也沒像這次貴的那麼誇張，可以說是我此生吃的最貴的自助餐不唬爛，原來可以自己隨意判斷價位，以後完全不考慮這家自助餐。
 郭小麟 ,https://www.google.com/maps/contrib/115316776989577651518/reviews?hl=zh-TW,1,False,4,三菜兩肉一飯一湯205？此生吃過最貴自助餐無誤，嚇死人，不過突然想吃個自助餐這麼坑…
 蘇一 ,https://www.google.com/maps/contrib/117083835569279323624/reviews?hl=zh-TW,4,True,101,好吃.可是很貴，久久吃一次還可以。
 Shawn Yang ,https://www.google.com/maps/contrib/111658134700654983789/reviews?hl=zh-TW,1,True,22,"價錢偏貴（小片雕魚50排骨就要40）
菜偏油要很早去夾菜才不會泡在油裡

裡面很多阿姨員工態度都很差
上菜的時候都不會管客人正在夾菜
會一直擠你

夾主菜旁有放置塑膠袋
整個弄得很油膩
在挑一個比較乾淨的時候
店員會很不耐煩的說「都一樣啦～～～」
明明就是不注重檯面整潔
還怪客人挑～"
 CHU ING HUANG ,https://www.google.com/maps/contrib/113599514601392203132/reviews?hl=zh-TW,1,True,218,這樣$270，說什麼都夾兩份，當人家沒吃過自助餐嗎？超級過分當人家傻子嗎？
 Lu CHI ,https://www.google.com/maps/contrib/109162634626641232089/reviews?hl=zh-TW,4,True,285,暈素皆有價格應稍降些
 Chen Wei-Ting ,https://www.google.com/maps/contrib/101329993174539171261/reviews?hl=zh-TW,1,True,56,"食物美味不在話下，但價格不透明，且愈來愈貴，已經讓消費者摸不著頭緒。過去兩個便當盒滿滿各五樣菜，160，最近一個便當盒，滿滿五樣菜，120，皆不含白飯，且沒有夾肉類主菜。

價格透明，就算物價上漲一樣也會支持，會再去幾次，若價錢一樣離譜，以後就不去了，也會告訴周邊的人拒絕去消費。"
 JIA YOU GAO ,https://www.google.com/maps/contrib/112497518168893184003/reviews?hl=zh-TW,3,False,20,"餐點還行，不過價格偏高。
餐點總類多，不過變化少。"
 Joy Huang ,https://www.google.com/maps/contrib/110177777074920355654/reviews?hl=zh-TW,1,False,10,計價方式不透明，是櫃台阿姨隨心所欲判定，一盤菜（沒有飯）全部145元，服務小姐們態度很差，一種要來沒來隨便你的晚娘口氣。
 Lin Betty ,https://www.google.com/maps/contrib/104630999155727489560/reviews?hl=zh-TW,1,False,2,"連兩天都夾差不多的菜色和份量，戴眼鏡的壯碩大嬸算的比較合理
瘦瘦年輕女生算的就特別特別貴，價格差了50元真的太扯了，每次算價格都用目測，毫無根據，相當差勁！"
 魏柏宣 ,https://www.google.com/maps/contrib/118345335153616378632/reviews?hl=zh-TW,4,True,413,東西蠻好吃的，食材也選用得不錯，但環境有點差強人意，價位偏高
 Weiming Chen ,https://www.google.com/maps/contrib/102066118570392903439/reviews?hl=zh-TW,1,True,51,三個青菜一小口豬肉一碗白飯100元，比信義區的自助餐還貴，店員態度極差，一副不差你這個客人的樣子，極不推薦
 中二病 ,https://www.google.com/maps/contrib/108341509227560276775/reviews?hl=zh-TW,1,False,32,"快收攤了才3樣東西就要100沒有飯拜託大家附近很多好吃的也不要來這邊買東西也不是特別好吃水準這樣越吃越氣菜都冷了還敢這樣喊價！
肉也很硬還很不新鮮隔壁素食都比較好吃，看到這個留言還敢來消費的我覺得三思不要吃個飯搞得自己心情不好不是多窮但是也不認為錢是這樣賺的，君子愛財取之有道。"
 Sen ,https://www.google.com/maps/contrib/117203209212384899988/reviews?hl=zh-TW,1,False,2,"買了會後悔
價錢太誇張
貴的離譜
拒吃
要不是要評論
連一顆星都不想給"
 傅玉佳 ,https://www.google.com/maps/contrib/108727579315365089887/reviews?hl=zh-TW,4,True,29,一碗紅豆湯10元，很便宜
 Ian Liu ,https://www.google.com/maps/contrib/113154364844555428011/reviews?hl=zh-TW,4,True,317,真的好吃每次來這裡必吃他的所有湯品都蠻好喝的也只要10元它還有鐵板料理
 Cathylee Fern ,https://www.google.com/maps/contrib/106577961373780752727/reviews?hl=zh-TW,1,True,59,"上面（沒肉的）$55，下面（有雞腿的）$90，怎麼那麼貴？
紅蘿蔔和菠菜又油又鹹"
 brian83416 ,https://www.google.com/maps/contrib/111294183658558883436/reviews?hl=zh-TW,1,True,42,"「傑出的ㄧ手」
這樣ㄧ百七十元。
是一位臉瘦挺鼻綁馬尾的中年女士算的，給你一個讚。"
 Lucinda1126@yahoo.com.tw Chen ,https://www.google.com/maps/contrib/107488102824160711375/reviews?hl=zh-TW,4,True,28,好吃，選擇多樣化，但就好貴
 Han John ,https://www.google.com/maps/contrib/118340643904420836644/reviews?hl=zh-TW,1,True,118,越賣越貴，一樣的飯菜量，不同天卻不同價格
 張天祥 ,https://www.google.com/maps/contrib/114363356635909306496/reviews?hl=zh-TW,1,False,3,真的夾沒幾樣，就好貴，真的看心情計價的（6菜一飯無主餐就要165…）
 Ming House ,https://www.google.com/maps/contrib/105007246709675505633/reviews?hl=zh-TW,1,False,12,四菜沒肉，飯一大一小85元，不如吃雞腿便當，貴，完全不推！
 徐利杰 ,https://www.google.com/maps/contrib/107711410286566426103/reviews?hl=zh-TW,5,True,89,CP值高但其實價格高低頗看阿姨心情
 呂維靜 ,https://www.google.com/maps/contrib/115799807927783262616/reviews?hl=zh-TW,4,False,78,餐點不錯，很喜歡這裡的主餐，很多元很豐富，但如果餐點費用能有夠清楚的表示或菜單更好
 George Lee ,https://www.google.com/maps/contrib/109638527942230572754/reviews?hl=zh-TW,3,True,210,菜色還蠻多元的但是調味偏鹹，價格稍貴
 HsinPu Hsieh ,https://www.google.com/maps/contrib/111501507135611855916/reviews?hl=zh-TW,2,True,59,一碗15塊的湯，這樣90.......
 高明耀 ,https://www.google.com/maps/contrib/108890388101849022824/reviews?hl=zh-TW,1,True,4,這樣收210元?
 Peter Young ,https://www.google.com/maps/contrib/112035377077061116693/reviews?hl=zh-TW,4,True,88,景美的知名自助餐廳，很多上班族在此打菜回家。菜色新鮮不油膩選擇也多，當自家廚房的概念。但必竟是學生族群及領薪階層居多的景美商圈，價位稍高就往往引來抱怨!值得一提的是固然有人抱怨菜價但是用餐時間也還是內用外帶一堆人在店裡~
 吳筱蓓 ,https://www.google.com/maps/contrib/110862795058474364320/reviews?hl=zh-TW,1,True,15,價錢沒有一個標準可言，常常拿一模一樣的東西，價差可以有20元以上，真不知道這樣，為何生意還這麼好？只能說景美這地方沒競爭對手，店家最大。
 林澤洋 ,https://www.google.com/maps/contrib/113685722828340601714/reviews?hl=zh-TW,3,False,102,"價位真的偏貴了點，不過考量環境維持的不錯又有冷氣就還可以接受。
菜色吃起來不油膩，如果是因為減肥吃自助餐的話這家可以考慮"
 Chen Duff ,https://www.google.com/maps/contrib/111775406787459015348/reviews?hl=zh-TW,4,True,20,"食材真的不錯選擇性很豐富
購買的感覺尚可CP值還可以接受
有湯可以另外購買（雖然我很少買）
肉品算不錯，每次購買都很滿意"
 陳泰維 ,https://www.google.com/maps/contrib/116506174352860873048/reviews?hl=zh-TW,4,True,52,不想煮飯，來這就對了！
 snow Chen ,https://www.google.com/maps/contrib/116548836578679691713/reviews?hl=zh-TW,4,False,20,多樣化的配菜，也不會太貴👍
 李忠憲 ,https://www.google.com/maps/contrib/113278885774192596673/reviews?hl=zh-TW,1,False,4,"自助餐最好不要買因為太貴了
不便宜"
 蔡寶瑩 ,https://www.google.com/maps/contrib/114506754177164446126/reviews?hl=zh-TW,1,False,10,非常昂貴的自助餐三菜一肉110
