user_name,user_profile_url,rating,local_guide,comment_num,comment_text
 Jason Liu ,https://www.google.com/maps/contrib/110196937153639833754/reviews?hl=zh-TW,4,True,78,"CP值高，餐點好吃，都沒有感受到任何的異味，便當盒是偏小的，拿3個便當盒裝滿，雖然不是素食自助餐，不過幾乎都沒有肉類（可能當時已經快沒了）我是不確定它如何算錢的，也沒稱重，總共真的只要150元就好。
青菜類選擇算多，很多常見的都能看得到，像是茄子、韭黃、麻婆豆腐、豆芽菜、番茄炒蛋、油豆腐、豆乾、冬粉、龍鬚菜都有，而且豆芽菜還有2種不同選擇。
取餐部分屬於全自助式，餐盤（一個餐盤可以放2個便當盒）和所有的夾菜都是自己操作的。
衛生環境看起來普通，外面沒有任何的消毒酒精，需要自備。
不過捷運景美站附近好像自助餐的選擇很少，所以還是不少人會來這邊。"
 Wendy Chen ,https://www.google.com/maps/contrib/108470952601402533725/reviews?hl=zh-TW,2,False,12,感覺每道菜都油膩膩的，而且算錢的人絕對不會心軟，筴多少算多少，好似有点不實在，所以我现在會換其他家換換口味。
 Y U ,https://www.google.com/maps/contrib/109531891139006649241/reviews?hl=zh-TW,1,False,1,店內中性女店員口氣跟態度很差…
 花花 ,https://www.google.com/maps/contrib/114416902686262399290/reviews?hl=zh-TW,1,False,28,"一樣的菜買了很多年價格都在75-100元之間，今天買竟然要120元，現在菜不是很便宜嗎？平常老闆娘算(常常算錢有上妝的那位，我不知道是不是老闆娘)都比較便宜，偶爾其他員工算會比老闆娘貴一些，但老闆娘今天算竟然要120元，早知道就去買個平價日式料理還比較實在。
本來一股衝動想問老闆娘怎麼算的，但之前有碰到前面有人有問過，結果被一個員工嗆「是你自己觀感的問題」，想想還是算了，買了這麼多年，真的不想再去買了，感覺真的很差"
 Fred Hsu ,https://www.google.com/maps/contrib/107492483978622301579/reviews?hl=zh-TW,5,True,124,每道菜都很可口美味，結帳時總會讓人覺得是不是少算了錢？
 Allison ,https://www.google.com/maps/contrib/102921623368387144475/reviews?hl=zh-TW,1,True,70,這樣110，完全沒有肉沒有白飯，當下真的覺得要老百姓怎麼活做事業要有點良心吧⋯⋯我以為我在買精緻餐點肉眼掃真的是可怕的誇張
 台北 A048許雅淳 ,https://www.google.com/maps/contrib/101494697643908236559/reviews?hl=zh-TW,5,True,156,"菜色多元豐富，價格算是可接受！有許多湯品可以選擇。

建議：
如果可以自備環保餐盒，會更好唷！"
 林冰 ,https://www.google.com/maps/contrib/100787210087019747614/reviews?hl=zh-TW,1,False,18,"價錢超級不穩定！
拜託看到戴眼鏡結帳女阿姨就離開
換其他人上班的時候價差超大

戴眼鏡女阿姨每次都算超貴！講法也不一
之前說吻仔魚蛋比較貴$30，番茄蛋比較便宜，菜一樣$15

這次
我夾雞腿肉+2樣菜+番茄蛋無飯
要算$105看我在翻零錢才說$100就好
（阿不是番茄蛋比較便宜？？？是便宜在哪）
朋友比較晚來夾一樣的肉+2樣菜+番茄蛋有飯$85

算錢根本對男生比較好？？？
屢試不爽真的超不爽！
員工訓練請加強價目表訂假的=="
 竹子邦 ,https://www.google.com/maps/contrib/104573767728856311420/reviews?hl=zh-TW,3,True,345,餐點很多也好吃，只是價位也高就是
 李冠叡 ,https://www.google.com/maps/contrib/118206678236062663079/reviews?hl=zh-TW,1,True,112,"態度真的太差，請人員幫忙切魚都不願意，叫我直接把魚對折？這應該是很基本的需求才對啊
而且每次價格不一，又偏貴，這次服務態度又不佳！
不會再來訪的一家店！"
 船夫 ,https://www.google.com/maps/contrib/114759601758135488071/reviews?hl=zh-TW,5,True,285,"菜色的種類眾多又很划算只是不管是飯或是粥與湯品都要另購
只有紅茶跟檸檬水無限暢飲
內用的環境還算可以人多的時候也有開放二樓用餐區"
 楊軒 ,https://www.google.com/maps/contrib/114163656265498079607/reviews?hl=zh-TW,1,False,10,浮誇飯裡面有頭髮塑膠鋼絲真的太猛了
 ONE ROY ,https://www.google.com/maps/contrib/117956259231669404695/reviews?hl=zh-TW,1,True,84,"分兩天
小心奕奕的夾買一樣菜色和份量
價錢就差了30元

分別是190及160元

態度感覺不是很好外，
是看心情在決定價錢的…

當場有點想問她那一道菜貴這麼多……"
 Formosa iLove ,https://www.google.com/maps/contrib/118194714437855152286/reviews?hl=zh-TW,1,True,149,"口味其實不錯
但算錢真的很因人而異
有時候沒主菜，少量配菜六樣也要120
有時候雙主菜配菜大約三樣加15元的湯卻只用100
用文字很難描述，但自己按照菜價跟量評估起來就是一頭霧水
----
今天去完決定改給一星
菜量甚至比之前雙主菜的還要少，上次100這次竟然130？
燙捲髮帶粉紅帽的阿桑算錢很不實在
另外中秋當天的菜都超鹹，吃得一肚子火..."
 HH Chen ,https://www.google.com/maps/contrib/105066956487040647995/reviews?hl=zh-TW,1,True,100,價格都不一致，完全都是有人來觀看定價，隨然菜色是很多樣，隨意夾幾樣就可以破百廷可怕，個人覺得偏油偏鹹，啥樣式都要另外要費用，就連湯(也沒有啥東西)也要收費，唯一好的就位子很多拉，有電視、冷氣、二樓還有位置同時有開放廁所，總結是不會再去，個人不是很推薦，各位看官可以斟酌。
 Eren ,https://www.google.com/maps/contrib/113411897368956786885/reviews?hl=zh-TW,4,True,228,"菜很多味道也都不錯
價錢比較主觀一點但都還可以接受
這次算便宜120元
檸檬水很棒"
 Jack Huang ,https://www.google.com/maps/contrib/116369946811498577869/reviews?hl=zh-TW,4,False,17,全自助餐，菜色多算是不錯，價錢還算公道，挾菜時請注意菜量，多了算二份或者更多，少了也是一份，不要吃虧了。每個結帳人算價格有些許差異，現場無標準示範菜量。
 茄子徐 ,https://www.google.com/maps/contrib/110080814338211057504/reviews?hl=zh-TW,1,True,8,價格隨便喊，兩塊肉一顆蛋要價120
 林P ,https://www.google.com/maps/contrib/102577555938960591182/reviews?hl=zh-TW,1,True,122,"給兩顆心最多了，動線差，一堆三八歐巴桑插隊插的理所當然，歐巴桑沒家教就算了。
主要是店內動線差到不行，都不知道哪裡是夾菜哪裡是排隊，一堆死老人一直狂插隊。
菜的價錢根本黑白喊，我跟我朋友夾一樣的量一樣的菜，價格一個100一個85。吃的很幹。不如買7-11"
 wolke lin ,https://www.google.com/maps/contrib/117987663069147838118/reviews?hl=zh-TW,3,False,8,這樣被收255元….
 more crony ,https://www.google.com/maps/contrib/102394951932119908340/reviews?hl=zh-TW,1,True,51,這家菜色本來是不錯，所以常來買。但今天買了四道菜：豆芽、胡蘿蔔絲、麵筋、大黃瓜。兩格式紙盒七分滿，居然要120！價格是平常裝滿五道菜的150%以上。實在太誇張太過分了！
 YC Su ,https://www.google.com/maps/contrib/102667460080182255370/reviews?hl=zh-TW,3,True,33,"菜色十分多樣，品質及調味也相當不錯，是個外食均衡好選擇。
有些人會覺得稍貴，但個人在不吃澱粉、又想吃少量多種菜色的狀況下，這樣的價錢相較其他餐廳算是很實惠的。
以下是缺點：
算價錢是用目測而非秤重，有失公允。
希望沾醬能提供不加辣的醬油，不然醬油類只有很辣的醬油跟醬油膏兩種選項。
托盤有時沒洗乾淨。
電視台永遠是TVBS，我每週下班來吃都不斷聽到歌頌韓X瑜的新聞，令人倒胃口。希望能轉到較無政治色彩的電視台，例如電影或體育台。"
 Takuan Chen ,https://www.google.com/maps/contrib/107356003115499869281/reviews?hl=zh-TW,5,True,123,100多樣的菜色，8、9種新鮮的煎魚，4種湯品，實惠的價格......像媽媽煮的菜。二樓冷氣50個座位，要注意人多的時候排隊排3排，要耐心排，餓一點，東西更美味。
 Maki Wang ,https://www.google.com/maps/contrib/117875687828415256241/reviews?hl=zh-TW,1,False,7,價格亂算有夠貴，有個人高馬大的女的超兇，再也不去了
 Ms LU ,https://www.google.com/maps/contrib/108080277353336911293/reviews?hl=zh-TW,1,False,5,強烈建議買之前要去看一下結帳的是哪一位，一條魚60，一塊白斬雞肉片25？一樣的菜，每次的計算標準都落差很大，根本受氣！雖然說目測計價本來就會不同，但每次只要是給「那位」結帳，總價格就會超過自己預估的非常多，問過計算方式，每樣菜都給那位自由心證加個五塊十塊的話，不如改天再來買！等不是那位結帳時再考慮要不要夾菜！換別家吃就好
 Johnason Wei ,https://www.google.com/maps/contrib/111084754068399756767/reviews?hl=zh-TW,1,False,2,菜色豐富選擇性不錯，但價格計算不合理，曾連續兩天刻意選同樣的菜色(一青菜一糖醋肉一豆腐一顆滷蛋+小碗白飯)第一天80元第二天110元，詢問如何計價110元？理由是糖醋肉配菜的青椒挑太少而肉的比例太高，我個人不愛吃青椒難道不能選擇嗎？這種隨老闆心情自由解釋的計價方式這能說謝謝~不見！
 中等美女 ,https://www.google.com/maps/contrib/111187210589569567845/reviews?hl=zh-TW,3,False,115,"這是間高價位自助餐，一個字[貴]，他們的白飯很好吃，大粒飽滿10元，青菜15元，夾多就多5元，算20，再多就2份的量就30元，肉類30元，看數量加收，排骨50元，雞腿、煎魚片就很貴50~70元，湯要付錢另買，室內用餐有免費茶可以喝，用餐區有1、2樓，還算好吃，價格很貴，記得錢要多帶一點，早上11點門口有推出特價便當(10：30開始陸續出)，每個60元，現在漲價是65元，賣完就收，男生應該是吃不飽.
我好幾次算錢被貴得嚇到，也看過有人太貴，跟算錢小姐大小聲，發怒說不要了，如果不是老媽還沒吃，我是不會吃這家的，感覺我連自助餐都快吃不起了，老媽吃客拉客，我吃85元的三寶飯，推薦大家去買三寶飯，就在頂好超市門口對面，現在改家樂福."
 Chen Wei Ting ,https://www.google.com/maps/contrib/111675514855516087493/reviews?hl=zh-TW,2,True,321,同一個阿姨結帳，夾一樣的菜色，有時價差到80元，雖然是偶爾算得比較貴，但已經少去了，還是吃附近固定價位的便當就好
 Nina ,https://www.google.com/maps/contrib/102806186992304859761/reviews?hl=zh-TW,1,True,54,"同樣菜色價格變來變去
某次一個人吃飯被算到130很驚訝的問老闆我的宮保雞丁多少，老闆竟然用倒算的
扣掉其他菜得出我的雞丁40塊（牆上明明標35）
黑店，不要來"
 高Linda ,https://www.google.com/maps/contrib/109313888028465496665/reviews?hl=zh-TW,5,False,4,"菜色多，新鮮、乾凈！
服務人員親切。
用餐環境乾凈~
2樓洗手間也非常乾凈喔。"
 人路 ,https://www.google.com/maps/contrib/106666063285839301496/reviews?hl=zh-TW,1,True,42,蠻貴的😊
 sandra wong ,https://www.google.com/maps/contrib/117869184170686018884/reviews?hl=zh-TW,1,True,761,"很多時候中午去包便當,
跟晚上去包便當,
點同一樣的東西,
可是價錢可以差很大,
好幾次去夾菜的時候,
莫名其妙被那一些送菜的阿姨直接撞開,
沒錯是直接撞開唷!!
難道講一聲讓開有那麼困難嗎？
一點禮貌都沒有!"
 柴柴 ,https://www.google.com/maps/contrib/100251807495538034578/reviews?hl=zh-TW,3,True,128,"每次去每次價格都算得亂七八糟的
明明拿一樣的東西價格可以90元~110元浮動
東西都拿少少的也不敢拿太多肉沒想到還可以算到破百
我寧願去其他地方買便當"
 james fang ,https://www.google.com/maps/contrib/102754914252489810476/reviews?hl=zh-TW,4,True,16,"價格公道，食物可口，環境整潔、寛敞，布置悅目，各個角度皆可看到電視，餐巾紙取用方便，廁所乾淨衛生，假日無休，此其優點。
缺點是：生意太好，計價收費的老闆娘面無笑容，收錢不知言謝，態度尚可改善。
放餐盤之托盤僅做擦拭，未經常刷洗，油膩得很。
希望服務繼續進步，生意不斷興隆，造褔地方消費者。"
 Princess Chien ,https://www.google.com/maps/contrib/102120549693927315537/reviews?hl=zh-TW,1,False,4,"要不是真的沒東西吃也不會進去
前兩次夾的菜45元
今天夾的菜色70元
前兩次還有三塊肉
今天只有夾一塊肉
反應還回我，菜不同所以價錢不同
整個價錢也差太多了吧
我真認真考慮吃隔壁素食
認真覺得很扯"
 X TC ,https://www.google.com/maps/contrib/103435752266575322013/reviews?hl=zh-TW,4,True,903,偶爾來吃還不錯！😄😆🤣😁😀
 J - NO ,https://www.google.com/maps/contrib/117140372436751266086/reviews?hl=zh-TW,4,True,49,菜色豐富好吃，很愛去買，但CP值不算高，價格偏貴，而且夾一樣菜色，每次價格都不太一樣，大概會差5元，不過不影響意願，會再光顧
 Sirus ,https://www.google.com/maps/contrib/109580785542137887947/reviews?hl=zh-TW,1,True,78,"這家店真是無比的爛又貴
好不好吃這個就沒心情去評論了
看看我上傳的照片一盒葷一盒素居然要收費270元...簡直是搶劫！
店內環境壅塞夾菜結帳路線混雜打結
夾個再排隊人海中塞個半天最後再排隊8分鐘才排到櫃檯給一個算帳貴又手腳慢的老太婆結帳

這家店之所以能夠存活沒倒閉根本是因為這附近沒有同性質的店競爭所以爛成這樣還沒倒掉

不想踩雷的或者覺得這樣合理想去冒險的歡迎來探險這樣的網路負評跟分數果然不是空穴來風這是我第一次給一家店這麼差的網路負評！"
 林煒哲 ,https://www.google.com/maps/contrib/100450665480869988673/reviews?hl=zh-TW,1,False,1,算錢的是一個中年婦女，貴死了，兩樣菜一樣主菜+一碗飯這樣110元，問她怎麼算的就說菜各20，主菜60元，重點是我付完錢後轉身要離開，要走上樓梯，他把我叫住說我還沒付錢，我氣噗噗走下樓說要不要請他調一下監視器，他想了一下才讓我離開，用餐情緒有夠差。
 gin Lu ,https://www.google.com/maps/contrib/109230767048576368157/reviews?hl=zh-TW,1,False,4,有史以來吃自助餐1人份可以吃到140元，活了30幾年來頭一次，就一般一人份的量（3樣副菜、1樣主菜白斬雞2.5小塊）及菜色，卻等於吃小火鍋的價格，而相對沒小火鍋的豐富及量多，吃過最貴的自助餐了。
 Dean McDaniel Keith ,https://www.google.com/maps/contrib/108338368463976674484/reviews?hl=zh-TW,2,False,13,食物看起來ok，沒吃到，還有足夠營業時間吃卻被趕走
 黃愷 ,https://www.google.com/maps/contrib/109514029997123397225/reviews?hl=zh-TW,3,False,39,每天10:30都有60元的餐盒外賣!
 Freeman Tsuei ,https://www.google.com/maps/contrib/106236436737152189928/reviews?hl=zh-TW,1,False,2,結帳自由心證，態度傲慢！
 Dylan Blue ,https://www.google.com/maps/contrib/105220006054468807366/reviews?hl=zh-TW,2,True,427,"2020.11飯太軟爛，沒之前好吃，菜有點油。
2018.價格比以前貴，兩人各兩菜一肉一魚，要$190,大碗飯，比以前貴$30~50。"
 三月 ,https://www.google.com/maps/contrib/103265699608438450214/reviews?hl=zh-TW,2,True,164,"鄰近景美捷運站的一間小餐館，
開設已有十幾年，
菜色多樣，也有數種湯品可選擇。
不過負責結帳的小姐，
臉色及價格似乎會隨心情起伏，
幾次選擇一樣的菜色、
夾的份量也一模一樣，
但偏偏結帳金額就是不同。
不只個人如此，多位同事亦有相同經歷。
是比較讓人詬病的地方。
此外，店內走道稍嫌狹窄，
尤其幾位店員在打包餐盒時，
常佔據夾菜、結帳的通道，
影響速度和時間，感覺不便。"
 yushen Chang ,https://www.google.com/maps/contrib/109129426204590093358/reviews?hl=zh-TW,1,False,12,因為工作地點不得已吃這間，定價浮動非常誇張大（感覺不是菜價因素，感覺亂算）身為景美人，極不推！
 王炳然 ,https://www.google.com/maps/contrib/107537013599448021287/reviews?hl=zh-TW,5,True,62,菜色方面美味可口品項蠻多每天生意都很好他的缺點是價格有點高每天都有很多人上門光顧都要排隊
 Brittany ,https://www.google.com/maps/contrib/109507170290298082714/reviews?hl=zh-TW,3,True,91,二樓用餐環境不錯，菜色多樣、鐵板現做煎魚，是店家的優勢；價格較一般貴上15-30元，連一碗湯要價10-15元，會令顧客不敢點太多。
 kuo grace003552 ,https://www.google.com/maps/contrib/117242173713949104489/reviews?hl=zh-TW,1,False,2,"服務態度超差，我自帶餐盒裝菜，在自行打包時，就曾被喝斥""你還沒付錢""...，近日我在自行打包時漏油，專門在包裝餐盒的店員拿張紙叫我到旁邊拭擦，掌櫃的女子不但對著她大喊""他還沒付錢""...，還繼續罵""早就該把錢準備好，.....浪費她的時間....""好像在對待乞丐，
想問該掌櫃的女士，人有三隻手嗎?蓋便當盒是需要2隻手的，如何先把錢準備好?一點同理心、良知都沒有。其他用免洗餐具的人由你們打包，自然可立即掏錢，...我自行打包，頂多浪費你十餘秒，相信排在後面的顧客也不致於不耐煩，生意人需要這樣惡形惡狀，把自備餐具的顧客當作是賊嗎?"
 澎大海 ,https://www.google.com/maps/contrib/115874117037264828202/reviews?hl=zh-TW,1,True,21,味道尚可店員超不親切尤其是算帳的那位大姐臉超臭價錢更是隨他們的心情亂算隨便夾個兩樣青菜一片肉排竟然要120元真的是一星級的水準卻要5星級的收費
 Lisa Ru ,https://www.google.com/maps/contrib/107078753706957471889/reviews?hl=zh-TW,2,False,18,夾一點點不知道在貴什麼，有次夾塊排骨和幾顆糖醋肉竟然算我60，夾多100以上，夾少也80幾，怎麼好意思收那麼多，垃圾店，奉勸大家真的不要去。
 psh信弘 ,https://www.google.com/maps/contrib/104122307591388312732/reviews?hl=zh-TW,1,True,10,東西選擇多，食材也不錯吃，唯一的污點遇到這個阿姨我都轉身走人，因為價格隨他亂算。問他他回給你的理由只會有損店家風評而已，瞎，好像不關他的事都是店家的錯，但是算價格的是你，無言以對。
 Karen- Chang ,https://www.google.com/maps/contrib/109479736452887128571/reviews?hl=zh-TW,2,True,37,"菜色偏油及重口味，價格太高(不是算重量，取決老闆心算價格)，計算方式無規則可循，買了幾次都回會被嚇到；
台北市自助餐店真的太少了"
 趙秀英 ,https://www.google.com/maps/contrib/108735943495503148189/reviews?hl=zh-TW,4,True,587,菜色多樣好選擇口味尚可有一二樓的用餐空間也有熟食炸物及鐵板料理結帳以目視論價這點可能有失準確性沒挑幾樣菜一不小心就可能破百何不採取秤重價位實在是不怎麼親民但附近人口居多經營自助餐型態的店家又少以致於生意始終不錯
 Jessie Ku ,https://www.google.com/maps/contrib/103006431722893827393/reviews?hl=zh-TW,1,False,4,"對自帶環保碗的客人非常不友善，價格明顯比用他們丟棄式餐盤來的高，而且屢試不爽。
非常不值得支持的一家餐廳，變相強迫顧客使用不環保的丟棄式餐具，只為圖他們作業方便！

另外，他們的計價方式非常不透明，價格完全由站在櫃檯那位決定，因此他們如何定義你夾的菜的多寡，你完全無根據可尋。"
 陳國禎 ,https://www.google.com/maps/contrib/102288407916914115778/reviews?hl=zh-TW,1,True,483,偏貴，而且跟同事夾一樣的菜，才體會人長的醜會被多收錢。白飯有時候很香Q，有時候像是小石子，看運氣。店內只要看得到碰得到的地方，都很油膩，走路有可能會被黏在地上的程度。
 侯傲東 ,https://www.google.com/maps/contrib/107290605230999073300/reviews?hl=zh-TW,1,False,1,這家自助餐店吃了15年了他們的菜每天固定就是那些菜色沒有什麼新菜色而且選4個菜份量很少的話價格都算的很貴
 LongN Cheng ,https://www.google.com/maps/contrib/114042462176150157406/reviews?hl=zh-TW,1,False,15,"東西很貴
魚裡面竟然還沒熟吃了差點吐了
不會再來消費"
 Danny Yang ,https://www.google.com/maps/contrib/108625124849629067404/reviews?hl=zh-TW,1,True,13,共110元，供大家消費前參考
 Louis chen ,https://www.google.com/maps/contrib/103468398979668137401/reviews?hl=zh-TW,1,False,9,夾了兩盒菜，沒買飯，一盒都是青菜，另一盒只選兩樣主菜，算我290，問一下價錢，態度很差，叫我自己去看前面有價目表，以後不會再去的自助餐，這菜色在新店知味自助餐，不到200元。
 Yolanda You ,https://www.google.com/maps/contrib/117823671325840402795/reviews?hl=zh-TW,1,False,8,價格隨櫃台阿姨心情算錢，三菜一點肉加飯就破百，真的是誇張貴~不實收費，這樣收費還不如吃池上雞腿便當~不會再光顧
 Jack Wu ,https://www.google.com/maps/contrib/115105414262421792887/reviews?hl=zh-TW,1,True,29,排隊的人跟夾菜的人都擠在一起，工作人員還經常擋著通道。三菜一魚就一百多，今天的豆皮涼菜還酸掉。
 Eugene Chang ,https://www.google.com/maps/contrib/103128233930106747489/reviews?hl=zh-TW,5,True,273,"菜色昌多樣,價格實在,還有湯品甜湯可以選購,也有免費紅茶,但是大概7:30後菜就幾乎被搶光囉~"
 The Boy Who Lived ,https://www.google.com/maps/contrib/106829361204644156523/reviews?hl=zh-TW,1,False,3,夾的量跟平常一樣，應該只要$70-75，但是換一個人來算錢就變貴，竟然收我$95!
 Victor Huang ,https://www.google.com/maps/contrib/110826659188132156495/reviews?hl=zh-TW,1,True,32,一樣的菜色價格天差地遠，環境衛生也越來越差，吃個飯還要擔心害怕錢夠不夠，不會再去了
 林區 ,https://www.google.com/maps/contrib/114112216967156301911/reviews?hl=zh-TW,2,True,76,價格高低不一定，結帳有點大驚奇，但是景美人沒什麼選擇，繼續吃吧！
 Larry Yueh-Feng Li ,https://www.google.com/maps/contrib/108552874242889646388/reviews?hl=zh-TW,3,True,5,菜色多樣，但是價格不透明，計價是由店員用眼睛看，曾經連續五天夾一樣的菜，價格卻在65到85之間跳動
 Alan Huang ,https://www.google.com/maps/contrib/110472050941527954777/reviews?hl=zh-TW,2,True,67,"一片魚一份雞肉一顆滷蛋兩個菜一碗湯一碗飯要價150,口味普普,過個橋往大坪林價錢大概會少40-50,大家可斟酌價位"
 Roger Tsai ,https://www.google.com/maps/contrib/116848471521671060900/reviews?hl=zh-TW,4,True,509,菜色很多也可口，價錢公道，空間寬敞舒適還有二樓。算是尋常午晚餐的好選擇。如果能改用環保餐具的話就給五顆星。
 胡文秋 ,https://www.google.com/maps/contrib/100536470429147299923/reviews?hl=zh-TW,2,False,1,"三菜一魚價格既然要180元超級貴感覺上不太公平,我有問結帳那個歐巴桑我說用目趁的我是希望能夠有趁仲量的比較公平一些."
 Chou Tien-chi ,https://www.google.com/maps/contrib/117348031986823530573/reviews?hl=zh-TW,1,True,219,"只有一樣肉三樣菜，這樣要280元
價格亂算毫無標準，從此拒絕往來
買三個池上便當還比這個划算太多"
 游建平 ,https://www.google.com/maps/contrib/103515506760382922729/reviews?hl=zh-TW,1,True,3,"三片雞肉計價$75
心情不美好"
 黃美雲 ,https://www.google.com/maps/contrib/108457059455781762191/reviews?hl=zh-TW,1,False,13,工作人員戴了手套卻又摸菜又碰工作台，原來只是怕自己的手油。夾子夾掉到地上的菜，都碰到地上地毯了還直接继續夾菜。工作人員聊天都口沫橫飛不戴口罩。真是不衛生。
 Jerry Hsu ,https://www.google.com/maps/contrib/114037376736533907387/reviews?hl=zh-TW,4,True,355,"菜色多樣且烹調方式不錯
價位稍高需要有技巧性地夾菜
一般離峰會比較優惠不過相對
菜色就少不少"
 林亞當 ,https://www.google.com/maps/contrib/108474573850532215777/reviews?hl=zh-TW,4,False,70,"菜色不錯,算精緻,要是常常吃,就會覺得有一點貴"
 陳笑棠 ,https://www.google.com/maps/contrib/101959425937865226099/reviews?hl=zh-TW,4,True,265,還不錯，菜色多
 Yoyo Cheng ,https://www.google.com/maps/contrib/110363630607069554120/reviews?hl=zh-TW,1,True,73,菜色普通，價格非常貴的自助餐。一樣菜只要被夾了幾乎就會算15塊起跳，喜歡少量多樣的要小心。
 李海泉 ,https://www.google.com/maps/contrib/116396596349310913540/reviews?hl=zh-TW,3,True,250,菜色多，價錢合理！
 Emma Liao ,https://www.google.com/maps/contrib/101082586938746018016/reviews?hl=zh-TW,1,False,2,"有人覺得周末和周間的價格價差很大嗎?我真心希望有別家自助餐來這平衡他的菜價，和分散人潮…
還有，店內的消毒水味超重和算錢的人真的臉很臭很臭很臭…我每次進去都先得自已有心裡準備…"
 吳紹維 ,https://www.google.com/maps/contrib/105725057323426952084/reviews?hl=zh-TW,1,True,158,菜色多樣，但是價格不透明且偏高，當負責結帳的濃妝大嬸報出比你預期中高上兩截的價格，頓時有種被當盤子宰的感覺
