user_name,user_profile_url,rating,local_guide,comment_num,comment_text
 李祥維 ,https://www.google.com/maps/contrib/107963971389008165748/reviews?hl=zh-TW,5,True,102,特殊的意麵配上甜鹹的甜辣醬，還有大把的韭菜，老店獨有的好滋味
 wendy H. ,https://www.google.com/maps/contrib/113858419049185203093/reviews?hl=zh-TW,1,True,25,"我在菜單註記不要甜辣醬，店員大媽很兇，瘋狂爆氣說：「不要醬用講的就好，用寫的看不懂啦！這樣寫⋯⋯」
傻眼的是，大媽罵完，一樣上了有加醬的餐😇
我說我不要醬，她跟我爆氣跳針說「啊你用寫的我都看不懂！」😇死不認錯👏所以我剛剛被罵心酸的嗎？

還有店員說餛飩麵點大碗，可以選麵多或餛飩多，然後我點餛飩多，大媽店員又爆氣說「你這是什麼！你就點一碗小的餛飩麵，再單點一份餛飩！」（明明兩者價格一模一樣😊）我跟他說是店員教我這樣點，大媽啞口無言，但繼續瞪著我😊

這個店員服務態度極差，她沒有跟廚房說不要醬，事後不認錯繼續怪客人。
其他店員一樣偏袒她，一致說是畫單的問題，問題是我的單從頭到尾都在我的桌上，他們拿的是大媽口述的單。
況且客人不知道店裡的規則很正常，我是花錢吃飯，不是花錢受罪，吃頓飯還要聽你碎念口氣差。"
 Yulin Tsai ,https://www.google.com/maps/contrib/108230793202349175392/reviews?hl=zh-TW,4,True,129,意麵和餛飩湯便宜又好吃！
 S小姐 ,https://www.google.com/maps/contrib/117407984918542825423/reviews?hl=zh-TW,5,True,34,甜辣醬乾麵超好吃
 Wanperng Lin ,https://www.google.com/maps/contrib/102996098049230924140/reviews?hl=zh-TW,4,True,452,口味道地，意麵一人一碗不太飽
 陳姿宇 ,https://www.google.com/maps/contrib/103985373149869417357/reviews?hl=zh-TW,4,True,129,"麵條很細有其獨特性，搭配古早味紅醬和青蔥
魚丸採用歸綏街本店附近的佳興魚丸
餛飩是小粒的，也有古早風味的特色"
 T 99Derrick99 ,https://www.google.com/maps/contrib/114339799174608106115/reviews?hl=zh-TW,2,False,4,抱著期待來吃卻有失望感，不會再去吃了。叫乾意麵（應該是招牌吧）只有意麵和一點韭菜連一個肉片也沒有$60，點肉品小菜份量少，3個人用餐花450，沒吃飽....是你會再來嗎？
 郭峻齊 ,https://www.google.com/maps/contrib/106151997085754188701/reviews?hl=zh-TW,1,False,8,我當時吃完麵後，打算叫他上冰，結果他直接無視我，還給我一個皺眉。我能理解客人多的時候，心情真的會不好，而且店員也沒很多，真的會忙不過來，但身為客人的我，這樣的情況根本難以接受……
 葉常芸 ,https://www.google.com/maps/contrib/118304227116619088162/reviews?hl=zh-TW,2,True,86,多年來一直覺得麵是好吃的，環境也乾淨，但服務人員的態度老闆在不在差很多、老闆不在碗盤都用摔的，櫃檯「大」美女的態度好像去吃碗麵害她們忙很對不起她，以為只有自己這樣感受，有次跟住在附近朋友去才發現大家都一樣認為，以致都期待去的時候老闆在，一陣子沒去了，天冷想吃麵特別去一趟，多年都是坐下來店員來畫單、那天下午不知道是否長官不在，已經坐下來叫我自己去櫃檯拿單畫，畫單時又站一旁不動很給壓力，然後店員開始大聲聊天，說同事八卦等等、完全無視客人，店員幾乎都是阿嬤級少數中年人，但服務沒有阿嬤級對親切，老闆不知道有沒在看評論了解客人的心聲？2顆星是給食物，少的三個星是服務人員的態度影響的。
 Vincent ,https://www.google.com/maps/contrib/112921354209125967310/reviews?hl=zh-TW,1,False,6,"簡單的意麵我以為大碗
可能加個10塊
媽的60還不飽
大碗完全沒到兩個小碗的量
吃完超空虛
還有那個肝連是怎樣
那個量我以為是給黃金鼠吃的
還敢收60
不要跟我說給租金啦！
這租金吃的還真不ok"
 Boshin “Cindy” Yang ,https://www.google.com/maps/contrib/106292823380761764062/reviews?hl=zh-TW,1,True,21,"餐點很好吃。但是員工很愛八卦，每次來都會聽到員工一直討論客人的事情。員工也很愛窺探別人的隱私。我拿我手機給我媽媽看照片，有位大媽（員工）就說那照片是你們家嗎？

我當下翻白眼很不爽也很不舒服，請問你們有職業道德嗎？

以後不會再來！

你們不是八卦記者，我們不是你茶餘飯後可以拿來討論的對象！"
 陳玟靜 ,https://www.google.com/maps/contrib/105861687971641986780/reviews?hl=zh-TW,4,True,18,好特別，第一次吃到用甜麵醬的乾麵，麵也很Q，不過小碗份量真的不多，男生會吃不飽，有機會可以再去吃。
 Hua Lin ,https://www.google.com/maps/contrib/108125451358354509516/reviews?hl=zh-TW,4,False,25,意麵各家都不一樣，在台北我覺得這家意麵王的意麵最好吃。
 Henz Lin ,https://www.google.com/maps/contrib/112867631097053669946/reviews?hl=zh-TW,5,True,137,意麵煮的熟度適中，是我喜歡的硬度。甜辣醬可以多加。梅子冰好吃，只是沒有牛奶要注意xd
 Angie Lin ,https://www.google.com/maps/contrib/111279326499125776412/reviews?hl=zh-TW,5,True,27,從小吃到大，非常喜歡
 Andy Hung ,https://www.google.com/maps/contrib/107455892342674746517/reviews?hl=zh-TW,4,True,"1,855",2018-05點湯意麵，麵Q彈好吃
 不專業護理師 ,https://www.google.com/maps/contrib/110519616667814239693/reviews?hl=zh-TW,5,True,250,"好吃的意麵
我點的是乾麵
餛飩也好吃
味道很香

我姪女說
「我不喜歡這間店」
我問
「為什麼？是麵麵不好吃嗎？」
她說
「不是，是因為那個阿伯說沒吃完要去洗碗」
哈哈😄⋯⋯
不過真的很好吃
一上桌也是清空喔！
謝謝那位阿伯"
 Tony TSAI ,https://www.google.com/maps/contrib/116426484273990357962/reviews?hl=zh-TW,5,True,150,簡單食材，一麵一湯，好吃六分飽的享受！
 Panny Lin ,https://www.google.com/maps/contrib/115530635350370688991/reviews?hl=zh-TW,5,False,184,"感覺只有3.9顆星太委屈了。
東西實在，麵體特別而且口感不錯，單純的好味道。"
 賴竺均 ,https://www.google.com/maps/contrib/114646638519447665011/reviews?hl=zh-TW,3,True,199,口味很普通，只賣麵跟米粉跟小菜，品項很少，特別的是還有賣剉冰，環境還算乾淨，店裡阿姨招呼很熱情，價格平價，沒錢的時候可以來填飽肚子
 T Carrie ,https://www.google.com/maps/contrib/117515113226518794886/reviews?hl=zh-TW,3,True,703,"意麵真的好吃，醬料獨特，很對學生胃口，放學時間很多學生來
但是!!!真的貴!!!小小一碗乾麵就要30塊，男生絕對吃不飽，因為連女生都吃不飽了...兩三口就沒了。大碗的份量加倍，價錢也加倍(60塊)，這樣是大碗沒錯，可是再點個湯就要100塊了，100塊吃一碗乾麵跟一碗湯...自從發現這點就不再來了
是好吃沒錯，但是比較適合小鳥味，或是宵夜想吃點鹹的解解饞，不然當正餐..要不是吃不飽就是太貴，100塊你可以有更好的選擇"
 Na na ,https://www.google.com/maps/contrib/105990419067951331124/reviews?hl=zh-TW,5,True,90,"麵很好吃
要不是怕胖真的很想學男友一樣叫兩碗吃"
 oscar kao ,https://www.google.com/maps/contrib/115816266994035313855/reviews?hl=zh-TW,3,True,85,一般般表現平常，至少算平價
 J J ,https://www.google.com/maps/contrib/107139601847969047483/reviews?hl=zh-TW,4,True,631,"乾意麵加上甜辣醬味道很特別，麵體Q彈好吃。餛飩味道鮮美。店很乾淨，服務熱忱。
小菜的豬心/紅燒肉味道都不錯，但份量有點少。"
 Jia-Ren Chiu ,https://www.google.com/maps/contrib/115552852076585550553/reviews?hl=zh-TW,4,False,85,餛飩好吃又有味道，湯好喝，我比較喜歡喝有晴菜的，不是加韭菜。麵好吃，但是若沒把煮麵湯濾乾，味道會差很多，可惜店員有時會忽視，黑白切，也不錯，冰也是特別特色，記得要加奶水更風味。
 LuCKy MaRUko ,https://www.google.com/maps/contrib/118034206939845261899/reviews?hl=zh-TW,4,True,641,餛飩皮很特別簡單樸實的滋味
 葉建宏 ,https://www.google.com/maps/contrib/105380018721604354267/reviews?hl=zh-TW,3,True,19,麵的口感相當特別，搭配店家特製醬料伴麵，不錯吃，其餘店內提供菜色憑良心說，份量實在不怎麼樣，或許是因為店內成本攤提關係，就這樣囉。
 SP R ,https://www.google.com/maps/contrib/101755859978395235519/reviews?hl=zh-TW,3,True,486,座位環境比另一家寬敞，口味好吃，但是麵和小菜的份量都很小，小貴，只能當點心不能當正餐。有開發票。
 RS (RS) ,https://www.google.com/maps/contrib/111161384084412832842/reviews?hl=zh-TW,3,True,734,簡單古早味小吃、刨冰
 Ikai Pan ,https://www.google.com/maps/contrib/114577797033874391101/reviews?hl=zh-TW,4,True,15,三種冰+牛奶，65塊，好吃😋
 ChengHan Kuo ,https://www.google.com/maps/contrib/114794140026567689132/reviews?hl=zh-TW,4,True,691,份量偏少，口味不錯！
 尚Lerevi ,https://www.google.com/maps/contrib/101484041406259356440/reviews?hl=zh-TW,5,True,46,"去看柯南展順便經過，和朋友進去點了兩碗。
吃第一口後.......
「老闆再來兩碗！」
我不喜歡紅紅醬所以沒有加。但是簡單的調味勝過我吃過的所有意麵。
然後冰品的部分也是，我好喜歡麥片，還會牽絲，真的有夠好吃。沒想到傳統冰品會讓我這麼驚艷。
下次再經過我要吃三碗。"
 Tony ,https://www.google.com/maps/contrib/101380559787981585464/reviews?hl=zh-TW,1,False,15,"店員態度非常差，在菜單上註明不要加醬還會被唸說用講的就好，結果呢？跟他說完上來的還是都有加醬
我也是醉了"
 高龍福 ,https://www.google.com/maps/contrib/102085128402068555485/reviews?hl=zh-TW,4,True,219,意麵美味，價格低廉，台北竟然還有30元的價格。
 William Chang ,https://www.google.com/maps/contrib/117536715122721893063/reviews?hl=zh-TW,4,True,87,80年老店就表示在士林開很久了！忽然想吃鯊魚煙可以來這裡！小吃店意外地有開統一發票！
 黃小貝的媽 ,https://www.google.com/maps/contrib/118446646077777733980/reviews?hl=zh-TW,3,True,117,意麵王的麵條好細，味道尚可，好小碗
 黃郁涵 ,https://www.google.com/maps/contrib/115708812439764485672/reviews?hl=zh-TW,4,True,85,"以位置及餐點來說，才30元非常值得
乾米粉是加甜辣醬下去拌，吃起來有台南味，不過吃久了有點膩
魚丸湯很香但味道稍微清淡了點"
 Peter Huang ,https://www.google.com/maps/contrib/101201948317510931495/reviews?hl=zh-TW,4,True,319,雖然有些人嫌價格貴，但外面一堆麵店的價錢更貴還沒什麼特色.這家的意麵真的不錯！
 cer e ,https://www.google.com/maps/contrib/115262870477675600509/reviews?hl=zh-TW,1,False,11,"意麵湯喝了會想吐
（添加化學味素過敏體質不適合）"
 NWD ,https://www.google.com/maps/contrib/110391659750061016248/reviews?hl=zh-TW,2,True,69,或許意麵口味是老口味，但並不能稱為美味，只能說口味普通，但紅豆牛奶冰就讓人不敢恭維，建議莫嚐試，以大紅豆混充紅豆，味道平淡，牛奶也無奶香唉！
 莊國華 ,https://www.google.com/maps/contrib/110214244344708949455/reviews?hl=zh-TW,4,True,"1,686",跟總店口味一樣好吃
 蕭兆辰 ,https://www.google.com/maps/contrib/104095577611995428689/reviews?hl=zh-TW,3,True,14,"店裏是古早味的口味
意麵小菜好吃
甜辣醬好吃
冰也有夠古早味
不過我還不夠老
吃不出箇中滋味
價錢在台北還可以"
 家欣 ,https://www.google.com/maps/contrib/105394621880522030920/reviews?hl=zh-TW,2,True,61,意麵好吃，但真的太小碗，三層肉一份50，算一算薄薄8片，門口櫃台還有外帶價目表，醬料一瓢要10元，有搶錢的感覺。。。雖然好吃，但我錢要花刀口上。先走不用送！
 真誠實 ,https://www.google.com/maps/contrib/115227176954669699030/reviews?hl=zh-TW,3,True,96,"乾麵很鹹、
叫了餛飩湯結果一樣鹹
總之…都過鹹
小菜份量…就不說了"
 邱信凱 ,https://www.google.com/maps/contrib/107880996603008498455/reviews?hl=zh-TW,1,False,4,煮麵的人換了以後還沒吃過煮熟的餛飩湯，跟員工反應阿婆還擺臉色很無語。
 童宇騰 ,https://www.google.com/maps/contrib/113572930314270346550/reviews?hl=zh-TW,1,False,3,"有夠難吃價格也很貴
點兩份湯麵只給一份
然後自己給錯還怪寫太小??
我畫正記符號誒"
 Cindy Huang ,https://www.google.com/maps/contrib/114806677210039491848/reviews?hl=zh-TW,1,False,8,不知道在吃什麼紅槽肉一盤50份量少還是冰的，魯蛋也是冰的餛飩湯像是清水煮，說是意麵王，乾麵感覺像是用現成醬料拌一拌，店家根本沒有在用心經營，滷個肉燥或是用心調味很難嗎？
 Ben Wu ,https://www.google.com/maps/contrib/115968566525667113218/reviews?hl=zh-TW,4,True,42,"士林這一家，比起歸綏街的那一家意麵王，好多了。1.停車方便，更屌的是：有緩衝期，30分鐘免費。
2.用餐的空間比較寬敞。
3.服務人員比較親切、敬業，不像歸緩街的員工常常忙著聊天，忘了旁邊所有的客人。
4.最最最厲害的是：廁所有冷氣，加上電風扇，上廁所保證不會流汗。
致士林意麵王的所有工作人員，謝謝你們認真的工作態度。我會用不斷地光臨，來肯定你們大家的用心！"
 Daiii C ,https://www.google.com/maps/contrib/111339351374667676859/reviews?hl=zh-TW,4,True,450,"很特別
比想像中好吃
（推薦意麵混沌）"
 Tina Cheng ,https://www.google.com/maps/contrib/101663154470519253527/reviews?hl=zh-TW,5,True,90,環境乾淨，店家使用瓷碗，不鏽鋼筷匙，乾意麵加上古早味紅醬真不錯吃，最愛他們家的豬心不會硬不會柴，燙青菜很清甜。服務也不錯。
 尚尚籤 ,https://www.google.com/maps/contrib/117724361084568559420/reviews?hl=zh-TW,5,False,2,"不是我要說啦
這個意麵是我吃過最好吃、最樸實的意麵
雖然我不喜歡加醬
每次吃完都想再來一碗"
 王呈功 ,https://www.google.com/maps/contrib/112688106814581961817/reviews?hl=zh-TW,5,True,83,簡單的美味，超級實惠的價格！難怪整間店高朋滿座！只是稍微美中不足的是吃完會比較口渴，可能味素放得比較重，腎不好的人還是盡量斟酌一下⋯
 J Jr. ,https://www.google.com/maps/contrib/103154116839415747901/reviews?hl=zh-TW,5,True,41,意麵樸實簡單卻味美。餛飩有自己的特色，口感略脆味濃。鯊魚煙則是適當的部位，柔嫩不帶腥。餐後來份古早味刨冰，更是大大的滿足，為忙碌的一天做了完美的休止。
 謝阿哲 ,https://www.google.com/maps/contrib/113585732030019674109/reviews?hl=zh-TW,5,False,9,這意麵算是我吃過最好吃的，男生最好都點大碗的來吃，不然絕對會吃不夠！！服務的品質也是很好，大推還沒吃過及正在看評論的（你/妳）快來吃看看🤣
 琛 ,https://www.google.com/maps/contrib/107362218870817920933/reviews?hl=zh-TW,2,False,18,小菜超貴份量超小
 nd Lin ,https://www.google.com/maps/contrib/112066728624864367890/reviews?hl=zh-TW,4,True,110,植入記憶的老味道。和本店的品質並沒有大分別，但這裡不像本店那麼擠。乾意麵的醬是蠻重甜味的，一般個人都會註明醬少。
 徐大均 ,https://www.google.com/maps/contrib/106969228264476158637/reviews?hl=zh-TW,3,True,106,窗明几淨價格合理相對於隔壁的店家此處較多來客一般而言色香味尚符合基本要求的學生族可多來光顧
 hanklo177 ,https://www.google.com/maps/contrib/100250503263981352196/reviews?hl=zh-TW,2,True,309,普通、意麵還可以，沒有大小碗之分，小菜cp値不高，最扯的是，湯沒味道，店家竟然叫我們自己加醬油，哇
 Jiun-Tang Tu ,https://www.google.com/maps/contrib/105111940480664323390/reviews?hl=zh-TW,4,True,58,入內拿單坐好後靜待服務人員過來點餐，消費略高，麵的分量較少，但相當美味。冰品是古早口味，要告知才會開始做。整體來說物有所值，會願意再來消費。
 Ansel Li ,https://www.google.com/maps/contrib/110193789251913098181/reviews?hl=zh-TW,2,True,270,好不好吃就甭談了，最基本的想吃個粗飽都不成。小碗就是塞牙縫的份量。鯊魚煙沒什麼香氣，口感鬆散粗。不知道到底主打賣什麼的。
 Carol H. Yan ,https://www.google.com/maps/contrib/106224007636235533110/reviews?hl=zh-TW,4,True,100,跟小時候記憶的一樣好吃，湯頭清淡～好吃；意麵的麵條自成一格～好吃！惟小菜的份量少了點，只能説刀工不錯～薄片！
 judy C ,https://www.google.com/maps/contrib/112624716381316563751/reviews?hl=zh-TW,3,False,14,麵好吃，但可以拜託老闆筷子遮蔽一下好嗎，整把朝上，如果一個肺炎咳嗽，大家都被傳染了！
 倪振耀 ,https://www.google.com/maps/contrib/118147557632069956358/reviews?hl=zh-TW,1,False,3,小菜超貴。肝連60元六片
 張艾咪 ,https://www.google.com/maps/contrib/112695598271943800037/reviews?hl=zh-TW,5,True,131,好味道的古早味小食，值得試試喔！讓你一來再來喔！
 陳福建 ,https://www.google.com/maps/contrib/101134476367778160850/reviews?hl=zh-TW,4,True,468,本店在歸綏街的意麵王，在士林中正路的分店，店裡面更舒適寬敞。簡單的辣味意麵，乾湯任客人選用，再輔以肉餡入味的餛飩湯，肉類小菜ˋ鯊魚煙ˋ燙魷魚，簡食就是一餐。吃完熱湯，還有布丁紅豆煉乳剉冰讓您解渴。
 M ,https://www.google.com/maps/contrib/105804211277160361526/reviews?hl=zh-TW,5,True,226,"店內明亮整潔、店員都是有年紀的叔叔阿姨們，但是非常親切有禮！
乾意麵及餛飩湯好吃，夠味，很久沒吃到這麼道地的古早味了～"
 won won ,https://www.google.com/maps/contrib/109009463963702611171/reviews?hl=zh-TW,5,False,36,意麵加了甜瓣醬很好吃，小碗的分量不多，適合再點個小菜、或湯搭配剛剛好
 jeng shaw ,https://www.google.com/maps/contrib/109867039235947384400/reviews?hl=zh-TW,4,True,248,古早意麵Q彈最特色是紅辣椒甜醬搭配餛飩湯不錯
 Milly Ou ,https://www.google.com/maps/contrib/101896304423954622218/reviews?hl=zh-TW,4,True,"1,426",30元意麵比較小碗，幾口就沒了，食量大的話要點大碗，麵條很細且蠻Q，不錯吃，餛飩湯普通。
 高淑津 ,https://www.google.com/maps/contrib/111591226082546722815/reviews?hl=zh-TW,4,True,66,在一面王用餐已經超過30年應該可以2選1其林一顆或兩顆星因為從來他的食物味道都很一致冬天夏天人多人少味道我不會差太遠是一個令人懷念的味道即使吃了30年還是會前往
 may kuo (小鎂人兒) ,https://www.google.com/maps/contrib/108741689200336341298/reviews?hl=zh-TW,5,True,67,從小吃到大，全家都愛的麵館，小鳥胃的我一碗乾麵、一碗餛飩湯就很飽，夏天再來一盤冰，大大滿足！
 Daphne Tai ,https://www.google.com/maps/contrib/111392885096437899819/reviews?hl=zh-TW,5,True,194,簡單的味道，價格實惠，用餐環境很乾淨！意麵硬度掌握的非常好
 劉建廷 ,https://www.google.com/maps/contrib/116637697825965626319/reviews?hl=zh-TW,4,True,63,"親民的價格，所以小碗算是吃精緻的
意麵的油蔥酥是關鍵，餛飩很紮實，好吃"
 張泰斗 ,https://www.google.com/maps/contrib/111018446902597155402/reviews?hl=zh-TW,5,True,96,意麵好吃.小菜也美味.飯後還有還可點古早味剉冰享用
 Vic ,https://www.google.com/maps/contrib/110554982448115222923/reviews?hl=zh-TW,3,True,372,水煮意麵伴五味醬，沒有任何其他配料，大份60元，CP值實在很低，不知為何生意一直很好
 WillDing ,https://www.google.com/maps/contrib/112797411188817228993/reviews?hl=zh-TW,5,True,85,好吃😋，大推，一定要點大碗的！
 王君如 ,https://www.google.com/maps/contrib/108278273022753323479/reviews?hl=zh-TW,4,True,40,"乾意麵湯意麵都好吃
但小碗份量超級少
要點大碗的才是一般正常份量"
 娃娃許 ,https://www.google.com/maps/contrib/102670295807257534830/reviews?hl=zh-TW,4,True,37,環境整理的很乾淨，意麵也好吃，就是小菜給的份量有點少。
 H ,https://www.google.com/maps/contrib/103647461383384635591/reviews?hl=zh-TW,5,True,709,物有所值，便宜、上菜快，味道不錯，值得特別一提的是，這樣的定位的店採用的是陶瓷碗跟不鏽鋼筷，衛生安全環保
 洪月娥 ,https://www.google.com/maps/contrib/116536876079592987142/reviews?hl=zh-TW,4,True,163,吃了許多年的台灣口味，不是很餓，不想吃大餐時，来碗意麵配黑白切，青菜。健康無負擔。是可信賴的老店
 Weiti Tseng ,https://www.google.com/maps/contrib/103141310983292317872/reviews?hl=zh-TW,4,True,26,店家服務態度親切，環境乾淨，麵很好吃!只是小碗不太夠，要點大碗才行!
 張秀蓮 ,https://www.google.com/maps/contrib/111439279591752687538/reviews?hl=zh-TW,5,False,88,我們家的最愛。不論意麵或冰都好吃。
 游志鈞 ,https://www.google.com/maps/contrib/106473664370304421610/reviews?hl=zh-TW,4,True,226,"美味啊～
份量小巧的乾意麵
淋上店家自己的醬汁
再點個豬心,臘腸,紅燒肉等等
最後再來個布丁冰品
啊～我醉了"
 許育維 ,https://www.google.com/maps/contrib/112212087447553882251/reviews?hl=zh-TW,5,True,279,"很妙的一家老店，賣麵也賣冰...
麵跟冰都是很古早的口味但就是好吃！"
 邱仲仲 ,https://www.google.com/maps/contrib/103763167589292963046/reviews?hl=zh-TW,5,True,108,乾意麵的麵很Q，醬非常特別，然後他們的混沌一定要吃過一次阿阿阿！超好吃
 霈霈 ,https://www.google.com/maps/contrib/115802017800777477478/reviews?hl=zh-TW,3,True,470,乾麵不錯.但分量偏少..算是較重口味的乾麵，餛飩湯的餛飩肉餡跟一般市售的是有稍微不同..口味上個人是覺得OK
 AL Lee ,https://www.google.com/maps/contrib/101913743061903905942/reviews?hl=zh-TW,4,True,57,乾淨、味美但份量均很小，當點心或者是還太餓的時候的正餐很合適。
 Ivy Lin ,https://www.google.com/maps/contrib/109021505798959256947/reviews?hl=zh-TW,3,True,488,麵條比一般市面上的意麵還細，醬汁是用甜麵醬，甜度偏甜。魚丸湯的魚丸很大顆，是較為厚實的口感。
 Yuan ,https://www.google.com/maps/contrib/117136741030825335394/reviews?hl=zh-TW,1,False,21,希望家慶媽媽趕快康復
 林玲玉 ,https://www.google.com/maps/contrib/103709931226393199475/reviews?hl=zh-TW,4,True,291,第一次吃到細的意麵，意麵上桌，看到只加一些紅色醬料吃起來簡單，麵條軟硬適中，非常好吃。
 芭尼力 ,https://www.google.com/maps/contrib/104944210998233014750/reviews?hl=zh-TW,5,False,51,鹹水意麵很好吃，不過分量跟價錢都很臺北市，是偏高的收費。
 Chi-Yu Chen ,https://www.google.com/maps/contrib/114343172383677953851/reviews?hl=zh-TW,1,True,104,外帶麵量根本不符合價格，幾乎是攤販兩倍價，非常的誇張。不想餓死的話請不要買。
 蕭文華 ,https://www.google.com/maps/contrib/101808061770551299660/reviews?hl=zh-TW,3,True,44,意麵不錯吃，雖然有點貴。冰點不推薦很普通，也是不便宜，60元。
 Huiwen Chuang ,https://www.google.com/maps/contrib/106829232762252348185/reviews?hl=zh-TW,5,True,37,從小吃到大，乾麵和餛飩湯是絕配！飯後來碗花生牛奶冰，享受！
 陳一仁 ,https://www.google.com/maps/contrib/107706015116026433436/reviews?hl=zh-TW,2,True,125,"麵湯和冰都不難吃但份量少價錢貴
不知為何這麼多人"
 Ansel Lin ,https://www.google.com/maps/contrib/108813638238439446834/reviews?hl=zh-TW,4,True,542,還不錯！小朋友很喜歡！
 ChengShun Lee ,https://www.google.com/maps/contrib/115250281534699802897/reviews?hl=zh-TW,5,True,41,點燒肉的話麵可以醬少一點，飯後肯定要來個麥角冰，麥角果然還是要白的才好吃！
 Lucas Chung ,https://www.google.com/maps/contrib/112019162482320851002/reviews?hl=zh-TW,1,False,6,明明是我先到的也點好餐了，服務生死不幫我點單，裝沒看到、我自己本身也是服務業的，我不懂是哪裡得罪你，今天你開門做生意，就不要挑客人！這種經驗我不會再去吃了！
 A-Kwon Fang ,https://www.google.com/maps/contrib/103714456755345789855/reviews?hl=zh-TW,2,True,"2,981",在其他區惡名昭彰的連鎖麵食店，不過士林區這家頂多就是你花了140還吃不飽、店員態度又差而已；加了甜辣醬的麵吃起來還好沒有怪異感無違和。
 章筑涵 ,https://www.google.com/maps/contrib/106721135806832660009/reviews?hl=zh-TW,5,True,45,吃了20年的店，乾意麵加甜辣醬，混沌湯，吃完再點個冰來吃，真是20年沒變的味道。
 eva shao ,https://www.google.com/maps/contrib/100048661079171765730/reviews?hl=zh-TW,5,False,5,口味道地的傳統好味😋
 Achilles Lin ,https://www.google.com/maps/contrib/117743963920878983827/reviews?hl=zh-TW,5,False,13,每次來士林有時候會來這裡吃懷念的口味他的乾意麵有點辣但口感相當好
 Itseemslike me ,https://www.google.com/maps/contrib/113596541720088783407/reviews?hl=zh-TW,4,True,62,"乾麵偏甜
餛飩湯好吃
價格實在
有給發票給推"
