user_name,user_profile_url,rating,local_guide,comment_num,comment_text
 LU YING ,https://www.google.com/maps/contrib/113283748784278180545/reviews?hl=zh-TW,1,False,2,"我從高中開始吃這間的牛肉麵,從店家默默無名時一碗不到100元的牛肉麵到現在名氣很旺又得獎一碗破200元以上,從可外帶到不能外帶僅能宅配(近期好像可以外帶了),從宅配是僅用塑膠袋裝到真空包....而我也破3X歲了。
以前很期待每次到台北可以吃上一碗,或者外帶十幾碗牛肉麵回家加熱,到宅配盛行用電話訂購宅配到府,都很讚,但是不知道什麼時候湯頭跟麵都變了,湯頭不在濃郁,麵條不再Q彈,我以為是我加熱的方法有誤,或者是宅配就不一樣了。
上周我特地到現場吃一碗,發現不用排隊了,當時還以為疫情關係,叫上一碗2百多的牛肉麵,非常失望.....湯沒味道(不是鹹不鹹,而是湯的濃郁感變淡到我覺得沒有牛肉麵的味道了),麵還有點糊了......。太糟糕了。
我還特別詢問了店員,他僅回我師傅也沒換,不可能不一樣....
我跟老公都覺得變得太多了,所以抱歉我這次僅能給一個星了....(附上當時先上小菜的照片...)"
 Wei Shan Chen ,https://www.google.com/maps/contrib/105253388880549493324/reviews?hl=zh-TW,2,True,84,"裝潢蠻高雅、現代的；用餐環境頗舒適。

然而餐點品質完全不如預期，在台北同樣價位的牛肉麵館，裝潢或許遠遜（或略遜）於牛店，但有的專精川味、湯頭濃勁香麻；有的職司清燉、湯清而醇厚味美，比起牛店更合我胃口。

今天點了小碗清燉牛肚麵（180元），清燉味道稱得上濃厚，尚能稱好喝。搭配的家常麵是機械麵，選正常口感的話，吃到最後有些偏軟，本來就不是走有嚼勁的麵條，一旦口感變軟，麵條就變得再普通不過；配料的牛肚片得很薄，因此吃起來口感偏韌，個人不是很喜歡；飲畢，開始覺得湯頭甚燥，這碗清燉雖稱得上鮮甜，可吃完舌頭略帶刺痛感，我想內場使用調味料提鮮的分量可能還要再多注意拿捏一下。

同行友人點了250元的川味滿漢，有三種配料。
裏頭腱子肉燒得蠻入味的（但僅薄薄數片，約莫5cmX5cm大小）
蹄筋是完整的一條（但整碗也只有一條），吃起來還算Q嫩有口感，但口味不若腱子肉片入味；而牛肚就跟牛肚湯裡的如出一轍，片得甚薄，口感不佳。

滿漢湯頭特地選了川味，然其名雖謂川味，但僅見少許辣油漂在湯上、因此嚐起來不似一般紅燒川味厚實，小辣也沒有一點我對川味預期的麻或辣，原以為這樣淡薄的川味細嚐會有厚實牛肉肉香，但這湯雖清卻無牛肉湯的鮮甜、也無一般高湯的鮮美；口味著實平淡不已。

於我，一碗250元的牛肉麵品質口味如此，實在不值得排隊去吃；就連不用排隊，我可能都不會再進去第二次。

撇除不合口味這點，這裡的擺盤甚為精美、湯匙異常順手好用，這兩點倒是給我很好的印象。

附記：
網上佳評如潮，然中間卻參雜著舊客反應品質大不如從前的評論，我沒吃過以前的牛店，然觀今時品質，店東應念之慎之。"
 Hung WU ,https://www.google.com/maps/contrib/104356274475577604469/reviews?hl=zh-TW,5,False,11,"第一次吃到這麼講究的牛肉麵！
以前吃過鰻魚三吃沒想到牛肉麵也可以這樣玩～
厲害！"
 Singer 蕭 ,https://www.google.com/maps/contrib/110384244943636548018/reviews?hl=zh-TW,3,True,852,"「牛肉麵」，肉的部分，肉質不錯，口感軟嫩，表現出色。再來麵的部分，不規則條狀拉麵，順口Q彈，表現維持一般水準。
最後就湯而言，湯頭與一般外面的牛肉麵店相比，較無牛肉味，且較死鹹，吃不出甘甜的成分存在，湯頭算是整碗麵裡表現最差的一個環節。"
 brad hsu ,https://www.google.com/maps/contrib/100940087142322707367/reviews?hl=zh-TW,1,True,915,"牛肉使用牛腱肉切片，燉煮軟爛適中，可惜味道太鹹，失去原有牛肉味道，也沒有燉煮的香氣。
麵可以起來應該是手工麵，可惜嚐起來卻像吃米苔目，沒有手工麵應有的筋性。
湯頭尚可，平淡中透著鹹鮮味，也不算精品，閉眼品嚐湯頭會以為是榨菜肉絲麵！
台北其他比這裡好吃的多矣！
環境不錯，服務尚待加強！"
 Eason ,https://www.google.com/maps/contrib/108912269540075976602/reviews?hl=zh-TW,4,True,69,"當天享用的是牛肉椒麻拌麵，小碗不辣，價格是200元(如圖一)，蔥花、洋蔥與牛肉份量很足，視覺上很吸睛。

雖然叫拌麵，裡面裝有1/3的醬汁，原先以為吃起來會濕爛濕爛，但是麵的軟硬度他們弄得很剛好，因此拌起來吃的很舒服；但有一點我覺得很可惜，就是吃不出他們的椒麻感，不確定是不是因為我沒有點辣的關係。

牛肉的部分，每一塊吃起來都非常的軟嫩與入味，不像其他牛肉麵店，同一碗牛肉可能有些好吃有些很難咬，讓我覺得他們有資格稱自己為牛店。

而另外一碗是一個吃素的朋友所點的椒麻拌麵(140元)，所以裡面少了牛肉燥!!另外也許是有加辣的關係，聞起來特別香!!

同行的另外兩位朋友點了清燉牛肉麵，聽他們所說不管是牛肉或是湯都相當鹹，提供給大家參考。

至於有一個我自己覺得關於拌麵的小缺點，我認為拌麵好吃的秘訣是醬汁必須咬進去麵裡面，但這家的拌麵卻是麵體配上大量的醬汁來吃🤔🤔"
 Jun Chihyuan ,https://www.google.com/maps/contrib/116725975361035782064/reviews?hl=zh-TW,4,False,107,"把牛肉麵做的很精緻的一家店，餐點也是裝潢也是，連音樂都是高級交響樂。
麵的部分太過普通，但是湯底和肉是感覺的出來用心製作也下了不少本吧，但是味道太淡了點。
此外店家在這邊給五星送小菜，我對於這種收買評價的方式是反感的。
店內人不像以前那麼多了"
 王俊霖 ,https://www.google.com/maps/contrib/102071982417291320472/reviews?hl=zh-TW,3,True,731,"價格：極品紅燒滿漢牛肉麵450
優點：紅燒醬是分開的可以按照喜好自己調整濃度也可以在一開始就調整醬的濃淡麵條Q
缺點：肉跟筋都不夠軟缺乏特點
廁所：網路：行動支付：無
二訪：否
雜語：完全不懂在有名什麼😂"
 卡爾瑟斯 ,https://www.google.com/maps/contrib/102596134892226103244/reviews?hl=zh-TW,2,True,443,"觀光客專用店：

以前吃覺得味道還可以，不知道為什麼這次吃起來很煩膩⋯

純粹主觀，味道並沒有太差，但不是我的菜。"
 Roderick Wu ,https://www.google.com/maps/contrib/105450277404229196346/reviews?hl=zh-TW,5,True,15,很好吃，以前清燉牛肉麵只有清燉湯頭才不辣的，現在也可以選紅燒不辣的湯頭！
 Jess ,https://www.google.com/maps/contrib/109576349506601084061/reviews?hl=zh-TW,4,True,95,米其林必比登推薦的牛肉麵店，觀光客很多常會大排長龍，湯頭很鮮美，牛肉軟嫩，麵條Q彈，整體算不錯，價格稍微高了點。
 蔡紫涵 ,https://www.google.com/maps/contrib/111813779410413197361/reviews?hl=zh-TW,5,True,9,「搜了點評過來的，沒想到人這麽多，但是可以在排隊時候點餐，裏面不算很大，人少的話需要拼桌，很幹凈還有熱茶水喝哦。一人點了一個分量就足夠了。辣的很辣，但是吃著比較過癮，分開的那款還給了說明告訴你怎麽吃面，整體味道都非常好。
 Erick Chen ,https://www.google.com/maps/contrib/100230723338222324217/reviews?hl=zh-TW,5,False,9,謝謝牛店的牛肉麵，在濕冷的天氣，讓一家得到滿足！超派！
 G V ,https://www.google.com/maps/contrib/115407481586211199348/reviews?hl=zh-TW,3,True,79,"（牛肚麵、半筋半肉麵）
1.麵與湯的味道分開
2.小辣不辣，建議平常有吃辣的人至少要點到中辣！
3.湯頭沒味道，辣油與湯頭也是分開的
4.三顆星是給牛肚跟牛肉牛筋的分數"
 Wade Wu ,https://www.google.com/maps/contrib/112067302629712544468/reviews?hl=zh-TW,5,True,"1,199",觀光客勝地，牛肉麵好吃不油膩，愛吃辣的朋友可以點椒麻拌麵，我自己是點牛肉麵，肉很軟嫩不柴！小菜都很入味，但價位偏高。
 Eric Tsai ,https://www.google.com/maps/contrib/113488888045104394096/reviews?hl=zh-TW,4,True,182,好吃！牛肉嫩，味道夠，但價錢偏貴。
 lilylilylily Lin ,https://www.google.com/maps/contrib/101542689896316764450/reviews?hl=zh-TW,2,True,521,椒麻拌麵是我多年以前吃到感動的東西，當時還感受得到用心經營的店家，沒有現在名聲那麼響亮，常常偶爾跑去吃一碗。而現在人多了，味道變得極為普通到覺得已經是別人做的麵了，應該不會再去了。
 洪裕淵 ,https://www.google.com/maps/contrib/115459791624014775708/reviews?hl=zh-TW,4,False,13,"好幾年沒吃了。漲價了好多有點嚇到
但牛肉麵好吃。
本來點小辣，後來自己加了很多牛骨辣醬
應該直接點大辣的！

今日的服務阿姨服務很好！"
 Yu Vivian ,https://www.google.com/maps/contrib/101905996854386430631/reviews?hl=zh-TW,1,True,25,"先不論好不好吃
服務態度很爛非常爛
「請問要小辣中辣大辣」
「請問你們有建議嗎？」
「看你啊！看你吃不吃辣啊！我沒有辦法回答你這個問題！（翻白眼）」
「那小辣好了⋯⋯欸沒關係那我要中辣」
「你要中辣嗎？欸！我們中辣很辣欸（瞪）」
最後只好點小辣

你寫小辣不想改就先說嘛先說看我又說沒辦法回答我問題要看我我想吃中辣又不讓我點是搞毛

20182019米其林現在是2022這些年發生什麼事我一點都不意外喔

BTW回家不到10分鐘的路程打開袋子才發現湯到處都是而且還真吃起來普普通通呢那麼急也沒做好什麼事啊"
 郭建男 ,https://www.google.com/maps/contrib/100291508641268510713/reviews?hl=zh-TW,5,False,4,會一直在訪的牛肉麵店滷味跟小菜都很好吃
 蔡沛穎 ,https://www.google.com/maps/contrib/112784801144891070722/reviews?hl=zh-TW,4,True,185,"牛肉麵好吃從剛開店的90到現在一碗200還是一樣的質感,可是用餐很燥,可能是要拼翻桌率所以都放快節奏音樂.比較像早期泡沫紅茶店.不介意的推薦去吃牛肉麵,趁現在不用排隊！"
 Lani W ,https://www.google.com/maps/contrib/105070746413838249700/reviews?hl=zh-TW,3,True,41,和老公期待蠻高的去買了外帶，紅燒清燉各買了一碗，店員有提醒紅燒較鹹，但我們吃了之後覺得清燉才是比較死鹹的那碗…是有做出自己的味道，但真的吃完有點太死鹹了…
 靖christine kitty ,https://www.google.com/maps/contrib/106682879020233478975/reviews?hl=zh-TW,3,False,791,常常去看到有人排隊，終於可以一享口福，服務還不錯，湯頭和麵體可以客製，濃淡軟Q可選，小菜不錯，豆干入味偏鹹，牛筋軟Q，湯頭清淡，價格略偏高
 MK Y ,https://www.google.com/maps/contrib/117951048856043472713/reviews?hl=zh-TW,5,False,10,到西門町必吃美食，麵條很特別，小菜很美味，重點是服務很好，服務人員很細心詢問飲食偏好！
 K Z ,https://www.google.com/maps/contrib/111745076267798997699/reviews?hl=zh-TW,5,True,353,好吃但是肉塊有點鹹，牛油也很香
 Winston Chang ,https://www.google.com/maps/contrib/112150130329431748946/reviews?hl=zh-TW,5,True,297,"印象中以前的麻香味比較重~

每次有去台北總是會想來一碗"
 Mr.小安先生 Mandera_juggling art ,https://www.google.com/maps/contrib/101230066742442980282/reviews?hl=zh-TW,5,False,23,這真的滿足我最近很想吃牛肉麵的慾望～
 蒼月喵 ,https://www.google.com/maps/contrib/110725140364488637756/reviews?hl=zh-TW,5,True,134,"略貴不過很好吃
會想再來吃吃看紅燒的(等月初？"
 謝定村 ,https://www.google.com/maps/contrib/106787800098039874949/reviews?hl=zh-TW,4,True,"1,230",麵條Q，肉質不錯，湯頭可，喜歡牛肉麵可試試。
 Allison ,https://www.google.com/maps/contrib/106328324185683322505/reviews?hl=zh-TW,5,True,273,店面不起眼，很喜歡精燉湯頭，環境不錯！
 Cynthia Yang ,https://www.google.com/maps/contrib/100544698394561930675/reviews?hl=zh-TW,4,True,485,麵條可以選擇Q爛，湯頭也可以調整，牛肉軟嫩不錯，湯頭不是紅燒的，清燉為主，花干好吃😋
 葉采凌 ,https://www.google.com/maps/contrib/107674352447704749535/reviews?hl=zh-TW,4,True,11,"😋必吃榜牛肉面，也確實人氣高，門口的排隊客人也非常多，遊客來自全球，可見有不少美食雜誌有推薦過他家。
😋點餐面條口感也是可以選擇，面條口感非常的棒，用的澳洲牛肉，牛肉燉的也剛好，入味軟糯又不失嚼頭，牛肉湯底鮮美，有時間值得排隊嘗試的面。"
 羅國軒 ,https://www.google.com/maps/contrib/113395938711396898605/reviews?hl=zh-TW,4,True,370,清燉原味滿漢牛肉麵味道很棒~隨桌附的辣醬很香。觀光客非常多~建議提早半小時登記候位就可以順利第一輪進去用餐，服務很親切。
 ricky yee ,https://www.google.com/maps/contrib/108400036990100556797/reviews?hl=zh-TW,4,True,57,湯頭鮮甜，麵質夠彈牙，我叫係筋+肉麵“多葱”同滷味牛肚，牛肉麵👍👍👍牛筋炆到好林，牛展肉亦如是，滷味牛肚入味但略鹹。
 Sampson Chen ,https://www.google.com/maps/contrib/101634821493648967971/reviews?hl=zh-TW,5,True,210,從剛開幕就吃了，一直覺得這老闆很認真也很多堅持，一定會成功，果然一直紅………！
 B one ,https://www.google.com/maps/contrib/114684333524800750264/reviews?hl=zh-TW,4,True,784,湯頭清淡，服務不錯，辣牛油有香
 SUNG EN CHEN ,https://www.google.com/maps/contrib/116756089965734100602/reviews?hl=zh-TW,5,False,10,"牛肉麵很好吃！
但希望店員在說明時可以更有耐心。謝謝！"
 葉威廷 ,https://www.google.com/maps/contrib/109221568093136664483/reviews?hl=zh-TW,4,True,21,牛肉不錯，但麵可以在多一點，以這個價格來說份量有點少，可以嚐鮮看看。另外，最基本應該一桌一包衛生紙吧，店中央的兩桌隔開結果只有一桌有衛生紙，現在這種時刻還要抽別桌的衛生紙，希望能改善。
 克蕾拉 ,https://www.google.com/maps/contrib/117735194300902765070/reviews?hl=zh-TW,5,True,51,推薦點半筋半肉的口味，有清燉及川味，好吃推薦
 陳文郁 ,https://www.google.com/maps/contrib/117849335042177297229/reviews?hl=zh-TW,4,True,101,"牛肉麵好吃，可以調整麵軟硬及湯濃淡。但價格偏高。

一碗小牛肉麵有四塊肉肉，女生吃得飽，男生要點大碗才可以。"
 威瑪 ,https://www.google.com/maps/contrib/100177601345654987541/reviews?hl=zh-TW,4,True,88,清燉湯頭鹹度微微過頭，尚能喝出湯頭韻味，牛三寶份量給超多，過癮
 Morris Lee ,https://www.google.com/maps/contrib/114065410726896713049/reviews?hl=zh-TW,4,True,337,麵條不錯，湯頭是我喜歡的口味，第一次來不知道內用排隊要先自己登記，整體來說有來附近想吃牛肉麵時可能會再訪
 阿信 ,https://www.google.com/maps/contrib/111969419115529526989/reviews?hl=zh-TW,1,True,62,以前都很愛吃這家很香的椒麻拌麵，現在竟然變味了，上來快半碗的水，都被稀釋了，完全沒有什麼味道了，和店家反映後就加了東西變很辣但是味道還是稀稀。轉型成真正的觀光客店家了。
 楊郁羚 ,https://www.google.com/maps/contrib/103765577219594398485/reviews?hl=zh-TW,5,True,9,"沒吃過其他家的牛肉面，所以不能做出對比性評價。單從這家店來說，是值得打卡的牛肉面店。
來了之後要在門口的登記簿上寫名字和用餐人數，然後等著叫名字。
牛肉湯面......"
 黃恆毅 ,https://www.google.com/maps/contrib/112990531961700841593/reviews?hl=zh-TW,4,True,196,麵條有點點q軟無味湯頭不錯建議吃乾麵比較好
 Ya-Chien Lin ,https://www.google.com/maps/contrib/100106962410795717021/reviews?hl=zh-TW,3,True,204,退步了，外帶也不會主動附醬料，也沒提醒客人要自己裝醬料
 阿菲 ,https://www.google.com/maps/contrib/103670339286545855517/reviews?hl=zh-TW,2,True,38,之前看每次都大牌長龍，今天難得不用排隊，吃了很失望，麵跟湯味道是分離的，牛肉湯底太淡，這價位不ok，應該是給觀光客吃的
 林家民 ,https://www.google.com/maps/contrib/111356172128232840492/reviews?hl=zh-TW,3,True,38,滿漢牛肉麵一碗280，麵不算我喜歡的類型屬於白圓麵，湯是走清燉類型的也不是我的菜，但牛肉跟牛筋很有水準，不過這樣還是沒有達到280一碗的程度，如果有得選我認為一樣在西門町的建宏更有吸引力。
 王振宇 ,https://www.google.com/maps/contrib/100667376239308992713/reviews?hl=zh-TW,3,True,33,買了一碗200元的牛肉麵，清燉口味，湯頭不錯，麵條Q彈，牛肉份量厚度Q彈度夠，可惜太鹹(鹹得有點誇張，最大敗筆)，附的免費茶還不錯喝。牆壁好像有貼什麼推薦必吃的，感覺有點被騙了，還是外國人都喜歡重鹹口味?!
 Hui-yu Tsai ,https://www.google.com/maps/contrib/108734969799780986072/reviews?hl=zh-TW,4,True,40,"湯頭很棒麵體不錯肉及格
環境舒適冷氣好涼～"
 無段道楓 ,https://www.google.com/maps/contrib/108089191503389213461/reviews?hl=zh-TW,3,True,714,"排隊大約一小時的牛肉麵店
聽說是米其林推薦的店
一碗280。加麵30。免費加湯一次
紅燒湯頭再加30
清燉湯頭還不錯。麵條還算不錯
招牌滿漢的牛筋牛肚普通
店內乾淨。內用可以自己倒味道不錯的熱茶！
服務不錯。但是有的服務生固定臭臉XD
整體來說。價格上稍貴一點
排那麽久不是那麼那麼的值得"
 s669955 ,https://www.google.com/maps/contrib/106633803870533570121/reviews?hl=zh-TW,3,True,103,"豆干、小菜夠入味！
清燉牛肉麵肉質鮮嫩！厚度及份量夠！
麵的硬度及湯頭鹹度及辣度皆可調整！
可惜裡面的店員【胖胖的女店員】竟然還在嚼口香糖.....
給人觀感實在不佳==""
可惜了！"
 Joe Chang ,https://www.google.com/maps/contrib/108895077850851105558/reviews?hl=zh-TW,5,False,16,以前的麵條比較好吃可惜沒有了其他湯頭小菜都很棒
 kenny bear ,https://www.google.com/maps/contrib/112331162459058291868/reviews?hl=zh-TW,5,True,622,非常好吃的牛肉麵店，湯頭有清燉跟川味，麵條彈牙，價格200起跳，用餐時間人很多，得自行在門口登記
 Jacky Shieh ,https://www.google.com/maps/contrib/104994754803709145424/reviews?hl=zh-TW,4,True,136,滿漢牛肉麵夠水準，價格比較台北，但是牛肉，牛筋，都入口即化，即使是牛肚，也是很好入口！
 小鴨鴨 ,https://www.google.com/maps/contrib/102464293023811474386/reviews?hl=zh-TW,4,True,356,牛肉很新鮮，可惜牛肉麵不是我喜歡的口味，椒麻麵頗辣，小辣就吃的很過癮！
 許傑丞 ,https://www.google.com/maps/contrib/115868612157425238631/reviews?hl=zh-TW,4,True,259,紅燒好吃，只是價格稍高
 日常食札 ,https://www.google.com/maps/contrib/116755706765046612303/reviews?hl=zh-TW,4,True,99,"滿漢牛肉麵不論是在湯頭、麵條及肉品都讓我留下深刻的記憶，食用完後，沒有一般紅燒湯頭像是狠狠踏過喉嚨的厚重感，反而是另一種優雅的細緻風味，即使有些刺痛的辣停留在口中，卻也被湯頭的溫潤所安撫，我想這滋味也或許足夠醞釀了下一次前來探訪的理由。
<完整圖文介紹Google搜尋：日常食札>"
 Wayne Huang ,https://www.google.com/maps/contrib/100617706503395513559/reviews?hl=zh-TW,5,True,662,"極品滿漢牛肉麵
多層次的食用方式是很好的體驗
味道濃淡也可以自己調整
牛肉4部位都處理的不錯
唯有麵條稍嫌普通"
 ulb B ,https://www.google.com/maps/contrib/107214880436336907769/reviews?hl=zh-TW,5,True,298,"點了一個牛肉麵不辣的，湯頭味道可以（屬於清淡順口的那種
牛肉也很嫩
空調如果再冷一點就好~"
 周宜庭 ,https://www.google.com/maps/contrib/108401469626611663734/reviews?hl=zh-TW,5,True,20,"用餐環境很舒適整潔乾淨
大推椒麻拌麵👍🏼"
 ShaluBoy ,https://www.google.com/maps/contrib/113759615992806987645/reviews?hl=zh-TW,4,True,184,"紅燒湯清淡不辣，甘甜。
不像是傳統豆瓣醬去熬的湯，算是走牛骨和蔬菜原味的清甜湯頭，需要味道比較重的話要自己添加旁邊附的辣牛油。

牛腱肉切的很漂亮，味道偏鹹，沒什麼滷香味。

麵條粗麵有咬勁，可惜個人偏愛細麵。

小碗牛肉麵200台幣，小菜40台幣

因為名氣來吃一次"
 亂封 ,https://www.google.com/maps/contrib/111067166414097730347/reviews?hl=zh-TW,5,False,19,小菜美味、湯頭甘醇、牛肉乾拌麵最高
 PEI-CI SHEN ,https://www.google.com/maps/contrib/105821954254307900079/reviews?hl=zh-TW,5,False,9,"很美味的麵，湯頭濃郁溫和而不膩，麵軟硬適中有勁，我不吃辣，所以都點清燉牛肉麵，也有點過湯麵，光只有湯和麵就非常好吃了，大大的一碗麵一般都吃不完的，我卻全都吃光了！
覺得美中不足的是，店內青菜的選擇少，醃蘿蔔和黃瓜，比較無法滿足飲食的均衡。"
 Link Lin ,https://www.google.com/maps/contrib/113817938089314846018/reviews?hl=zh-TW,2,True,326,"滿漢清燉牛肉麵今天去吃250💰口味清淡～牛肉牛筋好吃入口即化～但牛肉只有2片牛肚薄薄的2片一個牛筋～附圖片超空虛！！CP值低～
每次吃完整體只有後悔😥～比他便宜又好的牛肉麵很多～（下次只點黑麻麵110💰）就好了！小菜普普😟"
 Mika ,https://www.google.com/maps/contrib/111276295005636539180/reviews?hl=zh-TW,4,True,555,"紅燒牛肉麵湯頭特別，牛肉有嚼勁
小菜筍絲、豆乾好吃
熱茶好喝
麵條軟硬可以調，建議一般軟硬即可
用餐環境舒適"
 CC L ,https://www.google.com/maps/contrib/105815384552179657922/reviews?hl=zh-TW,3,True,397,"可，但，貴。

————————————

今日二訪！！
想不到上一次是五年前
當時外帶
今日內用
其實早就忘記味道了
點什麼也忘了
什麼都忘了

今天半筋半肉紅燒

嗯，湯偏鹹，有些些辣，但還是喝光了

麵條無感

肉雖然入口及碎
但咬起來的口感不是很好

牛筋沒有腥味，給過

這次還點了花干
等待麵上桌時是個不錯的前菜

有個單價400起跳限量的紅燒
下次再試試😉"
 牛奶 ,https://www.google.com/maps/contrib/113259371747184291434/reviews?hl=zh-TW,5,True,21,初訪，牛肉麵還行😆
 陳昱廷 ,https://www.google.com/maps/contrib/116847689482767128863/reviews?hl=zh-TW,5,True,48,覺得好吃！目前吃過最好吃的牛肉麵！
 Sylvia ,https://www.google.com/maps/contrib/113999414342869488131/reviews?hl=zh-TW,2,True,190,"排隊登記姓名和人數再點餐
整個SOP流程不是很好
店外很多國外遊客在等
然後客人一直來，超級混亂
外面也沒椅子，就一堆人站著
店內空間也很小，位子很少
問店員需不需要留電話
結果是直接在外面等店員再用喊的
問她要等多久說20分鐘
於是我們先去隔壁吃滷肉飯
吃完再回去問

從登記到進去，大概等了40幾分鐘
就算有位子餐也很久才來
這間就是生意很好感覺不怕沒客人
覺得服務態度可以再好點

店內餐具是陶瓷這點我覺得很好
原味牛肉麵＄200，有4塊牛肉
原味半筋半肉$280，有3塊肉3塊筋
椒麻拌麵＄120吃起來微微酸，還不錯
我覺得牛肉有筋有肉很軟嫩，但就是太鹹了
是很死鹹的那種，筋則不夠軟不夠入味
吃起來怕怕的，吃不到一塊就不想吃了

店內廁所的門也挺有趣的
和一般的不一樣，是用拉的，鎖很特別
這間店不能外帶，只供內用
我覺得牛肉麵沒有說特別好吃，太鹹了"
 Tim Khawn ,https://www.google.com/maps/contrib/114085475394400061355/reviews?hl=zh-TW,4,True,"1,333",2018米其林必比登餐盤之一：品質穩定，乾淨舒適
 KI S ,https://www.google.com/maps/contrib/106710240112918192413/reviews?hl=zh-TW,4,True,84,"吃椒麻拌麵
有點貴不過還不錯啦"
 jun jie ,https://www.google.com/maps/contrib/103439374061071047453/reviews?hl=zh-TW,2,True,473,"麵吃起來只有辣跟非常鹹
唯一好吃的只有牛肉"
 帥靜嵐（觀靜） ,https://www.google.com/maps/contrib/114700388477877125272/reviews?hl=zh-TW,5,True,547,十分熱門的店，常有國外旅客，拿著旅遊書，慕名而來，最喜歡此店的清燉牛肉麵，湯汁味美不油膩，小菜也都很好吃，還有獨特的沾醬
 Seven Chen ,https://www.google.com/maps/contrib/115218723948318052480/reviews?hl=zh-TW,4,True,208,米其林必比登，肉多實在，份量足夠，湯頭讚，值得來吃吃看
 DY ,https://www.google.com/maps/contrib/106820337341468690730/reviews?hl=zh-TW,4,True,177,湯頭麵體都還不錯、肉算蠻好吃的，小黃瓜偏酸比較普通，服務人員會詳細問要不要調整，態度也算不錯；但整體價格略高。
 A Uncle ,https://www.google.com/maps/contrib/108813398472761811107/reviews?hl=zh-TW,5,True,101,"真空包專業！！
看得到濃郁的牛骨濃湯
軟嫩適中的牛四寶
麵條也很耐煮

唯一可惜家裡沒蔥不然肯定對味"
 錢錢 ,https://www.google.com/maps/contrib/107955501499724238321/reviews?hl=zh-TW,4,True,513,滿漢牛肉麵吃了十分滿足，牛腱牛筋燉得很嫩，價格稍貴
