user_name,user_profile_url,rating,local_guide,comment_num,comment_text
 Vic Wang (濬凝、濬瑀的爸爸) ,https://www.google.com/maps/contrib/110469757783804445864/reviews?hl=zh-TW,5,True,26,"滿漢牛肉麵，超好吃，湯頭不死鹹，肉厚達5mm,讚"
 ying rou syue ,https://www.google.com/maps/contrib/113963713744229308312/reviews?hl=zh-TW,4,False,44,"豆干的調味很好吃，微微的辣，香氣十足，
可惜的部分是紅燒的口味單價都太高，清燉的口味不太適合喜歡吃紅燒的族群，建議小菜種類可以多樣化，會更吸引人再度光顧"
 呂宜學 ,https://www.google.com/maps/contrib/105724552458126340628/reviews?hl=zh-TW,4,True,108,味道不錯但價錢太貴了
 豪豬 ,https://www.google.com/maps/contrib/113253990228550667707/reviews?hl=zh-TW,5,False,9,"小菜黃瓜、花乾精緻入味。
湯頭質量不論是紅燒還是清燉，都非常有水準，心中排名都是前3。
大碗的份量也夠"
 Solomon Tam ,https://www.google.com/maps/contrib/116430361085411869278/reviews?hl=zh-TW,4,True,40,紅燒半根半肉牛肉麵好好味
 Ben Tang ,https://www.google.com/maps/contrib/103807186596505098715/reviews?hl=zh-TW,3,True,329,北市西門町排隊人氣店，每次假日看完電影後經過總是一堆排隊人潮，這次來店用餐選擇了平日來品嚐，餐點部分：一碗牛肉湯跟一碗川味牛肉麵，牛肉的厚度相當紮實，湯頭部分只有牛肉湯的口感還算不錯。川味部分感覺還可以接受，至於用餐環境方面蠻寬敞的，服務人員其實相當不錯！態度跟口語值得嘉許，看了很多其它評論部分有提到美中不足的可能是價位方面真的是高出了許多，也是比較多觀光客光臨，所以不能達到足夠吸引人的CP值。
 戴怡文 ,https://www.google.com/maps/contrib/103925323822906405496/reviews?hl=zh-TW,5,False,17,牛肚椒麻拌麵可調整辣度，酸辣配清爽的洋蔥絲非常好吃，牛肚大小適中很好入口。服務很好。
 H. H. ,https://www.google.com/maps/contrib/103720967704754313824/reviews?hl=zh-TW,4,True,"1,057",這附近比較少見的清燉牛肉麵，湯頭好喝不過麵條是圓麵條我個人比較不愛，另外定價太貴了...小碗就要200，肉大概只有四片，太少
 Emma ,https://www.google.com/maps/contrib/116760891714962444013/reviews?hl=zh-TW,5,False,6,之前經過都要大牌長龍的牛肉麵店，今天平日中午來不用排隊，椒麻麵很特別，可以選辣度，牛腸好吃
 Lin Rex ,https://www.google.com/maps/contrib/112809755638589981960/reviews?hl=zh-TW,5,True,157,極品！先喝清燉，再加紅燒湯汁，咬一口牛腱子肉，真心滿足，麵條口感佳。花干也很美味。大力推薦👍
 王Yueh ,https://www.google.com/maps/contrib/106815947109543848343/reviews?hl=zh-TW,4,False,23,"清燉牛肉很美味，店內工作人員親切
滿漢牛肉麵一碗280"
 楊禮安 ,https://www.google.com/maps/contrib/100754022350614938457/reviews?hl=zh-TW,1,True,79,湯頭沒以前的清香，以前是醇香的金黃色湯頭，這次顏色變淡且上面浮一層油…牛肉牛肚牛筋軟嫩度處理還不錯，除牛肚外其他兩個很鹹（特別是牛筋），必點的花干也變成普通的滷味，雖多汁但仍有很重的豆味，掰掰牛店！
 Jimmy Liang ,https://www.google.com/maps/contrib/105857365449089125302/reviews?hl=zh-TW,5,False,5,"湯清肉嫩麵Q,絕品！"
 Jet Fang ,https://www.google.com/maps/contrib/111259712279860737967/reviews?hl=zh-TW,2,True,48,"牛店一直以來都是我心目中牛肉麵的第一名
但隔一段時間沒吃最近來吃竟然換了麵條
真的跟原本拉麵口感的麵條落差太大整體真的扣分太多了未來可能換回原本的麵條或是麵條可供選擇才會再回去吃"
 UI ,https://www.google.com/maps/contrib/117157896812981756507/reviews?hl=zh-TW,3,True,45,"麵條跟肉是可以的
但湯真的太死鹹⋯⋯
麵會讓我想吃完但這湯喝幾口就膩了"
 fay wu ,https://www.google.com/maps/contrib/107930339162608170584/reviews?hl=zh-TW,1,True,87,"Bitpatheticreally.Brothhasnoflavor,noodlesarenotchewyenough,althoughwhiletendonsaretenderenough,it’swaytoosalty.Asingleplateofatinysidedishcost$40NTD,whichiswaytoomuchforTaiwanesestandard.Noneedtowasteyourtimehere.Period.

有點慘耶！爆小一碗$200，原味（清燉！？）湯頭一點也沒有味道啊，只是鹹；麵選了Q的結果也是店家自己的幻覺而已。牛筋很嫩但是死鹹。小菜超小一盤$40元是有點離譜。吃完整個口渴。拜託別去吃，肚子餓去買滿漢大餐大勝10倍！"
 鄭偉成 ,https://www.google.com/maps/contrib/115554517926261884113/reviews?hl=zh-TW,3,True,110,屬於清燉型的牛肉麵，湯頭一般，麵條算Q，首推椒麻拌麵，非常清爽、辣度適中，牛肉份量多非常軟嫩，但是一夾就會散，環境不錯，服務效率快，但是性價比不高。
 Doris Wang ,https://www.google.com/maps/contrib/109358933481195413148/reviews?hl=zh-TW,5,False,10,店裡質感不錯，服務員也很好，會推薦👍
 Mavis Yang ,https://www.google.com/maps/contrib/109940496936469670283/reviews?hl=zh-TW,2,True,35,"好久沒來，今天帶小朋友來吃，味道完全跟記憶中的不一樣，連小菜都是平凡無奇，對比門口米其林推薦的海報，真是有點尷尬。

因為是開放式廚房的關係，熱氣冒的整間店都很悶，我們被安排在廚房最近的位置，吃麵吃的超熱心情不可能會好，有跟店員反應但是他說「已經25度了」⋯⋯⋯⋯⋯⋯⋯⋯⋯，今天外頭35度以上⋯⋯⋯⋯⋯

退步太多不可能會再去
對不起這樣的定價

*唯一可取之處是有提供寶寶椅"
 HONGYI WANG ,https://www.google.com/maps/contrib/118310775215719786212/reviews?hl=zh-TW,4,True,97,點了滿漢牛肉麵川味，愛吃辣的推薦再加辣椒醬，口味會更棒，牛肉很軟嫩，麵條稍偏軟，個人覺得再硬一點更佳。
 傅韻潔 ,https://www.google.com/maps/contrib/100256348603153181653/reviews?hl=zh-TW,4,True,46,"當然是不錯吃而且難得沒有觀光客排隊，只是既然都要對點小辣的客人說這個很辣，不知道為什麼要設計成這麼辣，增加服務人員點餐的麻煩。我已經是無辣不歡了也喜歡麻辣的人，但是這個小辣我確是辣到無法吃完麵很不歡啊@@那一般人真的是....
最後只好把麵加進牛肉湯裡變成真正小辣的牛肉麵。"
 Somei Yang ,https://www.google.com/maps/contrib/110061727255676287738/reviews?hl=zh-TW,4,True,424,"精緻滿漢牛肉麵/紅燒牛肉麵是ㄧ次可以嚐試二種湯頭，紅燒，清燉，喜歡它的麵條，像拉麵，很Q,但450實在太貴，不會想吃第二遍"
 許香 ,https://www.google.com/maps/contrib/115446575565626789815/reviews?hl=zh-TW,1,False,15,"我覺得是個很不愉快的用餐經驗，點了一碗小碗的乾拌麵小辣，商品超出想像的鹹而且吃到後面覺得太辣，和服務升反應希望可以幫我加一點湯讓鹹度和辣度降低，一個阿姨態度很差直接說你這個是乾拌麵不能加湯，我說真的是因為太辣了想調整而已，不然給我熱水可以嗎，阿姨就直接說辣度點餐的時候就決定了，也沒有再提供湯或熱水的，然後就直接走掉。我不知道這樣的餐廳是想營造一個怎樣的用餐環境，當初點餐也沒威脅我辣度點完就不能調，再加上以往在外面我也都是點小辣，每間店辣度不同我可以接受，但完全不給水或湯也太不人性，難道你當初點餐有給我試過辣度再幫我點嗎？如果沒有你就不應該用那種理所當然的理由要我自己吸收吃不下去的麵和浪費的2百多元。
簡單來說我覺得一間店有沒有用心想經營客人從這種小細節就看得出來，我很失望，也不會再消費，請想再去的人三思，謝謝。"
 PH Lee ,https://www.google.com/maps/contrib/112122879560528296605/reviews?hl=zh-TW,1,True,44,米其林評牛肉麵真的不行，湯頭偏淡偏鹹，牛肉死鹹，真的那麽好吃的店不需要用小菜招待換五星，台北牛肉麵雷超多
 陳明彥 ,https://www.google.com/maps/contrib/105662914869750578960/reviews?hl=zh-TW,5,True,29,極品紅燒牛肉麵好好吃，麵條還可以客製化軟硬度，第一次來店覺得很喜歡，會再造訪第二次。
 ralph yen ,https://www.google.com/maps/contrib/102989327197128113729/reviews?hl=zh-TW,1,False,63,多年前來吃的時候印象還不錯，昨天吃了覺得失望透頂！湯頭不再濃郁，牛肉牛筋都透著一股奇怪的肉腥味，估計是變成網紅觀光客會來的店後不再用心，價格非常高，以他的價位，絕對對不起他的品質，列入不會再來的店
 李遵安 ,https://www.google.com/maps/contrib/113800000365529540814/reviews?hl=zh-TW,5,False,1,本店很窩心，可以依照顧客需求，對麵的軟硬度，湯頭的辣度，特別客製處理，下次有機會，再來光顧。
 lin卉（Yui） ,https://www.google.com/maps/contrib/105975050931507578024/reviews?hl=zh-TW,5,True,65,"環境乾淨，餐點好吃~
跟其他牛肉麵店不一樣的口味!"
 Vivi Angela ,https://www.google.com/maps/contrib/115022355485173856215/reviews?hl=zh-TW,5,False,12,東西非常的好吃，服務態度非常讚的，歡迎大家來捧場
 Voglia Hsu ,https://www.google.com/maps/contrib/104606357896885618216/reviews?hl=zh-TW,2,True,25,"小碗麵200元起跳蠻貴的
平日中午去排了半小時
老實說吃了一口蠻失望的
麵完全沒嚼勁沒有中式拉麵的口感
就是一般路邊攤陽春麵軟軟的感覺
湯頭也蠻普通的
唯一的亮點是牛筋不錯吃很入味
（但一般人吃應該會覺得太鹹吧）
cp值很低應不會再訪"
 Chihchin說真話 ,https://www.google.com/maps/contrib/114775547922574443031/reviews?hl=zh-TW,5,True,34,我吃這家很多年了，從凱悅到現在，很多都變成記憶的一部分，不管有沒有得名，我依舊是這裡的忠實老客，一家好店，不應該等到出名才被賞識。
 aocandme ,https://www.google.com/maps/contrib/110600172469267928812/reviews?hl=zh-TW,5,False,12,這間是我心目中全台北最好吃的牛肉麵店，肉、湯、麵都很完美，組合在一起更是呈現出一股平衡的美感！
 chang mina ,https://www.google.com/maps/contrib/103959458300114591495/reviews?hl=zh-TW,5,True,226,環境寬敞舒適，工作人員親切接待。
 李峻峰 ,https://www.google.com/maps/contrib/109981369394179202724/reviews?hl=zh-TW,5,True,448,昆明街146號，食焱廠。在牛店對面。
 虛無飄渺 ,https://www.google.com/maps/contrib/108797035631649529186/reviews?hl=zh-TW,4,True,113,"不知道第幾次來吃了。

久久再回訪，
依然牛肉清湯好喝！花干牛肚必配、牛肉片片好吃！

不過還是希望老闆遇本國客可問ㄧ下載具，
畢竟電子發票主要用意不就在於可免印嗎？！"
 陳伯彥 ,https://www.google.com/maps/contrib/101493306249186179420/reviews?hl=zh-TW,5,False,4,已經吃很多年了，來西門町必吃料理，但是就只有牛肉的料理就是。麵可以幫你做調整口感。
 Min Chu ,https://www.google.com/maps/contrib/105781033563385230024/reviews?hl=zh-TW,5,False,16,"牛肉超級軟嫩👍湯頭非常濃郁之外
牛肉湯鹹度還可以自己調整小菜也都好好吃♥"
 波蒂 ,https://www.google.com/maps/contrib/112618096159572227136/reviews?hl=zh-TW,1,False,2,"有一個瘦瘦的戴眼鏡站櫃檯店員態度很差，我們問說能不能併桌沒人理我們，然後那個店員衝過來拍桌兇大喊「不能併桌！」然後就轉頭走掉，我們九個人都嚇傻了。
直到另一個店員來跟我們解釋說因為桌子不能移動，所以才沒有幫我們併桌。
我們點了小菜時都說有、好喔等等上給我們，過很久都沒有來，直到面都快吃完詢問才說忘了⋯⋯賣完了⋯還特地強調我們點餐時就沒有了⋯可是點餐當下明明你是回覆我們說還有阿⋯⋯
個人不會再來第二次，實在是不怎麼喜歡有騷味的牛肉，覺得富宏牛肉麵無論在價錢、服務、湯頭上都略勝一籌！
Iwon’tvisitheresecondtime.
Serviceverybad.
Thebeeftestgamey,andsoupjustnormal.
Wekeepaskingcanweputtabletogetherwhenweintotheshop,butnooneanswer.Becausethereare9ofus,andwewanttosittogether.
Cashierrunoverandstrokourtablewhenwemovingthetable.Thenshewalkaway.Wearefrightened,andweevendon’tknowwhathappen.Untilanothergirltoldusthetablecan’tmovie.
Ijustfeelveryconfused,howhardtotellcustomerthetablecan’tmove.
Theyforgetourorder,andaren'ttooconcerned.
HonestlyIwouldliketoeatFUHONGbeefnoodlesthenhere.
Forthesoup,serviceandevenpriceFuHongisthebestbeefnoodlesintaipei."
 Tiffy Shih ,https://www.google.com/maps/contrib/101862560250429137861/reviews?hl=zh-TW,5,False,22,來很多次了，會特地來吃，是台北還蠻喜歡的牛肉麵店，環境也很乾淨
 Queenie Chan ,https://www.google.com/maps/contrib/100768404084671035227/reviews?hl=zh-TW,5,True,11,"來到先填名字等候入坐哦
真的值得試"
 James Liu ,https://www.google.com/maps/contrib/107458569451485853743/reviews?hl=zh-TW,3,True,100,好吃但沒有特別。價格很高
 Mindy Lu ,https://www.google.com/maps/contrib/102473709056153352054/reviews?hl=zh-TW,5,False,12,價格稍貴，但東西非常好吃，牛肉麵牛肉很嫩、麵軟硬適中、湯頭不會過鹹，味道調得非常恰當，值得一來！
 A-Kwon Fang ,https://www.google.com/maps/contrib/103714456755345789855/reviews?hl=zh-TW,3,True,"2,971","在昆明街上、離國賓影城甚近上菜速度也頗適合買完電影票快速吃一餐的牛肉麵專賣店，專賣牛肉牛肚牛筋等湯麵類和椒麻乾拌麵，不過價位實在偏高、有肉的就算是小碗也要從兩百元起跳。

乾拌麵可以選擇不要加洋蔥和青蔥等既有香辛，牛肉片每片都挺厚切不過碎的以及易碎的居多、很容易肉渣卡牙，牛肚每片都頗薄、牛筋倒是普通大小，三種部位都算是好咬而且滷的入味；麵的部分配上花椒和醬倒是挺麻挺香、麵浸潤在醬汁裡量夠多的情況下一口接著一口也算是挺飽足，不過價位上大概就是有心理準備是在吃名店的概念。"
 Chia-Hsien Ho ,https://www.google.com/maps/contrib/118421280687541745377/reviews?hl=zh-TW,4,True,"1,558","精燉湯頭和粗的白麵條都沒有太大驚艷，倒是厚切的牛腱肉軟嫩但非常鹹，甚至蓋過牛肉的原味，個人覺得跟清燉湯頭有些格格不入。
整體來說可以嘗鮮但不太會讓人再訪"
 Iven Yao ,https://www.google.com/maps/contrib/100051162880374559077/reviews?hl=zh-TW,3,True,311,"牛肉麵兩百，肉很軟嫩很棒，麵條是偏軟的個人比較不愛
微辣就已經很辣了，辣味有點蓋過其他味覺
也許清燉原味會好一點"
 Alpus Chen ,https://www.google.com/maps/contrib/101808292514267048556/reviews?hl=zh-TW,4,True,488,麵條Q彈，牛肉蛋花湯好喝
 Marco Tse ,https://www.google.com/maps/contrib/103156906648632501066/reviews?hl=zh-TW,4,True,51,牛肉麵味道不錯上菜快惟略小
 Lisa Lee ,https://www.google.com/maps/contrib/100792312363610782105/reviews?hl=zh-TW,5,False,3,好久沒吃了，開心
 Sophie Zhong ,https://www.google.com/maps/contrib/117089497848878491959/reviews?hl=zh-TW,5,False,5,很喜歡這家牛肉麵，湯頭是我喜歡的，小菜花干也超級好吃！
 毛茸茸 ,https://www.google.com/maps/contrib/118313446586192614693/reviews?hl=zh-TW,1,False,4,"這是滿漢牛肉麵，我選清淡原味湯頭。
首先，湯本身沒什麼味道，一般可能有的大骨味或蘋果或洋蔥味都沒有，就只有微微的鹹味。
接下來，牛筋及牛肚，完全沒味道，一點滷過的感覺都沒有，必需沾醬吃。
接著是牛腱，這是重頭戲，整碗麵唯一有感覺的就是牛腱，非常的鹹，而且沒有香味，可能只用鹽水燉熟。
麵體本身則感覺還可以。
整體來說，是一碗詭異的麵，可能適合吃很重鹹的人，因為可以自己加辣醬，但對一般人而言，沒有人能接受鹹淡如此懸殊的麵。"
 Tsai Min-nan ,https://www.google.com/maps/contrib/111760464406493814186/reviews?hl=zh-TW,3,False,14,"要在外面先登記,這一點對初次拜訪的觀光客很不貼心，肉麵湯整體雖都不錯，但個人感覺味道隍次不如林東芳。另外可能是為了翻桌率，剛喝完湯服務生買上急著收走整桌，感覺不是很舒服。"
 Krystal Lin ,https://www.google.com/maps/contrib/107794673535875875578/reviews?hl=zh-TW,5,True,16,"清燉牛肉湯的湯頭很清甜不死鹹
牛肉很嫩又香
從大學時期來西門玩就常光顧這家
門口總是排滿外國人
趁著疫情期間外國人來不了趕快再來吃一碗回味一下"
 Ho shing Chow ,https://www.google.com/maps/contrib/110677976578267773251/reviews?hl=zh-TW,1,True,14,cp值超很低。一碗280元的滿漢牛肉麵份量算少，重點是不好吃，原本期待蠻高的，榮獲台北國際牛肉麵節2010十大好店，名過於實，喝第一口湯有扔湯匙的衝動，麵質肉質都很一般，心裡os很怎麼那麼爛，一定沒下次。
 Chen Alvan ,https://www.google.com/maps/contrib/117772785599438561770/reviews?hl=zh-TW,5,False,9,從開店吃到現在，好吃！
 Mi Ng ,https://www.google.com/maps/contrib/118267713838119330069/reviews?hl=zh-TW,5,False,5,"湯底好好味，不過牛肚太薄，可能係我食慣左香港牛肚。
招牌果啲紅燒牛肋肉好好食，不過好似要食400蚊台幣果款先有牛肋肉🤔限量架，個姐姐話通常朝早就賣晒，之前果晚我8點前去到直頭咩都賣晒冇得食"
 Stella Wang ,https://www.google.com/maps/contrib/106861417988558384548/reviews?hl=zh-TW,4,False,52,今天點椒麻拌麵，味道一樣好吃，只是麵條好像換了，之前的比較有嚼勁。
 jack yang ,https://www.google.com/maps/contrib/117591510788187072493/reviews?hl=zh-TW,5,False,12,上次在美食評論家指引下來品嚐後，感覺味道很棒。這次特地與老婆分享
 Weili Hsueh ,https://www.google.com/maps/contrib/112288390588290093603/reviews?hl=zh-TW,3,True,104,以前吃覺得很好吃，後來因為人太多就至少一年多沒來，今天的感覺是平平，完全沒有早期吃到時的驚艷！
 Rex Liu ,https://www.google.com/maps/contrib/115779800882252446602/reviews?hl=zh-TW,2,False,21,沒以前好吃了，服務態度差，店內有夠熱，這麼熱外面也熱，要怎麼吃麵，也不是便宜價格，開冷氣有這麼難嗎？還跟我說已經最大了，你溫度那麼高，風最大到底有什麼用呢？
 Edward YU ,https://www.google.com/maps/contrib/111373681830238779178/reviews?hl=zh-TW,5,True,39,環境很好、老闆客氣、Good
 Kyo ,https://www.google.com/maps/contrib/118262041013175014296/reviews?hl=zh-TW,5,False,18,"好吃平常沒事就會到這邊用餐
滿漢牛肉麵超推"
 高盛益 ,https://www.google.com/maps/contrib/113764102801813062072/reviews?hl=zh-TW,2,True,50,"感覺就是滷味麵
牛肉太鹹湯也是
但是牛肉跟湯的鹹度完全搭不起來
麵不錯花干還行
麥茶不錯
說真的還不如吃鼎泰豐的牛肉麵"
 CHRISTINA ,https://www.google.com/maps/contrib/111889992148028747718/reviews?hl=zh-TW,1,True,166,"1.小碗牛肉麵$200，只有湯+四片肉+蔥花....
湯很淡（沒有調整湯的鹹度跟麵的硬度），沒什麼味道⋯⋯肉鹹湯淡@@
2.小菜尚可，一盤40
感覺牛肉麵退步了，以前還沒這麼難吃⋯
如果以cp值來說，下次不會再來了，感覺是給觀光客吃的店....."
 Nick Tseng ,https://www.google.com/maps/contrib/100553802673031607708/reviews?hl=zh-TW,1,True,103,今天去吃，我自己點了滿漢原味牛肉麵，牛肉很嫩，但是湯偏鹹，吃完沒什麼感覺，但是服務就讓人感到不舒服了，今天二大三小用餐，當大人吃完，但還有一位小朋友還沒吃完，服務人員就急著要把還沒吃完的碗收走，這服務真令人不敢恭維，沒有下次了！
 Jui-Yun Chang ,https://www.google.com/maps/contrib/100456017373415642613/reviews?hl=zh-TW,5,True,44,牛肉麵份量滿足的。牛肉燉得滿嫩的，湯頭清爽，麵條軟硬適中（可選）。有機會會再回訪
 BENNY CHANG ,https://www.google.com/maps/contrib/117338404158241884537/reviews?hl=zh-TW,5,True,39,台北最常吃的牛肉麵，個人覺得最大特點是品質穩定，相比許多傳統老店品質波動，牛店的品質穩定且用餐環境不錯，只是略顯壅擠，且現在越來越多觀光客來吃，用餐需排隊等候。
 徐右 ,https://www.google.com/maps/contrib/102511678849314181413/reviews?hl=zh-TW,5,False,12,從前來西門町必吃的牛肉麵，現在不只品質變差了還漲價，不會再來了
 Howard Yeh ,https://www.google.com/maps/contrib/104868632248878716196/reviews?hl=zh-TW,1,False,3,吃起來很普通，完全不值得菜單上那個價位，要吃牛肉麵還不如多走幾步去附近的麵店吃，價格比較合理，這家麵店在疫情之前應該是專門在賣給不知道去哪吃牛肉麵的外國觀光客吃的
 Han Zhong ,https://www.google.com/maps/contrib/105500256442434982722/reviews?hl=zh-TW,5,True,58,店面整體氛圍良好，用餐環境舒服，餐點分量較為精緻，口味還不錯，但整體單價稍稍偏高
 po ling chou ,https://www.google.com/maps/contrib/110927871447391807150/reviews?hl=zh-TW,5,False,4,今天特地來到牛店清燉的湯頭清甜不油膩花干滷的入味好吃樹間cp值很高的牛肉麵店
 Josh Lo ,https://www.google.com/maps/contrib/100154275942549298597/reviews?hl=zh-TW,1,False,5,二人去用餐，吃到滿頭大汗，跟店家反應好熱，完全不理會，外面氣溫15度左右，店裡面應該有35度吧，吃的好難受，真折騰人，希望你們早日被市場淘汰。
 April Hsieh ,https://www.google.com/maps/contrib/114421454890703049167/reviews?hl=zh-TW,5,True,31,剛開幕就吃到現在，當時是以前同事開的，真的很好吃，來西門町一定優先吃這家
 傅傅 ,https://www.google.com/maps/contrib/114116552054581406081/reviews?hl=zh-TW,5,False,23,"餐廳播放的音樂和用餐環境都讓人很舒服
店員服務態度很好，也會告知食用方式🤣"
 青揚 ,https://www.google.com/maps/contrib/107072994178517118136/reviews?hl=zh-TW,3,True,190,好吃平價選擇多
 Glad Glad ,https://www.google.com/maps/contrib/115393109591687220803/reviews?hl=zh-TW,5,True,21,真的很好吃，名不虛傳！
 Noëlle Carmina ,https://www.google.com/maps/contrib/100673821950642161960/reviews?hl=zh-TW,5,True,543,非常獨特的牛肉麵，也十分好吃，常常需要排隊，大推拌麵加上店家特製牛髓辣油，超香非常過癮！湯麵也很不錯。店內有裝潢跟一般牛肉麵小店走不一樣的風格。
 Chen Yutung ,https://www.google.com/maps/contrib/110424788212166708979/reviews?hl=zh-TW,5,False,5,"特地到西門町就是為了吃牛店！
湯頭跟麵條，尤其是辣度，真的是愛不釋手！"
 黃裕家 ,https://www.google.com/maps/contrib/110393809165032336028/reviews?hl=zh-TW,4,True,26,"半筋半肉牛肉麵筋軟肉大塊，特別要求淡口味的湯頭意外清甜，因為麵條本身有鹹味，口感搭起來剛剛好。

豆乾必點，服務人員態度很好👍🏾

但背景音樂放電音舞曲實在讓人越吃越焦慮🤣🤣🤣"
 周周 ,https://www.google.com/maps/contrib/101918646655825621168/reviews?hl=zh-TW,3,True,51,"店內裝潢風格不錯，滷味小菜都很好吃，店員也親切有有禮。
但湯頭不是我喜愛的風味，價格也是較高一點點。"
 Paul Chen阿保 ,https://www.google.com/maps/contrib/109170217153948460408/reviews?hl=zh-TW,5,False,8,這才是好吃的牛肉麵，環境乾淨，有裝潢，不管去幾次，口味都一致！朋友都說八德路的林x芳很好吃，我吃了3-4都吃到淡如水的湯頭，朋友才說品質不一，但我從沒吃到濃時的湯！要吃牛肉麵還是會來牛店！棒棒的....
 Yonghe Wen ,https://www.google.com/maps/contrib/113558403159396300459/reviews?hl=zh-TW,1,True,135,以前是給4星，對不起，因為很了不起店員改成一星。店裡就兩位印尼店員一高一矮，那位矮的是在跩什麼，填好單，叫她3次並招手，都看見了也不理也不過來，最後反而走到最前面去叫另一位過來，是怎樣，我進店沒幾分鐘是哪裡得罪妳了。有需要那麼跩嗎？
 人澹如菊 ,https://www.google.com/maps/contrib/109661324008861334472/reviews?hl=zh-TW,1,False,18,完全沒有牛肉味如同陽春麵一樣的湯頭，所以湯可以給到滿出來，台北市專賣清燉牛肉麵的湯都很捨不得給，因為是原汁。
 chen chen0987 ,https://www.google.com/maps/contrib/113965256767221820642/reviews?hl=zh-TW,2,False,12,肉質不錯，湯頭就遜了點。因為等候的人多，所以，只要吃完，碗~收的很快，意謂著，趕人，快離開。C/P值，不符。
 金宏明（金老爹） ,https://www.google.com/maps/contrib/103625261651602594819/reviews?hl=zh-TW,4,True,257,單純就烹煮方式，是符合清燉與紅燒分離的概念，且肉的品質很好，頂級的更好，唯獨價格是否值得，那就見仁見智了，至少個人覺得值得一吃
 Nathalie Wu ,https://www.google.com/maps/contrib/108570656993618942224/reviews?hl=zh-TW,4,True,84,"清燉牛肉麵有原味跟川味可選
如果不是要追求辣度上的刺激
川味微辣其實就很夠味了
無論肉還是麵條份量都不算多
以一碗280的牛肉麵來說
沒吃飽有點遺憾"
