user_name,user_profile_url,rating,local_guide,comment_num,comment_text
 Leon Lee ,https://www.google.com/maps/contrib/108251703202553296952/reviews?hl=zh-TW,3,True,195,"初訪…
麵類都是現點現煮
光這點就先給個讚

用餐時間還沒到
店內除了我們這桌也就2桌的客人
應該不是太忙碌
不過服務人員惜字如金的服務態度
介紹像在唸稿似的
一點也感受不到服務的熱忱…

店家一直強調湯頭是屬於偏重口味
可是實際喝下去的時候（紅燒滿福）其實還好
愛吃辣的，一定要試試他們家的辣椒
獨特的味道是別的地方沒吃過的
雖不像有牛油中藥超過辣油的香味
但獨特的味道卻可以提升湯頭的味道跟層次感

牛肉、牛肚、牛筋個人覺得倒是滷的很入味
味道甚至比湯頭還好一些⋯⋯
麵雖號稱是硬麵、但其實可以再硬一點口感會更好"
 妤琋 ,https://www.google.com/maps/contrib/100631183915797025040/reviews?hl=zh-TW,5,False,3,"好久沒來吃了，以前都是點滿漢牛肉麵（現在叫滿福）230的，這次是第一次吃極品紅燒滿福450元

清燉湯底配合軟硬適中的麵條，原本就讓人食指大動，把麵撈到小碗裡，再淋上極品紅燒湯汁，口味濃淡可以自己調整，算是紅燒清燉，湯麵乾麵一次體驗，喜歡吃牛肉麵的，牛店不會讓你失望"
 小李子 ,https://www.google.com/maps/contrib/108501792169527359054/reviews?hl=zh-TW,4,True,90,"趁0+7前來西門町的牛肉麵名店。
湯頭有紅燒.清燉.川味，連麵也可以客製軟硬程度。點了紅燒滿福牛肉麵並加了酸菜。一定要在醬料區拿辣牛髓油，加入湯中後很棒👍
滿福有腱子肉.牛肚.牛筋。牛肚脆軟Q彈，牛筋一口咬下就化成滿嘴膠質，腱子肉很大片又軟嫰富有牛肉香氣而不騷。我媽表示，這碗麵對牙口不好的人太友善，可以完完全全品嚐到它的美味。
雖然不便宜但美味度高，店裡也很乾淨整潔（店員很認真防疫，用餐完的桌面都會用酒精和紫外線槍消毒）值得回訪😋"
 Aastapolar ,https://www.google.com/maps/contrib/101027571893952617896/reviews?hl=zh-TW,4,True,21,"湯頭可以喝得出來牛骨高湯的香甜，但鹹味是非常突出明顯的，相較於一般的牛肉麵會有香料的風味，這個湯頭比較像是牛味和鹽巴的直球對決
椒麻拌麵香辣麻三種風味皆非常融合，麵條軟硬適中，推薦給喜歡麻辣的人，美中不足的地方是吃到沉在底部的醬汁讓鹹味非常突出，需要配茶水才能吃完
整體來說比較適合重口味的食客，可以趁著疫情期間人潮比以往少的時候來試試看"
 Jeffrey Yenn ,https://www.google.com/maps/contrib/114659875183374726484/reviews?hl=zh-TW,3,True,84,第一次吃以牛肉麵來說價格有點高店員大姐很專業的問我們要怎樣的麵跟辣度似乎都是可調整的這點很棒～但後來看發現湯頭也可調整她可能忘記問了。我老婆點牛筋湯麵我點麻辣拌面當麵上來時真的很期待，所以我隨便拍一張就吃了。嗯麵是很Q軟有嚼勁但是湯頭沒什麼味道應該說有點水蠻失望的不過牛筋非常入味燉的軟度又剛好蠻好吃但整體口味上湯頭不太行大扣分蠻可惜的要我形容就是外表裝備都完美但少了靈魂的感覺愛吃口感的人應該會給更高分～
 SMALL FAT (聽說他在減肥) ,https://www.google.com/maps/contrib/116339947550298112032/reviews?hl=zh-TW,4,True,152,"這家店我給4.3個星
服務態度很好，環境也很整潔，位子適中，適合一兩個人悠閒的享受
我今天點的是他的精燉牛肉麵，吃完的感覺是，他的湯是真的有下功夫，喝起來味道不錯，但是其它的部分就覺得很普通，牛肉軟嫩，但是沒有感覺的什麼特色，麵軟硬適中，但是一樣沒覺得什麼特別的地方，整體評價起來大概是中上
考慮到Cp值(份量，價格，味道)，我大概最多就是給到4.3，我點的這碗接近300，吃完真的是覺得普通！但也許最普通的東西，就是大家最追求的東西，期待各位饕客可以指出他更有特色的部分"
 Cynosure花蓮阿鴻 Chang ,https://www.google.com/maps/contrib/100957501103072745672/reviews?hl=zh-TW,3,True,453,牛肉牛腩牛肚都不錯吃，牛肉麵紅燒湯頭較重口味鹹一點(店員會先告知)，喝起來還ok。這家牛肉麵麵裡面沒有蔬菜，只有蔥花，比較不合個人。
 小佑 ,https://www.google.com/maps/contrib/100385527854789262750/reviews?hl=zh-TW,5,True,99,"紅燒三寶麵湯頭微微辣濃郁好喝，牛肉軟嫩好吃😋、牛肚微脆不偏硬、牛筋Q、麵條我選偏硬個人覺得蠻適中，有機會可以試試看～我覺得還不錯吃。
朋友說牛油配辣椒放湯頭裡面不錯，我比較不吃辣有機會喜歡吃辣的朋友可以試試～"
 Eva Wang ,https://www.google.com/maps/contrib/108303173088817325599/reviews?hl=zh-TW,5,True,776,牛腱超級好吃我心中全台第一，牛筋跟牛肚也很優秀。麵條Q彈，厚度剛好，湯頭清甜，是單純的牛骨清湯。肉類算是滿貴的，沒有那麼多預算的話其實吃個牛肉湯麵也會感到很滿足。滷豆干一絕。
 Epson Chen ,https://www.google.com/maps/contrib/102453033683598512847/reviews?hl=zh-TW,3,True,"1,113",沒有評論說得這麼厲害，麵是好吃，但是湯的牛肉味不足，不知道是辛香料蓋過去了還是怎麼樣覺得牛肉稍鹹，吃不到牛味，有點可惜
 Chung-Hao Cheng ,https://www.google.com/maps/contrib/103950258070004859223/reviews?hl=zh-TW,5,True,"1,092","2018-2020連續三年獲的米其林必比登推薦，儘管現在沒有觀光客，人潮還是絡繹不絕。
一入店就看到必比登寶寶和牆上滿滿的報導和獎狀，果然是得獎無數的名店。
入店後告知店員有幾位後就拿單入座點餐，點完後再請店員來收單就好。
牛肉麵湯頭有紅燒、清燉和川味三種，但點菜單上沒有，店員收單時會問，店員也會問麵條的軟硬度，還會說湯頭會說有點鹹，有沒有需要調淡一點，客製化的程度快跟拉麵一樣了。
假日生意比較好，通常晚上過18：00紅燒就賣完了，要吃要早點來。
前面餐檯上還有一些筍絲、黃瓜或豆干的小菜可以選，一份40元，這小菜份量不多，真的是小菜。
後面櫃上有茶和飲水機可以自取，但茶很難倒，而且沒保溫效果，倒出來都是冷的。
因為廚房只有一個人在做，而且又是照單出，所以點餐後要有耐心，當天用餐花干就等了約18分鐘。
另外牛肉麵等了24分鐘，滿漢牛肉麵裡有牛肉2塊、牛筋2塊、牛肚4條、牛腱3片，一碗可以吃到所有部位是相當滿足，牛肚很薄Q，牛腱燉的很嫩，麵條有嚼勁，紅燒湯頭很香濃，算是一碗很不錯的牛肉麵。
牆上有小菜配的辣椒醬和牛肉麵配的辣油，這個一定要加，味道可以更豐富有層次。
要講一下廁所的門鎖，研究了很就不知道怎麼關，最後才在很不起眼的地方找到插孔，實在很不人性化。
店裡的環境很乾凈清潔，外場的阿姨態度很好，客人離席也會確實用消毒機消毒，店裡的音樂還是撥放有格調的爵士樂，連續三年必比登推薦是實至名歸。"
 I&L ,https://www.google.com/maps/contrib/102340710516571432486/reviews?hl=zh-TW,5,True,192,想吃牛店很久了，之前都是星期一、二有空但可惜店家週一、週二休息。這次週三中午約一點到，原本沒什麼人，要走的時候幾乎客滿。店員服務非常好，熱心解說菜單，還非常貼心注意一些小細節，客人用餐後，也馬上清潔、消毒，五顆星給服務及整潔。餐點方面，紅燒牛肉麵的湯偏鹹，好像可以調鹹淡，比較沒這麼重口味的人可以選淡一點的，我下次會想點清燉；肉非常軟嫩；他們的麵可以調軟硬度，我選適中的對我來說蠻剛好的。牛腸是我看圖片一直很想點的，因為看起來太誘人，很想試試看，口感不是那種脆脆的，比較像一般雞腸的口感；小黃瓜蠻好吃的。自助的茶水，有常溫水及熱茶。
 寶村 ,https://www.google.com/maps/contrib/104010963005883713887/reviews?hl=zh-TW,5,True,66,好吃，適合重口味的我。拌麵味道也很好，肉質軟嫩，生洋蔥搭配下去很香，我又去跟店員添加了一次洋蔥。
 LC ,https://www.google.com/maps/contrib/108575600821452073655/reviews?hl=zh-TW,1,True,67,"$NT200-280口味普通的牛肉麵實在是無法接受，也不要說店租多貴，位子小的要死。二人用餐
隨便加個小菜消費超過500都可以去吃火鍋吃到飽+舒舒服服的位子

建議大家不要迷信必比登這種商業化炒作了。"
 ChiaHui Wei ,https://www.google.com/maps/contrib/110793967631114916465/reviews?hl=zh-TW,4,True,433,"極品紅燒味道還不賴，可以依據自己的口味調整鹹淡
牛肉軟嫩，牛筋Q彈軟嫩，但不會過度軟爛
價格稍微貴，整體來說是可以再訪好店"
 Christina W ,https://www.google.com/maps/contrib/106696872009460750593/reviews?hl=zh-TW,5,True,102,"湯頭有精燉、紅燒、川味可以選擇，麵條也能調整軟硬
紅燒湯頭濃郁，口味較鹹微辣；精燉湯頭清甜，肉的部分就中規中矩
熱花干必點！花干滷的非常入味，吸飽了湯汁，搭配小菜的辣醬非常涮嘴，一盤吃完又再加點了一盤
店內用餐環境整潔、店員親切"
 江麗玲 ,https://www.google.com/maps/contrib/108431285329954541431/reviews?hl=zh-TW,5,True,58,近西門町成都街，店面乾淨，喜歡樸素的紅磚牆原貌保留，牛肉好吃，原味湯頭好，小菜味佳，值得再度光臨。
 陳逸潔 ,https://www.google.com/maps/contrib/107342741879511631014/reviews?hl=zh-TW,5,True,12,"剛好錯開用餐時間，下午悠閒的享用好吃的牛肉麵
店員有禮貌，環境很有個性！雖然單價有點高，但是是好吃的！👍👍👍
今日點的
主食：牛筋麻辣乾拌麵-微辣（好吃可接受）
小菜：熱花干（有入味）"
 SKY Liou ,https://www.google.com/maps/contrib/116756495041902737381/reviews?hl=zh-TW,5,True,184,滿福牛肉麵味道還不賴，可以依據自己的口味調整鹹淡，環境乾淨明亮有落實防疫，祝生意興隆，高朋滿座～
 Sunking Yu ,https://www.google.com/maps/contrib/115367740108387039298/reviews?hl=zh-TW,5,True,99,"滿漢乾拌麵非常好吃，有很多牛肚、牛筋跟牛肉。牛筋軟Q入味，十分驚豔。醬汁底部還有很多碎牛肉，吸了醬汁會想要通通夾起來吃光光，不要浪費😂
小辣比想像中辣很多，不能吃辣跟口味清淡的朋友評估後再點。
清燉牛肉湯非常濃郁，好像有膠原蛋白的感覺（?），滿解辣的。價格不便宜，但是因為料真的多，所以是可以接受的，推薦給大家。"
 李苡甄 ,https://www.google.com/maps/contrib/115086631986957276573/reviews?hl=zh-TW,5,False,15,"清燉牛肉麵小碗200元
紅燒半筋半肉牛肉麵280元
小菜筍絲40元
店員會詢問麵條的軟硬程度～
整體來說美味好吃😋"
 PoFan Hsiao ,https://www.google.com/maps/contrib/103855103083385921512/reviews?hl=zh-TW,4,True,247,"牛肉乾拌麵：牛肉非常嫩，感覺有用醋調味，但整體口味偏清淡。

清燉的牛肉湯味道很樸實，是大骨湯搭配白蘿蔔的那種清甜的味道，但剛端上來時便溫溫的，對於喜愛喝熱湯的我來說覺得有點可惜。

算是非常精緻的牛肉麵，店內有熱茶可供飲用，店員也很親切的介紹招牌的牛肉麵，每個位置也都會消毒。

有機會會再訪"
 Rui Tsai ,https://www.google.com/maps/contrib/100971218385263544420/reviews?hl=zh-TW,5,True,86,"紅燒牛肉麵（小）正常硬度
味道精緻，麵軟硬適中，湯頭用心
即使點紅燒還是有清燉的牛肉湯味
紅燒的湯頭配牛腱就是100分"
 Yang Yang ,https://www.google.com/maps/contrib/117851388261256033390/reviews?hl=zh-TW,4,True,57,"滿漢牛肉麵
精燉牛筋麵
牛筋～👍
軟爛又保有QQ的口感
好好吃
精燉湯頭清甜又好喝
牛肚沾牛辣油
香辣好加分
最重要一定要稱讚的是店員
愛乾淨
收拾醬料時
很認真的把整個醬料碗以及湯匙都做清潔
👍👍👍"
 Shih ,https://www.google.com/maps/contrib/110393765203937089718/reviews?hl=zh-TW,4,True,113,"圖片為大碗的！
喜歡清淡一點的可點清燉
我吃清燉ㄉ整個沒fu⋯😭😭
下次想嘗試另外一個湯頭～"
 Ju ,https://www.google.com/maps/contrib/105744026671258146107/reviews?hl=zh-TW,4,True,68,"來到西門町想吃吃不同的牛肉麵.經YT分享.感覺可以來試試.於是晚上就前行。空間整潔明亮.廚房ㄧ進門就看得到.有種安心的感覺.收拾完桌面會在酒精最後消毒一下👍
今天點的是滿漢牛肉麵（肋條.毽子心.筋.肚）：如照片紅燒肉及湯麵🍜是分開裝.裡面有建議吃法是讓你先喝原味湯再將紅燒隨自己口味添加.牛肉滷的很嫩.有入口即化的口感。滿漢牛肉麵（毽子心.牛筋.牛肚））：.清燉是店內招牌+微辣剛剛好.湯淡淡香味好喝.牛肉.肚的部分切的剛好.一口就能進嘴裡.不會噎到😹
可以嘗試看看.味道真的不一樣😊😊😊"
 Suan Suan ,https://www.google.com/maps/contrib/106023440343954128408/reviews?hl=zh-TW,1,True,31,"請問必比登和Google評論都是用錢買的嗎？？？
（如果不是用錢買的，比起回覆留言，更希望你們把湯頭煮好，太難吃了！）

個人本身口味偏重，
但是沒想到整碗牛肉湯頭就是鹹，非常鹹，死鹹！
重點是，整晚牛肉麵的湯，一點牛肉味道都沒有，喝起來就是「熱水加一堆鹽巴的味道」非常噁心……
就連牛肉一口咬下也是滿嘴的鹹味…
硬是吃了半碗實在是黑人問號無法下嚥。

如果要來吃的各位，麻煩去自己家巷口的牛肉麵吃就好了，保證比這家好一百倍🙏🏻"
 許琳傑 ,https://www.google.com/maps/contrib/106258291274536914537/reviews?hl=zh-TW,5,True,572,必比登推薦名店，由於疫情少了外國遊客，現在比較不用排隊，精燉牛肉湯香氣足味道不會過鹹，牛肚牛筋都保留一些彈性跟咬勁，沒有燉到透爛，牛肉軟嫩而不柴，小菜清爽解膩，花干入味搭配辣醬滋味豐富，價格也合理，蠻值得去試試的。
 陳草草 ,https://www.google.com/maps/contrib/116231097524534776765/reviews?hl=zh-TW,5,True,166,"紅燒口味，夠味。不像一般牛肉麵店的湯頭。
清燉口味，別有一番風味。
牛肉非常入味又軟嫩。值得一吃"
 朱ジュウニン ,https://www.google.com/maps/contrib/115102898236844889192/reviews?hl=zh-TW,5,True,634,第一次來，吃清燉牛肉麵，很合我的胃口，下次來試試其他口味！
 沈Michael ,https://www.google.com/maps/contrib/101662797190708590800/reviews?hl=zh-TW,4,True,352,"價格偏貴，但跟相同價位的牛肉麵比起來，份量還不錯，肉給的很多，麵不算太多，湯頭也很讚，肉也好吃，價格就偏高！！
店裡的味道也滿香的。"
 黃麗珍 ,https://www.google.com/maps/contrib/100459898180743557961/reviews?hl=zh-TW,5,True,123,米其林餐廳真的沒話說，牛肉湯汁的層次感，牛肉恰當好處的烹調方式，真的是很棒的美味關係。
 曾志仁 ,https://www.google.com/maps/contrib/109859188060675947037/reviews?hl=zh-TW,5,True,788,精燉牛肉好吃，麵也不錯，但我喜歡湯熱一點，小菜辣醬也不錯，價位高一點不錯吃，老闆小姐服務不錯，可能是疫情期間小菜不多，餐桌用過餐後都消毒擦過，整體用餐環境不錯
 Stephen ,https://www.google.com/maps/contrib/105350874622062406856/reviews?hl=zh-TW,5,True,209,麵湯肉都好吃，真的要說缺點就是桌位不夠有時要併桌吧？
 張Mountain ,https://www.google.com/maps/contrib/108821934218994357247/reviews?hl=zh-TW,4,True,30,"來朝聖米其林級的牛肉麵。
點了極品紅燒牛肉麵及滿漢牛肉麵，兩種風味不同，肉質也不同，以價格來說，比起北市差不多價位的店家，極品紅燒牛肉麵確實有它不同之處，風味滿滿，相較之下，滿漢牛肉麵與一般牛肉麵店口感較為相同，但是個下次還會再來嚐鮮的口袋名單。
疫情期間店家的消毒工作也做的滿滿，大家有空可以來試試！"
 gloria chu ,https://www.google.com/maps/contrib/110344236071001925476/reviews?hl=zh-TW,5,False,28,牛店重新開幕了，一家非常用心的牛肉麵店，湯頭清甜美味，牛肉軟硬適中，麵條有彈性，服務態度親切～
 Carmina Ng ,https://www.google.com/maps/contrib/115239483971110117036/reviews?hl=zh-TW,4,True,439,"店內的設計很特色
服務態度親切
牛筋非常入味
料理區也保持整潔
唯有大門上的空調
需要清理油垢
破壞形象"
 飛刀門幫主 ,https://www.google.com/maps/contrib/117130589619690867484/reviews?hl=zh-TW,5,False,19,"來牛店一定要吃右上角的套餐！
非常好吃😋"
 Mark Wei ,https://www.google.com/maps/contrib/116593702306323162171/reviews?hl=zh-TW,4,True,82,終於有機會來品嚐了，紅燒的口味竟然比川味的重，川味的口味竟然偏淡，整體而言都偏清淡，但是麵條口感有嚼勁有加分。
 Hola_ 91 ,https://www.google.com/maps/contrib/104960474932100155711/reviews?hl=zh-TW,4,True,36,"今天點了滿漢牛肉麵跟極品紅燒牛肉麵，還有小菜：花干。從食物到環境再到服務全都在線，甚至連防疫消毒都做得很完善。是一間不會有任何雷點的店家。

極品紅燒牛肉麵的吃法能一次品嚐到兩種各有千秋的湯底，是不錯的選擇！（適合想犒賞自己時點，畢竟價格偏高）

店家內附的兩種醬料都推薦嘗試，而且都會辣。
牛肉麵辣油加進麵裡會額外增添許多香氣。
點花干一定要沾一些小菜辣椒醬～

還有附上吃法建議的小紙條有點可愛😂"
 廖昱錞 ,https://www.google.com/maps/contrib/110819255427129442579/reviews?hl=zh-TW,1,True,236,點了一個椒麻滿漢拌麵，口味不錯很好吃，另點一個滿漢牛肉麵紅燒，卻來了個清燉，叫員工來看說要幫我調整湯頭？結果就是吃了一些的麵拿去加一些紅燒湯，變成四不像的麵，送錯東西就這樣處理？從頭到尾就是點紅燒，我不吃清淡的東西，怎麼會點清燉？來點的員工過來也是不認錯，想這樣隨便解決了事，算了，自認倒楣，枉費我大老遠來吃！感受真是差勁👎
 小昱黃 ,https://www.google.com/maps/contrib/111495285273237458029/reviews?hl=zh-TW,5,True,256,湯頭甘甜，肉塊份量十足，環境乾淨舒適，服務親切，值得回訪
 陳維加 ,https://www.google.com/maps/contrib/109138986647060214460/reviews?hl=zh-TW,4,True,51,"環境很乾淨，有另外提供茶水，
我們點了半筋半肉跟極品紅燒（半筋半肉），
肉的口感很棒，湯底的味道偏重但是不死鹹，
另外，極品紅燒有不同的吃法，會有小紙條提供建議的品嚐方式，很貼心！
有機會可以來吃吃看！！
P.s.不過整體單價有比較高一些"
 張佳煒 ,https://www.google.com/maps/contrib/112821150507790745981/reviews?hl=zh-TW,5,True,36,"不錯，精燉湯頭推推。
花乾和牛筋最高！"
 台灣牛肉漢堡漢堡兄弟 ,https://www.google.com/maps/contrib/116667881825132593120/reviews?hl=zh-TW,5,True,104,慕名而來！湯頭真的很精燉，有些許黏嘴感，牛筋滑Q及牛肉也燉煮合宜，好吃👍
 林Luke ,https://www.google.com/maps/contrib/105286800564072859046/reviews?hl=zh-TW,5,True,317,台北最愛牛肉麵之一，湯頭清淡，要加牛油提味，麵體是有嚼勁，肉是有厚度的腱心肉，入口軟嫩，椒麻拌麵就很有味道了，有洋蔥還有小肉塊，小菜蘿蔔/小黃瓜都醃的剛好，花干也是不容錯過…多訪…
 ms ,https://www.google.com/maps/contrib/104412744755105601016/reviews?hl=zh-TW,4,True,148,牛肉軟嫩新鮮，清燉或紅燒都好吃！一碗就吃的很飽，會想再訪的店！但有點小貴了！
 Cary Yen ,https://www.google.com/maps/contrib/114004157066136960873/reviews?hl=zh-TW,5,True,169,"牛店

牛肉麵總是給人大口吃肉，大口喝湯的豪邁不羈感受，但有時想正經危坐，優雅氣質的吃碗牛肉麵，這時牛店是很好的選擇。歷史雖然不悠久，卻在食界發光發熱。

點了限量的滿漢半筋半肉牛肉麵，怕吃不飽，再加個豆乾、小黃瓜及熱花干。我趁著空檔盛點辣椒，辣椒分紅燒牛肉湯專用的牛骨髓油辣椒及滷味小菜專用的橘色辣椒，果然沒有一種醬料是包山包海的，應適情適性，因材施料。小菜給的蠻大方的，而且相當入味，應該都是自行烹煮而非外批，相當夠水準。

滿漢牛肉麵的確滿滿一盤，清燉牛肉麵+濃縮紅燒牛肉湯+牛筋+牛腱心+酸菜，自行調配可以吃清燉、紅燒、乾拌等不同口味。麵煮得極好，軟硬適中，有拉麵的水準。清燉牛骨湯有特殊香氣，應該有獨有配方，不太習慣。濃縮紅燒湯頭極香極鹹，必須對清燉湯頭才能食用，試了紅燒湯頭與拌麵，都是美滿且幸福。牛筋QQ，而牛腩是最大驚喜，大塊大塊的切，彈牙且黏牙，且極為入味，似乎是先醃後煎蒸煮，且火候控制講究，有台塑牛小排的口感（同學性喜自然，對於牛肉醃製頗有微詞，按下不表）。

是一家裝潢簡潔，窗明几淨，口味細膩，濃淡相宜的好餐廳，嘗說西餐是一種精確的藝術，中餐何嘗不然呢？

看看必比登的評語「工業風裝潢加上整齊制服的服務生，這家麵店無疑是走較精緻路線。牛肉麵的湯頭採用法式清湯製法、以多種牛骨部位與西式香料熬製，滋味清爽甘甜；而麵條則為自家生產，以家常麵做成拉麵口感，顧客更可挑選軟硬度。招牌滿漢牛肉麵包含牛腱、牛筋和牛肚三個部位，更附以辣醬油，是以同時可嚐到兩種風味。」"
 Jasmine Chang ,https://www.google.com/maps/contrib/101293774089072855625/reviews?hl=zh-TW,5,False,5,"推薦點極品紅燒牛肉麵！

可以一次嚐到清燉跟紅燒兩種湯頭，而且是可以依據自己的口味來混合味道的，第一次吃到這樣的吃法，覺得很新鮮有趣！

那個紅燒濃汁齁，加下去整個香味都出來了，再配一點點牛肉麵辣油，哦齁，香爆。

但同時清燉湯頭完全就是清爽的少女，非常溫和清爽的口味，也讓我捨不得把所有清燉湯頭都直接跟紅燒混合，連清燉湯頭都很珍惜的吃到最後，一滴不剩。

雖然要價400元有一點點小貴，但想成一份西餐來享用的話我覺得可以接受！心情不好的時候來吃一定也會完全被療癒，推推！"
 陳冠佑 ,https://www.google.com/maps/contrib/101978579730935927928/reviews?hl=zh-TW,5,False,13,"肉很大塊很嫩吃起來很過癮
花干也不錯"
 東湖梁朝偉 ,https://www.google.com/maps/contrib/115409061519570830236/reviews?hl=zh-TW,4,True,472,初次吃，點基本的牛肉麵，紅燒，麵條有嚼勁，湯頭沒加辣油前就微微辣，加辣油跟酸菜後更香，值得回訪！應該是西門數一數二好吃的牛肉麵吧！
 Yen Ming Lin ,https://www.google.com/maps/contrib/106451732287765622858/reviews?hl=zh-TW,5,True,45,"口味偏重，但無礙對牛肉麵的喜愛

辣度可調整，推薦"
 賴韋霖 ,https://www.google.com/maps/contrib/101919764306357076005/reviews?hl=zh-TW,3,False,18,店員一開始態度很差有種不耐煩的感覺，麵不難吃牛味十足麵條也煮的很剛好，但吃飽時發現店員切滷味小菜並沒有戴手套，直接用手拿取食物、切完再擦擦一旁抹布、隨後客人結帳又直接拿錢結帳，衛生品質恐怕令人擔心尤其疫情期間😔
 Jarvis Lin ,https://www.google.com/maps/contrib/105112559597624733277/reviews?hl=zh-TW,4,True,216,"牛肉
■■■■■■■■□□
牛筋
■■■■■■■■■□
牛肚
■■■■■■■■■■
湯頭
■■■■■□□□□□
麵條
■■■■■■■□□□

本次訪店點了滿福牛肉麵，川味微辣（川味是精燉湯頭加辣油）、麵條未調整。牛肉採用牛腱，屬於軟嫩口感，食材本身的味道相當濃厚；牛筋口感佳，邊緣可以用舌頭壓散，其他部分輕咬就化開了，有調味，不是單純膠質的味道。牛肚有幾片不是直上直下的切法，而是斜切，口感相當有趣，調味也沒問題，是本日最愛的品項。湯頭鹹味相當突兀，原本期待辣油會有額外的香氣，但我只感受到滿滿的牛味，略嫌單調。下次訪店會再試紅燒口味。"
 茜茜 ,https://www.google.com/maps/contrib/116366517833577290722/reviews?hl=zh-TW,5,True,80,"清燉牛肉湯湯頭好喝，再加上店家特製牛肉麵辣油更增添了美味！
第一次吃牛腸，原來裡面包了牛肉，很特別！
大家推薦的花干，天啊，滷的超入味！
麵條可以調整軟硬度，湯頭可以調整鹹淡！
是值得可以再來的店家哦！"
 Sheila Chen ,https://www.google.com/maps/contrib/111894873959535581088/reviews?hl=zh-TW,4,True,91,"店員詢問後點了川味的牛筋麵
麵調整硬度->軟
麵條我很喜歡
但個人覺得川味湯頭一點都不辣也很淡
稍微有點失望
店內備有茶水可使用還不錯"
