user_name,user_profile_url,rating,local_guide,comment_num,comment_text
 鄭景成 ,https://www.google.com/maps/contrib/112070120778760295435/reviews?hl=zh-TW,3,True,5,我吃過台北地區的很多家藏壽司，今天這是第一次在大直的用餐，不是太舒服，幾乎所有盤子都是油油的，之前用餐都不會這樣，所以這次給了較低的評分，食物仍是水平之上就是了。
 Rebecca Chuang ,https://www.google.com/maps/contrib/105138036209427319052/reviews?hl=zh-TW,3,True,161,服務人員很親切，對於行動不便的人會特別關心，盡速安排入座，就櫃檯服務人員給5顆星
 Xuan LEE ,https://www.google.com/maps/contrib/111520009708724957673/reviews?hl=zh-TW,5,False,5,"一堆智障奧客政府就規定兩人坐一桌
人家公司也有規定可不可以不要為難服務生？在那邊拖大家時間。我們三個人吃也是分兩桌乾你媽沒教你怎麼吃飯喔一定要人家陪才會吃是不是：）
要聚餐就回家聚少在那邊秀下限低能"
 菁菁 ,https://www.google.com/maps/contrib/111598505438238149951/reviews?hl=zh-TW,4,True,63,握壽司的飯和料的比例抓的很好，但是飯偏軟，大部份的口味做的不錯，自助螢幕點餐老人家不太會使用，唐揚雞有被雷到，味增湯偏鹹
 Chia-Wei Chang ,https://www.google.com/maps/contrib/115457683047287658788/reviews?hl=zh-TW,1,True,92,"醋飯是熱的，無法接受。飯很散…拿不起來。魚肉很黏不喜歡。結果這樣還可以魚飯分離。

魚是不是被悶熟了==

蓋子太難開還要教學，結果一群長輩小孩也是開開關關，拿到桌上又放回去轉檯，不太衛生…………周圍聲音很吵無法聽到隔壁人的聲音，乾脆不聊了。

員工很客氣，還有打折，但食物實在很難以接受，以上是這家的體驗。

沒有爭鮮便宜，但食物品質真的要加加油。

對了，點餐機太高，老婆手短按不到不開心，杯子放更高，老婆更不開心，找了五分鐘才看到。

小朋友一直玩餐點可能不是餐廳的問題，但我真的難以接受，只好都用點的，至少點菜來的算快，差不多一到三分鐘左右上菜。"
 Colin Jao ,https://www.google.com/maps/contrib/103392837778089918435/reviews?hl=zh-TW,4,True,"1,207",新鮮度好像沒有維持一致的水準……。
 Chen Andre ,https://www.google.com/maps/contrib/110457188350385360567/reviews?hl=zh-TW,3,False,18,食物品質與其他分店差很多…
 chuanshu chen ,https://www.google.com/maps/contrib/113673974780323699543/reviews?hl=zh-TW,2,True,492,第一次來大直店，去吃過日本的平價KURA就知道台灣的這分店根本不行！菜色一般又少價格又貴！壽司飯都還有溫熱的！吃完扣掉玩扭蛋小孩很Hi外，感覺就像吃完爭鮮一定是錯覺的fu！相同要排隊甚至比在美麗華的壽司郎都差很多.......加油別只是靠撈台灣的哈日在經營！
 林恆毅 ,https://www.google.com/maps/contrib/114709496508483005112/reviews?hl=zh-TW,3,True,118,現點美味好吃，但假日人潮太多，要先訂位
 Recy Liu ,https://www.google.com/maps/contrib/117293230872041178659/reviews?hl=zh-TW,1,True,20,預約還是現場等了半小時，那我幹嘛預約？
 Ritchie Chang ,https://www.google.com/maps/contrib/113952308643658976664/reviews?hl=zh-TW,4,True,372,吃東西，還可以轉蛋
 范巧湄 ,https://www.google.com/maps/contrib/101890402121570151646/reviews?hl=zh-TW,3,True,123,壽司好吃，但是ATT商店設計動線極差
 楊昇遠 ,https://www.google.com/maps/contrib/110238649873231339852/reviews?hl=zh-TW,4,False,23,連鎖店的品質都有一定，但是用餐當天晚上不知是平日因素，人手不足，所以餐點等待較久。
 Xiaowen Xiaowen ,https://www.google.com/maps/contrib/101343066382540698361/reviews?hl=zh-TW,5,True,449,中獎機會感覺因為疫情變高了些，10盤👍👍
 林家泰 ,https://www.google.com/maps/contrib/105146532130309027851/reviews?hl=zh-TW,5,True,599,相較其它分店，這家排隊人潮少很多，又方便停車，住內湖、大直的朋友，很適合來這家享用。
 索肇來 ,https://www.google.com/maps/contrib/101021810950823901356/reviews?hl=zh-TW,3,False,234,鮪魚壽司沒退凍口感不好，上餐速度快，服務員親切，扭蛋贈品越來越沒特色
 致瑋 ,https://www.google.com/maps/contrib/117327283468053614344/reviews?hl=zh-TW,5,True,12,"覺得跟其他的迴轉壽司比較起來，覺得藏壽司的食材蠻特別的，有季節鮮魚，提供在外面日本料理店都不太常見的生魚片壽司，像之前去過幾次有吃到不一樣的，

像是小黑鮪魚的壽司吃起來的感覺，魚肉是紮實Q彈的，味道是很鮮甜的很好吃，還有一個叫姬鯛湯引的壽司，覺得蠻特別的，之前在youtube有看到用熱水沖在生的魚塊上，然後趕緊泡到冰塊水裡去冰鎮的料理手法，但這個料理手法真的在台北的日本料理店比較少見，竟然在這邊吃的到，吃起來感覺因為有用熱水燙過了，所以魚的皮吃起來是有點脆脆的，但又好像不太能用脆來形容，就是感覺輕輕咬一下魚皮的部分就咬斷了，覺得口感蠻特別的，然後聽服務人員說魚是一大早從漁港那邊，挑選好魚就直接送往店鋪的，目的就是要提供新鮮的食材給我們消費者的。

然後有在詢問了一下，得知還有很多種類的鮮魚握壽司，但魚種會因的季節關係而不固定提供，然後又因為是從魚港直送的魚，所以提供的數量是有限的，所以下次去吃一定要先點來吃，希望能吃到更多不同種類的。"
 張賀翔 ,https://www.google.com/maps/contrib/115592285323419962187/reviews?hl=zh-TW,5,False,30,服務人員態度佳，在人多時有時候某些餐點的選項（點餐機）會不能選
 許家蓉 ,https://www.google.com/maps/contrib/117690423107462623001/reviews?hl=zh-TW,4,True,48,"整體來說從店員態度到食物都還不錯～
但少一顆星給其他客人們跑來跑去的小孩子們
跑來跑去還喊來喊去家長和店員都沒有阻止"
 Stanley Wu ,https://www.google.com/maps/contrib/106350243381464192823/reviews?hl=zh-TW,3,True,179,"環境、點餐方式與壽司郎相似，但點餐平板尺寸不大，又固定在高處，圖文都很小，對坐靠外側的人非常不便；揚物還可以，但麵食鹹到極點、壽司飯也不好吃；用餐結束前，服務員從另側堆放水杯，不慎推過頭，兩三個水杯砸到我們的餐桌，打翻飲料及餐點，雖無大礙但讓我家人受到驚嚇。
整體感覺還有很大的進步空間。"
 Jennifer Yu ,https://www.google.com/maps/contrib/105493084672774656126/reviews?hl=zh-TW,1,False,2,等超級久，現場候位根本都不叫＝＝，根本只有網路訂位才等的到，而且服務態度很差，完全沒想解決問題。
 張小雪 ,https://www.google.com/maps/contrib/118077865561893892653/reviews?hl=zh-TW,4,False,6,點個炸蝦試試看，還行。可惜沒有炸蝦沾醬
 ken-lun-chang ,https://www.google.com/maps/contrib/106333281261276441281/reviews?hl=zh-TW,5,True,26,好吃，但抽到扭蛋的機率真的不高
 ＸＸ ＯＯ ,https://www.google.com/maps/contrib/108013866239935692089/reviews?hl=zh-TW,2,True,76,"1.前一天用網路訂位，很順利訂到位置
2.客服人員很有禮貌，很親切
3.東西算不錯吃，也不會貴到嚇死人
4.點餐送來的軌道很新奇。

接下來是不滿的部分了：
1.在進門之前，接待人員還特地問，有沒有在藏壽司消費過，我回答沒有，想說應該會看我是新人，給我特別介紹一下吧。結果只給了我地圖跟座號，讓我自己去找路了。連爭X都會帶位了，這裡知道我是新人後還讓我自己迷宮探險，還好路標算有，沒有迷路很久。還好沒有收服務費，不然我就冰得。
2.第一樣，找不到醬料盤。
第二樣找不到杯子。
3.杯子找到後發現出水孔道出來是熱開水。很久以後才發現遠處有個東西叫做粉末茶。
4.終於想要取餐了，但發現軌道上的餐點蓋子打不開，我想會不會是我太小力，下一盤來的時候兩手都上，還是打不開。又過了N久，才發現桌子一角有寫要怎樣把餐點打開。
好不容易享用一盤以後，我才有力氣來打量附近到底寫了多少這種操作說明，真的是東一張西一張，不夠細心的人怕是不能發現。
5.桌面上有個孔，說是要把用過的盤子丟進去。但又看到另一張說明，紅色的盤子才能丟，從頭到尾也沒發現紅盤子。
6.座位附近沒有放紙巾很不方便。
我開醬包的時候，太難開，撒了一桌。
隔壁小姐不小心打翻茶杯。
雖然服務人員叫了就來，但無法隨手取得就是不舒坦。"
 Jessica Chang ,https://www.google.com/maps/contrib/100552682406167998123/reviews?hl=zh-TW,3,True,56,壽司🍣好吃，但是！櫃檯人員「陳*媃」指引抽號碼牌時態度不佳，事後想和經理反應，以免後面的客人也感受不佳，卻發現陳服務生的名牌刻意以反面待客，不讓人看見姓名？！這樣的狀況希望未來不會發生，否則影響影響顧客對藏壽司的觀感。
 陳之尊 ,https://www.google.com/maps/contrib/108276214317811401506/reviews?hl=zh-TW,5,True,23,真的還是不錯！只可惜吃了快300還是不夠飽阿~~
 Hung-Sheng Lin ,https://www.google.com/maps/contrib/116617563655566144682/reviews?hl=zh-TW,4,True,131,環境寬敞，但廁所離得較遠，並不是很方便，疫情期間只提供點餐服務，少了點迴轉壽司的樂趣
 Koes Lee ,https://www.google.com/maps/contrib/109246627855167713276/reviews?hl=zh-TW,1,True,671,"鮪魚鮭魚的品質都很差很難吃
以前去站前店的味道已經回不去了
才隔大概一兩年而已味道就差這麼多"
 吳庭宇 ,https://www.google.com/maps/contrib/104840914493323267341/reviews?hl=zh-TW,2,False,10,"餐點算能接受可是生章魚的紫蘇葉黑黑的感覺不是很好吃蠻多次每次都是黑的這次吃的時候還有一點點凍凍的入坐時桌子也都還很濕
還沒乾就讓客人入座感覺也不是很優還有一塊毛豆在迴轉台上🤔"
 Andy Lin ,https://www.google.com/maps/contrib/105641547509172071311/reviews?hl=zh-TW,4,True,123,"食物好吃。
座位空間稍擁擠，易被隔壁（後）桌影響。廣播喇叭音量有問題，影響用餐。"
 Lawren Quinn ,https://www.google.com/maps/contrib/102911326997349273941/reviews?hl=zh-TW,5,True,290,餐點種類比爭鮮跟壽司郎多
 Jason Yang ,https://www.google.com/maps/contrib/102655390453881741090/reviews?hl=zh-TW,1,False,14,智障的排位系統，排後補可能要等下班才能用餐。要現場選時間及後補都取號，才不會被耍。
 韓琛 ,https://www.google.com/maps/contrib/109293784049373221099/reviews?hl=zh-TW,2,True,51,除了菜色比爭鮮多，價格比較高，其他就真的沒差別，至少爭鮮的魚肉不容易滾下來……
 RAI-JHIH C ,https://www.google.com/maps/contrib/100138260592851599369/reviews?hl=zh-TW,3,False,5,"跟北車店比真的有夠失望，尤其是蝦子，蝦子端上來肉纖維一絲絲直接曬出來，腥味也重到不行，這是我最喜歡的餐點每次去北車店都必吃，沒想到大直店居然會如此
因為很喜歡藏壽司所以帶朋友到附近的大直店用餐
結果品質差到不行，對食物方面有夠失望，希望未來可以跟他店跟進一下食物品質的部分"
 Leon Lee ,https://www.google.com/maps/contrib/113707412612591878548/reviews?hl=zh-TW,5,True,185,好吃服務不錯
 Randy “軟迪” Tsai ,https://www.google.com/maps/contrib/102371144324867187278/reviews?hl=zh-TW,5,False,19,用餐環境舒適服務員親切
 Ting-hao Huang ,https://www.google.com/maps/contrib/110606327155500292341/reviews?hl=zh-TW,3,True,20,"送餐的方式很新奇
每集滿五個盤子有遊戲可玩
有機會獲得轉蛋
但吃到心是冷的唐揚雞，心情不好"
 若寒 ,https://www.google.com/maps/contrib/102664833792864697247/reviews?hl=zh-TW,5,True,175,"來了兩次吃五盤就抽到扭蛋真的是感謝前人種的樹讓我可以抽到蛋蛋
炙燒鮭魚系列也是我每次都會狂點的"
 Leo Lee ,https://www.google.com/maps/contrib/115891901225355021812/reviews?hl=zh-TW,3,True,143,這家螢幕超高超遠，要客人做運動舉手點餐嗎….而且米飯捏得好不確實，和南京分店的品質有差距
 啊嘎味 ,https://www.google.com/maps/contrib/106806549835433194409/reviews?hl=zh-TW,3,True,129,餐點口味正常，但是忘記出餐稍微可惜，服務沒什麼問題。
 Elvis Hou ,https://www.google.com/maps/contrib/108002773492523750344/reviews?hl=zh-TW,1,False,5,叫號機制超令人火大，忽然一次跳7、8號，然後一群人開始到紅線排隊，負責帶位的工作人員根本就在裡面，也沒叫號碼，就一個一個問號碼，排到時候說已經過號視同取消？
 deer hsieh ,https://www.google.com/maps/contrib/117481123656970052747/reviews?hl=zh-TW,2,True,113,"慢
不好吃
東西少
沒可樂"
 蔡東成 ,https://www.google.com/maps/contrib/113766583982538712319/reviews?hl=zh-TW,5,True,45,壽司，炸物，甜點種類繁多，口味好吃價格公道，五盤壽司盤還可以玩遊戲抽扭蛋，很不錯的用餐環境。
 林雅琦 ,https://www.google.com/maps/contrib/103608313424521517521/reviews?hl=zh-TW,4,True,47,好吃，也有小遊戲好玩，運氣不錯第一次的五盤就中獎
 尤韻雯 ,https://www.google.com/maps/contrib/115460843121828428243/reviews?hl=zh-TW,3,True,132,單點的餐點送達的很快~~但抽扭蛋越來越難中了....上次吃了20盤，抽4次一次都沒中...
 Jacky Lee ,https://www.google.com/maps/contrib/117786296084741300628/reviews?hl=zh-TW,5,True,18,好吃的壽司！！
 王政皓 ,https://www.google.com/maps/contrib/110745526324541364049/reviews?hl=zh-TW,1,False,3,"不懂有網路訂位為什麼還要跟現場客人一起在門外等了至少三十分鐘，與其都要等，那我幹嘛還要訂位
服務人員嚴重不足
第一次遇到藏壽司沒人帶位，進去還要自己找位置
座位狹小，連起身拿醬油碟都有困難"
 黃念中 ,https://www.google.com/maps/contrib/101586675138145453334/reviews?hl=zh-TW,5,False,8,好吃實惠，下次會再帶家人來吃😆😆
 lin lin Chien ,https://www.google.com/maps/contrib/112943540850500645031/reviews?hl=zh-TW,1,False,6,中午點了一份香煎芝麻扇貝結果吃到的確是冰冷的東西，詢問服務人員得到的是“只煎芝麻”。真是超傻眼！
 郭進輝 ,https://www.google.com/maps/contrib/114975757623028464931/reviews?hl=zh-TW,4,True,10,場地寬敞乾凈，點單上菜迅速，單價@40便宜，特別喜歡炸蝦手卷....
 Harvey Lee ,https://www.google.com/maps/contrib/105667875512876601808/reviews?hl=zh-TW,5,True,335,餐點新鮮美味，價格也很合理。非常推薦這間店的服務品質，人員有禮貌服務態度積極，帶給顧客很棒的用餐體驗。推薦使用app提前預訂，減少現場排隊等候時間
 郭小郭 ,https://www.google.com/maps/contrib/107844479761345311316/reviews?hl=zh-TW,4,True,50,好吃！但藏壽司這個樓層有很多親子的櫃位，but~~親子廁所卻沒有尿布台，很可惜啊啊
 Chihwen Ku ,https://www.google.com/maps/contrib/114040322343471298372/reviews?hl=zh-TW,4,True,184,好吃的藏壽司，目前有熊大集點活動
 Yang Wang ,https://www.google.com/maps/contrib/113352970757085136292/reviews?hl=zh-TW,3,False,14,東西選擇偏少，沒有生魚片、魚類也不多，份量偏少吃完沒有感覺吃什麼...有點失望，能推的大概是手磨的芥末和抹茶吧
 A H ,https://www.google.com/maps/contrib/100817696981370348753/reviews?hl=zh-TW,1,False,10,現場滿額無法在候位也不告知讓我乾等半小時訊問2次才說這服務態度讓人不想再去消費
 David Du ,https://www.google.com/maps/contrib/107206222802838877180/reviews?hl=zh-TW,4,True,88,客人多，但疫情期間沒有等很久
 Ning Xing ,https://www.google.com/maps/contrib/103279425639938333744/reviews?hl=zh-TW,3,False,515,"座位超少，應該是我看過位置最少、空間又最小的藏壽司分店吧，進出座位都非常困難。

假日不建議過來用餐，排隊會排到天荒地老；平日的話不用抽號碼牌，在門口排隊等待帶位即可，不過外場服務生感覺人手不足，每個人都很忙，還要負責帶位。"
 Han ,https://www.google.com/maps/contrib/117068162976944992939/reviews?hl=zh-TW,4,True,268,"整體上食材算新鮮。
炙燒鮭魚前後點了三次，每次厚度都不一樣，
像在抽獎一樣刺激。"
 katsura cheng 山林艾克 ,https://www.google.com/maps/contrib/114407900703575167965/reviews?hl=zh-TW,4,False,391,"今晚來新開幕ATT2樓藏壽司,首吃感言,
1桌位太窄，約一只手機長1.5倍寬
2,握壽司食材算新鮮,必點碟魚緣側比壽司郎好吃,茶碗蒸鰻魚遜色其他可以，
3芥茉應該是現磨，比壽司郎方便包新鮮，
4價位比壽司郎略低,個人消費約400-500上下,
5店內明亮整齊乾淨，人員服務佳，
6,有個賓果遊戲不錯，投五盤有一個扭蛋，適合親子來吃增加趣味性，
值得推薦的壽司店，但身型壯碩可能不適合來此用餐，因為座位太窄了！"
 Hugo ,https://www.google.com/maps/contrib/113541973356239031680/reviews?hl=zh-TW,5,True,53,服務人員非常溫柔喔
 Morgan Lee ,https://www.google.com/maps/contrib/116174061055404431230/reviews?hl=zh-TW,3,True,68,人手不夠店內待清座位多迴轉台上空盤多不上新盤點個冰淇淋快十分鐘才來門口很多人在等
 LIN ,https://www.google.com/maps/contrib/110727438587991108630/reviews?hl=zh-TW,4,True,20,有包箱位置，壽司好吃!味增湯有點鹹!壽司種類很多!
 小針 ,https://www.google.com/maps/contrib/103038329871742372413/reviews?hl=zh-TW,1,False,18,"非常不新鮮
差不多價位點爭鮮壽司郎都比較好吃
甚至藏壽司價格又再高一些
但是食材非常不新鮮很令人失望"
 娜美愛有限公司林育德 ,https://www.google.com/maps/contrib/103939847075646239927/reviews?hl=zh-TW,5,False,4,環境如常，服務依然滿分
 小波 ,https://www.google.com/maps/contrib/103439936552284905092/reviews?hl=zh-TW,1,False,2,現場候補寫0-10分鐘結果等了半小時一直都只叫預約的號碼
 林大克 ,https://www.google.com/maps/contrib/108748865048281733060/reviews?hl=zh-TW,5,True,62,建議使用E排客先訂位預約，不然排隊都要等30分鐘以上，價格不算便宜，但東西還可以不錯吃，常常帶孩子來吃。
 CH Wu ,https://www.google.com/maps/contrib/108429519698384426962/reviews?hl=zh-TW,3,True,65,可能今天剛好店員人數不足（？目視外場只有三人）因此候位上非常混亂
 曾大少 ,https://www.google.com/maps/contrib/111572347015764748137/reviews?hl=zh-TW,1,False,2,"有預約請我們在旁邊坐
竟然叫我們在外面等到過號
最後再來跟我們講要排隊是怎樣
超級爛的體驗
預約一點意義都沒有"
 May Yen ,https://www.google.com/maps/contrib/100624740239579871517/reviews?hl=zh-TW,1,True,23,服務人員態度超級差勁，要換個位置，百般不願意，只差沒有求她。建議總公司本店的人員教育訓練要加強！
 李忠達 ,https://www.google.com/maps/contrib/103287840686043175165/reviews?hl=zh-TW,2,True,141,蝦子半熟蛋的軍艦壽司吃起來怪怪
 劉嘉釜 ,https://www.google.com/maps/contrib/108906286840191672772/reviews?hl=zh-TW,5,False,3,服務員庭妤很親切也很熱情！
 Laetitia Chen ,https://www.google.com/maps/contrib/106959895786909389523/reviews?hl=zh-TW,4,True,246,2022/02/13藏壽司大直店
 幻無幽 ,https://www.google.com/maps/contrib/117932483476658865527/reviews?hl=zh-TW,5,False,4,好吃，有停車折抵
 Jenny Lee ,https://www.google.com/maps/contrib/103831114795699068585/reviews?hl=zh-TW,3,True,63,帶位的服務員把兩位穿裙子的女客人放在路衝的座位，很有趣...
 mj chien ,https://www.google.com/maps/contrib/107392340779618175588/reviews?hl=zh-TW,2,True,37,醋飯和氣溫一樣溫溫熱熱的也暖化了
 陳昱蓁 ,https://www.google.com/maps/contrib/105099951500990530215/reviews?hl=zh-TW,2,False,16,"跟北車比真的差很多
有手機預約訂位還等了超久
已經叫號排隊還被往後移
服務不怎麼樣🤨"
 JAY LIN ,https://www.google.com/maps/contrib/112587956971027234355/reviews?hl=zh-TW,5,True,94,親子共食好去處
 SHIHHAO Wang ,https://www.google.com/maps/contrib/113532484803497627845/reviews?hl=zh-TW,4,False,2,"還不錯
可以吃吃"
 osh J ,https://www.google.com/maps/contrib/113286510773752156864/reviews?hl=zh-TW,4,True,68,"每次的品嘗體驗落差很大
我想內部管理有一定的問題
FB上的抱怨可知端倪"
 Helen Huang ,https://www.google.com/maps/contrib/113856468028269574079/reviews?hl=zh-TW,2,False,5,座位安排不佳，已經預約時間的五人卻安排四人座，。入內看6人座的座位多是4人而已。
 Cherry Cheng ,https://www.google.com/maps/contrib/113917797847297102332/reviews?hl=zh-TW,5,True,405,就是要配啤酒最高，熱愛壽司。
 潘思穎 ,https://www.google.com/maps/contrib/113436771672597677023/reviews?hl=zh-TW,5,False,4,"服務生的服務態度很好
人很親切"
 盧學 ,https://www.google.com/maps/contrib/104515367814003678583/reviews?hl=zh-TW,5,True,349,Cp值與服務都很好。
 CY Wang ,https://www.google.com/maps/contrib/100336357939394512283/reviews?hl=zh-TW,1,True,198,"現場叫號跟切換燈號不同步
甚至連“叫號”跟“燈號顯示”都沒有
直接變成過號"
 SHIH KAI KUO ,https://www.google.com/maps/contrib/116048173376963416176/reviews?hl=zh-TW,4,True,96,以這價位算是好吃又好玩的
 Dairo Wang ,https://www.google.com/maps/contrib/116648709530544147151/reviews?hl=zh-TW,3,True,164,與爭鮮相比服務好一點，種類多一些，更新鮮，更好吃
 王暐婷 ,https://www.google.com/maps/contrib/112804099172920365572/reviews?hl=zh-TW,3,False,21,相對口感及品項會選擇美麗華裡的壽司店
 游佩芸 ,https://www.google.com/maps/contrib/113924197387855092279/reviews?hl=zh-TW,4,True,223,和一般藏壽司差不多，不過等待區滿小，塞一堆人，裡面空間也偏擠。
 Wilson Huang ,https://www.google.com/maps/contrib/103236774508050982361/reviews?hl=zh-TW,1,False,6,"冰淇淋翻車
下次一定壽司郎"
 Anix Huang ,https://www.google.com/maps/contrib/103520102371449148244/reviews?hl=zh-TW,3,True,36,炙燒系列跟其他間相較之下口感差滿多的而且炙燒沒有全熟的感覺吃起來感覺還生生的
 何品頡 ,https://www.google.com/maps/contrib/101113953283090662545/reviews?hl=zh-TW,4,True,73,環境不錯，沒有單純生魚片，全是帶飯，太容易飽。
 Rick Chen ,https://www.google.com/maps/contrib/114332341368981420826/reviews?hl=zh-TW,4,True,88,應該是跟館前店一樣，但是總覺得有點不同，沒觀察出差在哪裏，就是覺得差一點。
 呂鴨子（鵝鵝） ,https://www.google.com/maps/contrib/101995147706822766186/reviews?hl=zh-TW,5,True,246,美味且新鮮滿5盤能抽轉蛋我們有抽到
 hansen Chen ,https://www.google.com/maps/contrib/105135037918520720097/reviews?hl=zh-TW,3,True,38,"乾淨明亮，日式生魚片米壽司和熟食，
惟一無生魚片單點，有點可惜！"
 Hsiao-shan Hwang ,https://www.google.com/maps/contrib/114873538412844601874/reviews?hl=zh-TW,5,True,22,"疫情期間壽司不能迴轉有點可惜
之後還會去吃"
 Sharlene Cecilia Yau-Chyi Chou (Dr.Chou) ,https://www.google.com/maps/contrib/113774897071718181396/reviews?hl=zh-TW,5,True,86,服務優，產品佳，預約定位非常方便。
 西比歪 ,https://www.google.com/maps/contrib/105582096255693393138/reviews?hl=zh-TW,1,False,59,"員工太忙，櫃檯服務態度不佳⋯
茶杯油膩不乾淨！"
 dondon ,https://www.google.com/maps/contrib/100377632800852331641/reviews?hl=zh-TW,1,True,73,請問這壽司水準是？
 Henry Kuo ,https://www.google.com/maps/contrib/101333203913131217613/reviews?hl=zh-TW,2,False,48,炸雞，黃金酥脆卷料好少，去別間吃吧，新開幕非常失望
 Amazing Tw Seller ,https://www.google.com/maps/contrib/114270535249157351651/reviews?hl=zh-TW,5,False,15,外帶好吃的還是赤蝦，整體來說還不錯👍
 David Kao ,https://www.google.com/maps/contrib/108405851489274503631/reviews?hl=zh-TW,4,True,114,需等待時間較久
 Claire Lo ,https://www.google.com/maps/contrib/101994063455843913112/reviews?hl=zh-TW,5,False,11,服務人員積極有禮貌且訓練有素，用餐完非常愉快，謝謝
 Shawn Yan ,https://www.google.com/maps/contrib/114308341951583293688/reviews?hl=zh-TW,5,True,99,"適合帶小孩。
哇沙米在輸送台上了。"
 -Cafe racer Max.C ,https://www.google.com/maps/contrib/102519810835869351836/reviews?hl=zh-TW,3,True,550,好吃是好吃，但預算需要節制與衡量
 任婷鈺 ,https://www.google.com/maps/contrib/117910988674048998355/reviews?hl=zh-TW,1,True,62,"真的不好吃壽司郎好吃多了=_=
品項少料更少"
 玄鳳肉雞 ,https://www.google.com/maps/contrib/117805007391068921727/reviews?hl=zh-TW,5,True,48,味道新鮮，但最近冰淇淋縮水好多呀QQ
 Shih Kevin ,https://www.google.com/maps/contrib/102018580879606465000/reviews?hl=zh-TW,5,True,342,不是非常大間但是一切都好
 Maggie Yang ,https://www.google.com/maps/contrib/117947664407721976272/reviews?hl=zh-TW,4,True,30,好吃但很可惜沒有單生魚片的產品不然就更棒了
 蘇晉玄 ,https://www.google.com/maps/contrib/115481978533553624555/reviews?hl=zh-TW,5,True,185,服務人員態度非常好
 jeff Lai ,https://www.google.com/maps/contrib/117678697092053564965/reviews?hl=zh-TW,4,False,12,菜色選擇有侷限
