user_name,user_profile_url,rating,local_guide,comment_num,comment_text
 王德華 ,https://www.google.com/maps/contrib/113773706471875450487/reviews?hl=zh-TW,1,True,239,以價位來說餐點還算可以，但蠻多壽司都容易散掉。茶粉稍有結塊情況。餐廳沒有衛生紙，只有濕紙巾。整體來說還算可接受。但給一顆星的理由是因為在現場候補的時候，螢幕上顯示約等待10-30分鐘左右，便抽了坐下來的等，但實際用餐時，已經等了一個半小時...前面也有位先生跟店長和店員反應說他多次來光顧都很常遇到類似的情形。如果真的要等很久，可以跟顧客先說明。而不是浪費消費者的時間。錯誤的預估等待時間不如不要寫或是評估得更長一些。差了一個小時真的太誇張了。雖然後來店長店員都有道歉並說明人潮太多。也放了公告不再接受現場候位。但其實客戶要的不是這種形式上的說明，而是要實際解決問題，讓這種情況不要再發生。希望店家能真的跟總公司反應一下，如果系統不能稍微準確的預估，真的就不要誤導民眾。
 珍ㄗ紅茶 ,https://www.google.com/maps/contrib/103948851226910133870/reviews?hl=zh-TW,4,True,27,"心得感想：每盤都有在水準之上的平價迴轉壽司，以鹹食來說最愛鮭魚脂，因為魚肉香且軟；麵頗Q彈，但跟外面烏龍麵店相比就一般般；最後是甜點，豆乳甜甜圈很讚，甜圈很酥脆，但紅豆有點太甜（可能平常習慣喝無糖飲🤣），最後的最後，今日有扭到一顆蛋，爽👍🏾

👉🏻用餐日：11月某平日晚上
👉🏻今日花費：15盤+2碗麵+1碗冰，共$950
👉🏻今日所點：鮭魚脂*5、稻荷壽司、大帆立貝、蒲燒鰻魚、甜蝦、黑胡椒醃製鮭魚肚、洋蔥鮭魚、豆乳甜甜圈、辣味芝麻豬肉烏龍麵、醬油拉麵
👉🏻4顆🌟說明：美味程度不錯、服務態度也讚、點餐機略高，手都要伸很長…"
 STARS ,https://www.google.com/maps/contrib/100724205634401865155/reviews?hl=zh-TW,4,True,725,第一次光顧，檯上輸送帶取盤沒人教還真不知如何使用，每投5個盤子還有拿扭蛋機會，吃壽司配抹茶還不錯，大部分一盤都是40元，用餐時間1小時。
 Nuts Y. ,https://www.google.com/maps/contrib/114700693323316348532/reviews?hl=zh-TW,4,True,137,"比起其他藏壽司分店，這間來很多次了

1.停車方便
2.逛商場，廠牌不見得很多，但殺時間ok
3.一樓商家改成動漫主題，小朋友喜歡

因此來此用餐一舉數得。不過這間分店忙的時候，會有些小小的疏失，比如剛入座發現桌下有前客人的濕紙巾，或桌上小湯匙筒少放，但總體而言是可以再光顧令人愉快的壽司店"
 浩程楊憲騰 ,https://www.google.com/maps/contrib/106436892413988251589/reviews?hl=zh-TW,5,True,136,第一次帶孩子們來吃藏壽司，排隊等候的人潮誇張的多！12點45分左右到抽號碼牌，排隊進場已經是2點了，裝潢設計感覺很不錯，點餐及送餐的服務模式不僅噱頭十足，既能節省人力又提高效率。
 honey kiss ,https://www.google.com/maps/contrib/102981056380450305287/reviews?hl=zh-TW,5,True,374,"藏壽司在哪裡🈶️駐點⋯^_^⋯就要去吃👍
好開心😃⋯⋯今晚，吃了美好的晚餐💕💓😄又是在自己最喜歡💕的大直ATT❤️
太開心⋯^_^⋯
從劍南捷運🚇站2號出口，散步6分鐘就到⋯^_^⋯大直美麗的夜色&涼爽的晚風，心情自然好美麗💓！走在浪漫🌹的街景，沿路上的綠樹步道，樹下🈶️可愛動物藝術裝置，ATT閃亮迷人的光彩⋯一眼就看到⋯心花怒放🥰藏壽司就在裡面😄
等候時間，🉑️逛逛百貨公司⋯輕鬆愉快⋯
自己很餓又渴⋯大胃王開動⋯^_^⋯吃得很開心😄
服務品質很好的藏壽司👍會一直來吃的好壽司🍣👍
Thanks
讓我們享受美好的晚餐⋯⋯💕"
 水露 ,https://www.google.com/maps/contrib/108667249587562866315/reviews?hl=zh-TW,4,True,395,"優點：轉蛋機制有趣，奶油乳酪蟹風味棒很好吃，下次有機會還會想買！
缺點：輸送帶上的盤子好難拿，那個盒子還會卡住，我還不小心倒了一盤，然後甜點吃起來是冰很久拿出來的"
 Summer wu ,https://www.google.com/maps/contrib/110366597361753791870/reviews?hl=zh-TW,4,True,36,"平價好吃
選擇多樣化
還有孩子喜歡的扭蛋
只不過中獎機率真的不高
吃了25盤
才扭中一個
之前還有連扭六次都摃龜🤷🏻‍♀️"
 Karin Lai ,https://www.google.com/maps/contrib/117911624255995872602/reviews?hl=zh-TW,5,True,199,來自日本的藏壽司，用餐尖峰時間要排隊，尖峰用餐限時一小時，每盤40元，五盤看動畫抽扭蛋，但不一定會中獎，小朋友很喜歡。
 林怡汶 ,https://www.google.com/maps/contrib/100484705440989837217/reviews?hl=zh-TW,2,False,16,"號碼很混亂⋯⋯叫號聽不懂在叫什麼
候位寫20-50分鐘遠遠超過這時間
要不要乾脆廢除候位的號碼？
遲到的人拜託一下還是可以用餐？！
把乖乖等候的人當白痴？！
進去後位置明明一堆但入座速度卻神慢"
 agoboss agobosstw agobosshc楊憲騰 ,https://www.google.com/maps/contrib/105837207974998060577/reviews?hl=zh-TW,5,True,39,"壽司的部份其實跟爭鮮都差不多，差別在每一組客人都有自己的座位，讓人感覺就像在餐廳，整體感覺真的很不錯，他們的拉麵很好吃，但是麵非常少，我女兒除了壽司還能吃兩碗拉麵。重點他們的味噌湯真的很不OK，裡面只有幾顆海瓜子而已，其它什麼都沒有！一碗價錢要60元，自己在家煮都比較好喝，薯條炸的時間過久，吃起來硬硬乾乾的，冰淇淋也很好吃，避開這幾樣來說，CP值真的很高。
若有機會去吃的話，點餐方式是觸控式螢幕菜單，就先點一份，好吃再繼續點，這樣就不會一口氣踩雷了。😊😊😊"
 Yorin Nie ,https://www.google.com/maps/contrib/112172616591848059041/reviews?hl=zh-TW,1,False,7,4/122點多來用餐，等了快10分鐘結果都沒有看到工作人員，好不容易看到工作人員，結果卻是先讓別人結帳，而不是先讓我們進去，輸送台送來的冰淇淋也直接倒在輸送台上，覺得很傻眼，非常差的用餐體驗。
 派派 ,https://www.google.com/maps/contrib/100701110309118904835/reviews?hl=zh-TW,4,True,34,服務人員親切可愛，當天的外場藍帽男生很有活力，豆乳甜甜圈偏油（記得以前沒這麼油），炸花枝手捲跟印象中一樣好吃😋
 趙雷翔Jerry Chao ,https://www.google.com/maps/contrib/113833151566740414239/reviews?hl=zh-TW,5,True,469,也是一家好吃的壽司店，他們的特色就是吃完的盤子可以投入箱子裡，投五盤就可以玩一次抽中扭蛋的機會，這樣讓小朋友們都很專心的吃壽司，因為要趕快玩抽獎。
 Do it Just ,https://www.google.com/maps/contrib/107771647407890652855/reviews?hl=zh-TW,1,True,144,"孩子拿了水杯裝熱開水，裝完回到座位上，三個杯子上，全都浮著一層油，按了服務鈴跟服務生反應問題順便請他幫我們換個杯子，她說要跟主管反應，再來告訴我們，過了快15分鐘，一位號稱主管的人，過來跟我們解釋那是綠茶粉內的茶油，重點是⋯⋯我們倒的是開水，我們也沒有要怎樣，其實就是跟你們反應，請你們要注意一下而已，但這個解釋好像有點牽強，就是杯子沒洗乾淨這麼簡單而已，
後來吃到炸蝦天婦羅的時候，問題又來了，一咬開，裡面一股濃濃的臭味，感覺不是油耗味，而是海鮮腐敗掉的臭味，小朋友也咬了一口，也說怎麼臭臭的，因為小朋友很愛吃藏壽司的炸蝦天婦羅，而且在各家分店常常在吃，所以不可能沒辦法分辨，跟店員反應後，一樣要等主管來處理，後來就把三盤炸蝦端走了，最後等到我們全部都吃完了，還沒有人來處理，我才又按了服務鈴詢問服務人員，並且表明我們不是奧客，好像在雞蛋裡挑骨頭，過了一會兒，主管出現了，跟我們表明，炸蝦端回去了，他們聞了，確實有臭味，但他們覺得應該是油的問題！
呃🤔⋯⋯油有問題，應該是整支炸蝦連粉都有臭味吧？但是咬開後，裡面有一股濃濃的腐敗臭味，反正不重要，最後三盤炸蝦他們也端走，我們也沒吃，他們也沒算錢⋯⋯就這樣！
但真心覺得藏壽司大直店，出現這些問題，真的證明管理非常鬆散，需要大大的加強一下，不然真的砸了你們公司的招牌，很可惜⋯"
 Larry Chen ,https://www.google.com/maps/contrib/117061527517266669257/reviews?hl=zh-TW,4,True,417,店內位置不算多，店員講話速度都蠻快的但服務態度都很客氣，點餐平板依舊高掛難點就是了...
 J J ,https://www.google.com/maps/contrib/105412070863087619651/reviews?hl=zh-TW,5,True,302,離峰時去吃，完成不用排隊也沒限時，超讚！最喜歡一貫的炙燒蝦壽司、炙燒版鮭魚，超推，必點。招牌甜點要兩人分食比較適合，一人除非你是螞蟻才能嗑完。整體來說很有噱頭，當天還有轉到蛋，很開心！如果怕聚會時，沒話聊，非常適合來這間店吃飯，因為很少聊天，都在看列車跟使用平板點餐。
 Karen Lee ,https://www.google.com/maps/contrib/100747313216975542554/reviews?hl=zh-TW,5,True,167,"平日下午比較沒什麼人，環境整潔，積滿五個餐盤，可以抽獎一次

有ATT的會員，消費可以拿著收據到一樓服務台累積點數"
 Tammy Yang ,https://www.google.com/maps/contrib/110690533892169707703/reviews?hl=zh-TW,2,True,69,"滿心期待的去藏壽司做初體驗，但是竟讓人大失所望，食材並不新鮮，握壽司的米飯鬆散的誇張，旋轉台上的壽司盤，70%都是空的，轉盤上的壽司都看起來放很久不新鮮了，只能靠機器點餐，但機器點餐送餐速度慢到極致，點個手卷竟等快半小時才到餐。
服務生催著一個小時到了要我們離開，我也想離開阿！但是餐點一直不來，我怎麼離開？服務生竟然翻我白眼！？從來沒在日本企業的餐飲業受到這麼無言的服務，我實在無法給好評。"
 Chloe Cheng ,https://www.google.com/maps/contrib/112725267047740894480/reviews?hl=zh-TW,5,True,261,"炙烤大甜蝦好像沒有了🥲
但還是很好吃～～
壽司種類感覺變少了🤔"
 晴晴 ,https://www.google.com/maps/contrib/108508708773306848175/reviews?hl=zh-TW,4,True,36,"比壽司郎貴，但是吃起來個人感覺沒有壽司郎好吃，像是炙燒類的生魚片，炙燒起司的口感重到已經完全壓過生魚片的鮮味，拉麵倒是不錯，湯頭好喝。
覺得比較嚴重的缺點是，芒果冰淇淋聖代，杯子底下的盤子能不能改成可以抓好杯子的盤子，杯子外因為冰就有水珠了，加上因為傳送來停住杯子往前的慣性，聖代就倒了..."
 Phoebe菲比 ,https://www.google.com/maps/contrib/107058958436822269696/reviews?hl=zh-TW,5,True,52,"比較眾多平價壽司，整體服務和食材品質都很合理，對於喜歡吃壽司的人有很多品項可挑選，不太吃生的人也有很多熟食（天婦羅、炸蝦、拉麵、丼飯、手捲、茶碗蒸等），不吃生的人也可以去吃～

有迴轉台可以挑選，也可以用平板點餐直送，飯後還有丟盤子抽扭蛋～一系列體驗都非常好！

小提醒：丟盤子不要一直連續丟或靠太近丟口處感應，有時電腦反應會比較慢，確認螢幕數量再丟"
 凱蒂 ,https://www.google.com/maps/contrib/104126505096209539864/reviews?hl=zh-TW,1,False,11,"1.用餐時，將盤子丟入回收槽中，發現機器會吃盤子，
叫了服務生來，卻僅詢問：少幾個盤子呢？
直接補缺少的盤子數量給我(就這樣!?就這樣!?)

2.過一陣子再嘗試丟入，依舊吃盤子，再按一次服務鈴後，
一樣再補我盤子丟入…和我說一句抱歉(就這樣!?就這樣!?)

3.最後，用完餐要將剩餘的丟入，悲劇再度發生，
機器照樣吃盤子，這次要求我們先全部丟完再說少了幾盤，
整個不被店員信任阿，我整個超傻眼的

4.
覺得很傷心想點一杯抹茶牛奶冰淇淋補償自己的心靈，
才剛開始吃就吃到一塊不明物品…品管也太不優，
處理的方式更糟糕，補我一杯新的，沒有任何的其餘補償，
老天阿!!這理所當然好嘛!!
讓我一整天的心情掉到谷底

5.
想說，不補償就算了，至少請店員好好算盤數，
請求店員對一下餐點盤數有沒有誤差，
知道店員怎麼說嘛?
竟然說，餐點對應盤數，不會有錯!!!
我和店員說，請在幫我們仔細算一下，
店員竟然說，不然就上面的盤數來算就好
我當下超級傻眼，有處理跟沒處理一樣...
我整個晴天霹靂，怒火中燒結帳離開

這次用餐經驗，讓我們對藏壽司的印象大大扣分
我想我不會想再去一次了..."
 Brian Huang ,https://www.google.com/maps/contrib/115456888618694013905/reviews?hl=zh-TW,1,True,38,我還以爲自己在吃10元壽司例如：特製七味醬豬大家看看這是不是太誇張了；用看的就可以知道廚房的人是什麼心態在做事情，希望可以改進謝謝
 W FC ,https://www.google.com/maps/contrib/110418978300505223638/reviews?hl=zh-TW,1,True,366,"一上座位就發現桌上還有些許食物殘渣，雖服務人員馬上進行清潔，但感受還是不太佳。
食材也與圖片有極大差距⋯是成本變高變相省錢嗎？寧願你漲價也不要端出這種品質來。"
 issac Chien ,https://www.google.com/maps/contrib/115705404127187225866/reviews?hl=zh-TW,5,True,897,前一陣子因疫情嚴重無法內用，這個月總算開放內用，可能也因為非假日時段用餐人潮少許多，用餐環境因此更寬敞舒適。店內目前採現點現做的方式。
 周阿花 ,https://www.google.com/maps/contrib/117768643011530813755/reviews?hl=zh-TW,3,False,30,每次來必吃好幾盤的蔥花鮪魚軍艦今天看起來非常不新鮮，顏色很怪之外，魚肉也切的很詭異，不像以前那樣剁碎，想說是不是出錯餐點了，詢問了兩次，等待的時間也讓我吃飽了，最後得到餐點沒錯這個答案，針對餐點看起來有問題這件事情，也給不出什麼回答，我也懶得再等了，雖然我真的很想吃蔥花鮪魚軍艦，但這個我真的不敢吃，於是退了這個結帳走人了，覺得有點失望沒有吃到🥲
 C L ,https://www.google.com/maps/contrib/107880129795523553828/reviews?hl=zh-TW,3,True,264,"為了鮭魚卵海膽牛肉而來
但看了實品大失所望
非常圖文不符😂"
 THOMAS WANG ,https://www.google.com/maps/contrib/100897808433825355374/reviews?hl=zh-TW,5,True,756,"大直藏壽司的服務比台中三井的分店要好太多了！
台中三井要提升服務態度"
 大葳 ,https://www.google.com/maps/contrib/104313562147444515018/reviews?hl=zh-TW,4,True,628,服務親切有熱忱、炸物跟生芥末、還有煎茶都可口。
 Amber Liang ,https://www.google.com/maps/contrib/103333144287276763882/reviews?hl=zh-TW,1,False,39,慘～～～號碼機預估10-30分鐘結果等了一小時以上，好餓！什麼時候才換我？等了1:15正式棄權⋯⋯唉😮‍💨
 YO Kuro ,https://www.google.com/maps/contrib/111908664452052170455/reviews?hl=zh-TW,5,True,18,"已經多次帶小孩到這家連鎖店用餐了！
因為小朋友不吃生食，
藏壽司有很多熟食可以選擇！
每次必點熱騰騰的茶碗蒸、皮脆多汁的炸雞塊、炸花枝手捲、豬五花握壽司....現做搭“高鐵”送達就是美味。
唯一讓人沮喪的絕對是...沒抽到扭蛋XD"
 陳禹欽 ,https://www.google.com/maps/contrib/108336165595345809818/reviews?hl=zh-TW,3,True,79,撇開價格，食物在水準之內，上餐速度不慢！只是比較意外的是扭蛋有失敗率！內容物價值不菲就算了，十幾二十塊的東西也有失敗率！
 陳怡伶 ,https://www.google.com/maps/contrib/101517541575507949261/reviews?hl=zh-TW,1,True,56,約下午三點左右進入，沒有預約不用等待，但似乎員工不足，光走進去大約有5、6桌是沒有收拾的桌子，看到好幾桌桌上都有完整的壽司隨意丟在桌上看起來就很不新鮮，也沒有看到任何服務生正在收拾，我抱著兒子也完全沒有服務生幫忙拿兒童座椅，跟其他分店比起來差太多，看完這一切我直接走出去，完全沒有胃口吃
 Carol Hsieh ,https://www.google.com/maps/contrib/107041398601813755411/reviews?hl=zh-TW,3,True,54,"5盤抽一次，吃了1300,但從來沒有抽到過柯南。雖然知道扭蛋裡面的東西不怎麼樣，但是至少讓每桌客人抽到吧。壽司的花樣很多，但是感覺吃完很空虛。"
 Able Hsu ,https://www.google.com/maps/contrib/118216937421026741224/reviews?hl=zh-TW,4,True,143,"每次來ATT都看到大排長龍，連離峰時段也是，不過還好ATT這裡有很多的親子樂園，可以先抽號碼牌然後帶小朋友去遊樂園玩。
我們2大1小總共點了20盤，藏壽司似乎沒有單生魚片，都是握壽司，雖然小孩不太適合吃生食，還好這裡有烏龍麵類可以點，味增湯偏鹹，生食食材算新鮮，漂漂區沒看到什麼漂很久的食材，平板點餐很方便，炙燒鮭魚跟熟成鮪魚口感非常軟嫩，甜點豆乳甜甜圈有驚艷到，一定要點來吃看看。
缺點的話，當然還是要排隊，用餐時間限定60分鐘，只有濕紙巾，全店沒有衛生紙，是全店都沒有衛生紙，我實在是無法想像一家餐廳沒有衛生紙，但畢竟用餐主要還是看好不好吃，所以還是推薦大家可以來吃吃，算是很不錯的用餐選擇。"
 張旭 ,https://www.google.com/maps/contrib/101472244914920903460/reviews?hl=zh-TW,1,False,10,"抽完號碼牌後叫號一次叫3組在紅線內等待帶位
但我明明抽的是1023只是因為走進紅線排在1024的後面變成我要晚用餐雖然只有晚5分鐘但走進店裡看到明明比你晚抽號碼牌的客人已經坐好開吃心情很差號碼牌肯定是抽好玩的"
 朱冠昇 ,https://www.google.com/maps/contrib/109585430134600064954/reviews?hl=zh-TW,4,False,3,用餐過程中點了一份炸蝦天婦羅（60），實際拿到炸蝦天婦羅手捲（40），當下想說有盤子會計價就先吃了，等結帳再反應。結帳時店員告知餐點品項錯誤要當下反應才行，所以被多算了一份棕碗的60元，但實際上餐桌上沒那個粽碗，怎麼會是店員說的沒證據呢。寫在這裡提醒自己跟別人，品項異常要立即反應。
 Zack Chen ,https://www.google.com/maps/contrib/111781843695820405199/reviews?hl=zh-TW,5,True,164,停車方便，壽司現做新鮮，每盤都40，用餐時間為一小時，如果想來享受美味，最好平日下午來，避開假日人多時段，以及午晚餐顛峰時間，由於ATT22:00打烊，除了下午時段外，也可以晚間20:00到現場，就不用排對等待很久。
 謝裕仁 ,https://www.google.com/maps/contrib/117090952373943835179/reviews?hl=zh-TW,2,True,244,坦白說一星期前後剛吃完藏壽司、壽司郎，只能說我比較喜歡壽司郎，藏壽司甚至排在爭鮮後，所以評價就給4、3、2。主要藏壽司有多種壽司太鹹，且多款都奶油，容易膩，優點就是扭蛋五盤就一個，小孩子喜歡這種氛圍。
 崔可凡 ,https://www.google.com/maps/contrib/113678381487940674451/reviews?hl=zh-TW,5,False,11,食材基本上都是新鮮，來過無數次了！之前三麗鷗扭蛋每週來吃，之後小新也是2、3週來一次，吃飽飯順便帶小孩放風，有吃到1-2次海膽、蝦子有比較腥的味道！基本上很好👍🏻
 Nadia ,https://www.google.com/maps/contrib/114054204701508433077/reviews?hl=zh-TW,2,True,192,因為累積盤子可以抽獎成為孩子喜歡的店家，每次假日經過總是大排長龍，這次平日造訪，顧客也不算少，餐點的食材都乾乾的，不太美味！
 ann chang ,https://www.google.com/maps/contrib/105039358106229183031/reviews?hl=zh-TW,4,True,151,"食材維持穩定的品質。
但我們的位置（27號）有一邊的座位不夠寬闊，離桌子很近，朋友入座後覺得有壓迫感，我看他肚子都頂到桌子了😆
舒適度來說比其他分店差一些，入座動線也安排不好，不像其他分店有明確的指示，但店員發現我在找位置時，適時的指引，服務同樣的親切。
因為地點離家近又好停車，會再訪。"
 張怡婷 ,https://www.google.com/maps/contrib/106794371845410344013/reviews?hl=zh-TW,1,False,1,桌子沒擦乾淨還殘留上一組客人留下的醬汁，壽司盤底下也是沾滿醬油哇沙米，希望貴店在衛生整潔上加強。
 Eve Lu ,https://www.google.com/maps/contrib/104270881032975465544/reviews?hl=zh-TW,4,True,353,"點餐板太高，脖子好酸
餐點都很好吃，米飯部分過於鬆散
鮭魚個人覺得比某大型連鎖好吃很多，也比較有特色
茶碗蒸很讚、炸物都不錯吃"
 羽川信 ,https://www.google.com/maps/contrib/104884594231581904128/reviews?hl=zh-TW,4,True,96,價格實惠、上菜快、服務不錯。
 Robert Fan ,https://www.google.com/maps/contrib/105926131307329146702/reviews?hl=zh-TW,5,True,413,餐點有一定水準，性價比不錯，加上有扭蛋噱頭，難怪親子同來的客人非常多，地點在美麗華商圈，也算是人潮眾多的區域
 Emily Shih ,https://www.google.com/maps/contrib/107498752592670805566/reviews?hl=zh-TW,4,True,217,"感覺很充滿活力的一間店。
點了一碗拉麵,麵體Q彈，是我喜歡的口感。但...有點小碗啊，醬要130，有貴到。而且湯頭滿油的。
握壽司的肉我覺得比壽司郎的大塊，但醋飯，壽司郎略勝一籌。"
 曹老闆 ,https://www.google.com/maps/contrib/105590807469041486198/reviews?hl=zh-TW,5,True,87,"最好事先線上訂位
素食選擇少"
 Alex Lai ,https://www.google.com/maps/contrib/106700373537418158508/reviews?hl=zh-TW,3,True,47,服務有待加強，芥末請不要學壽司郎放在旋轉台，要拿取很不方便，請改回以前的方式放在桌上
 Leticia wang ,https://www.google.com/maps/contrib/116828369518247784285/reviews?hl=zh-TW,2,True,74,"店內環境：一般餐廳環境，還行
用餐價格：北海道牛奶布丁塔$40、炸蝦天婦羅手卷$40
用餐感想：今天吃到的壽司很多都很容易散開，出餐員工的訓練應該多多加強！再來就是北海道牛奶布丁塔跟炸蝦天婦羅手卷都偷工減料成這樣⋯很扯⋯^_^沒有看過那麼凹的布丁塔欸！布丁的部分只有照片的一半，還有手卷的部分根本是在咬空氣⋯料都只放一小戳！跟照片也差太多了吧⋯⋯完全是詐欺⋯吃其他藏壽司的分店都沒有個問題～唯獨大直att這家，難道是試營運金額打九折連食物品質也打九折了嗎？？？
餐廳服務：員工服務佳！👍🏽"
 翁大鈞 ,https://www.google.com/maps/contrib/114219620646013118675/reviews?hl=zh-TW,4,True,158,商品ok;投入五空盤可以扭蛋的設計吸引人，不過店內人手不足結帳要等員工的服務與訓練也有進步空間
 Kerick Cheng ,https://www.google.com/maps/contrib/117871527516397743019/reviews?hl=zh-TW,4,True,480,"服務有連鎖店的一致水準，禮貌、迅速；
餐點略差：當季或限定餐點選擇少，魚片有腥味，送餐速度也慢很多"
 亞瑟王 ,https://www.google.com/maps/contrib/100370589819231191957/reviews?hl=zh-TW,3,False,8,"可謂是藏壽司的隱藏版！Google地圖都很難找到
平日都不太用預約.假日人比較多.從文湖線劍南路站走路約五分鐘左右.可以順便逛一下美麗華百貨.五盤可以抽一次扭蛋！平均要20-25盤才有機會抽中！扭蛋行銷真的太強了。
而且藏壽司在台灣還是上市公司吔...."
 Jenpu Chang ,https://www.google.com/maps/contrib/110576964348014854814/reviews?hl=zh-TW,4,True,428,服務很親切，當天的自動送餐有點問題，沒點的餐自動送來，服務員來了兩次好像還沒搞清楚是怎麼回事
 Hwa “阿努爸爸” Chen ,https://www.google.com/maps/contrib/108502072021579388883/reviews?hl=zh-TW,5,True,116,"用餐環境10分/10分

1.日式連鎖，口味維持的非常好
2.ATT超級好停車，帶小朋友方便，很多小朋友的東西，方便👍"
 Catherine Huang ,https://www.google.com/maps/contrib/110816668645406529026/reviews?hl=zh-TW,5,True,406,"小孩為了能抽扭蛋，還蠻認真吃的🤣
食材尚稱新鮮，握壽司份量略小（所以可以多吃幾盤的意思）味增湯和茶碗蒸都挺不錯。
整體而言是個適合全家人一起吃飯的地方。"
 Hanna Hong ,https://www.google.com/maps/contrib/100541939360664329981/reviews?hl=zh-TW,3,True,77,雖然不用排隊，但是比別間不新鮮，三星完全是給不用排的，花一樣的價格建議還是找別間
 Jones Yu ,https://www.google.com/maps/contrib/113480032693170128288/reviews?hl=zh-TW,1,False,2,吃到沒退冰完的（霜）鰻魚！並不是第一次吃這家！品管感覺越來越走下坡⋯
 Shang-Wei Kuo ,https://www.google.com/maps/contrib/115774893694822741872/reviews?hl=zh-TW,4,True,"1,349",大直ATT藏壽司，開幕九折，很幸運吃25盤轉五次就得到兩個扭蛋，可惜都是拼圖，沒有拿到小新公仔
