user_name,user_profile_url,rating,local_guide,comment_num,comment_text
 ABIGAËLLE CHEN ,https://www.google.com/maps/contrib/103823020193756001273/reviews?hl=zh-TW,2,True,334,第一次來訪缺點沒人帶位要自己找位置，找到位置後，一些使用的方式也都沒人說明，最後我們做錯了點餐步驟，服務人員才無奈的來解說最後還被衛生眼，整體的用餐品質覺得很不是很好，點餐的機器偏高比較不好點餐。
 Yi Miao Lai ,https://www.google.com/maps/contrib/118270649178970244847/reviews?hl=zh-TW,3,True,157,"廣播叫號的聽不懂在說什麼整段話都黏在一起
今天的熟成鮪魚不好吃
檯面上有少許外觀不美麗的壽司
從進來到離開他們都還在上面轉"
 cc ,https://www.google.com/maps/contrib/114254287004133218301/reviews?hl=zh-TW,5,True,409,"好吃熱熱的
但是扭蛋超爛"
 Leo Chang ,https://www.google.com/maps/contrib/115995594203460670642/reviews?hl=zh-TW,4,True,236,"個人覺得比壽司郎好吃，但種類沒壽司郎多。
林口outlet店都要大排長龍，但ATT店平日來都不用排蠻空的。"
 陳逸潔 ,https://www.google.com/maps/contrib/107342741879511631014/reviews?hl=zh-TW,1,True,12,這個壽司盤實在是不及格！
 華安 ,https://www.google.com/maps/contrib/103903808323128340346/reviews?hl=zh-TW,4,False,74,"點餐系統較為完善、有定點送餐
吃滿5盤可以抽獎一次（限一般盤）"
 劉祺昱 ,https://www.google.com/maps/contrib/108669968158988265523/reviews?hl=zh-TW,5,True,142,位子超大，可以六個人一桌。東西好吃，尤其是炸物。
 Lee Carol ,https://www.google.com/maps/contrib/104133064199253345348/reviews?hl=zh-TW,4,True,138,"一如往常的品質～
但是有個位子不太方便，雖然店員有提醒是肩並肩的座位（我誤認為是吧檯那種）
結果是左右坐面壁的位子，這樣設計坐外面的人會較難點餐或是拿取壽司。
員工訓練很棒，食物也好吃，單純位子設計有點不方便～
推一個～藏壽司的烏龍麵超好吃😋

P.S沒有提供乾的衛生紙在座位，有點不方便"
 Jessie Huang ,https://www.google.com/maps/contrib/110262006863467896910/reviews?hl=zh-TW,3,True,"1,041",防疫期間不量體溫也不需清潔雙手即可入場，比起其他藏壽司店點，這家分店位在主打親子的att因此周圍常常會有小孩尖叫吵鬧或敲打座位，相對的週間人潮相對少，免排隊
 張庭瑄 ,https://www.google.com/maps/contrib/117089910034177573657/reviews?hl=zh-TW,2,True,21,5/6的店裡用餐，無需等候抽號碼牌，用餐體驗不太好。已經來該店用餐五次以上了，這次是體驗最不好的一次。可能因為疫情的關係迴轉台上的餐點數量很少（大概剩10分之1），所以大多數都使用平板點餐，出餐速度有變慢滿多的，但讓我評分2顆星是因為壽司盤都油油髒髒的，好像沒洗乾淨，有一個盤子還更扯背面都是黃黃的感覺像醬油污漬，希望店家在清潔方面可以確實一點⋯當下沒反應也沒拍照因為店員已經很忙碌了所以沒有反應，希望該店可以確實執行清潔工作，謝謝
 PT Chen ,https://www.google.com/maps/contrib/107606157986802712491/reviews?hl=zh-TW,4,True,32,目前已開放內用，採取隔板加梅花坐位，空間寬敞。烏龍麵味道不錯，熟食種類不少，可以帶小朋友一起用餐沒問題。目前有抽獎活動，為角落生物的扭蛋。
 糖 ,https://www.google.com/maps/contrib/114492010099655815020/reviews?hl=zh-TW,2,True,763,"真的沒有喜歡胖胖ㄉ米飯⋯
生魚片偏小飯又偏多
有些壽司夾起來就解體⋯傻眼
服務⋯五味雜陳
一開始進去聽到沒來過內用會仔細介紹
但是結帳的時候才發現也沒有幫我們介紹盤子要自己投入？所以又不像自己想像中的仔細
加上整個用餐過程也沒人提醒
服務是其次
可是真的沒有非常好吃
主要還是因為不太喜歡這麼胖的米+這麼多的澱粉
因為這個米應該不會想要再吃藏壽司
扭蛋內容是橡皮擦也是挺拉及ㄉ
然後用餐環境挺吵雜><
體驗挺不好ㄉ⋯⋯
還是壽司郎好吃（雖然比較貴）"
 HSU小容 ,https://www.google.com/maps/contrib/104325064469683631142/reviews?hl=zh-TW,5,True,194,壽司很美味，服務人員態度很好，吃五盤扭蛋一次，小孩很喜歡。
 Yi-Ching Pan ,https://www.google.com/maps/contrib/104219502349648609224/reviews?hl=zh-TW,3,True,117,"補一下評論
就是壽司

可能是接近打烊時間
店員一整個想下班

我能理解啦可是妳們真的太明顯
哪有人一直在客人旁邊徘徊
這樣我吃的壓力好大欸

壽司4🌟
服務2.5🌟"
 yijiun ,https://www.google.com/maps/contrib/109293260128056617383/reviews?hl=zh-TW,4,True,301,"下午時間去好些餐點都沒有
用餐環境優
出菜速度快
食物味道ok
抹茶冰淇淋好吃"
 蜜 ,https://www.google.com/maps/contrib/104310639016401582788/reviews?hl=zh-TW,3,True,205,雖然大直ATT的圓形動線有點母颯颯⋯幸好🍣沒讓我們失望⋯依然美味
 Griffon Lee ,https://www.google.com/maps/contrib/105738688534054791828/reviews?hl=zh-TW,1,True,286,挺詭異的…那一堆食物殘渣不知道在檯上放了多久？也不知道究竟是人為呢還是米老鼠？
 二之前 ,https://www.google.com/maps/contrib/108416213159115870302/reviews?hl=zh-TW,3,True,64,"大直藏壽司
1回總評—7.4分
(本次：整體—7.4分美味—7.6分)

共22盤$940

雖然適逢鮭魚之亂
人潮完全沒有減少(　ﾟдﾟ)
點餐的平板不能拿下來
手舉得有點痠（−＿−；）
貝類部分還不錯吃
但炸干貝著實不是個好的料理方式~_~
中腹的品名寫成中肚差點被我忽略
還好沒有錯過這道美食(´▽`)ﾉ
大顆的鮭魚卵不太有腥味
一口吃下真是好滿足⁄(⁄⁄⁄ω⁄⁄⁄)⁄
其他部分就中規中矩(￣▽￣)
美中不足的是因為客滿而限制一小時
讓人無法細細品嚐(;´༎ຶД༎ຶ`)

Instagram：ninomae_travel
Facebook：二之前
Youtube：二之前"
 orange lu ,https://www.google.com/maps/contrib/116151340794383424174/reviews?hl=zh-TW,3,True,38,"壽司的飯吃起來是熱的
第一次吃到熱的壽司飯
手拿整個飯是鬆散的
問了負責主管
回答說因為當天人多來不及冷…..
這應該不能當作藉口跟理由吧"
 L in ,https://www.google.com/maps/contrib/113795116852304905098/reviews?hl=zh-TW,3,True,32,"原本是衝著鮭魚溫泉蛋去的
結果沒了😤"
 Kevin Chen ,https://www.google.com/maps/contrib/116184043414295475166/reviews?hl=zh-TW,5,True,26,好吃到十分鐘就20盤
 蔡翠秋 ,https://www.google.com/maps/contrib/106901909233118304207/reviews?hl=zh-TW,3,True,158,"大概就是平價的關係海膽一點味道也沒有……
食材算是新鮮但也就是新鮮而已其他別強求味增湯一碗60沒什麼料cp值超低"
 Yen Ju Chien ,https://www.google.com/maps/contrib/111940752665027482240/reviews?hl=zh-TW,5,True,45,"壽司CP值很高，拉麵稍微鹹一點(畢竟日本拉麵口味偏鹹），小朋友為了玩扭蛋都很奮力地吃！
假日真的要排很久，服務人員態度都很親切。"
 黃少俠 ,https://www.google.com/maps/contrib/101673515075985254896/reviews?hl=zh-TW,5,True,15,"雖然品項比較少,但是小朋友喜歡扭蛋,開心吃飯!"
 郭曉霖 ,https://www.google.com/maps/contrib/103026980104463094177/reviews?hl=zh-TW,5,False,18,"壽司好吃拉麵好吃甜點也好吃
如果扭蛋中獎律再高一點就100方了🤣"
 Isabella ,https://www.google.com/maps/contrib/110913131765703145755/reviews?hl=zh-TW,2,True,506,"月初去的店裡蠻少人的
餐點新鮮只是果蠅🪰好多希望能改善！"
 周瀛 ,https://www.google.com/maps/contrib/106393741769693258670/reviews?hl=zh-TW,5,False,8,"全場都在看那對夫妻表演
我要是他們小孩真的丟臉死😲"
 盧室辰 ,https://www.google.com/maps/contrib/114647139358271618457/reviews?hl=zh-TW,3,True,102,五盤一抽，七抽中一，娛樂性的話這裡比壽司郎好，但好吃程度與誠意略有不足
 何俊緯 ,https://www.google.com/maps/contrib/111889813006821862717/reviews?hl=zh-TW,1,True,581,我沒辦法接受扭蛋“貢龜”＋＿＋
 林國松 ,https://www.google.com/maps/contrib/104724989161932852897/reviews?hl=zh-TW,1,True,38,吃很多盤但只抽中一個扭蛋，機率太小了
 林家豪 ,https://www.google.com/maps/contrib/110689277170648351052/reviews?hl=zh-TW,4,False,20,"鮭魚卵蟹肉：鮭魚卵好少
阿扭蛋轉了4次還5次才中哭啊"
 Lira Yang ,https://www.google.com/maps/contrib/103673471654463422352/reviews?hl=zh-TW,1,False,12,"昨天晚餐和友人共四人去用餐
回家後大家都起過敏反應，臉跟脖子和身體都一塊一塊尋麻疹及小點狀的紅疹，建議選購食材及食材保存上需要再改進！"
 David Lin ,https://www.google.com/maps/contrib/100328188328705316977/reviews?hl=zh-TW,5,True,233,壽司好吃可以線上訂位就不用排隊了
 石磊 ,https://www.google.com/maps/contrib/110183575076715748233/reviews?hl=zh-TW,1,False,12,"藏壽司陸續也吃了一兩年一直都覺得品質不錯今天照常點了兩份熟成鮪魚中腹結果送來的中腹一點油脂都沒有請問是在唬弄不懂生魚片的消費者嗎？好歹也演一下吧？熟成鮪魚跟中腹竟然沒有任何差別你還好意思一份賣$80？

肉眼觀察魚肉顏色油脂完全沒有任何不同我想說好吧可能我看不出來吃下去發現根本就是一模一樣的東西根本是把人當笨蛋是嗎？如果我不懂就算了好死不死我分得出來

根本無法讓人接受以後不會再光臨"
 周亮 ,https://www.google.com/maps/contrib/101329490360831061035/reviews?hl=zh-TW,5,True,77,第一次去除了一開始服務生介紹唸太快以外都很棒
 Ivone Chen ,https://www.google.com/maps/contrib/101587285689993573677/reviews?hl=zh-TW,5,False,7,似乎是新的分店，以後吃藏壽司玩轉蛋又多一個選擇了。店內服務人員一貫訓練有素服務到位，期間限定產品也常更換，值得推薦
 Rainer Tsou ,https://www.google.com/maps/contrib/108006220881731058707/reviews?hl=zh-TW,5,True,160,新鮮、多樣且價格合宜，唯壽司飯可以再精進一些些
 ds lin ,https://www.google.com/maps/contrib/112093347565192490477/reviews?hl=zh-TW,5,True,111,新鮮又美味...小朋友們的最愛啊！
 鄭智仁 ,https://www.google.com/maps/contrib/108435208117141721261/reviews?hl=zh-TW,4,True,77,迴轉壽司一盤價格40~80元，藏壽司甜點比其他同類型的迴轉壽司，風味要好很多
 小哈ouo ,https://www.google.com/maps/contrib/111868307456350335549/reviews?hl=zh-TW,5,False,10,"好ㄘ餒
看到想吃的拿就對了
扭蛋好玩"
 Man Wu ,https://www.google.com/maps/contrib/106851886113114999683/reviews?hl=zh-TW,5,True,108,"餐點不錯扭蛋遊戲也有趣
不過需要用掛在牆上平板點餐
略微不便"
 Jessie Tsai ,https://www.google.com/maps/contrib/106797798642218658307/reviews?hl=zh-TW,4,True,222,外場服務訓練有素；壽司品項稍不足。
 Hsu Yen-Min ,https://www.google.com/maps/contrib/102857805318396356357/reviews?hl=zh-TW,5,True,214,終於可以內用，防疫措施做的很好
 Kai Takagiri ,https://www.google.com/maps/contrib/102985583009526998735/reviews?hl=zh-TW,5,True,6,有特殊佐料柚子醬，以及喜歡放在烏賊、花枝等的紫蘇。
 沒有姓名 ,https://www.google.com/maps/contrib/100571762644987196938/reviews?hl=zh-TW,5,True,59,這間烏龍麵真的超級好吃XD莓果冰淇淋超級讚必吃就是有點貴
 W Chen ,https://www.google.com/maps/contrib/114945051122112501742/reviews?hl=zh-TW,1,True,33,"我只好選擇不再進入你們餐廳消費！
你們是一間龐大的國際連鎖。我……只是一個卑微的消費者！我能做的，只有將「250定律」運用到極致……僅此！
非常不滿意的用餐體驗！

規矩是你們訂的。沒問題！好吧。是我不懂的遊戲規則。

餐點內包含了不計算盤數的食物！
40元的餐點算一個盤子！五個盤子轉一次扭蛋。
「然後3個60元的餐點不計算盤子？」
點餐的時候也看不到任何告示：此餐點沒有計算。

使用了吸引小朋友的手段，鬼滅之刃招攬生意。
轉蛋機的機率我就不說了。畢竟機率本身也是種樂趣。

店內主管也只能不斷的表示，這是公司的政策，會在向上反應。
我。通通接受！畢竟你沒有決策權。

如果只是為了「吃」。
我可以吃壽司郎……。整間ATT，我有無數選擇。
選你們！只是因爲小朋喜歡！我才選擇進來用餐。

麥當勞的快樂兒童餐，如果不送玩具，你就賣鬼吧！"
 羽音 ,https://www.google.com/maps/contrib/107814113933361497183/reviews?hl=zh-TW,3,True,267,好吃，但是扭蛋中獎率真的太低了吧，才多少錢的東西，還有桌子沒擦乾淨，疫情期間還這樣母湯...
 David Lan ,https://www.google.com/maps/contrib/105400391205021235861/reviews?hl=zh-TW,5,True,123,這個不用說，除了吃壽司還有機會轉扭蛋
 Yih Chiou (Soulcat) ,https://www.google.com/maps/contrib/114638367371478946618/reviews?hl=zh-TW,1,True,137,消費體驗超爛！電子發票如果存入載具時，要用消費折抵停車需另外到一樓服務台辦理，非常奇怪且不方便！同賣場內的其它商家都沒這問題，可以直接用明細折抵停車！
 廖昱維 ,https://www.google.com/maps/contrib/117821444240325804922/reviews?hl=zh-TW,4,True,123,最近有用餐抽扭蛋，的確為了那差一點5盤抽一次，讓我吃到好撐（15盤+茶碗蒸）。軍艦壽司或海苔類建議用螢幕點，不知道轉多久，海苔都軟了，沾牙。
 feelgood I ,https://www.google.com/maps/contrib/117470747755286653405/reviews?hl=zh-TW,1,False,139,千萬不要現場候位，號碼機寫的時間是騙人的
 陳月鶯 ,https://www.google.com/maps/contrib/116016679801520541546/reviews?hl=zh-TW,4,True,"2,938","不是正餐時間，不用排隊😄😄
服務很棒！！廣播聲音很吵？常被嚇到😥😥😥收碗盤的聲音也很吵？
座位很窄？連站起來拿水杯都有困難？不知為何沒考慮？
甜蝦很棒😍😍😍新鮮，甜美！！是我的心頭好😋😋😋😋
可惜外頭排了長龍？匆忙結束？"
 陳彥甫 ,https://www.google.com/maps/contrib/111543800897160024830/reviews?hl=zh-TW,4,True,466,用餐記得下載E排隊，預約可以不用等太久。
 60363 D ,https://www.google.com/maps/contrib/106342192054231991795/reviews?hl=zh-TW,2,False,14,沒有提供薑片跟桌上小垃圾桶
 Abbott Wang ,https://www.google.com/maps/contrib/109365155657704717909/reviews?hl=zh-TW,3,True,33,壽司味道不用說，就是好吃，但排隊入場就很亂，連線上預約都要先提早排隊，沒聽見有叫號，排隊就對了
 國峰張 ,https://www.google.com/maps/contrib/101016911758979169105/reviews?hl=zh-TW,5,False,18,5個盤子換一個抽獎機會
 葉祐 ,https://www.google.com/maps/contrib/116395378324751565780/reviews?hl=zh-TW,2,False,25,今天用餐時感受到餐點偏鹹，體驗糟糕令人失望，如味噌湯、茶碗蒸，希望可以改進，謝謝！
 董威辰 ,https://www.google.com/maps/contrib/112916495544580437026/reviews?hl=zh-TW,3,True,175,轉淡蛋看運氣，壽司還可以但跟價錢比cp值就不太高
 黄廷雍 ,https://www.google.com/maps/contrib/113159895632433642618/reviews?hl=zh-TW,5,False,15,"第一次上的雙倍盛生鮭魚肉質有紋路、色澤，再點一次之後上來的卻如下圖🥺🥺。
然後味噌湯裡面只有花蛤，沒有魚肉跟豆腐🥺🥺。
希望能改進🥺🥺
鮭魚整體真的很好吃👍🏻"
 呂慕義 ,https://www.google.com/maps/contrib/106046660110733589166/reviews?hl=zh-TW,2,False,11,"10/3晚上用餐，食物還不錯，但店員態度真的是蠻糟糕的，好心情全都破壞了。覺得員工訓練不夠扎實，客人的問題只能給制式的答案。

比方說，今天小孩點的果汁沒喝完，但卻不能外帶，一陣折騰總共換了三個店員來，最後的答案是飲料沒喝完不能外帶，但店員也不知道為什麼不行⋯（後來沒算我們錢就是了）

帶著困惑去結帳，張姓女店員語速太快我們沒聽清楚，可以很明顯感受到對方的不耐煩。

很差的用餐經驗⋯"
 YHAO CHENG ,https://www.google.com/maps/contrib/104797288199424958076/reviews?hl=zh-TW,4,True,40,美味好吃，只是假日人潮多～要早點來拿號碼牌
 Kernel Hung ,https://www.google.com/maps/contrib/103017409846153941398/reviews?hl=zh-TW,5,True,30,"小孩子很喜歡
單獨隔間
疫情時期也方便"
 Chichun Lin ,https://www.google.com/maps/contrib/100180246788169353745/reviews?hl=zh-TW,2,True,74,唐揚雞米花？圖片與實物不符
 游閔婷 ,https://www.google.com/maps/contrib/109132402136423107124/reviews?hl=zh-TW,5,False,4,處理問題的態度積極良好，推推👍
 簡元章 ,https://www.google.com/maps/contrib/117186723966194864180/reviews?hl=zh-TW,4,True,58,蔥鮪軍艦味道重，半熟蛋鮪魚軍艦口感層次多。
 Jack Wang (CokeFever) ,https://www.google.com/maps/contrib/110083404335057221286/reviews?hl=zh-TW,3,True,696,小孩愛扭蛋不然沒什麼服務不算好東西也不算好吃
 YI SHUAN Lu ,https://www.google.com/maps/contrib/106197199255752251897/reviews?hl=zh-TW,2,False,2,跟爭鮮比較起來，沒到特別好吃
 Linda Wu ,https://www.google.com/maps/contrib/100421848470641552576/reviews?hl=zh-TW,5,True,229,送餐速度快，有著一般藏壽司的水準！
 紫海布丁 ,https://www.google.com/maps/contrib/109883706602641610191/reviews?hl=zh-TW,5,False,13,工作人員態度親切很喜歡這家店的氛圍❤️
 邱清松 ,https://www.google.com/maps/contrib/109564693916945152654/reviews?hl=zh-TW,5,False,220,"家庭包廂式隔間，很舒適。
觸控螢幕點餐很方便，到餐鈴聲提醒，供餐速度也很快。
投入式收點餐盤，方便又讓用餐空間清爽。
平價餐中也有較高檔限量食材，麵食與甜品也齊全，很適合一家人來用餐。
還有扭蛋抽獎，在期待中有中獎，另一種不一樣的用餐體驗。"
 Chu Rex ,https://www.google.com/maps/contrib/108545097125145671264/reviews?hl=zh-TW,1,False,43,"完全搞不懂抽號碼牌的制度邏輯是什麼
為啥要分指定的時間跟候補
19：10到場候補顯示等候時間10-30分鐘
指定時間顯示20：00
於是選擇了抽候補的號碼牌
結果等了一個小時都還沒輪到
為啥不直接一致叫好就好還要客人浪費時間賭運氣就是了
不想浪費資源所以沒有兩個選項都抽結果倒楣的是自己"
 詹詮凱 ,https://www.google.com/maps/contrib/109889950226172938257/reviews?hl=zh-TW,1,False,12,外場帶位人員可以靈光一點嗎？你的帶位邏輯真的令人費解。然後桌上沒有放芥末醬，要跟工作人員要才有。這家真的是最不可思議的分店，和新莊店差好多！
 Verna Liao ,https://www.google.com/maps/contrib/115409162673985159770/reviews?hl=zh-TW,3,False,55,第一次去，蠻新鮮的用餐點餐方式，玩2次可惜沒得到小新扭蛋😆
 Lance HSU (風秤子) ,https://www.google.com/maps/contrib/116866179821428692541/reviews?hl=zh-TW,4,True,"1,034","藏壽司本身就很好吃
但是大直ATT這邊上廁所的動線
實在是超級糟糕
男生2樓沒有廁所要跑到三樓
然後那個手扶梯又很繞路
用餐時間只有60分鐘
上廁所洗手就要花8分鐘
進去前一定要先處理好"
 Simon Hsu ,https://www.google.com/maps/contrib/115504867509555080064/reviews?hl=zh-TW,4,True,387,"我們最愛炙燒類的鮭魚，超美味。海膽壽司的海膽不錯，連不太敢吃海膽的老婆都喜歡。拉麵很好吃，不過挺小碗的。

這家店的用餐環境不錯，排隊的動線還不錯。"
 Chou Jun Yo ,https://www.google.com/maps/contrib/117969919757946239115/reviews?hl=zh-TW,5,True,103,可能受疫情影響人不多，連帶迴轉台上面沒什麼餐點，必須直接點餐
 James Chen ,https://www.google.com/maps/contrib/110895544885601100103/reviews?hl=zh-TW,4,True,87,吃飽飯可以順便逛逛樓下ATT新改裝的動漫型態商場，還不錯。
 Molly Kao ,https://www.google.com/maps/contrib/105759655825154542694/reviews?hl=zh-TW,5,True,192,剛開幕，一致的服務，品質好。
 Alice Chung ,https://www.google.com/maps/contrib/108422266806489284294/reviews?hl=zh-TW,4,True,103,有時候吃不到喜歡的壽司，季節食材要看有沒有遇到檔期，通常要排隊才能吃到，有預約現場也要等半小時左右才會帶位。但整體來說還是最喜歡藏壽司的扭蛋
 WeiSheng Ko ,https://www.google.com/maps/contrib/116978103215892691947/reviews?hl=zh-TW,1,True,30,"生魚片超薄超小，而且還很不新鮮！
醋飯就算了，連生魚片都是溫的。
不知道是怎麼保存食材的，口味更是不如以往，品項似乎也有減少…
整體而言，要不是附近沒什麼日本料理，實在是浪費時間排隊浪費錢。爛透
餐具還很髒，真的是不敢再來。"
 虱目魚 ,https://www.google.com/maps/contrib/100770074097043791267/reviews?hl=zh-TW,5,False,8,今天去用餐服務人員態度與服務都很好，尤其是在櫃檯結帳的蕭小姐對客人的態度讓我覺得很愉快很舒服🥰
 Reika You ,https://www.google.com/maps/contrib/117316187917369519389/reviews?hl=zh-TW,2,True,262,"品項種類少，壽司料不知是材料品質還是處理手法問題毫無鮮味可言，醋飯偏硬又很乾，山葵醬看起來是用真的山葵，但味道也都完全跑掉了。熟食點了豆皮烏龍麵，湯頭死鹹外還有讓人不太舒服絕不是來自豆皮的甜味。
從藏壽司在台北開第一間分店吃到現在，真的退步很多，拿掉扭蛋就什麼也不是。
兩顆星給乾淨的環境和服務態度。"
 蕭慶安 ,https://www.google.com/maps/contrib/108053798113751474950/reviews?hl=zh-TW,5,True,247,服務好，好吃，乾淨大
 jacky wu ,https://www.google.com/maps/contrib/115360936874140289691/reviews?hl=zh-TW,1,False,20,點握壽司居然現在有送白飯服務？
 林芳妤 ,https://www.google.com/maps/contrib/113053808209714939761/reviews?hl=zh-TW,5,False,11,餐點美味可口，價格較高。
 Arthur C ,https://www.google.com/maps/contrib/102782697967195767242/reviews?hl=zh-TW,2,False,6,中午時段後約ㄧ點多去用餐，轉盤上品項很少，幾乎都用單點的，或許是疫情的關係也不曉得，握壽司以連鎖店的品質來說還算中龜中菊，能吃得飽就是了；抽獎的部分讓小朋友很開心，適合小家庭用餐。再扣一分是因為聽到內場員工打了ㄧ個暴龍吼叫式的噴嚏，真心希望他有把口罩戴好
 Red ,https://www.google.com/maps/contrib/111853142801099431307/reviews?hl=zh-TW,1,False,7,"本想趁著幫朋友過生日來到這間高知名度的迴轉壽司店但一進去就感受到冷氣不冷、空氣差，點了蛋糕像是剛從冷凍櫃拿出來退冰口感吃起來不優，
生魚片跟貝類吃起來少了一點鮮味，第一次吃壽司吃了超少，下次不會再去了，也不敢在光顧其他分店。"
 Heui-Ting Lin ,https://www.google.com/maps/contrib/112156249723573323839/reviews?hl=zh-TW,5,True,"1,582",藏壽司怎麼吃都會吃著滿意的出來，但用餐時段人很多，建議非尖峰時間再來用餐，或是透過app先預約
 李沃軒 ,https://www.google.com/maps/contrib/115961860354208491555/reviews?hl=zh-TW,1,True,38,"！！！這邊只能配合2人一同用餐！！！

已經提早預約過用餐人數了
結果卻無法安排在一起用餐
而且是跨桌的
今天是3人用餐，鑒於上週在金城店用餐的經驗
(金城店當時訂位5位，但是有特殊隔板可4人同桌)
今天到大直直接又被迫分開
而且距離遠到是無法溝通的
不知道究竟是管理疏失還是大直att店已經窮到連隔板都無法投資了
用餐體驗巨差

藏壽司說白了就是有扭蛋噱頭的爭鮮
與夥伴來湊盤數還要被分開🤯
要不是最少只能一星
我一星也給不出去呀"
 Alson Feng ,https://www.google.com/maps/contrib/105063480776223832415/reviews?hl=zh-TW,3,False,20,沒想到藏壽司各店品質差異這麼不一，一直以來我都很喜愛吃藏壽司，這一次竟然點半熟蛋四貫沒有一個有蛋黃，鮪魚泥一堆筋膜，不過炸蝦手卷依舊美味，依舊喜愛藏壽司但不會再在此店用餐
 Karl Chiang ,https://www.google.com/maps/contrib/100251951234000306600/reviews?hl=zh-TW,1,True,62,今天晚上老婆帶著一家子共兩大兩小來慶祝父親節，我們排現場號，服務人員告訴我們根據政府規定，必須兩位兩位分開坐，因為有一桌已經清理完畢，就讓老婆帶著小兒子入座，三分鐘後，另一桌也清理完畢就讓我跟大兒子也入座，進去一看，媽媽在最裡面的9號桌，我在最外面的29號桌，一坐下來就發覺28號桌也空著，而29號桌隔著輸送帶的那一桌卻坐了四個人。跟店裡的人反應是否可以讓我們坐在隔壁桌，服務人員去叫了個疑似主管的人出來，這位仁兄的態度是：我們就是這樣，別想改。讓我有個錯覺，其實藏壽司不是來自日本，而是來自中國大陸。我應該是不會去第二次了，這是家頂著日式招牌，但卻是中國式服務水準的餐廳。
 Yu-Ting Wang ,https://www.google.com/maps/contrib/117341704851835512739/reviews?hl=zh-TW,5,True,53,好停車，兒童友善，多次造訪
