user_name,user_profile_url,rating,local_guide,comment_num,comment_text
 Kay Chen ,https://www.google.com/maps/contrib/110441689566047341524/reviews?hl=zh-TW,5,True,88,真的好吃。現點現炸，外酥內軟，其實不愛肉桂味，但streetchurros肉桂口味我超愛。飲料有點貴，吃吉拿棒就好
 Snow S ,https://www.google.com/maps/contrib/104076561122499022596/reviews?hl=zh-TW,4,True,64,吉拿棒外脆內軟，口感不錯，個人推薦吉拿泡芙，飲料也很好喝。價格偏高。
 Chun Eric ,https://www.google.com/maps/contrib/110740827966624846665/reviews?hl=zh-TW,5,True,816,吉拿棒非常好吃，我覺得比在西班牙吃的還好吃，不過要趁熱吃，冷掉後的吉拿棒大概就少一顆星了。
 Pibo Yu ,https://www.google.com/maps/contrib/102985884989994630591/reviews?hl=zh-TW,1,False,14,東西是好吃但女櫃檯的態度令我感覺很不想有人去光顧我也是做過服務業所以我不會認為客人至上這道理正確但給人的態度就是讓我不會想再去
 邱卓凡 ,https://www.google.com/maps/contrib/105508286748404799912/reviews?hl=zh-TW,5,True,114,熱名時段的排隊名店之一。今天幸運有座位且不需等候太久，店裡不吵雜氣氛佳，橙香熱可可加上肉桂吉拿很配，服務員態度良好。
 Teresa Liang ,https://www.google.com/maps/contrib/107073676242548751995/reviews?hl=zh-TW,2,True,132,"好吃是好吃，但問店員問題跟沒聽到問題一樣，繼續挖他的冰淇淋，到底是？？
還沒吃到就一團火了，再好吃也不會再來吃第二次，員工教育不夠好吧"
 翰 ,https://www.google.com/maps/contrib/113832663546657396670/reviews?hl=zh-TW,4,True,157,吉拿棒真的好吃，非常推薦肉桂麻吉口味，只是出餐速度慢了些，用餐時段需要等的有點久
 Tico Miyabi ,https://www.google.com/maps/contrib/105100230890094040994/reviews?hl=zh-TW,4,True,335,給錯口味了...但還是很好吃
 YH Tsai ,https://www.google.com/maps/contrib/115722959906783792335/reviews?hl=zh-TW,2,True,134,吉拿棒本身很好吃，但是店員態度不佳，明明排隊人不少，動作卻非~~~常慢，櫃台站了3個員工，一個送餐去另外兩個卻都在發呆，完全沒動作。
 Carrie Lan ,https://www.google.com/maps/contrib/109598792024640993741/reviews?hl=zh-TW,4,True,170,剛炸好的吉拿棒灑上肉桂粉，再配上霜淇淋，口感很好。店內座位可自行入座。
 莊冠軒 ,https://www.google.com/maps/contrib/111406733362204948108/reviews?hl=zh-TW,1,False,18,店員手沒戴手套，收完錢手就直接去接機器壓出來的吉拿棒，實在不是很衛生。
 Sonia Yang ,https://www.google.com/maps/contrib/108735817557287219593/reviews?hl=zh-TW,3,True,563,現炸的肉桂churros比起賣場的好吃多了。本以為巧克力醬像西班牙一樣是熱的，沒想到是一小盒榛果巧克力醬，味道很像Nutella，沾了反而蓋住原本肉桂churros的美味，有點畫蛇添足感。
 Jane Su (Yu-Chen) ,https://www.google.com/maps/contrib/109849493919311051850/reviews?hl=zh-TW,5,True,82,"肉桂口味不錯
因為下雨天就只好點肉桂，邊走邊吃很方便
因為沾醬是額外放盒子裝
但希望下次回訪，想吃吃看巧克力沾醬😇"
 Yu Chun Chen ,https://www.google.com/maps/contrib/110306179370760071868/reviews?hl=zh-TW,5,True,61,好吃！低消是一份餐點/飲料，限時一小時，人若不多可以坐就一點。不過希望店員可以多一些微笑！
 Rita Liu ,https://www.google.com/maps/contrib/100660078646153084222/reviews?hl=zh-TW,4,True,47,珍奶冰淇淋吉那圈非常好吃，茶香奶香調和的很好，吉那圈外酥內軟，搭配肉桂粉很香，飲料就比較普通
 Yang Grace ,https://www.google.com/maps/contrib/104989802352679091734/reviews?hl=zh-TW,5,True,20,"白天來更棒！因為可以盡情地聊天,沒有太吵雜聲音的干擾,
而且下午喝點小酒真的很放鬆,和晚上喝酒的感受截然不同.."
 Yaya ,https://www.google.com/maps/contrib/114501204495706909931/reviews?hl=zh-TW,5,True,302,我本來是不喜歡吉拿棒的人，到這邊點了奶油起司口味的吉拿棒，就從此對吉拿棒改觀了!(開始懷疑我在電影院吃的那種吉拿棒根本不是同一種東西吧…)
 田seagull ,https://www.google.com/maps/contrib/116497746987018918184/reviews?hl=zh-TW,1,False,6,"態度極差尤其紅頭髮女店員技能滿點一直瞪人
我是來吃東西還是來看你表演翻白眼的?
評論看下來真的店內神奇寶北一枚

大家有空可以去欣賞一下這家的員工喔"
 Harry Brutka ,https://www.google.com/maps/contrib/117975358231451379061/reviews?hl=zh-TW,4,True,79,吉拿棒和薯條好吃價錢也不貴適合跟朋友坐一下吃小點心
 Elise Yang ,https://www.google.com/maps/contrib/110683833625741785040/reviews?hl=zh-TW,4,True,813,熱熱的加上冰淇淋好吃
 荷蘋 ,https://www.google.com/maps/contrib/117200286367539172466/reviews?hl=zh-TW,1,False,2,"晚上8:50店員回覆不耐煩+冷臉
欠妳多少啊⋯⋯只是問個海鹽可可以前不是有冰的，堅持跟我說沒有，我吃過多少次了，我會不知道...火耶！服務業辛苦我體諒，但如果我今天一直刁難就不對，那是什麼態度啊！跩什麼"
 Yuwei Yeh ,https://www.google.com/maps/contrib/108294293706855944683/reviews?hl=zh-TW,1,True,19,態度有夠差！動作已經很慢了，等了20分鐘，輪到點餐時，居然把客人晾在那邊做自己的事約10分鐘後，客人和氣詢問是否可以點餐還被白眼。基本服務業工作態度不及格。反推！
 원디Wendy Chen ,https://www.google.com/maps/contrib/100214238011065888284/reviews?hl=zh-TW,5,True,363,好吃!環境也舒服呢！
 Yu-Rou Chen ,https://www.google.com/maps/contrib/116381264655912487173/reviews?hl=zh-TW,2,True,52,千萬別點海鹽焦糖博士茶，不好喝，很像在喝藥，吉拿棒冰淇淋勉強可以，服務人員話沒說清楚，容易讓人誤解，希望可以改進
 小伊 ,https://www.google.com/maps/contrib/102427505287351853742/reviews?hl=zh-TW,5,True,44,吉拿棒很脆沾巧克力很濃跟比利時感覺相似熱狗非常喜歡很像冰島有名的那間熱狗攤販
 Ryan Chang ,https://www.google.com/maps/contrib/108779857532100919952/reviews?hl=zh-TW,5,True,230,蠻好吃的吉拿棒，不沾醬就好吃了，不過巧克力和奶油起司沾醬也都很不錯，但價格不便宜
 沙拉 ,https://www.google.com/maps/contrib/105205860957429302424/reviews?hl=zh-TW,5,True,141,"現點現做
真的好吃
阿啾的吉棒有點小隻～
希望可以變大隻一點
不然120
有點小貴⋯
希望可以更好喔！"
 大衛 ,https://www.google.com/maps/contrib/112913146503842282798/reviews?hl=zh-TW,1,True,325,"⚠️110/2/26約下午五點半，女店員態度非常差勁

一副雇主幾個月沒發薪，或是每個客人欠他錢的樣子"
 劉昱辰 ,https://www.google.com/maps/contrib/102201955997091695066/reviews?hl=zh-TW,5,True,93,剛出爐的吉拿棒非常好吃！搭配巧克力醬更加美味，可惜稍嫌貴了一點。
 Hsu Richie ,https://www.google.com/maps/contrib/105701084515822908810/reviews?hl=zh-TW,4,True,110,東西好吃，價格略高但可接受
 liisuey Axdeark ,https://www.google.com/maps/contrib/100105450244783768977/reviews?hl=zh-TW,4,True,253,內用環境還ok，不過有點吵比較無法聽到店員叫號。如果要品嚐，請瞭解東西真的非常油。
 Luna Lin ,https://www.google.com/maps/contrib/107120110486397943322/reviews?hl=zh-TW,5,True,65,"肉桂吉拿棒就是讚🥰
巧遇拿鐵半價，海鹽焦糖拿鐵不錯喝"
 Jie ,https://www.google.com/maps/contrib/107284045217358430425/reviews?hl=zh-TW,1,True,20,店員的素質一次比一次差勁，點餐的那個一臉不耐只顧著聊天，取餐的那個口氣差到好像欠她幾百萬一樣，人都還沒走遠就聽到她在跟其他店員講人閒話，越想越氣東西都吃不下了。這是我最後一次去這個品牌的商店消費了
 靜SHIZUKA ,https://www.google.com/maps/contrib/111994902854029356275/reviews?hl=zh-TW,5,True,20,"大推吉拿棒+肉桂
最好現吃
熱熱的超好吃鬆軟鬆軟
薯條也很棒"
 Y C ,https://www.google.com/maps/contrib/108204179672226260548/reviews?hl=zh-TW,2,False,25,東西是不錯吃，但櫃檯女服務人員完全一副厭世的鬼態度，同情老闆，花錢請一個來砸自己招牌的員工
 Frances Huang ,https://www.google.com/maps/contrib/106014143850343613886/reviews?hl=zh-TW,5,True,9,吉那圈超級好吃，已經再訪好多遍啦
 Peggy Chuang ,https://www.google.com/maps/contrib/105923839579070597777/reviews?hl=zh-TW,4,True,16,吉拿棒真的滿好吃的！但很可惜點餐完後往左離開的動線會與排pickup的客人撞在一起....
 Showsa Huang ,https://www.google.com/maps/contrib/108481557423374700735/reviews?hl=zh-TW,5,True,100,"Churro現點現做，炸的脆、糖霜撒的足，咬起來溫溫的！滋味非常療癒！只是簡單的ㄧ個炸麵團圈，吃起來的滿足感完全不輸擺盤華麗的蛋糕鬆餅⋯。
但熱飲點的香蕉巧克力味道就較普通，廉價的調味乳香精味過多⋯"
 mark moon ,https://www.google.com/maps/contrib/106897783141032592569/reviews?hl=zh-TW,5,True,54,吉拿棒、軟法三明治跟美式都很棒，值得再去
 Koupen Chan ,https://www.google.com/maps/contrib/107150646145437698730/reviews?hl=zh-TW,3,False,"1,136","音樂很吵鬧，全部是韓國流行音樂。不適合工作常坐。
吉拿棒很普通，芒果冰沙$140還不錯。
冷氣很涼。"
 龔韋綸 ,https://www.google.com/maps/contrib/108783508815175213226/reviews?hl=zh-TW,2,False,9,吉拿棒本身很好吃，但店員態度很糟糕我站在櫃檯要點餐服務員完全不鳥我，一直在摸東摸西我叫了他兩次他才理我，感受非常不好
 Rebecca Luh ,https://www.google.com/maps/contrib/104698942905062177128/reviews?hl=zh-TW,1,False,5,店員態度很差詢問事情顯現不耐煩的表情
 楊貞惠 ,https://www.google.com/maps/contrib/112824265173380549978/reviews?hl=zh-TW,5,True,337,"好吃，油很乾淨，服務很好。值得一吃。有很多種類，例如吉拿棒泡芙,冰淇淋等有加草莓珍珠。"
 S姐野生活 ,https://www.google.com/maps/contrib/109852084410714682136/reviews?hl=zh-TW,5,True,41,"酥脆的吉拿圈搭配阿啾
阿啾冰淇淋口感香純濃郁
兩者是完美絕配"
 林妞兒 ,https://www.google.com/maps/contrib/116070792419695208537/reviews?hl=zh-TW,5,True,43,"啵啵啾好好吃❤️

濃郁厚奶茶霜淇淋+Q彈黑糖珍珠+酥脆吉那圈

zoo台北市立動物園店"
 海洋 ,https://www.google.com/maps/contrib/112566418182655782143/reviews?hl=zh-TW,1,True,66,3/16下午3:30櫃檯女性服務員態度不佳輕浮
 Yu hui Liu ,https://www.google.com/maps/contrib/100869554568347571889/reviews?hl=zh-TW,5,False,18,"吉拿圈+冰淇淋🍦很好吃
酥酥脆脆又不會太乾
咖啡也很好喝
只是需要耐心等候"
 國泰民安 ,https://www.google.com/maps/contrib/106044226232388993359/reviews?hl=zh-TW,1,False,9,櫃檯臉可以不用那麼臭也不是說服務業一定要隨時掛著笑容但真的沒必要擺出客人欠妳錢的樣子看了感覺很差二訪了這次覺得很後悔來消費連一星都不想給
 劉乃華 ,https://www.google.com/maps/contrib/110889768899561333697/reviews?hl=zh-TW,1,True,442,"吉拿加奶油起司醬好吃!!
但為什麼不管多冷下著雨，內用跟外帶都要在外面排隊點餐⋯"
 Joy Chen ,https://www.google.com/maps/contrib/100225554146396684115/reviews?hl=zh-TW,3,True,736,"服務人員態度都蠻好的，店裡空間蠻大，不會有壓迫感。咖啡就普通，不過吃這個就是跟咖啡才搭。

沙發座位很難坐，沙發都已經被坐爛了，沒有彈性，感覺整個人都陷入沙發裡，不舒服。建議可以巡一下沙發座椅，不堪使用的看是維修還是換掉吧！"
 Julia Chu (Julia Chu) ,https://www.google.com/maps/contrib/116068471335514325522/reviews?hl=zh-TW,5,True,37,晚上的時候人比較少，比較舒服。吉拿棒很好吃，常常來這裡吃
 SN H ,https://www.google.com/maps/contrib/100711995172063541356/reviews?hl=zh-TW,5,False,16,每次想吃甜的來這裡都可以獲得滿足🤣
 chan Tanya ,https://www.google.com/maps/contrib/101016050094236353229/reviews?hl=zh-TW,3,True,30,"老實說，可能因為暑假剛開幕、匯聚不少人氣、但店內除販售品項有點單薄....
雖說是自助式點心店、但服務人員仍應稍微巡視一下～"
 Anson Sue ,https://www.google.com/maps/contrib/111896348148774722109/reviews?hl=zh-TW,2,True,43,餐點氣氛都很不錯！可惜是跟下面評論一樣，店員態度讓人不想再光臨
 カクテル ,https://www.google.com/maps/contrib/110001226268858813142/reviews?hl=zh-TW,4,True,"1,381",剛炸好的吉拿棒好好吃！外酥內q而且不油膩，喜歡堅果口味配巧克力醬
 哎唷喂 ,https://www.google.com/maps/contrib/112290120681770336715/reviews?hl=zh-TW,4,True,264,價格稍貴，但熱吉拿配苦甜巧克力真的絕配，不過這裡不講服務的，所以不用太要求
 균이 ,https://www.google.com/maps/contrib/100092133083748756923/reviews?hl=zh-TW,5,False,11,"2/18開店的店員很親切♥️辛苦了!!!
這家吉拿棒真的很好吃🤤♥️"
 Zeke Yang ,https://www.google.com/maps/contrib/108035560729468697713/reviews?hl=zh-TW,4,True,28,"工作常會經過這裡若在平日前來其實不太需要等候且能挑喜歡的位置入坐另外搭配飲料會比較划算歐
不過重點是不要在假日來湊熱鬧他們都是現炸的啊!不要假日來!!!"
 劉靖嬿 ,https://www.google.com/maps/contrib/108362941269090794758/reviews?hl=zh-TW,5,True,21,吉拿棒愛好者必吃😉
 王奕翔 ,https://www.google.com/maps/contrib/111000407189063176944/reviews?hl=zh-TW,4,False,16,美味的小點店，開放式的用餐環境很舒適，惟獨易因店內音量聽不到店員的取餐叫號，但店員態度仍非常良好，餐點也很好吃，很適合在飯後享用餐點，值得再訪的好店！
 LESLIE YANG ,https://www.google.com/maps/contrib/112950875678703281261/reviews?hl=zh-TW,1,False,9,2位櫃檯小姐態度都很差，點餐時不耐煩，入座後小朋友不小心把冰淇淋打翻在地上，我們當然很不好意思趕快拿紙巾擦拭，但店員完全沒有拿布或拖把來清掃，只是看著我們.......
 李李 ,https://www.google.com/maps/contrib/112687735764444585763/reviews?hl=zh-TW,4,True,127,"真的還不錯，不愛甜食的我都覺得好吃
但是促銷是真的沒花心思
應該多作活動"
 Chih-Jung Ku ,https://www.google.com/maps/contrib/111754613320024942132/reviews?hl=zh-TW,5,True,134,吉拿棒真的很好吃！內用座位不多，人少的時候很舒服，但人多的時候有點吵雜。
 Joelleho Joelleho@gmail.com.tw ,https://www.google.com/maps/contrib/106636800813596580006/reviews?hl=zh-TW,5,True,472,"跟國賓Costco不一樣就是不一樣
還有收銀機旁邊那杯是sample是Sample是sample(正妹店員辛苦了~~~臉臭還是可以的)"
 85B方韻慈 ,https://www.google.com/maps/contrib/101921750705207593789/reviews?hl=zh-TW,3,True,82,剛做好熱騰騰的很好吃，外皮很酥裡頭麵團很Q，不過感覺是只會吃一次的東西，沒試過可以試試看
 周爺 ,https://www.google.com/maps/contrib/107734197785652382648/reviews?hl=zh-TW,5,True,129,薯條好好吃😋
 Chiung Wen Chang ,https://www.google.com/maps/contrib/107527133807841678968/reviews?hl=zh-TW,5,True,185,"喜歡吉拿棒的人千萬不要錯過啊～
外皮酥脆裡面鬆軟，一口咬下層次口感迸出來～"
 Sammi ,https://www.google.com/maps/contrib/113519014596482039454/reviews?hl=zh-TW,5,True,238,鮮炸吉拿灑上肉桂很酥香
 Chany Wang ,https://www.google.com/maps/contrib/108992281753906142594/reviews?hl=zh-TW,4,True,763,"吉拿棒好吃，茶類也很好喝
環境乾淨清幽，適合獨自用餐，
也適合帶小孩跟朋友一起小聚"
 黃鐙儀 ,https://www.google.com/maps/contrib/108729048891787799892/reviews?hl=zh-TW,5,True,133,"好吃的吉拿棒，完全顛覆我對電影院裡賣的難吃的形象。
推薦肉桂。"
 Sam Yang (Polar Bear) ,https://www.google.com/maps/contrib/115591970620422890515/reviews?hl=zh-TW,3,True,"1,348",和天母東西不一樣？
 林秉軒 ,https://www.google.com/maps/contrib/114016158551744982516/reviews?hl=zh-TW,2,False,1,店員服務態度差
 不小元 ,https://www.google.com/maps/contrib/109024035759168462620/reviews?hl=zh-TW,4,True,99,韓國店，不錯吃，如果運氣好可以坐路邊的沙發，你還是別去，免的我去了沒位置。
 Giles Hung (Giles) ,https://www.google.com/maps/contrib/106329987761522368596/reviews?hl=zh-TW,5,True,162,吉拿棒非常好吃，因為餐點製作時間較長，還請我吃冰淇淋，很貼心。
 Justine Yu ,https://www.google.com/maps/contrib/111742058664358843827/reviews?hl=zh-TW,2,True,68,咖啡配角的Churros卻變成一間店的主角，菜單感覺很弱，適合邊走邊吃的產品，價錢卻一點也不適合邊走邊吃。另外，旗艦店是什麼意思啊？完全感受不到旗艦店這三個字。但是churros不錯吃，Costco的吃起來更有口感，還能大口咬！
 Lucy Ting ,https://www.google.com/maps/contrib/105635045139924092220/reviews?hl=zh-TW,1,False,5,服務態度很差，點餐和加點時態度都很冷淡；提醒店員忘記找錢，她也沒有表示抱歉，只叫旁邊的男店員處理，整體消費經驗很差。
 Chris Yeh ,https://www.google.com/maps/contrib/101847278046628814838/reviews?hl=zh-TW,4,True,926,裝潢及飲品不錯
 Alice Liu ,https://www.google.com/maps/contrib/116473009923147586862/reviews?hl=zh-TW,5,True,403,等的有點久，不過吉拿棒鬆脆好吃，蔓越莓沾醬很香，有機會再來吃其他點心。
 dee lee ,https://www.google.com/maps/contrib/103548054708515799940/reviews?hl=zh-TW,3,False,14,店員態度急迫，給人蠻大壓力
 Bo Jill ,https://www.google.com/maps/contrib/106000421245331698446/reviews?hl=zh-TW,1,False,6,櫃檯人員態度極差，自己沒聽清楚，還口氣還差的不斷重複問。另外建議音樂可以開小聲一點
 陳奕慈 ,https://www.google.com/maps/contrib/105602746264379407168/reviews?hl=zh-TW,3,True,25,今天點啊啾，牛奶冰淇淋太甜了，可是即拿棒還不錯，下次會考慮點沾醬的就好。
 Sunnylove ,https://www.google.com/maps/contrib/112292245997508199268/reviews?hl=zh-TW,5,False,26,非常好吃的吉拿棒～每次經過必買😋
 Berry Chou ,https://www.google.com/maps/contrib/110177281162316470379/reviews?hl=zh-TW,4,True,683,吉拿棒好吃，飲料普通，座位少，但環境還錯，適合和閨蜜一起聊天說是非。
 曾華煌 ,https://www.google.com/maps/contrib/112087854405049442730/reviews?hl=zh-TW,5,True,72,"吉拿棒現點現做外酥內軟非常好吃
環境舒適人不多時非常休閒"
 廖偲庭 ,https://www.google.com/maps/contrib/116440537641353206853/reviews?hl=zh-TW,5,True,24,超級喜歡吃，這裡的食物好吃特別又用心
 SPH H ,https://www.google.com/maps/contrib/108903134456084964324/reviews?hl=zh-TW,4,True,83,辣的熱狗.....有被辣到，超帶勁的。churros加冰淇淋真的不錯，但是如果加巧克力醬，加價但那量真的不值那樣的價錢.....
 解振成 ,https://www.google.com/maps/contrib/100025462391220187773/reviews?hl=zh-TW,3,True,17,抹茶拿鐵125偏甜，抹茶味有點不夠
 Ariel ,https://www.google.com/maps/contrib/117099949367465161596/reviews?hl=zh-TW,4,True,77,"吉拿圈酥脆Q彈~好吃
搭配奶油起司沾醬令人驚豔
稍嫌貴了點"
 Ching Huang ,https://www.google.com/maps/contrib/114270631608140452579/reviews?hl=zh-TW,4,True,273,吉拿薯條不錯吃不過小小的就快100覺得有點不划算吃吉拿棒就夠了~~~
 賴昱安 ,https://www.google.com/maps/contrib/110099137196199505456/reviews?hl=zh-TW,1,False,5,老闆獎金該發要發不然店員臉這麼臭愛理不理
 Ching-Han Chuang ,https://www.google.com/maps/contrib/108082105663157907242/reviews?hl=zh-TW,3,True,121,只要吃吉拿棒就好，其他飲料都太甜像7-11的葡萄冰棒，喝起來很廉價卻賣的很貴。
 蓋茲比 ,https://www.google.com/maps/contrib/114304836169285506700/reviews?hl=zh-TW,1,False,6,外送餐點有缺漏
 free man ,https://www.google.com/maps/contrib/100655396725565225366/reviews?hl=zh-TW,4,True,319,"吉拿棒配冰淇淋吃起來真是美味
再加上現打柳橙汽泡微酸去膩😋"
 陳怡捷 ,https://www.google.com/maps/contrib/102343654657130107983/reviews?hl=zh-TW,4,True,35,好吃的吉拿棒！但有加料的都偏甜最後吃不下會膩
 Chia Chang ,https://www.google.com/maps/contrib/113639963980681152696/reviews?hl=zh-TW,5,True,600,好吃的吉拿棒，肉桂口味沾奶油起司超搭，香香酥酥的也不會有油耗味
 小頁 ,https://www.google.com/maps/contrib/103774177752552522390/reviews?hl=zh-TW,3,True,47,Cp值還好，現炸吉拿圈好吃，但是單吃會膩，希望能多點餐點可搭配
 Terry Lee ,https://www.google.com/maps/contrib/110090728309209163649/reviews?hl=zh-TW,4,True,260,2/15消費，吉拿棒很不錯，今生今世第一次食用
 Michelle Chen ,https://www.google.com/maps/contrib/111807393368042273729/reviews?hl=zh-TW,4,True,473,好吃。應該是說吉拿棒本該如此，是現有的太不好吃所顯的反差
 Jie-Bi Hu ,https://www.google.com/maps/contrib/108498467055897111922/reviews?hl=zh-TW,5,True,105,吉拿棒滿特殊的，不錯吃！但內用位置有點少...
 李諭玟 ,https://www.google.com/maps/contrib/104694392683292407942/reviews?hl=zh-TW,5,True,15,很適合下午和朋友一起來，吉拿棒很好吃，有時候搭配優惠會很划算
 yi amber ,https://www.google.com/maps/contrib/109812264887316789066/reviews?hl=zh-TW,5,True,119,很好吃但座位少了點😅
 林澄新 ,https://www.google.com/maps/contrib/106332414795555992585/reviews?hl=zh-TW,4,True,414,東西好吃可惜服務有待加強~
 楊蕙綺 ,https://www.google.com/maps/contrib/111511958906333201109/reviews?hl=zh-TW,3,True,161,好吃的肉桂吉拿棒，網美拍照一下不錯，但價位偏高。
 Teresa Shih ,https://www.google.com/maps/contrib/101410128028084725072/reviews?hl=zh-TW,4,True,89,真的很喜歡Churros！！！平價又好吃，外皮酥脆，內裡軟嫩，還創新了好多種吃法，值得推薦！
 Steve Kao ,https://www.google.com/maps/contrib/107267660109665716152/reviews?hl=zh-TW,5,True,25,東西好吃，服務親切，值得推薦！
 小薇薇 ,https://www.google.com/maps/contrib/104011549978001302987/reviews?hl=zh-TW,5,True,19,環境乾淨，東西好吃，店員親切~
 周凱歌 ,https://www.google.com/maps/contrib/117318338237137949642/reviews?hl=zh-TW,5,True,538,"真的很好吃跟一般坊間的吉拿棒不同，
口感很特別！！！"
 Chen Weian ,https://www.google.com/maps/contrib/117272849783743705795/reviews?hl=zh-TW,3,True,114,"滿推薦給喜歡肉桂的人
堅果口味吃起來味道比較不明顯
沾醬起司的好吃"
 Chehuang Wu ,https://www.google.com/maps/contrib/111928749324163826626/reviews?hl=zh-TW,3,True,582,好好吃，只是要有點小等，現做美食
 Linda Wu ,https://www.google.com/maps/contrib/104007842186134087712/reviews?hl=zh-TW,3,True,605,甜到不行的吉拿棒配冰淇淋，是滿特別的，但不會讓人想再吃。
 Hsuan-ju Chen ,https://www.google.com/maps/contrib/105886342123328947730/reviews?hl=zh-TW,3,True,306,地上好黏唷，內用的時候，覺得鞋子要被地板抓住了~走路困難。
 波特 ,https://www.google.com/maps/contrib/110078982339804391171/reviews?hl=zh-TW,5,True,31,吉拿的口味很特殊，跟其他種種配合起來有意料之外的美味
 JACK chen ,https://www.google.com/maps/contrib/100635136549478887081/reviews?hl=zh-TW,5,True,56,非常好吃的吉娜棒，無論是配咖啡還是配冰淇淋，都很棒^^
 Hilda K ,https://www.google.com/maps/contrib/105663069147925312430/reviews?hl=zh-TW,4,True,78,"價格有一點貴,但很好吃！"
 魚兒 ,https://www.google.com/maps/contrib/115399972786892227120/reviews?hl=zh-TW,5,False,16,本來還有信義店的，好可惜現在就只剩旗艦店了，靠近捷運站很方便人很多，真的很好吃～～！
 Yuling ,https://www.google.com/maps/contrib/116460528415941750502/reviews?hl=zh-TW,3,False,16,東西好吃，服務員態度超爛，結帳卡片直接丟桌上
 呂韋毅 ,https://www.google.com/maps/contrib/116897343393932634901/reviews?hl=zh-TW,1,False,16,服務人員態度極差無比
 黃以豪 ,https://www.google.com/maps/contrib/101623217130287226761/reviews?hl=zh-TW,5,False,3,東西好吃服務態度極優
 Chen Bonnie ,https://www.google.com/maps/contrib/114666784460890071497/reviews?hl=zh-TW,5,True,132,堅果比肉桂口味好吃，推薦加點奶油起司做搭配
 ヒナ ,https://www.google.com/maps/contrib/105127544899756391911/reviews?hl=zh-TW,5,True,43,"吉拿棒好吃，咖啡好喝！
每次去都大排長龍，店員們辛苦了☺️"
 鄭丞琮 ,https://www.google.com/maps/contrib/108105862609589635126/reviews?hl=zh-TW,5,True,29,獨特馬蹄鐵造型，韓國來的店，街頭小吃，咖啡也不錯，不定期辦活動更換口味
 徐紫嵐 ,https://www.google.com/maps/contrib/112104447260249636984/reviews?hl=zh-TW,5,False,20,吉拿棒很優非常值得尤其是他的季節限定草莓啵啵啾超好吃
 Kelsey Yang ,https://www.google.com/maps/contrib/112935971643848928886/reviews?hl=zh-TW,5,True,254,吉拿熱狗酥脆，起士濃郁
 Maix Lai ,https://www.google.com/maps/contrib/110257718471382315159/reviews?hl=zh-TW,4,True,49,短暫休憩，用吉拿棒、咖啡暖身。
 呂柏遠（Sirius） ,https://www.google.com/maps/contrib/111764476791858302026/reviews?hl=zh-TW,5,True,8,喜歡肉桂的話一定要去試試肉桂吉拿棒
