user_name,user_profile_url,rating,local_guide,comment_num,comment_text
 Amos Hsu ,https://www.google.com/maps/contrib/108980936983823304969/reviews?hl=zh-TW,5,True,336,"2020第3季整修完成，質感提升很多。

座椅、餐盤的質感有下功夫提升。
餐點的選擇及品質都有進化，不只是看起來跟其他高級吃到飽一樣豪華，美味程度也有十足進步。德國豬腳、佛跳牆讓我驚艷，甜點區的選項也讓人大開眼界。

這次吃平日午餐，幾乎客滿，人多還是要先訂位比較好。"
 Gustav Liu ,https://www.google.com/maps/contrib/106627216886835217034/reviews?hl=zh-TW,4,True,153,"有點普通的飯店Buffet，雖然飯店的吃到飽大概都差不多這樣，但除非很愛吃海鮮，不然選擇真的不算多。
吃過三次左右，每次吃都給我差不多的感受，希望能夠在菜色方面更多樣化"
 美卿Tina ,https://www.google.com/maps/contrib/117899945108852721602/reviews?hl=zh-TW,2,False,"1,369","11004-下午茶用餐,餐點菜色不多,口味便重,螃蟹超腥的,只有涼拌鮭魚可以
如果不是因為送的卷,大概也不會來"
 李安東尼 ,https://www.google.com/maps/contrib/104417722115278794815/reviews?hl=zh-TW,4,True,576,"該有的食材都有，食材也很多豐富
總體來說少了點精緻與鮮度
味蕾的感動不足"
 suliven Chen ,https://www.google.com/maps/contrib/106059650992467214603/reviews?hl=zh-TW,4,True,156,今天是中午去用餐，整體而言可選擇的品項算是少了點，握壽司，手捲都只有兩種，生魚片四至五種，甜點真的不錯，其他項目就......很普通，另外整個場地高高低低，有不少台階及斜坡，取用湯品時真的要特別小心。
 Joanna Wei ,https://www.google.com/maps/contrib/114684538214444422596/reviews?hl=zh-TW,2,True,113,很普通。也沒吃到龍蝦只有螃蟹，羊排老到咬不斷，咖啡不香。甜點也不精緻，應該不會再來了，名過於實...
 韋智群 ,https://www.google.com/maps/contrib/113000397582564752616/reviews?hl=zh-TW,4,False,71,"個人是下午茶時間消費的,其用餐區特點屬超挑高寬敞開放式自助環境,而周邊屬取餐區,總共有麵食湯品、中式、歐美式、飲料區、日式、沙拉吧、甜點、冰品和水果區,食材還算新鮮,人員服務也算可以,而店家招牌應該算多樣的甜點和haagendazs冰淇淋,如果想吃吃看的話還算可以去的餐廳.

為什麼算還可以去而不是值得推薦呢？
因為以星級吃到飽的價位來看就略為不值推了.....
首先,餐點種類過少,特別是熟食菜色和生魚片數量,不是量給少就是太小片和特定餐點因太熱門一下被拿完而補充太慢造成需排隊等待時間過長進而没吃到多少真的太令人失望.
再來是動線設計不佳,常常因為有人在排隊而卡到其他人行走取餐.
用餐時間太趕,而其最主要的問題還是排隊太花時間了,造成來不及選其他物品享用.

總得説如果如果有優惠券或其他折扣的話,還是可以去吃吃看的."
 Anita ,https://www.google.com/maps/contrib/114899744405564499334/reviews?hl=zh-TW,5,True,24,"因為公司聚會而來
用餐環境寬敞
天井設計讓我們有露天吃飯的悠閒感
食物多樣好吃
甜點選擇多還有現做的可麗餅❤️
除了飲料選擇較少
果汁似乎不是鮮榨原汁這點有點可惜
但不影響評分

P.s.骰子牛必吃❗️❗️❗️❗️❗️❗️"
 Heidi H ,https://www.google.com/maps/contrib/109475950271412355885/reviews?hl=zh-TW,1,True,63,"9/18更新
重新裝修前給5顆星，裝修後，不知道為何現場服務人員姿態都擺很高，講話口氣也很衝，說聲請很難嗎？還叫客人“欸”...，真的很沒禮貌！

4/23
因為疫情的影響，客人變很少，雖然如此，但飯店的服務人員依舊熱情親切，尤其甜點區的老爹更是，飯店內的防疫措施也做的很足，有要外出吃飯的人還是可以考慮到這邊用餐。"
 Andy Chen ,https://www.google.com/maps/contrib/108961116242746210080/reviews?hl=zh-TW,4,True,57,菜色蠻多的，也有些特殊不常看到的，但限於場地的關係，大排長龍是無可避免，整體cp值還好，但服務人員非常棒，也會提醒用餐的時間，所以給四顆星。
 Irena Chang ,https://www.google.com/maps/contrib/114533395828086908040/reviews?hl=zh-TW,5,True,169,"狂吃龍蝦🦞和螃蟹🦀️生魚片還有骰子牛肉
鰻魚飯
羊勒排
晚餐和午餐才有龍蝦🦞
一個人1390（不含服務費）
如果你有美國運通卡
何時來都買一送一
很划算喔！
若沒有美運推薦上網買GOMAJI卷
一樣有優惠票價
一個人不到1000元吃到飽
甜點有現做的可麗餅喔！"
 Francis Che ,https://www.google.com/maps/contrib/117255915469565959168/reviews?hl=zh-TW,2,True,441,"最近怎麼了，一直碰到雷，一千多這種品質不夠水準，不是難吃，是食物好...普...通.........,大哭。勉強合格的有烤牛肉，東勢鮮蚵，生魚片，冰淇淋和水果。果汁是濃縮還原的嗎？蝦蘆筍手捲是蝦薄片加蘆荀梗，烤雞串沒有烤的味道......這不是記憶中的味道

Disappointedtaste,gototheJapanesecuisineupstairsinstead."
 Linda Wu ,https://www.google.com/maps/contrib/117335048944327372008/reviews?hl=zh-TW,5,True,73,今年整修後，下午茶的餐點也做了改進，比之前好，剛好逢秋天的蟹季，下午茶也放上蟹供饗宴，挺不賴的！！
 CJ jeong ,https://www.google.com/maps/contrib/104866369541164357441/reviews?hl=zh-TW,1,True,129,如果有預算想要吃精緻Buffett慶祝節日，千萬別來！😤肯定敗興而歸~吃了很多，但沒有一道讓人印象深刻，廚房人員怠惰嚴重(大部份，約六成)不補餐點，讓食物看起來乾涸雜亂像剩菜，湯品不補~牛排也很難入口過於生，又有一堆筋🙄完全不是五星級飯店應有的水準！外場人員倒是挺認真的，不斷地留意客人餐盤及補充餐具，完全天壤之別！😟
 小巴戈 ,https://www.google.com/maps/contrib/111048397019787871345/reviews?hl=zh-TW,2,True,52,今天吃的是晚餐，生魚片壽司還不錯，對水煮海鮮有點失望，想說現在天氣冷蟹蝦類應該都很好吃，旭蟹、白蝦、淡菜都不好吃！旭蟹肉散散的沒甜味，白蝦殼軟頭稍微黑肉質不脆淡菜肉小，鐵板燒牛肉尚可魚肉很柴，蝦子（應該是天使紅蝦）不新鮮，唯獨現切牛肉還不錯，甜點都太甜，水果一般般，1500多的價位有更多選擇！
 Don Tan ,https://www.google.com/maps/contrib/103164300350559192154/reviews?hl=zh-TW,4,True,310,第二次在這用餐，這次有點失望，雞豬肉料理有點太柴，賣相和口感不佳的炒米粉，怎會上桌呢?日式料理部份不錯，尤其是炙燒壽司很好吃。甜品甜點多樣，還有haagen-dazs和北海道抹茶冰淇淋也不錯。不過這次會讓我感動的是服務人員的親切用心態度，在這感謝温在宇先生的安排，讓我朋友的慶生晚餐多了一些歡樂情節。
 邱小玲 ,https://www.google.com/maps/contrib/109755383899073717290/reviews?hl=zh-TW,4,True,93,種類豐富、龍蝦肉質太乾！特別驚艷的部分是價錢
 Ti-Ying Yang (俶滎) ,https://www.google.com/maps/contrib/100736574603000318139/reviews?hl=zh-TW,4,True,478,"整體而言
熱食部分種類多又精緻好吃
但甜點就有點出乎意料
種類多但口味有的過甜"
 Chung-Hao Cheng ,https://www.google.com/maps/contrib/103950258070004859223/reviews?hl=zh-TW,3,True,"1,097","因為有12國料理而以此命名，但消費後整體感受價值感低。
雖說有龍蝦、牛肉、生魚片、海鮮、鮑魚、烤鮭魚等食材，但龍蝦是龍蝦頭沒肉，牛肉普通稍微有筋，生魚片和海鮮種類少，只有鮑魚湯飯還不錯。
其他甜點、水果、冰淇淋還好一點，但這也只是基本該有的，果汁也喝的出來是罐裝的。
果然飯店吃到飽很多是付錢在裝潢上。"
 無敵老天鵝 ,https://www.google.com/maps/contrib/106087247668213058465/reviews?hl=zh-TW,2,True,222,"還好我是買券去吃.........
口味真的很像吃粗飽.......
很多菜色沒有入味，就是吃調味料，
蝦子是煮過頭了嗎又乾又硬。
螃蟹還可以，用蒸的方式至少沒有腥味（可能當天的螃蟹沒有雷到）。
和牛可麗餅，整團肉都是騷味，咬第一口我就吞不下去了。
不要抱太大的期望，餐券價格吃星級buffet這樣調適一下，失望度不會太大。

我懷念沾美......"
 Y.C.東尼 C. ,https://www.google.com/maps/contrib/106122667794594258080/reviews?hl=zh-TW,4,True,157,喜來登大飯店十二廚，海鮮為主軸，比較沒有牛肉或是雞鴨鵝肉等，海鮮很新鮮、樣式也多，義式漁夫鍋式滿滿的波士頓龍蝦和蝦、魚肉等，誠意十足，旭蟹、三點蟹量也很充足、生魚片旗魚、鮭魚、鯛魚、鯖魚、手捲、花壽司，也都很新鮮，也可現煮台南擔仔麵、炸醬麵或是越南牛肉河粉、德國豬腳、熱狗、炸薯條、炸春捲、炸洋蔥圈等，而燙青菜顯得小家子氣了一點，另有湯品、海鮮粥。生菜沙拉、蛋糕甜點類十分充沛、水果多款、哈根達斯(Häagen-Dazs)冰淇淋、果汁飲料，還會再去消費。
 alice tseng ,https://www.google.com/maps/contrib/110119174634646628942/reviews?hl=zh-TW,5,True,114,服務親切，食材新鮮，但下午茶菜色略少，著重在甜點點心類，有兩個品牌多種口味冰淇淋也有抹茶口味霜淇淋～
 蓋瑞叔叔 ,https://www.google.com/maps/contrib/104697167017182822154/reviews?hl=zh-TW,5,True,236,EZ上面訂比較便宜唷，兩人含服務費才1700元😍，一人850元，餐點的牛肉跟印度料理好吃，甜點🍮更不用說，必吃！吃好吃滿，空間與座位也讓人很舒適，愉快的午餐😍👍🏻
 Vanessa ,https://www.google.com/maps/contrib/117819811962040186859/reviews?hl=zh-TW,4,True,71,"熟食區菜色較少，但味道還不錯。
生魚片好吃，但的蝦子不太新鮮，味道不太好。
湯的選擇有點少好可惜......
甜點還滿多種的，算滿甜的！有些看起來很漂亮但色素太多吃起來會怕拍的～
印象最深刻的是法式可麗餅，超好吃的，還有香草醬和巧克力醬可以加～
服務生態度非常好，收盤速度也很快！"
 張玉冠 ,https://www.google.com/maps/contrib/101659392987178011910/reviews?hl=zh-TW,4,True,18,服務動線有點亂，最後還是帶錯位，現在防疫期間食物是用得讓人很安心，豬肉很好吃，也有標示台灣豬
 漢晨 ,https://www.google.com/maps/contrib/109836185389932124389/reviews?hl=zh-TW,1,False,5,"整個餐廳從鹹食湯品飲料到甜點

只有可口可樂跟哈根達斯好吃….."
 乓董 ,https://www.google.com/maps/contrib/107067863945663857226/reviews?hl=zh-TW,2,True,412,"2011.10.11
感覺很糟
去年買的餐券因為疫情
拖延到最近想去吃結果十月分都客滿
餐券這個月就到期詢問是否有因為疫情延長餐券有效期
表示沒有

退款會再聯繫大概過了一個禮拜了
都沒消息

我也知道疫情大家都有影響
但因為疫情展延餐券對妳們影響會有比退款處理要來的困難嗎

退款還要跑程序還要彼此花時間處理
我很難理解妳們的處理方式

每次想到這件事情懸在心上
就很煩

------------
訂位也要排隊@@
坐過，最難坐的椅子，脖子好痠，一直想把腳擺到矮桌上，還是，它其實是墊腳木🙃"
 張竹萍 ,https://www.google.com/maps/contrib/112849734227702607498/reviews?hl=zh-TW,4,True,464,食材有改變！不錯👍疫情期間避免接觸感染！商家很是用心
 J ,https://www.google.com/maps/contrib/102861344203111532529/reviews?hl=zh-TW,3,True,110,有種甜品冰淇淋吃到飽的概念，熟食區不太吸引人，飲品的部分，泰式奶茶不錯喝，還可以自製鹹檸七，員工服務態度不錯！
 Ophelia Chen ,https://www.google.com/maps/contrib/113890295322599404608/reviews?hl=zh-TW,4,False,11,冷盤和生魚片意外好吃。有好幾種口味的沙拉可供選擇，令人驚艷。熟食也算精緻，大推燉牛腩和牛肉。美中不足的地方是甜點表現普普，布丁蛋糕類有點死甜，而且整體菜色選擇不多。考量到這樣就要一張小朋友的價位來說，CP值還好。
 林威威 ,https://www.google.com/maps/contrib/113912951104877483733/reviews?hl=zh-TW,5,True,597,海鮮選擇豐富，還有帝王蟹腳吃到飽，人手一盤，排隊要排很久，裡面幾乎每道菜都好吃，最普通是煎豬排，跟外面便當店差不多；冰淇淋是哈根達斯有8種口味，甜點美觀又美味，用餐時段人潮洶湧，建議先上網訂位，假日現場幾乎沒位子，平日中餐價錢比較划算很多，假日貴三成。
 豬血糕 ,https://www.google.com/maps/contrib/110400858528132570497/reviews?hl=zh-TW,1,True,73,"總類我覺得算多但有些就差不多的食材不同的料理方式
但口味上不及格☹️☹️☹️
不至於難以下嚥卻也無法激起食慾
幸好是買餐券
若是原價吃我現在應該躲在被子裡哭了😢"
 李建霖 ,https://www.google.com/maps/contrib/116634029384544713329/reviews?hl=zh-TW,4,True,180,"氣氛裝潢雖好，但座位稍嫌擁擠導致走道空間不夠，理解餐廳想追求營收最大化，但若確實犧牲了品質（看起來不少人抱怨）就得深思。
熟食部分，骰子牛挺少見的，子排挺不錯的，好吃。冷食中規中矩，炙燒鮭魚握壽司應該還是最好吃的一項，個人喜好。
湯，黑蒜頭雞湯與東石鮮蚵湯都很不錯，料豐味美又暖，但巧達湯就普普。甜點是最值得稱頌的，品項多、而且不少都滿新奇的，口味也頗為驚艷，以布丁與可麗餅居冠。
飲料部分，雖然果汁、茶、咖啡都算是基本配備，但鹹檸七DIY與能自己做鮮奶茶、控制蔗糖糖漿與鮮奶的量，不錯的設計。
以12廚的價位，若能漸漸淘汰評價不佳的餐點，多加入一些創意、特別的品項，品質是能更上一層樓的。"
 lilian kuan ,https://www.google.com/maps/contrib/115448809256598032753/reviews?hl=zh-TW,4,True,226,"餐點樣式不多，但有幾項還是很有特色，
最喜歡雞肉粥，入口濃密香滑，
烤牛肉鮮嫩，義大利燉飯很道地，
可惜冷盤類就表現平平。"
 北科馬龍 ,https://www.google.com/maps/contrib/116602019424497307562/reviews?hl=zh-TW,4,True,154,跟一般的buffet差不多，中規中矩，菜的樣數個人覺得偏少一點點，生魚片切的有點小片，甜點比較多樣化，還不錯。
 楓 ,https://www.google.com/maps/contrib/110917177477360059836/reviews?hl=zh-TW,3,True,69,餐點ㄧ般，還行，但是甜點舒芙蕾吃到底部有點焦
 June Yang ,https://www.google.com/maps/contrib/114907847530695161683/reviews?hl=zh-TW,4,True,445,"整體體驗不錯
缺點是假日人潮較多
一開始拿食物需要排隊
生魚片好吃"
 兒詩 ,https://www.google.com/maps/contrib/114715909903565945468/reviews?hl=zh-TW,3,True,216,骰子牛肉最佳，涼拌魚皮可口，生鮮螃蟹龍蝦，湯品跟生魚片略少，甜點豐富精彩。很想給滿分但這價位cp值太低。
 陳淑紋 ,https://www.google.com/maps/contrib/116479222218236796242/reviews?hl=zh-TW,3,False,146,服務態度良好，東西好吃，但我們是三個人一起去吃下午茶結果卻把我們分很開，開二桌二人坐，就變成有一個人自己一人吃，感覺不好。
 莊阿宏 ,https://www.google.com/maps/contrib/106065436608503890758/reviews?hl=zh-TW,4,True,176,空間夠大，吃得樣式沒有到很多，但是還不錯！！價格算偏貴990左右！！
 Wesley Lee ,https://www.google.com/maps/contrib/101896353253941736477/reviews?hl=zh-TW,3,True,654,"已經存在許久，算是大老級的飯店餐廳。

上一次來訪大概是10年前，是人山人海大排長龍還需要預定的12廚自助餐。這一次來是前晚訂位，現場還有一些些空位，可見有一點沒落。

食材部分，下午茶的確比較少品項，德國豬腳與烤牛肉是大菜，但口味欠佳且量給的有點不足，排隊的動線也不是很好，生魚片的部分也是切好後自取，小小一塊的四種魚類，口感一樣一般般，價格上790元有點不符。

冰淇淋有兩種口味，點心甜點的部分比較豐富，飲品部分也還好，若要比較，天天排隊的晶華下午茶可以明顯分出高下，價格也差不多，綜合以上給3星，希望未來能有進步。

Ps喜來登二樓餐廳超棒。"
 阿瑋 ,https://www.google.com/maps/contrib/114381009313494421683/reviews?hl=zh-TW,2,True,296,"當天是選擇假日下午茶時段來用餐
一個成人價格880＋1成服務費
吃完之後其實覺得有點失望
整體並沒有網路上大家狂推的那麼棒
就連原本最讓我期待的甜點區都有點空虛😭
不過牛肉湯的滋味就蠻美味的
生魚片選擇不多，牛肉有嫩
熱炒部份也不到驚艷的感覺
至於飲料就更免說了，也沒太多的選擇😂"
 李丞祐 ,https://www.google.com/maps/contrib/102702653952703863516/reviews?hl=zh-TW,1,True,48,"非常難吃
沒看過實物這麼少的自助午餐
以近代自助餐
所有品相除了甜食以外都過少
尤其是晚餐時間熱食只有一排
種類又少
生魚片魚種少就算了
感覺還是很低等級的魚肉
比其他飯店的硬深深的小一半
我是沒看過這麼小片的生魚片啦😭
這價格完全對不起啊

把蟹做各種調味
蝦也不是我喜歡的
感覺也不是活蝦下去煮的
好難吃
真的淒慘無比

其他的食物
就是一些很普遍的菜色
但對我來說自助餐就是至少要吃到
一兩樣你會喜歡的驚艷的食物
但這間完全沒有

還有就是他是我看過用餐環境設計最差的吧
東一塊西一塊
用餐起來還要去看看那邊是什麼
雖然感覺是總空間不足啦
如果可以給負分我一定給👍

甜點也沒特別好吃
整體吃起來
整體感覺停留在十年前提供的感覺
只更新了裝潢食物卻沒更新的感覺
但價格趨於隨著趨勢而漲
但裝潢也沒比別家厲害
到底怎麼當天這麼多人去吃"
 莎菈 ,https://www.google.com/maps/contrib/107501453662745845787/reviews?hl=zh-TW,4,True,60,整體感覺還不錯，貼心的提早一天來聯絡，桌次坐位安排寬鬆舒適，菜色尚可，每人有半隻的龍蝦，若再增加些菜色會更好！（照片只是部分區域，尚有其他區）
 Vicky Wu ,https://www.google.com/maps/contrib/108146504052445741503/reviews?hl=zh-TW,3,True,251,"味道有點重，回家喝很多水。
龍蝦漁夫湯，蠻實在的。也有燙青菜跟甜點。
肉食主義者可以多吃。"
 Wayne Lai ,https://www.google.com/maps/contrib/101404218720277235303/reviews?hl=zh-TW,5,True,70,"喜歡這邊的洋蔥燻鮭～光吃這道就飽了！
露天開放空間整個很開闊～但是燈光好像又不夠浪漫！離開胃菜區近，可惜離主食地方遠了些。
整體吃到飽來說食材可以接受，主食有各國料理也美賣唷👍👍"
 Jack K. ,https://www.google.com/maps/contrib/102121940273859343178/reviews?hl=zh-TW,5,True,74,"看起來是每季都會換菜單
每次來都會發現不同驚喜
這次是和牛可樂餅，以及涼麵
涼麵好吃到掉淚，如果可以外賣的話就太好了"
 catlinging ,https://www.google.com/maps/contrib/116288716093836949604/reviews?hl=zh-TW,4,True,825,"鄰近捷運善導寺站，2號出口出來直走一分鐘~在喜來登飯店內，入門口後左轉直走約十秒抵達餐廳入口。

氣氛佳，位置多，建議預先訂位。餐券(分平日或假日:星五晚/六日)最晚在消費當天的前日買，一次要買十張，餐券免服務費。壽星有優惠，因會隨時變動壽星優惠，建議事先電話詢問~

主菜有帝王蟹，三點蟹，煙燻鮭魚，生魚片(鮭魚，鮪魚，鯡魚等)，中卷，淡菜(原味跟焗烤)，牛肉(牛鍵，澳洲牛，切的牛排)，羊肋排，煎鮭魚下巴，蝦子，手捲(鮭魚卵，蝦子，蘆筍)等。

另可以請廚師幫你煮麵，冬粉，河粉，加點小菜。

湯品有牛蒡雞湯，玉米濃湯。

小菜有茶碗蒸，珍珠丸，奶黃包，炒蔬菜，生菜沙拉區，水果區(葡萄，西瓜，葡萄柚，柳橙，芭樂)。

飲料有咖啡機，茶包組(烏龍茶，大吉嶺茶等)，果汁(冰水，西瓜汁，蔓越莓汁，花香蜂蜜水),有附肉桂粉~!

甜點種類很多，可麗餅(廚師現場製作，原味，草莓，巧克力口味)，可麗露，各式蛋糕，黑糖蕨餅，法式麵包(有小起司盒，烤麵包機，要吃多少自己切)，泡芙(餡料在旁自己加)，馬卡龍，Haagen-Dazs冰淇淋8種口味。

餐廳內有麵包店，在喜來登飯店內消費，購買麵包都可享9折。

餐點享用快結束時，服務人員會到位置區收取費用，整體服務很周到，會一直到各桌收盤子，維持著笑容服務。

基本上用餐挺愉快的，談天放鬆啖美食。用餐環境舒適，離美食區較遠處的位置較不易被打擾，未來有機會會再訪~"
 Tina ,https://www.google.com/maps/contrib/105872729546685058503/reviews?hl=zh-TW,3,True,"1,025",環境不錯，鹹食種類一般，吃起來普通，牛排有些部位太肥，唯羊膝和生魚片不錯，非常推薦甜點，飲料種類也較少選擇，西瓜汁不好喝。
 PEI CHI LU ,https://www.google.com/maps/contrib/101351279119511954293/reviews?hl=zh-TW,1,True,56,"菜色不多、調味非常重
難以想像鐵板燒的大蝦沒有去腸泥
鬼頭刀跟牛排硬到像石頭
只有炙燒壽司跟鮭魚重複拿了
雞湯壽喜燒也還不錯
壽星禮是甜點區就有的小檸檬塔+畫盤
雖然是附贈服務但實在是沒有任何一絲讓壽星覺得自己特別的感覺
吃飽隔天拉肚子拉了一整天到現在還在拉
還差不多把食物全吐了不會回訪"
 Wen ,https://www.google.com/maps/contrib/112358278511244591629/reviews?hl=zh-TW,3,True,821,"螃蟹很小一隻，德國豬腳肉沒什麼香氣，印度烤餅很硬，披薩&炒麵也都soso,最失望的是甜點區。"
 Queenie ,https://www.google.com/maps/contrib/104127894217344037673/reviews?hl=zh-TW,4,True,335,用餐前有上網看一下評論，果然感受跟大家評論的一樣，場地動線規劃不好，樣式也不多，但餐點口味還不錯，算是新鮮，只是CP值不高。
 Monica Wu ,https://www.google.com/maps/contrib/116353839059534960248/reviews?hl=zh-TW,4,True,372,下午茶CP值頗高
 Babel Chang ,https://www.google.com/maps/contrib/105678530664011891380/reviews?hl=zh-TW,3,True,362,環境整潔明亮、餐點多樣（只是比較不合個人胃口）
 fish l ,https://www.google.com/maps/contrib/104575136889793308954/reviews?hl=zh-TW,3,True,513,"類別：自助式美饌(五星級飯店餐廳)
餐點：分幾區:前菜(有生菜沙拉/冷食).熟食熱炒(牛排/麵點/中式熱炒)甜點區(鬆餅/小蛋糕/手工餅干/冰淇淋/水果)飲料(茶/果汁/咖啡.等)
餐點算多樣.但實際口味並沒有很吸引人.熟蝦可以.撒子牛太老.蟹有腥味.讓我有點失望.
甜點區算精緻.有提供可麗捲餅(軟式)和許多一口小餅干.馬卡龍不合我標準(我是馬卡龍控)冰淇淋是哈根達斯.喜歡的人可以盡情享用
咖啡就很不及格.(個人愛單品好咖啡.)
環境：寬敞明亮
服務：親切迅速有水準
價位：1000左右請看官網
其他：前2週剛享用了另一酒店的港式/中式餐點.相對比之下.還是茖差很多.畢竟有價差但喜好多樣化的還是可去嚐試每一個人口味不一樣或許會有不同驚喜"
 YiChia Lin ,https://www.google.com/maps/contrib/118080507796890663027/reviews?hl=zh-TW,4,True,879,東西種類還可以，但是美味程度只能說中等程度....CP值略低
 Tommy ,https://www.google.com/maps/contrib/111204314645120534398/reviews?hl=zh-TW,3,True,"2,564","以前有信用卡買一送一划算很多
後來一直漲一直漲
味道也每下愈況
以前真的比較好吃阿
甜點也是越來越差了"
 郭致驊 ,https://www.google.com/maps/contrib/101496275462363663369/reviews?hl=zh-TW,5,True,93,服務很好的老牌飯店，12廚8/12還在整修中，早餐移到地下室，沒有現煎歐姆蛋，只有擔仔麵
 Collina Lee ,https://www.google.com/maps/contrib/101809233678518255596/reviews?hl=zh-TW,4,False,10,"地點方便，捷運出口上來就是。
餐點其實除了海鮮(排隊的人實在很多)，熟食區的魚類也是不錯，令我驚訝的是豬排意外好吃！比起牛排帶筋的口感，豬排算是相當滑嫩。
甜點推現做的法式薄餅，冰淇淋是Haagen-dazs的這點也很讚！

另外，我個人想說有些吃自助餐的人，可以注意一下素質嗎？不是說不能挑自己愛的菜夾進自己盤內，但可以看準再出手啊！食物被你東翻西翻、挑挑撿撿的，這樣感覺很糟耶…
每次看到這種人，還是不認識的，都只好自我反省一下…

祝大家用餐愉快。"
