user_name,user_profile_url,rating,local_guide,comment_num,comment_text
 fjack1026 ,https://www.google.com/maps/contrib/115851646282291485906/reviews?hl=zh-TW,4,True,57,桌子小了點，餐點有一定水準，只是沒有特色記憶點
 Jolin Cau ,https://www.google.com/maps/contrib/111572012471853520480/reviews?hl=zh-TW,5,True,230,樣式算多下午茶非常划算唯一需要改善的是蝦子沒有蝦味不是非常新鮮有點可惜用餐環境非常舒服服務也很好
 唐佩鈴 ,https://www.google.com/maps/contrib/115568328275697038709/reviews?hl=zh-TW,3,True,173,東西不難吃，選擇性少了點！
 LEE ,https://www.google.com/maps/contrib/117182959990110974985/reviews?hl=zh-TW,4,True,222,跟以前比味道退步蠻多的然後冰很硬不好挖
 Fen Cheng ,https://www.google.com/maps/contrib/102110749426544993724/reviews?hl=zh-TW,4,True,107,假日午餐時段，食物供應充足，選擇多樣化，只是甜點沒有以前優。
 林宥蘋 ,https://www.google.com/maps/contrib/105354541642882420205/reviews?hl=zh-TW,5,True,163,菜色多又美味！！尤其是現泡牛肉湯😋
 陳宏毅 ,https://www.google.com/maps/contrib/116981310983303475927/reviews?hl=zh-TW,2,True,73,"吃那麼多自助餐廳，這家的感覺是最差的。菜色少的可憐，生魚片鮮度不佳，牛排筋多難咬。
海鮮吧就是魷魚圈，淡菜，蛤蜊，小螃蟹。
失望透了。"
 吳Bella ,https://www.google.com/maps/contrib/114263661744859560500/reviews?hl=zh-TW,4,True,36,樣式有點少，菜色不是很多。螃蟹很小隻。
 鄭羽哲 ,https://www.google.com/maps/contrib/104716723627350809726/reviews?hl=zh-TW,4,True,23,"時段是晚餐吃到飽1290+10%

最喜歡帝王蟹腳還有照片的大蝦
其他餐點也普遍都不錯
水果很甜好吃
不太會有食物缺很久不補的狀況，補蠻快的
整體算是值回票價"
 welly1101 ,https://www.google.com/maps/contrib/112648256615603694775/reviews?hl=zh-TW,2,True,86,生魚片不新鮮；淡菜太鹹；牛肉過生，回烤又過老；食材選擇不多，菜色不夠豐富。
 黃聖傑 ,https://www.google.com/maps/contrib/117117835879488878516/reviews?hl=zh-TW,5,True,81,"環境不錯
花樣也不少
值得來吃"
 唐三三 ,https://www.google.com/maps/contrib/105593418542893134623/reviews?hl=zh-TW,2,True,184,"Excuseme?我以為這裏是五星級的飯店
地板黏黏的讓我想起了海X天，餐盤拿起來五個有三個不乾凈，餐點普通，甜點也是。如果要說有什麼優點，就是成本控制(給客人感覺)做得很好，餐盤收得很快。這種品質就算降價了也不想再來"
 jerry93158 ,https://www.google.com/maps/contrib/102058056947080055859/reviews?hl=zh-TW,3,False,7,食材普通、品項太少，以1859這個價位來說不算划算。
 JAY KANG ,https://www.google.com/maps/contrib/104615633502655249457/reviews?hl=zh-TW,2,False,11,龍蝦“殼“盛宴，都是殼，其他餐點種類少，連紅豆湯都不好吃，1690+10%很差的體驗
 陳嘉旻 ,https://www.google.com/maps/contrib/101813875491968396462/reviews?hl=zh-TW,4,True,302,覺得以晚餐1000多的價格，並沒有真正符合的cp值，現做可麗餅和生魚片牛排不錯，其他普普
 Canny Lin ,https://www.google.com/maps/contrib/104521270751678387659/reviews?hl=zh-TW,3,True,364,"CP值偏低
稱不上好吃
就是能吃😂"
 Yiwen Pan ,https://www.google.com/maps/contrib/115970927737254247664/reviews?hl=zh-TW,5,True,82,服務人員非常禮貌得體並且很親切、甜點選擇豐富。
 Lin Dana ,https://www.google.com/maps/contrib/104570237398065611175/reviews?hl=zh-TW,3,True,32,早餐蠻好吃，不過好多人啊，8點下去就已經排很長的隊
 游宗霖 ,https://www.google.com/maps/contrib/101075433668612623093/reviews?hl=zh-TW,2,True,14,沒龍蝦，沒澎湖海產，舒芙雷小哥太沒效率...，不推
 Peter Huang ,https://www.google.com/maps/contrib/101201948317510931495/reviews?hl=zh-TW,3,True,319,"週六晚間時段去吃。
當第一批晚餐人龍消化掉以後，有些菜就不補了，像是帝王蟹、煙燻鮭魚、烤羊排、茶碗蒸這些才八點菜盤就是空的在那邊，只好放棄改吃甜點。
直到晚上九點多帝王蟹跟煙燻鮭魚才補出來，這是要給誰吃？很多人都已經離席了。
雖然信用卡有折扣，但下次不會考慮..."
 鍾小慧 ,https://www.google.com/maps/contrib/114322002271496727245/reviews?hl=zh-TW,5,True,130,菜色不錯，豐富好吃
 周玉奇 ,https://www.google.com/maps/contrib/101128435396762884924/reviews?hl=zh-TW,2,False,16,"以前我認為所有buffet中,十二廚最優,現在我覺得應該不值得吃了,最近吃的一次,種類少到拿兩盤就沒甚麼好拿的了,是經營換人了嗎?怎麼那麼變成那樣,只有半隻龍蝦療慰失望!"
 Cyanine Huang ,https://www.google.com/maps/contrib/106343975538457141499/reviews?hl=zh-TW,5,True,30,"每一道菜都可以感受到廚師的用心
尤其是這邊的甜點，其中又以芒果奶酪為佳，第一次吃到芒果奶酪用真芒果醬，不是化工味。"
 Ying Nung Chen ,https://www.google.com/maps/contrib/115808526457332495634/reviews?hl=zh-TW,3,False,5,海鮮不夠新鮮，晚餐收餐盤速度偏慢，味道普通。
 關里歐 ,https://www.google.com/maps/contrib/106834053877974915757/reviews?hl=zh-TW,3,True,225,晚上用餐卷來吃，跟饗饗比較有差，雖然知道兩邊價位不同，但餐點種類覺得還好，不會覺得有比較划算的感覺
 陳思樺 ,https://www.google.com/maps/contrib/105996483006401559920/reviews?hl=zh-TW,2,True,27,"這大概是我們家人一起聚餐，吃過CP直最低的buffet….😖
1.龍蝦不新鮮，吃起來粉粉的，而且腥味很重，每個人限量半隻憑牌拿取，我們四個人一起去吃，都吃了1-2口就都不吃了。
2.甜點馬卡龍只有吃到甜死人，其餘改有的香氣，都沒有。唯一好吃的甜點，巧克力烤布蕾。
3.牛肉乾柴…
4.土瓶蒸好喝
5.餐點唯一好吃～只有烤肋排～
這次是吃免費的餐卷～
下次再免費，我也不會再來吃"
 李美惠 ,https://www.google.com/maps/contrib/117467665891934180034/reviews?hl=zh-TW,2,False,4,"一人半隻龍蝦，肉質不Q,沒彈性，味道普通，無驚艷。越式河粉、擔仔麵都不入味，湯頭風味不足，炸物種類不多，有紅豆湯、湯圓，整體感覺cp值低，短期不會再訪"
 Peggy Lin ,https://www.google.com/maps/contrib/105529612858520902031/reviews?hl=zh-TW,3,False,7,好令人失望的下午茶，菜色少又不精緻～
 林侑萱 ,https://www.google.com/maps/contrib/117265668197523297617/reviews?hl=zh-TW,5,True,108,貼心的服務，餐點品質好，推薦親朋好友聚餐可以預先訂位。
 Emily Chang ,https://www.google.com/maps/contrib/108440091797859073268/reviews?hl=zh-TW,1,False,18,"這輩子第一次給一顆星，真的是要勸誡各位
28年來第一次食物過敏，就是在這吃了龍蝦
吃完差不多五分鐘內喉嚨超癢呼吸急促臉還起了一些些疹子
好在朋友隨身攜帶過敏藥趕快吃了過一小時左右症狀緩解
因為是公司聚餐不想破壞氣氛，加上從來沒有食物過敏過，所以當下也沒反應過來
但龍蝦除了我以外同桌同事也表示不新鮮有腥味
白蝦和肉也不新鮮很柴，完全沒有值得推薦的地方，一星都是給多了"
 Kim Tseng ,https://www.google.com/maps/contrib/115702465263604492663/reviews?hl=zh-TW,3,True,29,食材普通，環境乾乾淨淨，現主打無限吃螃蟹（大約3-4種），一人可領半隻龍蝦。平日晚餐時間8-9成滿，需要先預訂。
 Valentino Li ,https://www.google.com/maps/contrib/101045855299559405934/reviews?hl=zh-TW,1,True,163,"你在排隊嗎？這種價格...真的不用去~

一試成絕響！
見面不如聞名！！

202201週末午餐
服務，5顆星
食材....
烤鴨NG...聽說隔壁廳的烤鴨米其林三星
有麵包蟹，1隻OK，1隻NG
水煮蝦，很大隻，吃起來NG~柴
沒有雪蟹、沒有明蝦、沒有佛跳牆
龍蝦，一人半隻...也是難吃，不知道有啥好高價的！
難怪最近看評價已經到3.8顆星了！！"
 邱老師 ,https://www.google.com/maps/contrib/108176751659467468599/reviews?hl=zh-TW,5,True,270,豪華寬敞，服務親切，聚餐下午茶的首選。
 郁璉 ,https://www.google.com/maps/contrib/114720817334394082277/reviews?hl=zh-TW,3,False,4,覺得十二廚的生魚片區廚師服務態度不是很好，喜來登是5星飯店，吃飯收了那麼多錢種類也沒很多，cp值也非常普通，應該得大方一點才有更多顧客去光臨啊！同桌的只是想吃刺身的其中一個種類，因為其他種類不敢吃，廚師就說沒有這種選項？難道要直接拿了你們綜合，然後浪費你們才滿意？
 Nova Lu ,https://www.google.com/maps/contrib/107449715772153822348/reviews?hl=zh-TW,2,False,33,河粉未煮好就給你，每人一份龍蝦的料理很讓人失望，因下午茶時段標榜與晚餐相似，漲價500元大幅減少了人潮，但餐點也不值這價位！
 Joyce ,https://www.google.com/maps/contrib/101758597916142126561/reviews?hl=zh-TW,4,True,85,只能說是被甜點耽誤的龍蝦餐。甜點棒其他熱食也還可，主題龍蝦只有半隻不好，不過我還是飽到天靈蓋。
 yhn 3437 ,https://www.google.com/maps/contrib/116019630582970333168/reviews?hl=zh-TW,1,False,12,各大自助都有吃過喜來登真的退步很多變成最難吃沒一個東西好吃沙拉品質跟外面我家牛排可能都比不過熱食種類很少海鮮過熟炸物的薯條大概是我人生吃過最難吃的濃湯放太多松露就算了還一堆麵粉結塊的口感生魚片不新鮮牛排煙燻味很重豬肋排也不入味肉也不好甜點冷的口感完全沒有湯品區的廚師還在講髒話聊天我通常不會嫌東西難吃的這次被大雷到說好吃的我真的不相信😂
 Hiking ,https://www.google.com/maps/contrib/117102322929548755481/reviews?hl=zh-TW,1,True,38,"豬肋有肉腥味，適合喜歡肉味重的消費者。
蒜蘇羊排溫度偏低，適合喜歡偏冷食物者。
冷菜與價位只有1/3的吃到飽火鍋連鎖類似，例如螺肉、胡麻龍鬚菜。
煙燻鮭魚搭配胡椒鯛魚一起擺盤，與一般自助餐多為純煙燻鮭魚冷盤不同。
蛋糕類甜點的蛋糕體孔洞很大，口感偏粗，也乾。
可麗露、吉拿棒、泡芙等每一種的外層都偏韌，適合喜歡口感韌的消費者。
奶酪吃起來偏Q，奶味及綿密感不高，比較像布丁，適合喜歡這類口感的消費者。"
 曾裕文 ,https://www.google.com/maps/contrib/118246706805687480940/reviews?hl=zh-TW,4,True,321,龍蝦排隊大約8-10分鐘蝦體不大切成塊狀多數人都拿走肉身以致後來留下一大堆蝦頭比較驚艷的是甜點區五花八門
 Siam Zeng ,https://www.google.com/maps/contrib/107376902109942229715/reviews?hl=zh-TW,1,False,10,"種類不多連主打的澎湖海鮮
小卷也太軟爛"
 Brian Chiu ,https://www.google.com/maps/contrib/112269684015459874388/reviews?hl=zh-TW,1,True,72,"我只能慶幸餐券是朋友贈送，一顆星是給辛苦的服務人員，一間星級飯店提供這樣的晚餐自助吧真的應該要檢討改進。

正餐東西少、口感普通、動線安排不佳、燈光昏暗，如果是喜歡甜食的人或是經營下午茶尚可，晚間用餐提供這樣的餐飲服務真的讓人不敢恭維。

尤其在飯店挑空區用餐只在中間放一顆樹形狀的東西當燈源讓我想到在東南亞大排檔夜市用餐的環境。"
 牛奶喵milkmeow ,https://www.google.com/maps/contrib/102212081742374651455/reviews?hl=zh-TW,1,True,32,"2/23下午14:55左右在排下午餐買一送一活動時，站在電梯附近幫前一排客人解說的黑衣白皮膚沒戴眼鏡的男服務人員，態度有夠差勁！我很有禮貌地上前詢問，竟然用命令口氣責怪我應該自己去找排隊位置。
我是覺得身為外場人員就應該要有應有的服務態度！我知道買一送一的活動推出會讓很多客人前來用餐，但自己要做外場就要有禮貌啊，領薪水是領假的嗎？十二廚的主管職人員應該都有好好教吧？不要請這種會讓喜來登丟臉的員工好嗎！讓我在大庭廣眾之下出糗，為何有勇氣用服務人員的身分來這樣對待客人呢？
強烈建議這件事情應該要處理，十二廚跟喜來登都是大招牌，不要被一顆老鼠屎砸壞了！

以上評論為男友撰寫，本評論僅針對該服務人員，其他人員以及食物都很棒，不要讓老鼠屎壞了一鍋粥，謝謝"
 李明蓉 ,https://www.google.com/maps/contrib/101521143092521784685/reviews?hl=zh-TW,5,True,26,目前吃過，c/p值最高，食材新鮮，料理得當
 Lan Lee ,https://www.google.com/maps/contrib/100384773893884616444/reviews?hl=zh-TW,3,True,151,"現烤鬆餅，喜歡不加蜂蜜，奶油👍
烤布丁...無法用言語形容的口感😅"
 花姑娘 ,https://www.google.com/maps/contrib/112635826740466217848/reviews?hl=zh-TW,5,True,307,物超所值，食材新鮮，甜點精美，很適合家庭聚餐，公司聚會，推！👍👍👍
 James Fang ,https://www.google.com/maps/contrib/105820681222025299456/reviews?hl=zh-TW,1,False,7,晚餐很普通，不好吃。明顯差晶華一大截。
 羅玉枝 ,https://www.google.com/maps/contrib/110693861750467680700/reviews?hl=zh-TW,3,False,2,失望！十二廚之前的點心台很好吃，可是今天的點心類讓人失望。點心房師父，請看一下圖片，這樣的馬卡龍及格嗎？脆，不帶濕潤，不黏牙⋯其它品項就不一一點名了。3星是給外場的服務人員，她收了我的意見卡後，告訴我，一定會轉交給主管。
 李源枝 ,https://www.google.com/maps/contrib/108891445266473408951/reviews?hl=zh-TW,4,True,577,"還可以
但今天的海鮮不甜（鮮）"
 Liao如珊 ,https://www.google.com/maps/contrib/106559648582415764455/reviews?hl=zh-TW,3,True,87,"自助餐吃到飽【很飽】
分熱食/冷食/點心/冰淇淋/熱飲機器/冷料櫃

食材熱食種類還好，
我一直去舀(湯區)為多，有六甕種類…雞湯/味增魚湯/山藥雞湯…"
 江秀珊 ,https://www.google.com/maps/contrib/104529790906641523043/reviews?hl=zh-TW,2,False,6,"沒什麼好吃
生魚片種類超少蝦子吃起來粉粉的熟食部分也沒有好吃的進去吃不到半小時就不知道要吃什麼...
服務費加起來1600多還不如吃欣葉或再貼錢吃饗饗"
 范博崴（有點台的茶） ,https://www.google.com/maps/contrib/110003954821621446581/reviews?hl=zh-TW,4,True,144,2020/10/17來吃十二廚下午茶，食物、食材豐富，大家可以在下午的時候來嚐嚐喔
 owl yang ,https://www.google.com/maps/contrib/100207388499381590432/reviews?hl=zh-TW,3,True,52,"當天主題有龍蝦很期待可是吃了不如預期腥味很重肉質太硬主打的有點要加強
但其他餐點還算不錯菜色也多甜點超甜要配咖啡適合"
 鄭selina ,https://www.google.com/maps/contrib/116312600387246072916/reviews?hl=zh-TW,1,True,41,"菜色超少超級爛
熱食的菜色20道以內
主打龍蝦還都煮超老
螃蟹肉也都粉粉的
連基本的鮭魚生魚片都沒有
花了1600多完全不知道自己在吃什麼
第一次體驗到什麼叫吃到飽沒吃飽"
 更營養節拍 ,https://www.google.com/maps/contrib/109527951236516243756/reviews?hl=zh-TW,3,True,137,麻辣小龍蝦新鮮肉質Q彈，我的最愛。龍蝦三明治就還好。
 timvinny Chen ,https://www.google.com/maps/contrib/111344402175963929295/reviews?hl=zh-TW,1,False,4,過年期間去吃的，一人2千多給這樣菜色令人傻眼。人員服務不錯，但菜色選擇跟品質實在不ok，外面非常多店可以屌打這間，會對這間的食物高分評價只讓我覺得是很少在外面吃的人或是是找公關公司洗的，總之，食物體驗極差，人員服務很好
 Cindy Chen ,https://www.google.com/maps/contrib/112915450244642939556/reviews?hl=zh-TW,3,True,149,多年前吃過覺得還不錯，這次再去覺得很空虛，以後大概不會考慮了
 神之毅 ,https://www.google.com/maps/contrib/113834804271126421594/reviews?hl=zh-TW,3,False,76,"食物不錯吃
但是太貴食材高檔程度沒跟上"
 Chen Chan ,https://www.google.com/maps/contrib/108081809213788565958/reviews?hl=zh-TW,4,False,15,食材多樣、價錢小貴、環境不錯，總體而言算中上
 李侑穎 ,https://www.google.com/maps/contrib/113396239114318116044/reviews?hl=zh-TW,2,False,10,"客單$1600沒有超值感覺雖然噱頭有龍蝦
感覺就是不新鮮的熟凍龍蝦半隻成本大概200塊
食量大的我也吃差不多$600"
 刀槍blue ,https://www.google.com/maps/contrib/114570104825115011962/reviews?hl=zh-TW,2,True,405,一個人晚餐1690真的不值得。三級疫情過後又漲價龍蝦品質普普龍蝦又沒吃到飽海鮮類偏少整間甜點評價比正餐高唯一喜歡的就是裡面的甜點兩顆星是給甜點的三大兩小吃起來七千多可以去吃中高極套餐了
 Light Chen ,https://www.google.com/maps/contrib/110260776254358424969/reviews?hl=zh-TW,5,False,18,"用餐時段：10/15週五晚餐
我們是來吃蟹的，先切入重點：雪蟹非常鮮甜好吃！
用餐環境舒適，菜餚種類不多，但都有相當水準，調味口味大都很棒。
雪蟹腳：其實還包含蟹身，有分熱食與冷食，熱食較鮮甜；冷食碗裡有放淡菜，有點多餘。總之雪蟹非常好吃！
奶油黃金蟹：調味很棒很好吃，蟹身鮮甜Q彈，可惜蟹腳較為乾柴。
沙公：當天的非常不新鮮不好吃！
龍蝦：每人半隻，肉質軟軟的不好吃。
無錫排骨：非常好吃！
爐烤牛排：現切，非常好吃！
甜點：奶酪非常好吃，其他普通。
沙拉：盒裝好吃，但鮭魚只有一片太少啦～
一品雞湯：不合口味
草莓：不甜普通
其餘像啤酒、飲料、咖啡、哈根達斯、現煎扁鱈魚、佛跳牆、羊排、冷菜午魚都很好吃～
東西雖然不多，但也沒辦法全部吃到。
吃自己喜歡吃又好吃的東西，才是最好吃的！"
 seymour chang ,https://www.google.com/maps/contrib/101033166975932353495/reviews?hl=zh-TW,4,True,247,就不錯，還可以更進步吧，龍蝦一點都不好吃，難怪買一送一，一輪之後，完全沒有人排隊了，龍蝦太小，沒啥肉
 周俊宇 ,https://www.google.com/maps/contrib/113104569797219252449/reviews?hl=zh-TW,4,False,15,"尚有進步空間
CP值未達個人標準
1600價位我可以有更好的選擇"
 eLaine chen ,https://www.google.com/maps/contrib/116457473358235295746/reviews?hl=zh-TW,2,True,12,"我其實很少主動寫評論
但這是我第一次想回饋
12廚的服務人員的服務100分
謝謝你們真的很棒謝謝

但~
龍蝦肉是硬的
排骨肉是柴的
牛排~沒有味道耶
螃蟹肉有點沙沙的
真的有點可惜

但~甜點有厲害
只給2顆星真的是對熱食有失望呵呵~~"
 鄭玄德 ,https://www.google.com/maps/contrib/115016595873277559844/reviews?hl=zh-TW,3,True,17,"12/8午餐龍蝦半隻，每人限取一份。牛肉部分肉質鮮嫩，有薰烤香味，但肉有一半熟度近沒熟太軟咬不斷。很可惜，廚房人員服務有點不認真，到前面還沒主動要夾，且也不能指定要那塊肉。
哈根達斯只有四桶，香草，草莓，哈密瓜，巧克力。
自動啤酒機，蠻炫的。
甜點很多，但幾乎是螞蟻人最愛。有點甜。"
 jun7610310 ,https://www.google.com/maps/contrib/107699704834308183027/reviews?hl=zh-TW,3,False,21,"下午茶時段
沒有炸蝦、與牛排有點失望"
 Chaya ,https://www.google.com/maps/contrib/101277512491625940801/reviews?hl=zh-TW,5,True,65,"超級完美
蟹腳超級好吃，鮮甜肥嫩
甜點現點現作一級棒啊"
 warner chen ,https://www.google.com/maps/contrib/108273336925480332545/reviews?hl=zh-TW,5,True,25,"第二次來這用餐,服務一如以往的好,菜色也是有豐富的變化,也許讓想品嘗多種

菜色美食的人,是很棒的選擇"
 趙阿旎 ,https://www.google.com/maps/contrib/106904454893404531730/reviews?hl=zh-TW,5,False,9,"今天吃下午茶，以下午茶的價位來說很滿意。

入場服務人員帶位快速，時間到了很快就可以入場，中間用完的餐盤收拾速度也很快。

每樣菜都會裝成小盤供拿取，覺得衛生又美觀！
（但是的確如其他人評論，部分菜色可能會稍微冷掉，不過這部分我可以接受）

品項雖然少，不過幾乎每一樣都很好吃！

另外有人反應打電話都不接，我自己是每通電話都響很久，不過最後一定能夠接通！"
 Monica Huang ,https://www.google.com/maps/contrib/113026546468530348322/reviews?hl=zh-TW,3,True,535,和家人來這裡聚餐，現在已經沒有帝王蟹腳大大的失望
 liu lisa ,https://www.google.com/maps/contrib/103730321387378242876/reviews?hl=zh-TW,4,True,51,疫情後來吃，分盤料理，連醬汁都調妥，吃起來特別對味!謝謝餐廳的用心!特別值得一提的是辰園的干貝雞湯，幾乎是我喝過湯汁最鮮美的，不愧是星級料理!但餐廳一直主打的現做舒芙蕾和北海道草莓泡芙則令人失望；舒芙蕾外皮和內餡都因為預烤和復熱，到我餐桌已經變成外枯乾、內微涼的怪異口感，還好旁邊搭配的奶油處理得輕爽宜人，才勉強可以入口；北海道草莓泡芙也有同樣的問題，派皮已經枯乾、難咬，失去酥脆感，只能直接丟棄，甚為可惜!但整體而言，因為鹹食的突出表現，還是美味的一餐!
 Jenny Zhou ,https://www.google.com/maps/contrib/100835577944580679997/reviews?hl=zh-TW,1,False,1,蝦、蟹、龍蝦都不新鮮，無彈性且分其它食材普通，實在無法接受$1690加一成的高價位，五個人吃了將近一萬元，有被坑的感覺，失望至極，以後不會再去。
 莊日月中心 ,https://www.google.com/maps/contrib/109319903615637598325/reviews?hl=zh-TW,1,True,614,晚餐一千三百多，吃到八百元菜色內容，口碑干貝雞湯沒有，印尼龍蝦半隻還孖仔小蝦，既然貴五星級酒店無視評價，我也不客氣有一說一。
 張采琳 ,https://www.google.com/maps/contrib/108471867762344216287/reviews?hl=zh-TW,1,True,9,"龍蝦吃到飽是真的，但加過多的調味，加其他的食物，1600多的buffet真的很掉漆....

也算是踩到雷，大不推"
 Joe Liu ,https://www.google.com/maps/contrib/116891393018942869743/reviews?hl=zh-TW,3,False,3,11月9號晚餐，6點半入席，說實在有點失望，豬肋排略乾柴，雞肉，子排，佛跳牆黃魚，小管等味道都一般，甜點也無什亮點。一人半隻的龍蝦是唯一還不錯的，不過螃蟹確有點讓人難以接受，阿摩尼亞味極濃，顯見並不新鮮，以這種價位來說，覺得並不值得推薦，自己是不會再來。
 石宗霖 ,https://www.google.com/maps/contrib/113705544452847047767/reviews?hl=zh-TW,5,True,46,"有蟹腳能吃到飽真的很爽快~
生魚片是綜合一盒沒辦法單吃想吃的
龍蝦限一人一隻，口感不是Q彈的
滿可惜的"
 nrtceh chen ,https://www.google.com/maps/contrib/108204392506728072400/reviews?hl=zh-TW,2,True,"2,376","N年後的第2次品嚐早餐……😥差了！
差太多太多了！"
 Chih Yung Chiu ,https://www.google.com/maps/contrib/115006824982076319265/reviews?hl=zh-TW,3,True,17,用餐環境優，服務情切，相較這樣的價格，食材與新鮮度都算尚可
 Nathalie Wu ,https://www.google.com/maps/contrib/108570656993618942224/reviews?hl=zh-TW,3,True,84,"下午茶有點失望
沒有太特別的食材
螃蟹跟龍蝦的品質也不如預期
焗烤龍蝦有點過硬
牛排不錯
淡菜還蠻新鮮
冰淇淋的選擇好少
我最喜歡麻油豬肝湯
老公說啤酒最好喝🤣
來買單的服務人員口罩沒戴好露出鼻孔
令人介意"
 汪樹博 ,https://www.google.com/maps/contrib/115825064391090004460/reviews?hl=zh-TW,5,True,62,生魚片很好吃，服務人員很親切！
 林玉文 ,https://www.google.com/maps/contrib/102473364121223570280/reviews?hl=zh-TW,5,True,257,食物選項多，味道好吃
 張硯凱 ,https://www.google.com/maps/contrib/114835541779416659997/reviews?hl=zh-TW,5,False,7,改裝後的12廚，菜色變豐富，推！
 Andy Chang ,https://www.google.com/maps/contrib/102732350508093637708/reviews?hl=zh-TW,5,True,183,五星級飯店的水準，品項精緻，相對可選擇的菜色不多。午餐每人半隻龍蝦，戰斧牛肉吃到飽，挑高17層樓的中庭，用餐環境舒適。
 Jason Wang ,https://www.google.com/maps/contrib/100542474580397300298/reviews?hl=zh-TW,3,True,529,在競爭的吃到飽環境中，古老的餐廳還能保持高水準不多了
 小徐 ,https://www.google.com/maps/contrib/111345462256977289158/reviews?hl=zh-TW,1,False,2,今天5個人去吃了共9295元，菜色很少，龍蝦、雪蟹、蝦肉吃起來粉粉的，食材不新鮮，廚藝很平庸，付出高檔的錢，沒吃到高檔的食物，很是失望，沒以後了。
 Julie Chou ,https://www.google.com/maps/contrib/107783854753847866228/reviews?hl=zh-TW,5,False,56,漲價之後的11/1週一去的，人不少，帝王蟹，蝦，生魚片，還有海膽+鮭魚卵的壽司飯，讓愛吃海鮮的我大吃了各三份；還有限量的一人半隻超大龍蝦，過癮啊！到現在還在回味不已⋯⋯
 小船 ,https://www.google.com/maps/contrib/111454325240895447954/reviews?hl=zh-TW,1,False,13,一個人加上服務費1859元，覺得被坑，海鮮不新鮮，菜色少，蛋糕不可口，跟欣葉、饗食天堂、漢來比較起來，CP值太太低！不會再去！
