user_name,user_profile_url,rating,local_guide,comment_num,comment_text
 J H ,https://www.google.com/maps/contrib/107173939062523909959/reviews?hl=zh-TW,2,False,4,"6/18午餐
1、可能因疫情的關係，大部份的餐點都分盤裝好，雖然取菜方便，但有些餐盤過大（如：魚），托盤放不下幾道菜就滿了。既然為了防疫而分裝餐點，為何冰淇淋讓客人自己挖？而不是由服務人員處理？或提供杯裝或獨立包裝的冰品？在同一個餐廳裏防疫也有多重標準。
2、菜色明顯不足：上個月才去用餐，這次改變供餐方式，菜色也跟著縮水。cp值超低。
3、有時取餐需要場內人員協助取菜，場內人員顧聊天，讓客人瞎等。
4、收盤子的服務人員明顯不足。ㄧ道菜一個盤子方式供餐，桌子一下就擺滿盤子。好幾次都要客人自己把盤子疊起來，才騰出空間。但當天收盤子的服務人員實在太辛苦了！一直忙，從未停下來！實在是人手不足所致。今天的其中一顆星是給服務人員的。
5、餐點還算美味！"
 王彥凱 ,https://www.google.com/maps/contrib/116048565410579590169/reviews?hl=zh-TW,5,False,29,好吃，個人覺得還不錯！還有龍蝦的肉質真的可以！（推）
 Allen Lin ,https://www.google.com/maps/contrib/103769735207902524706/reviews?hl=zh-TW,1,False,36,超級爛不噴不舒服！看最新評論複製貼上就可以了都差不多很實在「「今天吃了下午茶1100菜色非常少。生魚片只有三種。螃蟹肉沒有口感又很很水。完全沒螃蟹的甜味。熱菜非常少。連炸蝦。炸物都沒有。冰淇淋硬到跟石頭一樣很難挖。這種價位比想食天堂高但品質完全無法比。很失望！」」生魚片就最便宜的鯛魚、黃金鯡魚卵、品質很差的鮭魚超小片客人很少還限制一次只能拿兩份？服務人員還用丟的！是怎樣跟妳施捨的嗎？#@%*¥食物少的可憐！又難吃！500元都不值得去吃！不留給人家打聽嗎？看看今天的評論區真的是笑死！還發意見表給客人填是怎樣？第一次吃buffet吃到要罵人🤬的！還有一大排廉價糕餅所有一切都比同等級飯店的早餐還不如...真的是很了不起！一星給服務！怎麼有人給廚師呢？超級難吃！不如好吃的自助餐便當店！不信快去試試！
 張言禎 ,https://www.google.com/maps/contrib/115523590622801307246/reviews?hl=zh-TW,5,True,207,"現做甜點,很棒。烤鴨也很優質，龍蝦可惜了沒吃到飽，今天還有聖誕老公公，祝福。"
 Raye Yeh ,https://www.google.com/maps/contrib/107760583514011027405/reviews?hl=zh-TW,1,True,98,"四年後再訪…
想不到沒有進步，反而越來越難吃
真的非常不簡單
首先品項非常不多，生魚片還必須透過師父拿
一份三片，請他給兩份還只有四片。有沒有這麼怕人吃？
其他熱食，要馬沒什麼味道，要馬食材不新鮮。
真的絕對不要再當怨大頭來這裡浪費錢了！！

-以下四年前-
菜色種類繁多
但可選擇數量不多
海鮮類和甜點類表現比較好
服務相當不錯
不停會有人員整理餐桌
但整體看來，價格仍偏高
可嘗試看看，但不會重複再來"
 Dale Lee ,https://www.google.com/maps/contrib/117102343937736418516/reviews?hl=zh-TW,5,True,27,"防疫動線規劃蠻好的，而且輔助人手很足，很放心採買，即使排隊人龍有點長，但還蠻快就可以進去採買完畢結帳離開。
三杯中卷便當的蔬菜不及格，過老，配菜不夠豐富，但中卷新鮮好吃！美式辣味烤翅非常好吃！滷味雞胗的入味稍嫌不足，煙燻鮭魚凱撒沙拉很新鮮好吃！"
 歪嘴雞Nash ,https://www.google.com/maps/contrib/107209468542940786122/reviews?hl=zh-TW,5,True,149,"疫情便當食記😷
到處找尋最好吃便當的我，在台北喜來登飯店，似乎發現了一個嶄新的便當售賣區域，剛開始便當五點開賣，我們四點半就開始排隊等候，前面有詳細的疫情檢測跟實聯制登記。

進入大廳後，之前去喜來登吃的餐廳都做了他們餐廳特製的便當售賣，感覺很有日本Mall的感覺，安東廳爐烤牛排、桃山日本料理都有出現，我們為了雙主菜便當而來，結果感覺像吃了很多間餐廳，整體來說值得來一次嚐鮮，也是目前最正式的一次買便當行程。"
 Linda CHANG ,https://www.google.com/maps/contrib/114364721813308565954/reviews?hl=zh-TW,5,True,158,"甜點非常好吃
牛排🥩羊排可以"
 nini wang ,https://www.google.com/maps/contrib/112401878595823545913/reviews?hl=zh-TW,1,False,9,"今天第一次吃，先生訂位很久才訂到的...期待整個落空😥

整體吃下來，真的一點都不推薦...
海鮮沒有想像中的新鮮
不管是生魚片、蝦子、螃蟹都是...

午餐兩大吃了2600左右，因為有12的部分有扣除服務費..

但是餐點真的不值得這個價錢..

看了別人的推薦，都說有海鮮羊排甚麼的...
但今天海鮮就只有幾種生魚片、螃蟹、蝦子..一款蒸的魚..其他沒甚麼大菜..原本看到有人說有龍蝦也沒有😭

再來肉的部分，看到有人推薦羊排，結果也沒有...只有一款牛肉現切的...

就是期待甚麼結果甚麼都沒有...加上看到別人分享的下午茶跟我們今天吃的好像也差不多...真不知道下午茶跟午餐的差異點是？？價格還差那麼多...

甜點好像也還好..但是看到大家都蠻推薦😥

冰品更是...那個haagen-dazs真的硬到挖到放棄...而且口味只有四種...

感覺今天是去踩雷...吃了個寂寞🤣🤣

結果上來看評價才知道近期的都這麼....雷

一顆星送給今天的服務人員，有客人把盤子掉落在地上因而破碎，一位男性服務員立刻處理後續，另位男性服務員桌邊按桌致歉，感覺有星級的處理，雖然我這桌是沒有，但靠近的幾桌，是都有看到服務人員在致歉👍🏻👍🏻"
 Hsien Chen ,https://www.google.com/maps/contrib/117960452833867995160/reviews?hl=zh-TW,1,False,8,"6/17用餐
改裝後滿心期待前往用餐，卻只換來失望兩個字
認真覺得比改裝前還難吃
最嚴重生魚片區：
1.師傅離開餐台長達10分鐘之久
2.請師傅幫忙炙燒一份握壽司，只聞師傅回答「我們都是現做的」
於是我又表明說「因為我剛拿了一盤你們餐檯上的握壽司，發現吃起來飯已經硬硬的有點冰冷了，而且炙燒的關係，放涼一段時間之後整個握壽司變的有點油膩，可以請你幫我做新的嗎」，只聽聞師傅聽完之後沉默，又繼續說一些無關緊要的話(就是沒有要幫我做的意思)。
因為很喜歡吃干貝的關係，第三輪我又走回餐檯，詢問他是否能幫我做干貝握壽司即可，且是否飯量少一點，只見師傅一臉不甚喜悅，甚至連回應都沒有。結果拿到手的干貝握壽司是滿滿的飯量，甚至比原本的份量還多。
第四輪我依舊前往餐檯請師傅製作飯量比較少的干貝握壽司，一樣是得到滿載飯量的握壽司。應該是故意的吧?
3.服務生收盤速度極慢，桌子已經滿放了龍蝦殼及螃蟹殼，卻遲遲等不到服務生。

失望透頂，我看不懂這樣的服務還要多收錢是什麼意思"
 Candice ,https://www.google.com/maps/contrib/110953328901216987936/reviews?hl=zh-TW,5,True,323,"最愛的buffet吃到飽
選擇非常多樣而且每一道品質都很好
從海鮮到肉品
除了新鮮之外調味跟料理方式也很優質
炸和牛可樂餅是極品
冷盤的部分生魚片生牛肉火腿沙拉
每一項都很有特色而且食材處理的很乾淨
甜點的部分不用多說，完勝其他品牌"
 Jerry Chu ,https://www.google.com/maps/contrib/117901470165078116183/reviews?hl=zh-TW,4,True,637,"改裝後的十二廚，用餐環境較先前更顯得寬敞；下午茶菜色上除了冷盤、沙拉、生魚片、熱食與甜點外，每桌還搭配一份主菜「一隻波士頓龍蝦、兩顆淡菜跟半隻麵包蟹」的海鮮綜合拼盤。

個人認為、十二廚持續為自助吃到飽C/P值的前十名內並非浪得虛名。這次雖然只是下午茶，但無論是冷盤鮮食、熱食烹調上都較改裝前有顯著的進步；尤其乾燒大蝦肉質Q彈、迷迭香小羊排鮮嫩多汁、爐烤美牛腹肉咬勁豐富，甜點選擇樣式也非常多元，加上餐廳贈送給的波士頓龍蝦非常加分，都看得出來十二廚的進步與企圖心(85)。"
 陳心怡 ,https://www.google.com/maps/contrib/110519935247627278677/reviews?hl=zh-TW,5,True,109,"精選來自世界各地的珍饈
提供新鮮多元的美食享受"
 林立人 ,https://www.google.com/maps/contrib/115069962379619713358/reviews?hl=zh-TW,1,True,40,今天跟從武漢回來台灣隔離3+4天的中國網紅直播主聚餐，享用期待已久的十二廚，結果唯一好吃的是素雞佛⋯
 Forever Wind ,https://www.google.com/maps/contrib/103867170096016858773/reviews?hl=zh-TW,4,True,94,今天是龍蝦祭所以特別預訂，是在這家吃了幾十年來最滿意的一次，黃金蟹都有蟹膏，熱蒸螃蟹都有鮮味，在這個活動時期很推薦來吃
 Sunglin 531松霖 ,https://www.google.com/maps/contrib/100478767086645588893/reviews?hl=zh-TW,3,True,66,"1、從111年7月1日起，調整餐費，假日下午餐成人990+10%。
2、有附設停車塔(從林森北路轉入飯店後面的小巷進入，專人引導服務)。
3、用餐環境良好、服務親切。
4、整體而言，以位在市區的飯店，交通方便，餐點種類大致都有，除了特別的大菜沒有。
5、平日下午餐770+10%，CP值尚可，假日下午餐則感覺沒之前的優惠。"
 Ying Chi Pai ,https://www.google.com/maps/contrib/110075140321631526313/reviews?hl=zh-TW,3,True,110,"1、服務有待加強：
（1）已經告知服務生有2位12月份壽星，服務生也表示會送上2份生日蛋糕畫盤，但一直等到晚上8點半離開餐廳時都沒送上來。
（2）平常日（12/17）晚上用餐，人手不足，一直看不到服務生，一開始收盤子速度很慢，中途還在buffet區看到服務生在處理盤子碎落一地的悲劇，餐廳的電話（6633-8900）不是斷掉就是沒人接。

2、菜色已經有比重新裝潢開幕以前進步，但仍然不會是吃到飽餐廳的首選或前幾名：
（1）牛肉品質普通，有的還有筋咬不斷，例如：手沖牛肉湯的牛肉，松露和牛炙燒的和牛（真的是和牛嗎？！），和牛壽喜燒（真的是和牛嗎？！），爐烤肋眼牛排的肉質跟口感就相較好很多。
（2）手沖牛肉湯的湯不夠燙，是溫的，佛跳牆還燙口一些。
（3）熱食區的水煮玉米不甜，比7-11的難吃，只啃了半顆就吃不下去了。
（4）松露薯條沒有什麼松露味，松露和牛炙燒的松露香氣比較明顯。
（5）蝦子品質不優，吃了一隻就沒有再吃第二隻的動力，據同事表示天使紅蝦也不好吃。
（6）葡萄不甜。

3、3顆星給義式漁夫鍋（雖然湯也是不燙，但龍蝦口感不錯）、和牛可樂餅、熔岩巧克力蛋糕、H牌冰淇淋（萊姆葡萄口味）、咖喱雞裡面的馬鈴薯燉的不錯。"
 Lena Kuo ,https://www.google.com/maps/contrib/100570026363214725972/reviews?hl=zh-TW,2,False,13,生日再訪12廚真的很失望，不僅菜色變少也沒特色不精緻，現切生魚片只有基本款的四種魚，握壽司只也是如此沒有炙燒，現切肉品只有牛肉沒其他的，除了清蒸魚、龍蝦、人篸鮑魚湯尚可外，熟食吃起來十分的普通，甜點的部份先前現做是可麗餅，現在改舒芙蕾，但我覺得可麗餅真的好吃有特色，舒芙蕾吃了就忘記了，甜點蛋糕吃起來也是一般般沒有驚豔的感覺，然後也沒有我最喜歡的手工餅乾了，先前肚子再撐都要吃上幾片才滿足，飲料茶包的部分Twinings茶包只有4種口味，其他就用天仁茗茶低價味茶包頂替...明明讓我先前驚豔不已的12廚怎麼會變成如此？
 David Ou ,https://www.google.com/maps/contrib/110487121607430992373/reviews?hl=zh-TW,1,False,8,"如果以其響亮的名聲和Buffet王的傳言來看，十二廚尚有許多可以進步的空間。本人於平常日的午餐時段入座用餐，服務人員的訓練不愧其五星飯店的水準，但是餐點提供卻不符合寒舍集團一貫高品質的標榜。雖然和其他的Buffet餐廳相同，該有的類別均有。但是食材料理相當普通且用心不足。
海鮮：僅白蝦、三點蟹、旭蟹、午魚。料理方式只有清蒸、川燙。
日式：一般生魚片、蒸蛋。沒有手卷或握壽司等其他菜品製作
現煎台：當天只製作海鮮餅。沒有其他菜色
現煮檯：擔仔麵(至少應該放一隻蝦仁)、河粉
湯品：玉米濃湯、雞湯。沒有麵包檯、Pizza檯。
甜點區：冰藏失當，已乾口失水的小甜點
至於口感鹹甜問題，因人而異就暫且不表。
簡單紀錄以上內容，以2個人午餐時段用餐花費近3000元(含服務費)的消費，真心覺得不佳。"
 林小羽 ,https://www.google.com/maps/contrib/114656540666243872288/reviews?hl=zh-TW,1,False,6,"第一次入住喜來登，沒想到感受是這麼的糟糕，明顯飯店對於應對機制沒有任何作為。以下針對兩點進行我個人的評論：
第一：Checkin
第一次遇到入住手續要等一個多小時，我能理解暑假加假日，但是櫃檯人員說無論平假日人就是那麼多，這麼多天為什麼飯店都沒有做任何可以讓顧客加快入住的改善呢？訂購了一泊二食的方案，等到入住手續結束，到了房間卸下行李之後已經六點多（晚餐時間6點～9點），更別說我後面還有一堆在大廳還在繼續等候入住手續的客人了………
第二：早餐
飯店對於大量的住客進行早餐的分流以避免擠在一起，分為07:10～08:10、08:10～09:10、09:10～10:10三個時段，而我選了第三個時段，09:10一到餐廳整個傻眼，櫃檯前排了將近20幾公尺的排隊人潮（心想說也太多人選這個時段了吧）結果排了將近15～20分鐘後，一到櫃檯結果發現櫃檯人員也沒有對房號及用餐時間（那入住時分用餐時段是問心酸的嗎？），等到被帶位後拿好餐點已經09:35，準備用餐就被服務人員告知：我們用餐只到10:10……真的傻眼…..唉…
總體而言，本懷著期待的心情，到後來只剩下失望的感覺⋯⋯"
 Dana Yang ,https://www.google.com/maps/contrib/100202404445285164785/reviews?hl=zh-TW,2,True,55,吃過很多家的buffet沒想到第一次吃到CP值極差的自助餐。除了三點蟹肉質還算豐富外，日式料理只有生魚片還可以，也沒有握壽司🍣超級失望。菜色很少，甜點只有鬆餅還可以，其他都沒有入口即化的口感讓人心碎。幸好還有個哈根達斯冰淇淋來畫上句點。(沒有拍餐點照是因為沒什麼讓我很驚艷或特別的菜色)
 娃娃楊 ,https://www.google.com/maps/contrib/100272503594171486754/reviews?hl=zh-TW,5,True,49,"距離上次用餐已經好多年前了，熟食類的餐點並不豐富,生魚片要多少跟廚師點數量，螃蟹我吃一隻嘴巴就過敏會癢就不敢再吃了，涼拌菜色樣式蠻多的，甜點很多樣也很精緻，感覺得到很注重甜點，所以如果想吃甜點下午茶就很推薦來這邊，但是其他的熟食跟生魚片料理真的沒有甚麼特別的，其他飯店的自助吧午餐都勝過這邊的菜色。真的太普通了沒拍其他照片🤷‍♀️"
 carry yang ,https://www.google.com/maps/contrib/113688255081216776088/reviews?hl=zh-TW,1,False,3,"前幾天為了慶祝女友生日
又看到網路上的文章看起來好像東西很多

但實際來吃整個大失望東西很少
肉的部分也只有牛肉其他羊排豬排通通沒有
也沒有什麼甘蔗雞油雞燻雞
連最基本普通的炸物都沒有
整體就是甜點比較豐富跟景色漂亮（唯二的優點）
主食比網路文章看到的少非常多
甚至水果也只有三種
也不要求要多貴的食材
但至少要豐富讓大家有多種選擇吧？
第一次吃吃到飽沒吃飽整個傻爆眼"
 chialing Kao ,https://www.google.com/maps/contrib/105408185105499572148/reviews?hl=zh-TW,4,True,91,星期六中午用餐，服務人員很有禮貌，不過壽司區生魚片種類不多只有五種，鮪魚吃起來口感有點爛爛的，有點小失望，所以生魚片也不敢再去拿第二輪，旁邊的干貝握壽司跟比目魚緣鰭握壽司是現做的，還炙燒過，比較美味，熟食區種類也不多，比較走精緻的感覺，像是蒸螃蟹、龍蝦湯、和牛可樂餅、羊排等等都很好吃。飲料有新鮮果汁跟啤酒、咖啡機、有氣飲料等等可選擇。甜點區五彩繽紛，我最喜歡這區，光看就食慾大開，可麗露、抹茶蛋糕、舒芙蕾（現做）都好好吃，用餐到一半時，服務員每人發一枚代幣，可以至販賣機投幣換一罐港式奶茶。
 Cheng Kayla ,https://www.google.com/maps/contrib/114230862510449137416/reviews?hl=zh-TW,1,True,63,"不說食物怎麼樣了，就如同其他評論說的，下午茶砍半價但高級或不錯的餐點全部刪除，沒有「舒芙蕾」、沒有「焗烤龍蝦」、沒有「天使紅蝦」、沒有「馬卡龍」、沒有「炸牡蠣」、沒有「佛跳牆」、沒有「西瓜汁」、沒有廣告打很兇的「酥炸午仔魚」、沒有也是廣告標榜的「芒果甜糯米」，唯一有的就是「澎湖海鮮煎」，但這些都不是重點！
重點是身為一個高級餐廳，我還是第一次遇到環境這麼糟糕的！！整個餐廳從一進去就感覺到地板黏踢踢==本來想說可能只是某一塊打掃沒做好，結果無論是哪裡的取餐路徑都是，走路每一步就是像鞋子被膠帶黏住拔開的感覺和聲音，真的有夠不舒適🤮
然後是餐檯也都老舊就算了也沒很乾淨。"
 Huey Ling Liu ,https://www.google.com/maps/contrib/113296818163800943466/reviews?hl=zh-TW,5,False,21,因疫情三級警戒，改成便當超市，提供飯店內的各家餐廳美食，日式、泰式、台式、中式、法式料理、甜點，應有盡有，內容豐富，選擇多樣，價格合理，感謝喜來登，讓我們在疫情期間還能享受五星級美食！
 Taiwan Tsai ,https://www.google.com/maps/contrib/109209859173075964133/reviews?hl=zh-TW,1,False,59,"1.取餐動線差
2.用餐區與排隊區一起，吃飯時大家一直看你吃"
 智攸 ,https://www.google.com/maps/contrib/112971669940592187258/reviews?hl=zh-TW,2,True,15,我是十二廚常客，昨天再次用餐時，雖然七月份下午茶特惠790元/人，但是螃蟹不新鮮，肉吃起來是粉粉的，鮭魚生魚片皮沒切乾淨，腥味重、竟然還吃到刺！其他熱食食材也沒有之前精緻，這次用完餐感覺十分失望，希望十二廚要再振作了，不要辜負了粉絲們對你的期待！
 Kun-Ting Chao ,https://www.google.com/maps/contrib/111120807358507747843/reviews?hl=zh-TW,1,True,261,食物選擇性不是很多，座位極度擁擠，隔壁桌對話都聽得清清楚楚，感覺非常不自在，主打龍蝦排隊隊伍冗長不說，經常排隊完看到的卻是空空如也的龍蝦空盤。
 Ritchie Chang ,https://www.google.com/maps/contrib/113952308643658976664/reviews?hl=zh-TW,5,True,372,"》久久沒來，有消息說改裝，睽違吃一次

*環境舒適寬敞，不會擠來擠去的問題.
*冷盤品項多，其中生牛肉、義大利小米很對味.
*熟食部分，紅咖哩味道很對味.沾麵包！
*甜點品項多，但也不失精緻即口味.
*飲品部分就少了許多.

*整體⬆️雖熟食菜色平均⬆️少了些，但是用餐環境舒適度、及甜點還是會讓我選擇這裡。"
 Raymond Wang ,https://www.google.com/maps/contrib/105218576629513321371/reviews?hl=zh-TW,5,True,570,"熱門喜來登便當
用原本十二廚的場地來販賣各色外帶餐盒
從一般便當到高級便當，從排餐到麵包
選擇眼花撩亂難怪人氣十足
#台北喜來登大飯店#sheratongrand#シェラトングランデ#喜來登#sheraton#シェラトン#外帶#外帶美食#防疫便當#防疫美食#takeout#takeoutfood#持ち帰り#中正區#台北#taipei#台北グルメ#taipeifood#台湾グルメ#taiwanfood
IG:ismshh"
 楊允仁 ,https://www.google.com/maps/contrib/105340913528198879253/reviews?hl=zh-TW,4,True,168,要配合餐卷，不然菜色與價錢有點差距。
 Lucky HYDY ,https://www.google.com/maps/contrib/116827186405340570987/reviews?hl=zh-TW,1,False,12,"濃湯裡的蛤蜊每一顆都有沙子
蝦蟹品質差，肉質很粉，完全不新鮮
爐烤牛排超肥，其他熟食也很普
甜點看起來不錯但是只有布丁檸檬塔布朗尼還可以
特別點名甜甜圈，一般麵包店賣的還比較好吃
吃了一個小時就沒有想要繼續了
唯一出彩的地方可能只有調味鯖魚，蘆薈汁，還有無精打采的服務員吧
體驗極差"
 Chiayao Chou ,https://www.google.com/maps/contrib/107122888476445588938/reviews?hl=zh-TW,1,False,3,"今天提前去慶祝88節，照說應該是一位難求，誰知到了現場，居然還有好多桌空著！
再來說食物～雖然是吃下午茶，價位也是要1100元，但菜色居然少的可憐，螃蟹水水爛爛的吃了好害怕，蝦也沒啥味道只好沾著芥末吃，還有一些港式點心、泰式料理，根本完全不行！
居家附近的泰式料理小店，都比它精緻，因甜點我不愛所以只吃了一個蛋撻～～吼～～不蓋你肯德基的都比它好吃100倍！不吃甜點，那我去挖冰淇淋吧！結果排前面的壯漢使出舉重的力氣，也挖不出一球，只能一片一片慢慢的鏟，我真的要昏倒了，大飯店的冰淇淋，還來搞這招，怕人挖嗎？
不想ㄧㄧ批評，因為真的批不完，但想講個尚可的菜色嘛，我還真的想不出⋯⋯總之，不會再去了！"
 Andersen Lee ,https://www.google.com/maps/contrib/115208604668162037725/reviews?hl=zh-TW,5,True,142,疫情期間的“便當”自助餐！經理聰明的設計管理讓餐廳度過疫情難關~~
 張登傑 ,https://www.google.com/maps/contrib/104563443861500174632/reviews?hl=zh-TW,2,True,44,"海鮮新鮮好吃沒話說
美中不足就是沒告知最後取餐時間
甜點完全沒吃到（12:30入場用餐）
14:00收甜點，暈"
 Janet ,https://www.google.com/maps/contrib/117071060740024600545/reviews?hl=zh-TW,1,False,4,"也是最近看了YT的介紹，決定和老公帶著爸媽一起吃午餐提前慶祝父親節。
雖說吃的是平日午餐，但菜色也太落漆了吧⋯⋯
蝦子完全沒甜味、菜色少到可憐⋯
說是主打澎湖海鮮，現場居然只有韓式煎餅、和清蒸午魚（重點是根本空櫃拿不到！
冷盤菜表現普普、羊膝也沒上、牛排居然變成牛腹肉⋯
舒芙蕾口感差、泡芙也不ok、哈根達斯整櫃鎖性封機⋯
覺得帶爸媽來慶祝父親節，真是錯誤的決定。
下次完全不考慮了！氣！"
 指尖對白 ,https://www.google.com/maps/contrib/104899818865777158235/reviews?hl=zh-TW,1,False,12,"不會再來了，
生魚片一直咬到筋還卡牙縫，
但是新鮮也沒什麼好吃的就一直吃生魚片，
舒芙蕾有一股油耗味，
肋排很鹹、很甜，
糖醋里肌嗎？很油、肉的口味很重，
餐點選擇很少，
只有濃湯跟芝麻蛋糕好吃，
芭樂（沒味道），
鳳梨（有點酒味好像過熟），
雜糧麵包非常的硬，
螃蟹很腥，
感覺自己花了一千多塊，
吃了五百塊的餐點，
饗食天堂好吃多了，
非常不如預期。"
 Monica Lin ,https://www.google.com/maps/contrib/108497654662809017486/reviews?hl=zh-TW,1,False,14,"Buffet之王的名稱真的過譽了！
這次去是週末晚餐時段，熟食區的食物非常少，大多都是一些普通的熱炒菜色。
例如：白菜滷、炒高麗菜跟花椰菜，不說我還以為在自助便當店，肉類的選項也很少，參雜一些炸物，走了一圈根本不知道吃什麼，食物陳設太單調。
冷食很多，像生菜沙拉、火腿冷盤、生魚片等等，連炙燒都是冷的！只能說吃完全身寒冷心也很冷，因為這筆錢花的不值得。
動線滿亂的，尤其是熱飲區跟冷飲分開，不仔細找不知道在哪。
整體吃下來真的不推薦，CP值非常低，還不如去吃饗食😂"
 湄芳孟 ,https://www.google.com/maps/contrib/118126248053552926427/reviews?hl=zh-TW,1,False,1,昨天10/11中午用餐實在太糟糕了，螃蟹蒸的太久也不新鮮整個蟹身都分離了！然後生魚片也是一股油味，生魚片散壽司我一吃就開始喉嚨癢，也是不新鮮！然後熟食部份很不值得午餐的價味，我還不如去吃便當，我想也許他們自己也有自覺，所以在結帳時主動要打八折！我真心很失望，我們家每年都會趁秋蟹時去用餐，已經連續第三年了，這是最糟糕的一年，以後不會再去了！
