user_name,user_profile_url,rating,local_guide,comment_num,comment_text
 Jade Jade ,https://www.google.com/maps/contrib/113498656697212033284/reviews?hl=zh-TW,3,True,133,"冰花煎餃非常油，卻不酥脆。size也很小顆。
炸豆腐口感不錯。麻油麵線普通。
最好吃的是蘿蔔糕，口感綿密，調味適中。"
 tony M ,https://www.google.com/maps/contrib/107408121168901389236/reviews?hl=zh-TW,5,True,386,"久聞大名，卻從不曾追蹤過，今日大早路過，恰符合開店早早進入原則，立馬點餐。只有假日0730-1100才有的早餐時段，店內整潔素雅，因疫情有實名制及額溫酒精消毒等程序，看了菜單每樣都食指大動。點了塔(九層)香豆皮燒餅(香脆酥)及杏仁茶(濃郁）,都很合口味，早餐好像都是蛋奶素，吃素的福音，幫老婆帶了油條及杏仁茶。店內提供麥茶無限續杯，也好喝，下次應該會全家一起來享用，還有快速取餐服務欸！"
 陳心瑜 ,https://www.google.com/maps/contrib/116421991810511617340/reviews?hl=zh-TW,4,True,10,"現在吃素的人越來越多，素食料理也越做越好，讓既使不吃素的人也可以接受
上善豆家的用餐環境乾淨、舒適，餐點內容有很多可以選擇，口味也還不錯，值得讓人去品嚐"
 Ritch ,https://www.google.com/maps/contrib/101877138627722134852/reviews?hl=zh-TW,5,True,128,"今天吃了口水g泰式臭豆腐水蓮娃娃菜麻油烘蛋都很好吃
豆花也很好吃
但醬燒g素料味太重不好吃
煎餃跟蒸餃皮超厚又很乾也不好吃
小菜也都還好很不精緻（畢竟是附的）
以後不要點這些
是會再回訪的店"
 JAMES LIU ,https://www.google.com/maps/contrib/118253310508295762101/reviews?hl=zh-TW,5,True,"1,165","確實非常好吃
而且環境非常清幽且空間寬敞
用餐完後感覺身心非常健康呢！
而且份量滿多的
不會讓你失望"
 Paul Kuo ,https://www.google.com/maps/contrib/111214067373229355176/reviews?hl=zh-TW,4,True,405,"對小朋友用餐相當友善,整體的用餐環境也相同寬裕,沒有壓迫感;雖然是素食,但料理還不錯,無糖豆漿以及麥茶免費提供,不知道是不是母親節來用膳的關係,餐後店家贈送每位大小朋友玫瑰果凍,所以大家吃得還蠻飽的;價格高了一些,但整體來說還不錯"
 Nextdoor Wang ,https://www.google.com/maps/contrib/116146312986926968344/reviews?hl=zh-TW,2,True,348,當日負責我們的服務人員態度不是很好，點完餐就跑走也沒說明自助吧使用方式，自助吧的盤子也沒給，點餐時特別要求餐點需求，最後還是上錯，結帳時也是臭臉，結完帳也不說一聲，卡留在桌上只拿收據給客人？一般不是連同信用卡跟收據還給客人嗎？？另外今日蘿蔔糕吃起來粉粉的感覺沒有熟透，連煎的顏色也像是過個油就起來，看網路大家都很推薦的蘿蔔糕真的很失望，再加上價格也滿高的，品質跟收費不符正比。
 尤淨瑩 ,https://www.google.com/maps/contrib/114500506181519582228/reviews?hl=zh-TW,4,True,49,"台北很知名的一家蔬食餐廳，當初看了很多的影片還有文章決定來朝聖一下。地點位於忠孝復興捷運站附近，餐點蠻好吃的，蔬菜非常新鮮乾淨，但覺得價格有點偏高。店內位子很多，但晚上平日時間一下子就客滿了，建議先訂位再來比較好

感覺服務的部份沒有特別優，服務生的素質蠻不一致，剛開始有被嚇到，有幾位可能要注意一下吧，希望店家可以加強訓練，讓之後來的客人都可以留下好印象，不論是素食或非素食者，都願意來像你們這樣很好的餐廳用餐"
 S C ,https://www.google.com/maps/contrib/103603096413732789384/reviews?hl=zh-TW,3,False,13,"某女服務員態度需要再注意，
揮手+出聲叫了三次、完全置之不理；刻意避免眼神接觸；去完廁所回位時，發現在等出菜時甚至刻意站在走廊邊邊柱子中間覺得別人看不到（？）
想跟她說你是來上班的欸…認命一點吧
店家有收服務費欸…

餐點非常好吃"
 Aniki ,https://www.google.com/maps/contrib/101689070042057321344/reviews?hl=zh-TW,4,True,384,"在此能品嚐到兒少時期的黃豆食材的香氣；懷舊的質樸口感是ㄧ種菜根香！
同時、也有新創的菜色擺盤上桌時、更增添些驚喜感！台灣多的是異國菜、以黃豆發展多變的菜色、可以說是用餐新體驗！
特別是帶長輩們來很適合！
第二次吃的是下午茶，菜色選擇性雖少但對節食者或許當為晚餐也不錯！
所貼照片為下午茶的菜色！
服務人員主動巡桌倒茶整理的積極性有待加強！
因下午茶沒什麼客人！"
 nayamiih AC ,https://www.google.com/maps/contrib/109574554785074621506/reviews?hl=zh-TW,4,True,268,"麻婆豆腐不夠辣
稍微可惜了一點"
 陳玲瓏 ,https://www.google.com/maps/contrib/113969700346971942902/reviews?hl=zh-TW,4,False,112,"東西是好吃，且在各家分店比較又更棒
但看到此留言的顧客可以在用餐時候注意音量嗎？
整堆上班族用餐聲音大到⋯⋯真的很吵
可能注意自己的用餐禮儀感謝"
 吳佩璇 ,https://www.google.com/maps/contrib/102241992334916664867/reviews?hl=zh-TW,5,True,129,"喜歡吃很多很多的豆腐
麻油麵線有阿嬤的味道
番茄蛋湯麵有媽媽的味道
蔬食自助吧可以吃到飽
Cp值很高
會再二訪的店家"
 Koala Ma ,https://www.google.com/maps/contrib/106868177086449815933/reviews?hl=zh-TW,4,True,219,"非常清爽美味的蔬食餐廳
服務也不錯
自助吧要點套餐或是單點150。
今日點的每道都好吃，除了豆花有點平凡。
自助吧的豆漿好喝好香
煎餃有點小顆"
 游正宏 ,https://www.google.com/maps/contrib/108048311997103558996/reviews?hl=zh-TW,5,True,256,店面坐位多，桌椅擺放很整齊，套餐口味多樣，但套餐份量不多，大食量的人可能會吃不太飽，還好有沙拉霸吃到飽可以彌補，單點的也有一些麵食，還有美味可口的豆花等甜點，會讓你吃起來，不輸給葷食食物喔，最後結帳有1成服務費
 SH ,https://www.google.com/maps/contrib/117211710758468948682/reviews?hl=zh-TW,4,True,37,"以蔬食餐廳來說餐點很不錯，
不過有點偏貴，
5個人吃下來平均一人要500元，
餃子的味道不錯，
推薦點煎的，蒸的皮太軟爛不好吃
八寶飯好吃
蘿蔔糕也好吃
是可以再訪的店"
 Bob Chang ,https://www.google.com/maps/contrib/103419887459124509729/reviews?hl=zh-TW,2,True,602,"點了梅干豆皮苦瓜封套餐加一份甜點花費大約NTD500。
雖然有沙拉吧跟豆漿無限暢飲，收這個價格仍然感覺太貴。
合理價位大概三百吧？
不過菜色真的很豐富。"
 Mingchi Wang ,https://www.google.com/maps/contrib/113600972427395792322/reviews?hl=zh-TW,5,True,120,上善豆家的原味豆漿、鹹豆漿我真的要大推，飯糰、蛋捲、蘿蔔絲餅、燒餅、蘿蔔糕每樣我都點，場地乾淨整潔，會經常光顧的餐廳，這裡也供應午餐和晚餐，記得提前訂位喔。
 丁丁 ,https://www.google.com/maps/contrib/115853632838912982384/reviews?hl=zh-TW,5,True,56,食物非常美味，環境乾淨優雅，我還會再來。可惜有限定90分鐘用餐時間，希望未來能更延長一點。
 張珮琪 ,https://www.google.com/maps/contrib/118181952635372206811/reviews?hl=zh-TW,1,False,2,東西不太好吃，飯很硬，菜也沒有鍋氣。超級失望的。去過相關的連鎖店，這家店最令人失望。
 Bob Tien ,https://www.google.com/maps/contrib/105582044518423996772/reviews?hl=zh-TW,5,True,39,推薦醬燒乾鍋雞，素肉超好吃的味道超香，有一些小菜可以自助取用，店員服務態度也很好👍
 萬孟賢 ,https://www.google.com/maps/contrib/103259931938584768986/reviews?hl=zh-TW,5,True,215,"環境清幽服務好，有自助吧可以豆漿、沙拉無限續，餐點口味很棒
聚餐&補充植物性蛋白的好去處～"
 Alice Huang ,https://www.google.com/maps/contrib/104545388063350192719/reviews?hl=zh-TW,5,True,167,"很好吃😋推薦！👍下次要再去～
咖喱豆腐G微辣好下飯，麻油烘蛋好香。麵的口感很特別實在。豆花好吃。
自助吧的小菜跟沙拉也很讚，醬料也有豆漿製成的醬料可選，熱豆漿跟麥茶好喝。
空間舒適，防疫也做的很好。店員服務也很好，服務費付的很值得。雖說用餐時間有限制，但因為後面沒有客人預定，所以也沒趕我們走，讓我們ㄧ直坐著聊天，邊喝豆漿或麥茶😄
第二次去有時間限制，很快被請走了。
第三次去一直坐到打烊。感覺人數多比較不會有用餐時間限制。"
 Cheng Yu Tsai ,https://www.google.com/maps/contrib/110200507436455965717/reviews?hl=zh-TW,4,True,132,沙拉區自取無限量供應，豆腐很好吃。米飯個人覺得實在是太硬了如果是老人家可能會有咬不動的情況。麻辣麵超麻很不錯，套餐的小菜也都很特別，尤其是嫩豆皮口感好豆香濃。
 Mark Sun ,https://www.google.com/maps/contrib/117591809627106344644/reviews?hl=zh-TW,5,True,143,"不同一般的素食餐廳，上善豆家以豆製品為主導，搭配其他蔬食；我個人覺得挺好吃的，雖是素食卻不會單調；

每樣小菜也都頗精巧，梅子番茄我個人很喜歡，每次都點

天然鹽鹵豆花還不錯，不過加金桔倒是挺奇妙的，沒有很搭

空間舒適，桌距也剛好，餐具使用木竹及瓷器，環保也有品味"
 STar WU ,https://www.google.com/maps/contrib/100229120079987807234/reviews?hl=zh-TW,4,True,87,"環境舒適乾淨，人員親切

推麻辣醬拌麵，麵條粗又Q，不是一入口就很夠味的那種醬，但越吃越好吃，越有味，加上炒過的菇，好吃
推豆花，真的好吃，雖然甜，但放了一顆金桔多了一點淡淡的酸香味不錯！

麻油麵線，口味一般，很油，天氣冷吃比較適合
煎餃賣相好拍，口味不錯搭配醋醬油，但偏油，然後怕芹菜味的人會有一點，但是我還能接受的範圍。
不推炸豆腐
口感是很紮實偏硬的那種豆腐，不是嫩的，搭配的醬油膏，覺得非常普通。"
 黃子亘 ,https://www.google.com/maps/contrib/103287889638528462224/reviews?hl=zh-TW,2,True,458,非常普通，單點的豆皮份量非常少，炸豆腐沾胡椒粉很乾吃不出特色，麻油烘蛋還可以，但麻油味不夠香，蕃茄滑蛋麵湯頭可以，但改成粗麵吃起來太軟了一點都沒嚼勁，咖哩蒸餃八顆160，不算大顆，皮還算薄Q，但內陷也不沒讓人驚艷的感覺。過多期待感導致吃完後有相當程度落差的失望，最多2.5顆星。
 YH W ,https://www.google.com/maps/contrib/106583559931044048142/reviews?hl=zh-TW,3,True,610,"🌕🌕🌕
當天點了小松菜、高麗菜煎餃、紅油炒手、蘿蔔糕、人氣炸豆腐和叉燒酥。豆腐是偏硬的那種，不是很喜歡。蘿蔔糕很綿密但覺得吃了會膩。唯一覺得不錯的是叉燒酥，麥茶跟豆漿是自行取用！"
 nana ho ,https://www.google.com/maps/contrib/106844027859453724166/reviews?hl=zh-TW,5,True,101,好吃。尤其是豆腐😋😋😋😋😋。胡麻醬口感很溫醇，豆漿醬是沒吃過的口感。下次去要帶家人去吃。
 Ryan Lee ,https://www.google.com/maps/contrib/103687925688897447557/reviews?hl=zh-TW,4,True,109,"很不錯的精緻素食料理，椰菜冰花煎餃超好吃，麻油薑猴頭菇也很濃味，包種芋頭煎餅有驚喜，三個人吃了800塊。

遺憾是新豬肉小籠包暫停供應，店員說在改良配方後，兩星期內會推出，十分期待！"
 506 LCA ,https://www.google.com/maps/contrib/102611910268029442848/reviews?hl=zh-TW,3,True,69,"特地帶吃素的外國朋友來吃

苦瓜其實處理真的蠻不錯的
雖然苦味在但不至於太濃厚
而且湯汁也不是死鹹的那種

鐵板豆腐就真的需要多喝水
吃裡面的菜還需要用湯過水
醬汁的鹹味是香的但真的鹹

沙拉吧多食材部分都很滿意
但套餐加總起來要近四百塊
也可能是店的點導致了價格
但概括起來要再訪真的很難

餐點跟環境其實都蠻有溫度
但外場服務人員態度都很冷
唯獨很高的男服務員有笑容

斜對面素的自助餐可能更好"
 Brad Chen陳建勛 ,https://www.google.com/maps/contrib/101444554002274164066/reviews?hl=zh-TW,5,True,48,"讓人放鬆的蔬食用餐地點，平穩的大片木紋裝飾，搭配柔和的燈光，連洗手台面也直接使用原木設計，第一印象就讓人印象深刻。
上善的主打當然是各式豆製品，舉凡豆腐、豆皮、豆漿、豆花，口感真的都醇厚，搭配套餐豆漿豆腐生菜沙拉也都無限供應，喜歡吃豆腐或喝豆漿的，真的是來對地方了，心裡大大的滿足。
服務生的態度也相當親切，點餐時竟也能提醒我們點的餐份量已足夠，不用再多點，上菜後果真各個吃到飽呢，還好沒有多點，真心感謝服務員貼心的提醒^^"
 chi Lai ,https://www.google.com/maps/contrib/108105133878972100126/reviews?hl=zh-TW,3,False,5,"地理位置離捷運站近
價格中高，每個人低消300元
菜色很油、鹹，鍋類料少
小菜比主菜好吃⋯"
 劉書帆 ,https://www.google.com/maps/contrib/116242258500454505615/reviews?hl=zh-TW,4,True,240,川味麻辣拌麵香麻好吃。煎餃很美，拍照很好看，味道普通不太驚豔。沙拉吧項目很少且量不多。整體而言食物味道普通但養生，環境乾淨，服務態度好，上菜時間稍久，價格偏高。
 Maro Li (StoneFree) ,https://www.google.com/maps/contrib/111758594508398330862/reviews?hl=zh-TW,4,True,"1,382","餐點很棒很多元。環境舒適舒服店員年輕可愛。
還有沙拉吧。

餐點美味算中上。
豆花偏杏仁豆腐的質地，豆味不濃。"
 Borong Chen ,https://www.google.com/maps/contrib/102765060545084030364/reviews?hl=zh-TW,5,True,413,健康、美味，份量偏小、點套餐有豆漿、豆腐、生菜可夾
 Chara Lin ,https://www.google.com/maps/contrib/112312561029352538304/reviews?hl=zh-TW,4,True,117,全素但調味很足。尤其推麻辣豆包，超級夠味很好吃👍！
 Green Tree ,https://www.google.com/maps/contrib/110798539118164338845/reviews?hl=zh-TW,3,False,29,"慕名而來但小失望。想點的東西已經售完，煎餃煎的真的很美、很油，但是裡面的青菜沒有煮全熟，有點嗆辣味。拌飯的芋頭很香，可是好鹹。豆漿無限暢飲，但是沒有豆香。
唯一喜歡的是麵線有q好吃。"
 梁富鈞 ,https://www.google.com/maps/contrib/100369097355121046261/reviews?hl=zh-TW,5,True,659,"今天喝的杏仁茶口感有點變差，向店家反應很快獲得正面回應，希望下次來還可以喝到好喝的杏仁茶！

杏仁茶+油條必點，其他CP值就不高了，但用餐環境相當舒適，要注意中餐晚餐時段有低消"
 張聖 ,https://www.google.com/maps/contrib/114083871229998216831/reviews?hl=zh-TW,2,True,113,"菜調味重油又重鹹又辣、
白菜滷幾乎沒有調味沒什麼味道、像是白水煮的、

印象中素食的感覺就是清淡輕調味但是這家的調味不是很重就是幾乎沒有非常兩極化、"
 una Lin ,https://www.google.com/maps/contrib/107443835058414873412/reviews?hl=zh-TW,5,True,34,"不得不說，上善豆家是豆腐界的瑪莎拉蒂，沒一道好吃的。滷白菜有阿媽的味道入口即化，豆腐丸子一點都不膩。川味麻辣豆腐真是辣的到位加上豆腐真是一絕。蕃茄湯麵光視覺就滿分，小妹筷子沒伸過去下次再去試口味.炸醬一直是我的首選，這個炸醬可以媲美京兆尹樸實不誇張的擺放，嗯很ok的。港式蘿蔔糕超對味，香菇又大又香的，讚。最後的大絕是雪花煎餃，是藝術，是口感，是juice,集於一身請自己去試。搭配套餐的蔬食自助bar每道都特別，飽到不行。你還猶豫什麼。"
 無段道楓 ,https://www.google.com/maps/contrib/108089191503389213461/reviews?hl=zh-TW,4,True,715,"全素餐廳。生意還不錯。服務也好
份量偏少。價位有的高有的普通
有機套餐的部份。單點CP高一點
但是第一次初訪建議試試套餐
推薦鐵板豆腐跟豆腐丸子
而麻婆豆腐普通
另外也建議試試菜掃光跟蘿蔔絲餅
而冰花餃子好看但味道失望
田樂豆腐則是不太一樣的東西
甜品的部份也是偏高
不過水準也不錯"
 Dick Lai ,https://www.google.com/maps/contrib/107348209354738858843/reviews?hl=zh-TW,5,True,361,"一家很有特色以豆腐為主題的素店。

環境衛生，光線充足，有與腐竹一樣的屏蔽，好有趣。

點了兩個麵的套餐，一個是湯麵，另一個是撈麵，果然是以豆為主題的餐廳，那些豆製品帶著豐富的豆味，套餐的幾個小菜都好吃，那個湯品基本上是一絕。餃子賣相好看。

甜品點了豆花，有點花生米在豆花上，吃起來好過引。

餐廳有最低消費額，價格於這地段不算太高。

地點於忠孝復興捷運站4號出口小路左轉，一直走就到。

好想試試這裡的早餐啊，還有那三支味噌豆腐串。"
 amazing 2000 ,https://www.google.com/maps/contrib/118236698309092494253/reviews?hl=zh-TW,4,True,373,杏仁茶不甜，很順口，濃郁香醇。一碗雖然七十元不便宜，但很值得點來喝喝看。燒餅夾蛋的燒餅酥香，口感不錯。蘿蔔絲餅是店員推薦的，也是不錯吃。餐點裝潢整體來說蠻不錯的。由於都是素食的，吃素食的人也可以來吃。
 YJ ,https://www.google.com/maps/contrib/101994426980306533534/reviews?hl=zh-TW,3,True,85,"除了豆漿喝到飽,其他都覺得中等,可能真的吃非常清淡.非常素的人會喜歡吧
絲瓜小籠包真的超級令人傻眼,又小餡大概就一咪咪,煎餃不錯"
 Curry Lee ,https://www.google.com/maps/contrib/115659867200413105489/reviews?hl=zh-TW,3,True,99,"點了「魯白菜豆腐丸子」套餐$360(單點$180)
魯白菜跟豆腐丸子都非常好吃，套餐附藥膳湯好喝，真心推一個！但小菜有個甜豆子我不愛，吃沒幾顆都剩下。
朋友點「川味麻辣拌麵」，個人覺得有點油，但朋友愛吃辣的喜歡！
蘿蔔糕我覺得普通，吃過更好吃的。
每人低消$300，餐點價格小貴，但標榜有機食材，飯也超好吃。
-
二訪上善豆家,但櫃台帶位人員態度不佳扣一顆星!!!
我們進店後當時櫃台無客人等候,一位服務人員請我們稍等正在整理位置,然後陸陸續續又來了三組人,櫃台人員就直接帶最後進來的那組入座....跟他反應只會說其他人沒跟他說,處理態度不好=.="
 Joanne Liu ,https://www.google.com/maps/contrib/110842285879205494336/reviews?hl=zh-TW,4,True,96,"餃子.港式點心類表現都不錯，
紅油抄手也不錯
價位中高
有無糖豆漿可以自行取用"
 Evelyn Cheng ,https://www.google.com/maps/contrib/113481418288106460398/reviews?hl=zh-TW,5,True,41,"吃過上善豆家的早餐和晚餐，覺得每道料理都很用心，尤其是米漿，連不愛喝米漿的我都愛上。
推薦想悠閒開始週末下午茶的朋友，可以來上善豆家吃早餐~"
 Rachel ShuHui Chu ,https://www.google.com/maps/contrib/101856622527328955666/reviews?hl=zh-TW,3,True,74,"白菜有苦味，丸子普普，蘿蔔糕不錯但不及他的價格，麵的味道還行但麵條過於軟爛。
整餐吃下來最好吃的是套餐附湯。不會再回訪。"
 吳宗曄 ,https://www.google.com/maps/contrib/106894753468207016835/reviews?hl=zh-TW,4,True,94,好吃的店，素食料理很有特色，座位用布簾做間隔，可以自在的聚餐聊天
 りせ浅野 ,https://www.google.com/maps/contrib/108358624587930463903/reviews?hl=zh-TW,5,True,329,"素食好地方
雖然免不了調味上鹹度偏高，但還是在好吃的標準內。小菜選擇滿多樣的，沙拉的部分醬料就比較普通，豆漿醬似乎跟一般的蜂蜜芥末沒什麼差別。
主餐梅干豆皮苦瓜封，跟豆腐皮相映成章，梅干應該經過多次漂洗，去鹹留香，跟苦瓜搭配苦中帶甘，相當古早味的菜色，不免稍嫌油膩。"
 Rafael Tang ,https://www.google.com/maps/contrib/109625613308114146756/reviews?hl=zh-TW,4,True,463,套餐組合加上自助吧台。價格中上喔！豆漿真的是招牌喔。味道鍋氣也十足喔！
 阿奏你不合喔 ,https://www.google.com/maps/contrib/103305930279893853724/reviews?hl=zh-TW,1,True,213,"本身吃葷的
今天陪吃素朋友來吃
對我來說是很難吃啦

吃素的朋友好像也不太喜歡
只能說素食者真可憐"
 Yu Linda ,https://www.google.com/maps/contrib/103465758894846466644/reviews?hl=zh-TW,3,True,687,用餐環境有點吵，小籠包沒有特別好吃、個人覺得普通，自助沙拉吧的小菜還不錯，但是覺得種類不是很多，尤其是蔬菜類真的很少。
 Luu Lu ,https://www.google.com/maps/contrib/114304446125574766460/reviews?hl=zh-TW,3,True,35,"點了
田樂豆腐
冰花煎餃-高麗菜
脆皮叉燒酥
蘿蔔絲餡餅
白玉蘿蔔糕
胡麻香辣麵套餐

只有覺得蘿蔔糕跟脆皮叉燒酥好吃🥲

樂田豆腐吃起來很乾、味道不夠的感覺

蘿蔔絲餅有鹹但不香

冰花煎餃以這價位，覺得吃起來很普通

胡麻香辣麵，滿油的、不香也沒什麼味道，不知道是不是就要做這樣，要多鹹再自己調味。

滿多餐點吃起來偏油，味道沒有太突出，不知道是不是沒有點到合適的餐點，整體吃下來有點失望，畢竟門口就掛了很讓人期待的標示"
 戚滿芳 ,https://www.google.com/maps/contrib/106958946474603920296/reviews?hl=zh-TW,4,True,148,"真的是不錯吃，尤其是杏仁露超好喝，米漿也非常濃郁，餐點很精緻，唯一被我詬病的是一個賣素食的簡單套餐店、進去一定還要有最低消費，有的時候不過興致來了只想喝一碗杏仁露，還要看他們臉色，所以自己考慮吧
後記：10月7號來吃的晚餐，有一點點改變就是現在任何點一到單點就可以以$150加沙拉吧，幾個月沒有來，服務變好了，東西一樣很好吃，尤其是杏仁茶，當天點的米漿有一點點苦，但是帶回去一小瓶米漿又很好喝、也許是在現場不斷地加熱吧，美國的朋友非常喜歡，說是覺得很養生"
 Ying-Kai Chen ,https://www.google.com/maps/contrib/116931829296242207019/reviews?hl=zh-TW,3,True,384,"東西不錯吃但真的是太貴了CP值很低冷氣確實真的很冷
內用可以無限量喝熱茶喝熱豆漿
📍川味麻辣乾拌麵$160夠香夠麻但不值得這個價格
📍番茄湯麵$160湯頭好喝但麵非常的普通也不值得這個價格
📍白玉蘿蔔糕$90滿滑嫩的煎的也恰到好處
📍冰花煎餃$200好吃又美觀但還是不值得這價格
📍冰豆花$70不是一般的糖水加了檸檬真的是絕了真的是畫龍點睛"
 軟綿綿 ,https://www.google.com/maps/contrib/100253854956639819217/reviews?hl=zh-TW,1,True,300,"原本覺得很好吃，還帶了好幾次朋友來吃。
剛剛卻看到有老鼠🐁出現！？

以餐廳而言這實在太誇張。
不會再來。"
 Kungchunlee李冠群 ,https://www.google.com/maps/contrib/108720829547888656251/reviews?hl=zh-TW,3,True,131,"豆腐料理類非常精緻的一間餐廳，整體上口味上偏向健康營養，但意外的有幾道菜鹹度特別重，尤其是番茄豆包，醬汁非常之下飯，感覺餐廳就是鼓勵客人一定要加值成套餐才有飯和其他淡口味的配菜。
煎餃的味道不特別，沒有記憶點，稍微吃到第五個就膩了；蘿蔔絲餅的內餡不夠香，沒什麼蘿蔔味，相比起來比較推薦另一間養心茶樓的蘿蔔絲酥。
推薦豆腐腦，清淡的米香與豆香剛好，會讓人想一口接一口，但分量不多，有回味無窮的感覺。
另外也推薦豆花，很健康很好吃。尤其紅豆湯和花生仁都自製的很美味。
此外也喜歡他們的服務態度。"
 dodo Lee ,https://www.google.com/maps/contrib/102990711129172925596/reviews?hl=zh-TW,3,True,107,"安全的店
煎芋頭餅可吃
冰豆花糖水對我來說太甜花生不夠綿"
 chichih kao ,https://www.google.com/maps/contrib/108820877624019281790/reviews?hl=zh-TW,4,True,29,自助吧小而精致味道不錯，小籠包內餡不是用一般素料滿特別，合我口味。炸醬拌麵口味較一般。以在東區的店面價位算合理。
 黃芙華 ,https://www.google.com/maps/contrib/112101414082133342327/reviews?hl=zh-TW,5,True,56,第一次吃真的為之驚艷！我點麻油當歸麵線，味道香濃而不膩，香到懷疑是不是葷食了！朋友點椒麻乾麵，也超好吃的，不過吃到後來有點太鹹了，還好有沙拉吧可以解膩！旁邊有豆漿可以自取，豆漿很香很好喝，還可以喝到一點點沙沙的口感，真的是現磨的感覺～下次一定會再回訪。
 William ,https://www.google.com/maps/contrib/116390543813760407757/reviews?hl=zh-TW,1,True,15,餐點每一道都非常油，我今天點了煎餃、烘蛋、蘿蔔糕⋯⋯等都非常油，完全無法接受！另外自助吧許久未補，包含豆漿、木耳。自助吧台旁邊有木耳掉落，地上也有一塊豆腐未清，我非常失望！而且隔壁好幾桌客人已走許久也未清理，就算清理也是到一半人就不見，留下一堆空盤空碗，不推薦來訪！
