user_name,user_profile_url,rating,local_guide,comment_num,comment_text
 Yu-Sheng Chen ,https://www.google.com/maps/contrib/112630363570636047180/reviews?hl=zh-TW,4,True,43,"來東區溜溜餓了休息吃一下飯發現原來全家便利商店合作的上善豆家是從這兒發跡。
服務不錯定位也方便距離soho徒步不用3分鐘就可到達地段很好。
不過可能開很久了椅子好髒⋯
點冰花煎餃，煎餃餡料食材好吃不過廚師應該不太會煎有點油。酸辣丸子煨麵不酸不辣沒味道有點雷麵又很多，非常不推。
醬燒乾鍋G好吃，不過裡面馬鈴薯煎的太過偏過軟，可以改善一下讓他更有口感。甜點豆花的糖水是濃厚焦糖味，非常好吃，推薦要點。
不過第一次吃豆花上面放一塊金桔🍊，是因為北部創新吃法？還是老闆是宜蘭人？
泰式臭豆腐就是炸豆腐加上百香木瓜加上泰式酸辣醬，只有泰式的皮沒有泰式料理的魂，這道不知道怎麼評論。
自助吧的海帶根捲以及豆腐是好吃的，給予正評論。
以這樣素食餐廳再這樣的區段，訂價我覺得算是便宜的，台中很明顯很多素食餐廳價格都太pricy.
Bytheway,水果茶一大壺才130，划算可以點也不難喝！"
 周容戎 ,https://www.google.com/maps/contrib/101669144635644791096/reviews?hl=zh-TW,5,True,34,"朋友聚餐，因為其中有人吃素所以選擇這一家店。
週六的晚上人蠻多的，還好有先訂位，入座點完餐之後才算用餐時間，假日是90分鐘。
點餐完之後服務人員會跟你說可以先拿自助餐台上的食物，會有一些涼拌的開胃小菜（百香果沙拉、涼拌木耳、韓式泡菜、涼拌海菜），還有可以自己調醬料的板豆腐，都蠻清爽的。
上菜速度非常快，差不多我們點完餐之後的10分鐘就全上齊了，滿桌子的菜看起來非常豐盛。
香酥雞裡面有搭配炸杏鮑菇，但我個人沒有很愛吃素肉所以覺得還行。
香椿水蓮野菇，蠻合我的口味，個人滿愛水蓮跟菇類的，味道偏重鹹一些，算是蠻下飯。
其他的菜我覺得都偏清淡，感覺是蠻健康的。但蕃茄鍋很好吃，熱熱的湯味道也蠻夠的。
後來加點了芋頭米粉，個人愛吃芋頭覺得湯頭很濃郁，可是朋友覺得米粉偏硬，不過味道很香。
甜點的部分其他三個朋友都點了豆花，他們說味道還不錯，我個人點了龜苓膏，可能有吃過別的地方的龜苓膏，所以覺得沒有太特別。
整體來說用餐空間環境算舒適，但餐點沒有十分讓我驚艷，可能個人口味問題。四個人吃完大概人均627，不算平價的店，可以參考看看。"
 Minnie Chen ,https://www.google.com/maps/contrib/104589501040745916512/reviews?hl=zh-TW,5,True,55,"捷運忠孝復興站走路5分鐘的蔬食餐廳。

麻婆豆腐中偏上辣度，很香很配飯；口水G原本可能要外酥內Q，但也許是我們放太久，涼了之後口感偏硬，但味道仍然很好，建議熱熱吃；炒水蓮搭配香料/醬汁，讓簡單的炒蔬菜味道變得很有層次，好吃！
自助吧小菜每次稍不太一樣，我們這次有豆腐，可以補充蛋白質！涼伴木耳，酸甜鹹脆很喜歡！

感覺得到店家對於蔬食食材、料理的用心，會更新菜單，下次想去嘗試其他料理！
幾次用餐的體驗都很好，謝謝！推薦！

二訪：
松露野菇鮮若口味的煎餃很特別，餐後購入冷凍水餃回家。
鍋巴咖喱G的醬汁偏少，但味道很好，配飯好吃！
醬燒乾鍋G上的裝飾不是蔥，店員介紹為了做全素（避免五辛素），所以選用外型像是蔥的碧玉筍做裝飾。詢問之下才知道店家的用心！
謝謝！"
 Funny ,https://www.google.com/maps/contrib/112260347171619950940/reviews?hl=zh-TW,4,True,84,"我和我朋友都非素食者，這次點了雙人套餐。
覺得三個女生吃可能會比較剛好，對我們來說份量有一點多。

🍽醬燒乾鍋G（微辣）
葷食者可能會不太習慣這個G的口感，因為不像肉泥一樣這麼扎實，咬起來還是吃的到散散有縫隙的感覺，但是味道和醬汁都滿不錯的！

🍽腐乳空心菜
朋友是超級空心菜愛好者，她說給過，我自己吃起來是覺得偏清淡類型

🍽高纖糙米飯
他的糙米飯很香，而且真的很大碗，超級有飽足感⋯

🍽口水G（小辣）
口水G底層的醬汁吃起來是麻辣味，大概是小辣，底層有金針菇跟豆皮，G本體還真的吃不出來是什麼，口感很像魚板或甜不辣那種類型的東西，外皮很酥脆

🍽脆皮蘿蔔糕芋粄
這道的蘿蔔糕超級軟嫩，芋粄非常酥脆，但同時也會覺得有點油膩。

🍽松露煎餃
一咬下去滿滿的松露味就爆開來，裡面的餡料也滿豐厚的，吃幾顆就覺得飽足感十足。"
 Sally Hsieh ,https://www.google.com/maps/contrib/113232043853813594674/reviews?hl=zh-TW,5,True,385,"一個人低消300元，有10%服務費，自助小菜吃到飽，有生菜、百香果沙拉、木耳、泡菜、麻辣豆腐跟昆布豆腐湯（還有各式沾醬可以自己搭配）。主餐有合菜跟豆腐鍋可以點，我們點了蟹黃豆腐、口水G、麻油烘蛋，蟹黃豆腐應該是用紅蘿蔔，不過吃起來很滑順，沒什麼紅蘿蔔味，還真的有點蟹黃感；口水G是煎或炸的恰恰的素肚跟柔軟的豆包夾金針菇，口感有硬有軟，調味是有點胡麻+椒麻感，加上一點花生，我最喜歡的一道！麻油烘蛋有點太油膩，下次可能不會再點～

單看主餐類覺得價格偏高，因為都是比較便宜的食材，料理方式也不複雜，口味不錯但不會太驚艷，不過因為有自助吃到飽，可以吃很多小菜就覺得價格還算合理，個人又非常喜歡豆類，吃的很飽很開心～"
 Zu0An IG:zu0an ,https://www.google.com/maps/contrib/104645394164366684331/reviews?hl=zh-TW,4,True,53,"這是一家價錢和氛圍呈正比的餐廳。價錢部分稍微小貴但店內相對也很舒服很有格調。說道吃的部分我和同伴是選擇點菜，然後各自單點他們家的麥飯粒一起吃

很特別的是他們的冰花野菜煎餃的設計，然後8顆一盤，而我個人偏愛絕蛋雙嬌，那個蛋是真好吃啊

另外脆皮蘿蔔糕芋板也很驚豔，平時很少吃芋頭的我吃得下去是因為芋頭並不會太重，甚至還有脆的口感

醬燒乾鍋G，喜歡他們的乾鍋配料，讓整體的醬燒G很加分甚至也不會顯得太搶味。來到他們家內用也發現他們竟然有自助式的小菜吃到飽

可以自由拿豆腐，鴨血和其他小菜以及醬料哦，當然不要浪費就好！

素食愛好者可以選擇的餐廳，而我和素食朋友共同前來都覺得很不錯哦"
 Ta Li Hsieh ,https://www.google.com/maps/contrib/113658933669355777774/reviews?hl=zh-TW,4,True,167,"用餐時間：5/817:30
剛榮獲蔬食米其林之稱-豐蔬食，一星推薦。
餐廳位於競爭激烈的東區商圈，附近也有諸多蔬食或是素食餐廳。
用餐環境舒適寬敞且明亮，座位有四人及六人位。此餐廳聽名字就知道事以豆類為主，另外有小菜及說得豆腐自助吧無限量提供，光吃小菜就很飽了！當天點了四人套餐，最喜歡的是炸蘿蔔糕跟芋頭粿，豆腐火鍋也很香，另外加點的松露冰花煎餃著實驚艷，為必點菜色，整體口味偏清淡，吃完覺得非常飽！
另外點評一下廁所很小，乾淨程度也需要加強。"
 Li SHEN ,https://www.google.com/maps/contrib/107164189921039505112/reviews?hl=zh-TW,5,True,167,"非基改黃豆製品，宜蘭行健米（好米的滋味真的不同），菜色選擇不少，是葷食者也很能接受的素食餐廳。
Sogo商圈交通方便，每人低消300很合理（看總額，沒有限制是一杯飲料或一份餐。）
小菜區為自取式，廚房會不斷補充。昨晚品嚐的黑木耳、紅蘿蔔、豆腐三種都好吃又天然。
臭豆腐厚實十分飽足，色澤淺金黃，感覺油品清潔。（建議店家推出3塊版給少人聚餐時可以選擇多品嚐其他的餐點）

昨晚吃完飯到今晨醒來後都沒有吃到過重調味或味精的不適感。
絕對會再回訪的店。

難怪被列為全台五大必訪素食餐廳。
生意很好建議預訂。

另外可以下載善菓蔬食的app,除了首次可贈送一份餐飲（每家店不同，昨晚贈送的是一大杯檸檬梅子飲），在旗下各店消費都能持續積點。（例如蔬慕VeganAmore，禪風茶樓，善菓堂，善菓屋，上善蔬食)
照片只拍一道，後來忙著品嚐就沒拍了。😁
昨晚兩人用餐金額九百多，兩人都飽到不行。在台北這樣的餐廳算CP值很高的。
初訪：2022.11.12"
 Morrison Su ,https://www.google.com/maps/contrib/107017054227588719455/reviews?hl=zh-TW,2,False,11,"已多次來到上善豆家，菜品的部分有維持在一定的水準。這一次還多了機器人送餐，應該算個噱頭吧。

不過服務的部分還是一樣的令人失望，點餐時一直問，這樣就好了嗎?還要什麼嗎?點餐的是老人家，一點都沒有站在老人家需要時間思考的立場。一直趕著要點餐，最經典的就是一直說什麼桂圓紅棗一杯還有人要嗎?問了2,3次根本沒有人要點什麼，都沒有想過為什麼沒人回應他嗎?

而且帶位、點餐都沒有提到用餐時間，到後面，一位男性服務員好像M開頭的吧。一過來就說，你們已經超過一個半小時用餐時間，請斟酌時間，謝謝。大家聽到都傻眼，如果知道用餐時間有限制，我們就不會約在這邊吃飯了，更何況現場沒有爆滿，沒排隊。我們也不是剩下最後一桌賴在那邊。一直趕人，有意思嗎?
更何況不到十分鐘，這個男服務員又過來說，請斟酌時間，謝謝。講完甩頭就走，這態度.....呵呵
當時大概是20:40左右，雖然我們都知道你們九點關門，不過是在哈摟嗎?隔壁桌的菜才上完沒多久，是打算21:00準時關燈拉下門來嗎?

就像我上面說的，已經多次來到上善用餐，服務依然讓人不敢恭維，這次如果不是朋友指定，應該不會讓人想要再踏進去吧。"
 Ya Li Huang ,https://www.google.com/maps/contrib/105510819093649153216/reviews?hl=zh-TW,4,True,417,餐點很特別，味道很不一樣，並不是一般的味道，豆腐很不錯吃，但有些菜我不太習慣，很創意料理，餐廳還有小菜自助吧，是可以自己隨意取的，餐點並不便宜，但蠻特別的，冷氣蠻強的，有冷到，雖然夏天很熱，但餐廳像是冬天，😅。
 Merche Hy ,https://www.google.com/maps/contrib/114075803192394415247/reviews?hl=zh-TW,1,True,128,"以前吃過很好吃，態度也很好，但因為大概3年前來吃一直念念不忘
今日再度光臨，發現一切都變了樣，店內沒有再賣拌麵了，卻還持續賣拌麵的醬等產品、跟全家合作也是以拌麵為主要合作餐點之一，一直誤導大眾店內還有的假象。我就是為了拌麵而來的～
另外要點冰花煎餃，2012/12/26下午1:00多時點餐，店員說沒有在賣了，只剩下蒸餃。勉為其難的點了其他的食物，卻在接近要吃完的時段，大約2:30左右，一盤盤的冰花煎餃從我們身邊而過，而且是好幾桌都點，上菜時也都有
這次吃的食物都沒有以前好吃，很油很鹹，我猜不是換老闆，不然就是名店拿翹了，不過現場還是很多人，請大家憑良心評價吧！

另外，請別貼罐頭回應，12萬分的歉意
跟告知外場主管，下面的評論已經看過很多了，就這樣吧！這是最後一次進入用餐了"
 Josh Lin ,https://www.google.com/maps/contrib/116305296945089874353/reviews?hl=zh-TW,4,True,12,"因為媽媽吃素的關係
就會開始關注一些素食餐廳
今年母親節在網路上看到這間的介紹
感覺還不錯就訂位了

這次選擇的是雙人套餐1090（另加10%服務費）
總共四道菜兩碗糙米飯兩杯飲料
旁邊有自助小菜可以無限取用

這次選擇的四道菜當中
比較符合我們胃口的是
臭豆腐跟口水G
另外兩道香樁水蓮野菇跟熊貓麻婆豆腐
我們覺得味道吃到後面會有些膩口
醬油味也偏重
小菜部分板豆腐跟海帶絲都很出色

整體是不錯媽媽吃的也開心
價格算是中上
給大家參考"
 朱Vickey ,https://www.google.com/maps/contrib/107193413749830043110/reviews?hl=zh-TW,4,True,93,"第一次來這邊用餐，整體來說還算滿意
點了兩人套餐，加上另外單點冰花煎餃
口水G的口感很有彈性
松露口味的冰花煎餃特別讓人驚艷❤️
味道濃郁、外皮超級酥脆
飲料的部分也很讚
不過，酸菜白肉粉絲煲則讓人覺得有點詭異（整體是沒有溫度的）
但整體而言，是很好吃的！"
 Chen Angel ,https://www.google.com/maps/contrib/116790698931247083277/reviews?hl=zh-TW,5,True,484,用餐時間90分鐘，一人低消300即可享受室內沙拉吧～💖只能說真的太讚了。環境很乾淨，空間很舒適，本來擔心位子不多，發現其實不少～服務態度也很好，沙拉吧沒了東西沒了都會立即補，松露蒸餃松露味道超重，炒空心菜味道剛剛好，不會太鹹，炒的剛剛好，各式小菜我也都很喜歡，另外最後的豆花，吃得出來新鮮與細膩，因為平時是喝無糖的，應該可以要求少糖～結論：一進門就感覺到滿滿的幸福與到家的體貼，謝謝你們😍
 CHIEH ,https://www.google.com/maps/contrib/117921553164041292917/reviews?hl=zh-TW,5,True,715,"每人低消300元，10%服務費，可以街口
每道菜都不會覺得美味到不行
但都是中等以上的好吃
甚至會覺得量有點少
跟材料比起來cp值有點低
（但還有一區自助吧可以無限量拿小菜
麻辣滷豆腐、醃小黃瓜、泡菜、生菜沙拉等等
絕對吃得飽）

但以跟朋友吃飯聊天的目的來說
店內環境很舒服
可以一直續茶"
 SKai C ,https://www.google.com/maps/contrib/101608954515861294343/reviews?hl=zh-TW,4,True,404,"中式素食料理

忠孝復興這一帶好像滿多素食餐廳，小小樹食、艾果豐等等。今天才嘗試上善豆家，不同於前兩家，是一家專攻中式料理的素食餐館。

紅燒豆腐好吃，味道好，還有加上九層塔、洋蔥、老薑還有杏鮑菇。豆腐滿多塊的，應該有三人份的量。麻油烘蛋調味偏甜，放在鑄鐵鍋裡面久久吃還是熱的。烘蛋記得趁熱趕快吃，微涼就顯得比較油。這個最下飯。腐乳空心菜看起來味道很重，其實腐乳醬不會過於濃稠黏膩，反正吃起來更多的是清爽的感覺。

旁邊還有小菜吃到飽，臭豆腐、木耳、泡菜、生菜等等，也是不錯。

服務員很多，很認真，餐點介紹、收盤子、補小菜等等都讓人感覺貼心。"
 Stanley Lin ,https://www.google.com/maps/contrib/110357195224772641551/reviews?hl=zh-TW,3,True,506,小菜能夠免費自取，有五樣和沙拉，還算豐富，豆腐和木耳都蠻好吃的，主餐的部分就普通，芋頭粿吃得到芋頭斯超級好吃，但蘿蔔糕超級普通，很平淡，冰花煎餃的內餡不太合口味，沒什麼香氣就很像平淡的雪裡紅素餃再拿去煎，炒青菜偏貴
 Ying- Chieh Huang ,https://www.google.com/maps/contrib/108427476614762116691/reviews?hl=zh-TW,4,True,47,善菓系列餐廳，剛開幕時蠻長來吃早餐，不過很久沒來。覺得口味好像有點變油，芋頭米粉的芋頭不夠軟爛，服務還是不錯，人也很多，還有小菜可以吃
 小蝸 ,https://www.google.com/maps/contrib/105567651275787700411/reviews?hl=zh-TW,3,True,49,"🚗上善豆家DeliSoys
⏰營業時間:
星期一~五11:30–14:30,17:30–21:00
星期六、日11:00–21:00
🍽餐點:野菇豆漿鍋330*2+麻油薑石鍋350*1+高纖糙米飯40*3
💰服務費10%:有
✍🏻評價：被店外面裝潢給吸引，沒有很注意招牌只看擺在門口菜單，誤以為是葷食，就決定找一天來吃吃看這家店，只是用餐當天店員介紹才知道都是素食餐點，當下有點傻眼不過想說也不是不能吃素，畢竟也是有很好吃的素食餐廳，因為第一次來吃最後我們覺得都點鍋物吃看看，還另外點了高纖糙米飯，想說如果好吃後續可以再來，另外自助吧區有一些小菜可自行夾取，也有可以搭配的醬料。

用餐過程我跟朋友都覺得不是很滿意，可能就整個豆類豆過頭了，小菜也是豆腐(都是冷冷小菜)，鍋物也是豆腐，料不多主要酸白菜很多，吃起來都沒什麼味道，醬料味道沒有很夠味，所以整個就跟吃水煮感覺，一直在吃菜跟豆料理吃到有點嚇到，而且豆腐也不是嫩豆腐那種，就是比較粗糙的豆腐，鍋物的素肉吃起來綿綿的很奇怪口感，可能這邊適合比較口味很清淡的人或吃過多豆類不會脹氣真的比較適合來這邊。"
 Jeffrey wu ,https://www.google.com/maps/contrib/109887027913400344527/reviews?hl=zh-TW,2,True,60,一年多前有來消費過一次，豆漿還可免費飲用。上禮拜無意間看看他們官網看到很多菜都還沒吃過，網站上的菜單餐點都拍得很漂亮，結果到現場點了口水G跟麻辣豆腐鍋，上菜後發現跟菜單上的樣子落差滿大的，再來就是口味上也偏向清淡，尤其麻辣豆腐鍋個人覺得根本不值得380而且還沒附贈白飯！內容物也不多，其實真的很普通，滿心期待去吃結果蠻失望的，兩個人隨便點幾樣就要900多，重點豆漿還停止免費供應了，也是蠻扯，看來要很久才會想再去當盤子消費一下了。
 Franco Li ,https://www.google.com/maps/contrib/103523875167907475712/reviews?hl=zh-TW,4,True,917,"很有自己素食料理特色，但餐點價位在中上，其素食也是屬於蛋奶素。
另外還有免費的小菜區，這到是很特別，也是價格偏中上的原因吧！
用餐環境乾淨舒適，若開車來此用餐，可以停市民大道下的地下停車場，在走路過來。
假日的中午及晚上，最好是先預約，才不會需要等太久。"
 Fiona Lee ,https://www.google.com/maps/contrib/108456915365306829336/reviews?hl=zh-TW,3,True,173,"台灣必吃五大素食餐廳。我是無肉不歡的人～
但～我也什麼都吃。
疫情間會更勝選餐廳環境以及衛生問題。
食材口味非常到位👍
只是服務感覺非常的制式。我也是服務業！
溫度，熱忱是服務業必備條件之一。
希望貴公司職前教育請重視。"
 霧島翔 ,https://www.google.com/maps/contrib/109380874794153987413/reviews?hl=zh-TW,3,False,107,"環境算舒服，價格稍高，有小菜可以自助取用還不錯。點了雙人套餐，口味尚可但是炒水蓮實在太鹹了，對身體的負擔有點大。額外加點的冰花煎餃的脆皮好吃，薄荷桂花飲是很漂亮的漸層有點意外。
廁所有裝扶手這點很貼心，畢竟客群也有不少高齡者。"
 kuoju liao ,https://www.google.com/maps/contrib/101060373944177436001/reviews?hl=zh-TW,5,False,127,"這次點的幾道菜(醬燒乾鍋G,滷臭豆腐,脆皮蘿蔔糕芋粄)都相當美味,自助吧也相對豐盛,跟三年前的用餐經驗相比,大有進步!"
 Nancy Yin ,https://www.google.com/maps/contrib/105676426745972118576/reviews?hl=zh-TW,5,True,50,"第一次到訪，非常好吃，雖然是素的，但讓我這愛吃肉的人也喜歡，每道菜雖然多數是豆類食物，但吃不出來，而且味道都不一樣！ㄧ定要再來。
今天6/12中午站櫃台帶位的服務人員，很詳細介紹，也很友善，額外加分！"
 劉杰妮 ,https://www.google.com/maps/contrib/102338842754234722893/reviews?hl=zh-TW,4,True,149,"以第一次用餐體驗來說算是很滿意～
對於平常少吃全素的人來說，料理的非常真實，那道三杯雞實在讓人驚豔到不行，可以下飯好幾碗，本來很害怕會有猴頭菇，但是大部分都是豆製品。
可以無限續的小菜也都讓人很滿意，唯一覺得點錯的就是那盤炸香菇了，跟夜市買的炸香菇沒兩樣，最後吃的好膩也吃不完。"
 梁家嘉 ,https://www.google.com/maps/contrib/108738338208465712585/reviews?hl=zh-TW,5,True,383,朋友提前訂位的餐廳，建議真的先訂，我們去的時候外面人潮超多，我們不小心點的有點多，不過每道都好吃，吃素的好選擇，而且還有小菜可以自取，有幾個小菜真的是蠻辣的，一吃直接被嗆到，狂喝水！但是口味都是好的～
 Yu-Sheng Chou ,https://www.google.com/maps/contrib/104599688553458221384/reviews?hl=zh-TW,5,True,46,"推薦
脆皮冰花煎餃（野菜鮮若）
鮮若蒸餃（松露野菇鮮若）
熊貓麻婆豆腐
脆皮蘿蔔糕芋粄
香酥G佐梅醬
香椿水蓮野菇
松露菜飯
天然鹽滷木桶豆花
桂花烏龍茶凍🌟🌟🌟"
 Daisy Chang ,https://www.google.com/maps/contrib/102463504018465652139/reviews?hl=zh-TW,5,False,65,忽然很想吃圓圓的煎餃，剛好最近腸胃也有點不舒服，吃蔬食剛剛好。煎餃難免有點油但口味很好。現在是內用滿300就可以用自助吧，小東西但吃一波還是很飽，推薦唷！
 Christina Liu ,https://www.google.com/maps/contrib/104929022088306555732/reviews?hl=zh-TW,4,True,83,"整體環境很棒，乾淨/安靜，地點在忠孝SOGO後面走路3分鐘，還算方便。素菜菜色還不錯。鍋物都很好吃（推薦）跟炸蘿蔔糕很好吃！選擇很多樣，吃素的朋友可以聚會的好所在
唯一需要改善的是服務生最後要趕人的方式，需要再訓練一下😅不然前面好印象都被最後這個環節弄壞🥲"
 HermonyLee ,https://www.google.com/maps/contrib/112693152242773814509/reviews?hl=zh-TW,5,True,39,"小菜吃到飽這點著的還不錯，醃小黃瓜、泡菜、豆腐，木耳。
主菜部分沒有肉，都是素食的，很新鮮推薦可以來看看。甜點的豆花跟杏仁豆腐很好吃，不會太甜"
 林雅 ,https://www.google.com/maps/contrib/116068733975045360257/reviews?hl=zh-TW,4,True,89,"文青風的素食餐廳，
店內有自助吧吃到飽區，提供吃到飽的小菜，
點了很多人推薦的煎餃，內餡紮實飽滿，
但吃起來有點油膩。"
 Claire Ko ,https://www.google.com/maps/contrib/118427356331712600142/reviews?hl=zh-TW,5,True,13,"餐廳內裝潢大部分都是
溫暖木質與花磚暖暖的色澤質樸無華，
室外的建築風格呼應了整家店主體：豆腐！
印象最深刻是冰花煎餃推野菇口味口感香香脆脆
還有川味麻婆豆腐麻麻辣辣不會太嗆不吃辣的我也能接受味道不太太重太鹹剛剛好。
小菜也是無限次供應
豆腐醬的味道很特別一定要試試
太多品項了一時吃不完還會再訪來吃早餐😊"
 黃yah1o28@gamiI.com ,https://www.google.com/maps/contrib/110926113698476367287/reviews?hl=zh-TW,3,True,79,店內有小菜和沙拉、豆腐可無限取用，今天點的是2人套餐1288元，三樣菜一道主食和飲料2杯，2人食量不大，套餐會吃不完。以後再去可以點主食和其它菜，因為有小菜跟沙拉可以取用
 Iris Chen ,https://www.google.com/maps/contrib/110145444069966926368/reviews?hl=zh-TW,5,True,333,"位於東區環境舒服餐點美味的豆類蔬食餐廳
平日中午用餐時間人也非常多生意很好
木質調裝潢搭配寬敞空間很舒適
五樣小菜可以無限續用非常棒
木耳脆口彈牙清爽
小黃瓜看似重口味但反而不太鹹
豆芽菜比較重口味涼拌蓮藕酸甜開胃
另外還有麻辣豆腐可以無限享用超划算
紮實的木棉豆腐卻能吸附滿滿湯汁很好吃

另外還有一鍋昆布豆腐也是無限享用
搭配豆乳醬與油醋醬算是非常豐盛

這次點的主餐是酸白菜鍋$330
湯頭清爽沒有多餘油脂但完全不會清淡
酸度足酸白菜也醃漬得入味卻不負擔
菜量非常足水蓮、青江菜、高麗菜、花椰菜、金針菇、杏鮑菇滿滿一鍋
我去掉豆皮店員還有幫我換成青菜很貼心
另外有豆腐跟素丸子，丸子口感近乎泥狀

整體而言吃下來飽足卻沒有負擔
搭配小菜讓口味有更多變化不會乏味
很推薦！"
 Sana Pan ,https://www.google.com/maps/contrib/105067093426213408216/reviews?hl=zh-TW,5,True,100,和朋友一人點一份套餐，後面還有一區自助吧可以自己夾～沒想到自助吧的餐點跟正餐一樣用心！座位區都有隔蠻遠的，讓人感到放心自在～很多非蔬食的朋友來吃都推薦！和其他友人來吃體驗非常好❤️會在回來吃飯😊
 湘 ,https://www.google.com/maps/contrib/113120077725039212815/reviews?hl=zh-TW,5,True,108,"📍上善豆家@忠孝復興

✔️滷白菜腐竹丸320元
✔️綜合野菇天婦羅220元
✔️醬燒乾鍋G320元
✔️糙米飯40元

#蔬食#素食
整體吃下來很清爽！三道菜+糙米飯我都很喜歡～～每道菜調味很夠，醬燒雞完全可以騙過我這個食肉動物😂超喜歡滷白菜腐竹丸湯很甜丸子脆脆的😋👍🏻👍🏻

#這間我回訪至少三次

凱若下班後🐼@carol_offduty_"
 Anna ,https://www.google.com/maps/contrib/116745041082569499713/reviews?hl=zh-TW,5,True,79,"搜集各間上善豆家！這間是料理種類最多且完整的！😍有單點的餐、熱炒、還有自助吧（冷菜、沙拉、湯品）

是上善豆家裡CP值最高的，一定要嘗試
🔸鐵板豆腐"
