user_name,user_profile_url,rating,local_guide,comment_num,comment_text
 May Ho ,https://www.google.com/maps/contrib/105028729756358924332/reviews?hl=zh-TW,4,True,223,"主打有機健康的豆類製品，店內座位約70，從兩人座位到六至八人座位都有。
服務親切，餐點從早餐的燒餅、麵線、中餐的麵食、套餐到晚上以360元～450元的套餐為主，種類因時段不同而有多樣選擇，也有販售鍋貼、豆花、芝麻糊、燒餅、蘿蔔糕等小點。
內用需要加收一成服務費，若是用餐時間，建議事先訂位。"
 ki li ,https://www.google.com/maps/contrib/102305225072923419827/reviews?hl=zh-TW,4,True,298,"2018/04
清淡又不至於無味，黃豆肉丸好吃，套餐小菜、米飯特別，吃得出用心
煎餃很美，但過於油膩且有股酸味，不確定是不是筍子的關係
價格過高
-----------------------------------------------
2018/08
二訪下午茶，
豆花很好吃
麻油當歸麵線不錯
番茄麵沒味道
蘿蔔糕、竹簾豆腐很普通"
 Roy Wu ,https://www.google.com/maps/contrib/102082333936883575486/reviews?hl=zh-TW,3,True,181,從進門就覺得跟服務人員有疏離感，餐點還算不錯，可是電話一直響都沒有人去接？費用偏高
 喵喵 ,https://www.google.com/maps/contrib/106601066959043384030/reviews?hl=zh-TW,3,False,5,"點了麻婆豆腐套餐，算是好吃，價格380，需另外收服務費10趴，整體來說吃不飽，這個價格來說，CP值偏低
網路評價過譽🤔"
 黃閔琪 ,https://www.google.com/maps/contrib/105391782183226254382/reviews?hl=zh-TW,4,True,369,很舒適的環境，東西很好吃，也用心烹飪，價格偏高，希望收取服務費可以獲得對等的被服務感受唷，不然真的搞不懂為什麼要收服務費。大推酸辣豆腐湯，蘿波糕也不錯。
 Colorido Li ,https://www.google.com/maps/contrib/113773153464863163067/reviews?hl=zh-TW,5,True,351,服務人員都面帶微笑，而且在使用洗手間會優先禮讓！非常的親切且態度良好！菜色很多樣化！只是消費一個人要＄400以上的套餐有點小貴。有機會一定會再去！店內還有賣相關的素食產品非常的吸引人！
 Hung Tom ,https://www.google.com/maps/contrib/106023612775229438251/reviews?hl=zh-TW,4,True,46,"一個豆腐愛好者的評價：主菜味道稍嫌平淡，不差可吃但是不會讓我想念，甜點的豆花好吃。
要排隊的店。"
 chihyuan Cheng ,https://www.google.com/maps/contrib/111233110132131171578/reviews?hl=zh-TW,3,False,32,"價格在ㄧ提高中。。
口味OK"
 Rosie Wang (噗麥外星喵) ,https://www.google.com/maps/contrib/107079550536387044070/reviews?hl=zh-TW,3,True,17,主餐比較普通偏貴，自助吧也偏貴普通，爸爸蠻喜歡父親節特別套餐（幾乎都是豆類豆腐），但豆花真的非常好吃，整體來說還算可以，但應該不會再回訪，覺得cp值不夠高
 Lucy Liu ,https://www.google.com/maps/contrib/115586556711017836438/reviews?hl=zh-TW,5,True,83,餐點好，裝潢很棒，服務人員素質佳
 Koala Koko ,https://www.google.com/maps/contrib/117357740857556337748/reviews?hl=zh-TW,5,True,58,"天冷可以喝免費熱豆漿
選擇很多，適合人多一點一起吃😋
疫情時外送的好選擇之一"
 Douglas Liu ,https://www.google.com/maps/contrib/116504687066883725712/reviews?hl=zh-TW,2,True,101,週日下午14：30下午茶時間，煎餃已經賣完了。豆花滑順，但是沒有豆香味，糖水稍有焦味，花生稍少。田樂燒口感不錯。
 陳月英 ,https://www.google.com/maps/contrib/101294041223605289042/reviews?hl=zh-TW,4,False,32,"菜色ok,服務親切，環境整潔，附近有一個地下停車場。"
 魏志宇 ,https://www.google.com/maps/contrib/113400393279471258749/reviews?hl=zh-TW,5,True,18,"很有氣氛與品味的一間素食餐廳
很適合和朋友一起聚餐～～"
 Fong-jheng Lin ,https://www.google.com/maps/contrib/110984561953610651286/reviews?hl=zh-TW,3,True,105,服務和裝潢佳，但是單點的價位實在太高，蒸蔬菜二朵花椰菜加幾片蘿蔔90元，建議加價吃自助吧相對划算，內用有低消250元。
 ゆう ,https://www.google.com/maps/contrib/117485010487925969298/reviews?hl=zh-TW,3,True,271,套餐吃起來普通，分量不多，價格偏貴，不過豆腐和豆花還不錯，豆香味滿濃的，有收10%服務費，CP值不高
 ANNA GU ,https://www.google.com/maps/contrib/115466186395621639545/reviews?hl=zh-TW,5,False,7,素食早餐店對素食者可以大口品嚐不同的早餐配對，不用忌諱一般早餐店與葷食的味道。整體吃起來味道不錯，品質看的到
 林玉菁 ,https://www.google.com/maps/contrib/111923657624791747413/reviews?hl=zh-TW,5,False,5,"很特別的一家店，是我少數見到以有機及豆類食材去研發菜色的店家。
服務人員非常的親切且態度良好！菜色很多樣化！

點了豆全席餐，好吃又很有特色，一次滿足我的期待，十分推薦！
下次還會和朋友再來吃。"
 Arvin ㄏㄨㄤˊ ,https://www.google.com/maps/contrib/106946148351796070444/reviews?hl=zh-TW,3,True,47,"沒有到""很好吃""或""非吃不可""的程度！用餐時段限時90min;有低消限制，對於菜單推薦的豆腐丸子跟冰花煎餃，真的還好而已，總結......豆腐口感很紥實。。。結束！！"
 Jenny Chen ,https://www.google.com/maps/contrib/111441384915995137820/reviews?hl=zh-TW,4,True,205,精緻素食餐，有點套餐可吃自助沙拉吧。麻油蛋是家人喜愛的，另外有麵類、豆類和鍋物餐食可供選擇。
 i H ,https://www.google.com/maps/contrib/118304116463404625136/reviews?hl=zh-TW,3,True,21,東西很好吃，可惜價位偏高，這個價位還能吃到更好吃的，服務品質中上
 Carrie Chen ,https://www.google.com/maps/contrib/115824735354025738384/reviews?hl=zh-TW,4,True,220,"食物清爽，走自然風，豆漿香濃豆腐有豆香，主餐紅燒獅子頭口味較淡，咖哩豆腐素基比較稍微重口味好吃下飯。
一人主餐+沙拉吧涼菜飲料也可用,大約300多元，有飲料二種自取豆漿及麥茶，雖然自取沙拉吧食物很簡單幾樣而已，整體走素食清淡風格，也是一特色。
豆漿不大瓶約360ml，一瓶原味印象約55元起跳，有的約65元不便宜喔，現在濃豆漿大概都這價位。"
 Joanne Hsu ,https://www.google.com/maps/contrib/111475442840651180771/reviews?hl=zh-TW,4,True,407,素餐不錯還有古早味豆花
 RED TEA ,https://www.google.com/maps/contrib/103250461024831236098/reviews?hl=zh-TW,5,False,4,蘿蔔糕真的很好吃，還有木棉豆腐吃的口感外酥內軟真的很好吃還有我比較推薦的是番茄滑蛋麵超好吃的（吃素的人一定要來這家吃吃看非常推！
 廖家祥 ,https://www.google.com/maps/contrib/115386236034060816656/reviews?hl=zh-TW,5,False,13,是一間很用心的店，食材用得很好，服務人員服務的很周到，吃不出來完全素食，店裡很有風格，推薦早餐，跟外面的燒餅油條完全不一樣
 H.B Lin ,https://www.google.com/maps/contrib/109475001180350879947/reviews?hl=zh-TW,5,True,50,"餐點口味好吃，有素食自助吧這點非常吸引人，用餐環境不錯。
用餐時段預訂一下會比較好"
 Tasha Jui-Yun Chang ,https://www.google.com/maps/contrib/114097708304633663044/reviews?hl=zh-TW,5,False,10,終於有家可以擺脫髒亂或擁擠印象的豆漿店！無論是食物品質或是人員服務，都可以讓客人體驗最單純的食物滋味。
 Ingram Chang ,https://www.google.com/maps/contrib/114304480045517942252/reviews?hl=zh-TW,5,True,53,用餐環境很棒，推薦「有機豆全席」可以吃到不同口感的驚為天人風味；「有機套餐」很好下飯，也不錯吃；「天然鹽滷豆花」非常滑順；「冰花煎餃」擺盤很美好吃（略油），如果白飯再加把勁就滿分了!價位套餐360起
 龍山國小陳薏如 ,https://www.google.com/maps/contrib/113136551572890528046/reviews?hl=zh-TW,5,True,114,"非常好吃且精緻的餐廳
喜歡豆味的人要試試！

必點的現做豆皮
朋友形容
簡直就像嬰兒的嘴唇👄般
嫩到極致的天然美味！"
 Jack Tseng ,https://www.google.com/maps/contrib/106934735394346930986/reviews?hl=zh-TW,2,True,112,"跟全家聯名的乾拌麻辣麵有點雷太鹹而且豆乾變得難吃麵條沒彈性
可惜為了聯名商品砸了招牌"
 林佳聖 ,https://www.google.com/maps/contrib/111155317513250400301/reviews?hl=zh-TW,5,True,138,餐點都是由豆腐相關製品，製作而成，吃起來清爽沒有負擔。裝潢處處有巧思。套餐還有自助吧可供使用，推薦給大家。
 陳昊 ,https://www.google.com/maps/contrib/111055261045406056088/reviews?hl=zh-TW,3,False,14,個人覺得味道偏淡，整體來說個人覺得還好
 p86111 ,https://www.google.com/maps/contrib/102495087023761052213/reviews?hl=zh-TW,4,True,524,"素食餐廳，但我不吃素
但很好吃
煎餃剪的好漂亮
素雞肉乾鍋跟叉燒酥都好吃不像素
蔬菜豆腐豆漿吃到飽很棒！"
 Píng Lîm Ngôo ,https://www.google.com/maps/contrib/111676937765009623873/reviews?hl=zh-TW,4,True,448,煎餃，豆腐料理很不錯，環境明亮舒適
 劉怡君 ,https://www.google.com/maps/contrib/103273284444888207993/reviews?hl=zh-TW,4,True,107,室內空間優雅舒適服務人員素養佳菜單看起來樣樣美味愛吃辣的我點了川味麻辣豆腐套餐有辣有香但是太鹹連配飯都覺得鹹要喝水😂不過整體是不錯的會再帶家人朋友前往
 Violet Peng ,https://www.google.com/maps/contrib/117815981805713774391/reviews?hl=zh-TW,3,False,13,"東西不難吃，
但給的量都好小氣啊～
木桶豆花的花生怎麼看都不是四人量⋯
加點還要10元。"
 黃香蘭 ,https://www.google.com/maps/contrib/113653926914859733781/reviews?hl=zh-TW,4,True,87,此店以非基因改造有機黃豆製品如豆腐豆包豆皮豆漿搭配入菜，有早午晚餐及下午茶(下午3點一5點)服務，午晚餐為套餐，早餐還有傳統燒餅油條7:30-11:00。下午茶有多樣點心選擇，麻油薑泥配寬板蕾絲麵及煎餃三色蘿葡糕配熱騰騰又濃又香的鹽滷豆漿皆是不錯的選擇。可選早午晚做不同的嚐試
 Joey Tseng ,https://www.google.com/maps/contrib/112783072355404118702/reviews?hl=zh-TW,5,False,8,冰花煎餃真的特好吃！豆漿也非常香醇！是一個非常有質感的素食餐廳，連吃葷的我都覺得非常好吃！
 Rebecca Lee ,https://www.google.com/maps/contrib/117694777506989415372/reviews?hl=zh-TW,5,True,630,素食者的天堂，喜歡清淡口味的素食者可以嚐嚐這裡，套餐、單點都是不錯的選擇！環境更是講究，日式風格讓客人感到沈靜！
 Sin-Yu Cheng ,https://www.google.com/maps/contrib/113202009891312610255/reviews?hl=zh-TW,4,True,27,有點像是半吃到飽的餐廳(選一個主餐旁邊的飲料、小菜、沙拉吃到飽)，套餐價錢約300起跳，會收10%服務費，個人覺得單點主餐分量太少，點套餐較划算喔～建議先訂位，或是早點到，因平日約快七點就都客滿了～
 洪思妤 ,https://www.google.com/maps/contrib/115747088439692846575/reviews?hl=zh-TW,2,False,3,"麵送來的時候都已經結塊了
我煮的都比他好吃
單點還要160元CP值真的太低"
 Tatianna Wu ,https://www.google.com/maps/contrib/106305490775538640997/reviews?hl=zh-TW,1,False,7,"東西好吃、願意等待。但是服務品質差！
點餐確認後40分鐘未上、選擇不等後費用還未取消！消耗時間、人力，可惜了！"
 陳淑敏 ,https://www.google.com/maps/contrib/101675151234468970913/reviews?hl=zh-TW,4,True,109,隨意走著，竟然發現了一家有素食可以吃的餐廳，真是太開心了！豆花真的是原味！好吃，豆漿純天然！非常讚！
 シフォン ,https://www.google.com/maps/contrib/102870679788557452708/reviews?hl=zh-TW,5,True,225,很棒的素食餐廳，豆製品沒有油耗味，樸實的豆香味很迷人，加上套餐份量很夠，男孩子也可以吃得很飽，裝潢氣氛與餐點的器皿也都看得出來相當用心。
 Jeffrey Yang ,https://www.google.com/maps/contrib/109855961784713391502/reviews?hl=zh-TW,1,False,1,10/9至貴店消費，因快要打烊，服務人員到桌邊收取信用卡，刷卡後卻沒有主動到桌邊核對消費金額及卡片持卡人，客人要離時應席時到櫃檯，服務人員才交付卡片，且沒有核對消費資料，如此恐造成盜刷之虞，建議貴店結帳時應該更謹慎相待。
 JASON chang ,https://www.google.com/maps/contrib/115103649127862870944/reviews?hl=zh-TW,2,False,14,"裝潢典雅燈光佳,價格高,口味中上,出餐慢,整體CP值偏低最後就是自助吧的地方雖然東西不錯食材也看起來新鮮但很多蟲飛來飛去完全沒有興趣拿那些很多蟲飛過的食物...應該不會再光顧"
 採小米 ,https://www.google.com/maps/contrib/112249216061940976934/reviews?hl=zh-TW,4,True,78,東西簡單但是可以料理的很美味～尤其是他的蘿蔔糕100分，火鍋湯頭好喝又天然只可以火鍋的食材太少450元CP值太底，杏仁茶100分，大推
 Kuei-chin Chang ,https://www.google.com/maps/contrib/108096994296558282629/reviews?hl=zh-TW,3,True,15,口味還不錯，但餐點單價偏高，建議設個服務鈴，要點餐都不知道要揮手幾次才能叫到服務生
 Yu Ted ,https://www.google.com/maps/contrib/109964232116180204998/reviews?hl=zh-TW,5,True,118,"店內有古樸的設計感，餐點看上去也許不是極度華麗，但吃得出用心。

個人非常喜歡蔬食buffet的胡麻醬，搭配小黃瓜或豆腐都好吃！"
 飛霏 ,https://www.google.com/maps/contrib/102789116533330003262/reviews?hl=zh-TW,3,True,103,"價格偏高，菜色普通，CP值沒有很高
一份套餐食量比較大的人是吃不飽的
小菜部分，涼拌番茄還不錯吃"
 Jessica Chen ,https://www.google.com/maps/contrib/115081320372565380202/reviews?hl=zh-TW,2,True,165,食物還行環境也ok但價格以這樣的內容來說真的偏貴豆花和杏仁凍不錯
 Shen-Yu Lin ,https://www.google.com/maps/contrib/102381019654393576682/reviews?hl=zh-TW,5,False,12,"很好吃的中式素食料理！麵很棒味道很棒
另外煎餃與花生湯也讓人驚艷！
會想要再次到訪❤️"
 楊CC ,https://www.google.com/maps/contrib/116000327145423917176/reviews?hl=zh-TW,5,True,38,吃完才想到還沒拍照打卡。蔬食料理精緻美味，若2人以上一起來吃則價格尚屬實惠！
 Phoebe Li ,https://www.google.com/maps/contrib/113254985996970329341/reviews?hl=zh-TW,5,False,5,"食物非常好吃健康，吃素依然可以簡單優雅！
豆漿必喝，真的是濃醇香，連續喝了四碗"
 Chiu MaoMao ,https://www.google.com/maps/contrib/102285311435453954101/reviews?hl=zh-TW,5,True,45,這是一間可以每天吃的蔬食餐廳，推薦大家要升級成套餐，蔬菜bar無限吃，小菜都很好吃喔！
 Chao-Yi Lin ,https://www.google.com/maps/contrib/101020198799340936067/reviews?hl=zh-TW,5,False,16,和父母和孩子二次造訪，店內用餐環境整潔樸素，令人放鬆；餐點健康美味，真的是茹素者的福音！
 Maggie ,https://www.google.com/maps/contrib/113717699422573377288/reviews?hl=zh-TW,4,True,192,"把傳統中式早餐精緻化。
食材講究，開放式廚房，
製程公開透明，用餐環境整潔。
想吃健康的燒餅油條豆漿就會再來。
👍"
 Pat Chen ,https://www.google.com/maps/contrib/110159205624115361630/reviews?hl=zh-TW,5,True,210,豆漿好喝！餐點調味濃淡適宜，麵體有嚼勁，下次會再訪
 stiff chiou ,https://www.google.com/maps/contrib/117574271909538525642/reviews?hl=zh-TW,1,True,209,"烤豆皮比較有特色，其他的東西普通
自助吧台菜色過少，而且有一半的東西都是偏酸的口味
對於怕酸的人，去之前要三思"
 Li Perry (右初柚蔭) ,https://www.google.com/maps/contrib/102174326950007843629/reviews?hl=zh-TW,5,True,18,番茄滑蛋湯麵跟抄手好吃下次還會來光顧紅豆酥一級棒服務人員態度真棒
 鄧紹禹 ,https://www.google.com/maps/contrib/114937191124729907881/reviews?hl=zh-TW,5,False,1,"餐點新鮮好吃美味
服務態度特優
已期待下星期再來"
 gilakung w ,https://www.google.com/maps/contrib/113564325569877292600/reviews?hl=zh-TW,3,True,62,推薦早餐的豆漿，米漿都很棒加上燒餅蘿蔔蛋絕配，套餐的小菜好像都是那幾樣不怎麼開胃，價格稍高，要加服務費
 Jeff Shih ,https://www.google.com/maps/contrib/103121770594958862531/reviews?hl=zh-TW,5,True,372,蠻舒服的一家店，很乾淨。一進門就能聞到豆香味，而且餐點也都蠻不錯的，早餐大推酸辣湯跟九層塔蛋餅
 Jessica Chin ,https://www.google.com/maps/contrib/112789103935501995082/reviews?hl=zh-TW,5,True,29,"好吃到讓人忘記它是素食！
豆腐丸子很特別，湯和其他小菜也不輸主食，值得帶崇尚健康飲食的朋友一起來！"
 Darren H. ,https://www.google.com/maps/contrib/102373368782419461319/reviews?hl=zh-TW,5,True,787,店家提供蠻舒適的場所硬要挑毛病的話兩人桌座位區冷氣有點強到下天穿短袖對歪嘴瘦雞我有點太涼爽單價雖然篇高但是店家沒有限制時間不失為一個想要朋友逛累了一起坐下來聊聊好地方東西都不差豆花很嫰入口滑順，芝麻糊香氣跟濃甜度我也覺得剛好，趁熱吃，非常好服務也蠻自然親切
 許俊湧 ,https://www.google.com/maps/contrib/107404323270993693346/reviews?hl=zh-TW,5,True,48,非常好的素食餐廳。
 Julie Lee ,https://www.google.com/maps/contrib/110045889446608665992/reviews?hl=zh-TW,2,False,2,我和先生之前也去過幾次.今天中午再次光臨.想要反應的是，今天氣溫偏低，喝的茶，吃的鍋都感覺只有溫溫的，沒有熱度.真是失望.
 梁建仁 ,https://www.google.com/maps/contrib/111350051659409286611/reviews?hl=zh-TW,5,False,8,兒子的邀約，讓我們體驗豐富的素食饗宴。用心的佳餚，服務的熱忱和貼心的推薦，是幸福的好滋味~讚不絕口~
 J S ,https://www.google.com/maps/contrib/111791437520483369630/reviews?hl=zh-TW,3,True,257,還不錯，服務人員很認真，但小貴，8顆高麗菜鍋貼搭一碗薑汁豆花就快$350，高麗菜鍋貼旁邊的雪晶很酥脆好吃
 akira Chen ,https://www.google.com/maps/contrib/100751706127274493948/reviews?hl=zh-TW,4,False,28,餐點不錯但是某些服務人員冷淡對客人連謝謝都不會說沒有服務精神如果可以改進更好
 Delphine Chiu ,https://www.google.com/maps/contrib/114520141356654101071/reviews?hl=zh-TW,4,False,23,蠻精緻的，擺盤調味都很好。價位偏高，但份量對我們來說剛剛好。
 ANNE WU ,https://www.google.com/maps/contrib/108414380588293216726/reviews?hl=zh-TW,5,False,6,東西好吃，服務親切~種類很多，價位適中，會想再去一次的好餐館，適合全家大小一起享用美好素食的地方~~
 abby Li ,https://www.google.com/maps/contrib/104907040329680866590/reviews?hl=zh-TW,2,True,101,炸醬酵素麵超辣(菜單沒寫會辣)吃起來就像曾拌麵的香蔥椒麻口味然後底部都是辣油吃完麻又油不推其他東西也都蠻貴的沒什麼特別豆花好吃但一小碗75
 Pearl Hung ,https://www.google.com/maps/contrib/110480284354889750565/reviews?hl=zh-TW,5,True,33,餐點精緻，份量適中，對食量大的人可能會有點空虛，不過很好吃，煎餃外脆內多汁，冰豆漿就是很純的豆味~
 Cate B ,https://www.google.com/maps/contrib/103592578968717480356/reviews?hl=zh-TW,5,False,8,"原本很喜愛的一家餐廳,近來餐點的製作品質下降很多,覺得經營者應該要注重一下餐點的品質,時好時壞!原本的燒餅很好吃,最近改的新版真的很不OK!"
 Mollie Lin ,https://www.google.com/maps/contrib/109607156633708479014/reviews?hl=zh-TW,1,True,18,已經吃完的客人佔著四人桌用筆電看影片，一個還在寫作業，然後跟現場候位的客人說要等四十分鐘，食慾全消
 李月容 ,https://www.google.com/maps/contrib/111259819809897944582/reviews?hl=zh-TW,2,True,108,餐廳環境很不錯，低消每人300，這次點的冰花煎餃內餡芹菜味不好吃，蘿蔔糕沒啥蘿蔔味總體來說不會再想去用餐
 王澤宇 ,https://www.google.com/maps/contrib/111753202524927079222/reviews?hl=zh-TW,1,True,53,撇開所謂健康飲食角度，東西實在難以下嚥，環境嘈雜，沒有什麼創新的料理，就是玩素食那幾樣基本食材。
 顏佑諭 ,https://www.google.com/maps/contrib/113457813972938346086/reviews?hl=zh-TW,3,True,46,"環境氛圍都很好
但我覺得食材上可以更加強！
很普通！！
就是會去試一試
但不會再去吃第二次，哈"
 Apple Huang ,https://www.google.com/maps/contrib/113075971390661969866/reviews?hl=zh-TW,5,False,12,豆花跟煎餃都好好吃😋
 許乃乃 ,https://www.google.com/maps/contrib/105296561996702821070/reviews?hl=zh-TW,1,True,41,"胎裡素33年
與女友點了
咖哩豆腐煲沒味道很稀
川味麻辣豆腐，不麻不辣
暴雷
這價格不便宜
Cp很低
很氣"
 倫敦樹 ,https://www.google.com/maps/contrib/115464367083307365915/reviews?hl=zh-TW,5,True,319,"蒸芋頭糕比煎的好，濃厚香氣。
假日午餐人多，最好先訂位"
 Maggie I’m ,https://www.google.com/maps/contrib/113252219207227172452/reviews?hl=zh-TW,4,True,371,"豆花，豆腐的材質，口感不錯
烤味增豆腐很不錯，但是有點乾乾的
整體環境舒適，有日式禪風的寧靜感都是木頭質感的裝潢"
 Cattie Chen ,https://www.google.com/maps/contrib/108501819837590480969/reviews?hl=zh-TW,5,True,24,好吃，想知道這是什麼菜
 Ya Jing Tsai ,https://www.google.com/maps/contrib/115558230351387283931/reviews?hl=zh-TW,5,True,51,年輕的客群很多店裡環境很舒服
 Name Name ,https://www.google.com/maps/contrib/102070645915551497910/reviews?hl=zh-TW,3,True,59,食物品質還可以，但豆皮沒有預期好(廣告說得太厲害)。價格偏高(高出10-20%)，CP值中低。
 David ,https://www.google.com/maps/contrib/108069269096981981281/reviews?hl=zh-TW,1,False,1,早上10點半左右進餐廳沒有人招呼帶位，問店員是不是自己找位子，直接回說早餐都沒了，服務的態度真的需要改善！
 吳酈屏 ,https://www.google.com/maps/contrib/107227634554976076445/reviews?hl=zh-TW,5,False,3,第一次來就有驚豔的感覺，不管是鍋類的或是麵點都好吃，而且食材新鮮，也看的出準備食物的用心，真的大推。
 陳美如 ,https://www.google.com/maps/contrib/117911304764593176650/reviews?hl=zh-TW,4,True,172,"裝潢舒適，氣氛和風。
餐點精緻美味，服務人員客氣有禮。
值得推薦的蔬食餐廳。"
 郭毓茹 ,https://www.google.com/maps/contrib/116783666369303431635/reviews?hl=zh-TW,4,True,238,鍋貼胡麻涼皮清爽好吃！杏仁茶香濃好喝！整體而言小菜類比較好吃！
 PeiChi Tsai ,https://www.google.com/maps/contrib/102572178240563002085/reviews?hl=zh-TW,5,True,239,素食餐廳東西精緻美味服務好
 Lulu Chen ,https://www.google.com/maps/contrib/107453599339436746823/reviews?hl=zh-TW,4,False,21,餐廳和員工的打扮都很特別。吃的是各種不同從軟到硬的豆腐和豆類製品。東西好吃！聽說是嚴長壽的親戚開的！
 林文生 ,https://www.google.com/maps/contrib/113089860336956679398/reviews?hl=zh-TW,4,True,11,廚藝精湛偏細••座位有配合防疫規劃••享食超安心°讚啦~
 LingYing TSENG ,https://www.google.com/maps/contrib/109326999957142664692/reviews?hl=zh-TW,5,True,255,"餐點健康好吃，
服務不錯"
 林月柔 ,https://www.google.com/maps/contrib/101134942065038061401/reviews?hl=zh-TW,1,False,5,7點快8點的時候想用餐說要等半小時就留了電話結果到了8.30電話沒打來我們就先去店裡看看情況結果店裡一半都空了然後店員居然跟我們說用餐時間是到9點廚房沒有要供餐了那請問一開始為什麼要讓我們留電話等位子呢不是很能理解害我們白白浪費了半小時什麼都沒吃到：）
 Bryant Kobe ,https://www.google.com/maps/contrib/106370774579246023470/reviews?hl=zh-TW,3,True,644,🍚
 ALLEN CHO ,https://www.google.com/maps/contrib/104082988863368575462/reviews?hl=zh-TW,5,False,35,餐點為之驚艷，而且二人套餐一定能吃得很飽
 Jenny Liu ,https://www.google.com/maps/contrib/116895680972295061237/reviews?hl=zh-TW,5,True,109,"Oneofmynewfavorites!Theservice,thefood,thesoyproducts...yum!!Veganfriendly,hopetobewholerestaurantvegansoonenough.Iwannaeat油條&酥餅,pls~~~

喔，有一美中不足，煎餃太過油膩，連盤子外緣都是油的。Anoverrateditem.:("
 吳航洪 ,https://www.google.com/maps/contrib/115499121501966901420/reviews?hl=zh-TW,5,False,4,餐點豐富美味、選擇多樣，用餐空間很大。用餐時段人潮蠻多的，尖峰時間可能要稍微等候才有空位。服務人員笑容親切有禮，適時問候卻不會感覺受打擾。
 祐成李 ,https://www.google.com/maps/contrib/105129565990510772171/reviews?hl=zh-TW,2,True,42,"服務生不太會介紹，料理也實在是....
跟斜對面的全國素食沒什麼差異......."
 蔣俊宏 ,https://www.google.com/maps/contrib/106223163047165786482/reviews?hl=zh-TW,1,False,8,"低消300元和一成服務費不是每個人適用
只要你是一個阿嬤來或是不會講中文的外國人
就可以免低消和收服務費
差別待遇的店家真是太棒了
3/1818:30消費經驗"
 Yuling Hsu ,https://www.google.com/maps/contrib/114704646659967750578/reviews?hl=zh-TW,4,True,128,"餐點品質不錯，價位稍高一些。
服務可以再進步，不是態度不好，是可以稍體貼一點，畢竟有收服務費。"
