user_name,user_profile_url,rating,local_guide,comment_num,comment_text
 Joce Gingin Yang ,https://www.google.com/maps/contrib/103319253102438942730/reviews?hl=zh-TW,3,True,77,"-環境很不錯但還是有一兩隻蒼蠅跟蚊子
-服務中規中矩
-點了450的麻辣鍋，但不麻也不辣
-即使被告知要蓋上鍋蓋，但湯沒有滾開過，食材是悶熟而非燙熟
-菜盤份量太少"
 張聖芬 ,https://www.google.com/maps/contrib/116221305514904074787/reviews?hl=zh-TW,3,True,112,餐點豐富，服務人員態度好，但出菜時間慢，光點好一份套餐到吃到嘴裏要等45分！
 Marg. C. ,https://www.google.com/maps/contrib/101929567070625506965/reviews?hl=zh-TW,3,True,389,餐點精緻，美味程度與價位、外觀有些許落差。
 朱小嫥 ,https://www.google.com/maps/contrib/107545787337737485285/reviews?hl=zh-TW,4,True,48,"好吃的素食餐廳🍴
服務態度好，環境氣氛讚👍
自助吧及餐點非常好吃😋
下次還會再品嚐！"
 Summer ,https://www.google.com/maps/contrib/113727434859577466285/reviews?hl=zh-TW,4,True,64,清爽好質感的食物，麻油雞麵線、蕃茄麵，可以品嚐到很真實食物的原味。豆花和嫩豆腐一樣軟，好吃。
 Yan Zi Jhuo ,https://www.google.com/maps/contrib/111616431430808950812/reviews?hl=zh-TW,3,False,20,最後加點時間到了不會事先提醒，直接六十分鐘後就開始一直收拾餐盤提醒時間到了趕人，服務態度不太好。
 Enya#8417 ,https://www.google.com/maps/contrib/101950914980029840240/reviews?hl=zh-TW,5,True,403,"雖然價位有點高但是很值得
每一口都感覺得到店家的用心
好吃！"
 KKJerry ,https://www.google.com/maps/contrib/107703444842941379987/reviews?hl=zh-TW,1,False,3,"1.真的很難吃
2.價格也太不合理
在超商裡真的只有等到即期報廢..."
 無極 ,https://www.google.com/maps/contrib/113771532033258752068/reviews?hl=zh-TW,5,True,518,杏仁茶好吃、搭配油條一口氣吃了兩碗、油條好吃超蓬鬆+口感紮實。蘿蔔糕好吃、但是好像參雜了點胡椒的味道。蘿蔔絲餅也有水準。蛋餅算大份的。喜歡這兒、畢竟中式的傳統早餐店很難得像這樣有服務有冷氣的。早餐還有飯糰哦！很樸實的飯糰反而被店內其他美食硬是給比了下去。雖然主打「豆類製品」但是上述的品項表現很出色！這天來用餐時接近中餐供應、店內服務員大概外場就至少有6位、人力非常充足！不用怕點個菜要等老半天。
 August Reem ,https://www.google.com/maps/contrib/100862127878541666371/reviews?hl=zh-TW,5,True,79,最推絲瓜小籠包、咖哩餃、蘿蔔糕、紅油抄手👌🏻
 林偉力 ,https://www.google.com/maps/contrib/107826545515271013753/reviews?hl=zh-TW,2,False,10,"已知用鹽？
味道淡到我以為我確診了
腐乳空心菜當清炒料理就對了"
 謝宗宇 ,https://www.google.com/maps/contrib/106900410222386605782/reviews?hl=zh-TW,5,True,346,精緻美食，環境好，服務客氣，蛋餅，燒餅油條，酸辣豆腐腦俱佳，麵粉香，價格實惠。非平價，然也不貴，早餐人均150-200就可以吃很好。
 陳立蓉 ,https://www.google.com/maps/contrib/118327222520896032011/reviews?hl=zh-TW,5,True,526,吃過最好吃的素食餐廳，特推他們的蘿蔔糕還有豆漿！真心推薦素食主義者來享用！
 Hao chiu ,https://www.google.com/maps/contrib/112329141835929228772/reviews?hl=zh-TW,4,True,75,"豆製品很好吃味道清淡口感紮實，豆花一定要點
服務態度滿分💯，去之前最好事先訂位"
 溫家慶 ,https://www.google.com/maps/contrib/115325010435361664212/reviews?hl=zh-TW,5,True,226,"😍服務態度親切用餐環境佳
菜單上套餐包含沙拉
我說不用沙拉後店員說可以換燙青菜
好吃給了給了5顆星😋"
 廖冠瑀 ,https://www.google.com/maps/contrib/110158119556582887052/reviews?hl=zh-TW,5,True,28,非常用心的一家店👍🏼服務品質很讚👍🏼而去食物更是好吃😋豆類愛好者必來
 陳俞靜 ,https://www.google.com/maps/contrib/110538017474177591544/reviews?hl=zh-TW,5,True,158,好喜歡這家店的氛圍，餐點清淡且種類豐富，非常符合我的口味，滷白菜豆腐丸好吃～有機食材雖然不平價，但好吃又值得
 Lynn ,https://www.google.com/maps/contrib/102710856551244161666/reviews?hl=zh-TW,4,True,158,素食餐點好吃無負擔，點套餐很划算，有沙拉吧可以享用
 Erica Chien ,https://www.google.com/maps/contrib/101189453204436299891/reviews?hl=zh-TW,5,True,172,超好吃的中式素食料理，或許是坐落在台北市的原因，價格稍高。但很適合與朋友聚會，偶爾品嚐一次，是很不錯的經驗！
 Paru T. (Paru) ,https://www.google.com/maps/contrib/106558638829613253890/reviews?hl=zh-TW,5,True,31,鹽滷豆花好有豆味，必吃！其他品質都很好，素食尚品，低消$300👍🏻
 Gina ,https://www.google.com/maps/contrib/101858460121340682341/reviews?hl=zh-TW,5,False,7,特別推麻油烘蛋、塔香鐵板豆腐跟煎餃，煎餃的口味濃郁，香脆好吃！
 Yun Huang ,https://www.google.com/maps/contrib/104875236037327031681/reviews?hl=zh-TW,3,True,68,不差，但也沒有驚艷，餃子非常還好，低消又要250，其實有時這些硬性要求讓一般胃口的人無法嘗試
 Tzu-Ching Chou ,https://www.google.com/maps/contrib/108707981218654119064/reviews?hl=zh-TW,5,True,30,豆料理好吃，口味適中，自助吧很豐富，可以吃到豆腐的原味，環境舒適，可以吃美食又方便聚餐聊天的好地方！
 雪莉蓮夢露Sherry’s Glamping Lifestyle ,https://www.google.com/maps/contrib/111478062608783304148/reviews?hl=zh-TW,4,True,156,食材天然原味.服務人員非常優秀.細心用心！燒餅不夠酥脆有點可惜.
 Mag Tsai ,https://www.google.com/maps/contrib/109405475943668152959/reviews?hl=zh-TW,5,True,70,特地一早來吃早餐，酸辣豆腐腦味道很好，燒餅油條，蛋餅，飯團都很美味👍
 簡阿哲 ,https://www.google.com/maps/contrib/108883633181635957375/reviews?hl=zh-TW,5,False,10,而內心而發的服務！是我強力推薦的重要因素！餐點美味（素食）跟用餐環境都讓人滿意！
 Yi-hsuan Chen ,https://www.google.com/maps/contrib/115112686275379255651/reviews?hl=zh-TW,2,True,58,"中午外帶九宮格便當$250
店員態度不好
內容物感受不出餐點價值
飯也只有半碗
不值得再買"
 HJ C ,https://www.google.com/maps/contrib/114538018815822090659/reviews?hl=zh-TW,5,True,208,早餐新選擇，非常適合帶外國人來體驗台灣式早餐，燒餅油條加豆漿，酸辣豆腐腦必點！
 Li Valerie ,https://www.google.com/maps/contrib/115996563551953055109/reviews?hl=zh-TW,4,True,239,梅干苦瓜豆皮套餐，附上有機宜蘭米，及自助saladbar.味道很好，價格略高。可能下午客人多，招待一般般，等待安排入座時間比較長
 郭彥儀 ,https://www.google.com/maps/contrib/103453254206465857756/reviews?hl=zh-TW,4,True,83,"主菜表現一般
小菜好好吃！！
煎餃雖然服務生有說放一下讓它瀝油但還是滿油的味道不錯但吃多會膩適合找人一起分著吃"
 undies ,https://www.google.com/maps/contrib/113533564105323779005/reviews?hl=zh-TW,4,True,178,好像是全素食的豆類中式餐廳，味道不錯，座位舒適，餐廳美麗
 Tiffany Huang ,https://www.google.com/maps/contrib/103399702290914504517/reviews?hl=zh-TW,3,True,206,食物真的普通，不值這個價錢，但服務很好值得稱讚👍
 yaya li ,https://www.google.com/maps/contrib/117189007318068052239/reviews?hl=zh-TW,5,True,33,"蔬食吧的小菜都很好吃
尤其是豆腐
淋上胡麻醬超級美味
連不愛吃豆腐的人都會讚賞
沾醬另有一個豆腐醬可淋生菜
味道清新又特別
是會再光顧的店家"
 雅婷林 ,https://www.google.com/maps/contrib/104050590649130056835/reviews?hl=zh-TW,3,True,86,周六晚上兩人用餐，幸運地沒有等太久就入座。工作人員服務非常好，冰花煎餃好吃，但椒麻麵和麻油麵線令人失望，一碗$180+一成服務費的價位CP值真的偏低。
 Tseng Mickey ,https://www.google.com/maps/contrib/107758422588215706448/reviews?hl=zh-TW,4,True,31,"酸辣湯非常非常的好吃，豆花非常的嫩，第一次發現豆花不用吃甜的也可以這麼好吃，念念不忘🤤
店內的招牌是他的燒餅，我個人覺得有些太乾，要一直配液體，香味也還好，總體不太喜歡"
 Ina Wang ,https://www.google.com/maps/contrib/114619203561082514017/reviews?hl=zh-TW,4,True,255,餐點用心，都很清淡好吃。服務人員態度很好。唯一希望調整的地方是冷飲的選擇可以多一些。不要只有豆漿或米漿而已。吃的午餐已經都是豆類製品了然後冰的冷飲只能配豆漿⋯好膩好膩
 짱근이 ,https://www.google.com/maps/contrib/100120260868722965287/reviews?hl=zh-TW,2,False,53,"很失望。之前在百貨店點了很多次外送，印象不錯。首先雙人座位很壅擠，和隔壁、後排距離很近，無法放鬆，走道上的服務人員看起來也很不方便。服務態度沒有不好，但和好幾位互動都感受到非常生疏僵硬、訓練不完整、廁所也非常濕，浪費了美麗的裝潢。
重點是餐點不難吃也沒有很好吃。煎餃非常油，讓我後悔沒有點蒸餃。招牌鐵板豆腐和炒青菜味道也都不如預期，豆腐偏乾、青菜偏油，甜點豆花、杏仁豆腐覺得完全沒有價值，不好吃。唯一覺得不錯的是沙拉吧的小黃瓜。
身為素食者非常珍惜與支持素食餐廳，但只留下失望、不會想再訪、不推薦，個人觀感僅供大家參考。"
 元 ,https://www.google.com/maps/contrib/116410604124798015843/reviews?hl=zh-TW,5,True,17,非常好吃的九宮格便當，每道菜都有自己的味道
 Lilian Chen ,https://www.google.com/maps/contrib/106245951775339566762/reviews?hl=zh-TW,5,True,"1,134",自助吧小菜調味很不錯，豆漿好喝
 Yun C. ,https://www.google.com/maps/contrib/112969255527994039794/reviews?hl=zh-TW,3,True,190,可能因蔬食類食物品項不多，價位偏高。
 DaWang Wei ,https://www.google.com/maps/contrib/103432833262144428634/reviews?hl=zh-TW,4,True,49,當日食用了麻婆豆腐套餐，有沙拉自助吧可以使用，口味偏鹹，環境寬敞。
 S品樂 ,https://www.google.com/maps/contrib/105195176320059492224/reviews?hl=zh-TW,4,True,112,"天然素食料理,豆漿,杏仁茶濃純香,豆花好吃,煱貼酥脆."
 Betty Hsu ,https://www.google.com/maps/contrib/104097033264027927796/reviews?hl=zh-TW,5,True,622,很棒的素食餐廳，低消250加服務費。
 rubio silver ,https://www.google.com/maps/contrib/108539726348263706258/reviews?hl=zh-TW,2,False,4,非常失望，視覺很高分，但吃起來真的都不合口味，說是豆製品專家，豆皮，豆花連個豆香味都沒有，其他菜點也都普普，4個人晚餐吃了2000出頭，非常不值
 EJ L ,https://www.google.com/maps/contrib/102407048147278828398/reviews?hl=zh-TW,3,True,830,東西不錯健康味道也不錯但套餐的菜梗超硬菜太老了咬不斷東西價格不便宜環境裝潢服務不錯
 sophie lai ,https://www.google.com/maps/contrib/118005562624090782467/reviews?hl=zh-TW,4,True,44,豆腐道地，價格實在，唯人手有點太少，點餐需要等一點時間，
 艾栗Ellie ,https://www.google.com/maps/contrib/110759481118858503523/reviews?hl=zh-TW,5,False,28,點套餐有自助吧（小菜好吃常常變換菜色），溫熱豆漿也可以自己取用，環境舒適，吃一吃好想睡個午覺⋯😃
 Flia Hsu ,https://www.google.com/maps/contrib/113720967868356117958/reviews?hl=zh-TW,4,True,74,精緻好吃且滿滿豆香的素食店，服務態度也很好。
 Marion Lu ,https://www.google.com/maps/contrib/104913489981892595599/reviews?hl=zh-TW,4,False,7,餐點好吃，服務很好，但是兩人座位排得太密集又沒有隔板，旁邊的客人有症狀又咳嗽又擤鼻涕，令人害怕。只希望自己沒有被感染.....建議要排這麼密就一定要放隔板，要有自覺沒有安全距離就必須有隔板！！！
 yo inn ,https://www.google.com/maps/contrib/116168407353523133358/reviews?hl=zh-TW,4,True,69,"有濃醇的熱豆漿以及麥茶可以解渴
套餐有自助沙拉可以取用，附的湯頭濃郁，主食入味不死鹹"
 林怡均 ,https://www.google.com/maps/contrib/101640782630787428031/reviews?hl=zh-TW,4,True,199,"很用心經營，不只是服務消費者，也培養許多人才。
改成用台灣豆會就更棒了"
 Q Megumi ,https://www.google.com/maps/contrib/105861472616322828828/reviews?hl=zh-TW,1,True,104,裝潢乾淨簡樸，食物普通到.....一個境界（對不挑食的我來說）.沒有標價的質感。可惜了。
 ting ,https://www.google.com/maps/contrib/104682240488655601892/reviews?hl=zh-TW,5,True,119,"環境跟菜色新鮮度都很棒，還有小菜沙拉吧
很有特色，也可以感受到用心經營
價格約350-450每個人，份量適中不會飽到不舒服或是不飽
但是整體吃下來，覺得主廚推薦的菜都沒有達到期望值
但是一般沒有特別推薦的，反而都很好吃唷"
 李政學 ,https://www.google.com/maps/contrib/116679547460546673923/reviews?hl=zh-TW,1,False,17,沙拉🥗區不錯沒有飲料可惜！結帳沒有linepay真是落後真是誇張
 Chou Chou ,https://www.google.com/maps/contrib/106299236477285604385/reviews?hl=zh-TW,4,False,42,是個連吃葷食的人都能接受素食餐廳，尤其個人最愛這三道菜超級好吃，入坐後還能先自去小菜也覺得很棒，小菜木耳跟豆芽也推推，然後我們四個人點了四人套餐，份量算滿夠吃的還打包，唯一美中不足的是時間到才能在櫃臺前報到後再ㄧ堆同時段人被帶入桌，疫情期間ㄧ堆人塞在櫃檯前也是滿妙的？然後生意太好服務人員很難顧到客人需求，連碗跟茶都忘了給…唯一覺得最好的服務生就是David囉👍🏻👍🏻👍🏻
 許瓊文 ,https://www.google.com/maps/contrib/111995610676364320059/reviews?hl=zh-TW,5,True,221,精緻美味，令人感受不一樣的素食料理
 WUN-JHEN SHEN ,https://www.google.com/maps/contrib/116961041590126531885/reviews?hl=zh-TW,5,True,53,今天第一次去用餐，點了「松露野菇鮮若煎餃」、「麻油烘蛋」、「梅子氣泡飲」，煎餃是我目前吃過最好吃的全素煎餃，梅子氣泡飲酸甜適中，喝起來很清爽，除了麻油烘蛋有點太油以外一切都很滿意，會再光顧。
 Andy ChangLiao ,https://www.google.com/maps/contrib/115142285274783599233/reviews?hl=zh-TW,5,True,42,價位偏高，多種豆類料理可以品嚐，防疫期間沙拉吧需要戴口罩，還好週末中午也沒有額外等候。
 Yenyun Lan ,https://www.google.com/maps/contrib/104598336711990403355/reviews?hl=zh-TW,1,False,22,本來一直以來蠻喜歡這裡的食物，但今天深深感受到店家的高傲，明明表訂21:00打烊，才20:10就直接把客人檔在門外說已經打烊了？如果是超過最後出餐時間不妨直說，也不是不能接受，但看到裡面根本高朋滿座卻說打烊了？？？實在無法理解，肯定是業績很好不缺生意
 Miya ,https://www.google.com/maps/contrib/113767025446546563974/reviews?hl=zh-TW,3,False,9,"餐廳環境不錯。
有一些豆腐涼菜的沙拉吧可以夾，點菜前份量要先斟酌一下。
當天上的茶溫溫涼涼的，不知道是不是本來就是準備涼的。但有些菜上的時候也溫溫的不是很熱。"
 Caroline Hsiao ,https://www.google.com/maps/contrib/114496176737304250552/reviews?hl=zh-TW,5,True,95,乾燒雞九宮格套餐主菜口味好吃，配菜、飯及湯口味也不錯。
 Roger Cheng ,https://www.google.com/maps/contrib/107472543785110772315/reviews?hl=zh-TW,5,True,102,好吃訓練良好，小部份調味料及罐裝醬料非天然
 Cheung 暉 Kelvin H ,https://www.google.com/maps/contrib/105876696911132947439/reviews?hl=zh-TW,5,True,66,這是一家集商業和價值觀都令人印象深刻的店，去了的次數不算少，卻少見冷清便知一角。
 Betty zhang ,https://www.google.com/maps/contrib/110634406983902121207/reviews?hl=zh-TW,5,True,95,"環境整潔、空間寬敞，喜歡黃豆的冰友可以來嘗試。

這次點了麻油麵線（2人份）、炸蘿蔔糕芋板（2人份）、豆漿火鍋，豆漿會火鍋料多、湯頭不錯。蘿蔔糕和芋頭外皮酥內餡軟，三樣費用約1000元。

自助吧小菜每天不太一樣，這次有百香果口味醃蘿蔔、椒麻木耳、涼拌海帶絲、甜的厚海帶捲、煎豆腐（有很多醬料可以佐），自助吧小菜蠻美味。

下次還會想再來！

用餐時間限制90分鐘。"
 TiNG ,https://www.google.com/maps/contrib/102115968662920947217/reviews?hl=zh-TW,4,True,253,料理非常精緻，也很好吃，豆花也很順口不會太甜，整體上吃起來很養身健康，幾乎都是素食，每人低消300，一個套餐大致上360-380，價格有點偏貴，畢竟是素食
 WANGきみ ,https://www.google.com/maps/contrib/109073702598462038314/reviews?hl=zh-TW,4,True,290,"番茄麵套餐(番茄湯麵、豆包、迷你沙拉吧無限供應)/330元(含一成服務費)！
小貴，偶爾吃不錯。"
 Dannie Hsiao ,https://www.google.com/maps/contrib/118082027750684332777/reviews?hl=zh-TW,5,True,299,想吃不油膩燒餅油條早餐的，來這裡絕對會一試成主顧！
 Shiang Huang ,https://www.google.com/maps/contrib/112424901257414072068/reviews?hl=zh-TW,5,True,572,"都是豆類製品為主,後面自助區的熱豆腐好吃,煎餃連著的脆餅很漂亮"
 許妙心 ,https://www.google.com/maps/contrib/111630573441309785577/reviews?hl=zh-TW,4,True,75,多種豆類的蔬食料理，是聚餐好所在
 Miao-Hua Shih ,https://www.google.com/maps/contrib/108684600250021926573/reviews?hl=zh-TW,5,True,127,3個大人，點2菜加上一鍋2碗飯就能吃的蠻飽的（店裡有免費的小菜）
 Dis Chen ,https://www.google.com/maps/contrib/103408308212968646005/reviews?hl=zh-TW,5,True,15,精緻的豆腐料理，味道有一定水準，但價格不算親民。與素食者聚餐，可考慮這裡。
 Rita Liao ,https://www.google.com/maps/contrib/103737693092541082728/reviews?hl=zh-TW,4,True,57,Uber外叫了很多次，滿滿的花生，真的很好吃😋
 Sherry kang ,https://www.google.com/maps/contrib/111900276816794673624/reviews?hl=zh-TW,5,True,16,這間餐廳是素食，適合素食者!東西食材新鮮，，服務態度好，用餐時間九分鐘!!生意很不錯!!
 K K ,https://www.google.com/maps/contrib/110709082114856680713/reviews?hl=zh-TW,4,True,199,特色素食寬敞的坐位免費供應小菜及滷豆腐，可惜過於吵雜，價位偏高
 HSU Emily ,https://www.google.com/maps/contrib/107005595594826508215/reviews?hl=zh-TW,4,True,126,很好吃的各種豆製品，會想再嘗試早餐的餐點~
 荻莫 ,https://www.google.com/maps/contrib/108527911908411920794/reviews?hl=zh-TW,5,True,26,東西好吃，服務親切，而且假日不會趕人，入口處是階梯，推車較不方便，但服務生看到會幫忙
 RayShin Lee ,https://www.google.com/maps/contrib/113177676927528422130/reviews?hl=zh-TW,5,True,36,口味清淡，點套餐就有豆腐&沙拉吃到飽😆
 NN Wu ,https://www.google.com/maps/contrib/112318286400731250525/reviews?hl=zh-TW,4,True,21,食物好吃，但青菜的部分有點油
 Ching-Ching Hung ,https://www.google.com/maps/contrib/101339667337973317447/reviews?hl=zh-TW,5,True,59,自助吧很豐盛，餐點也很優。
 除惡務盡挺善良 ,https://www.google.com/maps/contrib/117930396881441933414/reviews?hl=zh-TW,4,False,3,用餐環境好及服務還不錯。但食物就沒有驚豔感。
 Young Lee ,https://www.google.com/maps/contrib/111955583925730971121/reviews?hl=zh-TW,5,True,29,價錢加上整個環境我覺得不算貴餐點好吃豆漿看的出來是真的豆做的如果哪天心情好又不想坐路邊攤的話可以來👌
 RAY SONG ,https://www.google.com/maps/contrib/100736239193292053587/reviews?hl=zh-TW,4,True,185,裝潢細緻看的出老闆用心，豆腐套餐清淡可口，又多了一個素食的好地方。青菜稍嫌老建議改善就很完美。
 王渝涵 ,https://www.google.com/maps/contrib/112862067304980316561/reviews?hl=zh-TW,5,True,74,"外帶米漿/蘿蔔糕/涼粉
米漿非常濃郁，平常都喝無糖覺得甜度微甜不膩；蘿蔔糕是軟嫩加上素肉燥，也不錯吃～"
 David Chen ,https://www.google.com/maps/contrib/101195862973110358062/reviews?hl=zh-TW,5,True,69,非常舒服整潔的一間店。很適合想一嚐美味素食的朋友。
 Lynn Lien ,https://www.google.com/maps/contrib/110861716909914397383/reviews?hl=zh-TW,4,True,145,"好吃的蔬食也好飽價位中高
希望平日午餐用餐時間可以長一點"
 Aria Lee ,https://www.google.com/maps/contrib/109992723457314025706/reviews?hl=zh-TW,2,False,67,今天的乾鍋雞太鹹了啦！高麗菜也是飯這麼少根本不夠配啊😭😭😭
 Ashley Lai ,https://www.google.com/maps/contrib/116745632492852228741/reviews?hl=zh-TW,5,True,50,精緻素食店，超級好吃！升級套餐會有沙拉吃到飽，超讚👍🏼👍🏼
 Meg Kuo ,https://www.google.com/maps/contrib/105365035972650535885/reviews?hl=zh-TW,1,False,11,餐廳的桌距非常近，近到隔壁聊天內容聽得一清二楚。限時90分鐘用餐，點餐後過了50分鐘催餐，說芋頭米粉湯現煮，還要20分鐘才能上……無法出餐建議別接那麼多組客人，壞了餐點和用餐的品質。只能說，很糟糕的體驗
 蔡佩諭 ,https://www.google.com/maps/contrib/106461777186294659777/reviews?hl=zh-TW,1,False,8,"第一次給出一顆星
今天和朋友到店內用餐
坐下不到5分鐘，店員以人潮眾多為由請我們點餐
其中一位朋友禮貌詢問他的餐點可不可以待會決定後再告知
店員直接回答：「不可以」
何時點餐也需要被規定嗎？？？
令人傻眼

如果沒有能力消化那麼大量的客人，人數控管是店家的責任，以不算便宜的價格獲得這樣的用餐品質，相當失望

復興店的michael，請加油。"
 Ya Wen You ,https://www.google.com/maps/contrib/115780935526970979898/reviews?hl=zh-TW,5,True,59,黑糖豆奶好喝，讚許店長，詢問有沒有壽星蛋糕的優惠，即使店裡沒有提供這個服務，也很熱心的幫指引週邊有素食蛋糕的店家，購買完之後，也很周到的在適當時機幫送上蛋糕，很專業很有溫度，這次點雙人套餐，下次會點單點湯品與冰花煎餃！
 dai How ,https://www.google.com/maps/contrib/111481196872424313714/reviews?hl=zh-TW,1,False,14,東西每道都好吃，但用餐體驗不愉快。有些菜還沒用完服務生問都不問就收走，且我們也沒有超過用餐時間的限制。有服務生從我們進餐廳到離開餐廳口罩都沒蓋住過鼻子，建議要戴好
 Jiachi Liu ,https://www.google.com/maps/contrib/108863583938928981045/reviews?hl=zh-TW,1,False,3,"在網絡上看的這家素食的評價不錯決定來試試看
門口的接待員工不耐煩請我們掃實聯制量額溫連看都沒看還跳針有掃實聯制嗎
第一次用餐店員介紹的零零落落
這是粗麵這是麵線這是米粉
菜單上面的字我也看得懂不用唸給我聽…
希望可以知道的是怎麼樣的口感跟風味

最後點了豆漿鍋、炒水蓮、梅干冰花餃子、薑汁豆花
味道都很普通豆漿鍋味道很清淡幾乎沒有什麼豆香味
招牌煎餃更是令人失望似乎忘記做了但用餐了很長一段時間主動詢問之後才說要再等三分鐘口頭的不好意思讓你久等都沒有
內餡的素肉味道太重甚至壓過梅干的味道
而且過於油膩皮的口感也很普通
完全沒有吃出招牌的點在哪

將近八點店員急急忙忙的請我們買單
其他店員趕著開始收桌
在客人用餐的桌面客人的面前把剩餘的湯水殘渣倒在一起
感受真的很差且不專業…
第一次在餐廳用餐遇到這樣的情況
還以為是快炒店還是路邊小吃攤的服務品質

買單的店員態度也很差
請問客人怎麼會知道載具還是結帳先
大多數得結帳方式都是載具先
出示載具畫面並表示要行動支付
店員直接口氣很差的喊先結帳後載具！
我不知道是急著趕下班還是怎麼樣
趕收桌結帳的積極態度大於服務客人
我沒有花錢是老大的態度
同樣身為餐飲業真的是看不下去
這樣的服務還能收服務費…

是以後絕對不會來
也會讓身邊的朋友知道這裡完全不值得花時間和胃口來"
 翁韻嵐 ,https://www.google.com/maps/contrib/101684656747054583831/reviews?hl=zh-TW,5,False,4,蔬食豆料理，料理用心，也可包場蠻不錯的，素餐廳好選擇：）
 Phoebe Lin ,https://www.google.com/maps/contrib/109595988193757887897/reviews?hl=zh-TW,5,True,95,"已是二訪豆類蔬食專賣店
一人低消300
麻油麵線蒸餃套餐都好吃
下次要試試早餐系列！"
 Eva Lu ,https://www.google.com/maps/contrib/113187162573636265125/reviews?hl=zh-TW,3,True,37,"人好多，就算事先訂位還是要等等
服務普普、速度很佛
食物不錯、但夜不是好吃到會特別想再來吃
豆腐豆漿豆花我以為會很厲害、結果也是還好
煎餃松露的味道很香，還有麻油烘蛋應該是今天吃了比較記憶深刻的了

麻辣鍋、麻油鍋、咖哩、炸菇都還好"
 Coffee R Cat ,https://www.google.com/maps/contrib/107803559428835898055/reviews?hl=zh-TW,4,True,86,套餐的口味和小菜較鹹，適合重口味的人。冰花煎較好吃，但很油。
 chih-chin Chen ,https://www.google.com/maps/contrib/108137309261764839085/reviews?hl=zh-TW,3,True,614,價格小貴，東西味道普通，煎餃真的很油。
