user_name,user_profile_url,rating,local_guide,comment_num,comment_text
 徐諭潔 ,https://www.google.com/maps/contrib/105011743361575751367/reviews?hl=zh-TW,5,False,12,"蝦醬咖哩好吃😋

服務人員都很親切～
兩人同行評論送炸牛排🥩"
 pin pin ,https://www.google.com/maps/contrib/102443218240964475463/reviews?hl=zh-TW,3,True,25,"餐點擺盤看起來很美
服務很好/環境整潔/上菜速度快都給星
-
今天點蝦醬咖哩佐手打蝦排/牛雜咖哩
蝦醬咖哩的部份沒想到整個咖哩沒有咖哩味比較可惜
牛雜咖哩的肉軟嫩還行
-
整體來說咖哩口味不重
名符其實的溫咖哩
-
喜歡溫潤口感比較適合"
 Chi Chiu ,https://www.google.com/maps/contrib/111567836805906757898/reviews?hl=zh-TW,4,False,13,特殊口味咖哩餐點吸睛又口感豐富，份量夠，不需額外提供加醬加飯服務。用餐座位氣流通風良好，客滿時用餐仍舒適，服務非常周到。
 wei choco ,https://www.google.com/maps/contrib/115861070671343610200/reviews?hl=zh-TW,4,True,"2,059",牛肉和海鮮為主的咖哩，咖哩醬有很多天然辛香料是溫順的咖哩，這次點牛雜咖哩佐爐烤牛排五分，麵包內有咖哩醬覺得很棒。
 Adki Ya ,https://www.google.com/maps/contrib/104477330390670515943/reviews?hl=zh-TW,5,False,50,我覺得還不錯的高級海鮮料理，很像日式壽司的料理放在咖哩上面
 Hsiu chun Hsu (許琇淳) ,https://www.google.com/maps/contrib/105400527222302644825/reviews?hl=zh-TW,5,True,72,很好吃！蝦排很特別，咖哩醬的味道也各有不同，有高級的味道👍🏿
 Gigi Wang ,https://www.google.com/maps/contrib/104054293309799575314/reviews?hl=zh-TW,4,False,8,"服務人員非常親切👍👍
餐點份量多咖哩用料也很實在
咖哩醬味道稍淡
麵包搭配塗抹的醬好吃😋"
 Janice Teng ,https://www.google.com/maps/contrib/106871590977742988376/reviews?hl=zh-TW,4,True,18,"🦀️滿滿蟹膏咖喱
可以限定加購起司軟殼蟹。真的有滿滿的蟹膏，搭配有蟹肉棒的咖喱醬，缺點是蟹肉有點乾硬。
🦐自製蝦醬咖喱佐手打蝦排
蝦排是由兩隻蝦裹蝦漿，上面再蓋一層起司片，這道真的很讓人驚艷，咖喱醬裡面還有幾隻溪蝦，推推👍

餐點都是套餐的方式，咖哩內配料多（花椰菜、玉米筍、杏鮑菇、太陽蛋等），另外還有小菜（醃蘿蔔）、咖喱餐包及麥茶。

現在兩人內用點兩份套餐並上估狗評論有送炸牛排，很划算的活動，但牛排炸過熟了😓"
 盧育賢 ,https://www.google.com/maps/contrib/108516581763458874705/reviews?hl=zh-TW,5,False,9,"招待的炸牛排不錯吃
牛舌咖哩偏濃
怕膩喜歡清淡的可以點海瓜子
便宜好吃"
 Jinglr Liao ,https://www.google.com/maps/contrib/109817437983867091036/reviews?hl=zh-TW,5,True,129,味道濃郁的咖哩，喜歡重口味的人可以來品嚐，海瓜子咖哩較南洋風，有一點點酸、一點點辣，蝦醬咖哩蝦味十足~
 HuiTing Chang ,https://www.google.com/maps/contrib/102594370035087806288/reviews?hl=zh-TW,5,False,9,"咖哩口味很特別，層次豐富融合卻不衝突。整體份量非常足夠，附餐的現烤餐包非常好吃！咖哩各式主菜都很有特色，特地以不同的咖哩醬搭配，整體很用心。
服務非常親切，店員都很誠懇可愛，用餐間的小問題也會立即處理，感受得到對這間店的用心跟熱情❤️"
 MG ,https://www.google.com/maps/contrib/106499267111763137499/reviews?hl=zh-TW,5,True,32,"臨時的晚餐，意外發現一間好店。

親子友善：
可惜沒有兒童餐具和兒童椅
但咖哩醬可以另外放，即使孩子不吃咖哩，其它主食都可以盡情享用，覺得很棒❤️
（分開裝的咖哩滿滿一碗，超級好吃）

服務非常親切，上菜時都會詳細介紹。
推推～～"
 Le Cheng ,https://www.google.com/maps/contrib/107655019340824398686/reviews?hl=zh-TW,4,True,188,芒果咖哩口味很特別，口感偏甜些；海膽咖哩部分，醬的味道以花枝為主。打卡贈送的炸牛排普普。
 Omar ,https://www.google.com/maps/contrib/109183669455030019339/reviews?hl=zh-TW,5,True,28,"始於看到網路推薦前往，發現店內的裝潢很特別，走一種傳統的設計，在裡面用餐身歷其境彷彿回到以前鄉村。店內服務人員態度親切，商品種類不多他依舊依依像我們做仔細的介紹。當時去的時候有活動還招待我們一份炸牛排，吃下去有一種豬排結實酥脆的口感，吃到裡面又有牛排的軟嫩與鮮甜，非常好吃。

牛雜咖哩佐現煎牛排💰317(+10%)

依照個人偏好選了這樣餐點，咖哩的部分因為又有加一些鮮奶油在裡面，吃起來多了一股奶的香氣，再來裡面的牛雜，每一樣都相當入味，我彷彿在這份咖哩裡又吃到了一碗牛肉麵的感覺，味道相當特別且不衝突，牛排的話跟炸牛排一樣，吃起來軟嫩鮮甜，熟度相當剛好，其他旁邊小小點綴的玉米筍跟花椰菜，幫這份咖哩飯增添了一種解膩感簡直完美融合，最後配上那顆半熟蛋，配著吃，簡直可以直接說是｢完美｣，不過因為價格與份量的關係，我認為有稍嫌的貴了一些，CP值就稍微普通了一點。

自製蝦醬咖哩佐手打蝦排💰402(+10%)

我朋友則是點這份，送來時我簡直嚇了一跳，怎麼這麼「原型」的蝦排，而且又超大一個，不過口感就相對有點硬，味道是好吃的，上面的那片起司加了不少分，其他配料以海鮮類為主，一樣差在價格與CP值得關係。但真的必須說以美味程度來說是「非常好吃」。還是會推薦大家，只是可能就真的要考慮一下荷包。"
 Frank ,https://www.google.com/maps/contrib/104800645446372975272/reviews?hl=zh-TW,5,False,10,"服務很好，裝潢優美，進門滿滿咖哩香,東西也好吃！難怪google評價這麼高。值得大家一試！"
 Melissa Lai ,https://www.google.com/maps/contrib/102599383003060187271/reviews?hl=zh-TW,5,True,96,"北商附近新開、單價較高的咖哩餐點
有分外帶跟內用價，假日或晚上建議先打電話訂位

我點的餐點是自製蝦咖哩佐手打蝦排（基本套餐），＄365＋10％
附上的麥茶是熱的（可能因為冬天），味道獨特，不是一般麥茶的味道
自家烙印的餐包中間夾的也是咖哩醬

咖哩醬入口有感受得到蝦的味道，又不會太濃郁
蝦肉排真材實料，看得到蝦子在裡面
咖哩裡的溪蝦增加味道外，也多增加了口感"
 aguang Wang ,https://www.google.com/maps/contrib/107057374092717296766/reviews?hl=zh-TW,5,False,20,"充滿細節的店家。
任一盤咖哩內容物至少含有三種以上不同處理的主食，口感味覺變化豐富；連飯也是先炒過再淋上醬，濃郁味道十足"
 黃世賢 ,https://www.google.com/maps/contrib/106864786727201068241/reviews?hl=zh-TW,5,True,88,"餐點美味，牛排鮮嫩，
店員服務優質，也會詳細介紹餐點，
兩人同行打卡送炸牛排。
希望之後可以有電子支付或信用卡支付。"
 李翰威 ,https://www.google.com/maps/contrib/104717838725881726853/reviews?hl=zh-TW,5,True,21,份量吃得很飽，咖哩調味本身層次非常豐富，芒果咖哩與肉桂、小茴香子的味道層次豐富，非常驚艷；蝦醬咖哩與蝦味提升咖哩的鮮味！價位300-500間，只收現金。
 小門把 ,https://www.google.com/maps/contrib/102521972637732841883/reviews?hl=zh-TW,5,False,7,"蝦醬咖喱很溫順吃起來不會膩讚讚👍
而且送的牛排很有水準🥺"
 Wang ,https://www.google.com/maps/contrib/108639639127564485927/reviews?hl=zh-TW,5,False,15,隱身在台北的巷弄內，飯還先用咖哩先炒過，看得出廚師的細心，餐包是咖哩口味滿特別，服務人員親切，好吃價格中等，會再回訪
 Ran Ming ,https://www.google.com/maps/contrib/109071003630194565749/reviews?hl=zh-TW,5,False,16,"店員服務很棒，餐點說明又快又準
牛舌、自製蝦都很棒很好吃！"
 台灣아저씨 ,https://www.google.com/maps/contrib/109177347180897733991/reviews?hl=zh-TW,4,False,8,"重點★不推加點生煎牛排：沒什麼味道，夜市牛排都比較好吃，搭配咖哩吃…還好…我喝了好幾口水重新試吃很多次…不推…

不推點湯，蘿蔔皮沒削乾淨，但還好有燉爛，湯還喝得出豬味，就是骨頭熬湯前沒去乾淨血水。豬肉部份是好的，最大敗點筋沒爛…我嚼很久…

以上只是覺得不太需要加，看個人感覺，當然重點是咖哩，很讚，牛雜很成功的都燉爛去腥，牛肉勝過加點的牛排…不辛辣帶點蔬菜甜香與咖哩的香料很溫和。不虧是溫咖哩。

其它沒點過。所以只有吃過才會評價。

少一顆星在於價格
當然我想想因為是蔬菜熬出來的成本比較高。

空調希望改善，畢竟廚房是開放式的，客人很多，我在吃的時候，感覺很悶，所以快速的趕快吃完。"
 mina chung ,https://www.google.com/maps/contrib/107433899290598445852/reviews?hl=zh-TW,5,False,4,"點了牛舌溫咖喱
份量其實超足夠的
整體來說是蠻好吃的，喜歡吃滿滿肉的會很喜歡這道料理"
 蔡心喬 ,https://www.google.com/maps/contrib/112872451684762024485/reviews?hl=zh-TW,5,False,15,"海膽咖哩味道濃郁與一般的咖哩相比少了些咖哩味但也多了更多海鮮的鮮甜
螃蟹咖喱蟹膏很多整體海鮮很多"
 冼家佑 ,https://www.google.com/maps/contrib/102155309698415023120/reviews?hl=zh-TW,5,False,9,小奢侈的咖喱店！東西蠻多的而且很合我的口味～重點是服務人員超級親切的啦
 Bryan huang ,https://www.google.com/maps/contrib/114489573008093622020/reviews?hl=zh-TW,5,False,6,暖色系裝潢，吃飯環境很輕鬆，餐點牛舌很推，咖哩口味好幾種，價格200-500多，喜歡咖哩的可以一試。
 黃鈺雅 ,https://www.google.com/maps/contrib/103182113818849056805/reviews?hl=zh-TW,5,False,3,整間店的空間很舒適，所有員工都很親切友善，服務很好，而且咖喱的口味真的很日式又很特別，非常推薦，份量很多會吃的很撐
 Max Chang ,https://www.google.com/maps/contrib/100152456629539201137/reviews?hl=zh-TW,5,True,30,"芒果口味的咖哩蠻特別的！
低消一份餐，兩人同行留評論送炸牛排"
 政儒郭 ,https://www.google.com/maps/contrib/104055854485628989592/reviews?hl=zh-TW,5,False,3,"服務非常週到，服務生人超Nice
餐點蠻不錯吃的，咖哩生魚片很特別！"
 Joseph YU ,https://www.google.com/maps/contrib/115146990857972630357/reviews?hl=zh-TW,5,True,50,"芒果白咖哩佐牛肉漢堡排帶有清爽芒果味的咖哩微酸微甜很特別的味道還貼心的附了一小杯咖哩在咖哩不夠的時候用餐包裡面有咖哩肉醬鬆軟的口感也很棒沾咖哩醬又是另一種滋味總得來說值得一試
雖然很忙有點亂可是服務生的態度還是很好服務很不錯現在有打卡送炸牛排的活動"
 Kart He ,https://www.google.com/maps/contrib/102563120451097695540/reviews?hl=zh-TW,5,True,25,終於吃到溫咖哩了！牛舌很嫩、很好吃，咖哩味很濃，醃蘿蔔很脆、隨餐麵包有咖哩醬在裡頭耶！整體服務也很窩心🥰
 chyayi ,https://www.google.com/maps/contrib/115615235955240579276/reviews?hl=zh-TW,5,True,155,服務態度很好，餐點份量很夠，咖哩很香又濃郁，料也很多，值得推薦
 連佳萱 ,https://www.google.com/maps/contrib/116829354215233547402/reviews?hl=zh-TW,5,True,31,"軟殼蟹很好吃！一定要加點！
蟹膏咖哩不只有蟹膏，咖哩醬還充滿各種海鮮，雖然微辣但仍然很好吃！"
 黃彥穎 ,https://www.google.com/maps/contrib/100597610827722671360/reviews?hl=zh-TW,5,True,38,現在兩人同行送炸牛排一份，我點牛雜咖哩，味道很好吃喔！
 Otoko. Chang ,https://www.google.com/maps/contrib/104727137802430479396/reviews?hl=zh-TW,5,False,6,這家看好久了，今天終於有機會來，運氣不錯門口候位的人不多，點了牛雜咖哩跟海膽咖哩，香料炒牛雜加上3-5分熟牛排的組合吃起來香氣撲鼻很滿足，美中不足的是有知道咖哩葉的梗。海膽咖哩每一口都有明顯的鮮味，海膽與海鮮料份量也很夠，但吃起來好像有點不太像在吃咖喱的感覺😂。環境乾淨整潔，服務人員也很親切的介紹，整體來說還算不錯
 CT Chen ,https://www.google.com/maps/contrib/112746961239345927740/reviews?hl=zh-TW,5,True,526,"名列台北五大咖哩名店口味確實有獨到之處。
蝦醬咖哩海味濃郁；牛雜咖喱層次豐富。
外帶2份還有贈餐配菜服務人員熱心親切
相較之下麥茶倒是清淡了一些。"
 Mindy Huang ,https://www.google.com/maps/contrib/109165283221719975855/reviews?hl=zh-TW,4,False,18,牛排很嫩，咖喱濃郁，評論送的炸牛排口感很特別，整體還不錯，中午人多上餐會比較耽擱，上班族趕時間要考慮一下。
 An-Chi Chen ,https://www.google.com/maps/contrib/105839713365452473154/reviews?hl=zh-TW,5,False,7,別於坊間許多咖哩餐廳，僅有一兩款咖哩醬搭配不同主餐配菜，溫咖哩的咖哩醬每款不同、風味十足，主餐配菜也都很精緻，份量也很足夠，推薦給喜歡品嚐咖哩的朋友！
 曾昱翔 ,https://www.google.com/maps/contrib/114479551778779374344/reviews?hl=zh-TW,5,True,10,"今天點了爐烤牛肉及炸蝦套餐
另外單點起司漢堡排以及招待的炸牛排
口味特別有機會再來~"
 錢錢 ,https://www.google.com/maps/contrib/102566923704243216158/reviews?hl=zh-TW,5,True,30,"第一次來訪！
很期待😚
結果，一上桌，又忘了拍照（😳
相信看到照片，也能明白…超好吃😋
連米飯也有著鮮味～～"
 Wicky Chu ,https://www.google.com/maps/contrib/103162736636907348251/reviews?hl=zh-TW,5,False,18,"芒果白咖哩佐和牛起司漢堡排很適合夏天微甜清爽的味道，起司漢堡排就是王道！附餐的咖哩包是正統咖哩，一餐體驗兩種咖哩味，好吃😋份量也很足夠！
友人點的安鱇魚咖哩有安鱇魚肉和魚肝，附餐鮭魚咖哩生魚片味道也很讚👍
期待下次再來吃看看牛舌、牛雜咖哩了～"
 Uva Lin ,https://www.google.com/maps/contrib/114231955257139768040/reviews?hl=zh-TW,5,False,3,"從來都不知道，原來咖哩可以這樣配！味道新奇又美味，醬可以吃光光😍食材嚴選、咖哩包很好吃😭是我第二個會想念的鹹麵包！
店員很仔細的介紹咖哩和注意事項！🙏太細心了！！若客從遠方來，必定會帶朋友來這邊踩點！價格與美味成正比的好店！
✨在此除了留下評論，也感謝老闆、帶年輕人吃好東西✨✨✨✨"
 shuyu Lai ,https://www.google.com/maps/contrib/108793712814842365902/reviews?hl=zh-TW,5,False,11,用餐低消是每人點一份餐點，咖哩結合主菜套餐味道不錯，吃起來口感有層次味道不膩，店員服務好用心介紹餐點，兩人以上套餐還有送炸牛排。
 李語慈 ,https://www.google.com/maps/contrib/117116012314691231330/reviews?hl=zh-TW,5,False,15,咖哩味道濃郁，牛排也好吃，整體CP值很高，會再訪！
 熊大 ,https://www.google.com/maps/contrib/100829649475405278348/reviews?hl=zh-TW,5,False,316,"價位較高，但價值值得。
裝潢有品味，服務人員態度親和，食物美味，口感渾厚好吃，飲料真的還好。

比較可惜是飯略少，但和朋友一起吃飯會物超所值，好吃的食物也是話題"
 鍵盤聖戰士 ,https://www.google.com/maps/contrib/100716933761727719821/reviews?hl=zh-TW,5,True,22,超級好吃，每道小菜都很細心，點了海膽咖哩，咖哩味比較淡，但是海膽很濃郁，牛肉咖哩也給的很大方，店內氛圍舒適，店員都非常親切客氣，推薦！
 蘇柏宇 ,https://www.google.com/maps/contrib/100719833233564012449/reviews?hl=zh-TW,5,False,6,"來之前建議可以訂位，現場候位也OK假日限80分鐘用餐時間是足夠的
照片是夢幻牛舌咖哩，有附五分熟的爐烤牛肉，牛舌讓我很驚艷，非常多汁好吃，附餐的餐包裡面是咖哩醬也不錯，相較之下爐烤牛肉就比較中規中矩"
 MO ,https://www.google.com/maps/contrib/113193632290664733708/reviews?hl=zh-TW,5,False,2,每款咖喱都很濃郁也都非常特別，搭配的肉品一起吃，都有豐富的口感與味道層次，店員會熱情的介紹餐點口味，還會活絡氣氛，只能說溫咖哩真香！
 李紹農 ,https://www.google.com/maps/contrib/106933153580409567443/reviews?hl=zh-TW,5,True,36,店內空間跟氛圍都不錯，餐點味道很好，份量也很足夠👍👍店內服務人員也都非常細心，服務品質極佳
 carolnick81811 ,https://www.google.com/maps/contrib/105505354386196052691/reviews?hl=zh-TW,5,False,7,"點了「夢幻牛舌咖喱、自製蝦醬咖喱佐手打蝦排」
餐點新鮮好吃，值得推薦！"
 Hans Lin ,https://www.google.com/maps/contrib/116644772297402761507/reviews?hl=zh-TW,5,True,136,$300套餐非常滿意，咖哩好吃，兩人同行送的牛肉也超好吃，裝潢拍照也十分不錯，會是想常來的店！
 Gillian ,https://www.google.com/maps/contrib/100940440377821196503/reviews?hl=zh-TW,5,True,73,"特別的口味
舒適的用餐環境
親切的服務人員
不過咖哩口味只有牛跟海鮮可以選，希望未來口味可以多一點選擇"
 Zihjie ,https://www.google.com/maps/contrib/112552995200418355976/reviews?hl=zh-TW,5,False,39,套餐是低消，咖哩口味很特別，飯後有招待的抹茶豆花。兩人用餐留評論會加送炸牛排。
 Jessie H ,https://www.google.com/maps/contrib/113646554666319328586/reviews?hl=zh-TW,5,False,8,意外的逛進來，沒有訂位，剛好趕上最後2個空位，點了鮮蝦及牛雜，還送一份炸牛排，牛肉處理的很嫩，海鮮處理的鮮而不腥，好吃，下次要先訂位以免向隅。
 Kevin Lee ,https://www.google.com/maps/contrib/107123332939587865593/reviews?hl=zh-TW,4,True,546,食物沒話說，量大口味佳，服務人員的介紹也是一流，非常專業且態度良好。
 Tom Chang ,https://www.google.com/maps/contrib/107039726172561243491/reviews?hl=zh-TW,3,True,66,適合情侶約會夏天有些位置太熱坐著會流汗東西算好吃
 吳馥卉 ,https://www.google.com/maps/contrib/106736667349420606105/reviews?hl=zh-TW,5,False,4,咖哩醬美味、用料豐富、CP值極高牛舌軟嫩帶碳香。
 brendalien lien ,https://www.google.com/maps/contrib/102479699595452282145/reviews?hl=zh-TW,5,False,8,服務人員超親切，介紹也都很詳細，一進門就感覺很舒服。餐點美味可口，會想再吃吃看其他口味的餐點。今天點了滿滿蟹膏和白咖喱和牛漢堡排，都蠻推薦的！份量也很夠，吃完很滿足。美中不足的是店內一直有蚊子騷擾。另外，目前有點兩個套餐送炸牛排活動喔！期待下次的小驚喜，如果有布丁甜點感覺會更加分！
 張哲瑋 ,https://www.google.com/maps/contrib/105103697148025214032/reviews?hl=zh-TW,5,False,14,點了蝦醬咖哩，整體來說很有特色，但不太符合個人的口味，下次來會想點其他的咖哩嚐鮮看看
 KAORU HSU ,https://www.google.com/maps/contrib/116868948957181906886/reviews?hl=zh-TW,5,False,6,店員超親切又熱情讓人會很想再去，今天點了鮟鱇魚咖哩跟蝦排咖哩都非常好吃，值得再訪的好店！招待的炸牛肉也非常好吃，謝謝！
 Hugo Chan ,https://www.google.com/maps/contrib/105807239444666890499/reviews?hl=zh-TW,5,False,2,今天吃牛雜咖喱佐爐烤牛排（牛排我偏好較生，大約3～5分熟）。咖喱味道濃郁，牛雜軟嫩入味，連底下的飯都吸飽了咖喱醬汁。會再回訪😋
 Wen-Chi Chang ,https://www.google.com/maps/contrib/106671812490997251268/reviews?hl=zh-TW,5,True,36,"超好吃😋
二人同行留下GOOGLE評價
還送炸牛排"
 Ching Yo (YoChing) ,https://www.google.com/maps/contrib/108403531689656206228/reviews?hl=zh-TW,5,False,8,用料實在，每種咖哩都有特色，店員也很親切介紹每樣食物，超好吃～～～
 cow wan ,https://www.google.com/maps/contrib/117458443096679819187/reviews?hl=zh-TW,5,False,3,已珍藏在口袋名單許久，終於有機會來吃了！整體用餐體驗超乎預期的優秀，服務人員親切且詳細地介紹菜單，餐點相當豐盛，調味香氣佳、肉質鮮美、用料實在，絕對物超所值💕非常推薦給還在觀望的朋友們～
 郭威廷（TQ） ,https://www.google.com/maps/contrib/108959287463350119594/reviews?hl=zh-TW,3,True,503,可以感受到店家的用心，但覺得沒有吃到這個價格該有的料理水準。當天點了煎牛排牛雜咖喱與鹹蛋黃芒果白咖喱和牛起司漢堡排，漢堡排口感偏乾沒有肉汁也沒有和牛感，但芒果醬讓白咖喱風味增添不少，牛雜咖喱醬就十分可惜，沒有特別的香料味，比較像自家可煮出的日式咖喱塊風味。
 黃耀正 ,https://www.google.com/maps/contrib/104491702180347665740/reviews?hl=zh-TW,5,True,22,高級版咖哩，每一口都是海鮮料，香氣濃郁，飽足感很夠！
 朱Chu ,https://www.google.com/maps/contrib/115030761600105622445/reviews?hl=zh-TW,3,False,13,"餐點是牛雜咖喱跟漢堡盤咖喱～
牛雜咖喱的咖喱香氣明顯
漢堡排咖喱有明顯的芒果香氣

但是咖喱內含太多東西吃到最後感覺不知道自己在吃什麼⋯"
 黃怡婷Yi-ting ,https://www.google.com/maps/contrib/103038136368139233571/reviews?hl=zh-TW,4,True,294,來自花蓮的純淨滋味，距離上回多年前吃溫珈哩，與記憶中不同，一樣是定食卻多了溫潤，價格約在$280-$380之間，有飯食又有自製的咖哩抹醬餐包，還烙印上LOGO十分可愛，份量飽足讓你吃不完還帶著走。特別喜歡夏日限定的芒果白咖哩-有淡淡果香酸甜爽口，服務親切有禮，空間十分遵照防疫規定，也保有彈性-同桌一家人可以把隔板暫時拿下。配菜比例上蔬菜少了些，唯一美中不足，是值得再訪的用心店家。
 柯景翔 ,https://www.google.com/maps/contrib/100381798657419518611/reviews?hl=zh-TW,5,False,7,每種主餐搭配的咖喱都不一樣，海鮮非常鮮味，牛肉的也是很牛
 Michelle Lin ,https://www.google.com/maps/contrib/115433336513478930530/reviews?hl=zh-TW,5,True,149,今天點的是「自製蝦醬咖哩佐手打蝦排」🦐套餐，剛上桌就聞到很濃的酥香味，炸溪蝦超好吃，手炒咖哩很香裡面有小溪蝦跟中卷，附湯是「秘製豚骨煲湯」、餐包內餡是「芋泥絞肉」😍，配菜的「柚香醃蘿蔔」也不錯，不會很酸。友人點的是「北海道海膽咖哩」蓋上「梅酒漬魚下巴」、「築地辣味明太子」很夠味，開幕期間兩人內用即招待炸牛排一份！
 吳瓖洺 ,https://www.google.com/maps/contrib/112961053596477312215/reviews?hl=zh-TW,5,False,11,餐點精緻好吃，櫃檯服務人員態度好到可怕🤣，女朋友吃到地瓜馬鈴薯咖哩餐包很滿意👍，打卡送炸牛排超棒的。
 HH ,https://www.google.com/maps/contrib/115339228561464799714/reviews?hl=zh-TW,5,False,6,"鮟鱇魚咖喱套餐（附咖喱漬生魚片好吃）
蟹膏咖喱套餐加價一百有軟殼蟹
套餐附醃漬蘿蔔、餐包、麥茶"
 Derrick Tai ,https://www.google.com/maps/contrib/108258238052390391509/reviews?hl=zh-TW,5,True,57,初訪放在口袋名單已久的店，直接榮登台北咖哩第一名，每一口滿滿都是料，且不是白飯都還是拌過咖哩的香料飯，加入愛店之一。
 Carlos Yang ,https://www.google.com/maps/contrib/108364251847062939351/reviews?hl=zh-TW,5,True,4,"擁有特別風味的日式咖哩（蝦味/芒果甜味），除了很搭配米飯以外還有附一份麵包，份量充足。

服務人員態度非常親切，專業且語氣特別溫柔

打卡評論送炸牛排，份量也是很有誠意，但牛排可能過生不太好咬。"
 Rainie ,https://www.google.com/maps/contrib/118127562372242241148/reviews?hl=zh-TW,5,True,47,"咖喱取用新鮮海鮮食材製作，很特別
今天選擇了北海道海膽咖喱
及深海王頂級鮟鱇魚咖喱
Cp值頗高的尤其海鮮新鮮
推一個👍🏻"
 Flora ,https://www.google.com/maps/contrib/102430407878257743384/reviews?hl=zh-TW,5,False,12,"評論會送炸牛排
用料高級
但口味偏鹹～"
 Terry Chu Chu ,https://www.google.com/maps/contrib/104889918541927230022/reviews?hl=zh-TW,4,True,302,"牛雜咖喱口味較重，熟成牛排入口軟嫩爽口。
海膽咖喱…魚下巴醃製入味，好吃，海鮮咖喱很黃，口味較淡，顏色無限趨近營養午餐！？
店員服務態度很好，我給高分"
 李Chega ,https://www.google.com/maps/contrib/111523279992892401570/reviews?hl=zh-TW,5,False,16,咖哩口味豐富特別，沒有在其他地方看過，服務態度非常非常非常優良友善，環境舒適整潔，下次還會來！
