user_name,user_profile_url,rating,local_guide,comment_num,comment_text
 林詣雯 ,https://www.google.com/maps/contrib/107076816573179699255/reviews?hl=zh-TW,5,True,15,"咖哩麵包真的很好吃！
特色咖喱走澎湃路線，低消為每人一份套餐，目前有打卡送炸牛排的活動～"
 lulu Chi ,https://www.google.com/maps/contrib/104768191544041455469/reviews?hl=zh-TW,5,False,9,"這次點的是”芒果鹹蛋黃特濃白咖喱”口味是甜鹹甜鹹的很特別，飯量很夠，附餐的麵包夾了地瓜肉醬很特殊～女生吃的話可能一個人會吃不完或是超飽，是走日式鄉村感的咖喱店，推薦來吃吃看喔☺️

（另外店員的各種解說+服務很貼心～所以上來寫個評論～希望飲料可以多一點選擇呀"
 Andy Peng ,https://www.google.com/maps/contrib/102383973794579370220/reviews?hl=zh-TW,5,True,41,"疲勞的下班時間，與友人相約在這個巷口碰面，晚點有別的事情。還尚未用餐，友人也表達並不饑餓、隨便吃吃就好的念頭。
「你不是在蒐集咖哩爭霸戰的店家嗎？旁邊就是溫咖哩哦！」我慫恿著。
今天好累，真的好累，我想來點口味重的食物提振一下士氣，平常都是他問我吃咖哩行不行，今天換我開口了，他豈能有拒絕的道理？
「有點貴，你確定嗎？」他說著「可是好像有點東西。」
「就吃吧，反正終究都會踩到這間的。」

踏入店門，親切的問候帶領我們移動到了座位，奉上茶水和菜單後，仔細的介紹每一頁以及推薦的料理，並且也給予非常足夠的時間做出選擇。非常善於觀察的、移動到我們身邊幫我們點餐，也在這之前才說出，嗯我想好了，而已。

我點了牛舌咖哩，友人則是蟹膏咖哩。
稍做等待之後，端來的是撲鼻而來的香氣：滿溢的肉香佐辛香料口味的咖哩、濃郁蟹膏的芬芳配上鮮甜的海鮮咖哩，介紹完食用方式後便放我們二人在此大快朵頤。

整體來說，咖哩非常好吃，除了每一道主菜搭配的咖哩有所變化之外，香料使用恰到好處，使用炊飯而不是一般白飯更具有畫龍點睛之筆，甚是屬於台北市咖哩戰區中，非常具有競爭力的一匹良駒。若是加上非常到位的服務，我認為以此價格獲得如此體驗，應該是不至於認為昂貴了。

非常滿足的一餐，謝謝溫咖哩。"
 Aaron Hsu ,https://www.google.com/maps/contrib/113802473627320745182/reviews?hl=zh-TW,5,True,273,服務親切，介紹菜單非常詳細且專業，上菜速度快，餐點新鮮美味（點了咖哩牛肉、牛舌跟牛腱，還有一份炸牛排），醬料入味，配菜也很有味道，燈光美，氣氛佳，音樂好聽，值得再訪~
 康晴晴 ,https://www.google.com/maps/contrib/105921819031572637898/reviews?hl=zh-TW,3,True,208,"這次吃的是豐盛號咖哩與海膽咖哩
@豐盛號咖哩搭配芒果咖哩醬
芒果咖哩醬甜鹹甜香，口感很特別，但是因為我比較愛印度辣咖哩，所以我個人認為這款醬料吃久會膩，豐盛號內容有大蝦、干貝、鮟鱇魚、3分熟牛排、半熟蛋、蔬菜等等食材，另外附上肉醬麵包與醃醬瓜還有玄米茶，份量上對於一般女生應該剛好，對於肚子很餓的我有點不夠。
1.大蝦新鮮但有點老，2.鮟康魚酥脆好吃，3.牛排的口感就比較不是我喜歡的口感了，包含附贈的炸牛排，麵衣與牛排分離、牛肉的牛味不足，4.干貝我覺得可以再生一點，上下需要大火快煎會更好吃，5.半熟蛋完美好吃，6.蔬菜熟度剛好，但是灑在上面的義大利香料完美破壞整碗料理的味道。
整體而言，因為整份料理人如其名為溫咖哩，建議香料改為比較溫和的調味或是日式的香料會比較搭配。
@北海道海膽咖哩
說認真，又是一個義式香料破壞整體的好範例，套餐旁邊搭配的可生食等級的明太子與海膽，因為加上了香料，我完全吃不出原本食材的香氣，海膽咖哩溫和的類似燴飯，是不錯吃，上面的炸魚也很好吃
當初是因為看了YouTuber介紹來的，但是期待太大，導致有點失望
整體來說，喜歡溫和料理的人，這家是你可以嘗試的選擇，但是追尋刺激口感的，可能會讓你覺得還好，服務人員態度很好，建議先預約，不然要現場排隊。"
 陳詠華 ,https://www.google.com/maps/contrib/109701117439976384121/reviews?hl=zh-TW,5,False,3,"室內充滿農村裝飾，燈光與音樂的陪襯下，意外呈現一絲高雅且舒適的氣氛。
服務品質也是上等，也會主動幫忙加水，服務親切，上菜時也會細心介紹烹煮方式及吃法。
餐點方面也很棒，飯還有調理過，再配上他的咖喱，簡直絕了👍。麵包方面，外酥內軟，再配上他們自製的肉醬，也是讚不絕口，可以在淋上咖哩醬，也是另一種吃法喔！
價錢方面一般人應該也是可以接受，保證吃的飽。"
 Anne Wang ,https://www.google.com/maps/contrib/106159763589955735044/reviews?hl=zh-TW,4,True,11,"週二午餐來個海陸豐盛號😋

肥美的海大蝦、干貝、星鰻、透抽、板腱牛排，配上海瓜子咖哩⋯🤤🤤

海陸精華都在這裡了啦！😍👍

謝謝David請的生日餐呀！店家還貼心送了招牌小菜㊗️賀壽星！🥰🙏🏻

🌟目前優惠活動是點兩客咖哩拍照上傳Google且評論，就贈送價值NT175的日式炸牛排唷！"
 chenyin chi ,https://www.google.com/maps/contrib/113416538153907261044/reviews?hl=zh-TW,5,True,13,"芒果鹹蛋黃白咖哩佐和牛漢堡排
咖哩醬偏甜，很香很濃郁
喜歡偏甜口味的民眾會很喜歡
搭配小餐包也很好吃，適合小朋友的口味

店員非常親切可愛，用餐體驗非常開心舒適"
 Ivy Lim ,https://www.google.com/maps/contrib/105982177161956999685/reviews?hl=zh-TW,5,True,65,非常好吃！咖哩味道很特別，漢堡排很好吃，套餐也很飽，都快吃不完了，吃飽後還有招待豆花，也有招待的魚排，非常貼心。服務員態度真的好到不行！非常喜歡🥹
 Cynthia Lin ,https://www.google.com/maps/contrib/109307576058105378136/reviews?hl=zh-TW,4,False,6,"週日晚七點到座無虛席
好險有訂位始能順利入座
可惜有兩樣已售罄

蝦排咖喱可以吃到大小蝦
用料豐富，但不是想像中濃郁的味道
海膽咖喱比想像中的淡麗
魚下巴意外地夠味好吃

低消為一人一份套餐
套餐還有附餐包、飯量充足
一般女生可能會吃不完
男生可以吃很飽

兩人同行還有打卡評論送炸牛排的活動
店家誠意十足"
 張朕瑀 ,https://www.google.com/maps/contrib/106081491599397495981/reviews?hl=zh-TW,5,False,9,"口味非常特別的咖哩，很好吃份量足夠！
套餐附的麵包很用心好吃。
海瓜子咖哩、牛雜咖哩推推
值得一試"
 御雪 ,https://www.google.com/maps/contrib/116692010867110483480/reviews?hl=zh-TW,5,True,28,"這間咖喱真的讓我感到驚艷到耶
吃了這麼多的咖喱這間是目前我會邊吃邊想著我下次要找誰來一起吃的咖喱
真的每一口都是驚艷
吃的和開心
我下次會再帶有一起來享受著美味的咖喱"
 reirei jan ,https://www.google.com/maps/contrib/116994446338336899902/reviews?hl=zh-TW,5,False,22,"自製蝦醬咖喱
味道非常特別，有滿滿的花枝與小蝦海鮮味十足
芒果鹹蛋黃特濃白咖喱
有肉桂的味道與酸酸甜甜的芒果味，整體口感較甜"
 PETER YEN ,https://www.google.com/maps/contrib/104133124403793781356/reviews?hl=zh-TW,4,True,257,"這次點了
海膽咖哩$450
牛肉咖喱$308
套餐沒有附湯
原本以為會吃不飽
但當天有發動態送炸牛排的活動
吃完整個飽到晚餐
除了海膽咖哩等了比較久（事先沒告知）外
餐點都很美味"
 Goro Chou ,https://www.google.com/maps/contrib/118304967144098064815/reviews?hl=zh-TW,5,False,11,"牛肉熟度洽到好處，安康魚新鮮沒有腥味
咖哩醬配合不同的主餐有不同的口味
附餐麵包也好好吃，大推推推"
 Olemop Lin ,https://www.google.com/maps/contrib/103526916426688161774/reviews?hl=zh-TW,5,False,27,"今天吃海瓜子魚排咖哩，升級成牛排的套餐！

從訂位開始就感受到店家優質服務，食物也完全沒讓人失望，非常美味！大推！"
 Yumi Tseng ,https://www.google.com/maps/contrib/104638803726612268422/reviews?hl=zh-TW,5,True,60,"服務態度超棒，店內用餐環境也很舒適，海陸豐盛號要事先預訂，用餐前一小時打電話預訂即可。
如果沒有先吃小餐包的話，小餐包可能會黏在碗底，餐包裡有夾咖哩醬，拿起來的時候要小心，沒拿好手會戳進咖哩醬裡。冷了的話，可以請店員幫忙重新加熱。
咖哩醬裡有一些香料葉，不習慣的人可能會覺得吃起來有點卡卡的。
點海陸豐盛號的話，有一隻很大很大的蝦子，沒有可以丟殼的小盤子有點麻煩。
飲料直接是熱茶，可以請店家提供冰塊，自行調整。"
 Yi Chen Lin ,https://www.google.com/maps/contrib/105531581402699897152/reviews?hl=zh-TW,5,False,5,"假日用餐時間座無虛席，當天雖然沒有預約，但等待時間不會太長。服務人員相當親切¨̮♡︎
吃得出用心烹煮的咖哩，海鮮跟牛雜咖哩都各有特色！好吃，套餐份量也很足夠～"
 高筠婷 ,https://www.google.com/maps/contrib/105706490557299466661/reviews?hl=zh-TW,5,False,6,點了芒果鹹蛋黃特濃白咖哩佐和牛起司漢堡排。點餐時店員說味道比較特別而且肉桂味比較重害我有點擔心，但吃了之後完全符合我的胃口！超好吃！值得嘗試～
 Maggie Lin ,https://www.google.com/maps/contrib/100136454568416530525/reviews?hl=zh-TW,4,True,4,"今天點了蝦排和海膽口味，不同於傳統印象中的咖哩飯，菜單和餐點確實讓人驚艷⋯但飯量建議可以先減半，畢竟辛苦白米飯吃不完就是浪費。

可以理解店家想要創造最大坪效，只是對於很在乎用餐環境是否舒適的我真心覺得店內倆人位的配置過於「靠近」，還好今天5:30就去用餐還能坐到靠牆的位置，否則我可能不會想下次再光臨⋯"
 陳柏銘 ,https://www.google.com/maps/contrib/108977509120259759749/reviews?hl=zh-TW,5,True,12,今天吃海瓜子咖哩佐魚排！店員說裡面可能會有點苦苦酸酸的。苦苦的味道其實不明顯，主要是鹹味跟酸味很下飯！
 Tina Jiang ,https://www.google.com/maps/contrib/115088139728637403576/reviews?hl=zh-TW,5,True,27,"店員的服務態度非常有熱忱、活力！
食物美味不虛此行
牛舌咖哩上滿滿的肉和風味飯配上咖哩醬
讓人吃下第一口就有滿滿的驚艷和幸福感
以女生來講這個份量其實滿有飽足感
另外吃光後才能看見碗內有寫字呦"
 Kenneth Chen ,https://www.google.com/maps/contrib/104652452917446406697/reviews?hl=zh-TW,4,True,19,風味很特別，蝦醬咖哩有些微辣，裡面蔬菜菇類很多，份量很足夠。店裡人很多，還好有訂位，不過也是等了30-40分鐘才上菜。
 hsiupei Kuo ,https://www.google.com/maps/contrib/101988319749666225198/reviews?hl=zh-TW,5,True,33,小菜和正餐都美味，蝦醬咖哩超好吃超下飯！份量是男生也吃得飽，打卡送的炸牛排也很有誠意，服務人員對餐點說明很清楚，遇到小插曲（冷氣滴水）但還好不影響用餐，店內燈光與裝潢算舒適，有機會會再回訪。
 追追 ,https://www.google.com/maps/contrib/105950984496902630572/reviews?hl=zh-TW,5,True,124,"好飽好飽用料實在
超級滿足的
愛吃咖喱的人可以來試試
是特色咖哩
滿足不同的味蕾

很想試魚跟海膽類的
但價格有點不便宜😅

這次先吃吃漢堡排
還會附一個餐包

很好吃
餐後還送豆花

服務人員都超級親切喔
推推"
 hui-He Xie ,https://www.google.com/maps/contrib/107638486955410088031/reviews?hl=zh-TW,5,True,29,"訂位七點入座！

有七種套餐（六種咖喱醬）
每種配料都十分豐富，每口下去食感跟口味都有多種不一樣的組合，變化非常豐富🥰
主菜的炸花枝蝦仁跟漢堡排也很好吃、
兩人同行在google評論有送炸牛排🥩

除了飯還會有餐包，會非～常飽，一定要空腹來吃☺️

IG:pinpinebi_foodie"
 H sin ,https://www.google.com/maps/contrib/112430134661787453214/reviews?hl=zh-TW,5,False,8,"很有特色的咖哩，
蝦醬咖哩很濃郁的蝦味，
吃得出餐點的用心，
服務人員態度很好，
餐點介紹的很用心，
整體表現值得五顆星！"
 Wayne You ,https://www.google.com/maps/contrib/103082748299240940514/reviews?hl=zh-TW,4,True,437,"原本被負評嚇到，所以不太敢去。

實際吃過之後，對於味道跟份量感到滿意。飯就整體而言是最弱的一環。很一般，不論是米香或軟硬度都沒有什麼特點。

咖哩部分由於是點牛雜，所以牛肉香味充斥在咖哩味中，吃得出來是熬很久的牛肉味。然後搭配彈牙易嚼的牛雜，整個搭配起來非常香、口感也豐富。

主餐是牛排。由於烤3-5分熟，餘溫搭配咖喱與香料，味道很豐富，同時口感很紮實、不難咬。所以我給主餐不錯的評價。

配菜是醃蘿蔔，非常日式的搭配組合，如果可以嘗試醃薑或是醃蒜頭，會有不錯的效果。

麵包很普、茶不錯，有香味。甜點也普。半熟蛋因為上桌時，已經被搓破了，所以下面飯已經泡軟了，所以就不評論。"
 四軒 ,https://www.google.com/maps/contrib/117512976259232949986/reviews?hl=zh-TW,5,True,22,"難以置信的好味道

本來在看到菜單時的價格有點望之卻步
但直到服務生端餐點到面前的那一刻
你會覺得這根本是佛心店家

用料上完全不馬虎
咖哩餐包非常好吃
而每個咖哩醬都會使用餐點的肉類在裡面
其後台廚房的前置作業可想而知多繁雜
各種看似不合的肉類搭配咖哩後卻是天作之合

而前台的服務生姐姐們
對於顧客那親切卻又不越界的態度
也會時常觀察顧客的需求做應對反應
更令我覺得印象深刻

整體的用餐體驗非常之好
下次來這附近還會再來"
 Chen Wei ,https://www.google.com/maps/contrib/102785070118464135605/reviews?hl=zh-TW,4,True,59,"這是一家宛如坐過山車的咖哩店，嫩肉與橡膠交疊，美味咖哩與過鹹肉醬融匯
點了夢幻牛舌咖哩，加點100的煎烤牛舌
煎烤牛舌是這次用餐最滿意的餐點，鹽味恰如其分，除了舌尖火頭稍微過了，其他塊都鮮嫩彈牙，碳香四溢，建議手頭寬裕一定要加點
至於主餐的牛舌薄切的入口即化，切塊的卻“十分的有咬勁”，咖哩香料溫潤噴香，旁邊的肉醬卻鹹到微難入口，綜觀的體驗宛如一頓蘿蔔加大棒

芒果漢堡排的組合偏甜，咖哩醬料的濃郁程度更高，但不習慣偏甜口感的要稍微注意，漢堡排表現十分普通，餐包趁熱吃還不錯，醃蘿蔔解膩很讚，份量偏大，胃口小的女生可能會吃不太完

對了麥茶不好喝"
 Emily Y ,https://www.google.com/maps/contrib/101444293992849041089/reviews?hl=zh-TW,5,True,138,"華山文創那邊逛一逛，想要找用餐餐廳，想到有這家店不算遠，才繞過去試試。難得去吃，選了較貴的魚咖喱，非常好吃！
店內空間中午真的坐滿滿，建議可以早點去或晚一點再用餐。

份量很大很足！尤其我選了五百多塊的海鮮魚的咖喱，他隨餐有附上一小碟生魚片咖喱很喜歡！第一次吃到生魚片搭配咖喱，而且蠻好吃的😊可以的話，會想點一盤來嗑😆

咖喱飯的部分，裡面有魚也有貝類跟咖喱去煮，非常讚，真的可以吃很飽。
他有一小杯咖喱醬，怕喜歡咖喱跟飯一起吃的人，醬不夠，可以再加下去👏另外附贈的小餐包，裡面也有塗咖喱，不過會發現主餐、小菜和餐包的咖喱，都不太一樣的風味，覺得很用心。
店裡另外還有小活動，如果兩人以上到店消費評論分享，還有贈送炸牛排小菜，覺得很超值，推薦！"
 王輔翊 ,https://www.google.com/maps/contrib/106423394951803531006/reviews?hl=zh-TW,5,False,16,海膽咖哩鮮味滿滿，口感滑順咕溜，還有豐富的海鮮料和太陽蛋。上面的魚下巴調味令人驚艷，鮮嫩多汁。海瓜子咖哩味道比較特別，前味微微苦，再來可以吃到海的味道和堅果香氣，最後喉頭微辣，非常有層次。服務生很親切～拍照上傳可以招待炸牛排或魚排。
 Anita Cheng ,https://www.google.com/maps/contrib/102778246836767554038/reviews?hl=zh-TW,4,False,16,"第一次來訪，客人蠻多。
雨天在外等候了一陣子，因為當時客滿，店員還特別通知已訂位卻還沒到的客人，優先安排讓我們入場。

咖哩醬有蠻多口味，用料新鮮，送的炸牛排普普。
對於喜好咖哩的人，這間的咖哩會讓你印象深刻！"
 Tsai Eric ,https://www.google.com/maps/contrib/105112978029874378877/reviews?hl=zh-TW,4,False,7,有辦活動二人同行、寫評論送炸牛排一份還不錯，算偏高價的香料咖哩，對應的配料也較豐富
 林小蘋 ,https://www.google.com/maps/contrib/114208606603570445191/reviews?hl=zh-TW,5,True,28,"非常濃郁十足的咖哩❤️‍🔥❤️‍🔥❤️‍🔥
而且飽足感炸滿

北海道蟹黃主食
完全蟹膏轟炸🥰
附餐的餐包內餡也是咖喱醬

而單點薯條也會淋上厚厚咖喱醬汁
如果不想要咖喱味爆棚的話
建議點一份主食就好😆

建議先選好想吃的餐點
在電話預約訂位的同時
可以請店員預先預留餐點
才不會因售完而撲空噢"
 WU椪椪（みや） ,https://www.google.com/maps/contrib/106821163616892784450/reviews?hl=zh-TW,4,False,5,"原本以為是甜甜的日式咖喱，結果是香料咖喱！
整體來說算滿意，有到附近的話還會再回訪，也會願意介紹給朋友。
不過薄切牛舌好像有點烤太熟，加點的厚切就蠻好吃的。
另外麥茶好像不是普通的麥茶，有個不太習慣的味道😌
總之下次可能會選擇夢幻牛舌以外的餐🦀🦐🐂"
 劉湘羚 ,https://www.google.com/maps/contrib/102915099530071614578/reviews?hl=zh-TW,4,False,8,"2022/06/11
牛雜咖喱-咖喱層次濃郁豐富，牛雜用料也大方，可惜牛排即使是推薦的3-5分熟還是有點咬勁，若能更嫩一點更好
北海道海膽咖喱-海鮮及海膽味道相當突出，可惜魚下巴的腥味有點重，炸得過乾，失去魚下巴鮮嫩多汁應有的風味，若能再處理一下或改香煎會更好
炸牛排-雖是贈送的但份量不減、只是炸得太乾，牛肉太柴，若再嫩一點會更好！

總體來說還是相當驚艷，若能稍微留意NG的點還是很願意再訪！"
 那宇 ,https://www.google.com/maps/contrib/104618462524341752405/reviews?hl=zh-TW,5,False,13,"招待的炸牛排非常酥脆柔嫩，一點也不會老
咖哩、飯味道繽紛濃郁，味覺嗅覺的新興體驗。蟹黃飽滿濃郁，也有剪殼。
例湯用料豐富紮實，物超所值。
推薦店家"
 sweet heart Chien ,https://www.google.com/maps/contrib/105363619236777820287/reviews?hl=zh-TW,3,False,17,"溫咖哩的用餐環境簡約乾淨，服務人員親和，低消是一人一份套餐+10%服務費。這次點的兩份餐點，咖哩風味都還不錯，喜歡海瓜子咖哩比蝦醬咖哩多一些，但是兩款主菜（炸蝦排和炸魚排）都有點普通。或許店家把主菜拿掉（只單賣蝦醬咖哩飯或海瓜子咖哩飯），價格調降50元，再訪機率會提高。

我覺得不用特地來吃，如果剛好在附近覓食；或巧之味剛好沒開；且現場不用排隊候位，就可以列入考慮清單。"
 jasmine yang ,https://www.google.com/maps/contrib/113318865725884155730/reviews?hl=zh-TW,5,True,202,"餐點介紹的很詳細，也很貼心的幫同桌的所有人客製餐點；點了芒果白咖喱牛肉漢堡但不吃牛肉她也很貼心的更換成香腸。

外場服務態度超棒！（也很美😆）"
 Shan Huang ,https://www.google.com/maps/contrib/111216130659589356730/reviews?hl=zh-TW,5,False,7,"每種口味的咖喱
都好吃到爆啊
能讓我在加點一份也是不簡單
服務100%
店員顏值也是100%
除了給滿分我不知道該說什麼才好
吃完整體心情愉悅❤️"
 Sandy _H ,https://www.google.com/maps/contrib/110291603545120490162/reviews?hl=zh-TW,5,False,8,"餐點真的超級好吃(˶‾᷄⁻̫‾᷅˵)
而且份量很大
中午吃完直接讓我飽到晚餐都不用吃了
他們家有點偏南洋風味的那種香料咖哩（有夠喜歡的💕
另外店員的服務態度也很好很細心的介紹餐點
光這點我服務費就給的很心甘情願☺️
總之拜託有來台北的一定要來吃這家😤

照片中的餐點：自製蝦醬咖哩佐手打蝦排🍤🍛"
 高莉雅 ,https://www.google.com/maps/contrib/109238249077029076679/reviews?hl=zh-TW,5,True,17,海鮮非常新鮮，內容不可思議的豐富，不會因為是咖哩就蓋過海鮮的甜味，感受到主廚特別用心的把口味融合又特別強調出來，真的非常值得再訪
 Tony Lee ,https://www.google.com/maps/contrib/114238930416503614399/reviews?hl=zh-TW,5,True,82,咖哩滿滿香料，多了一種跟日式咖哩截然不同的溫潤口感～漢堡排多汁軟嫩，想再加一顆啊～～
 邱麗雯 ,https://www.google.com/maps/contrib/106122673246901310121/reviews?hl=zh-TW,4,False,5,不同於一般的咖哩料理，今天點的是深海王頂級鮟鱇魚咖哩，還贈送了鮭魚和炸牛排，料理豐盛～口味非常好吃😋😋😋
 LIZARD KUO ,https://www.google.com/maps/contrib/104318294663577628424/reviews?hl=zh-TW,5,False,30,"很好吃，推薦單點辣炒花枝
牛舌超讚！
如果想點螃蟹，建議加購起司殼（忘了正確名稱，就會連殼都可以吃，不然會陷入剝殼地獄😅😅"
 Matsuyoi N ,https://www.google.com/maps/contrib/100841051736112361400/reviews?hl=zh-TW,5,False,17,"挺好吃的，不是既定印象的咖哩，香料味其實很重，蝦排好吃，海味濃厚
送的炸牛排真的好吃，雖然全熟還是很軟嫩
份量很多，胃口算大的我竟然吃撐了🤣"
 Shan ,https://www.google.com/maps/contrib/117494407194454739729/reviews?hl=zh-TW,2,True,214,"服務100分，但
點了牛雜咖哩飯，牛排硬到不行有點不知道在吃什麼
蛋黃外觀看起來是半熟但外層吃起來像塑膠...
有看到很多評價說牛排很嫩很好吃蠻意外的
也可能是我個人觀感的問題僅供部分參考
咖哩部分也沒有很大的特色醬很多蠻膩蠻鹹的
環境部分椅子的墊子老舊有點微髒
整體CP不高對我來說是一次店

最後還是不得不稱讚服務態度真的很好👍
星星都給服務"
 Jake ,https://www.google.com/maps/contrib/117265365140945103026/reviews?hl=zh-TW,5,False,18,"整體用餐體驗非常新鮮，咖哩調味濃郁，與外面咖哩的感覺都不一樣。
這次點了芒果白咖哩牛肉漢堡排，漢堡排非常非常好吃，完全不膩口。
配餐加點豚肉湯也很好喝，濃郁香醇，重點是夠燙！
整體來說，除了蝦排沒這麼對口外，其他所有牛肉類的咖哩、炸物都非常非常推薦、好吃，很值得一再造訪。

最後最重點的，櫃檯服務的小姐基本上可以作為全台餐飲業服務員的表率，態度親切到令人開心！希望繼續保持，加分很多。"
 H.Y Chan ,https://www.google.com/maps/contrib/117969772295854503524/reviews?hl=zh-TW,3,True,42,"咖哩還有醬本身很不錯，但食材烹調上似乎跟我意識上好吃的呈現差距過大。

薯條含油率肉眼可見不酥偏軟，但肉醬是好吃的。

炸牛排麵衣偏水偏濕，肉本身沒味道，烹調過熟肉質算乾。

咖哩飯裡面的花椰菜太軟，玉米筍太油，飯太軟爛，太陽蛋有半熟的外表全熟的內在。

希望好吃的咖哩醬可以單賣不附其他東西可能才會在給機會。"
 Lily Chang ,https://www.google.com/maps/contrib/101236383907387509074/reviews?hl=zh-TW,5,True,219,"餐點用心服務良好的好餐廳😍
評論兩人同行有送炸牛排，餐廳有推廣但是是真的好吃，而且很尊重顧客意願！
牛雜咖喱三分熟完全不生很嫩
蝦醬咖喱滿滿的蝦花枝海鮮
芒果咖喱味道偏甜和諧好吃
三種味道都不錯，用料實在，份量十足🤤"
 亞次圓 ,https://www.google.com/maps/contrib/114210456089495247664/reviews?hl=zh-TW,5,True,87,"「溫」咖哩而非「熱」咖哩，但這並不減其餐點上桌時所帶來的份量感與奔騰熱氣。

有數種咖哩可選擇，每一種無論是搭配的醬汁、肉類，以及獨特的味覺刺激，都很令人驚奇，可以好好挑選自己最喜歡的組合！除此之外環境溫暖明亮、服務親切，也是此店的大優點之一~"
 TSAI Sonia ,https://www.google.com/maps/contrib/109008203017845451448/reviews?hl=zh-TW,5,False,117,"服務很親切，芒果鹹蛋黃白咖哩味道很獨特，很有趣的調味
google評論送的炸牛排很讚，餐廳的餐點本身質量很好，對得起目前4.8的高分~"
 林佩縈 ,https://www.google.com/maps/contrib/106296330996782690174/reviews?hl=zh-TW,5,True,160,"巷弄發現美食，安康魚咖哩太特別了，滿滿的鮮味跟海味。
打卡贈送的炸牛排也不馬虎，鮮嫩好吃"
 Larry Chen ,https://www.google.com/maps/contrib/111385908134305305777/reviews?hl=zh-TW,5,True,47,"咖哩非常好吃！
但美中不足的地方，用餐當天的冷氣很不強，吃完滿身汗…"
