user_name,user_profile_url,rating,local_guide,comment_num,comment_text
 Lexie Hung ,https://www.google.com/maps/contrib/115031407677057213326/reviews?hl=zh-TW,4,True,82,"偶爾的奢華系咖哩，適合小約會的餐廳，飽足感極高、為濃郁類咖哩。不喜重口味、辛香料、偏甜口味的人不建議嘗試～
低消一份套餐加一成服務費，人均消費$350（目前消費打卡或分享IGStory有送一份炸牛排）套餐附有一杯紅茶、一碟醃漬白蘿蔔、一個咖哩餐包（醬汁不夠可再續）

-牛雜咖哩佐爐烤牛排$308：很喜歡中規中矩的日式辣咖哩加上一點椰奶醬汁的濃稠感，辣上加點甜相當提味！牛雜吃起來會有一種牛肉牛雜麵的錯覺，可是卻在飯裡很特別～所有肉料都燉到軟爛，再配上3分熟左右的牛肋排，其實反倒更喜歡牛雜的部分，濃郁、溫潤腸胃，不至於過度創意讓肚子心驚

-芒果鹹蛋黃白咖哩佐和牛起司漢堡排$365：辛香、佐料非常的重！剛好我是很喜歡香料的人，所以吃起來驚喜又滿足。飯的部分店家選用類似炊飯和燜飯之間的口感，介於粒粒分明和濕黏間，配上很ㄍㄡˊ的咖哩醬相得益彰。
和牛漢堡非常香、搭上丁香和小茴香，增添了一種不同的風味口感，在飯裡還吃得到孜然粉和整根的肉桂棒，認真是一頓飽滿的味覺與嗅覺享受

附贈的咖哩餐包其實有一點點不需要，真的飽到不行，且內餡的咖哩醬跟主餐一比就弱了一些，其實好好吃主餐就大滿足！店家還有特色的海膽咖哩、炸蝦與螃蟹咖哩，需事先預訂。"
 PeiChun Liao ,https://www.google.com/maps/contrib/117205665736232875646/reviews?hl=zh-TW,5,True,88,"溫咖喱一直是跟友人的口袋名單，但其實有點忘記我們放口袋名單的原因是什麼了🤣🤣

跟友人臨時想起，所以我們並沒有訂位，中午12點多踏進了店裡，服務人員親切的幫我們填候補單，並告知可以先點餐預留餐點！

溫咖喱🍛的口味主要分成兩大類：海鮮、牛肉。喜歡吃魚的我，原本想點「海瓜子咖喱佐魚排」，但可惜的賣完了🥺🥺所以我跟友人分別點了「自製蝦醬咖哩左手打蝦排」及「芒果鹹蛋黃白咖哩佐和牛起司漢堡排」。

炎熱的星期六，外面的溫度估計少說也有36度以上吧..所以我跟友人先去隔壁的全家等待…少說也等了20分鐘以上！輪到我們～進到店內後才被告知兩人內用打卡可以送一份豬排，另外低消是一定要點套餐（附飲料、餐包、日式醬菜，及增量米飯和咖喱醬）！

飲料是不能選，喝起來應該是無糖麥茶；餐包～我記得店員是說「地瓜薯泥肉醬餐包」，地瓜的味道不明顯，倒是肉醬的味道我滿喜歡的；日式醬菜是「柚子醬白蘿蔔」，韓式的醃蘿蔔比較好吃說…

「自製蝦醬咖哩左手打蝦排」，蝦醬的味道很像越南料理的口味，只是又偏鹹了點，蝦排我覺得很有創意，外圍的炸物我吃起來是蝦漿的味道，裡面包裹的是完整的蝦肉，挺好吃的！

「芒果鹹蛋黃白咖哩佐和牛起司漢堡排」，這個口味在點餐的時候，店員就有告知咖喱醬味道偏甜且有肉桂味，甜味來自芒果，鹹蛋黃的味道其實月吃不太出來，肉桂的味道不太重，屬於可以接受；漢堡排是手作的，每份上面都有一片起司，鹹甜鹹甜的搭配在一起蠻好吃的！份量雖然不多，但是仍是可以吃很飽！

用餐的當日店內冷氣機剛好有問題…我邊流汗邊吃…實在是沒有什麼胃口（絕對不是咖喱不好吃..是天氣太熱造成的），儘管如此服務人員還一直跟我們道歉，真的是為難她了😅😅撇除天氣熱及冷氣的問題，溫咖喱的餐點很有創意，讓我想試試不同口味的咖哩，有機會會再訪！"
 陳靖予 ,https://www.google.com/maps/contrib/116522338719139289057/reviews?hl=zh-TW,5,True,79,"因為抽到《牛雜咖哩佐爐烤牛排》＄308買一送一所以我們今天就決定來吃這間咖哩～

套餐有附無糖麥茶、咖哩醬、醃蘿蔔、咖哩肉醬麵包、手工自製豆花
主食的內容物有：爐烤牛排、牛腩（？）、牛肚、玉米筍、花椰菜、杏鮑菇、半熟蛋、咖哩、香料飯
我覺得他們的咖哩真的很用心裡面還有牛肉碎肉、金針菇、蔬菜等等
辛香料的味道也不會很搶戲整體很溫和但又很濃郁
辣度是微微辣的程度
而且它本身的飯也不是白米那麼簡單它是用香料茶＋大骨湯熬煮的所以顏色偏深單吃就有味道的那種我自己好喜歡
但他其實飯量不多咖哩醬倒是給的很足
然後爐烤牛排是五分熟我自己覺得很不錯因為它肉咬起來是很嫩的而且給的量也很多
牛腩（？）一大塊並不會難咬反而偏向入口即化肉感很足好吃！
咖哩醬裡的牛肚也是好多塊而且很好咬不會像有些吃起來像咬橡皮筋一樣偏軟嫩而且很香
半熟蛋蛋黃戳破之後配上咖哩醬還有飯一起吃
超級無敵滿足的啦(〃'▽'〃)

另外兩人以上用餐點兩份餐點就送的炸牛排
我覺得蠻好吃的咬起來是比較有嚼勁的肉質外衣炸的很酥脆配上剛好的鹹醬汁加上五分熟的熟度我很喜歡！

麵包我就覺得還好了裡面的肉醬偏少吃起來也沒什麼味道還是要沾著咖哩吃比較好吃

最後的自製豆花豆味偏重而且比較綿密細緻

整體來說這間的咖哩我很喜歡！下次還想來吃啦～"
 林ting hen ,https://www.google.com/maps/contrib/100105445811020548185/reviews?hl=zh-TW,5,True,90,"想睡的星期六佐炎熱的39度大熱天！！我們兩人只記得溫咖哩是我們的口帶名單，但似乎忘了看裡面到底賣什麼膏藥就踏進了店內，服務人員親切的幫我們填候補單，並告知可以先點餐預留餐點。外頭熱到讓人受不了，我們倆決定到隔壁的全家避暑afewmomentslater（其實蠻久的）進到店內被告知兩人內用打卡可以送一份豬排，低消一定要點套餐。
我們選了海瓜子咖哩佐魚排被說賣完了，改成自製蝦醬咖哩左手打蝦排與芒果鹹蛋黃白咖哩佐和牛起司漢堡排，我飲料不能選，喝起來應該是麥茶，麵包裡有肉醬但不多，她蠻喜歡的，一碟小菜和多的咖哩醬，整體大概是這樣，如果可以我不想點套餐，覺得沒什么。
主餐的白咖哩店員有告知算甜且有肉桂味，可接受但不太愛肉桂味的我覺得味道不重，完全可以接受，漢堡排沒我想像的大，整個蠻好吃的！蝦醬的部分蝦排很好吃就這樣，因為他的醬我覺得過鹹所以我沒很愛（每個人口味不同不用太在意）
服務人員真的很親切，雖然她吃得很難過很不高興，因為他們冷氣有問題，熱得不像話。
撇除冷氣問題這是一間還不錯的店，服務人員好，餐點是有創意的咖哩，值得再訪"
 蔡承臻 ,https://www.google.com/maps/contrib/110241317621643163597/reviews?hl=zh-TW,5,True,962,"店內座位不算多，假日晚上17：30開門，大概18：00就快坐滿了，生意算很好！確定要來可以先打電話訂位。
之前有來外帶過一次，就覺得還不錯，今天來吃內用實在驚為天人！內用咖哩都是套餐形式，除了飯量和咖哩增量之外，還有咖哩餐包和飲料，另外兩份套餐會送一份炸牛排。
店內的咖哩種類很多也都很有特色，主要分為牛肉和海鮮兩種類別，店員也都很詳細的介紹。我們點了一份海膽咖哩和一份牛舌咖哩，兩者的路線很不同，但都非常美味。最讓人驚喜的地方是，咖哩裡面都會有名字之外的料，而且還不少種。例如海膽咖哩的配料有烤鯛魚下巴、小卷、小干貝、某種貝類、辣明太子跟整塊的海膽。牛舌咖哩除了烤牛舌片之外，還有牛筋跟牛腩，還可以另外加點厚切牛舌。
咖哩飯量很夠，還另外給了一小杯的醬料，裡面也是滿滿的配料，整份吃完非常滿足！雖然內用比外帶貴之外還要加收10%服務費，但我覺得非常值得。"
 Lily莉莉 ,https://www.google.com/maps/contrib/104371695812477297128/reviews?hl=zh-TW,5,True,244,"📍溫咖哩WenCurry

月初月底隨時來一碗，其實生活也沒有那麼難。

#芒果白咖哩口味
吃起來有淡淡的芒果香甜，鹹鹹甜甜的，又會帶一點辣感，口味非常的濃郁，個人是蠻喜歡嘗試看看新風味的口味的，所以對這次的咖哩醬很滿意，因為是第一次吃到這種口味的咖哩。

#牛雜咖哩
口味吃起來就中規中矩。

#海陸豐盛號
集結了海大蝦、干貝、星鰻、透抽、還有板腱牛排，滿滿的一大碗，吃起來特滿足的，不論是海鮮或是牛排的口感都很好，海鮮吃起來很新鮮，蝦子也有幫忙去蝦腸了，很貼心，這一碗吃下去真的超飽。

#自製蝦醬咖哩佐手拍蝦排
蝦排是蝦漿包覆兩尾新鮮的無毒藍鑽蝦油炸，上面再搭配上起司而成，蝦排外脆內扎實，咖哩醬裡有滿滿的料，花枝、蝦米、玉米筍等，但蝦米的頭會刺刺的，所以吃的時候要小心點，店員也有提醒。

吃一次就上癮的咖哩飯，沒想到咖哩會有這麼豐富的口味，餐上還有附贈一碗小咖哩醬，怕客人不夠沾附上的，還有LOGO餐包裡面包著咖哩醬，吃起來真的好好吃，雖然吃到後來覺得很膩了，份量真的蠻大的，但我還是很喜歡，是會再來吃好幾次的咖哩店。店內的店員也都很貼心，服務態度非常親切，店員姊姊也超漂亮的。

🍴𝑊ℎ𝑎𝑡𝐼𝑜𝑟𝑑𝑒𝑟𝑒𝑑
海陸豐盛號$680、自製蝦醬咖哩佐手拍蝦排$365、起司和牛漢堡排(2個)$150、雙人同行打卡送炸牛排

💰價位：偏中上，但是我覺得物超所值。
🅿️停車場：可以停台灣聯通停車場-醒吾場
🏬環境：店內蠻寬敞的，餐廳裝潢很有農村氣息，蠻多家庭會帶小朋友來吃。
💟好吃程度：有很多特別口味的咖哩，我覺得可以嘗試看看的，第一次吃到這麼多口感的咖哩，很喜歡。

#𝕃𝕚𝕝𝕪𝕤𝔽𝕠𝕠𝕕𝕚𝕖"
 Jeremyta Chen ,https://www.google.com/maps/contrib/103352468735316430136/reviews?hl=zh-TW,4,True,70,"咖哩的香氣不錯，算是比較不重口味的，飯內加了杏鮑菇增加口感，但我個人不敢吃菇類，只好打包回家給家人吃，如果菜單上能再加註說明會更好。

螃蟹是東南亞空運來，說實在這個價格很合理，但冷凍螃蟹入菜，對吃慣新鮮海鮮的台灣人來說，氣味就不太好聞，加點的螃蟹也覺得還好，但畢竟一分錢一分貨，如果真的嘴饞想吃螃蟹，還是可以試試。

贈送的炸豬排非常的棒，外酥內嫩，非常超值，吃得出好的肉質。

結論，口味很特別，有別一般傳統咖哩，肉類處理很棒，服務很好，價格合理。"
 tone hector ,https://www.google.com/maps/contrib/114443572853817007313/reviews?hl=zh-TW,4,True,788,"營業時間剛到就坐滿人，還好單人把台還有位子，用稻桿裝飾的還是第一次遇到，店內乾淨整潔。

外場三位女生負責，不至於應付不來，會詳細解說餐點。

點了蟹膏咖哩+點軟殼蟹+湯
蟹膏咖哩就一隻小螃蟹滿滿的蟹膏，不過蟹小沒什麼肉，這種搭配很有噱頭；至於咖哩醬口味蠻淡的，飯看起來像是風味飯，但也是偏淡，料中除了蔬菜外還有兩種海鮮，整體吃起來還可以。

加點的軟殼蟹不貴，加了起司稍稍偏鹹了點，夾在套餐麵包一起吃剛剛好。

排骨蘿蔔湯還不錯喝。

這邊兩人套餐只要評論就會送炸牛排，單人沒有喔！
整體吃下來咖哩覺得略貴了點，其他都還不錯。

另外結帳有含10%服務費喔！"
 esmeralda Lu ,https://www.google.com/maps/contrib/111206759259018533694/reviews?hl=zh-TW,5,True,31,"*兩人同行，寫評論或IG有送炸牛排，若不吃牛的人還可以換魚排喔！

今天點的是蝦醬咖哩蝦排套餐，包含一個奶油咖哩肉醬餐包、醃漬蘿蔔、無糖麥茶和一杯濃縮咖哩，提供給咖哩醬不夠的人加~
咖哩飯的部分裡面還有玉米筍、蝦排、魷魚、蛋、杏鮑菇丁和青花菜。
咖哩口感大概是提味的微辣感，蝦排很特別，是將蝦子跟蝦排結合在一起的，蔬菜也很新鮮，飯粒粒分明，也帶有咖哩味，魷魚很嫩。
餐包趁熱吃，非常鬆軟，搭配醃漬蘿蔔十分解膩。
整體來說，吃起來很飽，品質也很不錯！店員也很熱情~"
 SKYE CHEN ,https://www.google.com/maps/contrib/111819530758406463214/reviews?hl=zh-TW,5,True,41,"⌚️【去的時間】拜三中午1點
📞【有無預約】無，可能是1點用餐，沒有等候時間
👣【願意回訪程度】會二訪
💰【花費】$260+10%

📝【食記】
▪️海瓜子咖哩佐魚排$260
咖哩是椰奶口味，海瓜子跟所有食材跟咖哩mixed在一起，醬料非常濃郁，而且醬給的很多，不會有吃到最後沒醬汁的窘境，吃的過程中搭配副餐的蘿蔔，會瞬間變清爽很加分，但副餐的麵包就略顯普通。一份咖哩的份量也很多，兩人同行打卡還會贈送炸豬排，但最後根本吃不下，所以不知道贈送的那塊炸豬排到底好不好吃😆
最後還招待他們自制的豆花，也是直接打包帶走，但重點還是主食啦！

🔹後記
店員的服務非常好，很仔細的介紹餐點，也很細心的詢問要不要提供小碟子讓客人可以分食。

🌱P.S溫咖哩也有提供蔬食的咖哩，雖然菜單上沒有出現，但只要提前半小時以上預約訂餐，就可以吃到了～

🖍【滿分五分】
《餐飲》🌝🌝🌝🌝🌝
《服務》🌝🌝🌝🌝🌝
《氣氛》🌝🌝🌝🌜"
 Devin Chang ,https://www.google.com/maps/contrib/108764703944519493174/reviews?hl=zh-TW,5,True,72,"來來來！咖哩控看過來！跟一般咖哩不同這邊的咖哩都是熟成咖哩，是以25種以上的香料調配做出來的❤️

店內環境以木質為主的鄉村風的設計感，一進門就會看到很可愛的櫃檯，裡面很寬敞位置也很多坐起來不會有壓迫感，可以很放鬆的享受著咖哩🥰

今天本來想要選擇芒果鹹蛋黃白佐和牛起司漢堡排，但是到現場後發現有新的菜單，對於喜歡嚐鮮的我立馬就決定他了

夢幻牛舌咖哩
這是原本有的牛雜咖哩的2.0版本，既可以吃到薄切牛舌（熟度5-7分）又能吃到爐烤牛排🥩（熟度3-5分）兩種享受一次滿足，喜歡牛舌的朋友還可以在加購現煎厚切牛舌！咖哩吃起來口味偏重微辣的口感，跟牛舌牛排美美的太陽蛋，搭配在一起達到了完美的平衡😄，為了怕咖哩不夠還有多附上一杯咖哩，可以倒進去或是搭配餐包一起吃，都很棒❤️

雖然價格偏高，但是吃完之後真的覺得很值得👍

🌟夢幻牛舌咖哩$408
（現煎厚切牛舌+$100）

有喜歡的朋友歡迎追蹤
IGdevinc0922_eat"
 Cathy Chao ,https://www.google.com/maps/contrib/117511832198440802817/reviews?hl=zh-TW,5,True,28,"發揮創意的咖哩料理，原來吃一碗咖哩也可以是一場奢華饗宴！

採單點或套餐，店員會問喜歡吃牛肉還是海鮮進行餐點介紹～如果有特別想吃的口味，建議先訂位指定請店家保留，以免完售吃不到哦！

❤【夢幻牛舌咖哩】$408/份

套餐包含咖哩麵包、無糖麥茶、醃漬蘿蔔、補充咖哩一份，不用擔心吃到後面沒醬料單吃飯很乏味

一碗份量很多～還有玉米筍、花椰菜、杏鮑菇點綴，麵包軟軟的沾著咖哩很好吃🤤米飯也不是一般的白米，吃起來有點像糙米口感。

重點牛舌超、好、吃，很有嚼勁但又不會咬不爛，爐烤牛排有幾塊吃到最後有點硬（另外覺得不用加點$100的厚切牛舌，雖然也好吃，不過原本的薄牛舌就很讚了）

整體來說很棒！咖哩不是辛辣感，很純厚不膩口👍店員也超級親切～會想再回訪、揪朋友點其他料理

*全店料理需加10%服務費
*只收現金
*善導寺站4號出口走約6分鐘可抵達"
 ciaochan ,https://www.google.com/maps/contrib/104173759448391853057/reviews?hl=zh-TW,5,True,96,"🍛牛舌咖喱-薄片的牛舌是比較有脆感的，雖然不是我喜歡偏嫩的口感，但還是很不錯的。
咖喱飯本身已經辦過咖喱，並不是整個泡在裡面，而是另外又附一杯咖喱可以自行增減，這個部分真的是太貼心了🥰
咖喱麵包很香，蔬菜就是普通配角，荷包蛋幾乎9分全熟比較可惜，我喜歡半熟～

🍛朋友的蟹膏咖哩-螃蟹味道不錯可惜我不會吃螃蟹⋯朋友倒是吃的很仔細，高手啊！而且蟹膏咖喱的咖喱飯搭配的咖喱醬跟我的味道完全不一樣，他的咖喱超鮮的，十分海味的咖喱。

🍛加點軟殼蟹-有點濕，但味道不錯
🍛單點韓式辣炒花枝，花枝很Q而且韓式的辣醬不會甜過頭，只是辣不夠～但整體來說蠻喜歡的

🌶推薦另外請店員提供辣椒粉，搭配咖喱飯一起吃，絕！"
 Amber ,https://www.google.com/maps/contrib/110438844195446691332/reviews?hl=zh-TW,2,True,133,"評價4.8是打卡送東西來的～
建議從低評分開始看

現在雙人套餐送的炸牛排蠻老、外皮滿厚沒什麼特色，炸牛排不吃的話可以換魚排，但是魚排也是普，然後外皮不是脆的、軟軟的那樣，其他餐點的品質也蠻低落，大家都吃不太完

點了四種五種的套餐，沒有一種好吃到可以寫評論推薦的

500塊那個套餐加一成就550了不如去外面吃更好的set，品質沒有到，那個咖哩生魚片，真的只是咖哩加生魚片

還有明明是寫著日文招牌的咖哩裡面放韓國流行樂，很不ok：））

很普通的咖哩店沒發現是被洗評價所以進去消費，所以很失望，真的很普通"
 范卉淇 ,https://www.google.com/maps/contrib/115346868016268951864/reviews?hl=zh-TW,5,False,3,"每週固定要來忠孝新生站看中醫想說來搜尋看看IG有沒有推薦的忠孝新生美食結果發現很多人都推溫咖喱於是就跟老公來吃吃看！

📍自製蝦醬咖喱佐手打蝦排
網路上最多人推薦！蝦子是用整隻蝦去炸的有點驚艷到我蝦醬也很特別整體來說很好吃蝦排讓我跟老公都很驚艷👍

📍夢幻牛舌咖喱
牛舌我們是選5分熟不會很生的感覺老公說好吃但不知道怎麼形容🤣🤣有一點炭烤的感覺

日式起司魚排的部分起司味很夠喜歡起司的人應該會很喜歡

最後是服務的部分不得不說服務人員真的很親切態度也非常好上班一天的疲憊與老公的小約會得到紓解☺️☺️服務人員臉上都是滿滿的笑容講話很有元氣一聽到我們筷子掉了馬上衝上來換一雙新的👍👍"
 張皓翔 ,https://www.google.com/maps/contrib/104042325529868422891/reviews?hl=zh-TW,5,False,9,"餐點比預期的更令人驚艷，服務也很棒
在這附近以這價格，是CP值不錯的餐廳

芒果鹹蛋黃白咖哩佐和牛起司漢堡排
芒果鹹蛋黃白咖哩醬，酸甜滋味挺爽口，雖然對我而言有點甜，但也僅是果汁的甜度
漢堡排煎的剛好，外表帶點焦香，咬下一口肉汁四溢

牛雜咖哩佐爐烤牛排+升級牛排5盎司
肉煎的雖然偏熟，但並沒讓肉汁流失

咖哩起司肉醬薯條
薯條因為有二次炸的緣故，外酥內軟。外表不會過硬而刮傷口腔，能夠大口的享受罪惡食品

招待日式炸牛排
炸的油溫有控制好，讓外皮金黃酥脆的同時也沒讓內部的肉汁流失，配上店家的醬汁，讓人一口接一口"
 _Chung Josh ,https://www.google.com/maps/contrib/117241005801864458611/reviews?hl=zh-TW,5,False,3,"今日用餐餐點：
-夢幻牛舌咖哩
飯是有入味的飯，軟硬適中
精燉牛肉跟牛肚入口即化
牛舌三分熟，口感較有嚼勁
牛肉都非常多汁，肉汁都沒有跑掉
跟咖哩搭在一起口感特別
一份咖哩可以吃到多種牛肉，很特別
附贈打卡招待的炸牛排，多汁軟嫩

-煙燻抹茶咖哩搭磯煮鮑魚佐咖哩醋漬日本生蠔
生蠔很新鮮，完全不會有腥味，搭配咖哩醋很特別
鮑魚口感很軟不會難咬，且有入味，讓人印象深刻
咖哩內含蚵仔，以及非常軟嫩的花枝，還有超級多的干貝，口感也很柔軟
咖哩實際上吃不出來香菜味跟抹茶味
是很特別的口味的咖哩

附餐的咖哩餐包很美味~

另外服務人員態度極佳，上餐速度也很快
最後還有招待的豆花

想體驗特別口味的咖哩可以來這邊試試看
會推薦朋友來用餐"
 戴語歆 ,https://www.google.com/maps/contrib/108728608040609374338/reviews?hl=zh-TW,5,True,3,"•夢幻牛舌咖哩+100升級厚牛舌
厚牛舌有Q彈、咖哩醬韻味濃厚~一小杯咖哩醬可以沾麵包或是淋在碗裡，咖哩醬中還有牛筋跟其他配料！

•滿滿蟹膏咖哩+100起司軟殼蟹
入秋想吃螃蟹的朋友一圓螃蟹夢吃得很滿足、起司軟殼蟹起司加得恰到好處~

•芒果鹹蛋黃白咖哩佐和牛起司漢堡排
店員有提醒味道比較偏甜特殊，但我覺得很喜歡，白咖哩還有淋芒果醬，凸顯了咖哩味又多了清爽食感~我很喜歡！咖哩醬中還有厚切角培根、金針菇、洋蔥等等~口感豐富！

•目前點兩個套餐打卡有贈送炸牛排活動，炸牛排也很有水準，很好咬~

我們整體用餐體驗很喜歡~"
 林德美 ,https://www.google.com/maps/contrib/104852967262072823810/reviews?hl=zh-TW,5,True,40,"每一道餐都在水準之上，服務人員非常親切又貼心！
醬料會因應不同的餐有不同的風味，滿滿蟹膏是海鮮咖哩醬，夢幻牛舌有起司的風味
加點的軟殼蟹是非常難得一見的好吃，殼酥脆不刺嘴，調味也很合適～"
 Nancy將的生活筆計本 ,https://www.google.com/maps/contrib/110051692410303324986/reviews?hl=zh-TW,5,True,181,"温咖哩WenCurry主打熟成咖哩飯專賣店，有別常見的帶有甜味日式咖哩或是微辣的印度咖哩
我有吃過熟成牛肉但還沒有吃過熟成咖喱，對於熟成咖哩的味道十分好奇
温咖哩所提供的咖哩口味真的很特別，都是外面沒有吃過的咖哩口味
有海膽、海瓜子、蝦醬還有超特別的鮟鱇魚耶~
配料超威的海陸豐盛號咖哩需要提早預約喔~
消費內容
⭐️酌收10%服務費。
⭐️每人低消一份套餐。
⭐️用餐時間限制80分鐘。
⭐️套餐均附:日式醬菜、現烤奶香餐包、豚骨香米飯、咖哩增量、飲料乙杯
牛雜咖哩佐爐烤牛排
套餐均附:日式醬菜、現烤奶香餐包、豚骨香米飯、咖哩增量、飲料乙杯
怕咖哩不夠加店家還在套餐中多給了一小杯咖哩醬
牛排底下的米飯可不是單純的白米飯而是精燉豚骨高湯悶煮的米飯
單吃豚骨香米也非常的有味道喔~
芒果鹹蛋黃白咖哩佐和牛起司漢堡排
白醬使用枋山愛文芒果及優格來製作，吃起來是甜甜鹹鹹的味道
有咖哩香也有芒果香甜的香氣喔~這味道雖然特別但卻不會不好入口
起司和牛漢堡排表現的也很不錯
首次造訪温咖哩WenCurry餐點口味真的特別又好吃👍️"
 蹦羋乓 ,https://www.google.com/maps/contrib/113930582176782523698/reviews?hl=zh-TW,4,True,22,"海膽咖哩很好吃，蠻像海鮮豆腐煲的（這樣說有加分嗎？😂）
按讚送炸牛排，很嫩，超級出色的！！！外皮是標準日式的酥炸外皮，很好吃！
海陸豐盛號，雖然沒有事前預約，但仍然可以現場問問看，還是有機會吃到的，孜然牛排很出色，天使紅蝦大隻爽度很高。
抹茶豆花佐黑糖水，是贈送的試吃的甜點，抹茶豆花明顯有抹茶味，而且豆花是手作的，好吃😋"
 CMY ,https://www.google.com/maps/contrib/104497952459545003688/reviews?hl=zh-TW,3,True,24,"社群網站遍佈商業氣息濃厚的食記，看久還是忍不住驅車前往🌝

看起來大大的，實際上小小的。

咖哩名符其實溫溫的，雖有些不習慣但還能接受。

深海王頂級鮟鱇魚咖哩的鮟鱇魚肝綿密細緻，友人怕腥不愛，個人覺得帶點腥味才像鮟鱇魚肝，滿喜歡的🤎

筷子夾起的是風味咖哩漬鮭魚生魚片，這種搭配還是第一次見過。咖哩很冰、鮭魚肥美，咀嚼在口中能感受鮭魚油脂的香醇，咖哩蓋過生味，相當特別的組合。

原先想點北海道海膽咖哩，感謝服務人員告知海膽咖哩為了凸顯海膽的鮮甜，整體口味偏淡，才改成魚肝咖哩。因為魚肝咖哩已經挺淡的了😅

自製蝦醬咖哩佐手打蝦排，蝦味蓋過咖哩味，手打蝦排賞心悅目但滋味平凡，溪蝦吃起來刺刺的~個人不是很喜歡。

兩人同行，內用點兩份套餐打卡贈送的炸牛排皮肉分離、韌性十足，沒有加分效果呢。

一頓下來最好吃的是起司咖哩肉醬薯條，若是把贈送的炸牛排成本移到咖哩研發上，或許會更好~

CP值不高，但口味創新、出餐速度快、服務人員親切俐落，繼續加油！"
