user_name,user_profile_url,rating,local_guide,comment_num,comment_text
 Yun ju Chiang ,https://www.google.com/maps/contrib/107462441877417639070/reviews?hl=zh-TW,5,False,4,"店面本身的氛圍很溫暖，服務生的菜單介紹也很詳盡，針對客人的過敏原也熱心地協助調整配菜！

餐點也很快就上桌了，咖哩味道很溫潤，蝦排的作法也很新穎，感覺非常適合秋冬吃的溫暖咖哩❤️

套餐還有附咖哩麵包跟清爽解膩的醃蘿蔔，餐點份量對男生來說剛好，食量較小的女生可能不要把飯吃完比較不會那麼飽！

甜點的抹茶豆花也很清爽，豆花本身口感偏實在，帶有淡淡的抹茶香氣，配上微甜的甜湯非常Match!

非常推薦的店家👍👍👍"
 Lee Hao ,https://www.google.com/maps/contrib/111822814346954323865/reviews?hl=zh-TW,5,False,14,"這次點的是牛舌咖哩和抹茶的海鮮咖哩以及加點了一份每日例湯

例湯的部分
是很認真的大骨高湯，和豬肩頰以及蘿蔔
整體味道清甜，而且層次分明味道突出
是今天最滿意的部分

抹茶海鮮咖哩上面的鮑魚
鮮甜可口，而且熟度適中，所以口感嫩帶嚼勁，有認真對待食物的感覺
美中不足的部分就是沒有什麼抹茶味…？
咖哩的部分感覺有點可惜，但是其他食材的處理上淋漓盡致

牛舌咖哩的部分
味道很豐富，只是咖哩吃完口會有點渴
一定要配著其他的東西吃，才能襯托出來
食材都有被認真對待，很感動

自己對於咖哩體驗的部分感覺有種雞蛋裡挑骨頭的感覺

總之整體的感受很棒，店員也很貼心親切，下次有機會會再訪"
 Ava Lin ,https://www.google.com/maps/contrib/103561736235362360753/reviews?hl=zh-TW,4,False,3,咖喱口味特別，料很實在，蟹膏咖喱的螃蟹真的有滿滿的蟹膏，用餐環境明亮舒服，店員親切服務很好👍
 boss老大 ,https://www.google.com/maps/contrib/100543474672639829799/reviews?hl=zh-TW,5,False,4,"次數：第一次
餐點：自製蝦醬咖哩佐手打蝦排
感想：份量很足吃完很飽但不會撐到👍咖哩很香蝦排好吃😋👍👍"
 Ke-hsien Huang ,https://www.google.com/maps/contrib/101934921805409880400/reviews?hl=zh-TW,5,False,20,服務周到，海鮮咖喱料好實在。吃完飽足感十足。
 Gotman Tac ,https://www.google.com/maps/contrib/118268825229746181305/reviews?hl=zh-TW,5,False,2,"自製蝦醬咖哩佐手打蝦排，好香的蝦味，吃到後面超喜歡的。
芒果白咖哩佐起司和牛漢堡排，份量超充足。起司味道濃厚。
咖哩麵包好好吃，雖然最後才吃，很好吃硬是把它吃光光啦"
 Jay Huang ,https://www.google.com/maps/contrib/102184626099910551473/reviews?hl=zh-TW,5,False,5,滿滿蟹膏咖哩海鮮味十足很新鮮喲
 陳泳蓉 ,https://www.google.com/maps/contrib/117817223836808876528/reviews?hl=zh-TW,5,True,629,很好吃~~環境跟服務也都很好！
 Liu Eileen ,https://www.google.com/maps/contrib/102162490618833634827/reviews?hl=zh-TW,5,False,24,"蝦牌咖喱超好吃！
蝦子的香氣跟咖喱搭起來超讚！
而且店家服務態度很好唷！下次還會再來~
附上餐點照~~"
 Vivi Chen ,https://www.google.com/maps/contrib/109372822951248293648/reviews?hl=zh-TW,5,False,7,"一進門看到我提著蛋糕
就主動提出要幫我冰冰箱
非常的貼心讓我印象深刻

口味很特別從沒吃過的咖哩
蝦子跟咖哩意外的很融合
服務人員親切服務感覺很溫馨
飯後還招待手工抹茶豆花
👍👍讚讚會再來二訪100分"
 Jungkai Gu ,https://www.google.com/maps/contrib/117404004334578704254/reviews?hl=zh-TW,5,False,7,今天點了海瓜子咖喱，咖喱味道很細膩，好吃又划算
 許瑞紋 ,https://www.google.com/maps/contrib/115299831546289520680/reviews?hl=zh-TW,4,True,35,"咖哩味道不錯，而且有另外再多附咖哩醬
不會吃到後面都是飯
蝦排有點普通不如預期
整體來說還可以"
 hugo kuo ,https://www.google.com/maps/contrib/103113112273777052285/reviews?hl=zh-TW,4,True,247,豪華的咖哩，口味不錯，但CP值略低
 柳亦貞 ,https://www.google.com/maps/contrib/114493664743722408239/reviews?hl=zh-TW,3,False,6,"今天剛好餐點牛筋咬不下去🙃
份量足夠，吃很飽😃"
 YUAN ,https://www.google.com/maps/contrib/113086765606731821917/reviews?hl=zh-TW,5,False,2,"店員介紹非常仔細，餐點也十分好吃！

這次用餐點了兩份不同的咖哩，每款都很有特色！
服務也十分周到，還招待了炸牛排，下次會再度回訪"
 阿傑 ,https://www.google.com/maps/contrib/116359222051654162703/reviews?hl=zh-TW,5,False,5,"食材不錯～和朋友一起用餐很愉快
服務品質沒話說～櫃檯人員超親切～～"
 7 7 ,https://www.google.com/maps/contrib/112921348100825585380/reviews?hl=zh-TW,5,False,5,質感很棒食物也不錯經過的話可以進去試看看
 Carol Yang ,https://www.google.com/maps/contrib/115703157161535043649/reviews?hl=zh-TW,5,False,3,店員超級親切，餐點也美味，推推ჱ̒⸝⸝•̀֊•́⸝⸝)
 艾瑞克 ,https://www.google.com/maps/contrib/113722437293395239230/reviews?hl=zh-TW,5,False,4,"韓式辣炒花枝&日式炸牛肉好吃
咖哩飯的份量也足夠"
 Eden Chen ,https://www.google.com/maps/contrib/107943057402115946587/reviews?hl=zh-TW,5,False,18,用餐感受很好，服務、餐點，包含餐點的完整性，都值得五顆星😌
 kenn chen ,https://www.google.com/maps/contrib/104094445443716181527/reviews?hl=zh-TW,5,False,6,餐點很好吃！牛舌非常推薦
 Daisy ,https://www.google.com/maps/contrib/102105279537458672567/reviews?hl=zh-TW,5,False,3,在疫情期間的現在給我們溫暖體驗的一家小店，套餐很有份量也非常好吃，有機會會再來的
 馮詩宸 ,https://www.google.com/maps/contrib/104867301741101606216/reviews?hl=zh-TW,5,False,13,點了蝦醬咖哩蠻好吃~~雖然咖哩味不算很重，不過送的炸牛排很好吃！可以感覺到店家的用心❤️
 蕾唄卡 ,https://www.google.com/maps/contrib/110710340356652807814/reviews?hl=zh-TW,5,False,2,口袋名單的咖哩好好吃！服務人員好親切，下次還要再來吃！
 BOSHCHANG ,https://www.google.com/maps/contrib/116989501764856246910/reviews?hl=zh-TW,5,True,224,嘎哩醬豐富內涵，牛肉肉味十足
 蔡婷伃 ,https://www.google.com/maps/contrib/117346485013546828021/reviews?hl=zh-TW,4,False,16,"外帶回家也好吃😋
贈送小菜也好吃😋
漢堡排很多汁！
🦐排很新鮮～
唯一希望醬汁可以再多一點🙏

店員服務態度很好，看著外面下雨一直告訴我不要急，慢慢來就好～

再等疫情穩定，我要去內用！"
 林依璇 ,https://www.google.com/maps/contrib/117476539135681659511/reviews?hl=zh-TW,5,False,4,店員親切咖哩炸牛排好吃😋起士漢堡排必點❤️
 Yuyu Chen ,https://www.google.com/maps/contrib/101609081237864345778/reviews?hl=zh-TW,5,True,43,"挺好吃，cp值很高，招待甜點.
很特別味道的咖哩。和一般不同值得試試"
 Katie Chang ,https://www.google.com/maps/contrib/106257783045310394713/reviews?hl=zh-TW,5,False,6,"牛雜咖哩佐爐烤牛排
套餐附無糖麥茶醃蘿蔔咖哩肉醬麵包😆"
 張珈琪 ,https://www.google.com/maps/contrib/112433099573679744180/reviews?hl=zh-TW,5,False,8,食材新鮮，味道很棒，接待人員超級親切❤️
 chloe chiu ,https://www.google.com/maps/contrib/116812921385305966158/reviews?hl=zh-TW,5,False,7,牛舌咖哩好吃，店員也很親切👍🏻
 黃哲偉 ,https://www.google.com/maps/contrib/105933889825760104908/reviews?hl=zh-TW,5,False,4,咖喱料理非常精緻，服務也很親切！
 Calen Hsieh ,https://www.google.com/maps/contrib/106113178401693138457/reviews?hl=zh-TW,5,False,8,"別的地方吃不到的口味～
漢堡排的咖哩醬因為芒果的關係偏甜，但是也不會膩
份量也很足夠"
 廖婭婷 ,https://www.google.com/maps/contrib/118191428541157981665/reviews?hl=zh-TW,5,False,34,"不吃牛的可招待魚排~
牛雜咖哩&蝦醬蝦排咖哩好吃。

配菜-醃漬蘿蔔雖然是小配角，但一入口卻驚為天人，可見店家對配菜的處理也是很用心的~~

而，兩位的服務人員都很親切，對於第一次來的客人，菜單上的講解也很詳細。

希望不吃牛肉的我，下次再次造訪時，可以有多一點的餐點選擇~~~"
 陳心婗 ,https://www.google.com/maps/contrib/110290955104181383068/reviews?hl=zh-TW,5,True,56,味道很特別，歡迎大家嘗試～
 張唐綸 ,https://www.google.com/maps/contrib/102388939916235233026/reviews?hl=zh-TW,5,False,11,"芒果鹹蛋黃白咖喱：
口味偏甜很特別，芒果味足，醬底可以吃到雞軟骨、金針菇，喜歡嘗試特別口味咖喱的可以嘗試看看☺️

📌店員很貼心的會先提醒醬口味偏甜

套餐附的餐包：
餐包內是地瓜泥咖哩肉醬，麵包鬆軟熱熱的很好吃，但內餡偏少（個人愛好是內餡多）

炸牛排：
表層酥脆，肉還算厚，但整體沒有很特殊"
 柯雅詩 ,https://www.google.com/maps/contrib/117573497811844138344/reviews?hl=zh-TW,5,False,15,光是打卡招待的炸牛排就值得五顆星
 李世炘 ,https://www.google.com/maps/contrib/102930506547254981809/reviews?hl=zh-TW,1,True,77,"個人非常不推，強烈懷疑是打卡換評論的店，原因如下：

·咖哩偏日式，但香味平淡，口感詭異。

·三人共花了1598元，但價位完全沒有反應在食材的品質上。

·二人套餐，贈送的一小塊牛肉上居然是一大條類似嫩肩上的筋。這根本無法吃～由此可見一般。

以上"
 Gary Shine ,https://www.google.com/maps/contrib/110187394511492939696/reviews?hl=zh-TW,5,False,5,餐點很棒，牛肉很鮮，很好吃
 Shin Yi Lin ,https://www.google.com/maps/contrib/105470496400659540473/reviews?hl=zh-TW,5,False,10,咖哩的味道很特別很好吃，不膩
 鄭仲凱 ,https://www.google.com/maps/contrib/105905637303532773212/reviews?hl=zh-TW,5,True,19,今天只剩海鮮類咖哩，下次試試牛舌
 Angela Hung ,https://www.google.com/maps/contrib/108856802530176352860/reviews?hl=zh-TW,5,False,8,第一次來！非常好吃🥺已經在想下次來要吃什麼了
 Gan Ming-Hung ,https://www.google.com/maps/contrib/114211703549143364812/reviews?hl=zh-TW,4,True,26,好吃又奢華的咖哩，服務的態度超好！
 How ,https://www.google.com/maps/contrib/110915929389003304329/reviews?hl=zh-TW,5,False,7,蝦醬咖哩味道相當不錯，蝦味濃郁，醬中有幾隻小蝦要注意不要被刺著了。
 賴宣蓉 ,https://www.google.com/maps/contrib/106300055305924452903/reviews?hl=zh-TW,5,False,9,超級好吃！！牛肉很嫩，服務態度也超級好有給詳細的介紹
 Darcy Fang ,https://www.google.com/maps/contrib/115367866750172657548/reviews?hl=zh-TW,5,False,13,"下午看了食戟之靈幸平的咖哩之戰，決定找一間咖哩店當晚餐。

被劇情裡的芒果咖哩燒到，於是點了芒果白咖喱，酸香濃甜的芒果味，加上富含類似蘋果香的肉桂味，扎實的肉排與肉塊混合半熟荷包蛋，花椰菜、小玉米與杏鮑菇丁也搭配合宜，整體份量十足十。

混在肉塊咖哩醬裡的圓形香料，在吃的時候沒有注意分辨，各位看官小心咬到會被香料爆擊。

炸牛排不錯吃，湯很令人驚豔，但韓式辣炒花枝更推薦。

不多說了，得趕緊把衣服穿好。"
 Paul Chiang ,https://www.google.com/maps/contrib/110330967860690677802/reviews?hl=zh-TW,5,False,3,餐點相當好吃，服務人員態度親切，上餐速度快，用餐環境優良
 陳亭均 ,https://www.google.com/maps/contrib/100409693152887561953/reviews?hl=zh-TW,5,False,4,人潮很多，建議五六日要先訂位⋯用餐過程有聽到餐點售完的速度很快！！但服務人員每個都很有耐心，今天跟朋友點白咖喱跟牛舌😍😍，鹹甜的口感特別、牛舌脆口！好讚👍🏻👍🏻
 葉小龍 ,https://www.google.com/maps/contrib/106436048182599512739/reviews?hl=zh-TW,5,True,36,牛舌好Q彈也很好吃！服務真的很棒推👍
 莊舶鑫 ,https://www.google.com/maps/contrib/101628618911841376432/reviews?hl=zh-TW,5,False,14,"店員態度親切，說明也很清楚。
咖哩味道很棒，牛舌與牛排也很鮮嫩，最後甜點是抹茶豆花，微甜的糖水配上帶有抹茶香氣的豆花，為剛剛美味的咖哩畫上完美的句點。
是個適合約會聊天的好餐廳！"
 陸宛蘋 ,https://www.google.com/maps/contrib/115148606743384738529/reviews?hl=zh-TW,2,False,2,"午餐價格偏高,但是東西很普通,感覺不到那個價值!套餐內的小麵包是微波加熱的，所以叫我要先吃！微波加熱的麵包真的很難吃．
應該是主管人員聲音聒噪的很,看她在訓練新人,.聲音真的吵得我無法好好用餐!每位入店的客人,一上菜單就機哩瓜啦像連珠炮一樣的講...我識字~~讓我先看一下菜單不行嗎?吵死人了！很有壓力．．
只想好好安靜地吃個中餐，結果是匆匆吃完閃人．應該不會再去了！"
 陳馨瑜 ,https://www.google.com/maps/contrib/105543739646128226274/reviews?hl=zh-TW,5,True,95,蝦醬咖哩佐手打蝦排炸裂好吃
 yushiang ,https://www.google.com/maps/contrib/106627167041627027341/reviews?hl=zh-TW,5,True,412,"咖哩味很濃
適合重口味的，清淡者可能不適應
蟹膏和蝦醬很入味👍👍
可惜牛舌賣完了，要不一定很好吃
飯後還有抹茶口味的豆花唷～
裝潢是用稻草裝飾的，很特別"
 Lun Bear ,https://www.google.com/maps/contrib/106327096863241392255/reviews?hl=zh-TW,4,False,7,這餐點的是牛舌牛雜咖哩，可以感受到對食材的精心挑選與處理。但如果嚐了一口咖哩再去品嚐額外處理的牛肉，牛肉的原味似乎就完全被咖哩蓋過去，可惜了食材的味道。整體的服務體驗和食物都還是不錯的，會想來再訪。
 陳和煌 ,https://www.google.com/maps/contrib/104774701050254868666/reviews?hl=zh-TW,5,False,5,兒子推薦，來嚐鮮，什麼咖哩飯有什麼不一樣？首先用餐環境非常舒適，特別的農家莊稼風，還有服務人員用心仔細的介紹每道菜色的特色，接下來就開始上菜囉，這次點海鮮類咖里，新鮮蝦醬入味搭配鮮蝦排，有別於一般咖哩，新鮮蝦排搭配花枝咖哩飯滿滿味覺享受，雖份量不大，但7、8分也足夠矣
 老虎特調 ,https://www.google.com/maps/contrib/111898350086333498503/reviews?hl=zh-TW,5,False,5,"附贈的炸牛排很好吃
這次點的是夢幻牛舌咖哩
辣度方面非常親和我不太吃辣的也能夠接受
除了牛舌外還有牛排跟咖哩燉煮的牛肉塊
讓人感覺非常豐盛的牛肉套餐感
唯一牛舌比較韌一些稍微可惜
但總體的體驗相當不錯可以一試"
 Lucas Chen ,https://www.google.com/maps/contrib/117337676270716672335/reviews?hl=zh-TW,5,False,6,顛覆我對咖哩的印象，適合嚐鮮喔！
 yuhui lai ,https://www.google.com/maps/contrib/102263072147233649302/reviews?hl=zh-TW,5,False,13,"咖哩醬口味有層次、好吃不膩，飯不只是白飯，本身就有烹調過，就算單吃也好吃！店員服務好(有服務費)，整體👍🏾
不過只收現金，有點不太方便，希望能增設行動支付或刷卡。"
 WAN JUNG LEE ,https://www.google.com/maps/contrib/105550718463100756349/reviews?hl=zh-TW,5,False,53,手炒咖哩醬香濃郁，附贈的豚骨湯也好喝，疫情之下美味餐點的選擇👍
 TC Kuo ,https://www.google.com/maps/contrib/107958532116639127546/reviews?hl=zh-TW,5,False,9,"打卡五🌟送炸牛排🥩

謝謝送牛排但對不起真的不可以
連送的牛排我都覺得不太可以"
 鄭靖 ,https://www.google.com/maps/contrib/104513185018337470070/reviews?hl=zh-TW,5,False,9,本身是個很愛吃咖哩的人，由於離家近，早些時間忽略了這家店，今日一遊，非同小可。咖喱煙鮭魚入味軟嫩，安康魚塊魚肝與醬汁融合的恰到好處，一口咬下滿滿的鮮味。牛舌咖哩牛舌軟嫩鹹香，多汁美味，與牛排搭配的咖哩味道深邃久遠，高級且典雅，服務員也非常盡心。5星推薦！！！走過路過別錯過！
 張琬珮 ,https://www.google.com/maps/contrib/100537309995289625256/reviews?hl=zh-TW,4,True,30,今年四月第一次來時覺得印象深刻，餐點好吃，招待的德腸和豆花也都很美味。金天邀家人再訪，感覺出來餐廳有在認真經營社群，客人變超多，雖然食物依舊美味，但空間也變得擁擠吵雜
 陳儀庭 ,https://www.google.com/maps/contrib/100868797621956132117/reviews?hl=zh-TW,5,False,6,今天跟朋友點了芒果鹹蛋黃白咖哩佐和牛起司漢堡排跟牛雜咖哩佐爐烤牛排，好吃，芒果那道味道很特別，但有點不習慣甜甜的感覺，然後還送了日式烤牛排，配上現烤咖哩麵包，超好吃，不過咖哩一碗超級無敵大碗，超級飽。
 Chu CHu ,https://www.google.com/maps/contrib/110867819455508900596/reviews?hl=zh-TW,5,False,14,期待好久的店，終於來品嚐拉🤤
 Josh yang ,https://www.google.com/maps/contrib/100276467075066082510/reviews?hl=zh-TW,5,False,4,味道蠻有深度的偏歐風香料咖喱，點了牛舌以及芒果漢堡排咖哩，都很好入口，牛舌咖哩不誇張幾乎每口都有肉，一個肉比咖哩多的節奏，芒果漢堡排咖哩香料味濃厚，喜歡香料味的再點，整體來說，想吃保險一點的可以點牛舌，是一家會讓人想再來的店，冷氣可以再強一些。
 chun-yin Lee ,https://www.google.com/maps/contrib/117791609538634380047/reviews?hl=zh-TW,5,False,6,醬料濃厚、漢堡排口感紮實，配餐也相當好吃
 陳崇瑋 ,https://www.google.com/maps/contrib/108768676954797524707/reviews?hl=zh-TW,5,False,1,"服務人員非常親切🥰🥰🥰🥰
餐點的話人很多要等，但整體來說環境舒服，餐點好吃！
肋眼牛排牛舌真的很推薦！
蟹膏的蟹黃也很有誠意！
但下次會記得訂位⋯⋯候補好久🥲"
 李秉芳 ,https://www.google.com/maps/contrib/103306126115691048491/reviews?hl=zh-TW,5,False,1,非常精緻的餐點，超級好吃。
 wei yu (罐頭寶貝) ,https://www.google.com/maps/contrib/100633345630364714568/reviews?hl=zh-TW,5,False,13,"與以往不同的咖哩口味。
十八姑娘點了偏甜的起司漢堡排咖哩，我點微辣的蝦排咖哩，整體而言都不賴，只是十八姑娘覺得偏甜醬吃到一半就開始膩口，索性把隨餐多附的咖哩醬交換添加，做不同嘗試得到解決。巧遇冷氣故障，店家招待抹茶豆花，三溫暖中的小確幸。服務＆餐點整體表現滿意，服務人員很盡責辛苦了。讓我們印象深刻的，是小餐包喔。會有意再訪。"
 黃惠惠 ,https://www.google.com/maps/contrib/101420710331741150893/reviews?hl=zh-TW,4,False,3,今天吃到芒果鹹蛋黃白咖哩，有驚豔到，雖然點以前店員一直善意提醒有香料味喔風味特殊，確實耶！感覺外頭沒嚐過這樣的口味，口感跟風味都有兼顧，好吃喔～
 b101096087 (TMU) ,https://www.google.com/maps/contrib/111808668569689433565/reviews?hl=zh-TW,5,False,1,咖哩很特別，蝦排好吃而且份量超飽！現在也有兩人內用套餐送炸牛排與抹茶豆花甜點的活動，趁現在人不多來吃剛剛好！
 Chon Piggy ,https://www.google.com/maps/contrib/116106051960746443377/reviews?hl=zh-TW,4,True,35,"價位偏高一點份量偏少
但味道不錯店員很客氣"
 承諾李 ,https://www.google.com/maps/contrib/109416086335792185797/reviews?hl=zh-TW,5,True,62,有招待🐷排，整體蠻好吃的
 well chances ,https://www.google.com/maps/contrib/113050811562466221579/reviews?hl=zh-TW,4,False,11,"稍晚到餐廳，牛舌，牛雜，海瓜子完售。於是點了：蝦醬咖喱不錯吃，酥炸軟殼蟹好吃。螃蟹稍乾….
候位帶位服務人員態度令人讚賞…."
 Nei ,https://www.google.com/maps/contrib/108708019211019875143/reviews?hl=zh-TW,5,False,3,"牛雜咖哩處理的恰到好處，讓對牛雜畏懼的人也可以輕鬆入口，若是覺得醬汁不夠，另有一杯充滿菇類的咖哩可以淋上，配上解膩的蘿蔔、以及無糖的冰茶正好化解咖哩帶來的燥熱感。副餐咖哩麵包鬆軟，裡頭加上餡料甜中帶鹹。加購的豬肉湯鮮甜甜到令人驚艷。
只是活動附贈的炸牛排較為平淡，沒有什麼記憶點，這是唯一可惜之處。"
 吳憬懿 ,https://www.google.com/maps/contrib/109687796035713224140/reviews?hl=zh-TW,1,False,1,"看了IG介紹很期待來
結果真的只是業配

低消是一個人點一份主餐
看起來口味比較大眾的都賣完了
但是又不能單點其他的東西
所以最後點店員推薦的

抹茶咖喱跟鮟鱇魚咖喱
抹茶咖喱沒有什麼咖哩味
而且裡面加上蚵仔
個人覺得有點違和、不太好吃
不過生蠔跟鮑魚是新鮮的還不錯

鮟鱇魚咖喱腥味很重
個人覺得很像貓咪罐頭的味道
也是沒什麼咖哩味
但是味道比抹茶好一點

送一份炸牛排
炸的蠻酥脆的
但是牛排咬不動

副餐有麵包跟醃蘿蔔還有紅茶
麵包還算軟
醃蘿蔔是整份裡面我覺得最好吃的
紅茶沒什麼味道

優點是裡面的海鮮真的放蠻多的
服務生很熱情態度很好

缺點是價格偏高
環境狹小，蠻擠的有壓迫感
咖喱不好吃沒什麼咖哩味
覺得整體來說CP值很低

以google4.8分來說
會讓人去了蠻失望的"
 郭元富 ,https://www.google.com/maps/contrib/112300939514150269365/reviews?hl=zh-TW,5,False,5,"店裡服務品質讚
東西好吃，值得來一試~~"
 C.K. Lin ,https://www.google.com/maps/contrib/104072081391305233953/reviews?hl=zh-TW,5,True,30,咖哩溫合順口，炸牛排不油膩，套餐份量夠，價格合理，推薦大家！
 Jessika Yuan ,https://www.google.com/maps/contrib/101650926731630333957/reviews?hl=zh-TW,5,False,9,"第一次吃到香料咖哩!!
味道蠻特別的～不是一般的日式咖哩，有獨特的香氣。蝦餅、牛舌、牛排、鮭魚都很新鮮不錯吃，唯一建議是咖哩不要放杏鮑菇🤣"
 尹甄 ,https://www.google.com/maps/contrib/107993717364767196069/reviews?hl=zh-TW,4,True,122,炸牛排和薯條好吃～
 薛阿昱 ,https://www.google.com/maps/contrib/100215140198224021964/reviews?hl=zh-TW,5,True,55,咖哩有特色且美味，服務員親切！
 Emily Chuang ,https://www.google.com/maps/contrib/107750343485110286642/reviews?hl=zh-TW,2,True,24,"真的難吃又貴。
硬把各種食材煮在一起，咖哩醬跟主餐都難吃，5星評價都是送炸牛排來的。
連甜點送的豆花裡面有加抹茶粉，抹茶粉還沒散，直接顆粒狀存在豆花裡面？
送炸牛排跟甜點不如研究怎麼把咖哩煮好"
 林泓暘 ,https://www.google.com/maps/contrib/110398083459145699918/reviews?hl=zh-TW,5,True,26,非常好吃，態度很好，有禮貌，超乎期待
 莊景涵 ,https://www.google.com/maps/contrib/117683873950082327645/reviews?hl=zh-TW,5,False,4,蝦醬咖哩跟活動贈送的炸牛排都好吃
 楊子萱 ,https://www.google.com/maps/contrib/112268500540797094565/reviews?hl=zh-TW,5,False,2,"溫咖哩…一開始被男朋友拖來想說名字很酷😅
餐點還滿讓人驚艷的，本人不太愛吃咖哩系列，但能想到把牛肉跟海鮮結合在咖哩裡面還可以充滿濃郁的獨特風味，算是難得一見的好店。
總結：服務5🌟餐點4🌟
整體回訪率5🌟"
 出納組羅珍 ,https://www.google.com/maps/contrib/104712405229299072224/reviews?hl=zh-TW,4,False,3,芒果鹹蛋黃白咖喱起士和牛漢堡排飯很特別！整體偏甜，米飯的口味第一次吃到，很不錯，但店裡空調台熱了😢希望可以改進
 Danny Chang ,https://www.google.com/maps/contrib/114260432680545737052/reviews?hl=zh-TW,5,False,36,顛覆以往吃咖哩的美味，4樣咖哩套餐都美味，贈送的牛排及手工豆花好好吃（建議可單點豆花），單點的韓式辣炒花枝也好吃下飯。今日點的最受好評的是滿滿蟹膏咖哩、海陸豐盛號、夢幻牛舌咖哩、及芒果鹹蛋黃白咖哩佐起司和牛漢堡排。
 IWEN LIN ,https://www.google.com/maps/contrib/101002541613712885768/reviews?hl=zh-TW,5,False,3,"創新美味且吃得好飽🥹
服務人員相當友善"
 樂芬艾 ,https://www.google.com/maps/contrib/101202359516821571623/reviews?hl=zh-TW,4,True,423,"非常有特色咖喱
米飯非白米粒粒分明很有口感
芒果咖喱甜鹹，特別順口
漢堡排被辛香料蓋過，較無牛原味

海瓜子魚排
很鮮的海鮮燉飯，整體好吃😋

炸牛排嫩有汁不乾，可以！

屬於嚐鮮特色咖喱店🍛"
 Shawn Wang ,https://www.google.com/maps/contrib/108296521849392792351/reviews?hl=zh-TW,5,False,3,特色咖喱好讚，接待人員好熱情❤️‍🔥
 黃詩婷 ,https://www.google.com/maps/contrib/114302890790832225606/reviews?hl=zh-TW,4,False,8,第一次來覺得不錯，喜歡重口味的可以嘗試，看菜單以為口味會無法接受，但其實吃起來滿搭的，份量很多，主食食材不錯但價錢小貴，適合偶爾朋友聚餐～
 Gordon ,https://www.google.com/maps/contrib/114334655511750948136/reviews?hl=zh-TW,5,False,4,"牛舌軟嫩好吃
咖哩味道會稍為重鹹

牛肉漢堡排夠味
搭配芒果咖喱的香甜超極搭

分量都很多還會附上一杯有料的醬
吃的很飽👍👍👍"
 曾瑞鐘 ,https://www.google.com/maps/contrib/111526234759035085930/reviews?hl=zh-TW,4,False,2,今天點了芒果鹹蛋黃白咖喱是偏甜的咖喱裡面還有肉桂本來以為味道會不會有點奇怪沒想到確以外的蠻搭的是完全沒吃過的咖哩味道會想再次光臨
