user_name,user_profile_url,rating,local_guide,comment_num,comment_text
 Rouf Hung ,https://www.google.com/maps/contrib/109182779308616822034/reviews?hl=zh-TW,5,True,31,剛好在時代寓所的星巴克待了一個下午，想說雙月就在附近。晚餐就繞過來享用。點了「愛恨椒麻麵」及「鱸魚蛤蜊湯」。麵的椒麻味道濃密，嚼勁像極了烏龍麵的彈Q口感，真值得推薦哦。而滿滿的鱸魚蛤蜊湯，料多又實在，湯頭入味又爽口。這樣的飲食，讓平淡生活更加富裕😋😋
 winnie lu ,https://www.google.com/maps/contrib/115270725995316545226/reviews?hl=zh-TW,5,False,3,"愛恨椒芝麵，麻醬+花椒的味道，第一次吃意外的好吃。
蛤蜊燉雞湯，濃濃的蛤蜊味伴著淡淡的麻油跟酒味，還有高麗菜的甜味，份量多到一個人吃不完。
下次約朋友來可以加點滷味，聽說滷味也很好吃😋"
 林婕 ,https://www.google.com/maps/contrib/118013768416392910324/reviews?hl=zh-TW,5,True,53,"開店前10分鐘可以先進來候位及畫菜單，會有服務生來登記

📍雞腿剝皮辣椒$190
份量多
味道入味，很值得嘗試

📍豬皮$30
處理的乾淨，有軟有Q"
 Chloe Liao ,https://www.google.com/maps/contrib/106648709202688692825/reviews?hl=zh-TW,5,False,12,用餐環境舒適，有兩人以及四人座，還有一張可坐八人的大桌。麻油雞湯非常美味，走健康路線有家高麗菜，有家的味道啊！最重要的是，店內的餐具是瓷碗👍，只有裝骨頭的是美耐皿盤，工作人員很親切，份量超大份，很適合三五好友一起分享，若是一個人吃起來可能太撐了。若是有套餐式的選擇就更棒了！
 Chia ,https://www.google.com/maps/contrib/100812761738932283906/reviews?hl=zh-TW,3,True,50,和朋友一起去吃到現場沒有很多人所以很快就有座位可以坐上菜都要等一段時間主餐的部分覺得還不錯吃到一半想說先幫沒有跟到的朋友點外帶這樣等餐不用等太久點完後回到座位想繼續吃發現還有半碗的湯被收走了朋友說服務員有問能不能收掉空碗他說可以沒想到連還有一半的湯都被收走
 Hsuan Hsuan ,https://www.google.com/maps/contrib/107052214970034712933/reviews?hl=zh-TW,4,True,517,"2021/11/08造訪

這間分店排隊人潮較少，平日晚上排差不多15分鐘就有位置了，有特別的鱸魚湯可以點。

新上市的鴨肉飯蠻好吃，可以嘗試～

人均200-250"
 彭小婷 ,https://www.google.com/maps/contrib/101389545616211427589/reviews?hl=zh-TW,5,False,2,"蔥蔥飯第一口放入嘴裏有一種驚豔的感覺！好好吃！
小菜也超推薦！"
 成天樂 ,https://www.google.com/maps/contrib/110769903940151157521/reviews?hl=zh-TW,5,True,246,"危機處理一流，清蒸鱸魚排非常值得品嚐，連我這個不太吃魚的人，都覺得大呼過癮。

滷味入味，配上雞肉飯，非常開胃，並且吃得出食材選料上的用心。

另外用餐環境明亮，服務人員也非常熱心及專業。米其林必比登連續四年得榜，可謂實至名歸。"
 吳米娸 ,https://www.google.com/maps/contrib/109011667708417759286/reviews?hl=zh-TW,5,True,11,超愛雙月的愛恨蔥蔥飯搭配蒜泥蚵仔吃起來超滿足，再點碗熱騰騰的養生雞湯暖一下胃也暖心，雞湯份量很夠裡面還有許多高麗菜讓湯頭更鮮美，已經二訪過兩次還是覺得很好吃期待三訪😍
 品 ,https://www.google.com/maps/contrib/102350431603810605141/reviews?hl=zh-TW,5,True,29,中午時段內用真的都要提早來，不然都要等好久～會給五顆星的原因是東西好吃以外，今天跟同事外帶了一些滷味，結果店家超貼心將我們點的滷味平均分裝成兩碗🥹!我們原本在外面等，服務人員也請我們到裡面等餐，真的很貼心！
 Bruce Tsai ,https://www.google.com/maps/contrib/113248227218624565202/reviews?hl=zh-TW,1,True,12,"最令人不愉快的用餐體驗

12:10開始排隊排了一小時，排到愛恨蔥蔥飯完售，應該都是外送送到沒了（因此建議不想大熱天排隊、中午某些菜已賣光外加服務水準不佳的員工惹怒建議外送是您最佳選擇）
13:10結帳後入座，發現桌子完全沒擦，請旁邊服務人員來擦約莫3分鐘後
13:17上了兩杯檸檬愛玉
13:23上了汆燙鮮蚵
13:27最後兩碗愛恨椒芝麵（已經讓我又愛又恨
13:42由於太餓15分鐘吃完所有菜，但另一半的檸檬愛玉還在喝，沒辦法喝太快，此時服務人員已經開始收我們桌上的的碗盤接著另一位服務人員居然來跟我們說請我們喝快一點後面還有人在候位?!

左右兩桌都有吃到在外手機、看影片講電話的人重點他們早在我們入坐前已經吃的差不多，我才在想這間翻桌率令人堪憂的餐廳現在居然會趕我們了？米其林必比登連續上榜的餐廳是服務水準居然是這樣，應該是服務人員水準不在評比範圍之內，非常令人失望，排隊排了一小時吃了十五分鐘就開始趕人的餐廳撇除料理的好壞，最基本的餐飲服務都做不到，試問老闆及員工在外吃到這種餐廳你們做何感想？

你們可以調閱監視器證明來證明我所說事實"
 林郁人（Ren） ,https://www.google.com/maps/contrib/116645545645196450508/reviews?hl=zh-TW,3,True,106,2022/8/7初訪，當天帶位的服務人員態度非常好，點了愛恨椒芝麵，非常好吃，份量也剛剛好；另外點了剝皮辣椒雞湯，雞肉不太好咬，下次點別道試試😅
 李明臻 ,https://www.google.com/maps/contrib/103831452534994147952/reviews?hl=zh-TW,5,False,4,"📍愛恨椒芝麵（$70）
每次來都會點
吃起來有麻麻辣辣的感覺
很好吃！

📍愛恨蔥蔥飯（$45）
堪比嘉義火雞肉飯
超好吃！

📍滷味
可以自己選要吃什麼
推月亮骨肉、豬耳朵

📍紅燒金鮮鱸魚（$140）
第一次點，很大塊，也很讚！"
 Chen Yun ,https://www.google.com/maps/contrib/101808307059898109640/reviews?hl=zh-TW,3,True,364,"蛤蜊燉雞湯$170
湯頭⭐️⭐️⭐️⭐️⭐️很鮮甜好喝蛤蜊味大於雞味料也很多蛤蜊很新鮮
但雞肉⭐️很硬很難咬(´°̥̥̥̥̥̥̥̥ω°̥̥̥̥̥̥̥̥｀)
特別是最靠近鏡頭的那塊肉黏骨頭黏的特別緊

油蔥麵線$40⭐️過鹹（我已經是水餃和生魚片都會兩面沾滿醬油的重鹹人還能覺得他過鹹也是不容易）

還有下次的話會想試魚湯"
 Flora Chiu ,https://www.google.com/maps/contrib/117570527986345066712/reviews?hl=zh-TW,5,True,14,"排隊時間很快，上菜速度也快
口味調的非常剛好，餐點份量也比想像的多，吃的很撐XD"
 Danny黃 ,https://www.google.com/maps/contrib/117091399637234087402/reviews?hl=zh-TW,5,True,383,好吃又實惠，一級棒，本当に美味しい！#生活就是要這樣fb#這就是生活fb
 林駿鴻 ,https://www.google.com/maps/contrib/109024345325227422961/reviews?hl=zh-TW,5,True,118,"今日嚐鮮&暖心食堂推薦
愛恨椒芝麵
愛恨蔥蔥飯
阿甘剝皮辣椒雞湯
鮮翠豆芽
豬皮/幸福大腸/豆皮"
 Lily Chien ,https://www.google.com/maps/contrib/116639652154121410882/reviews?hl=zh-TW,5,True,287,"新推出的剝皮辣椒雞湯偏辣但很帶勁，干貝🐔湯是小干貝

今天第一次點了麻油瘦肉湯跟牛蒡瘦肉湯，都超濃郁好喝，大推薦。

點了愛恨椒芝麵、蔥蔥飯、蛤蜊鷄湯、滷味。其實從只有青島店就開始吃了，兩間分店的菜單些許不同。椒芝麵芝麻香帶椒辣味，果然是招牌。蔥蔥飯似乎是新的，友人說有嘉義雞肉飯的水準，蛤蜊雞湯永遠喝不膩，料多鮮美，至於滷味都有一定水準，最愛的還是豬血糕，非常入味。
缺點是中午會等較久，但服務人員還是很親切安撫等待的人。有點懷念之前剛開店時，人不多也不少的日子。"
 張家榕 ,https://www.google.com/maps/contrib/108617449292254735590/reviews?hl=zh-TW,5,True,13,終於有機會來雙月品嚐～湯鮮甜，湯料就是這麼誇張滿滿滿！👍🏻蔥蔥飯超香，雞肉絲軟嫩，點起來就是了！
 小姐陳 ,https://www.google.com/maps/contrib/101026286753030763317/reviews?hl=zh-TW,5,False,12,滷味滷得夠透，可沾特製辣椒醬油，好吃。蔥蔥雞肉飯的油蔥很香，整體來說口味/服務都很好。
 黃彥穎 ,https://www.google.com/maps/contrib/100597610827722671360/reviews?hl=zh-TW,5,True,38,"服務態度良好，推薦大家。

雞湯超大碗，下面放很多高麗菜，建議有點湯的人就不要點高麗菜了，可以點別種菜。"
 Sophie Liao ,https://www.google.com/maps/contrib/102823733854067304174/reviews?hl=zh-TW,5,True,101,環境舒適，食物美味，雙椒麵和蛤蜊雞湯、豬血糕和蒜泥鮮蚵都很好吃
 Sherry Chang ,https://www.google.com/maps/contrib/117576863786444246710/reviews?hl=zh-TW,5,False,10,花干超入味又不會死鹹！豬皮q彈有嚼勁，牛蒡瘦肉湯清甜爽口，內有滿滿高麗菜，超好吃的！
 A mis ,https://www.google.com/maps/contrib/107521353861916511898/reviews?hl=zh-TW,5,False,14,"第一次跟老婆來吃名店
滷肉飯跟愛恨蔥蔥飯
整體調味算清淡
比較喜歡麵跟小菜
鱸魚湯沒什麼刺很好入口，湯很甘甜
以下個人想法
優點：用餐環境跟服務都很好
缺點：主食略顯失色，希望可以有特色一些"
 Selena Wei ,https://www.google.com/maps/contrib/101858975430563315207/reviews?hl=zh-TW,4,True,228,"2022.5.28再訪
水準依舊服務說明有改善-補他1顆星星
現在物價飛漲，他們沒有漲價耶，算佛心
=================
久聞大名的名店
國慶日特地造訪2021.10.10
今日餐點如下：
蛤蜊雞湯～好喝。味濃。有水準
愛恨椒芝麵～不錯。但這味道坊間就吃的到
愛恨蔥蔥飯～一般般
滷味（豆皮。豬皮。豬耳朵）～一般般
地瓜葉～一般般
就餐點口味值得4星。CP值ok
服務參差不齊～扣掉1星
點餐結帳人員😤😡🤬態度不佳沒有耐心
不是每個人都有去消費過了解妳們的sop！
【現在周年慶有辦滿699抽獎及贈品活動】
抽獎券也沒有主動贈與還要詢問後才給
可惜了興致勃勃的我特別前往用餐的期待"
 陳圓圓 ,https://www.google.com/maps/contrib/107095280778432284336/reviews?hl=zh-TW,5,True,54,這間比青島店面更大用餐位置更舒適！雞湯很美味海鮮類餐點也很驚艷~鱸魚湯有小干貝很鮮美！
 ANN CHEN ,https://www.google.com/maps/contrib/110461643978390359839/reviews?hl=zh-TW,5,False,2,"花椒麵的花椒真的好香！不過對不吃辣的人來說應該已經是小辣以上的等級，不吃辣的人還是要斟酌一下😆
本來很擔心飯麵的份量會太少，但出乎意料的有誠意，兩個人點兩湯、飯麵各一份加兩份小菜，很飽！"
 Maggie Cheng ,https://www.google.com/maps/contrib/111564870025568234632/reviews?hl=zh-TW,5,False,4,每種湯品皆具備不同的美好風味，魚肉質新鮮彈牙，雞腿肉超優質，難怪蟬連四年米其林。
 歐馬嘟嘟 ,https://www.google.com/maps/contrib/102790317711301588536/reviews?hl=zh-TW,5,True,116,"中正區最強雞湯！！
愛恨蔥蔥飯必點，
燉雞湯跟魚湯份量很多，
雞肉已燉的入口即化～
適合冬日進補～"
 Julia Chang ,https://www.google.com/maps/contrib/106834307945184899543/reviews?hl=zh-TW,5,True,110,"值得現場排隊等位子的美食
我們這次假日晚間去用餐大約等40分鐘
不過有看到很多外送訂單
如果住得近點外送應該也是不錯的選擇
這次點的雞湯、椒芝麵、紅燒虱目魚都很優秀
飲料其實也不錯"
 雅筠 Elaine ,https://www.google.com/maps/contrib/104860033139654588334/reviews?hl=zh-TW,5,False,11,"還好提早到現場候位，生意相當的好，服務態度很好！
推薦大家也提醒無論外帶或室內用都需要有現場排隊的心理準備～"
 不自律女子 ,https://www.google.com/maps/contrib/111776063952106959184/reviews?hl=zh-TW,5,True,86,"每年變冷就一定會想來雙月喝一碗熱湯～
滿滿的蛤蜊，很鮮甜！
昨天晚上大約七點多排隊入場，
有些品項就被告知就賣完了，（像是油飯、蚵仔）
所以要吃的人最好早點來排隊哦"
 Teresa ,https://www.google.com/maps/contrib/107985504910049111822/reviews?hl=zh-TW,5,True,122,"第一次自己在青島總店用餐，對湯的印象深刻，這次與家人一起在濟南店用餐，點了愛恨蔥蔥飯，「蔥」是紅蔥，味道蠻有特色，雞湯依然令人深刻-滿滿的材料😀

剝皮辣椒很讚，未嚐試的可選擇，麻油瘦肉湯也很棒！！"
 陳怡臻 ,https://www.google.com/maps/contrib/115912974153532150946/reviews?hl=zh-TW,5,True,44,價格實惠，滷味乾淨好吃，午餐時段排隊較久一點要提早到
 Félix LIN ,https://www.google.com/maps/contrib/110510679974905511136/reviews?hl=zh-TW,5,True,99,湯品界的王者，湯清味濃，食材都是一時之選，元素簡單，做到最好，你怎麼可能不愛雙月
 Annie Chen ,https://www.google.com/maps/contrib/114524155501593648339/reviews?hl=zh-TW,5,True,289,"非常好吃！
整體用餐環境舒服、食物鮮甜美味！
湯超好喝非常推薦！"
 Rachel Tsai ,https://www.google.com/maps/contrib/105657618400964398104/reviews?hl=zh-TW,5,False,9,"真的不愧是米推！
週日晚上來的，等了半小時左右，還好有排隊，非常值得！
幸福好腸、滷肉飯、剝皮辣椒雞湯都是必點，超級美味，價格實惠，大概知道為什麼要排隊了😋"
 kc lim ,https://www.google.com/maps/contrib/109662058465501755532/reviews?hl=zh-TW,5,False,29,"外場幫忙登記排位的小姐很友善，會先告訴排隊客人需要等多久，也會耐心解釋菜名（月亮骨肉是豬的肩胛骨吃起來脆脆的），看到年紀大的長輩排隊會主動騰出位子讓他們坐著等；看到有外帶客人不小心把食物袋子掉地上怕灑出來會立馬上前關心。服務態度真的很好。

餐點方面都很不錯，雞湯沒有腥味很鮮很好喝，蒜泥乾蚵顆顆肥美沒有腥味，胡麻翻肉的胡麻醬很香，滷味都滷得很入味尤其豆皮，必吃啦！"
 YiFan Yang ,https://www.google.com/maps/contrib/116612213732739741759/reviews?hl=zh-TW,5,True,303,"連續四年蟬聯必比登推荐名店🎊

人潮滿滿

好吃！

會再回訪👍🏻

附：米其林必比登常識

紅色米其林指南就是一本美食指南，分為米其林星星（MichelinStar）、「必比登美食推介」（BibGournand）與「米其林餐盤」（MichelinthePlate）三大推薦類別！其中，星級美食最受矚目，而一星、二星、三星的評選標準，就是「食物」，從使用食材、烹飪的技巧與味道的層次、料理展現的創意、食物水準的一致性，至於環境、服務並不在評選重點。

米其林被封為史上最神秘的美食評鑑！因為它的評分、評選過程，從不對外公開，都是由他們特選的米其林密探來進行。他們從不表明身份，甚至有些人連枕邊人都不知道原來他是密探！當他們進行評鑑時，就跟一般客人沒兩樣，不會遞名片、假裝丟湯匙、做筆記，而且全額付費！

米其林星級餐廳發布前，都會先來公布一波「必比登美食推介餐廳」！必比登美食推介就是平價版的美食指南，標準是花不到1000元以下就能吃到3道菜的美味小館，或是路邊攤，因為價格超親民，官方也特別讓米其林寶寶「必比登」變身吐舌頭的俏皮版，凡得獎的餐廳，都能貼上這可愛貼紙。"
 Scott Lew ,https://www.google.com/maps/contrib/104433466041414060457/reviews?hl=zh-TW,4,True,230,"餐點都有一定的水準，服務也不錯。
位子有點擁擠。"
 Rich Chen ,https://www.google.com/maps/contrib/118223725036343472169/reviews?hl=zh-TW,5,False,6,有質感的台式料理，服務態度也超好。是一間值得推薦海內外遊客必訪的名店。
 Allen Kuo ,https://www.google.com/maps/contrib/107466484436756339997/reviews?hl=zh-TW,5,False,21,"乾淨明亮人潮眾多
蔥蔥飯味道獨特便宜又大碗
干貝雞湯是每次必點的啦…
服務人員李俊宏認真勤奮以客為尊
讓平價美味更添幾分滋味
燙鮮蚵與地瓜葉鮮嫩美味
等待再久都值得"
 胖紙仙女 ,https://www.google.com/maps/contrib/105917419874049959727/reviews?hl=zh-TW,3,True,37,"我哭哭😭
終於有機會點米其林小吃
兩個人點了一堆小菜
但….
滷大腸有很濃的味道
整份我們各吃一口直接放棄

然後蛤蠣還好還沒放到嘴裡
兩個裂掉的馬上驚嚇一跳
而且還有一種淡淡的腥味
我以為是我味覺有問題
（因為剛剛吞了一個大腸）
但喝完飲料後再吃還是一樣
只好喝湯吃菜蛤蠣再次放棄

我是不是運氣太好😭😭😭"
 鄭仁豪 ,https://www.google.com/maps/contrib/113458265800421389945/reviews?hl=zh-TW,5,True,26,喜歡蔥蔥飯跟干貝雞腿湯（鮮甜好喝）大腸也滿入味的
 Chen Li ,https://www.google.com/maps/contrib/111949212740861107241/reviews?hl=zh-TW,5,False,9,"/Chrisの美食分享🍲
在冷冷的天喝碗熱湯是再適合不過了😌有著台北最強雞湯店稱號的雙月食品社，連續四年得到米其林必比豋推薦🏅從店外的排隊人潮就能看出這家店有多受歡迎!!

✔️蛤蠣燉雞湯💰170$
✔️牛蒡瘦肉湯💰120$
✔️元氣爐魚湯💰120$
✔️紅燒虱目魚肚💰90$
✔️紅燒虱目魚皮💰90$
✔️蒜泥鮮蚵💰130$
✔️胡麻翻肉💰130$
✔️愛恨蔥蔥飯💰40$
✔️乾拌油麵💰35$
✔️檸檬愛玉💰35$
✔️冬瓜檸檬💰35$

湯品完全不添加味精，口感輕甜沒有負擔，一湯匙舀起來餡料超豐富😋他們的海鮮全部都是從產地直送，鱸魚湯內還有好多珠貝添加口感，除刺過的虱目魚搭配鹹香紅燒醬汁，每一口都是滿滿的膠原蛋白，招牌的東石鮮蚵肥美不帶任何腥味～

餐點份量實在且平價實惠，食材味道和視覺擺盤上都很有水準，連滷味都是用特製的雞高湯&純釀醬油滷製，在外食也可以達到營養均衡，是老少咸宜的一家餐廳👍🏻

更多食記分享可以關注IG:Clxx9s噢"
 Jessie杰熙 ,https://www.google.com/maps/contrib/115058430685411823496/reviews?hl=zh-TW,5,True,168,每道菜色都恰到好處，富含香氣也不過於鹹膩。食材新鮮、擺盤精美，價格實惠，難怪有那麼多人為此願意久候！
 張婷茹 ,https://www.google.com/maps/contrib/107486195390203708092/reviews?hl=zh-TW,5,True,18,"翻桌速度很快，排隊沒有等很久
喜歡愛恨椒麻麵，濃郁芝麻配椒麻香～有辣

滷味、青菜量還Ok
高麗菜很脆甜，不愧高山高麗菜"
 Kate Lin ,https://www.google.com/maps/contrib/106597104506333858090/reviews?hl=zh-TW,3,True,150,椒麻麵、干貝雞湯、甜不辣、豆干味道依舊美味，濟南店的座位區明亮寬敞，服務人員態度親切，可惜當日用餐店內有蒼蠅。
 209dailymood ,https://www.google.com/maps/contrib/104325701806712891218/reviews?hl=zh-TW,5,True,162,麵超好吃！必點！雞湯各人覺得配角比較像主角，但是是好喝的
 英文好好學 ,https://www.google.com/maps/contrib/110276504036793255396/reviews?hl=zh-TW,4,True,81,"這是第二次來，既然已經是網路名店
我想針對個人口味做評論

我覺得滷肉飯的滷汁真的「中等偏少」，下面的飯都沒有鹹味與醬汁🙄

至於鮮蚵與粉腸味道沒話說，由於鮮蚵是偏昂貴的食材，量少但定價高沒話說

Anyway,喜歡精緻台灣小吃的朋友可以來試試"
 Stan Cheng ,https://www.google.com/maps/contrib/103373986800591632674/reviews?hl=zh-TW,5,True,232,不愧是聞名遐邇的店家...湯頭跟用料超讚...看得出店家對於食材十分要求...
 帥俊國際服飾 ,https://www.google.com/maps/contrib/104848320131169340133/reviews?hl=zh-TW,5,True,320,榮獲《米其林必比登推介》，店內的雞湯及養生料理，美味、營養又好吃，口味眾多不油膩，吃了超有幸福滿足感！
 李冠勳 ,https://www.google.com/maps/contrib/114261308682310415009/reviews?hl=zh-TW,5,False,10,"愛恨椒芝麵
剝皮辣椒瘦肉湯
蛤蜊燉雞湯推推！
一定會再回訪
假日人很多週六下午五點半來大概等20分鐘～
要來請大家再預留排隊時間～"
 Vx QwQ ,https://www.google.com/maps/contrib/115249290141150167064/reviews?hl=zh-TW,5,False,50,"蛤蜊雞湯最讚讚讚讚！！
雞絲飯意外好吃
愛恨椒芝麵挺辣，但很順口"
 Jerry阿貝 ,https://www.google.com/maps/contrib/114090912904140721346/reviews?hl=zh-TW,5,True,532,剝皮辣椒雞湯雞肉Q彈新鮮好吃，椒芝麵也很有特色，值得一再來訪
 Tourーッと ,https://www.google.com/maps/contrib/114290501766114048321/reviews?hl=zh-TW,5,True,268,平日11:40用餐，已經有八成的位置坐滿。餐點CP值高，湯品價格較高但用料豐富，花椒油濃濃的花椒味，地道。
 K K ,https://www.google.com/maps/contrib/111054046187688029915/reviews?hl=zh-TW,3,False,388,"10/5晚上1930左右到貴店，很意外的當時還有位子，雖然有些品項已售完，但我們還是進去用餐，椒芝麵確實好吃，蚵仔也很新鮮飽滿，但當天用餐時候卻讓我不是很開心。
我坐靠近店裡最裡面的那區，鄰近的消毒櫃裡面的環保筷已用完但沒補，因此走到滷味區那邊的消毒櫃裡面拿筷子，順便想要拿一點辣椒醬油，走到鄰近的地方，果不其然罐子裡面的調味料也空了空，因此我又走到滷味區那邊拿取調味料，但前面有其他顧客在取用，因此我在後面排隊等待取用，其中有一位穿著便服的服務生（老闆？）和我告知原先我去拿取調味料的那區也有，但我和他反應裡面已經空空如也，當下他也有收到我的資訊，原當我要回座位等待補充調味料時，前面的那位小姐已取用完畢要離開，那位先生就和我說不然你先拿這邊的（指了滷味區調味料的方向），我想說算了直接取用，蓋子一打開果然又是送我空空如也的壺底油？當天消費也近七百元，也不是接近打烊時間就有打折的狀態下去去用餐，為什麼受到的是這樣的服務態度和水準？食物水平都很好，用完餐想要取一張衛生紙也沒了，等於說在我這的自助區的東西都沒了。我想這不是你們要帶給客人的態度吧！？"
 葉貞伶 ,https://www.google.com/maps/contrib/109090121733543200575/reviews?hl=zh-TW,5,True,106,"第一次就點滿桌的菜
雞湯很鮮甜！份量也很足夠"
 Yuching Chang ,https://www.google.com/maps/contrib/117871626896019437270/reviews?hl=zh-TW,5,False,61,"乾淨明亮！服務親切！
愛恨蔥蔥飯👍干貝燉雞湯👍紅燒鱸魚👍
CP值高！"
 YU WEI QIU ,https://www.google.com/maps/contrib/105541717357320999406/reviews?hl=zh-TW,4,True,250,"滷肉飯好吃😋看起來很清淡但口味剛好
聽對面說麻油的湯比較好喝（比較甜）
點了招牌雞湯很清爽😂肉很好吃

虱目魚皮好吃～～～
麵普通～"
 Jim ,https://www.google.com/maps/contrib/109286637957132328631/reviews?hl=zh-TW,4,True,40,鮮蚵很肥美，油蔥飯很香，高麗菜很脆，椒芝麵有濃厚麵體香氣，還有決明子加冬瓜可以免費喝
 YAYU CHANG ,https://www.google.com/maps/contrib/104255334291116121922/reviews?hl=zh-TW,5,True,104,冷冷的天氣吃麻油瘦肉湯真的很舒服，而且湯裡頭有大量的清甜高麗菜，好喜歡！滷味也滷得很入味，口味適中，如果店家有附辣椒醬就更好了！（現在只有辣椒醬油）
 徐慶鐘 ,https://www.google.com/maps/contrib/101011582787630476688/reviews?hl=zh-TW,5,True,138,年菜也很好吃唷！大推紅燒蹄膀、米糕、雞湯
 黃煦恩 ,https://www.google.com/maps/contrib/117371402802688308099/reviews?hl=zh-TW,5,False,5,服務很好👍🏻小菜一般⋯牛蒡雞湯很浮誇，滿滿的料，牛蒡味超濃！湯頭清澈鮮甜，很適合宿醉的時候來一碗👍🏻
 Sunny Wang ,https://www.google.com/maps/contrib/113126092758660187671/reviews?hl=zh-TW,5,True,132,"是名副其實的一家店～
生意非常非常好
湯品都很有水準！大推剝皮辣椒雞湯"
 Linda Chung ,https://www.google.com/maps/contrib/107955007603333491677/reviews?hl=zh-TW,3,False,14,"餐點都出了20分鐘，其他桌比我晚來的、滷味也都上了

但我的滷味始終沒來～
飯和菜都要吃完、才送來！

可能～很忙吧！才漏了我的單！

但～依舊好吃！

只是「好熱」，吃到一直流汗"
 Kalvin Yeh ,https://www.google.com/maps/contrib/104930810722996664412/reviews?hl=zh-TW,5,False,39,外帶回去也很好吃～虱目魚肚蛤蜊湯湯頭很清甜，蛤蜊也給的不手軟。麻油燉雞湯的麻油味夠卻不會覺得過度油膩。而且他們的湯品都是湯肉分離煮法，這樣湯頭濃郁外，肉也都很新鮮肉質更嫩。
 Catrina Lu ,https://www.google.com/maps/contrib/107918411977900853229/reviews?hl=zh-TW,4,True,97,"麵好吃，滷味還行，雞湯普通（肉偏硬）但干貝給蠻多的。
期待較高所以覺得沒有想像中好吃。"
 林子邕 ,https://www.google.com/maps/contrib/116561783485243337425/reviews?hl=zh-TW,4,True,94,第一次來嚐鮮，只點了愛恨蔥蔥飯、愛恨椒芝麵、蛤蠣燉雞湯及滷味小菜，若是多人一起用餐的話可以點更多樣菜。整體來說是間品質跟口味都有一定水準的小吃餐廳，下次還會再來用餐。
