user_name,user_profile_url,rating,local_guide,comment_num,comment_text
 Wynnie ,https://www.google.com/maps/contrib/107912484384287653606/reviews?hl=zh-TW,5,True,51,"趁著春節過年餐廳休息之前，終於去光顧了這間口袋名單裡的餐廳。
因為疫情又再度嚴峻的時候，選擇了外帶，先打電話預定好訂的餐點，在約定的時間前去取餐。
到達時已經包裝的完整妥當，因為實在是想嚐嚐每一樣餐點，所以點了很多樣，帶回家開吃，才知道份量十足，一個人根本吃不下。
除了麵線全部吃完，其他餐點都是跟家人共享。
最喜歡的三樣餐點是:
*油蔥麵線~清爽不油膩，有著淡淡的油蔥香味，雖然是外帶，不是現場吃，相隔了半個多小時才吃，但是絲毫不影響口感。
*蒜泥鮮蚵~產地直送的鮮蚵，一顆顆新鮮又飽滿，非常鮮美，底下鋪著一層豆芽菜，也很爽脆，這道料理讓我非常驚豔!
*蛤蜊雞湯~個人覺得值得大大推薦👍🏻
除了料十足，味道也是讓人回味。
一碗湯滿滿的蛤蜊，三大塊雞腿肉，配上清甜的高麗菜，湯頭還有一點點的薑味，喝了整個身體都暖呼呼的。
這一餐讓我覺得很滿意，甚至還覺得不過癮，等到疫情稍緩時，一定會再次光顧，選擇內用來試試頗負盛名的“元氣鱸魚湯”。"
 Chloe Yu ,https://www.google.com/maps/contrib/101865072754293170204/reviews?hl=zh-TW,5,True,90,"耳聞許久終於來朝聖，果然沒有失望，來個認真的菜點評！
1.環境乾淨舒適，店員每個人都親切有禮，會主動提醒內用外帶的排隊方式。
2.主食：愛恨蔥蔥飯鹹香好吃，記得在冷掉前努力吃完風味最好！油蔥麵線略為可惜，調味偏淡，麵線本體不像一般會鹹的麵線，但油蔥香氣還是不錯，如果跟飯一起點建議先吃麵線，比較不會有落差感～
3.配菜：豬耳朵蠻Q脆，沒有油耗味也不會過鹹，豆皮及花干都有吸飽湯汁，中規中矩，但記憶點不高；燙青菜口味偏淡，建議湯本身高麗菜含量已經很豐富了，不一定要點～
4.蛤蜊虱目魚肚湯：虱目魚沒有土味，刺去的很乾淨，是大加分，蛤蜊較小顆但湯頭鮮味足夠，吃起來很舒服！
5.牛蒡豬心湯：牛蒡是先煎至焦香才入湯，湯裡面沒有額外放新鮮牛蒡，所以牛蒡的味道淡了些，但喝起來相當清甜，完全沒有負擔感，喝完晚上也不口渴；豬心量給超多，口感稍微偏硬一點，但也是新鮮無腥味！
6.額外給兩個人的點餐建議：如果有要點滷味等其他食物，主食跟湯品建議可共食、不然會超級飽XD"
 黃品潔 ,https://www.google.com/maps/contrib/101762258193698113873/reviews?hl=zh-TW,5,True,170,"☺︎IG：ypj__0316
-
#愛恨蔥蔥飯ᴺᵀ⁴⁰
#愛恨椒芝麵ᴺᵀ⁷⁰
#油蔥麵線ᴺᵀ⁴⁰
#牛蒡燉雞湯ᴺᵀ¹⁷⁰
#麻油瘦肉湯ᴺᵀ¹²⁰
#元氣鱸魚湯ᴺᵀ¹²⁰
#紅燒魚肚ᴺᵀ⁹⁰
#蒜泥鮮蚵ᴺᵀ¹³⁰
#胡麻翻肉ᴺᵀ¹³⁰
#地瓜葉ᴺᵀ⁴⁰
#百頁豆腐ᴺᵀ³⁰
#米血糕ᴺᵀ³⁰
#花干ᴺᵀ³⁰
#滷蛋ᴺᵀ¹⁰
#甜不辣ᴺᵀ³⁰
#豬皮ᴺᵀ³⁰
#豬耳朵ᴺᵀ⁵⁰
#檸檬愛玉ᴺᵀ³⁵

吃貨的最高境界眼見為食
滿肚子的食物人才不會空虛
要吃飽喝飽肚子才不會空空的
有溫度的用心餐點雙月食品社
連續4年獲得台北米其林必登的推薦
講究台灣在地美食使用新鮮食材
到了用餐時間店內都是人直接客滿！
生意一直很好不分平假日晚點來就要排隊了
採用品質好就像媽媽煮給家人一樣的用心料理
滿滿的一桌會讓人感到很幸福(∂ω∂)
不管是飯、麵、甚至麵線個人都很喜歡
愛恨椒芝麵芝麻的香氣中帶有花椒的辣味
香醇的芝麻醬與椒麻香微辣口感
香氣十足敢吃辣的特別推薦
攪拌均勻芝麻醬讓麵條更滑潤
想在家裡吃到椒芝麵可以買拌麵回去
不加防腐劑、非油炸
層次豐富的口味吃過一次就會上癮
還有元氣鱸魚湯營養價值高
不管是術後、產後、養生都是必喝的湯品
很適合探病時當作伴手禮
他們家的滷味香氣也十足入味不死鹹
蒜泥鮮蚵東石產地直送新鮮現剝殼非泡水蚵
來到雙月一定不能錯過的單品
每顆都很肥美我超愛🤤
店主打燉湯各種養生料理👍🏻
雙月的雞湯是採用湯肉分離的煮法
雞湯是經過長時間熬煮後調味
另外加入新鮮的溫體雞肉烹煮
使用的是雞腿肉緊緊鎖住肉汁
依舊保持著軟嫩可口有香甜Q彈的口感
養生的牛蒡雞湯喝起來清爽有濃厚的牛蒡味
身受長輩喜愛吃起來負擔也不大
除了湯頭清淡好喝外對人體來說養生營養
麻油燉雞湯使用彰化純正黑麻油
香氣撲鼻湯喝來順口不嗆也不會油膩
麻油瘦肉湯軟嫩的瘦肉不肥膩
湯裡面一樣有大量高麗菜
年長者養生小孩補充營養壯年人補精力
吃完也不會燥熱天冷天熱吃都很適合
最後來杯檸檬愛玉搭上酸甜的檸檬有夠清爽
還可以喝到檸檬的纖維清涼無比
平日中午就很受上班族喜愛長輩更是愛
華人養生湯品第一品牌家人營養補給第一首選
────────────────────"
 HUIHUI Cheng ,https://www.google.com/maps/contrib/100121825907642656188/reviews?hl=zh-TW,5,True,50,"。
連續3年入圍必比登的雙月食品社
雖然這兩年分店越開越多
店家還是十分用心維持餐點品質
品項多
環境好
上菜快
除了尖峰時段不可避免的排隊
真是無可挑剔的家常小館首選。
-
·乾蚵-
選擇肥美的東石產地直送蚵仔
用乾煎和簡單油膏調味
保留自然的海味鮮美
底部還有清爽的豆芽菜
吃起來爽度十足。
-
·愛恨蔥蔥飯-
是紅蔥頭和雞油主導的雞肉飯流派
雞肉撲滿白飯份量大方
但如果是攪拌派
可能會稍嫌雞油不夠濕潤
不客觀評比火雞肉飯國度的嘉義人應該也會給過的程度。
-
·滷大腸、滷蛋、燙高麗菜-
雙月一大特色的吹風滷味
主打當日早上用純釀醬油滷製
不添加防腐劑
冬天吹電風扇
夏天吹冷氣
高溫滷製後再迅速風乾鎖住鹹香味
就是吹風滷味的由來
選項眾多也很平價。
-
週日只有濟南店有營業
想造訪的人要特別留意不要跑錯分店了。

IG:befithappily_hui"
 超級阿越 ,https://www.google.com/maps/contrib/101686466458931176409/reviews?hl=zh-TW,5,True,22,"今天跟同事整團來吃吃看雙月，味道真的很不錯，可以說是非常厲害了，先來說說餐點的味道～

👉愛恨蔥蔥飯
認真覺得超好吃欸，這個飯雖然只是簡單的油蔥酥跟雞絲，但是整個吃起來超香，味道也很剛好，激推👍

👉愛恨椒芝麵
同事覺得超強，說是比小辣再辣一些，而且帶麻，麵體非常Q彈，評價極高！

👉油蔥麵線
我個人覺得好吃，不過同事覺得還好哈哈哈，味道很夠，也不會重鹹，油蔥的味道很明顯，不過同事有加辣椒，她表示辣椒不香也沒什麼辣味哈哈哈

👉東石鮮蚵
中規中矩，當然新鮮是一定的，簡單配上蒜泥醬就很好吃了～

👉麻咪瘦肉湯
同事表示吃下去整個人都熱了，也是評價還不錯，瘦肉跟米血的量一個人吃絕對可以吃飽

👉蛤蜊燉雞腿湯
給個量其實很對的起這個價格，裡面有3大塊雞腿肉，咬起來Q彈好吃，蛤蜊也不少，好像也有10來顆，我沒細算，湯頭味道不會過重，每樣料都簡單卻美味，頗厲害的👍

👉元氣鱸魚湯
魚肉好吃，湯也很不錯，吃的到鮮甜，上面還有小干貝！

不過服務的部分可以再加強，尤其是店內動線跟送餐時間，動線規劃上客人會經過出餐口其實多多少少有點危險，怕一個不小心就出事了。

然後送餐時間部分，我們湯總共是點了4碗，分別是鱸魚湯、麻咪瘦肉湯跟2碗蛤蜊雞腿湯，但是兩碗雞腿湯上桌時間相差了快20分鐘，第二碗提醒了2次才說正在做，飲料檸檬愛玉也是直接拿就可以送上桌的，也是提醒了2次才送上，而且中間頻頻送錯餐點，或是重複送餐，蔥蔥飯差點要吃2碗😅，我是很想….哈哈，不過餐點精準度及服務品質真的需要加強一下～

已經想好下次來要喝什麼湯了，不愧是米其林推薦～^_^"
 Felicia Peng ,https://www.google.com/maps/contrib/101851314342703134470/reviews?hl=zh-TW,4,True,498,"第一次到訪雙月
久聞雙月的雞湯好喝～
在11點初的時候抵達
外面已經有很多外送員在等待
需掃店家前面的code預約候位
等快到時會有店員出來喊名字

基本上都會跟別人併桌
兩人對坐的桌面中間會放一塊透明隔板
不過一個人的空間就會變比較小～
同時點了湯品、飯、滷味
桌面就會變比較滿～

從點完餐到飯上桌時已經過了將近約半小時
可能因為中午外送或是訂單較多
有一區都是專門在處理外帶餐點

餐具、醬料、養生茶都是自取

-干貝燉雞腿湯
一碗200元價格稍微偏高
雖然看起來滿滿一碗
但雞肉的肉不太多的感覺？
裡面有很多小干貝
但吃起來也沒有什麼味道
不過湯頭很鮮甜滿滿高麗菜的甜味

-愛恨蔥蔥飯(仿土雞絲)
上桌的時候沒有很熱
吃起來有點可惜
有油蔥酥跟雞肉絲
滿不錯的整體是甜甜的

-幸福大腸/豆皮
滷味吸附很多滷汁滿入味
但因為整體偏甜
個人也沒有很喜歡
豆皮跟大腸放在一起
下方的湯汁滿多的
後來看到對面桌的人單點大腸
整盤是比較乾的
就不會整個跟滷汁混在一起

中午用餐時段人潮非常多
建議剛開店的時候前往
不然就需要在外面等候一段時間"
 Amber ,https://www.google.com/maps/contrib/110438844195446691332/reviews?hl=zh-TW,4,True,133,"人容易坐滿，要做好需要排隊的準備
人多的時候會要求只能吃40分鐘
但不會很壓迫的趕人
水可以跟服務人員要～

「評五星能夠拿一包麵線回去煮」
但是回頭看看食物品質覺得還可以更好
蛤蠣雞湯比想像中淡、蛤蠣很小沒有覺得特別新鮮、雞肉也不太好咬（往下看評論店家有解釋是肉質是故意這樣處理的，這方面就是隨個人喜好了，我沒那麼喜歡）

不過愛恨椒芝麵是不錯～辣味很香
普遍價格真的很平價！！
就算兩個人也可以吃很多樣

蒜泥白肉的部分，偏鹹、重口味，如果沒東西配不容易吃完、較膩，不然就要多點人分，可能3-5個人

燙青菜蠻好吃的，味道夠，單吃不會過鹹
價格跟份量都覺得很不錯

因為評價很高所以可能對品質有更大的期待
但還是會願意回訪，還有品項想試～"
 wei ,https://www.google.com/maps/contrib/109582866658213226346/reviews?hl=zh-TW,5,True,105,必點的愛恨蔥蔥飯（雞肉飯）和愛恨椒芝麵很好吃，蒜泥鮮蚵和小捲都很新鮮，蛤蜊燉雞湯裡面竟很多菜了，所以感覺可以不用再點一盤高麗菜😂滷味大推豬耳朵！
 johnnysywu ,https://www.google.com/maps/contrib/100742739276069922932/reviews?hl=zh-TW,5,True,85,"1.服務品質相當好，因爲母親年紀比較大，服務小姐特別為母親更換成沙發折疊椅，非常謝謝那位服務小姐
2.＂愛恨蔥蔥飯＂其實就是雞肉飯，份量不大，但比嘉義的雞肉飯更好吃
3.＂愛恨椒芝麵＂，其實就是麻醬麵加上花椒及辣椒和其他調味料，稍微辣連我家不吃辣的小朋友都愛吃，麵條為粗麵，口感Q彈，有花椒的香麻，份量剛好
4.檸檬冬瓜及檸檬愛玉味道濃郁，愛玉應該是天然的，沒有添加任何東西，口感不像外界的會Q軟
5.這湯品都還沒有機會點，看到別桌客人點的好像很好吃，份量很夠菜色又多
6.11點營業12點就客滿了，所以最好盡量早點用餐，不過感覺翻桌率很快，就算是排隊也可能很快就可以入內用餐"
 A W ,https://www.google.com/maps/contrib/108818478879995724683/reviews?hl=zh-TW,4,True,265,"乾麵不錯吃！雞湯也好喝，湯裡青菜很多，不需再額外單點青菜。

週末排隊真的太久了，排了超過一小時。好吃是好吃，但要排一小時可能下次來的意願不高，等人少不需要排隊這麼久的時候，會想再回訪。"
 jerry chen ,https://www.google.com/maps/contrib/112036271871413605281/reviews?hl=zh-TW,5,True,31,"👉🏻連續4年拿到米其林的雙月食品社🎉
主打燉湯、養生料理（完全是我的菜）
而且採用台灣在地新鮮食材料好又實在

麻油瘦肉湯味道濃卻不會油膩到不舒服
牛蒡雞湯是大家覺得又好喝又特別的口感

使用溫體仿土雞肉質鮮甜Q彈可口
使用高山高麗菜不只高品質也均衡飲食
使用湯肉分離煮法不會吃到軟爛的肉
用心烹煮一點也不馬虎

滷味用雞湯湯當作湯底、用純釀醬油滷製
醬汁入味卻不會顯得過於鹹膩"
 tone hector ,https://www.google.com/maps/contrib/114443572853817007313/reviews?hl=zh-TW,5,True,788,"很久以前吃過青島店，週日剛好青島店休，氣溫下降臨時想吃轉而到濟南店。

假日下午一點初都還客滿，到了記得跟店內小姐先登記候位再拿菜單先畫單等叫號點餐才入座。

每次來都有新的菜色蠻不錯的。
愛恨椒芝麵吃起來小辣但舌頭不會不舒服，胡麻醬吃起來順口，有種涼麵熱吃的感覺！？

川燙鮮蚵每次來必點，知道為什麼鮮蚵排的很整齊嗎？因為底下是豆芽充數，點了這個記得不要再點豆芽了！

金鮮鱸魚蛤蠣湯，多了蛤蠣湯頭更鮮，建議加點。

炒高麗菜有點過鹹，建議有點金鮮鱸魚蛤蠣湯的就不要再加點高麗菜了，因為湯裡面有近半都是高麗菜。

整體來說都還不錯，座位小了些。"
 justin hou ,https://www.google.com/maps/contrib/100326486540086288149/reviews?hl=zh-TW,4,True,51,"又是來一間久仰大名的店☺️
這一兩年快速展店，有點可怕
可能疫情期間，很多道菜都沒有供應
不過也夠了樣樣好吃！真的沒話說...我臣服了🤣
唯一的敗筆是滷味，普通到不行，又有點死鹹
說真的不太需要點來吃...😤
真實的評論就是不在乎你的評論好禮，希望你們加油👍，下一個展店到海外的台灣之光🥰"
 男友救星 ,https://www.google.com/maps/contrib/105728588081088520836/reviews?hl=zh-TW,4,True,288,"份量ok但單價稍高
也許是米其林的關係
用料感覺的出來還不錯
食材新鮮也是有
服務應該是很標準的sop不會不舒服
但目前吃自己感覺亮點是那一盅湯而已
其他東西不難吃，但就是覺得還好
可能我是南部甜口味的關係
有朋友來會特別帶他去吃一次
但重複再訪機率不高
有個小插曲是主食麵很晚才上
小菜都快吃完了
應該有快20分鐘
有發現應該是不小心漏單
我有主動提醒送菜人員
有看到疑似先送麵給後面的客人
稍微小扣分，但服務業難免意外

推薦情侶沒吃過的可以嘗鮮
也許很符合你的口味
青島也有一間店，兩間很近
可以不用一定要吃哪一家"
 豪大 ,https://www.google.com/maps/contrib/117163273587160085318/reviews?hl=zh-TW,4,True,391,"兩人份600左右會吃到很飽！
當天兩湯、麵飯、小菜飽翻
1.愛恨蔥蔥飯油蔥香就是重點將整碗飯質量大大提升，可惜蔥量有點少，上面雞肉算q軟好吃。
2.椒芝麵，點粗的，一上馬上攪拌，微辣口感，配上濃郁麻醬，麵偏軟醬濃十分滿足。
3.元氣鱸魚湯，湯頭甜感明顯，熱喝超讚，整條魚大概只有5.6根軟刺，還有配小貝柱，130個人覺得划算，很暖胃。
4.麻油瘦肉，超重磅，上肉下高麗菜滿滿滿，湯頭的麻油香算十分溫和圓融，本身不愛麻油湯，但還可接受
5.川燙鮮蚵，必點，身長中，但體型壯碩😂，是餐點中最亮點的，沒腥味一口接一口
6.月亮骨肉，蠻多軟骨的，很q適合愛咀嚼感的，50的份量有嚇到，但個人沒特推
整體就是以湯為主，每碗湯都蠻推喝喝看！麵飯配角，小菜沒特別亮眼，點了可能吃不完🤣
濟南店好處是可以掃qrcord預約，比現場排隊好，週日中午熱門時段大概等15-20分鐘，整體環境也很乾淨！必吃必吃"
 Ning Cheng ,https://www.google.com/maps/contrib/115705341739701423229/reviews?hl=zh-TW,3,True,346,"鮮蚵超大顆的
蛤蜊雞湯雞腿肉好嫩
但湯沒到我標準
沒有燉雞的味道也沒有蛤蜊鮮味
豬心湯湯好喝有燉品的濃度
但豬心邊緣多口感偏硬
清淡滿分不會過多負擔
但湯品比自家媽媽熬煮的還不濃厚
略可惜"
 劉佳一 ,https://www.google.com/maps/contrib/107195200823909226595/reviews?hl=zh-TW,5,False,3,"這次點了愛恨蔥蔥雞飯、油蔥麵線、蒜泥鮮蚵、豬耳朵豆皮以及干貝燉雞湯
蔥蔥雞飯吃下去後真的讓人產生愛恨
不自覺地想一直扒飯！不想吃都不行啊啊～
油蔥麵線看似簡單
但卻很有味道口感清爽真是不簡單👍
最厲害的真的就是干貝燉雞湯了👏🏻👏🏻👏🏻
湯頭口感清爽卻又富含干貝、高麗菜、雞肉的精華
太好了啦～～讓人一口接一口🤤🤤🤤

讓人會想一直回訪的餐點"
 Gary Chen ,https://www.google.com/maps/contrib/106180851950558572096/reviews?hl=zh-TW,4,True,56,量真的很多也很好喝，蛤蜊湯很好喝，但是干貝略鹹比較容易膩。愛恨椒汁麵真的蠻有特色的，雞肉飯胡椒味比較重一些，整體瑕不掩瑜。不過等了非常久，之後會考慮點外送就好😅
 伍玖玖 ,https://www.google.com/maps/contrib/104628999236830952049/reviews?hl=zh-TW,5,True,465,"內用還有服務員帶位，服務很好還不用服務費，到櫃檯付款後餐點會由服務員端上桌，自助區有醬料跟餐具涼茶可以裝。內用要儘早來不然很快就會客滿。

愛恨蔥蔥飯45元➡️蔥味重很香好吃。

必點👍愛恨椒芝麵70元➡️很香的花椒味，麻醬很香不會過多味道過重剛剛好。

必點👍汆燙鮮蚵130元➡️新鮮肥美好吃。

每盤滷味都有放薑絲可以搭配著吃。
燙地瓜葉40元➡️有點老可以不用點。
米血糕30元➡️有入味又Q。
花干30元➡️直接吃就很好吃了不見得要沾醬。
生腸50元➡️沒有腥味也要得爛處理得很好。
海帶30元、甜不辣30元普通。
檸檬愛玉35元➡️是冬瓜檸檬的味道。

便宜好吃cp值高，值得再訪。"
 州 ,https://www.google.com/maps/contrib/109673541182742869921/reviews?hl=zh-TW,5,True,"1,411","【干貝燉雞湯180元/汆燙鮮蚵130元/愛恨椒芝麵70元/愛恨蔥蔥飯（仿土雞絲）45元/紅燒金鮮鱸魚排120元/地瓜葉40元】

成功高中附近少有的美食🤣🤣
聽朋友的朋友說滷味好吃，結果點了甜不辣、米血、豆皮等等的都覺得很普，可能是內臟才好吃？🤔但湯真的很驚艷，滿滿一盅燉湯有好幾粒小干貝、多到爆的高麗菜和三四塊雞肉，湯頭鮮美，一碗下去其實就很滿足了；鮮蚵的塊頭（？）和新鮮程度在台北也算是數一數二了，真的肥嫩；麵的香辣則是在意料之中的好吃開胃；蔥蔥飯其實就是雞肉飯，和鱸魚排、地瓜葉都是中規中矩，可以試試。

整體而言完全可以專程來吃看看！"
 李思萱 ,https://www.google.com/maps/contrib/103361619039930901008/reviews?hl=zh-TW,5,True,73,"快一點還大排長龍
因為是第一次來點了網路上大家最推的幾項

·愛恨椒芝麵
·愛恨蔥蔥飯
·蛤蜊燉雞湯
·胡麻翻肉

以上幾項都好吃，甚至有點出乎意料，量也不少，很符合價格
唯一還好的是油蔥麵線，味道稍淡

一定會再來吃～"
 Jackie Lin ,https://www.google.com/maps/contrib/104301250575093037110/reviews?hl=zh-TW,5,True,121,雙月食品用餐環境明亮寬廣，服務親切，推蛤蠣高麗菜￼雞湯￼￼￼，雞肉Q彈湯頭清香甜，非常大的一碗，鱸魚湯魚肉嫩甜，湯頭清甜，另外滷味海帶、豆乾皮、豬頭皮、滷蛋非常入味￼￼￼香醇順口，愛恨蔥蔥飯香、雞肉絲甜，非常煞嘴，台北第一名養生雞湯湯，吃完開心又滿足。￼￼￼
 TinyHuman onBoard (寶寶愛放電) ,https://www.google.com/maps/contrib/107580895515815199534/reviews?hl=zh-TW,5,True,38,"店內服務👍都很客氣也都能適時給予協助，今天剛好帶小寶寶吃飯，服務人員幫忙安排在比較不會被打擾的角落。

必點👍愛恨蔥蔥翻，滿滿雞肉加上煎脆的蔥頭，不鹹不油飯比較Q軟，寶寶很喜歡（每人限點兩碗）
元氣爐魚湯刺很少但還是有刺喔，食用還是要注意，魚湯上灑上一些干貝看起來賣相很好，新鮮好喝👍

滷味我覺得每次來點的味道都不盡相同，但是是好吃的啦，豆乾感覺很新鮮百頁豆腐對我來說比較軟一點甜不辣也是有點偏軟

用餐環境可能是人多的關係，之前沒帶小寶寶，有小孩會很明顯的焦躁不安，畢竟餐廳生意很好人多聲音很吵雜也不能怪餐廳啦，但如果帶著小寶寶還是建議外帶就好。

整體來說，雙月還是我每次經過都會想來快速吃一下的店家！"
 Gail HUANG ,https://www.google.com/maps/contrib/101196122373298849046/reviews?hl=zh-TW,4,True,221,推薦元氣鱸魚湯跟愛恨椒芝麵，蛤蠣燉雞湯滿滿的高麗菜，小菜還好，花干太鹹了！環境乾淨整齊，但是動線很奇怪。
 Shelly ,https://www.google.com/maps/contrib/117201351464025869662/reviews?hl=zh-TW,5,False,9,"看完評論跟著大家點，2人份這樣點吃很飽：
1.干貝燉雞湯
如圖滿出來的湯品，兩個人share一盅湯很足夠，裡面的高麗菜菜量根本相當於一份燙青菜，湯頭清甜且雞腿肉肉質鮮嫩，吃起來很過癮
2.愛恨椒芝麵
花椒以及芝麻搭配出來的麵，麻而不辣吃起來很有層次感，是下次再訪還會想再點的菜
3.愛恨蔥蔥飯
其實就是雞肉飯，雞肉塊搭配香炸紅蔥酥，雞油口味比較沒那麼重。自己比較偏愛像嘉義雞肉飯很重的雞油味這種雞肉飯
4.鱸魚排
鱸魚鮮嫩美味，沒有過多的醬料提味，很適合跟其他菜色搭配
5.川燙鮮蚵
看評論似乎也是到雙月必點的川燙鮮蚵，沒有腥味，下面墊著豆芽菜，有菜以及蛋白質，營養均衡的一道菜"
 陳白 ,https://www.google.com/maps/contrib/100486834268655296901/reviews?hl=zh-TW,4,True,291,愛恨椒芝麵好愛，東石鮮蚵直送的乾蚵也是大大的滿足，滷味很好吃，有很多人點，但是吃完兩碗麵跟一碗滷肉飯，還有燙青菜跟鮮蚵後，滷味都還沒來，也催了兩次，可以體諒外帶跟內用單同時處理有點混亂，但控單出餐的部分還是建議可以改善。
 Hsuan ,https://www.google.com/maps/contrib/117793481730737648192/reviews?hl=zh-TW,5,True,85,"無論飯和麵、滷味、湯品都很好吃
每樣食物都做得很厲害!
兩個人不小心就點了滿桌還差點吃不完
店內明亮乾淨很舒服
會讓人想一再回訪"
 黃國倫 ,https://www.google.com/maps/contrib/115227155610294952932/reviews?hl=zh-TW,5,True,225,找晚餐意外發現的店家，原本想說評價4.7顆星且評論有2000多則的店家是透過什麼打卡活動洗出來的評論，一到現場才發現人潮眾多且外送數量也很多，許多外送員都在門口等餐。菜單上還寫著米其林必比登推薦，看來是太小看這家店了。這次點了愛恨椒芝麵、香拌意麵、滷肉飯、米血糕、豬耳朵、金鮮鱸魚蛤蜊湯，原本想點愛恨蔥蔥飯，只不過已經賣完了（內用似乎一人最多點兩碗），後來也加點一杯檸檬冬瓜來解渴。愛恨椒芝麵是主食最喜歡的一道，吃起來味道很豐富；滷肉飯則是比較肥一點的那種滷肉飯，吃起來也不錯；香拌意麵則是吃起來比較普通的一道主食。滷味表現還算可以，但吃起來沒有太特別的味道，金鮮鱸魚蛤蜊湯內容物多，湯喝起來非常鮮，不知道是怎麼做的，表現很優異。以上用餐體驗很棒，值得推薦大家來吃。
 Lisa Chang ,https://www.google.com/maps/contrib/111409268244887048918/reviews?hl=zh-TW,5,True,182,"平日中午約11：30就要候位
單人用餐會在兩人座中間加上隔板

原本想點蛤蜊雞湯
但看到店家公告蛤蜊產地毀損品質不一
果斷選擇貴10元的干貝雞湯

干貝雞湯$200
湯品的大小應該都一樣料都會爆出碗水平線
但因為湯匙比一般大一倍
把湯匙拿起來份量就正常多了

干貝是小干貝有些去殼不乾淨有點可惜
雞肉三塊高麗菜幾乎佔了半碗份量
湯頭鮮甜雞肉軟嫩高麗菜新鮮翠綠
剛好天氣轉涼喝上一碗非常舒服

油蔥麵線$40
麵線就很平凡甚至有點乾
如果沒有切小菜配真的有點難單獨吃完

結帳後入座大概還需要等候30分鐘
如果趕時間記得要避開用餐尖峰時段

整體來說很推薦
有提供免費牛蒡茶小姐阿姨態度都很親切"
 花煙 ,https://www.google.com/maps/contrib/105564891475052970054/reviews?hl=zh-TW,5,True,234,提早開店前十五分到，順位二，開場20分鐘位置就坐滿了。點的幾道菜和店內設置都很乾淨，很像鼎泰豐的感覺，高單價且乾淨，點餐與出菜都很有制度。每道湯都是爆炸多料，希望是大一些的碗來裝，前面有涼茶可以取，但杯子也很小。
