user_name,user_profile_url,rating,local_guide,comment_num,comment_text
 Green Star ,https://www.google.com/maps/contrib/106002666049117358099/reviews?hl=zh-TW,5,True,54,愛恨椒芝麵&蒜泥鮮蚵超好吃😋工作人員態度很好，離峰時間來人比較少
 jiajuang Lin ,https://www.google.com/maps/contrib/114567093807822273877/reviews?hl=zh-TW,5,True,55,蛤蜊雞湯真的好喝，2個人叫一盅湯感覺很夠，才能再吃別的
 楊孟凌 ,https://www.google.com/maps/contrib/102566034371719528419/reviews?hl=zh-TW,5,False,6,"餐點平價好吃cp值高！！
湯品料多澎湃～～
小菜也很推薦💯"
 吳承諭 ,https://www.google.com/maps/contrib/102863449076441192991/reviews?hl=zh-TW,2,False,7,"雖不致於每天吃雙月但以週吃二～三次也可以算老客人了吧⋯最近多以外帶替代內用，幾次訂餐自取的經驗令人眉頭越鎖越深⋯訂餐時已知要40、50分鐘後才能取餐，依照説好的時間前往結帳等候取餐，看著雙月小姐忙裡忙外不斷拿出來的儘是二大外送品牌的訂單！我認真的觀察統計一下平均18分鐘才有1筆外帶訂單唷！和我一樣等候外帶的客人不算少（當然沒有外送多）其間聽到雙月服務人員不斷告訴外送員轉單吧！外送架上看不到包裝號碼的就轉單！就在現場外帶客人不斷的詢問下，雙月小姐只好登記抄下外帶單號進去催單！觀察到這裡⋯我已經等了訂餐時告知的40分鐘又多加了30分鐘唷！我又再再度詢問並向雙月小姐反應接單的順序明顯獨厚外送訂單這樣的安排對我們外帶的客人公平嗎？更何況已經等候超過你們告訴我的時間40分鐘又加30分鐘了⋯
寫到這裡，我想我不會再有下次這樣耐心等候了！
不是只有外送的時間才是時間！外帶的就活該浪費時間傻等！語重心長反應希望店家能慎重思考調整貴店人力配置與接單能力！受到疫情影響很多餐廳相對冷清如貴店這樣強強滾生意興隆的狀態來講貴店是否更應該珍惜每一個客人訂單呢？"
 SY T ,https://www.google.com/maps/contrib/104011612356777473140/reviews?hl=zh-TW,5,False,3,"中和店沒繼續營業太可惜了料實在又美味
也很適合老人和小朋友一起吃吃的健康也安心"
 邱昱程 ,https://www.google.com/maps/contrib/100141922445522524075/reviews?hl=zh-TW,5,True,26,好吃才點這麼多啦舒服
 Phoebe Chiu ,https://www.google.com/maps/contrib/115605959614256727202/reviews?hl=zh-TW,5,False,1,蛤蜊雞湯非常好喝！從國外回來吃到第一餐的滿滿幸福台灣味
 Vicky Lu ,https://www.google.com/maps/contrib/108612691294362264484/reviews?hl=zh-TW,5,True,109,店內座位寬敞舒適，服務人員親切有禮，用餐時間有時候需要併桌，但空間夠大，不會覺得擁擠；招牌蛤蜊燉雞湯、滷味必點，滷肉飯也不錯，鱸魚湯倒是普通，雖然是處理過的鱸魚肉片，方便容易食用，但是口味不夠驚艷，料酒味較重；店內免費招待的牛蒡茶也好喝；整體上比起青島本店，下次會比較願意再來濟南店用餐
 陳小銘 ,https://www.google.com/maps/contrib/107095863449562087448/reviews?hl=zh-TW,5,False,8,"東西好吃就不多說了
服務態度很好！希望一直保持下去！"
 張月月 ,https://www.google.com/maps/contrib/108754215426961410028/reviews?hl=zh-TW,5,False,30,"不愧是必比登推薦
不論食物環境服務都好的沒話說
不愛排隊外送外帶真的是好選擇
超棒的一餐
一定會再回訪❤💙💚💛💜"
 fangfang fang ,https://www.google.com/maps/contrib/100989110032499364533/reviews?hl=zh-TW,5,False,13,"收口袋名單好久了，果真不浪得虛名！
雞湯甘甜好喝，雞肉紮實有嚼勁，此趟單槍匹馬前往，胃容量有限，菜單上還有好多品項想試試！

下次要多帶點朋友來，當胃容量的分母！"
 HeRong Hsieh ,https://www.google.com/maps/contrib/117155646022529641831/reviews?hl=zh-TW,5,True,54,餐點精緻好吃，油蔥和蒜香很搭，補品湯品很豐富
 TUNG ALEX ,https://www.google.com/maps/contrib/117214172039422259345/reviews?hl=zh-TW,5,False,48,口味不錯且價格公道，如果你有時間願意排隊的話，推薦可以來嚐一嚐！
 chen ye ,https://www.google.com/maps/contrib/108337598348254498022/reviews?hl=zh-TW,5,False,14,用餐在湯裡發現小蟲告知店家後便馬上處理。知道是在月子中心的母乳媽媽，送了鱸魚湯和蛤蜊雞湯等餐點，還送到月中。現在已經很少這樣用心且真誠的店家了。不枉我連續吃一週了哈哈～湯品和滷味都超讚👍🏼
 Ulan Chen ,https://www.google.com/maps/contrib/103987165822209150411/reviews?hl=zh-TW,5,False,2,第一次來用餐，蛤蠣雞腿湯料多味美，值得下次再來！
 徐寶珠 ,https://www.google.com/maps/contrib/114353139218580960059/reviews?hl=zh-TW,5,False,1,冷冷的天氣配上熱湯真是幸福！餐點味道很好，吃了很飽足😊服務人員態度親切❤️
 Janice Lin ,https://www.google.com/maps/contrib/101084046092743839130/reviews?hl=zh-TW,5,True,145,整體環境十分舒適優良，服務也很棒，一入座就提供牛蒡茶清喉，非常好吃的傳統料理，鱸魚湯、蛤蜊雞湯超級鮮甜，用料實在，絕對不會後悔。
" 洪 Hong, 晟惠 Cheng Huei Grace (Grace) ",https://www.google.com/maps/contrib/106358836992542733763/reviews?hl=zh-TW,5,False,6,服務好、環境優、食物更是美味～蛤蜊雞湯整個料飆出來，非常美味又心滿意足！
 mermaid atcitypool ,https://www.google.com/maps/contrib/112999529751666965787/reviews?hl=zh-TW,5,True,94,新分店，椒麻乾拌麵微辣，濃烈香氣十足，搭配蛤蜊雞湯十足平衡，推薦非用餐時間來免排隊
 Z Karen ,https://www.google.com/maps/contrib/116656084893851975857/reviews?hl=zh-TW,5,False,10,"蛤蜊新鮮虱目魚煮的很好沒老
高麗菜甜原本為了拿麵線五星評論結果蠻驚艷
東石鮮蚵也很讚
會再來的～推薦～"
 林子禾Daniel ,https://www.google.com/maps/contrib/110764285588957800724/reviews?hl=zh-TW,5,False,10,用心在細節的好餐廳，料多實在，期盼能繼續生存！
 及川大王 ,https://www.google.com/maps/contrib/114548263205306626780/reviews?hl=zh-TW,4,True,177,聽說這裡是排隊名店，果然一吃就成主顧了，雞湯清甜好喝，鱸魚湯入口就知魚鮮湯美，服務態度也很好，值得推薦喔！
 張譽瀚 ,https://www.google.com/maps/contrib/104117577236271247909/reviews?hl=zh-TW,5,True,875,與青島店有相同的品質，但品項略有不同（沒有油飯），空間頗為寬敞，人員服務佳，想喝雞湯時的首選。
 Chiawen Hu ,https://www.google.com/maps/contrib/103672941225609186953/reviews?hl=zh-TW,5,False,11,喜歡，滿滿的料真是威風😅
 楊琪琪 ,https://www.google.com/maps/contrib/105817316502264372514/reviews?hl=zh-TW,5,True,44,東西美味好吃，推薦蔥蔥飯
 Ariel Chao ,https://www.google.com/maps/contrib/107260303818842825180/reviews?hl=zh-TW,5,False,11,一上菜就聞到菜香，用餐環境佳，服務人員熱心！
 強強滾 ,https://www.google.com/maps/contrib/105409456746903507717/reviews?hl=zh-TW,5,False,11,立冬進補美味選擇❤️
 Y Y ,https://www.google.com/maps/contrib/100293146655348706809/reviews?hl=zh-TW,5,True,63,滷味還好蛤蜊雞湯鱸魚湯椒麻麵蔥雞飯都好吃
 YC L ,https://www.google.com/maps/contrib/101971274637439631762/reviews?hl=zh-TW,5,True,104,料多美味，服務親切。
 黃光明 ,https://www.google.com/maps/contrib/106891859336753629154/reviews?hl=zh-TW,5,False,4,湯品味道很清甜，一喝下去身體都暖和起來，小菜也很入味！會再回訪！
 LuvLuv Wang ,https://www.google.com/maps/contrib/107344549459487698693/reviews?hl=zh-TW,5,False,5,"非常喜歡！滷味處理的非常好👍
湯也好喝！如果有賣油飯更好😂"
 duggyhuang ,https://www.google.com/maps/contrib/117305971401980227849/reviews?hl=zh-TW,5,True,6,濃郁、Q彈且有層次感的愛恨椒芝麵，加上鎮店招牌的蛤蠣燉雞湯，大飽口福！
 joanna chou ,https://www.google.com/maps/contrib/107254177431385924690/reviews?hl=zh-TW,5,False,2,每個餐點都好吃，愛恨椒芝麵令人驚艷。
 MEI MEI ,https://www.google.com/maps/contrib/108642131208030481065/reviews?hl=zh-TW,5,False,5,"今天我朋友生日也是忌日帶他來吃雙月，好事成雙，樂，從南部上來吃真是辛苦他了😅他說他在南部吃豬腳麵線吃到好飽，第一次來這種餐廳吃飯真是樁腳俗😌😌他朋友都確診了，今天只有我跟他😅是不是他的朋友都會確診🈹️🈹️好瓜張🥵🚬
#粉色#生日#逢九不衰#雞湯#雙月#跟我一樣甜#打卡送麵線#南部人"
 Ginny Lin ,https://www.google.com/maps/contrib/108180673942061008840/reviews?hl=zh-TW,5,True,25,好吃又划算的雞湯。
 Jacky Lee ,https://www.google.com/maps/contrib/108055162198026569503/reviews?hl=zh-TW,4,True,469,好吃.衛生.價格實惠，湯品讚！
 Shin-Shin Tseng ,https://www.google.com/maps/contrib/110285893858428567576/reviews?hl=zh-TW,5,False,2,"牛蒡燉雞湯好喝！
每次來每次點～
同事推薦花干也好好吃😋"
 鄭小莫 ,https://www.google.com/maps/contrib/112586817321790683561/reviews?hl=zh-TW,1,True,129,"（更新，不用關心，目前沒事，希望你們可以多注意）

沒煮熟的肉，希望今晚不會拉肚子"
 欣貝貝 ,https://www.google.com/maps/contrib/110508530766714596091/reviews?hl=zh-TW,5,False,3,湯品好喝，餐點好吃，服務人員非常親切！會再回訪哦！
 娃娃 ,https://www.google.com/maps/contrib/106443724300729132146/reviews?hl=zh-TW,5,False,31,牛蒡豬心湯好好喝，愛恨椒芝麵也好吃
 Carmina Ng ,https://www.google.com/maps/contrib/115239483971110117036/reviews?hl=zh-TW,5,True,439,"沒有青島店的壓迫感
環境更明亮
食物新鮮
味道正宗
服務態度親切
享受的一頓"
 許安妮 ,https://www.google.com/maps/contrib/117331854237463208575/reviews?hl=zh-TW,5,False,9,非常好吃😋特地來吃
 楊國吉 ,https://www.google.com/maps/contrib/109550133480926593370/reviews?hl=zh-TW,5,True,145,味道鮮美，但不能訂位喔！
 Tu Emily ,https://www.google.com/maps/contrib/100780511540980402424/reviews?hl=zh-TW,3,True,292,結帳蠻沒有效率的很慢又只開一台櫃結帳，有載具有週邊商品
 Victor Liu ,https://www.google.com/maps/contrib/100471487328137715557/reviews?hl=zh-TW,5,True,664,雞湯香甜份量夠大，油飯香，油蔥麵古早味，虱目魚軟
 蔡東湘 ,https://www.google.com/maps/contrib/100651870621411950023/reviews?hl=zh-TW,5,True,159,"湯品必點用料豪邁實在
愛恨椒芝麵與滷味豆皮都很優"
 天官賜福太子 ,https://www.google.com/maps/contrib/112111015138649287410/reviews?hl=zh-TW,3,True,25,點了至少10次以上的外送，今天第一次點紅燒虱目魚肚價格100多，結果不僅很小片而且薄，吃了幾次燉湯都料好實在味道也好，就這個虱目魚，有點失望
 James “螞蟻肚皮鯨魚野心” Ni Foodie ,https://www.google.com/maps/contrib/108706798768226847087/reviews?hl=zh-TW,5,True,85,"每次來必點雞肉飯鮮蚵魚肚
這次來吃了他們家的新出乾麵，好吃😋"
 anzta lee ,https://www.google.com/maps/contrib/100867713725762650966/reviews?hl=zh-TW,5,False,2,超好吃古早味，不油不膩，口味適中，快來嚐鮮吧！
 Shauyu Liao ,https://www.google.com/maps/contrib/114577623843056622969/reviews?hl=zh-TW,5,False,5,超好吃！每次都特別來吃！牛蒡湯超好喝
 Karen W ,https://www.google.com/maps/contrib/118420826183494396146/reviews?hl=zh-TW,5,True,129,好吃新鮮，服務極佳，期待二訪
 Eva Yang ,https://www.google.com/maps/contrib/114245904616614986517/reviews?hl=zh-TW,5,False,1,"每樣菜色都沒踩雷，好食！
冬至將至，貼心準備湯圓甜品，吃在嘴裡暖在心裡！"
 陶涼 ,https://www.google.com/maps/contrib/110379955868150065150/reviews?hl=zh-TW,5,False,4,口感溫順的湯品，不會有太多的負擔
 Chin-Chi Liu ,https://www.google.com/maps/contrib/111226882786989407465/reviews?hl=zh-TW,5,True,14,蔥蔥飯跟滷味都很好吃，份量很夠！
 邱瑞源 ,https://www.google.com/maps/contrib/111065763476503955427/reviews?hl=zh-TW,5,False,3,蛤蜊雞湯很鮮，愛恨交織麵味道很夠，川燙蚵仔也很新鮮。
 陳世偉 ,https://www.google.com/maps/contrib/103173678046018512134/reviews?hl=zh-TW,5,True,279,好吃😋位置也好～價格OK!
 Karen Wang ,https://www.google.com/maps/contrib/102514412250915764205/reviews?hl=zh-TW,5,False,2,魚湯超好喝，愛恨椒芝麵讚
 Hank ,https://www.google.com/maps/contrib/101531083751165217440/reviews?hl=zh-TW,5,False,6,鱸魚蛤蜊湯頭很甜！滷味也都有入味，推薦大家來吃！
 林佐 ,https://www.google.com/maps/contrib/110119149304113020345/reviews?hl=zh-TW,4,True,83,去過幾次晚餐時段，人偏多，外帶要等一下，但餐點好吃，價位也很合理，個人覺得魚湯比其他湯好喝，湯跟魚都很鮮甜
 Sam Lee ,https://www.google.com/maps/contrib/106432382488489131197/reviews?hl=zh-TW,5,True,35,食物新鮮好吃，可以常常來吃喲！
 LY Zhu ,https://www.google.com/maps/contrib/112828866908072343766/reviews?hl=zh-TW,5,True,87,服務好、餐點好美味
 Yi-Hang Chen ,https://www.google.com/maps/contrib/102734225506887757624/reviews?hl=zh-TW,2,False,2,疫情期間座位仍以併桌方式緊密安排，隔板大概只有桌子寬度的一半，應該只能說是裝飾用而沒有任何的防護效果。
 林蕙怡 ,https://www.google.com/maps/contrib/108685769894829968555/reviews?hl=zh-TW,5,False,1,服務親切東西好吃，環境也乾淨
 Ivan Tseng ,https://www.google.com/maps/contrib/116762559661157650125/reviews?hl=zh-TW,5,True,46,鱸魚蛤蜊湯，好喝不會有腥味，不愧是米其林星級餐廳
 pei pei ,https://www.google.com/maps/contrib/102131170032187837414/reviews?hl=zh-TW,5,True,209,"外送叫紅燒鱸魚很好吃
滷味普通"
 Lion HSIEH ,https://www.google.com/maps/contrib/115898972345330140544/reviews?hl=zh-TW,5,True,31,吃幾次都好吃啊！
 REX KUO (Head) ,https://www.google.com/maps/contrib/103029783192029248600/reviews?hl=zh-TW,4,True,676,20211002-UberEats點餐，湯丶意麵丶豬皮很合口味
 Sean Chang ,https://www.google.com/maps/contrib/101995733886360891955/reviews?hl=zh-TW,5,True,81,湯頭很棒，飯、麵較小一點（價格合理）但配雞湯吃，份量很剛好。小菜好吃，我們一定會再來。
 Liu Yu ,https://www.google.com/maps/contrib/115924940705823016811/reviews?hl=zh-TW,5,False,28,湯頭真的很新鮮，海鮮類有精緻的口感😍😍
 Zoe Chen ,https://www.google.com/maps/contrib/115468890550951153591/reviews?hl=zh-TW,5,False,15,干貝燉雞湯的料多到滿出來，非常好吃！
 Hank Huang ,https://www.google.com/maps/contrib/111530711223859936613/reviews?hl=zh-TW,5,False,8,東西美味好吃新鮮，唯獨生意太好，每次來都要排隊
 FT S ,https://www.google.com/maps/contrib/112639306936462593759/reviews?hl=zh-TW,4,False,47,"1.真材實料而且給料大方
2.用餐後桌面清潔消毒很ok
3.員工需要加強訓練：菜送錯桌、上菜單已經放在桌邊卻還是從另一邊穿過桌面畫單"
 Apple Jye ,https://www.google.com/maps/contrib/111210153470739142825/reviews?hl=zh-TW,5,False,2,相當推薦，候位系統很棒，環境舒適，服務人員親切，唯一美中不足的是要等很久
 mikaliu ,https://www.google.com/maps/contrib/109381710919441052592/reviews?hl=zh-TW,4,False,77,"跟青島店相比，濟南店的裝潢比較漂亮，座位也比較寬敞，外面一樣大排長龍，但是有準備很多椅子讓等候的客人可以坐著休息，謝謝店家的貼心！

食物的部分，最推薦蛤蜊雞湯跟月亮骨，其他普普～"
 Caramel Carol ,https://www.google.com/maps/contrib/110816676850362008050/reviews?hl=zh-TW,5,True,498,高雄人北上的第一餐，真的大大的滿足，好吃到哭了。
 潘威豪 ,https://www.google.com/maps/contrib/105654659007952775152/reviews?hl=zh-TW,5,False,8,食物很好吃！服務也很好！外面的實習生很貼心很辛苦！一直提供好喝的飲料！
 Ekin Shen ,https://www.google.com/maps/contrib/111672066229320152185/reviews?hl=zh-TW,5,True,23,愛恨椒之麵霹靂無敵好好吃！月亮骨肉也很脆口！
 李翌綺 ,https://www.google.com/maps/contrib/104450837526405910333/reviews?hl=zh-TW,5,False,16,餐點清淡不油膩，味道新鮮超好吃！還要再來
 蕭麗娟 ,https://www.google.com/maps/contrib/118225520113293800545/reviews?hl=zh-TW,3,False,7,假日需要候位很正常！出餐沒有照順序，後來的餐先上，先入場的等不到餐，還要一直提醒..........餐不錯吃，但用餐的心情⋯⋯
 Debbie ,https://www.google.com/maps/contrib/115551559835946869166/reviews?hl=zh-TW,5,False,10,"CP值高爆👌🏻兩個女生各點一碗湯、共吃一個主食、再搭配一點點小菜就很夠！
以後一定一定會常來報到✨"
 Arlica Chen ,https://www.google.com/maps/contrib/116661342992042435940/reviews?hl=zh-TW,5,False,10,非常值得再訪的台灣小吃，蛤蜊雞湯必點👍
 Kevin Yang ,https://www.google.com/maps/contrib/111194132296800591776/reviews?hl=zh-TW,4,True,716,價位偏貴但用料實在的臺式小吃店，用餐環境乾淨舒適，值得推薦。
 楊朝鈞 ,https://www.google.com/maps/contrib/104725602195559651230/reviews?hl=zh-TW,5,False,4,東西好吃環境乾淨整潔
 YuTing Shiu ,https://www.google.com/maps/contrib/100533473346661820318/reviews?hl=zh-TW,5,False,9,"打卡五星送麵線❤️❤️
必點蔥蔥飯！干貝燉雞湯！好吃！"
 Cheng Hsueh Tsai ,https://www.google.com/maps/contrib/102450786803747319513/reviews?hl=zh-TW,5,False,9,干貝雞湯非常好喝！還會再來吃鱸魚排和鮮蚵
 Emily ,https://www.google.com/maps/contrib/109826529450644136176/reviews?hl=zh-TW,5,True,113,"蒜泥鮮蚵很新鮮，沒有海腥味
椒芝麵口感很好，麻味不膩
蛤仔雞湯份量足不油膩不鹹
整體大推
台北市划算的價格"
 曾中平 ,https://www.google.com/maps/contrib/105665898451381802854/reviews?hl=zh-TW,5,False,2,"6／18第二次來用餐，菜單，服務很佳，值得推薦！

服務親切，食材新鮮環境乾淨，大推愛恨椒蔴麵，好吃"
 Winnie Weng ,https://www.google.com/maps/contrib/113786971183016422938/reviews?hl=zh-TW,5,True,24,"真的很好吃😋剝皮辣椒雞湯清甜、愛恨椒芝麵微辣感難得是我喜歡的麻醬麵
服務人員非常親切👍"
 Harvey ,https://www.google.com/maps/contrib/113966200614858660753/reviews?hl=zh-TW,5,False,1,從小到大的好味道。現在還有給五顆星評價送麵線的活動，怎麼能不來給評！
 張Echo ,https://www.google.com/maps/contrib/117410887352068808242/reviews?hl=zh-TW,5,False,7,第一次來用餐，服務餐點覺得一極棒。值得等待的一家店
 Ted Chiu ,https://www.google.com/maps/contrib/108930946403135607597/reviews?hl=zh-TW,5,False,36,環境明亮乾淨，餐點主要為麵/湯/小菜，麵食的部份還OK，湯的部份料多味濃，小菜味道較淡也比較軟爛，基本上還算中規中矩，算值得再次光臨。
 I Shan ,https://www.google.com/maps/contrib/103273146659688945340/reviews?hl=zh-TW,5,True,43,麵體很Q雞湯超鮮甜值得嚐鮮
 chieh lin ,https://www.google.com/maps/contrib/108038690499379380194/reviews?hl=zh-TW,3,False,5,"東西好吃，也算常吃。
但喝完湯越來越有口很渴的感覺。
雖說標榜沒味精，但感覺有其他替代調味料。"
 陳靜婷 ,https://www.google.com/maps/contrib/109698276187057527814/reviews?hl=zh-TW,5,False,5,"每次都會點愛恨椒芝麵、米血糕、豬皮
已回訪很多次了"
 王凱 ,https://www.google.com/maps/contrib/114086545003135031220/reviews?hl=zh-TW,5,True,99,湯品非常好喝，值得再來一次
 Han Lun Tsai ,https://www.google.com/maps/contrib/106196998282029574006/reviews?hl=zh-TW,4,False,97,"喝湯專門店，湯好喝沒話說。
虱目魚皮的部分，調味完全遮蓋了虱目魚皮的鮮味只剩下鹹味、青菜也很油。
整體而言是個乾淨的麵攤菜色，但是湯真的很美味沒話說，所以除了湯可以不用點了。"
 酒的故事酒的故事 ,https://www.google.com/maps/contrib/115004156972264892897/reviews?hl=zh-TW,5,False,6,"第一次來貴店用餐
1.服務品質優
2.小菜選擇多
3.主食味道佳
4.送餐速度快而不失優雅
5.語調溫和
6.環境衛生服裝佳
7.唯一改善椅子
8.適合各年齡層"
 蔡敏中 ,https://www.google.com/maps/contrib/103900382979464484880/reviews?hl=zh-TW,5,False,16,好吃湯很好喝
 許秀鳳 ,https://www.google.com/maps/contrib/101364663751606658404/reviews?hl=zh-TW,5,False,3,因為好吃😋，再來一次！
 吳家欣 ,https://www.google.com/maps/contrib/113675831681156470417/reviews?hl=zh-TW,5,False,12,非常好吃，服務優質，台北雞湯第一品牌！
 森森 ,https://www.google.com/maps/contrib/104469299799543853333/reviews?hl=zh-TW,5,False,1,喜歡他們家的湯！還有滷味必點！可惜現在沒有蘿蔔糕跟油飯～也超讚的耶
 小不 ,https://www.google.com/maps/contrib/103600349463506859396/reviews?hl=zh-TW,5,False,5,每樣都好吃！
 Ruby Lu ,https://www.google.com/maps/contrib/112483522459910050978/reviews?hl=zh-TW,5,False,2,湯真的有夠好喝，目前喝到的每種都很愛，真心推
 MaoDing ,https://www.google.com/maps/contrib/109476934307594115336/reviews?hl=zh-TW,5,False,1,這個也太好吃了吧！
 Calvin Lin ,https://www.google.com/maps/contrib/101807832534340789250/reviews?hl=zh-TW,5,True,12,"愛恨蔥蔥飯
干貝燉雞湯
小菜
都不錯👍"
 Kevin Ericon ,https://www.google.com/maps/contrib/117667385050390569770/reviews?hl=zh-TW,5,True,40,好吃又實惠，在附近的話真的不要錯過
 孫孫孫 ,https://www.google.com/maps/contrib/100304118539159350712/reviews?hl=zh-TW,5,False,2,餐廳的佈置與裝潢都很漂亮，餐點都十分美味，價格也非常合理，服務人員態度良好，是非常棒的一次用餐體驗！
 潘雅慧 ,https://www.google.com/maps/contrib/112787353468970962629/reviews?hl=zh-TW,5,False,2,好好吃喔…滿足💖
 Will Huang ,https://www.google.com/maps/contrib/115347075973664384025/reviews?hl=zh-TW,5,False,4,滷肉飯相當入味、飯粒分明，是我喜歡的口感。鱸魚蛤蜊用料實在，魚肉新鮮，蛤蜊多多！
 徐昱慧 ,https://www.google.com/maps/contrib/110342860222930444515/reviews?hl=zh-TW,5,False,2,好吃😋值得推薦！
 吳沛臻 ,https://www.google.com/maps/contrib/105228784802212475815/reviews?hl=zh-TW,5,False,16,"只要有經過，我都會來！
今天看到菜單上有新品-剝皮辣椒雞湯，也很好喝！推推"
 林媛如 ,https://www.google.com/maps/contrib/100119951270080866903/reviews?hl=zh-TW,5,False,4,服務好、食物美味
 Wi LI (W) ,https://www.google.com/maps/contrib/111712317320033356412/reviews?hl=zh-TW,3,True,74,點了椒芝麵、蔥蔥飯、干貝雞湯、滷味、地瓜葉，口味普通但價格不貴、環境乾淨，用送餐點洗五星評價。
 Ching-Yu ,https://www.google.com/maps/contrib/101892260172772219404/reviews?hl=zh-TW,5,False,3,喜歡麵，花椒的香氣跟麵交織在一起，椒麻及麻醬的味道配上Q彈的麵體，讓我給這碗麵很高的評價。
 小美 ,https://www.google.com/maps/contrib/102494234757384839967/reviews?hl=zh-TW,5,False,5,"環境乾淨舒適、店員親切！
推推檸檬愛玉、剝皮辣椒雞湯、愛恨椒芝麵👍🏻會一直想回訪的店"
 CL KAO ,https://www.google.com/maps/contrib/118329230169815673795/reviews?hl=zh-TW,5,False,1,環境乾淨明亮，用餐氣氛很好，菜點也都很好吃，尤其是湯的部分，料很足，湯也足夠入味，值得來到吃吃看
 鄞芳暉 ,https://www.google.com/maps/contrib/118391801361091297897/reviews?hl=zh-TW,5,False,3,"吹風滷味跟雞湯超美味，每次必吃！
服務到位，讚！"
 Samuel Chao ,https://www.google.com/maps/contrib/109868752291567189211/reviews?hl=zh-TW,5,False,10,服務熱心，東西好吃，還幫我們顧毛小小孩，非常感謝
 IC P ,https://www.google.com/maps/contrib/116946138565902606019/reviews?hl=zh-TW,1,False,7,好忙，忙到值得給六星，和服務員需要大聲說話才會有反應，名氣響亮客人說話也要大聲才配得上，賜予你六星好評不用謝
 yuehan ,https://www.google.com/maps/contrib/107293742809169525200/reviews?hl=zh-TW,5,True,86,這間非常好吃我幾乎每週每個月都會叫一次外送雞湯非常推薦現場好像都要排很久生意真的非常好～
 Rebecca Chiu ,https://www.google.com/maps/contrib/104098436065677963134/reviews?hl=zh-TW,4,False,3,"鱸魚湯清爽，口感鮮甜，肉質細嫩~
唯青菜略鹹，其他都很ok"
 西堤王 ,https://www.google.com/maps/contrib/114480585204852467703/reviews?hl=zh-TW,5,False,29,常用熊貓點餐，餐點品質穩定，從沒遇過不好吃的品項，如果想喝熱湯雙月永遠不會讓人失望，推推
 玩具玩吉米 ,https://www.google.com/maps/contrib/103880997814685035624/reviews?hl=zh-TW,5,False,4,環境乾淨，候位手機系統很好用，服務人員服務好，餐點都好吃
 徐慧雯 ,https://www.google.com/maps/contrib/114227477197802639333/reviews?hl=zh-TW,5,False,1,每道菜都可以看到用心，更棒的是80多歲的老爸也能開心吃，會再來。
 Eric Chuang ,https://www.google.com/maps/contrib/112004102500657520205/reviews?hl=zh-TW,5,True,190,初來貴寶地，等待人數27組，希望能如留言一樣美味。
