user_name,user_profile_url,rating,local_guide,comment_num,comment_text
 Jay Lin ,https://www.google.com/maps/contrib/102090296439549810770/reviews?hl=zh-TW,1,True,128,抱歉有點失望，首先是大熱天的讓客人在外面熱的狂暴汗這點不夠貼心，等待不是問題，大家也知道平均等待時間要一小時左右但慕名而來都很期待所以等待並不太放心上，但是沒電風或其他降溫設施這等待的過程就會很辛苦。第二是餐點其實就我個人看來其實蠻普通的，名字取的很有亮點，但小菜普普，雞湯的部分我點了剝皮辣椒和干貝雞湯兩種，喝完只有一個共同的感覺就是油，雞肉腥味有點重，沒有把剝皮辣椒和干貝的食材特色發揮出來，也許是我嘴太刁，但當下覺得從服務細節到餐點內容都有點和米其林搭不上來。無存心批評之意勿戰。
 Judy Foster ,https://www.google.com/maps/contrib/112537822147572513564/reviews?hl=zh-TW,3,True,71,"雙月食品社（濟南店）由於是新開張，故相較僅隔一條街，但用餐時間總是大排長龍的青島東路總店而言，1.用餐環境更寬敞明亮。2.不加收服務費，服務更加細膩貼心（提供防疫隔板、置物籃等）。3.小菜更多樣，蘿蔔擺飾成玫瑰花非常用心。
#元氣鱸魚湯$120～僅濟南店提供。網路評價佳，實際品嘗結果：鱸魚肉雖無刺但軟爛，吃起來乎乎；魚湯有放薑片及枸杞；而點綴的幾粒干貝意外的好吃。
#雞肉飯80～少許的雞肉絲與大碗米飯不成比例，飯粒黏性及香味不足，因份量多，雖有醬汁，若不配小菜，吃起來還蠻無聊的。
#海帶30～爽脆，尚可。
#豆皮25～居雙月所有滷味中之翹楚，推薦。
#滷蛋10～蛋白Q彈，蛋黃不乾，沾醬料更好吃。
#甜不辣30～完全不及格，跟基隆魚漿味十足的甜不辣根本沒得比，吃多會膩。
#檸檬愛玉70～酸甜適中，愛玉Q彈，清爽解膩推薦。"
 Estrella lyn ,https://www.google.com/maps/contrib/116547225110849925666/reviews?hl=zh-TW,5,True,66,"第一次吃雙月，就一試成主顧！
鱸魚湯超級好喝，像是從老家廚房端出來的料理一樣，感人又深刻。
陸續嘗試了各樣料理，完全可以放心點，都很好吃！

另外，雖然生意很好，但每位服務員都訓練有素，又很親切有禮。總之，是很棒的體驗，大推！"
 呂志鵬 ,https://www.google.com/maps/contrib/101791791258464636225/reviews?hl=zh-TW,5,True,14,麵飯類各有特色又好吃，湯品皆真材實料
 嚴翊 ,https://www.google.com/maps/contrib/109509813302077609624/reviews?hl=zh-TW,5,True,612,"小菜部分月亮骨肉一絕，超貴的冬蟲夏草雞湯也挺好喝，明明是中藥卻很甜，雞腿很韌很大挺好吃的。
鮮蚵不錯吃，但有幾顆真得偏嫩，見仁見智。
其他都對得起價位。
我個人認為是火車站附近要吃好一點但又不會太貴的點，喔不過米血給得稍微有點少的樣子，可惜。"
 雲朵上的棉花糖 ,https://www.google.com/maps/contrib/114921239733665441760/reviews?hl=zh-TW,5,True,43,"店面座位較青島店寬敞舒適，唯二間門市菜色有所不同，
魚湯部分濟南店主打爐魚、青島店主打虱目魚，個人偏愛後者味道豐富些。
黃金蟲草燉雞湯頭濃郁、雞腿很壯，很難吃光呢！"
 Charlene Hsu ,https://www.google.com/maps/contrib/109346674058703643134/reviews?hl=zh-TW,5,True,554,"麻油瘦肉湯$120
滿滿一碗的瘦肉、高麗菜、薑片，料多到滿出碗來，瘦肉肉質略為乾柴，湯頭加入香氣撲鼻的麻油及大量高麗菜，喝來清甜。
⠀
元氣鱸魚湯$120
一大片的鱸魚搭配幾顆小干貝，肉質細緻沒有土味，湯頭鮮美，不過鱸魚還是有一些小刺，食用時要注意。
⠀
花干$30
以這價格來說份量挺大的，花干吸飽了滿滿滷汁，滷得很入味，但稍微鹹了點。"
 鄭嘉玲 ,https://www.google.com/maps/contrib/116291399432919959150/reviews?hl=zh-TW,5,False,3,椒芝麵味道很棒，蛤蜊雞湯真材實料。
 速小圓 ,https://www.google.com/maps/contrib/113130828792803773631/reviews?hl=zh-TW,5,True,192,湯很棒！滷肉飯也不錯，麵線最不如何的就是了，其餘都很好，下次還要來吃！
 Nancy Chen ,https://www.google.com/maps/contrib/116474716320158219203/reviews?hl=zh-TW,5,True,24,"必點招牌👉蛤蜊燉雞湯💯
金鮮蛤蜊鱸魚湯，好大一片鱸魚啊😁"
 劉亦倫 ,https://www.google.com/maps/contrib/113289231330225768246/reviews?hl=zh-TW,5,False,58,"說結論五星送麵線
雞肉飯非常好吃有味道雞肉有嚼勁
滷味非常一般普通
湯品裡的雞又柴肉又少又有點血味可以直接丟旁邊的程度
湯裡的菜很脆很甜

湯頭本身鬼之好喝光喝這個湯就值價位了不需要雞肉

麵線沒有搭配湯頭也是普普"
 A Mau Chen ,https://www.google.com/maps/contrib/103845664765535438380/reviews?hl=zh-TW,5,False,21,"超級好吃，湯不油，雞肉Q彈但不會過於韌。每樣都恰到好處。
建議若一人點一湯可能要斟酌要不要點燙青菜，因為份量太多，完全對得起這個價錢啊啊啊！！"
 到處吃吃喝喝 ,https://www.google.com/maps/contrib/109308296303570675624/reviews?hl=zh-TW,4,True,273,"五點初到店內用餐原以為避開人潮，結果已經不少人在享受美食囉！
幸好還有位置，蠻開心沒有排到隊😄

點了麻油瘦肉湯，肉蠻嫩的片數不多也不少
麻油香氣足夠很好喝很順口。

東石乾蚵，清燙蚵仔佐醬油膏底下鋪上些許豆芽菜，飽滿沒有腥味，蠻不錯吃價錢略貴

滷味點了甜不辣米血糕豬皮，滷得有入味帶有淡淡中藥香氣

蛤蜊燉雞湯，湯頭爽口好喝，裏頭有三大塊雞肉嫩嫩的蠻好咬，蛤蜊都有吐沙乾淨只有一顆未煮開，高麗菜鮮甜好吃😋

主食原本想要吃油飯，菜單上無提供似乎總店才有的樣子，最後選了油蔥麵線，蠻普通的麵線我自己淋了麻油湯汁進去，蠻不錯。

用餐環境幾乎都有併桌，中間都有使用隔板
位置其實不大，餐點較多的話桌面會很擁擠
吃起飯來較不順手，很怕用到旁邊的客人
另外桌距不大算有點小，服務員端盤送菜不太方便（有打到隔壁桌的東西）"
 Jerry Chu ,https://www.google.com/maps/contrib/117901470165078116183/reviews?hl=zh-TW,4,True,637,家常味、跟青島店一樣美味好吃；首重滷味(滷的洽到好處不死鹹～推米血糕)、湯品(蛤蠣燉雞湯、鱸魚湯～湯鮮料多實在)。蘿蔔糕、米糕的表現反而沒有我想像中來得Q彈且香。
 Chris Warton ,https://www.google.com/maps/contrib/106266991986881619969/reviews?hl=zh-TW,5,False,1,食物超好吃，服務態度又超好，推薦來！
 李彥萩 ,https://www.google.com/maps/contrib/108800810415725717634/reviews?hl=zh-TW,5,False,18,"海帶超好吃😋豬頭皮也不錯，個人覺得甜不辣普普！
干貝雞腿湯超好喝，湯頭很鮮甜完全不會有腥味，小干貝也給的蠻多的，保留了原本干貝的口感，完全不會因為煮湯變得乾硬，雞腿肉也超嫩超Q的，連雞皮都是滿滿的膠原蛋白口感！超推薦！
缺點是份量太多了！！"
 王俊翔 ,https://www.google.com/maps/contrib/103997860189423052838/reviews?hl=zh-TW,2,False,6,"排隊的先來後到到底是桌算還是先進先出我就不知道了
進去用餐了不用加工的缺晚上
更扯是雞湯滷味全上了飯麵還沒上事後跟她說還少上一碗飯
也等到都吃完還沒上還要等集單到五六碗在一起送是怎麼回事（是因為米還在洗沒跳嗎？）
到底是方便流程還是流程有問題
全部都吃光了才叫我吃飯嗎？
你們流程真的有很多問題
不會再去了"
 范哲瑄 ,https://www.google.com/maps/contrib/116544657882183149038/reviews?hl=zh-TW,1,False,4,"糟糕的用餐體驗。

從18:00開始候位，當時服務人員告知前面只剩兩組人，於是我與朋友共三位開始等。
等了一陣子後我們發現許多人都陸續進場，卻沒聽到我們的叫位，於是去詢問叫號服務生，服務生態度強硬，說著「我真的不知道要等多久！真的不知道！我沒辦法告訴你要等多久！」於是我們便回去候位區繼續等待。
約18:30，我們發現許多號碼在我們後面的人都已入座，但遲遲沒有等到我們的候位叫聲，於是我們便向服務人員訊問，他們表示「因為我們有三位，需要使用大桌子方可用餐」但，現場有許多雙人桌，若是將兩個雙人桌併起或是多拉一張椅子，我們也可以入座了？因為我們已經看到不只一兩組我們後面號碼的客人進去用餐，而我們只能在外等待。
最後18:46我們終於入坐，然而入座時座位上還有未被清除的菜渣。
希望貴公司能加強員工訓練處理。"
 Jessica Lee (秋秋) ,https://www.google.com/maps/contrib/102688505198950929355/reviews?hl=zh-TW,5,True,63,用餐和外帶和外送的人超多，幸好很快就有位子了！干貝燉雞湯～湯頭鮮甜美味，干貝超多，精華都在湯裏面！愛恨椒芝麵～麵很Q彈，辣得夠味！麻油瘦肉湯～薑片沒在客氣的，超大片，瘦肉很軟嫩，湯喝了很暖呼！難怪生意這麼好！
 X Man ,https://www.google.com/maps/contrib/111652150123574427293/reviews?hl=zh-TW,4,True,273,"湯真的好喝，不點就白來一趟了。
招牌麵條也可以點來吃下。
滷味一般般還不錯吃。
內用和外帶共同一個收銀，排隊排很久，透明的桌面隔板跟對面的客人吃東西互看，為什麼不做不透明的呢？感覺真的很怪。"
 曾靖婷 ,https://www.google.com/maps/contrib/106321943354300560905/reviews?hl=zh-TW,5,True,281,"超推椒芝麵，味道一級棒＆麵條口感涮嘴
蚵仔都很大顆，非常划算
湯類養生，味道較清淡"
 Bill ,https://www.google.com/maps/contrib/108107255396385990620/reviews?hl=zh-TW,4,True,328,"雙月在這附近開了兩家店，走路距離不到10分鐘。青島東路和濟南路兩家要分清楚。青島東路那一家人好像比較多，星期天會休息，菜單有油飯可以點；濟南路這一家星期天不休息，菜單沒有油飯，人潮比起青島東路那一家要少一點。
我的照片是青島東路那一家雙月：雞湯算清爽，湯裏面有高麗菜好吃，滷味跟油飯都好吃。可惜麻油瘦肉湯的瘦肉片像火鍋肉片一樣很薄。"
 Peggy Wu ,https://www.google.com/maps/contrib/116620225683768202148/reviews?hl=zh-TW,5,True,79,"因為看了電視節目介紹所以帶著家人跟老人家來嘗鮮~
用餐時間真的非常多人但還好我們是大約一點左右到的沒有等很久就有位置坐了.

這次點了雞湯/魚湯/雙椒麵/滷肉飯及一些滷味小菜.
雞湯料非常豐富,口味非常好,覺得非常超值.
魚湯的部分也很鮮美,價錢也真的很佛心價.
非常推薦點這兩個湯品~

店內服務人員很親切,對待家中長輩都會輕聲輕語講話,而且還招待一份魚給老人家吃.

此家店裝潢風格也很乾淨,非常推薦~"
 yato chen ,https://www.google.com/maps/contrib/116047590254429261490/reviews?hl=zh-TW,5,False,2,"第二次吃，還是吃光光
對孕婦很友善，提供舒適特別椅子"
 林笑笑 ,https://www.google.com/maps/contrib/117277215701145107386/reviews?hl=zh-TW,3,True,58,真的不覺得有那麼好吃每次來都要等
 Ching Min Su ,https://www.google.com/maps/contrib/100549784236515239810/reviews?hl=zh-TW,4,True,239,"店內位置不算多，但服務態度非常好，上菜速度也還可以，用餐時間來要排隊等一下；鱸魚湯跟愛恨椒芝麵是最喜歡的，尤其是鱸魚湯，非常的新鮮，湯喝起來很溫潤，且喝得到枸杞的甜味，會忍不住一口接一口，椒芝麵也很特別，有麻醬的香跟花椒的香，吃起來一點點辣辣的滿開胃，麻醬也不會太多讓你一下就吃膩，這兩樣都還滿推薦的。
油飯跟滷味就比較普通了點，油飯吃起來的口感稍微偏軟爛了些，滷味原本以為會吃的到中藥香味，但其實還好。"
 Mark Lu ,https://www.google.com/maps/contrib/105071949037242117287/reviews?hl=zh-TW,5,True,81,反應飯煮爛了，馬上透過LaLamove重新送餐，處理態度極佳（上方為重新送來的）
 joyning chung ,https://www.google.com/maps/contrib/113881449554859887880/reviews?hl=zh-TW,5,False,1,"雖然生意非常好但每位服務人員皆熱心.耐心的特優服務這在很多餐廳己見不到的服務精神真的是品質優服務優真的值得關注！
相信老闆的態度肯定能夠讓員工成為優秀人才。加油各位！您們是很棒的！"
 Julia Wen ,https://www.google.com/maps/contrib/117162344572359366039/reviews?hl=zh-TW,1,False,11,"點了蔥蔥飯-飯粒的品質不飽滿味道偏甜
鱸魚蛤蜊湯雞干貝湯-感覺湯頭一摸一樣也是偏甜又帶鹹

感覺都不是食物天然甜味，反而吃完嘴巴很渴要喝大量的水

店家回答所有湯頭都一樣的意思是指只有鋪在上面的不同所有的湯都是一樣的湯底嗎？"
 蘇聖文（RO） ,https://www.google.com/maps/contrib/111638805881295837695/reviews?hl=zh-TW,3,True,25,"耳聞必比登推薦名氣滿懷期待而來
排隊名店口味不習慣
招牌的飯跟意麵沒有吃出特別之處
一大碗的湯意外的偏甜
(與府城比有過之而無不及)
店內空間並不大
動線也值得再重新調整
但值得讚許的是排隊系統
不接受訂位現場掃碼等候"
 Chia0101 ,https://www.google.com/maps/contrib/113819515329996801409/reviews?hl=zh-TW,5,False,17,"在沒有等待的狀態下入座點餐
感覺真的非常之良好🤘🏻直上5顆星
蛤蠣雞湯非常清甜、雞肉嫩彈
戴牙套也能吃的程度
蘿蔔糕也推薦外酥內軟
紅燒虱目魚肚無刺大加分好吃！
地瓜葉切小快好入口

如果大門可以關閉餐點應可保溫更久更好食！"
 57 Chen ,https://www.google.com/maps/contrib/112679297789890080395/reviews?hl=zh-TW,1,False,4,"友人從18:00開始現場候位，等了快一小時還沒入座。詢問外場服務人員，人員告知我們有三位內用，沒有大的桌位因此不帶三位入座，卻同時帶入多組兩位客人入座，非常不懂那這樣我們何必候位？先來後到的順序帶位人員難道不懂嗎？
在詢問的時候帶位的男服務生態度非常不佳、回覆讓人感到非常不愉快，處理候位的方式讓人不能理解。
希望貴餐廳能夠加強員工訓練，並且制定公平公正的候位sop：）"
 Jill Shih ,https://www.google.com/maps/contrib/112470756783212687950/reviews?hl=zh-TW,3,True,136,口味仍在水準上，但是本日最大敗筆不管是鱸魚湯或紅燒鱸魚頭，鱗片只要吃到魚皮部分幾乎口口中....魚刺沒問題，但是鱗片很讓人遺憾...
 Jonas Yen ,https://www.google.com/maps/contrib/103161170170926223835/reviews?hl=zh-TW,5,True,684,"一進到店內就有超親切的服務人員接待，專業熱情且毫無感到壓力的介紹每樣食材或產品，服務真是周道！
當然除此之外，食物好吃是完全毫無疑問的，真的硬要挑小缺點，就是人潮眾多，座位有點擠囉。"
 Kenneth Wang ,https://www.google.com/maps/contrib/108392632593060203553/reviews?hl=zh-TW,5,False,5,"1.招牌干貝燉雞湯：湯頭相當鮮甜，高麗菜脆、干貝鮮且有嚼勁，枸杞及些許薑絲襯托的恰到好處2.紅燒金鮮鱸魚骨頭處理的乾淨，沒有土味，搭配淡醬油及薑絲將魚本身的鮮味襯托出來。
好吃！"
 Alena chen ,https://www.google.com/maps/contrib/108185236617836262091/reviews?hl=zh-TW,5,False,4,"環境乾淨舒適，店員每個人都親切有禮，會主動提醒內用外帶的排隊方式。
而且牛蒡豬心湯喝起來相當清甜，豬心量給超多！"
 Jason Lee ,https://www.google.com/maps/contrib/110736299483525031962/reviews?hl=zh-TW,4,True,155,用料真的是十分實在的一家小吃店，雞湯十分鮮美，鱸魚排也軟嫩適中處理的相當好，每一道菜都可以吃得到店家的用心榮獲必比登真的是實至名歸！
 王藝儒 ,https://www.google.com/maps/contrib/102235343771322049603/reviews?hl=zh-TW,5,True,518,"之前一直耳聞雙月補湯的厲害
但遲遲找不到時間去吃終於一償宿願😆
初訪雙月食品社濟南店
門口乾淨空間寬敞
配合防疫政策都有隔間讓人吃得安心

因為太期待所以馬上點了一桌菜
來說說印象深刻的推薦品項：

蒜泥鮮蚵
怎麼會有這麼好吃的蚵仔
一點都不腥口感很軟嫩
配上適當的調味簡直完美

元氣鱸魚湯
清淡的鱸魚湯上面有五個小干貝很提味
魚肉有嚼勁湯頭鮮甜
感覺很適合復原的時候享用

牛蒡燉雞湯
沒喝過牛蒡湯有點好奇就來喝看看
意外的有種甘甜的感覺耶
很回甘不會膩口
雞肉很大塊都是雞腿肉很讚

蛤蜊燉雞湯
一樣是清爽的湯品
蛤蜊都很大顆鮮甜有口感
雞腿肉也好好吃
裡面還有清脆的高麗菜
相當爽口感覺小孩子會喜歡

紅燒虱目魚皮
沒想到魚皮可以這麼有彈性
吃進好多膠原蛋白的感覺

愛恨椒芝麵
上面的花椒畫龍點睛
提升了原本麵條的麻醬味
麵條Q彈有勁份量滿足的

冬瓜愛玉
冬瓜的甜味恰到好處最怕喝這種飲料太甜了
雙月在這個飲料上也不馬虎愛玉切的很剛好
順口喝下去適合初夏的夜晚

整體來說
雖然是補湯店
但是口味意外的清爽
而且濟南店的空間寬敞又乾淨
融合了傳統與現代的設計感
讓人覺得喝個補湯也可以很時尚
下次有機會會再訪的～"
 Alice Shen ,https://www.google.com/maps/contrib/104584364935801633152/reviews?hl=zh-TW,5,True,230,"🔺美味程度：🌕🌕🌕🌕🌗
🔺上餐速度：🌕🌕🌕🌕🌕
🔺環境衛生：🌕🌕🌕🌕🌕
🔺服務態度：🌕🌕🌕🌕🌕
🔺人均消費：$300-$400

🔅愛恨椒芝麵$70
以胡麻醬為基底，再加上花椒調味，麵體非常Q彈，一入口就有滿滿的花椒香，辣度低，算是香而不辣，相較於花椒，胡麻味比較沒那麼突出，鹹度夠，醬較稠會牢牢地扒在麵上，友人覺得太稠會膩口，不過對於愛吃麻醬麵的我來說好喜歡啊～～～推！大推！份量不大，可以安心的給他點下去不會吃不完的！

🔅蛤蜊燉雞湯$170
湯品價格雖較高，但份量及味道對得起這個價格，一上桌就先被滿出來的雞肉驚豔到，雞肉共有三大塊，給的是雞腿肉，又嫩又彈好好吃～湯非常濃郁，一入口就有濃濃的蛤蜊鮮甜味，蛤蜊雖算不上大顆，但鮮度足且煮得恰到好處，沒有因過熟而萎縮。除了雞肉、蛤蜊外，高麗菜也給的很多，若有點這道，就可以不用再多點燙高麗菜了。整體清甜，調味適中，喝完不會有口渴的感覺。

🔅蒜泥鮮蚵$130
看看這個蚵多肥美！海鮮最重要的就是新鮮，只要新鮮，川燙一下不需要過多調味就很好吃。沒錯，這個蚵就是很鮮！熟度剛好，軟嫩的像豆腐一樣，一咬下那個鮮甜直接充滿整個口腔，歐買尬好好吃好喜歡，再配上甘甜的醬油及底下的豆芽菜，舒服！

🔅質樸蘿蔔糕$50
有點偏港式的臘味蘿蔔糕，口感味道皆屬中庸，以這個價位來說可以不用特別點來吃。

🔅筒仔油飯$40
米粒口感偏顆粒，非軟糯黏稠的米，整體調味溫和順口，每顆米都很入味且香氣足，上頭有加肉燥，配著甜辣醬及油飯一起吃很不錯。據說油飯超熱賣，晚來就買不到囉。

🔅米血糕$30
🔅花干$30
🔅甜不辣$30
🔅豆干$25
滷味非常平價，味道樸實，算是較家常的味道，滷得滿透且不會過鹹，中藥味不明顯，個人覺得可點可不點。

補班的週六晚上約七點過去用餐，店內已有幾組在候位，進店登記後便到店外等，等候的同時即有店員出來遞菜單及倒茶，等店內的客人入座後馬上請我們進店內坐著等，服務非常好。等了約十分鐘就入座了，上餐速度也是快的驚人，照片都還沒拍完，桌上就快被擺滿了。中秋前夕只要用餐還會送一罐飲料，這次送的是黃金牛蒡茶，我個人不喜歡哈哈哈哈，有一種太養生的感覺XD不過整體很滿意，推薦大家都去吃看看！"
 譚敬怡 ,https://www.google.com/maps/contrib/117325741327386946318/reviews?hl=zh-TW,5,False,4,椒麻麵香而不辣，雞湯清燉鮮甜好喝
 Amy Su ,https://www.google.com/maps/contrib/117565990287367616263/reviews?hl=zh-TW,5,True,"1,003","絕對給五顆星！
一進門就有服務人員帶位倒茶，採自助點餐，櫃台結帳完拿號碼牌到座位上等待餐點
湯類價格高，但食材選用、份量和調味都沒話說，個人覺得完全值那個價格
翡翠蛤蜊鱸魚湯(200)鱸魚超厚超嫩，是我吃過最好吃的鱸魚了！！！完全驚艷到不行
蛤蜊也很鮮美，足足放了快15顆吧，湯頭都是蛤蜊香氣
湯裡還加了海菜跟高麗菜，增添清爽的味道

元氣鱸魚湯(120)酒味濃，友人飯後還要騎車所以不太敢喝湯，詢問店員才知道店內的湯都有加酒，但下次點餐時可以事先跟櫃台備註不要加酒。感覺這碗的酒味比翡翠蛤蜊鱸魚濃的多"
 Hua猴猴 ,https://www.google.com/maps/contrib/100084298938003756460/reviews?hl=zh-TW,5,False,1,很好吃尤其是蔥蔥飯其他也很好吃
 田沛晴 ,https://www.google.com/maps/contrib/100877884582673476682/reviews?hl=zh-TW,5,False,10,來了100次了！雞湯滷味小菜蔥蔥飯麵，好好吃～
 Tinghui Yu ,https://www.google.com/maps/contrib/114262749869800169234/reviews?hl=zh-TW,5,False,7,"愛恨椒芝麵花椒香超香，麵體完全不爛！
每項餐點都不踩雷"
 Benson Chen ,https://www.google.com/maps/contrib/103563642139077952135/reviews?hl=zh-TW,5,True,185,空間明亮整潔，餐點美味可口！外帶要提早30分鐘以上預訂，才不會等很久！
 Hsu Purple ,https://www.google.com/maps/contrib/104423662558769789436/reviews?hl=zh-TW,5,True,81,室內溫度稍微悶熱，尤其在食用熱湯時，更感悶熱。椒麻麵口味不錯，鱸魚蛤蜊也很清甜，蛤蜊雞湯一如既往，肉質保持有嚼勁，意麵麵體較厚實，食用味道較一般。
 利維亞的傑洛特 ,https://www.google.com/maps/contrib/113435816663246581556/reviews?hl=zh-TW,5,False,11,餐廳乾淨明亮，服務人員態度很好，東西好吃
 Angel ,https://www.google.com/maps/contrib/106389366832813472841/reviews?hl=zh-TW,4,True,95,"其實我對米其林的餐廳沒有什麼信心
但這間雙月讓我非常的驚訝
我們才兩個人來用餐給每一桌
每樣都很好吃，味道都很到位。
推～～"
 Ming Yang ,https://www.google.com/maps/contrib/105024052487135719927/reviews?hl=zh-TW,5,True,294,"這間不用排這麼久、也比較寬敞。
照片中點的都可以試試，每樣都好吃！
-
✨遊山玩水看ig:crystalyang1024"
 Gim Wu ,https://www.google.com/maps/contrib/109880660029459044438/reviews?hl=zh-TW,5,False,11,餐點很好吃！服務人員也都很親切❤️❤️❤️❤️
 王阿樹 ,https://www.google.com/maps/contrib/110968154046241498578/reviews?hl=zh-TW,1,False,7,"外送報單號取餐，店員不馬上對講機確認進度，只跟我說還沒好！
等了十分鐘再次詢問進度，店員才發現單子不見了！跟我說再等十分鐘重做給我……
請問貴司是覺得訂戶不夠餓還是外送員時間多？"
 cathy tuan ,https://www.google.com/maps/contrib/112124282240684221665/reviews?hl=zh-TW,5,True,251,"翡翠蛤蠣鱸魚湯ㄧ入口真的鮮美的不得了！
蛤蠣雞湯加了高麗菜熬煮清爽甘甜
小菜部分燙蚵仔滿大顆，中藥滷味如推薦必點
米血很入味軟Q，花干吸飽湯汁意外好吃
主食的米糕&麻辣麵相較Ok沒有記憶點
雞肉飯的油蔥跟醬汁讓口味吃起來很有層次
空間安排稍擠，週末用餐時間大約候位30分
值得再訪
————————————————————-
再訪依舊五顆星體驗！
帶位的小姐馬上請懷孕的我先坐
也很快安排位子、貼心的換有椅背的椅子
上菜前還特別提醒將湯裡的酒去除
除了吃飽了美味、還嚐到滿滿溫暖❤️"
 Neco Yang ,https://www.google.com/maps/contrib/116914436436277276722/reviews?hl=zh-TW,4,True,139,"🥢滷司目魚肚
無刺、暖嫩、有一點過鹹

🥢中藥滷味：米血、粉腸
米血軟硬度煮的剛好

🥢蛤蜊雞湯
喝的到蛤蜊鮮甜、雞肉用雞腿肉吃起來Q彈

🥢米糕
菜單上寫限量的米糕味道不錯
米飯分明又不會太黏、醬很搭

🍵招待：牛蒡茶(冷)"
 Jimmy大吉 ,https://www.google.com/maps/contrib/111592936418077294854/reviews?hl=zh-TW,5,False,7,"點了一份愛恨椒芝麵，麵條很Q有嚼勁，淡淡的辣味配上芝麻醬！真是美味！芝麻醬應該是自製的吧，好吃😋
瘦肉剝皮辣椒，份量大！剝皮辣椒很大方的給了三大條，瘦肉也軟硬適中～
吃下來好撐啊！"
 翁大鈞 ,https://www.google.com/maps/contrib/114219620646013118675/reviews?hl=zh-TW,5,True,158,"雞湯好喝。所有湯類都值得一試。
不過口味清淡些的，點剝皮辣椒雞湯可能要與人分享。
其他滷味小菜都很棒，香煎魚肚也很推。
雞肉飯一定要試試。"
 sunnybear1223 ,https://www.google.com/maps/contrib/116684995854635047054/reviews?hl=zh-TW,5,True,120,"算是出乎意料的親切美食，干貝雞湯有種很鮮甜的口感，也很大盅份量很足夠
除了排隊要排比較久之外，服務跟上菜速度都算是不錯的！"
