user_name,user_profile_url,rating,local_guide,comment_num,comment_text
 Jen Yu Wu ,https://www.google.com/maps/contrib/106653835906886390984/reviews?hl=zh-TW,3,True,2,"從之前中山店吃到小乾杯，再到本店，不變的是店內歡樂的氣氛，餐點部分因為上等角切沒了只能改成乾杯角切；不過依舊軟嫩多汁！朝日生啤仍然綿密順口！
比較詬病的有3點:1.現切澳洲和牛，在場朋友都覺得太有嚼勁，難以咀嚼！覺得沒有價值。2.經典五花肉的生菜上面附著蝸牛（後來店家沒算進帳單內）3.麻辣脆雞軟骨真的很鹹（是為了要讓客人多喝幾杯酒嗎？）
可惜的是印象最好的小乾杯卻結束營業了⋯⋯另外，廁所能處理一下嗎？滿髒的！"
 Faye Wang ,https://www.google.com/maps/contrib/108510657337138925586/reviews?hl=zh-TW,5,True,58,"肉食主義者的天堂，食材的品種跟品質沒話說；除了食材好，還有好玩的三寶：親親五花肉、八點乾杯、牛排猜猜看，好玩的地方、好吃的美味，想要大口吃肉的時候，約個三五好友好乾個杯，暢懷大笑。
吃燒肉最適合就是要喝酒🍺帶著脂香的燒肉，與酒滑爽潤口的嗨棒，真的是絕佳的美味！

好玩三寶最喜歡的就是「八點乾杯」的活動，🆓免費贈酒不說，主持人帶著大家一一介紹特別來用餐要慶祝的事情，可以順便認識店裡「一期一會」的客人，有來相親的、來送別的、來慶祝的，一頓飯本來承載的就不僅僅是一頓飯而已。

喜歡熱鬧氛圍的，強烈建議可以晚上7點左右的時間段來用餐，可以參加八點乾杯活動體驗一下店員的熱情活力；如果不喜歡太吵雜，也可以挑晚上5、6點，或是中午時間段來～

乾杯現在生意愈做愈大，出門口還看到有寵物飼料，專for狗狗而出，一共有四款，店員「美心」很認真的說明每一種飼料適合哪一個品種的狗，牙口不好的狗狗也有選擇！當下立刻買了兩盒⋯😆😆😆"
 Liling Yu ,https://www.google.com/maps/contrib/110486103757571520810/reviews?hl=zh-TW,5,True,110,"氣氛餐點都不錯
一定要參加8點乾杯時刻
現場乾掉會再送一杯飲料
牛大腸、牛小腸必點才180元/份
上等牛五花380元油花口感讚大推
一般牛五花220元瘦但不硬
豬五花附包肉生菜及紫蘇葉+醬料盤
雖然貴一點但份量足喔！"
 chia chien ,https://www.google.com/maps/contrib/113692614858089341920/reviews?hl=zh-TW,1,True,79,"名不副實…神難吃……價錢其次
但根本沒質量也沒服務
裡面神吵完全無法聽到對面友人的話語
2個禮拜前就已經訂位
點的也不少
每個人也要一張小藍出場
吃不到30分鐘一直想趕我們走？？？
到底多缺錢？
不能因為我們吃得快不能休息一下聊天嗎？

有點牛排幾分鐘沒動而已
就來問還是我們要打包外帶？
（用一點腦好嗎？來單點的店問這句我們要不要外帶，還是在整體用餐不到30m的情況下，還一併問要收火爐嗎？
真心覺得神扯，也沒什麼桌邊服務，就幫你處理那大塊牛排而已）

尤其服務員大東？
態度神差…怎麼了欠你錢嗎？

到現場一直推飲料
ok這部分沒問題
但態度不能好一點嗎？

我們都第一次來
不太清楚如何點
或者該吃些什麼
想請他們介紹
介紹的也心不甘情不願
我們選擇的有點久
也基本讓他推薦
但那些東西都……
不是簡單的難吃
不是偏重鹹就是很柴

第一次也是最後一次
沒下次
也一併會讓身邊朋友知道貴店"
 蔡笨貓 ,https://www.google.com/maps/contrib/118315280881970703644/reviews?hl=zh-TW,5,True,24,"肉質鮮美店員細心熱情

猜牛肉重量遊戲幸運猜中公克數

獲得美味牛排一塊真的好吃

油脂的部位入口即化

可惜沒空間再塞茶泡飯

下次再來吃🤤"
 Jenny Huang ,https://www.google.com/maps/contrib/108129045438257484822/reviews?hl=zh-TW,5,True,129,來到乾杯除了可以享用鮮美的肉質，更可以感受到現場活力滿滿又親切的服務!!牛排猜猜看就算沒猜中，也很值得一試!
 鄭人誠 ,https://www.google.com/maps/contrib/112237696162421881260/reviews?hl=zh-TW,1,False,6,"本店的東西很好吃，但服務真的讓我傻眼，
和朋友去吃飯，我朋友當月當日壽星，壽星在加點前有辦好會員，也有跟店員說是當日壽星，結果換到的是巧克力蛋糕，當月當日壽星不是有燒肉蛋糕，最後加點也有再說一次，直到最後我們說請問壽星的燒肉蛋糕能不能幫我們上，服務員說不好意思過了加點時間不能加點🔥這是哪招，想請服務員換烤網等超久，還有我們點的肉，默默的被收走，我們卻不知情，我們問服務員，我們點的肉怎麼不見了，還說是誰收走的，明明就你拿走的，又在演哪一部電影，吃到最後我是很火，還說時間快來不及了，先幫你們拿去烤了，請問禮貌尊重在哪裡，你拿了東西不會先說一聲，不好意思因為時間快到了，我先幫你們的餐點請廚房烤，這不是很基本很簡單的事？如果我們沒發現，我們是不是就少了這盤肉，最傻眼的還是沒有補點到壽星的燒肉蛋糕，已經過了加點時間不能加點了，是在哈囉！中秋節的氣氛跟颱風天一樣🔥。"
 Patty Wong ,https://www.google.com/maps/contrib/110925453631115339951/reviews?hl=zh-TW,5,True,16,愛吃肉的來這就對了~食材新鮮、店員們都很親切，店內的氣氛很歡樂!!
 Amber Lee ,https://www.google.com/maps/contrib/103449737426102250972/reviews?hl=zh-TW,5,True,110,"氣氛好
服務生態度也很好
肉的品質也很穩定
是一個會令人開心吃飯的餐廳"
 白幽靈 ,https://www.google.com/maps/contrib/109768224576382042171/reviews?hl=zh-TW,5,True,12,"店員都很能聊，很好相處，餐點也好吃👍👍👍
給Nick武聖美心還有其他人100分🥰🥰🥰"
 O Jim ,https://www.google.com/maps/contrib/110223194543746301772/reviews?hl=zh-TW,5,True,623,"知名燒肉店乾杯的台北總店，於平日午間前往進行用餐，整體而言氛圍非常不錯，由於中午時間人潮較少，店員可以給予最直接的關注以及服務。
午間套餐超級划算，自己是選擇了雙牛五花套餐M的來進行用餐，牛五花的口感非常入口即化，搭配上附贈的醬料以及青蔥，讓整體的油膩感下降，更凸顯了肉類的美味。套餐加選的奶油菇以及焗烤馬鈴薯都令人覺得值回票價，兩者奶味都十分充足，卻又不會讓人有很容易味覺疲乏的感覺，很值得。
很建議中午時段來食用，但由於當日中午時段缺乏海鮮加購套餐，會影響下次是否在中午時段前往的意願。"
 Cindy ,https://www.google.com/maps/contrib/103323897347546200072/reviews?hl=zh-TW,5,True,254,品質和服務都一直保持很優良的店家，肉品每道都很好吃，唯獨燒烤店難免牆壁會有油漬，如果可以定期清理，會避免蚊蟲出現。
 Lee Mandy ,https://www.google.com/maps/contrib/116774255239057181052/reviews?hl=zh-TW,5,True,994,"💰餐點：
-上等牛五花切盤$599
-博多風鐵板炒拉麵$160
-和牛摩滋鍋（香純白味噌）$280
-乾杯角切$220（壽星禮）
-十六茶$50
⚠️注意事項：當月壽星贈送燒肉蛋糕或松阪豬
——————————————————————————-
每天八點乾杯送你一杯🍺當月壽星還贈送美味的乾杯角切！

上等牛五花切盤：拼盤內有上等牛五花、台灣豬五花與奶油雞腿肉，還會附上醬香濃郁的醬油奶油。牛五花油花如雪花般，快速烤一下那入口的多汁，記得跟服務生要辣椒醬更夠味🌶️

乾杯角切：喜歡有嚼勁、肉感的，會愛角切，搭配鹹香海味的鹽昆布！

博多風鐵板炒拉麵：日本博多屋台特色料理，到日本旅遊的時候，一定要在深夜食堂點炒拉麵、牛舌跟啤酒🍻半熟蛋非常畫龍點睛！

晚上的乾杯氣氛真的High到不行，20:00快到的時候，服務生會發鼓掌小手拍、還會問大家是來慶祝什麼，一起乾杯更是超過癮！"
 levi811204 ,https://www.google.com/maps/contrib/114561522568250408436/reviews?hl=zh-TW,5,True,393,"猜中牛排🥩幾克免費，還滿好玩的
直接命中！
牛舌非常脆又多汁
牛肉類都很推薦。"
 湘 ,https://www.google.com/maps/contrib/113120077725039212815/reviews?hl=zh-TW,3,True,108,"📍乾杯燒肉便當

✔️11號梅花豬+雞腿肉+100肉量加倍360元

整體來說偏貴，但肉真的好吃！
雞腿肉很嫩，梅花豬也很嫩：）
對女生來說剛好，男生需要加飯

凱若下班後🐼@carol_offduty_"
 Caitlyn Yang ,https://www.google.com/maps/contrib/105362532645285954395/reviews?hl=zh-TW,5,True,111,"2022/2/13每一位服務生的態度都非常好！
（煮湯那一區吧台的、結帳的、帶位的服務生都很好！）

非常好吃桌邊的服務生也會時時刻刻注意客人的情形
即時幫忙換烤網、
或是看到客人有狀況就會幫忙烤一些肉做示範

價格說真的也沒有說特別貴
就可以吃得很飽

總之光是熱情的服務態度就給人很好的印象
很有日本居酒屋的感覺與氣氛
一定會再訪💕💕❤️"
 lawrence lee ,https://www.google.com/maps/contrib/101922604967357675476/reviews?hl=zh-TW,5,True,119,"創業於1999年的乾杯本店,喜肉者一定要來,店內氣氛也活潑"
 Shih Wen Feng ,https://www.google.com/maps/contrib/102160914779019197387/reviews?hl=zh-TW,4,True,263,好久沒光顧乾杯，疫情期間，選擇便当外帶，肉質穩定，熟悉的味道，搭配的辣醬及蔥花實在太棒
 劉國良 ,https://www.google.com/maps/contrib/104211001580240215267/reviews?hl=zh-TW,5,True,35,"第一次在這用餐,感受非常特別和放鬆。不想多說,想知道…去一趟就知道!"
 Wendy W (Wooglelocalguide) ,https://www.google.com/maps/contrib/101817097303403201691/reviews?hl=zh-TW,5,True,221,東西很好吃，午間套餐不貴，肉質都很不錯，蠻推薦莎朗芯牛排真的好吃，加上88元套餐可以吃很飽，地瓜洋芋起司燒是馬鈴薯和地瓜的組合，很飽😂
 Jason Lee ,https://www.google.com/maps/contrib/106001594346961569350/reviews?hl=zh-TW,5,False,4,"第一次吃乾杯順便慶祝老婆生日
店員有離職失戀的
我們和員工領班一直喝酒
副店也一直招呼我們

第一次覺得餐飲店有這麼濃厚的情誼所屬難得
這次消費所費不貲但這種用餐環境氛微
絕對會讓人想再吃爆！

第一間有店家讓我想主動使用google評分的！！
推"
 vivian c ,https://www.google.com/maps/contrib/111512941798948254066/reviews?hl=zh-TW,5,True,410,"店員顏值有挑過嗎很多帥哥美女耶🥰
店員都很熱情會來關注不會烤的幫烤跟教烤
但看得出來都太忙了😅
點了一些店員推推：厚切牛舌、澳洲和牛頂級橫隔膜、澳洲和牛上等牛五花
還有玩和牛猜猜看猜中正負5g免費🆓
沒猜中100g$299蠻划算的
今天差2g就中了🥲🥲🥲沒有免費的命
不過肉都還是很好吃
來吃牛🐮就對了可以配一點小菜😋
然後柚子角要記得攪拌啊！！！
不然跟我一樣上面喝起來沒味道🥲喝到下面才變好喝"
 Chris Chen ,https://www.google.com/maps/contrib/109071729985387766517/reviews?hl=zh-TW,5,True,320,經典的厚切牛舌、頂級橫隔膜很嫩，啤酒推薦half黑生啤、比較不會脹氣很順口，不喝啤酒的話，原味角high也很順口，另外鮭魚茶漬飯、焗烤起士蕃茄牛肚頗好吃，青菜部分可以點鯷魚蒜香小黃瓜很清爽，是個下班小酌聊天聚餐的好去處
 顏子群 ,https://www.google.com/maps/contrib/106073029648162373400/reviews?hl=zh-TW,2,True,173,東西真的不錯吃服務也都很好只是最後真的滿傻眼的今天消費3696想說再加點一些湊滿4千可以有乾杯振興卷活動買單的這位人員跟我說時間到了如果加點生啤酒要自己去對面公園喝這間不是居酒屋嗎？當下只是覺得傻眼⋯⋯店內空座位還有不少又不是吃到飽的店也沒有客滿怎麼會限制時間呢？就算時間到不能再點也不用說叫我買了去對面公園喝吧真的滿傻眼的之前都是去敦南店吃也沒有限制時間第一次到本店吃應該也是最後一次吧
 陳安安 ,https://www.google.com/maps/contrib/100388582041607432306/reviews?hl=zh-TW,5,True,353,"座落在東區最熱鬧最繁華的地帶下班後想大口吃肉、痛快乾杯就趕快來乾杯

美味的燒肉搭上清涼暢快的啤酒，總是讓人一試難忘！

喜歡這種略為擁擠的感覺吃完以後再到門口的公園散步很舒服"
 蕭貴 ,https://www.google.com/maps/contrib/106500957772316770939/reviews?hl=zh-TW,3,False,10,"點餐很雷
白飯跟生菜可以先上
吃快完才上⋯^_^
店員知道後有道歉跟打折（補一顆星）"
 楊淳 ,https://www.google.com/maps/contrib/105204335955071725109/reviews?hl=zh-TW,5,True,192,因為公司聚餐才來吃的烤肉，店員很熱情氣氛熱絡，肉質與食材非常滿意，尤其喜歡吃蝦跟柳葉魚👍
 Crisx D ,https://www.google.com/maps/contrib/106392837487739328138/reviews?hl=zh-TW,4,True,45,"外送：「澳洲和牛上等牛五花&西班牙伊比利豬梅花」價錢490元
便當送來的時候有點冷掉了，此便當的白飯是好吃的，然後肉的部分幾乎跟官網看到的是一樣、也是好吃的，還有付湯、湯的部分不像那種免費或很水的。

整體來說這種便當只會試吃一次的，如果這價格牛肉可以再多4塊應該會更好然後我個人是沒吃飽😂"
 Jessie ,https://www.google.com/maps/contrib/106877997435390674880/reviews?hl=zh-TW,1,False,13,"吃過很多家乾杯
但沒吃過乾杯本店
吃完後覺得這家是品質最不好的一家乾杯
肉的份量和油花和別家比起來差很多
整體來說蠻失望的
建議如果想吃乾杯的話還是去別家"
 Michelle Huang ,https://www.google.com/maps/contrib/108372079681014718756/reviews?hl=zh-TW,4,True,457,"來乾杯專門吃牛肉，其他肉類一律略過。

此次，我們最喜歡的是貴的角切與橫膈膜，前者稍微嚼勁、後者鮮嫩多汁。
厚切牛舌>薄切牛舌：厚切真的很脆嫩，相形薄切就被比下去了。
Geta牛五花：之前去別間分店店員代烤的比較好吃。
牛排：此次最失敗的就是牛排！之前都沒點過，一吃就覺得膩！比其他部位都柴。

題外話，五點半左右就來，覺得廁所垃圾應該先收拾一下。"
 Vivian Fang ,https://www.google.com/maps/contrib/110840099388176437374/reviews?hl=zh-TW,5,True,27,肉品十分新鮮，和牛的口感Q彈、油脂分布均勻，堪稱人間美味！店員服務態度滿分💯，親切的詢問顧客需求，給予最中肯的建議，食材也令人驚豔！雖然烹調時間稍長，但等待是值得的！非常適合家族聚會，有置身居酒屋的錯覺^_^
 Cherry Chang ,https://www.google.com/maps/contrib/107658892197282815027/reviews?hl=zh-TW,2,False,2,"不是第一次吃乾杯了，但是第一次吃這間”本店”。點了牛排由服務人員代烤，烤完之後店員說要放涼再來剪，結果放到牛排都冷了才來協助剪，（看其他桌服務人員在剪的時候牛排都還冒著煙），一入口就是滿嘴的焦味，勉強混了白飯和生菜才能掩蓋，重點是明明點了五分熟，整個肉質硬，根本無法咀嚼，只能用吞的才能下肚，根本朋友都擔心自己會被肉噎死。服務人員有詢問我們今天的餐點，我也告知了，他也只回覆我好，然後人就不見了？！真的不知道詢問的意義為何？本來很喜歡吃乾杯，但吃完這間之後對乾杯非常的失望。

服務人員都很熱情招呼，但希望能站起來的時候在喊，不要在客人的耳邊大喊"
 㳺逸君 ,https://www.google.com/maps/contrib/105812065959499127483/reviews?hl=zh-TW,5,True,40,好吃，氣氛佳，適合三五好友聊天吃飯的好地方
 Kevin Chuang ,https://www.google.com/maps/contrib/107609035759600678755/reviews?hl=zh-TW,5,True,79,"週末結束工作後，與同事相約聚餐
於訂位時間前十分鐘提早抵達，接待服務人員也非常熱情地招呼，並快速準時地為我們安排了用餐座位
餐點部分最印象深刻的是炸墨西哥辣椒，無疑是下酒菜的首選，微辣帶鹹的味道，很適合口味較重的人享用
厚切牛舌入口即化，也足夠厚實，對得起價格
橫隔膜是乾杯必點，配上檸檬汁沾醬搭配，風味更上一層樓，真的意猶未盡
服務人員態度親切，桌邊服務也是專業且面面俱到
整個晚上搭配生啤酒與角嗨，有肉有酒又有好的服務，度過了非常愉快的夜晚"
 Isabella ,https://www.google.com/maps/contrib/110913131765703145755/reviews?hl=zh-TW,5,True,496,"非常好吃😋很推薦
提前訂餐再去拿就不用等很久喔！
很用心的一家燒烤店
外帶自取折$50很值得👍"
 陳姵 ,https://www.google.com/maps/contrib/110658733626231187495/reviews?hl=zh-TW,4,True,158,氣氛很不錯，還有專人服務～
 巴一 ,https://www.google.com/maps/contrib/100096223994809664139/reviews?hl=zh-TW,5,True,836,"氣氛歡樂，肉質不錯
服務人員態度親切，桌邊服務也是專業且面面俱到"
 陳思穎 ,https://www.google.com/maps/contrib/115106748826605231334/reviews?hl=zh-TW,1,False,20,"不得不說…非常不推薦來本店…

上菜非常非常慢，用餐時間一小時半，店員來詢問最後加點的時後，時間才過不到一小時…肉也只上了三到四盤..一大半肉都還沒上來就要我們最後加點…？
其他的肉盤甚至是在最後30分鐘內瘋狂上菜，其餘的時間都在燒空氣。

店員烤澳洲和牛時卻烤焦了大部分，也沒有任何致歉的意思..？我花了八九百多塊吃了燒焦的肉，各位千萬不要浪費錢點玩遊戲的和牛。

整體下來感到十分不愉快，而且店內沒有很多人…

如果要來吃乾杯，我推薦去中山店…
之前在中山店都吃的非常愉快，即使店內的員工都非常忙碌。

絕對不會再訪乾杯本店。"
 Yc Jai ,https://www.google.com/maps/contrib/102372318840561403088/reviews?hl=zh-TW,1,False,1,"來到台灣，昨天第一次吃乾杯，乾杯原本給我的印象一直是氣氛很好、食物美味，適合跟朋友聚會聊天的地方，但經過昨天的用餐體驗，只能說對乾杯東區店非常失望。

昨天一坐下來就是一位名叫安迪的店員為我們服務，當時大概是晚上七點半左右，一坐下來就催促我們點餐，我們點完之後原本想不夠之後再加點，但這位店員一直強調我們的用餐時間只有一個半小時，讓我們覺得時間很趕，好像再不點就沒辦法吃了一樣，最後也再問我們要不要再加點，聲稱再不點就不能再點了，然後就把單子印了出來（當時才用餐不到一個小時，比我們早來的客人也沒有單子）

整餐飯我們都很趕，好像在跟時間賽跑，可是整個餐廳只有我們這一桌在催在趕，其他客人都是很chill的吃東西，然後我們也看到有客人在加點，於是我們就問另一位店員現在能不能再加點，店員表示雖然有些肉沒有了，但其實還是可以加點的。

這就導致我們很好奇，到底為什麼那位名叫安迪的店員要一直催促我們用餐，食物很好吃，但最後整個用餐體驗都很糟糕，希望貴店能夠好好審視內部員工的服務方式，以免為其他客人帶來不好的用餐體驗，也影響了乾杯的風評。"
 roseline Gao ,https://www.google.com/maps/contrib/114774133482482387941/reviews?hl=zh-TW,2,False,6,"已經來了很多次，其實之前服務都ok,肉質很不錯，這次肉質也不錯，但加入會員送的肉感覺很不新鮮，不如不要送，另外就是服務了，大部分都不錯，但是有一位負責我們這區域工作人員，胖胖戴眼鏡，制服看起來滿髒的，要點餐不點餐，好像還有點耳背，後面加點的他也忘記，態度冷淡，反而都是客人跟他說謝謝不好意思。如果心情不爽就不要來需要歡樂氣氛的地方工作。"
 Yun Chien Cheng ,https://www.google.com/maps/contrib/100385516505935163184/reviews?hl=zh-TW,5,False,14,"沒猜到牛肉～～～～哭
但整體體驗很不錯
推薦厚切牛舌
服務讚👍"
 Wei ,https://www.google.com/maps/contrib/115421013198753754681/reviews?hl=zh-TW,5,True,26,這間乾杯🍻服務態度真的極好的👍從一進門就感受的到每位員工的熱情❤️‍🔥，當天服務的有四位員工吧！每一位真的都讓我很震驚，像對待朋友一樣，那種感受真的很好，還有店裡會炒熱氣氛有各種活動，當天是去幫朋友慶生的，那種氛圍真的是太好了！肉也好吃😋真的值得再去的一間店
 Claire ,https://www.google.com/maps/contrib/116200006793430989193/reviews?hl=zh-TW,1,False,120,"套餐牛排遜到爆炸
配上店員不太會烤
乾柴到極致
單點靠自己比較好

店員非常兩光
會說好輸入平板但什麼東西都沒來
不知道當時按來按去在幹嘛
然後帳單一定要檢查
會打錯造成自己的損失"
 ChiaYu Chen ,https://www.google.com/maps/contrib/114479880557323167028/reviews?hl=zh-TW,5,True,39,"乾杯便當🍱@230自取
有十足炭火燒肉味解了想吃烤肉的慾望，此次選擇-牛五花+雞腿肉，與表定時間些許差距，但吃了後可以接受一點的遲到，而配菜為涼拌胡麻秋葵與韓式泡菜讓燒肉不覺油膩，五花肉稍帶筋肉質還行，雞腿肉無特別，搭配提供鹽蔥一起享用美味，採用越光米讓此便當更加分囉！"
 Linda Kuo ,https://www.google.com/maps/contrib/102566696392412361337/reviews?hl=zh-TW,5,False,2,"今天帶家人在乾杯本店用餐，吃完覺得非常幸福！還有帥哥協助我們，態度非常好、有禮貌！

如果化妝室能更新會更吸引人喔！"
 Pin. ,https://www.google.com/maps/contrib/112609993177068629852/reviews?hl=zh-TW,4,True,860,"忠孝復興敦化附近。
氣氛非常好很嗨很開心，感染力十足的好地方！
服務人員都超親切的。
店裡活動相當有趣。
切牛排猜重量、生日燒肉蛋糕、入會禮、親親十秒送豬肋條、八點舉杯慶祝買一送一酒/飲料。
肉類都好好吃+厚牛舌+焗烤地瓜洋芋泥
+菜類也都很清甜+角嗨+生啤酒🍻"
 yufan chen ,https://www.google.com/maps/contrib/115185038512915881266/reviews?hl=zh-TW,3,True,28,距離上一次吃乾杯大約是一年多前了，一直都是吃中山店的，在中山店的印象非常好，這次第一次來本店，不曉得是太久沒吃還是怎麼回事，覺得肉變的很一般⋯整餐吃下來毫無半道有記憶點😅但不變的共同點是乾杯店員還是很親切！
 李婉菁 ,https://www.google.com/maps/contrib/103452617409342365885/reviews?hl=zh-TW,5,True,26,"第一次吃乾杯今天是為了慶祝生日！
中午時段店內人比較少，用餐環境很好
餐點很優秀吃了覺得很幸福😽🤍
想謝謝店內的員工大家辛苦了
也特別謝謝好可愛的波波
上班辛苦了推推有機會會再去吃看看推薦的菜色！"
 一二三三月 ,https://www.google.com/maps/contrib/102890936313111819685/reviews?hl=zh-TW,5,True,350,"乾杯系列中較為活潑的店
店內有眾多活動適合一群朋友或情侶一起聚餐
活動包含
8點乾杯（晚間8點前喝完飲料或酒即可免費續杯）
親嘴即贈一份肉會幫忙拍一張拍利得貼在店內牆上（自己找位置其中有許多人貼在莫名其妙的位置上🤣）
一段時間後會寄回來給自己
且在親嘴的瞬間整間店的氣氛會很High受盡各種鎂光燈視線🤣🤣
生日壽星贈送肉肉生日蛋糕
猜猜看牛排多重猜對就送該塊牛肉

而在晚上八點時店家會暫時手邊的工作開始跑各種活動流程
很像以前大學在辦活動一樣很有趣

肉質算是不錯因為都是單點原以為會花費許多錢
結果結帳時兩人皆吃得很飽卻也才花了2-3000元
值得！推薦生日去享受一下💛

此外起司地瓜很好吃😍但團子不行🤣🤣"
 Piper Hsiao ,https://www.google.com/maps/contrib/103386727316929184809/reviews?hl=zh-TW,3,False,16,"食物好吃，店內氛圍很歡樂，雖然整體環境吵雜聽不太到服務人員跟友人說話，但不減用餐興致。
可惜用餐時間只有90分鐘，以燒烤來說時間太短了，吃得很趕。"
 林敬弘 ,https://www.google.com/maps/contrib/114989628070792711258/reviews?hl=zh-TW,2,False,10,這種天氣在店裡用餐，冷氣不冷吃得滿頭大汗，雖然東西還不錯吃，也有其他客人也一樣多次跟服務人員反應都說會改善，但是完全沒有改善，這種天氣冷氣不冷那跟吃路邊攤有什麼兩樣，這麼大品牌的餐廳居然沒有應對政策，冷氣不冷難道只是一天的事嗎…
 Rick ,https://www.google.com/maps/contrib/111395753657388202470/reviews?hl=zh-TW,5,True,67,"東西沒話說，食材跟炸物真的五星好吃
但是如果你不喜歡用餐環境吵的人真的不建議！
店員認真有熱情，丹田有力🔊🔊🔊
這可能就是他們特色"
 人哪 ,https://www.google.com/maps/contrib/107636824985489048597/reviews?hl=zh-TW,5,True,602,很會帶活動的乾杯本店，接吻十秒送肉盤，完全不會讓人尷尬，好喜歡店裡的氛圍。最推厚切牛舌。壽星優惠贈送骰子牛。
