user_name,user_profile_url,rating,local_guide,comment_num,comment_text
 Mindy_Lai ,https://www.google.com/maps/contrib/116784149829330592284/reviews?hl=zh-TW,5,True,22,"肉很好吃😋，整體的氛圍非常棒！
服務人員非常親切（尤其是小樹！👍👍👍），我們過的非常開心🥳
很適合慶祝活動的地方
下次一定會再來"
 Todd Li ,https://www.google.com/maps/contrib/115168216666210776532/reviews?hl=zh-TW,1,True,112,"進店時店員們的口號很有力！可惜後續發生的插曲，讓這餐很不開心。

點了單人套餐兩份，再加點了一些東西。看上套餐也是因為有咖哩跟白飯可以搭配，覺得應該會不錯。限時90分鐘這事先有說明了我可以接受，進店45分鐘後，第一次跟店員詢問飯來了沒，回應說快好了。再過20分鐘，問第二次得到的答案是再5分鐘。再過15分鐘，我們問了第三次，答案是「我問看看。」

進店時間80分鐘的時候，領班不好意思的過來問我們要把套餐附的咖哩跟白飯更換成什麼？並且幫我們把單點的白飯跟茶泡飯取消掉。在用餐時間情急的情形下，勉強點了一個價位相近的東西。餐上來之後，味道也不是很滿意，畢竟要取代原本套餐內附餐價位的內容，選項真的很有限。

我相信貴店廚房的飯應該是出了什麼狀況，比較好的作法應該是提早跟客人說，在用餐時間還來得及的時候，讓客人改變選項，原本想增添飽足感的飯，到最後10分鐘才告知客人沒有了。整個感受就超差....

沒吃飽，真的會一肚子氣，送上一星精美評論。"
 王仕偉 ,https://www.google.com/maps/contrib/111159891440376391807/reviews?hl=zh-TW,5,True,67,防疫期間用餐，由店家烤好上桌，還是要由專業的來，以免烤差了浪費肉的品質
 Avon Teng ,https://www.google.com/maps/contrib/112509545123392177033/reviews?hl=zh-TW,5,True,167,"疫情期間乾杯的外帶餐盒
牛舌與五花肉，價位雖不低，但冷掉也好吃，超級推薦。值得一試！"
 Shanti Lee ,https://www.google.com/maps/contrib/113216433406044461041/reviews?hl=zh-TW,5,True,54,服務很好，肉質有一定水準，搭配生菜芝麻葉蒜片……可以當韓式烤肉吃，非常解膩。氣氛歡樂自在，和親友來此大塊吃肉，大口喝酒，很是痛快！
 TAN YU WU (Claudia Wu) ,https://www.google.com/maps/contrib/113994564056986252371/reviews?hl=zh-TW,1,False,14,"現在人就在店裡。
(1)套餐的沙拉沒有了，不提前跟客人說，等菜上到一半才說沒有，用多一份泡菜補。事實上在吿知沙拉沒有之前，泡菜來了兩大份，表示店家早就知道沙拉沒有了，但等菜上到一半才說
(2)燒烤吃完，但等熟食(咖哩飯、干貝、辣煮牛筋、甜點)等超過27分鐘，從13:15等到現在13:43都還沒來，已經空等27分鐘，中間服務人員不聞不問，把我們這桌晾在這，說人比較多熟食現做會慢一點，事實上店內客人才六成，而且熟食通常都是先備好的，這實在很難說服我們

簡而言之，服務態度糟、上菜慢得太誇張，我們不會再來消費了！！！"
 Jyun Syu ,https://www.google.com/maps/contrib/102649452594915154453/reviews?hl=zh-TW,5,True,41,第一次來本店吃，店內的氣氛蠻歡樂的，東西也好吃，價位剛剛好，蠻推薦三五好友一起來吃🙌
 niki lai ,https://www.google.com/maps/contrib/104416040900067918361/reviews?hl=zh-TW,5,True,96,"跟你身邊的人親親吻10秒以上送一碟豬或牛肉，這慨念也很好。
裡面的職員都是工讀生，人好好也很熱情。不像另一間沒禮貌也黑面⋯
晚上9點飲料買一送一"
 林至威 Eno ,https://www.google.com/maps/contrib/103499051409349971967/reviews?hl=zh-TW,4,True,39,"炭香味很夠，豬肋條很有汁～唯一可惜比較冷！
期待疫情後可以到店內好好享受燒肉"
 julypomme ,https://www.google.com/maps/contrib/118026148168978998325/reviews?hl=zh-TW,5,False,14,"服務很好～同行有嬰兒車有預先安排了嬰兒車可以放的位置
點餐時也會給建議什麼推薦什麼好吃～什麼適合先吃～整體下來服務很滿意
猜牛排活動很難很難🤣🤣🤣猜了兩片都差好多不過牛排本身還算好吃
晚上八點會有乾杯活動幾乎跟每桌客人都有活動真的整間店都很熱鬧！
不過也因為整場都太熱鬧，如果是認真要聊天的人可能不大適合，這點就看人囉！

友人的嬰兒很可愛，店員想互動也會有禮貌的詢問可不可以抱👍

食物部份整體都滿好吃的，很推薦厚片牛舌，口感很棒～白飯也好吃，牛肉部份覺得表現的還ok（也可能是我們烤功不夠🤣）

整體值得再訪～"
 punch man one ,https://www.google.com/maps/contrib/110822193550947028943/reviews?hl=zh-TW,2,True,128,用餐過程沒被關心過半次換烤網，肉上的速度也偏慢，很多時候空著桌等肉、等換網、等等等，乾杯已經是適合高中生吃的燒肉店了，用餐品質有待加強，肉貴又少，泡菜也不值得一點，最後一訪
 Anthony Huang ,https://www.google.com/maps/contrib/117384288449153417908/reviews?hl=zh-TW,5,True,829,和日本的燒肉居酒屋比起來，少了很重的煙燻味，很棒;)
 翁鉫復 ,https://www.google.com/maps/contrib/100795082634963510828/reviews?hl=zh-TW,4,True,386,氣氛很好店員會帶活動但是吃飽要好貴
 Samantha Lee ,https://www.google.com/maps/contrib/118306819750422677202/reviews?hl=zh-TW,5,True,261,"不管是肉的品質熱烈的氣氛都完全沒話說
吃飯時同聚一堂的所有認識與不認識的人好像都成為一家人一起吃飯
各式各樣的活動真的很有趣"
 逆天 ,https://www.google.com/maps/contrib/108533976479684582136/reviews?hl=zh-TW,5,True,162,好地方還會再來！食材新鮮服務好好吃好喝親吻十秒送肉。還有大家一起乾杯的活動喜歡熱鬧可以來！
 Virginie Lin ,https://www.google.com/maps/contrib/105106409183691660565/reviews?hl=zh-TW,5,True,59,肉質鮮嫩，服務貼心，店員人超好，氣氛熱鬧，聚餐超推。
 Emily Chang ,https://www.google.com/maps/contrib/115270384645677700704/reviews?hl=zh-TW,5,True,386,第一次吃乾杯，東西好吃，餐廳營造的氣分非常熱鬧，很適合來這裡慶祝唷👍🏻👍🏻👍🏻
 Ariel 林慧君 ,https://www.google.com/maps/contrib/107622425562226147554/reviews?hl=zh-TW,5,True,177,第一次來乾杯🍻服務讓我shock了一下，每位店員都非常有朝氣的跟你打招呼，大樹的服務超棒還幫忙燒烤，記得我不吃牛肉貼心提醒，很值得來吃喔！還有更特別的是，只要親親就送一盤豬肉！超划算！
 Chiahsun ,https://www.google.com/maps/contrib/107789592870327883648/reviews?hl=zh-TW,5,False,15,"店員服務態度都超好的而且人也很nice～
價格偏貴～但肉質新鮮、鮮嫩多汁，算合理。
餐點及飲料的部分都很優哦^_^
下次有機會可以再來。大推～
適合朋友聚餐的最佳地點❤️❤️❤️"
 Riley ,https://www.google.com/maps/contrib/112807177318592627964/reviews?hl=zh-TW,4,True,31,"這是為了換優惠而發的評論

但是必須說這裡的價格沒有很便宜
亮晶晶白飯一碗就要60塊
尤其是當一群大學生來這邊當吃到飽在吃
要顧慮荷包的朋友們要注意一下了

店內的裝潢啊還滿舒適的，整體的氛圍也很不錯，服務人員的訓練感覺挺紮實的，待人很好，也會辦很多活動，讓互不認識的客人們有一些簡單的互動，也會問每桌的客人們今天來用餐是不是要慶祝什麼，然後活動時間就會分享每桌要慶祝的事，大家一起鼓掌一起嗨，創造出的氣氛真的是挺棒的
不過整體而言是好吃的
然後猜重量換肉真的是不好猜
完全沒猜中"
 Yu Chia Tseng ,https://www.google.com/maps/contrib/109564275769826342922/reviews?hl=zh-TW,3,True,16,用餐1.5小時太短了，氛圍不錯但是用餐時間離譜的短，我們最後幾乎是用吞的吃完
 Marco Wang ,https://www.google.com/maps/contrib/109064624467377148681/reviews?hl=zh-TW,2,True,128,過度及不夠細緻的服務使人用餐略感壓力，價位愈來愈高也使這家餐廳整體CP值下降。
 謝部 ,https://www.google.com/maps/contrib/105644226477233849378/reviews?hl=zh-TW,5,True,23,"自從吃過日本燒烤後朋友說嘴就被養刁了
一直覺得沒有什麼燒烤店好吃
朋友一直推薦吃乾杯
但一直沒有去
第一次吃乾杯來這本店
氣氛非常好很歡樂
牛肉品質真的好
桌邊服務也是超棒
真的很推薦
幫我們服務的是位美女～LARA
我覺得很像解婕翎🤩🤩🤩"
 S Hu ,https://www.google.com/maps/contrib/101651117713171366324/reviews?hl=zh-TW,4,True,225,很久沒來了，氛圍還是一樣熱情，熱鬧!食材還是一樣的吸引著我!
 kXc ,https://www.google.com/maps/contrib/101720615600344350844/reviews?hl=zh-TW,5,True,423,超好味道，肉質好，要預訂，有限時，下次一定會再去！
 Li Chi ,https://www.google.com/maps/contrib/113610578615178398339/reviews?hl=zh-TW,5,True,132,差點就猜中免費牛排了😅
 Kaikai ,https://www.google.com/maps/contrib/101205229777878668720/reviews?hl=zh-TW,4,True,99,"外帶便當好吃，牛肉很嫩，
只是配菜太單調，
吃到後面有點膩。"
 Johnny Liu ,https://www.google.com/maps/contrib/105722740445917421374/reviews?hl=zh-TW,4,True,963,"肉品質量沒話說
歡樂氣氛沒話說
一直開心到結帳的時候
我就說不出話了⋯⋯"
 B A ,https://www.google.com/maps/contrib/100840434236730090823/reviews?hl=zh-TW,4,True,83,三個人吃了三千多，服務不錯，肉感覺較一般。
 吳承恩 ,https://www.google.com/maps/contrib/102963351751035003602/reviews?hl=zh-TW,5,True,47,肉的品質不到非常好，但是還算是水準以上。店裡氣氛很好，店員也很有活力。生日會再送一份肉蛋糕。
 潘浩柜 ,https://www.google.com/maps/contrib/115831084567564822510/reviews?hl=zh-TW,5,True,95,"價格合理，
食材亦是新鮮，
牛舌更是必點，
服務人員訓練有素！
能與客人互動參與店內活動，
會讓人想起大學生活，
店裏氣氛熱絡，
適合跟重要的人，
或是朋友在紀念日，
特來用餐留下珍貴回憶，
沾醬部分有萊姆汁也是別出心裁，
有時吃五花肉太多油脂，
搭配醬汁剛好解膩，
才不影響下一分每位入口！"
 Vincent Tseng ,https://www.google.com/maps/contrib/115441245053267662535/reviews?hl=zh-TW,5,True,166,燈光美氣氛佳食物好吃音樂好聽，一定會再訪👍🏻
 Chien-Ming Chen ,https://www.google.com/maps/contrib/118263367419032818046/reviews?hl=zh-TW,5,True,141,雖然不便宜但真的好吃沒話說也很有放鬆的fu且人員還會提供貼心燒烤服務十秒親親送肉盤著實令人害羞但超high的
 Lennie Tsai ,https://www.google.com/maps/contrib/110496052230844600901/reviews?hl=zh-TW,5,True,45,"店內空間小了點走路有點不方便，但是氣氛很好，很熱鬧，店員都很逗趣😂😂來過生日很開心。
晚上8點有送飲料喲😁😆"
 _Erin에린 ,https://www.google.com/maps/contrib/102263783600246776969/reviews?hl=zh-TW,5,False,12,服務用心，東西好吃！店員都很親切～～
 SMART BEN ,https://www.google.com/maps/contrib/103731893312838969498/reviews?hl=zh-TW,1,False,14,上餐點速度極慢，而且每份餐點上的落東落西的，都要不斷提醒什麼沒上，不然你就會被遺落在角落，很多基本東西都會跟你說賣完了😂😂，只要高單價的東西都還有，你要點什麼店員還會下指導棋要你點些你不會想點的東西（應該是滯銷的商品😂），開店要賺錢沒錯，但手法實在是粗糙到不行😂😂我是真的非常認真的在店內一邊用餐ㄧ邊打這篇文，奉勸要預約或要來吃的人真的真的要三思，真心不誇大⋯附上ㄧ張肉品的照片，實在勘憂⋯⋯
 Cristóbal Joshua Lin ,https://www.google.com/maps/contrib/109532548984714427506/reviews?hl=zh-TW,5,True,15,"太讓人喜歡的一間店，一不小心就變粉絲了。

優秀的食物，優秀的服務人員，最好的氣氛！"
 Momo Ma ,https://www.google.com/maps/contrib/109614866450803016351/reviews?hl=zh-TW,5,True,103,來過兩次，食材質量很高，肉很好吃。服務態度一流，氣氛很棒。CP值很高。
 Thompson Ho ,https://www.google.com/maps/contrib/113935586148471075571/reviews?hl=zh-TW,1,True,169,"有點久遠只記得兩點感受較差原因
1.有個猜牛排重量遊戲,先問我大慨想要多重,回曰220oz,負責的員工先切了一個厚道問我再切多厚我再接其厚道大約薄了一半,最後結果是3xxoz。有被欺騙的感覺。負責員工原切重量肯定不少於500oz那何苦先問我呢。

2.店半空,但安排2人坐正門口高座。後來者都可以正常坐進店內

自問進門時言談極少只說兩位謝謝沒有任何機會有開罪你們的地方。"
 Neo Shih ,https://www.google.com/maps/contrib/112137489264829976172/reviews?hl=zh-TW,5,True,33,"外帶燒肉便當🍱
店員很有活力服務很好
便當和照片一樣～
重點是很～好～吃！"
 Jeffrey Cheng ,https://www.google.com/maps/contrib/116447932736607953142/reviews?hl=zh-TW,4,True,956,服務親切，BMS7~9牛排狀況要看運氣。
 陳霖成 ,https://www.google.com/maps/contrib/106327309089470312101/reviews?hl=zh-TW,4,True,597,第一次買便當，真是厲害的燒肉，值得一吃
 Cheng-Yu Tsai ,https://www.google.com/maps/contrib/101334003800640030871/reviews?hl=zh-TW,5,False,19,祥祥讚爆！整天工作的辛勞都沒了！吃得很開心！
 心乙百心 ,https://www.google.com/maps/contrib/112817524121145684524/reviews?hl=zh-TW,5,True,39,"帶動的氛圍很棒，可以感受到每個職員盡心盡力.

坐吧台/細心的順風耳
吧台小哥都炸忙，還注意我跟朋友聊天對話，
立馬給予意見幫助，讓我跟朋友都很訝異！
像：（它家的）豬肉不用全熟、干貝生食是不錯的選擇、原來小哥跟我們都是水瓶座XD

結帳時/敢說的小哥
問有沒有吃飽，在常見的詢問方式後
：有吃飽，還以為點太少
店家小哥驚訝看明細：喔！你們應該真的很飽！平均消費來說，你們比別人多吃了一千呢！😂

八點活動/
心得：嗯，這裡很適合離職日，慶祝發洩老娘不幹了x2的好地方"
 HsinHung Lin ,https://www.google.com/maps/contrib/108663180295687550055/reviews?hl=zh-TW,5,True,32,大牛排好吃，晚上8點會有活動，但最好可以跟朋友一起來，然後要找個理由
 Tommy Lee ,https://www.google.com/maps/contrib/110089768108326012721/reviews?hl=zh-TW,3,True,94,"1.服務態度充滿活力與熱情5顆星
2.個人實在不會燒烤，烤的難吃或焦黑，真不知要怪自己還是忙碌的服務生3顆星
3.食材酒水平凡3.5顆星
4.隔壁桌玩猜牛排重量，眼尖的我發現年輕服務人員弄出了炭火焦黑牛排…我不忍看下去就離開了…
5.疫情期間不能在座位玩親親立可拍，但服務生很有心的淋著雨幫我們在門口拍照6顆星

追求用餐環境舒適的朋友不建議來
1.很吵因為活力滿滿
2.味道不好餐後衣服頭髮包包都是燒烤味

我年輕不在，不適合這個餐廳了"
 Sean Su ,https://www.google.com/maps/contrib/113279450186843206482/reviews?hl=zh-TW,5,False,6,週末與朋友聚餐，大推服務生美心，人好幽默又風趣，場內人員服務都很棒，會再次來訪。
 Sandy Lien (BIG NOOOBY MUM) ,https://www.google.com/maps/contrib/101380172790405628957/reviews?hl=zh-TW,4,True,873,"服務員很有幹勁，吧台氣氛好
牛肉有不同部位可選，乾杯啦！"
 jojonbagel ,https://www.google.com/maps/contrib/108569652522141125925/reviews?hl=zh-TW,5,True,295,"內用外帶都很好吃～
現在新推出的便當也很不錯
可惜的是便當附的汽水帶回家就沒什麼氣了
其他都很棒
店員態度也很好～"
 林郁玲 ,https://www.google.com/maps/contrib/102507683421929148423/reviews?hl=zh-TW,3,True,264,真心覺得台中的燒肉都贏了😅
 王宇彤 ,https://www.google.com/maps/contrib/103103091670449954215/reviews?hl=zh-TW,4,True,40,"食物很好吃，氣氛很嗨，但小可惜的就是訂9：00最後入座時間卻是9：50，可能當天是情人節人也比較多吧！
門口還有提供酒精消毒，衛生很好"
 Envy Lee ,https://www.google.com/maps/contrib/107883679548813945956/reviews?hl=zh-TW,5,True,516,店內氣氛歡樂，肉質鮮美品質穩定，上菜快服務好
 szuhsun ,https://www.google.com/maps/contrib/114845017398106207520/reviews?hl=zh-TW,5,True,190,"n訪多次
這個價位算蠻穩定的"
 Chi Chen ,https://www.google.com/maps/contrib/102260656146312092065/reviews?hl=zh-TW,5,True,60,肉品好吃，這次是去吃聖誕餐的
 黃嬿羽 ,https://www.google.com/maps/contrib/103105519953429300510/reviews?hl=zh-TW,5,True,10,服務很周到，有很多活動可以玩、很有趣！牛舌跟豬肋條很好吃😋
 魏湘鈴 ,https://www.google.com/maps/contrib/105226942861742360615/reviews?hl=zh-TW,4,True,275,"午間燒肉便當太太太好吃
自取折50蠻划算的
如果配菜能多一點就滿分了"
 Jackson Pan ,https://www.google.com/maps/contrib/118177569116835692135/reviews?hl=zh-TW,1,True,99,"訂位時間還被延後人都到現場了才告知

不鮮豬肉有怪味然後四個有三個人肚子不舒服

最後是價位稍高"
 Henry堡 ,https://www.google.com/maps/contrib/107782891984559505514/reviews?hl=zh-TW,2,False,6,"店員親切熱情！服務周到。
缺點是用餐環境有待加強，在吧台區用餐的客人會被料理的店員濺到醬料，從遠處噴射到餐盤上；另外用餐到一半有米粒大的蟑螂爬到餐盤上，即使一開始有好的氛圍，也壞了一整個用餐體驗。"
 Jackson ,https://www.google.com/maps/contrib/117679942335640375900/reviews?hl=zh-TW,5,True,"1,414",很棒的店！服務員都好親切！尤其是杜杜，阿酷和吐司！食材一流！尤其是澳洲和牛
 小元 ,https://www.google.com/maps/contrib/116251181515154221066/reviews?hl=zh-TW,4,True,615,"牛舌好吃
但烤肉醬的牛肉感覺太鹹"
 Chang-Hsuan Huang ,https://www.google.com/maps/contrib/114573096011245626952/reviews?hl=zh-TW,4,True,828,雖然有午間套餐但份量偏少，加上單點大概一個人要五百左右～～
 JC Tsai ,https://www.google.com/maps/contrib/102522339602457456294/reviews?hl=zh-TW,4,True,125,牛橫隔膜和牛舌必點，角HIGH生啤酒好喝，八點的乾杯活動全場一起乾杯氣氛很棒🍻
 Vinci Lin ,https://www.google.com/maps/contrib/108916375686193553184/reviews?hl=zh-TW,5,True,411,氣氛佳，食材新鮮，服務親切
 Allen Huang ,https://www.google.com/maps/contrib/100727664915706760035/reviews?hl=zh-TW,5,True,427,服務生態度很讚，午餐份量較少。
 張珀瑜 ,https://www.google.com/maps/contrib/103552843158310878149/reviews?hl=zh-TW,5,False,16,店員很親切，氣氛很好很熱鬧。
 Bubble Gum ,https://www.google.com/maps/contrib/110055084232350201883/reviews?hl=zh-TW,5,True,138,朋友聚會，服務員有活力，用餐氛圍很棒，食物美味好吃😋
 Kevin Huang (Kai) ,https://www.google.com/maps/contrib/114211634059594973823/reviews?hl=zh-TW,5,True,44,燒肉種類一直創新店員也都很親切熱情
 吳佳臻 ,https://www.google.com/maps/contrib/103209107928032795617/reviews?hl=zh-TW,4,True,171,"用Ubereat叫的牛五花及牛舌便當，牛舌很好吃👍

雖然價格稍貴，如果想吃還是會再訂一次"
 王佳祺 ,https://www.google.com/maps/contrib/104561573786206448679/reviews?hl=zh-TW,5,True,327,大口吃肉，大口喝酒，就是個聚餐的好地方。
 Jane Chang ,https://www.google.com/maps/contrib/108938174755063996119/reviews?hl=zh-TW,5,True,38,服務品質很好，店員會跟客人玩再一起，重點東西真的很好吃！！！
 Judy Hsu ,https://www.google.com/maps/contrib/114609370760511685637/reviews?hl=zh-TW,1,True,22,"用餐時間限制90分鐘一直提醒然後還晚15分鐘讓我們進場用餐也沒多加那15分鐘⋯
雖然店員態度都蠻好但之後都不會想再去吃了會選擇其他燒肉店！
還有店員一直問要不要加點什麼⋯⋯超煩以為每個人食量都很大是不是一下提醒時間又是加點感覺極差"
 Yixuan Wu ,https://www.google.com/maps/contrib/107853158714986585634/reviews?hl=zh-TW,5,True,90,目前內用是由店員烤好送到桌邊
 EMMA LI ,https://www.google.com/maps/contrib/108987085977285601834/reviews?hl=zh-TW,3,True,148,如果這麼多東西沒有。那應該要帶位前先講。
 柳元 ,https://www.google.com/maps/contrib/102546884071613259610/reviews?hl=zh-TW,5,True,129,非常棒的日式燒肉店，東西好吃氣氛好，算是台灣老牌的日式居酒屋風格燒肉店，後繼很多店在模仿，果然厲害
 邱喬喬 ,https://www.google.com/maps/contrib/114322595970894138399/reviews?hl=zh-TW,1,True,17,"中秋連假，豬肉叫不夠嗎？
這麼肥的肉也出，還說廠商給的不能挑？"
 Tosh ism ,https://www.google.com/maps/contrib/115416425632121437557/reviews?hl=zh-TW,2,True,170,"店員雖然都很有禮貌、友善
但是今天的服務真的不OK
點了套餐
竟然肉全部都烤完了才上白飯、沙拉跟小菜
當下覺得超傻眼
說要拿碗給我們也忘記
真的是很不用心耶
然後音樂不曉得為何要開那麼大聲
客人不吵反而是音樂很吵

食物的品質是不錯
小黃瓜蠻有創意的
但有一道麻辣番茄牛肚真的鹹到爆
覺得可以考慮調整一下"
 許姿婷 ,https://www.google.com/maps/contrib/117625852561410028503/reviews?hl=zh-TW,5,True,26,店員海鷗幽默有趣餐點好吃願意再訪可惜沒喝到味增鍋
 Lilian Chen ,https://www.google.com/maps/contrib/106245951775339566762/reviews?hl=zh-TW,5,True,"1,128",肉質很棒，牛橫膈膜不可思議好吃
 LAI TING HO ,https://www.google.com/maps/contrib/105810685022588093346/reviews?hl=zh-TW,5,False,2,從香港過來乾杯過生日，店員很熱情，東西好吃，過了一個很難忘的生日
 林家芸 ,https://www.google.com/maps/contrib/105932811255064194955/reviews?hl=zh-TW,4,True,69,一進門迎賓氣氛很嗨，8點主持人秀出每位賓客趣事很逗，只是單價算高肉量嫌少，偶而來嗨一次是值得的。
 LIU ,https://www.google.com/maps/contrib/110476942341759816365/reviews?hl=zh-TW,1,False,15,"明明兩個人不太餓店員硬是推了猜肉幾公斤的肉我有說不太餓不敢點因為無法預料到底是幾克店員說可以切200g就好
結果推車來切肉的小姐就問這個厚薄度o不ok
但其實一般的人哪看的出這個厚度是幾克
結果一切就是409g完全跟原本預想的200克數差很多可想而知最後就是吃不完==只是很傻眼一般民眾哪能單憑肉眼就猜的出幾克猜的出來我還會猜錯肉的克數嗎？而且看到2個人店員也不會切小一點是怎樣？"
 Grace Lee ,https://www.google.com/maps/contrib/112010744614551172045/reviews?hl=zh-TW,5,True,280,"店員超級親切的
很適合跟陌生或是新認識的朋友來
雖然比較窄
但氣氛很棒
肉品吃的出新鮮"
 ANNIE HSU ,https://www.google.com/maps/contrib/114398267139789548700/reviews?hl=zh-TW,5,True,60,喜歡店裡的氣氛，服務人員熱情也親切，吃的很開心，特愛牛舌❤️希望下次猜對牛肉克數😄🤭
 Tracy Shiu ,https://www.google.com/maps/contrib/117529302526038376607/reviews?hl=zh-TW,4,True,15,正呀超正，店員親切，會搞氣氛，推介牛橫膈膜
 張晏如 ,https://www.google.com/maps/contrib/112217451550633821937/reviews?hl=zh-TW,5,False,9,"店員長的帥
店裡環境氣氛超級棒👍👍
身為肉食主義的人一定要來"
 Roy Chen ,https://www.google.com/maps/contrib/115355516502723493917/reviews?hl=zh-TW,5,True,253,服務讚，餐點跟環境也優質
 ZY Chen ,https://www.google.com/maps/contrib/109597065508300633856/reviews?hl=zh-TW,3,True,24,氣氛熱鬧店員活潑牛舌好吃😋
 梁中其 ,https://www.google.com/maps/contrib/109327346829229047445/reviews?hl=zh-TW,5,True,97,好吃到太扯了啦，整間店一起嗨太開心了吧
 jason khoo ,https://www.google.com/maps/contrib/102295904870059773742/reviews?hl=zh-TW,5,True,127,"好吃好玩的乾杯
飽餐一頓的好去處"
 山崎邦正（Eric） ,https://www.google.com/maps/contrib/113114493779715117285/reviews?hl=zh-TW,1,False,4,東西好吃但用餐體驗到後半段很差，我們有定位且提前到達，時間到的時候，櫃檯說要再等一下前桌客人還沒走，我們也配合反正我們不趕時間，最後在外面等了快15分鐘才入場，剛開始吃體驗也很好我們4個人也點了7千左右的餐點。但後半段，店員就來很急的來幫忙烤，並告知用餐時間快到了，然後我們就開始吃的非常急迫，而且已經明確告知冰淇淋甜點等考完再上，結果在還有一個拼盤跟一整塊牛排還沒烤，甜點就送上來了，很急著想要你趕快吃完離開，跟店員反應，你們一開始已經讓我們晚進來了，時間都還沒到就在趕，店員才稍微比較收斂，甜點先吃了後面烤的肉都不好吃了，著重用餐感覺的可以不用考慮乾杯了！
