user_name,user_profile_url,rating,local_guide,comment_num,comment_text
 吳曼婷 ,https://www.google.com/maps/contrib/103512062595123903403/reviews?hl=zh-TW,5,False,10,真的很棒！很親切！雖然我不是台北人，但我一定叫所以人去你們店消費💪
 Sunny Kuo ,https://www.google.com/maps/contrib/113607459400199136524/reviews?hl=zh-TW,5,False,5,好久沒吃乾杯過了這麼久還是一樣好吃！
 費娜 ,https://www.google.com/maps/contrib/112531155551039869338/reviews?hl=zh-TW,5,False,1,"肉很好吃，但給到五顆星是因為服務員很帥🤣🤣🤣
他的臥蟬很可愛還很貼心👍
如果我再去一次不會是因為想吃乾杯是想看他的臥蟬"
 侯嘉珊 ,https://www.google.com/maps/contrib/103762350072743224653/reviews?hl=zh-TW,5,False,8,橫膈膜好好吃😋遊戲豐富好玩
 kuan R ,https://www.google.com/maps/contrib/106230994722305881700/reviews?hl=zh-TW,5,True,20,"早有耳聞的乾杯，一直都沒有去吃，這次選擇本店，差點就去錯地方了呢😂
肉新鮮好吃，服務人員也都很熱情，熱情的剛剛好那種，不會覺得不舒服，如果要吃燒肉，我會選乾杯！！！！！"
 Eason ,https://www.google.com/maps/contrib/107237292821395961682/reviews?hl=zh-TW,2,False,139,厚切牛舌用目視份量就跟其他桌不一樣，肉的份量也很少又薄
 戴姿綺 ,https://www.google.com/maps/contrib/107639963808779504696/reviews?hl=zh-TW,5,False,15,"食材新鮮、服務員態度又很好
真的是上班族下班跟朋友一起聚的好地方👍🏻
住在南部的我每上來一次北部就必來乾杯本店用餐👍🏻"
 Li Chieh Chou ,https://www.google.com/maps/contrib/113271089375807065528/reviews?hl=zh-TW,4,True,143,有服務熱忱，食材不錯，價位稍高，但相較數年前，似乎提供的肉品較為高檔些
 葛瑞絲 ,https://www.google.com/maps/contrib/104787452855767996908/reviews?hl=zh-TW,1,False,12,"態度有夠差的已經有先訂位已經有先訂位已經有先訂位！
我態度很好七個人擠在兩人桌的位置（只有一個鍋！）
是有什麼事嗎？

建議下次還是十四個人來吃才可以坐到前面的位置不用擠還好幾個鍋
還有可以先跟店家確認是不是要擠兩人桌再考慮要不要來吃吧！"
 Wei ,https://www.google.com/maps/contrib/114857296417382660234/reviews?hl=zh-TW,1,True,130,店員一問三不知，最後趕人還直接把肉丟到烤盤上也沒問我們。對飲料也不太了解的感覺。吃過很多次乾杯都覺得不錯，但這家本店的服務真的讓我感覺不如吃平價烤肉店。
 城旭遠 ,https://www.google.com/maps/contrib/113479405464229638721/reviews?hl=zh-TW,1,False,9,"週五晚間七點想預約兩位
每間店都說只剩下很晚的時間跟很早的時間
兩位的客人可以不用提前訂位了
因為根本訂不到

台北地區打電話每一間都一樣說法，店員只會說剛好客滿
非常的巧！"
 Hsu Megan ,https://www.google.com/maps/contrib/101263279178751259243/reviews?hl=zh-TW,5,True,64,服務好，食材新鮮
 吳昀珊 ,https://www.google.com/maps/contrib/109667821843826047219/reviews?hl=zh-TW,1,False,7,"Uber外送沒司機還接單
便當放一小時才送
不要訂！！"
 Peter Fong ,https://www.google.com/maps/contrib/118028695619851769565/reviews?hl=zh-TW,5,True,73,乾杯的食材沒話說，更有特色的是裡面有定時玩遊戲，如果是情侶，建議可以過來凹好康，促進一下感情喔！
 HuiCheng Lin ,https://www.google.com/maps/contrib/118305495422442462847/reviews?hl=zh-TW,5,True,32,燒肉前一定要先乾杯、微醺一下
 陳君櫂 ,https://www.google.com/maps/contrib/107657574528020312479/reviews?hl=zh-TW,4,False,11,環境不錯，晚上八點會有活動加送一杯飲料，那桌有人親親還可以送肉盤，不過價格偏高，推薦牛肉，豬肉一般般。
 Joan yu ,https://www.google.com/maps/contrib/116865254511519549795/reviews?hl=zh-TW,5,False,8,"乾杯便當超好吃
肉超嫩👍🏻👍🏻
疫情期間辛苦了，服務超好
外帶回家不會後悔👍🏻👍🏻👍🏻👍🏻"
 朱子揚 ,https://www.google.com/maps/contrib/101479915283676825090/reviews?hl=zh-TW,5,False,2,整體服務人員都很靈敏專業，態度也親切友善，尤其服務我們這桌的伍謙。
 Sophie A ,https://www.google.com/maps/contrib/114291183926415706226/reviews?hl=zh-TW,5,False,1,"今天幫朋友過生日很開心!很嗨\(^o^)/
燒肉超級好吃，猜牛排的活動也很有趣XD
下次再來這裡慶生♪(´▽｀)"
 rosha Pa ,https://www.google.com/maps/contrib/107774487105704591781/reviews?hl=zh-TW,5,False,16,"最喜歡的乾杯連鎖店，目前心中第一名
服務生態度都超好，店裡氣氛很歡樂

八點還有乾杯送飲料活動！
食材很新鮮好吃
超推山藥！！！"
 陳珮琪 ,https://www.google.com/maps/contrib/102980751986833530979/reviews?hl=zh-TW,1,True,165,聖誕節雙人套餐貴又沒東西，還得加成服務費。實在是賺很大，然後用餐時間還沒到就覺得在趕人的樣子。雖第一次來，也是最後一次。
 趙心瑜 ,https://www.google.com/maps/contrib/106879944384559966632/reviews?hl=zh-TW,5,False,28,味道不錯，服務很好
 Axel Chen ,https://www.google.com/maps/contrib/118367896103041176636/reviews?hl=zh-TW,2,False,9,肉還ok，價格不算低。若表達先點這樣，等會再加點，服務生會用近似威脅的語氣說：「這樣點太少吃不夠，等下再加點要等很久」，感覺非常不舒服，我知道這不是該服務生的問題，而是店家的SOP規定如此。若是單純該服務生的問題，以後還有光顧的可能，但是整家店的規定都這樣，所以以後肯定不會再光顧該集團任何一家店了。
 Yumin Chung ,https://www.google.com/maps/contrib/107391092027360100512/reviews?hl=zh-TW,1,True,43,先不論食材好不好吃，一張桌子要硬擠12個人，每個人都肩並肩在吃，烤個肉還會敲到隔壁人的肩膀，這樣賺錢實在讓人不敢恭維，完全不講究顧客的用餐品質，更遑論乾杯的用餐價位隨隨便便也要七八百以上，建議如果要多人聚餐的話請深思。
 Lisa Huang ,https://www.google.com/maps/contrib/111793202298012604528/reviews?hl=zh-TW,5,True,14,肉質美味、烤蔬菜也好好吃！最重要的是店內夥伴服務品質很好、又有熱情，很推薦唷！
 A-Kwon Fang ,https://www.google.com/maps/contrib/103714456755345789855/reviews?hl=zh-TW,4,True,"2,975",就如同在台灣各地吃到過的乾杯的經驗，就是料理極鮮美、服務極周到，然而量就是挺少、少到不容易點個套餐就能吃飽。
 pei-yu (小薔薇) ,https://www.google.com/maps/contrib/117052640223393934069/reviews?hl=zh-TW,5,True,99,店員親切，烤不完還會幫忙烤😅😅真的很貼心，到這裡吃晚餐有種回到家的安心感，非常推薦呢
 In Sham ,https://www.google.com/maps/contrib/104837194618297313348/reviews?hl=zh-TW,5,False,8,氣氛超好，店員都很會攪氣氛，價錢遍貴了一點點，不過還是值得一去的，啤酒就比較便宜，一杯生啤都是一百塊台幣，食物燒肉我覺得還算可以，邊燒邊飲啤酒一班朋友眾一下，很好的地方，記得要訂位，walkin是沒有位置的！
 Frances Lin ,https://www.google.com/maps/contrib/104231039132138894501/reviews?hl=zh-TW,5,True,107,"標籤：御膳房
低醣飲食者就是可以大口吃肉😀，不可以大口喝酒😱
乾杯絕對是首選，雖然最愛的牛舌已經不再供應，但是還是不減對乾杯的熱愛"
 徐國棟 ,https://www.google.com/maps/contrib/113323565685777653622/reviews?hl=zh-TW,3,True,230,好吃但是蠻貴的
 JC ,https://www.google.com/maps/contrib/109381075980118473551/reviews?hl=zh-TW,5,True,14,店內氣氛很好店員服務親切還會玩遊戲食物品質也很好!
 May Wang ,https://www.google.com/maps/contrib/102959644391061033749/reviews?hl=zh-TW,4,True,43,"很熱鬧的地方
現在有晚8點乾杯免費續杯的活動"
 Tina Hung (洪小雅) ,https://www.google.com/maps/contrib/107698099061132443759/reviews?hl=zh-TW,5,False,8,"很有氣氛的一家店
真的很適合聚餐
服務人員都很棒~"
 Din Din ,https://www.google.com/maps/contrib/106112487022467549750/reviews?hl=zh-TW,5,False,4,晚間20:00乾杯活動很有渲染力，用餐氣氛歡樂適合聚餐，餐點超過該價位應有的品質。
 Ray Lin ,https://www.google.com/maps/contrib/117015024072184656178/reviews?hl=zh-TW,1,False,6,點什麼沒什麼，食材尚可但價格偏高，服務也不怎樣，可以好好聽顧客點什麼以及說明嗎？跟第一次吃的感受天差地遠，非常不推薦
 Irene Chan ,https://www.google.com/maps/contrib/105036560041700526405/reviews?hl=zh-TW,5,False,19,Lara迷人又貼心。會烤肉，也會分享肉的特色和烤肉秘訣。當然所有的餐點也都非常美味。歡樂的用餐體驗
 楊寶寶 ,https://www.google.com/maps/contrib/102106673476314539479/reviews?hl=zh-TW,5,True,250,商業午餐，很棒。
 X Mi ,https://www.google.com/maps/contrib/103365069335324096926/reviews?hl=zh-TW,5,True,47,"真的很好吃天啊～～～
吃到肉的香味，店內氣氛也很棒
超推！"
 Yu Chen ,https://www.google.com/maps/contrib/108215850117320136325/reviews?hl=zh-TW,5,True,37,"每次必點柚子口味的角嗨
每年吃口感都沒有變
活動不會讓人太有壓力送的肉也非常好吃大方"
 Rex Wang ,https://www.google.com/maps/contrib/112441464758593294254/reviews?hl=zh-TW,1,False,2,吃個燒烤跟在打戰一樣，服務生一直催，單點的方式又不是吃到飽，一直趕一直趕，讓人感覺超不爽的，以後不會再去這家了，列為黑名單，超不愉快的用餐經驗。
 謝佳吟 ,https://www.google.com/maps/contrib/117295191583564429440/reviews?hl=zh-TW,3,False,16,位子分配的非常擁擠，肉的品質沒以前好吃，連好吃的薄切鹽蔥牛舌都沒了，以往每年都會去吃兩次慶祝，這種CP值越來越低的狀況下，讓我不想再去。
 KAY CHANG ,https://www.google.com/maps/contrib/114354083110540023769/reviews?hl=zh-TW,4,False,11,氣氛歡樂，食物好吃
 王天天 ,https://www.google.com/maps/contrib/113589363851529382539/reviews?hl=zh-TW,5,True,17,燒肉肉質非常鮮嫩，服務態度也很不錯，晚間八點的乾杯時間更是令這頓晚餐更熱鬧了，下次有機會的話一定會再度光臨！
 林沂 ,https://www.google.com/maps/contrib/115624209820204710023/reviews?hl=zh-TW,5,True,13,"中高價位,但服務很好肉值也不錯"
 劉米花 ,https://www.google.com/maps/contrib/104706847638681070358/reviews?hl=zh-TW,5,False,58,好吃氣氛佳
 Cami Law ,https://www.google.com/maps/contrib/101618395044726350323/reviews?hl=zh-TW,4,True,58,"換了新餐牌後比較少去了
新meau選擇種類變少價格也是回不去的
但乾杯本店氣氛很開心如果有來台的朋友還是建議可以去吃吃看"
 kiki chen ,https://www.google.com/maps/contrib/102414669251249870065/reviews?hl=zh-TW,5,True,21,"乾杯總是不讓人失望～
今天有著小郭、小蔡的服務讓今天的聚餐更加開心☺️
吃不膩，又平價😋"
 Kevin Lin ,https://www.google.com/maps/contrib/106806441206736284442/reviews?hl=zh-TW,4,True,87,吃起來還可以，情侶去會比較好，不然店內會cue情侶，如果只是和曖昧的對象吃可能會尷尬
 Pandora Box ,https://www.google.com/maps/contrib/106145259798642919676/reviews?hl=zh-TW,4,True,338,座位不多，但氣氛熱絡，每晚20：00乾杯都是高潮，最近兩周正好20周年，快跟上
 Yu Chi Chang ,https://www.google.com/maps/contrib/114022852927214865297/reviews?hl=zh-TW,5,False,1,第一次來乾杯吃飯~我覺得東西都很好吃氣氛很活躍😀肉汁很多很嫩👍
 wan-lin miau ,https://www.google.com/maps/contrib/101464496590435033916/reviews?hl=zh-TW,4,True,84,非常不錯的非常不錯的一家烤肉店但是有一種他比較不推薦的薄片肉吃起來又嫩又好吃就算他比較不推薦我們點來吃也很愛吃建議大家點那個還有記得看白飯的價錢
 Queenie Li ,https://www.google.com/maps/contrib/102022366686718386243/reviews?hl=zh-TW,5,False,1,"食物好，環境好，氣氛好，服務態度更好
服務員皮蛋跟我的外國朋友聊得很開心，他們很喜歡這𥚃，謝謝！"
 yeee ,https://www.google.com/maps/contrib/106752869012448094693/reviews?hl=zh-TW,5,True,25,"鹽蔥燒真的推吃完可以投胎了嗯
（btw店員都很逗（夜市系列好Q"
 Wen Yuh Liao ,https://www.google.com/maps/contrib/110845274613730302836/reviews?hl=zh-TW,2,True,170,雖然肉的品質不錯，但是，櫃台內的工作人員雖然有戴手套，但是從頭到尾沒有更換，熟食、生食都是同一雙手在作業，實在看了倒味口
 Uson Lai ,https://www.google.com/maps/contrib/111391822411429885488/reviews?hl=zh-TW,1,True,433,打電話預約20:30，結果當天到現場看到登記表上寫19:30(補)，還告知說你們是候補，會盡量安排你們在9點入座，被排在候補也沒事先告知
 S Liu ,https://www.google.com/maps/contrib/117402803334204425043/reviews?hl=zh-TW,5,True,39,真的很好吃，cp值很高，來這裡吃飯的意願遠高於其他更高級的燒肉，氣氛很歡樂，每次心情不好時只要來吃飯就能一掃陰霾。蘇偉很可愛
 Benson Lee ,https://www.google.com/maps/contrib/112395237687403493307/reviews?hl=zh-TW,4,True,398,好吃！但太貴，平均一人1500元都吃不飽，價位可以去更高級的鐵板燒........或都點便宜的肉吃........但既然都點便宜貨吃幹嘛不去吃到飽？
 Molly ,https://www.google.com/maps/contrib/107172235309110565226/reviews?hl=zh-TW,5,False,11,"好久沒來，還是一樣親切
肉新鮮好吃！"
 Piyo - ピヨイー ,https://www.google.com/maps/contrib/113340592579737056999/reviews?hl=zh-TW,4,True,560,環境比較嘈，不太適合小朋友前往，不過是成人的喝酒吃燒肉的好地方。價錢亦非常合理，店員很熱情。
 結成翔ㄏㄧ流 ,https://www.google.com/maps/contrib/116078351090164248982/reviews?hl=zh-TW,5,False,1,8點乾杯活動好玩開心LARA服務很棒會親自教你如何燒烤非常棒的服務一定要到本店吃看看
 高筱喬 ,https://www.google.com/maps/contrib/111678355349171806474/reviews?hl=zh-TW,2,False,19,雖然不錯吃，但東西都還沒吃完，就把餐具都收走，知道今天是聖誕節所以忙碌了一點，但我們用餐時間也還沒有到，就一直急著收拾讓下一組客人進來，不過還有東西沒有吃完就把餐具也收走讓人家感覺不是很好
 黃仁德 ,https://www.google.com/maps/contrib/100242794379588632217/reviews?hl=zh-TW,4,True,85,燒烤本就好吃，取餐方便，下次會再來吃別的口味
 Alex ,https://www.google.com/maps/contrib/110900955083617422224/reviews?hl=zh-TW,1,False,7,明明時間還沒到還有半個小時聽到我們沒有要加點了態度大轉變不給參加活動趕客人的感覺我們桌上飲料都還沒喝東西就開始一直收拼桌次?媽的去了一次不會去了還有4個人的位子硬要給我們塞成9人合併在一起他媽的沒位子還開放訂位?爛死
 羅唯寧 ,https://www.google.com/maps/contrib/115879301081701637431/reviews?hl=zh-TW,5,False,5,"肉都超好吃的😋😋😋
服務人員很親切
看到我們帶小孩還幫忙我們烤👍🏻👍🏻
而且烤的很剛好❤️"
 brian chien ,https://www.google.com/maps/contrib/103931116784051248208/reviews?hl=zh-TW,4,True,71,食材還是維持一樣水準，簡單調味味道就很不錯，中午午餐很超值。
 王宣涵 ,https://www.google.com/maps/contrib/113958841636903571642/reviews?hl=zh-TW,5,False,23,"食材新鮮，店裡氣氛很好，用餐很氣氛溫馨愉快。
（店員也五顆星，阿民，屁蛋，大樹👍🏻👍🏻👍🏻）"
 陳湘婷 ,https://www.google.com/maps/contrib/105629822064549963405/reviews?hl=zh-TW,1,False,9,"都已經定位了
卻還要我們在外面一直等
7：00到7：20才讓我進去先坐
而不能用餐
這樣合理嗎？"
 Pingyu Tsai ,https://www.google.com/maps/contrib/113555173656308835519/reviews?hl=zh-TW,1,False,12,9人擠一小桌只有一爐，還被忘記出菜跟飲料，無限制用餐時間卻先讓我們離場，要賺錢卻沒有品質，員工很熱情也是大扣分
 Kala Huang ,https://www.google.com/maps/contrib/117197328116819463285/reviews?hl=zh-TW,5,False,75,燒肉好吃，價格合理，店員都很有熱情，服務超好。心目中燒肉第一名！
 張仕鴻 ,https://www.google.com/maps/contrib/116425052157122645246/reviews?hl=zh-TW,5,False,4,"大東服務超讚👍🏻
店內的牛肉系列也很好吃😋"
 Nick SIE ,https://www.google.com/maps/contrib/106369273964860727888/reviews?hl=zh-TW,5,False,4,"服務人員熱情,肉的品質是有等級的,非常適合喜歡吃美食的人來享用"
 小苓 ,https://www.google.com/maps/contrib/111265572693370832565/reviews?hl=zh-TW,5,False,1,餐點好吃氣氛佳，謝謝店員皮蛋熱情服務，會是間想讓人再度光臨的餐廳
 Vivi Lin ,https://www.google.com/maps/contrib/109313011600609771602/reviews?hl=zh-TW,1,False,22,已和服務人員確認兩次訂位時間還是沒有改時間，害我們所有人乾等一個多小時！
 林芳毅 ,https://www.google.com/maps/contrib/117098740469498932377/reviews?hl=zh-TW,5,False,1,很好吃，餐點準備都很用心，下次還會再來
 琳琳 ,https://www.google.com/maps/contrib/104740966680601660543/reviews?hl=zh-TW,5,False,10,"來吃很多次了
很喜歡乾杯歡樂的氣氛
食材也都很新鮮👍🏻好吃💕"
 Joris Tseng ,https://www.google.com/maps/contrib/112307878240538533336/reviews?hl=zh-TW,5,True,608,"店員服務親切，雖然沒有訂位也可以溝通讓我們快速用餐;-)
牛舌推薦！酒蒸蛤蜊偏鹹比較還好…"
 李忠達 ,https://www.google.com/maps/contrib/103287840686043175165/reviews?hl=zh-TW,4,True,141,厚牛舌好好吃，牛排也很讚（還可以猜重量±5gfree)
 Jodie Jang ,https://www.google.com/maps/contrib/118009313747939643552/reviews?hl=zh-TW,5,True,58,感謝小郭幫我們hang足慶生趴～一個眼神就知道我們想幹嘛～還有肉烤的超級好吃😋
 吳宥薰 ,https://www.google.com/maps/contrib/108678989126722439956/reviews?hl=zh-TW,5,False,2,"覺得店員很熱情也很貼心桌邊烤肉服務
一定會推薦朋友來～"
 Jia-Wei Lin ,https://www.google.com/maps/contrib/113683979292235242083/reviews?hl=zh-TW,3,True,104,喜歡熱鬧氣氛，喜歡熱心店員，這裡絕對首選，但如果是來享用肉的美好，一樣價位，還不如去吃飯店吃到飽，肉的冰箱味實在是太重了
 kai ,https://www.google.com/maps/contrib/103000634581409047412/reviews?hl=zh-TW,5,False,25,第一次來吃，順便慶生，服務態度跟氣份超棒，非常推薦喔
 蔡函倪 ,https://www.google.com/maps/contrib/106575382633970397558/reviews?hl=zh-TW,5,True,27,"肉超好吃！服務生也很幽默風趣！
在這一點都不會有壓力推推！！！"
 PIG16611 ,https://www.google.com/maps/contrib/117359597384043920843/reviews?hl=zh-TW,2,True,53,前幾天預約七點半入座結果很晚來點餐，遇到八點乾杯活動，連飯要等半小時都沒事先說，中途問餐點才知道沒飯，雖然肉品和飲品好喝，但近期不會考慮再去用餐了！
 H ,https://www.google.com/maps/contrib/104801500657085314380/reviews?hl=zh-TW,5,False,23,"服務氣氛食材品質都非常讓人再三尋味
很棒的地方很喜歡來吃"
 Marion Lin ,https://www.google.com/maps/contrib/109804244011650179145/reviews?hl=zh-TW,3,True,124,"好處是價格便宜（相對其他燒肉）員工動作快熱情
壞處是肉沒那麼新鮮
口袋不深但硬想吃美味燒肉的最好選擇
港客多"
 taichi wang ,https://www.google.com/maps/contrib/116932683566095182071/reviews?hl=zh-TW,4,True,465,食材鮮美，服務親切
 YuMing Wang ,https://www.google.com/maps/contrib/103316246971381881649/reviews?hl=zh-TW,5,False,9,氣氛好丶食物佳的好所在，中午丶晚上還有燒肉便當喔，揪咪。
 Irene ,https://www.google.com/maps/contrib/112879588068807603881/reviews?hl=zh-TW,4,True,81,肉質好氣氛high但是一有活動就會拖到吃東西的時間畢竟有限時…
 許珍瑀 ,https://www.google.com/maps/contrib/112676185518942233209/reviews?hl=zh-TW,5,True,25,店內氣氛很熱情！！
 金鈺珊 ,https://www.google.com/maps/contrib/110067413570103397788/reviews?hl=zh-TW,5,False,9,今日來慶生服務人員大樹皮蛋超親切服務超優。熱情滿分。在這裡慶生有他們很開心🥳
 Ian Lau ,https://www.google.com/maps/contrib/113081458332030808989/reviews?hl=zh-TW,5,False,1,服務超棒的，店員男的帥女的美，今天八點乾杯的活動主持人帥到我都要排卵了
 田佳承 ,https://www.google.com/maps/contrib/109016954746044686069/reviews?hl=zh-TW,5,False,5,服務親切氣氛活潑歡樂肉品好吃😋一個月最少吃一次推薦帶著男女朋友來吃
 Wing ,https://www.google.com/maps/contrib/103129058464056153100/reviews?hl=zh-TW,3,True,194,鹽蔥牛舌和奶油菇好吃！氣氛適合喜歡熱鬧的客人，不是走安靜路線。
 陳先生 ,https://www.google.com/maps/contrib/116757477262027462632/reviews?hl=zh-TW,1,False,9,"都已經站在門口站櫃檯了
店家完全沒有想理人的意思
也沒有員工想出來了解狀況

難怪這時間沒有人想光臨
爛店"
 吳欣穎 ,https://www.google.com/maps/contrib/103481947008122417234/reviews?hl=zh-TW,3,False,9,很熱鬧，店員也親切，可是備料不足，想點幾樣東西都售完，感受不太好。位子稍小
 伊倫劉 ,https://www.google.com/maps/contrib/112742080562145806285/reviews?hl=zh-TW,5,False,6,"真的服務敲好很會帶氣氛❤️

北中南都去N次了😂

去不膩啦🥳🥳🥳🥳🥳🥳🥳🥳🥳🥳"
 芷嘉 ,https://www.google.com/maps/contrib/113515657693937766396/reviews?hl=zh-TW,5,True,43,服務很好套餐很滿足
 Wei wang ,https://www.google.com/maps/contrib/106880681084823212645/reviews?hl=zh-TW,5,False,9,"服務超好～超親切。
東西很好吃😋
非常值得大推薦👍🏻還會再來✌🏻"
 李昇霖 ,https://www.google.com/maps/contrib/114165453204555166581/reviews?hl=zh-TW,5,False,9,氣氛很好肉肉品質偏鹹但很有風味的居酒屋讚啦
 劉祐慈 ,https://www.google.com/maps/contrib/109758457062402634469/reviews?hl=zh-TW,5,True,61,"好久沒吃乾杯了～～
氣氛很熱鬧，肉也好好吃～很棒的聚會場所🧡🧡"
 Hsiu Gao ,https://www.google.com/maps/contrib/101572624607354599927/reviews?hl=zh-TW,5,False,2,"開心！好吃😋適合歡聚的好地方～
店員超有趣、超nice！
有機會會再造訪。"
 Joco Chen ,https://www.google.com/maps/contrib/110636697371357923918/reviews?hl=zh-TW,5,False,8,"好吃好玩好嗨🥰
店員妹妹偲O好可愛&超會烤肉👍🏼👍🏼"
 Albee Lu ,https://www.google.com/maps/contrib/109329546853909742009/reviews?hl=zh-TW,5,True,29,"好玩、好吃又美味
尤其是花園的服務特別棒棒！
別問我花園是誰，來就知道了！
👏🏻👏🏻👏🏻
推推唷👍🏻👍🏻👍🏻"
 Nico ,https://www.google.com/maps/contrib/116887728776412842874/reviews?hl=zh-TW,5,True,51,"大樹很棒！很會！
再次來到乾杯🍻感受到溫度而不是傷悲😂
大家來指定大樹服務唷！"
 Peiju Yu ,https://www.google.com/maps/contrib/100394891121523385471/reviews?hl=zh-TW,5,True,107,很熱鬧的氣氛！奶油雞肉好吃！
 徐婉庭（花花） ,https://www.google.com/maps/contrib/100959742165605319431/reviews?hl=zh-TW,5,False,24,"肉真的超好吃的氣氛也很好，
快點約朋友來吃辣❤️"
 藍中語 ,https://www.google.com/maps/contrib/112254873978632727400/reviews?hl=zh-TW,5,False,2,服務親切8點活動歡樂肉質很好吃個人最愛豬肋條推薦各位必點
 mei Yee ,https://www.google.com/maps/contrib/105916759108693933250/reviews?hl=zh-TW,5,False,1,店內氣氛十分好，店員十分親切，由其是大樹店員也十分熱情，有禮貌地推介，謝謝所有店員的熱情招待👏👏👏
 Lii Lee ,https://www.google.com/maps/contrib/104461917719372613412/reviews?hl=zh-TW,1,False,20,"中午的服務態度可以再差一點
說話都不用抬頭看你的
頸椎有問題？"
 Sunnie Chen ,https://www.google.com/maps/contrib/115080717387729261578/reviews?hl=zh-TW,1,False,7,明明事先預訂好10人桌到場卻告知作業失誤位子已提供給其他客人（5人）超扯現場也無能力調解處理換位給1分都嫌多
 Yu-Cheng Lin ,https://www.google.com/maps/contrib/118349657880069937135/reviews?hl=zh-TW,4,True,153,"服務好，氣氛熱絡。
有親親送五花肉和乾杯🍻再送一杯活動。

份量適中，口味不錯。"
 Ting Min ,https://www.google.com/maps/contrib/113001537860071554463/reviews?hl=zh-TW,5,False,11,"好吃好吃♥
店員人也很好，現場氣氛也很棒
還認識了Lara我的朋友♥"
 Chien-Hsing Tsai ,https://www.google.com/maps/contrib/118430129985523578456/reviews?hl=zh-TW,4,False,15,霜降豬與上等牛五花好吃，但我最喜歡的蔥鹽牛舌薄片居然停售了...QQ
 Oscar Chan ,https://www.google.com/maps/contrib/102733387355931743825/reviews?hl=zh-TW,5,False,3,"好吃，員工也好親切！
服務很好，活動也很有趣😆😆
P.S.謝謝大樹君"
 jade chiang ,https://www.google.com/maps/contrib/106124858048279331339/reviews?hl=zh-TW,5,True,36,店裏的服務員都親切有趣東西好吃八點乾杯時間也超會炒氣氛讚哦！
 Derek Kwan ,https://www.google.com/maps/contrib/112723060114980084218/reviews?hl=zh-TW,5,True,88,氣氛好，食物素質ok，適合聚會。
