user_name,user_profile_url,rating,local_guide,comment_num,comment_text
 Winnie ,https://www.google.com/maps/contrib/101973300124176789300/reviews?hl=zh-TW,1,False,13,"多肉柚香四季春-65元
柚子的味道很像韓國蜂蜜柚子茶(大罐玻璃瓶)，沒什麼特別。"
 Jackko Lai ,https://www.google.com/maps/contrib/110412829299056366810/reviews?hl=zh-TW,5,True,57,草莓優優冰沙很特別清爽，夏日消暑好夥伴
 我是魚 ,https://www.google.com/maps/contrib/102541839748901178867/reviews?hl=zh-TW,5,False,6,優優系列蠻推的👍芒果系列也很好喝，環境也很乾淨
 李碩碩 ,https://www.google.com/maps/contrib/113669461924673921199/reviews?hl=zh-TW,3,False,35,點了四杯飲料，櫃檯沒有重複確認飲品，我自己也沒注意，櫃檯有告知要等20分鐘，我拿到的時候已經超過20分鐘了ಥ_ಥ所以我等了超過20分鐘還拿到錯的飲料，尬衰小的一天
 蔡宜辰 ,https://www.google.com/maps/contrib/103394904002237505493/reviews?hl=zh-TW,5,False,2,今天叫外送時發現多肉葡萄綠沒有多肉，打去店家反應後店家直接補送飲料過來，店家服務真的非常好👍下次還會再來買🥰
 劉惠婷 ,https://www.google.com/maps/contrib/101264754699517803005/reviews?hl=zh-TW,5,False,2,今天點了多肉葡萄綠，底層以完美比例的多多、憨厚濃萃綠茶調和，喝到第一口真的是超級爽~
 陳怡妃 ,https://www.google.com/maps/contrib/110476598018865617837/reviews?hl=zh-TW,4,True,111,粉紅泡泡草莓優優，不錯喝～
 林俊珠 ,https://www.google.com/maps/contrib/104069705924967179015/reviews?hl=zh-TW,5,False,1,我覺得有飲的奶茶非常好喝，和其他間手搖飲非常不一樣，奶味很香醇，茶味也不會被蓋過去。
 Sandy Chen ,https://www.google.com/maps/contrib/106691053232866608029/reviews?hl=zh-TW,4,False,25,飲料普普沒有特別驚艷的好喝😂但我是欸了粉所以偶爾還是會來買一下😅
 侯蕾蕾 ,https://www.google.com/maps/contrib/102341578898285327292/reviews?hl=zh-TW,5,True,676,"多肉葡萄綠$65
微糖微冰
有好多葡萄本人好好喝
才$65價格很佛

夏天的芒果系列也很不錯"
 Hsuan ,https://www.google.com/maps/contrib/108156856695910130177/reviews?hl=zh-TW,1,False,7,真的非常難喝雙色地瓜圓一點味道都沒有而且口感就是硬掉的珍珠！！
 Caesar ,https://www.google.com/maps/contrib/118133784785498344832/reviews?hl=zh-TW,5,True,202,超有創意又好喝！椪糖加優格原來這麼搭，認真覺得比再睡X分鐘好喝很多，良性競爭啦哈哈😂
 DJ Y ,https://www.google.com/maps/contrib/102410724612629435084/reviews?hl=zh-TW,4,True,46,第一次喝有飲，喝起來真的蠻不錯的
 a49922 ,https://www.google.com/maps/contrib/108917712236569477105/reviews?hl=zh-TW,1,False,58,已經過了預定取餐時間二十分鐘。問了還是只說稍等一下。請控制好你們出餐時間。不要浪費別人時間。超過四十分鐘才出餐。出不了餐請不要開外送平台
 CHEN ,https://www.google.com/maps/contrib/116195133259092026416/reviews?hl=zh-TW,1,False,7,用foodpanda點了一杯奶霜紅茶，奶霜直接酸掉耶……，品質這樣真的很不應該
 葉欣怡 ,https://www.google.com/maps/contrib/117141453438806848094/reviews?hl=zh-TW,5,False,1,第一次看到手搖飲店店員這麼親切和客人點餐，都可以很清楚聽到店員詢問和複誦冰塊甜度，很棒！！
 陳品蓉（Ceci. 品蓉） ,https://www.google.com/maps/contrib/101798813094423813854/reviews?hl=zh-TW,4,True,305,原本想喝啵啵但當天沒有⋯但也是不錯喝啦～
 sunny lu ,https://www.google.com/maps/contrib/104922619047428759540/reviews?hl=zh-TW,4,True,155,"這家剛開幕總是大排長龍，最近可能是疫情，不需排隊了！草苺啵啵氣泡飲很推，但同系列檸檬綠茶啵啵甜到爆，因為這系列不能調整甜度，如果不喜歡太甜者,慎入！"
 王志強 ,https://www.google.com/maps/contrib/113795502227486227201/reviews?hl=zh-TW,5,False,8,店員態度好到爆生意好到可以叫外送員棄單如果不能應付線上跟現場客人自己店員要斟酌適當的時間別浪費外送員的時間我們隨時都可以當客人跟你們消費外送員就不是客人嗎叫我們棄單又是讓外送員等了10分鐘後才告知又要10分鐘不然你可以棄單好棒的服務希望你們可以加強什麼是服務態度
 Pon Peng ,https://www.google.com/maps/contrib/115488917392515560138/reviews?hl=zh-TW,2,True,135,茶沒味道，像是芒果加水
 林佳慧 ,https://www.google.com/maps/contrib/102870818300374632704/reviews?hl=zh-TW,5,False,1,奶霜很綿密，上面灑了一點椪糖，脆脆的，口感很棒，整體是有層次的
 仁 ,https://www.google.com/maps/contrib/115516925240434641483/reviews?hl=zh-TW,1,True,18,晚上6.裡面一個高高的馬尾女態度在差幾點的可以教育訓練嗎相比櫃檯男服務生好多了
 林美珠 ,https://www.google.com/maps/contrib/102133987977018562202/reviews?hl=zh-TW,5,False,2,多肉葡萄綠，入口是清爽茶香，尾韻有香甜葡萄果肉，讚讚大推拉。
 棕熊o ,https://www.google.com/maps/contrib/101284265578509596559/reviews?hl=zh-TW,5,True,18,店員帥，奶蓋超好喝，玫瑰口味的有優格的味道
 張家豪 ,https://www.google.com/maps/contrib/116150013399360708845/reviews?hl=zh-TW,5,False,2,秋季新品嚐鮮點了葡萄優優綿綿的冰沙再加上多顆葡萄果肉舒服～
 陳玉庭 ,https://www.google.com/maps/contrib/116605601598100646933/reviews?hl=zh-TW,5,False,1,好喜歡吃椪糖，竟然有椪糖口味的茶飲，椪糖四季春調得很好喝
 Sasha Wu ,https://www.google.com/maps/contrib/118235275465476205896/reviews?hl=zh-TW,1,False,13,"「請問椪糖是蔗糖是嗎？」
「…椪糖就是椪糖。」
「那..我平常都是喝半糖，請問比較建議甜度多少？」
「…茶本體是沒有甜的啊」
「….」

結果我點半糖根本太甜@@
員工的態度跟教育訓練不足，公館開幕終於第ㄧ次喝有飲，心情感覺很差！"
 Emma ,https://www.google.com/maps/contrib/103846324614158502306/reviews?hl=zh-TW,4,False,11,四季春茶微糖有點太甜，但最低也只能微糖。店員服務態度很好，店面很可愛很多裝飾👍🏻
 王鈺婷 ,https://www.google.com/maps/contrib/108839041477903834207/reviews?hl=zh-TW,5,False,15,"椪糖優優真的好喝～
店員也都很親切～
希望可以到林口開店😂"
 Lya Lin ,https://www.google.com/maps/contrib/101803301422153683509/reviews?hl=zh-TW,4,True,80,"店員很nice,推薦的草莓優優好喝，但我另外點的珍珠紅茶很普，珍珠心沒有透，硬硬的。"
 YSJ ,https://www.google.com/maps/contrib/117419065342421276566/reviews?hl=zh-TW,3,True,29,玫瑰鹽奶霜四季春奶霜味稍嫌不足，旺旺來鐵觀音半糖茶還是有點苦！
 appleamy hsu ,https://www.google.com/maps/contrib/113484574139681307697/reviews?hl=zh-TW,4,False,31,利用Uber點的飲品，宇治抹茶拿鐵丶半糖微冰加珍珠，抹茶夠味，但不論是$85現場還是$95外送價都不便宜。
 果果媽 ,https://www.google.com/maps/contrib/113018852119056104762/reviews?hl=zh-TW,5,True,52,"茶飲很有創意、飲料店名稱也很有趣😄
可惜目前只有大安區才有。希望能多一點分店！"
 MiMi ,https://www.google.com/maps/contrib/109995227623550078400/reviews?hl=zh-TW,5,False,7,"慶祝兒童節台北行，馬上想到有飲，想嚐鮮很久了
果然沒讓我失望👍👍👍👍

草莓優優超好喝，很順口會不知不覺就喝完了（最後跟兒子搶著喝，後悔沒買2杯）

新口味椪糖奶霜（微糖）剛剛好，有焦糖牛奶糖的味道，還吃的到微微的碎糖。

檸檬綠茶啵啵，第一口喝下去（我老公以為我點啤酒給他喝🤣）放一下子後再喝會有檸檬香氣跑出來，很特別的飲料！

弟弟也在店裡，很客氣，店員服務態度也很好，可惜自己臉皮太薄開不了口拍照😂

不過沒關係飲料好喝就好，期待自己下次的二訪"
 曾梓豪 ,https://www.google.com/maps/contrib/104283324377446886069/reviews?hl=zh-TW,5,True,18,"重焙鐵觀音拿鐵
-茶味夠清爽無負擔

假日晚上人沒想像中多
不用等太久就可以喝到
路過絕對可以買來吸上兩口"
 fish Yellow ,https://www.google.com/maps/contrib/105627403960380556804/reviews?hl=zh-TW,4,True,306,"優優真的滿優優！
原味就蠻好喝了
喜歡蘆薈！"
 shssty L ,https://www.google.com/maps/contrib/113106170304715663330/reviews?hl=zh-TW,5,True,9,"第一次去朝聖，跟朋友點了四杯不同的品項，全部都獲得好評🥰🥰
手握有飲，所項無敵👍"
 Vicky ,https://www.google.com/maps/contrib/103005331951484757187/reviews?hl=zh-TW,3,False,14,"前幾天在IG看到要推出焙茶系列
覺得非常特別，因為幾乎沒看過一般手搖飲做焙茶的品，剛好經過就很期待的點了厚乳焙茶奶霜
覺得有飲的奶霜滿像香草冰淇淋味道，也不會到過甜，不過⋯這杯焙茶拿鐵本身就我個人口味是無法接受，雖然得到焙茶的味道，但茶味真的淡很淡很淡，也沒有奶味，喝起來還有種水感
一直冒出這真的是拿鐵嗎的疑問
再來是單價也偏高，喝起來也不符合有厚乳的感覺
整體是蠻失望的，不會想再回購"
 Kakyom ,https://www.google.com/maps/contrib/111093066213333666270/reviews?hl=zh-TW,5,False,9,"新品凍滋凍滋焙香奶茶好喝耶～
一開始很擔心焙茶的烘焙味會不會很濃
結果焙茶沒有想像中的苦沙沙的
我覺得比例調得剛剛好
店員推薦的微糖很合我的胃口
裡面像茶凍的東西咕溜咕溜的好喝耶
而且料算是滿多的
雖然是奶精可是沒有很重的奶精味
而且最近新品3月底以前都還有打九折
很超值
這是我很喜歡的飲品
希望能常駐❤️❤️"
 周紫龍 ,https://www.google.com/maps/contrib/103433437268239668164/reviews?hl=zh-TW,5,False,2,新上市雲朵葡萄爽，超好喝超解熱的拉～～～讚
 Sean Chang ,https://www.google.com/maps/contrib/110297842533910724434/reviews?hl=zh-TW,5,True,24,"好喝啦，會想繼續嘗試其他味道😊😊
後來才知道是Youtuber開的😂😂😂"
 Syun Jhen Yao ,https://www.google.com/maps/contrib/101571594763265213460/reviews?hl=zh-TW,5,True,147,生日當月最後一天來兌換免費生日禮，選了厚乳焙茶奶霜無糖去冰，原本擔心無糖會有苦味，但還是有喝到稍微的甜味，覺得很不錯，店員有提醒去冰會比較膩口，但仍覺得不錯喝，有機會再嘗試其他口味：）感謝生日禮物！
 Doris ,https://www.google.com/maps/contrib/117209929808945931571/reviews?hl=zh-TW,5,False,38,粉紅泡泡草莓優優爆炸好喝❤️很驚艷，如果有去台北一定會順路再去買！推推👍👍👍
 Logan Hsu ,https://www.google.com/maps/contrib/100362834958683058822/reviews?hl=zh-TW,2,False,21,"之前路過四五次都爆多人
難得這次沒人立馬過去點一杯馬上回家喝
奶茶算有味道珍珠有軟有硬不知道是不是新舊珠混在一起
硬的偏多真的不ok
價位跟美味搭不上"
 Lin Stark ,https://www.google.com/maps/contrib/114590578939572963874/reviews?hl=zh-TW,5,False,30,"下午去買了粉紅泡泡跟清茶
覺得不錯喝，茶也蠻濃的
我覺得可以，只是可能不太熟悉
兩杯飲料有點久但服務很棒"
 Cheng ,https://www.google.com/maps/contrib/106333832056872290884/reviews?hl=zh-TW,5,True,393,"憨吉奶霜鐵觀音微糖去冰偏苦
建議點全糖
還不錯喝～"
 Manto bao ,https://www.google.com/maps/contrib/114770027119378629276/reviews?hl=zh-TW,4,True,140,"歡迎追蹤🔻🔻🔻
Instagram:mantobao_eating
Fb：饅不住你啦_吃美食GOGO
更多美食文都饅不住你啦🤤🤤
©️版權所有不得任意轉載
··························

《台北｜有飲Youin創意飲品》

#饅著你吃台北
#饅著你吃大安

饅頭也跑來追追一波欸這週啦～～
開幕到現在都沒空去
趁著假期的尾聲趕快跑來吸一杯壓壓驚😍😍
·························
▪️憨吉奶霜鐵觀音（70）
原本以為憨吉只是名字🤣🤣
原來是在奶霜部分有加入蜜香蕃薯
喝起來會有一點點沙沙的感覺（但味道不太明顯）
鐵觀音的味道搭配奶霜的口感
微冰微糖喝起來沒有負擔

▫️臉紅紅蘋果優優🍎（75/M）
優優系列是他們家的特色之一呦～～
蘋果優優是由酸甜蘋果和優格打成
喝起來像優格冰沙很解熱舒服
雖然甜度不能調
但整杯喝起來的甜度不會太高
想要嚐嚐看不同口味的朋友～也可以試試看🥰🥰

🔻🔻🔻
除了奶霜和優優
還有許多不同品項就交給大家品嚐完再和我們分享啦～～(๑˃̵͈́∀˂̵͈̀)
還沒買過的朋友快去考看看吧💓💓"
 Young Lee ,https://www.google.com/maps/contrib/111955583925730971121/reviews?hl=zh-TW,5,True,29,"從沒想到家裡樓下會開飲料店，還老天保佑運氣超好開了一家好喝的飲料店😇（好喝到升天（已成每日經過必買

目前喝過：
奶茶類：
古早味憨厚奶茶
斯里蘭卡厚奶茶
重培鐵觀音
珍珠奶茶爆擊

氣泡飲：
蜂蜜檸檬啵啵
莓果萊姆啵啵
柚香檸檬啵啵

優格飲：
草莓優優
百香果優優

無一踩雷（持續更新中）"
 Kuo Enya ,https://www.google.com/maps/contrib/109571049581221841394/reviews?hl=zh-TW,5,False,6,今天上班前打電話預約，好好喝，店長親切介紹、本來要點給同事大夜班喝，但會無法放置太久，所改訂及他飲料，希望他們可以有外送，這樣醫院同事都可以喝到
 大大海洋 ,https://www.google.com/maps/contrib/101088739860715447340/reviews?hl=zh-TW,5,False,3,"男服務員態度很友善，那天是晚上8點多到有飲，即使快到打烊時間也不會催趕，結帳速度也很快。
當天買了奶霜紅點了黃金比例，很好喝也不會太甜！👍"
 gi ko ,https://www.google.com/maps/contrib/104221723561504449880/reviews?hl=zh-TW,2,False,5,"點了七杯飲料，沒有一杯覺得滿意。
四季春和紅茶淡得像水，
柳橙多多啵啵裡面沒有多多的感覺，
憨厚濃萃綠茶拿鐵，奶味茶味都很淡。
青青小樹蘋果綠，味道是分開的，
底部還有一團ㄍㄡˊㄍㄡˊ的東西。

唯一優點就是不用等很久，做飲料算快。"
 Ruth Chai ,https://www.google.com/maps/contrib/101066010522383634956/reviews?hl=zh-TW,5,True,72,"店員熟悉菜單，很會介紹
飲料也不錯，優優系列推推"
 Eve Su ,https://www.google.com/maps/contrib/117333859138127790122/reviews?hl=zh-TW,1,False,12,"某一天上班路過，想說支持一下有飲（公館店）
我就買了想說不會踩雷的珍珠鮮奶茶「半糖正常冰」
（名字我沒記，從名字上我看不出來哪個才是我要點的飲品，所以我直接問店員，但這個不是重點）
店員告訴我只有M沒有L，我想說大小杯沒差，就回好。
買的時候沒有看價格，結帳的時候發現價格好像也沒有特別便宜，想到店址，「嗯，可以理解」
拿到飲料喝下去的第一口，我超級失望，喝起來就像喝白開水，像是冰塊融化後的那種沒味道的水，我喝不出來鮮奶味或是茶味，比我早餐店點的鮮奶茶還要難喝。
你們說你們對你們每一支飲品都很有信心，還說為了支持在地的，使用在地的飛牛牧場的鮮奶，但最基本的珍珠鮮奶茶都做的這麼難喝，我不會再回購。
建議多花點心思在「維持」飲品的品質，至少我相信我喝的那一杯應該不是你們的水準。
另外，配合政府政策掃描Qrcode，但我研究了半天，看不出來你們的Qrcode在哪裡？問男性店員，直接和我說，「你們沒有，還沒做好」，然後，從裡面跑出一位女士指一個小小的Qrcode，說是這個，我身高不高，158需要稍微彎腰才能掃碼，非常不方便。
花這麼多時間留言，希望你們可以看到，而不是用官方回覆，看下面刷一排官方回覆，感觀不優，若要官方回覆，就別回了"
 Sandy ,https://www.google.com/maps/contrib/112560919448452512483/reviews?hl=zh-TW,5,False,97,"珍珠口感偏硬很有嚼勁
奶茶的味道帶點麥茶香？
第一次嚐鮮的可以加賴拿購物金哦！"
 money talks ,https://www.google.com/maps/contrib/107175245866708453023/reviews?hl=zh-TW,1,False,13,"第二次來感受差異很大
第一次來是老闆親自到場服務不錯
這次有夠誇張
櫃檯點餐小姐口齒不清
講話有夠不耐煩有欠妳錢嗎
點什麼沒什麼
不會先講什麼沒有嗎
點完飲料等老半天
號碼跳來跳去
現場有夠混亂
應該不會再去第三次了"
 陳佩芳 ,https://www.google.com/maps/contrib/112467185070923254476/reviews?hl=zh-TW,5,False,1,粉紅泡泡草莓優優，甜而不膩，好喝！！
 橘子 ,https://www.google.com/maps/contrib/100112160660243728653/reviews?hl=zh-TW,5,False,14,公司附近新開的飲料店，招牌圖案設計很可愛，奶茶好喝！店員很熱情～～
 伶佩 ,https://www.google.com/maps/contrib/116617894444268970996/reviews?hl=zh-TW,1,True,24,"我是今天去買的客人
我等一小時多
第一動線規劃不當等餐客人跟排隊的完全混在一起
第二做餐的人員怎麼可以披頭散髮的？不綁頭髮！
第三我覺得如果要拍照其實要等到你們忙的差不多在跟粉絲互動要不然做餐要時間拍照要時間整個拖很久影響其他客人權益！
第四我買了古早味紅茶微糖微冰有點在喝水的感覺味道超級淡！建議可以改善
第一次去有這些感受有點失望不會再去第二次
9/20店家持續已讀不回"
 Mariage.T ,https://www.google.com/maps/contrib/100238957177815451263/reviews?hl=zh-TW,3,True,171,深焙鐵觀音好澀，草莓優優還不錯但很貴
 JAMES J. ,https://www.google.com/maps/contrib/115386580362938494937/reviews?hl=zh-TW,2,True,153,衝著欸的光環捧場一下。生意好得不得了！服務態度不錯。裝潢就還可以啦，比較沒有像隔壁網紅的好。至於飲料的部分，真的還可以啦。想說用實際的行動支持欸！！但是在這飲料的戰國時代中，真的很普通。加油👍
 洪子晴 ,https://www.google.com/maps/contrib/105355290241248312725/reviews?hl=zh-TW,5,False,10,"粉紅泡泡草莓優優建議加珍珠
酸酸甜甜的很好喝！"
 楊挹廷 ,https://www.google.com/maps/contrib/116141197103656183124/reviews?hl=zh-TW,5,False,13,"第一次喝憨厚濃粹奶綠，認真我很挑的人，有喝到茶香奶香～愛上，很值得來一喝～～
客人很多，但速度很快～明明很忙累，但還是笑容迎接對待，真的辛苦所有工作人員惹！加油"
 Ray Chao ,https://www.google.com/maps/contrib/111495007641016895394/reviews?hl=zh-TW,1,True,230,"真的是有夠失望的一間飲料店XD
飲料很水沒味道
價錢跟成本可以感覺的出來
毛利抽很高

真的是靠網紅出來撈一筆的而已⋯⋯
定價太高看得出來租金成本高
但全轉嫁給消費者真的體驗很不好
看能撐到什麼時候..."
 烏鴉明 ,https://www.google.com/maps/contrib/117578956359521678389/reviews?hl=zh-TW,5,True,232,這裡的飲料口味獨特又不突兀好喝到連舌頭👅都要融化了啦真心大推有飲喝拎啦推推😋😋😋💯💯💯💯💯💯
 JAMES CHEN ,https://www.google.com/maps/contrib/112621803173260192661/reviews?hl=zh-TW,1,False,13,買了斯里蘭卡醇拿鐵與憨吉奶霜鐵觀音，斯里蘭卡醇拿鐵味道偏淡，憨吉奶霜也不好喝。
 Joy Yen ,https://www.google.com/maps/contrib/106523203395729256451/reviews?hl=zh-TW,5,True,391,"欸了粉來報到❤️
L超大杯很划算
粉紅泡泡草莓優優也太好喝！"
 sine欣 ,https://www.google.com/maps/contrib/107772304865933830899/reviews?hl=zh-TW,5,False,8,點的是椪糖四季春茶味不算濃但不澀很順口適合喜歡薄茶的人椪糖融化在裡面有焦香真的很香很加分因為有椪糖會比原本點的甜度再甜一點
 VVN ,https://www.google.com/maps/contrib/114756382543392405021/reviews?hl=zh-TW,5,True,452,"旺旺來真的好好了，鮮奶茶微甜奶味夠重！👍
弟弟點餐很快速！"
 Wanqi Lin ,https://www.google.com/maps/contrib/111621863668403331734/reviews?hl=zh-TW,5,False,12,"今天下午五點左右去的時候
人小多也是排隊
但竟然飲料速速不到十分鐘就好了！
草莓優優非常好喝，不會太甜
喝的出來是真的草莓🍓
也點了兩種茶鐵觀音跟四季春為了喝出茶的純粹點了無糖去冰。
重烘培的鐵觀音沒有苦味只有回甘，茶韻也非常的香
四季春很清香的口味，一直以來我喝青茶、綠茶都會胃痛想吐；這次的茶完全沒有讓人不適
令我非常非常的驚艷呀
也點了玫瑰鹽奶蓋，奶蓋有一種小美冰淇淋的香味但沒有很甜是淡淡的鹹味跟淡淡的甜味，現場喝個幾口就得騎車所以請漂亮的出餐姊姊幫我用封膜的；還很貼心的跟我說騎車小心～最讓人驚嚇的是從大安騎車回到土城竟然奶蓋依舊沒有自動跟茶混合！
五告厲害可以繼續喝奶蓋惹🥺🥺

這一家飲料店不推對不起自己的良心
價格也非常合理！！"
 shfun huang ,https://www.google.com/maps/contrib/113181149336022149397/reviews?hl=zh-TW,3,False,14,住家附近新開的排隊店初購試水溫，茶味有點淡，珍珠有點硬，店員態度佳，下次有機會再試一次水溫
 林達達 ,https://www.google.com/maps/contrib/116507579451250843247/reviews?hl=zh-TW,5,False,9,"這人可以單手點餐真是太專業了本人有瘦
飲料好喝沒失望！"
 汪汪羽 ,https://www.google.com/maps/contrib/108621337957386330856/reviews?hl=zh-TW,1,True,244,"最近看到很多人排隊，今天看到人比較少排了一下
每個買的朋友都覺得茶類不好喝，有很大的進步空間…"
 王柏軒 ,https://www.google.com/maps/contrib/102827744504659438783/reviews?hl=zh-TW,1,False,8,"4/24特地為了「欸你這週」的知名度，而特地從台中奔波上台北喝有飲，想說室友這麼會煮飯，開的飲料應該很好喝，就開開心心的點了一杯水果茶，結果底茶苦澀的要命，後來完全喝不下去，只好忍痛丟掉，況且價格非常不親民，CP值不高，這應該是我目前喝過最難喝的水果茶，你們要再加油才行！！
最後建議換個茶葉吧，不然這樣會很對不起果農🫠"
 廖廖 ,https://www.google.com/maps/contrib/105631786567309689322/reviews?hl=zh-TW,5,False,64,鐵觀音奶茶溫三分糖好喝～奶味跟茶味都很夠！
 蘇菲Jung ,https://www.google.com/maps/contrib/114325364314140678543/reviews?hl=zh-TW,4,True,292,"不是弟弟😭😭😭
欠著一顆星等我遇到你再補❤️
點了粉紅泡泡期待"
 張家溱 ,https://www.google.com/maps/contrib/114419488679468863614/reviews?hl=zh-TW,1,False,4,"某男店員態度極差，不曉得在不爽什麼，服務業很辛苦沒錯，但該有的態度也是要有吧？
服務不好就算了飲料還很普。奶霜看很期待，但喝到覺得很普，珍珠尚可有QQ的！茶也不賴，但整體cp極低！服務品質有待加強！"
 王品方 ,https://www.google.com/maps/contrib/108471367116542150624/reviews?hl=zh-TW,4,False,5,"是滿好喝的啦～
只是店員我跟他說要斯里蘭卡純拿鐵+珍珠一開始可能沒聽到跟他講之後多加了10塊結果加到另一杯飲料上
店員要在加強一下，後來態度滿差"
 吕翊嘉 ,https://www.google.com/maps/contrib/115879850133952962028/reviews?hl=zh-TW,1,False,5,買了兩次，兩次都很失望。第二次買了店裡新品厚乳焙茶奶霜，那個焙茶喝起來粉粉的，非常不好喝，奶霜表現也很不好。第一次飲料無法喝完。
 晚餐貓 ,https://www.google.com/maps/contrib/105784972978904660799/reviews?hl=zh-TW,5,False,8,"上班剛好看到新開的飲料店當然要來搶先體驗！！！
風格復古又有點可愛<3
整體還不錯推一個"
 emily ,https://www.google.com/maps/contrib/103420442648244347167/reviews?hl=zh-TW,3,True,215,"個人覺得鐵觀音拿鐵沒有很好喝
鐵觀音泡的太苦澀了身為奶茶愛好者很勉強的喝完這杯"
 H Y ,https://www.google.com/maps/contrib/103737886059547317658/reviews?hl=zh-TW,5,True,113,"奶霜鐵觀音讚讚！
奶霜真的有在厲害，非常濃厚😍
客人消化速度也真的很快～
態度也非常親切！！推推"
 Yumi P ,https://www.google.com/maps/contrib/102507337789590652818/reviews?hl=zh-TW,5,True,24,店門擺設好可愛，玫瑰鹽奶霜紅茶真滴好喝><，希望我家附近也能快開間分店吶吶吶吶吶!!!!!!!!!!!!!!
 wenchi Tseng ,https://www.google.com/maps/contrib/102017007636740189717/reviews?hl=zh-TW,2,True,375,斯里蘭卡醇拿鐵微糖去冰，口味偏淡不會想再回訪
 xuan lin ,https://www.google.com/maps/contrib/114100479306921999775/reviews?hl=zh-TW,2,False,4,"剛開幕去的時候果肉也不只這樣
難道現在因為開了uber料就縮水了嗎？"
 Kari Shih ,https://www.google.com/maps/contrib/118261722521099352840/reviews?hl=zh-TW,4,False,5,爆芒啵啵真的好好喝😋炎熱夏天很消暑👍🏻但不知店內是否接了大量網路訂單的緣故，現場明明沒有很多人但卻等超久😅😅
 馬賦耀 ,https://www.google.com/maps/contrib/109341506265704736971/reviews?hl=zh-TW,1,False,6,店員機車明明就看到後面有很多人硬要先去做餐點才點餐，一到九點直接拒絕接客傻眼排隊排那麼久心酸的嗎
 陳駿朋 ,https://www.google.com/maps/contrib/110131455152823599547/reviews?hl=zh-TW,1,False,2,酸溜溜檸檬紅茶全糖怎是苦的，不好喝又貴
