user_name,user_profile_url,rating,local_guide,comment_num,comment_text
 Dan Lin ,https://www.google.com/maps/contrib/100892799704622839223/reviews?hl=zh-TW,5,True,369,"#開箱#飲料
-
#有飲Youin創意飲品
點了
#粉紅泡泡草莓優優$80
#焦香椪糖紅茶$40
#炎炎夏日水果茶$75
-
既然都來北部了
絕對要來踩點的啊！
然後都大老遠跑來
想喝的就一次買了

草莓優優
甜度冰塊固定不能調整
就是好喝的草莓冰沙
甜中帶點微酸安捏

水果茶好喝
我點半糖微冰剛剛好不會很甜
水果茶的果香味很有層次
裡面有加了很多水果
但彼此之間不搶味

焦香椪糖紅茶
我點半糖微冰
店員有特別提醒椪糖會隨時間慢慢融化
所以我基本上也沒喝到椪糖本人就融化了
但就是還不錯喝的紅茶啦
-
可以使用
Linepay
街口支付
有載具
-
⚠️飲料現點現做
可能品項都比較搞剛
所以要耐心等待一下唷～～～"
 啊穎 ,https://www.google.com/maps/contrib/116489205326373613571/reviews?hl=zh-TW,1,False,33,"說真的⋯是近期喝到最雷的飲料🥲
-觀音拿鐵加珍珠75元
喝起來完全就是糖水味，沒有奶味沒有茶味，唯一可以的只有很Q的珍珠給過。
大概平日下午五點附近去購買，不需排隊，店裡的店員四五個都在滑手機（超傻眼），點餐的人態度也很不耐煩，沒看過哪一家店店員這麼散。
我只能說鮮奶茶類千萬不要點，看評價原本還不相信，自己踩到雷才想哭，況且75元中杯真的很貴，其他飲品也許好喝，但衝著欸你來的，只能說失望到不行。"
 Tracy Wu ,https://www.google.com/maps/contrib/110452211329687281566/reviews?hl=zh-TW,5,True,513,"超級好喝耶💯😍椪糖奶霜紅茶很優秀、百香果優優用料很實在，還會想要來喝其他品項！
（但店員臉真的太臭了⋯講話又超小聲聽不太到⋯）"
 Kaymi ,https://www.google.com/maps/contrib/108867762851497627089/reviews?hl=zh-TW,5,True,242,今日點餐品項：旺旺來鐵觀音，玫瑰鹽奶霜四季春！旺來鐵觀音我本來要點無糖，店員說會苦，所以改了微糖，茶味真的有濃，但我覺得無糖還是可以的，因為鳳梨本身有甜度，鐵觀音的茶味是我喜歡的濃厚茶味，下次我要喝拿鐵類，可是我看拿鐵都是中杯而已，希望以後有大杯可以買！奶霜四季春的四季春是比較清香的茶，不知道是茶本身還是微糖的關係，我喝起來感覺會回甘耶，哈哈哈哈哈！總之，下次會回購！繼續喝看看別的產品！
 iris hsu ,https://www.google.com/maps/contrib/111704465749356960262/reviews?hl=zh-TW,2,True,40,使用UberEats外送叫餐。古早味紅茶算還可以，但珍珠完全不行，口感不Q外面有點爛爛的中心是硬的，像是擺了很長時間的珍珠。柳橙養樂多啵啵喝起來不是柳橙原汁，且味道偏淡。百香果優優喝了三四口後覺得膩口。以上個人口味分享～
 Yu Ling ,https://www.google.com/maps/contrib/106435846535468657549/reviews?hl=zh-TW,2,True,65,"員工真的是莫名臉臭
帶保溫瓶去買飲料，結果拿到的同時發現飲料品名的貼紙牢牢的黏在保溫瓶上…..實在無言
我拿保溫瓶去過那麼多間飲料店，大多都是沒有在貼的，又不是客人很多搞不請楚需要調製什麼飲料。

紅茶就是一點茶味+糖水
整體來說我家巷口的早餐店紅茶還比較好喝

一顆星給創業辛苦的老闆們
一顆星給復古風的裝潢"
 EINNOB ,https://www.google.com/maps/contrib/103638690955068230657/reviews?hl=zh-TW,5,True,666,"厚乳抹茶奶霜很好喝！抹茶喝起來微苦，加上鹹香的奶霜，整體喝起來很濃郁、很夠味！
加入Line好友，有20元抵用卷，還有ㄧ杯當月生日不限金額的飲料，拿到飲料的時候發現杯子上面有生日快樂，也太可愛了🥳
#椪糖紅茶也是很好喝"
 Regina Su (reginaeatandlife) ,https://www.google.com/maps/contrib/111858781526877378510/reviews?hl=zh-TW,3,True,62,珍珠奶茶爆擊喝起來就是一般奶精奶茶的味道，第一口有茶香後來就被奶精蓋過去了，珍珠很Q也沒有很甜還不錯～整體喝完沒有被爆擊的感覺
 S YO ,https://www.google.com/maps/contrib/118118446487480288678/reviews?hl=zh-TW,3,True,"1,248","芒果優優有點偏酸
糖冰固定，不能調
也許下次嘗試椪餅跟草莓系列的
（聽說評價高）"
 謝銘融 ,https://www.google.com/maps/contrib/105047742878110669667/reviews?hl=zh-TW,5,True,25,"認真！！是我喝過數一數二好喝的珍奶！
茶非常的香醇！珍珠也相當有感覺（自己來體會：））看得出...弟弟和室友的用心！
有飲~推推！！"
 Joe ,https://www.google.com/maps/contrib/110034114202289229403/reviews?hl=zh-TW,5,False,103,"焙茶口味較濃配上滑滑甜甜奶霜也沒有破壞原本的味道，但喝久了有點甜膩。

椪糖奶霜紅，茶味比較清香有個牛奶糖的味道，還有些許苦味，融合後喝起來比較不會發膩。"
 Nash XXX ,https://www.google.com/maps/contrib/111062912420781863876/reviews?hl=zh-TW,3,True,"1,034","結論就是有點失望，但喜歡看你們冰島那些影片，補到三星
--
四季春茶$35
我覺得四季春通常相對店裡會是相對安全的產品，結果我都還不是喝無糖的，就喝起來有點澀感，有飲四季春茶體真的不太行，我們喝兩口就放著不喝了，這無法想像喝無糖會怎樣，我的標準是50嵐四季春，50嵐只要是微糖的四季春，從來沒遇到失手過，我只能說有飲得加油
--
斯底蘭卡醇拿鐵$60
我最擔心的事情發生了，飛牛牧場的真的不像是高大那種，加一點就可以罩整杯，加的量恐怕要多一點才行，這杯是幾乎沒什麼奶味。斯底蘭卡的紅茶是滿適合做奶茶的，但是他們的茶也不算太濃，所以我其實不太知道他們想要表達茶還是想表達奶，就是一杯沒什麼個性的紅茶拿鐵，然後要賣$60，我個人只覺得比十杯濃，比可不可還要不刮胃，其他我真的講不出優點
--
珍珠奶茶爆擊$50
那珍珠奶茶應該要好喝了吧?也沒有，用奶精的奶茶淡到像是鮮奶茶，我還跟朋友確認是不是點珍珠鮮奶茶，然後我覺得他的奶精不香之外，我覺得他的珍珠滿硬的，幾乎是跟那個迷客夏差不多，喜歡那種硬度的人可以試試看，奶精珍奶還是50嵐才是王者
--
憨吉奶霜鐵觀音$70
很多人鐵觀音的胃口被養成茶湯會的形狀，覺得鐵觀音就是要很澀?如果你有喝過真的好喝的鐵觀音(像是冠葉)，你就知道鐵觀音真的是一款很棒的茶，然後我覺得有飲有比茶湯會好，但是也不算太好，但拿來搭配奶蓋還堪用，不要直接單喝都沒事。奶蓋我覺得算是很有特色，有一點地瓜的香氣，然後他的奶蓋有點太濃，濃到結成一大塊，不好跟著飲料一起上來，稍微調整一下會更好，但整體的風味我是給過
--
草莓優優$80
草莓優優我給過，我覺得很像是草莓優格飲，喝起來還有果醬的味道，酸酸甜甜的很好喝，但是也有可能是我們前面四杯都覺得普普，所以相對比較高分，但是一杯$80我覺得不算是可以天天喝的類型哈哈哈"
 PEI CHI PAN ,https://www.google.com/maps/contrib/100073079820069720662/reviews?hl=zh-TW,5,True,872,"⬛️這一年多紅了起來的「手握有飲，所向無敵」。
⬜️店面買的價格會便宜些，大概便宜$5-$10左右。
⬛️粉紅泡泡草莓優優是草莓與優格碰撞出的冰沙，精選的優質乳酸菌，無添加人工色素、防腐劑，口感嚐起來是股酸甜的滋味，再細緻一點的感受，甜味有再稍重一些，並且滑順到容易幾口就喝完了！"
 Chiaos Chen ,https://www.google.com/maps/contrib/108553097783804841971/reviews?hl=zh-TW,4,True,639,很可愛的一間店，品項也蠻有特色的除了一般單茶之外，也有許多水果類的選擇跟奶蓋奶茶等常見的部分另外有氣泡飲系列跟優格系列蠻特別的。
 Ting Yuu ,https://www.google.com/maps/contrib/107776441812260102563/reviews?hl=zh-TW,4,False,8,"點了一杯重培鐵觀音奶茶微糖微冰+雙色地瓜圓
重培鐵觀音奶茶非常好喝，鐵觀音的味道很厚，是會想要一口接一口的奶茶，而且會想再次回購！

地瓜圓的部分雖然料給滿多的，但都吸不太起來
最後飲料喝完料還剩很多，而且吃起來粉粉黏黏的沒有Q度，不知道是有稍微放一段時間（沒有超過一小時）才喝還是本來的口感就比較黏～

不管整體來說覺得還是好喝的，下次會想要嘗試看看別的飲料～"
 Serena Chen ,https://www.google.com/maps/contrib/101799891594545933935/reviews?hl=zh-TW,4,True,28,"耳聞已久第一次嘗試
看到網上兩極的評價有點擔心
但這次品嚐的口味覺得不錯、看來優優是比較不會踩雷的系列
-芒果優優(M)$75
芒果冰沙般的口感、配搭上優酪乳般酸甜解膩的滋味，只可惜有點小杯，飲料也沒有特別果粒或是其他口感，感受不出芒果是否新鮮、好吃，還算過關但是CP值不高。
下次可能會想嘗試看看茶類的飲品。"
 chunhui chan (麥麥) ,https://www.google.com/maps/contrib/112258025371829167740/reviews?hl=zh-TW,2,True,85,"12月11日早上11點半左右來訪
店員點餐客氣，介紹詳細
本次點玫瑰鹽奶霜四季春、熱情百香橙四季、檸檬綠茶啵啵

為什麼要仔細寫到時間
玫瑰鹽奶霜四季春及熱情百香橙四季基底茶都是四季春，但非常之《苦澀》，基本是我們買的時間點應該是第一泡，是真的很苦澀，這一點店家可能要多加油
熱情百香橙四季，百香果是籽並無果肉，所以有點讓我不知道在喝什麼！香橙的味道基本上也沒有

檸檬綠茶啵啵
這一款基本上沒有什麼問題，但在價位上偏貴

整體來說
基底茶-四季春的表現讓我非常驚訝，特地上台北去喝，也非常支持這些創作者，但原茶的表現可能要再好好控管，希望有機會再重新幫你們改評價"
 林婷婷 ,https://www.google.com/maps/contrib/100422974721996169205/reviews?hl=zh-TW,3,False,22,珍珠奶茶爆擊（無糖去冰），是很古早味的奶茶，無糖剛好，剛拿到時珍珠超Q，但過1小時後，珍珠變得比較沒有口感、偏硬，不過店家有建議半小時內飲用完畢，不太適合飲料會喝很久的人購買😂
 郭家禎 ,https://www.google.com/maps/contrib/104874158459165162453/reviews?hl=zh-TW,5,True,41,"是欸粉但也是愛喝手搖控的我
那一天點了四杯但最有印象是草莓優優
還有
檸檬波波夏天買一杯起來立馬解熱
草莓很真實喝起來酸酸甜甜的不會很膩
連不愛喝飲料的男友也覺得很讚🥳偷偷許願趕快來桃園開店啦(⁎⁍̴̛ᴗ⁍̴̛⁎)"
 Mita Lee ,https://www.google.com/maps/contrib/105759777152911017311/reviews?hl=zh-TW,3,True,266,"身為欸了粉來潮聖
結果這個人潮也太嚇人了吧！
先排隊很久後，等了10分鐘
店員說機器過熱，要再等10分鐘
真的傻眼貓咪⋯
飲料是好喝的濃度夠
就是草莓優格的感覺
小心一杯價格偏高"
 vivian kuang ,https://www.google.com/maps/contrib/111033000363750958325/reviews?hl=zh-TW,5,True,98,旺旺來鐵觀音🥤無糖微冰，好好喝☺️，原本店員提醒無糖會有苦味，但因為醃鳳梨帶點甜味，讓鐵觀音喝起來很有茶味卻又不澀，清爽又好喝👍
 葉容均 ,https://www.google.com/maps/contrib/111851512806288533207/reviews?hl=zh-TW,1,False,11,"第一次點的時候做錯，想說再喝一次試試看
這次點熱情百香橙四季微糖微冰
完全就是一杯有籽的無糖四季春茶
沒有任何水果香氣而且一杯不便宜"
 解妮瑾 ,https://www.google.com/maps/contrib/104999915584707768369/reviews?hl=zh-TW,4,True,380,飲品好喝，價位合理，不過在大安路一段單行道內，可能交通上比較要從仁愛路進來比較方便。
 Perry Chung ,https://www.google.com/maps/contrib/108260309448593716176/reviews?hl=zh-TW,4,True,402,天氣熱，等飲料流汗流爆。建議門口放電風扇給大家吹。裡面一堆人在搖飲料還是要等一下。不難喝。不然就是分一半人搖外送一半搖現場。不然天氣熱真的等到火氣大
 tone hector ,https://www.google.com/maps/contrib/114443572853817007313/reviews?hl=zh-TW,5,True,788,有些別的地方沒有的特色飲料，點了抹茶拿鐵三分糖剛好不會太苦或太甜，只是熱的外帶杯的防燙套多了一片出來不太好拿。
 Yeah ,https://www.google.com/maps/contrib/104974536667135263271/reviews?hl=zh-TW,5,True,26,"補紀錄一下3/19的體驗🥰

身為一個焙茶愛好者，這次點的品項是厚乳焙茶奶霜去冰微糖。
除了杯蓋的開口很有趣的是往下壓而非往上推以外，微鹹的奶蓋滑順好喝，焙茶本身的粉感也不會太重，深得我心❤️"
 Vivi Lin ,https://www.google.com/maps/contrib/115748141270849451280/reviews?hl=zh-TW,5,False,33,"椪糖奶霜紅茶
完全是我喜歡的，微冰微糖剛剛好，不會太甜太膩！店員充滿朝氣又可愛，讓我一天的開始擁有好心情☺️"
 琪琪洪 ,https://www.google.com/maps/contrib/110828056919615266758/reviews?hl=zh-TW,5,False,10,有飲生日禮免費，竟然口味可以任選！店員熱情拼命介紹口味，天氣寒冷，選了熱宇治濃抹茶拿鐵(價值75元)，重點，杯子上還打上生日快樂！店員說祝妳生日快樂！豪感動~😂😍💜😢
 tata cheng ,https://www.google.com/maps/contrib/106057549687263909592/reviews?hl=zh-TW,5,True,161,"生日當月有給一整杯飲料的店家，我還不推爆啊。

今天選了新品凍滋凍滋焙茶奶茶，入口是淡淡的焙茶味，尾韻有茶香。茶凍存在感不大。

店家在給你飲料還會說聲:生日快樂。非常有活力!"
 李芳瑩 ,https://www.google.com/maps/contrib/106049732100406432545/reviews?hl=zh-TW,4,True,70,"我喝的是粉紅泡泡草莓優優
自然的水果優格飲，個人偏好在酸一些🍓

想看更多好吃的資訊，歡迎追蹤iG-chin_twice-雙下巴女子日常"
 納蘭雪 ,https://www.google.com/maps/contrib/109744058489851608122/reviews?hl=zh-TW,4,True,339,"飲料都不錯喝，
且品項都很特別，
服務人員態度良好又細心☺️"
 蔡維軒 ,https://www.google.com/maps/contrib/101029964279535305647/reviews?hl=zh-TW,4,True,147,"初訪
位於東區附近的飲料店
由欸你這週要幹嘛的室友和弟弟開的
飲料好喝，但份量跟價錢比較起來確實偏高
點的是粉紅泡泡草莓優優
看起來是人氣商品
但可惜價錢真的偏高"
 Han Flower ,https://www.google.com/maps/contrib/114997557827231534906/reviews?hl=zh-TW,3,True,191,"來試試看珍珠奶茶（沒有特別驚艷的感覺）
奶味不夠重！下次試試看別的看看有沒有更好喝的"
 Daridiridara Du ,https://www.google.com/maps/contrib/108984354754228049903/reviews?hl=zh-TW,4,True,65,"去的時候動線覺得不是很好，疫情難免還是怕怕的，雖然大家都有排隊準備點餐，但是取餐等候真的很混亂（位置）

不過我是二次造訪，優優系列滿推推的
不是因為油土伯支持，而是年輕人白手起家一定支持（我也剛創業，知道這壓力辛苦）

（有飲）一定要加油💪🏻💪🏻"
 Rong hua Shih ,https://www.google.com/maps/contrib/110217366542087577084/reviews?hl=zh-TW,2,False,7,"點外送等了一個多小時，生意好可以理解
結果送來的珍珠真的是我近期吃過最硬的
當時14:20的訂單15:40才收到
難道我是吃到隔夜珍珠嗎？
但奶茶的茶味好喝"
 Jun ,https://www.google.com/maps/contrib/116685115250894285170/reviews?hl=zh-TW,3,False,23,"補4/21紀錄
當天主要是陪北上的朋友到貴店消費，點的飲料是柳橙養樂多波波，飲料中規中矩。
主要覺得員工訓練需加強，剛到店的當下，我實在沒有第一眼找到實名制的QRcode，只看到一個大大的QRcode是加入官方Line好友，於是詢問櫃台店員「請問實名制在哪裡？」當下兩三個女店員竟然面面相覷的不清不楚！最後是一位男店員出來說實名制的QRcode在剛剛看到那一張小告示個，仔細才看到加官方賴的左下有一個小小的QRcode才是實名制，防疫期間，顧客除了應主動掃實名制，員工也應該要進行督促，連實名制在哪裡都不知道，實在讓人很傻眼，希望有進步。"
 廖思婷 ,https://www.google.com/maps/contrib/112062034467394628709/reviews?hl=zh-TW,2,False,10,"也是欸了粉之一～❤️💜❤️
想說來台北一趟一定要來喝看看
最推薦的草莓🍓優優‼️
可是有點小小的失望....
因為..我的優優是從冷凍庫冰箱拿出來的..
並不是現打的..😭
店員小姐姐說他們都會先裝杯～冰起來～
可是...
我前面一位小姐的原味優優就是現打給她的⋯⋯
心裏..有點小小的失落...不知道為什麼不一樣..
應該不是之前多的才先放冷凍冰箱對吧...😭😭"
 浩倫—HAO LUN ,https://www.google.com/maps/contrib/117085142571783730335/reviews?hl=zh-TW,5,False,1,"已經拜訪有飲7次了他們的飲料真的很特別
茶種都是精心挑選過每一杯飲料都是他們精心調製
已經快把全品項喝完的我真心推薦優優系列
超級好喝的啦！推推👍"
 FeiFei Lee ,https://www.google.com/maps/contrib/117605199095980022676/reviews?hl=zh-TW,3,True,30,"鐵觀音拿鐵茶跟奶中規中矩
不難喝但在眾多飲料店不是特別讓人印象深刻
不過珍珠是Q的有加分
補充一下服務態度真的很不錯👍🏻"
 Pinyu Ting ,https://www.google.com/maps/contrib/112481041684479147459/reviews?hl=zh-TW,5,True,304,平日晚間八點到店裡，人潮不會很多，前面大約三組客人，點單的是弟弟阿勳，人很親切，看到我們在拍照還在後面比✌️，也都很有笑容的接待客人，詢問是否可以合照，阿勳也答應，很親民。飲料推薦：柳橙養樂多啵啵跟粉紅泡泡草莓優優，很特別的口味，外面一般飲料店沒有，值得推薦的店家，會再回購，許願希望下次可以看到欸家族的其他成員～
 Grace Ko ,https://www.google.com/maps/contrib/111022907445090148930/reviews?hl=zh-TW,1,False,19,"上禮拜買了一杯珍奶，覺得珍珠很Q很好吃，今天特地點了不一樣的雙寶圓，喝一口整個吐出來，很硬的地瓜圓跟芋圓。很糟糕
很像沒煮熟的口感（重點我一拿到就喝並沒有擺放過久）"
 Che-En Chang ,https://www.google.com/maps/contrib/100591465591493248825/reviews?hl=zh-TW,3,True,211,"名氣很大，但個人認為有點過譽。
焙茶拿鐵，熱，3分糖，喝第一口很濃郁，但喝到後面會覺得太甜，下次可能考慮點無糖。"
 JH. ,https://www.google.com/maps/contrib/100727197674155303709/reviews?hl=zh-TW,3,True,198,欸了粉來捧場，點了珍奶爆擊，茶味不夠，珍珠也有點死硬，真的不太好喝，囧，希望能改善進步，過一陣子會再來試試。
 Hannah Syu ,https://www.google.com/maps/contrib/110987259651252053949/reviews?hl=zh-TW,3,True,69,"出餐速度很快，這點很厲害👍
但整體不會再回購，購買流程店員讓人很壓迫，好像多等二秒他白眼就要上來了。
點了二杯奶霜系列糖度是店員建議的半糖，所有人喝起來都一致覺得偏淡沒味道，茶跟奶霜都很清淡，可能是走養生系列。
還點了蘋果優優，喝起來像蘋果牛奶的冰沙版，沒有想像中的驚艷，偏甜喝了覺得有點膩（我本身飲料都喝微糖或三分糖，所以本來就不愛喝太甜的）。"
 Banson LIN ,https://www.google.com/maps/contrib/114947692389900045601/reviews?hl=zh-TW,5,True,"1,149","相信自從你們公佈開店後，就忙得天翻地覆，且讓我驚訝的是，你們對待每個要求拍照的粉絲都來者不拒，在忙都會露出微笑與粉絲合照，對你們超佩服的。
另外你們的飲料真的好喝，沒有白跑一趟！推薦給大家"
 Abby Yang ,https://www.google.com/maps/contrib/117370820418462937767/reviews?hl=zh-TW,3,True,56,"星期日下午經過看到沒什麼人潮，買了2杯來嚐鮮，旺旺來鐵觀音喝起來是有茶味但是茶會澀，鳳梨的味道非常淡。
草莓優優不難喝，但是以這樣的價位會想去買比較有特色的飲料，整體來說不會想再回購第二次。"
 HE L ,https://www.google.com/maps/contrib/116614331419167692523/reviews?hl=zh-TW,5,False,3,點了新品多肉葡萄綠+寒天纖果但是都沒有喝到葡萄果粒🥺加料是會把果粒打碎嗎⋯🥺雖然沒有吃到葡萄果粒但是葡萄綠真的很好喝！！還是推推～
 LING (Lil) ,https://www.google.com/maps/contrib/108750039334774533351/reviews?hl=zh-TW,4,True,115,檸檬綠茶波波有夠讚，旺旺來鐵觀音就普通，應該是個人口味問題
 Bella ,https://www.google.com/maps/contrib/117914383976111130392/reviews?hl=zh-TW,1,False,4,剛剛點了一杯店員推薦動滋動滋焙香奶茶，店員推薦無糖或微糖；回去喝了發現非常苦，整杯拿回去跟店員說剛剛推薦的不好喝，店員兩相看後沒有反應，最後請店員幫我在點一杯厚乳焙茶奶霜，然後奶茶請幫忙丟掉，來回兩趟飲料店花了131元，非常不值得，哭泣！不推薦😭
 byRichang ,https://www.google.com/maps/contrib/110926412723645661183/reviews?hl=zh-TW,4,False,2,"🌈歡迎追蹤IG@byrichang
#客製化禮物#客製化犀牛盾#casetify客製化#客製化保溫瓶#客製化鑰匙圈#客製化無框畫#客製化手繪#客製化無臉畫#手機掛繩#交換禮物#情人節禮物#婚禮小物

c編是第一次喝，平常就會看欸的影片，緩解想出去玩的心情，而且成員都很有趣，邊看都會笑到不行～
還好去的時候人不多（c編很討厭排隊），其實根本不知道要喝什麼，只記得影片有介紹鳳梨什麼的，但是菜單看超久還是找不到，只好直接問店員
店面裝潢就是復古文青風，c編最喜歡花磚的裝飾跟玻璃窗花，真的有阿嬤家的感覺
🥤c編喝-鳳梨優優$75
友人是喝-檸檬綠茶啵啵$60
其實聽名字根本不知道是什麼😅，結果是優格冰沙，我覺得奶味偏重，鳳梨味不明顯（可能因為太冰），我覺得稍微融化後比較好喝
相比起來我更喜歡友人點的，很清爽，茶味跟檸檬味搭配的不錯，氣泡水應該也有點微微糖，氣泡不嗆喝起來蠻順的，也沒有氣泡水怪味
-
總結
不錯喝但價格不便宜，而且c編平常其實很少喝飲料，除非剛好有經過，不然應該不會特地買來喝
🦭c編給分
美味程度：☀️☀️☀️☀️"
 沈珮璇 ,https://www.google.com/maps/contrib/112141615128850019323/reviews?hl=zh-TW,3,False,9,"星期六早上11:40去購買，點單速度很快但等了超過10分鐘才拿到飲料(有算過前面只有兩張單共6杯飲料)，如果趕時間可能不太適合去排隊。
口味的部分，憨吉奶霜紅無糖去冰，偏水沒什麼茶味，蘋果優優還不錯。
遇到的櫃檯人員挺親切的，也會好好解答疑問，有一點希望可以再加強的部分，奶蓋可以不要杯蓋改成封膜(單據上可以打)，但內場依單據做出來的還是用杯蓋，是櫃檯人員喊號後才發現幫忙重新封膜的，多浪費了一個杯蓋。
除非想喝特別的口味，不然回購可能性低。"
 A_Yen Liu ,https://www.google.com/maps/contrib/107744261094552231404/reviews?hl=zh-TW,5,True,51,氣泡飲的系列很讚，另外喝過幾次鮮奶茶加珍珠也很喜歡，茶類的飲料整體來說蠻順口的。
 黃士倫 ,https://www.google.com/maps/contrib/101620592521030983188/reviews?hl=zh-TW,5,False,4,"是一間飲品充滿各種特色的店家

草莓優優是個人認為裡面最好喝的一款酸甜度滿接近剛好

百香優優：滿有特色好喝，跟外面其他家飲品的百香飲品相比之下百香的酸度跟香氣比較明顯且大於甜度，但比較可惜的是甜度還是蠻高的，希望能夠讓顧客選擇甜度，整體會更好

輕輕小樹蘋果綠：綠茶香味明顯蓋過蘋果，只有搭配蘋果果粒才比較有蘋果的香氣味道出來，猜測店家想呈現給顧客的感覺是茶味為主體搭配果粒，整體跟想像的不太一樣，
若是想要直接喝出飲品茶飲混著蘋果風味果汁或糖漿的人會稍微失望一些，不過喝起來也是滿不錯的"
 Qin Y ,https://www.google.com/maps/contrib/111848810122299519749/reviews?hl=zh-TW,4,True,165,"粉絲報到看到開了飲料店有機會就特地來朝聖
草莓優優真的意外的好喝！
糖冰固定但是酸酸甜甜的讓人不會膩
冰沙打得很細緻喝起來順口
外面其他店家很多都是太甜的草莓醬感
但是這杯真的很推❤️
大部分的人點餐也都點這杯
我還有買另一杯純茶
無糖喝起來是茶葉茶感覺真材實料❤️"
 weihan Weng ,https://www.google.com/maps/contrib/107313488282445795485/reviews?hl=zh-TW,5,True,49,"身為手搖飲博士試營運迫不及待馬上點來喝，草莓優優超好喝，微冰沙感，酸甜恰到好處
唯一的遺憾是沒有點兩杯🥲

再度回訪，這次點珍珠奶茶爆擊，珍珠超好吃奶茶茶香會回甘奶香適中喝起來剛好順口！蜜香釀珍珠好愛❤️

三訪！這次點玫瑰鹽奶霜紅茶🌹上面那層奶霜好愛，而且不會膩～淡淡玫瑰清香跟茶融合一體，誰也不搶誰的味道推推👍🏻"
