user_name,user_profile_url,rating,local_guide,comment_num,comment_text
 Shanna Lin ,https://www.google.com/maps/contrib/102393310524793953711/reviews?hl=zh-TW,5,False,6,被裝潢吸引～想說嘗試看看，沒想到竟然只是奶綠就這麼令人驚艷‼️真滴讚👍🏼下次要喝看看優格系列🤤
 沙拉生活SaraLee ,https://www.google.com/maps/contrib/118082014258015244365/reviews?hl=zh-TW,5,False,35,"好可愛的店面！第一天開！
飲料好喝啵啵氣泡系列推推
珍珠奶茶也不能錯過！"
 劉嘉雯（Culex） ,https://www.google.com/maps/contrib/109468313288801692746/reviews?hl=zh-TW,3,False,5,點了斯里蘭卡醇紅茶，嗚嗚好像抱太大期望，整個好澀，還是大家推的是奶類？🥲
 WEI ZHI ,https://www.google.com/maps/contrib/104911658379447672900/reviews?hl=zh-TW,5,False,9,"優優系列超讚的！
一定要買看看
恨不得可以喝更大杯"
 Joy ,https://www.google.com/maps/contrib/114110714972450275190/reviews?hl=zh-TW,5,False,11,"從台北遠渡來台中的蘋果優優完全沒有變味
感謝兩位老闆的貼心！！
推推"
 周秉萱 ,https://www.google.com/maps/contrib/101694200785341829581/reviews?hl=zh-TW,5,False,22,"百香果優優很好喝🥰
太開心可以看到你們了！
祝開業順利😁"
 Elmo Wu ,https://www.google.com/maps/contrib/101844266117923398384/reviews?hl=zh-TW,5,True,258,"有創意的飲品
遠從中部來踩點"
 王怡心 ,https://www.google.com/maps/contrib/111404224104826126651/reviews?hl=zh-TW,1,False,11,"訂了ubereats才說品項短缺

一杯7、80的中杯飲料真的很普通…"
 Giki Chen ,https://www.google.com/maps/contrib/103568952159087510970/reviews?hl=zh-TW,1,False,8,"特地去買，失望而返
濃粹綠茶一般般
柳橙養樂多波波完全沒有氣泡感"
 TY Huang ,https://www.google.com/maps/contrib/109009063712054380625/reviews?hl=zh-TW,1,True,82,"古早味紅茶餘韻非常澀
離峰時段四個店員製作都還要等蠻久的…."
 Mavis Chen ,https://www.google.com/maps/contrib/111559455419327201416/reviews?hl=zh-TW,3,True,201,"厚乳抹茶奶霜$80
抹茶味道好淡
但奶蓋不錯份量也蠻多的"
 Meg Lee ,https://www.google.com/maps/contrib/116960631583860097035/reviews?hl=zh-TW,3,True,132,"味道上偏普，價錢卻偏貴，所以不會再訪。
真是不懂現在大家喜歡ㄉ味道惹。"
 LCH ,https://www.google.com/maps/contrib/101154328089651118632/reviews?hl=zh-TW,1,False,6,呵呵做錯飲料太蝦了點了柳橙養樂多啵啵結果裡面是檸檬氣泡飲
 Wu ,https://www.google.com/maps/contrib/101276130032003079115/reviews?hl=zh-TW,4,False,7,草莓優優是不錯喝的但是價格偏高😵‍💫
 丁偉婷 ,https://www.google.com/maps/contrib/107709594229412329549/reviews?hl=zh-TW,1,False,6,1/1219點左右到公館店買飲料，飲料是蠻好喝，但是當晚結帳的戴眼鏡男店員態度真的讓人不敢恭維，點餐講話非常小聲完全聽不到，點到200元就放杯套在桌上，也不說是送的還是怎麼樣，好聲好氣的再次詢問，結果換來不耐煩，又不是每個人都是你們的粉絲怎麼會知道優惠活動，還有！載具刷不到，店員也就一個不耐煩的臉跟口氣說螢幕可以亮一點嗎，哈囉服務業很辛苦，但真的不需要再一個你不想工作的地方委屈自己，最後，就算飲料再好喝，員工訓練還是要吧。
 林庭毅 ,https://www.google.com/maps/contrib/114824714207405574612/reviews?hl=zh-TW,4,True,51,"粉紅泡泡草莓優優80
(甜度冰塊不能調整)

大概1-3分甜，
天然草莓味，
喜歡濃郁化學草莓的可能會不愛，
整體偏清爽，
因為是欸粉來支持。

少2星是因為：
飲料送上來時，
吸管明顯有被優優沾到，
拿飲料時發現店員沒有擦杯身，
導致沾得手都是，
(當時只有我一組客人)
但店員有發現我準備自己拿衛生紙，
迅速把飲料拿回去清理，
並遞上衛生紙給我，
覺得應變能力很好，
所以加1星。

希望之後可以再嘗試其他品項，
找到我的最愛。"
 Kev L ,https://www.google.com/maps/contrib/106824746741430561730/reviews?hl=zh-TW,2,False,34,"一般都會買飲料菜單上各品項至少一款才會留評價
珍奶類茶味不夠，珍珠太硬品質不穩
水果茶氣泡水類也是食之無味

除非粉絲濾鏡很重不然不推"
 Nana ,https://www.google.com/maps/contrib/102279626161995213146/reviews?hl=zh-TW,1,True,113,"朋友幫忙外帶買了飲品，第一次喝到這麼澀的手搖紅茶拿鐵，沒喝到半杯就直接倒進水槽了，越喝口就越渴。
朋友點的純茶鐵觀音更慘，沒喝到3/1杯也是整杯給水槽，打開封膜，發現茶的顏色竟然比普洱茶還深，茶味苦到不行，希望創辦飲料的人是真的自己有品嚐喝過店裡的品項。"
 Sylvia ,https://www.google.com/maps/contrib/101109665771335150021/reviews?hl=zh-TW,3,True,30,"2021開幕觀望了一陣子
每次都是滿滿的人潮
抱著期待的心來試一下

這次選了臉紅紅蘋果優優
是冰沙體甜度也是固定的
喝下去沒有特別驚豔的感覺反而被冰塊本體跟冰度蓋過了本身優格的味道，需要放一陣子有點融化了之後才喝得出優格的味道
可能要等夏天再嚐嚐看第二次"
 李雯雯 ,https://www.google.com/maps/contrib/101810425857069900898/reviews?hl=zh-TW,1,True,108,"第一次來朝聖
實在太失望…..
昨天買了五杯飲料
有兩杯是杯家人買的
一杯取餐是取餐店員發現做錯，所以馬上重做了一杯
另一杯到家才發現根本整個品項都不對
明明看著菜單點綠茶拿鐵60元
會到家才發現根本不是我點的品項
擅自幫我們點了新品，根本也沒有再菜單上然後一杯75…
點餐時店員也沒有重複確認品項
一而再的弄錯🤦🏻‍♀️
感受有夠差的….

另外補充：1922實聯制QRCODE有夠小有夠難掃…沒有主動問可能還找不到在哪呢！
（店家也沒有落實實名制）"
 小邱 ,https://www.google.com/maps/contrib/105754035879763184177/reviews?hl=zh-TW,3,False,21,"特地北上上來品嚐高雄鄉下人騎車U拜
狂飆台北單行道就為了阿迪的有飲
沒想到喝到中杯草莓優優後
感覺像高雄7-11的AB優格乳草莓冰沙
不大有到這個價格我猜應該是喝信仰的"
 Leo Yang ,https://www.google.com/maps/contrib/113090783663210999209/reviews?hl=zh-TW,1,True,44,點了menu推薦的憨吉奶霜鐵觀音，說茶沒茶味，奶霜也不香，也喝不出來地瓜香，整杯就是一股怪味，70元也不算便宜，真的是靠網紅炒作出來的飲料店....
 Nancy Lin ,https://www.google.com/maps/contrib/101592508436977715659/reviews?hl=zh-TW,3,True,20,"弟弟阿勳很親切先推平日下午不用等太久
草莓優優以各大飲料店來說，是很可以喝的草莓系飲料了，甜度濃度都很完美，即便放了一下融化也是不差，會想喝其他優優系列

但另一杯斯里蘭卡醇拿鐵加珍珠，就普普通通，茶用的感覺不差，但比較像早餐店的鮮奶茶不是濃厚系的，或許是飛牛鮮奶比較淡雅，可能要再著墨一下，珍珠就中規中矩"
 思 ,https://www.google.com/maps/contrib/114156008469036188558/reviews?hl=zh-TW,1,True,24,"喝完只有失望…單價好高(;´༎ຶД༎ຶ`)
尤其是珍珠死甜又硬
第一次買到喝不完的飲料店@@"
 李承駿 ,https://www.google.com/maps/contrib/108004325538634426432/reviews?hl=zh-TW,3,True,47,飲料的料稍微偏甜，已經無糖了還是覺得甜
 XIAN ,https://www.google.com/maps/contrib/102402250153074331648/reviews?hl=zh-TW,1,False,22,"覺得有點失望沒有如影片說的那樣多好喝..
當天點了重焙鐵觀音奶茶+珍珠溫的
店員說溫的只有中杯，我以為價格會少5-10元
結果沒有，照樣收大杯的錢，不懂價值在哪裡？
飲料容量少了160ml好像被坑了錢…
而後店員給小吸管，由於趕著離開沒注意到，到要喝的時候才愣住…也無法喝，只能放到回家喝
重焙喝起來也蠻普普的沒有想像中的濃，跟一般飲料店的奶茶比起來差不多.."
 Juanita Huang ,https://www.google.com/maps/contrib/102522014792673960103/reviews?hl=zh-TW,4,True,71,上台北玩特地繞去光顧的飲料店，草莓優格很好喝，只是單價有點高，柳橙養樂多氣泡飲喝不出特別，很有創意的店面，剛好遇到聖誕節，滿額有多送一瓶茶，只是茶的味道有點奇怪，但瓶子很可愛，喝完會想收藏。
 羅Eileen ,https://www.google.com/maps/contrib/108850067344752654337/reviews?hl=zh-TW,2,False,9,"今天11/28大概11:30多左右的時候去購買，很喜歡欸你這週！所以我們特地從台中上來怕要排隊一到台北就去貴店了。意外都沒有人，但點餐人員好冷淡，很沒有溫度，態度也沒有很好….覺得有點扣分
飲品-
草莓優優真的不錯
柳橙養樂多啵啵完全沒有味道，好像稀釋的柳橙汁，不符合預期
結論服務人員有待加強！！"
 雷磁頭殼 ,https://www.google.com/maps/contrib/102788214883240812648/reviews?hl=zh-TW,3,False,43,"從""欸你這週要幹嘛""認識弟弟和室友，
難得北上想說用行動支持他們，
點了百香優優和珍珠奶茶爆擊。

百香優優甜度有點甜，
可惜這項飲品不能調甜度冰塊，
不知道是為了要統一味道還是什麼原因，
如果有一天可以讓客人自行調整那就更讚了。

珍珠奶茶爆擊就......珍奶，
沒有到特別驚豔。

人潮雖然很多，
但出餐速度蠻快的!
P.S.店員好像都是女生?!!!!"
 Annabella Liao ,https://www.google.com/maps/contrib/100610901240743495377/reviews?hl=zh-TW,1,False,23,衝著是欸了粉來支持，第一次東區店點優格味道很奇怪很水，想說是因為剛開幕店員可能不熟練，到今天再去買一次旺旺鐵觀音半糖，沒鳳梨味只有澀澀茶味，店員態度也是一樣很沒禮貌
 W.Y Liang ,https://www.google.com/maps/contrib/101600650634677123737/reviews?hl=zh-TW,5,False,33,"個人喜歡茶味重的
鐵觀音珍奶跟一般珍奶都蠻好喝的
珍珠軟硬也剛剛好

原味優優普通
可能因為我不愛冰沙所以這對我來說吸引力不大"
 Ashley Liao ,https://www.google.com/maps/contrib/107318480966946365930/reviews?hl=zh-TW,4,True,232,"路過欸你這週弟弟開的飲料店
想說之前剛開大排長龍
這天沒排一定要來喝看看
看了一下估勾評論想看網友推薦啥
結果看到珍奶不推薦茶也不推薦的⋯🤣
但秉持著嚐鮮精神
點了水果茶試試(店員建議我半糖，我改微糖還是有點甜)
整體蠻清爽還不錯啦
但不是會讓我癡迷想念的飲料～

💰炎炎夏日水果茶NT$75"
 shao hsuan Lin ,https://www.google.com/maps/contrib/102094905857234520332/reviews?hl=zh-TW,5,False,7,"試營運人多但等待值得
價格比許多網紅合理許多
有飲喝拎推推👍🏻"
 Josh Chen ,https://www.google.com/maps/contrib/100393779449665242506/reviews?hl=zh-TW,1,False,22,"第一次買草莓優優覺得很普
但店員在推薦我這個最好喝
當下覺得可能是店內需要促銷此款
第二次買柳橙養樂多波波三百個問號
文案、店面整體都做的不錯
原物料跟飲品內容真的需要調整加強ㄧ下
否則大安路上不下十間飲料店不會選這家"
 羅育瑩 ,https://www.google.com/maps/contrib/103785729344977997367/reviews?hl=zh-TW,1,False,7,店員態度不耐煩，我說我偏好奶味重的，依她推薦點了鮮奶綠，結果很水，後面店員也都在玩手機很散漫的樣子，飲料如果是每個人口味不同，那請加強員工訓練。
 Alina Wu ,https://www.google.com/maps/contrib/109211769842332735489/reviews?hl=zh-TW,2,False,9,一店剛開幕有去喝過特色飲品（有點久了忘記喝什麼），這次二店開幕也特地去支持一下，身為無糖茶控這次點無糖四季春來試試，喝下第一口有嚇到，不會澀但也完全沒有茶味，我大概16:00去買的，不知道是不是生意太好，茶泡得不夠久，但入口有一股生水的味道，我真的不解怎麼會喝到這種味道，建議店家每一泡茶都要試喝一下，另外茶是飲料的基底，身為資深欸了粉，真心建議要好好處理茶的問題。
 Kyle ,https://www.google.com/maps/contrib/106347852297498429780/reviews?hl=zh-TW,5,False,4,"路過看到店面復古可愛就來買了
滿分1-10分我會給10分
尤其是旺旺來鐵觀音可以給到11分"
 jie chen ,https://www.google.com/maps/contrib/107879329068507122420/reviews?hl=zh-TW,1,False,3,"經過附近特地來踩點嚐鮮～
服務態度雖然很好，但飲品的部分有很大的進步空間，不可能一家飲料店能把所有品項都做到非常好，但個人覺得既然推出了這個品項就應該至少做到同行的中間值左右，如果達不到的話就應該要捨棄才不會讓大多數的顧客失望。

我點的是一杯鐵觀音，千辛萬苦才喝完，嚇到來看評論才發現一堆人都跟我一樣覺得在喝茶水奶水，真心希望可以將原物料或是SOP重新調整試試看，再加油"
 陳定緯 ,https://www.google.com/maps/contrib/113410157459310315765/reviews?hl=zh-TW,5,True,31,"去的時候看到很多人本來想放棄
但是因為是特地過去的所以還是買了
從排隊點餐到拿到飲料大概才五分多鐘
價格不貴飲料好喝動作快速服務親切
不給滿分真的不行👍"
 邱郁芳 ,https://www.google.com/maps/contrib/105499398753484018256/reviews?hl=zh-TW,1,False,2,"憨厚紅茶拿鐵要茶味沒茶味
要奶味沒奶味有點雷🥲像水"
 張凱翔（凱凱） ,https://www.google.com/maps/contrib/100244067095460356846/reviews?hl=zh-TW,5,True,174,"斯里蘭卡拿鐵+珍珠好吃❤️$70
弟弟很帥妹妹很瘦"
 WA蛙 ,https://www.google.com/maps/contrib/101303678338060908896/reviews?hl=zh-TW,5,True,137,每個種類都喝過啦～這次是喝優優！每次嘗試不同的種類都讓我多越多新歡啦！身為桃園人只要去台北都一定去有飲點一杯～老實說原本是粉絲心態去的，但現在完完全全是因為有飲真的很中我的味，每次回家都好想拜託闆闆擴店到桃園(⁎⁍̴̛ᴗ⁍̴̛⁎)
 陳依汶 ,https://www.google.com/maps/contrib/103266382084270835039/reviews?hl=zh-TW,5,False,10,"炭焙鐵觀音拿鐵很推，鐵觀音茶味非常香非常濃，身為鐵觀音控非常給過！
草莓優優、百香果優優超推，不會形容的味道，因為沒有喝過類似的，比草莓優酪乳更自然一點的味道（？真的很讚很推！
柚香氣泡飲也推！真的沒有踩雷的飲料，柚香味很足，不死甜！
珍珠也超級給過，Q彈有嚼勁，黑糖味很香，超讚！！
沒有雷的飲料啦，弟弟室友辛苦了加油～"
 Xuan Chang ,https://www.google.com/maps/contrib/105832266030654202413/reviews?hl=zh-TW,4,True,243,"珍珠奶茶爆擊珍珠不錯有Q
茶味帶點咖啡香不錯喝～～

韓吉奶霜鐵觀音
加的三寶料偏硬，感覺沒煮熟，比較可惜
但單喝茶是好喝的奶霜不膩真的有韓吉香"
 周詩涵 ,https://www.google.com/maps/contrib/106916560401752633208/reviews?hl=zh-TW,5,False,6,"四季春茶好喝！！
淡淡茶香很清爽喜歡喝茶的可以試試❤️
而且LOGO超可愛的～～～"
 杜翊瑄 ,https://www.google.com/maps/contrib/103491838228301926584/reviews?hl=zh-TW,5,False,6,"喝了珍珠奶茶爆擊超好喝！！
茶味濃，珍珠是好吃的還有先蜜過！！👍"
 Agnes Zheng ,https://www.google.com/maps/contrib/103075958360818899665/reviews?hl=zh-TW,3,False,11,"草莓優優好喝
深焙鐵觀音喝起來太澀了
然後看了很多評論
發現其它飲品也有些許問題
覺得你們開二店要在考量一下🤔"
 huiju chen ,https://www.google.com/maps/contrib/109477498876301098999/reviews?hl=zh-TW,3,True,46,可能期待太高，喝起來沒有很驚艷～～鐵觀音味道很濃，但泡過頭已經有點苦澀，上面奶蓋太稀也無法蓋過那個味道，導致喝完一口，留下的是茶的苦味～
 呆呆（呆呆） ,https://www.google.com/maps/contrib/110815868429192684446/reviews?hl=zh-TW,4,True,88,"優優系列的飲料個人記得不錯很好喝
珍珠奶茶的茶也不錯但是珍珠就相對糟糕了，不知道是因為客人多趕出餐還是時間把控不好當下拿到的時候吸的第一口就吃到了沒有熟的珍珠，希望可以多多再注意，加油！"
 Chiu Aileen ,https://www.google.com/maps/contrib/101929543483520107607/reviews?hl=zh-TW,5,False,11,"好久沒喝到好喝的珍珠奶茶🧋
珍珠是有味道的珍珠😋"
 鈴芳 ,https://www.google.com/maps/contrib/109203453953583699042/reviews?hl=zh-TW,5,True,71,"草莓優優很好喝！！
在外面沒喝過的飲品~推！"
 劉嘉欣 ,https://www.google.com/maps/contrib/116727720684577815991/reviews?hl=zh-TW,5,False,19,"草莓優悠
莓果啵啵很好喝
下次再來喝其他的~"
 Di Tao ,https://www.google.com/maps/contrib/101686503815693611254/reviews?hl=zh-TW,1,True,24,"9/28前往購買的
點了安全牌的珍珠奶茶爆擊（之前看到某支影片說這是銷售前兩名的飲品）
珍珠是好吃的有嚼勁的，但是給的量很少
真的很少，正常喝的情況下，珍珠吃完飲料還剩三分之一杯，我覺得很離譜，少的離譜
而且個人覺得都叫珍珠奶茶爆擊了，珍珠應該也不會太少吧，那不然就不要取那種名字，混淆消費者（還是只會混淆我？

隔沒幾天家人去買了一杯四季春加珍珠，茶味太淡，珍珠一樣給很少，正常的喝（這裡指的是不用刻意拿起吸管只喝茶，刻意沒吃到珍珠，或者刻意一直吃珍珠）喝到最後珍珠吃完，飲料一樣剩下三分之一再多一點！

應該不會有下一次了，試過味道就好，還是買50嵐就可以了😌"
 秀秀夢娜 ,https://www.google.com/maps/contrib/105794113926862429017/reviews?hl=zh-TW,5,True,37,"目前喝過
憨吉奶霜紅（5/5）（微糖少冰）微濃紅茶配上濃郁的奶霜（整個超厚一層很大手筆）完全絕配
玫瑰鹽奶霜（4/5）綠茶太清淡喝到最後奶霜有點膩
柳橙養樂多啵啵（4/5）很健康的感覺！完全不會太甜，淡淡的養樂多跟柳橙味道。
炎炎夏日水果茶（5/5）我心中最愛！青茶底跟柳橙百香果、葡萄柚帶出清爽的水果茶很讚！
.
欸～偶然經過
你看！
這邊開了一家新飲料店
週三午休剛好來買買看
要不是有試過
幹超好喝
麻煩再來一杯！
好喝一直喝了好多次
棒！"
 Liu Jonnhy ,https://www.google.com/maps/contrib/105998096136787375808/reviews?hl=zh-TW,4,False,6,"有點略為失望
草莓優優個人可以接受，喝起來蠻驚艷的，會回購
玫瑰鹽奶霜四季春，茶是香的，但是奶蓋沒有一點點鹽的味道，就是奶味非常重的奶蓋，且一杯70來說，cp值不高，可以點一杯四季春35，回家自己做奶蓋😂"
 Nelson ,https://www.google.com/maps/contrib/115005958014716186808/reviews?hl=zh-TW,5,True,46,"草莓優優果然是招牌真的好喝欸👍
柳橙養樂多啵啵很有氣泡感中規中矩的氣泡飲料覺得不夠甜但可惜糖度固定⋯
假日的下午來買排隊五分鐘就拿到飲料效率挺不錯的"
 hsiaowen Chung ,https://www.google.com/maps/contrib/101530196789201198767/reviews?hl=zh-TW,5,False,62,"復古文青好喝的飲料店
去到台北一定會去喝一杯"
 YAO YAO ,https://www.google.com/maps/contrib/115623201628654827655/reviews?hl=zh-TW,5,True,123,"粉紅泡泡草莓優優超好喝👍🏻酸甜剛剛好

IG:yao_928"
 H hc ,https://www.google.com/maps/contrib/106980160378748408723/reviews?hl=zh-TW,5,True,699,凍茲凍滋培香奶茶微糖微冰很香濃，凍稍硬也好吃
 Chia-En Tsai ,https://www.google.com/maps/contrib/102706270095350264920/reviews?hl=zh-TW,2,True,23,點了大家好評的玫瑰鹽奶霜紅茶和斯里蘭卡拿鐵加珍珠（本來想點珍珠奶茶爆擊換鮮奶，但店員說沒辦法），覺得很失望，兩杯喝起來都蠻普通的，但珍珠微甜好吃😋，如果不用排隊又剛好經過可以買！男性結帳店員態度不佳🙃
 高多 ,https://www.google.com/maps/contrib/109169273448604233078/reviews?hl=zh-TW,5,True,377,人員待人親切草莓優格好喝
 Z Zz ,https://www.google.com/maps/contrib/110915984096676081346/reviews?hl=zh-TW,5,True,317,"檸檬紅茶好好喝～
少冰半糖搭配剛剛好
推薦👍🏻👍🏻👍🏻"
 籃Y布魯 ,https://www.google.com/maps/contrib/118029427832844059614/reviews?hl=zh-TW,4,True,28,"老闆親力親為，拍照也來者不拒很親切喔。價格也跟一般網美店來講樸實很多。

宇治抹茶拿鐵真的不行。我點半糖了味道還是偏淡。
旺旺來鐵觀音。很像在喝觀音茶裡面放鳳梨顆粒而已。觀音茶太強勢了整個蓋過鳳梨味。
優優系列產品真的很棒！列為下次必點產品！"
 Hua Wu ,https://www.google.com/maps/contrib/102993253807880078575/reviews?hl=zh-TW,5,True,18,椪糖奶霜紅超級好喝～
 四四 ,https://www.google.com/maps/contrib/105785806620824416762/reviews?hl=zh-TW,5,True,43,"奶霜很好喝！
身為欸了粉必來朝聖！"
 何依庭 ,https://www.google.com/maps/contrib/111312708637005131417/reviews?hl=zh-TW,5,False,18,"路過來買了珍珠奶茶爆擊跟草莓優優
對平常喝微糖的人，優優有點太甜了
但我妹很愛，她說超好喝
我自己喜歡珍奶，點微糖微冰我覺得剛剛好
我爸喝了一口竟然說是他喝過最好喝的
（他很不愛珍奶，所以覺得茶味夠的比較好喝吧

下次再來試別種👍🏻"
 Parisa ,https://www.google.com/maps/contrib/114092087912255344875/reviews?hl=zh-TW,3,True,26,"飲品本身還是不錯
服務態度感受度沒有剛開幕這麼誠懇"
 大吉小姐 ,https://www.google.com/maps/contrib/115228808995279878124/reviews?hl=zh-TW,5,False,3,"旺旺來鐵觀音
天然茶香搭配鳳梨酸甜~
好喝"
 mi Mi ,https://www.google.com/maps/contrib/116223999784024313868/reviews?hl=zh-TW,5,False,13,"珍奶爆擊結果沒有被爆擊到，奶茶口味像是傳統復古奶茶，但就不知道爆擊的點在哪了？🤷🏻‍♀️
珍珠非常Q，有嚼勁的類型，咀嚼肌會變強壯💪🏻，帶點黑糖味。
鐵觀音奶茶也很好喝！
下次會買鐵觀音奶茶及嘗試其他口味👍🏻
（是在公館汀州路買的）"
 p86111 ,https://www.google.com/maps/contrib/102495087023761052213/reviews?hl=zh-TW,2,True,523,"外賣奶茶喝起來有種酸味
朋友喝茶的茶也很不好喝
----
第一次來試試看
點了一杯招牌，還不差
現場人很多，好像網紅開的。但排隊不用排
很多好像是來見網紅的"
 squirrel ooh ,https://www.google.com/maps/contrib/110869845218224050138/reviews?hl=zh-TW,4,False,32,"四顆星是因為真的很喜歡室友跟弟弟
不然不會再到店消費了⋯⋯
跟朋友北上買草莓優優、柳橙養樂多啵啵
草莓優優建議可以到超商買AB優酪乳草莓口味
柳橙養樂多真的超級淡⋯
就是很淡的柳橙氣泡水養樂多沒什麼味道
超級失望價格又偏貴🥲🥲🥲🥲"
 かまどねずこ ,https://www.google.com/maps/contrib/107495075105899971044/reviews?hl=zh-TW,5,True,29,很喜歡的室友跟弟弟開的兩家分店都去過了大安店的客人較多店員也比較忙相對的態度就較不好室友服務超好真的很開心希望下次可以再改進椪糖系列不能停
 賴思敏 ,https://www.google.com/maps/contrib/103539312905257542039/reviews?hl=zh-TW,5,False,5,"約下午3點多快4點到有飲公館店店員安琪、昀昀非常熱情貼心願意和我們拍照也幫我們拍照，雖然不認識但很快就打成一片非常開心❤️
拿鐵、啵啵、優優系列都超級好喝一定會再回訪！！！"
 Athena Cheng ,https://www.google.com/maps/contrib/105238987141061523728/reviews?hl=zh-TW,4,True,22,"奶蓋很好吃耶
但動線要規劃一下今天早上去排完全不知道排哪也沒有告示
茶沒有甚麼特殊的奶蓋讚讚"
 Nick ,https://www.google.com/maps/contrib/100861693504637644075/reviews?hl=zh-TW,1,False,23,斯里蘭卡醇拿鐵：中杯要60塊，以為味道多驚豔。結果茶不香、奶也不濃，整杯跟水一樣，難喝到要死，不如喝水，噁。
 Carol ,https://www.google.com/maps/contrib/103344822300391553188/reviews?hl=zh-TW,4,True,139,還可以囉
 CHIH-YU YEH ,https://www.google.com/maps/contrib/100180927325776737149/reviews?hl=zh-TW,2,False,5,"今天抱著期待的心情特地從苗栗北上到台北來，結果店員態度超差，沒有笑容、叫號用吼的，就連飲料都用摔的⋯⋯，心裡會覺得我有欠你錢ㄇ🤨
但今天點的草莓優優是好喝的，會讓人想回購的。"
 Avery Kuo ,https://www.google.com/maps/contrib/103569247578293986985/reviews?hl=zh-TW,2,False,6,"我是個對飲料很低標的人，珍珠好吃就可以了。
但這次真的蠻失望的，從高雄上來朝聖，但珍珠的部分中心完全沒煮透，導致整體很硬也不Q，覺得品管部分是不是應該再加強？"
 Hedy Lin ,https://www.google.com/maps/contrib/108606821958758886586/reviews?hl=zh-TW,2,False,3,"草莓優格飲是草莓醬冰沙....
退冰後也不是優格的濃稠感，完全被品名欺騙了
很水，太貴了，不值得這個價錢.....不推薦"
 A C ,https://www.google.com/maps/contrib/100150844968359224446/reviews?hl=zh-TW,1,True,20,喝起來好像在喝草莓果醬，超級甜膩，喝一口就喝不下去了（如圖），google評論真的要看一下，一杯要價90元感覺像是把錢丟到垃圾桶有點浪費。
