user_name,user_profile_url,rating,local_guide,comment_num,comment_text
 Che Fu Lin ,https://www.google.com/maps/contrib/102613216494194287197/reviews?hl=zh-TW,1,True,32,完全是網紅飲料店，連基本款茶類表現都不ok，茶喝起來偏澀，珍珠也沒有嚼勁，對不起明顯偏高的售價，不值得專程排隊購買。
 Tsai Sheng-Chu ,https://www.google.com/maps/contrib/100877307298685844301/reviews?hl=zh-TW,1,True,67,買了玫瑰鹽紅茶奶蓋、鐵觀音拿鐵加地瓜圓、紅茶拿鐵加珍珠，味道都很淡、很一般，沒什麼茶感，價位蠻高的，唯一可以稱讚的是珍珠還不錯，但地瓜圓很硬
 원디Wendy Chen ,https://www.google.com/maps/contrib/100214238011065888284/reviews?hl=zh-TW,4,True,363,尚青四季春茶微糖滿剛好的！
 Sandy Haha ,https://www.google.com/maps/contrib/114006529099362580642/reviews?hl=zh-TW,5,False,9,店員員工親切，珍珠奶茶🧋爆擊好喝！茶、奶、珍珠味道平衡順口！草莓優優也好喝，推推👍有經過會在來買🥰💛
 edfrick ,https://www.google.com/maps/contrib/103757952200633201345/reviews?hl=zh-TW,2,False,6,點了一杯憨吉奶霜鐵觀音，真的普通到不行，也沒有蕃薯的香氣口感都沒有，還特地從中部上去買！
 Yu ,https://www.google.com/maps/contrib/117719329827984781876/reviews?hl=zh-TW,2,False,4,"建議剛開幕人潮多排隊動線還是要規劃一下，不管是專員引導還是清楚標示。

珍珠真的很普通，若同價格會寧願選其他手搖品牌。

加油，希望不要淪為掛著「網美店」的飲料店"
 蕭美珍 ,https://www.google.com/maps/contrib/106606605598805984230/reviews?hl=zh-TW,1,False,4,"晚上8點左右點餐
店員態度極沒耐心好像欠他幾百萬
四季春茶味非常苦澀😭"
 陳盈竹 ,https://www.google.com/maps/contrib/116627221658712101557/reviews?hl=zh-TW,5,False,4,"酸溜溜檸檬紅茶好喝～
很順口又不會太酸❤"
 Han-Chieh Chuang ,https://www.google.com/maps/contrib/111033040868774477368/reviews?hl=zh-TW,1,False,5,超級難喝，今年喝到最難喝的飲料，紅茶你不說我以為我在喝水，完全沒味道，不懂為何這樣也敢出來開店賣
 hailie li ,https://www.google.com/maps/contrib/107522153941494907763/reviews?hl=zh-TW,1,False,19,點了珍珠奶茶跟重培鐵觀音奶茶，都是menu上面有拇指註記的推薦飲料，微冰微糖，感想是微糖真的不會很甜，但！微冰的冰塊還是超級多，然後重點是.....我以為我在喝稀釋後的奶茶，不！應該叫奶茶水才對！珍珠也偏軟沒Q感，整體喝起來像在夜市買的傳統飲料攤的飲料
 Sandy Shen ,https://www.google.com/maps/contrib/117381624859679503236/reviews?hl=zh-TW,4,False,3,今天下午路過買了杯玫瑰鹽奶霜四季春微糖微冰～人不多很快就拿到飲料了很好喝很喜歡下次再去試看看別款👍🏻👍🏻👍🏻
 超人不會飛 ,https://www.google.com/maps/contrib/100032123096967994554/reviews?hl=zh-TW,4,True,79,"厚奶茶不錯喝哦，跟進發家有得比，雖然沒喝到我愛的抹茶🍵，但底迪很有耐心的點餐讓我覺得不錯👌🏻恩妃也不會拒絕拍照📷哦。總之我還是太緊張說不出話😆
影片很好看啦！期待疫情穩定之後影片哦！
在地人支持🤛🏻"
 張芳瑜 ,https://www.google.com/maps/contrib/115495326868459959042/reviews?hl=zh-TW,5,False,3,我是欸了粉，而且我又是非常挑嘴的美食家，看到自己喜歡的YouTube開的飲料店也不容錯過，我買了鳳梨優格，本身很害怕優格的味道因為喜歡鳳梨所以嘗試了一下，真的超愛，優格非常濃郁加上鳳梨口味好喝到不行，真的要大推大推
 ㄏㄒ ,https://www.google.com/maps/contrib/117427061687507194083/reviews?hl=zh-TW,5,True,21,"點了重培鐵觀音奶茶&珍珠奶茶爆擊
不囉嗦辣好ㄏ！"
 管晧安 ,https://www.google.com/maps/contrib/102588430838320277075/reviews?hl=zh-TW,5,True,25,"飲料好喝平價的東區好店❤️
不用排隊就更好了⋯⋯"
 Ba lala (Kiyoaudrey) ,https://www.google.com/maps/contrib/104590403425809368171/reviews?hl=zh-TW,5,True,62,第二次來，和朋友一起來。是弟弟站櫃檯服務客人，弟弟的服務態度超好，我朋友很猶豫要點什麼飲料，弟弟說：「想好要點什麼在和我說。」我們在櫃檯看菜單大概看3~4分鐘，不會催促客人趕快點完。
 K T ,https://www.google.com/maps/contrib/114204459806338709948/reviews?hl=zh-TW,5,True,313,芒果青茶好喝，新鮮的感覺
 陳雯沛 ,https://www.google.com/maps/contrib/106217493343748633122/reviews?hl=zh-TW,5,False,2,超級好喝👍
 Elaine Yang ,https://www.google.com/maps/contrib/117713728317031233762/reviews?hl=zh-TW,5,False,9,奶茶無糖也好喝😍店員也都很親切唷！
 欣怡 ,https://www.google.com/maps/contrib/118130320114967778444/reviews?hl=zh-TW,5,False,1,微酸甜草莓🍓優格超好喝，來一杯活力滿滿
 Lyon Chiu (Lyonchiu) ,https://www.google.com/maps/contrib/114935824863847725310/reviews?hl=zh-TW,4,True,131,憨厚紅茶中規中舉！給過
 Jeannifer Lu ,https://www.google.com/maps/contrib/116809842032557138473/reviews?hl=zh-TW,5,True,37,"好喝,我們點了以下.
柳橙養樂多啵啵
鐵觀音奶茶
尚青四季春茶
憨厚濃綠茶拿鐵加珍珠
斯里蘭卡醇紅茶
百香果優優
都不雷~~
點餐先生很親切,後來才知道是youtuber.但這不是重點,因為他很耐心聽我點餐.準備時間也很快速,沒什麼等待.
推"
 アヤメ ,https://www.google.com/maps/contrib/104420868531226338454/reviews?hl=zh-TW,3,True,104,"買了鐵觀音奶茶跟柚香四季春，鐵觀音沒有茶味像在喝奶，四季春也只有柚子醬的味道。
飲料一顆星，兩顆星給欸"
 huiyu ,https://www.google.com/maps/contrib/116279954120459839029/reviews?hl=zh-TW,3,False,11,"前幾天去購買
還在櫃檯外結帳時就看到做飲料的店員用手拿空杯時把手指放在杯子內，覺得有點不衛生…
飲料普通！"
 Victor ,https://www.google.com/maps/contrib/105264414773777240436/reviews?hl=zh-TW,3,True,61,飲料部分就是普通飲料，另外建議飲料杯可以用軟的，現在這樣雖然比較有質感但反而偏脆弱，敲到容易破掉。
 Fish ,https://www.google.com/maps/contrib/103129590901755459473/reviews?hl=zh-TW,5,False,13,看完影片特地過去買鐵觀音拿鐵，好喝好喝、室友好親切親切😉
 杜宇翔 ,https://www.google.com/maps/contrib/114460053617721588523/reviews?hl=zh-TW,5,True,28,手握有飲所向無敵
 廖于凱 ,https://www.google.com/maps/contrib/118026301032054427452/reviews?hl=zh-TW,5,False,5,"價錢很平價飲料好喝
今天點的是粉紅泡泡草莓優優
酸酸甜甜的不會很酸也不會太甜酸甜適中優格的口感喝起來很棒（純屬個人的感想分享）"
 李賢 ,https://www.google.com/maps/contrib/109594188320744246722/reviews?hl=zh-TW,5,False,6,今天買了鳳梨優優真的之前沒有喝過這種類型的飲料有點優格的酸還有鳳梨的香氣跟鳳梨碎的口感好喝好喝
 王映淳 ,https://www.google.com/maps/contrib/108931063434721457748/reviews?hl=zh-TW,3,False,27,"加10元的珍珠…量少到3口就沒了🥲
而且拿鐵系列喝下去會讓人覺得…真的有加奶嗎，真的不太像拿鐵"
 封流影 ,https://www.google.com/maps/contrib/110454618165300935120/reviews?hl=zh-TW,2,False,8,昨天11/10點了重焙鐵觀音奶茶去冰微糖，味道淡如水，茶跟奶味喝不太出來，還有進步的空間！
 古嘉平 ,https://www.google.com/maps/contrib/107264660644311249440/reviews?hl=zh-TW,5,False,88,排隊速度比想像中快，草莓優優推推
 Tanya Lai ,https://www.google.com/maps/contrib/112814793582136851972/reviews?hl=zh-TW,5,False,6,"買了柚香四季春嚐鮮
很清爽好喝！"
 簡嘉蒨 ,https://www.google.com/maps/contrib/115871769997033635692/reviews?hl=zh-TW,1,False,3,"點了熱情百香橙四季很期待
但喝起來好淡.....
沒有茶味有沒有什摸百香果味
但還是很喜歡欸你這週啦～"
 Stacy Lee ,https://www.google.com/maps/contrib/117039328955827800506/reviews?hl=zh-TW,5,False,5,下班經過買了一杯，地瓜圓超Q，好喝耶！
 林旋呈 ,https://www.google.com/maps/contrib/107584468916863489086/reviews?hl=zh-TW,5,False,10,"讚讚
抹茶好喝❤️

下次可以在來訪"
 Ken Hsieh ,https://www.google.com/maps/contrib/105172034099064651578/reviews?hl=zh-TW,2,False,19,"我來說真話！真的還好而已...
或許比還好還差很多
我點珍珠奶茶爆擊少糖少冰
結果超甜（傻眼）
然後珍珠一整坨吸不上來
包裝店裝很可愛討喜
但又不能吃
飲料本身弱爆我覺得很可惜！"
 許嘉宏 ,https://www.google.com/maps/contrib/107886109208830014292/reviews?hl=zh-TW,5,False,7,"點了斯里蘭卡醇拿鐵微糖少冰味道稍微偏淡
不過旺來鐵觀音是真的很好喝！
下次會想再嘗試優優系列"
 yushuang tung ,https://www.google.com/maps/contrib/105634119524239193634/reviews?hl=zh-TW,5,True,155,"草莓優優好喜歡
希望可以來高雄開分店❤️"
 Kiri Chen ,https://www.google.com/maps/contrib/104916271871677534087/reviews?hl=zh-TW,2,True,33,家裡附近新開幕的茶飲，每天都很多人排隊，今天人潮變少就想說來捧場一下，點了多肉柚香四季春grapefruitgreentea＄65，結果是韓式柚子醬口味的茶，有點失望，被英文騙了⋯⋯加油！！
 Jade Tseng ,https://www.google.com/maps/contrib/114974084264701391524/reviews?hl=zh-TW,5,False,4,紅茶無糖也不澀，好喝👍
 王慧雯 ,https://www.google.com/maps/contrib/111948396205090273893/reviews?hl=zh-TW,5,False,1,很好喝，服務很好～謝謝老闆❤️
 林靖恩 ,https://www.google.com/maps/contrib/110106376024835132543/reviews?hl=zh-TW,1,False,1,抹茶拿鐵中杯大小售價75塊，因此原先抱以極高的期待，然而偏水的味道，讓人十分失望😞
 Tingjen Guo ,https://www.google.com/maps/contrib/114917557940109202769/reviews?hl=zh-TW,3,False,6,排隊等候前一位點餐時順便看品項，看到櫃檯服務員還在按平板就沒有馬上湊上去講話，一轉眼直接被一對情侶插隊，服務人員也並沒有做任何引導的動作，真的完全不相信櫃檯兩位服務人員沒有注意顧客的排隊動線，雖然現場客人不多也不差前面沒禮貌二人組的兩杯飲料時間，但希望服務人員即使看到了也不要悶不吭聲。
 吳倍宏 ,https://www.google.com/maps/contrib/108384428066100888328/reviews?hl=zh-TW,1,False,3,點了一杯柳橙養樂多波波，柳橙看到無言只有超級小的半片，喝起來只有氣泡水跟養樂多味道
 游瑄 ,https://www.google.com/maps/contrib/102118767610121047317/reviews?hl=zh-TW,5,True,33,"奶霜很特別喔，喝了有種回到嬰兒時期的安心感（？！
別的地方喝不到的！
草莓優優太好喝了"
 Summer chang ,https://www.google.com/maps/contrib/115091498408882128634/reviews?hl=zh-TW,5,False,4,"非常好喝！來了會有驚喜
見到你們好開心❤️"
 SS MY ,https://www.google.com/maps/contrib/103478945007510679582/reviews?hl=zh-TW,5,False,2,今天我和我朋友一起去買飲料，但是我朋友手滑不小心把飲料用撒了，跟店員說明之後，店員馬上幫我們清理之外還重新做一杯給我們，真的超好的
 萬士 ,https://www.google.com/maps/contrib/117672482190564230113/reviews?hl=zh-TW,5,True,527,"鐵觀音味道很香很好喝
半糖稍微甜了一點微糖應該會比較剛好"
 Jerah Lyn ,https://www.google.com/maps/contrib/110239549841757573758/reviews?hl=zh-TW,5,False,20,最近辦公室同事們的新歡，每天下午一定要來一杯，我個人很愛茶類手搖，不管加料還是單喝都很讚，朋友嘗試其他類型也都沒踩雷，大推!!
 陳孟 ,https://www.google.com/maps/contrib/105591696131469611663/reviews?hl=zh-TW,5,False,17,"珍珠真的不是開玩笑的好好吃😋❤️
茶味也很香醇不會整杯只有奶精味好喜歡推！！"
 TAMI TAMI ,https://www.google.com/maps/contrib/114328320245442322381/reviews?hl=zh-TW,5,True,31,草莓優優，喝起來很清涼，微冰沙口感，商品製作速度很快，馬上就拿到了！
 Yun ,https://www.google.com/maps/contrib/116521541559305297367/reviews?hl=zh-TW,1,True,134,"鮮奶茶很水
貴沒關係但要好喝
難喝又貴就真的很讓人失望了"
 郭小米 ,https://www.google.com/maps/contrib/104022187929491509820/reviews?hl=zh-TW,1,False,2,"今天要電話先預定，確回應10杯以上才能電話預訂….這回應是否叫客人硬是要購買10杯？
於是我們8杯就這樣得到現場排隊，那也是要等待，店家也是得製做，不懂為何要強迫客人10杯才能電話訂購，請內部嚴正討論這個機制，觀感不佳！！！"
 小安 ,https://www.google.com/maps/contrib/109457176944350997022/reviews?hl=zh-TW,5,False,"1,198","重焙鐵觀音奶茶
*茶味濃郁不苦澀無糖也很好喝；咖啡因會比較重"
 馬惟謙 ,https://www.google.com/maps/contrib/107554010144825067801/reviews?hl=zh-TW,5,False,9,"2021/11/07（日）下午大約四點
看似排隊的人很多
以為要等很久
結果馬上就排到而且點餐很快速

等待的號碼也隔了10多號在等
會有一波快速出餐😂
整體消費經驗還不錯👍

今日點的是
🌟粉紅泡泡草莓優優
🌟柳橙養樂多啵啵

兩個都很讚又很消暑🥰
只可惜今天沒有底迪室友跟shine🥲"
 錢育盛 ,https://www.google.com/maps/contrib/101655890355212447640/reviews?hl=zh-TW,3,False,2,今日去現場購買帶回去給同事喝覺得茶有點水珍珠沒有什麼味道但是店員很熱心推薦而且服務很好希望口味的部分可以改進會更好！
 I’m樹懶 ,https://www.google.com/maps/contrib/107747058312581793966/reviews?hl=zh-TW,1,True,189,"直接給他失望⋯⋯
奶茶太水了茶水比例不對"
 蔡悅梣 ,https://www.google.com/maps/contrib/106220180992336326462/reviews?hl=zh-TW,1,False,1,"人很多但速度沒像之前評論說得很慢
我是點柳橙養樂多啵啵
冰塊甜度無法調整
可能天氣熱喝得比較慢冰塊溶化後很水完全沒有養樂多的味道
喝起來就是很淡的柳橙氣泡水的感覺"
 Berryle Chen ,https://www.google.com/maps/contrib/113567895410098159169/reviews?hl=zh-TW,5,True,389,多肉柚香四季春（微冰微糖）讚！
 虤虤 ,https://www.google.com/maps/contrib/116627570876526933666/reviews?hl=zh-TW,1,False,5,"買了一杯梅果萊姆波波
想說一杯$70（中杯大小）最差應該也就用超甜果醬吧
結果我忘了還有一個東西叫糖漿😂
覺得很不值"
 jace Tsai ,https://www.google.com/maps/contrib/111896209585260256845/reviews?hl=zh-TW,5,False,15,玫瑰鹽奶霜四季春超強，尤其是杯蓋的設計第一次看到，每一口都能喝到四季春跟奶霜很棒欸，然後室友幫忙點餐很有耐心也很親切，推推👍
 賴sammi0417@gmail.com ,https://www.google.com/maps/contrib/118092327544560238221/reviews?hl=zh-TW,5,True,44,"弟弟應該累了一天，厭世臉也好可愛，妹妹本人很瘦很漂亮耶！
雖然人多，點餐跟完成都很快。
平常都喝無糖，我點微糖真的不甜，剛好是我愛的微微甜，這次點的烏龍拿鐵，茶味濃卻不苦，喝完也沒心悸的感覺，很棒唷。"
 楊洋洋 ,https://www.google.com/maps/contrib/101472658775188482919/reviews?hl=zh-TW,2,False,42,裝潢漂亮喝起來普通價格偏高
 Wild Vincent ,https://www.google.com/maps/contrib/100592884881220651158/reviews?hl=zh-TW,5,True,936,很好喝的綠茶～(⊙ω⊙)
 aru h ,https://www.google.com/maps/contrib/103851207003344240856/reviews?hl=zh-TW,1,False,6,"覺得沒有網路上推的好喝
個人喝珍奶爆擊
滿心期待沒有爆擊只有滿滿的打擊
奶茶不太好喝珍珠也沒味道跟Q彈"
 Ina chen ,https://www.google.com/maps/contrib/117575568056926026695/reviews?hl=zh-TW,5,False,44,在月光下喝到了令人幸福的飲料（珍珠太好吃了，謝謝老闆）
 林雅靚 ,https://www.google.com/maps/contrib/108466341517736511282/reviews?hl=zh-TW,1,False,2,"水果茶超難喝一杯還要75
少冰整杯都是冰塊
真正沒喝到幾口就沒了
現場客超少還要等15分鐘
超級不推"
 吳婕妤 ,https://www.google.com/maps/contrib/100240462850484654152/reviews?hl=zh-TW,1,False,4,"還沒喝到~因為一直被退預定訂單而無法喝到,非常無敵不開心,因為知道試營運期間太忙碌,而採先預訂訂單,但卻毫無預警被取消2次,打電話去店內也都沒接,所以根本就喝不到~殘念"
 Wang Smith ,https://www.google.com/maps/contrib/108197196694277017028/reviews?hl=zh-TW,5,False,36,"昨天點草莓優優～酸甜恰到好處，好喝一直喝👍
雖然人很多有排隊，不過店家做飲料的速度算快了～"
 樂活一生 ,https://www.google.com/maps/contrib/102697316996940817742/reviews?hl=zh-TW,5,True,296,玫瑰鹽奶霜四季春nice😁弟弟跟咩咩也都很親民
 陳嘉慶 ,https://www.google.com/maps/contrib/100549037262630534986/reviews?hl=zh-TW,5,True,49,"斯里蘭卡厚奶茶還蠻好喝的珍珠有嚼勁
室友本人比較瘦看來是被恩拍壞了😆"
 Rani Weng ,https://www.google.com/maps/contrib/118177937105199647982/reviews?hl=zh-TW,1,False,26,外送點去冰結果給我多冰，外送這麼貴結果還做錯
 VY I ,https://www.google.com/maps/contrib/118035261375284675582/reviews?hl=zh-TW,5,False,3,每個人對茶味的味道看法都有所不同，我喜歡喝茶香味，奶蓋鐵觀音真的好喝
 Jaymee Chow ,https://www.google.com/maps/contrib/106872854052735276321/reviews?hl=zh-TW,5,False,2,"也太好喝了吧！！！
斯里蘭卡厚奶推推！
草莓優優推推！"
 陳怡文 ,https://www.google.com/maps/contrib/115573738441900478966/reviews?hl=zh-TW,5,True,123,"這次點了重焙鐵觀音奶茶，微糖
覺得茶味蠻濃郁，好喝
奶茶系列都好推👍"
 劉育慈 ,https://www.google.com/maps/contrib/105137609256668660839/reviews?hl=zh-TW,5,False,11,"恭喜開幕大成功🥳
真的是好喝到爆讚的啦🤙🏻
推推👍🏻👍🏻👍🏻"
 陳里玟 ,https://www.google.com/maps/contrib/102191146608380435728/reviews?hl=zh-TW,5,False,25,"臉紅紅蘋果優優
超級好喝的啦！有驚艷到，只是價格不便宜，不過絕對會回購❤️"
 Anny Hsu ,https://www.google.com/maps/contrib/102253443402637319319/reviews?hl=zh-TW,1,False,49,榮登自己近幾年喝過最難喝的飲料
 Ya Yuan Hsu ,https://www.google.com/maps/contrib/103291092437077726212/reviews?hl=zh-TW,5,True,102,草莓優優好好喝👍
 Micky Lo ,https://www.google.com/maps/contrib/113778979707090096965/reviews?hl=zh-TW,2,True,114,"真的沒很好喝

然後有看到室友
但他臉好臭⋯⋯⋯"
 劉怡廷 ,https://www.google.com/maps/contrib/117309705705693356728/reviews?hl=zh-TW,5,False,22,身為欸粉，必須先支持五星，等我下次回家喝完再來新增照片和感想，一定好喝的啦～室友的手藝我相信💛💛室友和弟弟加油加油唷🧡🧡🧡
 鄧心雅 ,https://www.google.com/maps/contrib/113393954954969301038/reviews?hl=zh-TW,3,False,4,剛剛點了一杯微糖的鮮奶茶結果喝起來是完全無糖@@封膜上破了一個小洞還用膠帶貼起來：（
 劉阿奇 ,https://www.google.com/maps/contrib/101436908488828714407/reviews?hl=zh-TW,5,False,25,來朝聖，完全沒失望，真滴好喝，可惜沒機會見到闆娘室友
 陳宣竹 ,https://www.google.com/maps/contrib/103060732203620514319/reviews?hl=zh-TW,5,False,46,椪糖奶霜紅超級好喝，粉紅草莓優優也很推薦大家唷
 Trady C ,https://www.google.com/maps/contrib/109179161481370033210/reviews?hl=zh-TW,5,True,70,好喝果肉有泡過蘋果汁的感覺
 Chew Zi-Qi ,https://www.google.com/maps/contrib/102933109284538168156/reviews?hl=zh-TW,5,False,15,店員好有禮貌啊，東西也好喝，雖然要走一陣子但會一直想回來買的網紅店
 Sarah Wen ,https://www.google.com/maps/contrib/118037775391078127937/reviews?hl=zh-TW,2,True,69,水果茶不知道為什麼喝了反胃
 Luna ,https://www.google.com/maps/contrib/100505303291105365638/reviews?hl=zh-TW,1,True,12,小小一家店，非餐期時間六七個店員閒閒沒事幹的聚集大聲聊天，過去點單瞬間安靜，卻像我打擾到店員聊天一樣，沒半個人打招呼而且每個都臭臉的瞪著，回答問題的態度像欠幾百萬一樣態度超差……奶茶的茶味很香很好喝，但店員完全影響消費者體驗，不會想再去第二次。
 子晴 ,https://www.google.com/maps/contrib/117609524225127027839/reviews?hl=zh-TW,5,False,5,草莓優優$80超好喝雖然價格高也知道非新鮮草莓做成但味道就是好喝~
 張庭語 ,https://www.google.com/maps/contrib/115687377867417464605/reviews?hl=zh-TW,5,False,18,"憨吉奶霜紅（微糖微冰）
抱著嘗試的心態點的
但真的很好喝一點都不失望
很有特色也很有層次
推推！"
 Han nah ,https://www.google.com/maps/contrib/111725516771308429368/reviews?hl=zh-TW,2,False,23,"很期待的草莓優優
我跟朋友喝了都覺得完全不行
80元我只喝了一個口⋯"
 Yu Hsuan Wu ,https://www.google.com/maps/contrib/102265315192308836428/reviews?hl=zh-TW,5,False,20,重培鐵觀音奶茶讚啦！草莓優優真的好好喝！
 黃湘諺 ,https://www.google.com/maps/contrib/116902676738484402425/reviews?hl=zh-TW,1,False,9,"不知道是不是期待太高評論大家都給好高分
點個厚奶茶結果一喝要茶沒茶味要奶沒奶味
好失望🥲希望可以改善"
 LY ,https://www.google.com/maps/contrib/101699243714115057755/reviews?hl=zh-TW,1,False,37,"服務態度與專業度有待加強
一間店員工那麼多，聊天的聊天
你看我我看你
還要等你們聊完才能點餐！？
好不好喝每個人主觀不同
起碼最基本的服務要做好啊"
 G T ,https://www.google.com/maps/contrib/100108057682602960610/reviews?hl=zh-TW,1,False,50,"名副其實的網紅飲料店需要等很久
但非常失落

要茶味沒茶味要奶味沒奶味
這樣只靠粉絲支持是撐不久的"
 Hana ,https://www.google.com/maps/contrib/101413787448905976048/reviews?hl=zh-TW,5,True,117,"陪外公看醫生時
家人買
順路買回
服務實在很好
草莓口味好喝
蘋果也不錯
不會太甜是闔家歡樂的優格與優酪飲"
 柔 ,https://www.google.com/maps/contrib/103267294682429124713/reviews?hl=zh-TW,5,True,20,草莓優優很好喝且CP值高
 Reporter Brain ,https://www.google.com/maps/contrib/104773264192910747164/reviews?hl=zh-TW,1,False,1,首次體驗玫瑰鹽奶霜紅茶(微糖去冰)，真心覺得.....不好喝
 楊貞惠 ,https://www.google.com/maps/contrib/112824265173380549978/reviews?hl=zh-TW,5,True,337,"好喝，種類多選擇，新鮮現點現做。
人很多須排隊點餐後再叫號拿飲料。
讚！
下次有來東區會再次購買。"
 Jasmine Wang ,https://www.google.com/maps/contrib/105773538878123343476/reviews?hl=zh-TW,5,False,18,"店面裝潢超美！飲料也很好喝❤️
今天喝了斯里蘭卡醇拿鐵+地瓜圓，
奶味剛好，地瓜圓超好吃🥰
下次會試試看其他飲品☺️"
 Wang Jo ,https://www.google.com/maps/contrib/103149527252320941576/reviews?hl=zh-TW,3,True,85,點了柳橙養樂多波波，多多味道很淡幾乎沒有，就是單純喝柳橙氣泡水的感覺，有點對不起他的價格，可惜了點
 Yu-Hsin Hsieh ,https://www.google.com/maps/contrib/115367744900744223902/reviews?hl=zh-TW,1,False,1,說好12：30送來，變成2：00
 李思17玩起來（李思） ,https://www.google.com/maps/contrib/114543531738749474887/reviews?hl=zh-TW,1,True,42,青青小樹蘋果綠超水沒味道…
 Lin Wayne ,https://www.google.com/maps/contrib/115581234857863832478/reviews?hl=zh-TW,4,True,58,飲料中上，但吸管實在太短了，不方便吸
 Yan Pin Chen ,https://www.google.com/maps/contrib/106706660709582829940/reviews?hl=zh-TW,4,True,116,"每次區域東區一定會去的飲料店
服務態度好～飲料種類很多～
水果類很好喝～繼續回訪"
 趙怡雯 ,https://www.google.com/maps/contrib/100386907314388143892/reviews?hl=zh-TW,5,False,3,"新開的店來嘗鮮一下
珍奶好好喝喔~下次再買其他飲品試試!"
 Anna Chang ,https://www.google.com/maps/contrib/109315330313212776577/reviews?hl=zh-TW,3,True,33,點了觀音拿鐵，味道很水蠻失望的
 RUOJIE Jhuang ,https://www.google.com/maps/contrib/103577162389117487483/reviews?hl=zh-TW,1,False,23,氣泡飲跟水一樣⋯哪來的啵啵？
 薛欣怡914Hsueh ,https://www.google.com/maps/contrib/101525781629966866331/reviews?hl=zh-TW,5,True,18,"草莓優優好喝
點的那天不到20度，喝到嘎冷筍
夏天喝一定很爽。"
 ChungHua Chu ,https://www.google.com/maps/contrib/101993342252511354435/reviews?hl=zh-TW,3,True,824,"中規中矩
珍珠可能少了點"
 Erya She ,https://www.google.com/maps/contrib/103736197590835936019/reviews?hl=zh-TW,5,False,16,"檸檬紅茶無糖，不會酸欸，但是有檸檬香氣。
喜歡檸檬又怕酸的朋友可以點無糖試試看喔！"
 kevin wang ,https://www.google.com/maps/contrib/115842736995931244242/reviews?hl=zh-TW,2,False,65,"真的爆擊了啊！
珍珠是來不及煮嗎？
這米心口感跟燉飯一樣了呀"
 Kaneshiro Takeshi ,https://www.google.com/maps/contrib/102945191000127210985/reviews?hl=zh-TW,3,True,370,"v👍
斯里蘭卡醇拿鐵茶味比奶重，還不錯"
 戴毓宣 ,https://www.google.com/maps/contrib/104547196914683684033/reviews?hl=zh-TW,5,False,1,裝潢很漂亮٩(ˊᗜˋ)و
 k candy ,https://www.google.com/maps/contrib/103725669152698794101/reviews?hl=zh-TW,5,False,10,"柚子茶推推～
真的被驚喜嚇一跳"
